Orthogroup	Insecta_Diptera_Drosophila_melanogaster	Cnidaria_Anthozoa_Nematostella_vectensis
OG0000000	Drosophila_melanogaster_tr_Q9VF34_Q9VF34_DROME tr|Q9VF34|Q9VF34_DROME Fibrinogen C-terminal domain-containing protein OS=Drosophila melanogaster OX=7227 GN=FBpp0082632 PE=4 SV=2	Nematostella_vectensis_NV2t014110001.1 NV2t014110001.1, Nematostella_vectensis_NV2t006207001.1 NV2t006207001.1, Nematostella_vectensis_NV2t012138004.1 NV2t012138004.1, Nematostella_vectensis_NV2t012138001.1 NV2t012138001.1, Nematostella_vectensis_NV2t007004001.1 NV2t007004001.1, Nematostella_vectensis_NV2t005873001.1 NV2t005873001.1, Nematostella_vectensis_NV2t011374001.1 NV2t011374001.1, Nematostella_vectensis_NV2t025469001.1 NV2t025469001.1
OG0000000	Drosophila_melanogaster_tr_Q9VME7_Q9VME7_DROME tr|Q9VME7|Q9VME7_DROME Fibrinogen C-terminal domain-containing protein OS=Drosophila melanogaster OX=7227 GN=AAF52372 PE=4 SV=4, Drosophila_melanogaster_tr_Q4V4U2_Q4V4U2_DROME tr|Q4V4U2|Q4V4U2_DROME IP08170p OS=Drosophila melanogaster OX=7227 GN=AAF46801 PE=2 SV=1, Drosophila_melanogaster_tr_A1ZAJ8_A1ZAJ8_DROME tr|A1ZAJ8|A1ZAJ8_DROME FI17311p1 OS=Drosophila melanogaster OX=7227 GN=AAL48972 PE=2 SV=1, Drosophila_melanogaster_tr_A0A0B4K7T3_A0A0B4K7T3_DROME tr|A0A0B4K7T3|A0A0B4K7T3_DROME Uncharacterized protein_ isoform B OS=Drosophila melanogaster OX=7227 GN=AAF57948 PE=4 SV=1, Drosophila_melanogaster_tr_Q8SYS3_Q8SYS3_DROME tr|Q8SYS3|Q8SYS3_DROME RE38860p OS=Drosophila melanogaster OX=7227 GN=CG5550 PE=2 SV=1	Nematostella_vectensis_NV2t003941001.1 NV2t003941001.1, Nematostella_vectensis_NV2t022115001.1 NV2t022115001.1, Nematostella_vectensis_NV2t016067001.1 NV2t016067001.1, Nematostella_vectensis_NV2t025471001.1 NV2t025471001.1, Nematostella_vectensis_NV2t025467001.1 NV2t025467001.1, Nematostella_vectensis_NV2t025470001.1 NV2t025470001.1, Nematostella_vectensis_NV2t025464001.1 NV2t025464001.1, Nematostella_vectensis_NV2t025526001.1 NV2t025526001.1, Nematostella_vectensis_NV2t007038001.1 NV2t007038001.1, Nematostella_vectensis_NV2t019779001.1 NV2t019779001.1, Nematostella_vectensis_NV2t019779002.1 NV2t019779002.1, Nematostella_vectensis_NV2t022610001.1 NV2t022610001.1, Nematostella_vectensis_NV2t022609002.1 NV2t022609002.1, Nematostella_vectensis_NV2t022609001.1 NV2t022609001.1, Nematostella_vectensis_NV2t024484001.1 NV2t024484001.1, Nematostella_vectensis_NV2t017198001.1 NV2t017198001.1, Nematostella_vectensis_NV2t005688002.1 NV2t005688002.1, Nematostella_vectensis_NV2t005688001.1 NV2t005688001.1, Nematostella_vectensis_NV2t005687001.1 NV2t005687001.1, Nematostella_vectensis_NV2t006013001.1 NV2t006013001.1, Nematostella_vectensis_NV2t006016001.1 NV2t006016001.1, Nematostella_vectensis_NV2t006010001.1 NV2t006010001.1, Nematostella_vectensis_NV2t006015001.1 NV2t006015001.1, Nematostella_vectensis_NV2t006014001.1 NV2t006014001.1, Nematostella_vectensis_NV2t006014002.1 NV2t006014002.1, Nematostella_vectensis_NV2t017096001.1 NV2t017096001.1
OG0000000	Drosophila_melanogaster_tr_E8Z4Z6_E8Z4Z6_DROME tr|E8Z4Z6|E8Z4Z6_DROME Uncharacterized protein_ isoform D OS=Drosophila melanogaster OX=7227 GN=CG17443 PE=4 SV=1, Drosophila_melanogaster_tr_Q5BIB8_Q5BIB8_DROME tr|Q5BIB8|Q5BIB8_DROME RE19569p OS=Drosophila melanogaster OX=7227 GN=CG17443 PE=2 SV=1, Drosophila_melanogaster_tr_A8QHX1_A8QHX1_DROME tr|A8QHX1|A8QHX1_DROME Uncharacterized protein_ isoform B OS=Drosophila melanogaster OX=7227 GN=Dmel\CG41520 PE=4 SV=1	Nematostella_vectensis_NV2t010046003.1 NV2t010046003.1, Nematostella_vectensis_NV2t010046002.1 NV2t010046002.1, Nematostella_vectensis_NV2t010046001.1 NV2t010046001.1
OG0000001	Drosophila_melanogaster_sp_Q24568_NETB_DROME sp|Q24568|NETB_DROME Netrin-B OS=Drosophila melanogaster OX=7227 GN=NetB PE=1 SV=1, Drosophila_melanogaster_tr_E1JJP7_E1JJP7_DROME tr|E1JJP7|E1JJP7_DROME Netrin-B_ isoform B OS=Drosophila melanogaster OX=7227 GN=NetB PE=4 SV=1, Drosophila_melanogaster_tr_M9PH47_M9PH47_DROME tr|M9PH47|M9PH47_DROME Netrin-B_ isoform G OS=Drosophila melanogaster OX=7227 GN=NetB PE=4 SV=1, Drosophila_melanogaster_tr_Q95SP5_Q95SP5_DROME tr|Q95SP5|Q95SP5_DROME GH10173p OS=Drosophila melanogaster OX=7227 GN=NetB PE=2 SV=1	Nematostella_vectensis_NV2t007734005.1 NV2t007734005.1
OG0000001	Drosophila_melanogaster_sp_Q24567_NETA_DROME sp|Q24567|NETA_DROME Netrin-A OS=Drosophila melanogaster OX=7227 GN=NetA PE=2 SV=2, Drosophila_melanogaster_tr_X2JEZ9_X2JEZ9_DROME tr|X2JEZ9|X2JEZ9_DROME Netrin-A_ isoform C OS=Drosophila melanogaster OX=7227 GN=NetA PE=4 SV=1, Drosophila_melanogaster_tr_M9NF48_M9NF48_DROME tr|M9NF48|M9NF48_DROME Netrin-A_ isoform B OS=Drosophila melanogaster OX=7227 GN=NetA PE=4 SV=1	Nematostella_vectensis_NV2t007734002.1 NV2t007734002.1, Nematostella_vectensis_NV2t007734004.1 NV2t007734004.1, Nematostella_vectensis_NV2t007734001.1 NV2t007734001.1, Nematostella_vectensis_NV2t007734003.1 NV2t007734003.1
OG0000001	Drosophila_melanogaster_tr_X2JAW6_X2JAW6_DROME tr|X2JAW6|X2JAW6_DROME Laminin B2_ isoform B OS=Drosophila melanogaster OX=7227 GN=LanB2 PE=4 SV=1, Drosophila_melanogaster_sp_P15215_LAMC1_DROME sp|P15215|LAMC1_DROME Laminin subunit gamma-1 OS=Drosophila melanogaster OX=7227 GN=LanB2 PE=2 SV=2	Nematostella_vectensis_NV2t025737001.1 NV2t025737001.1
OG0000001	Drosophila_melanogaster_tr_Q9XZC9_Q9XZC9_DROME tr|Q9XZC9|Q9XZC9_DROME Laminin alpha1_2 OS=Drosophila melanogaster OX=7227 GN=wb PE=2 SV=1, Drosophila_melanogaster_tr_Q8IP51_Q8IP51_DROME tr|Q8IP51|Q8IP51_DROME Wing blister_ isoform B OS=Drosophila melanogaster OX=7227 GN=wb PE=4 SV=1, Drosophila_melanogaster_tr_R9PY40_R9PY40_DROME tr|R9PY40|R9PY40_DROME Wing blister_ isoform G OS=Drosophila melanogaster OX=7227 GN=wb PE=4 SV=1	Nematostella_vectensis_NV2t024158001.1 NV2t024158001.1, Nematostella_vectensis_NV2t022843001.1 NV2t022843001.1, Nematostella_vectensis_NV2t022840001.1 NV2t022840001.1
OG0000002	Drosophila_melanogaster_tr_Q968S4_Q968S4_DROME tr|Q968S4|Q968S4_DROME Putative thrombospondin OS=Drosophila melanogaster OX=7227 GN=Tsp PE=2 SV=1, Drosophila_melanogaster_tr_Q9VM97_Q9VM97_DROME tr|Q9VM97|Q9VM97_DROME Thrombospondin_ isoform A OS=Drosophila melanogaster OX=7227 GN=Tsp PE=3 SV=2, Drosophila_melanogaster_tr_B7Z030_B7Z030_DROME tr|B7Z030|B7Z030_DROME Thrombospondin_ isoform G OS=Drosophila melanogaster OX=7227 GN=Tsp PE=3 SV=1	Nematostella_vectensis_NV2t023886001.1 NV2t023886001.1, Nematostella_vectensis_NV2t023886003.1 NV2t023886003.1, Nematostella_vectensis_NV2t023886002.1 NV2t023886002.1
OG0000002	Drosophila_melanogaster_tr_Q7YU67_Q7YU67_DROME tr|Q7YU67|Q7YU67_DROME RE68041p OS=Drosophila melanogaster OX=7227 GN=Sema5c PE=2 SV=1, Drosophila_melanogaster_tr_Q9VTT0_Q9VTT0_DROME tr|Q9VTT0|Q9VTT0_DROME Semaphorin 5c_ isoform A OS=Drosophila melanogaster OX=7227 GN=Sema5c PE=4 SV=3, Drosophila_melanogaster_tr_Q9U631_Q9U631_DROME tr|Q9U631|Q9U631_DROME Semaphorin 5C OS=Drosophila melanogaster OX=7227 GN=Sema5c PE=2 SV=1	Nematostella_vectensis_NV2t011758001.1 NV2t011758001.1
OG0000002	Drosophila_melanogaster_tr_A1ZAF5_A1ZAF5_DROME tr|A1ZAF5|A1ZAF5_DROME FI18622p1 OS=Drosophila melanogaster OX=7227 GN=Sema2b PE=2 SV=1, Drosophila_melanogaster_tr_Q29QV5_Q29QV5_DROME tr|Q29QV5|Q29QV5_DROME IP13724p OS=Drosophila melanogaster OX=7227 GN=Sema2b PE=2 SV=1, Drosophila_melanogaster_tr_A0A0B4KG38_A0A0B4KG38_DROME tr|A0A0B4KG38|A0A0B4KG38_DROME Semaphorin 2b_ isoform D OS=Drosophila melanogaster OX=7227 GN=Sema2b PE=1 SV=1, Drosophila_melanogaster_sp_Q24323_SEM2A_DROME sp|Q24323|SEM2A_DROME Semaphorin-2A OS=Drosophila melanogaster OX=7227 GN=Sema2a PE=1 SV=2, Drosophila_melanogaster_sp_Q24322_SEM1A_DROME sp|Q24322|SEM1A_DROME Semaphorin-1A OS=Drosophila melanogaster OX=7227 GN=Sema1a PE=1 SV=3, Drosophila_melanogaster_tr_Q0E8S4_Q0E8S4_DROME tr|Q0E8S4|Q0E8S4_DROME Semaphorin 1a_ isoform D OS=Drosophila melanogaster OX=7227 GN=Sema1a PE=1 SV=2, Drosophila_melanogaster_tr_M9PCL7_M9PCL7_DROME tr|M9PCL7|M9PCL7_DROME Semaphorin 1a_ isoform G OS=Drosophila melanogaster OX=7227 GN=Sema1a PE=1 SV=1, Drosophila_melanogaster_tr_M9PFA5_M9PFA5_DROME tr|M9PFA5|M9PFA5_DROME Semaphorin 1a_ isoform H OS=Drosophila melanogaster OX=7227 GN=Sema1a PE=1 SV=1, Drosophila_melanogaster_tr_M9PB77_M9PB77_DROME tr|M9PB77|M9PB77_DROME Semaphorin 1a_ isoform I OS=Drosophila melanogaster OX=7227 GN=Sema1a PE=1 SV=1, Drosophila_melanogaster_tr_M9MRI2_M9MRI2_DROME tr|M9MRI2|M9MRI2_DROME Semaphorin 1a_ isoform F OS=Drosophila melanogaster OX=7227 GN=Sema1a PE=1 SV=1, Drosophila_melanogaster_tr_Q7KK54_Q7KK54_DROME tr|Q7KK54|Q7KK54_DROME MIP07328p OS=Drosophila melanogaster OX=7227 GN=Sema1b PE=1 SV=1, Drosophila_melanogaster_tr_O44253_O44253_DROME tr|O44253|O44253_DROME Similar to semaphorin-I OS=Drosophila melanogaster OX=7227 GN=Sema1b PE=2 SV=1	Nematostella_vectensis_NV2t022863003.1 NV2t022863003.1, Nematostella_vectensis_NV2t022863001.1 NV2t022863001.1, Nematostella_vectensis_NV2t022863002.1 NV2t022863002.1
OG0000003	Drosophila_melanogaster_tr_A1Z8L7_A1Z8L7_DROME tr|A1Z8L7|A1Z8L7_DROME Uncharacterized protein_ isoform C OS=Drosophila melanogaster OX=7227 GN=CK02422a PE=4 SV=2, Drosophila_melanogaster_tr_Q9VQX3_Q9VQX3_DROME tr|Q9VQX3|Q9VQX3_DROME HL05328p OS=Drosophila melanogaster OX=7227 GN=lectin-24Db PE=2 SV=1, Drosophila_melanogaster_tr_Q9VM16_Q9VM16_DROME tr|Q9VM16|Q9VM16_DROME LP02603p OS=Drosophila melanogaster OX=7227 GN=Dmel\CG15818 PE=2 SV=1, Drosophila_melanogaster_tr_Q9VQ53_Q9VQ53_DROME tr|Q9VQ53|Q9VQ53_DROME Uncharacterized protein_ isoform D OS=Drosophila melanogaster OX=7227 GN=mdcds_4396 PE=4 SV=3, Drosophila_melanogaster_tr_Q9VQU4_Q9VQU4_DROME tr|Q9VQU4|Q9VQU4_DROME Lectin-24A OS=Drosophila melanogaster OX=7227 GN=lectin-24A PE=2 SV=1, Drosophila_melanogaster_tr_Q9VPS3_Q9VPS3_DROME tr|Q9VPS3|Q9VPS3_DROME C-type lectin domain-containing protein OS=Drosophila melanogaster OX=7227 GN=Dmel\CG2839 PE=4 SV=2, Drosophila_melanogaster_tr_Q9W0I2_Q9W0I2_DROME tr|Q9W0I2|Q9W0I2_DROME RE15268p OS=Drosophila melanogaster OX=7227 GN=tfc PE=2 SV=1, Drosophila_melanogaster_tr_Q8IRH8_Q8IRH8_DROME tr|Q8IRH8|Q8IRH8_DROME LP02252p OS=Drosophila melanogaster OX=7227 GN=tfc PE=2 SV=1, Drosophila_melanogaster_sp_Q59DY5_LEDL3_DROME sp|Q59DY5|LEDL3_DROME C-type lectin 37Db OS=Drosophila melanogaster OX=7227 GN=lectin-37Db PE=2 SV=1, Drosophila_melanogaster_tr_Q9VKL8_Q9VKL8_DROME tr|Q9VKL8|Q9VKL8_DROME Lectin-33A OS=Drosophila melanogaster OX=7227 GN=lectin-33A PE=4 SV=2, Drosophila_melanogaster_tr_Q2XYE0_Q2XYE0_DROME tr|Q2XYE0|Q2XYE0_DROME CG8343 _Fragment_ OS=Drosophila melanogaster OX=7227 GN=CG8343 PE=4 SV=1, Drosophila_melanogaster_tr_Q6NMY2_Q6NMY2_DROME tr|Q6NMY2|Q6NMY2_DROME RH54371p OS=Drosophila melanogaster OX=7227 GN=BEST_GH10831 PE=2 SV=1	Nematostella_vectensis_NV2t005851001.1 NV2t005851001.1, Nematostella_vectensis_NV2t014809001.1 NV2t014809001.1, Nematostella_vectensis_NV2t014808004.1 NV2t014808004.1, Nematostella_vectensis_NV2t014772001.1 NV2t014772001.1, Nematostella_vectensis_NV2t014808002.1 NV2t014808002.1, Nematostella_vectensis_NV2t016335001.1 NV2t016335001.1
OG0000006	Drosophila_melanogaster_tr_Q058W1_Q058W1_DROME tr|Q058W1|Q058W1_DROME Hig-anchoring scaffold protein_ isoform D OS=Drosophila melanogaster OX=7227 GN=Hasp PE=1 SV=1, Drosophila_melanogaster_tr_Q9VIU9_Q9VIU9_DROME tr|Q9VIU9|Q9VIU9_DROME Hig-anchoring scaffold protein_ isoform C OS=Drosophila melanogaster OX=7227 GN=Hasp PE=1 SV=3, Drosophila_melanogaster_tr_B7YZX0_B7YZX0_DROME tr|B7YZX0|B7YZX0_DROME Hig-anchoring scaffold protein_ isoform G OS=Drosophila melanogaster OX=7227 GN=Hasp PE=1 SV=2, Drosophila_melanogaster_tr_Q8INW2_Q8INW2_DROME tr|Q8INW2|Q8INW2_DROME Hig-anchoring scaffold protein_ isoform A OS=Drosophila melanogaster OX=7227 GN=Hasp PE=1 SV=1	Nematostella_vectensis_NV2t025727002.1 NV2t025727002.1, Nematostella_vectensis_NV2t025727001.1 NV2t025727001.1, Nematostella_vectensis_NV2t025725003.1 NV2t025725003.1, Nematostella_vectensis_NV2t025725002.1 NV2t025725002.1, Nematostella_vectensis_NV2t025725001.1 NV2t025725001.1, Nematostella_vectensis_NV2t025725006.1 NV2t025725006.1, Nematostella_vectensis_NV2t025725005.1 NV2t025725005.1, Nematostella_vectensis_NV2t025725004.1 NV2t025725004.1, Nematostella_vectensis_NV2t025724001.1 NV2t025724001.1, Nematostella_vectensis_NV2t025722001.1 NV2t025722001.1
OG0000009	Drosophila_melanogaster_tr_Q49II5_Q49II5_DROME tr|Q49II5|Q49II5_DROME Metalloendopeptidase _Fragment_ OS=Drosophila melanogaster OX=7227 GN=tok PE=4 SV=1, Drosophila_melanogaster_tr_Q49IJ1_Q49IJ1_DROME tr|Q49IJ1|Q49IJ1_DROME Metalloendopeptidase _Fragment_ OS=Drosophila melanogaster OX=7227 GN=tok PE=4 SV=1, Drosophila_melanogaster_tr_Q49IJ0_Q49IJ0_DROME tr|Q49IJ0|Q49IJ0_DROME Metalloendopeptidase _Fragment_ OS=Drosophila melanogaster OX=7227 GN=tok PE=4 SV=1, Drosophila_melanogaster_tr_Q49II8_Q49II8_DROME tr|Q49II8|Q49II8_DROME Metalloendopeptidase _Fragment_ OS=Drosophila melanogaster OX=7227 GN=tok PE=4 SV=1, Drosophila_melanogaster_tr_Q49II0_Q49II0_DROME tr|Q49II0|Q49II0_DROME Metalloendopeptidase _Fragment_ OS=Drosophila melanogaster OX=7227 GN=tok PE=4 SV=1, Drosophila_melanogaster_tr_Q49II7_Q49II7_DROME tr|Q49II7|Q49II7_DROME Metalloendopeptidase _Fragment_ OS=Drosophila melanogaster OX=7227 GN=tok PE=4 SV=1, Drosophila_melanogaster_tr_Q49IK4_Q49IK4_DROME tr|Q49IK4|Q49IK4_DROME Metalloendopeptidase _Fragment_ OS=Drosophila melanogaster OX=7227 GN=tok PE=4 SV=1, Drosophila_melanogaster_sp_Q9VC47_TOK_DROME sp|Q9VC47|TOK_DROME Protein tolkin OS=Drosophila melanogaster OX=7227 GN=tok PE=1 SV=1, Drosophila_melanogaster_tr_Q7YU36_Q7YU36_DROME tr|Q7YU36|Q7YU36_DROME Metalloendopeptidase OS=Drosophila melanogaster OX=7227 GN=tld PE=2 SV=1, Drosophila_melanogaster_sp_P25723_TLD_DROME sp|P25723|TLD_DROME Dorsal-ventral patterning protein tolloid OS=Drosophila melanogaster OX=7227 GN=tld PE=2 SV=2	Nematostella_vectensis_NV2t003100001.1 NV2t003100001.1, Nematostella_vectensis_NV2t021954001.1 NV2t021954001.1, Nematostella_vectensis_NV2t014830001.1 NV2t014830001.1, Nematostella_vectensis_NV2t014830002.1 NV2t014830002.1, Nematostella_vectensis_NV2t014356001.1 NV2t014356001.1
OG0000010	Drosophila_melanogaster_tr_Q8MPN3_Q8MPN3_DROME tr|Q8MPN3|Q8MPN3_DROME Perlecan OS=Drosophila melanogaster OX=7227 GN=trol PE=2 SV=1, Drosophila_melanogaster_tr_M9NE56_M9NE56_DROME tr|M9NE56|M9NE56_DROME Terribly reduced optic lobes_ isoform AK OS=Drosophila melanogaster OX=7227 GN=trol PE=1 SV=1, Drosophila_melanogaster_tr_M9NDL5_M9NDL5_DROME tr|M9NDL5|M9NDL5_DROME Terribly reduced optic lobes_ isoform AF OS=Drosophila melanogaster OX=7227 GN=trol PE=1 SV=2, Drosophila_melanogaster_tr_M9NES6_M9NES6_DROME tr|M9NES6|M9NES6_DROME Terribly reduced optic lobes_ isoform AU OS=Drosophila melanogaster OX=7227 GN=trol PE=1 SV=2, Drosophila_melanogaster_tr_Q9W4Y3_Q9W4Y3_DROME tr|Q9W4Y3|Q9W4Y3_DROME Terribly reduced optic lobes_ isoform AT OS=Drosophila melanogaster OX=7227 GN=trol PE=1 SV=4, Drosophila_melanogaster_tr_E1JJC0_E1JJC0_DROME tr|E1JJC0|E1JJC0_DROME Terribly reduced optic lobes_ isoform AH OS=Drosophila melanogaster OX=7227 GN=trol PE=1 SV=3, Drosophila_melanogaster_tr_X2JCE8_X2JCE8_DROME tr|X2JCE8|X2JCE8_DROME Terribly reduced optic lobes_ isoform BA OS=Drosophila melanogaster OX=7227 GN=trol PE=1 SV=1, Drosophila_melanogaster_tr_X2JE09_X2JE09_DROME tr|X2JE09|X2JE09_DROME Terribly reduced optic lobes_ isoform AV OS=Drosophila melanogaster OX=7227 GN=trol PE=1 SV=1, Drosophila_melanogaster_tr_A0A023GRW4_A0A023GRW4_DROME tr|A0A023GRW4|A0A023GRW4_DROME Terribly reduced optic lobes_ isoform AZ OS=Drosophila melanogaster OX=7227 GN=trol PE=1 SV=1, Drosophila_melanogaster_tr_Q8IRV8_Q8IRV8_DROME tr|Q8IRV8|Q8IRV8_DROME Terribly reduced optic lobes_ isoform AO OS=Drosophila melanogaster OX=7227 GN=trol PE=1 SV=3, Drosophila_melanogaster_tr_M9NDM1_M9NDM1_DROME tr|M9NDM1|M9NDM1_DROME Terribly reduced optic lobes_ isoform AP OS=Drosophila melanogaster OX=7227 GN=trol PE=1 SV=2, Drosophila_melanogaster_tr_X2JDK9_X2JDK9_DROME tr|X2JDK9|X2JDK9_DROME Terribly reduced optic lobes_ isoform AS OS=Drosophila melanogaster OX=7227 GN=trol PE=1 SV=1, Drosophila_melanogaster_tr_Q9NFS9_Q9NFS9_DROME tr|Q9NFS9|Q9NFS9_DROME Perlecan domain V _Fragment_ OS=Drosophila melanogaster OX=7227 GN=trol PE=2 SV=1, Drosophila_melanogaster_tr_Q9NEG1_Q9NEG1_DROME tr|Q9NEG1|Q9NEG1_DROME EG_BACR25B3.11 protein OS=Drosophila melanogaster OX=7227 GN=trol PE=4 SV=1, Drosophila_melanogaster_tr_M9NET2_M9NET2_DROME tr|M9NET2|M9NET2_DROME Terribly reduced optic lobes_ isoform AI OS=Drosophila melanogaster OX=7227 GN=trol PE=1 SV=2, Drosophila_melanogaster_tr_M9NGK3_M9NGK3_DROME tr|M9NGK3|M9NGK3_DROME Terribly reduced optic lobes_ isoform AL OS=Drosophila melanogaster OX=7227 GN=trol PE=1 SV=2, Drosophila_melanogaster_tr_M9NFR6_M9NFR6_DROME tr|M9NFR6|M9NFR6_DROME Terribly reduced optic lobes_ isoform AY OS=Drosophila melanogaster OX=7227 GN=trol PE=1 SV=2, Drosophila_melanogaster_tr_Q8IRV9_Q8IRV9_DROME tr|Q8IRV9|Q8IRV9_DROME Terribly reduced optic lobes_ isoform AW OS=Drosophila melanogaster OX=7227 GN=trol PE=1 SV=3, Drosophila_melanogaster_tr_M9NGL3_M9NGL3_DROME tr|M9NGL3|M9NGL3_DROME Terribly reduced optic lobes_ isoform AM OS=Drosophila melanogaster OX=7227 GN=trol PE=1 SV=2, Drosophila_melanogaster_tr_Q8MSR5_Q8MSR5_DROME tr|Q8MSR5|Q8MSR5_DROME SD04592p OS=Drosophila melanogaster OX=7227 GN=trol PE=2 SV=1, Drosophila_melanogaster_tr_Q8IRV7_Q8IRV7_DROME tr|Q8IRV7|Q8IRV7_DROME Terribly reduced optic lobes_ isoform AG OS=Drosophila melanogaster OX=7227 GN=trol PE=1 SV=3, Drosophila_melanogaster_tr_X2JAC7_X2JAC7_DROME tr|X2JAC7|X2JAC7_DROME Terribly reduced optic lobes_ isoform AX OS=Drosophila melanogaster OX=7227 GN=trol PE=1 SV=1, Drosophila_melanogaster_tr_M9NE61_M9NE61_DROME tr|M9NE61|M9NE61_DROME Terribly reduced optic lobes_ isoform AR OS=Drosophila melanogaster OX=7227 GN=trol PE=1 SV=2, Drosophila_melanogaster_tr_Q9W4Y4_Q9W4Y4_DROME tr|Q9W4Y4|Q9W4Y4_DROME Terribly reduced optic lobes_ isoform AN OS=Drosophila melanogaster OX=7227 GN=trol PE=1 SV=5, Drosophila_melanogaster_tr_M9NFS1_M9NFS1_DROME tr|M9NFS1|M9NFS1_DROME Terribly reduced optic lobes_ isoform AQ OS=Drosophila melanogaster OX=7227 GN=trol PE=1 SV=2, Drosophila_melanogaster_tr_Q9NEF9_Q9NEF9_DROME tr|Q9NEF9|Q9NEF9_DROME EG_BACR25B3.1 protein OS=Drosophila melanogaster OX=7227 GN=trol PE=4 SV=1	Nematostella_vectensis_NV2t014905001.1 NV2t014905001.1, Nematostella_vectensis_NV2t014905002.1 NV2t014905002.1, Nematostella_vectensis_NV2t014905003.1 NV2t014905003.1
OG0000010	Drosophila_melanogaster_sp_A0A1F4_EYS_DROME sp|A0A1F4|EYS_DROME Protein eyes shut OS=Drosophila melanogaster OX=7227 GN=eys PE=1 SV=1, Drosophila_melanogaster_tr_M9PBU9_M9PBU9_DROME tr|M9PBU9|M9PBU9_DROME Eyes shut_ isoform E OS=Drosophila melanogaster OX=7227 GN=eys PE=4 SV=2	Nematostella_vectensis_NV2t006047001.1 NV2t006047001.1
OG0000010	Drosophila_melanogaster_tr_A1ZA87_A1ZA87_DROME tr|A1ZA87|A1ZA87_DROME SP2353_ isoform A OS=Drosophila melanogaster OX=7227 GN=SP2353 PE=4 SV=1, Drosophila_melanogaster_tr_Q9NGV2_Q9NGV2_DROME tr|Q9NGV2|Q9NGV2_DROME SP2353 OS=Drosophila melanogaster OX=7227 GN=SP2353 PE=2 SV=1	Nematostella_vectensis_NV2t000707001.1 NV2t000707001.1
OG0000010	Drosophila_melanogaster_tr_Q86NV3_Q86NV3_DROME tr|Q86NV3|Q86NV3_DROME Follistatin_ isoform A OS=Drosophila melanogaster OX=7227 GN=Fs PE=2 SV=1, Drosophila_melanogaster_tr_A0A0B4LFH4_A0A0B4LFH4_DROME tr|A0A0B4LFH4|A0A0B4LFH4_DROME Follistatin_ isoform B OS=Drosophila melanogaster OX=7227 GN=Fs PE=4 SV=1, Drosophila_melanogaster_tr_Q8WR59_Q8WR59_DROME tr|Q8WR59|Q8WR59_DROME Follistatin OS=Drosophila melanogaster OX=7227 GN=Fs PE=2 SV=1	Nematostella_vectensis_NV2t023832001.1 NV2t023832001.1
OG0000012	Drosophila_melanogaster_tr_Q9U5D0_Q9U5D0_DROME tr|Q9U5D0|Q9U5D0_DROME Hemolectin OS=Drosophila melanogaster OX=7227 GN=Hml PE=2 SV=1, Drosophila_melanogaster_tr_Q9VU94_Q9VU94_DROME tr|Q9VU94|Q9VU94_DROME Hemolectin_ isoform A OS=Drosophila melanogaster OX=7227 GN=Hml PE=1 SV=2, Drosophila_melanogaster_tr_M9PCE5_M9PCE5_DROME tr|M9PCE5|M9PCE5_DROME Hemolectin_ isoform B OS=Drosophila melanogaster OX=7227 GN=Hml PE=1 SV=1, Drosophila_melanogaster_tr_Q8MS79_Q8MS79_DROME tr|Q8MS79|Q8MS79_DROME LP05709p OS=Drosophila melanogaster OX=7227 GN=Hml PE=2 SV=1	Nematostella_vectensis_NV2t012902001.1 NV2t012902001.1, Nematostella_vectensis_NV2t016210001.1 NV2t016210001.1
OG0000012	Drosophila_melanogaster_tr_Q9W2H2_Q9W2H2_DROME tr|Q9W2H2|Q9W2H2_DROME Crossveinless 2 OS=Drosophila melanogaster OX=7227 GN=cv-2 PE=2 SV=2, Drosophila_melanogaster_tr_Q9GYX3_Q9GYX3_DROME tr|Q9GYX3|Q9GYX3_DROME Crossveinless 2 OS=Drosophila melanogaster OX=7227 GN=cv-2 PE=2 SV=2	Nematostella_vectensis_NV2t012730001.1 NV2t012730001.1
OG0000012	Drosophila_melanogaster_tr_Q9VKA7_Q9VKA7_DROME tr|Q9VKA7|Q9VKA7_DROME VWFC domain-containing protein OS=Drosophila melanogaster OX=7227 GN=Dmel\CG17211 PE=4 SV=1	Nematostella_vectensis_NV2t006919001.1 NV2t006919001.1, Nematostella_vectensis_NV2t019905001.1 NV2t019905001.1
OG0000013	Drosophila_melanogaster_tr_Q9VM26_Q9VM26_DROME tr|Q9VM26|Q9VM26_DROME Protein Wnt OS=Drosophila melanogaster OX=7227 GN=Wnt6 PE=2 SV=3	Nematostella_vectensis_NV2t011033001.1 NV2t011033001.1
OG0000013	Drosophila_melanogaster_sp_P09615_WNTG_DROME sp|P09615|WNTG_DROME Protein wingless OS=Drosophila melanogaster OX=7227 GN=wg PE=1 SV=1	Nematostella_vectensis_NV2t012225001.1 NV2t012225001.1
OG0000013	Drosophila_melanogaster_sp_P28465_WNT2_DROME sp|P28465|WNT2_DROME Protein Wnt-2 OS=Drosophila melanogaster OX=7227 GN=Wnt2 PE=2 SV=2, Drosophila_melanogaster_tr_A0A0B4LFY4_A0A0B4LFY4_DROME tr|A0A0B4LFY4|A0A0B4LFY4_DROME Protein Wnt OS=Drosophila melanogaster OX=7227 GN=Wnt2 PE=3 SV=1	Nematostella_vectensis_NV2t003609002.1 NV2t003609002.1, Nematostella_vectensis_NV2t003609001.1 NV2t003609001.1
OG0000013	Drosophila_melanogaster_sp_Q9VFX1_WNT8_DROME sp|Q9VFX1|WNT8_DROME Wnt inhibitor of Dorsal protein OS=Drosophila melanogaster OX=7227 GN=wntD PE=1 SV=2	Nematostella_vectensis_NV2t003689001.1 NV2t003689001.1, Nematostella_vectensis_NV2t004522001.1 NV2t004522001.1, Nematostella_vectensis_NV2t005661001.1 NV2t005661001.1
OG0000013	Drosophila_melanogaster_tr_Q9VM25_Q9VM25_DROME tr|Q9VM25|Q9VM25_DROME Protein Wnt OS=Drosophila melanogaster OX=7227 GN=Wnt10 PE=3 SV=4	Nematostella_vectensis_NV2t011032001.1 NV2t011032001.1
OG0000014	Drosophila_melanogaster_tr_Q9VKV3_Q9VKV3_DROME tr|Q9VKV3|Q9VKV3_DROME Lonely heart_ isoform A OS=Drosophila melanogaster OX=7227 GN=loh PE=4 SV=3, Drosophila_melanogaster_tr_Q8MSF8_Q8MSF8_DROME tr|Q8MSF8|Q8MSF8_DROME GM15606p OS=Drosophila melanogaster OX=7227 GN=loh PE=2 SV=1, Drosophila_melanogaster_tr_E1JHE3_E1JHE3_DROME tr|E1JHE3|E1JHE3_DROME Lonely heart_ isoform D OS=Drosophila melanogaster OX=7227 GN=loh PE=4 SV=2, Drosophila_melanogaster_tr_M9MRI1_M9MRI1_DROME tr|M9MRI1|M9MRI1_DROME Lonely heart_ isoform C OS=Drosophila melanogaster OX=7227 GN=loh PE=4 SV=1	Nematostella_vectensis_NV2t022999001.1 NV2t022999001.1
OG0000014	Drosophila_melanogaster_tr_E1JHP3_E1JHP3_DROME tr|E1JHP3|E1JHP3_DROME No long nerve cord_ isoform D OS=Drosophila melanogaster OX=7227 GN=nolo PE=1 SV=1, Drosophila_melanogaster_tr_Q0E8N3_Q0E8N3_DROME tr|Q0E8N3|Q0E8N3_DROME No long nerve cord_ isoform C OS=Drosophila melanogaster OX=7227 GN=nolo PE=1 SV=1, Drosophila_melanogaster_tr_X2JAM1_X2JAM1_DROME tr|X2JAM1|X2JAM1_DROME No long nerve cord_ isoform G OS=Drosophila melanogaster OX=7227 GN=nolo PE=1 SV=1, Drosophila_melanogaster_tr_Q8MRW9_Q8MRW9_DROME tr|Q8MRW9|Q8MRW9_DROME SD16815p OS=Drosophila melanogaster OX=7227 GN=nolo PE=2 SV=1, Drosophila_melanogaster_tr_Q9V9Q7_Q9V9Q7_DROME tr|Q9V9Q7|Q9V9Q7_DROME No long nerve cord_ isoform A OS=Drosophila melanogaster OX=7227 GN=nolo PE=1 SV=2, Drosophila_melanogaster_tr_X2JEX4_X2JEX4_DROME tr|X2JEX4|X2JEX4_DROME No long nerve cord_ isoform F OS=Drosophila melanogaster OX=7227 GN=nolo PE=1 SV=1, Drosophila_melanogaster_tr_Q9V9Q9_Q9V9Q9_DROME tr|Q9V9Q9|Q9V9Q9_DROME GH19218p OS=Drosophila melanogaster OX=7227 GN=nolo PE=1 SV=2	Nematostella_vectensis_NV2t023123001.1 NV2t023123001.1
OG0000014	Drosophila_melanogaster_sp_Q868Z9_PPN_DROME sp|Q868Z9|PPN_DROME Papilin OS=Drosophila melanogaster OX=7227 GN=Ppn PE=1 SV=2	Nematostella_vectensis_NV2t020821001.1 NV2t020821001.1
OG0000014	Drosophila_melanogaster_tr_A0A0B4KHK4_A0A0B4KHK4_DROME tr|A0A0B4KHK4|A0A0B4KHK4_DROME ADAM metallopeptidase with thrombospondin type 1 motif A_ isoform C OS=Drosophila melanogaster OX=7227 GN=AdamTS-A PE=4 SV=1, Drosophila_melanogaster_tr_Q7KSH7_Q7KSH7_DROME tr|Q7KSH7|Q7KSH7_DROME ADAM metallopeptidase with thrombospondin type 1 motif A_ isoform E OS=Drosophila melanogaster OX=7227 GN=AdamTS-A PE=4 SV=1, Drosophila_melanogaster_tr_Q8SXB0_Q8SXB0_DROME tr|Q8SXB0|Q8SXB0_DROME ADAM metallopeptidase with thrombospondin type 1 motif A_ isoform B OS=Drosophila melanogaster OX=7227 GN=AdamTS-A PE=2 SV=1	Nematostella_vectensis_NV2t000088001.1 NV2t000088001.1, Nematostella_vectensis_NV2t000087001.1 NV2t000087001.1
