Orthogroup	Insecta_Diptera_Drosophila_melanogaster	Cnidaria_Anthozoa_Nematostella_vectensis
OG0000017	Drosophila_melanogaster_tr_Q8MPN6_Q8MPN6_DROME tr|Q8MPN6|Q8MPN6_DROME Serpin 4 OS=Drosophila melanogaster OX=7227 GN=Spn42Da PE=1 SV=1, Drosophila_melanogaster_tr_Q8MPN8_Q8MPN8_DROME tr|Q8MPN8|Q8MPN8_DROME Serpin 4 OS=Drosophila melanogaster OX=7227 GN=Spn42Da PE=1 SV=1, Drosophila_melanogaster_tr_Q8MPN7_Q8MPN7_DROME tr|Q8MPN7|Q8MPN7_DROME GH08104p OS=Drosophila melanogaster OX=7227 GN=Spn42Da PE=1 SV=1, Drosophila_melanogaster_tr_Q8MPN5_Q8MPN5_DROME tr|Q8MPN5|Q8MPN5_DROME Serpin 4 OS=Drosophila melanogaster OX=7227 GN=Spn42Da PE=1 SV=1, Drosophila_melanogaster_tr_Q9U1I5_Q9U1I5_DROME tr|Q9U1I5|Q9U1I5_DROME Serine protease inhibitor _Serpin-4_ OS=Drosophila melanogaster OX=7227 GN=Spn42Da PE=2 SV=1, Drosophila_melanogaster_tr_Q7K8Y3_Q7K8Y3_DROME tr|Q7K8Y3|Q7K8Y3_DROME IP16419p OS=Drosophila melanogaster OX=7227 GN=Spn42Da PE=1 SV=1, Drosophila_melanogaster_tr_Q7K8Y5_Q7K8Y5_DROME tr|Q7K8Y5|Q7K8Y5_DROME Serpin 4 OS=Drosophila melanogaster OX=7227 GN=Spn42Da PE=1 SV=1, Drosophila_melanogaster_tr_Q8MM39_Q8MM39_DROME tr|Q8MM39|Q8MM39_DROME RE31022p OS=Drosophila melanogaster OX=7227 GN=Spn42Da PE=1 SV=1, Drosophila_melanogaster_tr_Q8MM49_Q8MM49_DROME tr|Q8MM49|Q8MM49_DROME Serpin 4 OS=Drosophila melanogaster OX=7227 GN=Spn42Da PE=1 SV=1, Drosophila_melanogaster_tr_Q8T0M5_Q8T0M5_DROME tr|Q8T0M5|Q8T0M5_DROME GH21896p OS=Drosophila melanogaster OX=7227 GN=Spn42Da PE=2 SV=1, Drosophila_melanogaster_tr_Q7JV69_Q7JV69_DROME tr|Q7JV69|Q7JV69_DROME SD11922p OS=Drosophila melanogaster OX=7227 GN=Spn55B PE=1 SV=1, Drosophila_melanogaster_tr_A1Z6R4_A1Z6R4_DROME tr|A1Z6R4|A1Z6R4_DROME Serpin 42Dc_ isoform A OS=Drosophila melanogaster OX=7227 GN=Spn42Dc PE=1 SV=1, Drosophila_melanogaster_tr_Q8T3Z2_Q8T3Z2_DROME tr|Q8T3Z2|Q8T3Z2_DROME AT24862p OS=Drosophila melanogaster OX=7227 GN=Spn42Dc PE=2 SV=1, Drosophila_melanogaster_tr_Q8SZF4_Q8SZF4_DROME tr|Q8SZF4|Q8SZF4_DROME RE02548p OS=Drosophila melanogaster OX=7227 GN=Spn42De PE=2 SV=1, Drosophila_melanogaster_tr_A0A0B4K6Q4_A0A0B4K6Q4_DROME tr|A0A0B4K6Q4|A0A0B4K6Q4_DROME Serpin 42De_ isoform B OS=Drosophila melanogaster OX=7227 GN=Spn42De PE=3 SV=1, Drosophila_melanogaster_tr_Q6V6U3_Q6V6U3_DROME tr|Q6V6U3|Q6V6U3_DROME Spn43Ac _Fragment_ OS=Drosophila melanogaster OX=7227 GN=nec PE=3 SV=1, Drosophila_melanogaster_tr_Q6V6U5_Q6V6U5_DROME tr|Q6V6U5|Q6V6U5_DROME Spn43Ac _Fragment_ OS=Drosophila melanogaster OX=7227 GN=nec PE=3 SV=1, Drosophila_melanogaster_tr_Q6V6U7_Q6V6U7_DROME tr|Q6V6U7|Q6V6U7_DROME Spn43Ac _Fragment_ OS=Drosophila melanogaster OX=7227 GN=nec PE=3 SV=1, Drosophila_melanogaster_tr_Q6V6V0_Q6V6V0_DROME tr|Q6V6V0|Q6V6V0_DROME Spn43Ac _Fragment_ OS=Drosophila melanogaster OX=7227 GN=nec PE=3 SV=1, Drosophila_melanogaster_tr_Q6V6U8_Q6V6U8_DROME tr|Q6V6U8|Q6V6U8_DROME Spn43Ac _Fragment_ OS=Drosophila melanogaster OX=7227 GN=nec PE=3 SV=1, Drosophila_melanogaster_tr_Q6V6U4_Q6V6U4_DROME tr|Q6V6U4|Q6V6U4_DROME Spn43Ac _Fragment_ OS=Drosophila melanogaster OX=7227 GN=nec PE=3 SV=1, Drosophila_melanogaster_tr_Q6V6U2_Q6V6U2_DROME tr|Q6V6U2|Q6V6U2_DROME Spn43Ac _Fragment_ OS=Drosophila melanogaster OX=7227 GN=nec PE=3 SV=1, Drosophila_melanogaster_tr_Q6V6U1_Q6V6U1_DROME tr|Q6V6U1|Q6V6U1_DROME Spn43Ac _Fragment_ OS=Drosophila melanogaster OX=7227 GN=nec PE=3 SV=1, Drosophila_melanogaster_tr_Q6V6U9_Q6V6U9_DROME tr|Q6V6U9|Q6V6U9_DROME Spn43Ac _Fragment_ OS=Drosophila melanogaster OX=7227 GN=nec PE=3 SV=1, Drosophila_melanogaster_tr_Q6V6U6_Q6V6U6_DROME tr|Q6V6U6|Q6V6U6_DROME Spn43Ac _Fragment_ OS=Drosophila melanogaster OX=7227 GN=nec PE=3 SV=1, Drosophila_melanogaster_tr_Q7JWX3_Q7JWX3_DROME tr|Q7JWX3|Q7JWX3_DROME GH10112p OS=Drosophila melanogaster OX=7227 GN=nec PE=1 SV=1, Drosophila_melanogaster_tr_Q9U5W7_Q9U5W7_DROME tr|Q9U5W7|Q9U5W7_DROME Serpin_ putative OS=Drosophila melanogaster OX=7227 GN=nec PE=2 SV=1, Drosophila_melanogaster_tr_Q7KA66_Q7KA66_DROME tr|Q7KA66|Q7KA66_DROME Serpin 43Aa OS=Drosophila melanogaster OX=7227 GN=Spn43Aa PE=1 SV=1, Drosophila_melanogaster_tr_Q8MQZ7_Q8MQZ7_DROME tr|Q8MQZ7|Q8MQZ7_DROME LP08647p _Fragment_ OS=Drosophila melanogaster OX=7227 GN=Spn43Aa PE=2 SV=1, Drosophila_melanogaster_tr_Q0E8V6_Q0E8V6_DROME tr|Q0E8V6|Q0E8V6_DROME Serpin 28Da OS=Drosophila melanogaster OX=7227 GN=Spn28Da PE=3 SV=1, Drosophila_melanogaster_tr_X2JAJ8_X2JAJ8_DROME tr|X2JAJ8|X2JAJ8_DROME Serpin 38F_ isoform B OS=Drosophila melanogaster OX=7227 GN=Spn38F PE=3 SV=1, Drosophila_melanogaster_tr_Q8MSJ3_Q8MSJ3_DROME tr|Q8MSJ3|Q8MSJ3_DROME GH09216p OS=Drosophila melanogaster OX=7227 GN=Spn38F PE=2 SV=1, Drosophila_melanogaster_tr_Q9VII7_Q9VII7_DROME tr|Q9VII7|Q9VII7_DROME Serpin 38F_ isoform A OS=Drosophila melanogaster OX=7227 GN=Spn38F PE=3 SV=3, Drosophila_melanogaster_tr_Q9U1I6_Q9U1I6_DROME tr|Q9U1I6|Q9U1I6_DROME Serine protease inhibitor _Serpin-3_ OS=Drosophila melanogaster OX=7227 GN=Spn38F PE=2 SV=1, Drosophila_melanogaster_tr_Q9VLQ7_Q9VLQ7_DROME tr|Q9VLQ7|Q9VLQ7_DROME Serpin 28F OS=Drosophila melanogaster OX=7227 GN=Spn28F PE=3 SV=2, Drosophila_melanogaster_tr_Q8MSJ4_Q8MSJ4_DROME tr|Q8MSJ4|Q8MSJ4_DROME GH08778p OS=Drosophila melanogaster OX=7227 GN=Spn28F PE=2 SV=1, Drosophila_melanogaster_tr_Q9U1I7_Q9U1I7_DROME tr|Q9U1I7|Q9U1I7_DROME Serine protease inhibitor _Serpin-2_ OS=Drosophila melanogaster OX=7227 GN=Spn28F PE=2 SV=1, Drosophila_melanogaster_tr_Q9VLZ8_Q9VLZ8_DROME tr|Q9VLZ8|Q9VLZ8_DROME Serpin 28B_ isoform A OS=Drosophila melanogaster OX=7227 GN=Spn28B PE=3 SV=2, Drosophila_melanogaster_sp_Q7YTY6_SP42D_DROME sp|Q7YTY6|SP42D_DROME Serine protease inhibitor 42Dd OS=Drosophila melanogaster OX=7227 GN=Spn42Dd PE=2 SV=1	Nematostella_vectensis_NV2t021103001.1 NV2t021103001.1
OG0000019	Drosophila_melanogaster_tr_Q9VQG9_Q9VQG9_DROME tr|Q9VQG9|Q9VQG9_DROME Dawdle_ isoform A OS=Drosophila melanogaster OX=7227 GN=daw PE=2 SV=1	Nematostella_vectensis_NV2t000173001.1 NV2t000173001.1
OG0000019	Drosophila_melanogaster_tr_X2JB15_X2JB15_DROME tr|X2JB15|X2JB15_DROME Screw_ isoform B OS=Drosophila melanogaster OX=7227 GN=scw PE=3 SV=1, Drosophila_melanogaster_sp_P54631_SCW_DROME sp|P54631|SCW_DROME Protein screw OS=Drosophila melanogaster OX=7227 GN=scw PE=2 SV=2, Drosophila_melanogaster_sp_P27091_60A_DROME sp|P27091|60A_DROME Protein 60A OS=Drosophila melanogaster OX=7227 GN=gbb PE=1 SV=1, Drosophila_melanogaster_tr_A0A0B4LGA7_A0A0B4LGA7_DROME tr|A0A0B4LGA7|A0A0B4LGA7_DROME Glass bottom boat_ isoform B OS=Drosophila melanogaster OX=7227 GN=gbb PE=3 SV=1	Nematostella_vectensis_NV2t006269003.1 NV2t006269003.1, Nematostella_vectensis_NV2t006269002.1 NV2t006269002.1, Nematostella_vectensis_NV2t006269001.1 NV2t006269001.1
OG0000019	Drosophila_melanogaster_sp_P07713_DECA_DROME sp|P07713|DECA_DROME Protein decapentaplegic OS=Drosophila melanogaster OX=7227 GN=dpp PE=1 SV=2	Nematostella_vectensis_NV2t019847002.1 NV2t019847002.1, Nematostella_vectensis_NV2t019847001.1 NV2t019847001.1
OG0000021	Drosophila_melanogaster_sp_A1Z877_NDG_DROME sp|A1Z877|NDG_DROME Nidogen OS=Drosophila melanogaster OX=7227 GN=Ndg PE=1 SV=1	Nematostella_vectensis_NV2t020722001.1 NV2t020722001.1, Nematostella_vectensis_NV2t020722002.1 NV2t020722002.1, Nematostella_vectensis_NV2t020722003.1 NV2t020722003.1
OG0000022	Drosophila_melanogaster_sp_Q9VXG4_ANX11_DROME sp|Q9VXG4|ANX11_DROME Annexin B11 OS=Drosophila melanogaster OX=7227 GN=AnxB11 PE=2 SV=2, Drosophila_melanogaster_tr_A0A0B4KH34_A0A0B4KH34_DROME tr|A0A0B4KH34|A0A0B4KH34_DROME Annexin OS=Drosophila melanogaster OX=7227 GN=AnxB9 PE=1 SV=1, Drosophila_melanogaster_sp_P22464_ANXB9_DROME sp|P22464|ANXB9_DROME Annexin B9 OS=Drosophila melanogaster OX=7227 GN=AnxB9 PE=1 SV=2, Drosophila_melanogaster_sp_P22465_ANX10_DROME sp|P22465|ANX10_DROME Annexin B10 OS=Drosophila melanogaster OX=7227 GN=AnxB10 PE=2 SV=3	Nematostella_vectensis_NV2t019403001.1 NV2t019403001.1, Nematostella_vectensis_NV2t019404001.1 NV2t019404001.1, Nematostella_vectensis_NV2t019402004.1 NV2t019402004.1, Nematostella_vectensis_NV2t019402002.1 NV2t019402002.1
OG0000023	Drosophila_melanogaster_tr_B7Z0Y2_B7Z0Y2_DROME tr|B7Z0Y2|B7Z0Y2_DROME Mind-meld_ isoform D OS=Drosophila melanogaster OX=7227 GN=mmd PE=4 SV=1, Drosophila_melanogaster_tr_Q9VXL1_Q9VXL1_DROME tr|Q9VXL1|Q9VXL1_DROME Mind-meld_ isoform F OS=Drosophila melanogaster OX=7227 GN=mmd PE=4 SV=6, Drosophila_melanogaster_tr_X2JE21_X2JE21_DROME tr|X2JE21|X2JE21_DROME Mind-meld_ isoform J OS=Drosophila melanogaster OX=7227 GN=mmd PE=4 SV=1, Drosophila_melanogaster_tr_M9PER2_M9PER2_DROME tr|M9PER2|M9PER2_DROME Mind-meld_ isoform H OS=Drosophila melanogaster OX=7227 GN=mmd PE=4 SV=1, Drosophila_melanogaster_tr_M9PH86_M9PH86_DROME tr|M9PH86|M9PH86_DROME Mind-meld_ isoform I OS=Drosophila melanogaster OX=7227 GN=mmd PE=4 SV=1, Drosophila_melanogaster_tr_M9NDY9_M9NDY9_DROME tr|M9NDY9|M9NDY9_DROME Mind-meld_ isoform G OS=Drosophila melanogaster OX=7227 GN=mmd PE=4 SV=1, Drosophila_melanogaster_tr_M9NH46_M9NH46_DROME tr|M9NH46|M9NH46_DROME Mind-meld_ isoform E OS=Drosophila melanogaster OX=7227 GN=mmd PE=4 SV=1, Drosophila_melanogaster_tr_Q7KUY7_Q7KUY7_DROME tr|Q7KUY7|Q7KUY7_DROME Mind-meld_ isoform B OS=Drosophila melanogaster OX=7227 GN=mmd PE=4 SV=2, Drosophila_melanogaster_tr_Q9GZ15_Q9GZ15_DROME tr|Q9GZ15|Q9GZ15_DROME MIND-MELD _Fragment_ OS=Drosophila melanogaster OX=7227 GN=mmd PE=2 SV=1	Nematostella_vectensis_NV2t018385002.1 NV2t018385002.1, Nematostella_vectensis_NV2t018385001.1 NV2t018385001.1
OG0000024	Drosophila_melanogaster_tr_A0A0B4KH80_A0A0B4KH80_DROME tr|A0A0B4KH80|A0A0B4KH80_DROME Carrier of wingless_ isoform E OS=Drosophila melanogaster OX=7227 GN=Cow PE=4 SV=1, Drosophila_melanogaster_sp_Q9VCR3_COW_DROME sp|Q9VCR3|COW_DROME Proteoglycan Cow OS=Drosophila melanogaster OX=7227 GN=Cow PE=1 SV=3	Nematostella_vectensis_NV2t003372003.1 NV2t003372003.1, Nematostella_vectensis_NV2t003372002.1 NV2t003372002.1, Nematostella_vectensis_NV2t003372001.1 NV2t003372001.1
OG0000028	Drosophila_melanogaster_tr_O18407_O18407_DROME tr|O18407|O18407_DROME Collagen type IV alpha 2 OS=Drosophila melanogaster OX=7227 GN=vkg PE=2 SV=1, Drosophila_melanogaster_tr_Q9VMV5_Q9VMV5_DROME tr|Q9VMV5|Q9VMV5_DROME Viking_ isoform A OS=Drosophila melanogaster OX=7227 GN=vkg PE=1 SV=1	Nematostella_vectensis_NV2t021411001.1 NV2t021411001.1
OG0000028	Drosophila_melanogaster_sp_P08120_CO4A1_DROME sp|P08120|CO4A1_DROME Collagen alpha-1_IV_ chain OS=Drosophila melanogaster OX=7227 GN=Col4a1 PE=1 SV=3	Nematostella_vectensis_NV2t021409001.1 NV2t021409001.1
OG0000030	Drosophila_melanogaster_sp_Q9VAC5_ADA17_DROME sp|Q9VAC5|ADA17_DROME ADAM 17-like protease OS=Drosophila melanogaster OX=7227 GN=Tace PE=2 SV=2	Nematostella_vectensis_NV2t006771001.1 NV2t006771001.1, Nematostella_vectensis_NV2t006771002.1 NV2t006771002.1
OG0000030	Drosophila_melanogaster_tr_Q9VAI2_Q9VAI2_DROME tr|Q9VAI2|Q9VAI2_DROME Kuzbanian-like_ isoform A OS=Drosophila melanogaster OX=7227 GN=Kul PE=4 SV=1, Drosophila_melanogaster_tr_A0A0B4LHU2_A0A0B4LHU2_DROME tr|A0A0B4LHU2|A0A0B4LHU2_DROME Kuzbanian-like_ isoform C OS=Drosophila melanogaster OX=7227 GN=Kul PE=4 SV=1, Drosophila_melanogaster_tr_Q59DZ3_Q59DZ3_DROME tr|Q59DZ3|Q59DZ3_DROME FI21209p1 OS=Drosophila melanogaster OX=7227 GN=kuz PE=1 SV=1, Drosophila_melanogaster_tr_A8DZ03_A8DZ03_DROME tr|A8DZ03|A8DZ03_DROME Kuzbanian_ isoform G OS=Drosophila melanogaster OX=7227 GN=kuz PE=1 SV=2, Drosophila_melanogaster_tr_A8DZ02_A8DZ02_DROME tr|A8DZ02|A8DZ02_DROME Kuzbanian_ isoform F OS=Drosophila melanogaster OX=7227 GN=kuz PE=1 SV=2, Drosophila_melanogaster_tr_Q9VJW9_Q9VJW9_DROME tr|Q9VJW9|Q9VJW9_DROME Kuzbanian_ isoform A OS=Drosophila melanogaster OX=7227 GN=kuz PE=1 SV=1, Drosophila_melanogaster_tr_Q94902_Q94902_DROME tr|Q94902|Q94902_DROME Kuzbanian OS=Drosophila melanogaster OX=7227 GN=kuz PE=2 SV=1	Nematostella_vectensis_NV2t013893003.1 NV2t013893003.1, Nematostella_vectensis_NV2t013893002.1 NV2t013893002.1, Nematostella_vectensis_NV2t024729009.1 NV2t024729009.1, Nematostella_vectensis_NV2t024729016.1 NV2t024729016.1, Nematostella_vectensis_NV2t024729018.1 NV2t024729018.1, Nematostella_vectensis_NV2t024729004.1 NV2t024729004.1, Nematostella_vectensis_NV2t024729015.1 NV2t024729015.1, Nematostella_vectensis_NV2t024729005.1 NV2t024729005.1, Nematostella_vectensis_NV2t024729010.1 NV2t024729010.1, Nematostella_vectensis_NV2t024729008.1 NV2t024729008.1, Nematostella_vectensis_NV2t024729007.1 NV2t024729007.1, Nematostella_vectensis_NV2t024729006.1 NV2t024729006.1
OG0000034	Drosophila_melanogaster_tr_Q9VLT6_Q9VLT6_DROME tr|Q9VLT6|Q9VLT6_DROME Multiple EGF like domains 8_ isoform B OS=Drosophila melanogaster OX=7227 GN=Megf8 PE=4 SV=4, Drosophila_melanogaster_tr_X2J9V1_X2J9V1_DROME tr|X2J9V1|X2J9V1_DROME Multiple EGF like domains 8_ isoform C OS=Drosophila melanogaster OX=7227 GN=Megf8 PE=4 SV=1, Drosophila_melanogaster_tr_Q8T0D8_Q8T0D8_DROME tr|Q8T0D8|Q8T0D8_DROME LD09511p OS=Drosophila melanogaster OX=7227 GN=Megf8 PE=2 SV=1	Nematostella_vectensis_NV2t021926001.1 NV2t021926001.1
OG0000036	Drosophila_melanogaster_tr_Q95RQ1_Q95RQ1_DROME tr|Q95RQ1|Q95RQ1_DROME LD16414p OS=Drosophila melanogaster OX=7227 GN=slow PE=2 SV=1	Nematostella_vectensis_NV2t025171002.1 NV2t025171002.1, Nematostella_vectensis_NV2t025171001.1 NV2t025171001.1, Nematostella_vectensis_NV2t022153002.1 NV2t022153002.1, Nematostella_vectensis_NV2t022153001.1 NV2t022153001.1
OG0000037	Drosophila_melanogaster_tr_Q8IP52_Q8IP52_DROME tr|Q8IP52|Q8IP52_DROME RE16941p OS=Drosophila melanogaster OX=7227 GN=Dmel\CG43333 PE=2 SV=1	Nematostella_vectensis_NV2t002364001.1 NV2t002364001.1, Nematostella_vectensis_NV2t002361001.1 NV2t002361001.1, Nematostella_vectensis_NV2t002361003.1 NV2t002361003.1, Nematostella_vectensis_NV2t002361002.1 NV2t002361002.1, Nematostella_vectensis_NV2t002361004.1 NV2t002361004.1
OG0000044	Drosophila_melanogaster_tr_Q8IPH0_Q8IPH0_DROME tr|Q8IPH0|Q8IPH0_DROME Transglutaminase_ isoform B OS=Drosophila melanogaster OX=7227 GN=Tg PE=1 SV=1, Drosophila_melanogaster_tr_Q9VLU2_Q9VLU2_DROME tr|Q9VLU2|Q9VLU2_DROME RE08173p OS=Drosophila melanogaster OX=7227 GN=Tg PE=2 SV=2	Nematostella_vectensis_NV2t009869001.1 NV2t009869001.1, Nematostella_vectensis_NV2t010348003.1 NV2t010348003.1, Nematostella_vectensis_NV2t010348004.1 NV2t010348004.1, Nematostella_vectensis_NV2t010348002.1 NV2t010348002.1, Nematostella_vectensis_NV2t010348007.1 NV2t010348007.1, Nematostella_vectensis_NV2t010348005.1 NV2t010348005.1, Nematostella_vectensis_NV2t010348010.1 NV2t010348010.1, Nematostella_vectensis_NV2t010348008.1 NV2t010348008.1
OG0000045	Drosophila_melanogaster_sp_Q00174_LAMA_DROME sp|Q00174|LAMA_DROME Laminin subunit alpha OS=Drosophila melanogaster OX=7227 GN=LanA PE=1 SV=2	Nematostella_vectensis_NV2t015819001.1 NV2t015819001.1, Nematostella_vectensis_NV2t017119001.1 NV2t017119001.1
OG0000045	Drosophila_melanogaster_tr_M9MRU0_M9MRU0_DROME tr|M9MRU0|M9MRU0_DROME Wing blister_ isoform C OS=Drosophila melanogaster OX=7227 GN=wb PE=4 SV=1	Nematostella_vectensis_NV2t015818001.1 NV2t015818001.1
OG0000047	Drosophila_melanogaster_tr_X2J8E8_X2J8E8_DROME tr|X2J8E8|X2J8E8_DROME Lethal _2_ 34Fc_ isoform B OS=Drosophila melanogaster OX=7227 GN=l_2_34Fc PE=4 SV=1, Drosophila_melanogaster_sp_Q9V3Y3_DFP_DROME sp|Q9V3Y3|DFP_DROME Defense protein l_2_34Fc OS=Drosophila melanogaster OX=7227 GN=l_2_34Fc PE=2 SV=1	Nematostella_vectensis_NV2t000021003.1 NV2t000021003.1, Nematostella_vectensis_NV2t000021001.1 NV2t000021001.1, Nematostella_vectensis_NV2t000021002.1 NV2t000021002.1, Nematostella_vectensis_NV2t000027001.1 NV2t000027001.1
OG0000049	Drosophila_melanogaster_tr_Q86M56_Q86M56_DROME tr|Q86M56|Q86M56_DROME LD10519p OS=Drosophila melanogaster OX=7227 GN=PlexA PE=2 SV=1, Drosophila_melanogaster_tr_Q9V491_Q9V491_DROME tr|Q9V491|Q9V491_DROME Plexin A_ isoform A OS=Drosophila melanogaster OX=7227 GN=PlexA PE=1 SV=1, Drosophila_melanogaster_tr_Q7YU07_Q7YU07_DROME tr|Q7YU07|Q7YU07_DROME LD15833p OS=Drosophila melanogaster OX=7227 GN=PlexA PE=2 SV=1, Drosophila_melanogaster_tr_Q0KIF1_Q0KIF1_DROME tr|Q0KIF1|Q0KIF1_DROME Plexin A_ isoform B OS=Drosophila melanogaster OX=7227 GN=PlexA PE=1 SV=1, Drosophila_melanogaster_tr_O96681_O96681_DROME tr|O96681|O96681_DROME Plexin A OS=Drosophila melanogaster OX=7227 GN=PlexA PE=2 SV=1, Drosophila_melanogaster_tr_H9XVP3_H9XVP3_DROME tr|H9XVP3|H9XVP3_DROME Plexin A_ isoform F OS=Drosophila melanogaster OX=7227 GN=PlexA PE=1 SV=1, Drosophila_melanogaster_sp_Q9V4A7_PLXB_DROME sp|Q9V4A7|PLXB_DROME Plexin-B OS=Drosophila melanogaster OX=7227 GN=PlexB PE=1 SV=2, Drosophila_melanogaster_tr_H9XVL5_H9XVL5_DROME tr|H9XVL5|H9XVL5_DROME Plexin B_ isoform B OS=Drosophila melanogaster OX=7227 GN=PlexB PE=3 SV=1	Nematostella_vectensis_NV2t002812001.1 NV2t002812001.1
OG0000063	Drosophila_melanogaster_sp_Q02936_HH_DROME sp|Q02936|HH_DROME Protein hedgehog OS=Drosophila melanogaster OX=7227 GN=hh PE=1 SV=4	Nematostella_vectensis_NV2t000128002.1 NV2t000128002.1, Nematostella_vectensis_NV2t000128001.1 NV2t000128001.1, Nematostella_vectensis_NV2t000128004.1 NV2t000128004.1, Nematostella_vectensis_NV2t000128003.1 NV2t000128003.1, Nematostella_vectensis_NV2t010760002.1 NV2t010760002.1, Nematostella_vectensis_NV2t010760001.1 NV2t010760001.1
OG0000065	Drosophila_melanogaster_tr_Q53XG2_Q53XG2_DROME tr|Q53XG2|Q53XG2_DROME Division abnormally delayed_ isoform B OS=Drosophila melanogaster OX=7227 GN=dally PE=1 SV=1, Drosophila_melanogaster_sp_Q24114_DALY_DROME sp|Q24114|DALY_DROME Division abnormally delayed protein OS=Drosophila melanogaster OX=7227 GN=dally PE=1 SV=1, Drosophila_melanogaster_tr_Q966V5_Q966V5_DROME tr|Q966V5|Q966V5_DROME Dally OS=Drosophila melanogaster OX=7227 GN=dally PE=3 SV=1	Nematostella_vectensis_NV2t022015001.1 NV2t022015001.1, Nematostella_vectensis_NV2t022018001.1 NV2t022018001.1
OG0000080	Drosophila_melanogaster_sp_Q9VH14_TIMP_DROME sp|Q9VH14|TIMP_DROME Tissue inhibitor of metalloproteinase OS=Drosophila melanogaster OX=7227 GN=Timp PE=1 SV=1	Nematostella_vectensis_NV2t017964001.1 NV2t017964001.1, Nematostella_vectensis_NV2t003669001.1 NV2t003669001.1, Nematostella_vectensis_NV2t003671001.1 NV2t003671001.1, Nematostella_vectensis_NV2t002779001.1 NV2t002779001.1
OG0000084	Drosophila_melanogaster_tr_Q86BH1_Q86BH1_DROME tr|Q86BH1|Q86BH1_DROME Multiplexin_ isoform E OS=Drosophila melanogaster OX=7227 GN=Mp PE=4 SV=1, Drosophila_melanogaster_tr_E1JI50_E1JI50_DROME tr|E1JI50|E1JI50_DROME Multiplexin_ isoform F OS=Drosophila melanogaster OX=7227 GN=Mp PE=4 SV=1, Drosophila_melanogaster_tr_Q8MT89_Q8MT89_DROME tr|Q8MT89|Q8MT89_DROME GH14382p OS=Drosophila melanogaster OX=7227 GN=Mp PE=2 SV=1, Drosophila_melanogaster_tr_X2JGC3_X2JGC3_DROME tr|X2JGC3|X2JGC3_DROME Multiplexin_ isoform S OS=Drosophila melanogaster OX=7227 GN=Mp PE=4 SV=1, Drosophila_melanogaster_tr_E1JI49_E1JI49_DROME tr|E1JI49|E1JI49_DROME Multiplexin_ isoform H OS=Drosophila melanogaster OX=7227 GN=Mp PE=4 SV=1, Drosophila_melanogaster_tr_X2JC42_X2JC42_DROME tr|X2JC42|X2JC42_DROME Multiplexin_ isoform T OS=Drosophila melanogaster OX=7227 GN=Mp PE=4 SV=1, Drosophila_melanogaster_tr_E1JIE0_E1JIE0_DROME tr|E1JIE0|E1JIE0_DROME Multiplexin_ isoform M OS=Drosophila melanogaster OX=7227 GN=Mp PE=4 SV=1, Drosophila_melanogaster_tr_M9ND55_M9ND55_DROME tr|M9ND55|M9ND55_DROME Multiplexin_ isoform R OS=Drosophila melanogaster OX=7227 GN=Mp PE=4 SV=1, Drosophila_melanogaster_tr_E1JIE3_E1JIE3_DROME tr|E1JIE3|E1JIE3_DROME Multiplexin_ isoform O OS=Drosophila melanogaster OX=7227 GN=Mp PE=4 SV=2, Drosophila_melanogaster_tr_E1JID9_E1JID9_DROME tr|E1JID9|E1JID9_DROME Multiplexin_ isoform G OS=Drosophila melanogaster OX=7227 GN=Mp PE=4 SV=1, Drosophila_melanogaster_tr_E1JIE1_E1JIE1_DROME tr|E1JIE1|E1JIE1_DROME Multiplexin_ isoform B OS=Drosophila melanogaster OX=7227 GN=Mp PE=4 SV=1, Drosophila_melanogaster_tr_E1JIE2_E1JIE2_DROME tr|E1JIE2|E1JIE2_DROME Multiplexin_ isoform L OS=Drosophila melanogaster OX=7227 GN=Mp PE=4 SV=1, Drosophila_melanogaster_tr_X2JCL0_X2JCL0_DROME tr|X2JCL0|X2JCL0_DROME Multiplexin_ isoform U OS=Drosophila melanogaster OX=7227 GN=Mp PE=4 SV=1, Drosophila_melanogaster_tr_E1JI52_E1JI52_DROME tr|E1JI52|E1JI52_DROME Multiplexin_ isoform J OS=Drosophila melanogaster OX=7227 GN=Mp PE=4 SV=1	Nematostella_vectensis_NV2t011420001.1 NV2t011420001.1
OG0000088	Drosophila_melanogaster_tr_O02029_O02029_DROME tr|O02029|O02029_DROME M-spondin OS=Drosophila melanogaster OX=7227 GN=mspo PE=2 SV=1, Drosophila_melanogaster_tr_Q7JY80_Q7JY80_DROME tr|Q7JY80|Q7JY80_DROME M-spondin_ isoform A OS=Drosophila melanogaster OX=7227 GN=mspo PE=2 SV=1, Drosophila_melanogaster_tr_Q8T988_Q8T988_DROME tr|Q8T988|Q8T988_DROME SD07907p OS=Drosophila melanogaster OX=7227 GN=CG17740 PE=2 SV=1, Drosophila_melanogaster_tr_A1Z8W6_A1Z8W6_DROME tr|A1Z8W6|A1Z8W6_DROME Spondin-1 OS=Drosophila melanogaster OX=7227 GN=CG17740 PE=2 SV=1, Drosophila_melanogaster_tr_Q3ZAL6_Q3ZAL6_DROME tr|Q3ZAL6|Q3ZAL6_DROME Spondin-1 OS=Drosophila melanogaster OX=7227 GN=CG17740 PE=2 SV=1, Drosophila_melanogaster_tr_Q7K3Y9_Q7K3Y9_DROME tr|Q7K3Y9|Q7K3Y9_DROME Spondin-1 OS=Drosophila melanogaster OX=7227 GN=Dmel\CG17739 PE=2 SV=1, Drosophila_melanogaster_tr_Q95S22_Q95S22_DROME tr|Q95S22|Q95S22_DROME HL01082p OS=Drosophila melanogaster OX=7227 GN=fat-spondin PE=2 SV=1, Drosophila_melanogaster_tr_Q7KN04_Q7KN04_DROME tr|Q7KN04|Q7KN04_DROME Spondin-1 OS=Drosophila melanogaster OX=7227 GN=fat-spondin PE=1 SV=1	Nematostella_vectensis_NV2t009987001.1 NV2t009987001.1
OG0000089	Drosophila_melanogaster_sp_Q24025_SOG_DROME sp|Q24025|SOG_DROME Dorsal-ventral patterning protein Sog OS=Drosophila melanogaster OX=7227 GN=sog PE=1 SV=1, Drosophila_melanogaster_tr_M9PH73_M9PH73_DROME tr|M9PH73|M9PH73_DROME Dorsal-ventral patterning protein Sog OS=Drosophila melanogaster OX=7227 GN=sog PE=3 SV=1	Nematostella_vectensis_NV2t014185001.1 NV2t014185001.1
OG0000095	Drosophila_melanogaster_tr_A4UZB1_A4UZB1_DROME tr|A4UZB1|A4UZB1_DROME Magu_ isoform F OS=Drosophila melanogaster OX=7227 GN=magu PE=4 SV=1, Drosophila_melanogaster_tr_Q95TQ2_Q95TQ2_DROME tr|Q95TQ2|Q95TQ2_DROME LD30894p OS=Drosophila melanogaster OX=7227 GN=magu PE=2 SV=1, Drosophila_melanogaster_tr_Q0E9E0_Q0E9E0_DROME tr|Q0E9E0|Q0E9E0_DROME FI05255p OS=Drosophila melanogaster OX=7227 GN=magu PE=2 SV=1, Drosophila_melanogaster_tr_Q86MK1_Q86MK1_DROME tr|Q86MK1|Q86MK1_DROME CG2264A OS=Drosophila melanogaster OX=7227 GN=magu PE=2 SV=1	Nematostella_vectensis_NV2t011433006.1 NV2t011433006.1, Nematostella_vectensis_NV2t011433002.1 NV2t011433002.1, Nematostella_vectensis_NV2t011433001.1 NV2t011433001.1, Nematostella_vectensis_NV2t011433005.1 NV2t011433005.1, Nematostella_vectensis_NV2t011433003.1 NV2t011433003.1, Nematostella_vectensis_NV2t011433004.1 NV2t011433004.1
OG0000120	Drosophila_melanogaster_tr_B7YZN0_B7YZN0_DROME tr|B7YZN0|B7YZN0_DROME Syndecan OS=Drosophila melanogaster OX=7227 GN=Sdc PE=1 SV=2, Drosophila_melanogaster_tr_E1JGQ9_E1JGQ9_DROME tr|E1JGQ9|E1JGQ9_DROME Syndecan OS=Drosophila melanogaster OX=7227 GN=Sdc PE=1 SV=2, Drosophila_melanogaster_sp_P49415_SDC_DROME sp|P49415|SDC_DROME Syndecan OS=Drosophila melanogaster OX=7227 GN=Sdc PE=2 SV=2, Drosophila_melanogaster_tr_B7YZM9_B7YZM9_DROME tr|B7YZM9|B7YZM9_DROME Syndecan OS=Drosophila melanogaster OX=7227 GN=Sdc PE=1 SV=1, Drosophila_melanogaster_tr_A0A0B4LG79_A0A0B4LG79_DROME tr|A0A0B4LG79|A0A0B4LG79_DROME Syndecan OS=Drosophila melanogaster OX=7227 GN=Sdc PE=1 SV=1, Drosophila_melanogaster_tr_A0A0B4K862_A0A0B4K862_DROME tr|A0A0B4K862|A0A0B4K862_DROME Syndecan OS=Drosophila melanogaster OX=7227 GN=Sdc PE=3 SV=1	Nematostella_vectensis_NV2t006659001.1 NV2t006659001.1
OG0000133	Drosophila_melanogaster_sp_Q9VPF0_ATK_DROME sp|Q9VPF0|ATK_DROME Protein artichoke OS=Drosophila melanogaster OX=7227 GN=atk PE=1 SV=2	Nematostella_vectensis_NV2t005944001.1 NV2t005944001.1
OG0000178	Drosophila_melanogaster_sp_Q0E908_HIL_DROME sp|Q0E908|HIL_DROME Hillarin OS=Drosophila melanogaster OX=7227 GN=Hil PE=1 SV=1	Nematostella_vectensis_NV2t006547001.1 NV2t006547001.1, Nematostella_vectensis_NV2t007463001.1 NV2t007463001.1
OG0000219	Drosophila_melanogaster_tr_Q9W347_Q9W347_DROME tr|Q9W347|Q9W347_DROME C12.2_ isoform A OS=Drosophila melanogaster OX=7227 GN=c12.2 PE=1 SV=3, Drosophila_melanogaster_tr_M9PHH0_M9PHH0_DROME tr|M9PHH0|M9PHH0_DROME C12.2_ isoform B OS=Drosophila melanogaster OX=7227 GN=c12.2 PE=1 SV=1	Nematostella_vectensis_NV2t022330001.1 NV2t022330001.1
OG0000248	Drosophila_melanogaster_tr_Q9VCC7_Q9VCC7_DROME tr|Q9VCC7|Q9VCC7_DROME FI03681p OS=Drosophila melanogaster OX=7227 GN=Kal1 PE=2 SV=2, Drosophila_melanogaster_tr_Q95SS0_Q95SS0_DROME tr|Q95SS0|Q95SS0_DROME GH04611p OS=Drosophila melanogaster OX=7227 GN=Kal1 PE=2 SV=1	Nematostella_vectensis_NV2t006365001.1 NV2t006365001.1
OG0000479	Drosophila_melanogaster_tr_Q9VKQ0_Q9VKQ0_DROME tr|Q9VKQ0|Q9VKQ0_DROME Uncharacterized protein_ isoform A OS=Drosophila melanogaster OX=7227 GN=CG18499 PE=4 SV=2	Nematostella_vectensis_NV2t012328001.1 NV2t012328001.1, Nematostella_vectensis_NV2t012484002.1 NV2t012484002.1
