Orthogroup	Platyhelminthes_Tricladida_Schmidtea_mediterranea	Chordata_Amphioxiformes_Branchiostoma_belcheri
OG0000028	Schmidtea_mediterranea_maker-scaffold11455-augustus-gene-0.21-mRNA-1 maker-scaffold11455-augustus-gene-0.21-mRNA-1 protein AED_0.05 eAED_0.08 QI_0|0|0|1|1|1|2|0|135, Schmidtea_mediterranea_maker-scaffold17765-snap-gene-0.7-mRNA-1 maker-scaffold17765-snap-gene-0.7-mRNA-1 protein AED_0.08 eAED_0.08 QI_46|0.92|0.89|0.96|0.96|0.96|29|0|1699, Schmidtea_mediterranea_maker-scaffold7038-augustus-gene-0.53-mRNA-1 maker-scaffold7038-augustus-gene-0.53-mRNA-1 protein AED_0.08 eAED_0.08 QI_168|0.93|0.86|1|1|1|30|0|2199, Schmidtea_mediterranea_maker-scaffold1323-snap-gene-0.42-mRNA-1 maker-scaffold1323-snap-gene-0.42-mRNA-1 protein AED_0.11 eAED_0.13 QI_0|0.91|0.88|1|0.88|0.94|36|391|2129, Schmidtea_mediterranea_maker-scaffold32825-augustus-gene-0.19-mRNA-1 maker-scaffold32825-augustus-gene-0.19-mRNA-1 protein AED_0.05 eAED_0.05 QI_61|0.92|0.96|0.96|0.96|0.96|27|28|1813	Branchiostoma_belcheri_tr_A0A6P4YE18_A0A6P4YE18_BRABE tr|A0A6P4YE18|A0A6P4YE18_BRABE Collagen alpha-2_IV_ chain-like isoform X1 OS=Branchiostoma belcheri OX=7741 GN=LOC109464461 PE=4 SV=1, Branchiostoma_belcheri_tr_A0A6P4XY10_A0A6P4XY10_BRABE tr|A0A6P4XY10|A0A6P4XY10_BRABE Collagen alpha-5_IV_ chain-like isoform X2 OS=Branchiostoma belcheri OX=7741 GN=LOC109464461 PE=4 SV=1, Branchiostoma_belcheri_tr_A0A6P4Y3L9_A0A6P4Y3L9_BRABE tr|A0A6P4Y3L9|A0A6P4Y3L9_BRABE Collagen alpha-5_IV_ chain-like isoform X3 OS=Branchiostoma belcheri OX=7741 GN=LOC109464461 PE=4 SV=1, Branchiostoma_belcheri_tr_A0A6P4XKD0_A0A6P4XKD0_BRABE tr|A0A6P4XKD0|A0A6P4XKD0_BRABE Collagen alpha-5_IV_ chain-like isoform X4 OS=Branchiostoma belcheri OX=7741 GN=LOC109464461 PE=4 SV=1, Branchiostoma_belcheri_tr_A0A6P4YIX8_A0A6P4YIX8_BRABE tr|A0A6P4YIX8|A0A6P4YIX8_BRABE Collagen alpha-2_IV_ chain-like OS=Branchiostoma belcheri OX=7741 GN=LOC109464462 PE=4 SV=1, Branchiostoma_belcheri_tr_A0A6P4Y017_A0A6P4Y017_BRABE tr|A0A6P4Y017|A0A6P4Y017_BRABE Collagen alpha-2_IV_ chain-like OS=Branchiostoma belcheri OX=7741 GN=LOC109468421 PE=4 SV=1, Branchiostoma_belcheri_tr_A0A6P4YUB4_A0A6P4YUB4_BRABE tr|A0A6P4YUB4|A0A6P4YUB4_BRABE Collagen alpha-2_IV_ chain-like OS=Branchiostoma belcheri OX=7741 GN=LOC109468418 PE=4 SV=1, Branchiostoma_belcheri_tr_A0A6P4YCS5_A0A6P4YCS5_BRABE tr|A0A6P4YCS5|A0A6P4YCS5_BRABE Collagen alpha-2_IV_ chain-like OS=Branchiostoma belcheri OX=7741 GN=LOC109468419 PE=4 SV=1, Branchiostoma_belcheri_tr_A0A6P4YKJ9_A0A6P4YKJ9_BRABE tr|A0A6P4YKJ9|A0A6P4YKJ9_BRABE Collagen alpha-2_IV_ chain-like OS=Branchiostoma belcheri OX=7741 GN=LOC109468420 PE=4 SV=1, Branchiostoma_belcheri_tr_A0A6P4YYL0_A0A6P4YYL0_BRABE tr|A0A6P4YYL0|A0A6P4YYL0_BRABE Collagen alpha-5_IV_ chain-like isoform X1 OS=Branchiostoma belcheri OX=7741 GN=LOC109468566 PE=4 SV=1, Branchiostoma_belcheri_tr_A0A6P4YD81_A0A6P4YD81_BRABE tr|A0A6P4YD81|A0A6P4YD81_BRABE Collagen alpha-1_I_ chain-like isoform X3 OS=Branchiostoma belcheri OX=7741 GN=LOC109468566 PE=4 SV=1, Branchiostoma_belcheri_tr_A0A6P4YL15_A0A6P4YL15_BRABE tr|A0A6P4YL15|A0A6P4YL15_BRABE Collagen alpha-1_I_ chain-like isoform X6 OS=Branchiostoma belcheri OX=7741 GN=LOC109468566 PE=4 SV=1, Branchiostoma_belcheri_tr_A0A6P4YUP7_A0A6P4YUP7_BRABE tr|A0A6P4YUP7|A0A6P4YUP7_BRABE Collagen alpha-2_IV_ chain-like isoform X2 OS=Branchiostoma belcheri OX=7741 GN=LOC109468566 PE=4 SV=1, Branchiostoma_belcheri_tr_A0A6P4YL12_A0A6P4YL12_BRABE tr|A0A6P4YL12|A0A6P4YL12_BRABE Collagen alpha-1_I_ chain-like isoform X4 OS=Branchiostoma belcheri OX=7741 GN=LOC109468566 PE=4 SV=1, Branchiostoma_belcheri_tr_A0A6P4YD85_A0A6P4YD85_BRABE tr|A0A6P4YD85|A0A6P4YD85_BRABE Collagen alpha-2_IV_ chain-like isoform X5 OS=Branchiostoma belcheri OX=7741 GN=LOC109468566 PE=4 SV=1, Branchiostoma_belcheri_tr_A0A6P4YDB6_A0A6P4YDB6_BRABE tr|A0A6P4YDB6|A0A6P4YDB6_BRABE Collagen alpha-2_IV_ chain-like isoform X1 OS=Branchiostoma belcheri OX=7741 GN=LOC109468578 PE=4 SV=1, Branchiostoma_belcheri_tr_A0A6P4YDC0_A0A6P4YDC0_BRABE tr|A0A6P4YDC0|A0A6P4YDC0_BRABE Collagen alpha-3_IV_ chain-like isoform X5 OS=Branchiostoma belcheri OX=7741 GN=LOC109468578 PE=4 SV=1, Branchiostoma_belcheri_tr_A0A6P4YUT0_A0A6P4YUT0_BRABE tr|A0A6P4YUT0|A0A6P4YUT0_BRABE Collagen alpha-2_IV_ chain-like isoform X4 OS=Branchiostoma belcheri OX=7741 GN=LOC109468578 PE=4 SV=1, Branchiostoma_belcheri_tr_A0A6P4YL40_A0A6P4YL40_BRABE tr|A0A6P4YL40|A0A6P4YL40_BRABE Collagen alpha-2_IV_ chain-like isoform X2 OS=Branchiostoma belcheri OX=7741 GN=LOC109468578 PE=4 SV=1, Branchiostoma_belcheri_tr_A0A6P4YYP9_A0A6P4YYP9_BRABE tr|A0A6P4YYP9|A0A6P4YYP9_BRABE Collagen alpha-3_IV_ chain-like isoform X3 OS=Branchiostoma belcheri OX=7741 GN=LOC109468578 PE=4 SV=1, Branchiostoma_belcheri_tr_A0A6P4Y8D4_A0A6P4Y8D4_BRABE tr|A0A6P4Y8D4|A0A6P4Y8D4_BRABE Collagen alpha-3_IV_ chain-like OS=Branchiostoma belcheri OX=7741 GN=LOC109462860 PE=4 SV=1, Branchiostoma_belcheri_tr_A0A6P4YH27_A0A6P4YH27_BRABE tr|A0A6P4YH27|A0A6P4YH27_BRABE Collagen alpha-4_IV_ chain-like OS=Branchiostoma belcheri OX=7741 GN=LOC109473114 PE=4 SV=1, Branchiostoma_belcheri_tr_A0A6P4ZQZ2_A0A6P4ZQZ2_BRABE tr|A0A6P4ZQZ2|A0A6P4ZQZ2_BRABE Collagen alpha-1_IV_ chain-like OS=Branchiostoma belcheri OX=7741 GN=LOC109479055 PE=4 SV=1, Branchiostoma_belcheri_tr_A0A6P5A3X6_A0A6P5A3X6_BRABE tr|A0A6P5A3X6|A0A6P5A3X6_BRABE Collagen alpha-5_IV_ chain-like isoform X7 OS=Branchiostoma belcheri OX=7741 GN=LOC109479045 PE=4 SV=1, Branchiostoma_belcheri_tr_A0A6P4ZQV4_A0A6P4ZQV4_BRABE tr|A0A6P4ZQV4|A0A6P4ZQV4_BRABE Collagen alpha-3_IV_ chain-like isoform X5 OS=Branchiostoma belcheri OX=7741 GN=LOC109479045 PE=4 SV=1, Branchiostoma_belcheri_tr_A0A6P4Z4N1_A0A6P4Z4N1_BRABE tr|A0A6P4Z4N1|A0A6P4Z4N1_BRABE Collagen alpha-3_IV_ chain-like isoform X6 OS=Branchiostoma belcheri OX=7741 GN=LOC109479045 PE=4 SV=1, Branchiostoma_belcheri_tr_A0A6P4Z4M6_A0A6P4Z4M6_BRABE tr|A0A6P4Z4M6|A0A6P4Z4M6_BRABE Collagen alpha-4_IV_ chain-like isoform X2 OS=Branchiostoma belcheri OX=7741 GN=LOC109479045 PE=4 SV=1, Branchiostoma_belcheri_tr_A0A6P4ZI43_A0A6P4ZI43_BRABE tr|A0A6P4ZI43|A0A6P4ZI43_BRABE Collagen alpha-1_I_ chain-like isoform X4 OS=Branchiostoma belcheri OX=7741 GN=LOC109479045 PE=4 SV=1, Branchiostoma_belcheri_tr_A0A6P4ZQU9_A0A6P4ZQU9_BRABE tr|A0A6P4ZQU9|A0A6P4ZQU9_BRABE Collagen alpha-4_IV_ chain-like isoform X1 OS=Branchiostoma belcheri OX=7741 GN=LOC109479045 PE=4 SV=1, Branchiostoma_belcheri_tr_A0A6P4ZZR0_A0A6P4ZZR0_BRABE tr|A0A6P4ZZR0|A0A6P4ZZR0_BRABE Collagen alpha-4_IV_ chain-like isoform X3 OS=Branchiostoma belcheri OX=7741 GN=LOC109479045 PE=4 SV=1, Branchiostoma_belcheri_tr_A0A6P4YKI5_A0A6P4YKI5_BRABE tr|A0A6P4YKI5|A0A6P4YKI5_BRABE Collagen alpha-5_IV_ chain-like OS=Branchiostoma belcheri OX=7741 GN=LOC109474176 PE=4 SV=1, Branchiostoma_belcheri_tr_A0A6P5A6M3_A0A6P5A6M3_BRABE tr|A0A6P5A6M3|A0A6P5A6M3_BRABE Collagen alpha-1_IV_ chain-like OS=Branchiostoma belcheri OX=7741 GN=LOC109483358 PE=4 SV=1, Branchiostoma_belcheri_tr_A0A6P4XQH0_A0A6P4XQH0_BRABE tr|A0A6P4XQH0|A0A6P4XQH0_BRABE Collagen alpha-1_II_ chain-like OS=Branchiostoma belcheri OX=7741 GN=LOC109462270 PE=4 SV=1
OG0000029	Schmidtea_mediterranea_maker-scaffold3932-snap-gene-0.36-mRNA-1 maker-scaffold3932-snap-gene-0.36-mRNA-1 protein AED_0.21 eAED_0.29 QI_0|0.75|0.69|1|0.58|0.92|13|170|790	Branchiostoma_belcheri_tr_A0A6P4Z6D9_A0A6P4Z6D9_BRABE tr|A0A6P4Z6D9|A0A6P4Z6D9_BRABE Contactin-associated protein-like 2 isoform X1 OS=Branchiostoma belcheri OX=7741 GN=LOC109475841 PE=3 SV=1, Branchiostoma_belcheri_tr_A0A6P4ZE90_A0A6P4ZE90_BRABE tr|A0A6P4ZE90|A0A6P4ZE90_BRABE Contactin-associated protein-like 2 isoform X2 OS=Branchiostoma belcheri OX=7741 GN=LOC109475841 PE=3 SV=1, Branchiostoma_belcheri_tr_A0A6P4YRX4_A0A6P4YRX4_BRABE tr|A0A6P4YRX4|A0A6P4YRX4_BRABE Contactin-associated protein-like 5 isoform X3 OS=Branchiostoma belcheri OX=7741 GN=LOC109475841 PE=3 SV=1
OG0000030	Schmidtea_mediterranea_maker-scaffold6061-augustus-gene-1.43-mRNA-1 maker-scaffold6061-augustus-gene-1.43-mRNA-1 protein AED_0.27 eAED_0.28 QI_0|0.64|0.61|0.94|0.58|0.88|18|137|784	Branchiostoma_belcheri_tr_A0A6P4Z3Q5_A0A6P4Z3Q5_BRABE tr|A0A6P4Z3Q5|A0A6P4Z3Q5_BRABE Disintegrin and metalloproteinase domain-containing protein 17-like OS=Branchiostoma belcheri OX=7741 GN=LOC109473119 PE=4 SV=1
OG0000030	Schmidtea_mediterranea_maker-scaffold4771-augustus-gene-0.17-mRNA-1 maker-scaffold4771-augustus-gene-0.17-mRNA-1 protein AED_0.15 eAED_0.19 QI_0|0|0|0.83|0.8|1|6|0|430	Branchiostoma_belcheri_tr_A0A6P4YCJ8_A0A6P4YCJ8_BRABE tr|A0A6P4YCJ8|A0A6P4YCJ8_BRABE Disintegrin and metalloproteinase domain-containing protein 10-like OS=Branchiostoma belcheri OX=7741 GN=LOC109468335 PE=4 SV=1, Branchiostoma_belcheri_tr_A0A6P4YZ43_A0A6P4YZ43_BRABE tr|A0A6P4YZ43|A0A6P4YZ43_BRABE Disintegrin and metalloproteinase domain-containing protein 10-like isoform X2 OS=Branchiostoma belcheri OX=7741 GN=LOC109468715 PE=4 SV=1, Branchiostoma_belcheri_tr_A0A6P4Y116_A0A6P4Y116_BRABE tr|A0A6P4Y116|A0A6P4Y116_BRABE Disintegrin and metalloproteinase domain-containing protein 10-like isoform X1 OS=Branchiostoma belcheri OX=7741 GN=LOC109468715 PE=4 SV=1, Branchiostoma_belcheri_tr_A0A6P4YLX1_A0A6P4YLX1_BRABE tr|A0A6P4YLX1|A0A6P4YLX1_BRABE Disintegrin and metalloproteinase domain-containing protein 10-like isoform X1 OS=Branchiostoma belcheri OX=7741 GN=LOC109468796 PE=4 SV=1, Branchiostoma_belcheri_tr_A0A6P4Y1A6_A0A6P4Y1A6_BRABE tr|A0A6P4Y1A6|A0A6P4Y1A6_BRABE Disintegrin and metalloproteinase domain-containing protein 10-like isoform X2 OS=Branchiostoma belcheri OX=7741 GN=LOC109468796 PE=4 SV=1
OG0000040	Schmidtea_mediterranea_maker-scaffold2624-snap-gene-0.62-mRNA-1 maker-scaffold2624-snap-gene-0.62-mRNA-1 protein AED_0.00 eAED_0.00 QI_163|1|1|1|1|1|3|260|253	Branchiostoma_belcheri_tr_A0A6P5AWE2_A0A6P5AWE2_BRABE tr|A0A6P5AWE2|A0A6P5AWE2_BRABE Kazal-type serine protease inhibitor domain-containing protein 1-like OS=Branchiostoma belcheri OX=7741 GN=LOC109486825 PE=4 SV=1, Branchiostoma_belcheri_tr_A0A6P4XY87_A0A6P4XY87_BRABE tr|A0A6P4XY87|A0A6P4XY87_BRABE Uncharacterized protein LOC109463154 OS=Branchiostoma belcheri OX=7741 GN=LOC109463154 PE=4 SV=1, Branchiostoma_belcheri_tr_A0A6P5AWF2_A0A6P5AWF2_BRABE tr|A0A6P5AWF2|A0A6P5AWF2_BRABE Insulin-like growth factor-binding protein 7 OS=Branchiostoma belcheri OX=7741 GN=LOC109486832 PE=4 SV=1
OG0000041	Schmidtea_mediterranea_snap_masked-scaffold19108-processed-gene-0.1-mRNA-1 snap_masked-scaffold19108-processed-gene-0.1-mRNA-1 protein AED_0.91 eAED_0.96 QI_0|0|0|0.41|1|1|12|0|406	Branchiostoma_belcheri_tr_A0A6P4ZKT8_A0A6P4ZKT8_BRABE tr|A0A6P4ZKT8|A0A6P4ZKT8_BRABE von Willebrand factor A domain-containing protein 5A-like OS=Branchiostoma belcheri OX=7741 GN=LOC109474402 PE=4 SV=1, Branchiostoma_belcheri_tr_A0A6P4Z940_A0A6P4Z940_BRABE tr|A0A6P4Z940|A0A6P4Z940_BRABE von Willebrand factor A domain-containing protein 5A-like OS=Branchiostoma belcheri OX=7741 GN=LOC109474530 PE=4 SV=1, Branchiostoma_belcheri_tr_A0A6P4Z2H8_A0A6P4Z2H8_BRABE tr|A0A6P4Z2H8|A0A6P4Z2H8_BRABE von Willebrand factor A domain-containing protein 5B1-like OS=Branchiostoma belcheri OX=7741 GN=LOC109472723 PE=4 SV=1, Branchiostoma_belcheri_tr_A0A6P4Z1T4_A0A6P4Z1T4_BRABE tr|A0A6P4Z1T4|A0A6P4Z1T4_BRABE von Willebrand factor A domain-containing protein 5B1-like OS=Branchiostoma belcheri OX=7741 GN=LOC109472557 PE=4 SV=1
OG0000042	Schmidtea_mediterranea_maker-scaffold25981-snap-gene-1.52-mRNA-1 maker-scaffold25981-snap-gene-1.52-mRNA-1 protein AED_0.29 eAED_0.29 QI_0|0.25|0|0.4|1|1|5|0|226, Schmidtea_mediterranea_maker-scaffold2082-snap-gene-0.19-mRNA-1 maker-scaffold2082-snap-gene-0.19-mRNA-1 protein AED_0.75 eAED_0.75 QI_0|0|0|0.04|1|1|24|0|703	Branchiostoma_belcheri_tr_A0A6P5ACS2_A0A6P5ACS2_BRABE tr|A0A6P5ACS2|A0A6P5ACS2_BRABE Neurexin-3-beta-like OS=Branchiostoma belcheri OX=7741 GN=LOC109482714 PE=4 SV=1, Branchiostoma_belcheri_tr_A0A6P4ZW01_A0A6P4ZW01_BRABE tr|A0A6P4ZW01|A0A6P4ZW01_BRABE Neurexin-3-like OS=Branchiostoma belcheri OX=7741 GN=LOC109482715 PE=4 SV=1
OG0000047	Schmidtea_mediterranea_maker-scaffold497-augustus-gene-0.36-mRNA-1 maker-scaffold497-augustus-gene-0.36-mRNA-1 protein AED_0.09 eAED_0.09 QI_0|0.71|0.8|0.86|0.35|0.53|15|149|652	Branchiostoma_belcheri_tr_A0A6P4Y7I0_A0A6P4Y7I0_BRABE tr|A0A6P4Y7I0|A0A6P4Y7I0_BRABE Ferric-chelate reductase 1 isoform X1 OS=Branchiostoma belcheri OX=7741 GN=LOC109465461 PE=3 SV=1, Branchiostoma_belcheri_tr_A0A6P4XNQ5_A0A6P4XNQ5_BRABE tr|A0A6P4XNQ5|A0A6P4XNQ5_BRABE Ferric-chelate reductase 1 isoform X2 OS=Branchiostoma belcheri OX=7741 GN=LOC109465461 PE=3 SV=1, Branchiostoma_belcheri_tr_A0A6P4YPI6_A0A6P4YPI6_BRABE tr|A0A6P4YPI6|A0A6P4YPI6_BRABE Ferric-chelate reductase 1 OS=Branchiostoma belcheri OX=7741 GN=LOC109475245 PE=3 SV=1, Branchiostoma_belcheri_tr_A0A6P4Z3T1_A0A6P4Z3T1_BRABE tr|A0A6P4Z3T1|A0A6P4Z3T1_BRABE Ferric-chelate reductase 1 OS=Branchiostoma belcheri OX=7741 GN=LOC109475132 PE=3 SV=1, Branchiostoma_belcheri_tr_A0A6P5A8U1_A0A6P5A8U1_BRABE tr|A0A6P5A8U1|A0A6P5A8U1_BRABE Defense protein 1 OS=Branchiostoma belcheri OX=7741 GN=LOC109486608 PE=4 SV=1, Branchiostoma_belcheri_tr_A0A6P4XPE0_A0A6P4XPE0_BRABE tr|A0A6P4XPE0|A0A6P4XPE0_BRABE Defense protein 3 OS=Branchiostoma belcheri OX=7741 GN=LOC109461902 PE=4 SV=1, Branchiostoma_belcheri_tr_A0A6P4XTD6_A0A6P4XTD6_BRABE tr|A0A6P4XTD6|A0A6P4XTD6_BRABE Defense protein 3 OS=Branchiostoma belcheri OX=7741 GN=LOC109461903 PE=4 SV=1, Branchiostoma_belcheri_tr_A0A6P4Y5F8_A0A6P4Y5F8_BRABE tr|A0A6P4Y5F8|A0A6P4Y5F8_BRABE Defense protein 3 OS=Branchiostoma belcheri OX=7741 GN=LOC109461901 PE=4 SV=1, Branchiostoma_belcheri_tr_A0A6P4XBS9_A0A6P4XBS9_BRABE tr|A0A6P4XBS9|A0A6P4XBS9_BRABE Defense protein 3 OS=Branchiostoma belcheri OX=7741 GN=LOC109461904 PE=4 SV=1, Branchiostoma_belcheri_tr_A0A6P4Z0U1_A0A6P4Z0U1_BRABE tr|A0A6P4Z0U1|A0A6P4Z0U1_BRABE Ferric-chelate reductase 1 OS=Branchiostoma belcheri OX=7741 GN=LOC109478139 PE=4 SV=1, Branchiostoma_belcheri_tr_A0A6P4ZVN8_A0A6P4ZVN8_BRABE tr|A0A6P4ZVN8|A0A6P4ZVN8_BRABE Mannan endo-1_4-beta-mannosidase-like OS=Branchiostoma belcheri OX=7741 GN=LOC109478001 PE=3 SV=1, Branchiostoma_belcheri_tr_A0A6P5ADE6_A0A6P5ADE6_BRABE tr|A0A6P5ADE6|A0A6P5ADE6_BRABE Uncharacterized protein LOC109481653 OS=Branchiostoma belcheri OX=7741 GN=LOC109481653 PE=4 SV=1
OG0000048	Schmidtea_mediterranea_maker-scaffold10901-augustus-gene-0.37-mRNA-1 maker-scaffold10901-augustus-gene-0.37-mRNA-1 protein AED_0.05 eAED_0.05 QI_126|1|1|1|0.66|0.57|7|1281|732	Branchiostoma_belcheri_tr_A0A6P4Z3S7_A0A6P4Z3S7_BRABE tr|A0A6P4Z3S7|A0A6P4Z3S7_BRABE Reticulon-4 receptor-like 2 OS=Branchiostoma belcheri OX=7741 GN=LOC109473164 PE=4 SV=1, Branchiostoma_belcheri_tr_A0A6P4Z3R7_A0A6P4Z3R7_BRABE tr|A0A6P4Z3R7|A0A6P4Z3R7_BRABE Leucine-rich repeat-containing protein 15-like OS=Branchiostoma belcheri OX=7741 GN=LOC109475116 PE=4 SV=1, Branchiostoma_belcheri_tr_A0A6P4ZSE5_A0A6P4ZSE5_BRABE tr|A0A6P4ZSE5|A0A6P4ZSE5_BRABE Leucine-rich repeat-containing protein 15-like OS=Branchiostoma belcheri OX=7741 GN=LOC109481604 PE=4 SV=1, Branchiostoma_belcheri_tr_A0A6P4ZKB2_A0A6P4ZKB2_BRABE tr|A0A6P4ZKB2|A0A6P4ZKB2_BRABE Leucine-rich repeat-containing protein 15-like OS=Branchiostoma belcheri OX=7741 GN=LOC109479684 PE=4 SV=1, Branchiostoma_belcheri_tr_A0A6P4Y6B8_A0A6P4Y6B8_BRABE tr|A0A6P4Y6B8|A0A6P4Y6B8_BRABE Peroxidasin homolog OS=Branchiostoma belcheri OX=7741 GN=LOC109465188 PE=4 SV=1, Branchiostoma_belcheri_tr_A0A6P4ZGU6_A0A6P4ZGU6_BRABE tr|A0A6P4ZGU6|A0A6P4ZGU6_BRABE Transient receptor potential cation channel subfamily M member 1-like OS=Branchiostoma belcheri OX=7741 GN=LOC109482196 PE=4 SV=1, Branchiostoma_belcheri_tr_A0A6P4YTP3_A0A6P4YTP3_BRABE tr|A0A6P4YTP3|A0A6P4YTP3_BRABE Osteomodulin-like OS=Branchiostoma belcheri OX=7741 GN=LOC109468193 PE=4 SV=1, Branchiostoma_belcheri_tr_A0A6P4ZEJ2_A0A6P4ZEJ2_BRABE tr|A0A6P4ZEJ2|A0A6P4ZEJ2_BRABE Platelet glycoprotein V-like OS=Branchiostoma belcheri OX=7741 GN=LOC109475937 PE=4 SV=1, Branchiostoma_belcheri_tr_A0A6P4ZE97_A0A6P4ZE97_BRABE tr|A0A6P4ZE97|A0A6P4ZE97_BRABE Slit homolog 2 protein-like OS=Branchiostoma belcheri OX=7741 GN=LOC109475845 PE=4 SV=1, Branchiostoma_belcheri_tr_A0A6P4YVN4_A0A6P4YVN4_BRABE tr|A0A6P4YVN4|A0A6P4YVN4_BRABE Platelet glycoprotein V-like OS=Branchiostoma belcheri OX=7741 GN=LOC109476829 PE=4 SV=1, Branchiostoma_belcheri_tr_A0A6P4ZRH7_A0A6P4ZRH7_BRABE tr|A0A6P4ZRH7|A0A6P4ZRH7_BRABE Platelet glycoprotein V-like OS=Branchiostoma belcheri OX=7741 GN=LOC109475854 PE=4 SV=1, Branchiostoma_belcheri_tr_A0A6P4ZIK9_A0A6P4ZIK9_BRABE tr|A0A6P4ZIK9|A0A6P4ZIK9_BRABE LOW QUALITY PROTEIN_ uncharacterized protein LOC109477245 OS=Branchiostoma belcheri OX=7741 GN=LOC109477245 PE=4 SV=1, Branchiostoma_belcheri_tr_A0A6P4ZRH0_A0A6P4ZRH0_BRABE tr|A0A6P4ZRH0|A0A6P4ZRH0_BRABE Uncharacterized protein LOC109476960 OS=Branchiostoma belcheri OX=7741 GN=LOC109476960 PE=4 SV=1, Branchiostoma_belcheri_tr_A0A6P4YFS0_A0A6P4YFS0_BRABE tr|A0A6P4YFS0|A0A6P4YFS0_BRABE Uncharacterized protein LOC109464950 OS=Branchiostoma belcheri OX=7741 GN=LOC109464950 PE=4 SV=1, Branchiostoma_belcheri_tr_A0A6P4YCH8_A0A6P4YCH8_BRABE tr|A0A6P4YCH8|A0A6P4YCH8_BRABE Slit homolog 1 protein-like OS=Branchiostoma belcheri OX=7741 GN=LOC109462484 PE=4 SV=1, Branchiostoma_belcheri_tr_A0A6P4XV25_A0A6P4XV25_BRABE tr|A0A6P4XV25|A0A6P4XV25_BRABE Slit homolog 2 protein-like OS=Branchiostoma belcheri OX=7741 GN=LOC109462371 PE=4 SV=1
OG0000051	Schmidtea_mediterranea_maker-scaffold22381-augustus-gene-0.8-mRNA-1 maker-scaffold22381-augustus-gene-0.8-mRNA-1 protein AED_0.11 eAED_0.11 QI_0|0.5|0.33|0.66|1|0.66|3|67|1403	Branchiostoma_belcheri_tr_A0A6P4Y686_A0A6P4Y686_BRABE tr|A0A6P4Y686|A0A6P4Y686_BRABE Uncharacterized protein LOC109465163 OS=Branchiostoma belcheri OX=7741 GN=LOC109465163 PE=3 SV=1
OG0000053	Schmidtea_mediterranea_augustus_masked-scaffold16533-processed-gene-0.1-mRNA-1 augustus_masked-scaffold16533-processed-gene-0.1-mRNA-1 protein AED_0.08 eAED_0.08 QI_0|-1|0|1|-1|1|1|0|877	Branchiostoma_belcheri_tr_A0A6P5A9T6_A0A6P5A9T6_BRABE tr|A0A6P5A9T6|A0A6P5A9T6_BRABE Malignant fibrous histiocytoma-amplified sequence 1 homolog OS=Branchiostoma belcheri OX=7741 GN=LOC109486911 PE=4 SV=1, Branchiostoma_belcheri_tr_A0A6P5AJJ4_A0A6P5AJJ4_BRABE tr|A0A6P5AJJ4|A0A6P5AJJ4_BRABE Malignant fibrous histiocytoma-amplified sequence 1 homolog OS=Branchiostoma belcheri OX=7741 GN=LOC109486951 PE=4 SV=1
OG0000056	Schmidtea_mediterranea_maker-scaffold6014-snap-gene-0.37-mRNA-1 maker-scaffold6014-snap-gene-0.37-mRNA-1 protein AED_0.00 eAED_0.00 QI_166|0.85|0.87|1|0.42|0.5|8|407|786	Branchiostoma_belcheri_tr_A0A6P4Z8B5_A0A6P4Z8B5_BRABE tr|A0A6P4Z8B5|A0A6P4Z8B5_BRABE RING-type E3 ubiquitin transferase OS=Branchiostoma belcheri OX=7741 GN=LOC109472172 PE=4 SV=1, Branchiostoma_belcheri_tr_A0A6P4YSH6_A0A6P4YSH6_BRABE tr|A0A6P4YSH6|A0A6P4YSH6_BRABE RING-type E3 ubiquitin transferase OS=Branchiostoma belcheri OX=7741 GN=LOC109472172 PE=4 SV=1, Branchiostoma_belcheri_tr_A0A6P4YDQ8_A0A6P4YDQ8_BRABE tr|A0A6P4YDQ8|A0A6P4YDQ8_BRABE RING-type E3 ubiquitin transferase OS=Branchiostoma belcheri OX=7741 GN=LOC109472172 PE=4 SV=1, Branchiostoma_belcheri_tr_A0A6P4Z044_A0A6P4Z044_BRABE tr|A0A6P4Z044|A0A6P4Z044_BRABE RING-type E3 ubiquitin transferase OS=Branchiostoma belcheri OX=7741 GN=LOC109472172 PE=4 SV=1
OG0000064	Schmidtea_mediterranea_maker-scaffold2473-augustus-gene-0.58-mRNA-1 maker-scaffold2473-augustus-gene-0.58-mRNA-1 protein AED_0.13 eAED_0.13 QI_0|0.66|0.25|1|0.33|0.5|4|0|143	Branchiostoma_belcheri_tr_A0A6P4YEJ3_A0A6P4YEJ3_BRABE tr|A0A6P4YEJ3|A0A6P4YEJ3_BRABE Fibrillin-2-like OS=Branchiostoma belcheri OX=7741 GN=LOC109463096 PE=4 SV=1, Branchiostoma_belcheri_tr_A0A6P4ZVB9_A0A6P4ZVB9_BRABE tr|A0A6P4ZVB9|A0A6P4ZVB9_BRABE Latent-transforming growth factor beta-binding protein 4-like OS=Branchiostoma belcheri OX=7741 GN=LOC109476983 PE=4 SV=1, Branchiostoma_belcheri_tr_A0A6P4ZRJ0_A0A6P4ZRJ0_BRABE tr|A0A6P4ZRJ0|A0A6P4ZRJ0_BRABE Latent-transforming growth factor beta-binding protein 2-like OS=Branchiostoma belcheri OX=7741 GN=LOC109476984 PE=4 SV=1
OG0000070	Schmidtea_mediterranea_maker-scaffold5478-snap-gene-0.30-mRNA-1 maker-scaffold5478-snap-gene-0.30-mRNA-1 protein AED_0.23 eAED_0.24 QI_0|0.2|0|1|0.2|0.16|6|0|1775	Branchiostoma_belcheri_tr_A0A6P5AJK5_A0A6P5AJK5_BRABE tr|A0A6P5AJK5|A0A6P5AJK5_BRABE Peroxidasin-like OS=Branchiostoma belcheri OX=7741 GN=LOC109484480 PE=4 SV=1, Branchiostoma_belcheri_tr_A0A6P4ZNS4_A0A6P4ZNS4_BRABE tr|A0A6P4ZNS4|A0A6P4ZNS4_BRABE Thyroid peroxidase OS=Branchiostoma belcheri OX=7741 GN=LOC109480675 PE=3 SV=1, Branchiostoma_belcheri_tr_A0A6P5A9T4_A0A6P5A9T4_BRABE tr|A0A6P5A9T4|A0A6P5A9T4_BRABE Thyroid peroxidase OS=Branchiostoma belcheri OX=7741 GN=LOC109480722 PE=3 SV=1, Branchiostoma_belcheri_tr_A0A6P4ZNX8_A0A6P4ZNX8_BRABE tr|A0A6P4ZNX8|A0A6P4ZNX8_BRABE Thyroid peroxidase OS=Branchiostoma belcheri OX=7741 GN=LOC109480722 PE=3 SV=1, Branchiostoma_belcheri_tr_A0A6P4YR12_A0A6P4YR12_BRABE tr|A0A6P4YR12|A0A6P4YR12_BRABE LOW QUALITY PROTEIN_ peroxidasin homolog OS=Branchiostoma belcheri OX=7741 GN=LOC109466411 PE=4 SV=1, Branchiostoma_belcheri_tr_A0A6P4Y5G4_A0A6P4Y5G4_BRABE tr|A0A6P4Y5G4|A0A6P4Y5G4_BRABE LOW QUALITY PROTEIN_ peroxidasin homolog OS=Branchiostoma belcheri OX=7741 GN=LOC109466403 PE=4 SV=1
OG0000073	Schmidtea_mediterranea_maker-scaffold4363-snap-gene-0.37-mRNA-1 maker-scaffold4363-snap-gene-0.37-mRNA-1 protein AED_0.12 eAED_0.12 QI_0|0.69|0.66|0.91|0.52|0.75|24|0|1648	Branchiostoma_belcheri_tr_A0A6P4YTZ0_A0A6P4YTZ0_BRABE tr|A0A6P4YTZ0|A0A6P4YTZ0_BRABE Uncharacterized protein LOC109468288 isoform X1 OS=Branchiostoma belcheri OX=7741 GN=LOC109468288 PE=4 SV=1, Branchiostoma_belcheri_tr_A0A6P4YCG6_A0A6P4YCG6_BRABE tr|A0A6P4YCG6|A0A6P4YCG6_BRABE Uncharacterized protein LOC109468288 isoform X2 OS=Branchiostoma belcheri OX=7741 GN=LOC109468288 PE=4 SV=1, Branchiostoma_belcheri_tr_A0A6P4Z218_A0A6P4Z218_BRABE tr|A0A6P4Z218|A0A6P4Z218_BRABE Uncharacterized protein LOC109472616 OS=Branchiostoma belcheri OX=7741 GN=LOC109472616 PE=4 SV=1, Branchiostoma_belcheri_tr_A0A6P4YAY0_A0A6P4YAY0_BRABE tr|A0A6P4YAY0|A0A6P4YAY0_BRABE Uncharacterized protein LOC109471388 OS=Branchiostoma belcheri OX=7741 GN=LOC109471388 PE=4 SV=1, Branchiostoma_belcheri_tr_A0A6P4Z991_A0A6P4Z991_BRABE tr|A0A6P4Z991|A0A6P4Z991_BRABE Uncharacterized protein LOC109471390 OS=Branchiostoma belcheri OX=7741 GN=LOC109471390 PE=4 SV=1, Branchiostoma_belcheri_tr_A0A6P4YCF8_A0A6P4YCF8_BRABE tr|A0A6P4YCF8|A0A6P4YCF8_BRABE Uncharacterized protein LOC109468278 OS=Branchiostoma belcheri OX=7741 GN=LOC109468278 PE=4 SV=1, Branchiostoma_belcheri_tr_A0A6P4YA10_A0A6P4YA10_BRABE tr|A0A6P4YA10|A0A6P4YA10_BRABE Uncharacterized protein LOC109467707 OS=Branchiostoma belcheri OX=7741 GN=LOC109467707 PE=4 SV=1
OG0000074	Schmidtea_mediterranea_maker-scaffold388-augustus-gene-4.45-mRNA-1 maker-scaffold388-augustus-gene-4.45-mRNA-1 protein AED_0.03 eAED_0.03 QI_1337|1|1|1|0.30|0.40|27|353|1205	Branchiostoma_belcheri_tr_A0A6P4ZNI1_A0A6P4ZNI1_BRABE tr|A0A6P4ZNI1|A0A6P4ZNI1_BRABE LOW QUALITY PROTEIN_ slit homolog 2 protein-like OS=Branchiostoma belcheri OX=7741 GN=LOC109478478 PE=4 SV=1
OG0000080	Schmidtea_mediterranea_maker-scaffold16385-augustus-gene-0.38-mRNA-1 maker-scaffold16385-augustus-gene-0.38-mRNA-1 protein AED_0.00 eAED_0.00 QI_443|1|1|1|0|0.33|3|35|141, Schmidtea_mediterranea_maker-scaffold4907-snap-gene-0.19-mRNA-1 maker-scaffold4907-snap-gene-0.19-mRNA-1 protein AED_0.29 eAED_0.29 QI_0|0.16|0.15|0.26|0.72|0.73|19|700|487	Branchiostoma_belcheri_tr_A0A6P5AN13_A0A6P5AN13_BRABE tr|A0A6P5AN13|A0A6P5AN13_BRABE Metalloproteinase inhibitor 1-like OS=Branchiostoma belcheri OX=7741 GN=LOC109485337 PE=3 SV=1, Branchiostoma_belcheri_tr_A0A6P4XVC3_A0A6P4XVC3_BRABE tr|A0A6P4XVC3|A0A6P4XVC3_BRABE Metalloproteinase inhibitor 2-like OS=Branchiostoma belcheri OX=7741 GN=LOC109467109 PE=4 SV=1
OG0000081	Schmidtea_mediterranea_maker-scaffold21973-augustus-gene-0.25-mRNA-1 maker-scaffold21973-augustus-gene-0.25-mRNA-1 protein AED_0.01 eAED_0.02 QI_2|0|0|1|0|0|2|0|715	Branchiostoma_belcheri_tr_A0A6P4ZEK2_A0A6P4ZEK2_BRABE tr|A0A6P4ZEK2|A0A6P4ZEK2_BRABE Cysteine-rich with EGF-like domain protein 2-A isoform X4 OS=Branchiostoma belcheri OX=7741 GN=LOC109472669 PE=3 SV=1, Branchiostoma_belcheri_tr_A0A6P4ZAJ1_A0A6P4ZAJ1_BRABE tr|A0A6P4ZAJ1|A0A6P4ZAJ1_BRABE Cysteine-rich with EGF-like domain protein 2-A isoform X6 OS=Branchiostoma belcheri OX=7741 GN=LOC109472669 PE=3 SV=1, Branchiostoma_belcheri_tr_A0A6P4ZAF3_A0A6P4ZAF3_BRABE tr|A0A6P4ZAF3|A0A6P4ZAF3_BRABE Cysteine-rich with EGF-like domain protein 2-B isoform X1 OS=Branchiostoma belcheri OX=7741 GN=LOC109472669 PE=3 SV=1, Branchiostoma_belcheri_tr_A0A6P4YFR9_A0A6P4YFR9_BRABE tr|A0A6P4YFR9|A0A6P4YFR9_BRABE Cysteine-rich with EGF-like domain protein 2-B isoform X2 OS=Branchiostoma belcheri OX=7741 GN=LOC109472669 PE=3 SV=1, Branchiostoma_belcheri_tr_A0A6P4YUT2_A0A6P4YUT2_BRABE tr|A0A6P4YUT2|A0A6P4YUT2_BRABE Cysteine-rich with EGF-like domain protein 2-B isoform X3 OS=Branchiostoma belcheri OX=7741 GN=LOC109472669 PE=3 SV=1, Branchiostoma_belcheri_tr_A0A6P4YUU0_A0A6P4YUU0_BRABE tr|A0A6P4YUU0|A0A6P4YUU0_BRABE Cysteine-rich with EGF-like domain protein 2-B isoform X5 OS=Branchiostoma belcheri OX=7741 GN=LOC109472669 PE=3 SV=1, Branchiostoma_belcheri_tr_A0A6P4Z330_A0A6P4Z330_BRABE tr|A0A6P4Z330|A0A6P4Z330_BRABE Signal peptide_ CUB and EGF-like domain-containing protein 2 OS=Branchiostoma belcheri OX=7741 GN=LOC109472919 PE=4 SV=1
