Orthogroup	Platyhelminthes_Tricladida_Schmidtea_mediterranea	Chordata_Amphioxiformes_Branchiostoma_belcheri
OG0000009	Schmidtea_mediterranea_maker-scaffold5831-snap-gene-1.66-mRNA-1 maker-scaffold5831-snap-gene-1.66-mRNA-1 protein AED_0.56 eAED_0.56 QI_0|0|0|0.22|1|1|9|0|397, Schmidtea_mediterranea_maker-scaffold5831-snap-gene-1.67-mRNA-1 maker-scaffold5831-snap-gene-1.67-mRNA-1 protein AED_0.58 eAED_0.58 QI_0|0|0|0.5|0.66|1|4|0|254, Schmidtea_mediterranea_maker-scaffold5831-snap-gene-1.65-mRNA-1 maker-scaffold5831-snap-gene-1.65-mRNA-1 protein AED_0.69 eAED_0.69 QI_0|0|0|0.2|1|1|5|0|244	Branchiostoma_belcheri_tr_A0A6P4Z5M5_A0A6P4Z5M5_BRABE tr|A0A6P4Z5M5|A0A6P4Z5M5_BRABE CUB and sushi domain-containing protein 2-like isoform X2 OS=Branchiostoma belcheri OX=7741 GN=LOC109471493 PE=4 SV=1, Branchiostoma_belcheri_tr_A0A6P4Z9R3_A0A6P4Z9R3_BRABE tr|A0A6P4Z9R3|A0A6P4Z9R3_BRABE Seizure 6-like protein 2 isoform X1 OS=Branchiostoma belcheri OX=7741 GN=LOC109471493 PE=4 SV=1
OG0000010	Schmidtea_mediterranea_maker-scaffold40828-augustus-gene-0.30-mRNA-1 maker-scaffold40828-augustus-gene-0.30-mRNA-1 protein AED_0.00 eAED_0.00 QI_82|1|0.66|1|1|1|3|0|1101	Branchiostoma_belcheri_tr_A0A6P5ADU1_A0A6P5ADU1_BRABE tr|A0A6P5ADU1|A0A6P5ADU1_BRABE Roundabout homolog 1-like isoform X7 OS=Branchiostoma belcheri OX=7741 GN=LOC109488168 PE=4 SV=1, Branchiostoma_belcheri_tr_A0A6P5AXY8_A0A6P5AXY8_BRABE tr|A0A6P5AXY8|A0A6P5AXY8_BRABE Roundabout homolog 1-like isoform X6 OS=Branchiostoma belcheri OX=7741 GN=LOC109488168 PE=4 SV=1, Branchiostoma_belcheri_tr_A0A6P5AP31_A0A6P5AP31_BRABE tr|A0A6P5AP31|A0A6P5AP31_BRABE Roundabout homolog 1-like isoform X8 OS=Branchiostoma belcheri OX=7741 GN=LOC109488168 PE=4 SV=1, Branchiostoma_belcheri_tr_A0A6P5A3R8_A0A6P5A3R8_BRABE tr|A0A6P5A3R8|A0A6P5A3R8_BRABE Roundabout homolog 1-like isoform X5 OS=Branchiostoma belcheri OX=7741 GN=LOC109488168 PE=4 SV=1, Branchiostoma_belcheri_tr_A0A6P5ADT6_A0A6P5ADT6_BRABE tr|A0A6P5ADT6|A0A6P5ADT6_BRABE Roundabout homolog 1-like isoform X3 OS=Branchiostoma belcheri OX=7741 GN=LOC109488168 PE=4 SV=1, Branchiostoma_belcheri_tr_A0A6P5AXY4_A0A6P5AXY4_BRABE tr|A0A6P5AXY4|A0A6P5AXY4_BRABE Roundabout homolog 1-like isoform X2 OS=Branchiostoma belcheri OX=7741 GN=LOC109488168 PE=4 SV=1, Branchiostoma_belcheri_tr_A0A6P5A3R5_A0A6P5A3R5_BRABE tr|A0A6P5A3R5|A0A6P5A3R5_BRABE Roundabout homolog 1-like isoform X1 OS=Branchiostoma belcheri OX=7741 GN=LOC109488168 PE=4 SV=1, Branchiostoma_belcheri_tr_A0A6P5AP27_A0A6P5AP27_BRABE tr|A0A6P5AP27|A0A6P5AP27_BRABE Roundabout homolog 1-like isoform X4 OS=Branchiostoma belcheri OX=7741 GN=LOC109488168 PE=4 SV=1, Branchiostoma_belcheri_tr_A0A6P5A3S4_A0A6P5A3S4_BRABE tr|A0A6P5A3S4|A0A6P5A3S4_BRABE Roundabout homolog 1-like isoform X9 OS=Branchiostoma belcheri OX=7741 GN=LOC109488168 PE=4 SV=1
OG0000011	Schmidtea_mediterranea_maker-scaffold10194-snap-gene-0.60-mRNA-1 maker-scaffold10194-snap-gene-0.60-mRNA-1 protein AED_0.18 eAED_0.18 QI_0|0|0|0.42|1|1|7|0|322	Branchiostoma_belcheri_tr_A0A6P4Y6I1_A0A6P4Y6I1_BRABE tr|A0A6P4Y6I1|A0A6P4Y6I1_BRABE Uncharacterized protein LOC109466730 OS=Branchiostoma belcheri OX=7741 GN=LOC109466730 PE=4 SV=1
OG0000011	Schmidtea_mediterranea_maker-scaffold1071-snap-gene-1.56-mRNA-1 maker-scaffold1071-snap-gene-1.56-mRNA-1 protein AED_0.54 eAED_0.54 QI_0|0|0|0.25|0.33|0.25|4|0|122, Schmidtea_mediterranea_maker-scaffold1071-snap-gene-1.57-mRNA-1 maker-scaffold1071-snap-gene-1.57-mRNA-1 protein AED_0.22 eAED_0.24 QI_0|0|0|1|0|0|2|0|203	Branchiostoma_belcheri_tr_A0A6P5AHC2_A0A6P5AHC2_BRABE tr|A0A6P5AHC2|A0A6P5AHC2_BRABE Uncharacterized protein LOC109482840 OS=Branchiostoma belcheri OX=7741 GN=LOC109482840 PE=4 SV=1
OG0000011	Schmidtea_mediterranea_maker-scaffold19804-snap-gene-0.12-mRNA-1 maker-scaffold19804-snap-gene-0.12-mRNA-1 protein AED_0.04 eAED_0.04 QI_37|0.5|0.66|1|0|0|3|77|99, Schmidtea_mediterranea_maker-scaffold15368-augustus-gene-0.16-mRNA-1 maker-scaffold15368-augustus-gene-0.16-mRNA-1 protein AED_0.04 eAED_0.04 QI_0|1|0.5|1|1|1|2|80|186	Branchiostoma_belcheri_tr_A0A6P4ZF41_A0A6P4ZF41_BRABE tr|A0A6P4ZF41|A0A6P4ZF41_BRABE Uncharacterized protein LOC109472881 isoform X2 OS=Branchiostoma belcheri OX=7741 GN=LOC109472881 PE=4 SV=1
OG0000011	Schmidtea_mediterranea_maker-scaffold392-augustus-gene-1.29-mRNA-1 maker-scaffold392-augustus-gene-1.29-mRNA-1 protein AED_0.01 eAED_0.01 QI_0|0.66|0.5|0.75|0.66|0.75|4|1444|178	Branchiostoma_belcheri_tr_A0A6P5A877_A0A6P5A877_BRABE tr|A0A6P5A877|A0A6P5A877_BRABE Uncharacterized protein LOC109480243 OS=Branchiostoma belcheri OX=7741 GN=LOC109480243 PE=4 SV=1, Branchiostoma_belcheri_tr_A0A6P4ZVQ5_A0A6P4ZVQ5_BRABE tr|A0A6P4ZVQ5|A0A6P4ZVQ5_BRABE Plasminogen-like OS=Branchiostoma belcheri OX=7741 GN=LOC109480338 PE=4 SV=1
OG0000012	Schmidtea_mediterranea_maker-scaffold15036-snap-gene-0.26-mRNA-1 maker-scaffold15036-snap-gene-0.26-mRNA-1 protein AED_0.06 eAED_0.06 QI_0|0.83|0.83|0.96|0.53|0.58|31|0|1798	Branchiostoma_belcheri_tr_A0A6P5APH5_A0A6P5APH5_BRABE tr|A0A6P5APH5|A0A6P5APH5_BRABE SCO-spondin-like OS=Branchiostoma belcheri OX=7741 GN=LOC109488277 PE=4 SV=1
OG0000012	Schmidtea_mediterranea_maker-scaffold3230-augustus-gene-1.44-mRNA-1 maker-scaffold3230-augustus-gene-1.44-mRNA-1 protein AED_0.24 eAED_0.29 QI_0|0.78|0.8|0.93|0.28|0.53|15|59|1141, Schmidtea_mediterranea_maker-scaffold12100-snap-gene-0.38-mRNA-1 maker-scaffold12100-snap-gene-0.38-mRNA-1 protein AED_0.26 eAED_0.26 QI_0|0.75|0.6|0.8|0.5|0.2|5|0|1076	Branchiostoma_belcheri_tr_A0A6P5A465_A0A6P5A465_BRABE tr|A0A6P5A465|A0A6P5A465_BRABE Proteoglycan 4-like OS=Branchiostoma belcheri OX=7741 GN=LOC109488278 PE=4 SV=1, Branchiostoma_belcheri_tr_A0A6P5AE63_A0A6P5AE63_BRABE tr|A0A6P5AE63|A0A6P5AE63_BRABE Mucin-5AC-like OS=Branchiostoma belcheri OX=7741 GN=LOC109488281 PE=4 SV=1, Branchiostoma_belcheri_tr_A0A6P5APL0_A0A6P5APL0_BRABE tr|A0A6P5APL0|A0A6P5APL0_BRABE Mucin-6-like OS=Branchiostoma belcheri OX=7741 GN=LOC109488313 PE=4 SV=1
OG0000012	Schmidtea_mediterranea_maker-scaffold17393-augustus-gene-0.24-mRNA-1 maker-scaffold17393-augustus-gene-0.24-mRNA-1 protein AED_0.05 eAED_0.05 QI_240|0.66|0.5|1|1|1|4|0|943, Schmidtea_mediterranea_maker-scaffold17393-augustus-gene-0.25-mRNA-1 maker-scaffold17393-augustus-gene-0.25-mRNA-1 protein AED_0.00 eAED_0.00 QI_434|1|1|1|0.5|0.66|3|24|211	Branchiostoma_belcheri_tr_A0A6P5A8U6_A0A6P5A8U6_BRABE tr|A0A6P5A8U6|A0A6P5A8U6_BRABE Tenascin-like OS=Branchiostoma belcheri OX=7741 GN=LOC109486622 PE=4 SV=1, Branchiostoma_belcheri_tr_A0A6P4YY24_A0A6P4YY24_BRABE tr|A0A6P4YY24|A0A6P4YY24_BRABE LOW QUALITY PROTEIN_ uncharacterized protein LOC109469615 OS=Branchiostoma belcheri OX=7741 GN=LOC109469615 PE=4 SV=1
OG0000013	Schmidtea_mediterranea_maker-scaffold1075-snap-gene-0.46-mRNA-1 maker-scaffold1075-snap-gene-0.46-mRNA-1 protein AED_0.12 eAED_0.12 QI_109|0.66|0.42|1|0.33|0|7|0|511, Schmidtea_mediterranea_maker-scaffold4491-snap-gene-0.19-mRNA-1 maker-scaffold4491-snap-gene-0.19-mRNA-1 protein AED_0.08 eAED_0.08 QI_0|0|0|0.5|0.2|0.16|6|0|372, Schmidtea_mediterranea_maker-scaffold14654-snap-gene-0.26-mRNA-1 maker-scaffold14654-snap-gene-0.26-mRNA-1 protein AED_0.15 eAED_0.15 QI_0|0|0|0.33|0.8|0.83|6|0|309, Schmidtea_mediterranea_maker-scaffold24568-augustus-gene-0.47-mRNA-1 maker-scaffold24568-augustus-gene-0.47-mRNA-1 protein AED_0.00 eAED_0.00 QI_16|1|1|1|0.5|0.33|3|124|372	Branchiostoma_belcheri_tr_A0A6P4YVT8_A0A6P4YVT8_BRABE tr|A0A6P4YVT8|A0A6P4YVT8_BRABE Protein Wnt OS=Branchiostoma belcheri OX=7741 GN=LOC109476891 PE=3 SV=1
OG0000013	Schmidtea_mediterranea_maker-scaffold4184-snap-gene-0.24-mRNA-1 maker-scaffold4184-snap-gene-0.24-mRNA-1 protein AED_0.05 eAED_0.05 QI_0|0|0|0.5|0.6|0.5|6|0|427	Branchiostoma_belcheri_tr_A0A6P4ZX28_A0A6P4ZX28_BRABE tr|A0A6P4ZX28|A0A6P4ZX28_BRABE Protein Wnt OS=Branchiostoma belcheri OX=7741 GN=LOC109477379 PE=3 SV=1
OG0000013	Schmidtea_mediterranea_maker-scaffold5858-augustus-gene-1.57-mRNA-1 maker-scaffold5858-augustus-gene-1.57-mRNA-1 protein AED_0.19 eAED_0.19 QI_722|0.83|0.85|0.85|0.16|0.71|7|0|346	Branchiostoma_belcheri_tr_A0A6P4ZRB9_A0A6P4ZRB9_BRABE tr|A0A6P4ZRB9|A0A6P4ZRB9_BRABE Protein Wnt OS=Branchiostoma belcheri OX=7741 GN=LOC109476910 PE=3 SV=1, Branchiostoma_belcheri_tr_A0A6P4ZTM3_A0A6P4ZTM3_BRABE tr|A0A6P4ZTM3|A0A6P4ZTM3_BRABE Protein Wnt OS=Branchiostoma belcheri OX=7741 GN=LOC109477463 PE=3 SV=1
OG0000014	Schmidtea_mediterranea_maker-scaffold35401-snap-gene-0.54-mRNA-1 maker-scaffold35401-snap-gene-0.54-mRNA-1 protein AED_0.10 eAED_0.10 QI_27|0.84|0.84|1|0.36|0.65|26|101|1154	Branchiostoma_belcheri_tr_A0A6P4ZJ53_A0A6P4ZJ53_BRABE tr|A0A6P4ZJ53|A0A6P4ZJ53_BRABE A disintegrin and metalloproteinase with thrombospondin motifs 9-like isoform X2 OS=Branchiostoma belcheri OX=7741 GN=LOC109477323 PE=4 SV=1, Branchiostoma_belcheri_tr_A0A6P4ZBN8_A0A6P4ZBN8_BRABE tr|A0A6P4ZBN8|A0A6P4ZBN8_BRABE A disintegrin and metalloproteinase with thrombospondin motifs 9-like isoform X1 OS=Branchiostoma belcheri OX=7741 GN=LOC109477323 PE=4 SV=1, Branchiostoma_belcheri_tr_A0A6P4YXJ1_A0A6P4YXJ1_BRABE tr|A0A6P4YXJ1|A0A6P4YXJ1_BRABE A disintegrin and metalloproteinase with thrombospondin motifs 9-like isoform X3 OS=Branchiostoma belcheri OX=7741 GN=LOC109477323 PE=4 SV=1, Branchiostoma_belcheri_tr_A0A6P4ZA21_A0A6P4ZA21_BRABE tr|A0A6P4ZA21|A0A6P4ZA21_BRABE A disintegrin and metalloproteinase with thrombospondin motifs 9-like OS=Branchiostoma belcheri OX=7741 GN=LOC109476941 PE=4 SV=1
OG0000016	Schmidtea_mediterranea_maker-scaffold7938-snap-gene-0.18-mRNA-1 maker-scaffold7938-snap-gene-0.18-mRNA-1 protein AED_0.17 eAED_0.21 QI_0|0.58|0.53|0.76|0.66|0.61|13|0|486, Schmidtea_mediterranea_maker-scaffold4098-snap-gene-0.30-mRNA-1 maker-scaffold4098-snap-gene-0.30-mRNA-1 protein AED_0.01 eAED_0.01 QI_131|0.81|0.83|1|0.63|0.58|12|36|484, Schmidtea_mediterranea_maker-scaffold41550-snap-gene-0.65-mRNA-1 maker-scaffold41550-snap-gene-0.65-mRNA-1 protein AED_0.02 eAED_0.02 QI_0|0.8|0.72|0.90|0.9|0.90|11|37|491	Branchiostoma_belcheri_tr_A0A6P4ZKT6_A0A6P4ZKT6_BRABE tr|A0A6P4ZKT6|A0A6P4ZKT6_BRABE Stromelysin-2-like OS=Branchiostoma belcheri OX=7741 GN=LOC109483262 PE=3 SV=1, Branchiostoma_belcheri_tr_A0A6P4ZHX6_A0A6P4ZHX6_BRABE tr|A0A6P4ZHX6|A0A6P4ZHX6_BRABE Stromelysin-1-like OS=Branchiostoma belcheri OX=7741 GN=LOC109482489 PE=3 SV=1, Branchiostoma_belcheri_tr_A0A6P4Z8R5_A0A6P4Z8R5_BRABE tr|A0A6P4Z8R5|A0A6P4Z8R5_BRABE Matrix metalloproteinase-9-like OS=Branchiostoma belcheri OX=7741 GN=LOC109474420 PE=3 SV=1, Branchiostoma_belcheri_tr_A0A6P4Y5L7_A0A6P4Y5L7_BRABE tr|A0A6P4Y5L7|A0A6P4Y5L7_BRABE Uncharacterized protein LOC109461959 OS=Branchiostoma belcheri OX=7741 GN=LOC109461959 PE=3 SV=1, Branchiostoma_belcheri_tr_A0A6P4XTS6_A0A6P4XTS6_BRABE tr|A0A6P4XTS6|A0A6P4XTS6_BRABE Matrix metalloproteinase-18-like OS=Branchiostoma belcheri OX=7741 GN=LOC109462004 PE=3 SV=1
OG0000018	Schmidtea_mediterranea_maker-scaffold2109-augustus-gene-0.18-mRNA-1 maker-scaffold2109-augustus-gene-0.18-mRNA-1 protein AED_0.33 eAED_0.33 QI_39|0.62|0.66|0.88|0.37|0.66|9|50|645, Schmidtea_mediterranea_maker-scaffold11314-snap-gene-0.19-mRNA-1 maker-scaffold11314-snap-gene-0.19-mRNA-1 protein AED_0.45 eAED_0.50 QI_0|0|0|0.5|0|0|2|0|360, Schmidtea_mediterranea_maker-scaffold11314-snap-gene-0.20-mRNA-1 maker-scaffold11314-snap-gene-0.20-mRNA-1 protein AED_0.45 eAED_0.50 QI_0|0|0|0.5|1|1|2|0|360	Branchiostoma_belcheri_tr_A0A6P5ASY6_A0A6P5ASY6_BRABE tr|A0A6P5ASY6|A0A6P5ASY6_BRABE Protein-lysine 6-oxidase-like OS=Branchiostoma belcheri OX=7741 GN=LOC109486753 PE=3 SV=1, Branchiostoma_belcheri_tr_A0A6P4ZYU5_A0A6P4ZYU5_BRABE tr|A0A6P4ZYU5|A0A6P4ZYU5_BRABE Lysyl oxidase homolog 1-like isoform X1 OS=Branchiostoma belcheri OX=7741 GN=LOC109486857 PE=4 SV=1, Branchiostoma_belcheri_tr_A0A6P5AWH8_A0A6P5AWH8_BRABE tr|A0A6P5AWH8|A0A6P5AWH8_BRABE Protein-lysine 6-oxidase-like isoform X2 OS=Branchiostoma belcheri OX=7741 GN=LOC109486857 PE=4 SV=1
OG0000019	Schmidtea_mediterranea_maker-scaffold6043-augustus-gene-0.26-mRNA-1 maker-scaffold6043-augustus-gene-0.26-mRNA-1 protein AED_0.00 eAED_0.00 QI_219|1|1|1|0.33|0.75|4|544|374, Schmidtea_mediterranea_maker-scaffold8614-snap-gene-1.51-mRNA-1 maker-scaffold8614-snap-gene-1.51-mRNA-1 protein AED_0.33 eAED_0.34 QI_0|0.66|0.75|1|0|0.25|4|201|247	Branchiostoma_belcheri_tr_A0A6P4ZEK8_A0A6P4ZEK8_BRABE tr|A0A6P4ZEK8|A0A6P4ZEK8_BRABE Growth/differentiation factor 8-like OS=Branchiostoma belcheri OX=7741 GN=LOC109478106 PE=3 SV=1, Branchiostoma_belcheri_tr_A0A6P4ZMV3_A0A6P4ZMV3_BRABE tr|A0A6P4ZMV3|A0A6P4ZMV3_BRABE Bone morphogenetic protein 4-like OS=Branchiostoma belcheri OX=7741 GN=LOC109476017 PE=3 SV=1, Branchiostoma_belcheri_tr_A0A6P4Z0Q3_A0A6P4Z0Q3_BRABE tr|A0A6P4Z0Q3|A0A6P4Z0Q3_BRABE Inhibin beta B chain-like OS=Branchiostoma belcheri OX=7741 GN=LOC109478109 PE=3 SV=1, Branchiostoma_belcheri_tr_A0A6P4ZN64_A0A6P4ZN64_BRABE tr|A0A6P4ZN64|A0A6P4ZN64_BRABE Growth/differentiation factor 8-like OS=Branchiostoma belcheri OX=7741 GN=LOC109476087 PE=3 SV=1, Branchiostoma_belcheri_tr_A0A6P4YK91_A0A6P4YK91_BRABE tr|A0A6P4YK91|A0A6P4YK91_BRABE Bone morphogenetic protein 6-like OS=Branchiostoma belcheri OX=7741 GN=LOC109464877 PE=3 SV=1
OG0000019	Schmidtea_mediterranea_maker-scaffold34701-augustus-gene-0.6-mRNA-1 maker-scaffold34701-augustus-gene-0.6-mRNA-1 protein AED_0.00 eAED_0.00 QI_51|1|1|1|1|1|2|116|143, Schmidtea_mediterranea_maker-scaffold4731-augustus-gene-0.23-mRNA-1 maker-scaffold4731-augustus-gene-0.23-mRNA-1 protein AED_0.40 eAED_0.40 QI_0|0.14|0.12|0.25|1|1|8|64|556, Schmidtea_mediterranea_maker-scaffold34701-augustus-gene-0.5-mRNA-1 maker-scaffold34701-augustus-gene-0.5-mRNA-1 protein AED_0.05 eAED_0.05 QI_0|0.5|0.33|0.66|1|0.66|3|116|165, Schmidtea_mediterranea_maker-scaffold2542-augustus-gene-0.6-mRNA-1 maker-scaffold2542-augustus-gene-0.6-mRNA-1 protein AED_0.24 eAED_0.24 QI_0|0.5|0.33|0.66|1|1|3|116|310	Branchiostoma_belcheri_tr_A0A6P5A0C8_A0A6P5A0C8_BRABE tr|A0A6P5A0C8|A0A6P5A0C8_BRABE Bone morphogenetic protein 2-like OS=Branchiostoma belcheri OX=7741 GN=LOC109478266 PE=3 SV=1, Branchiostoma_belcheri_tr_A0A6P4YW57_A0A6P4YW57_BRABE tr|A0A6P4YW57|A0A6P4YW57_BRABE Bone morphogenetic protein 7-like OS=Branchiostoma belcheri OX=7741 GN=LOC109473118 PE=3 SV=1, Branchiostoma_belcheri_tr_A0A6P4ZTT2_A0A6P4ZTT2_BRABE tr|A0A6P4ZTT2|A0A6P4ZTT2_BRABE Uncharacterized protein LOC109477517 OS=Branchiostoma belcheri OX=7741 GN=LOC109477517 PE=3 SV=1, Branchiostoma_belcheri_tr_A0A6P4YT30_A0A6P4YT30_BRABE tr|A0A6P4YT30|A0A6P4YT30_BRABE Bone morphogenetic protein 6-like OS=Branchiostoma belcheri OX=7741 GN=LOC109476129 PE=3 SV=1, Branchiostoma_belcheri_tr_A0A6P5ABX2_A0A6P5ABX2_BRABE tr|A0A6P5ABX2|A0A6P5ABX2_BRABE Bone morphogenetic protein 2-like OS=Branchiostoma belcheri OX=7741 GN=LOC109482544 PE=3 SV=1, Branchiostoma_belcheri_tr_A0A6P5A3G1_A0A6P5A3G1_BRABE tr|A0A6P5A3G1|A0A6P5A3G1_BRABE LOW QUALITY PROTEIN_ protein DVR-1-like OS=Branchiostoma belcheri OX=7741 GN=LOC109482546 PE=3 SV=1, Branchiostoma_belcheri_tr_A0A6P4Z5G7_A0A6P4Z5G7_BRABE tr|A0A6P4Z5G7|A0A6P4Z5G7_BRABE Growth/differentiation factor 5-like OS=Branchiostoma belcheri OX=7741 GN=LOC109473658 PE=3 SV=1, Branchiostoma_belcheri_tr_A0A6P4ZRR9_A0A6P4ZRR9_BRABE tr|A0A6P4ZRR9|A0A6P4ZRR9_BRABE Bone morphogenetic protein 3-like isoform X1 OS=Branchiostoma belcheri OX=7741 GN=LOC109481417 PE=3 SV=1, Branchiostoma_belcheri_tr_A0A6P5A3N3_A0A6P5A3N3_BRABE tr|A0A6P5A3N3|A0A6P5A3N3_BRABE Univin-like OS=Branchiostoma belcheri OX=7741 GN=LOC109488141 PE=3 SV=1, Branchiostoma_belcheri_tr_A0A6P4ZAY0_A0A6P4ZAY0_BRABE tr|A0A6P4ZAY0|A0A6P4ZAY0_BRABE Bone morphogenetic protein 2-B-like OS=Branchiostoma belcheri OX=7741 GN=LOC109472830 PE=3 SV=1, Branchiostoma_belcheri_tr_A0A6P4XU83_A0A6P4XU83_BRABE tr|A0A6P4XU83|A0A6P4XU83_BRABE Nodal homolog 2-A-like OS=Branchiostoma belcheri OX=7741 GN=LOC109466818 PE=3 SV=1
OG0000020	Schmidtea_mediterranea_maker-scaffold19303-augustus-gene-0.58-mRNA-1 maker-scaffold19303-augustus-gene-0.58-mRNA-1 protein AED_0.22 eAED_0.31 QI_0|0.74|0.78|1|0.77|0.85|28|191|2030	Branchiostoma_belcheri_tr_A0A6P5AAT0_A0A6P5AAT0_BRABE tr|A0A6P5AAT0|A0A6P5AAT0_BRABE Collagen alpha-1_XI_ chain-like isoform X1 OS=Branchiostoma belcheri OX=7741 GN=LOC109484488 PE=4 SV=1, Branchiostoma_belcheri_tr_A0A6P5AMT1_A0A6P5AMT1_BRABE tr|A0A6P5AMT1|A0A6P5AMT1_BRABE Collagen alpha-1_XI_ chain-like isoform X3 OS=Branchiostoma belcheri OX=7741 GN=LOC109484488 PE=4 SV=1, Branchiostoma_belcheri_tr_A0A6P4ZQ52_A0A6P4ZQ52_BRABE tr|A0A6P4ZQ52|A0A6P4ZQ52_BRABE Collagen alpha-1_XI_ chain-like isoform X2 OS=Branchiostoma belcheri OX=7741 GN=LOC109484488 PE=4 SV=1, Branchiostoma_belcheri_tr_A0A6P5AJQ3_A0A6P5AJQ3_BRABE tr|A0A6P5AJQ3|A0A6P5AJQ3_BRABE Collagen alpha-1_V_ chain-like isoform X4 OS=Branchiostoma belcheri OX=7741 GN=LOC109484488 PE=4 SV=1, Branchiostoma_belcheri_tr_A0A6P5A1L4_A0A6P5A1L4_BRABE tr|A0A6P5A1L4|A0A6P5A1L4_BRABE Collagen alpha-2_I_ chain-like OS=Branchiostoma belcheri OX=7741 GN=LOC109484390 PE=4 SV=1, Branchiostoma_belcheri_tr_A0A6P4ZRC9_A0A6P4ZRC9_BRABE tr|A0A6P4ZRC9|A0A6P4ZRC9_BRABE Collagen alpha-1_I_ chain-like isoform X3 OS=Branchiostoma belcheri OX=7741 GN=LOC109475829 PE=4 SV=1, Branchiostoma_belcheri_tr_A0A6P4YRU8_A0A6P4YRU8_BRABE tr|A0A6P4YRU8|A0A6P4YRU8_BRABE Collagen alpha-1_I_ chain-like isoform X2 OS=Branchiostoma belcheri OX=7741 GN=LOC109475829 PE=4 SV=1, Branchiostoma_belcheri_tr_A0A6P4ZE62_A0A6P4ZE62_BRABE tr|A0A6P4ZE62|A0A6P4ZE62_BRABE Collagen alpha-1_I_ chain-like isoform X1 OS=Branchiostoma belcheri OX=7741 GN=LOC109475829 PE=4 SV=1, Branchiostoma_belcheri_tr_A0A6P4ZM83_A0A6P4ZM83_BRABE tr|A0A6P4ZM83|A0A6P4ZM83_BRABE Collagen alpha-1_I_ chain-like isoform X4 OS=Branchiostoma belcheri OX=7741 GN=LOC109475829 PE=4 SV=1, Branchiostoma_belcheri_tr_A0A6P4ZE66_A0A6P4ZE66_BRABE tr|A0A6P4ZE66|A0A6P4ZE66_BRABE Collagen alpha-1_I_ chain-like isoform X6 OS=Branchiostoma belcheri OX=7741 GN=LOC109475829 PE=4 SV=1, Branchiostoma_belcheri_tr_A0A6P4ZRD5_A0A6P4ZRD5_BRABE tr|A0A6P4ZRD5|A0A6P4ZRD5_BRABE Collagen alpha-1_I_ chain-like isoform X8 OS=Branchiostoma belcheri OX=7741 GN=LOC109475829 PE=4 SV=1, Branchiostoma_belcheri_tr_A0A6P4Z6C1_A0A6P4Z6C1_BRABE tr|A0A6P4Z6C1|A0A6P4Z6C1_BRABE Collagen alpha-1_I_ chain-like isoform X5 OS=Branchiostoma belcheri OX=7741 GN=LOC109475829 PE=4 SV=1, Branchiostoma_belcheri_tr_A0A6P4YRV3_A0A6P4YRV3_BRABE tr|A0A6P4YRV3|A0A6P4YRV3_BRABE Collagen alpha-1_I_ chain-like isoform X7 OS=Branchiostoma belcheri OX=7741 GN=LOC109475829 PE=4 SV=1
OG0000021	Schmidtea_mediterranea_maker-scaffold5879-augustus-gene-0.28-mRNA-1 maker-scaffold5879-augustus-gene-0.28-mRNA-1 protein AED_0.28 eAED_0.28 QI_330|0.33|0.5|0.9|0.22|0.5|10|395|587, Schmidtea_mediterranea_maker-scaffold19113-snap-gene-0.19-mRNA-1 maker-scaffold19113-snap-gene-0.19-mRNA-1 protein AED_0.15 eAED_0.15 QI_40|0.71|0.75|0.87|0.57|0.75|8|183|628	Branchiostoma_belcheri_tr_A0A6P5A6E5_A0A6P5A6E5_BRABE tr|A0A6P5A6E5|A0A6P5A6E5_BRABE Prolow-density lipoprotein receptor-related protein 1-like OS=Branchiostoma belcheri OX=7741 GN=LOC109480925 PE=4 SV=1
OG0000022	Schmidtea_mediterranea_maker-scaffold17507-augustus-gene-0.9-mRNA-1 maker-scaffold17507-augustus-gene-0.9-mRNA-1 protein AED_0.22 eAED_0.22 QI_471|1|1|1|0.5|0.55|9|69|339, Schmidtea_mediterranea_snap_masked-scaffold46263-processed-gene-0.1-mRNA-1 snap_masked-scaffold46263-processed-gene-0.1-mRNA-1 protein AED_0.25 eAED_0.25 QI_0|0|0|1|1|1|4|0|149, Schmidtea_mediterranea_maker-scaffold1449-augustus-gene-0.17-mRNA-1 maker-scaffold1449-augustus-gene-0.17-mRNA-1 protein AED_0.20 eAED_0.20 QI_63|0.52|0.55|0.83|0.76|0.66|18|0|1431	Branchiostoma_belcheri_tr_A0A6P4XTC9_A0A6P4XTC9_BRABE tr|A0A6P4XTC9|A0A6P4XTC9_BRABE Annexin OS=Branchiostoma belcheri OX=7741 GN=LOC109466626 PE=3 SV=1, Branchiostoma_belcheri_tr_A0A6P4YRN1_A0A6P4YRN1_BRABE tr|A0A6P4YRN1|A0A6P4YRN1_BRABE Annexin OS=Branchiostoma belcheri OX=7741 GN=LOC109466572 PE=3 SV=1, Branchiostoma_belcheri_tr_A0A6P5A6Q0_A0A6P5A6Q0_BRABE tr|A0A6P5A6Q0|A0A6P5A6Q0_BRABE Annexin OS=Branchiostoma belcheri OX=7741 GN=LOC109485926 PE=3 SV=1, Branchiostoma_belcheri_tr_A0A6P5AQ05_A0A6P5AQ05_BRABE tr|A0A6P5AQ05|A0A6P5AQ05_BRABE Annexin OS=Branchiostoma belcheri OX=7741 GN=LOC109485926 PE=3 SV=1, Branchiostoma_belcheri_tr_A0A6P5AFH2_A0A6P5AFH2_BRABE tr|A0A6P5AFH2|A0A6P5AFH2_BRABE Annexin OS=Branchiostoma belcheri OX=7741 GN=LOC109485860 PE=3 SV=1
OG0000024	Schmidtea_mediterranea_maker-scaffold34004-snap-gene-0.20-mRNA-1 maker-scaffold34004-snap-gene-0.20-mRNA-1 protein AED_0.47 eAED_0.47 QI_0|0.4|0.16|0.83|0|0|6|0|243, Schmidtea_mediterranea_maker-scaffold10745-augustus-gene-0.24-mRNA-1 maker-scaffold10745-augustus-gene-0.24-mRNA-1 protein AED_0.31 eAED_0.31 QI_115|1|1|1|1|1|3|107|175, Schmidtea_mediterranea_maker-scaffold12358-augustus-gene-0.7-mRNA-1 maker-scaffold12358-augustus-gene-0.7-mRNA-1 protein AED_0.00 eAED_0.00 QI_152|1|1|1|1|1|3|55|169, Schmidtea_mediterranea_maker-scaffold15670-augustus-gene-0.9-mRNA-1 maker-scaffold15670-augustus-gene-0.9-mRNA-1 protein AED_0.00 eAED_0.00 QI_21|1|1|1|1|1|3|52|163, Schmidtea_mediterranea_maker-scaffold31871-augustus-gene-0.18-mRNA-1 maker-scaffold31871-augustus-gene-0.18-mRNA-1 protein AED_0.00 eAED_0.00 QI_21|1|1|1|1|1|3|52|163, Schmidtea_mediterranea_maker-scaffold31871-snap-gene-0.21-mRNA-1 maker-scaffold31871-snap-gene-0.21-mRNA-1 protein AED_0.25 eAED_0.25 QI_0|0.4|0.16|0.83|1|1|6|0|191, Schmidtea_mediterranea_maker-scaffold29512-snap-gene-0.44-mRNA-1 maker-scaffold29512-snap-gene-0.44-mRNA-1 protein AED_0.51 eAED_0.53 QI_0|0.14|0|0.37|1|1|8|0|188	Branchiostoma_belcheri_tr_A0A6P4XZ68_A0A6P4XZ68_BRABE tr|A0A6P4XZ68|A0A6P4XZ68_BRABE Protein crumbs homolog 2-like OS=Branchiostoma belcheri OX=7741 GN=LOC109464806 PE=4 SV=1
