Orthogroup	Platyhelminthes_Tricladida_Schmidtea_mediterranea	Chordata_Amphioxiformes_Branchiostoma_belcheri
OG0000085	Schmidtea_mediterranea_maker-scaffold29486-augustus-gene-0.14-mRNA-1 maker-scaffold29486-augustus-gene-0.14-mRNA-1 protein AED_0.26 eAED_0.30 QI_91|0.5|0.66|1|0|0.66|3|0|437	Branchiostoma_belcheri_tr_A0A6P5A8A2_A0A6P5A8A2_BRABE tr|A0A6P5A8A2|A0A6P5A8A2_BRABE Leucine-rich repeat and immunoglobulin-like domain-containing nogo receptor-interacting protein 1-B OS=Branchiostoma belcheri OX=7741 GN=LOC109486444 PE=4 SV=1, Branchiostoma_belcheri_tr_A0A6P5AG63_A0A6P5AG63_BRABE tr|A0A6P5AG63|A0A6P5AG63_BRABE SLIT and NTRK-like protein 6 OS=Branchiostoma belcheri OX=7741 GN=LOC109483641 PE=4 SV=1, Branchiostoma_belcheri_tr_A0A6P4Z2J8_A0A6P4Z2J8_BRABE tr|A0A6P4Z2J8|A0A6P4Z2J8_BRABE Leucine-rich repeat-containing protein 15-like OS=Branchiostoma belcheri OX=7741 GN=LOC109472751 PE=4 SV=1, Branchiostoma_belcheri_tr_A0A6P5A0C1_A0A6P5A0C1_BRABE tr|A0A6P5A0C1|A0A6P5A0C1_BRABE Leucine-rich repeat-containing protein 15-like OS=Branchiostoma belcheri OX=7741 GN=LOC109479197 PE=4 SV=1, Branchiostoma_belcheri_tr_A0A6P5A8U7_A0A6P5A8U7_BRABE tr|A0A6P5A8U7|A0A6P5A8U7_BRABE Immunoglobulin superfamily member 10-like OS=Branchiostoma belcheri OX=7741 GN=LOC109481602 PE=4 SV=1, Branchiostoma_belcheri_tr_A0A6P4ZK56_A0A6P4ZK56_BRABE tr|A0A6P4ZK56|A0A6P4ZK56_BRABE Leucine-rich repeat-containing protein 4C-like OS=Branchiostoma belcheri OX=7741 GN=LOC109477502 PE=4 SV=1, Branchiostoma_belcheri_tr_A0A6P4ZNH7_A0A6P4ZNH7_BRABE tr|A0A6P4ZNH7|A0A6P4ZNH7_BRABE Leucine-rich repeat and immunoglobulin-like domain-containing nogo receptor-interacting protein 1 OS=Branchiostoma belcheri OX=7741 GN=LOC109475084 PE=4 SV=1, Branchiostoma_belcheri_tr_A0A6P4XSQ9_A0A6P4XSQ9_BRABE tr|A0A6P4XSQ9|A0A6P4XSQ9_BRABE Leucine-rich repeat-containing protein 24-like OS=Branchiostoma belcheri OX=7741 GN=LOC109462934 PE=4 SV=1, Branchiostoma_belcheri_tr_A0A6P4ZMS4_A0A6P4ZMS4_BRABE tr|A0A6P4ZMS4|A0A6P4ZMS4_BRABE Immunoglobulin superfamily member 10-like OS=Branchiostoma belcheri OX=7741 GN=LOC109475985 PE=4 SV=1, Branchiostoma_belcheri_tr_A0A6P5A7R1_A0A6P5A7R1_BRABE tr|A0A6P5A7R1|A0A6P5A7R1_BRABE Immunoglobulin superfamily member 10-like isoform X1 OS=Branchiostoma belcheri OX=7741 GN=LOC109486278 PE=4 SV=1, Branchiostoma_belcheri_tr_A0A6P5AH37_A0A6P5AH37_BRABE tr|A0A6P5AH37|A0A6P5AH37_BRABE Immunoglobulin superfamily member 10-like isoform X2 OS=Branchiostoma belcheri OX=7741 GN=LOC109486278 PE=4 SV=1, Branchiostoma_belcheri_tr_A0A6P4YGM7_A0A6P4YGM7_BRABE tr|A0A6P4YGM7|A0A6P4YGM7_BRABE Leucine-rich repeat-containing protein 4C-like OS=Branchiostoma belcheri OX=7741 GN=LOC109469509 PE=4 SV=1, Branchiostoma_belcheri_tr_A0A6P4ZCG9_A0A6P4ZCG9_BRABE tr|A0A6P4ZCG9|A0A6P4ZCG9_BRABE Leucine-rich repeat and fibronectin type-III domain-containing protein 5-like OS=Branchiostoma belcheri OX=7741 GN=LOC109477518 PE=4 SV=1, Branchiostoma_belcheri_tr_A0A6P4ZGH5_A0A6P4ZGH5_BRABE tr|A0A6P4ZGH5|A0A6P4ZGH5_BRABE Chondroadherin-like OS=Branchiostoma belcheri OX=7741 GN=LOC109478607 PE=4 SV=1, Branchiostoma_belcheri_tr_A0A6P5A224_A0A6P5A224_BRABE tr|A0A6P5A224|A0A6P5A224_BRABE Chondroadherin-like OS=Branchiostoma belcheri OX=7741 GN=LOC109478606 PE=4 SV=1, Branchiostoma_belcheri_tr_A0A6P4YGK9_A0A6P4YGK9_BRABE tr|A0A6P4YGK9|A0A6P4YGK9_BRABE SLIT and NTRK-like protein 2 OS=Branchiostoma belcheri OX=7741 GN=LOC109469493 PE=4 SV=1, Branchiostoma_belcheri_tr_A0A6P4YTH4_A0A6P4YTH4_BRABE tr|A0A6P4YTH4|A0A6P4YTH4_BRABE Chondroadherin-like OS=Branchiostoma belcheri OX=7741 GN=LOC109468127 PE=4 SV=1, Branchiostoma_belcheri_tr_A0A6P4ZJR2_A0A6P4ZJR2_BRABE tr|A0A6P4ZJR2|A0A6P4ZJR2_BRABE Leucine-rich repeat-containing protein 15-like OS=Branchiostoma belcheri OX=7741 GN=LOC109475191 PE=4 SV=1, Branchiostoma_belcheri_tr_A0A6P4ZJ67_A0A6P4ZJ67_BRABE tr|A0A6P4ZJ67|A0A6P4ZJ67_BRABE Immunoglobulin superfamily containing leucine-rich repeat protein-like OS=Branchiostoma belcheri OX=7741 GN=LOC109479286 PE=4 SV=1, Branchiostoma_belcheri_tr_A0A6P5A726_A0A6P5A726_BRABE tr|A0A6P5A726|A0A6P5A726_BRABE LOW QUALITY PROTEIN_ leucine-rich repeat_ immunoglobulin-like domain and transmembrane domain-containing protein 3 OS=Branchiostoma belcheri OX=7741 GN=LOC109486089 PE=4 SV=1, Branchiostoma_belcheri_tr_A0A6P4XZ47_A0A6P4XZ47_BRABE tr|A0A6P4XZ47|A0A6P4XZ47_BRABE Slit homolog 3 protein-like OS=Branchiostoma belcheri OX=7741 GN=LOC109468116 PE=4 SV=1, Branchiostoma_belcheri_tr_A0A6P4YXQ0_A0A6P4YXQ0_BRABE tr|A0A6P4YXQ0|A0A6P4YXQ0_BRABE Chondroadherin-like OS=Branchiostoma belcheri OX=7741 GN=LOC109469496 PE=4 SV=1, Branchiostoma_belcheri_tr_A0A6P4YPJ1_A0A6P4YPJ1_BRABE tr|A0A6P4YPJ1|A0A6P4YPJ1_BRABE Leucine-rich repeat-containing protein 4C-like OS=Branchiostoma belcheri OX=7741 GN=LOC109469510 PE=4 SV=1, Branchiostoma_belcheri_tr_A0A6P4YXE0_A0A6P4YXE0_BRABE tr|A0A6P4YXE0|A0A6P4YXE0_BRABE Slit homolog 1 protein-like OS=Branchiostoma belcheri OX=7741 GN=LOC109468125 PE=4 SV=1, Branchiostoma_belcheri_tr_A0A6P4YPG8_A0A6P4YPG8_BRABE tr|A0A6P4YPG8|A0A6P4YPG8_BRABE Chondroadherin-like OS=Branchiostoma belcheri OX=7741 GN=LOC109469494 PE=4 SV=1, Branchiostoma_belcheri_tr_A0A6P4Y3B7_A0A6P4Y3B7_BRABE tr|A0A6P4Y3B7|A0A6P4Y3B7_BRABE Leucine-rich repeat and immunoglobulin-like domain-containing nogo receptor-interacting protein 3 OS=Branchiostoma belcheri OX=7741 GN=LOC109465880 PE=4 SV=1, Branchiostoma_belcheri_tr_A0A6P4Y039_A0A6P4Y039_BRABE tr|A0A6P4Y039|A0A6P4Y039_BRABE Slit homolog 1 protein-like OS=Branchiostoma belcheri OX=7741 GN=LOC109465073 PE=4 SV=1, Branchiostoma_belcheri_tr_A0A6P4YHE3_A0A6P4YHE3_BRABE tr|A0A6P4YHE3|A0A6P4YHE3_BRABE Leucine-rich repeat-containing protein 15-like OS=Branchiostoma belcheri OX=7741 GN=LOC109467730 PE=4 SV=1, Branchiostoma_belcheri_tr_A0A6P4YTH9_A0A6P4YTH9_BRABE tr|A0A6P4YTH9|A0A6P4YTH9_BRABE Leucine-rich repeat and immunoglobulin-like domain-containing nogo receptor-interacting protein 2 OS=Branchiostoma belcheri OX=7741 GN=LOC109470534 PE=4 SV=1, Branchiostoma_belcheri_tr_A0A6P4Z984_A0A6P4Z984_BRABE tr|A0A6P4Z984|A0A6P4Z984_BRABE Leucine-rich repeat-containing protein 4C-like OS=Branchiostoma belcheri OX=7741 GN=LOC109476672 PE=4 SV=1, Branchiostoma_belcheri_tr_A0A6P5ARY3_A0A6P5ARY3_BRABE tr|A0A6P5ARY3|A0A6P5ARY3_BRABE Leucine-rich repeat and immunoglobulin-like domain-containing nogo receptor-interacting protein 2 OS=Branchiostoma belcheri OX=7741 GN=LOC109486442 PE=4 SV=1, Branchiostoma_belcheri_tr_A0A6P4YS69_A0A6P4YS69_BRABE tr|A0A6P4YS69|A0A6P4YS69_BRABE Leucine-rich repeat-containing protein 15-like OS=Branchiostoma belcheri OX=7741 GN=LOC109472058 PE=4 SV=1, Branchiostoma_belcheri_tr_A0A6P4XAE2_A0A6P4XAE2_BRABE tr|A0A6P4XAE2|A0A6P4XAE2_BRABE Leucine-rich repeat-containing protein 15-like OS=Branchiostoma belcheri OX=7741 GN=LOC109461493 PE=4 SV=1, Branchiostoma_belcheri_tr_A0A6P4ZSX0_A0A6P4ZSX0_BRABE tr|A0A6P4ZSX0|A0A6P4ZSX0_BRABE SLIT and NTRK-like protein 1 OS=Branchiostoma belcheri OX=7741 GN=LOC109481800 PE=4 SV=1
OG0000088	Schmidtea_mediterranea_maker-scaffold2562-augustus-gene-0.30-mRNA-1 maker-scaffold2562-augustus-gene-0.30-mRNA-1 protein AED_0.31 eAED_0.32 QI_0|1|0.75|1|0.66|0.5|4|179|609, Schmidtea_mediterranea_maker-scaffold2562-snap-gene-0.37-mRNA-1 maker-scaffold2562-snap-gene-0.37-mRNA-1 protein AED_0.07 eAED_0.09 QI_0|0.33|0.14|1|0.66|0.57|7|0|1127, Schmidtea_mediterranea_maker-scaffold2562-snap-gene-0.38-mRNA-1 maker-scaffold2562-snap-gene-0.38-mRNA-1 protein AED_0.62 eAED_0.63 QI_0|0|0|0.16|1|1|6|0|510, Schmidtea_mediterranea_maker-scaffold4198-snap-gene-0.24-mRNA-1 maker-scaffold4198-snap-gene-0.24-mRNA-1 protein AED_0.16 eAED_0.16 QI_0|0.5|0.2|0.8|0.75|0.8|5|0|730	Branchiostoma_belcheri_tr_A0A6P5AJ26_A0A6P5AJ26_BRABE tr|A0A6P5AJ26|A0A6P5AJ26_BRABE Spondin-1-like isoform X1 OS=Branchiostoma belcheri OX=7741 GN=LOC109486813 PE=4 SV=1, Branchiostoma_belcheri_tr_A0A6P4ZYP0_A0A6P4ZYP0_BRABE tr|A0A6P4ZYP0|A0A6P4ZYP0_BRABE Spondin-1-like isoform X2 OS=Branchiostoma belcheri OX=7741 GN=LOC109486813 PE=4 SV=1, Branchiostoma_belcheri_tr_A0A6P4ZII0_A0A6P4ZII0_BRABE tr|A0A6P4ZII0|A0A6P4ZII0_BRABE Uncharacterized protein LOC109477214 isoform X1 OS=Branchiostoma belcheri OX=7741 GN=LOC109477214 PE=4 SV=1, Branchiostoma_belcheri_tr_A0A6P4YWW2_A0A6P4YWW2_BRABE tr|A0A6P4YWW2|A0A6P4YWW2_BRABE Uncharacterized protein LOC109477214 isoform X2 OS=Branchiostoma belcheri OX=7741 GN=LOC109477214 PE=4 SV=1, Branchiostoma_belcheri_tr_A0A6P4ZPY5_A0A6P4ZPY5_BRABE tr|A0A6P4ZPY5|A0A6P4ZPY5_BRABE Spondin-1 OS=Branchiostoma belcheri OX=7741 GN=LOC109476505 PE=4 SV=1, Branchiostoma_belcheri_tr_A0A6P4ZTW0_A0A6P4ZTW0_BRABE tr|A0A6P4ZTW0|A0A6P4ZTW0_BRABE Spondin-1 OS=Branchiostoma belcheri OX=7741 GN=LOC109476505 PE=4 SV=1
OG0000093	Schmidtea_mediterranea_maker-scaffold13106-augustus-gene-0.13-mRNA-1 maker-scaffold13106-augustus-gene-0.13-mRNA-1 protein AED_0.40 eAED_0.40 QI_0|0|0|0.66|1|1|3|0|99, Schmidtea_mediterranea_maker-scaffold13106-augustus-gene-0.14-mRNA-1 maker-scaffold13106-augustus-gene-0.14-mRNA-1 protein AED_0.40 eAED_0.40 QI_0|0|0|0.66|1|1|3|0|99, Schmidtea_mediterranea_maker-scaffold9678-snap-gene-0.36-mRNA-1 maker-scaffold9678-snap-gene-0.36-mRNA-1 protein AED_0.24 eAED_0.24 QI_0|0.4|0.33|0.5|0.8|0.83|6|359|259, Schmidtea_mediterranea_augustus_masked-scaffold17106-processed-gene-0.0-mRNA-1 augustus_masked-scaffold17106-processed-gene-0.0-mRNA-1 protein AED_0.07 eAED_0.07 QI_0|0|0|1|1|1|2|0|77	Branchiostoma_belcheri_tr_A0A6P5AZZ3_A0A6P5AZZ3_BRABE tr|A0A6P5AZZ3|A0A6P5AZZ3_BRABE Cystatin-B-like OS=Branchiostoma belcheri OX=7741 GN=LOC109488080 PE=3 SV=1, Branchiostoma_belcheri_tr_A0A6P5ADJ1_A0A6P5ADJ1_BRABE tr|A0A6P5ADJ1|A0A6P5ADJ1_BRABE Cystatin-B-like OS=Branchiostoma belcheri OX=7741 GN=LOC109488081 PE=3 SV=1, Branchiostoma_belcheri_tr_A0A6P5ANS3_A0A6P5ANS3_BRABE tr|A0A6P5ANS3|A0A6P5ANS3_BRABE Cystatin-B-like OS=Branchiostoma belcheri OX=7741 GN=LOC109488082 PE=3 SV=1
OG0000094	Schmidtea_mediterranea_maker-scaffold3545-snap-gene-0.55-mRNA-1 maker-scaffold3545-snap-gene-0.55-mRNA-1 protein AED_0.30 eAED_0.30 QI_137|0.57|0.5|1|0.28|0.25|8|0|278	Branchiostoma_belcheri_tr_A0A6P4ZV84_A0A6P4ZV84_BRABE tr|A0A6P4ZV84|A0A6P4ZV84_BRABE Leucine-rich repeat and calponin homology domain-containing protein 1-like isoform X3 OS=Branchiostoma belcheri OX=7741 GN=LOC109477857 PE=4 SV=1, Branchiostoma_belcheri_tr_A0A6P4YZX5_A0A6P4YZX5_BRABE tr|A0A6P4YZX5|A0A6P4YZX5_BRABE Leucine-rich repeat and calponin homology domain-containing protein 3-like isoform X1 OS=Branchiostoma belcheri OX=7741 GN=LOC109477857 PE=4 SV=1, Branchiostoma_belcheri_tr_A0A6P4ZZ32_A0A6P4ZZ32_BRABE tr|A0A6P4ZZ32|A0A6P4ZZ32_BRABE Leucine-rich repeat and calponin homology domain-containing protein 1-like isoform X2 OS=Branchiostoma belcheri OX=7741 GN=LOC109477857 PE=4 SV=1, Branchiostoma_belcheri_tr_A0A6P4ZDS1_A0A6P4ZDS1_BRABE tr|A0A6P4ZDS1|A0A6P4ZDS1_BRABE Leucine-rich repeat and calponin homology domain-containing protein 1-like isoform X4 OS=Branchiostoma belcheri OX=7741 GN=LOC109477857 PE=4 SV=1, Branchiostoma_belcheri_tr_A0A6P4ZZ36_A0A6P4ZZ36_BRABE tr|A0A6P4ZZ36|A0A6P4ZZ36_BRABE Leucine-rich repeat and calponin homology domain-containing protein 1-like isoform X7 OS=Branchiostoma belcheri OX=7741 GN=LOC109477857 PE=4 SV=1, Branchiostoma_belcheri_tr_A0A6P4YZY0_A0A6P4YZY0_BRABE tr|A0A6P4YZY0|A0A6P4YZY0_BRABE Leucine-rich repeat and calponin homology domain-containing protein 1-like isoform X6 OS=Branchiostoma belcheri OX=7741 GN=LOC109477857 PE=4 SV=1, Branchiostoma_belcheri_tr_A0A6P4ZLE9_A0A6P4ZLE9_BRABE tr|A0A6P4ZLE9|A0A6P4ZLE9_BRABE Leucine-rich repeat and calponin homology domain-containing protein 3-like isoform X5 OS=Branchiostoma belcheri OX=7741 GN=LOC109477857 PE=4 SV=1
OG0000101	Schmidtea_mediterranea_maker-scaffold1238-augustus-gene-0.40-mRNA-1 maker-scaffold1238-augustus-gene-0.40-mRNA-1 protein AED_0.10 eAED_0.10 QI_905|0.66|0.74|0.80|0.63|0.64|31|1053|2217	Branchiostoma_belcheri_tr_A0A6P4YDX7_A0A6P4YDX7_BRABE tr|A0A6P4YDX7|A0A6P4YDX7_BRABE Nephrin-like isoform X6 OS=Branchiostoma belcheri OX=7741 GN=LOC109472226 PE=4 SV=1, Branchiostoma_belcheri_tr_A0A6P4ZCI1_A0A6P4ZCI1_BRABE tr|A0A6P4ZCI1|A0A6P4ZCI1_BRABE Nephrin-like isoform X7 OS=Branchiostoma belcheri OX=7741 GN=LOC109472226 PE=4 SV=1, Branchiostoma_belcheri_tr_A0A6P4YDX0_A0A6P4YDX0_BRABE tr|A0A6P4YDX0|A0A6P4YDX0_BRABE Nephrin-like isoform X1 OS=Branchiostoma belcheri OX=7741 GN=LOC109472226 PE=4 SV=1, Branchiostoma_belcheri_tr_A0A6P4YDX4_A0A6P4YDX4_BRABE tr|A0A6P4YDX4|A0A6P4YDX4_BRABE Nephrin-like isoform X3 OS=Branchiostoma belcheri OX=7741 GN=LOC109472226 PE=4 SV=1, Branchiostoma_belcheri_tr_A0A6P4YSQ5_A0A6P4YSQ5_BRABE tr|A0A6P4YSQ5|A0A6P4YSQ5_BRABE Nephrin-like isoform X4 OS=Branchiostoma belcheri OX=7741 GN=LOC109472226 PE=4 SV=1, Branchiostoma_belcheri_tr_A0A6P4ZCH1_A0A6P4ZCH1_BRABE tr|A0A6P4ZCH1|A0A6P4ZCH1_BRABE Nephrin-like isoform X2 OS=Branchiostoma belcheri OX=7741 GN=LOC109472226 PE=4 SV=1, Branchiostoma_belcheri_tr_A0A6P4Z0C2_A0A6P4Z0C2_BRABE tr|A0A6P4Z0C2|A0A6P4Z0C2_BRABE Nephrin-like isoform X5 OS=Branchiostoma belcheri OX=7741 GN=LOC109472226 PE=4 SV=1
OG0000111	Schmidtea_mediterranea_maker-scaffold1368-snap-gene-2.30-mRNA-1 maker-scaffold1368-snap-gene-2.30-mRNA-1 protein AED_0.26 eAED_0.26 QI_0|0.5|0.57|1|0.16|0.57|7|375|480	Branchiostoma_belcheri_tr_A0A6P4XRN8_A0A6P4XRN8_BRABE tr|A0A6P4XRN8|A0A6P4XRN8_BRABE Activating transcription factor 7-interacting protein 1-like OS=Branchiostoma belcheri OX=7741 GN=LOC109462627 PE=4 SV=1, Branchiostoma_belcheri_tr_A0A6P4YWE8_A0A6P4YWE8_BRABE tr|A0A6P4YWE8|A0A6P4YWE8_BRABE Activating transcription factor 7-interacting protein 1-like OS=Branchiostoma belcheri OX=7741 GN=LOC109471227 PE=4 SV=1
OG0000113	Schmidtea_mediterranea_snap_masked-scaffold2036-processed-gene-0.23-mRNA-1 snap_masked-scaffold2036-processed-gene-0.23-mRNA-1 protein AED_0.14 eAED_0.14 QI_2086|0.25|0.23|0.28|1|1|21|0|917	Branchiostoma_belcheri_tr_A0A6P4YHR3_A0A6P4YHR3_BRABE tr|A0A6P4YHR3|A0A6P4YHR3_BRABE Titin-like OS=Branchiostoma belcheri OX=7741 GN=LOC109465444 PE=4 SV=1, Branchiostoma_belcheri_tr_A0A6P4ZDK7_A0A6P4ZDK7_BRABE tr|A0A6P4ZDK7|A0A6P4ZDK7_BRABE Fibronectin type-III domain-containing protein 3A-like isoform X1 OS=Branchiostoma belcheri OX=7741 GN=LOC109477817 PE=4 SV=1, Branchiostoma_belcheri_tr_A0A6P4ZL90_A0A6P4ZL90_BRABE tr|A0A6P4ZL90|A0A6P4ZL90_BRABE Fibronectin type-III domain-containing protein 3A-like isoform X2 OS=Branchiostoma belcheri OX=7741 GN=LOC109477817 PE=4 SV=1
OG0000114	Schmidtea_mediterranea_maker-scaffold3444-snap-gene-0.54-mRNA-1 maker-scaffold3444-snap-gene-0.54-mRNA-1 protein AED_0.20 eAED_0.21 QI_0|0.71|0.62|1|0.71|0.62|8|144|1028	Branchiostoma_belcheri_tr_A0A6P4Z042_A0A6P4Z042_BRABE tr|A0A6P4Z042|A0A6P4Z042_BRABE Host cell factor-like OS=Branchiostoma belcheri OX=7741 GN=LOC109468977 PE=4 SV=1
OG0000120	Schmidtea_mediterranea_maker-scaffold913-augustus-gene-0.3-mRNA-1 maker-scaffold913-augustus-gene-0.3-mRNA-1 protein AED_0.01 eAED_0.01 QI_1098|1|1|1|0.5|0.33|3|511|65	Branchiostoma_belcheri_tr_A0A6P4ZSM1_A0A6P4ZSM1_BRABE tr|A0A6P4ZSM1|A0A6P4ZSM1_BRABE Syndecan OS=Branchiostoma belcheri OX=7741 GN=LOC109479555 PE=3 SV=1, Branchiostoma_belcheri_tr_A0A6P4Z6M8_A0A6P4Z6M8_BRABE tr|A0A6P4Z6M8|A0A6P4Z6M8_BRABE Syndecan OS=Branchiostoma belcheri OX=7741 GN=LOC109479555 PE=3 SV=1
OG0000129	Schmidtea_mediterranea_maker-scaffold7616-snap-gene-0.60-mRNA-1 maker-scaffold7616-snap-gene-0.60-mRNA-1 protein AED_0.03 eAED_0.03 QI_28|0.94|0.94|1|0.62|0.75|36|74|3676	Branchiostoma_belcheri_tr_A0A6P4ZU97_A0A6P4ZU97_BRABE tr|A0A6P4ZU97|A0A6P4ZU97_BRABE Uncharacterized protein LOC109477618 OS=Branchiostoma belcheri OX=7741 GN=LOC109477618 PE=4 SV=1
OG0000133	Schmidtea_mediterranea_maker-scaffold38628-augustus-gene-0.4-mRNA-1 maker-scaffold38628-augustus-gene-0.4-mRNA-1 protein AED_0.06 eAED_0.06 QI_0|0|0|0.5|1|1|2|0|1488, Schmidtea_mediterranea_maker-scaffold11278-augustus-gene-0.66-mRNA-1 maker-scaffold11278-augustus-gene-0.66-mRNA-1 protein AED_0.11 eAED_0.12 QI_0|0.44|0.4|0.9|0.88|0.9|10|504|578	Branchiostoma_belcheri_tr_A0A6P4YSZ8_A0A6P4YSZ8_BRABE tr|A0A6P4YSZ8|A0A6P4YSZ8_BRABE LOW QUALITY PROTEIN_ leucine-rich repeat-containing protein 9-like OS=Branchiostoma belcheri OX=7741 GN=LOC109472272 PE=4 SV=1
OG0000134	Schmidtea_mediterranea_maker-scaffold18052-snap-gene-0.20-mRNA-1 maker-scaffold18052-snap-gene-0.20-mRNA-1 protein AED_0.11 eAED_0.32 QI_0|0.6|0.57|0.85|0.6|0.71|21|37|4030	Branchiostoma_belcheri_tr_A0A6P5AKU1_A0A6P5AKU1_BRABE tr|A0A6P5AKU1|A0A6P5AKU1_BRABE Midasin OS=Branchiostoma belcheri OX=7741 GN=LOC109487306 PE=3 SV=1
OG0000141	Schmidtea_mediterranea_maker-scaffold11956-snap-gene-0.30-mRNA-1 maker-scaffold11956-snap-gene-0.30-mRNA-1 protein AED_0.14 eAED_0.14 QI_111|0.75|0.8|0.8|0.5|0.6|5|0|273	Branchiostoma_belcheri_tr_A0A6P5A2L2_A0A6P5A2L2_BRABE tr|A0A6P5A2L2|A0A6P5A2L2_BRABE Connective tissue growth factor-like OS=Branchiostoma belcheri OX=7741 GN=LOC109484672 PE=3 SV=1
OG0000152	Schmidtea_mediterranea_maker-scaffold1162-snap-gene-0.32-mRNA-1 maker-scaffold1162-snap-gene-0.32-mRNA-1 protein AED_0.16 eAED_0.17 QI_0|0|0|0.66|0.5|0.66|9|0|492	Branchiostoma_belcheri_tr_A0A6P4XD39_A0A6P4XD39_BRABE tr|A0A6P4XD39|A0A6P4XD39_BRABE Leucine-rich repeat protein SHOC-2-like OS=Branchiostoma belcheri OX=7741 GN=LOC109462359 PE=4 SV=1
OG0000156	Schmidtea_mediterranea_maker-scaffold12426-augustus-gene-0.24-mRNA-1 maker-scaffold12426-augustus-gene-0.24-mRNA-1 protein AED_0.01 eAED_0.01 QI_102|1|1|1|0|0|2|41|456	Branchiostoma_belcheri_tr_A0A6P4Y1B4_A0A6P4Y1B4_BRABE tr|A0A6P4Y1B4|A0A6P4Y1B4_BRABE Microfibrillar-associated protein 1-like OS=Branchiostoma belcheri OX=7741 GN=LOC109468806 PE=3 SV=1
OG0000166	Schmidtea_mediterranea_maker-scaffold2622-augustus-gene-0.20-mRNA-1 maker-scaffold2622-augustus-gene-0.20-mRNA-1 protein AED_0.00 eAED_0.00 QI_387|0.5|0.66|1|1|1|3|193|346	Branchiostoma_belcheri_tr_A0A6P4YYN8_A0A6P4YYN8_BRABE tr|A0A6P4YYN8|A0A6P4YYN8_BRABE Secreted frizzled-related protein 2-like isoform X1 OS=Branchiostoma belcheri OX=7741 GN=LOC109477586 PE=3 SV=1, Branchiostoma_belcheri_tr_A0A6P4ZY26_A0A6P4ZY26_BRABE tr|A0A6P4ZY26|A0A6P4ZY26_BRABE Secreted frizzled-related protein 2-like isoform X3 OS=Branchiostoma belcheri OX=7741 GN=LOC109477586 PE=3 SV=1
OG0000171	Schmidtea_mediterranea_maker-scaffold1856-augustus-gene-1.52-mRNA-1 maker-scaffold1856-augustus-gene-1.52-mRNA-1 protein AED_0.15 eAED_0.15 QI_138|0.5|0.8|0.8|0.5|0.6|5|1177|445	Branchiostoma_belcheri_tr_A0A6P4XBR6_A0A6P4XBR6_BRABE tr|A0A6P4XBR6|A0A6P4XBR6_BRABE Peptide-N_4_-_N-acetyl-beta-glucosaminyl_asparagine amidase OS=Branchiostoma belcheri OX=7741 GN=LOC109461889 PE=3 SV=1
OG0000177	Schmidtea_mediterranea_maker-scaffold2908-augustus-gene-0.26-mRNA-1 maker-scaffold2908-augustus-gene-0.26-mRNA-1 protein AED_0.00 eAED_0.00 QI_148|1|1|1|1|1|2|57|318	Branchiostoma_belcheri_tr_A0A6P4ZLV0_A0A6P4ZLV0_BRABE tr|A0A6P4ZLV0|A0A6P4ZLV0_BRABE Protein phosphatase 1 regulatory subunit 7-like OS=Branchiostoma belcheri OX=7741 GN=LOC109480060 PE=4 SV=1
OG0000178	Schmidtea_mediterranea_maker-scaffold16961-snap-gene-0.42-mRNA-1 maker-scaffold16961-snap-gene-0.42-mRNA-1 protein AED_0.11 eAED_0.11 QI_44|0.85|0.77|0.95|0.71|0.95|22|0|1896, Schmidtea_mediterranea_maker-scaffold1813-snap-gene-1.37-mRNA-1 maker-scaffold1813-snap-gene-1.37-mRNA-1 protein AED_0.01 eAED_0.01 QI_361|0.9|0.81|1|0.7|0.81|11|154|1476	Branchiostoma_belcheri_tr_A0A6P4ZHR8_A0A6P4ZHR8_BRABE tr|A0A6P4ZHR8|A0A6P4ZHR8_BRABE Kyphoscoliosis peptidase-like OS=Branchiostoma belcheri OX=7741 GN=LOC109478948 PE=4 SV=1, Branchiostoma_belcheri_tr_A0A6P4YGL6_A0A6P4YGL6_BRABE tr|A0A6P4YGL6|A0A6P4YGL6_BRABE Kyphoscoliosis peptidase-like OS=Branchiostoma belcheri OX=7741 GN=LOC109465214 PE=4 SV=1, Branchiostoma_belcheri_tr_A0A6P4YLQ1_A0A6P4YLQ1_BRABE tr|A0A6P4YLQ1|A0A6P4YLQ1_BRABE LOW QUALITY PROTEIN_ uncharacterized protein LOC109465307 OS=Branchiostoma belcheri OX=7741 GN=LOC109465307 PE=4 SV=1
OG0000192	Schmidtea_mediterranea_snap_masked-scaffold10663-processed-gene-0.9-mRNA-1 snap_masked-scaffold10663-processed-gene-0.9-mRNA-1 protein AED_0.09 eAED_0.09 QI_518|1|1|1|0.5|0.63|11|203|1281	Branchiostoma_belcheri_tr_A0A6P4Y7X5_A0A6P4Y7X5_BRABE tr|A0A6P4Y7X5|A0A6P4Y7X5_BRABE Protein flightless-1 homolog isoform X3 OS=Branchiostoma belcheri OX=7741 GN=LOC109462755 PE=4 SV=1, Branchiostoma_belcheri_tr_A0A6P4YD87_A0A6P4YD87_BRABE tr|A0A6P4YD87|A0A6P4YD87_BRABE Protein flightless-1 homolog isoform X1 OS=Branchiostoma belcheri OX=7741 GN=LOC109462755 PE=4 SV=1
OG0000195	Schmidtea_mediterranea_snap_masked-scaffold9675-processed-gene-0.6-mRNA-1 snap_masked-scaffold9675-processed-gene-0.6-mRNA-1 protein AED_0.06 eAED_0.06 QI_133|1|1|1|0.75|0.55|9|598|273	Branchiostoma_belcheri_tr_A0A6P4XWY1_A0A6P4XWY1_BRABE tr|A0A6P4XWY1|A0A6P4XWY1_BRABE Ras suppressor protein 1-like OS=Branchiostoma belcheri OX=7741 GN=LOC109464096 PE=4 SV=1
OG0000199	Schmidtea_mediterranea_augustus_masked-scaffold9704-processed-gene-0.0-mRNA-1 augustus_masked-scaffold9704-processed-gene-0.0-mRNA-1 protein AED_0.13 eAED_0.13 QI_0|0|0|0.5|1|1|2|0|354, Schmidtea_mediterranea_maker-scaffold9367-augustus-gene-0.26-mRNA-1 maker-scaffold9367-augustus-gene-0.26-mRNA-1 protein AED_0.12 eAED_0.12 QI_0|0|0.5|1|0|0.5|2|132|286, Schmidtea_mediterranea_maker-scaffold8689-snap-gene-0.34-mRNA-1 maker-scaffold8689-snap-gene-0.34-mRNA-1 protein AED_0.22 eAED_0.22 QI_0|0|0|0.22|1|1|9|0|350	Branchiostoma_belcheri_tr_A0A6P5AWD0_A0A6P5AWD0_BRABE tr|A0A6P5AWD0|A0A6P5AWD0_BRABE 26S proteasome non-ATPase regulatory subunit 4 OS=Branchiostoma belcheri OX=7741 GN=LOC109486814 PE=3 SV=1
OG0000209	Schmidtea_mediterranea_maker-scaffold5436-augustus-gene-0.16-mRNA-1 maker-scaffold5436-augustus-gene-0.16-mRNA-1 protein AED_0.24 eAED_0.24 QI_406|0.6|0.56|0.68|0.8|0.81|16|0|1330	Branchiostoma_belcheri_tr_A0A6P4ZDS6_A0A6P4ZDS6_BRABE tr|A0A6P4ZDS6|A0A6P4ZDS6_BRABE Integrator complex subunit 6-A-like OS=Branchiostoma belcheri OX=7741 GN=LOC109477860 PE=4 SV=1
OG0000210	Schmidtea_mediterranea_maker-scaffold25626-augustus-gene-0.17-mRNA-1 maker-scaffold25626-augustus-gene-0.17-mRNA-1 protein AED_0.19 eAED_0.19 QI_57|0.77|0.7|0.8|0.77|0.9|10|0|792	Branchiostoma_belcheri_tr_A0A6P4YF26_A0A6P4YF26_BRABE tr|A0A6P4YF26|A0A6P4YF26_BRABE X-ray radiation resistance-associated protein 1-like OS=Branchiostoma belcheri OX=7741 GN=LOC109472485 PE=4 SV=1
OG0000248	Schmidtea_mediterranea_maker-scaffold12332-augustus-gene-1.33-mRNA-1 maker-scaffold12332-augustus-gene-1.33-mRNA-1 protein AED_0.31 eAED_0.31 QI_175|0.55|0.63|0.84|0.27|0.63|19|168|852	Branchiostoma_belcheri_tr_A0A6P5ALF4_A0A6P5ALF4_BRABE tr|A0A6P5ALF4|A0A6P5ALF4_BRABE Anosmin-1-like OS=Branchiostoma belcheri OX=7741 GN=LOC109484970 PE=4 SV=1
OG0000274	Schmidtea_mediterranea_maker-scaffold18081-snap-gene-0.31-mRNA-1 maker-scaffold18081-snap-gene-0.31-mRNA-1 protein AED_0.21 eAED_0.21 QI_0|0|0|0.37|1|1|8|0|332	Branchiostoma_belcheri_tr_A0A6P4Y0A0_A0A6P4Y0A0_BRABE tr|A0A6P4Y0A0|A0A6P4Y0A0_BRABE Leucine-rich repeat-containing protein 23-like OS=Branchiostoma belcheri OX=7741 GN=LOC109468512 PE=4 SV=1
OG0000282	Schmidtea_mediterranea_maker-scaffold3815-snap-gene-1.62-mRNA-1 maker-scaffold3815-snap-gene-1.62-mRNA-1 protein AED_0.17 eAED_0.21 QI_7|0.25|0.4|0.8|0.25|0.4|5|37|540	Branchiostoma_belcheri_tr_A0A6P5A9R5_A0A6P5A9R5_BRABE tr|A0A6P5A9R5|A0A6P5A9R5_BRABE Leucine-rich repeat-containing protein 47-like OS=Branchiostoma belcheri OX=7741 GN=LOC109484176 PE=4 SV=1
OG0000291	Schmidtea_mediterranea_maker-scaffold4965-augustus-gene-0.21-mRNA-1 maker-scaffold4965-augustus-gene-0.21-mRNA-1 protein AED_0.00 eAED_0.00 QI_218|1|1|1|1|1|6|22|452	Branchiostoma_belcheri_tr_A0A6P4ZJ43_A0A6P4ZJ43_BRABE tr|A0A6P4ZJ43|A0A6P4ZJ43_BRABE Mucin-5AC-like OS=Branchiostoma belcheri OX=7741 GN=LOC109482834 PE=4 SV=1, Branchiostoma_belcheri_tr_A0A6P4XKU2_A0A6P4XKU2_BRABE tr|A0A6P4XKU2|A0A6P4XKU2_BRABE Interphotoreceptor matrix proteoglycan 2-like OS=Branchiostoma belcheri OX=7741 GN=LOC109464607 PE=4 SV=1
OG0000371	Schmidtea_mediterranea_maker-scaffold16205-augustus-gene-1.38-mRNA-1 maker-scaffold16205-augustus-gene-1.38-mRNA-1 protein AED_0.00 eAED_0.00 QI_117|1|1|1|0.57|0.86|15|371|685	Branchiostoma_belcheri_tr_A0A6P5AZZ5_A0A6P5AZZ5_BRABE tr|A0A6P5AZZ5|A0A6P5AZZ5_BRABE LOW QUALITY PROTEIN_ uncharacterized protein LOC109488084 OS=Branchiostoma belcheri OX=7741 GN=LOC109488084 PE=4 SV=1
OG0000449	Schmidtea_mediterranea_maker-scaffold6683-augustus-gene-0.10-mRNA-1 maker-scaffold6683-augustus-gene-0.10-mRNA-1 protein AED_0.33 eAED_0.33 QI_0|0.5|0.66|0.66|0.5|0.66|3|5|216	Branchiostoma_belcheri_tr_A0A6P4YZS2_A0A6P4YZS2_BRABE tr|A0A6P4YZS2|A0A6P4YZS2_BRABE Neurogenic locus notch homolog protein 1-like OS=Branchiostoma belcheri OX=7741 GN=LOC109477820 PE=4 SV=1, Branchiostoma_belcheri_tr_A0A6P4XW49_A0A6P4XW49_BRABE tr|A0A6P4XW49|A0A6P4XW49_BRABE Neurogenic locus notch homolog protein 3-like OS=Branchiostoma belcheri OX=7741 GN=LOC109463847 PE=4 SV=1
OG0000508	Schmidtea_mediterranea_maker-scaffold2512-snap-gene-0.34-mRNA-1 maker-scaffold2512-snap-gene-0.34-mRNA-1 protein AED_0.52 eAED_0.59 QI_0|0.18|0.25|0.33|1|1|12|0|370	Branchiostoma_belcheri_tr_A0A6P4Y1E3_A0A6P4Y1E3_BRABE tr|A0A6P4Y1E3|A0A6P4Y1E3_BRABE Cubilin-like OS=Branchiostoma belcheri OX=7741 GN=LOC109468843 PE=4 SV=1
OG0000575	Schmidtea_mediterranea_maker-scaffold5053-snap-gene-0.61-mRNA-1 maker-scaffold5053-snap-gene-0.61-mRNA-1 protein AED_0.33 eAED_0.38 QI_0|0.3|0.45|0.81|0.4|0.45|11|253|658, Schmidtea_mediterranea_snap_masked-scaffold10953-processed-gene-0.9-mRNA-1 snap_masked-scaffold10953-processed-gene-0.9-mRNA-1 protein AED_0.22 eAED_0.22 QI_0|0|0|0.2|1|1|10|0|681	Branchiostoma_belcheri_tr_A0A6P5A1C4_A0A6P5A1C4_BRABE tr|A0A6P5A1C4|A0A6P5A1C4_BRABE Leucine-rich repeat-containing protein 4B-like isoform X1 OS=Branchiostoma belcheri OX=7741 GN=LOC109478480 PE=4 SV=1, Branchiostoma_belcheri_tr_A0A6P4ZFS5_A0A6P4ZFS5_BRABE tr|A0A6P4ZFS5|A0A6P4ZFS5_BRABE Leucine-rich repeat-containing protein 4B-like isoform X2 OS=Branchiostoma belcheri OX=7741 GN=LOC109478480 PE=4 SV=1
