Orthogroup	Cnidaria_Hydrozoa_Clytia_hemispherica	Porifera_Demospongiae_Amphimedon_queenslandica
OG0000010	Clytia_hemispherica_TCONS_00073670-protein TCONS_00073670-protein, Clytia_hemispherica_TCONS_00073671-protein TCONS_00073671-protein	Amphimedon_queenslandica_tr_A0A1X7UPV7_A0A1X7UPV7_AMPQE tr_A0A1X7UPV7_A0A1X7UPV7_AMPQE Uncharacterized protein OS=Amphimedon queenslandica OX=400682 PE=4 SV=1, Amphimedon_queenslandica_tr_A0A1X7SQ55_A0A1X7SQ55_AMPQE tr_A0A1X7SQ55_A0A1X7SQ55_AMPQE Uncharacterized protein OS=Amphimedon queenslandica OX=400682 PE=4 SV=1
OG0000013	Clytia_hemispherica_TCONS_00050019-protein TCONS_00050019-protein	Amphimedon_queenslandica_tr_A0A1X7UFS4_A0A1X7UFS4_AMPQE tr_A0A1X7UFS4_A0A1X7UFS4_AMPQE Protein Wnt OS=Amphimedon queenslandica OX=400682 PE=3 SV=1, Amphimedon_queenslandica_tr_A9YRX3_A9YRX3_AMPQE tr_A9YRX3_A9YRX3_AMPQE Protein Wnt OS=Amphimedon queenslandica OX=400682 GN=100641115 PE=3 SV=1
OG0000013	Clytia_hemispherica_TCONS_00073720-protein TCONS_00073720-protein	Amphimedon_queenslandica_tr_A0A1X7VSA1_A0A1X7VSA1_AMPQE tr_A0A1X7VSA1_A0A1X7VSA1_AMPQE Protein Wnt OS=Amphimedon queenslandica OX=400682 PE=3 SV=1
OG0000014	Clytia_hemispherica_TCONS_00034923-protein TCONS_00034923-protein, Clytia_hemispherica_TCONS_00022833-protein TCONS_00022833-protein	Amphimedon_queenslandica_tr_A0A1X7U0W6_A0A1X7U0W6_AMPQE tr_A0A1X7U0W6_A0A1X7U0W6_AMPQE Uncharacterized protein OS=Amphimedon queenslandica OX=400682 GN=105314085 PE=4 SV=1
OG0000014	Clytia_hemispherica_TCONS_00008326-protein TCONS_00008326-protein, Clytia_hemispherica_TCONS_00055972-protein TCONS_00055972-protein, Clytia_hemispherica_TCONS_00024369-protein TCONS_00024369-protein, Clytia_hemispherica_TCONS_00024371-protein TCONS_00024371-protein, Clytia_hemispherica_TCONS_00024372-protein TCONS_00024372-protein	Amphimedon_queenslandica_tr_A0A1X7U5R5_A0A1X7U5R5_AMPQE tr_A0A1X7U5R5_A0A1X7U5R5_AMPQE Peptidase M12B domain-containing protein OS=Amphimedon queenslandica OX=400682 GN=100633222 PE=4 SV=1
OG0000018	Clytia_hemispherica_TCONS_00019092-protein TCONS_00019092-protein, Clytia_hemispherica_TCONS_00038451-protein TCONS_00038451-protein, Clytia_hemispherica_TCONS_00053338-protein TCONS_00053338-protein, Clytia_hemispherica_TCONS_00066533-protein TCONS_00066533-protein	Amphimedon_queenslandica_tr_A0A1X7URD2_A0A1X7URD2_AMPQE tr_A0A1X7URD2_A0A1X7URD2_AMPQE Uncharacterized protein OS=Amphimedon queenslandica OX=400682 GN=100636203 PE=4 SV=1, Amphimedon_queenslandica_tr_A0A1X7UQY5_A0A1X7UQY5_AMPQE tr_A0A1X7UQY5_A0A1X7UQY5_AMPQE Uncharacterized protein OS=Amphimedon queenslandica OX=400682 PE=4 SV=1
OG0000019	Clytia_hemispherica_TCONS_00061469-protein TCONS_00061469-protein	Amphimedon_queenslandica_tr_A0A1X7VB63_A0A1X7VB63_AMPQE tr_A0A1X7VB63_A0A1X7VB63_AMPQE TGF_BETA_2 domain-containing protein OS=Amphimedon queenslandica OX=400682 GN=105312033 PE=3 SV=1
OG0000019	Clytia_hemispherica_TCONS_00032606-protein TCONS_00032606-protein	Amphimedon_queenslandica_tr_A0A1X7VCN7_A0A1X7VCN7_AMPQE tr_A0A1X7VCN7_A0A1X7VCN7_AMPQE TGF_BETA_2 domain-containing protein OS=Amphimedon queenslandica OX=400682 GN=105311952 PE=3 SV=1
OG0000020	Clytia_hemispherica_TCONS_00072191-protein TCONS_00072191-protein	Amphimedon_queenslandica_tr_A0A1X7UIM6_A0A1X7UIM6_AMPQE tr_A0A1X7UIM6_A0A1X7UIM6_AMPQE Fibrillar collagen NC1 domain-containing protein OS=Amphimedon queenslandica OX=400682 PE=4 SV=1, Amphimedon_queenslandica_tr_A0A1X7UEW8_A0A1X7UEW8_AMPQE tr_A0A1X7UEW8_A0A1X7UEW8_AMPQE Fibrillar collagen NC1 domain-containing protein OS=Amphimedon queenslandica OX=400682 GN=100642101 PE=4 SV=1
OG0000021	Clytia_hemispherica_TCONS_00061561-protein TCONS_00061561-protein	Amphimedon_queenslandica_tr_A0A1X7TVZ2_A0A1X7TVZ2_AMPQE tr_A0A1X7TVZ2_A0A1X7TVZ2_AMPQE Thrombomodulin OS=Amphimedon queenslandica OX=400682 PE=4 SV=1
OG0000021	Clytia_hemispherica_TCONS_00037916-protein TCONS_00037916-protein	Amphimedon_queenslandica_tr_A0A1X7SJY3_A0A1X7SJY3_AMPQE tr_A0A1X7SJY3_A0A1X7SJY3_AMPQE EGF-like domain-containing protein OS=Amphimedon queenslandica OX=400682 PE=4 SV=1, Amphimedon_queenslandica_tr_A0A1X7SJQ5_A0A1X7SJQ5_AMPQE tr_A0A1X7SJQ5_A0A1X7SJQ5_AMPQE EGF-like domain-containing protein OS=Amphimedon queenslandica OX=400682 PE=4 SV=1, Amphimedon_queenslandica_tr_A0A1X7TB95_A0A1X7TB95_AMPQE tr_A0A1X7TB95_A0A1X7TB95_AMPQE Uncharacterized protein OS=Amphimedon queenslandica OX=400682 PE=4 SV=1
OG0000022	Clytia_hemispherica_TCONS_00055551-protein TCONS_00055551-protein	Amphimedon_queenslandica_tr_A0A1X7VQ74_A0A1X7VQ74_AMPQE tr_A0A1X7VQ74_A0A1X7VQ74_AMPQE Annexin OS=Amphimedon queenslandica OX=400682 GN=100638289 PE=3 SV=1
OG0000024	Clytia_hemispherica_TCONS_00000826-protein TCONS_00000826-protein, Clytia_hemispherica_TCONS_00051917-protein TCONS_00051917-protein, Clytia_hemispherica_TCONS_00016849-protein TCONS_00016849-protein, Clytia_hemispherica_TCONS_00005637-protein TCONS_00005637-protein, Clytia_hemispherica_TCONS_00018835-protein TCONS_00018835-protein, Clytia_hemispherica_TCONS_00055942-protein TCONS_00055942-protein	Amphimedon_queenslandica_tr_A0A1X7VFM2_A0A1X7VFM2_AMPQE tr_A0A1X7VFM2_A0A1X7VFM2_AMPQE Uncharacterized protein OS=Amphimedon queenslandica OX=400682 GN=100635554 PE=4 SV=1
