Orthogroup	Cnidaria_Hydrozoa_Clytia_hemispherica	Porifera_Demospongiae_Amphimedon_queenslandica
OG0000030	Clytia_hemispherica_TCONS_00007497-protein TCONS_00007497-protein, Clytia_hemispherica_TCONS_00007500-protein TCONS_00007500-protein	Amphimedon_queenslandica_tr_A0A1X7VBP5_A0A1X7VBP5_AMPQE tr_A0A1X7VBP5_A0A1X7VBP5_AMPQE Uncharacterized protein OS=Amphimedon queenslandica OX=400682 GN=105311941 PE=4 SV=1, Amphimedon_queenslandica_tr_A0A1X7SR42_A0A1X7SR42_AMPQE tr_A0A1X7SR42_A0A1X7SR42_AMPQE Peptidase M12B domain-containing protein OS=Amphimedon queenslandica OX=400682 PE=4 SV=1, Amphimedon_queenslandica_tr_A0A1X7V044_A0A1X7V044_AMPQE tr_A0A1X7V044_A0A1X7V044_AMPQE Uncharacterized protein OS=Amphimedon queenslandica OX=400682 PE=4 SV=1
OG0000030	Clytia_hemispherica_TCONS_00004356-protein TCONS_00004356-protein, Clytia_hemispherica_TCONS_00028602-protein TCONS_00028602-protein	Amphimedon_queenslandica_tr_A0A1X7U7R3_A0A1X7U7R3_AMPQE tr_A0A1X7U7R3_A0A1X7U7R3_AMPQE Disintegrin domain-containing protein OS=Amphimedon queenslandica OX=400682 PE=4 SV=1, Amphimedon_queenslandica_tr_A0A1X7U550_A0A1X7U550_AMPQE tr_A0A1X7U550_A0A1X7U550_AMPQE Uncharacterized protein OS=Amphimedon queenslandica OX=400682 GN=100632085 PE=4 SV=1
OG0000032	Clytia_hemispherica_TCONS_00034838-protein TCONS_00034838-protein, Clytia_hemispherica_TCONS_00051558-protein TCONS_00051558-protein	Amphimedon_queenslandica_tr_A0A1X7TCP0_A0A1X7TCP0_AMPQE tr_A0A1X7TCP0_A0A1X7TCP0_AMPQE Uncharacterized protein OS=Amphimedon queenslandica OX=400682 PE=4 SV=1, Amphimedon_queenslandica_tr_A0A1X7T0X2_A0A1X7T0X2_AMPQE tr_A0A1X7T0X2_A0A1X7T0X2_AMPQE Uncharacterized protein OS=Amphimedon queenslandica OX=400682 PE=4 SV=1
OG0000034	Clytia_hemispherica_TCONS_00051590-protein TCONS_00051590-protein	Amphimedon_queenslandica_tr_A0A1X7UWV8_A0A1X7UWV8_AMPQE tr_A0A1X7UWV8_A0A1X7UWV8_AMPQE Uncharacterized protein OS=Amphimedon queenslandica OX=400682 GN=109581856 PE=4 SV=1, Amphimedon_queenslandica_tr_A0A1X7VPN4_A0A1X7VPN4_AMPQE tr_A0A1X7VPN4_A0A1X7VPN4_AMPQE Laminin EGF-like domain-containing protein OS=Amphimedon queenslandica OX=400682 PE=4 SV=1
OG0000034	Clytia_hemispherica_TCONS_00025513-protein TCONS_00025513-protein	Amphimedon_queenslandica_tr_A0A1X7TBK3_A0A1X7TBK3_AMPQE tr_A0A1X7TBK3_A0A1X7TBK3_AMPQE Uncharacterized protein OS=Amphimedon queenslandica OX=400682 PE=4 SV=1
OG0000036	Clytia_hemispherica_TCONS_00048494-protein TCONS_00048494-protein	Amphimedon_queenslandica_tr_A0A1X7UB01_A0A1X7UB01_AMPQE tr_A0A1X7UB01_A0A1X7UB01_AMPQE Uncharacterized protein OS=Amphimedon queenslandica OX=400682 PE=4 SV=1, Amphimedon_queenslandica_tr_A0A1X7UBI8_A0A1X7UBI8_AMPQE tr_A0A1X7UBI8_A0A1X7UBI8_AMPQE Uncharacterized protein OS=Amphimedon queenslandica OX=400682 PE=4 SV=1, Amphimedon_queenslandica_tr_A0A1X7SZB4_A0A1X7SZB4_AMPQE tr_A0A1X7SZB4_A0A1X7SZB4_AMPQE Uncharacterized protein OS=Amphimedon queenslandica OX=400682 PE=4 SV=1, Amphimedon_queenslandica_tr_A0A1X7V5F3_A0A1X7V5F3_AMPQE tr_A0A1X7V5F3_A0A1X7V5F3_AMPQE Uncharacterized protein OS=Amphimedon queenslandica OX=400682 PE=4 SV=1
OG0000036	Clytia_hemispherica_TCONS_00048163-protein TCONS_00048163-protein	Amphimedon_queenslandica_tr_A0A1X7V656_A0A1X7V656_AMPQE tr_A0A1X7V656_A0A1X7V656_AMPQE Uncharacterized protein OS=Amphimedon queenslandica OX=400682 PE=4 SV=1, Amphimedon_queenslandica_tr_A0A1X7UCB5_A0A1X7UCB5_AMPQE tr_A0A1X7UCB5_A0A1X7UCB5_AMPQE Uncharacterized protein OS=Amphimedon queenslandica OX=400682 PE=4 SV=1, Amphimedon_queenslandica_tr_A0A1X7TBI3_A0A1X7TBI3_AMPQE tr_A0A1X7TBI3_A0A1X7TBI3_AMPQE Uncharacterized protein OS=Amphimedon queenslandica OX=400682 PE=4 SV=1, Amphimedon_queenslandica_tr_A0A1X7V7J8_A0A1X7V7J8_AMPQE tr_A0A1X7V7J8_A0A1X7V7J8_AMPQE Uncharacterized protein OS=Amphimedon queenslandica OX=400682 GN=105312253 PE=4 SV=1, Amphimedon_queenslandica_tr_A0A1X7VV77_A0A1X7VV77_AMPQE tr_A0A1X7VV77_A0A1X7VV77_AMPQE Uncharacterized protein OS=Amphimedon queenslandica OX=400682 GN=109580237 PE=4 SV=1, Amphimedon_queenslandica_tr_A0A1X7TT31_A0A1X7TT31_AMPQE tr_A0A1X7TT31_A0A1X7TT31_AMPQE Uncharacterized protein OS=Amphimedon queenslandica OX=400682 PE=4 SV=1, Amphimedon_queenslandica_tr_A0A1X7TTE5_A0A1X7TTE5_AMPQE tr_A0A1X7TTE5_A0A1X7TTE5_AMPQE Uncharacterized protein OS=Amphimedon queenslandica OX=400682 PE=4 SV=1, Amphimedon_queenslandica_tr_A0A1X7TSV3_A0A1X7TSV3_AMPQE tr_A0A1X7TSV3_A0A1X7TSV3_AMPQE Uncharacterized protein OS=Amphimedon queenslandica OX=400682 PE=4 SV=1, Amphimedon_queenslandica_tr_A0A1X7VJK4_A0A1X7VJK4_AMPQE tr_A0A1X7VJK4_A0A1X7VJK4_AMPQE Uncharacterized protein OS=Amphimedon queenslandica OX=400682 PE=4 SV=1, Amphimedon_queenslandica_tr_A0A1X7T0G0_A0A1X7T0G0_AMPQE tr_A0A1X7T0G0_A0A1X7T0G0_AMPQE Uncharacterized protein OS=Amphimedon queenslandica OX=400682 PE=4 SV=1, Amphimedon_queenslandica_tr_A0A1X7SGQ6_A0A1X7SGQ6_AMPQE tr_A0A1X7SGQ6_A0A1X7SGQ6_AMPQE Uncharacterized protein OS=Amphimedon queenslandica OX=400682 PE=4 SV=1, Amphimedon_queenslandica_tr_A0A1X7T4Q7_A0A1X7T4Q7_AMPQE tr_A0A1X7T4Q7_A0A1X7T4Q7_AMPQE Uncharacterized protein OS=Amphimedon queenslandica OX=400682 PE=4 SV=1, Amphimedon_queenslandica_tr_A0A1X7U143_A0A1X7U143_AMPQE tr_A0A1X7U143_A0A1X7U143_AMPQE Uncharacterized protein OS=Amphimedon queenslandica OX=400682 PE=4 SV=1, Amphimedon_queenslandica_tr_A0A1X7SW10_A0A1X7SW10_AMPQE tr_A0A1X7SW10_A0A1X7SW10_AMPQE Uncharacterized protein OS=Amphimedon queenslandica OX=400682 PE=4 SV=1, Amphimedon_queenslandica_tr_A0A1X7UBP4_A0A1X7UBP4_AMPQE tr_A0A1X7UBP4_A0A1X7UBP4_AMPQE Uncharacterized protein OS=Amphimedon queenslandica OX=400682 PE=4 SV=1, Amphimedon_queenslandica_tr_A0A1X7T5Z8_A0A1X7T5Z8_AMPQE tr_A0A1X7T5Z8_A0A1X7T5Z8_AMPQE Uncharacterized protein OS=Amphimedon queenslandica OX=400682 PE=4 SV=1
OG0000039	Clytia_hemispherica_TCONS_00014774-protein TCONS_00014774-protein	Amphimedon_queenslandica_tr_A0A1X7VS50_A0A1X7VS50_AMPQE tr_A0A1X7VS50_A0A1X7VS50_AMPQE Sushi domain-containing protein OS=Amphimedon queenslandica OX=400682 PE=3 SV=1
OG0000040	Clytia_hemispherica_TCONS_00015477-protein TCONS_00015477-protein, Clytia_hemispherica_TCONS_00054801-protein TCONS_00054801-protein, Clytia_hemispherica_TCONS_00063899-protein TCONS_00063899-protein	Amphimedon_queenslandica_tr_A0A1X7TVU0_A0A1X7TVU0_AMPQE tr_A0A1X7TVU0_A0A1X7TVU0_AMPQE Uncharacterized protein OS=Amphimedon queenslandica OX=400682 PE=4 SV=1
OG0000041	Clytia_hemispherica_TCONS_00059541-protein TCONS_00059541-protein	Amphimedon_queenslandica_tr_A0A1X7V1S2_A0A1X7V1S2_AMPQE tr_A0A1X7V1S2_A0A1X7V1S2_AMPQE Poly [ADP-ribose] polymerase OS=Amphimedon queenslandica OX=400682 GN=100633591 PE=3 SV=1
OG0000044	Clytia_hemispherica_TCONS_00053572-protein TCONS_00053572-protein, Clytia_hemispherica_TCONS_00062853-protein TCONS_00062853-protein, Clytia_hemispherica_TCONS_00033083-protein TCONS_00033083-protein	Amphimedon_queenslandica_tr_A0A1X7UJE9_A0A1X7UJE9_AMPQE tr_A0A1X7UJE9_A0A1X7UJE9_AMPQE TGc domain-containing protein OS=Amphimedon queenslandica OX=400682 PE=4 SV=1, Amphimedon_queenslandica_tr_A0A1X7TBY3_A0A1X7TBY3_AMPQE tr_A0A1X7TBY3_A0A1X7TBY3_AMPQE TGc domain-containing protein OS=Amphimedon queenslandica OX=400682 PE=4 SV=1, Amphimedon_queenslandica_tr_A0A1X7UK01_A0A1X7UK01_AMPQE tr_A0A1X7UK01_A0A1X7UK01_AMPQE TGc domain-containing protein OS=Amphimedon queenslandica OX=400682 PE=3 SV=1, Amphimedon_queenslandica_tr_A0A1X7VEP3_A0A1X7VEP3_AMPQE tr_A0A1X7VEP3_A0A1X7VEP3_AMPQE TGc domain-containing protein OS=Amphimedon queenslandica OX=400682 GN=105316957 PE=4 SV=1
OG0000048	Clytia_hemispherica_TCONS_00070298-protein TCONS_00070298-protein	Amphimedon_queenslandica_tr_A0A1X7UU24_A0A1X7UU24_AMPQE tr_A0A1X7UU24_A0A1X7UU24_AMPQE Uncharacterized protein OS=Amphimedon queenslandica OX=400682 PE=4 SV=1
OG0000049	Clytia_hemispherica_TCONS_00064915-protein TCONS_00064915-protein	Amphimedon_queenslandica_tr_A0A1X7VVB6_A0A1X7VVB6_AMPQE tr_A0A1X7VVB6_A0A1X7VVB6_AMPQE Sema domain-containing protein OS=Amphimedon queenslandica OX=400682 GN=100641578 PE=3 SV=1, Amphimedon_queenslandica_tr_A0A1X7SV56_A0A1X7SV56_AMPQE tr_A0A1X7SV56_A0A1X7SV56_AMPQE Uncharacterized protein OS=Amphimedon queenslandica OX=400682 PE=4 SV=1, Amphimedon_queenslandica_tr_A0A1X7T417_A0A1X7T417_AMPQE tr_A0A1X7T417_A0A1X7T417_AMPQE Sema domain-containing protein OS=Amphimedon queenslandica OX=400682 PE=4 SV=1, Amphimedon_queenslandica_tr_A0A1X7UU11_A0A1X7UU11_AMPQE tr_A0A1X7UU11_A0A1X7UU11_AMPQE Uncharacterized protein OS=Amphimedon queenslandica OX=400682 PE=4 SV=1, Amphimedon_queenslandica_tr_A0A1X7VVB4_A0A1X7VVB4_AMPQE tr_A0A1X7VVB4_A0A1X7VVB4_AMPQE Uncharacterized protein OS=Amphimedon queenslandica OX=400682 GN=100641705 PE=3 SV=1, Amphimedon_queenslandica_tr_A0A1X7URZ8_A0A1X7URZ8_AMPQE tr_A0A1X7URZ8_A0A1X7URZ8_AMPQE Uncharacterized protein OS=Amphimedon queenslandica OX=400682 PE=4 SV=1, Amphimedon_queenslandica_tr_A0A1X7URK3_A0A1X7URK3_AMPQE tr_A0A1X7URK3_A0A1X7URK3_AMPQE Sema domain-containing protein OS=Amphimedon queenslandica OX=400682 PE=4 SV=1
OG0000051	Clytia_hemispherica_TCONS_00024466-protein TCONS_00024466-protein, Clytia_hemispherica_TCONS_00037794-protein TCONS_00037794-protein, Clytia_hemispherica_TCONS_00046933-protein TCONS_00046933-protein, Clytia_hemispherica_TCONS_00065253-protein TCONS_00065253-protein	Amphimedon_queenslandica_tr_A0A1X7V466_A0A1X7V466_AMPQE tr_A0A1X7V466_A0A1X7V466_AMPQE VWFA domain-containing protein OS=Amphimedon queenslandica OX=400682 GN=109581210 PE=4 SV=1
OG0000054	Clytia_hemispherica_TCONS_00029751-protein TCONS_00029751-protein	Amphimedon_queenslandica_tr_A0A1X7TU95_A0A1X7TU95_AMPQE tr_A0A1X7TU95_A0A1X7TU95_AMPQE Uncharacterized protein OS=Amphimedon queenslandica OX=400682 PE=4 SV=1, Amphimedon_queenslandica_tr_A0A1X7STD8_A0A1X7STD8_AMPQE tr_A0A1X7STD8_A0A1X7STD8_AMPQE Uncharacterized protein OS=Amphimedon queenslandica OX=400682 PE=4 SV=1
OG0000054	Clytia_hemispherica_TCONS_00036167-protein TCONS_00036167-protein	Amphimedon_queenslandica_tr_A0A1X7UT64_A0A1X7UT64_AMPQE tr_A0A1X7UT64_A0A1X7UT64_AMPQE Uncharacterized protein OS=Amphimedon queenslandica OX=400682 GN=100636327 PE=4 SV=1
OG0000061	Clytia_hemispherica_TCONS_00002099-protein TCONS_00002099-protein, Clytia_hemispherica_TCONS_00005277-protein TCONS_00005277-protein, Clytia_hemispherica_TCONS_00040450-protein TCONS_00040450-protein, Clytia_hemispherica_TCONS_00005276-protein TCONS_00005276-protein	Amphimedon_queenslandica_tr_A0A1X7USU2_A0A1X7USU2_AMPQE tr_A0A1X7USU2_A0A1X7USU2_AMPQE Uncharacterized protein OS=Amphimedon queenslandica OX=400682 GN=100634021 PE=3 SV=1
OG0000063	Clytia_hemispherica_TCONS_00002634-protein TCONS_00002634-protein, Clytia_hemispherica_TCONS_00002631-protein TCONS_00002631-protein	Amphimedon_queenslandica_tr_A0A1X7TB22_A0A1X7TB22_AMPQE tr_A0A1X7TB22_A0A1X7TB22_AMPQE HintN domain-containing protein OS=Amphimedon queenslandica OX=400682 PE=4 SV=1, Amphimedon_queenslandica_tr_A0A1X7UIG2_A0A1X7UIG2_AMPQE tr_A0A1X7UIG2_A0A1X7UIG2_AMPQE HintN domain-containing protein OS=Amphimedon queenslandica OX=400682 PE=3 SV=1, Amphimedon_queenslandica_tr_A0A1X7TZL0_A0A1X7TZL0_AMPQE tr_A0A1X7TZL0_A0A1X7TZL0_AMPQE HintN domain-containing protein OS=Amphimedon queenslandica OX=400682 PE=3 SV=1, Amphimedon_queenslandica_tr_A0A1X7UHL0_A0A1X7UHL0_AMPQE tr_A0A1X7UHL0_A0A1X7UHL0_AMPQE HintN domain-containing protein OS=Amphimedon queenslandica OX=400682 PE=4 SV=1
OG0000081	Clytia_hemispherica_TCONS_00053462-protein TCONS_00053462-protein, Clytia_hemispherica_TCONS_00022711-protein TCONS_00022711-protein, Clytia_hemispherica_TCONS_00006563-protein TCONS_00006563-protein	Amphimedon_queenslandica_tr_A0A1X7VRA4_A0A1X7VRA4_AMPQE tr_A0A1X7VRA4_A0A1X7VRA4_AMPQE Uncharacterized protein OS=Amphimedon queenslandica OX=400682 GN=105314063 PE=3 SV=1
OG0000086	Clytia_hemispherica_TCONS_00068191-protein TCONS_00068191-protein	Amphimedon_queenslandica_tr_A0A1X7SDK1_A0A1X7SDK1_AMPQE tr_A0A1X7SDK1_A0A1X7SDK1_AMPQE Angiopoietin-related protein 4 OS=Amphimedon queenslandica OX=400682 PE=4 SV=1, Amphimedon_queenslandica_tr_A0A1X7TIJ9_A0A1X7TIJ9_AMPQE tr_A0A1X7TIJ9_A0A1X7TIJ9_AMPQE Fibrinogen C-terminal domain-containing protein OS=Amphimedon queenslandica OX=400682 PE=4 SV=1
OG0000094	Clytia_hemispherica_TCONS_00019291-protein TCONS_00019291-protein	Amphimedon_queenslandica_tr_A0A1X7V5H9_A0A1X7V5H9_AMPQE tr_A0A1X7V5H9_A0A1X7V5H9_AMPQE G2_mitotic-specific cyclin-B3 OS=Amphimedon queenslandica OX=400682 PE=3 SV=1
OG0000099	Clytia_hemispherica_TCONS_00015995-protein TCONS_00015995-protein	Amphimedon_queenslandica_tr_A0A1X7SEW5_A0A1X7SEW5_AMPQE tr_A0A1X7SEW5_A0A1X7SEW5_AMPQE Sushi domain-containing protein OS=Amphimedon queenslandica OX=400682 PE=4 SV=1
OG0000103	Clytia_hemispherica_TCONS_00012064-protein TCONS_00012064-protein	Amphimedon_queenslandica_tr_A0A1X7VXX5_A0A1X7VXX5_AMPQE tr_A0A1X7VXX5_A0A1X7VXX5_AMPQE Uncharacterized protein OS=Amphimedon queenslandica OX=400682 PE=4 SV=1
OG0000106	Clytia_hemispherica_TCONS_00050547-protein TCONS_00050547-protein, Clytia_hemispherica_TCONS_00050544-protein TCONS_00050544-protein, Clytia_hemispherica_TCONS_00034674-protein TCONS_00034674-protein, Clytia_hemispherica_TCONS_00024961-protein TCONS_00024961-protein, Clytia_hemispherica_TCONS_00037516-protein TCONS_00037516-protein, Clytia_hemispherica_TCONS_00015172-protein TCONS_00015172-protein	Amphimedon_queenslandica_tr_A0A1X7UEK5_A0A1X7UEK5_AMPQE tr_A0A1X7UEK5_A0A1X7UEK5_AMPQE Fibronectin type-III domain-containing protein OS=Amphimedon queenslandica OX=400682 GN=109583727 PE=3 SV=1, Amphimedon_queenslandica_tr_A0A1X7UA06_A0A1X7UA06_AMPQE tr_A0A1X7UA06_A0A1X7UA06_AMPQE Fibronectin type-III domain-containing protein OS=Amphimedon queenslandica OX=400682 GN=100640421 PE=3 SV=1, Amphimedon_queenslandica_tr_A0A1X7SFW6_A0A1X7SFW6_AMPQE tr_A0A1X7SFW6_A0A1X7SFW6_AMPQE Fibronectin type-III domain-containing protein OS=Amphimedon queenslandica OX=400682 PE=4 SV=1, Amphimedon_queenslandica_tr_A0A1X7U2T4_A0A1X7U2T4_AMPQE tr_A0A1X7U2T4_A0A1X7U2T4_AMPQE Fibronectin type-III domain-containing protein OS=Amphimedon queenslandica OX=400682 PE=3 SV=1, Amphimedon_queenslandica_tr_A0A1X7SFC2_A0A1X7SFC2_AMPQE tr_A0A1X7SFC2_A0A1X7SFC2_AMPQE Fibronectin type-III domain-containing protein OS=Amphimedon queenslandica OX=400682 PE=4 SV=1
OG0000119	Clytia_hemispherica_TCONS_00020107-protein TCONS_00020107-protein	Amphimedon_queenslandica_tr_A0A1X7SIT2_A0A1X7SIT2_AMPQE tr_A0A1X7SIT2_A0A1X7SIT2_AMPQE Uncharacterized protein OS=Amphimedon queenslandica OX=400682 GN=105316203 PE=4 SV=1, Amphimedon_queenslandica_tr_A0A1X7T3R6_A0A1X7T3R6_AMPQE tr_A0A1X7T3R6_A0A1X7T3R6_AMPQE Uncharacterized protein OS=Amphimedon queenslandica OX=400682 PE=4 SV=1, Amphimedon_queenslandica_tr_A0A1X7TAB1_A0A1X7TAB1_AMPQE tr_A0A1X7TAB1_A0A1X7TAB1_AMPQE Uncharacterized protein OS=Amphimedon queenslandica OX=400682 GN=105315149 PE=4 SV=1, Amphimedon_queenslandica_tr_A0A1X7UXB2_A0A1X7UXB2_AMPQE tr_A0A1X7UXB2_A0A1X7UXB2_AMPQE Uncharacterized protein OS=Amphimedon queenslandica OX=400682 PE=4 SV=1, Amphimedon_queenslandica_tr_A0A1X7TCJ5_A0A1X7TCJ5_AMPQE tr_A0A1X7TCJ5_A0A1X7TCJ5_AMPQE Uncharacterized protein OS=Amphimedon queenslandica OX=400682 PE=4 SV=1, Amphimedon_queenslandica_tr_A0A1X7T3G0_A0A1X7T3G0_AMPQE tr_A0A1X7T3G0_A0A1X7T3G0_AMPQE Uncharacterized protein OS=Amphimedon queenslandica OX=400682 PE=4 SV=1, Amphimedon_queenslandica_tr_A0A1X7T648_A0A1X7T648_AMPQE tr_A0A1X7T648_A0A1X7T648_AMPQE Uncharacterized protein OS=Amphimedon queenslandica OX=400682 PE=4 SV=1, Amphimedon_queenslandica_tr_A0A1X7VSI4_A0A1X7VSI4_AMPQE tr_A0A1X7VSI4_A0A1X7VSI4_AMPQE Uncharacterized protein OS=Amphimedon queenslandica OX=400682 PE=4 SV=1
OG0000121	Clytia_hemispherica_TCONS_00000040-protein TCONS_00000040-protein	Amphimedon_queenslandica_tr_A0A1X7VNX7_A0A1X7VNX7_AMPQE tr_A0A1X7VNX7_A0A1X7VNX7_AMPQE Uncharacterized protein OS=Amphimedon queenslandica OX=400682 PE=4 SV=1
OG0000128	Clytia_hemispherica_TCONS_00031500-protein TCONS_00031500-protein, Clytia_hemispherica_TCONS_00019986-protein TCONS_00019986-protein	Amphimedon_queenslandica_tr_A0A1X7VRQ2_A0A1X7VRQ2_AMPQE tr_A0A1X7VRQ2_A0A1X7VRQ2_AMPQE VWFA domain-containing protein OS=Amphimedon queenslandica OX=400682 GN=100635885 PE=4 SV=1
OG0000131	Clytia_hemispherica_TCONS_00002425-protein TCONS_00002425-protein, Clytia_hemispherica_TCONS_00002495-protein TCONS_00002495-protein	Amphimedon_queenslandica_tr_A0A1X7SI22_A0A1X7SI22_AMPQE tr_A0A1X7SI22_A0A1X7SI22_AMPQE Fibronectin type-III domain-containing protein OS=Amphimedon queenslandica OX=400682 PE=4 SV=1, Amphimedon_queenslandica_tr_A0A1X7TPE4_A0A1X7TPE4_AMPQE tr_A0A1X7TPE4_A0A1X7TPE4_AMPQE Fibronectin type-III domain-containing protein OS=Amphimedon queenslandica OX=400682 PE=4 SV=1, Amphimedon_queenslandica_tr_A0A1X7SP49_A0A1X7SP49_AMPQE tr_A0A1X7SP49_A0A1X7SP49_AMPQE Uncharacterized protein OS=Amphimedon queenslandica OX=400682 PE=4 SV=1, Amphimedon_queenslandica_tr_A0A1X7SZ33_A0A1X7SZ33_AMPQE tr_A0A1X7SZ33_A0A1X7SZ33_AMPQE Uncharacterized protein OS=Amphimedon queenslandica OX=400682 PE=4 SV=1, Amphimedon_queenslandica_tr_A0A1X7TBG3_A0A1X7TBG3_AMPQE tr_A0A1X7TBG3_A0A1X7TBG3_AMPQE Uncharacterized protein OS=Amphimedon queenslandica OX=400682 GN=100638404 PE=4 SV=1
OG0000133	Clytia_hemispherica_TCONS_00000171-protein TCONS_00000171-protein	Amphimedon_queenslandica_tr_A0A1X7SQZ0_A0A1X7SQZ0_AMPQE tr_A0A1X7SQZ0_A0A1X7SQZ0_AMPQE Uncharacterized protein OS=Amphimedon queenslandica OX=400682 PE=4 SV=1, Amphimedon_queenslandica_tr_A0A1X7TED1_A0A1X7TED1_AMPQE tr_A0A1X7TED1_A0A1X7TED1_AMPQE Uncharacterized protein OS=Amphimedon queenslandica OX=400682 PE=4 SV=1, Amphimedon_queenslandica_tr_A0A1X7UY43_A0A1X7UY43_AMPQE tr_A0A1X7UY43_A0A1X7UY43_AMPQE Uncharacterized protein OS=Amphimedon queenslandica OX=400682 GN=100631783 PE=4 SV=1
OG0000134	Clytia_hemispherica_TCONS_00009201-protein TCONS_00009201-protein	Amphimedon_queenslandica_tr_A0A1X7TJY7_A0A1X7TJY7_AMPQE tr_A0A1X7TJY7_A0A1X7TJY7_AMPQE VWFA domain-containing protein OS=Amphimedon queenslandica OX=400682 PE=4 SV=1, Amphimedon_queenslandica_tr_A0A1X7UQB4_A0A1X7UQB4_AMPQE tr_A0A1X7UQB4_A0A1X7UQB4_AMPQE VWFA domain-containing protein OS=Amphimedon queenslandica OX=400682 PE=4 SV=1, Amphimedon_queenslandica_tr_A0A1X7URE1_A0A1X7URE1_AMPQE tr_A0A1X7URE1_A0A1X7URE1_AMPQE Uncharacterized protein OS=Amphimedon queenslandica OX=400682 PE=4 SV=1
OG0000152	Clytia_hemispherica_TCONS_00060223-protein TCONS_00060223-protein	Amphimedon_queenslandica_tr_A0A1X7V1L2_A0A1X7V1L2_AMPQE tr_A0A1X7V1L2_A0A1X7V1L2_AMPQE Uncharacterized protein OS=Amphimedon queenslandica OX=400682 GN=100638898 PE=3 SV=1
OG0000156	Clytia_hemispherica_TCONS_00025665-protein TCONS_00025665-protein	Amphimedon_queenslandica_tr_A0A1X7V0B9_A0A1X7V0B9_AMPQE tr_A0A1X7V0B9_A0A1X7V0B9_AMPQE MFAP1 domain-containing protein OS=Amphimedon queenslandica OX=400682 GN=105312554 PE=3 SV=1
OG0000173	Clytia_hemispherica_TCONS_00037871-protein TCONS_00037871-protein	Amphimedon_queenslandica_tr_A0A1X7UPL0_A0A1X7UPL0_AMPQE tr_A0A1X7UPL0_A0A1X7UPL0_AMPQE Uncharacterized protein OS=Amphimedon queenslandica OX=400682 GN=105312971 PE=4 SV=1, Amphimedon_queenslandica_tr_A0A1X7UQY9_A0A1X7UQY9_AMPQE tr_A0A1X7UQY9_A0A1X7UQY9_AMPQE Uncharacterized protein OS=Amphimedon queenslandica OX=400682 PE=4 SV=1, Amphimedon_queenslandica_tr_A0A1X7VBL1_A0A1X7VBL1_AMPQE tr_A0A1X7VBL1_A0A1X7VBL1_AMPQE Uncharacterized protein OS=Amphimedon queenslandica OX=400682 PE=4 SV=1, Amphimedon_queenslandica_tr_A0A1X7TCF3_A0A1X7TCF3_AMPQE tr_A0A1X7TCF3_A0A1X7TCF3_AMPQE Uncharacterized protein OS=Amphimedon queenslandica OX=400682 PE=4 SV=1, Amphimedon_queenslandica_tr_A0A1X7SXR0_A0A1X7SXR0_AMPQE tr_A0A1X7SXR0_A0A1X7SXR0_AMPQE Uncharacterized protein OS=Amphimedon queenslandica OX=400682 PE=4 SV=1, Amphimedon_queenslandica_tr_A0A1X7UXM5_A0A1X7UXM5_AMPQE tr_A0A1X7UXM5_A0A1X7UXM5_AMPQE Uncharacterized protein OS=Amphimedon queenslandica OX=400682 PE=4 SV=1
OG0000176	Clytia_hemispherica_TCONS_00050730-protein TCONS_00050730-protein	Amphimedon_queenslandica_tr_A0A1X7VU56_A0A1X7VU56_AMPQE tr_A0A1X7VU56_A0A1X7VU56_AMPQE Fibronectin type-III domain-containing protein OS=Amphimedon queenslandica OX=400682 GN=100635339 PE=4 SV=1
OG0000177	Clytia_hemispherica_TCONS_00003500-protein TCONS_00003500-protein	Amphimedon_queenslandica_tr_A0A1X7UHH8_A0A1X7UHH8_AMPQE tr_A0A1X7UHH8_A0A1X7UHH8_AMPQE Uncharacterized protein OS=Amphimedon queenslandica OX=400682 GN=100634571 PE=4 SV=1
OG0000178	Clytia_hemispherica_TCONS_00050084-protein TCONS_00050084-protein	Amphimedon_queenslandica_tr_A0A1X7VB34_A0A1X7VB34_AMPQE tr_A0A1X7VB34_A0A1X7VB34_AMPQE TGc domain-containing protein OS=Amphimedon queenslandica OX=400682 PE=4 SV=1
OG0000182	Clytia_hemispherica_TCONS_00059231-protein TCONS_00059231-protein, Clytia_hemispherica_TCONS_00046759-protein TCONS_00046759-protein	Amphimedon_queenslandica_tr_A0A1X7U8Z7_A0A1X7U8Z7_AMPQE tr_A0A1X7U8Z7_A0A1X7U8Z7_AMPQE VWFA domain-containing protein OS=Amphimedon queenslandica OX=400682 PE=4 SV=1
OG0000187	Clytia_hemispherica_TCONS_00003206-protein TCONS_00003206-protein	Amphimedon_queenslandica_tr_A0A1X7UM53_A0A1X7UM53_AMPQE tr_A0A1X7UM53_A0A1X7UM53_AMPQE Uncharacterized protein OS=Amphimedon queenslandica OX=400682 PE=4 SV=1, Amphimedon_queenslandica_tr_A0A1X7SVQ1_A0A1X7SVQ1_AMPQE tr_A0A1X7SVQ1_A0A1X7SVQ1_AMPQE Uncharacterized protein OS=Amphimedon queenslandica OX=400682 PE=4 SV=1
OG0000192	Clytia_hemispherica_TCONS_00014937-protein TCONS_00014937-protein	Amphimedon_queenslandica_tr_A0A1X7V6M4_A0A1X7V6M4_AMPQE tr_A0A1X7V6M4_A0A1X7V6M4_AMPQE Uncharacterized protein OS=Amphimedon queenslandica OX=400682 GN=100640615 PE=4 SV=1
OG0000193	Clytia_hemispherica_TCONS_00053692-protein TCONS_00053692-protein	Amphimedon_queenslandica_tr_A0A1X7UT99_A0A1X7UT99_AMPQE tr_A0A1X7UT99_A0A1X7UT99_AMPQE Poly_A_-specific ribonuclease OS=Amphimedon queenslandica OX=400682 PE=3 SV=1, Amphimedon_queenslandica_tr_A0A1X7T0L4_A0A1X7T0L4_AMPQE tr_A0A1X7T0L4_A0A1X7T0L4_AMPQE Uncharacterized protein OS=Amphimedon queenslandica OX=400682 PE=4 SV=1
OG0000194	Clytia_hemispherica_TCONS_00071632-protein TCONS_00071632-protein, Clytia_hemispherica_TCONS_00030436-protein TCONS_00030436-protein	Amphimedon_queenslandica_tr_A0A1X7U0I0_A0A1X7U0I0_AMPQE tr_A0A1X7U0I0_A0A1X7U0I0_AMPQE Uncharacterized protein OS=Amphimedon queenslandica OX=400682 PE=4 SV=1
OG0000195	Clytia_hemispherica_TCONS_00066994-protein TCONS_00066994-protein	Amphimedon_queenslandica_tr_A0A1X7ULH5_A0A1X7ULH5_AMPQE tr_A0A1X7ULH5_A0A1X7ULH5_AMPQE Uncharacterized protein OS=Amphimedon queenslandica OX=400682 GN=100637466 PE=4 SV=1
OG0000199	Clytia_hemispherica_TCONS_00047808-protein TCONS_00047808-protein	Amphimedon_queenslandica_tr_A0A1X7VCS5_A0A1X7VCS5_AMPQE tr_A0A1X7VCS5_A0A1X7VCS5_AMPQE 26S proteasome non-ATPase regulatory subunit 4 OS=Amphimedon queenslandica OX=400682 GN=105316936 PE=3 SV=1
OG0000200	Clytia_hemispherica_TCONS_00023146-protein TCONS_00023146-protein	Amphimedon_queenslandica_tr_A0A1X7V355_A0A1X7V355_AMPQE tr_A0A1X7V355_A0A1X7V355_AMPQE VWFA domain-containing protein OS=Amphimedon queenslandica OX=400682 PE=4 SV=1, Amphimedon_queenslandica_tr_A0A1X7SZ55_A0A1X7SZ55_AMPQE tr_A0A1X7SZ55_A0A1X7SZ55_AMPQE VWFA domain-containing protein OS=Amphimedon queenslandica OX=400682 PE=4 SV=1
OG0000204	Clytia_hemispherica_TCONS_00063679-protein TCONS_00063679-protein	Amphimedon_queenslandica_tr_A0A1X7UD61_A0A1X7UD61_AMPQE tr_A0A1X7UD61_A0A1X7UD61_AMPQE Uncharacterized protein OS=Amphimedon queenslandica OX=400682 GN=100635112 PE=4 SV=1
OG0000209	Clytia_hemispherica_TCONS_00065263-protein TCONS_00065263-protein	Amphimedon_queenslandica_tr_A0A1X7VKV0_A0A1X7VKV0_AMPQE tr_A0A1X7VKV0_A0A1X7VKV0_AMPQE Uncharacterized protein OS=Amphimedon queenslandica OX=400682 PE=4 SV=1
OG0000210	Clytia_hemispherica_TCONS_00052810-protein TCONS_00052810-protein	Amphimedon_queenslandica_tr_A0A1X7UF90_A0A1X7UF90_AMPQE tr_A0A1X7UF90_A0A1X7UF90_AMPQE Uncharacterized protein OS=Amphimedon queenslandica OX=400682 PE=4 SV=1
OG0000237	Clytia_hemispherica_TCONS_00028314-protein TCONS_00028314-protein	Amphimedon_queenslandica_tr_A0A1X7T4Q5_A0A1X7T4Q5_AMPQE tr_A0A1X7T4Q5_A0A1X7T4Q5_AMPQE Uncharacterized protein OS=Amphimedon queenslandica OX=400682 PE=4 SV=1, Amphimedon_queenslandica_tr_A0A1X7TQV5_A0A1X7TQV5_AMPQE tr_A0A1X7TQV5_A0A1X7TQV5_AMPQE Uncharacterized protein OS=Amphimedon queenslandica OX=400682 PE=4 SV=1
OG0000247	Clytia_hemispherica_TCONS_00047950-protein TCONS_00047950-protein	Amphimedon_queenslandica_tr_A0A1X7SRL3_A0A1X7SRL3_AMPQE tr_A0A1X7SRL3_A0A1X7SRL3_AMPQE LRRNT domain-containing protein OS=Amphimedon queenslandica OX=400682 PE=4 SV=1
OG0000267	Clytia_hemispherica_TCONS_00024032-protein TCONS_00024032-protein	Amphimedon_queenslandica_tr_A0A1X7U8J8_A0A1X7U8J8_AMPQE tr_A0A1X7U8J8_A0A1X7U8J8_AMPQE Uncharacterized protein OS=Amphimedon queenslandica OX=400682 PE=4 SV=1, Amphimedon_queenslandica_tr_A0A1X7SWZ3_A0A1X7SWZ3_AMPQE tr_A0A1X7SWZ3_A0A1X7SWZ3_AMPQE Uncharacterized protein OS=Amphimedon queenslandica OX=400682 PE=4 SV=1, Amphimedon_queenslandica_tr_A0A1X7UBG3_A0A1X7UBG3_AMPQE tr_A0A1X7UBG3_A0A1X7UBG3_AMPQE Uncharacterized protein OS=Amphimedon queenslandica OX=400682 GN=105313653 PE=4 SV=1
OG0000274	Clytia_hemispherica_TCONS_00056724-protein TCONS_00056724-protein	Amphimedon_queenslandica_tr_A0A1X7VMX6_A0A1X7VMX6_AMPQE tr_A0A1X7VMX6_A0A1X7VMX6_AMPQE Uncharacterized protein OS=Amphimedon queenslandica OX=400682 GN=100640148 PE=4 SV=1
OG0000282	Clytia_hemispherica_TCONS_00000534-protein TCONS_00000534-protein	Amphimedon_queenslandica_tr_A0A1X7TY91_A0A1X7TY91_AMPQE tr_A0A1X7TY91_A0A1X7TY91_AMPQE B3_4 domain-containing protein OS=Amphimedon queenslandica OX=400682 GN=100638911 PE=4 SV=1
OG0000309	Clytia_hemispherica_TCONS_00026216-protein TCONS_00026216-protein	Amphimedon_queenslandica_tr_A0A1X7UUZ2_A0A1X7UUZ2_AMPQE tr_A0A1X7UUZ2_A0A1X7UUZ2_AMPQE Uncharacterized protein OS=Amphimedon queenslandica OX=400682 GN=105312819 PE=4 SV=1
