Orthogroup	Cnidaria_Hydrozoa_Clytia_hemispherica	Porifera_Demospongiae_Amphimedon_queenslandica
OG0000000	Clytia_hemispherica_TCONS_00002198-protein TCONS_00002198-protein	Amphimedon_queenslandica_tr_A0A1X7TP62_A0A1X7TP62_AMPQE tr_A0A1X7TP62_A0A1X7TP62_AMPQE Fibrinogen C-terminal domain-containing protein OS=Amphimedon queenslandica OX=400682 PE=4 SV=1
OG0000000	Clytia_hemispherica_TCONS_00056369-protein TCONS_00056369-protein, Clytia_hemispherica_TCONS_00036375-protein TCONS_00036375-protein, Clytia_hemispherica_TCONS_00057358-protein TCONS_00057358-protein, Clytia_hemispherica_TCONS_00020582-protein TCONS_00020582-protein, Clytia_hemispherica_TCONS_00019248-protein TCONS_00019248-protein, Clytia_hemispherica_TCONS_00050286-protein TCONS_00050286-protein, Clytia_hemispherica_TCONS_00022360-protein TCONS_00022360-protein, Clytia_hemispherica_TCONS_00053667-protein TCONS_00053667-protein	Amphimedon_queenslandica_tr_A0A1X7ULD6_A0A1X7ULD6_AMPQE tr_A0A1X7ULD6_A0A1X7ULD6_AMPQE Fibrinogen C-terminal domain-containing protein OS=Amphimedon queenslandica OX=400682 GN=105313195 PE=4 SV=1, Amphimedon_queenslandica_tr_A0A1X7UNX5_A0A1X7UNX5_AMPQE tr_A0A1X7UNX5_A0A1X7UNX5_AMPQE Fibrinogen C-terminal domain-containing protein OS=Amphimedon queenslandica OX=400682 PE=4 SV=1, Amphimedon_queenslandica_tr_A0A1X7VAP0_A0A1X7VAP0_AMPQE tr_A0A1X7VAP0_A0A1X7VAP0_AMPQE Fibrinogen C-terminal domain-containing protein OS=Amphimedon queenslandica OX=400682 GN=100637828 PE=4 SV=1, Amphimedon_queenslandica_tr_A0A1X7UEI3_A0A1X7UEI3_AMPQE tr_A0A1X7UEI3_A0A1X7UEI3_AMPQE Fibrinogen C-terminal domain-containing protein OS=Amphimedon queenslandica OX=400682 PE=4 SV=1, Amphimedon_queenslandica_tr_A0A1X7TEI7_A0A1X7TEI7_AMPQE tr_A0A1X7TEI7_A0A1X7TEI7_AMPQE Fibrinogen C-terminal domain-containing protein OS=Amphimedon queenslandica OX=400682 PE=4 SV=1, Amphimedon_queenslandica_tr_A0A1X7SPQ0_A0A1X7SPQ0_AMPQE tr_A0A1X7SPQ0_A0A1X7SPQ0_AMPQE Fibrinogen C-terminal domain-containing protein OS=Amphimedon queenslandica OX=400682 PE=4 SV=1, Amphimedon_queenslandica_tr_A0A1X7TF91_A0A1X7TF91_AMPQE tr_A0A1X7TF91_A0A1X7TF91_AMPQE Fibrinogen C-terminal domain-containing protein OS=Amphimedon queenslandica OX=400682 PE=4 SV=1, Amphimedon_queenslandica_tr_A0A1X7UXI6_A0A1X7UXI6_AMPQE tr_A0A1X7UXI6_A0A1X7UXI6_AMPQE Fibrinogen C-terminal domain-containing protein OS=Amphimedon queenslandica OX=400682 PE=4 SV=1, Amphimedon_queenslandica_tr_A0A1X7UYQ5_A0A1X7UYQ5_AMPQE tr_A0A1X7UYQ5_A0A1X7UYQ5_AMPQE Fibrinogen C-terminal domain-containing protein OS=Amphimedon queenslandica OX=400682 GN=100632538 PE=4 SV=1, Amphimedon_queenslandica_tr_A0A1X7TTH3_A0A1X7TTH3_AMPQE tr_A0A1X7TTH3_A0A1X7TTH3_AMPQE Fibrinogen C-terminal domain-containing protein OS=Amphimedon queenslandica OX=400682 PE=4 SV=1, Amphimedon_queenslandica_tr_A0A1X7TT50_A0A1X7TT50_AMPQE tr_A0A1X7TT50_A0A1X7TT50_AMPQE Fibrinogen C-terminal domain-containing protein OS=Amphimedon queenslandica OX=400682 GN=100639626 PE=4 SV=1, Amphimedon_queenslandica_tr_A0A1X7U6Q1_A0A1X7U6Q1_AMPQE tr_A0A1X7U6Q1_A0A1X7U6Q1_AMPQE Fibrinogen C-terminal domain-containing protein OS=Amphimedon queenslandica OX=400682 PE=4 SV=1, Amphimedon_queenslandica_tr_A0A1X7U6Q6_A0A1X7U6Q6_AMPQE tr_A0A1X7U6Q6_A0A1X7U6Q6_AMPQE Fibrinogen C-terminal domain-containing protein OS=Amphimedon queenslandica OX=400682 PE=4 SV=1, Amphimedon_queenslandica_tr_A0A1X7T854_A0A1X7T854_AMPQE tr_A0A1X7T854_A0A1X7T854_AMPQE Fibrinogen C-terminal domain-containing protein OS=Amphimedon queenslandica OX=400682 GN=100637814 PE=4 SV=1, Amphimedon_queenslandica_tr_A0A1X7U6G7_A0A1X7U6G7_AMPQE tr_A0A1X7U6G7_A0A1X7U6G7_AMPQE Fibrinogen C-terminal domain-containing protein OS=Amphimedon queenslandica OX=400682 GN=105313870 PE=4 SV=1, Amphimedon_queenslandica_tr_A0A1X7TRL5_A0A1X7TRL5_AMPQE tr_A0A1X7TRL5_A0A1X7TRL5_AMPQE Fibrinogen C-terminal domain-containing protein OS=Amphimedon queenslandica OX=400682 GN=100634289 PE=4 SV=1, Amphimedon_queenslandica_tr_A0A1X7U772_A0A1X7U772_AMPQE tr_A0A1X7U772_A0A1X7U772_AMPQE Fibrinogen C-terminal domain-containing protein OS=Amphimedon queenslandica OX=400682 GN=105313869 PE=4 SV=1, Amphimedon_queenslandica_tr_A0A1X7TNT2_A0A1X7TNT2_AMPQE tr_A0A1X7TNT2_A0A1X7TNT2_AMPQE Fibrinogen C-terminal domain-containing protein OS=Amphimedon queenslandica OX=400682 GN=100639582 PE=4 SV=1, Amphimedon_queenslandica_tr_A0A1X7STA5_A0A1X7STA5_AMPQE tr_A0A1X7STA5_A0A1X7STA5_AMPQE Fibrinogen C-terminal domain-containing protein OS=Amphimedon queenslandica OX=400682 PE=4 SV=1, Amphimedon_queenslandica_tr_A0A1X7TF57_A0A1X7TF57_AMPQE tr_A0A1X7TF57_A0A1X7TF57_AMPQE Fibrinogen C-terminal domain-containing protein OS=Amphimedon queenslandica OX=400682 GN=100633103 PE=4 SV=1, Amphimedon_queenslandica_tr_A0A1X7T456_A0A1X7T456_AMPQE tr_A0A1X7T456_A0A1X7T456_AMPQE Fibrinogen C-terminal domain-containing protein OS=Amphimedon queenslandica OX=400682 PE=4 SV=1, Amphimedon_queenslandica_tr_A0A1X7U0N8_A0A1X7U0N8_AMPQE tr_A0A1X7U0N8_A0A1X7U0N8_AMPQE Fibrinogen C-terminal domain-containing protein OS=Amphimedon queenslandica OX=400682 GN=105314125 PE=4 SV=1, Amphimedon_queenslandica_tr_A0A1X7U0C2_A0A1X7U0C2_AMPQE tr_A0A1X7U0C2_A0A1X7U0C2_AMPQE Fibrinogen C-terminal domain-containing protein OS=Amphimedon queenslandica OX=400682 PE=4 SV=1, Amphimedon_queenslandica_tr_A0A1X7TP65_A0A1X7TP65_AMPQE tr_A0A1X7TP65_A0A1X7TP65_AMPQE Arpin OS=Amphimedon queenslandica OX=400682 PE=3 SV=1, Amphimedon_queenslandica_tr_A0A1X7U606_A0A1X7U606_AMPQE tr_A0A1X7U606_A0A1X7U606_AMPQE Fibrinogen C-terminal domain-containing protein OS=Amphimedon queenslandica OX=400682 PE=4 SV=1, Amphimedon_queenslandica_tr_A0A1X7T8J7_A0A1X7T8J7_AMPQE tr_A0A1X7T8J7_A0A1X7T8J7_AMPQE Fibrinogen C-terminal domain-containing protein OS=Amphimedon queenslandica OX=400682 PE=4 SV=1
OG0000000	Clytia_hemispherica_TCONS_00047229-protein TCONS_00047229-protein, Clytia_hemispherica_TCONS_00035351-protein TCONS_00035351-protein, Clytia_hemispherica_TCONS_00072749-protein TCONS_00072749-protein, Clytia_hemispherica_TCONS_00060419-protein TCONS_00060419-protein, Clytia_hemispherica_TCONS_00027220-protein TCONS_00027220-protein, Clytia_hemispherica_TCONS_00019639-protein TCONS_00019639-protein, Clytia_hemispherica_TCONS_00041903-protein TCONS_00041903-protein, Clytia_hemispherica_TCONS_00055631-protein TCONS_00055631-protein, Clytia_hemispherica_TCONS_00017249-protein TCONS_00017249-protein, Clytia_hemispherica_TCONS_00071837-protein TCONS_00071837-protein, Clytia_hemispherica_TCONS_00011360-protein TCONS_00011360-protein, Clytia_hemispherica_TCONS_00060455-protein TCONS_00060455-protein, Clytia_hemispherica_TCONS_00032431-protein TCONS_00032431-protein, Clytia_hemispherica_TCONS_00062122-protein TCONS_00062122-protein, Clytia_hemispherica_TCONS_00006663-protein TCONS_00006663-protein, Clytia_hemispherica_TCONS_00015470-protein TCONS_00015470-protein, Clytia_hemispherica_TCONS_00021098-protein TCONS_00021098-protein, Clytia_hemispherica_TCONS_00022251-protein TCONS_00022251-protein, Clytia_hemispherica_TCONS_00031046-protein TCONS_00031046-protein, Clytia_hemispherica_TCONS_00056773-protein TCONS_00056773-protein, Clytia_hemispherica_TCONS_00049966-protein TCONS_00049966-protein	Amphimedon_queenslandica_tr_A0A1X7UM32_A0A1X7UM32_AMPQE tr_A0A1X7UM32_A0A1X7UM32_AMPQE Fibrinogen C-terminal domain-containing protein OS=Amphimedon queenslandica OX=400682 PE=4 SV=1
OG0000001	Clytia_hemispherica_TCONS_00049799-protein TCONS_00049799-protein	Amphimedon_queenslandica_tr_A0A1X7VTD0_A0A1X7VTD0_AMPQE tr_A0A1X7VTD0_A0A1X7VTD0_AMPQE Uncharacterized protein OS=Amphimedon queenslandica OX=400682 GN=105314164 PE=4 SV=1
OG0000001	Clytia_hemispherica_TCONS_00018494-protein TCONS_00018494-protein, Clytia_hemispherica_TCONS_00018496-protein TCONS_00018496-protein	Amphimedon_queenslandica_tr_A0A1X7VJK8_A0A1X7VJK8_AMPQE tr_A0A1X7VJK8_A0A1X7VJK8_AMPQE Uncharacterized protein OS=Amphimedon queenslandica OX=400682 PE=4 SV=1, Amphimedon_queenslandica_tr_A0A1X7VJP3_A0A1X7VJP3_AMPQE tr_A0A1X7VJP3_A0A1X7VJP3_AMPQE Uncharacterized protein OS=Amphimedon queenslandica OX=400682 PE=4 SV=1, Amphimedon_queenslandica_tr_A0A1X7ULH8_A0A1X7ULH8_AMPQE tr_A0A1X7ULH8_A0A1X7ULH8_AMPQE Uncharacterized protein OS=Amphimedon queenslandica OX=400682 PE=3 SV=1, Amphimedon_queenslandica_tr_A0A1X7VI68_A0A1X7VI68_AMPQE tr_A0A1X7VI68_A0A1X7VI68_AMPQE Uncharacterized protein OS=Amphimedon queenslandica OX=400682 PE=4 SV=1
OG0000001	Clytia_hemispherica_TCONS_00027713-protein TCONS_00027713-protein	Amphimedon_queenslandica_tr_A0A1X7TD79_A0A1X7TD79_AMPQE tr_A0A1X7TD79_A0A1X7TD79_AMPQE Uncharacterized protein OS=Amphimedon queenslandica OX=400682 PE=4 SV=1
OG0000001	Clytia_hemispherica_TCONS_00064310-protein TCONS_00064310-protein	Amphimedon_queenslandica_tr_A0A1X7UXM0_A0A1X7UXM0_AMPQE tr_A0A1X7UXM0_A0A1X7UXM0_AMPQE Uncharacterized protein OS=Amphimedon queenslandica OX=400682 GN=105312708 PE=4 SV=1
OG0000001	Clytia_hemispherica_TCONS_00025379-protein TCONS_00025379-protein	Amphimedon_queenslandica_tr_A0A1X7SE74_A0A1X7SE74_AMPQE tr_A0A1X7SE74_A0A1X7SE74_AMPQE Uncharacterized protein OS=Amphimedon queenslandica OX=400682 PE=4 SV=1
OG0000001	Clytia_hemispherica_TCONS_00020951-protein TCONS_00020951-protein	Amphimedon_queenslandica_tr_A0A1X7V889_A0A1X7V889_AMPQE tr_A0A1X7V889_A0A1X7V889_AMPQE Uncharacterized protein OS=Amphimedon queenslandica OX=400682 PE=4 SV=1
OG0000001	Clytia_hemispherica_TCONS_00064021-protein TCONS_00064021-protein, Clytia_hemispherica_TCONS_00011362-protein TCONS_00011362-protein, Clytia_hemispherica_TCONS_00067350-protein TCONS_00067350-protein, Clytia_hemispherica_TCONS_00004794-protein TCONS_00004794-protein, Clytia_hemispherica_TCONS_00056933-protein TCONS_00056933-protein	Amphimedon_queenslandica_tr_A0A1X7SK21_A0A1X7SK21_AMPQE tr_A0A1X7SK21_A0A1X7SK21_AMPQE Laminin EGF-like domain-containing protein OS=Amphimedon queenslandica OX=400682 PE=4 SV=1
OG0000002	Clytia_hemispherica_TCONS_00027170-protein TCONS_00027170-protein	Amphimedon_queenslandica_tr_A0A1X7V5N9_A0A1X7V5N9_AMPQE tr_A0A1X7V5N9_A0A1X7V5N9_AMPQE Sema domain-containing protein OS=Amphimedon queenslandica OX=400682 GN=105312297 PE=4 SV=1, Amphimedon_queenslandica_tr_A0A1X7V831_A0A1X7V831_AMPQE tr_A0A1X7V831_A0A1X7V831_AMPQE Sema domain-containing protein OS=Amphimedon queenslandica OX=400682 PE=4 SV=1, Amphimedon_queenslandica_tr_A0A1X7U8W1_A0A1X7U8W1_AMPQE tr_A0A1X7U8W1_A0A1X7U8W1_AMPQE Sema domain-containing protein OS=Amphimedon queenslandica OX=400682 PE=4 SV=1
OG0000002	Clytia_hemispherica_TCONS_00009631-protein TCONS_00009631-protein, Clytia_hemispherica_TCONS_00054324-protein TCONS_00054324-protein, Clytia_hemispherica_TCONS_00061931-protein TCONS_00061931-protein, Clytia_hemispherica_TCONS_00003803-protein TCONS_00003803-protein, Clytia_hemispherica_TCONS_00067913-protein TCONS_00067913-protein, Clytia_hemispherica_TCONS_00040020-protein TCONS_00040020-protein, Clytia_hemispherica_TCONS_00043370-protein TCONS_00043370-protein, Clytia_hemispherica_TCONS_00062091-protein TCONS_00062091-protein	Amphimedon_queenslandica_tr_A0A1X7T8F3_A0A1X7T8F3_AMPQE tr_A0A1X7T8F3_A0A1X7T8F3_AMPQE Uncharacterized protein OS=Amphimedon queenslandica OX=400682 PE=4 SV=1, Amphimedon_queenslandica_tr_A0A1X7SPA1_A0A1X7SPA1_AMPQE tr_A0A1X7SPA1_A0A1X7SPA1_AMPQE Uncharacterized protein OS=Amphimedon queenslandica OX=400682 PE=4 SV=1
OG0000002	Clytia_hemispherica_TCONS_00044266-protein TCONS_00044266-protein, Clytia_hemispherica_TCONS_00050522-protein TCONS_00050522-protein, Clytia_hemispherica_TCONS_00058980-protein TCONS_00058980-protein, Clytia_hemispherica_TCONS_00040179-protein TCONS_00040179-protein, Clytia_hemispherica_TCONS_00022855-protein TCONS_00022855-protein, Clytia_hemispherica_TCONS_00064167-protein TCONS_00064167-protein, Clytia_hemispherica_TCONS_00050254-protein TCONS_00050254-protein, Clytia_hemispherica_TCONS_00006687-protein TCONS_00006687-protein, Clytia_hemispherica_TCONS_00010430-protein TCONS_00010430-protein, Clytia_hemispherica_TCONS_00010066-protein TCONS_00010066-protein, Clytia_hemispherica_TCONS_00010069-protein TCONS_00010069-protein, Clytia_hemispherica_TCONS_00047795-protein TCONS_00047795-protein, Clytia_hemispherica_TCONS_00001402-protein TCONS_00001402-protein, Clytia_hemispherica_TCONS_00050865-protein TCONS_00050865-protein	Amphimedon_queenslandica_tr_A0A1X7U240_A0A1X7U240_AMPQE tr_A0A1X7U240_A0A1X7U240_AMPQE Uncharacterized protein OS=Amphimedon queenslandica OX=400682 GN=100632678 PE=3 SV=1
OG0000004	Clytia_hemispherica_TCONS_00025069-protein TCONS_00025069-protein	Amphimedon_queenslandica_tr_A0A1X7UFR8_A0A1X7UFR8_AMPQE tr_A0A1X7UFR8_A0A1X7UFR8_AMPQE Uncharacterized protein OS=Amphimedon queenslandica OX=400682 GN=100631576 PE=4 SV=1
OG0000004	Clytia_hemispherica_TCONS_00029812-protein TCONS_00029812-protein	Amphimedon_queenslandica_tr_A0A1X7TTU5_A0A1X7TTU5_AMPQE tr_A0A1X7TTU5_A0A1X7TTU5_AMPQE Uncharacterized protein OS=Amphimedon queenslandica OX=400682 GN=100635582 PE=4 SV=1
OG0000004	Clytia_hemispherica_TCONS_00053426-protein TCONS_00053426-protein	Amphimedon_queenslandica_tr_A0A1X7UE75_A0A1X7UE75_AMPQE tr_A0A1X7UE75_A0A1X7UE75_AMPQE Uncharacterized protein OS=Amphimedon queenslandica OX=400682 PE=4 SV=1
OG0000005	Clytia_hemispherica_TCONS_00005192-protein TCONS_00005192-protein, Clytia_hemispherica_TCONS_00002523-protein TCONS_00002523-protein, Clytia_hemispherica_TCONS_00025486-protein TCONS_00025486-protein, Clytia_hemispherica_TCONS_00071313-protein TCONS_00071313-protein, Clytia_hemispherica_TCONS_00020048-protein TCONS_00020048-protein, Clytia_hemispherica_TCONS_00012296-protein TCONS_00012296-protein, Clytia_hemispherica_TCONS_00027133-protein TCONS_00027133-protein, Clytia_hemispherica_TCONS_00070170-protein TCONS_00070170-protein, Clytia_hemispherica_TCONS_00064563-protein TCONS_00064563-protein, Clytia_hemispherica_TCONS_00002689-protein TCONS_00002689-protein, Clytia_hemispherica_TCONS_00002617-protein TCONS_00002617-protein, Clytia_hemispherica_TCONS_00002686-protein TCONS_00002686-protein, Clytia_hemispherica_TCONS_00051638-protein TCONS_00051638-protein, Clytia_hemispherica_TCONS_00062688-protein TCONS_00062688-protein, Clytia_hemispherica_TCONS_00019373-protein TCONS_00019373-protein	Amphimedon_queenslandica_tr_A0A1X7V0Y1_A0A1X7V0Y1_AMPQE tr_A0A1X7V0Y1_A0A1X7V0Y1_AMPQE Metalloendopeptidase OS=Amphimedon queenslandica OX=400682 GN=100635688 PE=4 SV=1, Amphimedon_queenslandica_tr_A0A1X7V1Q9_A0A1X7V1Q9_AMPQE tr_A0A1X7V1Q9_A0A1X7V1Q9_AMPQE Metalloendopeptidase OS=Amphimedon queenslandica OX=400682 GN=100641422 PE=4 SV=1, Amphimedon_queenslandica_tr_A0A1X7TQH0_A0A1X7TQH0_AMPQE tr_A0A1X7TQH0_A0A1X7TQH0_AMPQE Metalloendopeptidase OS=Amphimedon queenslandica OX=400682 PE=4 SV=1, Amphimedon_queenslandica_tr_A0A1X7V396_A0A1X7V396_AMPQE tr_A0A1X7V396_A0A1X7V396_AMPQE Metalloendopeptidase OS=Amphimedon queenslandica OX=400682 GN=105312432 PE=4 SV=1, Amphimedon_queenslandica_tr_A0A1X7TXE7_A0A1X7TXE7_AMPQE tr_A0A1X7TXE7_A0A1X7TXE7_AMPQE Metalloendopeptidase OS=Amphimedon queenslandica OX=400682 PE=4 SV=1
OG0000005	Clytia_hemispherica_TCONS_00071679-protein TCONS_00071679-protein, Clytia_hemispherica_TCONS_00027341-protein TCONS_00027341-protein, Clytia_hemispherica_TCONS_00071675-protein TCONS_00071675-protein, Clytia_hemispherica_TCONS_00071669-protein TCONS_00071669-protein	Amphimedon_queenslandica_tr_A0A1X7U6X6_A0A1X7U6X6_AMPQE tr_A0A1X7U6X6_A0A1X7U6X6_AMPQE Metalloendopeptidase OS=Amphimedon queenslandica OX=400682 PE=4 SV=1
OG0000005	Clytia_hemispherica_TCONS_00050320-protein TCONS_00050320-protein	Amphimedon_queenslandica_tr_A0A1X7V1R6_A0A1X7V1R6_AMPQE tr_A0A1X7V1R6_A0A1X7V1R6_AMPQE Metalloendopeptidase OS=Amphimedon queenslandica OX=400682 GN=100632746 PE=4 SV=1, Amphimedon_queenslandica_tr_A0A1X7T7V4_A0A1X7T7V4_AMPQE tr_A0A1X7T7V4_A0A1X7T7V4_AMPQE Metalloendopeptidase OS=Amphimedon queenslandica OX=400682 PE=4 SV=1, Amphimedon_queenslandica_tr_A0A1X7V1R1_A0A1X7V1R1_AMPQE tr_A0A1X7V1R1_A0A1X7V1R1_AMPQE Metalloendopeptidase OS=Amphimedon queenslandica OX=400682 GN=100637879 PE=4 SV=1
OG0000006	Clytia_hemispherica_TCONS_00017431-protein TCONS_00017431-protein, Clytia_hemispherica_TCONS_00046199-protein TCONS_00046199-protein	Amphimedon_queenslandica_tr_A0A1X7VVY6_A0A1X7VVY6_AMPQE tr_A0A1X7VVY6_A0A1X7VVY6_AMPQE Uncharacterized protein OS=Amphimedon queenslandica OX=400682 PE=4 SV=1, Amphimedon_queenslandica_tr_A0A1X7SNE5_A0A1X7SNE5_AMPQE tr_A0A1X7SNE5_A0A1X7SNE5_AMPQE Uncharacterized protein OS=Amphimedon queenslandica OX=400682 GN=109592231 PE=4 SV=1, Amphimedon_queenslandica_tr_A0A1X7VTZ5_A0A1X7VTZ5_AMPQE tr_A0A1X7VTZ5_A0A1X7VTZ5_AMPQE Uncharacterized protein OS=Amphimedon queenslandica OX=400682 PE=4 SV=1
OG0000007	Clytia_hemispherica_TCONS_00028848-protein TCONS_00028848-protein	Amphimedon_queenslandica_tr_A0A1X7VF43_A0A1X7VF43_AMPQE tr_A0A1X7VF43_A0A1X7VF43_AMPQE EGF-like domain-containing protein OS=Amphimedon queenslandica OX=400682 PE=4 SV=1, Amphimedon_queenslandica_tr_A0A1X7V609_A0A1X7V609_AMPQE tr_A0A1X7V609_A0A1X7V609_AMPQE EGF-like domain-containing protein OS=Amphimedon queenslandica OX=400682 PE=4 SV=1, Amphimedon_queenslandica_tr_A0A1X7SHW9_A0A1X7SHW9_AMPQE tr_A0A1X7SHW9_A0A1X7SHW9_AMPQE Uncharacterized protein OS=Amphimedon queenslandica OX=400682 PE=4 SV=1, Amphimedon_queenslandica_tr_A0A1X7V0H0_A0A1X7V0H0_AMPQE tr_A0A1X7V0H0_A0A1X7V0H0_AMPQE Uncharacterized protein OS=Amphimedon queenslandica OX=400682 PE=4 SV=1, Amphimedon_queenslandica_tr_A0A1X7SVD2_A0A1X7SVD2_AMPQE tr_A0A1X7SVD2_A0A1X7SVD2_AMPQE Uncharacterized protein OS=Amphimedon queenslandica OX=400682 PE=4 SV=1, Amphimedon_queenslandica_tr_A0A1X7SLA6_A0A1X7SLA6_AMPQE tr_A0A1X7SLA6_A0A1X7SLA6_AMPQE Uncharacterized protein OS=Amphimedon queenslandica OX=400682 PE=4 SV=1, Amphimedon_queenslandica_tr_A0A1X7TEE8_A0A1X7TEE8_AMPQE tr_A0A1X7TEE8_A0A1X7TEE8_AMPQE Uncharacterized protein OS=Amphimedon queenslandica OX=400682 PE=4 SV=1, Amphimedon_queenslandica_tr_A0A1X7U208_A0A1X7U208_AMPQE tr_A0A1X7U208_A0A1X7U208_AMPQE Uncharacterized protein OS=Amphimedon queenslandica OX=400682 PE=4 SV=1, Amphimedon_queenslandica_tr_A0A1X7STU5_A0A1X7STU5_AMPQE tr_A0A1X7STU5_A0A1X7STU5_AMPQE Uncharacterized protein OS=Amphimedon queenslandica OX=400682 PE=4 SV=1, Amphimedon_queenslandica_tr_A0A1X7SF39_A0A1X7SF39_AMPQE tr_A0A1X7SF39_A0A1X7SF39_AMPQE Uncharacterized protein OS=Amphimedon queenslandica OX=400682 PE=4 SV=1, Amphimedon_queenslandica_tr_A0A1X7TP49_A0A1X7TP49_AMPQE tr_A0A1X7TP49_A0A1X7TP49_AMPQE Uncharacterized protein OS=Amphimedon queenslandica OX=400682 PE=4 SV=1, Amphimedon_queenslandica_tr_A0A1X7SDX5_A0A1X7SDX5_AMPQE tr_A0A1X7SDX5_A0A1X7SDX5_AMPQE EGF-like domain-containing protein OS=Amphimedon queenslandica OX=400682 PE=4 SV=1, Amphimedon_queenslandica_tr_A0A1X7UZT4_A0A1X7UZT4_AMPQE tr_A0A1X7UZT4_A0A1X7UZT4_AMPQE EGF-like domain-containing protein OS=Amphimedon queenslandica OX=400682 PE=4 SV=1, Amphimedon_queenslandica_tr_A0A1X7UBV4_A0A1X7UBV4_AMPQE tr_A0A1X7UBV4_A0A1X7UBV4_AMPQE Uncharacterized protein OS=Amphimedon queenslandica OX=400682 PE=4 SV=1, Amphimedon_queenslandica_tr_A0A1X7T313_A0A1X7T313_AMPQE tr_A0A1X7T313_A0A1X7T313_AMPQE Uncharacterized protein OS=Amphimedon queenslandica OX=400682 PE=4 SV=1, Amphimedon_queenslandica_tr_A0A1X7T9P6_A0A1X7T9P6_AMPQE tr_A0A1X7T9P6_A0A1X7T9P6_AMPQE Uncharacterized protein OS=Amphimedon queenslandica OX=400682 PE=4 SV=1, Amphimedon_queenslandica_tr_A0A1X7VP98_A0A1X7VP98_AMPQE tr_A0A1X7VP98_A0A1X7VP98_AMPQE Uncharacterized protein OS=Amphimedon queenslandica OX=400682 GN=109586822 PE=4 SV=1
OG0000007	Clytia_hemispherica_TCONS_00000042-protein TCONS_00000042-protein	Amphimedon_queenslandica_tr_A0A1X7T0Q0_A0A1X7T0Q0_AMPQE tr_A0A1X7T0Q0_A0A1X7T0Q0_AMPQE EGF_CA domain-containing protein OS=Amphimedon queenslandica OX=400682 PE=4 SV=1
OG0000007	Clytia_hemispherica_TCONS_00064084-protein TCONS_00064084-protein	Amphimedon_queenslandica_tr_A0A1X7T8K6_A0A1X7T8K6_AMPQE tr_A0A1X7T8K6_A0A1X7T8K6_AMPQE EGF_CA domain-containing protein OS=Amphimedon queenslandica OX=400682 PE=4 SV=1
OG0000007	Clytia_hemispherica_TCONS_00022735-protein TCONS_00022735-protein	Amphimedon_queenslandica_tr_A0A1X7SPG3_A0A1X7SPG3_AMPQE tr_A0A1X7SPG3_A0A1X7SPG3_AMPQE CUB domain-containing protein OS=Amphimedon queenslandica OX=400682 PE=4 SV=1
OG0000007	Clytia_hemispherica_TCONS_00012963-protein TCONS_00012963-protein	Amphimedon_queenslandica_tr_A0A1X7UXG1_A0A1X7UXG1_AMPQE tr_A0A1X7UXG1_A0A1X7UXG1_AMPQE Uncharacterized protein OS=Amphimedon queenslandica OX=400682 PE=4 SV=1, Amphimedon_queenslandica_tr_A0A1X7SNX2_A0A1X7SNX2_AMPQE tr_A0A1X7SNX2_A0A1X7SNX2_AMPQE VWFD domain-containing protein OS=Amphimedon queenslandica OX=400682 PE=4 SV=1, Amphimedon_queenslandica_tr_A0A1X7U0H9_A0A1X7U0H9_AMPQE tr_A0A1X7U0H9_A0A1X7U0H9_AMPQE AMOP domain-containing protein OS=Amphimedon queenslandica OX=400682 PE=4 SV=1, Amphimedon_queenslandica_tr_A0A1X7VEX8_A0A1X7VEX8_AMPQE tr_A0A1X7VEX8_A0A1X7VEX8_AMPQE Uncharacterized protein OS=Amphimedon queenslandica OX=400682 PE=4 SV=1, Amphimedon_queenslandica_tr_A0A1X7U0T3_A0A1X7U0T3_AMPQE tr_A0A1X7U0T3_A0A1X7U0T3_AMPQE VWFD domain-containing protein OS=Amphimedon queenslandica OX=400682 PE=4 SV=1, Amphimedon_queenslandica_tr_A0A1X7TZY4_A0A1X7TZY4_AMPQE tr_A0A1X7TZY4_A0A1X7TZY4_AMPQE Uncharacterized protein OS=Amphimedon queenslandica OX=400682 PE=4 SV=1, Amphimedon_queenslandica_tr_A0A1X7VE59_A0A1X7VE59_AMPQE tr_A0A1X7VE59_A0A1X7VE59_AMPQE Uncharacterized protein OS=Amphimedon queenslandica OX=400682 PE=4 SV=1, Amphimedon_queenslandica_tr_A0A1X7VFS2_A0A1X7VFS2_AMPQE tr_A0A1X7VFS2_A0A1X7VFS2_AMPQE VWFD domain-containing protein OS=Amphimedon queenslandica OX=400682 PE=4 SV=1, Amphimedon_queenslandica_tr_A0A1X7TQL5_A0A1X7TQL5_AMPQE tr_A0A1X7TQL5_A0A1X7TQL5_AMPQE Uncharacterized protein OS=Amphimedon queenslandica OX=400682 PE=4 SV=1, Amphimedon_queenslandica_tr_A0A1X7VD60_A0A1X7VD60_AMPQE tr_A0A1X7VD60_A0A1X7VD60_AMPQE EGF-like domain-containing protein OS=Amphimedon queenslandica OX=400682 PE=4 SV=1, Amphimedon_queenslandica_tr_A0A1X7VCF9_A0A1X7VCF9_AMPQE tr_A0A1X7VCF9_A0A1X7VCF9_AMPQE Uncharacterized protein OS=Amphimedon queenslandica OX=400682 PE=4 SV=1, Amphimedon_queenslandica_tr_A0A1X7TQV9_A0A1X7TQV9_AMPQE tr_A0A1X7TQV9_A0A1X7TQV9_AMPQE Uncharacterized protein OS=Amphimedon queenslandica OX=400682 PE=4 SV=1, Amphimedon_queenslandica_tr_A0A1X7TR13_A0A1X7TR13_AMPQE tr_A0A1X7TR13_A0A1X7TR13_AMPQE EGF-like domain-containing protein OS=Amphimedon queenslandica OX=400682 PE=4 SV=1, Amphimedon_queenslandica_tr_A0A1X7TH31_A0A1X7TH31_AMPQE tr_A0A1X7TH31_A0A1X7TH31_AMPQE EGF-like domain-containing protein OS=Amphimedon queenslandica OX=400682 PE=4 SV=1
OG0000007	Clytia_hemispherica_TCONS_00030157-protein TCONS_00030157-protein	Amphimedon_queenslandica_tr_A0A1X7TTF3_A0A1X7TTF3_AMPQE tr_A0A1X7TTF3_A0A1X7TTF3_AMPQE Uncharacterized protein OS=Amphimedon queenslandica OX=400682 PE=4 SV=1
OG0000008	Clytia_hemispherica_TCONS_00027161-protein TCONS_00027161-protein, Clytia_hemispherica_TCONS_00060667-protein TCONS_00060667-protein, Clytia_hemispherica_TCONS_00060626-protein TCONS_00060626-protein, Clytia_hemispherica_TCONS_00027172-protein TCONS_00027172-protein, Clytia_hemispherica_TCONS_00027164-protein TCONS_00027164-protein	Amphimedon_queenslandica_tr_A0A1X7V143_A0A1X7V143_AMPQE tr_A0A1X7V143_A0A1X7V143_AMPQE Uncharacterized protein OS=Amphimedon queenslandica OX=400682 GN=100633932 PE=4 SV=1, Amphimedon_queenslandica_tr_A0A1X7SNK1_A0A1X7SNK1_AMPQE tr_A0A1X7SNK1_A0A1X7SNK1_AMPQE Uncharacterized protein OS=Amphimedon queenslandica OX=400682 PE=4 SV=1
OG0000008	Clytia_hemispherica_TCONS_00060669-protein TCONS_00060669-protein	Amphimedon_queenslandica_tr_A0A1X7VCQ2_A0A1X7VCQ2_AMPQE tr_A0A1X7VCQ2_A0A1X7VCQ2_AMPQE Uncharacterized protein OS=Amphimedon queenslandica OX=400682 PE=4 SV=1
OG0000008	Clytia_hemispherica_TCONS_00026307-protein TCONS_00026307-protein	Amphimedon_queenslandica_tr_A0A1X7UBZ1_A0A1X7UBZ1_AMPQE tr_A0A1X7UBZ1_A0A1X7UBZ1_AMPQE Uncharacterized protein OS=Amphimedon queenslandica OX=400682 PE=4 SV=1, Amphimedon_queenslandica_tr_A0A1X7TSH4_A0A1X7TSH4_AMPQE tr_A0A1X7TSH4_A0A1X7TSH4_AMPQE Uncharacterized protein OS=Amphimedon queenslandica OX=400682 PE=4 SV=1, Amphimedon_queenslandica_tr_A0A1X7V9A5_A0A1X7V9A5_AMPQE tr_A0A1X7V9A5_A0A1X7V9A5_AMPQE Uncharacterized protein OS=Amphimedon queenslandica OX=400682 PE=4 SV=1, Amphimedon_queenslandica_tr_A0A1X7V7Z4_A0A1X7V7Z4_AMPQE tr_A0A1X7V7Z4_A0A1X7V7Z4_AMPQE Uncharacterized protein OS=Amphimedon queenslandica OX=400682 GN=105312177 PE=4 SV=1, Amphimedon_queenslandica_tr_A0A1X7V9F3_A0A1X7V9F3_AMPQE tr_A0A1X7V9F3_A0A1X7V9F3_AMPQE Uncharacterized protein OS=Amphimedon queenslandica OX=400682 PE=4 SV=1, Amphimedon_queenslandica_tr_A0A1X7V328_A0A1X7V328_AMPQE tr_A0A1X7V328_A0A1X7V328_AMPQE Uncharacterized protein OS=Amphimedon queenslandica OX=400682 GN=109581420 PE=3 SV=1, Amphimedon_queenslandica_tr_A0A1X7SNY2_A0A1X7SNY2_AMPQE tr_A0A1X7SNY2_A0A1X7SNY2_AMPQE Uncharacterized protein OS=Amphimedon queenslandica OX=400682 PE=4 SV=1, Amphimedon_queenslandica_tr_A0A1X7T6V2_A0A1X7T6V2_AMPQE tr_A0A1X7T6V2_A0A1X7T6V2_AMPQE Uncharacterized protein OS=Amphimedon queenslandica OX=400682 PE=4 SV=1
OG0000008	Clytia_hemispherica_TCONS_00073669-protein TCONS_00073669-protein	Amphimedon_queenslandica_tr_A0A1X7V844_A0A1X7V844_AMPQE tr_A0A1X7V844_A0A1X7V844_AMPQE Uncharacterized protein OS=Amphimedon queenslandica OX=400682 GN=105312186 PE=4 SV=1
OG0000009	Clytia_hemispherica_TCONS_00004070-protein TCONS_00004070-protein	Amphimedon_queenslandica_tr_A0A1X7VLX5_A0A1X7VLX5_AMPQE tr_A0A1X7VLX5_A0A1X7VLX5_AMPQE Uncharacterized protein OS=Amphimedon queenslandica OX=400682 GN=105316580 PE=4 SV=1
OG0000010	Clytia_hemispherica_TCONS_00059787-protein TCONS_00059787-protein	Amphimedon_queenslandica_tr_A0A1X7T9W5_A0A1X7T9W5_AMPQE tr_A0A1X7T9W5_A0A1X7T9W5_AMPQE Ig-like domain-containing protein OS=Amphimedon queenslandica OX=400682 PE=4 SV=1
