Orthogroup	Placozoa_Trichoplacidae_Trichoplax_spec-H2	Ctenophora_Tentaculata_Pleurobrachia_bachei
OG0000001	Trichoplax_specH2_tr_A0A369SGJ7_A0A369SGJ7_9METZ tr|A0A369SGJ7|A0A369SGJ7_9METZ Laminin subunit beta-1 OS=Trichoplax sp. H2 OX=287889 GN=TrispH2_001775 PE=4 SV=1	Pleurobrachia_bachei_sb_2652422_ sb_2652422_
OG0000001	Trichoplax_specH2_tr_A0A369SD60_A0A369SD60_9METZ tr|A0A369SD60|A0A369SD60_9METZ Netrin-1 OS=Trichoplax sp. H2 OX=287889 GN=TrispH2_003497 PE=4 SV=1, Trichoplax_specH2_tr_A0A369S4Q1_A0A369S4Q1_9METZ tr|A0A369S4Q1|A0A369S4Q1_9METZ Netrin unc-6 OS=Trichoplax sp. H2 OX=287889 GN=TrispH2_006376 PE=4 SV=1	Pleurobrachia_bachei_sb_2653902_ sb_2653902_
OG0000001	Trichoplax_specH2_tr_A0A369SBY2_A0A369SBY2_9METZ tr|A0A369SBY2|A0A369SBY2_9METZ Laminin subunit gamma-1 OS=Trichoplax sp. H2 OX=287889 GN=TrispH2_003028 PE=4 SV=1	Pleurobrachia_bachei_sb_2656958_ sb_2656958_, Pleurobrachia_bachei_sb_2651191_ sb_2651191_
OG0000002	Trichoplax_specH2_tr_A0A369RVI4_A0A369RVI4_9METZ tr|A0A369RVI4|A0A369RVI4_9METZ Thrombospondin-3a OS=Trichoplax sp. H2 OX=287889 GN=TrispH2_009811 PE=3 SV=1	Pleurobrachia_bachei_sb_2659350_ sb_2659350_
OG0000003	Trichoplax_specH2_tr_A0A369RRG2_A0A369RRG2_9METZ tr|A0A369RRG2|A0A369RRG2_9METZ EGF-like domain-containing protein OS=Trichoplax sp. H2 OX=287889 GN=TrispH2_010065 PE=4 SV=1	Pleurobrachia_bachei_sb_2666979_ sb_2666979_
OG0000005	Trichoplax_specH2_tr_A0A369RXS2_A0A369RXS2_9METZ tr|A0A369RXS2|A0A369RXS2_9METZ Metalloendopeptidase OS=Trichoplax sp. H2 OX=287889 GN=TrispH2_008764 PE=4 SV=1, Trichoplax_specH2_tr_A0A369RXS7_A0A369RXS7_9METZ tr|A0A369RXS7|A0A369RXS7_9METZ Metalloendopeptidase OS=Trichoplax sp. H2 OX=287889 GN=TrispH2_008765 PE=4 SV=1, Trichoplax_specH2_tr_A0A369RVQ8_A0A369RVQ8_9METZ tr|A0A369RVQ8|A0A369RVQ8_9METZ Metalloendopeptidase OS=Trichoplax sp. H2 OX=287889 GN=TrispH2_009194 PE=4 SV=1, Trichoplax_specH2_tr_A0A369S221_A0A369S221_9METZ tr|A0A369S221|A0A369S221_9METZ Metalloendopeptidase OS=Trichoplax sp. H2 OX=287889 GN=TrispH2_007517 PE=4 SV=1, Trichoplax_specH2_tr_A0A369RTA1_A0A369RTA1_9METZ tr|A0A369RTA1|A0A369RTA1_9METZ Metalloendopeptidase OS=Trichoplax sp. H2 OX=287889 GN=TrispH2_010451 PE=4 SV=1, Trichoplax_specH2_tr_A0A369SCL3_A0A369SCL3_9METZ tr|A0A369SCL3|A0A369SCL3_9METZ Metalloendopeptidase OS=Trichoplax sp. H2 OX=287889 GN=TrispH2_003256 PE=4 SV=1	Pleurobrachia_bachei_sb_2653163_ sb_2653163_, Pleurobrachia_bachei_sb_2665088_ sb_2665088_, Pleurobrachia_bachei_sb_2642012_ sb_2642012_, Pleurobrachia_bachei_sb_2654112_ sb_2654112_, Pleurobrachia_bachei_sb_2651359_ sb_2651359_
OG0000007	Trichoplax_specH2_tr_A0A369S9B7_A0A369S9B7_9METZ tr|A0A369S9B7|A0A369S9B7_9METZ Hemicentin-1 OS=Trichoplax sp. H2 OX=287889 GN=TrispH2_004103 PE=4 SV=1	Pleurobrachia_bachei_sb_2647954_ sb_2647954_, Pleurobrachia_bachei_sb_2638238_ sb_2638238_
OG0000008	Trichoplax_specH2_tr_A0A369RQA9_A0A369RQA9_9METZ tr|A0A369RQA9|A0A369RQA9_9METZ Neurogenic locus notch-like protein 3 OS=Trichoplax sp. H2 OX=287889 GN=TrispH2_010771 PE=4 SV=1	Pleurobrachia_bachei_sb_2663865_ sb_2663865_
OG0000010	Trichoplax_specH2_tr_A0A369S805_A0A369S805_9METZ tr|A0A369S805|A0A369S805_9METZ Fibrillin-1 OS=Trichoplax sp. H2 OX=287889 GN=TrispH2_004981 PE=4 SV=1, Trichoplax_specH2_tr_A0A369SGZ7_A0A369SGZ7_9METZ tr|A0A369SGZ7|A0A369SGZ7_9METZ Follistatin OS=Trichoplax sp. H2 OX=287889 GN=TrispH2_002122 PE=4 SV=1	Pleurobrachia_bachei_sb_2653999_ sb_2653999_
OG0000011	Trichoplax_specH2_tr_A0A369SG72_A0A369SG72_9METZ tr|A0A369SG72|A0A369SG72_9METZ Plasminogen OS=Trichoplax sp. H2 OX=287889 GN=TrispH2_001906 PE=4 SV=1	Pleurobrachia_bachei_sb_2646994_ sb_2646994_, Pleurobrachia_bachei_sb_2669487_ sb_2669487_, Pleurobrachia_bachei_sb_2641704_ sb_2641704_
OG0000011	Trichoplax_specH2_tr_A0A369SG46_A0A369SG46_9METZ tr|A0A369SG46|A0A369SG46_9METZ Plasminogen OS=Trichoplax sp. H2 OX=287889 GN=TrispH2_003216 PE=4 SV=1, Trichoplax_specH2_tr_A0A369RQ32_A0A369RQ32_9METZ tr|A0A369RQ32|A0A369RQ32_9METZ Hepatocyte growth factor-like protein OS=Trichoplax sp. H2 OX=287889 GN=TrispH2_011475 PE=4 SV=1, Trichoplax_specH2_tr_A0A369RUX0_A0A369RUX0_9METZ tr|A0A369RUX0|A0A369RUX0_9METZ Plasminogen OS=Trichoplax sp. H2 OX=287889 GN=TrispH2_009661 PE=4 SV=1, Trichoplax_specH2_tr_A0A369RUZ3_A0A369RUZ3_9METZ tr|A0A369RUZ3|A0A369RUZ3_9METZ Plasminogen OS=Trichoplax sp. H2 OX=287889 GN=TrispH2_009071 PE=4 SV=1, Trichoplax_specH2_tr_A0A369RNX8_A0A369RNX8_9METZ tr|A0A369RNX8|A0A369RNX8_9METZ Neurotrypsin OS=Trichoplax sp. H2 OX=287889 GN=TrispH2_011681 PE=4 SV=1, Trichoplax_specH2_tr_A0A369RPG0_A0A369RPG0_9METZ tr|A0A369RPG0|A0A369RPG0_9METZ Neurotrypsin OS=Trichoplax sp. H2 OX=287889 GN=TrispH2_011806 PE=4 SV=1, Trichoplax_specH2_tr_A0A369S0J0_A0A369S0J0_9METZ tr|A0A369S0J0|A0A369S0J0_9METZ Antigen WC1.1 OS=Trichoplax sp. H2 OX=287889 GN=TrispH2_008475 PE=4 SV=1, Trichoplax_specH2_tr_A0A369SEP3_A0A369SEP3_9METZ tr|A0A369SEP3|A0A369SEP3_9METZ Plasminogen OS=Trichoplax sp. H2 OX=287889 GN=TrispH2_003221 PE=4 SV=1, Trichoplax_specH2_tr_A0A369RSM3_A0A369RSM3_9METZ tr|A0A369RSM3|A0A369RSM3_9METZ Hyaluronan-binding protein 2 OS=Trichoplax sp. H2 OX=287889 GN=TrispH2_010599 PE=4 SV=1, Trichoplax_specH2_tr_A0A369RSF0_A0A369RSF0_9METZ tr|A0A369RSF0|A0A369RSF0_9METZ Hepatocyte growth factor-like protein OS=Trichoplax sp. H2 OX=287889 GN=TrispH2_010598 PE=4 SV=1, Trichoplax_specH2_tr_A0A369RRY9_A0A369RRY9_9METZ tr|A0A369RRY9|A0A369RRY9_9METZ MAM and LDL-receptor class A domain-containing protein 2 OS=Trichoplax sp. H2 OX=287889 GN=TrispH2_010597 PE=4 SV=1, Trichoplax_specH2_tr_A0A369RRA5_A0A369RRA5_9METZ tr|A0A369RRA5|A0A369RRA5_9METZ MAM and LDL-receptor class A domain-containing protein 2 OS=Trichoplax sp. H2 OX=287889 GN=TrispH2_010596 PE=4 SV=1, Trichoplax_specH2_tr_A0A369RRQ1_A0A369RRQ1_9METZ tr|A0A369RRQ1|A0A369RRQ1_9METZ MAM and LDL-receptor class A domain-containing protein 2 OS=Trichoplax sp. H2 OX=287889 GN=TrispH2_010595 PE=4 SV=1, Trichoplax_specH2_tr_A0A369SDE6_A0A369SDE6_9METZ tr|A0A369SDE6|A0A369SDE6_9METZ MAM and LDL-receptor class A domain-containing protein 1 OS=Trichoplax sp. H2 OX=287889 GN=TrispH2_003222 PE=4 SV=1, Trichoplax_specH2_tr_A0A369SE49_A0A369SE49_9METZ tr|A0A369SE49|A0A369SE49_9METZ Neurotrypsin OS=Trichoplax sp. H2 OX=287889 GN=TrispH2_002984 PE=4 SV=1, Trichoplax_specH2_tr_A0A369RZ52_A0A369RZ52_9METZ tr|A0A369RZ52|A0A369RZ52_9METZ Neurotrypsin OS=Trichoplax sp. H2 OX=287889 GN=TrispH2_007547 PE=4 SV=1, Trichoplax_specH2_tr_A0A369S6S6_A0A369S6S6_9METZ tr|A0A369S6S6|A0A369S6S6_9METZ Neurotrypsin OS=Trichoplax sp. H2 OX=287889 GN=TrispH2_006821 PE=4 SV=1, Trichoplax_specH2_tr_A0A369RQR2_A0A369RQR2_9METZ tr|A0A369RQR2|A0A369RQR2_9METZ Neurotrypsin OS=Trichoplax sp. H2 OX=287889 GN=TrispH2_010133 PE=4 SV=1	Pleurobrachia_bachei_sb_2661063_ sb_2661063_
OG0000011	Trichoplax_specH2_tr_A0A369RV82_A0A369RV82_9METZ tr|A0A369RV82|A0A369RV82_9METZ Kremen protein 1 OS=Trichoplax sp. H2 OX=287889 GN=TrispH2_007833 PE=4 SV=1	Pleurobrachia_bachei_sb_2660538_ sb_2660538_, Pleurobrachia_bachei_sb_2640534_ sb_2640534_, Pleurobrachia_bachei_sb_2652995_ sb_2652995_
OG0000012	Trichoplax_specH2_tr_A0A369RVP1_A0A369RVP1_9METZ tr|A0A369RVP1|A0A369RVP1_9METZ SCO-spondin _Fragment_ OS=Trichoplax sp. H2 OX=287889 GN=TrispH2_008599 PE=4 SV=1	Pleurobrachia_bachei_sb_2646755_ sb_2646755_, Pleurobrachia_bachei_sb_2666898_ sb_2666898_, Pleurobrachia_bachei_sb_2651486_ sb_2651486_, Pleurobrachia_bachei_sb_2648597_ sb_2648597_
OG0000012	Trichoplax_specH2_tr_A0A369RQH6_A0A369RQH6_9METZ tr|A0A369RQH6|A0A369RQH6_9METZ Fibrillin-2 _Fragment_ OS=Trichoplax sp. H2 OX=287889 GN=TrispH2_011117 PE=4 SV=1, Trichoplax_specH2_tr_A0A369RVG2_A0A369RVG2_9METZ tr|A0A369RVG2|A0A369RVG2_9METZ BMP-binding endothelial regulator protein OS=Trichoplax sp. H2 OX=287889 GN=TrispH2_010308 PE=4 SV=1	Pleurobrachia_bachei_sb_2662653_ sb_2662653_, Pleurobrachia_bachei_sb_2662654_ sb_2662654_, Pleurobrachia_bachei_sb_2662655_ sb_2662655_, Pleurobrachia_bachei_sb_2650533_ sb_2650533_, Pleurobrachia_bachei_sb_2642902_ sb_2642902_, Pleurobrachia_bachei_sb_2653924_ sb_2653924_, Pleurobrachia_bachei_sb_2638518_ sb_2638518_, Pleurobrachia_bachei_sb_2669102_ sb_2669102_, Pleurobrachia_bachei_sb_2647317_ sb_2647317_, Pleurobrachia_bachei_sb_2649652_ sb_2649652_, Pleurobrachia_bachei_sb_2648688_ sb_2648688_, Pleurobrachia_bachei_sb_2663772_ sb_2663772_, Pleurobrachia_bachei_sb_2643491_ sb_2643491_, Pleurobrachia_bachei_sb_2668726_ sb_2668726_
OG0000013	Trichoplax_specH2_tr_A0A369RPH7_A0A369RPH7_9METZ tr|A0A369RPH7|A0A369RPH7_9METZ Protein Wnt _Fragment_ OS=Trichoplax sp. H2 OX=287889 GN=TrispH2_011947 PE=3 SV=1, Trichoplax_specH2_tr_A0A369RU23_A0A369RU23_9METZ tr|A0A369RU23|A0A369RU23_9METZ Protein Wnt OS=Trichoplax sp. H2 OX=287889 GN=TrispH2_009161 PE=3 SV=1	Pleurobrachia_bachei_sb_2658374_ sb_2658374_
OG0000015	Trichoplax_specH2_tr_A0A369RPZ6_A0A369RPZ6_9METZ tr|A0A369RPZ6|A0A369RPZ6_9METZ Oncoprotein-induced transcript 3 protein OS=Trichoplax sp. H2 OX=287889 GN=TrispH2_011015 PE=4 SV=1, Trichoplax_specH2_tr_A0A369RZH8_A0A369RZH8_9METZ tr|A0A369RZH8|A0A369RZH8_9METZ Oncoprotein-induced transcript 3 protein OS=Trichoplax sp. H2 OX=287889 GN=TrispH2_007988 PE=4 SV=1	Pleurobrachia_bachei_sb_2660649_ sb_2660649_
OG0000018	Trichoplax_specH2_tr_A0A369RVY6_A0A369RVY6_9METZ tr|A0A369RVY6|A0A369RVY6_9METZ Fibropellin-1 OS=Trichoplax sp. H2 OX=287889 GN=TrispH2_009781 PE=4 SV=1	Pleurobrachia_bachei_sb_2648056_ sb_2648056_, Pleurobrachia_bachei_sb_2667738_ sb_2667738_
OG0000019	Trichoplax_specH2_tr_A0A369SCW4_A0A369SCW4_9METZ tr|A0A369SCW4|A0A369SCW4_9METZ Bone morphogenetic protein 7 OS=Trichoplax sp. H2 OX=287889 GN=TrispH2_002915 PE=3 SV=1, Trichoplax_specH2_tr_A0A369S437_A0A369S437_9METZ tr|A0A369S437|A0A369S437_9METZ Bone morphogenetic protein 7 OS=Trichoplax sp. H2 OX=287889 GN=TrispH2_006205 PE=3 SV=1, Trichoplax_specH2_tr_A0A369SLN1_A0A369SLN1_9METZ tr|A0A369SLN1|A0A369SLN1_9METZ Bone morphogenetic protein 2 OS=Trichoplax sp. H2 OX=287889 GN=TrispH2_000628 PE=3 SV=1, Trichoplax_specH2_tr_A0A369SEF4_A0A369SEF4_9METZ tr|A0A369SEF4|A0A369SEF4_9METZ Bone morphogenetic protein 4 OS=Trichoplax sp. H2 OX=287889 GN=TrispH2_002393 PE=3 SV=1	Pleurobrachia_bachei_sb_2641584_ sb_2641584_
OG0000022	Trichoplax_specH2_tr_A0A369SEG5_A0A369SEG5_9METZ tr|A0A369SEG5|A0A369SEG5_9METZ Annexin A13 OS=Trichoplax sp. H2 OX=287889 GN=TrispH2_002403 PE=3 SV=1, Trichoplax_specH2_tr_A0A369SEN0_A0A369SEN0_9METZ tr|A0A369SEN0|A0A369SEN0_9METZ Annexin OS=Trichoplax sp. H2 OX=287889 GN=TrispH2_002298 PE=3 SV=1	Pleurobrachia_bachei_sb_2639090_ sb_2639090_, Pleurobrachia_bachei_sb_2646697_ sb_2646697_, Pleurobrachia_bachei_sb_2657768_ sb_2657768_, Pleurobrachia_bachei_sb_2659001_ sb_2659001_
OG0000022	Trichoplax_specH2_tr_A0A369SFY9_A0A369SFY9_9METZ tr|A0A369SFY9|A0A369SFY9_9METZ Annexin OS=Trichoplax sp. H2 OX=287889 GN=TrispH2_002457 PE=3 SV=1, Trichoplax_specH2_tr_A0A369RNY4_A0A369RNY4_9METZ tr|A0A369RNY4|A0A369RNY4_9METZ Annexin OS=Trichoplax sp. H2 OX=287889 GN=TrispH2_011427 PE=3 SV=1	Pleurobrachia_bachei_sb_2664400_ sb_2664400_, Pleurobrachia_bachei_sb_2669029_ sb_2669029_, Pleurobrachia_bachei_sb_2669026_ sb_2669026_
OG0000024	Trichoplax_specH2_tr_A0A369S7Y3_A0A369S7Y3_9METZ tr|A0A369S7Y3|A0A369S7Y3_9METZ Equistatin OS=Trichoplax sp. H2 OX=287889 GN=TrispH2_005616 PE=4 SV=1	Pleurobrachia_bachei_sb_2642401_ sb_2642401_, Pleurobrachia_bachei_sb_2666091_ sb_2666091_, Pleurobrachia_bachei_sb_2668118_ sb_2668118_, Pleurobrachia_bachei_sb_2639255_ sb_2639255_
OG0000024	Trichoplax_specH2_tr_A0A369RTM3_A0A369RTM3_9METZ tr|A0A369RTM3|A0A369RTM3_9METZ Boophilin-H2 OS=Trichoplax sp. H2 OX=287889 GN=TrispH2_009566 PE=4 SV=1	Pleurobrachia_bachei_sb_2659893_ sb_2659893_
OG0000028	Trichoplax_specH2_tr_A0A369SN44_A0A369SN44_9METZ tr|A0A369SN44|A0A369SN44_9METZ Collagen alpha-1_IV_ chain OS=Trichoplax sp. H2 OX=287889 GN=TrispH2_000807 PE=4 SV=1, Trichoplax_specH2_tr_A0A369SLF9_A0A369SLF9_9METZ tr|A0A369SLF9|A0A369SLF9_9METZ Collagen alpha-1_IV_ chain OS=Trichoplax sp. H2 OX=287889 GN=TrispH2_000806 PE=4 SV=1	Pleurobrachia_bachei_sb_2641475_ sb_2641475_, Pleurobrachia_bachei_sb_2668107_ sb_2668107_, Pleurobrachia_bachei_sb_2645065_ sb_2645065_, Pleurobrachia_bachei_sb_2664067_ sb_2664067_, Pleurobrachia_bachei_sb_2657347_ sb_2657347_, Pleurobrachia_bachei_sb_2641871_ sb_2641871_, Pleurobrachia_bachei_sb_2663219_ sb_2663219_, Pleurobrachia_bachei_sb_2663218_ sb_2663218_, Pleurobrachia_bachei_sb_2660067_ sb_2660067_, Pleurobrachia_bachei_sb_2660069_ sb_2660069_, Pleurobrachia_bachei_sb_2647124_ sb_2647124_, Pleurobrachia_bachei_sb_2663221_ sb_2663221_, Pleurobrachia_bachei_sb_2651590_ sb_2651590_, Pleurobrachia_bachei_sb_2662150_ sb_2662150_
OG0000030	Trichoplax_specH2_tr_A0A369S5E1_A0A369S5E1_9METZ tr|A0A369S5E1|A0A369S5E1_9METZ ADAM 17-like protease OS=Trichoplax sp. H2 OX=287889 GN=TrispH2_005778 PE=4 SV=1	Pleurobrachia_bachei_sb_2669546_ sb_2669546_, Pleurobrachia_bachei_sb_2648059_ sb_2648059_, Pleurobrachia_bachei_sb_2657674_ sb_2657674_, Pleurobrachia_bachei_sb_2655687_ sb_2655687_
OG0000030	Trichoplax_specH2_tr_A0A369SER2_A0A369SER2_9METZ tr|A0A369SER2|A0A369SER2_9METZ Disintegrin and metalloproteinase domain-containing protein 10 OS=Trichoplax sp. H2 OX=287889 GN=TrispH2_003217 PE=4 SV=1, Trichoplax_specH2_tr_A0A369S7J2_A0A369S7J2_9METZ tr|A0A369S7J2|A0A369S7J2_9METZ Disintegrin and metalloproteinase domain-containing protein 10 OS=Trichoplax sp. H2 OX=287889 GN=TrispH2_005268 PE=4 SV=1, Trichoplax_specH2_tr_A0A369RXA9_A0A369RXA9_9METZ tr|A0A369RXA9|A0A369RXA9_9METZ Disintegrin and metalloproteinase domain-containing protein 10 OS=Trichoplax sp. H2 OX=287889 GN=TrispH2_009082 PE=4 SV=1, Trichoplax_specH2_tr_A0A369RV51_A0A369RV51_9METZ tr|A0A369RV51|A0A369RV51_9METZ Disintegrin and metalloproteinase domain-containing protein 10 OS=Trichoplax sp. H2 OX=287889 GN=TrispH2_008658 PE=4 SV=1	Pleurobrachia_bachei_sb_2643788_ sb_2643788_, Pleurobrachia_bachei_sb_2660324_ sb_2660324_, Pleurobrachia_bachei_sb_2642194_ sb_2642194_
OG0000034	Trichoplax_specH2_tr_A0A369S1X9_A0A369S1X9_9METZ tr|A0A369S1X9|A0A369S1X9_9METZ Attractin-like protein 1 OS=Trichoplax sp. H2 OX=287889 GN=TrispH2_007083 PE=4 SV=1	Pleurobrachia_bachei_sb_2658465_ sb_2658465_
OG0000041	Trichoplax_specH2_tr_A0A369RUI5_A0A369RUI5_9METZ tr|A0A369RUI5|A0A369RUI5_9METZ Poly [ADP-ribose] polymerase OS=Trichoplax sp. H2 OX=287889 GN=TrispH2_009716 PE=3 SV=1, Trichoplax_specH2_tr_A0A369RVR9_A0A369RVR9_9METZ tr|A0A369RVR9|A0A369RVR9_9METZ Poly [ADP-ribose] polymerase OS=Trichoplax sp. H2 OX=287889 GN=TrispH2_009712 PE=3 SV=1	Pleurobrachia_bachei_sb_2662959_ sb_2662959_
OG0000045	Trichoplax_specH2_tr_A0A369SH79_A0A369SH79_9METZ tr|A0A369SH79|A0A369SH79_9METZ Laminin subunit alpha-1 OS=Trichoplax sp. H2 OX=287889 GN=TrispH2_001452 PE=4 SV=1	Pleurobrachia_bachei_sb_2652096_ sb_2652096_, Pleurobrachia_bachei_sb_2652094_ sb_2652094_
OG0000048	Trichoplax_specH2_tr_A0A369RPZ4_A0A369RPZ4_9METZ tr|A0A369RPZ4|A0A369RPZ4_9METZ Leucine-rich repeat-containing G-protein coupled receptor 4 OS=Trichoplax sp. H2 OX=287889 GN=TrispH2_011545 PE=4 SV=1, Trichoplax_specH2_tr_A0A369RYW5_A0A369RYW5_9METZ tr|A0A369RYW5|A0A369RYW5_9METZ Insulin-like growth factor-binding protein complex acid labile subunit OS=Trichoplax sp. H2 OX=287889 GN=TrispH2_008406 PE=4 SV=1	Pleurobrachia_bachei_sb_2663997_ sb_2663997_
OG0000049	Trichoplax_specH2_tr_A0A369S9H8_A0A369S9H8_9METZ tr|A0A369S9H8|A0A369S9H8_9METZ Plexin-A2 OS=Trichoplax sp. H2 OX=287889 GN=TrispH2_004244 PE=3 SV=1, Trichoplax_specH2_tr_A0A369SC16_A0A369SC16_9METZ tr|A0A369SC16|A0A369SC16_9METZ Plexin A3 OS=Trichoplax sp. H2 OX=287889 GN=TrispH2_004246 PE=3 SV=1	Pleurobrachia_bachei_sb_2663696_ sb_2663696_
OG0000051	Trichoplax_specH2_tr_A0A369SBR8_A0A369SBR8_9METZ tr|A0A369SBR8|A0A369SBR8_9METZ VWFA and cache domain-containing protein 1 OS=Trichoplax sp. H2 OX=287889 GN=TrispH2_004133 PE=4 SV=1, Trichoplax_specH2_tr_A0A369SAB3_A0A369SAB3_9METZ tr|A0A369SAB3|A0A369SAB3_9METZ Voltage-dependent calcium channel subunit alpha-2/delta-1 OS=Trichoplax sp. H2 OX=287889 GN=TrispH2_004901 PE=4 SV=1	Pleurobrachia_bachei_sb_2637527_ sb_2637527_, Pleurobrachia_bachei_sb_2653257_ sb_2653257_, Pleurobrachia_bachei_sb_2638879_ sb_2638879_, Pleurobrachia_bachei_sb_2661597_ sb_2661597_, Pleurobrachia_bachei_sb_2658565_ sb_2658565_, Pleurobrachia_bachei_sb_2646130_ sb_2646130_, Pleurobrachia_bachei_sb_2660715_ sb_2660715_, Pleurobrachia_bachei_sb_2650431_ sb_2650431_, Pleurobrachia_bachei_sb_2661717_ sb_2661717_, Pleurobrachia_bachei_sb_2659691_ sb_2659691_
OG0000054	Trichoplax_specH2_tr_A0A369S0G0_A0A369S0G0_9METZ tr|A0A369S0G0|A0A369S0G0_9METZ Leucine-rich repeat-containing protein 7 OS=Trichoplax sp. H2 OX=287889 GN=TrispH2_007703 PE=4 SV=1, Trichoplax_specH2_tr_A0A369S7Y8_A0A369S7Y8_9METZ tr|A0A369S7Y8|A0A369S7Y8_9METZ Leucine-rich repeat-containing protein 1 OS=Trichoplax sp. H2 OX=287889 GN=TrispH2_005790 PE=4 SV=1	Pleurobrachia_bachei_sb_2665304_ sb_2665304_
OG0000058	Trichoplax_specH2_tr_A0A369RQT7_A0A369RQT7_9METZ tr|A0A369RQT7|A0A369RQT7_9METZ Neurotrypsin OS=Trichoplax sp. H2 OX=287889 GN=TrispH2_010134 PE=4 SV=1, Trichoplax_specH2_tr_A0A369RTU2_A0A369RTU2_9METZ tr|A0A369RTU2|A0A369RTU2_9METZ MAM and LDL-receptor class A domain-containing protein 2 OS=Trichoplax sp. H2 OX=287889 GN=TrispH2_010594 PE=4 SV=1, Trichoplax_specH2_tr_A0A369S074_A0A369S074_9METZ tr|A0A369S074|A0A369S074_9METZ MAM and LDL-receptor class A domain-containing protein 2 OS=Trichoplax sp. H2 OX=287889 GN=TrispH2_008467 PE=4 SV=1	Pleurobrachia_bachei_sb_2667086_ sb_2667086_
OG0000061	Trichoplax_specH2_tr_A0A369RSA4_A0A369RSA4_9METZ tr|A0A369RSA4|A0A369RSA4_9METZ Copine-3 OS=Trichoplax sp. H2 OX=287889 GN=TrispH2_009324 PE=3 SV=1, Trichoplax_specH2_tr_A0A369SAQ3_A0A369SAQ3_9METZ tr|A0A369SAQ3|A0A369SAQ3_9METZ Copine-3 OS=Trichoplax sp. H2 OX=287889 GN=TrispH2_004213 PE=3 SV=1	Pleurobrachia_bachei_sb_2656184_ sb_2656184_
OG0000061	Trichoplax_specH2_tr_A0A369S1I2_A0A369S1I2_9METZ tr|A0A369S1I2|A0A369S1I2_9METZ Copine-8 OS=Trichoplax sp. H2 OX=287889 GN=TrispH2_007458 PE=3 SV=1, Trichoplax_specH2_tr_A0A369S101_A0A369S101_9METZ tr|A0A369S101|A0A369S101_9METZ Copine-8 OS=Trichoplax sp. H2 OX=287889 GN=TrispH2_007456 PE=3 SV=1, Trichoplax_specH2_tr_A0A369S108_A0A369S108_9METZ tr|A0A369S108|A0A369S108_9METZ Copine-5 OS=Trichoplax sp. H2 OX=287889 GN=TrispH2_007455 PE=3 SV=1, Trichoplax_specH2_tr_A0A369S1A7_A0A369S1A7_9METZ tr|A0A369S1A7|A0A369S1A7_9METZ Copine-8 OS=Trichoplax sp. H2 OX=287889 GN=TrispH2_007453 PE=3 SV=1	Pleurobrachia_bachei_sb_2650594_ sb_2650594_
OG0000065	Trichoplax_specH2_tr_A0A369RSU8_A0A369RSU8_9METZ tr|A0A369RSU8|A0A369RSU8_9METZ Glypican-1 OS=Trichoplax sp. H2 OX=287889 GN=TrispH2_011045 PE=3 SV=1	Pleurobrachia_bachei_sb_2651946_ sb_2651946_, Pleurobrachia_bachei_sb_2652826_ sb_2652826_, Pleurobrachia_bachei_sb_2639926_ sb_2639926_
OG0000076	Trichoplax_specH2_tr_A0A369SIH0_A0A369SIH0_9METZ tr|A0A369SIH0|A0A369SIH0_9METZ IgGFc-binding protein OS=Trichoplax sp. H2 OX=287889 GN=TrispH2_001042 PE=4 SV=1, Trichoplax_specH2_tr_A0A369SDE2_A0A369SDE2_9METZ tr|A0A369SDE2|A0A369SDE2_9METZ Neurogenic locus notch-like protein 1 OS=Trichoplax sp. H2 OX=287889 GN=TrispH2_003735 PE=4 SV=1, Trichoplax_specH2_tr_A0A369RRC8_A0A369RRC8_9METZ tr|A0A369RRC8|A0A369RRC8_9METZ Receptor-type tyrosine-protein phosphatase F _Fragment_ OS=Trichoplax sp. H2 OX=287889 GN=TrispH2_010153 PE=4 SV=1, Trichoplax_specH2_tr_A0A369S780_A0A369S780_9METZ tr|A0A369S780|A0A369S780_9METZ IgGFc-binding protein _Fragment_ OS=Trichoplax sp. H2 OX=287889 GN=TrispH2_004821 PE=4 SV=1	Pleurobrachia_bachei_sb_2649109_ sb_2649109_, Pleurobrachia_bachei_sb_2653383_ sb_2653383_
OG0000081	Trichoplax_specH2_tr_A0A369RU82_A0A369RU82_9METZ tr|A0A369RU82|A0A369RU82_9METZ Cysteine-rich with EGF-like domain protein 2-B OS=Trichoplax sp. H2 OX=287889 GN=TrispH2_010094 PE=3 SV=1	Pleurobrachia_bachei_sb_2661112_ sb_2661112_
OG0000087	Trichoplax_specH2_tr_A0A369RRF5_A0A369RRF5_9METZ tr|A0A369RRF5|A0A369RRF5_9METZ A-kinase anchor protein 9 OS=Trichoplax sp. H2 OX=287889 GN=TrispH2_010842 PE=4 SV=1	Pleurobrachia_bachei_sb_2638853_ sb_2638853_
OG0000087	Trichoplax_specH2_tr_A0A369SIZ0_A0A369SIZ0_9METZ tr|A0A369SIZ0|A0A369SIZ0_9METZ Peripheral-type benzodiazepine receptor-associated protein 1 OS=Trichoplax sp. H2 OX=287889 GN=TrispH2_002002 PE=3 SV=1	Pleurobrachia_bachei_sb_2655518_ sb_2655518_
OG0000088	Trichoplax_specH2_tr_A0A369S3Q5_A0A369S3Q5_9METZ tr|A0A369S3Q5|A0A369S3Q5_9METZ Spondin-1 OS=Trichoplax sp. H2 OX=287889 GN=TrispH2_005556 PE=4 SV=1	Pleurobrachia_bachei_sb_2642240_ sb_2642240_
OG0000094	Trichoplax_specH2_tr_A0A369S3W3_A0A369S3W3_9METZ tr|A0A369S3W3|A0A369S3W3_9METZ Leucine-rich repeat and calponin homology domain-containing protein 4 OS=Trichoplax sp. H2 OX=287889 GN=TrispH2_006311 PE=4 SV=1	Pleurobrachia_bachei_sb_2649790_ sb_2649790_
OG0000103	Trichoplax_specH2_tr_A0A369SHJ4_A0A369SHJ4_9METZ tr|A0A369SHJ4|A0A369SHJ4_9METZ Leucine-rich repeat-containing protein 49 OS=Trichoplax sp. H2 OX=287889 GN=TrispH2_001347 PE=4 SV=1	Pleurobrachia_bachei_sb_2660818_ sb_2660818_
OG0000119	Trichoplax_specH2_tr_A0A369S6X6_A0A369S6X6_9METZ tr|A0A369S6X6|A0A369S6X6_9METZ Leucine-rich repeat-containing protein 40 OS=Trichoplax sp. H2 OX=287889 GN=TrispH2_005295 PE=4 SV=1	Pleurobrachia_bachei_sb_2645666_ sb_2645666_, Pleurobrachia_bachei_sb_2669413_ sb_2669413_, Pleurobrachia_bachei_sb_2654209_ sb_2654209_, Pleurobrachia_bachei_sb_2654210_ sb_2654210_
OG0000133	Trichoplax_specH2_tr_A0A369RUT8_A0A369RUT8_9METZ tr|A0A369RUT8|A0A369RUT8_9METZ Leucine-rich repeat-containing protein 9 OS=Trichoplax sp. H2 OX=287889 GN=TrispH2_009164 PE=4 SV=1	Pleurobrachia_bachei_sb_2638205_ sb_2638205_
OG0000134	Trichoplax_specH2_tr_A0A369S5P2_A0A369S5P2_9METZ tr|A0A369S5P2|A0A369S5P2_9METZ Midasin OS=Trichoplax sp. H2 OX=287889 GN=TrispH2_005306 PE=3 SV=1	Pleurobrachia_bachei_sb_2657552_ sb_2657552_
OG0000138	Trichoplax_specH2_tr_A0A369S9F1_A0A369S9F1_9METZ tr|A0A369S9F1|A0A369S9F1_9METZ Usherin OS=Trichoplax sp. H2 OX=287889 GN=TrispH2_003954 PE=4 SV=1	Pleurobrachia_bachei_sb_2645404_ sb_2645404_, Pleurobrachia_bachei_sb_2662267_ sb_2662267_
OG0000146	Trichoplax_specH2_tr_A0A369RWD8_A0A369RWD8_9METZ tr|A0A369RWD8|A0A369RWD8_9METZ Volume-regulated anion channel subunit LRRC8A OS=Trichoplax sp. H2 OX=287889 GN=TrispH2_008603 PE=4 SV=1, Trichoplax_specH2_tr_A0A369RZY2_A0A369RZY2_9METZ tr|A0A369RZY2|A0A369RZY2_9METZ Leucine-rich repeat-containing protein 15 OS=Trichoplax sp. H2 OX=287889 GN=TrispH2_007672 PE=4 SV=1, Trichoplax_specH2_tr_A0A369S9L9_A0A369S9L9_9METZ tr|A0A369S9L9|A0A369S9L9_9METZ Leucine-rich repeat-containing protein 27 OS=Trichoplax sp. H2 OX=287889 GN=TrispH2_006595 PE=4 SV=1	Pleurobrachia_bachei_sb_2638266_ sb_2638266_
OG0000152	Trichoplax_specH2_tr_A0A369SCJ8_A0A369SCJ8_9METZ tr|A0A369SCJ8|A0A369SCJ8_9METZ Leucine-rich repeat protein soc-2-like protein OS=Trichoplax sp. H2 OX=287889 GN=TrispH2_003372 PE=4 SV=1	Pleurobrachia_bachei_sb_2656754_ sb_2656754_, Pleurobrachia_bachei_sb_2667777_ sb_2667777_, Pleurobrachia_bachei_sb_2638257_ sb_2638257_, Pleurobrachia_bachei_sb_2657752_ sb_2657752_, Pleurobrachia_bachei_sb_2643708_ sb_2643708_
OG0000156	Trichoplax_specH2_tr_A0A369S512_A0A369S512_9METZ tr|A0A369S512|A0A369S512_9METZ Microfibrillar-associated protein 1 OS=Trichoplax sp. H2 OX=287889 GN=TrispH2_005170 PE=3 SV=1	Pleurobrachia_bachei_sb_2660631_ sb_2660631_, Pleurobrachia_bachei_sb_2660632_ sb_2660632_
OG0000159	Trichoplax_specH2_tr_A0A369S617_A0A369S617_9METZ tr|A0A369S617|A0A369S617_9METZ Fibronectin type 3 and ankyrin repeat domains protein 1 OS=Trichoplax sp. H2 OX=287889 GN=TrispH2_005137 PE=4 SV=1	Pleurobrachia_bachei_sb_2666628_ sb_2666628_, Pleurobrachia_bachei_sb_2666626_ sb_2666626_
OG0000165	Trichoplax_specH2_tr_A0A369S6V3_A0A369S6V3_9METZ tr|A0A369S6V3|A0A369S6V3_9METZ Leucine-rich repeat-containing protein 58 OS=Trichoplax sp. H2 OX=287889 GN=TrispH2_007187 PE=4 SV=1	Pleurobrachia_bachei_sb_2662898_ sb_2662898_
OG0000166	Trichoplax_specH2_tr_A0A369SCT1_A0A369SCT1_9METZ tr|A0A369SCT1|A0A369SCT1_9METZ Secreted frizzled-related protein 3 OS=Trichoplax sp. H2 OX=287889 GN=TrispH2_003359 PE=4 SV=1	Pleurobrachia_bachei_sb_2639839_ sb_2639839_
OG0000171	Trichoplax_specH2_tr_A0A369SB05_A0A369SB05_9METZ tr|A0A369SB05|A0A369SB05_9METZ Peptide-N_4_-_N-acetyl-beta-glucosaminyl_asparagine amidase OS=Trichoplax sp. H2 OX=287889 GN=TrispH2_003946 PE=3 SV=1	Pleurobrachia_bachei_sb_2650981_ sb_2650981_
OG0000177	Trichoplax_specH2_tr_A0A369SCM1_A0A369SCM1_9METZ tr|A0A369SCM1|A0A369SCM1_9METZ Protein phosphatase 1 regulatory subunit 7 OS=Trichoplax sp. H2 OX=287889 GN=TrispH2_004666 PE=4 SV=1	Pleurobrachia_bachei_sb_2656763_ sb_2656763_
OG0000187	Trichoplax_specH2_tr_A0A369SB83_A0A369SB83_9METZ tr|A0A369SB83|A0A369SB83_9METZ Leucine-rich repeat-containing protein 69 OS=Trichoplax sp. H2 OX=287889 GN=TrispH2_003856 PE=4 SV=1	Pleurobrachia_bachei_sb_2656245_ sb_2656245_
OG0000192	Trichoplax_specH2_tr_A0A369S5A1_A0A369S5A1_9METZ tr|A0A369S5A1|A0A369S5A1_9METZ Protein flightless-1-like protein OS=Trichoplax sp. H2 OX=287889 GN=TrispH2_006167 PE=4 SV=1	Pleurobrachia_bachei_sb_2638886_ sb_2638886_
OG0000193	Trichoplax_specH2_tr_A0A369SL81_A0A369SL81_9METZ tr|A0A369SL81|A0A369SL81_9METZ poly_A_-specific ribonuclease OS=Trichoplax sp. H2 OX=287889 GN=TrispH2_000252 PE=3 SV=1	Pleurobrachia_bachei_sb_2667957_ sb_2667957_
OG0000194	Trichoplax_specH2_tr_A0A369SDN1_A0A369SDN1_9METZ tr|A0A369SDN1|A0A369SDN1_9METZ Leucine-rich repeat-containing protein 57 OS=Trichoplax sp. H2 OX=287889 GN=TrispH2_003128 PE=4 SV=1	Pleurobrachia_bachei_sb_2644221_ sb_2644221_, Pleurobrachia_bachei_sb_2653137_ sb_2653137_
OG0000195	Trichoplax_specH2_tr_A0A369SEK2_A0A369SEK2_9METZ tr|A0A369SEK2|A0A369SEK2_9METZ Ras suppressor protein 1 OS=Trichoplax sp. H2 OX=287889 GN=TrispH2_002282 PE=4 SV=1	Pleurobrachia_bachei_sb_2646890_ sb_2646890_, Pleurobrachia_bachei_sb_2645395_ sb_2645395_
