Orthogroup	Placozoa_Trichoplacidae_Trichoplax_spec-H2	Ctenophora_Tentaculata_Pleurobrachia_bachei
OG0000199	Trichoplax_specH2_tr_A0A369S9I3_A0A369S9I3_9METZ tr|A0A369S9I3|A0A369S9I3_9METZ 26S proteasome non-ATPase regulatory subunit 4 OS=Trichoplax sp. H2 OX=287889 GN=TrispH2_005037 PE=3 SV=1	Pleurobrachia_bachei_sb_2661537_ sb_2661537_
OG0000200	Trichoplax_specH2_tr_A0A369SIX8_A0A369SIX8_9METZ tr|A0A369SIX8|A0A369SIX8_9METZ von Willebrand factor A domain-containing protein 3B OS=Trichoplax sp. H2 OX=287889 GN=TrispH2_001129 PE=4 SV=1	Pleurobrachia_bachei_sb_2649701_ sb_2649701_
OG0000204	Trichoplax_specH2_tr_A0A369RR22_A0A369RR22_9METZ tr|A0A369RR22|A0A369RR22_9METZ Leucine-rich repeat-containing protein 59 OS=Trichoplax sp. H2 OX=287889 GN=TrispH2_011004 PE=4 SV=1	Pleurobrachia_bachei_sb_2656197_ sb_2656197_
OG0000209	Trichoplax_specH2_tr_A0A369S4D6_A0A369S4D6_9METZ tr|A0A369S4D6|A0A369S4D6_9METZ Integrator complex subunit 6-A OS=Trichoplax sp. H2 OX=287889 GN=TrispH2_006915 PE=4 SV=1	Pleurobrachia_bachei_sb_2649904_ sb_2649904_
OG0000210	Trichoplax_specH2_tr_A0A369SJG3_A0A369SJG3_9METZ tr|A0A369SJG3|A0A369SJG3_9METZ X-ray radiation resistance-associated protein 1 OS=Trichoplax sp. H2 OX=287889 GN=TrispH2_000966 PE=4 SV=1	Pleurobrachia_bachei_sb_2664616_ sb_2664616_
OG0000211	Trichoplax_specH2_tr_A0A369S995_A0A369S995_9METZ tr|A0A369S995|A0A369S995_9METZ Centriolin OS=Trichoplax sp. H2 OX=287889 GN=TrispH2_004094 PE=4 SV=1	Pleurobrachia_bachei_sb_2660965_ sb_2660965_
OG0000212	Trichoplax_specH2_tr_A0A369S958_A0A369S958_9METZ tr|A0A369S958|A0A369S958_9METZ E3 ubiquitin-protein ligase LRSAM1 OS=Trichoplax sp. H2 OX=287889 GN=TrispH2_004164 PE=4 SV=1	Pleurobrachia_bachei_sb_2659924_ sb_2659924_, Pleurobrachia_bachei_sb_2659926_ sb_2659926_
OG0000214	Trichoplax_specH2_tr_A0A369SIJ2_A0A369SIJ2_9METZ tr|A0A369SIJ2|A0A369SIJ2_9METZ Integrator complex subunit 14 OS=Trichoplax sp. H2 OX=287889 GN=TrispH2_001307 PE=3 SV=1	Pleurobrachia_bachei_sb_2668479_ sb_2668479_
OG0000229	Trichoplax_specH2_tr_A0A369RYG9_A0A369RYG9_9METZ tr|A0A369RYG9|A0A369RYG9_9METZ Leucine-rich repeat protein 1 OS=Trichoplax sp. H2 OX=287889 GN=TrispH2_009033 PE=4 SV=1	Pleurobrachia_bachei_sb_2641828_ sb_2641828_
OG0000238	Trichoplax_specH2_tr_A0A369RNH2_A0A369RNH2_9METZ tr|A0A369RNH2|A0A369RNH2_9METZ C-type lectin domain-containing protein OS=Trichoplax sp. H2 OX=287889 GN=TrispH2_011671 PE=4 SV=1	Pleurobrachia_bachei_sb_2639900_ sb_2639900_
OG0000239	Trichoplax_specH2_tr_A0A369S1A9_A0A369S1A9_9METZ tr|A0A369S1A9|A0A369S1A9_9METZ von Willebrand factor A domain-containing protein 3B OS=Trichoplax sp. H2 OX=287889 GN=TrispH2_007298 PE=4 SV=1	Pleurobrachia_bachei_sb_2664913_ sb_2664913_
OG0000274	Trichoplax_specH2_tr_A0A369SBH0_A0A369SBH0_9METZ tr|A0A369SBH0|A0A369SBH0_9METZ Leucine-rich repeat-containing protein 23 OS=Trichoplax sp. H2 OX=287889 GN=TrispH2_004687 PE=4 SV=1	Pleurobrachia_bachei_sb_2643436_ sb_2643436_
OG0000348	Trichoplax_specH2_tr_A0A369RXF9_A0A369RXF9_9METZ tr|A0A369RXF9|A0A369RXF9_9METZ Chondroadherin OS=Trichoplax sp. H2 OX=287889 GN=TrispH2_008135 PE=4 SV=1	Pleurobrachia_bachei_sb_2643644_ sb_2643644_
OG0000454	Trichoplax_specH2_tr_A0A369SDF6_A0A369SDF6_9METZ tr|A0A369SDF6|A0A369SDF6_9METZ Neurotrypsin OS=Trichoplax sp. H2 OX=287889 GN=TrispH2_003218 PE=4 SV=1	Pleurobrachia_bachei_sb_2663859_ sb_2663859_, Pleurobrachia_bachei_sb_2653046_ sb_2653046_
OG0000538	Trichoplax_specH2_tr_A0A369RUK3_A0A369RUK3_9METZ tr|A0A369RUK3|A0A369RUK3_9METZ Protocadherin Fat 4 OS=Trichoplax sp. H2 OX=287889 GN=TrispH2_008570 PE=4 SV=1	Pleurobrachia_bachei_sb_2661751_ sb_2661751_
OG0000659	Trichoplax_specH2_tr_A0A369RUI0_A0A369RUI0_9METZ tr|A0A369RUI0|A0A369RUI0_9METZ Leucine-rich repeat-containing protein 15 OS=Trichoplax sp. H2 OX=287889 GN=TrispH2_009863 PE=4 SV=1	Pleurobrachia_bachei_sb_2663207_ sb_2663207_
OG0000923	Trichoplax_specH2_tr_A0A369S3Z7_A0A369S3Z7_9METZ tr|A0A369S3Z7|A0A369S3Z7_9METZ Kielin/chordin-like protein OS=Trichoplax sp. H2 OX=287889 GN=TrispH2_006304 PE=4 SV=1	Pleurobrachia_bachei_sb_2659197_ sb_2659197_, Pleurobrachia_bachei_sb_2649467_ sb_2649467_
OG0001383	Trichoplax_specH2_tr_A0A369SF44_A0A369SF44_9METZ tr|A0A369SF44|A0A369SF44_9METZ Leucine-rich repeat neuronal protein 2 OS=Trichoplax sp. H2 OX=287889 GN=TrispH2_003004 PE=4 SV=1	Pleurobrachia_bachei_sb_2660930_ sb_2660930_
