Orthogroup	Placozoa_Trichoplacidae_Trichoplax_spec-H2	Cnidaria_Anthozoa_Stylophora_pistillata
OG0000018	Trichoplax_specH2_tr_A0A369RS12_A0A369RS12_9METZ tr|A0A369RS12|A0A369RS12_9METZ Neurogenic locus Notch protein _Fragment_ OS=Trichoplax sp. H2 OX=287889 GN=TrispH2_010937 PE=4 SV=1, Trichoplax_specH2_tr_A0A369RLU0_A0A369RLU0_9METZ tr|A0A369RLU0|A0A369RLU0_9METZ Scavenger receptor cysteine-rich domain superfamily protein _Fragment_ OS=Trichoplax sp. H2 OX=287889 GN=TrispH2_012026 PE=4 SV=1, Trichoplax_specH2_tr_A0A369SBL6_A0A369SBL6_9METZ tr|A0A369SBL6|A0A369SBL6_9METZ Neurogenic locus notch-like protein 1 OS=Trichoplax sp. H2 OX=287889 GN=TrispH2_003460 PE=4 SV=1, Trichoplax_specH2_tr_A0A369S179_A0A369S179_9METZ tr|A0A369S179|A0A369S179_9METZ Deleted in malignant brain tumors 1 protein _Fragment_ OS=Trichoplax sp. H2 OX=287889 GN=TrispH2_007263 PE=4 SV=1, Trichoplax_specH2_tr_A0A369RNM2_A0A369RNM2_9METZ tr|A0A369RNM2|A0A369RNM2_9METZ Scavenger receptor cysteine-rich domain superfamily protein _Fragment_ OS=Trichoplax sp. H2 OX=287889 GN=TrispH2_011888 PE=4 SV=1, Trichoplax_specH2_tr_A0A369S394_A0A369S394_9METZ tr|A0A369S394|A0A369S394_9METZ Deleted in malignant brain tumors 1 protein OS=Trichoplax sp. H2 OX=287889 GN=TrispH2_005649 PE=4 SV=1, Trichoplax_specH2_tr_A0A369RNE8_A0A369RNE8_9METZ tr|A0A369RNE8|A0A369RNE8_9METZ Scavenger receptor cysteine-rich domain superfamily protein OS=Trichoplax sp. H2 OX=287889 GN=TrispH2_011666 PE=4 SV=1, Trichoplax_specH2_tr_A0A369S0X8_A0A369S0X8_9METZ tr|A0A369S0X8|A0A369S0X8_9METZ Deleted in malignant brain tumors 1 protein _Fragment_ OS=Trichoplax sp. H2 OX=287889 GN=TrispH2_007445 PE=4 SV=1, Trichoplax_specH2_tr_A0A369S5N9_A0A369S5N9_9METZ tr|A0A369S5N9|A0A369S5N9_9METZ Deleted in malignant brain tumors 1 protein OS=Trichoplax sp. H2 OX=287889 GN=TrispH2_005286 PE=4 SV=1, Trichoplax_specH2_tr_A0A369RV21_A0A369RV21_9METZ tr|A0A369RV21|A0A369RV21_9METZ Deleted in malignant brain tumors 1 protein OS=Trichoplax sp. H2 OX=287889 GN=TrispH2_009063 PE=4 SV=1, Trichoplax_specH2_tr_A0A369SFS7_A0A369SFS7_9METZ tr|A0A369SFS7|A0A369SFS7_9METZ Deleted in malignant brain tumors 1 protein OS=Trichoplax sp. H2 OX=287889 GN=TrispH2_002800 PE=4 SV=1, Trichoplax_specH2_tr_A0A369SFF2_A0A369SFF2_9METZ tr|A0A369SFF2|A0A369SFF2_9METZ Deleted in malignant brain tumors 1 protein OS=Trichoplax sp. H2 OX=287889 GN=TrispH2_002801 PE=4 SV=1, Trichoplax_specH2_tr_A0A369SFG1_A0A369SFG1_9METZ tr|A0A369SFG1|A0A369SFG1_9METZ Deleted in malignant brain tumors 1 protein OS=Trichoplax sp. H2 OX=287889 GN=TrispH2_002804 PE=4 SV=1, Trichoplax_specH2_tr_A0A369SFL5_A0A369SFL5_9METZ tr|A0A369SFL5|A0A369SFL5_9METZ Deleted in malignant brain tumors 1 protein OS=Trichoplax sp. H2 OX=287889 GN=TrispH2_002803 PE=4 SV=1, Trichoplax_specH2_tr_A0A369S4B2_A0A369S4B2_9METZ tr|A0A369S4B2|A0A369S4B2_9METZ Deleted in malignant brain tumors 1 protein OS=Trichoplax sp. H2 OX=287889 GN=TrispH2_005663 PE=4 SV=1, Trichoplax_specH2_tr_A0A369RQM6_A0A369RQM6_9METZ tr|A0A369RQM6|A0A369RQM6_9METZ Neurogenic locus Notch protein _Fragment_ OS=Trichoplax sp. H2 OX=287889 GN=TrispH2_011146 PE=4 SV=1	Stylophora_pistillata_Spis18453 Spis18453 SpisGene18453, Stylophora_pistillata_Spis14524 Spis14524 SpisGene14524, Stylophora_pistillata_Spis18452 Spis18452 SpisGene18452
OG0000018	Trichoplax_specH2_tr_A0A369RVY6_A0A369RVY6_9METZ tr|A0A369RVY6|A0A369RVY6_9METZ Fibropellin-1 OS=Trichoplax sp. H2 OX=287889 GN=TrispH2_009781 PE=4 SV=1	Stylophora_pistillata_Spis15398 Spis15398 SpisGene15398, Stylophora_pistillata_Spis17286.t1 Spis17286.t1 SpisGene17286, Stylophora_pistillata_Spis11637 Spis11637 SpisGene11637
OG0000019	Trichoplax_specH2_tr_A0A369SHA9_A0A369SHA9_9METZ tr|A0A369SHA9|A0A369SHA9_9METZ Growth/differentiation factor 8 OS=Trichoplax sp. H2 OX=287889 GN=TrispH2_001421 PE=3 SV=1	Stylophora_pistillata_Spis6384 Spis6384 SpisGene6384
OG0000019	Trichoplax_specH2_tr_A0A369SEF4_A0A369SEF4_9METZ tr|A0A369SEF4|A0A369SEF4_9METZ Bone morphogenetic protein 4 OS=Trichoplax sp. H2 OX=287889 GN=TrispH2_002393 PE=3 SV=1	Stylophora_pistillata_Spis4504 Spis4504 SpisGene4504
OG0000021	Trichoplax_specH2_tr_A0A369RTQ1_A0A369RTQ1_9METZ tr|A0A369RTQ1|A0A369RTQ1_9METZ Nidogen-1 OS=Trichoplax sp. H2 OX=287889 GN=TrispH2_009409 PE=4 SV=1	Stylophora_pistillata_Spis9526 Spis9526 SpisGene9526
OG0000021	Trichoplax_specH2_tr_A0A369SSL3_A0A369SSL3_9METZ tr|A0A369SSL3|A0A369SSL3_9METZ Low-density lipoprotein receptor-related protein 4 OS=Trichoplax sp. H2 OX=287889 GN=TrispH2_000491 PE=4 SV=1	Stylophora_pistillata_Spis17567 Spis17567 SpisGene17567
OG0000022	Trichoplax_specH2_tr_A0A369SFY9_A0A369SFY9_9METZ tr|A0A369SFY9|A0A369SFY9_9METZ Annexin OS=Trichoplax sp. H2 OX=287889 GN=TrispH2_002457 PE=3 SV=1	Stylophora_pistillata_Spis3665 Spis3665 SpisGene3665
OG0000022	Trichoplax_specH2_tr_A0A369RNY4_A0A369RNY4_9METZ tr|A0A369RNY4|A0A369RNY4_9METZ Annexin OS=Trichoplax sp. H2 OX=287889 GN=TrispH2_011427 PE=3 SV=1	Stylophora_pistillata_Spis14896 Spis14896 SpisGene14896
OG0000023	Trichoplax_specH2_tr_A0A369RUH1_A0A369RUH1_9METZ tr|A0A369RUH1|A0A369RUH1_9METZ Disintegrin and metalloproteinase domain-containing protein 12 OS=Trichoplax sp. H2 OX=287889 GN=TrispH2_009954 PE=4 SV=1, Trichoplax_specH2_tr_A0A369RP58_A0A369RP58_9METZ tr|A0A369RP58|A0A369RP58_9METZ Disintegrin and metalloproteinase domain-containing protein 9 OS=Trichoplax sp. H2 OX=287889 GN=TrispH2_011592 PE=4 SV=1, Trichoplax_specH2_tr_A0A369RUI2_A0A369RUI2_9METZ tr|A0A369RUI2|A0A369RUI2_9METZ Disintegrin and metalloproteinase domain-containing protein 12 OS=Trichoplax sp. H2 OX=287889 GN=TrispH2_009955 PE=4 SV=1, Trichoplax_specH2_tr_A0A369RUG6_A0A369RUG6_9METZ tr|A0A369RUG6|A0A369RUG6_9METZ Disintegrin and metalloproteinase domain-containing protein 9 OS=Trichoplax sp. H2 OX=287889 GN=TrispH2_009958 PE=4 SV=1, Trichoplax_specH2_tr_A0A369RNG1_A0A369RNG1_9METZ tr|A0A369RNG1|A0A369RNG1_9METZ Disintegrin and metalloproteinase domain-containing protein 12 _Fragment_ OS=Trichoplax sp. H2 OX=287889 GN=TrispH2_011748 PE=4 SV=1	Stylophora_pistillata_Spis8398 Spis8398 SpisGene8398
OG0000024	Trichoplax_specH2_tr_A0A369S7Y3_A0A369S7Y3_9METZ tr|A0A369S7Y3|A0A369S7Y3_9METZ Equistatin OS=Trichoplax sp. H2 OX=287889 GN=TrispH2_005616 PE=4 SV=1	Stylophora_pistillata_Spis21695 Spis21695 SpisGene21695, Stylophora_pistillata_Spis1604 Spis1604 SpisGene1604, Stylophora_pistillata_Spis7748 Spis7748 SpisGene7748, Stylophora_pistillata_Spis20024 Spis20024 SpisGene20024, Stylophora_pistillata_Spis20026 Spis20026 SpisGene20026
OG0000028	Trichoplax_specH2_tr_A0A369SN44_A0A369SN44_9METZ tr|A0A369SN44|A0A369SN44_9METZ Collagen alpha-1_IV_ chain OS=Trichoplax sp. H2 OX=287889 GN=TrispH2_000807 PE=4 SV=1, Trichoplax_specH2_tr_A0A369SLF9_A0A369SLF9_9METZ tr|A0A369SLF9|A0A369SLF9_9METZ Collagen alpha-1_IV_ chain OS=Trichoplax sp. H2 OX=287889 GN=TrispH2_000806 PE=4 SV=1	Stylophora_pistillata_Spis2632 Spis2632 SpisGene2632, Stylophora_pistillata_Spis2634 Spis2634 SpisGene2634
OG0000029	Trichoplax_specH2_tr_A0A369S5H8_A0A369S5H8_9METZ tr|A0A369S5H8|A0A369S5H8_9METZ Contactin-associated protein-like 5 OS=Trichoplax sp. H2 OX=287889 GN=TrispH2_005166 PE=4 SV=1, Trichoplax_specH2_tr_A0A369SFH7_A0A369SFH7_9METZ tr|A0A369SFH7|A0A369SFH7_9METZ Contactin-associated protein-like 5 OS=Trichoplax sp. H2 OX=287889 GN=TrispH2_002868 PE=4 SV=1, Trichoplax_specH2_tr_A0A369RZ57_A0A369RZ57_9METZ tr|A0A369RZ57|A0A369RZ57_9METZ Contactin-associated protein-like 5 OS=Trichoplax sp. H2 OX=287889 GN=TrispH2_008811 PE=4 SV=1, Trichoplax_specH2_tr_A0A369RZ29_A0A369RZ29_9METZ tr|A0A369RZ29|A0A369RZ29_9METZ Contactin-associated protein-like 5 OS=Trichoplax sp. H2 OX=287889 GN=TrispH2_008809 PE=4 SV=1, Trichoplax_specH2_tr_A0A369RUI3_A0A369RUI3_9METZ tr|A0A369RUI3|A0A369RUI3_9METZ Contactin-associated protein-like 5 OS=Trichoplax sp. H2 OX=287889 GN=TrispH2_010415 PE=4 SV=1	Stylophora_pistillata_Spis14460 Spis14460 SpisGene14460, Stylophora_pistillata_Spis14294 Spis14294 SpisGene14294, Stylophora_pistillata_Spis14293 Spis14293 SpisGene14293, Stylophora_pistillata_Spis11924 Spis11924 SpisGene11924, Stylophora_pistillata_Spis1889 Spis1889 SpisGene1889, Stylophora_pistillata_Spis22508 Spis22508 SpisGene22508, Stylophora_pistillata_Spis18580 Spis18580 SpisGene18580, Stylophora_pistillata_Spis2060 Spis2060 SpisGene2060, Stylophora_pistillata_Spis13497 Spis13497 SpisGene13497, Stylophora_pistillata_Spis2936 Spis2936 SpisGene2936, Stylophora_pistillata_Spis2937 Spis2937 SpisGene2937, Stylophora_pistillata_Spis14747 Spis14747 SpisGene14747, Stylophora_pistillata_Spis25131 Spis25131 SpisGene25131, Stylophora_pistillata_Spis25256 Spis25256 SpisGene25256, Stylophora_pistillata_Spis24484 Spis24484 SpisGene24484, Stylophora_pistillata_Spis244 Spis244 SpisGene244, Stylophora_pistillata_Spis15298 Spis15298 SpisGene15298, Stylophora_pistillata_Spis24019 Spis24019 SpisGene24019, Stylophora_pistillata_Spis19778 Spis19778 SpisGene19778, Stylophora_pistillata_Spis15297 Spis15297 SpisGene15297, Stylophora_pistillata_Spis15300 Spis15300 SpisGene15300, Stylophora_pistillata_Spis24485 Spis24485 SpisGene24485, Stylophora_pistillata_Spis24018 Spis24018 SpisGene24018, Stylophora_pistillata_Spis246 Spis246 SpisGene246, Stylophora_pistillata_Spis245 Spis245 SpisGene245, Stylophora_pistillata_Spis15299 Spis15299 SpisGene15299, Stylophora_pistillata_Spis21846 Spis21846 SpisGene21846, Stylophora_pistillata_Spis18858 Spis18858 SpisGene18858, Stylophora_pistillata_Spis22181 Spis22181 SpisGene22181, Stylophora_pistillata_Spis2049 Spis2049 SpisGene2049, Stylophora_pistillata_Spis2052 Spis2052 SpisGene2052, Stylophora_pistillata_Spis22182 Spis22182 SpisGene22182, Stylophora_pistillata_Spis21966 Spis21966 SpisGene21966, Stylophora_pistillata_Spis12132 Spis12132 SpisGene12132, Stylophora_pistillata_Spis24685 Spis24685 SpisGene24685, Stylophora_pistillata_Spis2056 Spis2056 SpisGene2056, Stylophora_pistillata_Spis22125 Spis22125 SpisGene22125, Stylophora_pistillata_Spis24654 Spis24654 SpisGene24654
OG0000030	Trichoplax_specH2_tr_A0A369S5E1_A0A369S5E1_9METZ tr|A0A369S5E1|A0A369S5E1_9METZ ADAM 17-like protease OS=Trichoplax sp. H2 OX=287889 GN=TrispH2_005778 PE=4 SV=1	Stylophora_pistillata_Spis8205 Spis8205 SpisGene8205
OG0000030	Trichoplax_specH2_tr_A0A369SER2_A0A369SER2_9METZ tr|A0A369SER2|A0A369SER2_9METZ Disintegrin and metalloproteinase domain-containing protein 10 OS=Trichoplax sp. H2 OX=287889 GN=TrispH2_003217 PE=4 SV=1, Trichoplax_specH2_tr_A0A369S7J2_A0A369S7J2_9METZ tr|A0A369S7J2|A0A369S7J2_9METZ Disintegrin and metalloproteinase domain-containing protein 10 OS=Trichoplax sp. H2 OX=287889 GN=TrispH2_005268 PE=4 SV=1, Trichoplax_specH2_tr_A0A369RXA9_A0A369RXA9_9METZ tr|A0A369RXA9|A0A369RXA9_9METZ Disintegrin and metalloproteinase domain-containing protein 10 OS=Trichoplax sp. H2 OX=287889 GN=TrispH2_009082 PE=4 SV=1, Trichoplax_specH2_tr_A0A369RV51_A0A369RV51_9METZ tr|A0A369RV51|A0A369RV51_9METZ Disintegrin and metalloproteinase domain-containing protein 10 OS=Trichoplax sp. H2 OX=287889 GN=TrispH2_008658 PE=4 SV=1	Stylophora_pistillata_Spis14458 Spis14458 SpisGene14458, Stylophora_pistillata_Spis18004 Spis18004 SpisGene18004
OG0000034	Trichoplax_specH2_tr_A0A369S1X9_A0A369S1X9_9METZ tr|A0A369S1X9|A0A369S1X9_9METZ Attractin-like protein 1 OS=Trichoplax sp. H2 OX=287889 GN=TrispH2_007083 PE=4 SV=1	Stylophora_pistillata_Spis8934.t1 Spis8934.t1 SpisGene8934, Stylophora_pistillata_Spis9650 Spis9650 SpisGene9650
OG0000034	Trichoplax_specH2_tr_A0A369SCB4_A0A369SCB4_9METZ tr|A0A369SCB4|A0A369SCB4_9METZ Multiple epidermal growth factor-like domains protein 8 OS=Trichoplax sp. H2 OX=287889 GN=TrispH2_004337 PE=4 SV=1	Stylophora_pistillata_Spis1480 Spis1480 SpisGene1480
OG0000041	Trichoplax_specH2_tr_A0A369RUI5_A0A369RUI5_9METZ tr|A0A369RUI5|A0A369RUI5_9METZ Poly [ADP-ribose] polymerase OS=Trichoplax sp. H2 OX=287889 GN=TrispH2_009716 PE=3 SV=1, Trichoplax_specH2_tr_A0A369RVR9_A0A369RVR9_9METZ tr|A0A369RVR9|A0A369RVR9_9METZ Poly [ADP-ribose] polymerase OS=Trichoplax sp. H2 OX=287889 GN=TrispH2_009712 PE=3 SV=1	Stylophora_pistillata_Spis1360 Spis1360 SpisGene1360
OG0000047	Trichoplax_specH2_tr_A0A369RTL2_A0A369RTL2_9METZ tr|A0A369RTL2|A0A369RTL2_9METZ Ferric-chelate reductase 1 OS=Trichoplax sp. H2 OX=287889 GN=TrispH2_010618 PE=3 SV=1	Stylophora_pistillata_Spis8993 Spis8993 SpisGene8993
OG0000049	Trichoplax_specH2_tr_A0A369S9H8_A0A369S9H8_9METZ tr|A0A369S9H8|A0A369S9H8_9METZ Plexin-A2 OS=Trichoplax sp. H2 OX=287889 GN=TrispH2_004244 PE=3 SV=1, Trichoplax_specH2_tr_A0A369SC16_A0A369SC16_9METZ tr|A0A369SC16|A0A369SC16_9METZ Plexin A3 OS=Trichoplax sp. H2 OX=287889 GN=TrispH2_004246 PE=3 SV=1	Stylophora_pistillata_Spis6729 Spis6729 SpisGene6729
OG0000051	Trichoplax_specH2_tr_A0A369SBR8_A0A369SBR8_9METZ tr|A0A369SBR8|A0A369SBR8_9METZ VWFA and cache domain-containing protein 1 OS=Trichoplax sp. H2 OX=287889 GN=TrispH2_004133 PE=4 SV=1	Stylophora_pistillata_Spis5233 Spis5233 SpisGene5233
OG0000051	Trichoplax_specH2_tr_A0A369SAB3_A0A369SAB3_9METZ tr|A0A369SAB3|A0A369SAB3_9METZ Voltage-dependent calcium channel subunit alpha-2/delta-1 OS=Trichoplax sp. H2 OX=287889 GN=TrispH2_004901 PE=4 SV=1	Stylophora_pistillata_Spis14642 Spis14642 SpisGene14642
OG0000054	Trichoplax_specH2_tr_A0A369S0G0_A0A369S0G0_9METZ tr|A0A369S0G0|A0A369S0G0_9METZ Leucine-rich repeat-containing protein 7 OS=Trichoplax sp. H2 OX=287889 GN=TrispH2_007703 PE=4 SV=1	Stylophora_pistillata_Spis4424.t3 Spis4424.t3 SpisGene4424
OG0000054	Trichoplax_specH2_tr_A0A369S7Y8_A0A369S7Y8_9METZ tr|A0A369S7Y8|A0A369S7Y8_9METZ Leucine-rich repeat-containing protein 1 OS=Trichoplax sp. H2 OX=287889 GN=TrispH2_005790 PE=4 SV=1	Stylophora_pistillata_Spis725 Spis725 SpisGene725
OG0000056	Trichoplax_specH2_tr_A0A369S7K0_A0A369S7K0_9METZ tr|A0A369S7K0|A0A369S7K0_9METZ E3 ubiquitin-protein ligase TRIM9 OS=Trichoplax sp. H2 OX=287889 GN=TrispH2_005591 PE=4 SV=1	Stylophora_pistillata_Spis17018 Spis17018 SpisGene17018
OG0000058	Trichoplax_specH2_tr_A0A369RQT7_A0A369RQT7_9METZ tr|A0A369RQT7|A0A369RQT7_9METZ Neurotrypsin OS=Trichoplax sp. H2 OX=287889 GN=TrispH2_010134 PE=4 SV=1, Trichoplax_specH2_tr_A0A369RTU2_A0A369RTU2_9METZ tr|A0A369RTU2|A0A369RTU2_9METZ MAM and LDL-receptor class A domain-containing protein 2 OS=Trichoplax sp. H2 OX=287889 GN=TrispH2_010594 PE=4 SV=1	Stylophora_pistillata_Spis23576 Spis23576 SpisGene23576, Stylophora_pistillata_Spis21562 Spis21562 SpisGene21562, Stylophora_pistillata_Spis19455 Spis19455 SpisGene19455
OG0000058	Trichoplax_specH2_tr_A0A369S074_A0A369S074_9METZ tr|A0A369S074|A0A369S074_9METZ MAM and LDL-receptor class A domain-containing protein 2 OS=Trichoplax sp. H2 OX=287889 GN=TrispH2_008467 PE=4 SV=1	Stylophora_pistillata_Spis12423 Spis12423 SpisGene12423
OG0000061	Trichoplax_specH2_tr_A0A369RSA4_A0A369RSA4_9METZ tr|A0A369RSA4|A0A369RSA4_9METZ Copine-3 OS=Trichoplax sp. H2 OX=287889 GN=TrispH2_009324 PE=3 SV=1, Trichoplax_specH2_tr_A0A369SAQ3_A0A369SAQ3_9METZ tr|A0A369SAQ3|A0A369SAQ3_9METZ Copine-3 OS=Trichoplax sp. H2 OX=287889 GN=TrispH2_004213 PE=3 SV=1	Stylophora_pistillata_Spis17364 Spis17364 SpisGene17364
OG0000061	Trichoplax_specH2_tr_A0A369S1I2_A0A369S1I2_9METZ tr|A0A369S1I2|A0A369S1I2_9METZ Copine-8 OS=Trichoplax sp. H2 OX=287889 GN=TrispH2_007458 PE=3 SV=1, Trichoplax_specH2_tr_A0A369S101_A0A369S101_9METZ tr|A0A369S101|A0A369S101_9METZ Copine-8 OS=Trichoplax sp. H2 OX=287889 GN=TrispH2_007456 PE=3 SV=1, Trichoplax_specH2_tr_A0A369S108_A0A369S108_9METZ tr|A0A369S108|A0A369S108_9METZ Copine-5 OS=Trichoplax sp. H2 OX=287889 GN=TrispH2_007455 PE=3 SV=1, Trichoplax_specH2_tr_A0A369S1A7_A0A369S1A7_9METZ tr|A0A369S1A7|A0A369S1A7_9METZ Copine-8 OS=Trichoplax sp. H2 OX=287889 GN=TrispH2_007453 PE=3 SV=1	Stylophora_pistillata_Spis5917.t1 Spis5917.t1 SpisGene5917
OG0000062	Trichoplax_specH2_tr_A0A369SLK4_A0A369SLK4_9METZ tr|A0A369SLK4|A0A369SLK4_9METZ Delta-like protein _Fragment_ OS=Trichoplax sp. H2 OX=287889 GN=TrispH2_000422 PE=4 SV=1	Stylophora_pistillata_Spis8963.t1 Spis8963.t1 SpisGene8963
OG0000065	Trichoplax_specH2_tr_A0A369RSU8_A0A369RSU8_9METZ tr|A0A369RSU8|A0A369RSU8_9METZ Glypican-1 OS=Trichoplax sp. H2 OX=287889 GN=TrispH2_011045 PE=3 SV=1	Stylophora_pistillata_Spis8479 Spis8479 SpisGene8479
OG0000065	Trichoplax_specH2_tr_A0A369S461_A0A369S461_9METZ tr|A0A369S461|A0A369S461_9METZ Glypican-5 OS=Trichoplax sp. H2 OX=287889 GN=TrispH2_006316 PE=3 SV=1	Stylophora_pistillata_Spis8480 Spis8480 SpisGene8480
OG0000080	Trichoplax_specH2_tr_A0A369SDK0_A0A369SDK0_9METZ tr|A0A369SDK0|A0A369SDK0_9METZ Metalloproteinase inhibitor 2 OS=Trichoplax sp. H2 OX=287889 GN=TrispH2_003781 PE=3 SV=1	Stylophora_pistillata_Spis6044 Spis6044 SpisGene6044, Stylophora_pistillata_Spis855.t1 Spis855.t1 SpisGene855, Stylophora_pistillata_Spis854 Spis854 SpisGene854, Stylophora_pistillata_Spis857 Spis857 SpisGene857, Stylophora_pistillata_Spis7913 Spis7913 SpisGene7913, Stylophora_pistillata_Spis847 Spis847 SpisGene847, Stylophora_pistillata_Spis845 Spis845 SpisGene845, Stylophora_pistillata_Spis846 Spis846 SpisGene846, Stylophora_pistillata_Spis844 Spis844 SpisGene844
OG0000087	Trichoplax_specH2_tr_A0A369RRF5_A0A369RRF5_9METZ tr|A0A369RRF5|A0A369RRF5_9METZ A-kinase anchor protein 9 OS=Trichoplax sp. H2 OX=287889 GN=TrispH2_010842 PE=4 SV=1	Stylophora_pistillata_Spis4884 Spis4884 SpisGene4884
OG0000087	Trichoplax_specH2_tr_A0A369SIZ0_A0A369SIZ0_9METZ tr|A0A369SIZ0|A0A369SIZ0_9METZ Peripheral-type benzodiazepine receptor-associated protein 1 OS=Trichoplax sp. H2 OX=287889 GN=TrispH2_002002 PE=3 SV=1	Stylophora_pistillata_Spis3470 Spis3470 SpisGene3470
OG0000088	Trichoplax_specH2_tr_A0A369S3Q5_A0A369S3Q5_9METZ tr|A0A369S3Q5|A0A369S3Q5_9METZ Spondin-1 OS=Trichoplax sp. H2 OX=287889 GN=TrispH2_005556 PE=4 SV=1	Stylophora_pistillata_Spis17637 Spis17637 SpisGene17637
OG0000089	Trichoplax_specH2_tr_A0A369SKS5_A0A369SKS5_9METZ tr|A0A369SKS5|A0A369SKS5_9METZ Chordin-like protein 2 OS=Trichoplax sp. H2 OX=287889 GN=TrispH2_000973 PE=4 SV=1	Stylophora_pistillata_Spis6266 Spis6266 SpisGene6266
OG0000094	Trichoplax_specH2_tr_A0A369S3W3_A0A369S3W3_9METZ tr|A0A369S3W3|A0A369S3W3_9METZ Leucine-rich repeat and calponin homology domain-containing protein 4 OS=Trichoplax sp. H2 OX=287889 GN=TrispH2_006311 PE=4 SV=1	Stylophora_pistillata_Spis10117 Spis10117 SpisGene10117
OG0000103	Trichoplax_specH2_tr_A0A369SHJ4_A0A369SHJ4_9METZ tr|A0A369SHJ4|A0A369SHJ4_9METZ Leucine-rich repeat-containing protein 49 OS=Trichoplax sp. H2 OX=287889 GN=TrispH2_001347 PE=4 SV=1	Stylophora_pistillata_Spis345 Spis345 SpisGene345
OG0000114	Trichoplax_specH2_tr_A0A369SL69_A0A369SL69_9METZ tr|A0A369SL69|A0A369SL69_9METZ Host cell factor 1 OS=Trichoplax sp. H2 OX=287889 GN=TrispH2_001164 PE=4 SV=1	Stylophora_pistillata_Spis1676 Spis1676 SpisGene1676
OG0000119	Trichoplax_specH2_tr_A0A369S6X6_A0A369S6X6_9METZ tr|A0A369S6X6|A0A369S6X6_9METZ Leucine-rich repeat-containing protein 40 OS=Trichoplax sp. H2 OX=287889 GN=TrispH2_005295 PE=4 SV=1	Stylophora_pistillata_Spis5011 Spis5011 SpisGene5011
OG0000126	Trichoplax_specH2_tr_A0A369SI23_A0A369SI23_9METZ tr|A0A369SI23|A0A369SI23_9METZ Vitellogenin _Fragment_ OS=Trichoplax sp. H2 OX=287889 GN=TrispH2_001424 PE=4 SV=1	Stylophora_pistillata_Spis15117 Spis15117 SpisGene15117, Stylophora_pistillata_Spis2954.t1 Spis2954.t1 SpisGene2954
OG0000129	Trichoplax_specH2_tr_A0A369S634_A0A369S634_9METZ tr|A0A369S634|A0A369S634_9METZ Apolipoprotein B-100 _Fragment_ OS=Trichoplax sp. H2 OX=287889 GN=TrispH2_005290 PE=4 SV=1	Stylophora_pistillata_Spis15601 Spis15601 SpisGene15601
OG0000131	Trichoplax_specH2_tr_A0A369SDN2_A0A369SDN2_9METZ tr|A0A369SDN2|A0A369SDN2_9METZ Ephrin type-B receptor 3 _Fragment_ OS=Trichoplax sp. H2 OX=287889 GN=TrispH2_003778 PE=4 SV=1, Trichoplax_specH2_tr_A0A369SDG4_A0A369SDG4_9METZ tr|A0A369SDG4|A0A369SDG4_9METZ Ephrin type-A receptor 4 OS=Trichoplax sp. H2 OX=287889 GN=TrispH2_003777 PE=4 SV=1, Trichoplax_specH2_tr_A0A369SCK6_A0A369SCK6_9METZ tr|A0A369SCK6|A0A369SCK6_9METZ Ephrin type-B receptor 5 OS=Trichoplax sp. H2 OX=287889 GN=TrispH2_003776 PE=4 SV=1	Stylophora_pistillata_Spis6119 Spis6119 SpisGene6119, Stylophora_pistillata_Spis6120 Spis6120 SpisGene6120
OG0000133	Trichoplax_specH2_tr_A0A369RUT8_A0A369RUT8_9METZ tr|A0A369RUT8|A0A369RUT8_9METZ Leucine-rich repeat-containing protein 9 OS=Trichoplax sp. H2 OX=287889 GN=TrispH2_009164 PE=4 SV=1	Stylophora_pistillata_Spis7100 Spis7100 SpisGene7100
OG0000134	Trichoplax_specH2_tr_A0A369S5P2_A0A369S5P2_9METZ tr|A0A369S5P2|A0A369S5P2_9METZ Midasin OS=Trichoplax sp. H2 OX=287889 GN=TrispH2_005306 PE=3 SV=1	Stylophora_pistillata_Spis15413 Spis15413 SpisGene15413, Stylophora_pistillata_Spis19516 Spis19516 SpisGene19516
OG0000138	Trichoplax_specH2_tr_A0A369S9F1_A0A369S9F1_9METZ tr|A0A369S9F1|A0A369S9F1_9METZ Usherin OS=Trichoplax sp. H2 OX=287889 GN=TrispH2_003954 PE=4 SV=1	Stylophora_pistillata_Spis23375 Spis23375 SpisGene23375
OG0000150	Trichoplax_specH2_tr_A0A369SEN7_A0A369SEN7_9METZ tr|A0A369SEN7|A0A369SEN7_9METZ Pappalysin-1 OS=Trichoplax sp. H2 OX=287889 GN=TrispH2_002674 PE=4 SV=1	Stylophora_pistillata_Spis1789 Spis1789 SpisGene1789
OG0000152	Trichoplax_specH2_tr_A0A369SCJ8_A0A369SCJ8_9METZ tr|A0A369SCJ8|A0A369SCJ8_9METZ Leucine-rich repeat protein soc-2-like protein OS=Trichoplax sp. H2 OX=287889 GN=TrispH2_003372 PE=4 SV=1	Stylophora_pistillata_Spis11015 Spis11015 SpisGene11015
OG0000156	Trichoplax_specH2_tr_A0A369S512_A0A369S512_9METZ tr|A0A369S512|A0A369S512_9METZ Microfibrillar-associated protein 1 OS=Trichoplax sp. H2 OX=287889 GN=TrispH2_005170 PE=3 SV=1	Stylophora_pistillata_Spis944 Spis944 SpisGene944
OG0000159	Trichoplax_specH2_tr_A0A369S617_A0A369S617_9METZ tr|A0A369S617|A0A369S617_9METZ Fibronectin type 3 and ankyrin repeat domains protein 1 OS=Trichoplax sp. H2 OX=287889 GN=TrispH2_005137 PE=4 SV=1	Stylophora_pistillata_Spis20878 Spis20878 SpisGene20878
OG0000165	Trichoplax_specH2_tr_A0A369S6V3_A0A369S6V3_9METZ tr|A0A369S6V3|A0A369S6V3_9METZ Leucine-rich repeat-containing protein 58 OS=Trichoplax sp. H2 OX=287889 GN=TrispH2_007187 PE=4 SV=1	Stylophora_pistillata_Spis9482 Spis9482 SpisGene9482
OG0000166	Trichoplax_specH2_tr_A0A369SCT1_A0A369SCT1_9METZ tr|A0A369SCT1|A0A369SCT1_9METZ Secreted frizzled-related protein 3 OS=Trichoplax sp. H2 OX=287889 GN=TrispH2_003359 PE=4 SV=1	Stylophora_pistillata_Spis1126 Spis1126 SpisGene1126
OG0000171	Trichoplax_specH2_tr_A0A369SB05_A0A369SB05_9METZ tr|A0A369SB05|A0A369SB05_9METZ Peptide-N_4_-_N-acetyl-beta-glucosaminyl_asparagine amidase OS=Trichoplax sp. H2 OX=287889 GN=TrispH2_003946 PE=3 SV=1	Stylophora_pistillata_Spis4618.t1 Spis4618.t1 SpisGene4618, Stylophora_pistillata_Spis4617 Spis4617 SpisGene4617
OG0000176	Trichoplax_specH2_tr_A0A369SFQ5_A0A369SFQ5_9METZ tr|A0A369SFQ5|A0A369SFQ5_9METZ Ankyrin repeat and fibronectin type-III domain-containing protein 1 OS=Trichoplax sp. H2 OX=287889 GN=TrispH2_002743 PE=4 SV=1	Stylophora_pistillata_Spis9429.t1 Spis9429.t1 SpisGene9429
OG0000177	Trichoplax_specH2_tr_A0A369SCM1_A0A369SCM1_9METZ tr|A0A369SCM1|A0A369SCM1_9METZ Protein phosphatase 1 regulatory subunit 7 OS=Trichoplax sp. H2 OX=287889 GN=TrispH2_004666 PE=4 SV=1	Stylophora_pistillata_Spis16587 Spis16587 SpisGene16587
OG0000182	Trichoplax_specH2_tr_A0A369RQE4_A0A369RQE4_9METZ tr|A0A369RQE4|A0A369RQE4_9METZ von Willebrand factor A domain-containing protein 3A OS=Trichoplax sp. H2 OX=287889 GN=TrispH2_011375 PE=4 SV=1	Stylophora_pistillata_Spis6187 Spis6187 SpisGene6187
OG0000192	Trichoplax_specH2_tr_A0A369S5A1_A0A369S5A1_9METZ tr|A0A369S5A1|A0A369S5A1_9METZ Protein flightless-1-like protein OS=Trichoplax sp. H2 OX=287889 GN=TrispH2_006167 PE=4 SV=1	Stylophora_pistillata_Spis3294 Spis3294 SpisGene3294
OG0000194	Trichoplax_specH2_tr_A0A369SDN1_A0A369SDN1_9METZ tr|A0A369SDN1|A0A369SDN1_9METZ Leucine-rich repeat-containing protein 57 OS=Trichoplax sp. H2 OX=287889 GN=TrispH2_003128 PE=4 SV=1	Stylophora_pistillata_Spis7867 Spis7867 SpisGene7867
OG0000195	Trichoplax_specH2_tr_A0A369SEK2_A0A369SEK2_9METZ tr|A0A369SEK2|A0A369SEK2_9METZ Ras suppressor protein 1 OS=Trichoplax sp. H2 OX=287889 GN=TrispH2_002282 PE=4 SV=1	Stylophora_pistillata_Spis16217 Spis16217 SpisGene16217
OG0000199	Trichoplax_specH2_tr_A0A369S9I3_A0A369S9I3_9METZ tr|A0A369S9I3|A0A369S9I3_9METZ 26S proteasome non-ATPase regulatory subunit 4 OS=Trichoplax sp. H2 OX=287889 GN=TrispH2_005037 PE=3 SV=1	Stylophora_pistillata_Spis5428 Spis5428 SpisGene5428
OG0000200	Trichoplax_specH2_tr_A0A369SIX8_A0A369SIX8_9METZ tr|A0A369SIX8|A0A369SIX8_9METZ von Willebrand factor A domain-containing protein 3B OS=Trichoplax sp. H2 OX=287889 GN=TrispH2_001129 PE=4 SV=1	Stylophora_pistillata_Spis3925 Spis3925 SpisGene3925
OG0000201	Trichoplax_specH2_tr_A0A369SK25_A0A369SK25_9METZ tr|A0A369SK25|A0A369SK25_9METZ Leucine-rich repeats and immunoglobulin-like domains protein 3 OS=Trichoplax sp. H2 OX=287889 GN=TrispH2_000076 PE=4 SV=1	Stylophora_pistillata_Spis17755 Spis17755 SpisGene17755
OG0000203	Trichoplax_specH2_tr_A0A369RU06_A0A369RU06_9METZ tr|A0A369RU06|A0A369RU06_9METZ Delta and Notch-like epidermal growth factor-related receptor OS=Trichoplax sp. H2 OX=287889 GN=TrispH2_009790 PE=4 SV=1	Stylophora_pistillata_Spis10328 Spis10328 SpisGene10328
OG0000204	Trichoplax_specH2_tr_A0A369RR22_A0A369RR22_9METZ tr|A0A369RR22|A0A369RR22_9METZ Leucine-rich repeat-containing protein 59 OS=Trichoplax sp. H2 OX=287889 GN=TrispH2_011004 PE=4 SV=1	Stylophora_pistillata_Spis8062 Spis8062 SpisGene8062
OG0000206	Trichoplax_specH2_tr_A0A369RN89_A0A369RN89_9METZ tr|A0A369RN89|A0A369RN89_9METZ Neurogenic locus Notch protein _Fragment_ OS=Trichoplax sp. H2 OX=287889 GN=TrispH2_011721 PE=4 SV=1	Stylophora_pistillata_Spis487 Spis487 SpisGene487, Stylophora_pistillata_Spis506 Spis506 SpisGene506, Stylophora_pistillata_Spis488 Spis488 SpisGene488, Stylophora_pistillata_Spis1206 Spis1206 SpisGene1206, Stylophora_pistillata_Spis19689 Spis19689 SpisGene19689, Stylophora_pistillata_Spis21830 Spis21830 SpisGene21830, Stylophora_pistillata_Spis21829 Spis21829 SpisGene21829, Stylophora_pistillata_Spis12126 Spis12126 SpisGene12126
