Orthogroup	Placozoa_Trichoplacidae_Trichoplax_spec-H2	Cnidaria_Anthozoa_Stylophora_pistillata
OG0000209	Trichoplax_specH2_tr_A0A369S4D6_A0A369S4D6_9METZ tr|A0A369S4D6|A0A369S4D6_9METZ Integrator complex subunit 6-A OS=Trichoplax sp. H2 OX=287889 GN=TrispH2_006915 PE=4 SV=1	Stylophora_pistillata_Spis1455 Spis1455 SpisGene1455
OG0000210	Trichoplax_specH2_tr_A0A369SJG3_A0A369SJG3_9METZ tr|A0A369SJG3|A0A369SJG3_9METZ X-ray radiation resistance-associated protein 1 OS=Trichoplax sp. H2 OX=287889 GN=TrispH2_000966 PE=4 SV=1	Stylophora_pistillata_Spis6298 Spis6298 SpisGene6298
OG0000211	Trichoplax_specH2_tr_A0A369S995_A0A369S995_9METZ tr|A0A369S995|A0A369S995_9METZ Centriolin OS=Trichoplax sp. H2 OX=287889 GN=TrispH2_004094 PE=4 SV=1	Stylophora_pistillata_Spis17130 Spis17130 SpisGene17130
OG0000213	Trichoplax_specH2_tr_A0A369SET5_A0A369SET5_9METZ tr|A0A369SET5|A0A369SET5_9METZ Neurogenic locus notch-like protein 1 OS=Trichoplax sp. H2 OX=287889 GN=TrispH2_002645 PE=3 SV=1	Stylophora_pistillata_Spis12105 Spis12105 SpisGene12105
OG0000214	Trichoplax_specH2_tr_A0A369SIJ2_A0A369SIJ2_9METZ tr|A0A369SIJ2|A0A369SIJ2_9METZ Integrator complex subunit 14 OS=Trichoplax sp. H2 OX=287889 GN=TrispH2_001307 PE=3 SV=1	Stylophora_pistillata_Spis15474 Spis15474 SpisGene15474
OG0000219	Trichoplax_specH2_tr_A0A369S539_A0A369S539_9METZ tr|A0A369S539|A0A369S539_9METZ von Willebrand factor A domain-containing protein 8 OS=Trichoplax sp. H2 OX=287889 GN=TrispH2_005205 PE=4 SV=1	Stylophora_pistillata_Spis1071 Spis1071 SpisGene1071
OG0000225	Trichoplax_specH2_tr_A0A369RM65_A0A369RM65_9METZ tr|A0A369RM65|A0A369RM65_9METZ Sushi_ von Willebrand factor type A_ EGF and pentraxin domain-containing protein 1 _Fragment_ OS=Trichoplax sp. H2 OX=287889 GN=TrispH2_011952 PE=4 SV=1	Stylophora_pistillata_Spis15616 Spis15616 SpisGene15616, Stylophora_pistillata_Spis16922 Spis16922 SpisGene16922, Stylophora_pistillata_Spis16932 Spis16932 SpisGene16932, Stylophora_pistillata_Spis16930 Spis16930 SpisGene16930, Stylophora_pistillata_Spis2297 Spis2297 SpisGene2297, Stylophora_pistillata_Spis16913 Spis16913 SpisGene16913, Stylophora_pistillata_Spis24221 Spis24221 SpisGene24221, Stylophora_pistillata_Spis2293 Spis2293 SpisGene2293, Stylophora_pistillata_Spis16920 Spis16920 SpisGene16920
OG0000239	Trichoplax_specH2_tr_A0A369S1A9_A0A369S1A9_9METZ tr|A0A369S1A9|A0A369S1A9_9METZ von Willebrand factor A domain-containing protein 3B OS=Trichoplax sp. H2 OX=287889 GN=TrispH2_007298 PE=4 SV=1	Stylophora_pistillata_Spis3105 Spis3105 SpisGene3105
OG0000253	Trichoplax_specH2_tr_A0A369S9T7_A0A369S9T7_9METZ tr|A0A369S9T7|A0A369S9T7_9METZ General transcription factor IIH subunit OS=Trichoplax sp. H2 OX=287889 GN=TrispH2_005084 PE=3 SV=1	Stylophora_pistillata_Spis8764 Spis8764 SpisGene8764
OG0000265	Trichoplax_specH2_tr_A0A369S4B7_A0A369S4B7_9METZ tr|A0A369S4B7|A0A369S4B7_9METZ Protein turtle-like protein B OS=Trichoplax sp. H2 OX=287889 GN=TrispH2_007172 PE=4 SV=1	Stylophora_pistillata_Spis8472.t1 Spis8472.t1 SpisGene8472
OG0000268	Trichoplax_specH2_tr_A0A369SFP1_A0A369SFP1_9METZ tr|A0A369SFP1|A0A369SFP1_9METZ Cytokine receptor-like factor 3 OS=Trichoplax sp. H2 OX=287889 GN=TrispH2_002349 PE=4 SV=1	Stylophora_pistillata_Spis4565 Spis4565 SpisGene4565
OG0000299	Trichoplax_specH2_tr_A0A369RTP5_A0A369RTP5_9METZ tr|A0A369RTP5|A0A369RTP5_9METZ Papilin OS=Trichoplax sp. H2 OX=287889 GN=TrispH2_009567 PE=4 SV=1	Stylophora_pistillata_Spis9163 Spis9163 SpisGene9163
OG0000314	Trichoplax_specH2_tr_A0A369S009_A0A369S009_9METZ tr|A0A369S009|A0A369S009_9METZ Protein phosphatase 1 regulatory subunit 7 OS=Trichoplax sp. H2 OX=287889 GN=TrispH2_008307 PE=4 SV=1	Stylophora_pistillata_Spis16091 Spis16091 SpisGene16091
OG0000317	Trichoplax_specH2_tr_A0A369S020_A0A369S020_9METZ tr|A0A369S020|A0A369S020_9METZ Mucin-13 OS=Trichoplax sp. H2 OX=287889 GN=TrispH2_009216 PE=4 SV=1, Trichoplax_specH2_tr_A0A369RZP7_A0A369RZP7_9METZ tr|A0A369RZP7|A0A369RZP7_9METZ Uncharacterized protein OS=Trichoplax sp. H2 OX=287889 GN=TrispH2_009212 PE=4 SV=1, Trichoplax_specH2_tr_A0A369RZP6_A0A369RZP6_9METZ tr|A0A369RZP6|A0A369RZP6_9METZ Neurogenic locus notch-like protein 2 OS=Trichoplax sp. H2 OX=287889 GN=TrispH2_009209 PE=4 SV=1, Trichoplax_specH2_tr_A0A369S278_A0A369S278_9METZ tr|A0A369S278|A0A369S278_9METZ Uncharacterized protein _Fragment_ OS=Trichoplax sp. H2 OX=287889 GN=TrispH2_009200 PE=4 SV=1, Trichoplax_specH2_tr_A0A369S288_A0A369S288_9METZ tr|A0A369S288|A0A369S288_9METZ Pro-epidermal growth factor OS=Trichoplax sp. H2 OX=287889 GN=TrispH2_009222 PE=4 SV=1, Trichoplax_specH2_tr_A0A369RQY0_A0A369RQY0_9METZ tr|A0A369RQY0|A0A369RQY0_9METZ Neurogenic locus notch-like protein 3 _Fragment_ OS=Trichoplax sp. H2 OX=287889 GN=TrispH2_011722 PE=4 SV=1	Stylophora_pistillata_Spis22512 Spis22512 SpisGene22512, Stylophora_pistillata_Spis23104 Spis23104 SpisGene23104
OG0000363	Trichoplax_specH2_tr_A0A369RXU3_A0A369RXU3_9METZ tr|A0A369RXU3|A0A369RXU3_9METZ G-protein coupled receptors family 2 profile 2 domain-containing protein OS=Trichoplax sp. H2 OX=287889 GN=TrispH2_008832 PE=4 SV=1	Stylophora_pistillata_Spis12896 Spis12896 SpisGene12896
OG0000391	Trichoplax_specH2_tr_A0A369RP83_A0A369RP83_9METZ tr|A0A369RP83|A0A369RP83_9METZ Macrophage mannose receptor 1 OS=Trichoplax sp. H2 OX=287889 GN=TrispH2_011587 PE=4 SV=1, Trichoplax_specH2_tr_A0A369RWP4_A0A369RWP4_9METZ tr|A0A369RWP4|A0A369RWP4_9METZ Macrophage mannose receptor 1 OS=Trichoplax sp. H2 OX=287889 GN=TrispH2_009651 PE=4 SV=1, Trichoplax_specH2_tr_A0A369RVQ5_A0A369RVQ5_9METZ tr|A0A369RVQ5|A0A369RVQ5_9METZ Macrophage mannose receptor 1 OS=Trichoplax sp. H2 OX=287889 GN=TrispH2_009650 PE=4 SV=1, Trichoplax_specH2_tr_A0A369RVH3_A0A369RVH3_9METZ tr|A0A369RVH3|A0A369RVH3_9METZ Macrophage mannose receptor 1 OS=Trichoplax sp. H2 OX=287889 GN=TrispH2_009652 PE=4 SV=1	Stylophora_pistillata_Spis6172 Spis6172 SpisGene6172
OG0000448	Trichoplax_specH2_tr_A0A369S9Q9_A0A369S9Q9_9METZ tr|A0A369S9Q9|A0A369S9Q9_9METZ ATP-binding cassette sub-family A member 1 OS=Trichoplax sp. H2 OX=287889 GN=TrispH2_003678 PE=4 SV=1	Stylophora_pistillata_Spis7021 Spis7021 SpisGene7021
OG0000538	Trichoplax_specH2_tr_A0A369RUK3_A0A369RUK3_9METZ tr|A0A369RUK3|A0A369RUK3_9METZ Protocadherin Fat 4 OS=Trichoplax sp. H2 OX=287889 GN=TrispH2_008570 PE=4 SV=1	Stylophora_pistillata_Spis1942 Spis1942 SpisGene1942, Stylophora_pistillata_Spis21040 Spis21040 SpisGene21040, Stylophora_pistillata_Spis1949 Spis1949 SpisGene1949, Stylophora_pistillata_Spis1948 Spis1948 SpisGene1948, Stylophora_pistillata_Spis24712 Spis24712 SpisGene24712, Stylophora_pistillata_Spis1945 Spis1945 SpisGene1945
OG0000581	Trichoplax_specH2_tr_A0A369S648_A0A369S648_9METZ tr|A0A369S648|A0A369S648_9METZ Leucine-rich repeat and fibronectin type III domain-containing protein 1 OS=Trichoplax sp. H2 OX=287889 GN=TrispH2_005864 PE=4 SV=1	Stylophora_pistillata_Spis12156 Spis12156 SpisGene12156
OG0000698	Trichoplax_specH2_tr_A0A369RY66_A0A369RY66_9METZ tr|A0A369RY66|A0A369RY66_9METZ Arachidonate 5-lipoxygenase OS=Trichoplax sp. H2 OX=287889 GN=TrispH2_008233 PE=4 SV=1	Stylophora_pistillata_Spis20953 Spis20953 SpisGene20953
