Orthogroup	Cnidaria_Anthozoa_Xenia_spec	Chordata_Amphioxiformes_Branchiostoma_lanceolatum
OG0000040	Xenia_spec_Xe_008627_T1 Xe_008627_T1 Xe_008627	Branchiostoma_lanceolatum_tr_A0A8K0EQC8_A0A8K0EQC8_BRALA tr|A0A8K0EQC8|A0A8K0EQC8_BRALA KAZALD1 protein OS=Branchiostoma lanceolatum OX=7740 GN=KAZALD1 PE=4 SV=1, Branchiostoma_lanceolatum_tr_A0A8K0EMT5_A0A8K0EMT5_BRALA tr|A0A8K0EMT5|A0A8K0EMT5_BRALA KAZALD1 protein OS=Branchiostoma lanceolatum OX=7740 GN=KAZALD1 PE=4 SV=1, Branchiostoma_lanceolatum_tr_A0A8J9ZMS7_A0A8J9ZMS7_BRALA tr|A0A8J9ZMS7|A0A8J9ZMS7_BRALA IGFBP7 protein OS=Branchiostoma lanceolatum OX=7740 GN=IGFBP7 PE=4 SV=1, Branchiostoma_lanceolatum_tr_A0A8J9ZQP9_A0A8J9ZQP9_BRALA tr|A0A8J9ZQP9|A0A8J9ZQP9_BRALA IGFBP7 protein OS=Branchiostoma lanceolatum OX=7740 GN=IGFBP7 PE=4 SV=1, Branchiostoma_lanceolatum_tr_A0A8J9ZN21_A0A8J9ZN21_BRALA tr|A0A8J9ZN21|A0A8J9ZN21_BRALA IGFBP7 protein OS=Branchiostoma lanceolatum OX=7740 GN=IGFBP7 PE=4 SV=1
OG0000041	Xenia_spec_Xe_005440_T1 Xe_005440_T1 Xe_005440, Xenia_spec_Xe_005437_T1 Xe_005437_T1 Xe_005437, Xenia_spec_Xe_005431_T1 Xe_005431_T1 Xe_005431, Xenia_spec_Xe_005447_T1 Xe_005447_T1 Xe_005447, Xenia_spec_Xe_005456_T1 Xe_005456_T1 Xe_005456, Xenia_spec_Xe_005470_T1 Xe_005470_T1 Xe_005470, Xenia_spec_Xe_005444_T1 Xe_005444_T1 Xe_005444, Xenia_spec_Xe_005450_T1 Xe_005450_T1 Xe_005450, Xenia_spec_Xe_005434_T1 Xe_005434_T1 Xe_005434, Xenia_spec_Xe_005453_T1 Xe_005453_T1 Xe_005453, Xenia_spec_Xe_005472_T1 Xe_005472_T1 Xe_005472, Xenia_spec_Xe_005471_T1 Xe_005471_T1 Xe_005471, Xenia_spec_Xe_005454_T1 Xe_005454_T1 Xe_005454	Branchiostoma_lanceolatum_tr_A0A8K0A822_A0A8K0A822_BRALA tr|A0A8K0A822|A0A8K0A822_BRALA VWA5A protein OS=Branchiostoma lanceolatum OX=7740 GN=VWA5A PE=4 SV=1, Branchiostoma_lanceolatum_tr_A0A8K0A824_A0A8K0A824_BRALA tr|A0A8K0A824|A0A8K0A824_BRALA VWA5A protein OS=Branchiostoma lanceolatum OX=7740 GN=VWA5A PE=4 SV=1, Branchiostoma_lanceolatum_tr_A0A8K0A830_A0A8K0A830_BRALA tr|A0A8K0A830|A0A8K0A830_BRALA VWA5A protein OS=Branchiostoma lanceolatum OX=7740 GN=VWA5A PE=4 SV=1, Branchiostoma_lanceolatum_tr_A0A8K0A907_A0A8K0A907_BRALA tr|A0A8K0A907|A0A8K0A907_BRALA VWA5A protein OS=Branchiostoma lanceolatum OX=7740 GN=VWA5A PE=4 SV=1, Branchiostoma_lanceolatum_tr_A0A8K0A997_A0A8K0A997_BRALA tr|A0A8K0A997|A0A8K0A997_BRALA VWA5A protein OS=Branchiostoma lanceolatum OX=7740 GN=VWA5A PE=4 SV=1
OG0000041	Xenia_spec_Xe_012595_T1 Xe_012595_T1 Xe_012595	Branchiostoma_lanceolatum_tr_A0A8J9WGG4_A0A8J9WGG4_BRALA tr|A0A8J9WGG4|A0A8J9WGG4_BRALA VWA5B1 protein OS=Branchiostoma lanceolatum OX=7740 GN=VWA5B1 PE=4 SV=1, Branchiostoma_lanceolatum_tr_A0A8J9YSH2_A0A8J9YSH2_BRALA tr|A0A8J9YSH2|A0A8J9YSH2_BRALA VWA5B1 protein OS=Branchiostoma lanceolatum OX=7740 GN=VWA5B1 PE=4 SV=1, Branchiostoma_lanceolatum_tr_A0A8J9VRS7_A0A8J9VRS7_BRALA tr|A0A8J9VRS7|A0A8J9VRS7_BRALA VWA5B1 protein OS=Branchiostoma lanceolatum OX=7740 GN=VWA5B1 PE=4 SV=1, Branchiostoma_lanceolatum_tr_A0A8J9YRS7_A0A8J9YRS7_BRALA tr|A0A8J9YRS7|A0A8J9YRS7_BRALA VWA5B1 protein OS=Branchiostoma lanceolatum OX=7740 GN=VWA5B1 PE=4 SV=1
OG0000045	Xenia_spec_Xe_002601_T1 Xe_002601_T1 Xe_002601	Branchiostoma_lanceolatum_tr_A0A8J9ZKD8_A0A8J9ZKD8_BRALA tr|A0A8J9ZKD8|A0A8J9ZKD8_BRALA LAMA5 protein OS=Branchiostoma lanceolatum OX=7740 GN=LAMA5 PE=4 SV=1, Branchiostoma_lanceolatum_tr_A0A8J9ZL65_A0A8J9ZL65_BRALA tr|A0A8J9ZL65|A0A8J9ZL65_BRALA LAMA5 protein OS=Branchiostoma lanceolatum OX=7740 GN=LAMA5 PE=4 SV=1, Branchiostoma_lanceolatum_tr_A0A8K0ENK4_A0A8K0ENK4_BRALA tr|A0A8K0ENK4|A0A8K0ENK4_BRALA LAMA5 protein OS=Branchiostoma lanceolatum OX=7740 GN=LAMA5 PE=4 SV=1, Branchiostoma_lanceolatum_tr_A0A8K0EJ37_A0A8K0EJ37_BRALA tr|A0A8K0EJ37|A0A8K0EJ37_BRALA LAMA5 protein OS=Branchiostoma lanceolatum OX=7740 GN=LAMA5 PE=4 SV=1, Branchiostoma_lanceolatum_tr_A0A8J9ZKU4_A0A8J9ZKU4_BRALA tr|A0A8J9ZKU4|A0A8J9ZKU4_BRALA LAMA5 protein OS=Branchiostoma lanceolatum OX=7740 GN=LAMA5 PE=4 SV=1, Branchiostoma_lanceolatum_tr_A0A8K0EL18_A0A8K0EL18_BRALA tr|A0A8K0EL18|A0A8K0EL18_BRALA LAMA5 protein OS=Branchiostoma lanceolatum OX=7740 GN=LAMA5 PE=4 SV=1, Branchiostoma_lanceolatum_tr_A0A8K0EL51_A0A8K0EL51_BRALA tr|A0A8K0EL51|A0A8K0EL51_BRALA LAMA5 protein OS=Branchiostoma lanceolatum OX=7740 GN=LAMA5 PE=4 SV=1, Branchiostoma_lanceolatum_tr_A0A8K0EP27_A0A8K0EP27_BRALA tr|A0A8K0EP27|A0A8K0EP27_BRALA LAMA5 protein OS=Branchiostoma lanceolatum OX=7740 GN=LAMA5 PE=4 SV=1, Branchiostoma_lanceolatum_tr_A0A8J9ZID3_A0A8J9ZID3_BRALA tr|A0A8J9ZID3|A0A8J9ZID3_BRALA LAMA5 protein OS=Branchiostoma lanceolatum OX=7740 GN=LAMA5 PE=4 SV=1
OG0000047	Xenia_spec_Xe_015330_T1 Xe_015330_T1 Xe_015330, Xenia_spec_Xe_015331_T1 Xe_015331_T1 Xe_015331, Xenia_spec_Xe_015337_T1 Xe_015337_T1 Xe_015337, Xenia_spec_Xe_015332_T1 Xe_015332_T1 Xe_015332, Xenia_spec_Xe_015336_T1 Xe_015336_T1 Xe_015336	Branchiostoma_lanceolatum_tr_A0A8K0E8B9_A0A8K0E8B9_BRALA tr|A0A8K0E8B9|A0A8K0E8B9_BRALA FRRS1 protein OS=Branchiostoma lanceolatum OX=7740 GN=FRRS1 PE=4 SV=1, Branchiostoma_lanceolatum_tr_A0A8J9YWJ2_A0A8J9YWJ2_BRALA tr|A0A8J9YWJ2|A0A8J9YWJ2_BRALA FRRS1 protein OS=Branchiostoma lanceolatum OX=7740 GN=FRRS1 PE=3 SV=1, Branchiostoma_lanceolatum_tr_A0A8J9YWP7_A0A8J9YWP7_BRALA tr|A0A8J9YWP7|A0A8J9YWP7_BRALA FRRS1 protein OS=Branchiostoma lanceolatum OX=7740 GN=FRRS1 PE=3 SV=1, Branchiostoma_lanceolatum_tr_A0A8J9YWE8_A0A8J9YWE8_BRALA tr|A0A8J9YWE8|A0A8J9YWE8_BRALA FRRS1 protein OS=Branchiostoma lanceolatum OX=7740 GN=FRRS1 PE=3 SV=1, Branchiostoma_lanceolatum_tr_A0A8J9YWC3_A0A8J9YWC3_BRALA tr|A0A8J9YWC3|A0A8J9YWC3_BRALA FRRS1 protein OS=Branchiostoma lanceolatum OX=7740 GN=FRRS1 PE=3 SV=1, Branchiostoma_lanceolatum_tr_A0A8J9YW77_A0A8J9YW77_BRALA tr|A0A8J9YW77|A0A8J9YW77_BRALA FRRS1 protein OS=Branchiostoma lanceolatum OX=7740 GN=FRRS1 PE=3 SV=1, Branchiostoma_lanceolatum_tr_A0A8J9YWI1_A0A8J9YWI1_BRALA tr|A0A8J9YWI1|A0A8J9YWI1_BRALA FRRS1 protein OS=Branchiostoma lanceolatum OX=7740 GN=FRRS1 PE=3 SV=1, Branchiostoma_lanceolatum_tr_A0A8J9YW79_A0A8J9YW79_BRALA tr|A0A8J9YW79|A0A8J9YW79_BRALA FRRS1 protein OS=Branchiostoma lanceolatum OX=7740 GN=FRRS1 PE=3 SV=1
OG0000047	Xenia_spec_Xe_015019_T1 Xe_015019_T1 Xe_015019, Xenia_spec_Xe_015019_T2 Xe_015019_T2 Xe_015019, Xenia_spec_Xe_014825_T1 Xe_014825_T1 Xe_014825	Branchiostoma_lanceolatum_tr_A0A8J9VF10_A0A8J9VF10_BRALA tr|A0A8J9VF10|A0A8J9VF10_BRALA FRRS1 protein OS=Branchiostoma lanceolatum OX=7740 GN=FRRS1 PE=4 SV=1, Branchiostoma_lanceolatum_tr_A0A8J9YS78_A0A8J9YS78_BRALA tr|A0A8J9YS78|A0A8J9YS78_BRALA FRRS1 protein OS=Branchiostoma lanceolatum OX=7740 GN=FRRS1 PE=4 SV=1, Branchiostoma_lanceolatum_tr_A0A8J9YRD4_A0A8J9YRD4_BRALA tr|A0A8J9YRD4|A0A8J9YRD4_BRALA FRRS1 protein OS=Branchiostoma lanceolatum OX=7740 GN=FRRS1 PE=4 SV=1, Branchiostoma_lanceolatum_tr_A0A8K0EDP0_A0A8K0EDP0_BRALA tr|A0A8K0EDP0|A0A8K0EDP0_BRALA FRRS1 protein OS=Branchiostoma lanceolatum OX=7740 GN=FRRS1 PE=4 SV=1, Branchiostoma_lanceolatum_tr_A0A8K0EHI5_A0A8K0EHI5_BRALA tr|A0A8K0EHI5|A0A8K0EHI5_BRALA FRRS1 protein OS=Branchiostoma lanceolatum OX=7740 GN=FRRS1 PE=4 SV=1, Branchiostoma_lanceolatum_tr_A0A8J9Z8I4_A0A8J9Z8I4_BRALA tr|A0A8J9Z8I4|A0A8J9Z8I4_BRALA Hypp8510 protein OS=Branchiostoma lanceolatum OX=7740 GN=Hypp8510 PE=4 SV=1, Branchiostoma_lanceolatum_tr_A0A8J9VXH7_A0A8J9VXH7_BRALA tr|A0A8J9VXH7|A0A8J9VXH7_BRALA FRRS1 protein OS=Branchiostoma lanceolatum OX=7740 GN=FRRS1 PE=4 SV=1, Branchiostoma_lanceolatum_tr_A0A8J9VE65_A0A8J9VE65_BRALA tr|A0A8J9VE65|A0A8J9VE65_BRALA FRRS1 protein OS=Branchiostoma lanceolatum OX=7740 GN=FRRS1 PE=4 SV=1, Branchiostoma_lanceolatum_tr_A0A8K0AH80_A0A8K0AH80_BRALA tr|A0A8K0AH80|A0A8K0AH80_BRALA Hypp5334 protein OS=Branchiostoma lanceolatum OX=7740 GN=Hypp5334 PE=4 SV=1, Branchiostoma_lanceolatum_tr_A0A8J9ZLD2_A0A8J9ZLD2_BRALA tr|A0A8J9ZLD2|A0A8J9ZLD2_BRALA FRRS1 protein OS=Branchiostoma lanceolatum OX=7740 GN=FRRS1 PE=4 SV=1, Branchiostoma_lanceolatum_tr_A0A8J9ZMR7_A0A8J9ZMR7_BRALA tr|A0A8J9ZMR7|A0A8J9ZMR7_BRALA FRRS1 protein OS=Branchiostoma lanceolatum OX=7740 GN=FRRS1 PE=4 SV=1
OG0000048	Xenia_spec_Xe_016590_T1 Xe_016590_T1 Xe_016590	Branchiostoma_lanceolatum_tr_A0A8J9YPP9_A0A8J9YPP9_BRALA tr|A0A8J9YPP9|A0A8J9YPP9_BRALA SLIT1 protein OS=Branchiostoma lanceolatum OX=7740 GN=SLIT1 PE=4 SV=1
OG0000049	Xenia_spec_Xe_014133_T1 Xe_014133_T1 Xe_014133	Branchiostoma_lanceolatum_tr_A0A8J9ZZQ5_A0A8J9ZZQ5_BRALA tr|A0A8J9ZZQ5|A0A8J9ZZQ5_BRALA PLXNA4 protein OS=Branchiostoma lanceolatum OX=7740 GN=PLXNA4 PE=3 SV=1, Branchiostoma_lanceolatum_tr_A0A8J9ZYE2_A0A8J9ZYE2_BRALA tr|A0A8J9ZYE2|A0A8J9ZYE2_BRALA PLXNA4 protein OS=Branchiostoma lanceolatum OX=7740 GN=PLXNA4 PE=3 SV=1, Branchiostoma_lanceolatum_tr_A0A8K0ETU9_A0A8K0ETU9_BRALA tr|A0A8K0ETU9|A0A8K0ETU9_BRALA PLXNA1 protein OS=Branchiostoma lanceolatum OX=7740 GN=PLXNA1 PE=3 SV=1, Branchiostoma_lanceolatum_tr_A0A8K0EWJ2_A0A8K0EWJ2_BRALA tr|A0A8K0EWJ2|A0A8K0EWJ2_BRALA PLXNA1 protein OS=Branchiostoma lanceolatum OX=7740 GN=PLXNA1 PE=3 SV=1, Branchiostoma_lanceolatum_tr_A0A8K0ETK9_A0A8K0ETK9_BRALA tr|A0A8K0ETK9|A0A8K0ETK9_BRALA PLXNA1 protein OS=Branchiostoma lanceolatum OX=7740 GN=PLXNA1 PE=3 SV=1, Branchiostoma_lanceolatum_tr_A0A8K0ERD8_A0A8K0ERD8_BRALA tr|A0A8K0ERD8|A0A8K0ERD8_BRALA PLXNA1 protein OS=Branchiostoma lanceolatum OX=7740 GN=PLXNA1 PE=3 SV=1
OG0000051	Xenia_spec_Xe_014313_T1 Xe_014313_T1 Xe_014313	Branchiostoma_lanceolatum_tr_A0A8K0EQF9_A0A8K0EQF9_BRALA tr|A0A8K0EQF9|A0A8K0EQF9_BRALA CACHD1 protein OS=Branchiostoma lanceolatum OX=7740 GN=CACHD1 PE=4 SV=1, Branchiostoma_lanceolatum_tr_A0A8J9ZWV3_A0A8J9ZWV3_BRALA tr|A0A8J9ZWV3|A0A8J9ZWV3_BRALA chitinase OS=Branchiostoma lanceolatum OX=7740 GN=CACHD1 PE=4 SV=1, Branchiostoma_lanceolatum_tr_A0A8J9ZYW2_A0A8J9ZYW2_BRALA tr|A0A8J9ZYW2|A0A8J9ZYW2_BRALA chitinase OS=Branchiostoma lanceolatum OX=7740 GN=CACHD1 PE=4 SV=1, Branchiostoma_lanceolatum_tr_A0A8K0EW43_A0A8K0EW43_BRALA tr|A0A8K0EW43|A0A8K0EW43_BRALA CACHD1 protein OS=Branchiostoma lanceolatum OX=7740 GN=CACHD1 PE=4 SV=1, Branchiostoma_lanceolatum_tr_A0A8J9ZZJ7_A0A8J9ZZJ7_BRALA tr|A0A8J9ZZJ7|A0A8J9ZZJ7_BRALA CACHD1 protein OS=Branchiostoma lanceolatum OX=7740 GN=CACHD1 PE=4 SV=1, Branchiostoma_lanceolatum_tr_A0A8J9ZWB3_A0A8J9ZWB3_BRALA tr|A0A8J9ZWB3|A0A8J9ZWB3_BRALA CACHD1 protein OS=Branchiostoma lanceolatum OX=7740 GN=CACHD1 PE=4 SV=1
OG0000051	Xenia_spec_Xe_016324_T2 Xe_016324_T2 Xe_016324, Xenia_spec_Xe_016324_T1 Xe_016324_T1 Xe_016324	Branchiostoma_lanceolatum_tr_A0A8J9YY73_A0A8J9YY73_BRALA tr|A0A8J9YY73|A0A8J9YY73_BRALA CACHD1 protein OS=Branchiostoma lanceolatum OX=7740 GN=CACHD1 PE=3 SV=1
OG0000053	Xenia_spec_Xe_017104_T1 Xe_017104_T1 Xe_017104	Branchiostoma_lanceolatum_tr_A0A8K0EK52_A0A8K0EK52_BRALA tr|A0A8K0EK52|A0A8K0EK52_BRALA MFHAS1 protein OS=Branchiostoma lanceolatum OX=7740 GN=MFHAS1 PE=4 SV=1, Branchiostoma_lanceolatum_tr_A0A8K0F2J8_A0A8K0F2J8_BRALA tr|A0A8K0F2J8|A0A8K0F2J8_BRALA ubiquitinyl hydrolase 1 OS=Branchiostoma lanceolatum OX=7740 GN=MFHAS1 PE=4 SV=1, Branchiostoma_lanceolatum_tr_A0A8K0EWV4_A0A8K0EWV4_BRALA tr|A0A8K0EWV4|A0A8K0EWV4_BRALA ubiquitinyl hydrolase 1 OS=Branchiostoma lanceolatum OX=7740 GN=MFHAS1 PE=4 SV=1, Branchiostoma_lanceolatum_tr_A0A8K0ABL0_A0A8K0ABL0_BRALA tr|A0A8K0ABL0|A0A8K0ABL0_BRALA ubiquitinyl hydrolase 1 OS=Branchiostoma lanceolatum OX=7740 GN=MFHAS1 PE=4 SV=1, Branchiostoma_lanceolatum_tr_A0A8K0ADA9_A0A8K0ADA9_BRALA tr|A0A8K0ADA9|A0A8K0ADA9_BRALA ubiquitinyl hydrolase 1 OS=Branchiostoma lanceolatum OX=7740 GN=MFHAS1 PE=4 SV=1, Branchiostoma_lanceolatum_tr_A0A8K0AAL6_A0A8K0AAL6_BRALA tr|A0A8K0AAL6|A0A8K0AAL6_BRALA ubiquitinyl hydrolase 1 OS=Branchiostoma lanceolatum OX=7740 GN=MFHAS1 PE=4 SV=1, Branchiostoma_lanceolatum_tr_A0A8K0A9L2_A0A8K0A9L2_BRALA tr|A0A8K0A9L2|A0A8K0A9L2_BRALA ubiquitinyl hydrolase 1 OS=Branchiostoma lanceolatum OX=7740 GN=MFHAS1 PE=4 SV=1, Branchiostoma_lanceolatum_tr_A0A8K0EZK7_A0A8K0EZK7_BRALA tr|A0A8K0EZK7|A0A8K0EZK7_BRALA ubiquitinyl hydrolase 1 OS=Branchiostoma lanceolatum OX=7740 GN=MFHAS1 PE=4 SV=1, Branchiostoma_lanceolatum_tr_A0A8K0AC65_A0A8K0AC65_BRALA tr|A0A8K0AC65|A0A8K0AC65_BRALA MFHAS1 protein OS=Branchiostoma lanceolatum OX=7740 GN=MFHAS1 PE=4 SV=1, Branchiostoma_lanceolatum_tr_A0A8J9ZLH9_A0A8J9ZLH9_BRALA tr|A0A8J9ZLH9|A0A8J9ZLH9_BRALA MFHAS1 protein OS=Branchiostoma lanceolatum OX=7740 GN=MFHAS1 PE=4 SV=1, Branchiostoma_lanceolatum_tr_A0A8J9ZLG4_A0A8J9ZLG4_BRALA tr|A0A8J9ZLG4|A0A8J9ZLG4_BRALA MFHAS1 protein OS=Branchiostoma lanceolatum OX=7740 GN=MFHAS1 PE=4 SV=1, Branchiostoma_lanceolatum_tr_A0A8K0A9N6_A0A8K0A9N6_BRALA tr|A0A8K0A9N6|A0A8K0A9N6_BRALA MFHAS1 protein OS=Branchiostoma lanceolatum OX=7740 GN=MFHAS1 PE=4 SV=1, Branchiostoma_lanceolatum_tr_A0A8K0AF20_A0A8K0AF20_BRALA tr|A0A8K0AF20|A0A8K0AF20_BRALA MFHAS1 protein OS=Branchiostoma lanceolatum OX=7740 GN=MFHAS1 PE=4 SV=1, Branchiostoma_lanceolatum_tr_A0A8J9V6F8_A0A8J9V6F8_BRALA tr|A0A8J9V6F8|A0A8J9V6F8_BRALA MFHAS1 protein OS=Branchiostoma lanceolatum OX=7740 GN=MFHAS1 PE=4 SV=1, Branchiostoma_lanceolatum_tr_A0A8K0ABK4_A0A8K0ABK4_BRALA tr|A0A8K0ABK4|A0A8K0ABK4_BRALA MFHAS1 protein OS=Branchiostoma lanceolatum OX=7740 GN=MFHAS1 PE=4 SV=1, Branchiostoma_lanceolatum_tr_A0A8K0AAG9_A0A8K0AAG9_BRALA tr|A0A8K0AAG9|A0A8K0AAG9_BRALA MFHAS1 protein OS=Branchiostoma lanceolatum OX=7740 GN=MFHAS1 PE=4 SV=1, Branchiostoma_lanceolatum_tr_A0A8J9VKC9_A0A8J9VKC9_BRALA tr|A0A8J9VKC9|A0A8J9VKC9_BRALA MFHAS1 protein OS=Branchiostoma lanceolatum OX=7740 GN=MFHAS1 PE=3 SV=1, Branchiostoma_lanceolatum_tr_A0A8J9YSH0_A0A8J9YSH0_BRALA tr|A0A8J9YSH0|A0A8J9YSH0_BRALA MFHAS1 protein OS=Branchiostoma lanceolatum OX=7740 GN=MFHAS1 PE=4 SV=1, Branchiostoma_lanceolatum_tr_A0A8J9YSH4_A0A8J9YSH4_BRALA tr|A0A8J9YSH4|A0A8J9YSH4_BRALA LRRC7 protein OS=Branchiostoma lanceolatum OX=7740 GN=LRRC7 PE=4 SV=1, Branchiostoma_lanceolatum_tr_A0A8J9YRS1_A0A8J9YRS1_BRALA tr|A0A8J9YRS1|A0A8J9YRS1_BRALA ubiquitinyl hydrolase 1 OS=Branchiostoma lanceolatum OX=7740 GN=SHOC2 PE=4 SV=1, Branchiostoma_lanceolatum_tr_A0A8J9VGH8_A0A8J9VGH8_BRALA tr|A0A8J9VGH8|A0A8J9VGH8_BRALA ubiquitinyl hydrolase 1 OS=Branchiostoma lanceolatum OX=7740 GN=SHOC2 PE=4 SV=1, Branchiostoma_lanceolatum_tr_A0A8J9VRT8_A0A8J9VRT8_BRALA tr|A0A8J9VRT8|A0A8J9VRT8_BRALA MFHAS1 protein OS=Branchiostoma lanceolatum OX=7740 GN=MFHAS1 PE=4 SV=1, Branchiostoma_lanceolatum_tr_A0A8J9YRT3_A0A8J9YRT3_BRALA tr|A0A8J9YRT3|A0A8J9YRT3_BRALA MFHAS1 protein OS=Branchiostoma lanceolatum OX=7740 GN=MFHAS1 PE=4 SV=1, Branchiostoma_lanceolatum_tr_A0A8J9VFF7_A0A8J9VFF7_BRALA tr|A0A8J9VFF7|A0A8J9VFF7_BRALA MFHAS1 protein OS=Branchiostoma lanceolatum OX=7740 GN=MFHAS1 PE=4 SV=1, Branchiostoma_lanceolatum_tr_A0A8J9Z390_A0A8J9Z390_BRALA tr|A0A8J9Z390|A0A8J9Z390_BRALA MFHAS1 protein OS=Branchiostoma lanceolatum OX=7740 GN=MFHAS1 PE=4 SV=1, Branchiostoma_lanceolatum_tr_A0A8K0F3K6_A0A8K0F3K6_BRALA tr|A0A8K0F3K6|A0A8K0F3K6_BRALA MFHAS1 protein OS=Branchiostoma lanceolatum OX=7740 GN=MFHAS1 PE=4 SV=1, Branchiostoma_lanceolatum_tr_A0A8K0AF89_A0A8K0AF89_BRALA tr|A0A8K0AF89|A0A8K0AF89_BRALA MFHAS1 protein OS=Branchiostoma lanceolatum OX=7740 GN=MFHAS1 PE=4 SV=1
OG0000054	Xenia_spec_Xe_016386_T1 Xe_016386_T1 Xe_016386	Branchiostoma_lanceolatum_tr_A0A8K0E8Q0_A0A8K0E8Q0_BRALA tr|A0A8K0E8Q0|A0A8K0E8Q0_BRALA ERBIN protein OS=Branchiostoma lanceolatum OX=7740 GN=ERBIN PE=4 SV=1, Branchiostoma_lanceolatum_tr_A0A8K0EBD9_A0A8K0EBD9_BRALA tr|A0A8K0EBD9|A0A8K0EBD9_BRALA ERBIN protein OS=Branchiostoma lanceolatum OX=7740 GN=ERBIN PE=4 SV=1
OG0000054	Xenia_spec_Xe_002676_T1 Xe_002676_T1 Xe_002676	Branchiostoma_lanceolatum_tr_A0A8J9Z6U2_A0A8J9Z6U2_BRALA tr|A0A8J9Z6U2|A0A8J9Z6U2_BRALA SCRIB protein OS=Branchiostoma lanceolatum OX=7740 GN=SCRIB PE=4 SV=1
OG0000059	Xenia_spec_Xe_008324_T1 Xe_008324_T1 Xe_008324	Branchiostoma_lanceolatum_tr_A0A8J9ZLA4_A0A8J9ZLA4_BRALA tr|A0A8J9ZLA4|A0A8J9ZLA4_BRALA SCUBE1 protein OS=Branchiostoma lanceolatum OX=7740 GN=SCUBE1 PE=4 SV=1, Branchiostoma_lanceolatum_tr_A0A8J9ZNH9_A0A8J9ZNH9_BRALA tr|A0A8J9ZNH9|A0A8J9ZNH9_BRALA SCUBE1 protein OS=Branchiostoma lanceolatum OX=7740 GN=SCUBE1 PE=4 SV=1, Branchiostoma_lanceolatum_tr_A0A8J9ZND0_A0A8J9ZND0_BRALA tr|A0A8J9ZND0|A0A8J9ZND0_BRALA SCUBE1 protein OS=Branchiostoma lanceolatum OX=7740 GN=SCUBE1 PE=4 SV=1, Branchiostoma_lanceolatum_tr_A0A8J9ZL40_A0A8J9ZL40_BRALA tr|A0A8J9ZL40|A0A8J9ZL40_BRALA SCUBE1 protein OS=Branchiostoma lanceolatum OX=7740 GN=SCUBE1 PE=4 SV=1, Branchiostoma_lanceolatum_tr_A0A8J9ZPX7_A0A8J9ZPX7_BRALA tr|A0A8J9ZPX7|A0A8J9ZPX7_BRALA SCUBE1 protein OS=Branchiostoma lanceolatum OX=7740 GN=SCUBE1 PE=4 SV=1, Branchiostoma_lanceolatum_tr_A0A8J9ZPY7_A0A8J9ZPY7_BRALA tr|A0A8J9ZPY7|A0A8J9ZPY7_BRALA SCUBE1 protein OS=Branchiostoma lanceolatum OX=7740 GN=SCUBE1 PE=4 SV=1, Branchiostoma_lanceolatum_tr_A0A8K0EKG9_A0A8K0EKG9_BRALA tr|A0A8K0EKG9|A0A8K0EKG9_BRALA SCUBE1 protein OS=Branchiostoma lanceolatum OX=7740 GN=SCUBE1 PE=4 SV=1, Branchiostoma_lanceolatum_tr_A0A8K0EQ34_A0A8K0EQ34_BRALA tr|A0A8K0EQ34|A0A8K0EQ34_BRALA SCUBE1 protein OS=Branchiostoma lanceolatum OX=7740 GN=SCUBE1 PE=4 SV=1, Branchiostoma_lanceolatum_tr_A0A8K0EMJ7_A0A8K0EMJ7_BRALA tr|A0A8K0EMJ7|A0A8K0EMJ7_BRALA SCUBE1 protein OS=Branchiostoma lanceolatum OX=7740 GN=SCUBE1 PE=4 SV=1, Branchiostoma_lanceolatum_tr_A0A8J9ZMK5_A0A8J9ZMK5_BRALA tr|A0A8J9ZMK5|A0A8J9ZMK5_BRALA SCUBE1 protein OS=Branchiostoma lanceolatum OX=7740 GN=SCUBE1 PE=4 SV=1, Branchiostoma_lanceolatum_tr_A0A8K0EQL9_A0A8K0EQL9_BRALA tr|A0A8K0EQL9|A0A8K0EQL9_BRALA SCUBE1 protein OS=Branchiostoma lanceolatum OX=7740 GN=SCUBE1 PE=4 SV=1, Branchiostoma_lanceolatum_tr_A0A8K0EMJ3_A0A8K0EMJ3_BRALA tr|A0A8K0EMJ3|A0A8K0EMJ3_BRALA SCUBE1 protein OS=Branchiostoma lanceolatum OX=7740 GN=SCUBE1 PE=4 SV=1, Branchiostoma_lanceolatum_tr_A0A8J9ZNB7_A0A8J9ZNB7_BRALA tr|A0A8J9ZNB7|A0A8J9ZNB7_BRALA SCUBE1 protein OS=Branchiostoma lanceolatum OX=7740 GN=SCUBE1 PE=4 SV=1, Branchiostoma_lanceolatum_tr_A0A8J9ZL43_A0A8J9ZL43_BRALA tr|A0A8J9ZL43|A0A8J9ZL43_BRALA SCUBE1 protein OS=Branchiostoma lanceolatum OX=7740 GN=SCUBE1 PE=4 SV=1, Branchiostoma_lanceolatum_tr_A0A8J9ZNU6_A0A8J9ZNU6_BRALA tr|A0A8J9ZNU6|A0A8J9ZNU6_BRALA SCUBE1 protein OS=Branchiostoma lanceolatum OX=7740 GN=SCUBE1 PE=4 SV=1, Branchiostoma_lanceolatum_tr_A0A8K0EMJ2_A0A8K0EMJ2_BRALA tr|A0A8K0EMJ2|A0A8K0EMJ2_BRALA SCUBE1 protein OS=Branchiostoma lanceolatum OX=7740 GN=SCUBE1 PE=4 SV=1, Branchiostoma_lanceolatum_tr_A0A8J9ZP39_A0A8J9ZP39_BRALA tr|A0A8J9ZP39|A0A8J9ZP39_BRALA SCUBE1 protein OS=Branchiostoma lanceolatum OX=7740 GN=SCUBE1 PE=4 SV=1, Branchiostoma_lanceolatum_tr_A0A8K0EKG3_A0A8K0EKG3_BRALA tr|A0A8K0EKG3|A0A8K0EKG3_BRALA SCUBE1 protein OS=Branchiostoma lanceolatum OX=7740 GN=SCUBE1 PE=4 SV=1, Branchiostoma_lanceolatum_tr_A0A8K0EQ29_A0A8K0EQ29_BRALA tr|A0A8K0EQ29|A0A8K0EQ29_BRALA SCUBE1 protein OS=Branchiostoma lanceolatum OX=7740 GN=SCUBE1 PE=4 SV=1, Branchiostoma_lanceolatum_tr_A0A8K0EMI8_A0A8K0EMI8_BRALA tr|A0A8K0EMI8|A0A8K0EMI8_BRALA SCUBE1 protein OS=Branchiostoma lanceolatum OX=7740 GN=SCUBE1 PE=4 SV=1, Branchiostoma_lanceolatum_tr_A0A8K0EQL4_A0A8K0EQL4_BRALA tr|A0A8K0EQL4|A0A8K0EQL4_BRALA SCUBE1 protein OS=Branchiostoma lanceolatum OX=7740 GN=SCUBE1 PE=4 SV=1, Branchiostoma_lanceolatum_tr_A0A8J9ZNT6_A0A8J9ZNT6_BRALA tr|A0A8J9ZNT6|A0A8J9ZNT6_BRALA SCUBE1 protein OS=Branchiostoma lanceolatum OX=7740 GN=SCUBE1 PE=4 SV=1, Branchiostoma_lanceolatum_tr_A0A8J9ZMJ6_A0A8J9ZMJ6_BRALA tr|A0A8J9ZMJ6|A0A8J9ZMJ6_BRALA SCUBE1 protein OS=Branchiostoma lanceolatum OX=7740 GN=SCUBE1 PE=4 SV=1, Branchiostoma_lanceolatum_tr_A0A8J9ZP29_A0A8J9ZP29_BRALA tr|A0A8J9ZP29|A0A8J9ZP29_BRALA SCUBE1 protein OS=Branchiostoma lanceolatum OX=7740 GN=SCUBE1 PE=4 SV=1, Branchiostoma_lanceolatum_tr_A0A8J9ZL74_A0A8J9ZL74_BRALA tr|A0A8J9ZL74|A0A8J9ZL74_BRALA SCUBE1 protein OS=Branchiostoma lanceolatum OX=7740 GN=SCUBE1 PE=4 SV=1, Branchiostoma_lanceolatum_tr_A0A8J9ZL95_A0A8J9ZL95_BRALA tr|A0A8J9ZL95|A0A8J9ZL95_BRALA SCUBE1 protein OS=Branchiostoma lanceolatum OX=7740 GN=SCUBE1 PE=4 SV=1, Branchiostoma_lanceolatum_tr_A0A8J9ZL31_A0A8J9ZL31_BRALA tr|A0A8J9ZL31|A0A8J9ZL31_BRALA SCUBE1 protein OS=Branchiostoma lanceolatum OX=7740 GN=SCUBE1 PE=4 SV=1, Branchiostoma_lanceolatum_tr_A0A8J9ZL81_A0A8J9ZL81_BRALA tr|A0A8J9ZL81|A0A8J9ZL81_BRALA SCUBE1 protein OS=Branchiostoma lanceolatum OX=7740 GN=SCUBE1 PE=4 SV=1, Branchiostoma_lanceolatum_tr_A0A8J9ZL34_A0A8J9ZL34_BRALA tr|A0A8J9ZL34|A0A8J9ZL34_BRALA SCUBE1 protein OS=Branchiostoma lanceolatum OX=7740 GN=SCUBE1 PE=4 SV=1, Branchiostoma_lanceolatum_tr_A0A8J9ZNG8_A0A8J9ZNG8_BRALA tr|A0A8J9ZNG8|A0A8J9ZNG8_BRALA SCUBE1 protein OS=Branchiostoma lanceolatum OX=7740 GN=SCUBE1 PE=4 SV=1
OG0000061	Xenia_spec_Xe_020705_T1 Xe_020705_T1 Xe_020705	Branchiostoma_lanceolatum_tr_A0A8J9ZKP6_A0A8J9ZKP6_BRALA tr|A0A8J9ZKP6|A0A8J9ZKP6_BRALA CPNE3 protein OS=Branchiostoma lanceolatum OX=7740 GN=CPNE3 PE=3 SV=1, Branchiostoma_lanceolatum_tr_A0A8K0EIW3_A0A8K0EIW3_BRALA tr|A0A8K0EIW3|A0A8K0EIW3_BRALA CPNE3 protein OS=Branchiostoma lanceolatum OX=7740 GN=CPNE3 PE=3 SV=1, Branchiostoma_lanceolatum_tr_A0A8K0ENT9_A0A8K0ENT9_BRALA tr|A0A8K0ENT9|A0A8K0ENT9_BRALA CPNE3 protein OS=Branchiostoma lanceolatum OX=7740 GN=CPNE3 PE=3 SV=1, Branchiostoma_lanceolatum_tr_A0A8K0A8B7_A0A8K0A8B7_BRALA tr|A0A8K0A8B7|A0A8K0A8B7_BRALA CPNE7 protein OS=Branchiostoma lanceolatum OX=7740 GN=CPNE7 PE=3 SV=1
OG0000061	Xenia_spec_Xe_003790_T1 Xe_003790_T1 Xe_003790	Branchiostoma_lanceolatum_tr_A0A8K0ESI7_A0A8K0ESI7_BRALA tr|A0A8K0ESI7|A0A8K0ESI7_BRALA CPNE8 protein OS=Branchiostoma lanceolatum OX=7740 GN=CPNE8 PE=3 SV=1, Branchiostoma_lanceolatum_tr_A0A8J9ZYS0_A0A8J9ZYS0_BRALA tr|A0A8J9ZYS0|A0A8J9ZYS0_BRALA CPNE8 protein OS=Branchiostoma lanceolatum OX=7740 GN=CPNE8 PE=3 SV=1, Branchiostoma_lanceolatum_tr_A0A8K0EQ33_A0A8K0EQ33_BRALA tr|A0A8K0EQ33|A0A8K0EQ33_BRALA CPNE8 protein OS=Branchiostoma lanceolatum OX=7740 GN=CPNE8 PE=3 SV=1, Branchiostoma_lanceolatum_tr_A0A8J9ZY72_A0A8J9ZY72_BRALA tr|A0A8J9ZY72|A0A8J9ZY72_BRALA CPNE8 protein OS=Branchiostoma lanceolatum OX=7740 GN=CPNE8 PE=3 SV=1, Branchiostoma_lanceolatum_tr_A0A8J9ZW37_A0A8J9ZW37_BRALA tr|A0A8J9ZW37|A0A8J9ZW37_BRALA CPNE8 protein OS=Branchiostoma lanceolatum OX=7740 GN=CPNE8 PE=3 SV=1, Branchiostoma_lanceolatum_tr_A0A8J9ZVL4_A0A8J9ZVL4_BRALA tr|A0A8J9ZVL4|A0A8J9ZVL4_BRALA CPNE8 protein OS=Branchiostoma lanceolatum OX=7740 GN=CPNE8 PE=3 SV=1, Branchiostoma_lanceolatum_tr_A0A8K0EVQ5_A0A8K0EVQ5_BRALA tr|A0A8K0EVQ5|A0A8K0EVQ5_BRALA CPNE8 protein OS=Branchiostoma lanceolatum OX=7740 GN=CPNE8 PE=3 SV=1
OG0000062	Xenia_spec_Xe_011884_T1 Xe_011884_T1 Xe_011884	Branchiostoma_lanceolatum_tr_A0A8J9Z763_A0A8J9Z763_BRALA tr|A0A8J9Z763|A0A8J9Z763_BRALA Delta-like protein OS=Branchiostoma lanceolatum OX=7740 GN=DLL1 PE=4 SV=1, Branchiostoma_lanceolatum_tr_A0A8K0ESR6_A0A8K0ESR6_BRALA tr|A0A8K0ESR6|A0A8K0ESR6_BRALA DLL1 protein OS=Branchiostoma lanceolatum OX=7740 GN=DLL1 PE=4 SV=1, Branchiostoma_lanceolatum_tr_A0A8K0EQ31_A0A8K0EQ31_BRALA tr|A0A8K0EQ31|A0A8K0EQ31_BRALA DLL1 protein OS=Branchiostoma lanceolatum OX=7740 GN=DLL1 PE=4 SV=1, Branchiostoma_lanceolatum_tr_A0A8K0ESC1_A0A8K0ESC1_BRALA tr|A0A8K0ESC1|A0A8K0ESC1_BRALA JAG1 protein OS=Branchiostoma lanceolatum OX=7740 GN=JAG1 PE=4 SV=1, Branchiostoma_lanceolatum_tr_A0A8K0EUY5_A0A8K0EUY5_BRALA tr|A0A8K0EUY5|A0A8K0EUY5_BRALA Delta-like protein OS=Branchiostoma lanceolatum OX=7740 GN=JAG1 PE=4 SV=1
OG0000062	Xenia_spec_Xe_011964_T1 Xe_011964_T1 Xe_011964	Branchiostoma_lanceolatum_tr_A0A8K0EPJ4_A0A8K0EPJ4_BRALA tr|A0A8K0EPJ4|A0A8K0EPJ4_BRALA NOTCH1 protein OS=Branchiostoma lanceolatum OX=7740 GN=NOTCH1 PE=4 SV=1
OG0000063	Xenia_spec_Xe_010055_T1 Xe_010055_T1 Xe_010055	Branchiostoma_lanceolatum_tr_A0A8K0E9L0_A0A8K0E9L0_BRALA tr|A0A8K0E9L0|A0A8K0E9L0_BRALA Hedgehog protein OS=Branchiostoma lanceolatum OX=7740 GN=IHH PE=3 SV=1
OG0000064	Xenia_spec_Xe_002322_T1 Xe_002322_T1 Xe_002322	Branchiostoma_lanceolatum_tr_A0A8J9ZJN5_A0A8J9ZJN5_BRALA tr|A0A8J9ZJN5|A0A8J9ZJN5_BRALA FBN3 protein OS=Branchiostoma lanceolatum OX=7740 GN=FBN3 PE=4 SV=1, Branchiostoma_lanceolatum_tr_A0A8J9ZV83_A0A8J9ZV83_BRALA tr|A0A8J9ZV83|A0A8J9ZV83_BRALA FBN2 protein OS=Branchiostoma lanceolatum OX=7740 GN=FBN2 PE=4 SV=1, Branchiostoma_lanceolatum_tr_A0A8J9ZVQ7_A0A8J9ZVQ7_BRALA tr|A0A8J9ZVQ7|A0A8J9ZVQ7_BRALA FBN2 protein OS=Branchiostoma lanceolatum OX=7740 GN=FBN2 PE=4 SV=1, Branchiostoma_lanceolatum_tr_A0A8J9ZGP7_A0A8J9ZGP7_BRALA tr|A0A8J9ZGP7|A0A8J9ZGP7_BRALA FBN2 protein _Fragment_ OS=Branchiostoma lanceolatum OX=7740 GN=FBN2 PE=4 SV=1, Branchiostoma_lanceolatum_tr_A0A8J9ZH02_A0A8J9ZH02_BRALA tr|A0A8J9ZH02|A0A8J9ZH02_BRALA FBN2 protein OS=Branchiostoma lanceolatum OX=7740 GN=FBN2 PE=3 SV=1, Branchiostoma_lanceolatum_tr_A0A8K0EJ95_A0A8K0EJ95_BRALA tr|A0A8K0EJ95|A0A8K0EJ95_BRALA FBN2 protein OS=Branchiostoma lanceolatum OX=7740 GN=FBN2 PE=3 SV=1, Branchiostoma_lanceolatum_tr_A0A8J9ZEI5_A0A8J9ZEI5_BRALA tr|A0A8J9ZEI5|A0A8J9ZEI5_BRALA FBN2 protein OS=Branchiostoma lanceolatum OX=7740 GN=FBN2 PE=4 SV=1, Branchiostoma_lanceolatum_tr_A0A8K0EHA4_A0A8K0EHA4_BRALA tr|A0A8K0EHA4|A0A8K0EHA4_BRALA FBN2 protein OS=Branchiostoma lanceolatum OX=7740 GN=FBN2 PE=4 SV=1, Branchiostoma_lanceolatum_tr_A0A8K0ELI4_A0A8K0ELI4_BRALA tr|A0A8K0ELI4|A0A8K0ELI4_BRALA FBN2 protein OS=Branchiostoma lanceolatum OX=7740 GN=FBN2 PE=4 SV=1, Branchiostoma_lanceolatum_tr_A0A8K0ELZ7_A0A8K0ELZ7_BRALA tr|A0A8K0ELZ7|A0A8K0ELZ7_BRALA FBN2 protein OS=Branchiostoma lanceolatum OX=7740 GN=FBN2 PE=4 SV=1
OG0000065	Xenia_spec_Xe_015641_T1 Xe_015641_T1 Xe_015641, Xenia_spec_Xe_015614_T1 Xe_015614_T1 Xe_015614, Xenia_spec_Xe_015613_T1 Xe_015613_T1 Xe_015613	Branchiostoma_lanceolatum_tr_A0A8K0EDI7_A0A8K0EDI7_BRALA tr|A0A8K0EDI7|A0A8K0EDI7_BRALA GPC5 protein OS=Branchiostoma lanceolatum OX=7740 GN=GPC5 PE=3 SV=1
