Orthogroup	Cnidaria_Anthozoa_Xenia_spec	Chordata_Amphioxiformes_Branchiostoma_lanceolatum
OG0000015	Xenia_spec_Xe_002027_T1 Xe_002027_T1 Xe_002027, Xenia_spec_Xe_002017_T1 Xe_002017_T1 Xe_002017, Xenia_spec_Xe_002026_T1 Xe_002026_T1 Xe_002026, Xenia_spec_Xe_002028_T1 Xe_002028_T1 Xe_002028, Xenia_spec_Xe_001050_T1 Xe_001050_T1 Xe_001050, Xenia_spec_Xe_001050_T2 Xe_001050_T2 Xe_001050, Xenia_spec_Xe_007946_T1 Xe_007946_T1 Xe_007946, Xenia_spec_Xe_007945_T1 Xe_007945_T1 Xe_007945	Branchiostoma_lanceolatum_tr_A0A8J9ZI44_A0A8J9ZI44_BRALA tr|A0A8J9ZI44|A0A8J9ZI44_BRALA MRC1 protein OS=Branchiostoma lanceolatum OX=7740 GN=MRC1 PE=4 SV=1, Branchiostoma_lanceolatum_tr_A0A8J9ZYR0_A0A8J9ZYR0_BRALA tr|A0A8J9ZYR0|A0A8J9ZYR0_BRALA chitinase OS=Branchiostoma lanceolatum OX=7740 GN=CUZD1 PE=4 SV=1, Branchiostoma_lanceolatum_tr_A0A8K0A6Y4_A0A8K0A6Y4_BRALA tr|A0A8K0A6Y4|A0A8K0A6Y4_BRALA OIT3 protein OS=Branchiostoma lanceolatum OX=7740 GN=OIT3 PE=4 SV=1, Branchiostoma_lanceolatum_tr_A0A8K0EU68_A0A8K0EU68_BRALA tr|A0A8K0EU68|A0A8K0EU68_BRALA OIT3 protein OS=Branchiostoma lanceolatum OX=7740 GN=OIT3 PE=4 SV=1, Branchiostoma_lanceolatum_tr_A0A8J9Z0G2_A0A8J9Z0G2_BRALA tr|A0A8J9Z0G2|A0A8J9Z0G2_BRALA FBN1 protein OS=Branchiostoma lanceolatum OX=7740 GN=FBN1 PE=4 SV=1, Branchiostoma_lanceolatum_tr_A0A8J9ZHH9_A0A8J9ZHH9_BRALA tr|A0A8J9ZHH9|A0A8J9ZHH9_BRALA OIT3 protein OS=Branchiostoma lanceolatum OX=7740 GN=OIT3 PE=4 SV=1, Branchiostoma_lanceolatum_tr_A0A8J9ZIR8_A0A8J9ZIR8_BRALA tr|A0A8J9ZIR8|A0A8J9ZIR8_BRALA OIT3 protein OS=Branchiostoma lanceolatum OX=7740 GN=OIT3 PE=4 SV=1, Branchiostoma_lanceolatum_tr_A0A8K0EJF2_A0A8K0EJF2_BRALA tr|A0A8K0EJF2|A0A8K0EJF2_BRALA OIT3 protein OS=Branchiostoma lanceolatum OX=7740 GN=OIT3 PE=4 SV=1, Branchiostoma_lanceolatum_tr_A0A8J9ZHU3_A0A8J9ZHU3_BRALA tr|A0A8J9ZHU3|A0A8J9ZHU3_BRALA NPTX2 protein OS=Branchiostoma lanceolatum OX=7740 GN=NPTX2 PE=4 SV=1, Branchiostoma_lanceolatum_tr_A0A8K0A2I7_A0A8K0A2I7_BRALA tr|A0A8K0A2I7|A0A8K0A2I7_BRALA TECTA protein OS=Branchiostoma lanceolatum OX=7740 GN=TECTA PE=4 SV=1, Branchiostoma_lanceolatum_tr_A0A8J9ZEQ2_A0A8J9ZEQ2_BRALA tr|A0A8J9ZEQ2|A0A8J9ZEQ2_BRALA OIT3 protein OS=Branchiostoma lanceolatum OX=7740 GN=OIT3 PE=4 SV=1, Branchiostoma_lanceolatum_tr_A0A8K0EVP9_A0A8K0EVP9_BRALA tr|A0A8K0EVP9|A0A8K0EVP9_BRALA OIT3 protein OS=Branchiostoma lanceolatum OX=7740 GN=OIT3 PE=4 SV=1, Branchiostoma_lanceolatum_tr_A0A8K0EV50_A0A8K0EV50_BRALA tr|A0A8K0EV50|A0A8K0EV50_BRALA OIT3 protein OS=Branchiostoma lanceolatum OX=7740 GN=OIT3 PE=4 SV=1, Branchiostoma_lanceolatum_tr_A0A8J9ZGY7_A0A8J9ZGY7_BRALA tr|A0A8J9ZGY7|A0A8J9ZGY7_BRALA HSD17B6 protein OS=Branchiostoma lanceolatum OX=7740 GN=HSD17B6 PE=4 SV=1, Branchiostoma_lanceolatum_tr_A0A8K0A3G0_A0A8K0A3G0_BRALA tr|A0A8K0A3G0|A0A8K0A3G0_BRALA CUZD1 protein OS=Branchiostoma lanceolatum OX=7740 GN=CUZD1 PE=4 SV=1, Branchiostoma_lanceolatum_tr_A0A8K0EZW3_A0A8K0EZW3_BRALA tr|A0A8K0EZW3|A0A8K0EZW3_BRALA PI16 protein OS=Branchiostoma lanceolatum OX=7740 GN=PI16 PE=4 SV=1, Branchiostoma_lanceolatum_tr_A0A8J9V786_A0A8J9V786_BRALA tr|A0A8J9V786|A0A8J9V786_BRALA CUZD1 protein OS=Branchiostoma lanceolatum OX=7740 GN=CUZD1 PE=4 SV=1, Branchiostoma_lanceolatum_tr_A0A8J9YPJ6_A0A8J9YPJ6_BRALA tr|A0A8J9YPJ6|A0A8J9YPJ6_BRALA CUZD1 protein OS=Branchiostoma lanceolatum OX=7740 GN=CUZD1 PE=4 SV=1, Branchiostoma_lanceolatum_tr_A0A8J9VSH3_A0A8J9VSH3_BRALA tr|A0A8J9VSH3|A0A8J9VSH3_BRALA OIT3 protein OS=Branchiostoma lanceolatum OX=7740 GN=OIT3 PE=4 SV=1, Branchiostoma_lanceolatum_tr_A0A8J9VAL4_A0A8J9VAL4_BRALA tr|A0A8J9VAL4|A0A8J9VAL4_BRALA DMBT1 protein OS=Branchiostoma lanceolatum OX=7740 GN=DMBT1 PE=4 SV=1, Branchiostoma_lanceolatum_tr_A0A8J9WBD5_A0A8J9WBD5_BRALA tr|A0A8J9WBD5|A0A8J9WBD5_BRALA COL14A1 protein OS=Branchiostoma lanceolatum OX=7740 GN=COL14A1 PE=4 SV=1, Branchiostoma_lanceolatum_tr_A0A8J9YIZ6_A0A8J9YIZ6_BRALA tr|A0A8J9YIZ6|A0A8J9YIZ6_BRALA OIT3 protein OS=Branchiostoma lanceolatum OX=7740 GN=OIT3 PE=4 SV=1, Branchiostoma_lanceolatum_tr_A0A8J9VWU9_A0A8J9VWU9_BRALA tr|A0A8J9VWU9|A0A8J9VWU9_BRALA OIT3 protein OS=Branchiostoma lanceolatum OX=7740 GN=OIT3 PE=4 SV=1, Branchiostoma_lanceolatum_tr_A0A8J9ZEJ2_A0A8J9ZEJ2_BRALA tr|A0A8J9ZEJ2|A0A8J9ZEJ2_BRALA OIT3 protein OS=Branchiostoma lanceolatum OX=7740 GN=OIT3 PE=4 SV=1, Branchiostoma_lanceolatum_tr_A0A8J9ZG12_A0A8J9ZG12_BRALA tr|A0A8J9ZG12|A0A8J9ZG12_BRALA FBN2 protein OS=Branchiostoma lanceolatum OX=7740 GN=FBN2 PE=4 SV=1, Branchiostoma_lanceolatum_tr_A0A8J9VJQ1_A0A8J9VJQ1_BRALA tr|A0A8J9VJQ1|A0A8J9VJQ1_BRALA OIT3 protein OS=Branchiostoma lanceolatum OX=7740 GN=OIT3 PE=4 SV=1, Branchiostoma_lanceolatum_tr_A0A8K0EGU7_A0A8K0EGU7_BRALA tr|A0A8K0EGU7|A0A8K0EGU7_BRALA CUZD1 protein OS=Branchiostoma lanceolatum OX=7740 GN=CUZD1 PE=4 SV=1, Branchiostoma_lanceolatum_tr_A0A8K0EE67_A0A8K0EE67_BRALA tr|A0A8K0EE67|A0A8K0EE67_BRALA CUZD1 protein OS=Branchiostoma lanceolatum OX=7740 GN=CUZD1 PE=4 SV=1, Branchiostoma_lanceolatum_tr_A0A8J9Z749_A0A8J9Z749_BRALA tr|A0A8J9Z749|A0A8J9Z749_BRALA CUZD1 protein OS=Branchiostoma lanceolatum OX=7740 GN=CUZD1 PE=4 SV=1, Branchiostoma_lanceolatum_tr_A0A8K0ECX6_A0A8K0ECX6_BRALA tr|A0A8K0ECX6|A0A8K0ECX6_BRALA CUZD1 protein OS=Branchiostoma lanceolatum OX=7740 GN=CUZD1 PE=4 SV=1, Branchiostoma_lanceolatum_tr_A0A8K0EBW5_A0A8K0EBW5_BRALA tr|A0A8K0EBW5|A0A8K0EBW5_BRALA CUZD1 protein OS=Branchiostoma lanceolatum OX=7740 GN=CUZD1 PE=4 SV=1, Branchiostoma_lanceolatum_tr_A0A8S4MM50_A0A8S4MM50_BRALA tr|A0A8S4MM50|A0A8S4MM50_BRALA CUZD1 protein OS=Branchiostoma lanceolatum OX=7740 GN=CUZD1 PE=4 SV=1, Branchiostoma_lanceolatum_tr_A0A8S4MLT3_A0A8S4MLT3_BRALA tr|A0A8S4MLT3|A0A8S4MLT3_BRALA DMBT1 protein OS=Branchiostoma lanceolatum OX=7740 GN=DMBT1 PE=4 SV=1, Branchiostoma_lanceolatum_tr_A0A8J9ZSS8_A0A8J9ZSS8_BRALA tr|A0A8J9ZSS8|A0A8J9ZSS8_BRALA CUZD1 protein OS=Branchiostoma lanceolatum OX=7740 GN=CUZD1 PE=4 SV=1, Branchiostoma_lanceolatum_tr_A0A8J9ZDC5_A0A8J9ZDC5_BRALA tr|A0A8J9ZDC5|A0A8J9ZDC5_BRALA CUZD1 protein OS=Branchiostoma lanceolatum OX=7740 GN=CUZD1 PE=4 SV=1, Branchiostoma_lanceolatum_tr_A0A8J9ZCF5_A0A8J9ZCF5_BRALA tr|A0A8J9ZCF5|A0A8J9ZCF5_BRALA MATN2 protein OS=Branchiostoma lanceolatum OX=7740 GN=MATN2 PE=4 SV=1, Branchiostoma_lanceolatum_tr_A0A8J9ZB42_A0A8J9ZB42_BRALA tr|A0A8J9ZB42|A0A8J9ZB42_BRALA CUZD1 protein OS=Branchiostoma lanceolatum OX=7740 GN=CUZD1 PE=4 SV=1, Branchiostoma_lanceolatum_tr_A0A8J9ZBX5_A0A8J9ZBX5_BRALA tr|A0A8J9ZBX5|A0A8J9ZBX5_BRALA CUZD1 protein OS=Branchiostoma lanceolatum OX=7740 GN=CUZD1 PE=4 SV=1, Branchiostoma_lanceolatum_tr_A0A8J9VUQ8_A0A8J9VUQ8_BRALA tr|A0A8J9VUQ8|A0A8J9VUQ8_BRALA OIT3 protein OS=Branchiostoma lanceolatum OX=7740 GN=OIT3 PE=4 SV=1, Branchiostoma_lanceolatum_tr_A0A8K0E5P6_A0A8K0E5P6_BRALA tr|A0A8K0E5P6|A0A8K0E5P6_BRALA CUZD1 protein OS=Branchiostoma lanceolatum OX=7740 GN=CUZD1 PE=4 SV=1, Branchiostoma_lanceolatum_tr_A0A8K0E3M7_A0A8K0E3M7_BRALA tr|A0A8K0E3M7|A0A8K0E3M7_BRALA CUZD1 protein OS=Branchiostoma lanceolatum OX=7740 GN=CUZD1 PE=4 SV=1, Branchiostoma_lanceolatum_tr_A0A8K0EKS0_A0A8K0EKS0_BRALA tr|A0A8K0EKS0|A0A8K0EKS0_BRALA CUZD1 protein OS=Branchiostoma lanceolatum OX=7740 GN=CUZD1 PE=4 SV=1, Branchiostoma_lanceolatum_tr_A0A8J9VSI0_A0A8J9VSI0_BRALA tr|A0A8J9VSI0|A0A8J9VSI0_BRALA OIT3 protein OS=Branchiostoma lanceolatum OX=7740 GN=OIT3 PE=4 SV=1
OG0000016	Xenia_spec_Xe_012705_T1 Xe_012705_T1 Xe_012705	Branchiostoma_lanceolatum_tr_A0A8K0AEQ2_A0A8K0AEQ2_BRALA tr|A0A8K0AEQ2|A0A8K0AEQ2_BRALA MMP1 protein OS=Branchiostoma lanceolatum OX=7740 GN=MMP1 PE=3 SV=1, Branchiostoma_lanceolatum_tr_A0A8J9YSC3_A0A8J9YSC3_BRALA tr|A0A8J9YSC3|A0A8J9YSC3_BRALA MMP1 protein OS=Branchiostoma lanceolatum OX=7740 GN=MMP1 PE=3 SV=1, Branchiostoma_lanceolatum_tr_A0A8K0EZV9_A0A8K0EZV9_BRALA tr|A0A8K0EZV9|A0A8K0EZV9_BRALA MMP12 protein OS=Branchiostoma lanceolatum OX=7740 GN=MMP12 PE=3 SV=1, Branchiostoma_lanceolatum_tr_A0A8K0AHE5_A0A8K0AHE5_BRALA tr|A0A8K0AHE5|A0A8K0AHE5_BRALA MMP12 protein OS=Branchiostoma lanceolatum OX=7740 GN=MMP12 PE=3 SV=1, Branchiostoma_lanceolatum_tr_A0A8K0ACF2_A0A8K0ACF2_BRALA tr|A0A8K0ACF2|A0A8K0ACF2_BRALA TTC28 protein OS=Branchiostoma lanceolatum OX=7740 GN=TTC28 PE=3 SV=1
OG0000018	Xenia_spec_Xe_013913_T1 Xe_013913_T1 Xe_013913, Xenia_spec_Xe_013934_T1 Xe_013934_T1 Xe_013934	Branchiostoma_lanceolatum_tr_A0A8S4MM45_A0A8S4MM45_BRALA tr|A0A8S4MM45|A0A8S4MM45_BRALA LOXL3 protein OS=Branchiostoma lanceolatum OX=7740 GN=LOXL3 PE=3 SV=1
OG0000018	Xenia_spec_Xe_009686_T1 Xe_009686_T1 Xe_009686, Xenia_spec_Xe_009691_T1 Xe_009691_T1 Xe_009691, Xenia_spec_Xe_010129_T1 Xe_010129_T1 Xe_010129, Xenia_spec_Xe_010158_T1 Xe_010158_T1 Xe_010158, Xenia_spec_Xe_006051_T1 Xe_006051_T1 Xe_006051, Xenia_spec_Xe_010156_T1 Xe_010156_T1 Xe_010156, Xenia_spec_Xe_010159_T1 Xe_010159_T1 Xe_010159, Xenia_spec_Xe_010157_T1 Xe_010157_T1 Xe_010157, Xenia_spec_Xe_002016_T1 Xe_002016_T1 Xe_002016	Branchiostoma_lanceolatum_tr_A0A8K0EJM6_A0A8K0EJM6_BRALA tr|A0A8K0EJM6|A0A8K0EJM6_BRALA DMBT1 protein OS=Branchiostoma lanceolatum OX=7740 GN=DMBT1 PE=4 SV=1, Branchiostoma_lanceolatum_tr_A0A8K0EFK8_A0A8K0EFK8_BRALA tr|A0A8K0EFK8|A0A8K0EFK8_BRALA PRSS12 protein OS=Branchiostoma lanceolatum OX=7740 GN=PRSS12 PE=4 SV=1, Branchiostoma_lanceolatum_tr_A0A8J9ZCL7_A0A8J9ZCL7_BRALA tr|A0A8J9ZCL7|A0A8J9ZCL7_BRALA DMBT1 protein OS=Branchiostoma lanceolatum OX=7740 GN=DMBT1 PE=4 SV=1
OG0000018	Xenia_spec_Xe_013911_T1 Xe_013911_T1 Xe_013911	Branchiostoma_lanceolatum_tr_A0A8K0EI03_A0A8K0EI03_BRALA tr|A0A8K0EI03|A0A8K0EI03_BRALA ZAN protein OS=Branchiostoma lanceolatum OX=7740 GN=ZAN PE=4 SV=1, Branchiostoma_lanceolatum_tr_A0A8K0EFK5_A0A8K0EFK5_BRALA tr|A0A8K0EFK5|A0A8K0EFK5_BRALA PRSS12 protein OS=Branchiostoma lanceolatum OX=7740 GN=PRSS12 PE=3 SV=1
OG0000018	Xenia_spec_Xe_005091_T1 Xe_005091_T1 Xe_005091	Branchiostoma_lanceolatum_tr_A0A8J9VDI4_A0A8J9VDI4_BRALA tr|A0A8J9VDI4|A0A8J9VDI4_BRALA NOTCH1 protein OS=Branchiostoma lanceolatum OX=7740 GN=NOTCH1 PE=4 SV=1, Branchiostoma_lanceolatum_tr_A0A8J9YN11_A0A8J9YN11_BRALA tr|A0A8J9YN11|A0A8J9YN11_BRALA NOTCH2 protein OS=Branchiostoma lanceolatum OX=7740 GN=NOTCH2 PE=4 SV=1
OG0000018	Xenia_spec_Xe_004831_T1 Xe_004831_T1 Xe_004831	Branchiostoma_lanceolatum_tr_A0A8K0EUZ0_A0A8K0EUZ0_BRALA tr|A0A8K0EUZ0|A0A8K0EUZ0_BRALA Sortilin-related receptor OS=Branchiostoma lanceolatum OX=7740 GN=SORL1 PE=3 SV=1, Branchiostoma_lanceolatum_tr_A0A8K0ES26_A0A8K0ES26_BRALA tr|A0A8K0ES26|A0A8K0ES26_BRALA Sortilin-related receptor OS=Branchiostoma lanceolatum OX=7740 GN=SORL1 PE=3 SV=1
OG0000019	Xenia_spec_Xe_002372_T1 Xe_002372_T1 Xe_002372, Xenia_spec_Xe_002371_T1 Xe_002371_T1 Xe_002371	Branchiostoma_lanceolatum_tr_A0A8J9Z6A2_A0A8J9Z6A2_BRALA tr|A0A8J9Z6A2|A0A8J9Z6A2_BRALA BMP7 protein OS=Branchiostoma lanceolatum OX=7740 GN=BMP7 PE=3 SV=1, Branchiostoma_lanceolatum_tr_A0A8J9Z644_A0A8J9Z644_BRALA tr|A0A8J9Z644|A0A8J9Z644_BRALA BMP7 protein OS=Branchiostoma lanceolatum OX=7740 GN=BMP7 PE=3 SV=1
OG0000019	Xenia_spec_Xe_000961_T1 Xe_000961_T1 Xe_000961, Xenia_spec_Xe_000961_T2 Xe_000961_T2 Xe_000961	Branchiostoma_lanceolatum_tr_A0A8J9ZTM1_A0A8J9ZTM1_BRALA tr|A0A8J9ZTM1|A0A8J9ZTM1_BRALA BMP2 protein OS=Branchiostoma lanceolatum OX=7740 GN=BMP2 PE=3 SV=1, Branchiostoma_lanceolatum_tr_A0A8J9ZTJ3_A0A8J9ZTJ3_BRALA tr|A0A8J9ZTJ3|A0A8J9ZTJ3_BRALA BMP4 protein OS=Branchiostoma lanceolatum OX=7740 GN=BMP4 PE=3 SV=1
OG0000019	Xenia_spec_Xe_002679_T1 Xe_002679_T1 Xe_002679	Branchiostoma_lanceolatum_tr_A0A8K0EZZ8_A0A8K0EZZ8_BRALA tr|A0A8K0EZZ8|A0A8K0EZZ8_BRALA GDF5 protein OS=Branchiostoma lanceolatum OX=7740 GN=GDF5 PE=3 SV=1, Branchiostoma_lanceolatum_tr_A0A8K0EBU4_A0A8K0EBU4_BRALA tr|A0A8K0EBU4|A0A8K0EBU4_BRALA BMP3 protein OS=Branchiostoma lanceolatum OX=7740 GN=BMP3 PE=3 SV=1
OG0000020	Xenia_spec_Xe_008243_T1 Xe_008243_T1 Xe_008243	Branchiostoma_lanceolatum_tr_A0A8K0A9T4_A0A8K0A9T4_BRALA tr|A0A8K0A9T4|A0A8K0A9T4_BRALA COL11A2 protein OS=Branchiostoma lanceolatum OX=7740 GN=COL11A2 PE=4 SV=1, Branchiostoma_lanceolatum_tr_A0A8K0AAG3_A0A8K0AAG3_BRALA tr|A0A8K0AAG3|A0A8K0AAG3_BRALA COL11A2 protein OS=Branchiostoma lanceolatum OX=7740 GN=COL11A2 PE=4 SV=1, Branchiostoma_lanceolatum_tr_A0A8K0ADJ7_A0A8K0ADJ7_BRALA tr|A0A8K0ADJ7|A0A8K0ADJ7_BRALA COL11A2 protein OS=Branchiostoma lanceolatum OX=7740 GN=COL11A2 PE=4 SV=1, Branchiostoma_lanceolatum_tr_A0A8K0A9U2_A0A8K0A9U2_BRALA tr|A0A8K0A9U2|A0A8K0A9U2_BRALA COL11A2 protein OS=Branchiostoma lanceolatum OX=7740 GN=COL11A2 PE=4 SV=1, Branchiostoma_lanceolatum_tr_A0A8K0F255_A0A8K0F255_BRALA tr|A0A8K0F255|A0A8K0F255_BRALA COL11A2 protein OS=Branchiostoma lanceolatum OX=7740 GN=COL11A2 PE=4 SV=1, Branchiostoma_lanceolatum_tr_A0A8K0AAU6_A0A8K0AAU6_BRALA tr|A0A8K0AAU6|A0A8K0AAU6_BRALA COL11A2 protein OS=Branchiostoma lanceolatum OX=7740 GN=COL11A2 PE=4 SV=1, Branchiostoma_lanceolatum_tr_A0A8K0AC48_A0A8K0AC48_BRALA tr|A0A8K0AC48|A0A8K0AC48_BRALA COL11A2 protein OS=Branchiostoma lanceolatum OX=7740 GN=COL11A2 PE=4 SV=1, Branchiostoma_lanceolatum_tr_A0A8K0ACN8_A0A8K0ACN8_BRALA tr|A0A8K0ACN8|A0A8K0ACN8_BRALA COL11A2 protein OS=Branchiostoma lanceolatum OX=7740 GN=COL11A2 PE=4 SV=1, Branchiostoma_lanceolatum_tr_A0A8K0AB08_A0A8K0AB08_BRALA tr|A0A8K0AB08|A0A8K0AB08_BRALA COL11A2 protein OS=Branchiostoma lanceolatum OX=7740 GN=COL11A2 PE=4 SV=1, Branchiostoma_lanceolatum_tr_A0A8K0EZ91_A0A8K0EZ91_BRALA tr|A0A8K0EZ91|A0A8K0EZ91_BRALA COL11A2 protein OS=Branchiostoma lanceolatum OX=7740 GN=COL11A2 PE=4 SV=1, Branchiostoma_lanceolatum_tr_A0A8K0EWZ4_A0A8K0EWZ4_BRALA tr|A0A8K0EWZ4|A0A8K0EWZ4_BRALA COL11A2 protein OS=Branchiostoma lanceolatum OX=7740 GN=COL11A2 PE=4 SV=1, Branchiostoma_lanceolatum_tr_A0A8K0EZQ0_A0A8K0EZQ0_BRALA tr|A0A8K0EZQ0|A0A8K0EZQ0_BRALA COL11A2 protein OS=Branchiostoma lanceolatum OX=7740 GN=COL11A2 PE=4 SV=1, Branchiostoma_lanceolatum_tr_A0A8K0F2N2_A0A8K0F2N2_BRALA tr|A0A8K0F2N2|A0A8K0F2N2_BRALA COL11A2 protein OS=Branchiostoma lanceolatum OX=7740 GN=COL11A2 PE=4 SV=1, Branchiostoma_lanceolatum_tr_A0A8K0AFY6_A0A8K0AFY6_BRALA tr|A0A8K0AFY6|A0A8K0AFY6_BRALA COL11A2 protein OS=Branchiostoma lanceolatum OX=7740 GN=COL11A2 PE=4 SV=1, Branchiostoma_lanceolatum_tr_A0A8K0ABU0_A0A8K0ABU0_BRALA tr|A0A8K0ABU0|A0A8K0ABU0_BRALA COL11A2 protein OS=Branchiostoma lanceolatum OX=7740 GN=COL11A2 PE=4 SV=1, Branchiostoma_lanceolatum_tr_A0A8K0AAH5_A0A8K0AAH5_BRALA tr|A0A8K0AAH5|A0A8K0AAH5_BRALA COL24A1 protein OS=Branchiostoma lanceolatum OX=7740 GN=COL24A1 PE=4 SV=1
OG0000020	Xenia_spec_Xe_007965_T1 Xe_007965_T1 Xe_007965, Xenia_spec_Xe_009290_T1 Xe_009290_T1 Xe_009290, Xenia_spec_Xe_009738_T1 Xe_009738_T1 Xe_009738, Xenia_spec_Xe_010176_T1 Xe_010176_T1 Xe_010176, Xenia_spec_Xe_009677_T1 Xe_009677_T1 Xe_009677, Xenia_spec_Xe_001362_T1 Xe_001362_T1 Xe_001362, Xenia_spec_Xe_009975_T1 Xe_009975_T1 Xe_009975, Xenia_spec_Xe_009974_T1 Xe_009974_T1 Xe_009974	Branchiostoma_lanceolatum_tr_A0A8J9YT59_A0A8J9YT59_BRALA tr|A0A8J9YT59|A0A8J9YT59_BRALA COL1A2 protein OS=Branchiostoma lanceolatum OX=7740 GN=COL1A2 PE=4 SV=1, Branchiostoma_lanceolatum_tr_A0A8J9YT63_A0A8J9YT63_BRALA tr|A0A8J9YT63|A0A8J9YT63_BRALA COL1A2 protein OS=Branchiostoma lanceolatum OX=7740 GN=COL1A2 PE=4 SV=1, Branchiostoma_lanceolatum_tr_A0A8J9YT64_A0A8J9YT64_BRALA tr|A0A8J9YT64|A0A8J9YT64_BRALA COL1A2 protein OS=Branchiostoma lanceolatum OX=7740 GN=COL1A2 PE=4 SV=1, Branchiostoma_lanceolatum_tr_A0A8J9YT67_A0A8J9YT67_BRALA tr|A0A8J9YT67|A0A8J9YT67_BRALA COL1A2 protein OS=Branchiostoma lanceolatum OX=7740 GN=COL1A2 PE=4 SV=1, Branchiostoma_lanceolatum_tr_A0A8J9YT77_A0A8J9YT77_BRALA tr|A0A8J9YT77|A0A8J9YT77_BRALA COL1A2 protein OS=Branchiostoma lanceolatum OX=7740 GN=COL1A2 PE=4 SV=1, Branchiostoma_lanceolatum_tr_A0A8J9YT73_A0A8J9YT73_BRALA tr|A0A8J9YT73|A0A8J9YT73_BRALA COL1A2 protein OS=Branchiostoma lanceolatum OX=7740 GN=COL1A2 PE=4 SV=1, Branchiostoma_lanceolatum_tr_A0A8J9YT79_A0A8J9YT79_BRALA tr|A0A8J9YT79|A0A8J9YT79_BRALA COL1A2 protein OS=Branchiostoma lanceolatum OX=7740 GN=COL1A2 PE=4 SV=1, Branchiostoma_lanceolatum_tr_A0A8J9YT91_A0A8J9YT91_BRALA tr|A0A8J9YT91|A0A8J9YT91_BRALA COL1A2 protein OS=Branchiostoma lanceolatum OX=7740 GN=COL1A2 PE=4 SV=1, Branchiostoma_lanceolatum_tr_A0A8K0E3B6_A0A8K0E3B6_BRALA tr|A0A8K0E3B6|A0A8K0E3B6_BRALA COL1A2 protein OS=Branchiostoma lanceolatum OX=7740 GN=COL1A2 PE=4 SV=1, Branchiostoma_lanceolatum_tr_A0A8K0E3M5_A0A8K0E3M5_BRALA tr|A0A8K0E3M5|A0A8K0E3M5_BRALA COL1A2 protein OS=Branchiostoma lanceolatum OX=7740 GN=COL1A2 PE=4 SV=1, Branchiostoma_lanceolatum_tr_A0A8K0E8K7_A0A8K0E8K7_BRALA tr|A0A8K0E8K7|A0A8K0E8K7_BRALA COL1A2 protein OS=Branchiostoma lanceolatum OX=7740 GN=COL1A2 PE=4 SV=1, Branchiostoma_lanceolatum_tr_A0A8K0E9F2_A0A8K0E9F2_BRALA tr|A0A8K0E9F2|A0A8K0E9F2_BRALA COL1A2 protein OS=Branchiostoma lanceolatum OX=7740 GN=COL1A2 PE=4 SV=1, Branchiostoma_lanceolatum_tr_A0A8K0E3A7_A0A8K0E3A7_BRALA tr|A0A8K0E3A7|A0A8K0E3A7_BRALA COL1A2 protein OS=Branchiostoma lanceolatum OX=7740 GN=COL1A2 PE=4 SV=1, Branchiostoma_lanceolatum_tr_A0A8J9YT83_A0A8J9YT83_BRALA tr|A0A8J9YT83|A0A8J9YT83_BRALA COL1A2 protein OS=Branchiostoma lanceolatum OX=7740 GN=COL1A2 PE=4 SV=1, Branchiostoma_lanceolatum_tr_A0A8J9YT57_A0A8J9YT57_BRALA tr|A0A8J9YT57|A0A8J9YT57_BRALA COL1A2 protein OS=Branchiostoma lanceolatum OX=7740 GN=COL1A2 PE=4 SV=1, Branchiostoma_lanceolatum_tr_A0A8J9YT55_A0A8J9YT55_BRALA tr|A0A8J9YT55|A0A8J9YT55_BRALA COL1A2 protein OS=Branchiostoma lanceolatum OX=7740 GN=COL1A2 PE=4 SV=1, Branchiostoma_lanceolatum_tr_A0A8K0E9E2_A0A8K0E9E2_BRALA tr|A0A8K0E9E2|A0A8K0E9E2_BRALA COL1A2 protein OS=Branchiostoma lanceolatum OX=7740 GN=COL1A2 PE=4 SV=1, Branchiostoma_lanceolatum_tr_A0A8K0E5D4_A0A8K0E5D4_BRALA tr|A0A8K0E5D4|A0A8K0E5D4_BRALA COL1A2 protein OS=Branchiostoma lanceolatum OX=7740 GN=COL1A2 PE=4 SV=1, Branchiostoma_lanceolatum_tr_A0A8J9YT86_A0A8J9YT86_BRALA tr|A0A8J9YT86|A0A8J9YT86_BRALA COL1A2 protein OS=Branchiostoma lanceolatum OX=7740 GN=COL1A2 PE=4 SV=1, Branchiostoma_lanceolatum_tr_A0A8J9YT78_A0A8J9YT78_BRALA tr|A0A8J9YT78|A0A8J9YT78_BRALA COL1A2 protein OS=Branchiostoma lanceolatum OX=7740 GN=COL1A2 PE=4 SV=1, Branchiostoma_lanceolatum_tr_A0A8J9YT72_A0A8J9YT72_BRALA tr|A0A8J9YT72|A0A8J9YT72_BRALA COL1A2 protein OS=Branchiostoma lanceolatum OX=7740 GN=COL1A2 PE=4 SV=1, Branchiostoma_lanceolatum_tr_A0A8J9YT75_A0A8J9YT75_BRALA tr|A0A8J9YT75|A0A8J9YT75_BRALA COL1A2 protein OS=Branchiostoma lanceolatum OX=7740 GN=COL1A2 PE=4 SV=1, Branchiostoma_lanceolatum_tr_A0A8J9YT74_A0A8J9YT74_BRALA tr|A0A8J9YT74|A0A8J9YT74_BRALA COL1A2 protein OS=Branchiostoma lanceolatum OX=7740 GN=COL1A2 PE=4 SV=1, Branchiostoma_lanceolatum_tr_A0A8J9YT70_A0A8J9YT70_BRALA tr|A0A8J9YT70|A0A8J9YT70_BRALA COL1A2 protein OS=Branchiostoma lanceolatum OX=7740 GN=COL1A2 PE=4 SV=1, Branchiostoma_lanceolatum_tr_A0A8J9YT69_A0A8J9YT69_BRALA tr|A0A8J9YT69|A0A8J9YT69_BRALA COL1A2 protein OS=Branchiostoma lanceolatum OX=7740 GN=COL1A2 PE=4 SV=1, Branchiostoma_lanceolatum_tr_A0A8J9YT68_A0A8J9YT68_BRALA tr|A0A8J9YT68|A0A8J9YT68_BRALA COL1A2 protein OS=Branchiostoma lanceolatum OX=7740 GN=COL1A2 PE=4 SV=1, Branchiostoma_lanceolatum_tr_A0A8J9YT65_A0A8J9YT65_BRALA tr|A0A8J9YT65|A0A8J9YT65_BRALA COL1A2 protein OS=Branchiostoma lanceolatum OX=7740 GN=COL1A2 PE=4 SV=1
OG0000021	Xenia_spec_Xe_012353_T1 Xe_012353_T1 Xe_012353	Branchiostoma_lanceolatum_tr_A0A8S4MLH2_A0A8S4MLH2_BRALA tr|A0A8S4MLH2|A0A8S4MLH2_BRALA NID1 protein OS=Branchiostoma lanceolatum OX=7740 GN=NID1 PE=4 SV=1, Branchiostoma_lanceolatum_tr_A0A8S4MM32_A0A8S4MM32_BRALA tr|A0A8S4MM32|A0A8S4MM32_BRALA NID1 protein OS=Branchiostoma lanceolatum OX=7740 GN=NID1 PE=4 SV=1, Branchiostoma_lanceolatum_tr_A0A8S4MMY0_A0A8S4MMY0_BRALA tr|A0A8S4MMY0|A0A8S4MMY0_BRALA NID1 protein OS=Branchiostoma lanceolatum OX=7740 GN=NID1 PE=4 SV=1, Branchiostoma_lanceolatum_tr_A0A8S4MMH3_A0A8S4MMH3_BRALA tr|A0A8S4MMH3|A0A8S4MMH3_BRALA NID1 protein OS=Branchiostoma lanceolatum OX=7740 GN=NID1 PE=4 SV=1, Branchiostoma_lanceolatum_tr_A0A8S4MML2_A0A8S4MML2_BRALA tr|A0A8S4MML2|A0A8S4MML2_BRALA NID1 protein OS=Branchiostoma lanceolatum OX=7740 GN=NID1 PE=4 SV=1, Branchiostoma_lanceolatum_tr_A0A8S4MLP1_A0A8S4MLP1_BRALA tr|A0A8S4MLP1|A0A8S4MLP1_BRALA NID1 protein OS=Branchiostoma lanceolatum OX=7740 GN=NID1 PE=4 SV=1, Branchiostoma_lanceolatum_tr_A0A8S4MLX3_A0A8S4MLX3_BRALA tr|A0A8S4MLX3|A0A8S4MLX3_BRALA NID1 protein OS=Branchiostoma lanceolatum OX=7740 GN=NID1 PE=4 SV=1, Branchiostoma_lanceolatum_tr_A0A8S4MLI6_A0A8S4MLI6_BRALA tr|A0A8S4MLI6|A0A8S4MLI6_BRALA NID1 protein OS=Branchiostoma lanceolatum OX=7740 GN=NID1 PE=4 SV=1, Branchiostoma_lanceolatum_tr_A0A8S4MLV2_A0A8S4MLV2_BRALA tr|A0A8S4MLV2|A0A8S4MLV2_BRALA NID1 protein OS=Branchiostoma lanceolatum OX=7740 GN=NID1 PE=4 SV=1, Branchiostoma_lanceolatum_tr_A0A8S4MLF4_A0A8S4MLF4_BRALA tr|A0A8S4MLF4|A0A8S4MLF4_BRALA NID1 protein OS=Branchiostoma lanceolatum OX=7740 GN=NID1 PE=4 SV=1, Branchiostoma_lanceolatum_tr_A0A8S4MNV0_A0A8S4MNV0_BRALA tr|A0A8S4MNV0|A0A8S4MNV0_BRALA NID1 protein OS=Branchiostoma lanceolatum OX=7740 GN=NID1 PE=4 SV=1
OG0000021	Xenia_spec_Xe_008104_T1 Xe_008104_T1 Xe_008104	Branchiostoma_lanceolatum_tr_A0A8K0E6W3_A0A8K0E6W3_BRALA tr|A0A8K0E6W3|A0A8K0E6W3_BRALA LRP1 protein OS=Branchiostoma lanceolatum OX=7740 GN=LRP1 PE=4 SV=1, Branchiostoma_lanceolatum_tr_A0A8J9YX93_A0A8J9YX93_BRALA tr|A0A8J9YX93|A0A8J9YX93_BRALA VLDLR protein OS=Branchiostoma lanceolatum OX=7740 GN=VLDLR PE=4 SV=1
OG0000021	Xenia_spec_Xe_007982_T1 Xe_007982_T1 Xe_007982	Branchiostoma_lanceolatum_tr_A0A8J9YZA2_A0A8J9YZA2_BRALA tr|A0A8J9YZA2|A0A8J9YZA2_BRALA FBN2 protein OS=Branchiostoma lanceolatum OX=7740 GN=FBN2 PE=4 SV=1
OG0000022	Xenia_spec_Xe_008122_T1 Xe_008122_T1 Xe_008122	Branchiostoma_lanceolatum_tr_A0A8J9Z4F2_A0A8J9Z4F2_BRALA tr|A0A8J9Z4F2|A0A8J9Z4F2_BRALA Annexin OS=Branchiostoma lanceolatum OX=7740 GN=ANXA7 PE=3 SV=1, Branchiostoma_lanceolatum_tr_A0A8J9Z3Q9_A0A8J9Z3Q9_BRALA tr|A0A8J9Z3Q9|A0A8J9Z3Q9_BRALA Annexin OS=Branchiostoma lanceolatum OX=7740 GN=ANXA7 PE=3 SV=1, Branchiostoma_lanceolatum_tr_A0A8J9Z3X0_A0A8J9Z3X0_BRALA tr|A0A8J9Z3X0|A0A8J9Z3X0_BRALA Annexin OS=Branchiostoma lanceolatum OX=7740 GN=ANXA7 PE=3 SV=1, Branchiostoma_lanceolatum_tr_A0A8J9Z3U1_A0A8J9Z3U1_BRALA tr|A0A8J9Z3U1|A0A8J9Z3U1_BRALA Annexin OS=Branchiostoma lanceolatum OX=7740 GN=ANXA7 PE=3 SV=1, Branchiostoma_lanceolatum_tr_A0A8J9Z3T0_A0A8J9Z3T0_BRALA tr|A0A8J9Z3T0|A0A8J9Z3T0_BRALA Annexin OS=Branchiostoma lanceolatum OX=7740 GN=ANXA7 PE=3 SV=1
OG0000023	Xenia_spec_Xe_013551_T1 Xe_013551_T1 Xe_013551, Xenia_spec_Xe_013537_T1 Xe_013537_T1 Xe_013537	Branchiostoma_lanceolatum_tr_A0A8J9ZM90_A0A8J9ZM90_BRALA tr|A0A8J9ZM90|A0A8J9ZM90_BRALA ADAM12 protein OS=Branchiostoma lanceolatum OX=7740 GN=ADAM12 PE=4 SV=1, Branchiostoma_lanceolatum_tr_A0A8J9ZMF5_A0A8J9ZMF5_BRALA tr|A0A8J9ZMF5|A0A8J9ZMF5_BRALA ADAM12 protein OS=Branchiostoma lanceolatum OX=7740 GN=ADAM12 PE=4 SV=1, Branchiostoma_lanceolatum_tr_A0A8J9VFV9_A0A8J9VFV9_BRALA tr|A0A8J9VFV9|A0A8J9VFV9_BRALA ADAM23 protein OS=Branchiostoma lanceolatum OX=7740 GN=ADAM23 PE=4 SV=1, Branchiostoma_lanceolatum_tr_A0A8J9VEB7_A0A8J9VEB7_BRALA tr|A0A8J9VEB7|A0A8J9VEB7_BRALA ADAM23 protein OS=Branchiostoma lanceolatum OX=7740 GN=ADAM23 PE=4 SV=1, Branchiostoma_lanceolatum_tr_A0A8J9YLN7_A0A8J9YLN7_BRALA tr|A0A8J9YLN7|A0A8J9YLN7_BRALA ADAM23 protein OS=Branchiostoma lanceolatum OX=7740 GN=ADAM23 PE=4 SV=1, Branchiostoma_lanceolatum_tr_A0A8J9W3N8_A0A8J9W3N8_BRALA tr|A0A8J9W3N8|A0A8J9W3N8_BRALA ADAM23 protein OS=Branchiostoma lanceolatum OX=7740 GN=ADAM23 PE=4 SV=1, Branchiostoma_lanceolatum_tr_A0A8J9W6V1_A0A8J9W6V1_BRALA tr|A0A8J9W6V1|A0A8J9W6V1_BRALA ADAM23 protein OS=Branchiostoma lanceolatum OX=7740 GN=ADAM23 PE=4 SV=1
OG0000024	Xenia_spec_Xe_015864_T1 Xe_015864_T1 Xe_015864	Branchiostoma_lanceolatum_tr_A0A8K0F3Y3_A0A8K0F3Y3_BRALA tr|A0A8K0F3Y3|A0A8K0F3Y3_BRALA OLFM3 protein OS=Branchiostoma lanceolatum OX=7740 GN=OLFM3 PE=4 SV=1, Branchiostoma_lanceolatum_tr_A0A8K0F196_A0A8K0F196_BRALA tr|A0A8K0F196|A0A8K0F196_BRALA OLFM3 protein OS=Branchiostoma lanceolatum OX=7740 GN=OLFM3 PE=4 SV=1, Branchiostoma_lanceolatum_tr_A0A8K0F1T2_A0A8K0F1T2_BRALA tr|A0A8K0F1T2|A0A8K0F1T2_BRALA OLFM3 protein OS=Branchiostoma lanceolatum OX=7740 GN=OLFM3 PE=4 SV=1, Branchiostoma_lanceolatum_tr_A0A8K0AH10_A0A8K0AH10_BRALA tr|A0A8K0AH10|A0A8K0AH10_BRALA OLFM3 protein OS=Branchiostoma lanceolatum OX=7740 GN=OLFM3 PE=4 SV=1, Branchiostoma_lanceolatum_tr_A0A8K0AGI0_A0A8K0AGI0_BRALA tr|A0A8K0AGI0|A0A8K0AGI0_BRALA OLFM3 protein OS=Branchiostoma lanceolatum OX=7740 GN=OLFM3 PE=4 SV=1, Branchiostoma_lanceolatum_tr_A0A8K0AJA9_A0A8K0AJA9_BRALA tr|A0A8K0AJA9|A0A8K0AJA9_BRALA OLFM3 protein OS=Branchiostoma lanceolatum OX=7740 GN=OLFM3 PE=4 SV=1, Branchiostoma_lanceolatum_tr_A0A8K0F3L5_A0A8K0F3L5_BRALA tr|A0A8K0F3L5|A0A8K0F3L5_BRALA OLFM3 protein OS=Branchiostoma lanceolatum OX=7740 GN=OLFM3 PE=4 SV=1, Branchiostoma_lanceolatum_tr_A0A8K0EZ53_A0A8K0EZ53_BRALA tr|A0A8K0EZ53|A0A8K0EZ53_BRALA OLFM3 protein OS=Branchiostoma lanceolatum OX=7740 GN=OLFM3 PE=4 SV=1
OG0000024	Xenia_spec_Xe_019806_T1 Xe_019806_T1 Xe_019806	Branchiostoma_lanceolatum_tr_A0A8K0EAA9_A0A8K0EAA9_BRALA tr|A0A8K0EAA9|A0A8K0EAA9_BRALA NOTCH2 protein OS=Branchiostoma lanceolatum OX=7740 GN=NOTCH2 PE=4 SV=1, Branchiostoma_lanceolatum_tr_A0A8K0E459_A0A8K0E459_BRALA tr|A0A8K0E459|A0A8K0E459_BRALA NOTCH2 protein OS=Branchiostoma lanceolatum OX=7740 GN=NOTCH2 PE=4 SV=1
OG0000024	Xenia_spec_Xe_015637_T1 Xe_015637_T1 Xe_015637	Branchiostoma_lanceolatum_tr_A0A8K0EFL5_A0A8K0EFL5_BRALA tr|A0A8K0EFL5|A0A8K0EFL5_BRALA SPOCK3 protein OS=Branchiostoma lanceolatum OX=7740 GN=SPOCK3 PE=4 SV=1
