Orthogroup	Cnidaria_Anthozoa_Xenia_spec	Chordata_Amphioxiformes_Branchiostoma_lanceolatum
OG0000000	Xenia_spec_Xe_009126_T1 Xe_009126_T1 Xe_009126	Branchiostoma_lanceolatum_tr_A0A8J9YVS3_A0A8J9YVS3_BRALA tr|A0A8J9YVS3|A0A8J9YVS3_BRALA MEGF10 protein OS=Branchiostoma lanceolatum OX=7740 GN=MEGF10 PE=3 SV=1, Branchiostoma_lanceolatum_tr_A0A8J9YVW9_A0A8J9YVW9_BRALA tr|A0A8J9YVW9|A0A8J9YVW9_BRALA ANGPT2 protein OS=Branchiostoma lanceolatum OX=7740 GN=ANGPT2 PE=3 SV=1, Branchiostoma_lanceolatum_tr_A0A8K0A2Y8_A0A8K0A2Y8_BRALA tr|A0A8K0A2Y8|A0A8K0A2Y8_BRALA NOTCH3 protein OS=Branchiostoma lanceolatum OX=7740 GN=NOTCH3 PE=4 SV=1, Branchiostoma_lanceolatum_tr_A0A8K0A2N6_A0A8K0A2N6_BRALA tr|A0A8K0A2N6|A0A8K0A2N6_BRALA NOTCH3 protein OS=Branchiostoma lanceolatum OX=7740 GN=NOTCH3 PE=4 SV=1, Branchiostoma_lanceolatum_tr_A0A8K0A5F9_A0A8K0A5F9_BRALA tr|A0A8K0A5F9|A0A8K0A5F9_BRALA NOTCH3 protein OS=Branchiostoma lanceolatum OX=7740 GN=NOTCH3 PE=4 SV=1, Branchiostoma_lanceolatum_tr_A0A8K0EUG9_A0A8K0EUG9_BRALA tr|A0A8K0EUG9|A0A8K0EUG9_BRALA NOTCH3 protein OS=Branchiostoma lanceolatum OX=7740 GN=NOTCH3 PE=4 SV=1, Branchiostoma_lanceolatum_tr_A0A8K0ECH5_A0A8K0ECH5_BRALA tr|A0A8K0ECH5|A0A8K0ECH5_BRALA FIBCD1 protein OS=Branchiostoma lanceolatum OX=7740 GN=FIBCD1 PE=4 SV=1, Branchiostoma_lanceolatum_tr_A0A8J9ZK72_A0A8J9ZK72_BRALA tr|A0A8J9ZK72|A0A8J9ZK72_BRALA FIBCD1 protein OS=Branchiostoma lanceolatum OX=7740 GN=FIBCD1 PE=4 SV=1, Branchiostoma_lanceolatum_tr_A0A8J9ZY15_A0A8J9ZY15_BRALA tr|A0A8J9ZY15|A0A8J9ZY15_BRALA ANGPT2 protein OS=Branchiostoma lanceolatum OX=7740 GN=ANGPT2 PE=4 SV=1, Branchiostoma_lanceolatum_tr_A0A8K0A955_A0A8K0A955_BRALA tr|A0A8K0A955|A0A8K0A955_BRALA PKD1L3 protein OS=Branchiostoma lanceolatum OX=7740 GN=PKD1L3 PE=3 SV=1
OG0000000	Xenia_spec_Xe_009140_T1 Xe_009140_T1 Xe_009140	Branchiostoma_lanceolatum_tr_A0A8J9ZFK3_A0A8J9ZFK3_BRALA tr|A0A8J9ZFK3|A0A8J9ZFK3_BRALA TNR protein OS=Branchiostoma lanceolatum OX=7740 GN=TNR PE=4 SV=1, Branchiostoma_lanceolatum_tr_A0A8J9ZEH8_A0A8J9ZEH8_BRALA tr|A0A8J9ZEH8|A0A8J9ZEH8_BRALA TNR protein OS=Branchiostoma lanceolatum OX=7740 GN=TNR PE=4 SV=1, Branchiostoma_lanceolatum_tr_A0A8K0A9G0_A0A8K0A9G0_BRALA tr|A0A8K0A9G0|A0A8K0A9G0_BRALA FCN1 protein OS=Branchiostoma lanceolatum OX=7740 GN=FCN1 PE=4 SV=1, Branchiostoma_lanceolatum_tr_A0A8K0F2M8_A0A8K0F2M8_BRALA tr|A0A8K0F2M8|A0A8K0F2M8_BRALA TNR protein OS=Branchiostoma lanceolatum OX=7740 GN=TNR PE=4 SV=1, Branchiostoma_lanceolatum_tr_A0A8J9ZZV3_A0A8J9ZZV3_BRALA tr|A0A8J9ZZV3|A0A8J9ZZV3_BRALA TNR protein OS=Branchiostoma lanceolatum OX=7740 GN=TNR PE=4 SV=1
OG0000001	Xenia_spec_Xe_003284_T1 Xe_003284_T1 Xe_003284	Branchiostoma_lanceolatum_tr_A0A8K0A481_A0A8K0A481_BRALA tr|A0A8K0A481|A0A8K0A481_BRALA LAMB1 protein OS=Branchiostoma lanceolatum OX=7740 GN=LAMB1 PE=4 SV=1, Branchiostoma_lanceolatum_tr_A0A8K0A1W6_A0A8K0A1W6_BRALA tr|A0A8K0A1W6|A0A8K0A1W6_BRALA LAMB1 protein OS=Branchiostoma lanceolatum OX=7740 GN=LAMB1 PE=4 SV=1, Branchiostoma_lanceolatum_tr_A0A8K0A1K9_A0A8K0A1K9_BRALA tr|A0A8K0A1K9|A0A8K0A1K9_BRALA LAMB1 protein OS=Branchiostoma lanceolatum OX=7740 GN=LAMB1 PE=4 SV=1, Branchiostoma_lanceolatum_tr_A0A8J9ZZ56_A0A8J9ZZ56_BRALA tr|A0A8J9ZZ56|A0A8J9ZZ56_BRALA LAMB1 protein OS=Branchiostoma lanceolatum OX=7740 GN=LAMB1 PE=4 SV=1, Branchiostoma_lanceolatum_tr_A0A8K0A0G1_A0A8K0A0G1_BRALA tr|A0A8K0A0G1|A0A8K0A0G1_BRALA LAMB1 protein OS=Branchiostoma lanceolatum OX=7740 GN=LAMB1 PE=4 SV=1, Branchiostoma_lanceolatum_tr_A0A8J9ZZ61_A0A8J9ZZ61_BRALA tr|A0A8J9ZZ61|A0A8J9ZZ61_BRALA LAMB1 protein OS=Branchiostoma lanceolatum OX=7740 GN=LAMB1 PE=4 SV=1
OG0000001	Xenia_spec_Xe_020701_T1 Xe_020701_T1 Xe_020701	Branchiostoma_lanceolatum_tr_A0A8J9ZDC2_A0A8J9ZDC2_BRALA tr|A0A8J9ZDC2|A0A8J9ZDC2_BRALA NEO1 protein OS=Branchiostoma lanceolatum OX=7740 GN=NEO1 PE=4 SV=1, Branchiostoma_lanceolatum_tr_A0A8J9ZDK6_A0A8J9ZDK6_BRALA tr|A0A8J9ZDK6|A0A8J9ZDK6_BRALA NEO1 protein OS=Branchiostoma lanceolatum OX=7740 GN=NEO1 PE=4 SV=1, Branchiostoma_lanceolatum_tr_A0A8K0EJV3_A0A8K0EJV3_BRALA tr|A0A8K0EJV3|A0A8K0EJV3_BRALA NEO1 protein OS=Branchiostoma lanceolatum OX=7740 GN=NEO1 PE=3 SV=1, Branchiostoma_lanceolatum_tr_A0A8K0EHQ4_A0A8K0EHQ4_BRALA tr|A0A8K0EHQ4|A0A8K0EHQ4_BRALA NEO1 protein OS=Branchiostoma lanceolatum OX=7740 GN=NEO1 PE=3 SV=1, Branchiostoma_lanceolatum_tr_A0A8J9ZE07_A0A8J9ZE07_BRALA tr|A0A8J9ZE07|A0A8J9ZE07_BRALA NEO1 protein OS=Branchiostoma lanceolatum OX=7740 GN=NEO1 PE=3 SV=1, Branchiostoma_lanceolatum_tr_A0A8K0EH85_A0A8K0EH85_BRALA tr|A0A8K0EH85|A0A8K0EH85_BRALA NEO1 protein OS=Branchiostoma lanceolatum OX=7740 GN=NEO1 PE=3 SV=1, Branchiostoma_lanceolatum_tr_A0A8K0EKB7_A0A8K0EKB7_BRALA tr|A0A8K0EKB7|A0A8K0EKB7_BRALA NEO1 protein OS=Branchiostoma lanceolatum OX=7740 GN=NEO1 PE=3 SV=1, Branchiostoma_lanceolatum_tr_A0A8K0EFS0_A0A8K0EFS0_BRALA tr|A0A8K0EFS0|A0A8K0EFS0_BRALA NEO1 protein OS=Branchiostoma lanceolatum OX=7740 GN=NEO1 PE=3 SV=1, Branchiostoma_lanceolatum_tr_A0A8J9ZD06_A0A8J9ZD06_BRALA tr|A0A8J9ZD06|A0A8J9ZD06_BRALA NEO1 protein OS=Branchiostoma lanceolatum OX=7740 GN=NEO1 PE=3 SV=1, Branchiostoma_lanceolatum_tr_A0A8J9ZBD6_A0A8J9ZBD6_BRALA tr|A0A8J9ZBD6|A0A8J9ZBD6_BRALA PRTG protein OS=Branchiostoma lanceolatum OX=7740 GN=PRTG PE=4 SV=1
OG0000001	Xenia_spec_Xe_014520_T1 Xe_014520_T1 Xe_014520	Branchiostoma_lanceolatum_tr_A0A8K0AAL2_A0A8K0AAL2_BRALA tr|A0A8K0AAL2|A0A8K0AAL2_BRALA PTPRQ protein OS=Branchiostoma lanceolatum OX=7740 GN=PTPRQ PE=3 SV=1, Branchiostoma_lanceolatum_tr_A0A8K0AGT1_A0A8K0AGT1_BRALA tr|A0A8K0AGT1|A0A8K0AGT1_BRALA FN1 protein OS=Branchiostoma lanceolatum OX=7740 GN=FN1 PE=4 SV=1, Branchiostoma_lanceolatum_tr_A0A8K0AJE6_A0A8K0AJE6_BRALA tr|A0A8K0AJE6|A0A8K0AJE6_BRALA FN1 protein OS=Branchiostoma lanceolatum OX=7740 GN=FN1 PE=4 SV=1, Branchiostoma_lanceolatum_tr_A0A8K0AHA8_A0A8K0AHA8_BRALA tr|A0A8K0AHA8|A0A8K0AHA8_BRALA FN1 protein OS=Branchiostoma lanceolatum OX=7740 GN=FN1 PE=4 SV=1, Branchiostoma_lanceolatum_tr_A0A8K0AFN9_A0A8K0AFN9_BRALA tr|A0A8K0AFN9|A0A8K0AFN9_BRALA FN1 protein OS=Branchiostoma lanceolatum OX=7740 GN=FN1 PE=4 SV=1, Branchiostoma_lanceolatum_tr_A0A8K0AFP9_A0A8K0AFP9_BRALA tr|A0A8K0AFP9|A0A8K0AFP9_BRALA FN1 protein OS=Branchiostoma lanceolatum OX=7740 GN=FN1 PE=4 SV=1, Branchiostoma_lanceolatum_tr_A0A8K0AJE9_A0A8K0AJE9_BRALA tr|A0A8K0AJE9|A0A8K0AJE9_BRALA FN1 protein OS=Branchiostoma lanceolatum OX=7740 GN=FN1 PE=4 SV=1, Branchiostoma_lanceolatum_tr_A0A8K0AFJ7_A0A8K0AFJ7_BRALA tr|A0A8K0AFJ7|A0A8K0AFJ7_BRALA FN1 protein OS=Branchiostoma lanceolatum OX=7740 GN=FN1 PE=4 SV=1, Branchiostoma_lanceolatum_tr_A0A8K0AGD9_A0A8K0AGD9_BRALA tr|A0A8K0AGD9|A0A8K0AGD9_BRALA FN1 protein OS=Branchiostoma lanceolatum OX=7740 GN=FN1 PE=4 SV=1, Branchiostoma_lanceolatum_tr_A0A8K0F1X9_A0A8K0F1X9_BRALA tr|A0A8K0F1X9|A0A8K0F1X9_BRALA FN1 protein OS=Branchiostoma lanceolatum OX=7740 GN=FN1 PE=4 SV=1, Branchiostoma_lanceolatum_tr_A0A8K0F3P9_A0A8K0F3P9_BRALA tr|A0A8K0F3P9|A0A8K0F3P9_BRALA FN1 protein OS=Branchiostoma lanceolatum OX=7740 GN=FN1 PE=4 SV=1, Branchiostoma_lanceolatum_tr_A0A8K0F401_A0A8K0F401_BRALA tr|A0A8K0F401|A0A8K0F401_BRALA FN1 protein OS=Branchiostoma lanceolatum OX=7740 GN=FN1 PE=4 SV=1, Branchiostoma_lanceolatum_tr_A0A8K0F404_A0A8K0F404_BRALA tr|A0A8K0F404|A0A8K0F404_BRALA FN1 protein OS=Branchiostoma lanceolatum OX=7740 GN=FN1 PE=4 SV=1, Branchiostoma_lanceolatum_tr_A0A8K0F1F1_A0A8K0F1F1_BRALA tr|A0A8K0F1F1|A0A8K0F1F1_BRALA FN1 protein OS=Branchiostoma lanceolatum OX=7740 GN=FN1 PE=4 SV=1, Branchiostoma_lanceolatum_tr_A0A8K0AGU0_A0A8K0AGU0_BRALA tr|A0A8K0AGU0|A0A8K0AGU0_BRALA FN1 protein OS=Branchiostoma lanceolatum OX=7740 GN=FN1 PE=4 SV=1, Branchiostoma_lanceolatum_tr_A0A8K0AEM6_A0A8K0AEM6_BRALA tr|A0A8K0AEM6|A0A8K0AEM6_BRALA FN1 protein OS=Branchiostoma lanceolatum OX=7740 GN=FN1 PE=4 SV=1, Branchiostoma_lanceolatum_tr_A0A8K0F3P6_A0A8K0F3P6_BRALA tr|A0A8K0F3P6|A0A8K0F3P6_BRALA FN1 protein OS=Branchiostoma lanceolatum OX=7740 GN=FN1 PE=4 SV=1, Branchiostoma_lanceolatum_tr_A0A8K0AHB7_A0A8K0AHB7_BRALA tr|A0A8K0AHB7|A0A8K0AHB7_BRALA FN1 protein OS=Branchiostoma lanceolatum OX=7740 GN=FN1 PE=4 SV=1, Branchiostoma_lanceolatum_tr_A0A8K0F1E5_A0A8K0F1E5_BRALA tr|A0A8K0F1E5|A0A8K0F1E5_BRALA FN1 protein OS=Branchiostoma lanceolatum OX=7740 GN=FN1 PE=4 SV=1, Branchiostoma_lanceolatum_tr_A0A8K0EZA8_A0A8K0EZA8_BRALA tr|A0A8K0EZA8|A0A8K0EZA8_BRALA FN1 protein OS=Branchiostoma lanceolatum OX=7740 GN=FN1 PE=4 SV=1, Branchiostoma_lanceolatum_tr_A0A8K0AFI5_A0A8K0AFI5_BRALA tr|A0A8K0AFI5|A0A8K0AFI5_BRALA FN1 protein OS=Branchiostoma lanceolatum OX=7740 GN=FN1 PE=4 SV=1, Branchiostoma_lanceolatum_tr_A0A8K0AD39_A0A8K0AD39_BRALA tr|A0A8K0AD39|A0A8K0AD39_BRALA KCP protein OS=Branchiostoma lanceolatum OX=7740 GN=KCP PE=4 SV=1, Branchiostoma_lanceolatum_tr_A0A8K0AEB4_A0A8K0AEB4_BRALA tr|A0A8K0AEB4|A0A8K0AEB4_BRALA KCP protein OS=Branchiostoma lanceolatum OX=7740 GN=KCP PE=4 SV=1
OG0000001	Xenia_spec_Xe_018235_T1 Xe_018235_T1 Xe_018235	Branchiostoma_lanceolatum_tr_A0A8K0ACS0_A0A8K0ACS0_BRALA tr|A0A8K0ACS0|A0A8K0ACS0_BRALA SDK1 protein OS=Branchiostoma lanceolatum OX=7740 GN=SDK1 PE=4 SV=1, Branchiostoma_lanceolatum_tr_A0A8K0AEB9_A0A8K0AEB9_BRALA tr|A0A8K0AEB9|A0A8K0AEB9_BRALA SDK1 protein OS=Branchiostoma lanceolatum OX=7740 GN=SDK1 PE=4 SV=1
OG0000001	Xenia_spec_Xe_000439_T1 Xe_000439_T1 Xe_000439	Branchiostoma_lanceolatum_tr_A0A8K0EHD0_A0A8K0EHD0_BRALA tr|A0A8K0EHD0|A0A8K0EHD0_BRALA PTPRB protein OS=Branchiostoma lanceolatum OX=7740 GN=PTPRB PE=4 SV=1
OG0000001	Xenia_spec_Xe_008027_T1 Xe_008027_T1 Xe_008027	Branchiostoma_lanceolatum_tr_A0A8K0AAI7_A0A8K0AAI7_BRALA tr|A0A8K0AAI7|A0A8K0AAI7_BRALA NTNG2 protein OS=Branchiostoma lanceolatum OX=7740 GN=NTNG2 PE=4 SV=1, Branchiostoma_lanceolatum_tr_A0A8K0ABQ5_A0A8K0ABQ5_BRALA tr|A0A8K0ABQ5|A0A8K0ABQ5_BRALA NTNG2 protein OS=Branchiostoma lanceolatum OX=7740 GN=NTNG2 PE=4 SV=1
OG0000001	Xenia_spec_Xe_016511_T1 Xe_016511_T1 Xe_016511	Branchiostoma_lanceolatum_tr_A0A8K0AEM3_A0A8K0AEM3_BRALA tr|A0A8K0AEM3|A0A8K0AEM3_BRALA Netrin-1 OS=Branchiostoma lanceolatum OX=7740 GN=NTN1 PE=4 SV=1, Branchiostoma_lanceolatum_tr_A0A8K0AER8_A0A8K0AER8_BRALA tr|A0A8K0AER8|A0A8K0AER8_BRALA NTN1 protein OS=Branchiostoma lanceolatum OX=7740 GN=NTN1 PE=4 SV=1, Branchiostoma_lanceolatum_tr_A0A8K0ADI9_A0A8K0ADI9_BRALA tr|A0A8K0ADI9|A0A8K0ADI9_BRALA NTN1 protein OS=Branchiostoma lanceolatum OX=7740 GN=NTN1 PE=4 SV=1
OG0000001	Xenia_spec_Xe_008821_T1 Xe_008821_T1 Xe_008821	Branchiostoma_lanceolatum_tr_A0A8K0AD48_A0A8K0AD48_BRALA tr|A0A8K0AD48|A0A8K0AD48_BRALA LAMC1 protein OS=Branchiostoma lanceolatum OX=7740 GN=LAMC1 PE=4 SV=1, Branchiostoma_lanceolatum_tr_A0A8K0ABF1_A0A8K0ABF1_BRALA tr|A0A8K0ABF1|A0A8K0ABF1_BRALA LAMC1 protein OS=Branchiostoma lanceolatum OX=7740 GN=LAMC1 PE=4 SV=1, Branchiostoma_lanceolatum_tr_A0A8K0A9E9_A0A8K0A9E9_BRALA tr|A0A8K0A9E9|A0A8K0A9E9_BRALA LAMC1 protein OS=Branchiostoma lanceolatum OX=7740 GN=LAMC1 PE=4 SV=1, Branchiostoma_lanceolatum_tr_A0A8K0AAF3_A0A8K0AAF3_BRALA tr|A0A8K0AAF3|A0A8K0AAF3_BRALA LAMC1 protein OS=Branchiostoma lanceolatum OX=7740 GN=LAMC1 PE=4 SV=1, Branchiostoma_lanceolatum_tr_A0A8K0A9E1_A0A8K0A9E1_BRALA tr|A0A8K0A9E1|A0A8K0A9E1_BRALA LAMC1 protein OS=Branchiostoma lanceolatum OX=7740 GN=LAMC1 PE=4 SV=1
OG0000001	Xenia_spec_Xe_002223_T1 Xe_002223_T1 Xe_002223	Branchiostoma_lanceolatum_tr_A0A8K0EGU1_A0A8K0EGU1_BRALA tr|A0A8K0EGU1|A0A8K0EGU1_BRALA LAMA5 protein OS=Branchiostoma lanceolatum OX=7740 GN=LAMA5 PE=4 SV=1
OG0000002	Xenia_spec_Xe_002086_T1 Xe_002086_T1 Xe_002086	Branchiostoma_lanceolatum_tr_A0A8J9W3E3_A0A8J9W3E3_BRALA tr|A0A8J9W3E3|A0A8J9W3E3_BRALA COMP protein OS=Branchiostoma lanceolatum OX=7740 GN=COMP PE=4 SV=1
OG0000002	Xenia_spec_Xe_003115_T1 Xe_003115_T1 Xe_003115, Xenia_spec_Xe_003081_T1 Xe_003081_T1 Xe_003081	Branchiostoma_lanceolatum_tr_A0A8K0EJ68_A0A8K0EJ68_BRALA tr|A0A8K0EJ68|A0A8K0EJ68_BRALA THBS3 protein OS=Branchiostoma lanceolatum OX=7740 GN=THBS3 PE=3 SV=1
OG0000002	Xenia_spec_Xe_009903_T1 Xe_009903_T1 Xe_009903	Branchiostoma_lanceolatum_tr_A0A8K0E9X6_A0A8K0E9X6_BRALA tr|A0A8K0E9X6|A0A8K0E9X6_BRALA SEMA5A protein OS=Branchiostoma lanceolatum OX=7740 GN=SEMA5A PE=4 SV=1
OG0000002	Xenia_spec_Xe_012746_T1 Xe_012746_T1 Xe_012746	Branchiostoma_lanceolatum_tr_A0A8J9ZJV5_A0A8J9ZJV5_BRALA tr|A0A8J9ZJV5|A0A8J9ZJV5_BRALA HMCN1 protein OS=Branchiostoma lanceolatum OX=7740 GN=HMCN1 PE=4 SV=1
OG0000002	Xenia_spec_Xe_007911_T1 Xe_007911_T1 Xe_007911	Branchiostoma_lanceolatum_tr_A0A8J9VKV4_A0A8J9VKV4_BRALA tr|A0A8J9VKV4|A0A8J9VKV4_BRALA HMCN1 protein OS=Branchiostoma lanceolatum OX=7740 GN=HMCN1 PE=4 SV=1
OG0000002	Xenia_spec_Xe_014527_T1 Xe_014527_T1 Xe_014527, Xenia_spec_Xe_014521_T1 Xe_014521_T1 Xe_014521	Branchiostoma_lanceolatum_tr_A0A8J9YS55_A0A8J9YS55_BRALA tr|A0A8J9YS55|A0A8J9YS55_BRALA HMCN1 protein OS=Branchiostoma lanceolatum OX=7740 GN=HMCN1 PE=4 SV=1, Branchiostoma_lanceolatum_tr_A0A8J9YPL8_A0A8J9YPL8_BRALA tr|A0A8J9YPL8|A0A8J9YPL8_BRALA HMCN1 protein OS=Branchiostoma lanceolatum OX=7740 GN=HMCN1 PE=4 SV=1
OG0000003	Xenia_spec_Xe_008816_T1 Xe_008816_T1 Xe_008816, Xenia_spec_Xe_008846_T1 Xe_008846_T1 Xe_008846, Xenia_spec_Xe_008853_T1 Xe_008853_T1 Xe_008853, Xenia_spec_Xe_008849_T1 Xe_008849_T1 Xe_008849, Xenia_spec_Xe_008844_T1 Xe_008844_T1 Xe_008844, Xenia_spec_Xe_018389_T1 Xe_018389_T1 Xe_018389, Xenia_spec_Xe_018387_T1 Xe_018387_T1 Xe_018387, Xenia_spec_Xe_000730_T1 Xe_000730_T1 Xe_000730, Xenia_spec_Xe_001746_T1 Xe_001746_T1 Xe_001746, Xenia_spec_Xe_003671_T1 Xe_003671_T1 Xe_003671, Xenia_spec_Xe_003677_T1 Xe_003677_T1 Xe_003677, Xenia_spec_Xe_001745_T1 Xe_001745_T1 Xe_001745, Xenia_spec_Xe_003679_T1 Xe_003679_T1 Xe_003679, Xenia_spec_Xe_003678_T1 Xe_003678_T1 Xe_003678, Xenia_spec_Xe_001646_T1 Xe_001646_T1 Xe_001646, Xenia_spec_Xe_001667_T1 Xe_001667_T1 Xe_001667, Xenia_spec_Xe_001636_T1 Xe_001636_T1 Xe_001636, Xenia_spec_Xe_001677_T1 Xe_001677_T1 Xe_001677	Branchiostoma_lanceolatum_tr_A0A8J9YRR5_A0A8J9YRR5_BRALA tr|A0A8J9YRR5|A0A8J9YRR5_BRALA CLEC4M protein OS=Branchiostoma lanceolatum OX=7740 GN=CLEC4M PE=4 SV=1, Branchiostoma_lanceolatum_tr_A0A8J9YSG8_A0A8J9YSG8_BRALA tr|A0A8J9YSG8|A0A8J9YSG8_BRALA COLEC12 protein OS=Branchiostoma lanceolatum OX=7740 GN=COLEC12 PE=4 SV=1, Branchiostoma_lanceolatum_tr_A0A8J9YS14_A0A8J9YS14_BRALA tr|A0A8J9YS14|A0A8J9YS14_BRALA COLEC10 protein OS=Branchiostoma lanceolatum OX=7740 GN=COLEC10 PE=4 SV=1, Branchiostoma_lanceolatum_tr_A0A8J9VQ42_A0A8J9VQ42_BRALA tr|A0A8J9VQ42|A0A8J9VQ42_BRALA COLEC10 protein OS=Branchiostoma lanceolatum OX=7740 GN=COLEC10 PE=4 SV=1, Branchiostoma_lanceolatum_tr_A0A8J9W4U8_A0A8J9W4U8_BRALA tr|A0A8J9W4U8|A0A8J9W4U8_BRALA COLEC11 protein OS=Branchiostoma lanceolatum OX=7740 GN=COLEC11 PE=4 SV=1, Branchiostoma_lanceolatum_tr_A0A8J9VFW5_A0A8J9VFW5_BRALA tr|A0A8J9VFW5|A0A8J9VFW5_BRALA COLEC11 protein OS=Branchiostoma lanceolatum OX=7740 GN=COLEC11 PE=4 SV=1, Branchiostoma_lanceolatum_tr_A0A8J9VKH1_A0A8J9VKH1_BRALA tr|A0A8J9VKH1|A0A8J9VKH1_BRALA CLEC4M protein OS=Branchiostoma lanceolatum OX=7740 GN=CLEC4M PE=4 SV=1, Branchiostoma_lanceolatum_tr_A0A8J9VHM6_A0A8J9VHM6_BRALA tr|A0A8J9VHM6|A0A8J9VHM6_BRALA CLEC4E protein OS=Branchiostoma lanceolatum OX=7740 GN=CLEC4E PE=4 SV=1, Branchiostoma_lanceolatum_tr_A0A8J9YS89_A0A8J9YS89_BRALA tr|A0A8J9YS89|A0A8J9YS89_BRALA CD209 protein OS=Branchiostoma lanceolatum OX=7740 GN=CD209 PE=4 SV=1, Branchiostoma_lanceolatum_tr_A0A8J9VYW8_A0A8J9VYW8_BRALA tr|A0A8J9VYW8|A0A8J9VYW8_BRALA COLEC10 protein OS=Branchiostoma lanceolatum OX=7740 GN=COLEC10 PE=4 SV=1, Branchiostoma_lanceolatum_tr_A0A8J9YNZ2_A0A8J9YNZ2_BRALA tr|A0A8J9YNZ2|A0A8J9YNZ2_BRALA FAM213B protein OS=Branchiostoma lanceolatum OX=7740 GN=FAM213B PE=4 SV=1, Branchiostoma_lanceolatum_tr_A0A8J9ZSB2_A0A8J9ZSB2_BRALA tr|A0A8J9ZSB2|A0A8J9ZSB2_BRALA Hypp2268 protein OS=Branchiostoma lanceolatum OX=7740 GN=Hypp2268 PE=4 SV=1, Branchiostoma_lanceolatum_tr_A0A8K0AF07_A0A8K0AF07_BRALA tr|A0A8K0AF07|A0A8K0AF07_BRALA BCAN protein OS=Branchiostoma lanceolatum OX=7740 GN=BCAN PE=4 SV=1
OG0000003	Xenia_spec_Xe_009803_T1 Xe_009803_T1 Xe_009803, Xenia_spec_Xe_009805_T1 Xe_009805_T1 Xe_009805, Xenia_spec_Xe_009799_T1 Xe_009799_T1 Xe_009799	Branchiostoma_lanceolatum_tr_A0A8J9Z1N5_A0A8J9Z1N5_BRALA tr|A0A8J9Z1N5|A0A8J9Z1N5_BRALA MRC1 protein OS=Branchiostoma lanceolatum OX=7740 GN=MRC1 PE=4 SV=1, Branchiostoma_lanceolatum_tr_A0A8S4MP38_A0A8S4MP38_BRALA tr|A0A8S4MP38|A0A8S4MP38_BRALA MRC1 protein OS=Branchiostoma lanceolatum OX=7740 GN=MRC1 PE=4 SV=1, Branchiostoma_lanceolatum_tr_A0A8K0ECH3_A0A8K0ECH3_BRALA tr|A0A8K0ECH3|A0A8K0ECH3_BRALA MRC1 protein OS=Branchiostoma lanceolatum OX=7740 GN=MRC1 PE=4 SV=1, Branchiostoma_lanceolatum_tr_A0A8K0EEG4_A0A8K0EEG4_BRALA tr|A0A8K0EEG4|A0A8K0EEG4_BRALA MRC1 protein _Fragment_ OS=Branchiostoma lanceolatum OX=7740 GN=MRC1 PE=4 SV=1, Branchiostoma_lanceolatum_tr_A0A8J9Z287_A0A8J9Z287_BRALA tr|A0A8J9Z287|A0A8J9Z287_BRALA MRC1 protein OS=Branchiostoma lanceolatum OX=7740 GN=MRC1 PE=4 SV=1, Branchiostoma_lanceolatum_tr_A0A8J9Z2L8_A0A8J9Z2L8_BRALA tr|A0A8J9Z2L8|A0A8J9Z2L8_BRALA MRC1 protein OS=Branchiostoma lanceolatum OX=7740 GN=MRC1 PE=4 SV=1, Branchiostoma_lanceolatum_tr_A0A8J9Z236_A0A8J9Z236_BRALA tr|A0A8J9Z236|A0A8J9Z236_BRALA MRC1 protein OS=Branchiostoma lanceolatum OX=7740 GN=MRC1 PE=4 SV=1, Branchiostoma_lanceolatum_tr_A0A8J9Z1L7_A0A8J9Z1L7_BRALA tr|A0A8J9Z1L7|A0A8J9Z1L7_BRALA MRC1 protein OS=Branchiostoma lanceolatum OX=7740 GN=MRC1 PE=4 SV=1, Branchiostoma_lanceolatum_tr_A0A8J9Z2G6_A0A8J9Z2G6_BRALA tr|A0A8J9Z2G6|A0A8J9Z2G6_BRALA MRC1 protein OS=Branchiostoma lanceolatum OX=7740 GN=MRC1 PE=4 SV=1, Branchiostoma_lanceolatum_tr_A0A8J9Z1M2_A0A8J9Z1M2_BRALA tr|A0A8J9Z1M2|A0A8J9Z1M2_BRALA MRC1 protein OS=Branchiostoma lanceolatum OX=7740 GN=MRC1 PE=4 SV=1, Branchiostoma_lanceolatum_tr_A0A8J9Z2J1_A0A8J9Z2J1_BRALA tr|A0A8J9Z2J1|A0A8J9Z2J1_BRALA MRC1 protein OS=Branchiostoma lanceolatum OX=7740 GN=MRC1 PE=4 SV=1, Branchiostoma_lanceolatum_tr_A0A8J9Z1Q6_A0A8J9Z1Q6_BRALA tr|A0A8J9Z1Q6|A0A8J9Z1Q6_BRALA MRC1 protein OS=Branchiostoma lanceolatum OX=7740 GN=MRC1 PE=4 SV=1
OG0000003	Xenia_spec_Xe_008296_T1 Xe_008296_T1 Xe_008296	Branchiostoma_lanceolatum_tr_A0A8J9Z2F1_A0A8J9Z2F1_BRALA tr|A0A8J9Z2F1|A0A8J9Z2F1_BRALA ASGR2 protein OS=Branchiostoma lanceolatum OX=7740 GN=ASGR2 PE=4 SV=1, Branchiostoma_lanceolatum_tr_A0A8J9ZHT9_A0A8J9ZHT9_BRALA tr|A0A8J9ZHT9|A0A8J9ZHT9_BRALA COLEC12 protein OS=Branchiostoma lanceolatum OX=7740 GN=COLEC12 PE=4 SV=1
OG0000003	Xenia_spec_Xe_002591_T1 Xe_002591_T1 Xe_002591	Branchiostoma_lanceolatum_tr_A0A8J9Z828_A0A8J9Z828_BRALA tr|A0A8J9Z828|A0A8J9Z828_BRALA CD209 protein OS=Branchiostoma lanceolatum OX=7740 GN=CD209 PE=4 SV=1, Branchiostoma_lanceolatum_tr_A0A8K0EFB5_A0A8K0EFB5_BRALA tr|A0A8K0EFB5|A0A8K0EFB5_BRALA CD209 protein OS=Branchiostoma lanceolatum OX=7740 GN=CD209 PE=4 SV=1, Branchiostoma_lanceolatum_tr_A0A8J9ZVT0_A0A8J9ZVT0_BRALA tr|A0A8J9ZVT0|A0A8J9ZVT0_BRALA MRC1 protein OS=Branchiostoma lanceolatum OX=7740 GN=MRC1 PE=4 SV=1, Branchiostoma_lanceolatum_tr_A0A8K0EMT7_A0A8K0EMT7_BRALA tr|A0A8K0EMT7|A0A8K0EMT7_BRALA MRC1 protein OS=Branchiostoma lanceolatum OX=7740 GN=MRC1 PE=4 SV=1, Branchiostoma_lanceolatum_tr_A0A8J9Z754_A0A8J9Z754_BRALA tr|A0A8J9Z754|A0A8J9Z754_BRALA MRC2 protein OS=Branchiostoma lanceolatum OX=7740 GN=MRC2 PE=4 SV=1, Branchiostoma_lanceolatum_tr_A0A8J9ZIL6_A0A8J9ZIL6_BRALA tr|A0A8J9ZIL6|A0A8J9ZIL6_BRALA MRC1 protein OS=Branchiostoma lanceolatum OX=7740 GN=MRC1 PE=4 SV=1, Branchiostoma_lanceolatum_tr_A0A8J9ZWF4_A0A8J9ZWF4_BRALA tr|A0A8J9ZWF4|A0A8J9ZWF4_BRALA MRC1 protein OS=Branchiostoma lanceolatum OX=7740 GN=MRC1 PE=4 SV=1
OG0000004	Xenia_spec_Xe_002025_T1 Xe_002025_T1 Xe_002025	Branchiostoma_lanceolatum_tr_A0A8J9ZDU8_A0A8J9ZDU8_BRALA tr|A0A8J9ZDU8|A0A8J9ZDU8_BRALA CSMD3 protein OS=Branchiostoma lanceolatum OX=7740 GN=CSMD3 PE=4 SV=1, Branchiostoma_lanceolatum_tr_A0A8J9YT76_A0A8J9YT76_BRALA tr|A0A8J9YT76|A0A8J9YT76_BRALA COL6A3 protein OS=Branchiostoma lanceolatum OX=7740 GN=COL6A3 PE=4 SV=1, Branchiostoma_lanceolatum_tr_A0A8J9YT82_A0A8J9YT82_BRALA tr|A0A8J9YT82|A0A8J9YT82_BRALA COL6A3 protein OS=Branchiostoma lanceolatum OX=7740 GN=COL6A3 PE=4 SV=1, Branchiostoma_lanceolatum_tr_A0A8K0F1S5_A0A8K0F1S5_BRALA tr|A0A8K0F1S5|A0A8K0F1S5_BRALA MATN1 protein OS=Branchiostoma lanceolatum OX=7740 GN=MATN1 PE=4 SV=1, Branchiostoma_lanceolatum_tr_A0A8J9ZF38_A0A8J9ZF38_BRALA tr|A0A8J9ZF38|A0A8J9ZF38_BRALA COL12A1 protein OS=Branchiostoma lanceolatum OX=7740 GN=COL12A1 PE=4 SV=1, Branchiostoma_lanceolatum_tr_A0A8J9ZAA6_A0A8J9ZAA6_BRALA tr|A0A8J9ZAA6|A0A8J9ZAA6_BRALA MATN2 protein OS=Branchiostoma lanceolatum OX=7740 GN=MATN2 PE=4 SV=1, Branchiostoma_lanceolatum_tr_A0A8J9Z9Z4_A0A8J9Z9Z4_BRALA tr|A0A8J9Z9Z4|A0A8J9Z9Z4_BRALA MATN2 protein OS=Branchiostoma lanceolatum OX=7740 GN=MATN2 PE=4 SV=1, Branchiostoma_lanceolatum_tr_A0A8J9ZFY2_A0A8J9ZFY2_BRALA tr|A0A8J9ZFY2|A0A8J9ZFY2_BRALA MATN1 protein OS=Branchiostoma lanceolatum OX=7740 GN=MATN1 PE=4 SV=1, Branchiostoma_lanceolatum_tr_A0A8J9ZE69_A0A8J9ZE69_BRALA tr|A0A8J9ZE69|A0A8J9ZE69_BRALA MATN1 protein OS=Branchiostoma lanceolatum OX=7740 GN=MATN1 PE=4 SV=1, Branchiostoma_lanceolatum_tr_A0A8J9ZJA7_A0A8J9ZJA7_BRALA tr|A0A8J9ZJA7|A0A8J9ZJA7_BRALA COL6A3 protein OS=Branchiostoma lanceolatum OX=7740 GN=COL6A3 PE=4 SV=1, Branchiostoma_lanceolatum_tr_A0A8K0AAB0_A0A8K0AAB0_BRALA tr|A0A8K0AAB0|A0A8K0AAB0_BRALA MATN2 protein OS=Branchiostoma lanceolatum OX=7740 GN=MATN2 PE=4 SV=1
OG0000004	Xenia_spec_Xe_016049_T1 Xe_016049_T1 Xe_016049	Branchiostoma_lanceolatum_tr_A0A8K0EXF8_A0A8K0EXF8_BRALA tr|A0A8K0EXF8|A0A8K0EXF8_BRALA FAT4 protein OS=Branchiostoma lanceolatum OX=7740 GN=FAT4 PE=4 SV=1
OG0000004	Xenia_spec_Xe_005233_T1 Xe_005233_T1 Xe_005233, Xenia_spec_Xe_005231_T1 Xe_005231_T1 Xe_005231	Branchiostoma_lanceolatum_tr_A0A8K0EUZ8_A0A8K0EUZ8_BRALA tr|A0A8K0EUZ8|A0A8K0EUZ8_BRALA CELSR2 protein OS=Branchiostoma lanceolatum OX=7740 GN=CELSR2 PE=4 SV=1
OG0000004	Xenia_spec_Xe_015008_T2 Xe_015008_T2 Xe_015008, Xenia_spec_Xe_015008_T1 Xe_015008_T1 Xe_015008	Branchiostoma_lanceolatum_tr_A0A8K0A395_A0A8K0A395_BRALA tr|A0A8K0A395|A0A8K0A395_BRALA FAT1 protein OS=Branchiostoma lanceolatum OX=7740 GN=FAT1 PE=4 SV=1, Branchiostoma_lanceolatum_tr_A0A8K0ESM8_A0A8K0ESM8_BRALA tr|A0A8K0ESM8|A0A8K0ESM8_BRALA FAT1 protein OS=Branchiostoma lanceolatum OX=7740 GN=FAT1 PE=4 SV=1, Branchiostoma_lanceolatum_tr_A0A8K0EYI0_A0A8K0EYI0_BRALA tr|A0A8K0EYI0|A0A8K0EYI0_BRALA FAT1 protein OS=Branchiostoma lanceolatum OX=7740 GN=FAT1 PE=4 SV=1, Branchiostoma_lanceolatum_tr_A0A8K0A4A6_A0A8K0A4A6_BRALA tr|A0A8K0A4A6|A0A8K0A4A6_BRALA FAT1 protein OS=Branchiostoma lanceolatum OX=7740 GN=FAT1 PE=4 SV=1
OG0000005	Xenia_spec_Xe_011516_T1 Xe_011516_T1 Xe_011516	Branchiostoma_lanceolatum_tr_A0A8J9VYT1_A0A8J9VYT1_BRALA tr|A0A8J9VYT1|A0A8J9VYT1_BRALA Metalloendopeptidase OS=Branchiostoma lanceolatum OX=7740 GN=TLL2 PE=4 SV=1, Branchiostoma_lanceolatum_tr_A0A8J9YIF9_A0A8J9YIF9_BRALA tr|A0A8J9YIF9|A0A8J9YIF9_BRALA Metalloendopeptidase OS=Branchiostoma lanceolatum OX=7740 GN=TLL2 PE=4 SV=1
OG0000005	Xenia_spec_Xe_001395_T1 Xe_001395_T1 Xe_001395	Branchiostoma_lanceolatum_tr_A0A8J9WGX0_A0A8J9WGX0_BRALA tr|A0A8J9WGX0|A0A8J9WGX0_BRALA Metalloendopeptidase OS=Branchiostoma lanceolatum OX=7740 GN=TLL2 PE=4 SV=1, Branchiostoma_lanceolatum_tr_A0A8J9W4Q2_A0A8J9W4Q2_BRALA tr|A0A8J9W4Q2|A0A8J9W4Q2_BRALA Metalloendopeptidase OS=Branchiostoma lanceolatum OX=7740 GN=TLL2 PE=4 SV=1, Branchiostoma_lanceolatum_tr_A0A8J9W5K0_A0A8J9W5K0_BRALA tr|A0A8J9W5K0|A0A8J9W5K0_BRALA Metalloendopeptidase OS=Branchiostoma lanceolatum OX=7740 GN=TLL1 PE=4 SV=1, Branchiostoma_lanceolatum_tr_A0A8J9YPT1_A0A8J9YPT1_BRALA tr|A0A8J9YPT1|A0A8J9YPT1_BRALA Metalloendopeptidase OS=Branchiostoma lanceolatum OX=7740 GN=TLL1 PE=4 SV=1, Branchiostoma_lanceolatum_tr_A0A8J9YKH8_A0A8J9YKH8_BRALA tr|A0A8J9YKH8|A0A8J9YKH8_BRALA Metalloendopeptidase OS=Branchiostoma lanceolatum OX=7740 GN=TLL1 PE=4 SV=1
OG0000005	Xenia_spec_Xe_010516_T1 Xe_010516_T1 Xe_010516	Branchiostoma_lanceolatum_tr_A0A8J9ZKB1_A0A8J9ZKB1_BRALA tr|A0A8J9ZKB1|A0A8J9ZKB1_BRALA Metalloendopeptidase OS=Branchiostoma lanceolatum OX=7740 GN=MEP1B PE=4 SV=1, Branchiostoma_lanceolatum_tr_A0A8J9ZKD0_A0A8J9ZKD0_BRALA tr|A0A8J9ZKD0|A0A8J9ZKD0_BRALA Metalloendopeptidase OS=Branchiostoma lanceolatum OX=7740 GN=MEP1B PE=4 SV=1, Branchiostoma_lanceolatum_tr_A0A8J9ZKH5_A0A8J9ZKH5_BRALA tr|A0A8J9ZKH5|A0A8J9ZKH5_BRALA Metalloendopeptidase OS=Branchiostoma lanceolatum OX=7740 GN=MEP1B PE=4 SV=1, Branchiostoma_lanceolatum_tr_A0A8K0EDX3_A0A8K0EDX3_BRALA tr|A0A8K0EDX3|A0A8K0EDX3_BRALA Metalloendopeptidase OS=Branchiostoma lanceolatum OX=7740 GN=MEP1B PE=4 SV=1, Branchiostoma_lanceolatum_tr_A0A8K0E8W1_A0A8K0E8W1_BRALA tr|A0A8K0E8W1|A0A8K0E8W1_BRALA Metalloendopeptidase OS=Branchiostoma lanceolatum OX=7740 GN=MEP1B PE=4 SV=1
OG0000006	Xenia_spec_Xe_008035_T1 Xe_008035_T1 Xe_008035	Branchiostoma_lanceolatum_tr_A0A8K0EYB5_A0A8K0EYB5_BRALA tr|A0A8K0EYB5|A0A8K0EYB5_BRALA CSMD1 protein OS=Branchiostoma lanceolatum OX=7740 GN=CSMD1 PE=4 SV=1, Branchiostoma_lanceolatum_tr_A0A8K0AAR1_A0A8K0AAR1_BRALA tr|A0A8K0AAR1|A0A8K0AAR1_BRALA CSMD1 protein OS=Branchiostoma lanceolatum OX=7740 GN=CSMD1 PE=3 SV=1
OG0000006	Xenia_spec_Xe_007877_T1 Xe_007877_T1 Xe_007877, Xenia_spec_Xe_007877_T2 Xe_007877_T2 Xe_007877, Xenia_spec_Xe_020681_T1 Xe_020681_T1 Xe_020681, Xenia_spec_Xe_007894_T1 Xe_007894_T1 Xe_007894, Xenia_spec_Xe_007895_T1 Xe_007895_T1 Xe_007895	Branchiostoma_lanceolatum_tr_A0A8K0F1W0_A0A8K0F1W0_BRALA tr|A0A8K0F1W0|A0A8K0F1W0_BRALA CSMD1 protein OS=Branchiostoma lanceolatum OX=7740 GN=CSMD1 PE=4 SV=1, Branchiostoma_lanceolatum_tr_A0A8K0EW27_A0A8K0EW27_BRALA tr|A0A8K0EW27|A0A8K0EW27_BRALA CSMD1 protein OS=Branchiostoma lanceolatum OX=7740 GN=CSMD1 PE=4 SV=1
