Orthogroup	Chordata_Amphioxiformes_Branchiostoma_belcheri	Cnidaria_Cubozoa_Morbakka_virulenta
OG0000000	Branchiostoma_belcheri_tr_A0A6P4XKH2_A0A6P4XKH2_BRABE tr|A0A6P4XKH2|A0A6P4XKH2_BRABE Fibrinogen-like protein 1 OS=Branchiostoma belcheri OX=7741 GN=LOC109464489 PE=4 SV=1, Branchiostoma_belcheri_tr_A0A6P5A3M2_A0A6P5A3M2_BRABE tr|A0A6P5A3M2|A0A6P5A3M2_BRABE Fibrinogen-like protein 1 OS=Branchiostoma belcheri OX=7741 GN=LOC109485040 PE=4 SV=1, Branchiostoma_belcheri_tr_A0A6P4ZUI1_A0A6P4ZUI1_BRABE tr|A0A6P4ZUI1|A0A6P4ZUI1_BRABE Fibrinogen-like protein 1 OS=Branchiostoma belcheri OX=7741 GN=LOC109485587 PE=4 SV=1, Branchiostoma_belcheri_tr_A0A6P5AM29_A0A6P5AM29_BRABE tr|A0A6P5AM29|A0A6P5AM29_BRABE Fibrinogen-like protein 1 OS=Branchiostoma belcheri OX=7741 GN=LOC109485109 PE=4 SV=1, Branchiostoma_belcheri_tr_A0A6P4Y5B9_A0A6P4Y5B9_BRABE tr|A0A6P4Y5B9|A0A6P4Y5B9_BRABE Fibrinogen-like protein 1 OS=Branchiostoma belcheri OX=7741 GN=LOC109469899 PE=4 SV=1, Branchiostoma_belcheri_tr_A0A6P5AET1_A0A6P5AET1_BRABE tr|A0A6P5AET1|A0A6P5AET1_BRABE Angiopoietin-related protein 7-like OS=Branchiostoma belcheri OX=7741 GN=LOC109485594 PE=4 SV=1, Branchiostoma_belcheri_tr_A0A6P4YGC2_A0A6P4YGC2_BRABE tr|A0A6P4YGC2|A0A6P4YGC2_BRABE Ficolin-2-like OS=Branchiostoma belcheri OX=7741 GN=LOC109469421 PE=4 SV=1, Branchiostoma_belcheri_tr_A0A6P4ZD09_A0A6P4ZD09_BRABE tr|A0A6P4ZD09|A0A6P4ZD09_BRABE Fibrinogen-like protein 1 OS=Branchiostoma belcheri OX=7741 GN=LOC109477660 PE=4 SV=1, Branchiostoma_belcheri_tr_A0A6P4YGY1_A0A6P4YGY1_BRABE tr|A0A6P4YGY1|A0A6P4YGY1_BRABE Angiopoietin-related protein 7-like OS=Branchiostoma belcheri OX=7741 GN=LOC109467609 PE=4 SV=1, Branchiostoma_belcheri_tr_A0A6P4ZL63_A0A6P4ZL63_BRABE tr|A0A6P4ZL63|A0A6P4ZL63_BRABE Microfibril-associated glycoprotein 4-like OS=Branchiostoma belcheri OX=7741 GN=LOC109477800 PE=4 SV=1, Branchiostoma_belcheri_tr_A0A6P5AWN0_A0A6P5AWN0_BRABE tr|A0A6P5AWN0|A0A6P5AWN0_BRABE Fibrinogen-like protein 1 isoform X2 OS=Branchiostoma belcheri OX=7741 GN=LOC109486936 PE=4 SV=1, Branchiostoma_belcheri_tr_A0A6P4ZZ24_A0A6P4ZZ24_BRABE tr|A0A6P4ZZ24|A0A6P4ZZ24_BRABE Fibrinogen-like protein 1 isoform X1 OS=Branchiostoma belcheri OX=7741 GN=LOC109486936 PE=4 SV=1, Branchiostoma_belcheri_tr_A0A6P4YCA4_A0A6P4YCA4_BRABE tr|A0A6P4YCA4|A0A6P4YCA4_BRABE Microfibril-associated glycoprotein 4-like OS=Branchiostoma belcheri OX=7741 GN=LOC109468225 PE=4 SV=1, Branchiostoma_belcheri_tr_A0A6P4ZUE6_A0A6P4ZUE6_BRABE tr|A0A6P4ZUE6|A0A6P4ZUE6_BRABE Microfibril-associated glycoprotein 4-like isoform X1 OS=Branchiostoma belcheri OX=7741 GN=LOC109477672 PE=4 SV=1, Branchiostoma_belcheri_tr_A0A6P4ZYC4_A0A6P4ZYC4_BRABE tr|A0A6P4ZYC4|A0A6P4ZYC4_BRABE Microfibril-associated glycoprotein 4-like isoform X3 OS=Branchiostoma belcheri OX=7741 GN=LOC109477672 PE=4 SV=1, Branchiostoma_belcheri_tr_A0A6P4ZYB3_A0A6P4ZYB3_BRABE tr|A0A6P4ZYB3|A0A6P4ZYB3_BRABE Microfibril-associated glycoprotein 4-like isoform X2 OS=Branchiostoma belcheri OX=7741 GN=LOC109477672 PE=4 SV=1, Branchiostoma_belcheri_tr_A0A6P4ZD38_A0A6P4ZD38_BRABE tr|A0A6P4ZD38|A0A6P4ZD38_BRABE Fibrinogen-like protein 1 OS=Branchiostoma belcheri OX=7741 GN=LOC109477690 PE=4 SV=1, Branchiostoma_belcheri_tr_A0A6P5A705_A0A6P5A705_BRABE tr|A0A6P5A705|A0A6P5A705_BRABE Ficolin-2-like OS=Branchiostoma belcheri OX=7741 GN=LOC109481037 PE=4 SV=1, Branchiostoma_belcheri_tr_A0A6P5ATP3_A0A6P5ATP3_BRABE tr|A0A6P5ATP3|A0A6P5ATP3_BRABE Fibroleukin-like OS=Branchiostoma belcheri OX=7741 GN=LOC109486958 PE=4 SV=1, Branchiostoma_belcheri_tr_A0A6P5A7S9_A0A6P5A7S9_BRABE tr|A0A6P5A7S9|A0A6P5A7S9_BRABE Ficolin-2-like OS=Branchiostoma belcheri OX=7741 GN=LOC109481293 PE=4 SV=1, Branchiostoma_belcheri_tr_A0A6P4YKD1_A0A6P4YKD1_BRABE tr|A0A6P4YKD1|A0A6P4YKD1_BRABE Fibrinogen-like protein 1 OS=Branchiostoma belcheri OX=7741 GN=LOC109470379 PE=4 SV=1, Branchiostoma_belcheri_tr_A0A6P5A1Q2_A0A6P5A1Q2_BRABE tr|A0A6P5A1Q2|A0A6P5A1Q2_BRABE Fibrinogen-like protein 1 OS=Branchiostoma belcheri OX=7741 GN=LOC109487638 PE=4 SV=1, Branchiostoma_belcheri_tr_A0A6P4Z3Q2_A0A6P4Z3Q2_BRABE tr|A0A6P4Z3Q2|A0A6P4Z3Q2_BRABE Ficolin-2-like OS=Branchiostoma belcheri OX=7741 GN=LOC109469886 PE=4 SV=1, Branchiostoma_belcheri_tr_A0A6P4YW84_A0A6P4YW84_BRABE tr|A0A6P4YW84|A0A6P4YW84_BRABE Ficolin-1-like OS=Branchiostoma belcheri OX=7741 GN=LOC109469052 PE=4 SV=1, Branchiostoma_belcheri_tr_A0A6P4XVN1_A0A6P4XVN1_BRABE tr|A0A6P4XVN1|A0A6P4XVN1_BRABE Ficolin-2-like OS=Branchiostoma belcheri OX=7741 GN=LOC109462528 PE=4 SV=1, Branchiostoma_belcheri_tr_A0A6P5AWL3_A0A6P5AWL3_BRABE tr|A0A6P5AWL3|A0A6P5AWL3_BRABE Fibrinogen-like protein 1 OS=Branchiostoma belcheri OX=7741 GN=LOC109486909 PE=4 SV=1, Branchiostoma_belcheri_tr_A0A6P4YKG3_A0A6P4YKG3_BRABE tr|A0A6P4YKG3|A0A6P4YKG3_BRABE Ficolin-2-like OS=Branchiostoma belcheri OX=7741 GN=LOC109470413 PE=4 SV=1, Branchiostoma_belcheri_tr_A0A6P4ZWP3_A0A6P4ZWP3_BRABE tr|A0A6P4ZWP3|A0A6P4ZWP3_BRABE Techylectin-5A-like OS=Branchiostoma belcheri OX=7741 GN=LOC109480631 PE=4 SV=1, Branchiostoma_belcheri_tr_A0A6P5AER1_A0A6P5AER1_BRABE tr|A0A6P5AER1|A0A6P5AER1_BRABE Microfibril-associated glycoprotein 4-like OS=Branchiostoma belcheri OX=7741 GN=LOC109485569 PE=4 SV=1, Branchiostoma_belcheri_tr_A0A6P4YR77_A0A6P4YR77_BRABE tr|A0A6P4YR77|A0A6P4YR77_BRABE Angiopoietin-2-like OS=Branchiostoma belcheri OX=7741 GN=LOC109469883 PE=4 SV=1, Branchiostoma_belcheri_tr_A0A6P4ZMN6_A0A6P4ZMN6_BRABE tr|A0A6P4ZMN6|A0A6P4ZMN6_BRABE Microfibril-associated glycoprotein 4-like OS=Branchiostoma belcheri OX=7741 GN=LOC109475949 PE=4 SV=1, Branchiostoma_belcheri_tr_A0A6P4Z154_A0A6P4Z154_BRABE tr|A0A6P4Z154|A0A6P4Z154_BRABE Fibrinogen-like protein 1 OS=Branchiostoma belcheri OX=7741 GN=LOC109474400 PE=4 SV=1, Branchiostoma_belcheri_tr_A0A6P4Z1N4_A0A6P4Z1N4_BRABE tr|A0A6P4Z1N4|A0A6P4Z1N4_BRABE Ficolin-2-like OS=Branchiostoma belcheri OX=7741 GN=LOC109469415 PE=4 SV=1, Branchiostoma_belcheri_tr_A0A6P4YXB7_A0A6P4YXB7_BRABE tr|A0A6P4YXB7|A0A6P4YXB7_BRABE Fibrinogen C domain-containing protein 1-like OS=Branchiostoma belcheri OX=7741 GN=LOC109469359 PE=4 SV=1, Branchiostoma_belcheri_tr_A0A6P4XUL8_A0A6P4XUL8_BRABE tr|A0A6P4XUL8|A0A6P4XUL8_BRABE Fibrinogen-like protein 1 OS=Branchiostoma belcheri OX=7741 GN=LOC109462239 PE=4 SV=1	Morbakka_virulenta_scaffold713.g2.t2 scaffold713.g2.t2, Morbakka_virulenta_scaffold713.g2.t1 scaffold713.g2.t1, Morbakka_virulenta_scaffold16.g2.t1 scaffold16.g2.t1
OG0000001	Branchiostoma_belcheri_tr_A0A6P4YR81_A0A6P4YR81_BRABE tr|A0A6P4YR81|A0A6P4YR81_BRABE LOW QUALITY PROTEIN_ laminin subunit beta-1-like OS=Branchiostoma belcheri OX=7741 GN=LOC109469885 PE=4 SV=1	Morbakka_virulenta_scaffold19.g85.t2 scaffold19.g85.t2, Morbakka_virulenta_scaffold19.g85.t4 scaffold19.g85.t4, Morbakka_virulenta_scaffold19.g85.t3 scaffold19.g85.t3, Morbakka_virulenta_scaffold19.g85.t1 scaffold19.g85.t1
OG0000001	Branchiostoma_belcheri_tr_A0A6P4Y5S7_A0A6P4Y5S7_BRABE tr|A0A6P4Y5S7|A0A6P4Y5S7_BRABE Laminin subunit alpha-1-like OS=Branchiostoma belcheri OX=7741 GN=LOC109470016 PE=4 SV=1	Morbakka_virulenta_scaffold55.g43.t1 scaffold55.g43.t1, Morbakka_virulenta_scaffold227.g30.t1 scaffold227.g30.t1
OG0000001	Branchiostoma_belcheri_tr_A0A6P4YUP0_A0A6P4YUP0_BRABE tr|A0A6P4YUP0|A0A6P4YUP0_BRABE Neogenin-like isoform X5 OS=Branchiostoma belcheri OX=7741 GN=LOC109468561 PE=3 SV=1, Branchiostoma_belcheri_tr_A0A6P4YUN6_A0A6P4YUN6_BRABE tr|A0A6P4YUN6|A0A6P4YUN6_BRABE Neogenin-like isoform X1 OS=Branchiostoma belcheri OX=7741 GN=LOC109468561 PE=3 SV=1, Branchiostoma_belcheri_tr_A0A6P4YKZ6_A0A6P4YKZ6_BRABE tr|A0A6P4YKZ6|A0A6P4YKZ6_BRABE Neogenin-like isoform X3 OS=Branchiostoma belcheri OX=7741 GN=LOC109468561 PE=3 SV=1, Branchiostoma_belcheri_tr_A0A6P4YD66_A0A6P4YD66_BRABE tr|A0A6P4YD66|A0A6P4YD66_BRABE Neogenin-like isoform X2 OS=Branchiostoma belcheri OX=7741 GN=LOC109468561 PE=3 SV=1, Branchiostoma_belcheri_tr_A0A6P4Y0G1_A0A6P4Y0G1_BRABE tr|A0A6P4Y0G1|A0A6P4Y0G1_BRABE Neogenin-like isoform X4 OS=Branchiostoma belcheri OX=7741 GN=LOC109468561 PE=3 SV=1, Branchiostoma_belcheri_tr_A0A6P4YD71_A0A6P4YD71_BRABE tr|A0A6P4YD71|A0A6P4YD71_BRABE Neogenin-like isoform X6 OS=Branchiostoma belcheri OX=7741 GN=LOC109468561 PE=3 SV=1, Branchiostoma_belcheri_tr_A0A6P4YL01_A0A6P4YL01_BRABE tr|A0A6P4YL01|A0A6P4YL01_BRABE Neogenin-like isoform X7 OS=Branchiostoma belcheri OX=7741 GN=LOC109468561 PE=3 SV=1	Morbakka_virulenta_scaffold397.g4.t2 scaffold397.g4.t2, Morbakka_virulenta_scaffold397.g4.t1 scaffold397.g4.t1
OG0000001	Branchiostoma_belcheri_tr_A0A6P5A1V3_A0A6P5A1V3_BRABE tr|A0A6P5A1V3|A0A6P5A1V3_BRABE LOW QUALITY PROTEIN_ tenascin-X-like OS=Branchiostoma belcheri OX=7741 GN=LOC109484472 PE=3 SV=1, Branchiostoma_belcheri_tr_A0A6P4Z8M8_A0A6P4Z8M8_BRABE tr|A0A6P4Z8M8|A0A6P4Z8M8_BRABE Uncharacterized protein LOC109474384 OS=Branchiostoma belcheri OX=7741 GN=LOC109474384 PE=4 SV=1, Branchiostoma_belcheri_tr_A0A6P5ADU8_A0A6P5ADU8_BRABE tr|A0A6P5ADU8|A0A6P5ADU8_BRABE LOW QUALITY PROTEIN_ uncharacterized protein LOC109481795 OS=Branchiostoma belcheri OX=7741 GN=LOC109481795 PE=4 SV=1	Morbakka_virulenta_scaffold12.g138.t1 scaffold12.g138.t1, Morbakka_virulenta_scaffold361.g18.t1 scaffold361.g18.t1, Morbakka_virulenta_scaffold209.g24.t6 scaffold209.g24.t6, Morbakka_virulenta_scaffold209.g24.t3 scaffold209.g24.t3, Morbakka_virulenta_scaffold209.g24.t5 scaffold209.g24.t5, Morbakka_virulenta_scaffold209.g24.t4 scaffold209.g24.t4
OG0000001	Branchiostoma_belcheri_tr_A0A6P5AN90_A0A6P5AN90_BRABE tr|A0A6P5AN90|A0A6P5AN90_BRABE Protein sidekick-2-like isoform X1 OS=Branchiostoma belcheri OX=7741 GN=LOC109484602 PE=4 SV=1, Branchiostoma_belcheri_tr_A0A6P5ANA6_A0A6P5ANA6_BRABE tr|A0A6P5ANA6|A0A6P5ANA6_BRABE Protein sidekick-2-like isoform X3 OS=Branchiostoma belcheri OX=7741 GN=LOC109484602 PE=4 SV=1, Branchiostoma_belcheri_tr_A0A6P5ANC2_A0A6P5ANC2_BRABE tr|A0A6P5ANC2|A0A6P5ANC2_BRABE Protein sidekick-2-like isoform X5 OS=Branchiostoma belcheri OX=7741 GN=LOC109484602 PE=4 SV=1, Branchiostoma_belcheri_tr_A0A6P5ABA9_A0A6P5ABA9_BRABE tr|A0A6P5ABA9|A0A6P5ABA9_BRABE Protein sidekick-2-like isoform X4 OS=Branchiostoma belcheri OX=7741 GN=LOC109484602 PE=4 SV=1	Morbakka_virulenta_scaffold68.g48.t2 scaffold68.g48.t2, Morbakka_virulenta_scaffold68.g48.t1 scaffold68.g48.t1
OG0000001	Branchiostoma_belcheri_tr_A0A6P4Y5K9_A0A6P4Y5K9_BRABE tr|A0A6P4Y5K9|A0A6P4Y5K9_BRABE Protein sidekick-2-like OS=Branchiostoma belcheri OX=7741 GN=LOC109461953 PE=4 SV=1	Morbakka_virulenta_scaffold37.g39.t1 scaffold37.g39.t1
OG0000001	Branchiostoma_belcheri_tr_A0A6P4Y9F8_A0A6P4Y9F8_BRABE tr|A0A6P4Y9F8|A0A6P4Y9F8_BRABE LOW QUALITY PROTEIN_ usherin-like OS=Branchiostoma belcheri OX=7741 GN=LOC109463174 PE=4 SV=1	Morbakka_virulenta_scaffold43.g67.t1 scaffold43.g67.t1, Morbakka_virulenta_scaffold43.g67.t2 scaffold43.g67.t2
OG0000001	Branchiostoma_belcheri_tr_A0A6P5AGP2_A0A6P5AGP2_BRABE tr|A0A6P5AGP2|A0A6P5AGP2_BRABE Netrin-G2-like OS=Branchiostoma belcheri OX=7741 GN=LOC109482640 PE=4 SV=1, Branchiostoma_belcheri_tr_A0A6P5AGP7_A0A6P5AGP7_BRABE tr|A0A6P5AGP7|A0A6P5AGP7_BRABE Netrin-G1-like OS=Branchiostoma belcheri OX=7741 GN=LOC109482641 PE=4 SV=1	Morbakka_virulenta_scaffold35.g66.t1 scaffold35.g66.t1, Morbakka_virulenta_scaffold152.g29.t1 scaffold152.g29.t1, Morbakka_virulenta_scaffold152.g29.t2 scaffold152.g29.t2, Morbakka_virulenta_scaffold152.g29.t3 scaffold152.g29.t3
OG0000001	Branchiostoma_belcheri_tr_A0A6P4YK87_A0A6P4YK87_BRABE tr|A0A6P4YK87|A0A6P4YK87_BRABE Laminin subunit gamma-1-like isoform X1 OS=Branchiostoma belcheri OX=7741 GN=LOC109466026 PE=4 SV=1, Branchiostoma_belcheri_tr_A0A6P4Y3X6_A0A6P4Y3X6_BRABE tr|A0A6P4Y3X6|A0A6P4Y3X6_BRABE Laminin subunit gamma-1-like isoform X2 OS=Branchiostoma belcheri OX=7741 GN=LOC109466026 PE=4 SV=1, Branchiostoma_belcheri_tr_A0A6P4Y9Y1_A0A6P4Y9Y1_BRABE tr|A0A6P4Y9Y1|A0A6P4Y9Y1_BRABE Laminin subunit gamma-1-like isoform X3 OS=Branchiostoma belcheri OX=7741 GN=LOC109466026 PE=4 SV=1	Morbakka_virulenta_scaffold1.g52.t1 scaffold1.g52.t1, Morbakka_virulenta_scaffold1.g52.t2 scaffold1.g52.t2
OG0000001	Branchiostoma_belcheri_tr_A0A6P5A1G4_A0A6P5A1G4_BRABE tr|A0A6P5A1G4|A0A6P5A1G4_BRABE Laminin subunit beta-1-like OS=Branchiostoma belcheri OX=7741 GN=LOC109484324 PE=4 SV=1	Morbakka_virulenta_scaffold212.g45.t1 scaffold212.g45.t1
OG0000001	Branchiostoma_belcheri_tr_A0A6P4ZJJ8_A0A6P4ZJJ8_BRABE tr|A0A6P4ZJJ8|A0A6P4ZJJ8_BRABE Laminin-like protein epi-1 OS=Branchiostoma belcheri OX=7741 GN=LOC109475156 PE=4 SV=1, Branchiostoma_belcheri_tr_A0A6P4Y697_A0A6P4Y697_BRABE tr|A0A6P4Y697|A0A6P4Y697_BRABE LOW QUALITY PROTEIN_ laminin subunit alpha-2-like OS=Branchiostoma belcheri OX=7741 GN=LOC109465175 PE=4 SV=1	Morbakka_virulenta_scaffold55.g42.t1 scaffold55.g42.t1
OG0000002	Branchiostoma_belcheri_tr_A0A6P4ZAP7_A0A6P4ZAP7_BRABE tr|A0A6P4ZAP7|A0A6P4ZAP7_BRABE Cartilage oligomeric matrix protein-like OS=Branchiostoma belcheri OX=7741 GN=LOC109477096 PE=3 SV=1	Morbakka_virulenta_scaffold166.g7.t2 scaffold166.g7.t2, Morbakka_virulenta_scaffold166.g7.t1 scaffold166.g7.t1
OG0000002	Branchiostoma_belcheri_tr_A0A6P5AES8_A0A6P5AES8_BRABE tr|A0A6P5AES8|A0A6P5AES8_BRABE LOW QUALITY PROTEIN_ thrombospondin-3-like OS=Branchiostoma belcheri OX=7741 GN=LOC109483219 PE=3 SV=1	Morbakka_virulenta_scaffold164.g26.t1 scaffold164.g26.t1
OG0000002	Branchiostoma_belcheri_tr_A0A6P4YJP9_A0A6P4YJP9_BRABE tr|A0A6P4YJP9|A0A6P4YJP9_BRABE Uncharacterized protein LOC109468189 OS=Branchiostoma belcheri OX=7741 GN=LOC109468189 PE=3 SV=1, Branchiostoma_belcheri_tr_A0A6P5AB96_A0A6P5AB96_BRABE tr|A0A6P5AB96|A0A6P5AB96_BRABE Cartilage oligomeric matrix protein-like OS=Branchiostoma belcheri OX=7741 GN=LOC109481033 PE=3 SV=1, Branchiostoma_belcheri_tr_A0A6P4ZK29_A0A6P4ZK29_BRABE tr|A0A6P4ZK29|A0A6P4ZK29_BRABE Cartilage oligomeric matrix protein-like OS=Branchiostoma belcheri OX=7741 GN=LOC109475273 PE=3 SV=1, Branchiostoma_belcheri_tr_A0A6P4YKI0_A0A6P4YKI0_BRABE tr|A0A6P4YKI0|A0A6P4YKI0_BRABE Cartilage oligomeric matrix protein-like OS=Branchiostoma belcheri OX=7741 GN=LOC109474168 PE=3 SV=1, Branchiostoma_belcheri_tr_A0A6P4YT56_A0A6P4YT56_BRABE tr|A0A6P4YT56|A0A6P4YT56_BRABE Cartilage oligomeric matrix protein-like OS=Branchiostoma belcheri OX=7741 GN=LOC109476155 PE=4 SV=1, Branchiostoma_belcheri_tr_A0A6P5A4N0_A0A6P5A4N0_BRABE tr|A0A6P5A4N0|A0A6P5A4N0_BRABE Cartilage oligomeric matrix protein-like OS=Branchiostoma belcheri OX=7741 GN=LOC109480413 PE=3 SV=1, Branchiostoma_belcheri_tr_A0A6P4ZBX7_A0A6P4ZBX7_BRABE tr|A0A6P4ZBX7|A0A6P4ZBX7_BRABE Cartilage oligomeric matrix protein-like OS=Branchiostoma belcheri OX=7741 GN=LOC109475252 PE=3 SV=1, Branchiostoma_belcheri_tr_A0A6P4XGP0_A0A6P4XGP0_BRABE tr|A0A6P4XGP0|A0A6P4XGP0_BRABE Neurogenic locus notch homolog protein 1-like OS=Branchiostoma belcheri OX=7741 GN=LOC109463371 PE=3 SV=1, Branchiostoma_belcheri_tr_A0A6P4YRI4_A0A6P4YRI4_BRABE tr|A0A6P4YRI4|A0A6P4YRI4_BRABE Cartilage oligomeric matrix protein-like OS=Branchiostoma belcheri OX=7741 GN=LOC109475738 PE=3 SV=1	Morbakka_virulenta_scaffold353.g2.t2 scaffold353.g2.t2, Morbakka_virulenta_scaffold353.g1.t1 scaffold353.g1.t1
OG0000002	Branchiostoma_belcheri_tr_A0A6P4ZK59_A0A6P4ZK59_BRABE tr|A0A6P4ZK59|A0A6P4ZK59_BRABE Semaphorin-5A-like OS=Branchiostoma belcheri OX=7741 GN=LOC109474202 PE=4 SV=1	Morbakka_virulenta_scaffold24.g105.t1 scaffold24.g105.t1
OG0000002	Branchiostoma_belcheri_tr_A0A6P4ZGX7_A0A6P4ZGX7_BRABE tr|A0A6P4ZGX7|A0A6P4ZGX7_BRABE Semaphorin-3C-like OS=Branchiostoma belcheri OX=7741 GN=LOC109482228 PE=4 SV=1, Branchiostoma_belcheri_tr_A0A6P4ZSC7_A0A6P4ZSC7_BRABE tr|A0A6P4ZSC7|A0A6P4ZSC7_BRABE Semaphorin-1A-like isoform X3 OS=Branchiostoma belcheri OX=7741 GN=LOC109476014 PE=4 SV=1, Branchiostoma_belcheri_tr_A0A6P4YSZ6_A0A6P4YSZ6_BRABE tr|A0A6P4YSZ6|A0A6P4YSZ6_BRABE Semaphorin-1A-like isoform X5 OS=Branchiostoma belcheri OX=7741 GN=LOC109476014 PE=4 SV=1, Branchiostoma_belcheri_tr_A0A6P4YSY3_A0A6P4YSY3_BRABE tr|A0A6P4YSY3|A0A6P4YSY3_BRABE Semaphorin-1A-like isoform X4 OS=Branchiostoma belcheri OX=7741 GN=LOC109476014 PE=4 SV=1, Branchiostoma_belcheri_tr_A0A6P4ZN59_A0A6P4ZN59_BRABE tr|A0A6P4ZN59|A0A6P4ZN59_BRABE Semaphorin-1A-like isoform X1 OS=Branchiostoma belcheri OX=7741 GN=LOC109476014 PE=4 SV=1, Branchiostoma_belcheri_tr_A0A6P4Z788_A0A6P4Z788_BRABE tr|A0A6P4Z788|A0A6P4Z788_BRABE Semaphorin-1A-like isoform X2 OS=Branchiostoma belcheri OX=7741 GN=LOC109476014 PE=4 SV=1	Morbakka_virulenta_scaffold22.g63.t2 scaffold22.g63.t2, Morbakka_virulenta_scaffold22.g63.t3 scaffold22.g63.t3, Morbakka_virulenta_scaffold22.g63.t1 scaffold22.g63.t1
OG0000002	Branchiostoma_belcheri_tr_A0A6P5AJ98_A0A6P5AJ98_BRABE tr|A0A6P5AJ98|A0A6P5AJ98_BRABE SCO-spondin-like OS=Branchiostoma belcheri OX=7741 GN=LOC109486880 PE=4 SV=1	Morbakka_virulenta_scaffold255.g10.t1 scaffold255.g10.t1, Morbakka_virulenta_scaffold218.g5.t1 scaffold218.g5.t1, Morbakka_virulenta_scaffold218.g5.t2 scaffold218.g5.t2
OG0000002	Branchiostoma_belcheri_tr_A0A6P5ABP9_A0A6P5ABP9_BRABE tr|A0A6P5ABP9|A0A6P5ABP9_BRABE Hemicentin-1-like OS=Branchiostoma belcheri OX=7741 GN=LOC109487508 PE=4 SV=1	Morbakka_virulenta_scaffold44.g87.t5 scaffold44.g87.t5, Morbakka_virulenta_scaffold44.g87.t4 scaffold44.g87.t4, Morbakka_virulenta_scaffold44.g87.t3 scaffold44.g87.t3, Morbakka_virulenta_scaffold44.g87.t2 scaffold44.g87.t2
OG0000002	Branchiostoma_belcheri_tr_A0A6P4Z752_A0A6P4Z752_BRABE tr|A0A6P4Z752|A0A6P4Z752_BRABE Fibronectin-like OS=Branchiostoma belcheri OX=7741 GN=LOC109479681 PE=4 SV=1, Branchiostoma_belcheri_tr_A0A6P4Z717_A0A6P4Z717_BRABE tr|A0A6P4Z717|A0A6P4Z717_BRABE Brain-specific angiogenesis inhibitor 1-like OS=Branchiostoma belcheri OX=7741 GN=LOC109479662 PE=4 SV=1	Morbakka_virulenta_scaffold255.g9.t1 scaffold255.g9.t1
OG0000003	Branchiostoma_belcheri_tr_A0A6P4XMZ1_A0A6P4XMZ1_BRABE tr|A0A6P4XMZ1|A0A6P4XMZ1_BRABE Cuticle collagen 2C-like OS=Branchiostoma belcheri OX=7741 GN=LOC109465273 PE=4 SV=1	Morbakka_virulenta_scaffold3.g19.t1 scaffold3.g19.t1
OG0000003	Branchiostoma_belcheri_tr_A0A6P4XU70_A0A6P4XU70_BRABE tr|A0A6P4XU70|A0A6P4XU70_BRABE Uncharacterized protein LOC109466808 OS=Branchiostoma belcheri OX=7741 GN=LOC109466808 PE=4 SV=1, Branchiostoma_belcheri_tr_A0A6P4YMV7_A0A6P4YMV7_BRABE tr|A0A6P4YMV7|A0A6P4YMV7_BRABE LOW QUALITY PROTEIN_ macrophage mannose receptor 1-like OS=Branchiostoma belcheri OX=7741 GN=LOC109466723 PE=4 SV=1	Morbakka_virulenta_scaffold138.g37.t1 scaffold138.g37.t1
OG0000003	Branchiostoma_belcheri_tr_A0A6P4ZE52_A0A6P4ZE52_BRABE tr|A0A6P4ZE52|A0A6P4ZE52_BRABE Mucin-22-like OS=Branchiostoma belcheri OX=7741 GN=LOC109472587 PE=4 SV=1	Morbakka_virulenta_scaffold163.g30.t1 scaffold163.g30.t1
OG0000003	Branchiostoma_belcheri_tr_A0A6P4YWD3_A0A6P4YWD3_BRABE tr|A0A6P4YWD3|A0A6P4YWD3_BRABE Fibrillin-2-like OS=Branchiostoma belcheri OX=7741 GN=LOC109469111 PE=4 SV=1, Branchiostoma_belcheri_tr_A0A6P4YMU8_A0A6P4YMU8_BRABE tr|A0A6P4YMU8|A0A6P4YMU8_BRABE Uncharacterized protein LOC109465569 OS=Branchiostoma belcheri OX=7741 GN=LOC109465569 PE=4 SV=1	Morbakka_virulenta_scaffold2.g141.t1 scaffold2.g141.t1, Morbakka_virulenta_scaffold192.g7.t1 scaffold192.g7.t1
OG0000003	Branchiostoma_belcheri_tr_A0A6P4Z8Z1_A0A6P4Z8Z1_BRABE tr|A0A6P4Z8Z1|A0A6P4Z8Z1_BRABE Uncharacterized protein LOC109474505 OS=Branchiostoma belcheri OX=7741 GN=LOC109474505 PE=4 SV=1, Branchiostoma_belcheri_tr_A0A6P4Z1E2_A0A6P4Z1E2_BRABE tr|A0A6P4Z1E2|A0A6P4Z1E2_BRABE Fibrillin-1-like OS=Branchiostoma belcheri OX=7741 GN=LOC109474499 PE=4 SV=1, Branchiostoma_belcheri_tr_A0A6P4XNR5_A0A6P4XNR5_BRABE tr|A0A6P4XNR5|A0A6P4XNR5_BRABE Uncharacterized protein LOC109461753 OS=Branchiostoma belcheri OX=7741 GN=LOC109461753 PE=4 SV=1	Morbakka_virulenta_scaffold252.g1.t1 scaffold252.g1.t1
OG0000004	Branchiostoma_belcheri_tr_A0A6P4YE76_A0A6P4YE76_BRABE tr|A0A6P4YE76|A0A6P4YE76_BRABE von Willebrand factor A domain-containing protein 2-like OS=Branchiostoma belcheri OX=7741 GN=LOC109464495 PE=4 SV=1, Branchiostoma_belcheri_tr_A0A6P4YNC9_A0A6P4YNC9_BRABE tr|A0A6P4YNC9|A0A6P4YNC9_BRABE Collagen alpha-1_XII_ chain-like isoform X3 OS=Branchiostoma belcheri OX=7741 GN=LOC109474920 PE=4 SV=1, Branchiostoma_belcheri_tr_A0A6P4ZF38_A0A6P4ZF38_BRABE tr|A0A6P4ZF38|A0A6P4ZF38_BRABE Collagen alpha-4_VI_ chain-like OS=Branchiostoma belcheri OX=7741 GN=LOC109472877 PE=3 SV=1, Branchiostoma_belcheri_tr_A0A6P4ZGY5_A0A6P4ZGY5_BRABE tr|A0A6P4ZGY5|A0A6P4ZGY5_BRABE Collagen alpha-6_VI_ chain-like OS=Branchiostoma belcheri OX=7741 GN=LOC109476707 PE=3 SV=1	Morbakka_virulenta_scaffold74.g40.t1 scaffold74.g40.t1
OG0000004	Branchiostoma_belcheri_tr_A0A6P4ZXU6_A0A6P4ZXU6_BRABE tr|A0A6P4ZXU6|A0A6P4ZXU6_BRABE Uncharacterized protein LOC109486587 OS=Branchiostoma belcheri OX=7741 GN=LOC109486587 PE=4 SV=1, Branchiostoma_belcheri_tr_A0A6P5AI24_A0A6P5AI24_BRABE tr|A0A6P5AI24|A0A6P5AI24_BRABE Uncharacterized protein LOC109486543 OS=Branchiostoma belcheri OX=7741 GN=LOC109486543 PE=4 SV=1	Morbakka_virulenta_scaffold502.g1.t1 scaffold502.g1.t1
OG0000004	Branchiostoma_belcheri_tr_A0A6P4YH08_A0A6P4YH08_BRABE tr|A0A6P4YH08|A0A6P4YH08_BRABE G-protein coupled receptor 98-like OS=Branchiostoma belcheri OX=7741 GN=LOC109469625 PE=4 SV=1	Morbakka_virulenta_scaffold55.g36.t1 scaffold55.g36.t1
OG0000004	Branchiostoma_belcheri_tr_A0A6P5AWR8_A0A6P5AWR8_BRABE tr|A0A6P5AWR8|A0A6P5AWR8_BRABE Protocadherin Fat 4-like OS=Branchiostoma belcheri OX=7741 GN=LOC109487846 PE=4 SV=1, Branchiostoma_belcheri_tr_A0A6P5A4R1_A0A6P5A4R1_BRABE tr|A0A6P5A4R1|A0A6P5A4R1_BRABE Protocadherin Fat 4-like OS=Branchiostoma belcheri OX=7741 GN=LOC109485356 PE=4 SV=1	Morbakka_virulenta_scaffold495.g5.t1 scaffold495.g5.t1
OG0000004	Branchiostoma_belcheri_tr_A0A6P4ZEB4_A0A6P4ZEB4_BRABE tr|A0A6P4ZEB4|A0A6P4ZEB4_BRABE Neural-cadherin-like OS=Branchiostoma belcheri OX=7741 GN=LOC109473833 PE=4 SV=1	Morbakka_virulenta_scaffold292.g12.t1 scaffold292.g12.t1
OG0000004	Branchiostoma_belcheri_tr_A0A6P4YI02_A0A6P4YI02_BRABE tr|A0A6P4YI02|A0A6P4YI02_BRABE Protocadherin Fat 1-like isoform X3 OS=Branchiostoma belcheri OX=7741 GN=LOC109467873 PE=4 SV=1, Branchiostoma_belcheri_tr_A0A6P4YAP5_A0A6P4YAP5_BRABE tr|A0A6P4YAP5|A0A6P4YAP5_BRABE Protocadherin Fat 1-like isoform X2 OS=Branchiostoma belcheri OX=7741 GN=LOC109467873 PE=4 SV=1, Branchiostoma_belcheri_tr_A0A6P4YSB6_A0A6P4YSB6_BRABE tr|A0A6P4YSB6|A0A6P4YSB6_BRABE Protocadherin Fat 1-like isoform X1 OS=Branchiostoma belcheri OX=7741 GN=LOC109467873 PE=4 SV=1	Morbakka_virulenta_scaffold86.g35.t1 scaffold86.g35.t1
OG0000004	Branchiostoma_belcheri_tr_A0A6P5ADV5_A0A6P5ADV5_BRABE tr|A0A6P5ADV5|A0A6P5ADV5_BRABE Uncharacterized protein LOC109481803 OS=Branchiostoma belcheri OX=7741 GN=LOC109481803 PE=4 SV=1	Morbakka_virulenta_scaffold1.g67.t2 scaffold1.g67.t2, Morbakka_virulenta_scaffold152.g33.t1 scaffold152.g33.t1, Morbakka_virulenta_scaffold152.g33.t2 scaffold152.g33.t2, Morbakka_virulenta_scaffold1.g56.t1 scaffold1.g56.t1, Morbakka_virulenta_scaffold1.g66.t1 scaffold1.g66.t1, Morbakka_virulenta_scaffold1.g59.t1 scaffold1.g59.t1, Morbakka_virulenta_scaffold1.g57.t1 scaffold1.g57.t1
OG0000005	Branchiostoma_belcheri_tr_A0A6P5ABT0_A0A6P5ABT0_BRABE tr|A0A6P5ABT0|A0A6P5ABT0_BRABE Metalloendopeptidase OS=Branchiostoma belcheri OX=7741 GN=LOC109481187 PE=4 SV=1	Morbakka_virulenta_scaffold177.g27.t1 scaffold177.g27.t1
OG0000005	Branchiostoma_belcheri_tr_A0A6P5AEI0_A0A6P5AEI0_BRABE tr|A0A6P5AEI0|A0A6P5AEI0_BRABE Metalloendopeptidase OS=Branchiostoma belcheri OX=7741 GN=LOC109481999 PE=4 SV=1, Branchiostoma_belcheri_tr_A0A6P4ZQ43_A0A6P4ZQ43_BRABE tr|A0A6P4ZQ43|A0A6P4ZQ43_BRABE Metalloendopeptidase OS=Branchiostoma belcheri OX=7741 GN=LOC109476538 PE=4 SV=1	Morbakka_virulenta_scaffold14.g118.t1 scaffold14.g118.t1, Morbakka_virulenta_scaffold14.g118.t2 scaffold14.g118.t2, Morbakka_virulenta_scaffold14.g119.t1 scaffold14.g119.t1, Morbakka_virulenta_scaffold393.g3.t1 scaffold393.g3.t1, Morbakka_virulenta_scaffold393.g2.t1 scaffold393.g2.t1
OG0000005	Branchiostoma_belcheri_tr_A0A6P4ZP12_A0A6P4ZP12_BRABE tr|A0A6P4ZP12|A0A6P4ZP12_BRABE Metalloendopeptidase OS=Branchiostoma belcheri OX=7741 GN=LOC109484132 PE=4 SV=1, Branchiostoma_belcheri_tr_A0A6P5ALI5_A0A6P5ALI5_BRABE tr|A0A6P5ALI5|A0A6P5ALI5_BRABE Metalloendopeptidase OS=Branchiostoma belcheri OX=7741 GN=LOC109484132 PE=4 SV=1, Branchiostoma_belcheri_tr_A0A6P4ZIN2_A0A6P4ZIN2_BRABE tr|A0A6P4ZIN2|A0A6P4ZIN2_BRABE Metalloendopeptidase OS=Branchiostoma belcheri OX=7741 GN=LOC109482697 PE=4 SV=1	Morbakka_virulenta_scaffold159.g55.t1 scaffold159.g55.t1, Morbakka_virulenta_scaffold421.g6.t1 scaffold421.g6.t1, Morbakka_virulenta_scaffold421.g6.t2 scaffold421.g6.t2, Morbakka_virulenta_scaffold421.g14.t1 scaffold421.g14.t1, Morbakka_virulenta_scaffold159.g56.t1 scaffold159.g56.t1, Morbakka_virulenta_scaffold10.g74.t2 scaffold10.g74.t2, Morbakka_virulenta_scaffold10.g74.t1 scaffold10.g74.t1
OG0000005	Branchiostoma_belcheri_tr_A0A6P4ZTV7_A0A6P4ZTV7_BRABE tr|A0A6P4ZTV7|A0A6P4ZTV7_BRABE Metalloendopeptidase OS=Branchiostoma belcheri OX=7741 GN=LOC109485440 PE=4 SV=1	Morbakka_virulenta_scaffold31.g31.t1 scaffold31.g31.t1
OG0000005	Branchiostoma_belcheri_tr_A0A6P4ZTB9_A0A6P4ZTB9_BRABE tr|A0A6P4ZTB9|A0A6P4ZTB9_BRABE Metalloendopeptidase OS=Branchiostoma belcheri OX=7741 GN=LOC109481933 PE=4 SV=1, Branchiostoma_belcheri_tr_A0A6P5A4R6_A0A6P5A4R6_BRABE tr|A0A6P5A4R6|A0A6P5A4R6_BRABE Metalloendopeptidase OS=Branchiostoma belcheri OX=7741 GN=LOC109479257 PE=4 SV=1	Morbakka_virulenta_scaffold376.g5.t1 scaffold376.g5.t1
OG0000006	Branchiostoma_belcheri_tr_A0A6P4YNL3_A0A6P4YNL3_BRABE tr|A0A6P4YNL3|A0A6P4YNL3_BRABE Sushi domain-containing protein 4-like OS=Branchiostoma belcheri OX=7741 GN=LOC109474991 PE=4 SV=1	Morbakka_virulenta_scaffold93.g18.t1 scaffold93.g18.t1
OG0000006	Branchiostoma_belcheri_tr_A0A6P4Y1X8_A0A6P4Y1X8_BRABE tr|A0A6P4Y1X8|A0A6P4Y1X8_BRABE Sushi_ von Willebrand factor type A_ EGF and pentraxin domain-containing protein 1-like OS=Branchiostoma belcheri OX=7741 GN=LOC109464005 PE=3 SV=1	Morbakka_virulenta_scaffold315.g6.t1 scaffold315.g6.t1
