Orthogroup	Chordata_Amphioxiformes_Branchiostoma_belcheri	Cnidaria_Cubozoa_Morbakka_virulenta
OG0000013	Branchiostoma_belcheri_tr_A0A6P4YHP8_A0A6P4YHP8_BRABE tr|A0A6P4YHP8|A0A6P4YHP8_BRABE Protein Wnt OS=Branchiostoma belcheri OX=7741 GN=LOC109465440 PE=3 SV=1, Branchiostoma_belcheri_tr_A0A6P4XNN2_A0A6P4XNN2_BRABE tr|A0A6P4XNN2|A0A6P4XNN2_BRABE Protein Wnt OS=Branchiostoma belcheri OX=7741 GN=LOC109465440 PE=3 SV=1, Branchiostoma_belcheri_tr_A0A6P4Y1D8_A0A6P4Y1D8_BRABE tr|A0A6P4Y1D8|A0A6P4Y1D8_BRABE Protein Wnt OS=Branchiostoma belcheri OX=7741 GN=LOC109465440 PE=3 SV=1, Branchiostoma_belcheri_tr_A0A6P4YMB1_A0A6P4YMB1_BRABE tr|A0A6P4YMB1|A0A6P4YMB1_BRABE Protein Wnt OS=Branchiostoma belcheri OX=7741 GN=LOC109465440 PE=3 SV=1, Branchiostoma_belcheri_tr_A0A6P4YMA7_A0A6P4YMA7_BRABE tr|A0A6P4YMA7|A0A6P4YMA7_BRABE Protein Wnt OS=Branchiostoma belcheri OX=7741 GN=LOC109465440 PE=3 SV=1, Branchiostoma_belcheri_tr_A0A6P4Y7G4_A0A6P4Y7G4_BRABE tr|A0A6P4Y7G4|A0A6P4Y7G4_BRABE Protein Wnt OS=Branchiostoma belcheri OX=7741 GN=LOC109465440 PE=3 SV=1, Branchiostoma_belcheri_tr_A0A6P4XNM7_A0A6P4XNM7_BRABE tr|A0A6P4XNM7|A0A6P4XNM7_BRABE Protein Wnt OS=Branchiostoma belcheri OX=7741 GN=LOC109465440 PE=3 SV=1, Branchiostoma_belcheri_tr_A0A6P4YHP4_A0A6P4YHP4_BRABE tr|A0A6P4YHP4|A0A6P4YHP4_BRABE Protein Wnt OS=Branchiostoma belcheri OX=7741 GN=LOC109465440 PE=3 SV=1, Branchiostoma_belcheri_tr_A0A6P4Y1D1_A0A6P4Y1D1_BRABE tr|A0A6P4Y1D1|A0A6P4Y1D1_BRABE Protein Wnt OS=Branchiostoma belcheri OX=7741 GN=LOC109465440 PE=3 SV=1, Branchiostoma_belcheri_tr_A0A6P4YMA2_A0A6P4YMA2_BRABE tr|A0A6P4YMA2|A0A6P4YMA2_BRABE Protein Wnt OS=Branchiostoma belcheri OX=7741 GN=LOC109465440 PE=3 SV=1, Branchiostoma_belcheri_tr_A0A6P4XNN7_A0A6P4XNN7_BRABE tr|A0A6P4XNN7|A0A6P4XNN7_BRABE Protein Wnt OS=Branchiostoma belcheri OX=7741 GN=LOC109465440 PE=3 SV=1	Morbakka_virulenta_scaffold120.g22.t1 scaffold120.g22.t1
OG0000013	Branchiostoma_belcheri_tr_A0A6P4YHN4_A0A6P4YHN4_BRABE tr|A0A6P4YHN4|A0A6P4YHN4_BRABE Protein Wnt OS=Branchiostoma belcheri OX=7741 GN=LOC109465431 PE=3 SV=1	Morbakka_virulenta_scaffold120.g23.t2 scaffold120.g23.t2, Morbakka_virulenta_scaffold1708.g1.t1 scaffold1708.g1.t1, Morbakka_virulenta_scaffold120.g23.t1 scaffold120.g23.t1
OG0000013	Branchiostoma_belcheri_tr_A0A6P4XMY0_A0A6P4XMY0_BRABE tr|A0A6P4XMY0|A0A6P4XMY0_BRABE Protein Wnt OS=Branchiostoma belcheri OX=7741 GN=LOC109465267 PE=3 SV=1, Branchiostoma_belcheri_tr_A0A6P4YLJ3_A0A6P4YLJ3_BRABE tr|A0A6P4YLJ3|A0A6P4YLJ3_BRABE Protein Wnt OS=Branchiostoma belcheri OX=7741 GN=LOC109465267 PE=3 SV=1	Morbakka_virulenta_scaffold3.g1.t1 scaffold3.g1.t1
OG0000013	Branchiostoma_belcheri_tr_A0A6P5AIC6_A0A6P5AIC6_BRABE tr|A0A6P5AIC6|A0A6P5AIC6_BRABE Protein Wnt OS=Branchiostoma belcheri OX=7741 GN=LOC109484151 PE=3 SV=1	Morbakka_virulenta_scaffold426.g7.t1 scaffold426.g7.t1
OG0000013	Branchiostoma_belcheri_tr_A0A6P4Y3L5_A0A6P4Y3L5_BRABE tr|A0A6P4Y3L5|A0A6P4Y3L5_BRABE Protein Wnt OS=Branchiostoma belcheri OX=7741 GN=LOC109464459 PE=3 SV=1	Morbakka_virulenta_scaffold18.g46.t1 scaffold18.g46.t1, Morbakka_virulenta_scaffold18.g51.t1 scaffold18.g51.t1
OG0000013	Branchiostoma_belcheri_tr_A0A6P4ZTM3_A0A6P4ZTM3_BRABE tr|A0A6P4ZTM3|A0A6P4ZTM3_BRABE Protein Wnt OS=Branchiostoma belcheri OX=7741 GN=LOC109477463 PE=3 SV=1	Morbakka_virulenta_scaffold12.g86.t1 scaffold12.g86.t1
OG0000013	Branchiostoma_belcheri_tr_A0A6P4ZF84_A0A6P4ZF84_BRABE tr|A0A6P4ZF84|A0A6P4ZF84_BRABE Protein Wnt OS=Branchiostoma belcheri OX=7741 GN=LOC109478337 PE=3 SV=1, Branchiostoma_belcheri_tr_A0A6P4Z1G2_A0A6P4Z1G2_BRABE tr|A0A6P4Z1G2|A0A6P4Z1G2_BRABE Protein Wnt OS=Branchiostoma belcheri OX=7741 GN=LOC109478337 PE=3 SV=1, Branchiostoma_belcheri_tr_A0A6P4ZWS5_A0A6P4ZWS5_BRABE tr|A0A6P4ZWS5|A0A6P4ZWS5_BRABE Protein Wnt OS=Branchiostoma belcheri OX=7741 GN=LOC109478337 PE=3 SV=1, Branchiostoma_belcheri_tr_A0A6P4ZN33_A0A6P4ZN33_BRABE tr|A0A6P4ZN33|A0A6P4ZN33_BRABE Protein Wnt OS=Branchiostoma belcheri OX=7741 GN=LOC109478337 PE=3 SV=1, Branchiostoma_belcheri_tr_A0A6P4ZF79_A0A6P4ZF79_BRABE tr|A0A6P4ZF79|A0A6P4ZF79_BRABE Protein Wnt OS=Branchiostoma belcheri OX=7741 GN=LOC109478337 PE=3 SV=1	Morbakka_virulenta_scaffold536.g7.t1 scaffold536.g7.t1
OG0000014	Branchiostoma_belcheri_tr_A0A6P4YM63_A0A6P4YM63_BRABE tr|A0A6P4YM63|A0A6P4YM63_BRABE ADAMTS-like protein 2 OS=Branchiostoma belcheri OX=7741 GN=LOC109474657 PE=4 SV=1, Branchiostoma_belcheri_tr_A0A6P4YH70_A0A6P4YH70_BRABE tr|A0A6P4YH70|A0A6P4YH70_BRABE Thrombospondin type-1 domain-containing protein 4-like isoform X4 OS=Branchiostoma belcheri OX=7741 GN=LOC109469672 PE=4 SV=1, Branchiostoma_belcheri_tr_A0A6P4YQ13_A0A6P4YQ13_BRABE tr|A0A6P4YQ13|A0A6P4YQ13_BRABE Thrombospondin type-1 domain-containing protein 4-like isoform X1 OS=Branchiostoma belcheri OX=7741 GN=LOC109469672 PE=4 SV=1, Branchiostoma_belcheri_tr_A0A6P4Y425_A0A6P4Y425_BRABE tr|A0A6P4Y425|A0A6P4Y425_BRABE Thrombospondin type-1 domain-containing protein 4-like isoform X2 OS=Branchiostoma belcheri OX=7741 GN=LOC109469672 PE=4 SV=1, Branchiostoma_belcheri_tr_A0A6P4Z2I5_A0A6P4Z2I5_BRABE tr|A0A6P4Z2I5|A0A6P4Z2I5_BRABE Thrombospondin type-1 domain-containing protein 4-like isoform X3 OS=Branchiostoma belcheri OX=7741 GN=LOC109469672 PE=4 SV=1	Morbakka_virulenta_scaffold67.g21.t1 scaffold67.g21.t1
OG0000014	Branchiostoma_belcheri_tr_A0A6P5ACX3_A0A6P5ACX3_BRABE tr|A0A6P5ACX3|A0A6P5ACX3_BRABE LOW QUALITY PROTEIN_ A disintegrin and metalloproteinase with thrombospondin motifs 12-like OS=Branchiostoma belcheri OX=7741 GN=LOC109485153 PE=4 SV=1	Morbakka_virulenta_scaffold2.g203.t4 scaffold2.g203.t4, Morbakka_virulenta_scaffold2.g203.t2 scaffold2.g203.t2, Morbakka_virulenta_scaffold2.g203.t3 scaffold2.g203.t3, Morbakka_virulenta_scaffold2.g203.t1 scaffold2.g203.t1
OG0000014	Branchiostoma_belcheri_tr_A0A6P4ZGZ8_A0A6P4ZGZ8_BRABE tr|A0A6P4ZGZ8|A0A6P4ZGZ8_BRABE LOW QUALITY PROTEIN_ papilin-like OS=Branchiostoma belcheri OX=7741 GN=LOC109482249 PE=4 SV=1	Morbakka_virulenta_scaffold105.g40.t1 scaffold105.g40.t1
OG0000014	Branchiostoma_belcheri_tr_A0A6P4ZJ53_A0A6P4ZJ53_BRABE tr|A0A6P4ZJ53|A0A6P4ZJ53_BRABE A disintegrin and metalloproteinase with thrombospondin motifs 9-like isoform X2 OS=Branchiostoma belcheri OX=7741 GN=LOC109477323 PE=4 SV=1, Branchiostoma_belcheri_tr_A0A6P4ZBN8_A0A6P4ZBN8_BRABE tr|A0A6P4ZBN8|A0A6P4ZBN8_BRABE A disintegrin and metalloproteinase with thrombospondin motifs 9-like isoform X1 OS=Branchiostoma belcheri OX=7741 GN=LOC109477323 PE=4 SV=1, Branchiostoma_belcheri_tr_A0A6P4YXJ1_A0A6P4YXJ1_BRABE tr|A0A6P4YXJ1|A0A6P4YXJ1_BRABE A disintegrin and metalloproteinase with thrombospondin motifs 9-like isoform X3 OS=Branchiostoma belcheri OX=7741 GN=LOC109477323 PE=4 SV=1, Branchiostoma_belcheri_tr_A0A6P4ZA21_A0A6P4ZA21_BRABE tr|A0A6P4ZA21|A0A6P4ZA21_BRABE A disintegrin and metalloproteinase with thrombospondin motifs 9-like OS=Branchiostoma belcheri OX=7741 GN=LOC109476941 PE=4 SV=1	Morbakka_virulenta_scaffold269.g24.t1 scaffold269.g24.t1
OG0000015	Branchiostoma_belcheri_tr_A0A6P4Z7Q7_A0A6P4Z7Q7_BRABE tr|A0A6P4Z7Q7|A0A6P4Z7Q7_BRABE Deleted in malignant brain tumors 1 protein-like OS=Branchiostoma belcheri OX=7741 GN=LOC109476236 PE=4 SV=1, Branchiostoma_belcheri_tr_A0A6P5A590_A0A6P5A590_BRABE tr|A0A6P5A590|A0A6P5A590_BRABE Uncharacterized protein LOC109479418 OS=Branchiostoma belcheri OX=7741 GN=LOC109479418 PE=4 SV=1, Branchiostoma_belcheri_tr_A0A6P4ZNT9_A0A6P4ZNT9_BRABE tr|A0A6P4ZNT9|A0A6P4ZNT9_BRABE Uncharacterized protein LOC109476248 OS=Branchiostoma belcheri OX=7741 GN=LOC109476248 PE=4 SV=1, Branchiostoma_belcheri_tr_A0A6P4YUD7_A0A6P4YUD7_BRABE tr|A0A6P4YUD7|A0A6P4YUD7_BRABE Uncharacterized protein LOC109476511 isoform X1 OS=Branchiostoma belcheri OX=7741 GN=LOC109476511 PE=4 SV=1, Branchiostoma_belcheri_tr_A0A6P4ZTW8_A0A6P4ZTW8_BRABE tr|A0A6P4ZTW8|A0A6P4ZTW8_BRABE Uncharacterized protein LOC109476511 isoform X2 OS=Branchiostoma belcheri OX=7741 GN=LOC109476511 PE=4 SV=1, Branchiostoma_belcheri_tr_A0A6P4ZPZ5_A0A6P4ZPZ5_BRABE tr|A0A6P4ZPZ5|A0A6P4ZPZ5_BRABE ZP domain-containing protein-like isoform X3 OS=Branchiostoma belcheri OX=7741 GN=LOC109476511 PE=4 SV=1, Branchiostoma_belcheri_tr_A0A6P4Y8Z5_A0A6P4Y8Z5_BRABE tr|A0A6P4Y8Z5|A0A6P4Y8Z5_BRABE LOW QUALITY PROTEIN_ uncharacterized protein LOC109465776 OS=Branchiostoma belcheri OX=7741 GN=LOC109465776 PE=4 SV=1, Branchiostoma_belcheri_tr_A0A6P4ZU84_A0A6P4ZU84_BRABE tr|A0A6P4ZU84|A0A6P4ZU84_BRABE Uncharacterized protein LOC109477602 OS=Branchiostoma belcheri OX=7741 GN=LOC109477602 PE=4 SV=1, Branchiostoma_belcheri_tr_A0A6P4XCV1_A0A6P4XCV1_BRABE tr|A0A6P4XCV1|A0A6P4XCV1_BRABE Uncharacterized protein LOC109462269 OS=Branchiostoma belcheri OX=7741 GN=LOC109462269 PE=4 SV=1, Branchiostoma_belcheri_tr_A0A6P4XUY1_A0A6P4XUY1_BRABE tr|A0A6P4XUY1|A0A6P4XUY1_BRABE Uncharacterized protein LOC109462332 OS=Branchiostoma belcheri OX=7741 GN=LOC109462332 PE=4 SV=1, Branchiostoma_belcheri_tr_A0A6P4XZJ5_A0A6P4XZJ5_BRABE tr|A0A6P4XZJ5|A0A6P4XZJ5_BRABE CUB and zona pellucida-like domain-containing protein 1 OS=Branchiostoma belcheri OX=7741 GN=LOC109468249 PE=4 SV=1, Branchiostoma_belcheri_tr_A0A6P4ZHC8_A0A6P4ZHC8_BRABE tr|A0A6P4ZHC8|A0A6P4ZHC8_BRABE Uncharacterized protein LOC109482347 OS=Branchiostoma belcheri OX=7741 GN=LOC109482347 PE=4 SV=1, Branchiostoma_belcheri_tr_A0A6P4YF61_A0A6P4YF61_BRABE tr|A0A6P4YF61|A0A6P4YF61_BRABE Deleted in malignant brain tumors 1 protein-like OS=Branchiostoma belcheri OX=7741 GN=LOC109472523 PE=4 SV=1	Morbakka_virulenta_scaffold70.g1.t1 scaffold70.g1.t1
OG0000016	Branchiostoma_belcheri_tr_A0A6P4ZKT6_A0A6P4ZKT6_BRABE tr|A0A6P4ZKT6|A0A6P4ZKT6_BRABE Stromelysin-2-like OS=Branchiostoma belcheri OX=7741 GN=LOC109483262 PE=3 SV=1, Branchiostoma_belcheri_tr_A0A6P4ZHX6_A0A6P4ZHX6_BRABE tr|A0A6P4ZHX6|A0A6P4ZHX6_BRABE Stromelysin-1-like OS=Branchiostoma belcheri OX=7741 GN=LOC109482489 PE=3 SV=1, Branchiostoma_belcheri_tr_A0A6P4Z8R5_A0A6P4Z8R5_BRABE tr|A0A6P4Z8R5|A0A6P4Z8R5_BRABE Matrix metalloproteinase-9-like OS=Branchiostoma belcheri OX=7741 GN=LOC109474420 PE=3 SV=1, Branchiostoma_belcheri_tr_A0A6P4Y5L7_A0A6P4Y5L7_BRABE tr|A0A6P4Y5L7|A0A6P4Y5L7_BRABE Uncharacterized protein LOC109461959 OS=Branchiostoma belcheri OX=7741 GN=LOC109461959 PE=3 SV=1, Branchiostoma_belcheri_tr_A0A6P4XTS6_A0A6P4XTS6_BRABE tr|A0A6P4XTS6|A0A6P4XTS6_BRABE Matrix metalloproteinase-18-like OS=Branchiostoma belcheri OX=7741 GN=LOC109462004 PE=3 SV=1	Morbakka_virulenta_scaffold592.g1.t1 scaffold592.g1.t1
OG0000017	Branchiostoma_belcheri_tr_A0A6P5AJR0_A0A6P5AJR0_BRABE tr|A0A6P5AJR0|A0A6P5AJR0_BRABE Uncharacterized protein LOC109484493 OS=Branchiostoma belcheri OX=7741 GN=LOC109484493 PE=3 SV=1	Morbakka_virulenta_scaffold66.g59.t1 scaffold66.g59.t1, Morbakka_virulenta_scaffold259.g30.t1 scaffold259.g30.t1, Morbakka_virulenta_scaffold259.g31.t1 scaffold259.g31.t1, Morbakka_virulenta_scaffold237.g10.t1 scaffold237.g10.t1
OG0000018	Branchiostoma_belcheri_tr_A0A6P4ZYS2_A0A6P4ZYS2_BRABE tr|A0A6P4ZYS2|A0A6P4ZYS2_BRABE Lysyl oxidase homolog 4-like isoform X1 OS=Branchiostoma belcheri OX=7741 GN=LOC109486842 PE=3 SV=1, Branchiostoma_belcheri_tr_A0A6P5AWG1_A0A6P5AWG1_BRABE tr|A0A6P5AWG1|A0A6P5AWG1_BRABE Lysyl oxidase homolog 4-like isoform X2 OS=Branchiostoma belcheri OX=7741 GN=LOC109486842 PE=3 SV=1, Branchiostoma_belcheri_tr_A0A6P5AT97_A0A6P5AT97_BRABE tr|A0A6P5AT97|A0A6P5AT97_BRABE Lysyl oxidase homolog 4-like isoform X3 OS=Branchiostoma belcheri OX=7741 GN=LOC109486842 PE=3 SV=1	Morbakka_virulenta_scaffold203.g33.t1 scaffold203.g33.t1, Morbakka_virulenta_scaffold290.g29.t1 scaffold290.g29.t1, Morbakka_virulenta_scaffold290.g29.t2 scaffold290.g29.t2, Morbakka_virulenta_scaffold290.g29.t3 scaffold290.g29.t3
OG0000018	Branchiostoma_belcheri_tr_A0A6P4YTQ3_A0A6P4YTQ3_BRABE tr|A0A6P4YTQ3|A0A6P4YTQ3_BRABE Sortilin-related receptor OS=Branchiostoma belcheri OX=7741 GN=LOC109467145 PE=3 SV=1, Branchiostoma_belcheri_tr_A0A6P4YPP0_A0A6P4YPP0_BRABE tr|A0A6P4YPP0|A0A6P4YPP0_BRABE Sortilin-related receptor OS=Branchiostoma belcheri OX=7741 GN=LOC109467145 PE=3 SV=1	Morbakka_virulenta_scaffold18.g35.t1 scaffold18.g35.t1, Morbakka_virulenta_scaffold18.g35.t2 scaffold18.g35.t2
OG0000019	Branchiostoma_belcheri_tr_A0A6P4ZN64_A0A6P4ZN64_BRABE tr|A0A6P4ZN64|A0A6P4ZN64_BRABE Growth/differentiation factor 8-like OS=Branchiostoma belcheri OX=7741 GN=LOC109476087 PE=3 SV=1	Morbakka_virulenta_scaffold47.g131.t1 scaffold47.g131.t1, Morbakka_virulenta_scaffold455.g5.t1 scaffold455.g5.t1
OG0000019	Branchiostoma_belcheri_tr_A0A6P5A0C8_A0A6P5A0C8_BRABE tr|A0A6P5A0C8|A0A6P5A0C8_BRABE Bone morphogenetic protein 2-like OS=Branchiostoma belcheri OX=7741 GN=LOC109478266 PE=3 SV=1	Morbakka_virulenta_scaffold14.g2.t1 scaffold14.g2.t1, Morbakka_virulenta_scaffold14.g3.t1 scaffold14.g3.t1
OG0000019	Branchiostoma_belcheri_tr_A0A6P4YW57_A0A6P4YW57_BRABE tr|A0A6P4YW57|A0A6P4YW57_BRABE Bone morphogenetic protein 7-like OS=Branchiostoma belcheri OX=7741 GN=LOC109473118 PE=3 SV=1	Morbakka_virulenta_scaffold135.g49.t1 scaffold135.g49.t1
OG0000019	Branchiostoma_belcheri_tr_A0A6P4ZTT2_A0A6P4ZTT2_BRABE tr|A0A6P4ZTT2|A0A6P4ZTT2_BRABE Uncharacterized protein LOC109477517 OS=Branchiostoma belcheri OX=7741 GN=LOC109477517 PE=3 SV=1, Branchiostoma_belcheri_tr_A0A6P4YT30_A0A6P4YT30_BRABE tr|A0A6P4YT30|A0A6P4YT30_BRABE Bone morphogenetic protein 6-like OS=Branchiostoma belcheri OX=7741 GN=LOC109476129 PE=3 SV=1, Branchiostoma_belcheri_tr_A0A6P5ABX2_A0A6P5ABX2_BRABE tr|A0A6P5ABX2|A0A6P5ABX2_BRABE Bone morphogenetic protein 2-like OS=Branchiostoma belcheri OX=7741 GN=LOC109482544 PE=3 SV=1, Branchiostoma_belcheri_tr_A0A6P5A3G1_A0A6P5A3G1_BRABE tr|A0A6P5A3G1|A0A6P5A3G1_BRABE LOW QUALITY PROTEIN_ protein DVR-1-like OS=Branchiostoma belcheri OX=7741 GN=LOC109482546 PE=3 SV=1	Morbakka_virulenta_scaffold7.g3.t1 scaffold7.g3.t1
OG0000019	Branchiostoma_belcheri_tr_A0A6P4Z5G7_A0A6P4Z5G7_BRABE tr|A0A6P4Z5G7|A0A6P4Z5G7_BRABE Growth/differentiation factor 5-like OS=Branchiostoma belcheri OX=7741 GN=LOC109473658 PE=3 SV=1, Branchiostoma_belcheri_tr_A0A6P4ZRR9_A0A6P4ZRR9_BRABE tr|A0A6P4ZRR9|A0A6P4ZRR9_BRABE Bone morphogenetic protein 3-like isoform X1 OS=Branchiostoma belcheri OX=7741 GN=LOC109481417 PE=3 SV=1	Morbakka_virulenta_scaffold36.g28.t1 scaffold36.g28.t1
OG0000020	Branchiostoma_belcheri_tr_A0A6P4ZRC9_A0A6P4ZRC9_BRABE tr|A0A6P4ZRC9|A0A6P4ZRC9_BRABE Collagen alpha-1_I_ chain-like isoform X3 OS=Branchiostoma belcheri OX=7741 GN=LOC109475829 PE=4 SV=1, Branchiostoma_belcheri_tr_A0A6P4YRU8_A0A6P4YRU8_BRABE tr|A0A6P4YRU8|A0A6P4YRU8_BRABE Collagen alpha-1_I_ chain-like isoform X2 OS=Branchiostoma belcheri OX=7741 GN=LOC109475829 PE=4 SV=1, Branchiostoma_belcheri_tr_A0A6P4ZE62_A0A6P4ZE62_BRABE tr|A0A6P4ZE62|A0A6P4ZE62_BRABE Collagen alpha-1_I_ chain-like isoform X1 OS=Branchiostoma belcheri OX=7741 GN=LOC109475829 PE=4 SV=1, Branchiostoma_belcheri_tr_A0A6P4ZM83_A0A6P4ZM83_BRABE tr|A0A6P4ZM83|A0A6P4ZM83_BRABE Collagen alpha-1_I_ chain-like isoform X4 OS=Branchiostoma belcheri OX=7741 GN=LOC109475829 PE=4 SV=1, Branchiostoma_belcheri_tr_A0A6P4ZE66_A0A6P4ZE66_BRABE tr|A0A6P4ZE66|A0A6P4ZE66_BRABE Collagen alpha-1_I_ chain-like isoform X6 OS=Branchiostoma belcheri OX=7741 GN=LOC109475829 PE=4 SV=1, Branchiostoma_belcheri_tr_A0A6P4ZRD5_A0A6P4ZRD5_BRABE tr|A0A6P4ZRD5|A0A6P4ZRD5_BRABE Collagen alpha-1_I_ chain-like isoform X8 OS=Branchiostoma belcheri OX=7741 GN=LOC109475829 PE=4 SV=1, Branchiostoma_belcheri_tr_A0A6P4Z6C1_A0A6P4Z6C1_BRABE tr|A0A6P4Z6C1|A0A6P4Z6C1_BRABE Collagen alpha-1_I_ chain-like isoform X5 OS=Branchiostoma belcheri OX=7741 GN=LOC109475829 PE=4 SV=1, Branchiostoma_belcheri_tr_A0A6P4YRV3_A0A6P4YRV3_BRABE tr|A0A6P4YRV3|A0A6P4YRV3_BRABE Collagen alpha-1_I_ chain-like isoform X7 OS=Branchiostoma belcheri OX=7741 GN=LOC109475829 PE=4 SV=1	Morbakka_virulenta_scaffold39.g96.t1 scaffold39.g96.t1, Morbakka_virulenta_scaffold131.g48.t3 scaffold131.g48.t3, Morbakka_virulenta_scaffold131.g48.t2 scaffold131.g48.t2, Morbakka_virulenta_scaffold131.g48.t1 scaffold131.g48.t1, Morbakka_virulenta_scaffold461.g6.t1 scaffold461.g6.t1, Morbakka_virulenta_scaffold461.g6.t2 scaffold461.g6.t2
OG0000021	Branchiostoma_belcheri_tr_A0A6P4Z4K6_A0A6P4Z4K6_BRABE tr|A0A6P4Z4K6|A0A6P4Z4K6_BRABE Neurogenic locus notch homolog protein 2-like isoform X4 OS=Branchiostoma belcheri OX=7741 GN=LOC109470172 PE=4 SV=1, Branchiostoma_belcheri_tr_A0A6P4Z0E6_A0A6P4Z0E6_BRABE tr|A0A6P4Z0E6|A0A6P4Z0E6_BRABE Fibrillin-2-like isoform X5 OS=Branchiostoma belcheri OX=7741 GN=LOC109470172 PE=4 SV=1, Branchiostoma_belcheri_tr_A0A6P4Y665_A0A6P4Y665_BRABE tr|A0A6P4Y665|A0A6P4Y665_BRABE Fibrillin-2-like isoform X3 OS=Branchiostoma belcheri OX=7741 GN=LOC109470172 PE=4 SV=1, Branchiostoma_belcheri_tr_A0A6P4YJ96_A0A6P4YJ96_BRABE tr|A0A6P4YJ96|A0A6P4YJ96_BRABE Fibrillin-2-like isoform X1 OS=Branchiostoma belcheri OX=7741 GN=LOC109470172 PE=4 SV=1, Branchiostoma_belcheri_tr_A0A6P4YS24_A0A6P4YS24_BRABE tr|A0A6P4YS24|A0A6P4YS24_BRABE Fibrillin-2-like isoform X2 OS=Branchiostoma belcheri OX=7741 GN=LOC109470172 PE=4 SV=1, Branchiostoma_belcheri_tr_A0A6P4Z4L6_A0A6P4Z4L6_BRABE tr|A0A6P4Z4L6|A0A6P4Z4L6_BRABE Fibrillin-2-like isoform X12 OS=Branchiostoma belcheri OX=7741 GN=LOC109470172 PE=4 SV=1, Branchiostoma_belcheri_tr_A0A6P4Z4L1_A0A6P4Z4L1_BRABE tr|A0A6P4Z4L1|A0A6P4Z4L1_BRABE Neurogenic locus notch homolog protein 1-like isoform X8 OS=Branchiostoma belcheri OX=7741 GN=LOC109470172 PE=4 SV=1, Branchiostoma_belcheri_tr_A0A6P4YJA4_A0A6P4YJA4_BRABE tr|A0A6P4YJA4|A0A6P4YJA4_BRABE Fibrillin-2-like isoform X9 OS=Branchiostoma belcheri OX=7741 GN=LOC109470172 PE=4 SV=1, Branchiostoma_belcheri_tr_A0A6P4Y679_A0A6P4Y679_BRABE tr|A0A6P4Y679|A0A6P4Y679_BRABE Fibrillin-2-like isoform X16 OS=Branchiostoma belcheri OX=7741 GN=LOC109470172 PE=4 SV=1, Branchiostoma_belcheri_tr_A0A6P4Y684_A0A6P4Y684_BRABE tr|A0A6P4Y684|A0A6P4Y684_BRABE Fibrillin-2-like isoform X21 OS=Branchiostoma belcheri OX=7741 GN=LOC109470172 PE=4 SV=1, Branchiostoma_belcheri_tr_A0A6P4YS53_A0A6P4YS53_BRABE tr|A0A6P4YS53|A0A6P4YS53_BRABE Neurogenic locus notch homolog protein 1-like isoform X24 OS=Branchiostoma belcheri OX=7741 GN=LOC109470172 PE=4 SV=1, Branchiostoma_belcheri_tr_A0A6P4Z0G7_A0A6P4Z0G7_BRABE tr|A0A6P4Z0G7|A0A6P4Z0G7_BRABE Fibrillin-2-like isoform X23 OS=Branchiostoma belcheri OX=7741 GN=LOC109470172 PE=4 SV=1, Branchiostoma_belcheri_tr_A0A6P4YJB0_A0A6P4YJB0_BRABE tr|A0A6P4YJB0|A0A6P4YJB0_BRABE Fibrillin-2-like isoform X14 OS=Branchiostoma belcheri OX=7741 GN=LOC109470172 PE=4 SV=1, Branchiostoma_belcheri_tr_A0A6P4Y675_A0A6P4Y675_BRABE tr|A0A6P4Y675|A0A6P4Y675_BRABE Fibrillin-1-like isoform X11 OS=Branchiostoma belcheri OX=7741 GN=LOC109470172 PE=4 SV=1, Branchiostoma_belcheri_tr_A0A6P4YS38_A0A6P4YS38_BRABE tr|A0A6P4YS38|A0A6P4YS38_BRABE Neurogenic locus notch homolog protein 1-like isoform X10 OS=Branchiostoma belcheri OX=7741 GN=LOC109470172 PE=4 SV=1, Branchiostoma_belcheri_tr_A0A6P4YS43_A0A6P4YS43_BRABE tr|A0A6P4YS43|A0A6P4YS43_BRABE Fibrillin-2-like isoform X15 OS=Branchiostoma belcheri OX=7741 GN=LOC109470172 PE=4 SV=1, Branchiostoma_belcheri_tr_A0A6P4Z0G2_A0A6P4Z0G2_BRABE tr|A0A6P4Z0G2|A0A6P4Z0G2_BRABE Neurogenic locus notch homolog protein 2-like isoform X18 OS=Branchiostoma belcheri OX=7741 GN=LOC109470172 PE=4 SV=1, Branchiostoma_belcheri_tr_A0A6P4Z4M1_A0A6P4Z4M1_BRABE tr|A0A6P4Z4M1|A0A6P4Z4M1_BRABE Neurogenic locus notch homolog protein 2-like isoform X17 OS=Branchiostoma belcheri OX=7741 GN=LOC109470172 PE=4 SV=1, Branchiostoma_belcheri_tr_A0A6P4Z0F6_A0A6P4Z0F6_BRABE tr|A0A6P4Z0F6|A0A6P4Z0F6_BRABE Fibrillin-2-like isoform X13 OS=Branchiostoma belcheri OX=7741 GN=LOC109470172 PE=4 SV=1, Branchiostoma_belcheri_tr_A0A6P4Y669_A0A6P4Y669_BRABE tr|A0A6P4Y669|A0A6P4Y669_BRABE Neurogenic locus notch homolog protein 1-like isoform X7 OS=Branchiostoma belcheri OX=7741 GN=LOC109470172 PE=4 SV=1, Branchiostoma_belcheri_tr_A0A6P4YJA0_A0A6P4YJA0_BRABE tr|A0A6P4YJA0|A0A6P4YJA0_BRABE Fibrillin-2-like isoform X6 OS=Branchiostoma belcheri OX=7741 GN=LOC109470172 PE=4 SV=1, Branchiostoma_belcheri_tr_A0A6P4YJB6_A0A6P4YJB6_BRABE tr|A0A6P4YJB6|A0A6P4YJB6_BRABE Fibrillin-2-like isoform X19 OS=Branchiostoma belcheri OX=7741 GN=LOC109470172 PE=4 SV=1, Branchiostoma_belcheri_tr_A0A6P4Z4M5_A0A6P4Z4M5_BRABE tr|A0A6P4Z4M5|A0A6P4Z4M5_BRABE Fibrillin-1-like isoform X22 OS=Branchiostoma belcheri OX=7741 GN=LOC109470172 PE=4 SV=1, Branchiostoma_belcheri_tr_A0A6P4YS48_A0A6P4YS48_BRABE tr|A0A6P4YS48|A0A6P4YS48_BRABE Neurogenic locus notch homolog protein 2-like isoform X20 OS=Branchiostoma belcheri OX=7741 GN=LOC109470172 PE=4 SV=1, Branchiostoma_belcheri_tr_A0A6P4Y689_A0A6P4Y689_BRABE tr|A0A6P4Y689|A0A6P4Y689_BRABE Nidogen-1-like isoform X25 OS=Branchiostoma belcheri OX=7741 GN=LOC109470172 PE=4 SV=1	Morbakka_virulenta_scaffold66.g10.t1 scaffold66.g10.t1, Morbakka_virulenta_scaffold66.g10.t2 scaffold66.g10.t2
OG0000021	Branchiostoma_belcheri_tr_A0A6P4ZJY5_A0A6P4ZJY5_BRABE tr|A0A6P4ZJY5|A0A6P4ZJY5_BRABE Very low-density lipoprotein receptor-like OS=Branchiostoma belcheri OX=7741 GN=LOC109475237 PE=4 SV=1, Branchiostoma_belcheri_tr_A0A6P5AGP4_A0A6P5AGP4_BRABE tr|A0A6P5AGP4|A0A6P5AGP4_BRABE Very low-density lipoprotein receptor-like OS=Branchiostoma belcheri OX=7741 GN=LOC109486221 PE=4 SV=1	Morbakka_virulenta_scaffold500.g10.t1 scaffold500.g10.t1, Morbakka_virulenta_scaffold49.g15.t1 scaffold49.g15.t1, Morbakka_virulenta_scaffold214.g8.t1 scaffold214.g8.t1
OG0000021	Branchiostoma_belcheri_tr_A0A6P4Z4K2_A0A6P4Z4K2_BRABE tr|A0A6P4Z4K2|A0A6P4Z4K2_BRABE Low-density lipoprotein receptor-related protein 1-like OS=Branchiostoma belcheri OX=7741 GN=LOC109479030 PE=3 SV=1	Morbakka_virulenta_scaffold3.g40.t1 scaffold3.g40.t1, Morbakka_virulenta_scaffold3.g40.t2 scaffold3.g40.t2
OG0000021	Branchiostoma_belcheri_tr_A0A6P5A6E5_A0A6P5A6E5_BRABE tr|A0A6P5A6E5|A0A6P5A6E5_BRABE Prolow-density lipoprotein receptor-related protein 1-like OS=Branchiostoma belcheri OX=7741 GN=LOC109480925 PE=4 SV=1	Morbakka_virulenta_scaffold377.g17.t1 scaffold377.g17.t1, Morbakka_virulenta_scaffold209.g39.t1 scaffold209.g39.t1
OG0000022	Branchiostoma_belcheri_tr_A0A6P5A6P1_A0A6P5A6P1_BRABE tr|A0A6P5A6P1|A0A6P5A6P1_BRABE Annexin OS=Branchiostoma belcheri OX=7741 GN=LOC109485919 PE=3 SV=1	Morbakka_virulenta_scaffold19.g106.t1 scaffold19.g106.t1
OG0000022	Branchiostoma_belcheri_tr_A0A6P4XTC9_A0A6P4XTC9_BRABE tr|A0A6P4XTC9|A0A6P4XTC9_BRABE Annexin OS=Branchiostoma belcheri OX=7741 GN=LOC109466626 PE=3 SV=1	Morbakka_virulenta_scaffold487.g6.t1 scaffold487.g6.t1
OG0000023	Branchiostoma_belcheri_tr_A0A6P4YWU4_A0A6P4YWU4_BRABE tr|A0A6P4YWU4|A0A6P4YWU4_BRABE Disintegrin and metalloproteinase domain-containing protein 12-like OS=Branchiostoma belcheri OX=7741 GN=LOC109471360 PE=4 SV=1, Branchiostoma_belcheri_tr_A0A6P4Z547_A0A6P4Z547_BRABE tr|A0A6P4Z547|A0A6P4Z547_BRABE Disintegrin and metalloproteinase domain-containing protein 12-like OS=Branchiostoma belcheri OX=7741 GN=LOC109471358 PE=4 SV=1, Branchiostoma_belcheri_tr_A0A6P4Y582_A0A6P4Y582_BRABE tr|A0A6P4Y582|A0A6P4Y582_BRABE Disintegrin and metalloproteinase domain-containing protein 11-like isoform X1 OS=Branchiostoma belcheri OX=7741 GN=LOC109461827 PE=4 SV=1, Branchiostoma_belcheri_tr_A0A6P4XT39_A0A6P4XT39_BRABE tr|A0A6P4XT39|A0A6P4XT39_BRABE Disintegrin and metalloproteinase domain-containing protein 11-like isoform X2 OS=Branchiostoma belcheri OX=7741 GN=LOC109461827 PE=4 SV=1	Morbakka_virulenta_scaffold206.g31.t1 scaffold206.g31.t1
OG0000024	Branchiostoma_belcheri_tr_A0A6P4ZMN7_A0A6P4ZMN7_BRABE tr|A0A6P4ZMN7|A0A6P4ZMN7_BRABE Testican-2-like OS=Branchiostoma belcheri OX=7741 GN=LOC109478264 PE=4 SV=1	Morbakka_virulenta_scaffold12.g79.t1 scaffold12.g79.t1
OG0000027	Branchiostoma_belcheri_tr_A0A6P4ZC25_A0A6P4ZC25_BRABE tr|A0A6P4ZC25|A0A6P4ZC25_BRABE Uncharacterized protein LOC109473213 OS=Branchiostoma belcheri OX=7741 GN=LOC109473213 PE=3 SV=1, Branchiostoma_belcheri_tr_A0A6P4YU40_A0A6P4YU40_BRABE tr|A0A6P4YU40|A0A6P4YU40_BRABE LOW QUALITY PROTEIN_ uncharacterized protein LOC109468339 OS=Branchiostoma belcheri OX=7741 GN=LOC109468339 PE=3 SV=1, Branchiostoma_belcheri_tr_A0A6P4ZUS6_A0A6P4ZUS6_BRABE tr|A0A6P4ZUS6|A0A6P4ZUS6_BRABE LOW QUALITY PROTEIN_ uncharacterized protein LOC109482379 OS=Branchiostoma belcheri OX=7741 GN=LOC109482379 PE=4 SV=1, Branchiostoma_belcheri_tr_A0A6P4YIG3_A0A6P4YIG3_BRABE tr|A0A6P4YIG3|A0A6P4YIG3_BRABE Uncharacterized protein LOC109464289 OS=Branchiostoma belcheri OX=7741 GN=LOC109464289 PE=4 SV=1, Branchiostoma_belcheri_tr_A0A6P4YIG7_A0A6P4YIG7_BRABE tr|A0A6P4YIG7|A0A6P4YIG7_BRABE Uncharacterized protein LOC109464300 OS=Branchiostoma belcheri OX=7741 GN=LOC109464300 PE=4 SV=1, Branchiostoma_belcheri_tr_A0A6P5ACV0_A0A6P5ACV0_BRABE tr|A0A6P5ACV0|A0A6P5ACV0_BRABE Uncharacterized protein LOC109481474 OS=Branchiostoma belcheri OX=7741 GN=LOC109481474 PE=4 SV=1, Branchiostoma_belcheri_tr_A0A6P4ZZZ2_A0A6P4ZZZ2_BRABE tr|A0A6P4ZZZ2|A0A6P4ZZZ2_BRABE Fibronectin-like OS=Branchiostoma belcheri OX=7741 GN=LOC109481472 PE=4 SV=1, Branchiostoma_belcheri_tr_A0A6P4YRP1_A0A6P4YRP1_BRABE tr|A0A6P4YRP1|A0A6P4YRP1_BRABE Uncharacterized protein LOC109466591 OS=Branchiostoma belcheri OX=7741 GN=LOC109466591 PE=4 SV=1, Branchiostoma_belcheri_tr_A0A6P4YWQ6_A0A6P4YWQ6_BRABE tr|A0A6P4YWQ6|A0A6P4YWQ6_BRABE Tyrosine-protein phosphatase 10D-like OS=Branchiostoma belcheri OX=7741 GN=LOC109471320 PE=4 SV=1	Morbakka_virulenta_scaffold424.g6.t1 scaffold424.g6.t1
