Orthogroup	Chordata_Amphioxiformes_Branchiostoma_belcheri	Cnidaria_Cubozoa_Morbakka_virulenta
OG0000028	Branchiostoma_belcheri_tr_A0A6P4YE18_A0A6P4YE18_BRABE tr|A0A6P4YE18|A0A6P4YE18_BRABE Collagen alpha-2_IV_ chain-like isoform X1 OS=Branchiostoma belcheri OX=7741 GN=LOC109464461 PE=4 SV=1, Branchiostoma_belcheri_tr_A0A6P4XY10_A0A6P4XY10_BRABE tr|A0A6P4XY10|A0A6P4XY10_BRABE Collagen alpha-5_IV_ chain-like isoform X2 OS=Branchiostoma belcheri OX=7741 GN=LOC109464461 PE=4 SV=1, Branchiostoma_belcheri_tr_A0A6P4Y3L9_A0A6P4Y3L9_BRABE tr|A0A6P4Y3L9|A0A6P4Y3L9_BRABE Collagen alpha-5_IV_ chain-like isoform X3 OS=Branchiostoma belcheri OX=7741 GN=LOC109464461 PE=4 SV=1, Branchiostoma_belcheri_tr_A0A6P4XKD0_A0A6P4XKD0_BRABE tr|A0A6P4XKD0|A0A6P4XKD0_BRABE Collagen alpha-5_IV_ chain-like isoform X4 OS=Branchiostoma belcheri OX=7741 GN=LOC109464461 PE=4 SV=1	Morbakka_virulenta_scaffold9.g62.t1 scaffold9.g62.t1
OG0000028	Branchiostoma_belcheri_tr_A0A6P4Y017_A0A6P4Y017_BRABE tr|A0A6P4Y017|A0A6P4Y017_BRABE Collagen alpha-2_IV_ chain-like OS=Branchiostoma belcheri OX=7741 GN=LOC109468421 PE=4 SV=1, Branchiostoma_belcheri_tr_A0A6P4YUB4_A0A6P4YUB4_BRABE tr|A0A6P4YUB4|A0A6P4YUB4_BRABE Collagen alpha-2_IV_ chain-like OS=Branchiostoma belcheri OX=7741 GN=LOC109468418 PE=4 SV=1, Branchiostoma_belcheri_tr_A0A6P4YCS5_A0A6P4YCS5_BRABE tr|A0A6P4YCS5|A0A6P4YCS5_BRABE Collagen alpha-2_IV_ chain-like OS=Branchiostoma belcheri OX=7741 GN=LOC109468419 PE=4 SV=1, Branchiostoma_belcheri_tr_A0A6P4YKJ9_A0A6P4YKJ9_BRABE tr|A0A6P4YKJ9|A0A6P4YKJ9_BRABE Collagen alpha-2_IV_ chain-like OS=Branchiostoma belcheri OX=7741 GN=LOC109468420 PE=4 SV=1, Branchiostoma_belcheri_tr_A0A6P4YYL0_A0A6P4YYL0_BRABE tr|A0A6P4YYL0|A0A6P4YYL0_BRABE Collagen alpha-5_IV_ chain-like isoform X1 OS=Branchiostoma belcheri OX=7741 GN=LOC109468566 PE=4 SV=1, Branchiostoma_belcheri_tr_A0A6P4YD81_A0A6P4YD81_BRABE tr|A0A6P4YD81|A0A6P4YD81_BRABE Collagen alpha-1_I_ chain-like isoform X3 OS=Branchiostoma belcheri OX=7741 GN=LOC109468566 PE=4 SV=1, Branchiostoma_belcheri_tr_A0A6P4YL15_A0A6P4YL15_BRABE tr|A0A6P4YL15|A0A6P4YL15_BRABE Collagen alpha-1_I_ chain-like isoform X6 OS=Branchiostoma belcheri OX=7741 GN=LOC109468566 PE=4 SV=1, Branchiostoma_belcheri_tr_A0A6P4YUP7_A0A6P4YUP7_BRABE tr|A0A6P4YUP7|A0A6P4YUP7_BRABE Collagen alpha-2_IV_ chain-like isoform X2 OS=Branchiostoma belcheri OX=7741 GN=LOC109468566 PE=4 SV=1, Branchiostoma_belcheri_tr_A0A6P4YL12_A0A6P4YL12_BRABE tr|A0A6P4YL12|A0A6P4YL12_BRABE Collagen alpha-1_I_ chain-like isoform X4 OS=Branchiostoma belcheri OX=7741 GN=LOC109468566 PE=4 SV=1, Branchiostoma_belcheri_tr_A0A6P4YD85_A0A6P4YD85_BRABE tr|A0A6P4YD85|A0A6P4YD85_BRABE Collagen alpha-2_IV_ chain-like isoform X5 OS=Branchiostoma belcheri OX=7741 GN=LOC109468566 PE=4 SV=1, Branchiostoma_belcheri_tr_A0A6P4YDB6_A0A6P4YDB6_BRABE tr|A0A6P4YDB6|A0A6P4YDB6_BRABE Collagen alpha-2_IV_ chain-like isoform X1 OS=Branchiostoma belcheri OX=7741 GN=LOC109468578 PE=4 SV=1, Branchiostoma_belcheri_tr_A0A6P4YDC0_A0A6P4YDC0_BRABE tr|A0A6P4YDC0|A0A6P4YDC0_BRABE Collagen alpha-3_IV_ chain-like isoform X5 OS=Branchiostoma belcheri OX=7741 GN=LOC109468578 PE=4 SV=1, Branchiostoma_belcheri_tr_A0A6P4YUT0_A0A6P4YUT0_BRABE tr|A0A6P4YUT0|A0A6P4YUT0_BRABE Collagen alpha-2_IV_ chain-like isoform X4 OS=Branchiostoma belcheri OX=7741 GN=LOC109468578 PE=4 SV=1, Branchiostoma_belcheri_tr_A0A6P4YL40_A0A6P4YL40_BRABE tr|A0A6P4YL40|A0A6P4YL40_BRABE Collagen alpha-2_IV_ chain-like isoform X2 OS=Branchiostoma belcheri OX=7741 GN=LOC109468578 PE=4 SV=1, Branchiostoma_belcheri_tr_A0A6P4YYP9_A0A6P4YYP9_BRABE tr|A0A6P4YYP9|A0A6P4YYP9_BRABE Collagen alpha-3_IV_ chain-like isoform X3 OS=Branchiostoma belcheri OX=7741 GN=LOC109468578 PE=4 SV=1, Branchiostoma_belcheri_tr_A0A6P4Y8D4_A0A6P4Y8D4_BRABE tr|A0A6P4Y8D4|A0A6P4Y8D4_BRABE Collagen alpha-3_IV_ chain-like OS=Branchiostoma belcheri OX=7741 GN=LOC109462860 PE=4 SV=1, Branchiostoma_belcheri_tr_A0A6P4YH27_A0A6P4YH27_BRABE tr|A0A6P4YH27|A0A6P4YH27_BRABE Collagen alpha-4_IV_ chain-like OS=Branchiostoma belcheri OX=7741 GN=LOC109473114 PE=4 SV=1, Branchiostoma_belcheri_tr_A0A6P4ZQZ2_A0A6P4ZQZ2_BRABE tr|A0A6P4ZQZ2|A0A6P4ZQZ2_BRABE Collagen alpha-1_IV_ chain-like OS=Branchiostoma belcheri OX=7741 GN=LOC109479055 PE=4 SV=1, Branchiostoma_belcheri_tr_A0A6P5A3X6_A0A6P5A3X6_BRABE tr|A0A6P5A3X6|A0A6P5A3X6_BRABE Collagen alpha-5_IV_ chain-like isoform X7 OS=Branchiostoma belcheri OX=7741 GN=LOC109479045 PE=4 SV=1, Branchiostoma_belcheri_tr_A0A6P4ZQV4_A0A6P4ZQV4_BRABE tr|A0A6P4ZQV4|A0A6P4ZQV4_BRABE Collagen alpha-3_IV_ chain-like isoform X5 OS=Branchiostoma belcheri OX=7741 GN=LOC109479045 PE=4 SV=1, Branchiostoma_belcheri_tr_A0A6P4Z4N1_A0A6P4Z4N1_BRABE tr|A0A6P4Z4N1|A0A6P4Z4N1_BRABE Collagen alpha-3_IV_ chain-like isoform X6 OS=Branchiostoma belcheri OX=7741 GN=LOC109479045 PE=4 SV=1, Branchiostoma_belcheri_tr_A0A6P4Z4M6_A0A6P4Z4M6_BRABE tr|A0A6P4Z4M6|A0A6P4Z4M6_BRABE Collagen alpha-4_IV_ chain-like isoform X2 OS=Branchiostoma belcheri OX=7741 GN=LOC109479045 PE=4 SV=1, Branchiostoma_belcheri_tr_A0A6P4ZI43_A0A6P4ZI43_BRABE tr|A0A6P4ZI43|A0A6P4ZI43_BRABE Collagen alpha-1_I_ chain-like isoform X4 OS=Branchiostoma belcheri OX=7741 GN=LOC109479045 PE=4 SV=1, Branchiostoma_belcheri_tr_A0A6P4ZQU9_A0A6P4ZQU9_BRABE tr|A0A6P4ZQU9|A0A6P4ZQU9_BRABE Collagen alpha-4_IV_ chain-like isoform X1 OS=Branchiostoma belcheri OX=7741 GN=LOC109479045 PE=4 SV=1, Branchiostoma_belcheri_tr_A0A6P4ZZR0_A0A6P4ZZR0_BRABE tr|A0A6P4ZZR0|A0A6P4ZZR0_BRABE Collagen alpha-4_IV_ chain-like isoform X3 OS=Branchiostoma belcheri OX=7741 GN=LOC109479045 PE=4 SV=1	Morbakka_virulenta_scaffold9.g59.t2 scaffold9.g59.t2, Morbakka_virulenta_scaffold9.g59.t1 scaffold9.g59.t1
OG0000028	Branchiostoma_belcheri_tr_A0A6P4YKI5_A0A6P4YKI5_BRABE tr|A0A6P4YKI5|A0A6P4YKI5_BRABE Collagen alpha-5_IV_ chain-like OS=Branchiostoma belcheri OX=7741 GN=LOC109474176 PE=4 SV=1, Branchiostoma_belcheri_tr_A0A6P5A6M3_A0A6P5A6M3_BRABE tr|A0A6P5A6M3|A0A6P5A6M3_BRABE Collagen alpha-1_IV_ chain-like OS=Branchiostoma belcheri OX=7741 GN=LOC109483358 PE=4 SV=1, Branchiostoma_belcheri_tr_A0A6P4XQH0_A0A6P4XQH0_BRABE tr|A0A6P4XQH0|A0A6P4XQH0_BRABE Collagen alpha-1_II_ chain-like OS=Branchiostoma belcheri OX=7741 GN=LOC109462270 PE=4 SV=1	Morbakka_virulenta_scaffold9.g60.t5 scaffold9.g60.t5, Morbakka_virulenta_scaffold9.g60.t1 scaffold9.g60.t1, Morbakka_virulenta_scaffold9.g60.t4 scaffold9.g60.t4, Morbakka_virulenta_scaffold9.g60.t3 scaffold9.g60.t3, Morbakka_virulenta_scaffold9.g60.t2 scaffold9.g60.t2
OG0000029	Branchiostoma_belcheri_tr_A0A6P4Z6D9_A0A6P4Z6D9_BRABE tr|A0A6P4Z6D9|A0A6P4Z6D9_BRABE Contactin-associated protein-like 2 isoform X1 OS=Branchiostoma belcheri OX=7741 GN=LOC109475841 PE=3 SV=1, Branchiostoma_belcheri_tr_A0A6P4ZE90_A0A6P4ZE90_BRABE tr|A0A6P4ZE90|A0A6P4ZE90_BRABE Contactin-associated protein-like 2 isoform X2 OS=Branchiostoma belcheri OX=7741 GN=LOC109475841 PE=3 SV=1, Branchiostoma_belcheri_tr_A0A6P4YRX4_A0A6P4YRX4_BRABE tr|A0A6P4YRX4|A0A6P4YRX4_BRABE Contactin-associated protein-like 5 isoform X3 OS=Branchiostoma belcheri OX=7741 GN=LOC109475841 PE=3 SV=1	Morbakka_virulenta_scaffold12.g130.t1 scaffold12.g130.t1
OG0000030	Branchiostoma_belcheri_tr_A0A6P4Z3Q5_A0A6P4Z3Q5_BRABE tr|A0A6P4Z3Q5|A0A6P4Z3Q5_BRABE Disintegrin and metalloproteinase domain-containing protein 17-like OS=Branchiostoma belcheri OX=7741 GN=LOC109473119 PE=4 SV=1	Morbakka_virulenta_scaffold273.g11.t2 scaffold273.g11.t2, Morbakka_virulenta_scaffold273.g11.t1 scaffold273.g11.t1
OG0000030	Branchiostoma_belcheri_tr_A0A6P4YCJ8_A0A6P4YCJ8_BRABE tr|A0A6P4YCJ8|A0A6P4YCJ8_BRABE Disintegrin and metalloproteinase domain-containing protein 10-like OS=Branchiostoma belcheri OX=7741 GN=LOC109468335 PE=4 SV=1, Branchiostoma_belcheri_tr_A0A6P4YZ43_A0A6P4YZ43_BRABE tr|A0A6P4YZ43|A0A6P4YZ43_BRABE Disintegrin and metalloproteinase domain-containing protein 10-like isoform X2 OS=Branchiostoma belcheri OX=7741 GN=LOC109468715 PE=4 SV=1, Branchiostoma_belcheri_tr_A0A6P4Y116_A0A6P4Y116_BRABE tr|A0A6P4Y116|A0A6P4Y116_BRABE Disintegrin and metalloproteinase domain-containing protein 10-like isoform X1 OS=Branchiostoma belcheri OX=7741 GN=LOC109468715 PE=4 SV=1, Branchiostoma_belcheri_tr_A0A6P4YLX1_A0A6P4YLX1_BRABE tr|A0A6P4YLX1|A0A6P4YLX1_BRABE Disintegrin and metalloproteinase domain-containing protein 10-like isoform X1 OS=Branchiostoma belcheri OX=7741 GN=LOC109468796 PE=4 SV=1, Branchiostoma_belcheri_tr_A0A6P4Y1A6_A0A6P4Y1A6_BRABE tr|A0A6P4Y1A6|A0A6P4Y1A6_BRABE Disintegrin and metalloproteinase domain-containing protein 10-like isoform X2 OS=Branchiostoma belcheri OX=7741 GN=LOC109468796 PE=4 SV=1	Morbakka_virulenta_scaffold233.g2.t1 scaffold233.g2.t1
OG0000031	Branchiostoma_belcheri_tr_A0A6P4YA93_A0A6P4YA93_BRABE tr|A0A6P4YA93|A0A6P4YA93_BRABE von Willebrand factor D and EGF domain-containing protein-like OS=Branchiostoma belcheri OX=7741 GN=LOC109467789 PE=4 SV=1	Morbakka_virulenta_scaffold463.g10.t1 scaffold463.g10.t1
OG0000031	Branchiostoma_belcheri_tr_A0A6P4XQ48_A0A6P4XQ48_BRABE tr|A0A6P4XQ48|A0A6P4XQ48_BRABE von Willebrand factor D and EGF domain-containing protein-like OS=Branchiostoma belcheri OX=7741 GN=LOC109462158 PE=4 SV=1	Morbakka_virulenta_scaffold277.g6.t1 scaffold277.g6.t1
OG0000032	Branchiostoma_belcheri_tr_A0A6P5A329_A0A6P5A329_BRABE tr|A0A6P5A329|A0A6P5A329_BRABE Cuticle collagen 91 OS=Branchiostoma belcheri OX=7741 GN=LOC109484866 PE=4 SV=1	Morbakka_virulenta_scaffold319.g15.t1 scaffold319.g15.t1
OG0000034	Branchiostoma_belcheri_tr_A0A6P4ZEX6_A0A6P4ZEX6_BRABE tr|A0A6P4ZEX6|A0A6P4ZEX6_BRABE Attractin-like protein 1 OS=Branchiostoma belcheri OX=7741 GN=LOC109478279 PE=4 SV=1	Morbakka_virulenta_scaffold45.g31.t2 scaffold45.g31.t2, Morbakka_virulenta_scaffold45.g31.t1 scaffold45.g31.t1
OG0000034	Branchiostoma_belcheri_tr_A0A6P4YU35_A0A6P4YU35_BRABE tr|A0A6P4YU35|A0A6P4YU35_BRABE Multiple epidermal growth factor-like domains protein 10 OS=Branchiostoma belcheri OX=7741 GN=LOC109468334 PE=4 SV=1, Branchiostoma_belcheri_tr_A0A6P4XZU7_A0A6P4XZU7_BRABE tr|A0A6P4XZU7|A0A6P4XZU7_BRABE Multiple epidermal growth factor-like domains protein 11 OS=Branchiostoma belcheri OX=7741 GN=LOC109468347 PE=4 SV=1	Morbakka_virulenta_scaffold592.g10.t1 scaffold592.g10.t1, Morbakka_virulenta_scaffold592.g10.t2 scaffold592.g10.t2
OG0000034	Branchiostoma_belcheri_tr_A0A6P4ZN34_A0A6P4ZN34_BRABE tr|A0A6P4ZN34|A0A6P4ZN34_BRABE LOW QUALITY PROTEIN_ multiple epidermal growth factor-like domains protein 8 OS=Branchiostoma belcheri OX=7741 GN=LOC109474978 PE=4 SV=1	Morbakka_virulenta_scaffold1.g337.t2 scaffold1.g337.t2, Morbakka_virulenta_scaffold1.g337.t3 scaffold1.g337.t3, Morbakka_virulenta_scaffold1.g337.t1 scaffold1.g337.t1
OG0000035	Branchiostoma_belcheri_tr_A0A6P4Z6A4_A0A6P4Z6A4_BRABE tr|A0A6P4Z6A4|A0A6P4Z6A4_BRABE Mucin-5AC-like OS=Branchiostoma belcheri OX=7741 GN=LOC109471684 PE=4 SV=1	Morbakka_virulenta_scaffold400.g3.t2 scaffold400.g3.t2, Morbakka_virulenta_scaffold400.g3.t1 scaffold400.g3.t1
OG0000036	Branchiostoma_belcheri_tr_A0A6P4Y591_A0A6P4Y591_BRABE tr|A0A6P4Y591|A0A6P4Y591_BRABE Mucin-like protein OS=Branchiostoma belcheri OX=7741 GN=LOC109466322 PE=4 SV=1	Morbakka_virulenta_scaffold236.g32.t2 scaffold236.g32.t2, Morbakka_virulenta_scaffold236.g32.t1 scaffold236.g32.t1, Morbakka_virulenta_scaffold50.g85.t1 scaffold50.g85.t1, Morbakka_virulenta_scaffold98.g20.t3 scaffold98.g20.t3, Morbakka_virulenta_scaffold98.g20.t2 scaffold98.g20.t2, Morbakka_virulenta_scaffold98.g20.t4 scaffold98.g20.t4, Morbakka_virulenta_scaffold98.g20.t1 scaffold98.g20.t1, Morbakka_virulenta_scaffold98.g26.t1 scaffold98.g26.t1
OG0000036	Branchiostoma_belcheri_tr_A0A6P5AGV5_A0A6P5AGV5_BRABE tr|A0A6P5AGV5|A0A6P5AGV5_BRABE Epidermal growth factor-like protein 7 OS=Branchiostoma belcheri OX=7741 GN=LOC109482676 PE=4 SV=1, Branchiostoma_belcheri_tr_A0A6P4Z2C8_A0A6P4Z2C8_BRABE tr|A0A6P4Z2C8|A0A6P4Z2C8_BRABE Uncharacterized protein LOC109470654 OS=Branchiostoma belcheri OX=7741 GN=LOC109470654 PE=3 SV=1	Morbakka_virulenta_scaffold2.g64.t1 scaffold2.g64.t1
OG0000037	Branchiostoma_belcheri_tr_A0A6P4XR51_A0A6P4XR51_BRABE tr|A0A6P4XR51|A0A6P4XR51_BRABE Uncharacterized protein LOC109465977 OS=Branchiostoma belcheri OX=7741 GN=LOC109465977 PE=4 SV=1, Branchiostoma_belcheri_tr_A0A6P4YKU9_A0A6P4YKU9_BRABE tr|A0A6P4YKU9|A0A6P4YKU9_BRABE Transforming growth factor-beta-induced protein ig-h3-like OS=Branchiostoma belcheri OX=7741 GN=LOC109470526 PE=4 SV=1	Morbakka_virulenta_scaffold93.g25.t1 scaffold93.g25.t1, Morbakka_virulenta_scaffold93.g22.t1 scaffold93.g22.t1
OG0000038	Branchiostoma_belcheri_tr_A0A6P5ASF7_A0A6P5ASF7_BRABE tr|A0A6P5ASF7|A0A6P5ASF7_BRABE Tumor necrosis factor ligand superfamily member 10-like OS=Branchiostoma belcheri OX=7741 GN=LOC109485726 PE=3 SV=1, Branchiostoma_belcheri_tr_A0A6P5A1T2_A0A6P5A1T2_BRABE tr|A0A6P5A1T2|A0A6P5A1T2_BRABE Tumor necrosis factor ligand superfamily member 10-like OS=Branchiostoma belcheri OX=7741 GN=LOC109484452 PE=3 SV=1, Branchiostoma_belcheri_tr_A0A6P5AAP8_A0A6P5AAP8_BRABE tr|A0A6P5AAP8|A0A6P5AAP8_BRABE Tumor necrosis factor ligand superfamily member 10-like OS=Branchiostoma belcheri OX=7741 GN=LOC109484460 PE=3 SV=1, Branchiostoma_belcheri_tr_A0A6P5AFB1_A0A6P5AFB1_BRABE tr|A0A6P5AFB1|A0A6P5AFB1_BRABE Tumor necrosis factor ligand superfamily member 10-like OS=Branchiostoma belcheri OX=7741 GN=LOC109485775 PE=3 SV=1, Branchiostoma_belcheri_tr_A0A6P5APH3_A0A6P5APH3_BRABE tr|A0A6P5APH3|A0A6P5APH3_BRABE Uncharacterized protein LOC109485757 isoform X2 OS=Branchiostoma belcheri OX=7741 GN=LOC109485757 PE=3 SV=1, Branchiostoma_belcheri_tr_A0A6P5ASJ3_A0A6P5ASJ3_BRABE tr|A0A6P5ASJ3|A0A6P5ASJ3_BRABE Tumor necrosis factor ligand superfamily member 10-like isoform X1 OS=Branchiostoma belcheri OX=7741 GN=LOC109485757 PE=3 SV=1, Branchiostoma_belcheri_tr_A0A6P4YLG4_A0A6P4YLG4_BRABE tr|A0A6P4YLG4|A0A6P4YLG4_BRABE Tumor necrosis factor ligand superfamily member 10-like OS=Branchiostoma belcheri OX=7741 GN=LOC109470672 PE=3 SV=1, Branchiostoma_belcheri_tr_A0A6P5AFD0_A0A6P5AFD0_BRABE tr|A0A6P5AFD0|A0A6P5AFD0_BRABE Tumor necrosis factor ligand superfamily member 10-like OS=Branchiostoma belcheri OX=7741 GN=LOC109485806 PE=3 SV=1	Morbakka_virulenta_scaffold302.g10.t1 scaffold302.g10.t1
OG0000040	Branchiostoma_belcheri_tr_A0A6P4Z7N2_A0A6P4Z7N2_BRABE tr|A0A6P4Z7N2|A0A6P4Z7N2_BRABE Cysteine-rich motor neuron 1 protein-like OS=Branchiostoma belcheri OX=7741 GN=LOC109471964 PE=4 SV=1	Morbakka_virulenta_scaffold572.g7.t2 scaffold572.g7.t2, Morbakka_virulenta_scaffold572.g7.t1 scaffold572.g7.t1
OG0000040	Branchiostoma_belcheri_tr_A0A6P5AWE2_A0A6P5AWE2_BRABE tr|A0A6P5AWE2|A0A6P5AWE2_BRABE Kazal-type serine protease inhibitor domain-containing protein 1-like OS=Branchiostoma belcheri OX=7741 GN=LOC109486825 PE=4 SV=1, Branchiostoma_belcheri_tr_A0A6P4XY87_A0A6P4XY87_BRABE tr|A0A6P4XY87|A0A6P4XY87_BRABE Uncharacterized protein LOC109463154 OS=Branchiostoma belcheri OX=7741 GN=LOC109463154 PE=4 SV=1, Branchiostoma_belcheri_tr_A0A6P5AWF2_A0A6P5AWF2_BRABE tr|A0A6P5AWF2|A0A6P5AWF2_BRABE Insulin-like growth factor-binding protein 7 OS=Branchiostoma belcheri OX=7741 GN=LOC109486832 PE=4 SV=1	Morbakka_virulenta_scaffold37.g21.t1 scaffold37.g21.t1, Morbakka_virulenta_scaffold37.g22.t1 scaffold37.g22.t1
OG0000041	Branchiostoma_belcheri_tr_A0A6P4ZKT8_A0A6P4ZKT8_BRABE tr|A0A6P4ZKT8|A0A6P4ZKT8_BRABE von Willebrand factor A domain-containing protein 5A-like OS=Branchiostoma belcheri OX=7741 GN=LOC109474402 PE=4 SV=1, Branchiostoma_belcheri_tr_A0A6P4Z940_A0A6P4Z940_BRABE tr|A0A6P4Z940|A0A6P4Z940_BRABE von Willebrand factor A domain-containing protein 5A-like OS=Branchiostoma belcheri OX=7741 GN=LOC109474530 PE=4 SV=1	Morbakka_virulenta_scaffold235.g13.t1 scaffold235.g13.t1, Morbakka_virulenta_scaffold235.g9.t1 scaffold235.g9.t1, Morbakka_virulenta_scaffold71.g73.t1 scaffold71.g73.t1
OG0000041	Branchiostoma_belcheri_tr_A0A6P4Z2H8_A0A6P4Z2H8_BRABE tr|A0A6P4Z2H8|A0A6P4Z2H8_BRABE von Willebrand factor A domain-containing protein 5B1-like OS=Branchiostoma belcheri OX=7741 GN=LOC109472723 PE=4 SV=1, Branchiostoma_belcheri_tr_A0A6P4Z1T4_A0A6P4Z1T4_BRABE tr|A0A6P4Z1T4|A0A6P4Z1T4_BRABE von Willebrand factor A domain-containing protein 5B1-like OS=Branchiostoma belcheri OX=7741 GN=LOC109472557 PE=4 SV=1	Morbakka_virulenta_scaffold92.g7.t1 scaffold92.g7.t1
OG0000042	Branchiostoma_belcheri_tr_A0A6P5ACS2_A0A6P5ACS2_BRABE tr|A0A6P5ACS2|A0A6P5ACS2_BRABE Neurexin-3-beta-like OS=Branchiostoma belcheri OX=7741 GN=LOC109482714 PE=4 SV=1, Branchiostoma_belcheri_tr_A0A6P4ZW01_A0A6P4ZW01_BRABE tr|A0A6P4ZW01|A0A6P4ZW01_BRABE Neurexin-3-like OS=Branchiostoma belcheri OX=7741 GN=LOC109482715 PE=4 SV=1	Morbakka_virulenta_scaffold231.g1.t1 scaffold231.g1.t1
OG0000044	Branchiostoma_belcheri_tr_A0A6P4ZCM9_A0A6P4ZCM9_BRABE tr|A0A6P4ZCM9|A0A6P4ZCM9_BRABE Protein-glutamine gamma-glutamyltransferase K-like OS=Branchiostoma belcheri OX=7741 GN=LOC109473438 PE=3 SV=1, Branchiostoma_belcheri_tr_A0A6P4ZGV0_A0A6P4ZGV0_BRABE tr|A0A6P4ZGV0|A0A6P4ZGV0_BRABE Protein-glutamine gamma-glutamyltransferase K-like OS=Branchiostoma belcheri OX=7741 GN=LOC109473437 PE=3 SV=1, Branchiostoma_belcheri_tr_A0A6P4YY06_A0A6P4YY06_BRABE tr|A0A6P4YY06|A0A6P4YY06_BRABE Coagulation factor XIII A chain-like OS=Branchiostoma belcheri OX=7741 GN=LOC109473654 PE=3 SV=1, Branchiostoma_belcheri_tr_A0A6P4Z5G1_A0A6P4Z5G1_BRABE tr|A0A6P4Z5G1|A0A6P4Z5G1_BRABE Protein-glutamine gamma-glutamyltransferase K-like OS=Branchiostoma belcheri OX=7741 GN=LOC109473655 PE=3 SV=1, Branchiostoma_belcheri_tr_A0A6P4XY89_A0A6P4XY89_BRABE tr|A0A6P4XY89|A0A6P4XY89_BRABE Protein-glutamine gamma-glutamyltransferase K-like OS=Branchiostoma belcheri OX=7741 GN=LOC109464530 PE=3 SV=1, Branchiostoma_belcheri_tr_A0A6P5AE64_A0A6P5AE64_BRABE tr|A0A6P5AE64|A0A6P5AE64_BRABE Coagulation factor XIII A chain-like OS=Branchiostoma belcheri OX=7741 GN=LOC109481877 PE=3 SV=1	Morbakka_virulenta_scaffold291.g8.t1 scaffold291.g8.t1, Morbakka_virulenta_scaffold99.g38.t1 scaffold99.g38.t1, Morbakka_virulenta_scaffold90.g31.t1 scaffold90.g31.t1, Morbakka_virulenta_scaffold90.g28.t1 scaffold90.g28.t1, Morbakka_virulenta_scaffold433.g1.t1 scaffold433.g1.t1
OG0000045	Branchiostoma_belcheri_tr_A0A6P5APV6_A0A6P5APV6_BRABE tr|A0A6P5APV6|A0A6P5APV6_BRABE Laminin subunit alpha-4-like OS=Branchiostoma belcheri OX=7741 GN=LOC109485885 PE=4 SV=1, Branchiostoma_belcheri_tr_A0A6P5AFK2_A0A6P5AFK2_BRABE tr|A0A6P5AFK2|A0A6P5AFK2_BRABE LOW QUALITY PROTEIN_ laminin subunit alpha-5-like OS=Branchiostoma belcheri OX=7741 GN=LOC109485887 PE=4 SV=1	Morbakka_virulenta_scaffold15.g24.t1 scaffold15.g24.t1
OG0000049	Branchiostoma_belcheri_tr_A0A6P4ZV34_A0A6P4ZV34_BRABE tr|A0A6P4ZV34|A0A6P4ZV34_BRABE Plexin-A1-like OS=Branchiostoma belcheri OX=7741 GN=LOC109480177 PE=4 SV=1	Morbakka_virulenta_scaffold3390.g1.t1 scaffold3390.g1.t1
OG0000049	Branchiostoma_belcheri_tr_A0A6P4ZHF9_A0A6P4ZHF9_BRABE tr|A0A6P4ZHF9|A0A6P4ZHF9_BRABE Plexin-A4-like OS=Branchiostoma belcheri OX=7741 GN=LOC109476886 PE=3 SV=1, Branchiostoma_belcheri_tr_A0A6P4ZWV4_A0A6P4ZWV4_BRABE tr|A0A6P4ZWV4|A0A6P4ZWV4_BRABE Plexin-A1-like isoform X2 OS=Branchiostoma belcheri OX=7741 GN=LOC109477341 PE=3 SV=1, Branchiostoma_belcheri_tr_A0A6P4YXM3_A0A6P4YXM3_BRABE tr|A0A6P4YXM3|A0A6P4YXM3_BRABE Plexin-A1-like isoform X1 OS=Branchiostoma belcheri OX=7741 GN=LOC109477341 PE=3 SV=1, Branchiostoma_belcheri_tr_A0A6P4ZT25_A0A6P4ZT25_BRABE tr|A0A6P4ZT25|A0A6P4ZT25_BRABE Plexin-A1-like isoform X3 OS=Branchiostoma belcheri OX=7741 GN=LOC109477341 PE=3 SV=1, Branchiostoma_belcheri_tr_A0A6P4ZBS9_A0A6P4ZBS9_BRABE tr|A0A6P4ZBS9|A0A6P4ZBS9_BRABE Plexin-A1-like isoform X4 OS=Branchiostoma belcheri OX=7741 GN=LOC109477341 PE=3 SV=1	Morbakka_virulenta_scaffold314.g7.t1 scaffold314.g7.t1
