Orthogroup	Chordata_Amphioxiformes_Branchiostoma_belcheri	Cnidaria_Cubozoa_Morbakka_virulenta
OG0000053	Branchiostoma_belcheri_tr_A0A6P5A9T6_A0A6P5A9T6_BRABE tr|A0A6P5A9T6|A0A6P5A9T6_BRABE Malignant fibrous histiocytoma-amplified sequence 1 homolog OS=Branchiostoma belcheri OX=7741 GN=LOC109486911 PE=4 SV=1, Branchiostoma_belcheri_tr_A0A6P5AJJ4_A0A6P5AJJ4_BRABE tr|A0A6P5AJJ4|A0A6P5AJJ4_BRABE Malignant fibrous histiocytoma-amplified sequence 1 homolog OS=Branchiostoma belcheri OX=7741 GN=LOC109486951 PE=4 SV=1, Branchiostoma_belcheri_tr_A0A6P4ZSA5_A0A6P4ZSA5_BRABE tr|A0A6P4ZSA5|A0A6P4ZSA5_BRABE Malignant fibrous histiocytoma-amplified sequence 1 homolog OS=Branchiostoma belcheri OX=7741 GN=LOC109481547 PE=4 SV=1, Branchiostoma_belcheri_tr_A0A6P5A711_A0A6P5A711_BRABE tr|A0A6P5A711|A0A6P5A711_BRABE Malignant fibrous histiocytoma-amplified sequence 1 homolog OS=Branchiostoma belcheri OX=7741 GN=LOC109481040 PE=4 SV=1, Branchiostoma_belcheri_tr_A0A6P4ZQI4_A0A6P4ZQI4_BRABE tr|A0A6P4ZQI4|A0A6P4ZQI4_BRABE Malignant fibrous histiocytoma-amplified sequence 1 homolog OS=Branchiostoma belcheri OX=7741 GN=LOC109481051 PE=4 SV=1, Branchiostoma_belcheri_tr_A0A6P4ZQJ4_A0A6P4ZQJ4_BRABE tr|A0A6P4ZQJ4|A0A6P4ZQJ4_BRABE Malignant fibrous histiocytoma-amplified sequence 1 homolog OS=Branchiostoma belcheri OX=7741 GN=LOC109481063 PE=4 SV=1, Branchiostoma_belcheri_tr_A0A6P5AAF6_A0A6P5AAF6_BRABE tr|A0A6P5AAF6|A0A6P5AAF6_BRABE Malignant fibrous histiocytoma-amplified sequence 1 homolog OS=Branchiostoma belcheri OX=7741 GN=LOC109484369 PE=4 SV=1, Branchiostoma_belcheri_tr_A0A6P4YJC2_A0A6P4YJC2_BRABE tr|A0A6P4YJC2|A0A6P4YJC2_BRABE Malignant fibrous histiocytoma-amplified sequence 1 homolog OS=Branchiostoma belcheri OX=7741 GN=LOC109473846 PE=4 SV=1, Branchiostoma_belcheri_tr_A0A6P4ZYF4_A0A6P4ZYF4_BRABE tr|A0A6P4ZYF4|A0A6P4ZYF4_BRABE LOW QUALITY PROTEIN_ uncharacterized protein LOC109486739 OS=Branchiostoma belcheri OX=7741 GN=LOC109486739 PE=4 SV=1, Branchiostoma_belcheri_tr_A0A6P4YQC6_A0A6P4YQC6_BRABE tr|A0A6P4YQC6|A0A6P4YQC6_BRABE Malignant fibrous histiocytoma-amplified sequence 1 homolog OS=Branchiostoma belcheri OX=7741 GN=LOC109466190 PE=4 SV=1, Branchiostoma_belcheri_tr_A0A6P4YI19_A0A6P4YI19_BRABE tr|A0A6P4YI19|A0A6P4YI19_BRABE Malignant fibrous histiocytoma-amplified sequence 1 homolog OS=Branchiostoma belcheri OX=7741 GN=LOC109467889 PE=4 SV=1, Branchiostoma_belcheri_tr_A0A6P5A2W7_A0A6P5A2W7_BRABE tr|A0A6P5A2W7|A0A6P5A2W7_BRABE Malignant fibrous histiocytoma-amplified sequence 1 homolog OS=Branchiostoma belcheri OX=7741 GN=LOC109484764 PE=4 SV=1, Branchiostoma_belcheri_tr_A0A6P4YLR3_A0A6P4YLR3_BRABE tr|A0A6P4YLR3|A0A6P4YLR3_BRABE non-specific serine/threonine protein kinase OS=Branchiostoma belcheri OX=7741 GN=LOC109466375 PE=4 SV=1, Branchiostoma_belcheri_tr_A0A6P4ZH59_A0A6P4ZH59_BRABE tr|A0A6P4ZH59|A0A6P4ZH59_BRABE Malignant fibrous histiocytoma-amplified sequence 1 homolog OS=Branchiostoma belcheri OX=7741 GN=LOC109482290 PE=4 SV=1, Branchiostoma_belcheri_tr_A0A6P4ZR76_A0A6P4ZR76_BRABE tr|A0A6P4ZR76|A0A6P4ZR76_BRABE Malignant fibrous histiocytoma-amplified sequence 1 homolog OS=Branchiostoma belcheri OX=7741 GN=LOC109484783 PE=4 SV=1, Branchiostoma_belcheri_tr_A0A6P4ZE96_A0A6P4ZE96_BRABE tr|A0A6P4ZE96|A0A6P4ZE96_BRABE Malignant fibrous histiocytoma-amplified sequence 1 homolog isoform X2 OS=Branchiostoma belcheri OX=7741 GN=LOC109472615 PE=3 SV=1, Branchiostoma_belcheri_tr_A0A6P4Y619_A0A6P4Y619_BRABE tr|A0A6P4Y619|A0A6P4Y619_BRABE Malignant fibrous histiocytoma-amplified sequence 1 homolog OS=Branchiostoma belcheri OX=7741 GN=LOC109462096 PE=3 SV=1, Branchiostoma_belcheri_tr_A0A6P4Z6C9_A0A6P4Z6C9_BRABE tr|A0A6P4Z6C9|A0A6P4Z6C9_BRABE Uncharacterized protein LOC109471708 OS=Branchiostoma belcheri OX=7741 GN=LOC109471708 PE=3 SV=1, Branchiostoma_belcheri_tr_A0A6P4YY18_A0A6P4YY18_BRABE tr|A0A6P4YY18|A0A6P4YY18_BRABE Malignant fibrous histiocytoma-amplified sequence 1 homolog OS=Branchiostoma belcheri OX=7741 GN=LOC109471705 PE=3 SV=1, Branchiostoma_belcheri_tr_A0A6P4XU04_A0A6P4XU04_BRABE tr|A0A6P4XU04|A0A6P4XU04_BRABE ubiquitinyl hydrolase 1 OS=Branchiostoma belcheri OX=7741 GN=LOC109462064 PE=4 SV=1, Branchiostoma_belcheri_tr_A0A6P4YBB6_A0A6P4YBB6_BRABE tr|A0A6P4YBB6|A0A6P4YBB6_BRABE Malignant fibrous histiocytoma-amplified sequence 1 homolog OS=Branchiostoma belcheri OX=7741 GN=LOC109462055 PE=4 SV=1, Branchiostoma_belcheri_tr_A0A6P4YFG9_A0A6P4YFG9_BRABE tr|A0A6P4YFG9|A0A6P4YFG9_BRABE Uncharacterized protein LOC109472615 isoform X1 OS=Branchiostoma belcheri OX=7741 GN=LOC109472615 PE=4 SV=1, Branchiostoma_belcheri_tr_A0A6P4Y5Y3_A0A6P4Y5Y3_BRABE tr|A0A6P4Y5Y3|A0A6P4Y5Y3_BRABE Malignant fibrous histiocytoma-amplified sequence 1 homolog OS=Branchiostoma belcheri OX=7741 GN=LOC109462056 PE=4 SV=1, Branchiostoma_belcheri_tr_A0A6P4YCW7_A0A6P4YCW7_BRABE tr|A0A6P4YCW7|A0A6P4YCW7_BRABE Malignant fibrous histiocytoma-amplified sequence 1 homolog OS=Branchiostoma belcheri OX=7741 GN=LOC109464104 PE=4 SV=1, Branchiostoma_belcheri_tr_A0A6P5ADR3_A0A6P5ADR3_BRABE tr|A0A6P5ADR3|A0A6P5ADR3_BRABE Malignant fibrous histiocytoma-amplified sequence 1-like isoform X2 OS=Branchiostoma belcheri OX=7741 GN=LOC109481758 PE=4 SV=1, Branchiostoma_belcheri_tr_A0A6P4ZFA9_A0A6P4ZFA9_BRABE tr|A0A6P4ZFA9|A0A6P4ZFA9_BRABE Malignant fibrous histiocytoma-amplified sequence 1-like isoform X1 OS=Branchiostoma belcheri OX=7741 GN=LOC109481758 PE=4 SV=1, Branchiostoma_belcheri_tr_A0A6P4YLB1_A0A6P4YLB1_BRABE tr|A0A6P4YLB1|A0A6P4YLB1_BRABE Uncharacterized protein LOC109474394 OS=Branchiostoma belcheri OX=7741 GN=LOC109474394 PE=4 SV=1, Branchiostoma_belcheri_tr_A0A6P4XPW3_A0A6P4XPW3_BRABE tr|A0A6P4XPW3|A0A6P4XPW3_BRABE Uncharacterized protein LOC109462063 OS=Branchiostoma belcheri OX=7741 GN=LOC109462063 PE=4 SV=1, Branchiostoma_belcheri_tr_A0A6P4YBF4_A0A6P4YBF4_BRABE tr|A0A6P4YBF4|A0A6P4YBF4_BRABE Malignant fibrous histiocytoma-amplified sequence 1 homolog OS=Branchiostoma belcheri OX=7741 GN=LOC109462095 PE=4 SV=1, Branchiostoma_belcheri_tr_A0A6P4Z367_A0A6P4Z367_BRABE tr|A0A6P4Z367|A0A6P4Z367_BRABE Malignant fibrous histiocytoma-amplified sequence 1 homolog OS=Branchiostoma belcheri OX=7741 GN=LOC109470872 PE=4 SV=1, Branchiostoma_belcheri_tr_A0A6P4Y681_A0A6P4Y681_BRABE tr|A0A6P4Y681|A0A6P4Y681_BRABE Malignant fibrous histiocytoma-amplified sequence 1 homolog OS=Branchiostoma belcheri OX=7741 GN=LOC109466664 PE=4 SV=1, Branchiostoma_belcheri_tr_A0A6P4XBP7_A0A6P4XBP7_BRABE tr|A0A6P4XBP7|A0A6P4XBP7_BRABE LOW QUALITY PROTEIN_ malignant fibrous histiocytoma-amplified sequence 1 homolog OS=Branchiostoma belcheri OX=7741 GN=LOC109461853 PE=4 SV=1, Branchiostoma_belcheri_tr_A0A6P4XTM6_A0A6P4XTM6_BRABE tr|A0A6P4XTM6|A0A6P4XTM6_BRABE Malignant fibrous histiocytoma-amplified sequence 1 homolog OS=Branchiostoma belcheri OX=7741 GN=LOC109461965 PE=4 SV=1, Branchiostoma_belcheri_tr_A0A6P5AIJ6_A0A6P5AIJ6_BRABE tr|A0A6P5AIJ6|A0A6P5AIJ6_BRABE Malignant fibrous histiocytoma-amplified sequence 1 homolog OS=Branchiostoma belcheri OX=7741 GN=LOC109483213 PE=4 SV=1	Morbakka_virulenta_scaffold155.g5.t1 scaffold155.g5.t1
OG0000054	Branchiostoma_belcheri_tr_A0A6P5A7J1_A0A6P5A7J1_BRABE tr|A0A6P5A7J1|A0A6P5A7J1_BRABE Leucine-rich repeat-containing protein 7-like isoform X2 OS=Branchiostoma belcheri OX=7741 GN=LOC109486248 PE=4 SV=1, Branchiostoma_belcheri_tr_A0A6P5AR32_A0A6P5AR32_BRABE tr|A0A6P5AR32|A0A6P5AR32_BRABE Uncharacterized protein LOC109486248 isoform X1 OS=Branchiostoma belcheri OX=7741 GN=LOC109486248 PE=4 SV=1	Morbakka_virulenta_scaffold47.g48.t2 scaffold47.g48.t2, Morbakka_virulenta_scaffold47.g48.t1 scaffold47.g48.t1
OG0000056	Branchiostoma_belcheri_tr_A0A6P4XQV8_A0A6P4XQV8_BRABE tr|A0A6P4XQV8|A0A6P4XQV8_BRABE E3 ubiquitin-protein ligase Midline-1-like OS=Branchiostoma belcheri OX=7741 GN=LOC109462399 PE=4 SV=1, Branchiostoma_belcheri_tr_A0A6P4Y6X5_A0A6P4Y6X5_BRABE tr|A0A6P4Y6X5|A0A6P4Y6X5_BRABE RING-type E3 ubiquitin transferase OS=Branchiostoma belcheri OX=7741 GN=LOC109462398 PE=4 SV=1, Branchiostoma_belcheri_tr_A0A6P4XV43_A0A6P4XV43_BRABE tr|A0A6P4XV43|A0A6P4XV43_BRABE RING-type E3 ubiquitin transferase OS=Branchiostoma belcheri OX=7741 GN=LOC109462385 PE=4 SV=1, Branchiostoma_belcheri_tr_A0A6P4ZZW5_A0A6P4ZZW5_BRABE tr|A0A6P4ZZW5|A0A6P4ZZW5_BRABE RING-type E3 ubiquitin transferase OS=Branchiostoma belcheri OX=7741 GN=LOC109478093 PE=4 SV=1, Branchiostoma_belcheri_tr_A0A6P4YVF7_A0A6P4YVF7_BRABE tr|A0A6P4YVF7|A0A6P4YVF7_BRABE Muscle M-line assembly protein unc-89-like OS=Branchiostoma belcheri OX=7741 GN=LOC109468813 PE=4 SV=1, Branchiostoma_belcheri_tr_A0A6P4YYT2_A0A6P4YYT2_BRABE tr|A0A6P4YYT2|A0A6P4YYT2_BRABE RING-type E3 ubiquitin transferase OS=Branchiostoma belcheri OX=7741 GN=LOC109473809 PE=4 SV=1, Branchiostoma_belcheri_tr_A0A6P4Y4I2_A0A6P4Y4I2_BRABE tr|A0A6P4Y4I2|A0A6P4Y4I2_BRABE E3 ubiquitin-protein ligase Midline-1-like OS=Branchiostoma belcheri OX=7741 GN=LOC109464693 PE=4 SV=1, Branchiostoma_belcheri_tr_A0A6P4YAQ4_A0A6P4YAQ4_BRABE tr|A0A6P4YAQ4|A0A6P4YAQ4_BRABE E3 ubiquitin-protein ligase Midline-1-like OS=Branchiostoma belcheri OX=7741 GN=LOC109461852 PE=4 SV=1, Branchiostoma_belcheri_tr_A0A6P4YLS7_A0A6P4YLS7_BRABE tr|A0A6P4YLS7|A0A6P4YLS7_BRABE E3 ubiquitin-protein ligase Midline-1-like OS=Branchiostoma belcheri OX=7741 GN=LOC109465318 PE=4 SV=1, Branchiostoma_belcheri_tr_A0A6P5AB99_A0A6P5AB99_BRABE tr|A0A6P5AB99|A0A6P5AB99_BRABE RING-type E3 ubiquitin transferase OS=Branchiostoma belcheri OX=7741 GN=LOC109487368 PE=4 SV=1, Branchiostoma_belcheri_tr_A0A6P4YMF5_A0A6P4YMF5_BRABE tr|A0A6P4YMF5|A0A6P4YMF5_BRABE E3 ubiquitin-protein ligase TRIM36-like isoform X1 OS=Branchiostoma belcheri OX=7741 GN=LOC109468953 PE=4 SV=1, Branchiostoma_belcheri_tr_A0A6P4Y1R1_A0A6P4Y1R1_BRABE tr|A0A6P4Y1R1|A0A6P4Y1R1_BRABE E3 ubiquitin-protein ligase TRIM36-like isoform X2 OS=Branchiostoma belcheri OX=7741 GN=LOC109468953 PE=4 SV=1, Branchiostoma_belcheri_tr_A0A6P4YU51_A0A6P4YU51_BRABE tr|A0A6P4YU51|A0A6P4YU51_BRABE Down syndrome cell adhesion molecule-like protein Dscam2 OS=Branchiostoma belcheri OX=7741 GN=LOC109468349 PE=4 SV=1	Morbakka_virulenta_scaffold338.g2.t2 scaffold338.g2.t2, Morbakka_virulenta_scaffold338.g2.t1 scaffold338.g2.t1
OG0000056	Branchiostoma_belcheri_tr_A0A6P4Z8B5_A0A6P4Z8B5_BRABE tr|A0A6P4Z8B5|A0A6P4Z8B5_BRABE RING-type E3 ubiquitin transferase OS=Branchiostoma belcheri OX=7741 GN=LOC109472172 PE=4 SV=1, Branchiostoma_belcheri_tr_A0A6P4YSH6_A0A6P4YSH6_BRABE tr|A0A6P4YSH6|A0A6P4YSH6_BRABE RING-type E3 ubiquitin transferase OS=Branchiostoma belcheri OX=7741 GN=LOC109472172 PE=4 SV=1, Branchiostoma_belcheri_tr_A0A6P4YDQ8_A0A6P4YDQ8_BRABE tr|A0A6P4YDQ8|A0A6P4YDQ8_BRABE RING-type E3 ubiquitin transferase OS=Branchiostoma belcheri OX=7741 GN=LOC109472172 PE=4 SV=1, Branchiostoma_belcheri_tr_A0A6P4Z044_A0A6P4Z044_BRABE tr|A0A6P4Z044|A0A6P4Z044_BRABE RING-type E3 ubiquitin transferase OS=Branchiostoma belcheri OX=7741 GN=LOC109472172 PE=4 SV=1	Morbakka_virulenta_scaffold31.g52.t1 scaffold31.g52.t1
OG0000059	Branchiostoma_belcheri_tr_A0A6P4ZPP7_A0A6P4ZPP7_BRABE tr|A0A6P4ZPP7|A0A6P4ZPP7_BRABE Signal peptide_ CUB and EGF-like domain-containing protein 1 isoform X13 OS=Branchiostoma belcheri OX=7741 GN=LOC109475463 PE=4 SV=1, Branchiostoma_belcheri_tr_A0A6P4ZPQ4_A0A6P4ZPQ4_BRABE tr|A0A6P4ZPQ4|A0A6P4ZPQ4_BRABE Signal peptide_ CUB and EGF-like domain-containing protein 1 isoform X17 OS=Branchiostoma belcheri OX=7741 GN=LOC109475463 PE=4 SV=1, Branchiostoma_belcheri_tr_A0A6P4ZKN0_A0A6P4ZKN0_BRABE tr|A0A6P4ZKN0|A0A6P4ZKN0_BRABE Signal peptide_ CUB and EGF-like domain-containing protein 1 isoform X14 OS=Branchiostoma belcheri OX=7741 GN=LOC109475463 PE=4 SV=1, Branchiostoma_belcheri_tr_A0A6P4Z4X2_A0A6P4Z4X2_BRABE tr|A0A6P4Z4X2|A0A6P4Z4X2_BRABE Signal peptide_ CUB and EGF-like domain-containing protein 1 isoform X15 OS=Branchiostoma belcheri OX=7741 GN=LOC109475463 PE=4 SV=1, Branchiostoma_belcheri_tr_A0A6P4ZCL6_A0A6P4ZCL6_BRABE tr|A0A6P4ZCL6|A0A6P4ZCL6_BRABE Signal peptide_ CUB and EGF-like domain-containing protein 1 isoform X16 OS=Branchiostoma belcheri OX=7741 GN=LOC109475463 PE=4 SV=1, Branchiostoma_belcheri_tr_A0A6P4ZKM3_A0A6P4ZKM3_BRABE tr|A0A6P4ZKM3|A0A6P4ZKM3_BRABE Signal peptide_ CUB and EGF-like domain-containing protein 1 isoform X10 OS=Branchiostoma belcheri OX=7741 GN=LOC109475463 PE=4 SV=1, Branchiostoma_belcheri_tr_A0A6P4ZKM0_A0A6P4ZKM0_BRABE tr|A0A6P4ZKM0|A0A6P4ZKM0_BRABE Signal peptide_ CUB and EGF-like domain-containing protein 1 isoform X5 OS=Branchiostoma belcheri OX=7741 GN=LOC109475463 PE=4 SV=1, Branchiostoma_belcheri_tr_A0A6P4YQ93_A0A6P4YQ93_BRABE tr|A0A6P4YQ93|A0A6P4YQ93_BRABE Signal peptide_ CUB and EGF-like domain-containing protein 1 isoform X8 OS=Branchiostoma belcheri OX=7741 GN=LOC109475463 PE=4 SV=1, Branchiostoma_belcheri_tr_A0A6P4ZCK5_A0A6P4ZCK5_BRABE tr|A0A6P4ZCK5|A0A6P4ZCK5_BRABE Signal peptide_ CUB and EGF-like domain-containing protein 1 isoform X7 OS=Branchiostoma belcheri OX=7741 GN=LOC109475463 PE=4 SV=1, Branchiostoma_belcheri_tr_A0A6P4Z4V5_A0A6P4Z4V5_BRABE tr|A0A6P4Z4V5|A0A6P4Z4V5_BRABE Signal peptide_ CUB and EGF-like domain-containing protein 1 isoform X1 OS=Branchiostoma belcheri OX=7741 GN=LOC109475463 PE=4 SV=1, Branchiostoma_belcheri_tr_A0A6P4YQ87_A0A6P4YQ87_BRABE tr|A0A6P4YQ87|A0A6P4YQ87_BRABE Signal peptide_ CUB and EGF-like domain-containing protein 1 isoform X3 OS=Branchiostoma belcheri OX=7741 GN=LOC109475463 PE=4 SV=1, Branchiostoma_belcheri_tr_A0A6P4ZPN8_A0A6P4ZPN8_BRABE tr|A0A6P4ZPN8|A0A6P4ZPN8_BRABE Signal peptide_ CUB and EGF-like domain-containing protein 1 isoform X9 OS=Branchiostoma belcheri OX=7741 GN=LOC109475463 PE=4 SV=1, Branchiostoma_belcheri_tr_A0A6P4ZCL1_A0A6P4ZCL1_BRABE tr|A0A6P4ZCL1|A0A6P4ZCL1_BRABE Signal peptide_ CUB and EGF-like domain-containing protein 1 isoform X12 OS=Branchiostoma belcheri OX=7741 GN=LOC109475463 PE=4 SV=1, Branchiostoma_belcheri_tr_A0A6P4Z4W6_A0A6P4Z4W6_BRABE tr|A0A6P4Z4W6|A0A6P4Z4W6_BRABE Signal peptide_ CUB and EGF-like domain-containing protein 1 isoform X11 OS=Branchiostoma belcheri OX=7741 GN=LOC109475463 PE=4 SV=1, Branchiostoma_belcheri_tr_A0A6P4ZPN4_A0A6P4ZPN4_BRABE tr|A0A6P4ZPN4|A0A6P4ZPN4_BRABE Signal peptide_ CUB and EGF-like domain-containing protein 1 isoform X4 OS=Branchiostoma belcheri OX=7741 GN=LOC109475463 PE=4 SV=1	Morbakka_virulenta_scaffold164.g5.t1 scaffold164.g5.t1
OG0000061	Branchiostoma_belcheri_tr_A0A6P5AAB2_A0A6P5AAB2_BRABE tr|A0A6P5AAB2|A0A6P5AAB2_BRABE Copine-3-like isoform X2 OS=Branchiostoma belcheri OX=7741 GN=LOC109480822 PE=3 SV=1, Branchiostoma_belcheri_tr_A0A6P4ZXE2_A0A6P4ZXE2_BRABE tr|A0A6P4ZXE2|A0A6P4ZXE2_BRABE Copine-3-like isoform X1 OS=Branchiostoma belcheri OX=7741 GN=LOC109480822 PE=3 SV=1, Branchiostoma_belcheri_tr_A0A6P4Z6Y0_A0A6P4Z6Y0_BRABE tr|A0A6P4Z6Y0|A0A6P4Z6Y0_BRABE Copine-3-like isoform X1 OS=Branchiostoma belcheri OX=7741 GN=LOC109473940 PE=3 SV=1, Branchiostoma_belcheri_tr_A0A6P4ZJB0_A0A6P4ZJB0_BRABE tr|A0A6P4ZJB0|A0A6P4ZJB0_BRABE Copine-4-like isoform X2 OS=Branchiostoma belcheri OX=7741 GN=LOC109473940 PE=3 SV=1	Morbakka_virulenta_scaffold265.g6.t1 scaffold265.g6.t1, Morbakka_virulenta_scaffold92.g46.t1 scaffold92.g46.t1
OG0000061	Branchiostoma_belcheri_tr_A0A6P4ZBG6_A0A6P4ZBG6_BRABE tr|A0A6P4ZBG6|A0A6P4ZBG6_BRABE Copine-8-like isoform X4 OS=Branchiostoma belcheri OX=7741 GN=LOC109477303 PE=3 SV=1, Branchiostoma_belcheri_tr_A0A6P4ZIW8_A0A6P4ZIW8_BRABE tr|A0A6P4ZIW8|A0A6P4ZIW8_BRABE Copine-8-like isoform X1 OS=Branchiostoma belcheri OX=7741 GN=LOC109477303 PE=3 SV=1, Branchiostoma_belcheri_tr_A0A6P4ZSR6_A0A6P4ZSR6_BRABE tr|A0A6P4ZSR6|A0A6P4ZSR6_BRABE Copine-8-like isoform X3 OS=Branchiostoma belcheri OX=7741 GN=LOC109477303 PE=3 SV=1, Branchiostoma_belcheri_tr_A0A6P4YXA8_A0A6P4YXA8_BRABE tr|A0A6P4YXA8|A0A6P4YXA8_BRABE Copine-8-like isoform X2 OS=Branchiostoma belcheri OX=7741 GN=LOC109477303 PE=3 SV=1	Morbakka_virulenta_scaffold73.g24.t1 scaffold73.g24.t1
OG0000062	Branchiostoma_belcheri_tr_A0A6P4ZI42_A0A6P4ZI42_BRABE tr|A0A6P4ZI42|A0A6P4ZI42_BRABE Delta-like protein OS=Branchiostoma belcheri OX=7741 GN=LOC109477094 PE=4 SV=1, Branchiostoma_belcheri_tr_A0A6P4ZVQ6_A0A6P4ZVQ6_BRABE tr|A0A6P4ZVQ6|A0A6P4ZVQ6_BRABE Delta-like protein OS=Branchiostoma belcheri OX=7741 GN=LOC109477094 PE=4 SV=1, Branchiostoma_belcheri_tr_A0A6P4YWI2_A0A6P4YWI2_BRABE tr|A0A6P4YWI2|A0A6P4YWI2_BRABE Delta-like protein OS=Branchiostoma belcheri OX=7741 GN=LOC109477094 PE=4 SV=1	Morbakka_virulenta_scaffold2.g62.t1 scaffold2.g62.t1, Morbakka_virulenta_scaffold2.g62.t2 scaffold2.g62.t2
OG0000062	Branchiostoma_belcheri_tr_A0A6P4Z419_A0A6P4Z419_BRABE tr|A0A6P4Z419|A0A6P4Z419_BRABE Delta-like protein C isoform X2 OS=Branchiostoma belcheri OX=7741 GN=LOC109469993 PE=4 SV=1, Branchiostoma_belcheri_tr_A0A6P4YRH7_A0A6P4YRH7_BRABE tr|A0A6P4YRH7|A0A6P4YRH7_BRABE Delta-like protein C isoform X1 OS=Branchiostoma belcheri OX=7741 GN=LOC109469993 PE=4 SV=1	Morbakka_virulenta_scaffold2.g110.t3 scaffold2.g110.t3, Morbakka_virulenta_scaffold2.g110.t1 scaffold2.g110.t1, Morbakka_virulenta_scaffold2.g110.t2 scaffold2.g110.t2
OG0000064	Branchiostoma_belcheri_tr_A0A6P4ZVB9_A0A6P4ZVB9_BRABE tr|A0A6P4ZVB9|A0A6P4ZVB9_BRABE Latent-transforming growth factor beta-binding protein 4-like OS=Branchiostoma belcheri OX=7741 GN=LOC109476983 PE=4 SV=1, Branchiostoma_belcheri_tr_A0A6P4ZRJ0_A0A6P4ZRJ0_BRABE tr|A0A6P4ZRJ0|A0A6P4ZRJ0_BRABE Latent-transforming growth factor beta-binding protein 2-like OS=Branchiostoma belcheri OX=7741 GN=LOC109476984 PE=4 SV=1	Morbakka_virulenta_scaffold164.g7.t1 scaffold164.g7.t1
OG0000065	Branchiostoma_belcheri_tr_A0A6P4YC50_A0A6P4YC50_BRABE tr|A0A6P4YC50|A0A6P4YC50_BRABE Glypican-5-like OS=Branchiostoma belcheri OX=7741 GN=LOC109463911 PE=3 SV=1	Morbakka_virulenta_scaffold1.g340.t1 scaffold1.g340.t1
OG0000070	Branchiostoma_belcheri_tr_A0A6P4ZCE8_A0A6P4ZCE8_BRABE tr|A0A6P4ZCE8|A0A6P4ZCE8_BRABE Uncharacterized protein LOC109475417 OS=Branchiostoma belcheri OX=7741 GN=LOC109475417 PE=4 SV=1, Branchiostoma_belcheri_tr_A0A6P4Y9P9_A0A6P4Y9P9_BRABE tr|A0A6P4Y9P9|A0A6P4Y9P9_BRABE Thyroid peroxidase-like OS=Branchiostoma belcheri OX=7741 GN=LOC109461565 PE=4 SV=1, Branchiostoma_belcheri_tr_A0A6P5A579_A0A6P5A579_BRABE tr|A0A6P5A579|A0A6P5A579_BRABE Thyroid peroxidase-like OS=Branchiostoma belcheri OX=7741 GN=LOC109479411 PE=4 SV=1, Branchiostoma_belcheri_tr_A0A6P4Y345_A0A6P4Y345_BRABE tr|A0A6P4Y345|A0A6P4Y345_BRABE Peroxidase mlt-7-like OS=Branchiostoma belcheri OX=7741 GN=LOC109464354 PE=4 SV=1, Branchiostoma_belcheri_tr_A0A6P4Z5V1_A0A6P4Z5V1_BRABE tr|A0A6P4Z5V1|A0A6P4Z5V1_BRABE Myeloperoxidase-like OS=Branchiostoma belcheri OX=7741 GN=LOC109479341 PE=4 SV=1	Morbakka_virulenta_scaffold64.g73.t1 scaffold64.g73.t1
OG0000070	Branchiostoma_belcheri_tr_A0A6P4YR12_A0A6P4YR12_BRABE tr|A0A6P4YR12|A0A6P4YR12_BRABE LOW QUALITY PROTEIN_ peroxidasin homolog OS=Branchiostoma belcheri OX=7741 GN=LOC109466411 PE=4 SV=1, Branchiostoma_belcheri_tr_A0A6P4Y5G4_A0A6P4Y5G4_BRABE tr|A0A6P4Y5G4|A0A6P4Y5G4_BRABE LOW QUALITY PROTEIN_ peroxidasin homolog OS=Branchiostoma belcheri OX=7741 GN=LOC109466403 PE=4 SV=1	Morbakka_virulenta_scaffold190.g18.t1 scaffold190.g18.t1
OG0000073	Branchiostoma_belcheri_tr_A0A6P4YTZ0_A0A6P4YTZ0_BRABE tr|A0A6P4YTZ0|A0A6P4YTZ0_BRABE Uncharacterized protein LOC109468288 isoform X1 OS=Branchiostoma belcheri OX=7741 GN=LOC109468288 PE=4 SV=1, Branchiostoma_belcheri_tr_A0A6P4YCG6_A0A6P4YCG6_BRABE tr|A0A6P4YCG6|A0A6P4YCG6_BRABE Uncharacterized protein LOC109468288 isoform X2 OS=Branchiostoma belcheri OX=7741 GN=LOC109468288 PE=4 SV=1, Branchiostoma_belcheri_tr_A0A6P4Z218_A0A6P4Z218_BRABE tr|A0A6P4Z218|A0A6P4Z218_BRABE Uncharacterized protein LOC109472616 OS=Branchiostoma belcheri OX=7741 GN=LOC109472616 PE=4 SV=1, Branchiostoma_belcheri_tr_A0A6P4YAY0_A0A6P4YAY0_BRABE tr|A0A6P4YAY0|A0A6P4YAY0_BRABE Uncharacterized protein LOC109471388 OS=Branchiostoma belcheri OX=7741 GN=LOC109471388 PE=4 SV=1, Branchiostoma_belcheri_tr_A0A6P4Z991_A0A6P4Z991_BRABE tr|A0A6P4Z991|A0A6P4Z991_BRABE Uncharacterized protein LOC109471390 OS=Branchiostoma belcheri OX=7741 GN=LOC109471390 PE=4 SV=1, Branchiostoma_belcheri_tr_A0A6P4YCF8_A0A6P4YCF8_BRABE tr|A0A6P4YCF8|A0A6P4YCF8_BRABE Uncharacterized protein LOC109468278 OS=Branchiostoma belcheri OX=7741 GN=LOC109468278 PE=4 SV=1, Branchiostoma_belcheri_tr_A0A6P4YA10_A0A6P4YA10_BRABE tr|A0A6P4YA10|A0A6P4YA10_BRABE Uncharacterized protein LOC109467707 OS=Branchiostoma belcheri OX=7741 GN=LOC109467707 PE=4 SV=1	Morbakka_virulenta_scaffold47.g78.t1 scaffold47.g78.t1
OG0000075	Branchiostoma_belcheri_tr_A0A6P4ZAW2_A0A6P4ZAW2_BRABE tr|A0A6P4ZAW2|A0A6P4ZAW2_BRABE Sushi_ von Willebrand factor type A_ EGF and pentraxin domain-containing protein 1-like OS=Branchiostoma belcheri OX=7741 GN=LOC109472809 PE=4 SV=1, Branchiostoma_belcheri_tr_A0A6P5A656_A0A6P5A656_BRABE tr|A0A6P5A656|A0A6P5A656_BRABE Sushi_ von Willebrand factor type A_ EGF and pentraxin domain-containing protein 1-like OS=Branchiostoma belcheri OX=7741 GN=LOC109479728 PE=4 SV=1	Morbakka_virulenta_scaffold416.g3.t1 scaffold416.g3.t1, Morbakka_virulenta_scaffold416.g3.t2 scaffold416.g3.t2, Morbakka_virulenta_scaffold307.g13.t1 scaffold307.g13.t1
OG0000080	Branchiostoma_belcheri_tr_A0A6P5AN13_A0A6P5AN13_BRABE tr|A0A6P5AN13|A0A6P5AN13_BRABE Metalloproteinase inhibitor 1-like OS=Branchiostoma belcheri OX=7741 GN=LOC109485337 PE=3 SV=1, Branchiostoma_belcheri_tr_A0A6P4XVC3_A0A6P4XVC3_BRABE tr|A0A6P4XVC3|A0A6P4XVC3_BRABE Metalloproteinase inhibitor 2-like OS=Branchiostoma belcheri OX=7741 GN=LOC109467109 PE=4 SV=1	Morbakka_virulenta_scaffold190.g25.t1 scaffold190.g25.t1
OG0000083	Branchiostoma_belcheri_tr_A0A6P4ZNB0_A0A6P4ZNB0_BRABE tr|A0A6P4ZNB0|A0A6P4ZNB0_BRABE Hyaluronidase OS=Branchiostoma belcheri OX=7741 GN=LOC109475028 PE=3 SV=1, Branchiostoma_belcheri_tr_A0A6P4ZJ66_A0A6P4ZJ66_BRABE tr|A0A6P4ZJ66|A0A6P4ZJ66_BRABE Hyaluronidase OS=Branchiostoma belcheri OX=7741 GN=LOC109475028 PE=3 SV=1, Branchiostoma_belcheri_tr_A0A6P4Z3H4_A0A6P4Z3H4_BRABE tr|A0A6P4Z3H4|A0A6P4Z3H4_BRABE Hyaluronidase OS=Branchiostoma belcheri OX=7741 GN=LOC109475028 PE=3 SV=1, Branchiostoma_belcheri_tr_A0A6P4YNS5_A0A6P4YNS5_BRABE tr|A0A6P4YNS5|A0A6P4YNS5_BRABE Hyaluronidase OS=Branchiostoma belcheri OX=7741 GN=LOC109475028 PE=3 SV=1, Branchiostoma_belcheri_tr_A0A6P4YU48_A0A6P4YU48_BRABE tr|A0A6P4YU48|A0A6P4YU48_BRABE Hyaluronidase OS=Branchiostoma belcheri OX=7741 GN=LOC109472527 PE=3 SV=1, Branchiostoma_belcheri_tr_A0A6P4YF66_A0A6P4YF66_BRABE tr|A0A6P4YF66|A0A6P4YF66_BRABE Hyaluronidase OS=Branchiostoma belcheri OX=7741 GN=LOC109472528 PE=3 SV=1, Branchiostoma_belcheri_tr_A0A6P4ZTA6_A0A6P4ZTA6_BRABE tr|A0A6P4ZTA6|A0A6P4ZTA6_BRABE Hyaluronidase OS=Branchiostoma belcheri OX=7741 GN=LOC109479777 PE=3 SV=1, Branchiostoma_belcheri_tr_A0A6P4ZKN1_A0A6P4ZKN1_BRABE tr|A0A6P4ZKN1|A0A6P4ZKN1_BRABE Hyaluronidase OS=Branchiostoma belcheri OX=7741 GN=LOC109479776 PE=3 SV=1	Morbakka_virulenta_scaffold8.g32.t1 scaffold8.g32.t1, Morbakka_virulenta_scaffold1428.g1.t1 scaffold1428.g1.t1
OG0000084	Branchiostoma_belcheri_tr_A0A6P4ZQI3_A0A6P4ZQI3_BRABE tr|A0A6P4ZQI3|A0A6P4ZQI3_BRABE Collagen alpha-1_I_ chain-like isoform X7 OS=Branchiostoma belcheri OX=7741 GN=LOC109478941 PE=4 SV=1, Branchiostoma_belcheri_tr_A0A6P4Z479_A0A6P4Z479_BRABE tr|A0A6P4Z479|A0A6P4Z479_BRABE Collagen alpha-1_I_ chain-like isoform X8 OS=Branchiostoma belcheri OX=7741 GN=LOC109478941 PE=4 SV=1, Branchiostoma_belcheri_tr_A0A6P5A3J1_A0A6P5A3J1_BRABE tr|A0A6P5A3J1|A0A6P5A3J1_BRABE Collagen alpha-1_I_ chain-like isoform X4 OS=Branchiostoma belcheri OX=7741 GN=LOC109478941 PE=4 SV=1, Branchiostoma_belcheri_tr_A0A6P4ZHQ9_A0A6P4ZHQ9_BRABE tr|A0A6P4ZHQ9|A0A6P4ZHQ9_BRABE Collagen alpha-1_I_ chain-like isoform X6 OS=Branchiostoma belcheri OX=7741 GN=LOC109478941 PE=4 SV=1, Branchiostoma_belcheri_tr_A0A6P4ZZB1_A0A6P4ZZB1_BRABE tr|A0A6P4ZZB1|A0A6P4ZZB1_BRABE Collagen alpha-1_I_ chain-like isoform X1 OS=Branchiostoma belcheri OX=7741 GN=LOC109478941 PE=4 SV=1, Branchiostoma_belcheri_tr_A0A6P4Z474_A0A6P4Z474_BRABE tr|A0A6P4Z474|A0A6P4Z474_BRABE Collagen alpha-1_I_ chain-like isoform X3 OS=Branchiostoma belcheri OX=7741 GN=LOC109478941 PE=4 SV=1, Branchiostoma_belcheri_tr_A0A6P4ZZB7_A0A6P4ZZB7_BRABE tr|A0A6P4ZZB7|A0A6P4ZZB7_BRABE Collagen alpha-1_I_ chain-like isoform X5 OS=Branchiostoma belcheri OX=7741 GN=LOC109478941 PE=4 SV=1, Branchiostoma_belcheri_tr_A0A6P4ZQH9_A0A6P4ZQH9_BRABE tr|A0A6P4ZQH9|A0A6P4ZQH9_BRABE Collagen alpha-1_I_ chain-like isoform X2 OS=Branchiostoma belcheri OX=7741 GN=LOC109478941 PE=4 SV=1	Morbakka_virulenta_scaffold357.g1.t3 scaffold357.g1.t3, Morbakka_virulenta_scaffold357.g1.t2 scaffold357.g1.t2, Morbakka_virulenta_scaffold357.g1.t1 scaffold357.g1.t1
OG0000087	Branchiostoma_belcheri_tr_A0A6P5AIX3_A0A6P5AIX3_BRABE tr|A0A6P5AIX3|A0A6P5AIX3_BRABE RIMS-binding protein 3A-like OS=Branchiostoma belcheri OX=7741 GN=LOC109486780 PE=3 SV=1	Morbakka_virulenta_scaffold306.g6.t1 scaffold306.g6.t1, Morbakka_virulenta_scaffold306.g6.t3 scaffold306.g6.t3
