Orthogroup	Cnidaria_Anthozoa_Exaiptasia_diaphana	Placozoa_Trichoplacidae_Trichoplax_spec-H2
OG0000011	Exaiptasia_diaphana_XP_020895286.2 XP_020895286.2 uncharacterized protein LOC110234259_ partial [Exaiptasia diaphana], Exaiptasia_diaphana_XP_028513122.1 XP_028513122.1 tyrosine-protein kinase transmembrane receptor Ror2-like isoform X1 [Exaiptasia diaphana], Exaiptasia_diaphana_XP_020894038.2 XP_020894038.2 tyrosine-protein kinase transmembrane receptor Ror2-like isoform X2 [Exaiptasia diaphana], Exaiptasia_diaphana_XP_028513123.1 XP_028513123.1 tyrosine-protein kinase transmembrane receptor Ror2-like isoform X3 [Exaiptasia diaphana], Exaiptasia_diaphana_XP_028516046.1 XP_028516046.1 tyrosine-protein kinase transmembrane receptor ROR2 isoform X4 [Exaiptasia diaphana], Exaiptasia_diaphana_XP_028516044.1 XP_028516044.1 uncharacterized protein LOC110242972 isoform X2 [Exaiptasia diaphana], Exaiptasia_diaphana_XP_028516045.1 XP_028516045.1 uncharacterized protein LOC110242972 isoform X3 [Exaiptasia diaphana], Exaiptasia_diaphana_XP_028516043.1 XP_028516043.1 uncharacterized protein LOC110242972 isoform X1 [Exaiptasia diaphana]	Trichoplax_specH2_tr_A0A369SG46_A0A369SG46_9METZ tr|A0A369SG46|A0A369SG46_9METZ Plasminogen OS=Trichoplax sp. H2 OX=287889 GN=TrispH2_003216 PE=4 SV=1, Trichoplax_specH2_tr_A0A369RQ32_A0A369RQ32_9METZ tr|A0A369RQ32|A0A369RQ32_9METZ Hepatocyte growth factor-like protein OS=Trichoplax sp. H2 OX=287889 GN=TrispH2_011475 PE=4 SV=1, Trichoplax_specH2_tr_A0A369RUX0_A0A369RUX0_9METZ tr|A0A369RUX0|A0A369RUX0_9METZ Plasminogen OS=Trichoplax sp. H2 OX=287889 GN=TrispH2_009661 PE=4 SV=1, Trichoplax_specH2_tr_A0A369RUZ3_A0A369RUZ3_9METZ tr|A0A369RUZ3|A0A369RUZ3_9METZ Plasminogen OS=Trichoplax sp. H2 OX=287889 GN=TrispH2_009071 PE=4 SV=1, Trichoplax_specH2_tr_A0A369RNX8_A0A369RNX8_9METZ tr|A0A369RNX8|A0A369RNX8_9METZ Neurotrypsin OS=Trichoplax sp. H2 OX=287889 GN=TrispH2_011681 PE=4 SV=1, Trichoplax_specH2_tr_A0A369RPG0_A0A369RPG0_9METZ tr|A0A369RPG0|A0A369RPG0_9METZ Neurotrypsin OS=Trichoplax sp. H2 OX=287889 GN=TrispH2_011806 PE=4 SV=1, Trichoplax_specH2_tr_A0A369S0J0_A0A369S0J0_9METZ tr|A0A369S0J0|A0A369S0J0_9METZ Antigen WC1.1 OS=Trichoplax sp. H2 OX=287889 GN=TrispH2_008475 PE=4 SV=1, Trichoplax_specH2_tr_A0A369SEP3_A0A369SEP3_9METZ tr|A0A369SEP3|A0A369SEP3_9METZ Plasminogen OS=Trichoplax sp. H2 OX=287889 GN=TrispH2_003221 PE=4 SV=1, Trichoplax_specH2_tr_A0A369RSM3_A0A369RSM3_9METZ tr|A0A369RSM3|A0A369RSM3_9METZ Hyaluronan-binding protein 2 OS=Trichoplax sp. H2 OX=287889 GN=TrispH2_010599 PE=4 SV=1, Trichoplax_specH2_tr_A0A369RSF0_A0A369RSF0_9METZ tr|A0A369RSF0|A0A369RSF0_9METZ Hepatocyte growth factor-like protein OS=Trichoplax sp. H2 OX=287889 GN=TrispH2_010598 PE=4 SV=1, Trichoplax_specH2_tr_A0A369RRY9_A0A369RRY9_9METZ tr|A0A369RRY9|A0A369RRY9_9METZ MAM and LDL-receptor class A domain-containing protein 2 OS=Trichoplax sp. H2 OX=287889 GN=TrispH2_010597 PE=4 SV=1, Trichoplax_specH2_tr_A0A369RRA5_A0A369RRA5_9METZ tr|A0A369RRA5|A0A369RRA5_9METZ MAM and LDL-receptor class A domain-containing protein 2 OS=Trichoplax sp. H2 OX=287889 GN=TrispH2_010596 PE=4 SV=1, Trichoplax_specH2_tr_A0A369RRQ1_A0A369RRQ1_9METZ tr|A0A369RRQ1|A0A369RRQ1_9METZ MAM and LDL-receptor class A domain-containing protein 2 OS=Trichoplax sp. H2 OX=287889 GN=TrispH2_010595 PE=4 SV=1, Trichoplax_specH2_tr_A0A369SDE6_A0A369SDE6_9METZ tr|A0A369SDE6|A0A369SDE6_9METZ MAM and LDL-receptor class A domain-containing protein 1 OS=Trichoplax sp. H2 OX=287889 GN=TrispH2_003222 PE=4 SV=1, Trichoplax_specH2_tr_A0A369SE49_A0A369SE49_9METZ tr|A0A369SE49|A0A369SE49_9METZ Neurotrypsin OS=Trichoplax sp. H2 OX=287889 GN=TrispH2_002984 PE=4 SV=1, Trichoplax_specH2_tr_A0A369RZ52_A0A369RZ52_9METZ tr|A0A369RZ52|A0A369RZ52_9METZ Neurotrypsin OS=Trichoplax sp. H2 OX=287889 GN=TrispH2_007547 PE=4 SV=1, Trichoplax_specH2_tr_A0A369S6S6_A0A369S6S6_9METZ tr|A0A369S6S6|A0A369S6S6_9METZ Neurotrypsin OS=Trichoplax sp. H2 OX=287889 GN=TrispH2_006821 PE=4 SV=1, Trichoplax_specH2_tr_A0A369RQR2_A0A369RQR2_9METZ tr|A0A369RQR2|A0A369RQR2_9METZ Neurotrypsin OS=Trichoplax sp. H2 OX=287889 GN=TrispH2_010133 PE=4 SV=1
OG0000012	Exaiptasia_diaphana_XP_020903410.2 XP_020903410.2 von Willebrand factor-like [Exaiptasia diaphana]	Trichoplax_specH2_tr_A0A369RVP1_A0A369RVP1_9METZ tr|A0A369RVP1|A0A369RVP1_9METZ SCO-spondin _Fragment_ OS=Trichoplax sp. H2 OX=287889 GN=TrispH2_008599 PE=4 SV=1
OG0000012	Exaiptasia_diaphana_XP_020913063.1 XP_020913063.1 kielin_chordin-like protein [Exaiptasia diaphana]	Trichoplax_specH2_tr_A0A369RQH6_A0A369RQH6_9METZ tr|A0A369RQH6|A0A369RQH6_9METZ Fibrillin-2 _Fragment_ OS=Trichoplax sp. H2 OX=287889 GN=TrispH2_011117 PE=4 SV=1, Trichoplax_specH2_tr_A0A369RVG2_A0A369RVG2_9METZ tr|A0A369RVG2|A0A369RVG2_9METZ BMP-binding endothelial regulator protein OS=Trichoplax sp. H2 OX=287889 GN=TrispH2_010308 PE=4 SV=1
OG0000013	Exaiptasia_diaphana_XP_028514332.1 XP_028514332.1 protein Wnt-8a isoform X2 [Exaiptasia diaphana], Exaiptasia_diaphana_XP_020898355.1 XP_020898355.1 protein Wnt-8b [Exaiptasia diaphana], Exaiptasia_diaphana_XP_020898335.1 XP_020898335.1 protein Wnt-8b isoform X1 [Exaiptasia diaphana], Exaiptasia_diaphana_XP_020898370.1 XP_020898370.1 protein Wnt-8b_ partial [Exaiptasia diaphana]	Trichoplax_specH2_tr_A0A369RTS8_A0A369RTS8_9METZ tr|A0A369RTS8|A0A369RTS8_9METZ Protein Wnt OS=Trichoplax sp. H2 OX=287889 GN=TrispH2_010556 PE=3 SV=1, Trichoplax_specH2_tr_A0A369SL16_A0A369SL16_9METZ tr|A0A369SL16|A0A369SL16_9METZ Protein Wnt OS=Trichoplax sp. H2 OX=287889 GN=TrispH2_000144 PE=3 SV=1
OG0000014	Exaiptasia_diaphana_XP_028519306.1 XP_028519306.1 LOW QUALITY PROTEIN_ thrombospondin type-1 domain-containing protein 4 [Exaiptasia diaphana], Exaiptasia_diaphana_XP_020903155.1 XP_020903155.1 A disintegrin and metalloproteinase with thrombospondin motifs 7 isoform X2 [Exaiptasia diaphana], Exaiptasia_diaphana_XP_028515635.1 XP_028515635.1 A disintegrin and metalloproteinase with thrombospondin motifs 12 isoform X1 [Exaiptasia diaphana], Exaiptasia_diaphana_XP_020914481.1 XP_020914481.1 A disintegrin and metalloproteinase with thrombospondin motifs 19 [Exaiptasia diaphana], Exaiptasia_diaphana_XP_020906187.1 XP_020906187.1 ADAMTS-like protein 2 [Exaiptasia diaphana], Exaiptasia_diaphana_XP_028517311.1 XP_028517311.1 A disintegrin and metalloproteinase with thrombospondin motifs 9 [Exaiptasia diaphana], Exaiptasia_diaphana_XP_020916248.1 XP_020916248.1 A disintegrin and metalloproteinase with thrombospondin motifs 6 [Exaiptasia diaphana], Exaiptasia_diaphana_XP_020906831.1 XP_020906831.1 A disintegrin and metalloproteinase with thrombospondin motifs 16 [Exaiptasia diaphana], Exaiptasia_diaphana_XP_020906830.1 XP_020906830.1 A disintegrin and metalloproteinase with thrombospondin motifs 16 [Exaiptasia diaphana], Exaiptasia_diaphana_XP_020903669.1 XP_020903669.1 A disintegrin and metalloproteinase with thrombospondin motifs 7 [Exaiptasia diaphana], Exaiptasia_diaphana_XP_020899199.1 XP_020899199.1 A disintegrin and metalloproteinase with thrombospondin motifs 18 [Exaiptasia diaphana], Exaiptasia_diaphana_XP_028515757.1 XP_028515757.1 A disintegrin and metalloproteinase with thrombospondin motifs 6 [Exaiptasia diaphana], Exaiptasia_diaphana_XP_020908001.1 XP_020908001.1 A disintegrin and metalloproteinase with thrombospondin motifs 18 [Exaiptasia diaphana], Exaiptasia_diaphana_XP_020908093.1 XP_020908093.1 A disintegrin and metalloproteinase with thrombospondin motifs 18 [Exaiptasia diaphana], Exaiptasia_diaphana_XP_020903567.1 XP_020903567.1 A disintegrin and metalloproteinase with thrombospondin motifs 6 [Exaiptasia diaphana], Exaiptasia_diaphana_XP_028515755.1 XP_028515755.1 A disintegrin and metalloproteinase with thrombospondin motifs 18-like_ partial [Exaiptasia diaphana], Exaiptasia_diaphana_XP_028514068.1 XP_028514068.1 A disintegrin and metalloproteinase with thrombospondin motifs 10 [Exaiptasia diaphana], Exaiptasia_diaphana_XP_028514067.1 XP_028514067.1 A disintegrin and metalloproteinase with thrombospondin motifs 1 [Exaiptasia diaphana], Exaiptasia_diaphana_XP_028512951.1 XP_028512951.1 A disintegrin and metalloproteinase with thrombospondin motifs 18 [Exaiptasia diaphana], Exaiptasia_diaphana_XP_020916890.2 XP_020916890.2 mucin-2-like_ partial [Exaiptasia diaphana]	Trichoplax_specH2_tr_A0A369S333_A0A369S333_9METZ tr|A0A369S333|A0A369S333_9METZ A disintegrin and metalloproteinase with thrombospondin motifs 19 OS=Trichoplax sp. H2 OX=287889 GN=TrispH2_005653 PE=4 SV=1
OG0000015	Exaiptasia_diaphana_XP_028517878.1 XP_028517878.1 fibrillin-1 [Exaiptasia diaphana], Exaiptasia_diaphana_XP_020908628.1 XP_020908628.1 ZP domain-containing protein [Exaiptasia diaphana], Exaiptasia_diaphana_XP_020898716.1 XP_020898716.1 ZP domain-containing protein [Exaiptasia diaphana], Exaiptasia_diaphana_XP_020915359.2 XP_020915359.2 ZP domain-containing protein [Exaiptasia diaphana], Exaiptasia_diaphana_XP_020915360.1 XP_020915360.1 uncharacterized protein LOC110252848 [Exaiptasia diaphana]	Trichoplax_specH2_tr_A0A369RPZ6_A0A369RPZ6_9METZ tr|A0A369RPZ6|A0A369RPZ6_9METZ Oncoprotein-induced transcript 3 protein OS=Trichoplax sp. H2 OX=287889 GN=TrispH2_011015 PE=4 SV=1, Trichoplax_specH2_tr_A0A369RZH8_A0A369RZH8_9METZ tr|A0A369RZH8|A0A369RZH8_9METZ Oncoprotein-induced transcript 3 protein OS=Trichoplax sp. H2 OX=287889 GN=TrispH2_007988 PE=4 SV=1
OG0000017	Exaiptasia_diaphana_XP_020902588.1 XP_020902588.1 serpin B6 [Exaiptasia diaphana], Exaiptasia_diaphana_XP_020913182.1 XP_020913182.1 leukocyte elastase inhibitor-like [Exaiptasia diaphana], Exaiptasia_diaphana_XP_020902591.1 XP_020902591.1 leukocyte elastase inhibitor A-like [Exaiptasia diaphana]	Trichoplax_specH2_tr_A0A369S4E6_A0A369S4E6_9METZ tr|A0A369S4E6|A0A369S4E6_9METZ Serpin B10 OS=Trichoplax sp. H2 OX=287889 GN=TrispH2_006507 PE=3 SV=1, Trichoplax_specH2_tr_A0A369S5H0_A0A369S5H0_9METZ tr|A0A369S5H0|A0A369S5H0_9METZ Serpin B9 OS=Trichoplax sp. H2 OX=287889 GN=TrispH2_006508 PE=3 SV=1
OG0000018	Exaiptasia_diaphana_XP_020907184.1 XP_020907184.1 deleted in malignant brain tumors 1 protein [Exaiptasia diaphana]	Trichoplax_specH2_tr_A0A369S493_A0A369S493_9METZ tr|A0A369S493|A0A369S493_9METZ Sortilin-related receptor OS=Trichoplax sp. H2 OX=287889 GN=TrispH2_007580 PE=3 SV=1
OG0000018	Exaiptasia_diaphana_XP_028515710.1 XP_028515710.1 uncharacterized protein LOC110241854 [Exaiptasia diaphana], Exaiptasia_diaphana_XP_020895213.1 XP_020895213.1 sortilin-related receptor [Exaiptasia diaphana]	Trichoplax_specH2_tr_A0A369RVY6_A0A369RVY6_9METZ tr|A0A369RVY6|A0A369RVY6_9METZ Fibropellin-1 OS=Trichoplax sp. H2 OX=287889 GN=TrispH2_009781 PE=4 SV=1
OG0000019	Exaiptasia_diaphana_XP_020906144.1 XP_020906144.1 growth_differentiation factor 8 [Exaiptasia diaphana]	Trichoplax_specH2_tr_A0A369SHA9_A0A369SHA9_9METZ tr|A0A369SHA9|A0A369SHA9_9METZ Growth/differentiation factor 8 OS=Trichoplax sp. H2 OX=287889 GN=TrispH2_001421 PE=3 SV=1
OG0000019	Exaiptasia_diaphana_XP_020905685.1 XP_020905685.1 bone morphogenetic protein 4 [Exaiptasia diaphana], Exaiptasia_diaphana_XP_020905684.1 XP_020905684.1 bone morphogenetic protein 4 [Exaiptasia diaphana]	Trichoplax_specH2_tr_A0A369SEF4_A0A369SEF4_9METZ tr|A0A369SEF4|A0A369SEF4_9METZ Bone morphogenetic protein 4 OS=Trichoplax sp. H2 OX=287889 GN=TrispH2_002393 PE=3 SV=1
OG0000021	Exaiptasia_diaphana_XP_020901946.1 XP_020901946.1 hemicentin-1-like [Exaiptasia diaphana], Exaiptasia_diaphana_XP_020901927.1 XP_020901927.1 low-density lipoprotein receptor-related protein 2-like isoform X3 [Exaiptasia diaphana], Exaiptasia_diaphana_XP_020901926.1 XP_020901926.1 low-density lipoprotein receptor-related protein 2-like isoform X2 [Exaiptasia diaphana], Exaiptasia_diaphana_XP_028515277.1 XP_028515277.1 low-density lipoprotein receptor-related protein 2-like isoform X1 [Exaiptasia diaphana]	Trichoplax_specH2_tr_A0A369RTQ1_A0A369RTQ1_9METZ tr|A0A369RTQ1|A0A369RTQ1_9METZ Nidogen-1 OS=Trichoplax sp. H2 OX=287889 GN=TrispH2_009409 PE=4 SV=1
OG0000021	Exaiptasia_diaphana_XP_020911424.1 XP_020911424.1 low-density lipoprotein receptor-related protein 4 isoform X2 [Exaiptasia diaphana], Exaiptasia_diaphana_XP_020911423.1 XP_020911423.1 very low-density lipoprotein receptor isoform X1 [Exaiptasia diaphana], Exaiptasia_diaphana_XP_028518014.1 XP_028518014.1 low-density lipoprotein receptor-related protein 4 isoform X3 [Exaiptasia diaphana]	Trichoplax_specH2_tr_A0A369SSL3_A0A369SSL3_9METZ tr|A0A369SSL3|A0A369SSL3_9METZ Low-density lipoprotein receptor-related protein 4 OS=Trichoplax sp. H2 OX=287889 GN=TrispH2_000491 PE=4 SV=1
OG0000022	Exaiptasia_diaphana_XP_020904987.1 XP_020904987.1 annexin A5 [Exaiptasia diaphana]	Trichoplax_specH2_tr_A0A369SFY9_A0A369SFY9_9METZ tr|A0A369SFY9|A0A369SFY9_9METZ Annexin OS=Trichoplax sp. H2 OX=287889 GN=TrispH2_002457 PE=3 SV=1
OG0000022	Exaiptasia_diaphana_XP_020902679.1 XP_020902679.1 annexin A5 [Exaiptasia diaphana], Exaiptasia_diaphana_XP_020902678.1 XP_020902678.1 annexin A5 [Exaiptasia diaphana]	Trichoplax_specH2_tr_A0A369RNY4_A0A369RNY4_9METZ tr|A0A369RNY4|A0A369RNY4_9METZ Annexin OS=Trichoplax sp. H2 OX=287889 GN=TrispH2_011427 PE=3 SV=1
OG0000023	Exaiptasia_diaphana_XP_028514247.1 XP_028514247.1 zinc metalloproteinase-disintegrin-like BjussuMP-1 [Exaiptasia diaphana]	Trichoplax_specH2_tr_A0A369RUH1_A0A369RUH1_9METZ tr|A0A369RUH1|A0A369RUH1_9METZ Disintegrin and metalloproteinase domain-containing protein 12 OS=Trichoplax sp. H2 OX=287889 GN=TrispH2_009954 PE=4 SV=1, Trichoplax_specH2_tr_A0A369RP58_A0A369RP58_9METZ tr|A0A369RP58|A0A369RP58_9METZ Disintegrin and metalloproteinase domain-containing protein 9 OS=Trichoplax sp. H2 OX=287889 GN=TrispH2_011592 PE=4 SV=1, Trichoplax_specH2_tr_A0A369RUI2_A0A369RUI2_9METZ tr|A0A369RUI2|A0A369RUI2_9METZ Disintegrin and metalloproteinase domain-containing protein 12 OS=Trichoplax sp. H2 OX=287889 GN=TrispH2_009955 PE=4 SV=1, Trichoplax_specH2_tr_A0A369RUG6_A0A369RUG6_9METZ tr|A0A369RUG6|A0A369RUG6_9METZ Disintegrin and metalloproteinase domain-containing protein 9 OS=Trichoplax sp. H2 OX=287889 GN=TrispH2_009958 PE=4 SV=1, Trichoplax_specH2_tr_A0A369RNG1_A0A369RNG1_9METZ tr|A0A369RNG1|A0A369RNG1_9METZ Disintegrin and metalloproteinase domain-containing protein 12 _Fragment_ OS=Trichoplax sp. H2 OX=287889 GN=TrispH2_011748 PE=4 SV=1
OG0000024	Exaiptasia_diaphana_XP_028519592.1 XP_028519592.1 zonadhesin-like_ partial [Exaiptasia diaphana], Exaiptasia_diaphana_XP_020903926.1 XP_020903926.1 equistatin [Exaiptasia diaphana], Exaiptasia_diaphana_XP_028512983.1 XP_028512983.1 uncharacterized protein LOC110232652 isoform X2 [Exaiptasia diaphana], Exaiptasia_diaphana_XP_028512982.1 XP_028512982.1 cell death abnormality protein 1 isoform X1 [Exaiptasia diaphana], Exaiptasia_diaphana_XP_028515408.1 XP_028515408.1 uncharacterized protein LOC110240827 [Exaiptasia diaphana], Exaiptasia_diaphana_XP_020896594.1 XP_020896594.1 equistatin [Exaiptasia diaphana], Exaiptasia_diaphana_XP_028515409.1 XP_028515409.1 thyroglobulin_ partial [Exaiptasia diaphana], Exaiptasia_diaphana_XP_028515410.1 XP_028515410.1 thyroglobulin-like [Exaiptasia diaphana], Exaiptasia_diaphana_XP_020902304.1 XP_020902304.1 thyroglobulin [Exaiptasia diaphana], Exaiptasia_diaphana_XP_020908611.1 XP_020908611.1 WAP_ Kazal_ immunoglobulin_ Kunitz and NTR domain-containing protein 2 [Exaiptasia diaphana], Exaiptasia_diaphana_XP_028517142.1 XP_028517142.1 uncharacterized protein LOC110246567 [Exaiptasia diaphana], Exaiptasia_diaphana_XP_020902306.1 XP_020902306.1 uncharacterized protein LOC110240830 [Exaiptasia diaphana], Exaiptasia_diaphana_XP_020909087.1 XP_020909087.1 SPARC-related modular calcium-binding protein 2_ partial [Exaiptasia diaphana], Exaiptasia_diaphana_XP_020901650.1 XP_020901650.1 mucin-2_ partial [Exaiptasia diaphana], Exaiptasia_diaphana_XP_020897812.1 XP_020897812.1 nidogen-2-like_ partial [Exaiptasia diaphana]	Trichoplax_specH2_tr_A0A369S7Y3_A0A369S7Y3_9METZ tr|A0A369S7Y3|A0A369S7Y3_9METZ Equistatin OS=Trichoplax sp. H2 OX=287889 GN=TrispH2_005616 PE=4 SV=1
OG0000024	Exaiptasia_diaphana_XP_020905524.1 XP_020905524.1 thyroglobulin [Exaiptasia diaphana]	Trichoplax_specH2_tr_A0A369RTM3_A0A369RTM3_9METZ tr|A0A369RTM3|A0A369RTM3_9METZ Boophilin-H2 OS=Trichoplax sp. H2 OX=287889 GN=TrispH2_009566 PE=4 SV=1
OG0000028	Exaiptasia_diaphana_XP_028518629.1 XP_028518629.1 collagen alpha-5_IV_ chain [Exaiptasia diaphana], Exaiptasia_diaphana_XP_020913453.1 XP_020913453.1 collagen alpha-2_IV_ chain [Exaiptasia diaphana]	Trichoplax_specH2_tr_A0A369SN44_A0A369SN44_9METZ tr|A0A369SN44|A0A369SN44_9METZ Collagen alpha-1_IV_ chain OS=Trichoplax sp. H2 OX=287889 GN=TrispH2_000807 PE=4 SV=1, Trichoplax_specH2_tr_A0A369SLF9_A0A369SLF9_9METZ tr|A0A369SLF9|A0A369SLF9_9METZ Collagen alpha-1_IV_ chain OS=Trichoplax sp. H2 OX=287889 GN=TrispH2_000806 PE=4 SV=1
OG0000029	Exaiptasia_diaphana_XP_028517803.1 XP_028517803.1 contactin-associated protein-like 2 [Exaiptasia diaphana], Exaiptasia_diaphana_XP_020911021.1 XP_020911021.1 contactin-associated protein-like 5 [Exaiptasia diaphana], Exaiptasia_diaphana_XP_020911022.1 XP_020911022.1 contactin-associated protein-like 5 [Exaiptasia diaphana], Exaiptasia_diaphana_XP_028519738.1 XP_028519738.1 contactin-associated protein-like 5 [Exaiptasia diaphana], Exaiptasia_diaphana_XP_028513207.1 XP_028513207.1 contactin-associated protein-like 4 [Exaiptasia diaphana], Exaiptasia_diaphana_XP_020894377.1 XP_020894377.1 contactin-associated protein-like 4 [Exaiptasia diaphana], Exaiptasia_diaphana_XP_020894378.1 XP_020894378.1 contactin-associated protein-like 4 [Exaiptasia diaphana], Exaiptasia_diaphana_XP_020893090.1 XP_020893090.1 EGF and laminin G domain-containing protein [Exaiptasia diaphana], Exaiptasia_diaphana_XP_020908663.1 XP_020908663.1 neuronal cell adhesion molecule_ partial [Exaiptasia diaphana], Exaiptasia_diaphana_XP_020901326.2 XP_020901326.2 uncharacterized protein LOC110239917 [Exaiptasia diaphana], Exaiptasia_diaphana_XP_020898281.2 XP_020898281.2 contactin-associated protein 1 [Exaiptasia diaphana], Exaiptasia_diaphana_XP_020904668.2 XP_020904668.2 contactin-associated protein 1 [Exaiptasia diaphana], Exaiptasia_diaphana_XP_020901514.1 XP_020901514.1 contactin-associated protein-like 2 isoform X1 [Exaiptasia diaphana], Exaiptasia_diaphana_XP_020892120.1 XP_020892120.1 fibrillin-1 [Exaiptasia diaphana], Exaiptasia_diaphana_XP_028512646.1 XP_028512646.1 fibrillin-1 [Exaiptasia diaphana], Exaiptasia_diaphana_XP_020904109.2 XP_020904109.2 contactin-associated protein-like 2 [Exaiptasia diaphana]	Trichoplax_specH2_tr_A0A369S5H8_A0A369S5H8_9METZ tr|A0A369S5H8|A0A369S5H8_9METZ Contactin-associated protein-like 5 OS=Trichoplax sp. H2 OX=287889 GN=TrispH2_005166 PE=4 SV=1, Trichoplax_specH2_tr_A0A369SFH7_A0A369SFH7_9METZ tr|A0A369SFH7|A0A369SFH7_9METZ Contactin-associated protein-like 5 OS=Trichoplax sp. H2 OX=287889 GN=TrispH2_002868 PE=4 SV=1, Trichoplax_specH2_tr_A0A369RZ57_A0A369RZ57_9METZ tr|A0A369RZ57|A0A369RZ57_9METZ Contactin-associated protein-like 5 OS=Trichoplax sp. H2 OX=287889 GN=TrispH2_008811 PE=4 SV=1, Trichoplax_specH2_tr_A0A369RZ29_A0A369RZ29_9METZ tr|A0A369RZ29|A0A369RZ29_9METZ Contactin-associated protein-like 5 OS=Trichoplax sp. H2 OX=287889 GN=TrispH2_008809 PE=4 SV=1, Trichoplax_specH2_tr_A0A369RUI3_A0A369RUI3_9METZ tr|A0A369RUI3|A0A369RUI3_9METZ Contactin-associated protein-like 5 OS=Trichoplax sp. H2 OX=287889 GN=TrispH2_010415 PE=4 SV=1
OG0000030	Exaiptasia_diaphana_XP_028518433.1 XP_028518433.1 disintegrin and metalloproteinase domain-containing protein 17 [Exaiptasia diaphana]	Trichoplax_specH2_tr_A0A369S5E1_A0A369S5E1_9METZ tr|A0A369S5E1|A0A369S5E1_9METZ ADAM 17-like protease OS=Trichoplax sp. H2 OX=287889 GN=TrispH2_005778 PE=4 SV=1
OG0000030	Exaiptasia_diaphana_XP_020898884.1 XP_020898884.1 disintegrin and metalloproteinase domain-containing protein 10 [Exaiptasia diaphana], Exaiptasia_diaphana_XP_028517814.1 XP_028517814.1 disintegrin and metalloproteinase domain-containing protein 10 [Exaiptasia diaphana], Exaiptasia_diaphana_XP_020910720.1 XP_020910720.1 disintegrin and metalloproteinase domain-containing protein 10 [Exaiptasia diaphana]	Trichoplax_specH2_tr_A0A369SER2_A0A369SER2_9METZ tr|A0A369SER2|A0A369SER2_9METZ Disintegrin and metalloproteinase domain-containing protein 10 OS=Trichoplax sp. H2 OX=287889 GN=TrispH2_003217 PE=4 SV=1, Trichoplax_specH2_tr_A0A369S7J2_A0A369S7J2_9METZ tr|A0A369S7J2|A0A369S7J2_9METZ Disintegrin and metalloproteinase domain-containing protein 10 OS=Trichoplax sp. H2 OX=287889 GN=TrispH2_005268 PE=4 SV=1, Trichoplax_specH2_tr_A0A369RXA9_A0A369RXA9_9METZ tr|A0A369RXA9|A0A369RXA9_9METZ Disintegrin and metalloproteinase domain-containing protein 10 OS=Trichoplax sp. H2 OX=287889 GN=TrispH2_009082 PE=4 SV=1, Trichoplax_specH2_tr_A0A369RV51_A0A369RV51_9METZ tr|A0A369RV51|A0A369RV51_9METZ Disintegrin and metalloproteinase domain-containing protein 10 OS=Trichoplax sp. H2 OX=287889 GN=TrispH2_008658 PE=4 SV=1
OG0000034	Exaiptasia_diaphana_XP_020912671.1 XP_020912671.1 attractin-like protein 1 [Exaiptasia diaphana], Exaiptasia_diaphana_XP_020915954.1 XP_020915954.1 attractin-like protein 1 isoform X1 [Exaiptasia diaphana], Exaiptasia_diaphana_XP_020916106.1 XP_020916106.1 attractin-like protein 1 isoform X3 [Exaiptasia diaphana], Exaiptasia_diaphana_XP_020916031.1 XP_020916031.1 attractin-like protein 1 isoform X2 [Exaiptasia diaphana]	Trichoplax_specH2_tr_A0A369S1X9_A0A369S1X9_9METZ tr|A0A369S1X9|A0A369S1X9_9METZ Attractin-like protein 1 OS=Trichoplax sp. H2 OX=287889 GN=TrispH2_007083 PE=4 SV=1
OG0000034	Exaiptasia_diaphana_XP_028517202.1 XP_028517202.1 multiple epidermal growth factor-like domains protein 8 [Exaiptasia diaphana]	Trichoplax_specH2_tr_A0A369SCB4_A0A369SCB4_9METZ tr|A0A369SCB4|A0A369SCB4_9METZ Multiple epidermal growth factor-like domains protein 8 OS=Trichoplax sp. H2 OX=287889 GN=TrispH2_004337 PE=4 SV=1
OG0000041	Exaiptasia_diaphana_XP_020912183.1 XP_020912183.1 protein mono-ADP-ribosyltransferase PARP4 isoform X1 [Exaiptasia diaphana], Exaiptasia_diaphana_XP_020912184.1 XP_020912184.1 protein mono-ADP-ribosyltransferase PARP4 isoform X2 [Exaiptasia diaphana], Exaiptasia_diaphana_XP_020912185.1 XP_020912185.1 protein mono-ADP-ribosyltransferase PARP4 isoform X3 [Exaiptasia diaphana], Exaiptasia_diaphana_XP_028518262.1 XP_028518262.1 protein mono-ADP-ribosyltransferase PARP4 isoform X4 [Exaiptasia diaphana], Exaiptasia_diaphana_XP_020912186.1 XP_020912186.1 protein mono-ADP-ribosyltransferase PARP4 isoform X5 [Exaiptasia diaphana]	Trichoplax_specH2_tr_A0A369RUI5_A0A369RUI5_9METZ tr|A0A369RUI5|A0A369RUI5_9METZ Poly [ADP-ribose] polymerase OS=Trichoplax sp. H2 OX=287889 GN=TrispH2_009716 PE=3 SV=1, Trichoplax_specH2_tr_A0A369RVR9_A0A369RVR9_9METZ tr|A0A369RVR9|A0A369RVR9_9METZ Poly [ADP-ribose] polymerase OS=Trichoplax sp. H2 OX=287889 GN=TrispH2_009712 PE=3 SV=1
OG0000047	Exaiptasia_diaphana_XP_020915822.1 XP_020915822.1 ferric-chelate reductase 1 isoform X1 [Exaiptasia diaphana], Exaiptasia_diaphana_XP_020915824.1 XP_020915824.1 ferric-chelate reductase 1 isoform X2 [Exaiptasia diaphana], Exaiptasia_diaphana_XP_020915825.1 XP_020915825.1 ferric-chelate reductase 1 isoform X3 [Exaiptasia diaphana]	Trichoplax_specH2_tr_A0A369RTL2_A0A369RTL2_9METZ tr|A0A369RTL2|A0A369RTL2_9METZ Ferric-chelate reductase 1 OS=Trichoplax sp. H2 OX=287889 GN=TrispH2_010618 PE=3 SV=1
OG0000049	Exaiptasia_diaphana_XP_028518799.1 XP_028518799.1 plexin-A1 [Exaiptasia diaphana]	Trichoplax_specH2_tr_A0A369S9H8_A0A369S9H8_9METZ tr|A0A369S9H8|A0A369S9H8_9METZ Plexin-A2 OS=Trichoplax sp. H2 OX=287889 GN=TrispH2_004244 PE=3 SV=1, Trichoplax_specH2_tr_A0A369SC16_A0A369SC16_9METZ tr|A0A369SC16|A0A369SC16_9METZ Plexin A3 OS=Trichoplax sp. H2 OX=287889 GN=TrispH2_004246 PE=3 SV=1
OG0000051	Exaiptasia_diaphana_XP_028513623.1 XP_028513623.1 voltage-dependent calcium channel subunit alpha-2_delta-3 [Exaiptasia diaphana]	Trichoplax_specH2_tr_A0A369SAB3_A0A369SAB3_9METZ tr|A0A369SAB3|A0A369SAB3_9METZ Voltage-dependent calcium channel subunit alpha-2/delta-1 OS=Trichoplax sp. H2 OX=287889 GN=TrispH2_004901 PE=4 SV=1
OG0000054	Exaiptasia_diaphana_XP_020910667.1 XP_020910667.1 erbin [Exaiptasia diaphana]	Trichoplax_specH2_tr_A0A369S0G0_A0A369S0G0_9METZ tr|A0A369S0G0|A0A369S0G0_9METZ Leucine-rich repeat-containing protein 7 OS=Trichoplax sp. H2 OX=287889 GN=TrispH2_007703 PE=4 SV=1
OG0000054	Exaiptasia_diaphana_XP_028513465.1 XP_028513465.1 protein scribble homolog [Exaiptasia diaphana]	Trichoplax_specH2_tr_A0A369S7Y8_A0A369S7Y8_9METZ tr|A0A369S7Y8|A0A369S7Y8_9METZ Leucine-rich repeat-containing protein 1 OS=Trichoplax sp. H2 OX=287889 GN=TrispH2_005790 PE=4 SV=1
OG0000056	Exaiptasia_diaphana_XP_020900175.1 XP_020900175.1 E3 ubiquitin-protein ligase TRIM9 [Exaiptasia diaphana]	Trichoplax_specH2_tr_A0A369S7K0_A0A369S7K0_9METZ tr|A0A369S7K0|A0A369S7K0_9METZ E3 ubiquitin-protein ligase TRIM9 OS=Trichoplax sp. H2 OX=287889 GN=TrispH2_005591 PE=4 SV=1
OG0000058	Exaiptasia_diaphana_XP_028514138.1 XP_028514138.1 uncharacterized protein LOC110236629 [Exaiptasia diaphana], Exaiptasia_diaphana_XP_028517068.1 XP_028517068.1 uncharacterized protein LOC114575757 [Exaiptasia diaphana], Exaiptasia_diaphana_XP_028516447.1 XP_028516447.1 uncharacterized protein LOC110244407 [Exaiptasia diaphana]	Trichoplax_specH2_tr_A0A369RQT7_A0A369RQT7_9METZ tr|A0A369RQT7|A0A369RQT7_9METZ Neurotrypsin OS=Trichoplax sp. H2 OX=287889 GN=TrispH2_010134 PE=4 SV=1, Trichoplax_specH2_tr_A0A369RTU2_A0A369RTU2_9METZ tr|A0A369RTU2|A0A369RTU2_9METZ MAM and LDL-receptor class A domain-containing protein 2 OS=Trichoplax sp. H2 OX=287889 GN=TrispH2_010594 PE=4 SV=1
