Orthogroup	Cnidaria_Anthozoa_Exaiptasia_diaphana	Placozoa_Trichoplacidae_Trichoplax_spec-H2
OG0000448	Exaiptasia_diaphana_XP_020901814.1 XP_020901814.1 uncharacterized protein LOC110240353 [Exaiptasia diaphana]	Trichoplax_specH2_tr_A0A369S9Q9_A0A369S9Q9_9METZ tr|A0A369S9Q9|A0A369S9Q9_9METZ ATP-binding cassette sub-family A member 1 OS=Trichoplax sp. H2 OX=287889 GN=TrispH2_003678 PE=4 SV=1
OG0000485	Exaiptasia_diaphana_XP_028512628.1 XP_028512628.1 ephrin type-A receptor 4-B isoform X4 [Exaiptasia diaphana], Exaiptasia_diaphana_XP_020892283.1 XP_020892283.1 ephrin type-A receptor 4-B isoform X1 [Exaiptasia diaphana], Exaiptasia_diaphana_XP_020892282.1 XP_020892282.1 ephrin type-A receptor 4-B isoform X1 [Exaiptasia diaphana], Exaiptasia_diaphana_XP_028512627.1 XP_028512627.1 ephrin type-A receptor 4-B isoform X1 [Exaiptasia diaphana], Exaiptasia_diaphana_XP_020892284.1 XP_020892284.1 ephrin type-A receptor 4-B isoform X2 [Exaiptasia diaphana], Exaiptasia_diaphana_XP_020892285.1 XP_020892285.1 ephrin type-A receptor 4-B isoform X3 [Exaiptasia diaphana], Exaiptasia_diaphana_XP_028514051.1 XP_028514051.1 ephrin type-A receptor 4 isoform X1 [Exaiptasia diaphana]	Trichoplax_specH2_tr_A0A369SBF7_A0A369SBF7_9METZ tr|A0A369SBF7|A0A369SBF7_9METZ Ephrin type-A receptor 7 OS=Trichoplax sp. H2 OX=287889 GN=TrispH2_004018 PE=4 SV=1
OG0000809	Exaiptasia_diaphana_XP_028517195.1 XP_028517195.1 slit homolog 3 protein [Exaiptasia diaphana]	Trichoplax_specH2_tr_A0A369S105_A0A369S105_9METZ tr|A0A369S105|A0A369S105_9METZ Carboxypeptidase N subunit 2 OS=Trichoplax sp. H2 OX=287889 GN=TrispH2_007677 PE=4 SV=1
OG0000833	Exaiptasia_diaphana_XP_020905971.1 XP_020905971.1 fibropellin-1 [Exaiptasia diaphana]	Trichoplax_specH2_tr_A0A369S0Z7_A0A369S0Z7_9METZ tr|A0A369S0Z7|A0A369S0Z7_9METZ EGF-like calcium-binding domain-containing protein OS=Trichoplax sp. H2 OX=287889 GN=TrispH2_007471 PE=4 SV=1
OG0001042	Exaiptasia_diaphana_XP_020914406.2 XP_020914406.2 leucine-rich repeat transmembrane neuronal protein 1-like [Exaiptasia diaphana]	Trichoplax_specH2_tr_A0A369RQJ6_A0A369RQJ6_9METZ tr|A0A369RQJ6|A0A369RQJ6_9METZ Leucine-rich repeat-containing protein 15 OS=Trichoplax sp. H2 OX=287889 GN=TrispH2_011248 PE=4 SV=1
OG0001551	Exaiptasia_diaphana_XP_028513352.1 XP_028513352.1 thrombospondin-1 [Exaiptasia diaphana]	Trichoplax_specH2_tr_A0A369S8V5_A0A369S8V5_9METZ tr|A0A369S8V5|A0A369S8V5_9METZ Adhesion G protein-coupled receptor B3 OS=Trichoplax sp. H2 OX=287889 GN=TrispH2_004487 PE=4 SV=1
