Orthogroup	Cnidaria_Anthozoa_Exaiptasia_diaphana	Placozoa_Trichoplacidae_Trichoplax_spec-H2
OG0000001	Exaiptasia_diaphana_XP_028516585.1 XP_028516585.1 laminin subunit beta-1 [Exaiptasia diaphana]	Trichoplax_specH2_tr_A0A369SGJ7_A0A369SGJ7_9METZ tr|A0A369SGJ7|A0A369SGJ7_9METZ Laminin subunit beta-1 OS=Trichoplax sp. H2 OX=287889 GN=TrispH2_001775 PE=4 SV=1
OG0000001	Exaiptasia_diaphana_XP_028518401.1 XP_028518401.1 contactin-6 isoform X3 [Exaiptasia diaphana], Exaiptasia_diaphana_XP_028518216.1 XP_028518216.1 contactin-6 isoform X3 [Exaiptasia diaphana], Exaiptasia_diaphana_XP_020903383.2 XP_020903383.2 contactin-6 isoform X1 [Exaiptasia diaphana], Exaiptasia_diaphana_XP_028517822.1 XP_028517822.1 contactin-6 isoform X1 [Exaiptasia diaphana], Exaiptasia_diaphana_XP_020902298.1 XP_020902298.1 contactin-6 isoform X3 [Exaiptasia diaphana], Exaiptasia_diaphana_XP_028518803.1 XP_028518803.1 contactin-6 isoform X3 [Exaiptasia diaphana], Exaiptasia_diaphana_XP_020904116.2 XP_020904116.2 contactin-6 isoform X2 [Exaiptasia diaphana], Exaiptasia_diaphana_XP_028518005.1 XP_028518005.1 contactin-6 isoform X2 [Exaiptasia diaphana]	Trichoplax_specH2_tr_A0A369S6H3_A0A369S6H3_9METZ tr|A0A369S6H3|A0A369S6H3_9METZ Protein sidekick-1 OS=Trichoplax sp. H2 OX=287889 GN=TrispH2_005469 PE=4 SV=1
OG0000001	Exaiptasia_diaphana_XP_020901424.1 XP_020901424.1 protein sidekick-2 [Exaiptasia diaphana]	Trichoplax_specH2_tr_A0A369S2W3_A0A369S2W3_9METZ tr|A0A369S2W3|A0A369S2W3_9METZ Protein sidekick-2 OS=Trichoplax sp. H2 OX=287889 GN=TrispH2_006253 PE=4 SV=1
OG0000001	Exaiptasia_diaphana_XP_020908774.1 XP_020908774.1 Down syndrome cell adhesion molecule-like protein 1 isoform X2 [Exaiptasia diaphana], Exaiptasia_diaphana_XP_020908773.1 XP_020908773.1 Down syndrome cell adhesion molecule-like protein 1 isoform X1 [Exaiptasia diaphana]	Trichoplax_specH2_tr_A0A369S5F0_A0A369S5F0_9METZ tr|A0A369S5F0|A0A369S5F0_9METZ Down syndrome cell adhesion molecule-like protein OS=Trichoplax sp. H2 OX=287889 GN=TrispH2_007185 PE=4 SV=1
OG0000001	Exaiptasia_diaphana_XP_020916901.1 XP_020916901.1 laminin subunit gamma-1_ partial [Exaiptasia diaphana], Exaiptasia_diaphana_XP_020916243.1 XP_020916243.1 laminin subunit gamma-1 [Exaiptasia diaphana]	Trichoplax_specH2_tr_A0A369SBY2_A0A369SBY2_9METZ tr|A0A369SBY2|A0A369SBY2_9METZ Laminin subunit gamma-1 OS=Trichoplax sp. H2 OX=287889 GN=TrispH2_003028 PE=4 SV=1
OG0000002	Exaiptasia_diaphana_XP_028519693.1 XP_028519693.1 semaphorin-5A [Exaiptasia diaphana], Exaiptasia_diaphana_XP_028519694.1 XP_028519694.1 semaphorin-5A [Exaiptasia diaphana]	Trichoplax_specH2_tr_A0A369SFC4_A0A369SFC4_9METZ tr|A0A369SFC4|A0A369SFC4_9METZ Semaphorin-5A OS=Trichoplax sp. H2 OX=287889 GN=TrispH2_002772 PE=4 SV=1
OG0000002	Exaiptasia_diaphana_XP_028516031.1 XP_028516031.1 semaphorin-3D [Exaiptasia diaphana]	Trichoplax_specH2_tr_A0A369SGE8_A0A369SGE8_9METZ tr|A0A369SGE8|A0A369SGE8_9METZ Semaphorin-5A OS=Trichoplax sp. H2 OX=287889 GN=TrispH2_002776 PE=3 SV=1
OG0000003	Exaiptasia_diaphana_XP_028512924.1 XP_028512924.1 fibrillin-1_ partial [Exaiptasia diaphana], Exaiptasia_diaphana_XP_028517876.1 XP_028517876.1 mucin-2-like [Exaiptasia diaphana]	Trichoplax_specH2_tr_A0A369RUF6_A0A369RUF6_9METZ tr|A0A369RUF6|A0A369RUF6_9METZ EGF-like domain-containing protein OS=Trichoplax sp. H2 OX=287889 GN=TrispH2_010661 PE=4 SV=1, Trichoplax_specH2_tr_A0A369S6N3_A0A369S6N3_9METZ tr|A0A369S6N3|A0A369S6N3_9METZ Pro-epidermal growth factor OS=Trichoplax sp. H2 OX=287889 GN=TrispH2_005589 PE=4 SV=1
OG0000003	Exaiptasia_diaphana_XP_028518736.1 XP_028518736.1 fibrillin-1 [Exaiptasia diaphana]	Trichoplax_specH2_tr_A0A369S631_A0A369S631_9METZ tr|A0A369S631|A0A369S631_9METZ Pro-epidermal growth factor OS=Trichoplax sp. H2 OX=287889 GN=TrispH2_005194 PE=4 SV=1, Trichoplax_specH2_tr_A0A369RXQ2_A0A369RXQ2_9METZ tr|A0A369RXQ2|A0A369RXQ2_9METZ Fibrillin-3 OS=Trichoplax sp. H2 OX=287889 GN=TrispH2_008035 PE=4 SV=1, Trichoplax_specH2_tr_A0A369RQB1_A0A369RQB1_9METZ tr|A0A369RQB1|A0A369RQB1_9METZ Fibrillin-1 _Fragment_ OS=Trichoplax sp. H2 OX=287889 GN=TrispH2_011419 PE=4 SV=1
OG0000004	Exaiptasia_diaphana_XP_028517283.1 XP_028517283.1 coadhesin-like [Exaiptasia diaphana], Exaiptasia_diaphana_XP_020908856.1 XP_020908856.1 coadhesin [Exaiptasia diaphana], Exaiptasia_diaphana_XP_020912230.1 XP_020912230.1 coadhesin [Exaiptasia diaphana], Exaiptasia_diaphana_XP_028518251.1 XP_028518251.1 uncharacterized protein LOC110249981 [Exaiptasia diaphana]	Trichoplax_specH2_tr_A0A369RWX1_A0A369RWX1_9METZ tr|A0A369RWX1|A0A369RWX1_9METZ Protocadherin beta-13 OS=Trichoplax sp. H2 OX=287889 GN=TrispH2_009019 PE=4 SV=1
OG0000004	Exaiptasia_diaphana_XP_020910017.1 XP_020910017.1 protocadherin Fat 4 [Exaiptasia diaphana]	Trichoplax_specH2_tr_A0A369RRF2_A0A369RRF2_9METZ tr|A0A369RRF2|A0A369RRF2_9METZ Protocadherin Fat 4 OS=Trichoplax sp. H2 OX=287889 GN=TrispH2_011401 PE=4 SV=1
OG0000004	Exaiptasia_diaphana_XP_020913069.1 XP_020913069.1 protocadherin-like protein [Exaiptasia diaphana], Exaiptasia_diaphana_XP_020900065.1 XP_020900065.1 protocadherin-like protein [Exaiptasia diaphana], Exaiptasia_diaphana_XP_020900069.1 XP_020900069.1 protocadherin-like protein [Exaiptasia diaphana], Exaiptasia_diaphana_XP_028513163.1 XP_028513163.1 protocadherin-like protein isoform X3 [Exaiptasia diaphana], Exaiptasia_diaphana_XP_028513162.1 XP_028513162.1 protocadherin-like protein isoform X2 [Exaiptasia diaphana], Exaiptasia_diaphana_XP_020894174.1 XP_020894174.1 protocadherin-like protein isoform X1 [Exaiptasia diaphana]	Trichoplax_specH2_tr_A0A369SLV2_A0A369SLV2_9METZ tr|A0A369SLV2|A0A369SLV2_9METZ Protocadherin-like protein OS=Trichoplax sp. H2 OX=287889 GN=TrispH2_001602 PE=4 SV=1
OG0000004	Exaiptasia_diaphana_XP_020902039.1 XP_020902039.1 LOW QUALITY PROTEIN_ fat-like cadherin-related tumor suppressor homolog_ partial [Exaiptasia diaphana]	Trichoplax_specH2_tr_A0A369RXK6_A0A369RXK6_9METZ tr|A0A369RXK6|A0A369RXK6_9METZ Protocadherin Fat 1 OS=Trichoplax sp. H2 OX=287889 GN=TrispH2_009009 PE=4 SV=1
OG0000005	Exaiptasia_diaphana_XP_020906559.1 XP_020906559.1 blastula protease 10 [Exaiptasia diaphana], Exaiptasia_diaphana_XP_020914254.1 XP_020914254.1 zinc metalloproteinase nas-4 [Exaiptasia diaphana], Exaiptasia_diaphana_XP_020908974.1 XP_020908974.1 uncharacterized protein LOC110246932 [Exaiptasia diaphana], Exaiptasia_diaphana_XP_020908967.2 XP_020908967.2 uncharacterized protein LOC110246925 [Exaiptasia diaphana], Exaiptasia_diaphana_XP_020902117.2 XP_020902117.2 nematocyst expressed protein 6-like [Exaiptasia diaphana], Exaiptasia_diaphana_XP_020915721.1 XP_020915721.1 low choriolytic enzyme [Exaiptasia diaphana], Exaiptasia_diaphana_XP_020901461.1 XP_020901461.1 zinc metalloproteinase nas-4_ partial [Exaiptasia diaphana], Exaiptasia_diaphana_XP_020907018.2 XP_020907018.2 blastula protease 10_ partial [Exaiptasia diaphana], Exaiptasia_diaphana_XP_020916020.1 XP_020916020.1 blastula protease 10 [Exaiptasia diaphana], Exaiptasia_diaphana_XP_020901178.2 XP_020901178.2 zinc metalloproteinase nas-15 [Exaiptasia diaphana], Exaiptasia_diaphana_XP_020908170.1 XP_020908170.1 zinc metalloproteinase nas-15 [Exaiptasia diaphana], Exaiptasia_diaphana_XP_020910129.1 XP_020910129.1 zinc metalloproteinase nas-15 [Exaiptasia diaphana], Exaiptasia_diaphana_XP_020901630.1 XP_020901630.1 zinc metalloproteinase nas-4 [Exaiptasia diaphana], Exaiptasia_diaphana_XP_020901634.1 XP_020901634.1 blastula protease 10-like [Exaiptasia diaphana], Exaiptasia_diaphana_XP_020901633.1 XP_020901633.1 zinc metalloproteinase nas-15 [Exaiptasia diaphana], Exaiptasia_diaphana_XP_020901632.1 XP_020901632.1 blastula protease 10 [Exaiptasia diaphana], Exaiptasia_diaphana_XP_028515202.1 XP_028515202.1 zinc metalloproteinase nas-15 [Exaiptasia diaphana], Exaiptasia_diaphana_XP_028515434.1 XP_028515434.1 zinc metalloproteinase nas-15 [Exaiptasia diaphana], Exaiptasia_diaphana_XP_020914948.1 XP_020914948.1 zinc metalloproteinase nas-13 [Exaiptasia diaphana], Exaiptasia_diaphana_XP_028514125.1 XP_028514125.1 zinc metalloproteinase nas-13 isoform X1 [Exaiptasia diaphana], Exaiptasia_diaphana_XP_028514126.1 XP_028514126.1 zinc metalloproteinase nas-13 isoform X2 [Exaiptasia diaphana], Exaiptasia_diaphana_XP_020893266.1 XP_020893266.1 uncharacterized protein LOC110232415 [Exaiptasia diaphana], Exaiptasia_diaphana_XP_020893267.1 XP_020893267.1 uncharacterized protein LOC110232415 [Exaiptasia diaphana], Exaiptasia_diaphana_XP_020909077.1 XP_020909077.1 zinc metalloproteinase nas-1 [Exaiptasia diaphana], Exaiptasia_diaphana_XP_028512430.1 XP_028512430.1 zinc metalloproteinase nas-36 [Exaiptasia diaphana], Exaiptasia_diaphana_XP_028514338.1 XP_028514338.1 zinc metalloproteinase nas-4_ partial [Exaiptasia diaphana], Exaiptasia_diaphana_XP_020911183.1 XP_020911183.1 bone morphogenetic protein 1 [Exaiptasia diaphana]	Trichoplax_specH2_tr_A0A369RXS2_A0A369RXS2_9METZ tr|A0A369RXS2|A0A369RXS2_9METZ Metalloendopeptidase OS=Trichoplax sp. H2 OX=287889 GN=TrispH2_008764 PE=4 SV=1, Trichoplax_specH2_tr_A0A369RXS7_A0A369RXS7_9METZ tr|A0A369RXS7|A0A369RXS7_9METZ Metalloendopeptidase OS=Trichoplax sp. H2 OX=287889 GN=TrispH2_008765 PE=4 SV=1, Trichoplax_specH2_tr_A0A369RVQ8_A0A369RVQ8_9METZ tr|A0A369RVQ8|A0A369RVQ8_9METZ Metalloendopeptidase OS=Trichoplax sp. H2 OX=287889 GN=TrispH2_009194 PE=4 SV=1, Trichoplax_specH2_tr_A0A369S221_A0A369S221_9METZ tr|A0A369S221|A0A369S221_9METZ Metalloendopeptidase OS=Trichoplax sp. H2 OX=287889 GN=TrispH2_007517 PE=4 SV=1, Trichoplax_specH2_tr_A0A369RTA1_A0A369RTA1_9METZ tr|A0A369RTA1|A0A369RTA1_9METZ Metalloendopeptidase OS=Trichoplax sp. H2 OX=287889 GN=TrispH2_010451 PE=4 SV=1, Trichoplax_specH2_tr_A0A369SCL3_A0A369SCL3_9METZ tr|A0A369SCL3|A0A369SCL3_9METZ Metalloendopeptidase OS=Trichoplax sp. H2 OX=287889 GN=TrispH2_003256 PE=4 SV=1
OG0000007	Exaiptasia_diaphana_XP_028519369.1 XP_028519369.1 mucin-like protein [Exaiptasia diaphana]	Trichoplax_specH2_tr_A0A369SAV9_A0A369SAV9_9METZ tr|A0A369SAV9|A0A369SAV9_9METZ Multiple epidermal growth factor-like domains protein 6 OS=Trichoplax sp. H2 OX=287889 GN=TrispH2_004559 PE=4 SV=1
OG0000007	Exaiptasia_diaphana_XP_028517538.1 XP_028517538.1 mucin-like protein_ partial [Exaiptasia diaphana], Exaiptasia_diaphana_XP_028518064.1 XP_028518064.1 mucin-like protein_ partial [Exaiptasia diaphana], Exaiptasia_diaphana_XP_028518950.1 XP_028518950.1 mucin-like protein [Exaiptasia diaphana], Exaiptasia_diaphana_XP_020893670.2 XP_020893670.2 mucin-like protein [Exaiptasia diaphana], Exaiptasia_diaphana_XP_028517536.1 XP_028517536.1 mucin-like protein [Exaiptasia diaphana], Exaiptasia_diaphana_XP_020902301.1 XP_020902301.1 mucin-like protein_ partial [Exaiptasia diaphana], Exaiptasia_diaphana_XP_028515682.1 XP_028515682.1 uncharacterized protein LOC110241747 [Exaiptasia diaphana], Exaiptasia_diaphana_XP_028513418.1 XP_028513418.1 uncharacterized protein LOC110234357 [Exaiptasia diaphana], Exaiptasia_diaphana_XP_020915371.2 XP_020915371.2 mucin-like protein [Exaiptasia diaphana], Exaiptasia_diaphana_XP_020915241.1 XP_020915241.1 mucin-like protein_ partial [Exaiptasia diaphana], Exaiptasia_diaphana_XP_028514098.1 XP_028514098.1 mucin-like protein_ partial [Exaiptasia diaphana]	Trichoplax_specH2_tr_A0A369S010_A0A369S010_9METZ tr|A0A369S010|A0A369S010_9METZ Mucin-like protein OS=Trichoplax sp. H2 OX=287889 GN=TrispH2_008355 PE=4 SV=1, Trichoplax_specH2_tr_A0A369RY43_A0A369RY43_9METZ tr|A0A369RY43|A0A369RY43_9METZ Mucin-like protein OS=Trichoplax sp. H2 OX=287889 GN=TrispH2_008351 PE=4 SV=1, Trichoplax_specH2_tr_A0A369RZ11_A0A369RZ11_9METZ tr|A0A369RZ11|A0A369RZ11_9METZ Mucin-like protein OS=Trichoplax sp. H2 OX=287889 GN=TrispH2_008354 PE=4 SV=1, Trichoplax_specH2_tr_A0A369RYK0_A0A369RYK0_9METZ tr|A0A369RYK0|A0A369RYK0_9METZ Mucin-like protein OS=Trichoplax sp. H2 OX=287889 GN=TrispH2_008353 PE=4 SV=1
OG0000007	Exaiptasia_diaphana_XP_020915927.1 XP_020915927.1 uncharacterized protein LOC110253367 [Exaiptasia diaphana], Exaiptasia_diaphana_XP_020895662.2 XP_020895662.2 fibulin-1 [Exaiptasia diaphana]	Trichoplax_specH2_tr_A0A369RQ73_A0A369RQ73_9METZ tr|A0A369RQ73|A0A369RQ73_9METZ Mucin-like protein OS=Trichoplax sp. H2 OX=287889 GN=TrispH2_011343 PE=4 SV=1, Trichoplax_specH2_tr_A0A369RPH5_A0A369RPH5_9METZ tr|A0A369RPH5|A0A369RPH5_9METZ Mucin-like protein OS=Trichoplax sp. H2 OX=287889 GN=TrispH2_011565 PE=4 SV=1, Trichoplax_specH2_tr_A0A369S4T6_A0A369S4T6_9METZ tr|A0A369S4T6|A0A369S4T6_9METZ Mucin-like protein _Fragment_ OS=Trichoplax sp. H2 OX=287889 GN=TrispH2_007189 PE=4 SV=1, Trichoplax_specH2_tr_A0A369RN78_A0A369RN78_9METZ tr|A0A369RN78|A0A369RN78_9METZ Latent-transforming growth factor beta-binding protein 1 _Fragment_ OS=Trichoplax sp. H2 OX=287889 GN=TrispH2_011578 PE=4 SV=1, Trichoplax_specH2_tr_A0A369S2P8_A0A369S2P8_9METZ tr|A0A369S2P8|A0A369S2P8_9METZ Mucin-like protein OS=Trichoplax sp. H2 OX=287889 GN=TrispH2_005647 PE=4 SV=1, Trichoplax_specH2_tr_A0A369RWY4_A0A369RWY4_9METZ tr|A0A369RWY4|A0A369RWY4_9METZ Mucin-like protein OS=Trichoplax sp. H2 OX=287889 GN=TrispH2_008034 PE=4 SV=1, Trichoplax_specH2_tr_A0A369SB42_A0A369SB42_9METZ tr|A0A369SB42|A0A369SB42_9METZ Neurogenic locus notch-like protein 1 OS=Trichoplax sp. H2 OX=287889 GN=TrispH2_004605 PE=4 SV=1, Trichoplax_specH2_tr_A0A369RXM4_A0A369RXM4_9METZ tr|A0A369RXM4|A0A369RXM4_9METZ Mucin-like protein _Fragment_ OS=Trichoplax sp. H2 OX=287889 GN=TrispH2_008039 PE=4 SV=1, Trichoplax_specH2_tr_A0A369S5X3_A0A369S5X3_9METZ tr|A0A369S5X3|A0A369S5X3_9METZ Mucin-like protein _Fragment_ OS=Trichoplax sp. H2 OX=287889 GN=TrispH2_005312 PE=4 SV=1, Trichoplax_specH2_tr_A0A369RXN5_A0A369RXN5_9METZ tr|A0A369RXN5|A0A369RXN5_9METZ Fibrillin-2 OS=Trichoplax sp. H2 OX=287889 GN=TrispH2_008036 PE=3 SV=1, Trichoplax_specH2_tr_A0A369RY18_A0A369RY18_9METZ tr|A0A369RY18|A0A369RY18_9METZ Mucin-like protein OS=Trichoplax sp. H2 OX=287889 GN=TrispH2_007838 PE=4 SV=1, Trichoplax_specH2_tr_A0A369RNR1_A0A369RNR1_9METZ tr|A0A369RNR1|A0A369RNR1_9METZ Mucin-like protein _Fragment_ OS=Trichoplax sp. H2 OX=287889 GN=TrispH2_011392 PE=4 SV=1, Trichoplax_specH2_tr_A0A369RXL3_A0A369RXL3_9METZ tr|A0A369RXL3|A0A369RXL3_9METZ Mucin-like protein _Fragment_ OS=Trichoplax sp. H2 OX=287889 GN=TrispH2_007837 PE=4 SV=1
OG0000007	Exaiptasia_diaphana_XP_028519601.1 XP_028519601.1 fibulin-1-like [Exaiptasia diaphana], Exaiptasia_diaphana_XP_020908530.1 XP_020908530.1 fibrillin-2 isoform X1 [Exaiptasia diaphana], Exaiptasia_diaphana_XP_020908531.1 XP_020908531.1 fibrillin-2 isoform X2 [Exaiptasia diaphana]	Trichoplax_specH2_tr_A0A369S2C9_A0A369S2C9_9METZ tr|A0A369S2C9|A0A369S2C9_9METZ Pro-epidermal growth factor OS=Trichoplax sp. H2 OX=287889 GN=TrispH2_007469 PE=4 SV=1, Trichoplax_specH2_tr_A0A369S0Z1_A0A369S0Z1_9METZ tr|A0A369S0Z1|A0A369S0Z1_9METZ Nidogen-2 OS=Trichoplax sp. H2 OX=287889 GN=TrispH2_007470 PE=4 SV=1, Trichoplax_specH2_tr_A0A369RUV9_A0A369RUV9_9METZ tr|A0A369RUV9|A0A369RUV9_9METZ Pro-epidermal growth factor OS=Trichoplax sp. H2 OX=287889 GN=TrispH2_010664 PE=4 SV=1
OG0000008	Exaiptasia_diaphana_XP_020908364.1 XP_020908364.1 neurogenic locus notch homolog protein 1 [Exaiptasia diaphana], Exaiptasia_diaphana_XP_028516255.1 XP_028516255.1 uromodulin-like [Exaiptasia diaphana], Exaiptasia_diaphana_XP_028516256.1 XP_028516256.1 uncharacterized protein LOC110243828 [Exaiptasia diaphana], Exaiptasia_diaphana_XP_020905625.1 XP_020905625.1 uncharacterized protein LOC110243830_ partial [Exaiptasia diaphana], Exaiptasia_diaphana_XP_028516771.1 XP_028516771.1 fibropellin-1 [Exaiptasia diaphana], Exaiptasia_diaphana_XP_020893910.1 XP_020893910.1 oncoprotein-induced transcript 3 protein isoform X2 [Exaiptasia diaphana], Exaiptasia_diaphana_XP_028513086.1 XP_028513086.1 neurogenic locus Notch protein [Exaiptasia diaphana], Exaiptasia_diaphana_XP_028519038.1 XP_028519038.1 uncharacterized protein LOC110252550 isoform X2 [Exaiptasia diaphana], Exaiptasia_diaphana_XP_020915034.1 XP_020915034.1 uncharacterized protein LOC110252550 isoform X1 [Exaiptasia diaphana], Exaiptasia_diaphana_XP_028516912.1 XP_028516912.1 uromodulin-like [Exaiptasia diaphana], Exaiptasia_diaphana_XP_028518784.1 XP_028518784.1 cubilin-like [Exaiptasia diaphana], Exaiptasia_diaphana_XP_028513929.1 XP_028513929.1 uromodulin-like [Exaiptasia diaphana], Exaiptasia_diaphana_XP_020904484.1 XP_020904484.1 uromodulin [Exaiptasia diaphana], Exaiptasia_diaphana_XP_028514431.1 XP_028514431.1 uromodulin [Exaiptasia diaphana], Exaiptasia_diaphana_XP_028513931.1 XP_028513931.1 uncharacterized protein LOC114574740 [Exaiptasia diaphana], Exaiptasia_diaphana_XP_020897911.1 XP_020897911.1 uromodulin [Exaiptasia diaphana]	Trichoplax_specH2_tr_A0A369RQN3_A0A369RQN3_9METZ tr|A0A369RQN3|A0A369RQN3_9METZ Oncoprotein-induced transcript 3 protein OS=Trichoplax sp. H2 OX=287889 GN=TrispH2_010898 PE=4 SV=1, Trichoplax_specH2_tr_A0A369RVT7_A0A369RVT7_9METZ tr|A0A369RVT7|A0A369RVT7_9METZ Oncoprotein-induced transcript 3 protein OS=Trichoplax sp. H2 OX=287889 GN=TrispH2_010640 PE=4 SV=1, Trichoplax_specH2_tr_A0A369SAR6_A0A369SAR6_9METZ tr|A0A369SAR6|A0A369SAR6_9METZ Neurogenic locus notch-like protein 1 _Fragment_ OS=Trichoplax sp. H2 OX=287889 GN=TrispH2_004287 PE=4 SV=1, Trichoplax_specH2_tr_A0A369S4F0_A0A369S4F0_9METZ tr|A0A369S4F0|A0A369S4F0_9METZ Neurogenic locus notch-like protein 1 OS=Trichoplax sp. H2 OX=287889 GN=TrispH2_006297 PE=4 SV=1, Trichoplax_specH2_tr_A0A369RZ02_A0A369RZ02_9METZ tr|A0A369RZ02|A0A369RZ02_9METZ Neurogenic locus notch-like protein 1 OS=Trichoplax sp. H2 OX=287889 GN=TrispH2_007780 PE=4 SV=1, Trichoplax_specH2_tr_A0A369RPA6_A0A369RPA6_9METZ tr|A0A369RPA6|A0A369RPA6_9METZ Neurogenic locus notch-like protein 1 OS=Trichoplax sp. H2 OX=287889 GN=TrispH2_011618 PE=4 SV=1, Trichoplax_specH2_tr_A0A369RQA4_A0A369RQA4_9METZ tr|A0A369RQA4|A0A369RQA4_9METZ Neurogenic locus Notch protein _Fragment_ OS=Trichoplax sp. H2 OX=287889 GN=TrispH2_010772 PE=4 SV=1, Trichoplax_specH2_tr_A0A369RQ96_A0A369RQ96_9METZ tr|A0A369RQ96|A0A369RQ96_9METZ Fibropellin-1 OS=Trichoplax sp. H2 OX=287889 GN=TrispH2_010769 PE=4 SV=1, Trichoplax_specH2_tr_A0A369RYD6_A0A369RYD6_9METZ tr|A0A369RYD6|A0A369RYD6_9METZ Neurogenic locus notch-like protein 1 OS=Trichoplax sp. H2 OX=287889 GN=TrispH2_007985 PE=4 SV=1
OG0000008	Exaiptasia_diaphana_XP_020901125.1 XP_020901125.1 fibropellin-1_ partial [Exaiptasia diaphana]	Trichoplax_specH2_tr_A0A369RQA9_A0A369RQA9_9METZ tr|A0A369RQA9|A0A369RQA9_9METZ Neurogenic locus notch-like protein 3 OS=Trichoplax sp. H2 OX=287889 GN=TrispH2_010771 PE=4 SV=1
OG0000008	Exaiptasia_diaphana_XP_028513439.1 XP_028513439.1 fibulin-1 [Exaiptasia diaphana], Exaiptasia_diaphana_XP_020912929.2 XP_020912929.2 protein kinase C-binding protein NELL2-like [Exaiptasia diaphana], Exaiptasia_diaphana_XP_020911361.1 XP_020911361.1 fibropellin-1 isoform X2 [Exaiptasia diaphana], Exaiptasia_diaphana_XP_020911360.1 XP_020911360.1 fibropellin-1 isoform X1 [Exaiptasia diaphana]	Trichoplax_specH2_tr_A0A369SC23_A0A369SC23_9METZ tr|A0A369SC23|A0A369SC23_9METZ Protein crumbs OS=Trichoplax sp. H2 OX=287889 GN=TrispH2_003111 PE=4 SV=1
OG0000009	Exaiptasia_diaphana_XP_020913923.2 XP_020913923.2 CUB domain-containing protein 2 [Exaiptasia diaphana], Exaiptasia_diaphana_XP_020913902.1 XP_020913902.1 procollagen C-endopeptidase enhancer 2 [Exaiptasia diaphana]	Trichoplax_specH2_tr_A0A369SFK8_A0A369SFK8_9METZ tr|A0A369SFK8|A0A369SFK8_9METZ Cubilin OS=Trichoplax sp. H2 OX=287889 GN=TrispH2_002786 PE=4 SV=1
OG0000009	Exaiptasia_diaphana_XP_020905815.1 XP_020905815.1 tolloid-like protein 2_ partial [Exaiptasia diaphana], Exaiptasia_diaphana_XP_020905817.2 XP_020905817.2 tolloid-like protein 2 [Exaiptasia diaphana], Exaiptasia_diaphana_XP_020905818.2 XP_020905818.2 protein shisa-5-like_ partial [Exaiptasia diaphana], Exaiptasia_diaphana_XP_020905821.1 XP_020905821.1 tolloid-like protein 2 [Exaiptasia diaphana], Exaiptasia_diaphana_XP_020905820.1 XP_020905820.1 tolloid-like protein 2 [Exaiptasia diaphana], Exaiptasia_diaphana_XP_028518116.1 XP_028518116.1 cubilin [Exaiptasia diaphana], Exaiptasia_diaphana_XP_020911687.2 XP_020911687.2 cubilin-like [Exaiptasia diaphana], Exaiptasia_diaphana_XP_020902050.1 XP_020902050.1 tolloid-like protein 1 [Exaiptasia diaphana], Exaiptasia_diaphana_XP_020914019.1 XP_020914019.1 tolloid-like protein 1 [Exaiptasia diaphana], Exaiptasia_diaphana_XP_020905197.1 XP_020905197.1 tolloid-like protein 1 [Exaiptasia diaphana], Exaiptasia_diaphana_XP_020913976.1 XP_020913976.1 cubilin [Exaiptasia diaphana], Exaiptasia_diaphana_XP_020913978.1 XP_020913978.1 dorsal-ventral patterning tolloid-like protein 1 isoform X1 [Exaiptasia diaphana], Exaiptasia_diaphana_XP_020913979.1 XP_020913979.1 dorsal-ventral patterning tolloid-like protein 1 isoform X2 [Exaiptasia diaphana], Exaiptasia_diaphana_XP_020909071.1 XP_020909071.1 tolloid-like protein 1 [Exaiptasia diaphana]	Trichoplax_specH2_tr_A0A369SFU7_A0A369SFU7_9METZ tr|A0A369SFU7|A0A369SFU7_9METZ Cubilin OS=Trichoplax sp. H2 OX=287889 GN=TrispH2_002261 PE=4 SV=1
OG0000010	Exaiptasia_diaphana_XP_020914581.2 XP_020914581.2 basement membrane-specific heparan sulfate proteoglycan core protein [Exaiptasia diaphana]	Trichoplax_specH2_tr_A0A369RPG1_A0A369RPG1_9METZ tr|A0A369RPG1|A0A369RPG1_9METZ Basement membrane-specific heparan sulfate proteoglycan core protein _Fragment_ OS=Trichoplax sp. H2 OX=287889 GN=TrispH2_010827 PE=4 SV=1
OG0000010	Exaiptasia_diaphana_XP_020899237.1 XP_020899237.1 roundabout homolog 1 isoform X4 [Exaiptasia diaphana], Exaiptasia_diaphana_XP_028514562.1 XP_028514562.1 roundabout homolog 1 isoform X1 [Exaiptasia diaphana], Exaiptasia_diaphana_XP_020899232.1 XP_020899232.1 roundabout homolog 1 isoform X1 [Exaiptasia diaphana], Exaiptasia_diaphana_XP_020899235.1 XP_020899235.1 roundabout homolog 1 isoform X2 [Exaiptasia diaphana], Exaiptasia_diaphana_XP_020899236.1 XP_020899236.1 roundabout homolog 1 isoform X3 [Exaiptasia diaphana], Exaiptasia_diaphana_XP_020899238.1 XP_020899238.1 roundabout homolog 1 isoform X5 [Exaiptasia diaphana]	Trichoplax_specH2_tr_A0A369S1P8_A0A369S1P8_9METZ tr|A0A369S1P8|A0A369S1P8_9METZ Roundabout-like protein 3 OS=Trichoplax sp. H2 OX=287889 GN=TrispH2_007861 PE=4 SV=1
OG0000010	Exaiptasia_diaphana_XP_028519293.1 XP_028519293.1 hemicentin-2-like [Exaiptasia diaphana], Exaiptasia_diaphana_XP_028519300.1 XP_028519300.1 hemicentin-1 [Exaiptasia diaphana]	Trichoplax_specH2_tr_A0A369RVV2_A0A369RVV2_9METZ tr|A0A369RVV2|A0A369RVV2_9METZ Neural cell adhesion molecule 2 OS=Trichoplax sp. H2 OX=287889 GN=TrispH2_010641 PE=4 SV=1, Trichoplax_specH2_tr_A0A369RWI3_A0A369RWI3_9METZ tr|A0A369RWI3|A0A369RWI3_9METZ Protein sax-3 OS=Trichoplax sp. H2 OX=287889 GN=TrispH2_010638 PE=4 SV=1
OG0000010	Exaiptasia_diaphana_XP_020898537.1 XP_020898537.1 hemicentin-1 [Exaiptasia diaphana], Exaiptasia_diaphana_XP_020898540.1 XP_020898540.1 uncharacterized protein LOC110237290 [Exaiptasia diaphana], Exaiptasia_diaphana_XP_020906332.1 XP_020906332.1 titin_ partial [Exaiptasia diaphana], Exaiptasia_diaphana_XP_020906312.1 XP_020906312.1 neurogenic locus notch homolog protein 1 [Exaiptasia diaphana], Exaiptasia_diaphana_XP_020898535.1 XP_020898535.1 hemicentin-1 [Exaiptasia diaphana], Exaiptasia_diaphana_XP_020902103.1 XP_020902103.1 hemicentin-1 [Exaiptasia diaphana], Exaiptasia_diaphana_XP_028519211.1 XP_028519211.1 neural cell adhesion molecule 1-like_ partial [Exaiptasia diaphana]	Trichoplax_specH2_tr_A0A369RVJ4_A0A369RVJ4_9METZ tr|A0A369RVJ4|A0A369RVJ4_9METZ Hemicentin-2 _Fragment_ OS=Trichoplax sp. H2 OX=287889 GN=TrispH2_009801 PE=4 SV=1
OG0000010	Exaiptasia_diaphana_XP_028517264.1 XP_028517264.1 neural cell adhesion molecule 2 [Exaiptasia diaphana]	Trichoplax_specH2_tr_A0A369S339_A0A369S339_9METZ tr|A0A369S339|A0A369S339_9METZ Hemicentin-1 _Fragment_ OS=Trichoplax sp. H2 OX=287889 GN=TrispH2_007564 PE=4 SV=1
OG0000010	Exaiptasia_diaphana_XP_020894828.2 XP_020894828.2 protein eyes shut homolog [Exaiptasia diaphana], Exaiptasia_diaphana_XP_028518930.1 XP_028518930.1 basement membrane-specific heparan sulfate proteoglycan core protein [Exaiptasia diaphana], Exaiptasia_diaphana_XP_028518186.1 XP_028518186.1 pikachurin [Exaiptasia diaphana]	Trichoplax_specH2_tr_A0A369SBT0_A0A369SBT0_9METZ tr|A0A369SBT0|A0A369SBT0_9METZ Agrin OS=Trichoplax sp. H2 OX=287889 GN=TrispH2_004613 PE=4 SV=1
