Orthogroup	Choanozoa_Choanoflagellatea_Salpingoeca_rosetta	Chordata_Vertebrata_Homo_sapiens
OG0000001	Salpingoeca_rosetta_XP_004993731.1 XP_004993731.1 laminin alpha 5 chain [Salpingoeca rosetta]	Homo_sapiens_sp_Q96CW9_NTNG2_HUMAN sp|Q96CW9|NTNG2_HUMAN Netrin-G2 OS=Homo sapiens OX=9606 GN=NTNG2 PE=1 SV=2, Homo_sapiens_sp_Q9Y2I2_NTNG1_HUMAN sp|Q9Y2I2|NTNG1_HUMAN Netrin-G1 OS=Homo sapiens OX=9606 GN=NTNG1 PE=1 SV=3, Homo_sapiens_sp_O00634_NET3_HUMAN sp|O00634|NET3_HUMAN Netrin-3 OS=Homo sapiens OX=9606 GN=NTN3 PE=1 SV=1, Homo_sapiens_sp_Q9Y6N6_LAMC3_HUMAN sp|Q9Y6N6|LAMC3_HUMAN Laminin subunit gamma-3 OS=Homo sapiens OX=9606 GN=LAMC3 PE=1 SV=3, Homo_sapiens_sp_P11047_LAMC1_HUMAN sp|P11047|LAMC1_HUMAN Laminin subunit gamma-1 OS=Homo sapiens OX=9606 GN=LAMC1 PE=1 SV=3
OG0000003	Salpingoeca_rosetta_XP_004995286.1 XP_004995286.1 lung surfactant protein A [Salpingoeca rosetta], Salpingoeca_rosetta_XP_004992387.1 XP_004992387.1 salivary C-type lectin [Salpingoeca rosetta], Salpingoeca_rosetta_XP_004997986.1 XP_004997986.1 C-type lectin [Salpingoeca rosetta]	Homo_sapiens_sp_Q9BWP8_COL11_HUMAN sp|Q9BWP8|COL11_HUMAN Collectin-11 OS=Homo sapiens OX=9606 GN=COLEC11 PE=1 SV=1, Homo_sapiens_sp_Q9Y6Z7_COL10_HUMAN sp|Q9Y6Z7|COL10_HUMAN Collectin-10 OS=Homo sapiens OX=9606 GN=COLEC10 PE=1 SV=2, Homo_sapiens_sp_P11226_MBL2_HUMAN sp|P11226|MBL2_HUMAN Mannose-binding protein C OS=Homo sapiens OX=9606 GN=MBL2 PE=1 SV=2
OG0000006	Salpingoeca_rosetta_XP_004992611.1 XP_004992611.1 uncharacterized protein PTSG_12546 [Salpingoeca rosetta], Salpingoeca_rosetta_XP_004987977.1 XP_004987977.1 NHL repeat-containing protein [Salpingoeca rosetta], Salpingoeca_rosetta_XP_004990947.1 XP_004990947.1 NHL repeat-containing protein [Salpingoeca rosetta], Salpingoeca_rosetta_XP_004987838.1 XP_004987838.1 uncharacterized protein PTSG_13151 [Salpingoeca rosetta], Salpingoeca_rosetta_XP_004989977.1 XP_004989977.1 NHL repeat protein [Salpingoeca rosetta], Salpingoeca_rosetta_XP_004990650.1 XP_004990650.1 NHL repeat-containing protein [Salpingoeca rosetta], Salpingoeca_rosetta_XP_004996527.1 XP_004996527.1 NHL repeat protein [Salpingoeca rosetta], Salpingoeca_rosetta_XP_004997497.1 XP_004997497.1 uncharacterized protein PTSG_01519 [Salpingoeca rosetta]	Homo_sapiens_sp_Q53RD9_FBLN7_HUMAN sp|Q53RD9|FBLN7_HUMAN Fibulin-7 OS=Homo sapiens OX=9606 GN=FBLN7 PE=2 SV=1
OG0000011	Salpingoeca_rosetta_XP_004994000.1 XP_004994000.1 uncharacterized protein PTSG_12315 [Salpingoeca rosetta]	Homo_sapiens_sp_Q96FE7_P3IP1_HUMAN sp|Q96FE7|P3IP1_HUMAN Phosphoinositide-3-kinase-interacting protein 1 OS=Homo sapiens OX=9606 GN=PIK3IP1 PE=1 SV=2
OG0000020	Salpingoeca_rosetta_XP_004997835.1 XP_004997835.1 uncharacterized protein PTSG_11789 [Salpingoeca rosetta], Salpingoeca_rosetta_XP_004999076.1 XP_004999076.1 uncharacterized protein PTSG_11601 [Salpingoeca rosetta]	Homo_sapiens_sp_Q17RW2_COOA1_HUMAN sp|Q17RW2|COOA1_HUMAN Collagen alpha-1_XXIV_ chain OS=Homo sapiens OX=9606 GN=COL24A1 PE=1 SV=2, Homo_sapiens_sp_Q8IZC6_CORA1_HUMAN sp|Q8IZC6|CORA1_HUMAN Collagen alpha-1_XXVII_ chain OS=Homo sapiens OX=9606 GN=COL27A1 PE=1 SV=1
OG0000022	Salpingoeca_rosetta_XP_004988766.1 XP_004988766.1 annexin A7 [Salpingoeca rosetta]	Homo_sapiens_sp_P20073_ANXA7_HUMAN sp|P20073|ANXA7_HUMAN Annexin A7 OS=Homo sapiens OX=9606 GN=ANXA7 PE=1 SV=3
OG0000022	Salpingoeca_rosetta_XP_004993260.1 XP_004993260.1 uncharacterized protein PTSG_12438 [Salpingoeca rosetta], Salpingoeca_rosetta_XP_004993498.1 XP_004993498.1 uncharacterized protein PTSG_12342 [Salpingoeca rosetta], Salpingoeca_rosetta_XP_004993501.1 XP_004993501.1 annexin A7 [Salpingoeca rosetta]	Homo_sapiens_sp_P27216_ANX13_HUMAN sp|P27216|ANX13_HUMAN Annexin A13 OS=Homo sapiens OX=9606 GN=ANXA13 PE=1 SV=3
OG0000030	Salpingoeca_rosetta_XP_004993196.1 XP_004993196.1 ADAM-17 protein [Salpingoeca rosetta], Salpingoeca_rosetta_XP_004992519.1 XP_004992519.1 uncharacterized protein PTSG_07102 [Salpingoeca rosetta], Salpingoeca_rosetta_XP_004990777.1 XP_004990777.1 uncharacterized protein PTSG_07278 [Salpingoeca rosetta]	Homo_sapiens_sp_P78536_ADA17_HUMAN sp|P78536|ADA17_HUMAN Disintegrin and metalloproteinase domain-containing protein 17 OS=Homo sapiens OX=9606 GN=ADAM17 PE=1 SV=1
OG0000030	Salpingoeca_rosetta_XP_004994795.1 XP_004994795.1 uncharacterized protein PTSG_03901 [Salpingoeca rosetta], Salpingoeca_rosetta_XP_004988368.1 XP_004988368.1 uncharacterized protein PTSG_10317 [Salpingoeca rosetta]	Homo_sapiens_sp_O14672_ADA10_HUMAN sp|O14672|ADA10_HUMAN Disintegrin and metalloproteinase domain-containing protein 10 OS=Homo sapiens OX=9606 GN=ADAM10 PE=1 SV=1
OG0000034	Salpingoeca_rosetta_XP_004991206.1 XP_004991206.1 wnt inhibitory factor 1 [Salpingoeca rosetta], Salpingoeca_rosetta_XP_004999045.1 XP_004999045.1 laminin B1 [Salpingoeca rosetta]	Homo_sapiens_sp_Q7Z7M0_MEGF8_HUMAN sp|Q7Z7M0|MEGF8_HUMAN Multiple epidermal growth factor-like domains protein 8 OS=Homo sapiens OX=9606 GN=MEGF8 PE=1 SV=2
OG0000041	Salpingoeca_rosetta_XP_004992203.1 XP_004992203.1 beta-actin [Salpingoeca rosetta]	Homo_sapiens_sp_O00534_VMA5A_HUMAN sp|O00534|VMA5A_HUMAN von Willebrand factor A domain-containing protein 5A OS=Homo sapiens OX=9606 GN=VWA5A PE=1 SV=2, Homo_sapiens_sp_Q5TIE3_VW5B1_HUMAN sp|Q5TIE3|VW5B1_HUMAN von Willebrand factor A domain-containing protein 5B1 OS=Homo sapiens OX=9606 GN=VWA5B1 PE=1 SV=2
OG0000048	Salpingoeca_rosetta_XP_004987589.1 XP_004987589.1 uncharacterized protein PTSG_13192_ partial [Salpingoeca rosetta]	Homo_sapiens_sp_Q9BXN1_ASPN_HUMAN sp|Q9BXN1|ASPN_HUMAN Asporin OS=Homo sapiens OX=9606 GN=ASPN PE=1 SV=2, Homo_sapiens_sp_P07585_PGS2_HUMAN sp|P07585|PGS2_HUMAN Decorin OS=Homo sapiens OX=9606 GN=DCN PE=1 SV=1, Homo_sapiens_sp_P21810_PGS1_HUMAN sp|P21810|PGS1_HUMAN Biglycan OS=Homo sapiens OX=9606 GN=BGN PE=1 SV=2, Homo_sapiens_sp_Q7Z5L7_PODN_HUMAN sp|Q7Z5L7|PODN_HUMAN Podocan OS=Homo sapiens OX=9606 GN=PODN PE=1 SV=2, Homo_sapiens_sp_Q06828_FMOD_HUMAN sp|Q06828|FMOD_HUMAN Fibromodulin OS=Homo sapiens OX=9606 GN=FMOD PE=1 SV=2, Homo_sapiens_sp_P51884_LUM_HUMAN sp|P51884|LUM_HUMAN Lumican OS=Homo sapiens OX=9606 GN=LUM PE=1 SV=2, Homo_sapiens_sp_Q99983_OMD_HUMAN sp|Q99983|OMD_HUMAN Osteomodulin OS=Homo sapiens OX=9606 GN=OMD PE=1 SV=1, Homo_sapiens_sp_O60938_KERA_HUMAN sp|O60938|KERA_HUMAN Keratocan OS=Homo sapiens OX=9606 GN=KERA PE=1 SV=1, Homo_sapiens_sp_P51888_PRELP_HUMAN sp|P51888|PRELP_HUMAN Prolargin OS=Homo sapiens OX=9606 GN=PRELP PE=1 SV=1, Homo_sapiens_sp_O94769_ECM2_HUMAN sp|O94769|ECM2_HUMAN Extracellular matrix protein 2 OS=Homo sapiens OX=9606 GN=ECM2 PE=2 SV=1
OG0000064	Salpingoeca_rosetta_XP_004991801.1 XP_004991801.1 salivary glue protein Sgs-3 [Salpingoeca rosetta], Salpingoeca_rosetta_XP_004998469.1 XP_004998469.1 gamma-carboxyglutamic acid protein 3 splice variant A [Salpingoeca rosetta], Salpingoeca_rosetta_XP_004988554.1 XP_004988554.1 uncharacterized protein PTSG_10215 [Salpingoeca rosetta]	Homo_sapiens_sp_Q8N2S1_LTBP4_HUMAN sp|Q8N2S1|LTBP4_HUMAN Latent-transforming growth factor beta-binding protein 4 OS=Homo sapiens OX=9606 GN=LTBP4 PE=1 SV=2, Homo_sapiens_sp_Q14767_LTBP2_HUMAN sp|Q14767|LTBP2_HUMAN Latent-transforming growth factor beta-binding protein 2 OS=Homo sapiens OX=9606 GN=LTBP2 PE=1 SV=3, Homo_sapiens_sp_Q9NS15_LTBP3_HUMAN sp|Q9NS15|LTBP3_HUMAN Latent-transforming growth factor beta-binding protein 3 OS=Homo sapiens OX=9606 GN=LTBP3 PE=1 SV=4, Homo_sapiens_sp_Q14766_LTBP1_HUMAN sp|Q14766|LTBP1_HUMAN Latent-transforming growth factor beta-binding protein 1 OS=Homo sapiens OX=9606 GN=LTBP1 PE=1 SV=4
OG0000081	Salpingoeca_rosetta_XP_004994461.1 XP_004994461.1 cysteine-rich with EGF-like domain-containing protein 2 [Salpingoeca rosetta], Salpingoeca_rosetta_XP_004991372.1 XP_004991372.1 uncharacterized protein PTSG_07576 [Salpingoeca rosetta]	Homo_sapiens_sp_Q6UXH1_CREL2_HUMAN sp|Q6UXH1|CREL2_HUMAN Protein disulfide isomerase CRELD2 OS=Homo sapiens OX=9606 GN=CRELD2 PE=1 SV=1, Homo_sapiens_sp_Q96HD1_CREL1_HUMAN sp|Q96HD1|CREL1_HUMAN Protein disulfide isomerase CRELD1 OS=Homo sapiens OX=9606 GN=CRELD1 PE=1 SV=3
OG0000088	Salpingoeca_rosetta_XP_004989262.1 XP_004989262.1 uncharacterized protein PTSG_09907 [Salpingoeca rosetta]	Homo_sapiens_sp_Q9BUD6_SPON2_HUMAN sp|Q9BUD6|SPON2_HUMAN Spondin-2 OS=Homo sapiens OX=9606 GN=SPON2 PE=1 SV=4, Homo_sapiens_sp_Q9HCB6_SPON1_HUMAN sp|Q9HCB6|SPON1_HUMAN Spondin-1 OS=Homo sapiens OX=9606 GN=SPON1 PE=1 SV=2
OG0000093	Salpingoeca_rosetta_XP_004996477.1 XP_004996477.1 uncharacterized protein PTSG_02962 [Salpingoeca rosetta]	Homo_sapiens_sp_P01040_CYTA_HUMAN sp|P01040|CYTA_HUMAN Cystatin-A OS=Homo sapiens OX=9606 GN=CSTA PE=1 SV=1, Homo_sapiens_sp_P04080_CYTB_HUMAN sp|P04080|CYTB_HUMAN Cystatin-B OS=Homo sapiens OX=9606 GN=CSTB PE=1 SV=2
OG0000102	Salpingoeca_rosetta_XP_004988631.1 XP_004988631.1 uncharacterized protein PTSG_10665 [Salpingoeca rosetta], Salpingoeca_rosetta_XP_004995207.1 XP_004995207.1 uncharacterized protein PTSG_03475 [Salpingoeca rosetta], Salpingoeca_rosetta_XP_004993827.1 XP_004993827.1 uncharacterized protein PTSG_12283 [Salpingoeca rosetta], Salpingoeca_rosetta_XP_004992684.1 XP_004992684.1 uncharacterized protein PTSG_12565 [Salpingoeca rosetta], Salpingoeca_rosetta_XP_004991002.1 XP_004991002.1 hemagglutinin_amebocyte aggregation factor [Salpingoeca rosetta], Salpingoeca_rosetta_XP_004992431.1 XP_004992431.1 uncharacterized protein PTSG_07019 [Salpingoeca rosetta], Salpingoeca_rosetta_XP_004998423.1 XP_004998423.1 uncharacterized protein PTSG_11664 [Salpingoeca rosetta], Salpingoeca_rosetta_XP_004987839.1 XP_004987839.1 uncharacterized protein PTSG_11194 [Salpingoeca rosetta], Salpingoeca_rosetta_XP_004989978.1 XP_004989978.1 uncharacterized protein PTSG_09549 [Salpingoeca rosetta], Salpingoeca_rosetta_XP_004990651.1 XP_004990651.1 hypothetical protein_ variant [Salpingoeca rosetta], Salpingoeca_rosetta_XP_004990652.1 XP_004990652.1 uncharacterized protein PTSG_12719 [Salpingoeca rosetta], Salpingoeca_rosetta_XP_004996528.1 XP_004996528.1 uncharacterized protein PTSG_03009 [Salpingoeca rosetta], Salpingoeca_rosetta_XP_004987976.1 XP_004987976.1 uncharacterized protein PTSG_11057 [Salpingoeca rosetta], Salpingoeca_rosetta_XP_004990946.1 XP_004990946.1 uncharacterized protein PTSG_07442 [Salpingoeca rosetta], Salpingoeca_rosetta_XP_004992612.1 XP_004992612.1 uncharacterized protein PTSG_07192 [Salpingoeca rosetta]	Homo_sapiens_sp_Q9UBX5_FBLN5_HUMAN sp|Q9UBX5|FBLN5_HUMAN Fibulin-5 OS=Homo sapiens OX=9606 GN=FBLN5 PE=1 SV=1, Homo_sapiens_sp_O95967_FBLN4_HUMAN sp|O95967|FBLN4_HUMAN EGF-containing fibulin-like extracellular matrix protein 2 OS=Homo sapiens OX=9606 GN=EFEMP2 PE=1 SV=3, Homo_sapiens_sp_Q12805_FBLN3_HUMAN sp|Q12805|FBLN3_HUMAN EGF-containing fibulin-like extracellular matrix protein 1 OS=Homo sapiens OX=9606 GN=EFEMP1 PE=1 SV=2
OG0000112	Salpingoeca_rosetta_XP_004998289.1 XP_004998289.1 uncharacterized protein PTSG_00821 [Salpingoeca rosetta]	Homo_sapiens_sp_Q8WWQ2_HPSE2_HUMAN sp|Q8WWQ2|HPSE2_HUMAN Inactive heparanase-2 OS=Homo sapiens OX=9606 GN=HPSE2 PE=1 SV=3
OG0000122	Salpingoeca_rosetta_XP_004989019.1 XP_004989019.1 Megf11 [Salpingoeca rosetta]	Homo_sapiens_sp_P08253_MMP2_HUMAN sp|P08253|MMP2_HUMAN 72 kDa type IV collagenase OS=Homo sapiens OX=9606 GN=MMP2 PE=1 SV=2, Homo_sapiens_sp_P14780_MMP9_HUMAN sp|P14780|MMP9_HUMAN Matrix metalloproteinase-9 OS=Homo sapiens OX=9606 GN=MMP9 PE=1 SV=3
OG0000156	Salpingoeca_rosetta_XP_004992790.1 XP_004992790.1 uncharacterized protein PTSG_05897 [Salpingoeca rosetta]	Homo_sapiens_sp_P55081_MFAP1_HUMAN sp|P55081|MFAP1_HUMAN Microfibrillar-associated protein 1 OS=Homo sapiens OX=9606 GN=MFAP1 PE=1 SV=2
OG0000157	Salpingoeca_rosetta_XP_004992034.1 XP_004992034.1 uncharacterized protein PTSG_06646 [Salpingoeca rosetta], Salpingoeca_rosetta_XP_004993741.1 XP_004993741.1 uncharacterized protein PTSG_05162 [Salpingoeca rosetta]	Homo_sapiens_sp_Q86XX4_FRAS1_HUMAN sp|Q86XX4|FRAS1_HUMAN Extracellular matrix organizing protein FRAS1 OS=Homo sapiens OX=9606 GN=FRAS1 PE=1 SV=2, Homo_sapiens_sp_Q5H8C1_FREM1_HUMAN sp|Q5H8C1|FREM1_HUMAN FRAS1-related extracellular matrix protein 1 OS=Homo sapiens OX=9606 GN=FREM1 PE=1 SV=3
OG0000158	Salpingoeca_rosetta_XP_004991218.1 XP_004991218.1 uncharacterized protein PTSG_08193 [Salpingoeca rosetta]	Homo_sapiens_sp_Q8IVN8_SBSPO_HUMAN sp|Q8IVN8|SBSPO_HUMAN Somatomedin-B and thrombospondin type-1 domain-containing protein OS=Homo sapiens OX=9606 GN=SBSPON PE=1 SV=2
OG0000171	Salpingoeca_rosetta_XP_004995449.1 XP_004995449.1 uncharacterized protein PTSG_03725 [Salpingoeca rosetta]	Homo_sapiens_sp_Q96IV0_NGLY1_HUMAN sp|Q96IV0|NGLY1_HUMAN Peptide-N_4_-_N-acetyl-beta-glucosaminyl_asparagine amidase OS=Homo sapiens OX=9606 GN=NGLY1 PE=1 SV=1
OG0000181	Salpingoeca_rosetta_XP_004997925.1 XP_004997925.1 uncharacterized protein PTSG_11806 [Salpingoeca rosetta], Salpingoeca_rosetta_XP_004989184.1 XP_004989184.1 uncharacterized protein PTSG_09827 [Salpingoeca rosetta], Salpingoeca_rosetta_XP_004987674.1 XP_004987674.1 uncharacterized protein PTSG_11315 [Salpingoeca rosetta], Salpingoeca_rosetta_XP_004993972.1 XP_004993972.1 uncharacterized protein PTSG_05399 [Salpingoeca rosetta]	Homo_sapiens_sp_Q2MKA7_RSPO1_HUMAN sp|Q2MKA7|RSPO1_HUMAN R-spondin-1 OS=Homo sapiens OX=9606 GN=RSPO1 PE=1 SV=1, Homo_sapiens_sp_Q9BXY4_RSPO3_HUMAN sp|Q9BXY4|RSPO3_HUMAN R-spondin-3 OS=Homo sapiens OX=9606 GN=RSPO3 PE=1 SV=1
OG0000182	Salpingoeca_rosetta_XP_004993157.1 XP_004993157.1 uncharacterized protein PTSG_12420 [Salpingoeca rosetta]	Homo_sapiens_sp_A6NCI4_VWA3A_HUMAN sp|A6NCI4|VWA3A_HUMAN von Willebrand factor A domain-containing protein 3A OS=Homo sapiens OX=9606 GN=VWA3A PE=2 SV=3
OG0000200	Salpingoeca_rosetta_XP_004998525.1 XP_004998525.1 uncharacterized protein PTSG_11678 [Salpingoeca rosetta]	Homo_sapiens_sp_Q502W6_VWA3B_HUMAN sp|Q502W6|VWA3B_HUMAN von Willebrand factor A domain-containing protein 3B OS=Homo sapiens OX=9606 GN=VWA3B PE=1 SV=3
OG0000447	Salpingoeca_rosetta_XP_004992279.1 XP_004992279.1 uncharacterized protein PTSG_06880 [Salpingoeca rosetta]	Homo_sapiens_sp_Q92954_PRG4_HUMAN sp|Q92954|PRG4_HUMAN Proteoglycan 4 OS=Homo sapiens OX=9606 GN=PRG4 PE=1 SV=3
OG0000623	Salpingoeca_rosetta_XP_004997205.1 XP_004997205.1 uncharacterized protein PTSG_01232 [Salpingoeca rosetta]	Homo_sapiens_sp_P12109_CO6A1_HUMAN sp|P12109|CO6A1_HUMAN Collagen alpha-1_VI_ chain OS=Homo sapiens OX=9606 GN=COL6A1 PE=1 SV=3
