Orthogroup	Placozoa_Trichoplacidae_Tricoplax_adhaerens	Cnidaria_Anthozoa_Acropora_digitifera
OG0000001	Tricoplax_adhaerens_tr_B3RUG1_B3RUG1_TRIAD tr_B3RUG1_B3RUG1_TRIAD Uncharacterized protein _Fragment_ OS=Trichoplax adhaerens OX=10228 GN=TRIADDRAFT_24524 PE=4 SV=1	Acropora_digitifera_adi_v1.19636 adi_v1.19636
OG0000001	Tricoplax_adhaerens_tr_B3RXC1_B3RXC1_TRIAD tr_B3RXC1_B3RXC1_TRIAD Uncharacterized protein OS=Trichoplax adhaerens OX=10228 GN=TRIADDRAFT_56157 PE=4 SV=1	Acropora_digitifera_adi_v1.11962 adi_v1.11962
OG0000001	Tricoplax_adhaerens_tr_B3RQ47_B3RQ47_TRIAD tr_B3RQ47_B3RQ47_TRIAD Uncharacterized protein OS=Trichoplax adhaerens OX=10228 GN=TRIADDRAFT_53774 PE=4 SV=1	Acropora_digitifera_adi_v1.00967 adi_v1.00967
OG0000001	Tricoplax_adhaerens_tr_B3RIT3_B3RIT3_TRIAD tr_B3RIT3_B3RIT3_TRIAD Uncharacterized protein OS=Trichoplax adhaerens OX=10228 GN=TRIADDRAFT_51357 PE=4 SV=1	Acropora_digitifera_adi_v1.03506 adi_v1.03506
OG0000001	Tricoplax_adhaerens_tr_B3SCK7_B3SCK7_TRIAD tr_B3SCK7_B3SCK7_TRIAD Uncharacterized protein OS=Trichoplax adhaerens OX=10228 GN=TRIADDRAFT_62007 PE=4 SV=1, Tricoplax_adhaerens_tr_B3SCK6_B3SCK6_TRIAD tr_B3SCK6_B3SCK6_TRIAD Uncharacterized protein OS=Trichoplax adhaerens OX=10228 GN=TRIADDRAFT_62006 PE=4 SV=1, Tricoplax_adhaerens_tr_B3SCJ5_B3SCJ5_TRIAD tr_B3SCJ5_B3SCJ5_TRIAD Uncharacterized protein _Fragment_ OS=Trichoplax adhaerens OX=10228 GN=TRIADDRAFT_33302 PE=4 SV=1, Tricoplax_adhaerens_tr_B3SCK9_B3SCK9_TRIAD tr_B3SCK9_B3SCK9_TRIAD Uncharacterized protein _Fragment_ OS=Trichoplax adhaerens OX=10228 GN=TRIADDRAFT_4136 PE=4 SV=1, Tricoplax_adhaerens_tr_B3S4N4_B3S4N4_TRIAD tr_B3S4N4_B3S4N4_TRIAD Uncharacterized protein OS=Trichoplax adhaerens OX=10228 GN=TRIADDRAFT_59150 PE=4 SV=1	Acropora_digitifera_adi_v1.20924 adi_v1.20924, Acropora_digitifera_adi_v1.22909 adi_v1.22909, Acropora_digitifera_adi_v1.17200 adi_v1.17200, Acropora_digitifera_adi_v1.22911 adi_v1.22911
OG0000001	Tricoplax_adhaerens_tr_B3SDW1_B3SDW1_TRIAD tr_B3SDW1_B3SDW1_TRIAD Uncharacterized protein OS=Trichoplax adhaerens OX=10228 GN=TRIADDRAFT_62466 PE=4 SV=1	Acropora_digitifera_adi_v1.11082 adi_v1.11082
OG0000001	Tricoplax_adhaerens_tr_B3RNB7_B3RNB7_TRIAD tr_B3RNB7_B3RNB7_TRIAD Uncharacterized protein OS=Trichoplax adhaerens OX=10228 GN=TRIADDRAFT_21436 PE=4 SV=1	Acropora_digitifera_adi_v1.06175 adi_v1.06175
OG0000001	Tricoplax_adhaerens_tr_B3S235_B3S235_TRIAD tr_B3S235_B3S235_TRIAD Uncharacterized protein OS=Trichoplax adhaerens OX=10228 GN=TRIADDRAFT_27868 PE=4 SV=1	Acropora_digitifera_adi_v1.19391 adi_v1.19391, Acropora_digitifera_adi_v1.06434 adi_v1.06434
OG0000002	Tricoplax_adhaerens_tr_B3RLH2_B3RLH2_TRIAD tr_B3RLH2_B3RLH2_TRIAD TSP C-terminal domain-containing protein OS=Trichoplax adhaerens OX=10228 GN=TRIADDRAFT_20056 PE=3 SV=1	Acropora_digitifera_adi_v1.13969 adi_v1.13969
OG0000002	Tricoplax_adhaerens_tr_B3RQE3_B3RQE3_TRIAD tr_B3RQE3_B3RQE3_TRIAD Sema domain-containing protein OS=Trichoplax adhaerens OX=10228 GN=TRIADDRAFT_53875 PE=4 SV=1	Acropora_digitifera_adi_v1.01703 adi_v1.01703, Acropora_digitifera_adi_v1.01702 adi_v1.01702, Acropora_digitifera_adi_v1.01379 adi_v1.01379, Acropora_digitifera_adi_v1.14561 adi_v1.14561, Acropora_digitifera_adi_v1.01794 adi_v1.01794, Acropora_digitifera_adi_v1.18031 adi_v1.18031
OG0000002	Tricoplax_adhaerens_tr_B3RQE7_B3RQE7_TRIAD tr_B3RQE7_B3RQE7_TRIAD Uncharacterized protein OS=Trichoplax adhaerens OX=10228 GN=TRIADDRAFT_53879 PE=3 SV=1	Acropora_digitifera_adi_v1.10800 adi_v1.10800
OG0000003	Tricoplax_adhaerens_tr_B3RIF4_B3RIF4_TRIAD tr_B3RIF4_B3RIF4_TRIAD C-type lectin domain-containing protein _Fragment_ OS=Trichoplax adhaerens OX=10228 GN=TRIADDRAFT_18412 PE=4 SV=1	Acropora_digitifera_adi_v1.01273 adi_v1.01273
OG0000003	Tricoplax_adhaerens_tr_B3SAG5_B3SAG5_TRIAD tr_B3SAG5_B3SAG5_TRIAD Uncharacterized protein OS=Trichoplax adhaerens OX=10228 GN=TRIADDRAFT_61251 PE=4 SV=1	Acropora_digitifera_adi_v1.05022 adi_v1.05022
OG0000003	Tricoplax_adhaerens_tr_B3SE10_B3SE10_TRIAD tr_B3SE10_B3SE10_TRIAD Uncharacterized protein _Fragment_ OS=Trichoplax adhaerens OX=10228 GN=TRIADDRAFT_962 PE=4 SV=1	Acropora_digitifera_adi_v1.04076 adi_v1.04076
OG0000005	Tricoplax_adhaerens_tr_B3RTE3_B3RTE3_TRIAD tr_B3RTE3_B3RTE3_TRIAD Metalloendopeptidase OS=Trichoplax adhaerens OX=10228 GN=TRIADDRAFT_54934 PE=4 SV=1, Tricoplax_adhaerens_tr_B3RTE4_B3RTE4_TRIAD tr_B3RTE4_B3RTE4_TRIAD Metalloendopeptidase OS=Trichoplax adhaerens OX=10228 GN=TRIADDRAFT_54935 PE=4 SV=1, Tricoplax_adhaerens_tr_B3S9X8_B3S9X8_TRIAD tr_B3S9X8_B3S9X8_TRIAD Metalloendopeptidase _Fragment_ OS=Trichoplax adhaerens OX=10228 GN=TRIADDRAFT_32049 PE=4 SV=1, Tricoplax_adhaerens_tr_B3RTC7_B3RTC7_TRIAD tr_B3RTC7_B3RTC7_TRIAD Metalloendopeptidase _Fragment_ OS=Trichoplax adhaerens OX=10228 GN=TRIADDRAFT_8107 PE=4 SV=1, Tricoplax_adhaerens_tr_B3SD01_B3SD01_TRIAD tr_B3SD01_B3SD01_TRIAD Metalloendopeptidase _Fragment_ OS=Trichoplax adhaerens OX=10228 GN=TRIADDRAFT_33646 PE=4 SV=1, Tricoplax_adhaerens_tr_B3S0U5_B3S0U5_TRIAD tr_B3S0U5_B3S0U5_TRIAD Metalloendopeptidase _Fragment_ OS=Trichoplax adhaerens OX=10228 GN=TRIADDRAFT_26557 PE=4 SV=1	Acropora_digitifera_adi_v1.20368 adi_v1.20368, Acropora_digitifera_adi_v1.07444 adi_v1.07444, Acropora_digitifera_adi_v1.06940 adi_v1.06940, Acropora_digitifera_adi_v1.17845 adi_v1.17845, Acropora_digitifera_adi_v1.15751 adi_v1.15751, Acropora_digitifera_adi_v1.07442 adi_v1.07442, Acropora_digitifera_adi_v1.18953 adi_v1.18953, Acropora_digitifera_adi_v1.15782 adi_v1.15782, Acropora_digitifera_adi_v1.13648 adi_v1.13648, Acropora_digitifera_adi_v1.01716 adi_v1.01716
OG0000007	Tricoplax_adhaerens_tr_B3RJF7_B3RJF7_TRIAD tr_B3RJF7_B3RJF7_TRIAD Uncharacterized protein _Fragment_ OS=Trichoplax adhaerens OX=10228 GN=TRIADDRAFT_2919 PE=4 SV=1	Acropora_digitifera_adi_v1.24149 adi_v1.24149
OG0000007	Tricoplax_adhaerens_tr_B3SD52_B3SD52_TRIAD tr_B3SD52_B3SD52_TRIAD Uncharacterized protein _Fragment_ OS=Trichoplax adhaerens OX=10228 GN=TRIADDRAFT_33760 PE=4 SV=1	Acropora_digitifera_adi_v1.06437 adi_v1.06437, Acropora_digitifera_adi_v1.18885 adi_v1.18885, Acropora_digitifera_adi_v1.09820 adi_v1.09820, Acropora_digitifera_adi_v1.22003 adi_v1.22003, Acropora_digitifera_adi_v1.14298 adi_v1.14298, Acropora_digitifera_adi_v1.14299 adi_v1.14299, Acropora_digitifera_adi_v1.14300 adi_v1.14300, Acropora_digitifera_adi_v1.19005 adi_v1.19005, Acropora_digitifera_adi_v1.11371 adi_v1.11371, Acropora_digitifera_adi_v1.13720 adi_v1.13720, Acropora_digitifera_adi_v1.06951 adi_v1.06951, Acropora_digitifera_adi_v1.06438 adi_v1.06438, Acropora_digitifera_adi_v1.21019 adi_v1.21019
OG0000007	Tricoplax_adhaerens_tr_B3RIT7_B3RIT7_TRIAD tr_B3RIT7_B3RIT7_TRIAD Uncharacterized protein OS=Trichoplax adhaerens OX=10228 GN=TRIADDRAFT_51362 PE=4 SV=1, Tricoplax_adhaerens_tr_B3RIU2_B3RIU2_TRIAD tr_B3RIU2_B3RIU2_TRIAD Uncharacterized protein OS=Trichoplax adhaerens OX=10228 GN=TRIADDRAFT_51368 PE=4 SV=1, Tricoplax_adhaerens_tr_B3SES2_B3SES2_TRIAD tr_B3SES2_B3SES2_TRIAD Uncharacterized protein _Fragment_ OS=Trichoplax adhaerens OX=10228 GN=TRIADDRAFT_62756 PE=4 SV=1, Tricoplax_adhaerens_tr_B3SDW9_B3SDW9_TRIAD tr_B3SDW9_B3SDW9_TRIAD Uncharacterized protein _Fragment_ OS=Trichoplax adhaerens OX=10228 GN=TRIADDRAFT_62473 PE=4 SV=1, Tricoplax_adhaerens_tr_B3SDW6_B3SDW6_TRIAD tr_B3SDW6_B3SDW6_TRIAD EGF-like domain-containing protein _Fragment_ OS=Trichoplax adhaerens OX=10228 GN=TRIADDRAFT_62471 PE=4 SV=1, Tricoplax_adhaerens_tr_B3RIT9_B3RIT9_TRIAD tr_B3RIT9_B3RIT9_TRIAD Uncharacterized protein OS=Trichoplax adhaerens OX=10228 GN=TRIADDRAFT_51365 PE=4 SV=1, Tricoplax_adhaerens_tr_B3RIT6_B3RIT6_TRIAD tr_B3RIT6_B3RIT6_TRIAD Uncharacterized protein _Fragment_ OS=Trichoplax adhaerens OX=10228 GN=TRIADDRAFT_19226 PE=4 SV=1, Tricoplax_adhaerens_tr_B3RS19_B3RS19_TRIAD tr_B3RS19_B3RS19_TRIAD Uncharacterized protein OS=Trichoplax adhaerens OX=10228 GN=TRIADDRAFT_54445 PE=4 SV=1, Tricoplax_adhaerens_tr_B3RZV6_B3RZV6_TRIAD tr_B3RZV6_B3RZV6_TRIAD Uncharacterized protein _Fragment_ OS=Trichoplax adhaerens OX=10228 GN=TRIADDRAFT_27138 PE=4 SV=1, Tricoplax_adhaerens_tr_B3RS17_B3RS17_TRIAD tr_B3RS17_B3RS17_TRIAD Uncharacterized protein OS=Trichoplax adhaerens OX=10228 GN=TRIADDRAFT_54443 PE=4 SV=1, Tricoplax_adhaerens_tr_B3RZV7_B3RZV7_TRIAD tr_B3RZV7_B3RZV7_TRIAD VWFD domain-containing protein _Fragment_ OS=Trichoplax adhaerens OX=10228 GN=TRIADDRAFT_14672 PE=4 SV=1, Tricoplax_adhaerens_tr_B3SEN2_B3SEN2_TRIAD tr_B3SEN2_B3SEN2_TRIAD Uncharacterized protein OS=Trichoplax adhaerens OX=10228 GN=TRIADDRAFT_62718 PE=4 SV=1, Tricoplax_adhaerens_tr_B3SEJ1_B3SEJ1_TRIAD tr_B3SEJ1_B3SEJ1_TRIAD Uncharacterized protein OS=Trichoplax adhaerens OX=10228 GN=TRIADDRAFT_62682 PE=4 SV=1, Tricoplax_adhaerens_tr_B3RS22_B3RS22_TRIAD tr_B3RS22_B3RS22_TRIAD Uncharacterized protein OS=Trichoplax adhaerens OX=10228 GN=TRIADDRAFT_54448 PE=3 SV=1, Tricoplax_adhaerens_tr_B3RQ10_B3RQ10_TRIAD tr_B3RQ10_B3RQ10_TRIAD Uncharacterized protein OS=Trichoplax adhaerens OX=10228 GN=TRIADDRAFT_53736 PE=4 SV=1, Tricoplax_adhaerens_tr_B3RQ07_B3RQ07_TRIAD tr_B3RQ07_B3RQ07_TRIAD Uncharacterized protein OS=Trichoplax adhaerens OX=10228 GN=TRIADDRAFT_53733 PE=4 SV=1	Acropora_digitifera_adi_v1.07913 adi_v1.07913, Acropora_digitifera_adi_v1.11289 adi_v1.11289, Acropora_digitifera_adi_v1.07914 adi_v1.07914
OG0000007	Tricoplax_adhaerens_tr_B3SCC4_B3SCC4_TRIAD tr_B3SCC4_B3SCC4_TRIAD Uncharacterized protein _Fragment_ OS=Trichoplax adhaerens OX=10228 GN=TRIADDRAFT_33213 PE=4 SV=1	Acropora_digitifera_adi_v1.21164 adi_v1.21164
OG0000007	Tricoplax_adhaerens_tr_B3SDB5_B3SDB5_TRIAD tr_B3SDB5_B3SDB5_TRIAD Uncharacterized protein _Fragment_ OS=Trichoplax adhaerens OX=10228 GN=TRIADDRAFT_33810 PE=4 SV=1, Tricoplax_adhaerens_tr_B3SDB2_B3SDB2_TRIAD tr_B3SDB2_B3SDB2_TRIAD EGF-like domain-containing protein OS=Trichoplax adhaerens OX=10228 GN=TRIADDRAFT_62270 PE=4 SV=1, Tricoplax_adhaerens_tr_B3SDB3_B3SDB3_TRIAD tr_B3SDB3_B3SDB3_TRIAD Uncharacterized protein OS=Trichoplax adhaerens OX=10228 GN=TRIADDRAFT_62271 PE=4 SV=1, Tricoplax_adhaerens_tr_B3SDN3_B3SDN3_TRIAD tr_B3SDN3_B3SDN3_TRIAD EGF-like domain-containing protein OS=Trichoplax adhaerens OX=10228 GN=TRIADDRAFT_62390 PE=4 SV=1, Tricoplax_adhaerens_tr_B3SDN4_B3SDN4_TRIAD tr_B3SDN4_B3SDN4_TRIAD Predicted protein OS=Trichoplax adhaerens OX=10228 GN=TRIADDRAFT_62391 PE=4 SV=1, Tricoplax_adhaerens_tr_B3SDN5_B3SDN5_TRIAD tr_B3SDN5_B3SDN5_TRIAD EGF-like domain-containing protein OS=Trichoplax adhaerens OX=10228 GN=TRIADDRAFT_62392 PE=4 SV=1, Tricoplax_adhaerens_tr_B3SDR0_B3SDR0_TRIAD tr_B3SDR0_B3SDR0_TRIAD Uncharacterized protein OS=Trichoplax adhaerens OX=10228 GN=TRIADDRAFT_62420 PE=4 SV=1	Acropora_digitifera_adi_v1.17191 adi_v1.17191, Acropora_digitifera_adi_v1.14511 adi_v1.14511
OG0000008	Tricoplax_adhaerens_tr_B3RS24_B3RS24_TRIAD tr_B3RS24_B3RS24_TRIAD Uncharacterized protein _Fragment_ OS=Trichoplax adhaerens OX=10228 GN=TRIADDRAFT_22166 PE=4 SV=1	Acropora_digitifera_adi_v1.09287 adi_v1.09287
OG0000008	Tricoplax_adhaerens_tr_B3RNJ4_B3RNJ4_TRIAD tr_B3RNJ4_B3RNJ4_TRIAD Uncharacterized protein _Fragment_ OS=Trichoplax adhaerens OX=10228 GN=TRIADDRAFT_21526 PE=4 SV=1	Acropora_digitifera_adi_v1.12714 adi_v1.12714
OG0000008	Tricoplax_adhaerens_tr_B3RK62_B3RK62_TRIAD tr_B3RK62_B3RK62_TRIAD Uncharacterized protein OS=Trichoplax adhaerens OX=10228 GN=TRIADDRAFT_63477 PE=4 SV=1, Tricoplax_adhaerens_tr_B3S5W3_B3S5W3_TRIAD tr_B3S5W3_B3S5W3_TRIAD Predicted protein OS=Trichoplax adhaerens OX=10228 GN=TRIADDRAFT_59529 PE=4 SV=1, Tricoplax_adhaerens_tr_B3RNP9_B3RNP9_TRIAD tr_B3RNP9_B3RNP9_TRIAD Uncharacterized protein OS=Trichoplax adhaerens OX=10228 GN=TRIADDRAFT_53244 PE=4 SV=1, Tricoplax_adhaerens_tr_B3RRK3_B3RRK3_TRIAD tr_B3RRK3_B3RRK3_TRIAD Predicted protein OS=Trichoplax adhaerens OX=10228 GN=TRIADDRAFT_54273 PE=4 SV=1	Acropora_digitifera_adi_v1.05561 adi_v1.05561, Acropora_digitifera_adi_v1.19041 adi_v1.19041, Acropora_digitifera_adi_v1.21250 adi_v1.21250, Acropora_digitifera_adi_v1.20031 adi_v1.20031, Acropora_digitifera_adi_v1.23528 adi_v1.23528, Acropora_digitifera_adi_v1.11566 adi_v1.11566, Acropora_digitifera_adi_v1.10230 adi_v1.10230, Acropora_digitifera_adi_v1.04804 adi_v1.04804, Acropora_digitifera_adi_v1.02443 adi_v1.02443, Acropora_digitifera_adi_v1.12140 adi_v1.12140, Acropora_digitifera_adi_v1.22879 adi_v1.22879, Acropora_digitifera_adi_v1.23160 adi_v1.23160, Acropora_digitifera_adi_v1.07571 adi_v1.07571, Acropora_digitifera_adi_v1.04859 adi_v1.04859, Acropora_digitifera_adi_v1.22883 adi_v1.22883, Acropora_digitifera_adi_v1.06352 adi_v1.06352, Acropora_digitifera_adi_v1.24395 adi_v1.24395, Acropora_digitifera_adi_v1.07153 adi_v1.07153, Acropora_digitifera_adi_v1.24319 adi_v1.24319, Acropora_digitifera_adi_v1.21910 adi_v1.21910, Acropora_digitifera_adi_v1.07154 adi_v1.07154, Acropora_digitifera_adi_v1.09419 adi_v1.09419, Acropora_digitifera_adi_v1.09420 adi_v1.09420, Acropora_digitifera_adi_v1.18672 adi_v1.18672
OG0000008	Tricoplax_adhaerens_tr_B3RZ30_B3RZ30_TRIAD tr_B3RZ30_B3RZ30_TRIAD Uncharacterized protein OS=Trichoplax adhaerens OX=10228 GN=TRIADDRAFT_26446 PE=4 SV=1	Acropora_digitifera_adi_v1.23462 adi_v1.23462
OG0000008	Tricoplax_adhaerens_tr_B3RZV3_B3RZV3_TRIAD tr_B3RZV3_B3RZV3_TRIAD Uncharacterized protein OS=Trichoplax adhaerens OX=10228 GN=TRIADDRAFT_26633 PE=4 SV=1	Acropora_digitifera_adi_v1.14878 adi_v1.14878, Acropora_digitifera_adi_v1.10976 adi_v1.10976
OG0000008	Tricoplax_adhaerens_tr_B3RPA9_B3RPA9_TRIAD tr_B3RPA9_B3RPA9_TRIAD Uncharacterized protein OS=Trichoplax adhaerens OX=10228 GN=TRIADDRAFT_21402 PE=4 SV=1	Acropora_digitifera_adi_v1.07797 adi_v1.07797, Acropora_digitifera_adi_v1.05293 adi_v1.05293
OG0000009	Tricoplax_adhaerens_tr_B3SBF5_B3SBF5_TRIAD tr_B3SBF5_B3SBF5_TRIAD Uncharacterized protein OS=Trichoplax adhaerens OX=10228 GN=TRIADDRAFT_61597 PE=4 SV=1, Tricoplax_adhaerens_tr_B3RNS9_B3RNS9_TRIAD tr_B3RNS9_B3RNS9_TRIAD Uncharacterized protein OS=Trichoplax adhaerens OX=10228 GN=TRIADDRAFT_53274 PE=4 SV=1, Tricoplax_adhaerens_tr_B3RNS7_B3RNS7_TRIAD tr_B3RNS7_B3RNS7_TRIAD Uncharacterized protein OS=Trichoplax adhaerens OX=10228 GN=TRIADDRAFT_53272 PE=4 SV=1, Tricoplax_adhaerens_tr_B3SBF6_B3SBF6_TRIAD tr_B3SBF6_B3SBF6_TRIAD Uncharacterized protein OS=Trichoplax adhaerens OX=10228 GN=TRIADDRAFT_61598 PE=4 SV=1, Tricoplax_adhaerens_tr_B3SEL3_B3SEL3_TRIAD tr_B3SEL3_B3SEL3_TRIAD CUB domain-containing protein _Fragment_ OS=Trichoplax adhaerens OX=10228 GN=TRIADDRAFT_62701 PE=4 SV=1, Tricoplax_adhaerens_tr_B3RMS1_B3RMS1_TRIAD tr_B3RMS1_B3RMS1_TRIAD CUB domain-containing protein OS=Trichoplax adhaerens OX=10228 GN=TRIADDRAFT_52902 PE=4 SV=1	Acropora_digitifera_adi_v1.09663 adi_v1.09663, Acropora_digitifera_adi_v1.19260 adi_v1.19260, Acropora_digitifera_adi_v1.19569 adi_v1.19569
OG0000009	Tricoplax_adhaerens_tr_B3RPJ0_B3RPJ0_TRIAD tr_B3RPJ0_B3RPJ0_TRIAD Uncharacterized protein OS=Trichoplax adhaerens OX=10228 GN=TRIADDRAFT_53560 PE=4 SV=1, Tricoplax_adhaerens_tr_B3RPJ1_B3RPJ1_TRIAD tr_B3RPJ1_B3RPJ1_TRIAD Uncharacterized protein OS=Trichoplax adhaerens OX=10228 GN=TRIADDRAFT_53561 PE=4 SV=1	Acropora_digitifera_adi_v1.11309 adi_v1.11309, Acropora_digitifera_adi_v1.11310 adi_v1.11310, Acropora_digitifera_adi_v1.20169 adi_v1.20169, Acropora_digitifera_adi_v1.16563 adi_v1.16563, Acropora_digitifera_adi_v1.16561 adi_v1.16561, Acropora_digitifera_adi_v1.23168 adi_v1.23168, Acropora_digitifera_adi_v1.02161 adi_v1.02161, Acropora_digitifera_adi_v1.02163 adi_v1.02163
OG0000010	Tricoplax_adhaerens_tr_B3RZZ3_B3RZZ3_TRIAD tr_B3RZZ3_B3RZZ3_TRIAD Uncharacterized protein _Fragment_ OS=Trichoplax adhaerens OX=10228 GN=TRIADDRAFT_26220 PE=4 SV=1	Acropora_digitifera_adi_v1.00664 adi_v1.00664
OG0000010	Tricoplax_adhaerens_tr_B3RTM7_B3RTM7_TRIAD tr_B3RTM7_B3RTM7_TRIAD Predicted protein OS=Trichoplax adhaerens OX=10228 GN=TRIADDRAFT_55980 PE=4 SV=1	Acropora_digitifera_adi_v1.04228 adi_v1.04228
OG0000010	Tricoplax_adhaerens_tr_B3S5W2_B3S5W2_TRIAD tr_B3S5W2_B3S5W2_TRIAD Uncharacterized protein OS=Trichoplax adhaerens OX=10228 GN=TRIADDRAFT_59528 PE=4 SV=1, Tricoplax_adhaerens_tr_B3S5W5_B3S5W5_TRIAD tr_B3S5W5_B3S5W5_TRIAD Uncharacterized protein OS=Trichoplax adhaerens OX=10228 GN=TRIADDRAFT_59531 PE=4 SV=1	Acropora_digitifera_adi_v1.05562 adi_v1.05562, Acropora_digitifera_adi_v1.07946 adi_v1.07946
OG0000010	Tricoplax_adhaerens_tr_B3SCT4_B3SCT4_TRIAD tr_B3SCT4_B3SCT4_TRIAD Uncharacterized protein OS=Trichoplax adhaerens OX=10228 GN=TRIADDRAFT_62089 PE=4 SV=1	Acropora_digitifera_adi_v1.17180 adi_v1.17180
OG0000010	Tricoplax_adhaerens_tr_B3S003_B3S003_TRIAD tr_B3S003_B3S003_TRIAD Uncharacterized protein OS=Trichoplax adhaerens OX=10228 GN=TRIADDRAFT_57635 PE=4 SV=1	Acropora_digitifera_adi_v1.05525 adi_v1.05525, Acropora_digitifera_adi_v1.18396 adi_v1.18396
OG0000010	Tricoplax_adhaerens_tr_B3RSW2_B3RSW2_TRIAD tr_B3RSW2_B3RSW2_TRIAD Uncharacterized protein OS=Trichoplax adhaerens OX=10228 GN=TRIADDRAFT_63780 PE=4 SV=1	Acropora_digitifera_adi_v1.05424 adi_v1.05424
OG0000011	Tricoplax_adhaerens_tr_B3RL69_B3RL69_TRIAD tr_B3RL69_B3RL69_TRIAD Uncharacterized protein OS=Trichoplax adhaerens OX=10228 GN=TRIADDRAFT_51898 PE=4 SV=1, Tricoplax_adhaerens_tr_B3S8L1_B3S8L1_TRIAD tr_B3S8L1_B3S8L1_TRIAD Kringle domain-containing protein _Fragment_ OS=Trichoplax adhaerens OX=10228 GN=TRIADDRAFT_31001 PE=4 SV=1, Tricoplax_adhaerens_tr_B3S8S0_B3S8S0_TRIAD tr_B3S8S0_B3S8S0_TRIAD Kringle domain-containing protein _Fragment_ OS=Trichoplax adhaerens OX=10228 GN=TRIADDRAFT_8692 PE=4 SV=1, Tricoplax_adhaerens_tr_B3S9I4_B3S9I4_TRIAD tr_B3S9I4_B3S9I4_TRIAD Kringle domain-containing protein _Fragment_ OS=Trichoplax adhaerens OX=10228 GN=TRIADDRAFT_9323 PE=4 SV=1, Tricoplax_adhaerens_tr_B3S9I9_B3S9I9_TRIAD tr_B3S9I9_B3S9I9_TRIAD Kringle domain-containing protein _Fragment_ OS=Trichoplax adhaerens OX=10228 GN=TRIADDRAFT_9202 PE=4 SV=1, Tricoplax_adhaerens_tr_B3S5U6_B3S5U6_TRIAD tr_B3S5U6_B3S5U6_TRIAD Kringle domain-containing protein OS=Trichoplax adhaerens OX=10228 GN=TRIADDRAFT_29648 PE=4 SV=1, Tricoplax_adhaerens_tr_B3RL75_B3RL75_TRIAD tr_B3RL75_B3RL75_TRIAD Uncharacterized protein OS=Trichoplax adhaerens OX=10228 GN=TRIADDRAFT_51904 PE=4 SV=1, Tricoplax_adhaerens_tr_B3RL82_B3RL82_TRIAD tr_B3RL82_B3RL82_TRIAD Uncharacterized protein OS=Trichoplax adhaerens OX=10228 GN=TRIADDRAFT_51914 PE=4 SV=1, Tricoplax_adhaerens_tr_B3RL76_B3RL76_TRIAD tr_B3RL76_B3RL76_TRIAD Uncharacterized protein OS=Trichoplax adhaerens OX=10228 GN=TRIADDRAFT_51905 PE=4 SV=1, Tricoplax_adhaerens_tr_B3RL85_B3RL85_TRIAD tr_B3RL85_B3RL85_TRIAD Predicted protein OS=Trichoplax adhaerens OX=10228 GN=TRIADDRAFT_51917 PE=4 SV=1, Tricoplax_adhaerens_tr_B3S501_B3S501_TRIAD tr_B3S501_B3S501_TRIAD Kringle domain-containing protein _Fragment_ OS=Trichoplax adhaerens OX=10228 GN=TRIADDRAFT_29248 PE=4 SV=1, Tricoplax_adhaerens_tr_B3SE75_B3SE75_TRIAD tr_B3SE75_B3SE75_TRIAD Kringle domain-containing protein _Fragment_ OS=Trichoplax adhaerens OX=10228 GN=TRIADDRAFT_8320 PE=4 SV=1	Acropora_digitifera_adi_v1.08937 adi_v1.08937, Acropora_digitifera_adi_v1.14221 adi_v1.14221, Acropora_digitifera_adi_v1.14220 adi_v1.14220
OG0000012	Tricoplax_adhaerens_tr_B3RRG7_B3RRG7_TRIAD tr_B3RRG7_B3RRG7_TRIAD Uncharacterized protein OS=Trichoplax adhaerens OX=10228 GN=TRIADDRAFT_54231 PE=4 SV=1	Acropora_digitifera_adi_v1.12876 adi_v1.12876
OG0000013	Tricoplax_adhaerens_tr_B3S743_B3S743_TRIAD tr_B3S743_B3S743_TRIAD Protein Wnt _Fragment_ OS=Trichoplax adhaerens OX=10228 GN=TRIADDRAFT_30370 PE=3 SV=1, Tricoplax_adhaerens_tr_B3RIQ5_B3RIQ5_TRIAD tr_B3RIQ5_B3RIQ5_TRIAD Protein Wnt OS=Trichoplax adhaerens OX=10228 GN=TRIADDRAFT_52489 PE=3 SV=1	Acropora_digitifera_adi_v1.13774 adi_v1.13774, Acropora_digitifera_adi_v1.13773 adi_v1.13773, Acropora_digitifera_adi_v1.08272 adi_v1.08272
OG0000014	Tricoplax_adhaerens_tr_B3RJG1_B3RJG1_TRIAD tr_B3RJG1_B3RJG1_TRIAD Peptidase M12B domain-containing protein OS=Trichoplax adhaerens OX=10228 GN=TRIADDRAFT_52613 PE=4 SV=1	Acropora_digitifera_adi_v1.10799 adi_v1.10799, Acropora_digitifera_adi_v1.14366 adi_v1.14366, Acropora_digitifera_adi_v1.10968 adi_v1.10968, Acropora_digitifera_adi_v1.01169 adi_v1.01169, Acropora_digitifera_adi_v1.14580 adi_v1.14580, Acropora_digitifera_adi_v1.14581 adi_v1.14581, Acropora_digitifera_adi_v1.06910 adi_v1.06910, Acropora_digitifera_adi_v1.01444 adi_v1.01444, Acropora_digitifera_adi_v1.22993 adi_v1.22993, Acropora_digitifera_adi_v1.22282 adi_v1.22282, Acropora_digitifera_adi_v1.16116 adi_v1.16116, Acropora_digitifera_adi_v1.14772 adi_v1.14772, Acropora_digitifera_adi_v1.16603 adi_v1.16603, Acropora_digitifera_adi_v1.13245 adi_v1.13245, Acropora_digitifera_adi_v1.20449 adi_v1.20449, Acropora_digitifera_adi_v1.05790 adi_v1.05790, Acropora_digitifera_adi_v1.02358 adi_v1.02358, Acropora_digitifera_adi_v1.16964 adi_v1.16964, Acropora_digitifera_adi_v1.13244 adi_v1.13244, Acropora_digitifera_adi_v1.13631 adi_v1.13631
OG0000015	Tricoplax_adhaerens_tr_B3RRK6_B3RRK6_TRIAD tr_B3RRK6_B3RRK6_TRIAD Uncharacterized protein OS=Trichoplax adhaerens OX=10228 GN=TRIADDRAFT_54276 PE=4 SV=1	Acropora_digitifera_adi_v1.23833 adi_v1.23833, Acropora_digitifera_adi_v1.22393 adi_v1.22393, Acropora_digitifera_adi_v1.10186 adi_v1.10186
OG0000017	Tricoplax_adhaerens_tr_B3S279_B3S279_TRIAD tr_B3S279_B3S279_TRIAD SERPIN domain-containing protein OS=Trichoplax adhaerens OX=10228 GN=TRIADDRAFT_63332 PE=3 SV=1	Acropora_digitifera_adi_v1.20054 adi_v1.20054, Acropora_digitifera_adi_v1.12711 adi_v1.12711, Acropora_digitifera_adi_v1.17942 adi_v1.17942
OG0000018	Tricoplax_adhaerens_tr_B3RKU5_B3RKU5_TRIAD tr_B3RKU5_B3RKU5_TRIAD Uncharacterized protein OS=Trichoplax adhaerens OX=10228 GN=TRIADDRAFT_51770 PE=4 SV=1	Acropora_digitifera_adi_v1.03894 adi_v1.03894
OG0000018	Tricoplax_adhaerens_tr_B3RS21_B3RS21_TRIAD tr_B3RS21_B3RS21_TRIAD Uncharacterized protein OS=Trichoplax adhaerens OX=10228 GN=TRIADDRAFT_54447 PE=3 SV=1	Acropora_digitifera_adi_v1.19537 adi_v1.19537, Acropora_digitifera_adi_v1.24394 adi_v1.24394, Acropora_digitifera_adi_v1.06439 adi_v1.06439, Acropora_digitifera_adi_v1.08717 adi_v1.08717, Acropora_digitifera_adi_v1.18043 adi_v1.18043, Acropora_digitifera_adi_v1.04186 adi_v1.04186, Acropora_digitifera_adi_v1.02958 adi_v1.02958, Acropora_digitifera_adi_v1.13776 adi_v1.13776, Acropora_digitifera_adi_v1.10056 adi_v1.10056, Acropora_digitifera_adi_v1.13777 adi_v1.13777
OG0000018	Tricoplax_adhaerens_tr_B3RJF8_B3RJF8_TRIAD tr_B3RJF8_B3RJF8_TRIAD Uncharacterized protein OS=Trichoplax adhaerens OX=10228 GN=TRIADDRAFT_52608 PE=4 SV=1, Tricoplax_adhaerens_tr_B3RMD2_B3RMD2_TRIAD tr_B3RMD2_B3RMD2_TRIAD Uncharacterized protein OS=Trichoplax adhaerens OX=10228 GN=TRIADDRAFT_53907 PE=4 SV=1	Acropora_digitifera_adi_v1.13977 adi_v1.13977
OG0000019	Tricoplax_adhaerens_tr_B3S1T4_B3S1T4_TRIAD tr_B3S1T4_B3S1T4_TRIAD TGF_BETA_2 domain-containing protein OS=Trichoplax adhaerens OX=10228 GN=TRIADDRAFT_57877 PE=3 SV=1	Acropora_digitifera_adi_v1.06152 adi_v1.06152, Acropora_digitifera_adi_v1.06153 adi_v1.06153
OG0000019	Tricoplax_adhaerens_tr_B3S0I2_B3S0I2_TRIAD tr_B3S0I2_B3S0I2_TRIAD TGF_BETA_2 domain-containing protein OS=Trichoplax adhaerens OX=10228 GN=TRIADDRAFT_57057 PE=3 SV=1	Acropora_digitifera_adi_v1.01025 adi_v1.01025
OG0000021	Tricoplax_adhaerens_tr_B3S0C6_B3S0C6_TRIAD tr_B3S0C6_B3S0C6_TRIAD Uncharacterized protein OS=Trichoplax adhaerens OX=10228 GN=TRIADDRAFT_57765 PE=4 SV=1	Acropora_digitifera_adi_v1.16464 adi_v1.16464, Acropora_digitifera_adi_v1.16465 adi_v1.16465
OG0000022	Tricoplax_adhaerens_tr_B3S0N9_B3S0N9_TRIAD tr_B3S0N9_B3S0N9_TRIAD Annexin OS=Trichoplax adhaerens OX=10228 GN=TRIADDRAFT_57118 PE=3 SV=1	Acropora_digitifera_adi_v1.17095 adi_v1.17095
OG0000022	Tricoplax_adhaerens_tr_B3S9E5_B3S9E5_TRIAD tr_B3S9E5_B3S9E5_TRIAD Annexin OS=Trichoplax adhaerens OX=10228 GN=TRIADDRAFT_38333 PE=3 SV=1	Acropora_digitifera_adi_v1.08755 adi_v1.08755
OG0000023	Tricoplax_adhaerens_tr_B3SAV4_B3SAV4_TRIAD tr_B3SAV4_B3SAV4_TRIAD Uncharacterized protein OS=Trichoplax adhaerens OX=10228 GN=TRIADDRAFT_64349 PE=4 SV=1, Tricoplax_adhaerens_tr_B3SAV3_B3SAV3_TRIAD tr_B3SAV3_B3SAV3_TRIAD Uncharacterized protein _Fragment_ OS=Trichoplax adhaerens OX=10228 GN=TRIADDRAFT_32380 PE=4 SV=1, Tricoplax_adhaerens_tr_B3SAV2_B3SAV2_TRIAD tr_B3SAV2_B3SAV2_TRIAD Uncharacterized protein _Fragment_ OS=Trichoplax adhaerens OX=10228 GN=TRIADDRAFT_32362 PE=4 SV=1, Tricoplax_adhaerens_tr_B3SAV6_B3SAV6_TRIAD tr_B3SAV6_B3SAV6_TRIAD Uncharacterized protein OS=Trichoplax adhaerens OX=10228 GN=TRIADDRAFT_32445 PE=4 SV=1, Tricoplax_adhaerens_tr_B3SAV5_B3SAV5_TRIAD tr_B3SAV5_B3SAV5_TRIAD Uncharacterized protein OS=Trichoplax adhaerens OX=10228 GN=TRIADDRAFT_61393 PE=4 SV=1, Tricoplax_adhaerens_tr_B3SAW2_B3SAW2_TRIAD tr_B3SAW2_B3SAW2_TRIAD Uncharacterized protein OS=Trichoplax adhaerens OX=10228 GN=TRIADDRAFT_32386 PE=4 SV=1, Tricoplax_adhaerens_tr_B3RIV5_B3RIV5_TRIAD tr_B3RIV5_B3RIV5_TRIAD Uncharacterized protein _Fragment_ OS=Trichoplax adhaerens OX=10228 GN=TRIADDRAFT_1282 PE=4 SV=1	Acropora_digitifera_adi_v1.19445 adi_v1.19445
OG0000023	Tricoplax_adhaerens_tr_B3SF24_B3SF24_TRIAD tr_B3SF24_B3SF24_TRIAD Peptidase M12B domain-containing protein _Fragment_ OS=Trichoplax adhaerens OX=10228 GN=TRIADDRAFT_9730 PE=4 SV=1	Acropora_digitifera_adi_v1.03638 adi_v1.03638
OG0000024	Tricoplax_adhaerens_tr_B3SAJ2_B3SAJ2_TRIAD tr_B3SAJ2_B3SAJ2_TRIAD Predicted protein OS=Trichoplax adhaerens OX=10228 GN=TRIADDRAFT_61279 PE=4 SV=1	Acropora_digitifera_adi_v1.05361 adi_v1.05361, Acropora_digitifera_adi_v1.10598 adi_v1.10598, Acropora_digitifera_adi_v1.05363 adi_v1.05363, Acropora_digitifera_adi_v1.05362 adi_v1.05362
OG0000028	Tricoplax_adhaerens_tr_B3S7P7_B3S7P7_TRIAD tr_B3S7P7_B3S7P7_TRIAD Collagen IV NC1 domain-containing protein OS=Trichoplax adhaerens OX=10228 GN=TRIADDRAFT_30529 PE=4 SV=1, Tricoplax_adhaerens_tr_B3S7P5_B3S7P5_TRIAD tr_B3S7P5_B3S7P5_TRIAD Collagen IV NC1 domain-containing protein OS=Trichoplax adhaerens OX=10228 GN=TRIADDRAFT_60245 PE=4 SV=1	Acropora_digitifera_adi_v1.22704 adi_v1.22704
