Orthogroup	Placozoa_Trichoplacidae_Tricoplax_adhaerens	Cnidaria_Anthozoa_Acropora_digitifera
OG0000029	Tricoplax_adhaerens_tr_B3RLL8_B3RLL8_TRIAD tr_B3RLL8_B3RLL8_TRIAD Predicted protein OS=Trichoplax adhaerens OX=10228 GN=TRIADDRAFT_52048 PE=4 SV=1, Tricoplax_adhaerens_tr_B3S1M6_B3S1M6_TRIAD tr_B3S1M6_B3S1M6_TRIAD Predicted protein OS=Trichoplax adhaerens OX=10228 GN=TRIADDRAFT_58343 PE=4 SV=1, Tricoplax_adhaerens_tr_B3S8K5_B3S8K5_TRIAD tr_B3S8K5_B3S8K5_TRIAD Uncharacterized protein OS=Trichoplax adhaerens OX=10228 GN=TRIADDRAFT_60571 PE=4 SV=1, Tricoplax_adhaerens_tr_B3S8J9_B3S8J9_TRIAD tr_B3S8J9_B3S8J9_TRIAD LAM_G_DOMAIN domain-containing protein _Fragment_ OS=Trichoplax adhaerens OX=10228 GN=TRIADDRAFT_5406 PE=4 SV=1, Tricoplax_adhaerens_tr_B3S945_B3S945_TRIAD tr_B3S945_B3S945_TRIAD LAM_G_DOMAIN domain-containing protein OS=Trichoplax adhaerens OX=10228 GN=TRIADDRAFT_31364 PE=4 SV=1	Acropora_digitifera_adi_v1.05908 adi_v1.05908, Acropora_digitifera_adi_v1.23964 adi_v1.23964, Acropora_digitifera_adi_v1.05909 adi_v1.05909, Acropora_digitifera_adi_v1.07579 adi_v1.07579, Acropora_digitifera_adi_v1.23498 adi_v1.23498, Acropora_digitifera_adi_v1.06123 adi_v1.06123, Acropora_digitifera_adi_v1.06122 adi_v1.06122, Acropora_digitifera_adi_v1.15580 adi_v1.15580, Acropora_digitifera_adi_v1.18528 adi_v1.18528, Acropora_digitifera_adi_v1.24512 adi_v1.24512, Acropora_digitifera_adi_v1.05640 adi_v1.05640, Acropora_digitifera_adi_v1.23664 adi_v1.23664, Acropora_digitifera_adi_v1.19333 adi_v1.19333, Acropora_digitifera_adi_v1.18835 adi_v1.18835, Acropora_digitifera_adi_v1.14934 adi_v1.14934, Acropora_digitifera_adi_v1.17464 adi_v1.17464, Acropora_digitifera_adi_v1.23425 adi_v1.23425, Acropora_digitifera_adi_v1.13649 adi_v1.13649, Acropora_digitifera_adi_v1.21194 adi_v1.21194, Acropora_digitifera_adi_v1.02560 adi_v1.02560, Acropora_digitifera_adi_v1.06270 adi_v1.06270, Acropora_digitifera_adi_v1.10787 adi_v1.10787, Acropora_digitifera_adi_v1.03968 adi_v1.03968, Acropora_digitifera_adi_v1.24346 adi_v1.24346, Acropora_digitifera_adi_v1.03966 adi_v1.03966, Acropora_digitifera_adi_v1.10914 adi_v1.10914, Acropora_digitifera_adi_v1.10785 adi_v1.10785, Acropora_digitifera_adi_v1.10786 adi_v1.10786, Acropora_digitifera_adi_v1.12762 adi_v1.12762, Acropora_digitifera_adi_v1.12761 adi_v1.12761
OG0000030	Tricoplax_adhaerens_tr_B3S467_B3S467_TRIAD tr_B3S467_B3S467_TRIAD Peptidase M12B domain-containing protein OS=Trichoplax adhaerens OX=10228 GN=TRIADDRAFT_58971 PE=4 SV=1	Acropora_digitifera_adi_v1.13106 adi_v1.13106
OG0000030	Tricoplax_adhaerens_tr_B3RL71_B3RL71_TRIAD tr_B3RL71_B3RL71_TRIAD Uncharacterized protein OS=Trichoplax adhaerens OX=10228 GN=TRIADDRAFT_19172 PE=4 SV=1, Tricoplax_adhaerens_tr_B3RJM6_B3RJM6_TRIAD tr_B3RJM6_B3RJM6_TRIAD Uncharacterized protein OS=Trichoplax adhaerens OX=10228 GN=TRIADDRAFT_19354 PE=4 SV=1, Tricoplax_adhaerens_tr_B3RJQ4_B3RJQ4_TRIAD tr_B3RJQ4_B3RJQ4_TRIAD Uncharacterized protein OS=Trichoplax adhaerens OX=10228 GN=TRIADDRAFT_51548 PE=4 SV=1, Tricoplax_adhaerens_tr_B3RMA9_B3RMA9_TRIAD tr_B3RMA9_B3RMA9_TRIAD Uncharacterized protein OS=Trichoplax adhaerens OX=10228 GN=TRIADDRAFT_52298 PE=4 SV=1	Acropora_digitifera_adi_v1.02168 adi_v1.02168, Acropora_digitifera_adi_v1.09623 adi_v1.09623
OG0000031	Tricoplax_adhaerens_tr_B3RR34_B3RR34_TRIAD tr_B3RR34_B3RR34_TRIAD Uncharacterized protein _Fragment_ OS=Trichoplax adhaerens OX=10228 GN=TRIADDRAFT_22292 PE=4 SV=1	Acropora_digitifera_adi_v1.15338 adi_v1.15338
OG0000034	Tricoplax_adhaerens_tr_B3S377_B3S377_TRIAD tr_B3S377_B3S377_TRIAD Laminin EGF-like domain-containing protein OS=Trichoplax adhaerens OX=10228 GN=TRIADDRAFT_58624 PE=4 SV=1	Acropora_digitifera_adi_v1.08610 adi_v1.08610
OG0000034	Tricoplax_adhaerens_tr_B3RTL8_B3RTL8_TRIAD tr_B3RTL8_B3RTL8_TRIAD Uncharacterized protein OS=Trichoplax adhaerens OX=10228 GN=TRIADDRAFT_55971 PE=4 SV=1	Acropora_digitifera_adi_v1.13495 adi_v1.13495, Acropora_digitifera_adi_v1.18578 adi_v1.18578
OG0000040	Tricoplax_adhaerens_tr_B3SCG1_B3SCG1_TRIAD tr_B3SCG1_B3SCG1_TRIAD IGFBP N-terminal domain-containing protein OS=Trichoplax adhaerens OX=10228 GN=TRIADDRAFT_64395 PE=4 SV=1	Acropora_digitifera_adi_v1.09775 adi_v1.09775
OG0000041	Tricoplax_adhaerens_tr_B3SBE5_B3SBE5_TRIAD tr_B3SBE5_B3SBE5_TRIAD Poly [ADP-ribose] polymerase OS=Trichoplax adhaerens OX=10228 GN=TRIADDRAFT_61586 PE=4 SV=1, Tricoplax_adhaerens_tr_B3SBE1_B3SBE1_TRIAD tr_B3SBE1_B3SBE1_TRIAD Poly [ADP-ribose] polymerase _Fragment_ OS=Trichoplax adhaerens OX=10228 GN=TRIADDRAFT_32651 PE=4 SV=1	Acropora_digitifera_adi_v1.12520 adi_v1.12520, Acropora_digitifera_adi_v1.02837 adi_v1.02837
OG0000049	Tricoplax_adhaerens_tr_B3RWZ7_B3RWZ7_TRIAD tr_B3RWZ7_B3RWZ7_TRIAD Sema domain-containing protein OS=Trichoplax adhaerens OX=10228 GN=TRIADDRAFT_56941 PE=3 SV=1, Tricoplax_adhaerens_tr_B3RWZ9_B3RWZ9_TRIAD tr_B3RWZ9_B3RWZ9_TRIAD Sema domain-containing protein OS=Trichoplax adhaerens OX=10228 GN=TRIADDRAFT_56943 PE=3 SV=1	Acropora_digitifera_adi_v1.00526 adi_v1.00526
OG0000051	Tricoplax_adhaerens_tr_B3RP11_B3RP11_TRIAD tr_B3RP11_B3RP11_TRIAD VWFA domain-containing protein OS=Trichoplax adhaerens OX=10228 GN=TRIADDRAFT_53363 PE=4 SV=1	Acropora_digitifera_adi_v1.03896 adi_v1.03896
OG0000051	Tricoplax_adhaerens_tr_B3RWW7_B3RWW7_TRIAD tr_B3RWW7_B3RWW7_TRIAD VWFA domain-containing protein OS=Trichoplax adhaerens OX=10228 GN=TRIADDRAFT_56910 PE=4 SV=1	Acropora_digitifera_adi_v1.17811 adi_v1.17811
OG0000054	Tricoplax_adhaerens_tr_B3S477_B3S477_TRIAD tr_B3S477_B3S477_TRIAD Uncharacterized protein OS=Trichoplax adhaerens OX=10228 GN=TRIADDRAFT_28844 PE=4 SV=1	Acropora_digitifera_adi_v1.00193 adi_v1.00193
OG0000058	Tricoplax_adhaerens_tr_B3RL79_B3RL79_TRIAD tr_B3RL79_B3RL79_TRIAD Uncharacterized protein OS=Trichoplax adhaerens OX=10228 GN=TRIADDRAFT_51908 PE=4 SV=1	Acropora_digitifera_adi_v1.10945 adi_v1.10945
OG0000058	Tricoplax_adhaerens_tr_B3S5T8_B3S5T8_TRIAD tr_B3S5T8_B3S5T8_TRIAD Uncharacterized protein OS=Trichoplax adhaerens OX=10228 GN=TRIADDRAFT_59472 PE=4 SV=1	Acropora_digitifera_adi_v1.09968 adi_v1.09968
OG0000065	Tricoplax_adhaerens_tr_B3SCH4_B3SCH4_TRIAD tr_B3SCH4_B3SCH4_TRIAD Uncharacterized protein OS=Trichoplax adhaerens OX=10228 GN=TRIADDRAFT_61971 PE=3 SV=1	Acropora_digitifera_adi_v1.01898 adi_v1.01898, Acropora_digitifera_adi_v1.06117 adi_v1.06117
OG0000065	Tricoplax_adhaerens_tr_B3SCH2_B3SCH2_TRIAD tr_B3SCH2_B3SCH2_TRIAD Uncharacterized protein OS=Trichoplax adhaerens OX=10228 GN=TRIADDRAFT_61969 PE=3 SV=1, Tricoplax_adhaerens_tr_B3SCH3_B3SCH3_TRIAD tr_B3SCH3_B3SCH3_TRIAD Uncharacterized protein OS=Trichoplax adhaerens OX=10228 GN=TRIADDRAFT_61970 PE=3 SV=1	Acropora_digitifera_adi_v1.06118 adi_v1.06118
OG0000080	Tricoplax_adhaerens_tr_B3RWZ3_B3RWZ3_TRIAD tr_B3RWZ3_B3RWZ3_TRIAD NTR domain-containing protein OS=Trichoplax adhaerens OX=10228 GN=TRIADDRAFT_56937 PE=3 SV=1	Acropora_digitifera_adi_v1.23049 adi_v1.23049, Acropora_digitifera_adi_v1.20179 adi_v1.20179, Acropora_digitifera_adi_v1.03235 adi_v1.03235
OG0000087	Tricoplax_adhaerens_tr_B3S564_B3S564_TRIAD tr_B3S564_B3S564_TRIAD Uncharacterized protein OS=Trichoplax adhaerens OX=10228 GN=TRIADDRAFT_59211 PE=3 SV=1	Acropora_digitifera_adi_v1.01106 adi_v1.01106
OG0000088	Tricoplax_adhaerens_tr_B3SC37_B3SC37_TRIAD tr_B3SC37_B3SC37_TRIAD Spondin domain-containing protein OS=Trichoplax adhaerens OX=10228 GN=TRIADDRAFT_61837 PE=4 SV=1	Acropora_digitifera_adi_v1.01059 adi_v1.01059
OG0000089	Tricoplax_adhaerens_tr_B3RM16_B3RM16_TRIAD tr_B3RM16_B3RM16_TRIAD Uncharacterized protein OS=Trichoplax adhaerens OX=10228 GN=TRIADDRAFT_52199 PE=4 SV=1	Acropora_digitifera_adi_v1.01316 adi_v1.01316
OG0000094	Tricoplax_adhaerens_tr_B3SCG9_B3SCG9_TRIAD tr_B3SCG9_B3SCG9_TRIAD Uncharacterized protein _Fragment_ OS=Trichoplax adhaerens OX=10228 GN=TRIADDRAFT_33284 PE=4 SV=1	Acropora_digitifera_adi_v1.13477 adi_v1.13477
OG0000103	Tricoplax_adhaerens_tr_B3RSJ4_B3RSJ4_TRIAD tr_B3RSJ4_B3RSJ4_TRIAD Uncharacterized protein OS=Trichoplax adhaerens OX=10228 GN=TRIADDRAFT_54619 PE=4 SV=1	Acropora_digitifera_adi_v1.12265 adi_v1.12265
OG0000114	Tricoplax_adhaerens_tr_B3RXZ8_B3RXZ8_TRIAD tr_B3RXZ8_B3RXZ8_TRIAD Fibronectin type-III domain-containing protein _Fragment_ OS=Trichoplax adhaerens OX=10228 GN=TRIADDRAFT_16582 PE=4 SV=1	Acropora_digitifera_adi_v1.04340 adi_v1.04340
OG0000119	Tricoplax_adhaerens_tr_B3S1E5_B3S1E5_TRIAD tr_B3S1E5_B3S1E5_TRIAD Uncharacterized protein OS=Trichoplax adhaerens OX=10228 GN=TRIADDRAFT_27850 PE=4 SV=1	Acropora_digitifera_adi_v1.12204 adi_v1.12204
OG0000131	Tricoplax_adhaerens_tr_B3RWZ0_B3RWZ0_TRIAD tr_B3RWZ0_B3RWZ0_TRIAD Predicted protein OS=Trichoplax adhaerens OX=10228 GN=TRIADDRAFT_56934 PE=4 SV=1, Tricoplax_adhaerens_tr_B3RWY9_B3RWY9_TRIAD tr_B3RWY9_B3RWY9_TRIAD Uncharacterized protein OS=Trichoplax adhaerens OX=10228 GN=TRIADDRAFT_56933 PE=4 SV=1, Tricoplax_adhaerens_tr_B3RWY7_B3RWY7_TRIAD tr_B3RWY7_B3RWY7_TRIAD Predicted protein OS=Trichoplax adhaerens OX=10228 GN=TRIADDRAFT_56931 PE=4 SV=1	Acropora_digitifera_adi_v1.13891 adi_v1.13891
OG0000133	Tricoplax_adhaerens_tr_B3S208_B3S208_TRIAD tr_B3S208_B3S208_TRIAD Uncharacterized protein _Fragment_ OS=Trichoplax adhaerens OX=10228 GN=TRIADDRAFT_10167 PE=4 SV=1, Tricoplax_adhaerens_tr_B3SB90_B3SB90_TRIAD tr_B3SB90_B3SB90_TRIAD Uncharacterized protein OS=Trichoplax adhaerens OX=10228 GN=TRIADDRAFT_61531 PE=4 SV=1	Acropora_digitifera_adi_v1.13517 adi_v1.13517
OG0000150	Tricoplax_adhaerens_tr_B3RPD5_B3RPD5_TRIAD tr_B3RPD5_B3RPD5_TRIAD Uncharacterized protein OS=Trichoplax adhaerens OX=10228 GN=TRIADDRAFT_53495 PE=4 SV=1	Acropora_digitifera_adi_v1.12343 adi_v1.12343
OG0000152	Tricoplax_adhaerens_tr_B3RKQ5_B3RKQ5_TRIAD tr_B3RKQ5_B3RKQ5_TRIAD Uncharacterized protein OS=Trichoplax adhaerens OX=10228 GN=TRIADDRAFT_51723 PE=3 SV=1	Acropora_digitifera_adi_v1.16224 adi_v1.16224
OG0000156	Tricoplax_adhaerens_tr_B3RLM2_B3RLM2_TRIAD tr_B3RLM2_B3RLM2_TRIAD MFAP1 domain-containing protein _Fragment_ OS=Trichoplax adhaerens OX=10228 GN=TRIADDRAFT_7634 PE=3 SV=1	Acropora_digitifera_adi_v1.15791 adi_v1.15791
OG0000165	Tricoplax_adhaerens_tr_B3RIT5_B3RIT5_TRIAD tr_B3RIT5_B3RIT5_TRIAD Uncharacterized protein _Fragment_ OS=Trichoplax adhaerens OX=10228 GN=TRIADDRAFT_15826 PE=4 SV=1	Acropora_digitifera_adi_v1.19692 adi_v1.19692
OG0000171	Tricoplax_adhaerens_tr_B3RRV6_B3RRV6_TRIAD tr_B3RRV6_B3RRV6_TRIAD Peptide-N_4_-_N-acetyl-beta-glucosaminyl_asparagine amidase OS=Trichoplax adhaerens OX=10228 GN=TRIADDRAFT_22754 PE=3 SV=1	Acropora_digitifera_adi_v1.04624 adi_v1.04624, Acropora_digitifera_adi_v1.01870 adi_v1.01870
OG0000176	Tricoplax_adhaerens_tr_B3RQB3_B3RQB3_TRIAD tr_B3RQB3_B3RQB3_TRIAD Fibronectin type-III domain-containing protein OS=Trichoplax adhaerens OX=10228 GN=TRIADDRAFT_53843 PE=4 SV=1	Acropora_digitifera_adi_v1.05518 adi_v1.05518
OG0000193	Tricoplax_adhaerens_tr_B3S637_B3S637_TRIAD tr_B3S637_B3S637_TRIAD Poly_A_-specific ribonuclease OS=Trichoplax adhaerens OX=10228 GN=TRIADDRAFT_30062 PE=3 SV=1	Acropora_digitifera_adi_v1.08763 adi_v1.08763
OG0000194	Tricoplax_adhaerens_tr_B3RKY1_B3RKY1_TRIAD tr_B3RKY1_B3RKY1_TRIAD Uncharacterized protein OS=Trichoplax adhaerens OX=10228 GN=TRIADDRAFT_51807 PE=4 SV=1	Acropora_digitifera_adi_v1.00469 adi_v1.00469
OG0000195	Tricoplax_adhaerens_tr_B3RPL2_B3RPL2_TRIAD tr_B3RPL2_B3RPL2_TRIAD Uncharacterized protein OS=Trichoplax adhaerens OX=10228 GN=TRIADDRAFT_53580 PE=4 SV=1	Acropora_digitifera_adi_v1.01290 adi_v1.01290
OG0000200	Tricoplax_adhaerens_tr_B3RXW6_B3RXW6_TRIAD tr_B3RXW6_B3RXW6_TRIAD Uncharacterized protein OS=Trichoplax adhaerens OX=10228 GN=TRIADDRAFT_56355 PE=4 SV=1	Acropora_digitifera_adi_v1.07516 adi_v1.07516
OG0000201	Tricoplax_adhaerens_tr_B3RIC1_B3RIC1_TRIAD tr_B3RIC1_B3RIC1_TRIAD Uncharacterized protein OS=Trichoplax adhaerens OX=10228 GN=TRIADDRAFT_63545 PE=4 SV=1	Acropora_digitifera_adi_v1.11496 adi_v1.11496
OG0000203	Tricoplax_adhaerens_tr_B3SD19_B3SD19_TRIAD tr_B3SD19_B3SD19_TRIAD Uncharacterized protein OS=Trichoplax adhaerens OX=10228 GN=TRIADDRAFT_62176 PE=4 SV=1	Acropora_digitifera_adi_v1.04333 adi_v1.04333
OG0000204	Tricoplax_adhaerens_tr_B3SBR6_B3SBR6_TRIAD tr_B3SBR6_B3SBR6_TRIAD Uncharacterized protein _Fragment_ OS=Trichoplax adhaerens OX=10228 GN=TRIADDRAFT_16904 PE=4 SV=1	Acropora_digitifera_adi_v1.12294 adi_v1.12294
OG0000209	Tricoplax_adhaerens_tr_B3S5H0_B3S5H0_TRIAD tr_B3S5H0_B3S5H0_TRIAD Uncharacterized protein OS=Trichoplax adhaerens OX=10228 GN=TRIADDRAFT_59612 PE=4 SV=1	Acropora_digitifera_adi_v1.07265 adi_v1.07265
OG0000210	Tricoplax_adhaerens_tr_B3RM08_B3RM08_TRIAD tr_B3RM08_B3RM08_TRIAD Uncharacterized protein OS=Trichoplax adhaerens OX=10228 GN=TRIADDRAFT_52191 PE=4 SV=1	Acropora_digitifera_adi_v1.01691 adi_v1.01691
OG0000212	Tricoplax_adhaerens_tr_B3RP37_B3RP37_TRIAD tr_B3RP37_B3RP37_TRIAD RING-type domain-containing protein OS=Trichoplax adhaerens OX=10228 GN=TRIADDRAFT_53391 PE=4 SV=1	Acropora_digitifera_adi_v1.12729 adi_v1.12729
OG0000219	Tricoplax_adhaerens_tr_B3RLQ7_B3RLQ7_TRIAD tr_B3RLQ7_B3RLQ7_TRIAD VWFA domain-containing protein OS=Trichoplax adhaerens OX=10228 GN=TRIADDRAFT_52086 PE=4 SV=1	Acropora_digitifera_adi_v1.15112 adi_v1.15112
OG0000220	Tricoplax_adhaerens_tr_B3RZY7_B3RZY7_TRIAD tr_B3RZY7_B3RZY7_TRIAD Predicted protein OS=Trichoplax adhaerens OX=10228 GN=TRIADDRAFT_57621 PE=4 SV=1	Acropora_digitifera_adi_v1.22708 adi_v1.22708
OG0000229	Tricoplax_adhaerens_tr_B3RKL9_B3RKL9_TRIAD tr_B3RKL9_B3RKL9_TRIAD Uncharacterized protein OS=Trichoplax adhaerens OX=10228 GN=TRIADDRAFT_52818 PE=4 SV=1	Acropora_digitifera_adi_v1.02366 adi_v1.02366
OG0000267	Tricoplax_adhaerens_tr_B3SB93_B3SB93_TRIAD tr_B3SB93_B3SB93_TRIAD Uncharacterized protein OS=Trichoplax adhaerens OX=10228 GN=TRIADDRAFT_61534 PE=4 SV=1	Acropora_digitifera_adi_v1.17264 adi_v1.17264
OG0000282	Tricoplax_adhaerens_tr_B3RRY9_B3RRY9_TRIAD tr_B3RRY9_B3RRY9_TRIAD B3_4 domain-containing protein OS=Trichoplax adhaerens OX=10228 GN=TRIADDRAFT_54414 PE=4 SV=1	Acropora_digitifera_adi_v1.06060 adi_v1.06060, Acropora_digitifera_adi_v1.20668 adi_v1.20668
OG0000314	Tricoplax_adhaerens_tr_B3RMY1_B3RMY1_TRIAD tr_B3RMY1_B3RMY1_TRIAD Uncharacterized protein OS=Trichoplax adhaerens OX=10228 GN=TRIADDRAFT_52967 PE=4 SV=1	Acropora_digitifera_adi_v1.05227 adi_v1.05227
OG0000348	Tricoplax_adhaerens_tr_B3RI43_B3RI43_TRIAD tr_B3RI43_B3RI43_TRIAD Uncharacterized protein OS=Trichoplax adhaerens OX=10228 GN=TRIADDRAFT_51260 PE=4 SV=1	Acropora_digitifera_adi_v1.13243 adi_v1.13243
OG0000698	Tricoplax_adhaerens_tr_B3S831_B3S831_TRIAD tr_B3S831_B3S831_TRIAD Uncharacterized protein OS=Trichoplax adhaerens OX=10228 GN=TRIADDRAFT_60387 PE=4 SV=1	Acropora_digitifera_adi_v1.03683 adi_v1.03683
OG0001143	Tricoplax_adhaerens_tr_B3RRK0_B3RRK0_TRIAD tr_B3RRK0_B3RRK0_TRIAD Uncharacterized protein _Fragment_ OS=Trichoplax adhaerens OX=10228 GN=TRIADDRAFT_4952 PE=4 SV=1	Acropora_digitifera_adi_v1.18511 adi_v1.18511, Acropora_digitifera_adi_v1.11996 adi_v1.11996
