Orthogroup	Cnidaria_Anthozoa_Stylophora_pistillata	Insecta_Diptera_Drosophila_melanogaster
OG0000000	Stylophora_pistillata_Spis6522 Spis6522 SpisGene6522, Stylophora_pistillata_Spis23020 Spis23020 SpisGene23020, Stylophora_pistillata_Spis15804 Spis15804 SpisGene15804, Stylophora_pistillata_Spis17174 Spis17174 SpisGene17174, Stylophora_pistillata_Spis20835 Spis20835 SpisGene20835, Stylophora_pistillata_Spis7346 Spis7346 SpisGene7346, Stylophora_pistillata_Spis17775 Spis17775 SpisGene17775, Stylophora_pistillata_Spis6288 Spis6288 SpisGene6288, Stylophora_pistillata_Spis3982 Spis3982 SpisGene3982, Stylophora_pistillata_Spis18763 Spis18763 SpisGene18763, Stylophora_pistillata_Spis10724 Spis10724 SpisGene10724, Stylophora_pistillata_Spis14953 Spis14953 SpisGene14953, Stylophora_pistillata_Spis19393 Spis19393 SpisGene19393, Stylophora_pistillata_Spis16696 Spis16696 SpisGene16696, Stylophora_pistillata_Spis12602 Spis12602 SpisGene12602, Stylophora_pistillata_Spis16434 Spis16434 SpisGene16434	Drosophila_melanogaster_tr_Q9VF34_Q9VF34_DROME tr|Q9VF34|Q9VF34_DROME Fibrinogen C-terminal domain-containing protein OS=Drosophila melanogaster OX=7227 GN=FBpp0082632 PE=4 SV=2
OG0000000	Stylophora_pistillata_Spis6532 Spis6532 SpisGene6532, Stylophora_pistillata_Spis22079 Spis22079 SpisGene22079, Stylophora_pistillata_Spis10952 Spis10952 SpisGene10952, Stylophora_pistillata_Spis14746 Spis14746 SpisGene14746, Stylophora_pistillata_Spis8083 Spis8083 SpisGene8083, Stylophora_pistillata_Spis8082 Spis8082 SpisGene8082, Stylophora_pistillata_Spis22076 Spis22076 SpisGene22076, Stylophora_pistillata_Spis18042 Spis18042 SpisGene18042, Stylophora_pistillata_Spis22993 Spis22993 SpisGene22993, Stylophora_pistillata_Spis9885 Spis9885 SpisGene9885, Stylophora_pistillata_Spis22619 Spis22619 SpisGene22619, Stylophora_pistillata_Spis22620 Spis22620 SpisGene22620, Stylophora_pistillata_Spis24695 Spis24695 SpisGene24695, Stylophora_pistillata_Spis17676 Spis17676 SpisGene17676, Stylophora_pistillata_Spis13935 Spis13935 SpisGene13935, Stylophora_pistillata_Spis10579 Spis10579 SpisGene10579, Stylophora_pistillata_Spis22545 Spis22545 SpisGene22545, Stylophora_pistillata_Spis24864 Spis24864 SpisGene24864, Stylophora_pistillata_Spis19503 Spis19503 SpisGene19503, Stylophora_pistillata_Spis12490 Spis12490 SpisGene12490, Stylophora_pistillata_Spis12489 Spis12489 SpisGene12489, Stylophora_pistillata_Spis19236 Spis19236 SpisGene19236, Stylophora_pistillata_Spis19237 Spis19237 SpisGene19237, Stylophora_pistillata_Spis22546 Spis22546 SpisGene22546, Stylophora_pistillata_Spis24624 Spis24624 SpisGene24624, Stylophora_pistillata_Spis19239 Spis19239 SpisGene19239, Stylophora_pistillata_Spis13910 Spis13910 SpisGene13910, Stylophora_pistillata_Spis18528 Spis18528 SpisGene18528, Stylophora_pistillata_Spis19451 Spis19451 SpisGene19451, Stylophora_pistillata_Spis1850 Spis1850 SpisGene1850, Stylophora_pistillata_Spis23981 Spis23981 SpisGene23981, Stylophora_pistillata_Spis5782 Spis5782 SpisGene5782, Stylophora_pistillata_Spis18527 Spis18527 SpisGene18527, Stylophora_pistillata_Spis1852 Spis1852 SpisGene1852, Stylophora_pistillata_Spis23181 Spis23181 SpisGene23181, Stylophora_pistillata_Spis22449 Spis22449 SpisGene22449, Stylophora_pistillata_Spis22450 Spis22450 SpisGene22450, Stylophora_pistillata_Spis12605 Spis12605 SpisGene12605, Stylophora_pistillata_Spis17776 Spis17776 SpisGene17776, Stylophora_pistillata_Spis12307 Spis12307 SpisGene12307, Stylophora_pistillata_Spis23976 Spis23976 SpisGene23976, Stylophora_pistillata_Spis12306 Spis12306 SpisGene12306, Stylophora_pistillata_Spis23675 Spis23675 SpisGene23675, Stylophora_pistillata_Spis5600 Spis5600 SpisGene5600, Stylophora_pistillata_Spis12603 Spis12603 SpisGene12603, Stylophora_pistillata_Spis7189 Spis7189 SpisGene7189, Stylophora_pistillata_Spis23677 Spis23677 SpisGene23677, Stylophora_pistillata_Spis16435 Spis16435 SpisGene16435, Stylophora_pistillata_Spis7226 Spis7226 SpisGene7226, Stylophora_pistillata_Spis22078 Spis22078 SpisGene22078, Stylophora_pistillata_Spis23974 Spis23974 SpisGene23974, Stylophora_pistillata_Spis7191 Spis7191 SpisGene7191, Stylophora_pistillata_Spis23211 Spis23211 SpisGene23211	Drosophila_melanogaster_tr_Q9VME7_Q9VME7_DROME tr|Q9VME7|Q9VME7_DROME Fibrinogen C-terminal domain-containing protein OS=Drosophila melanogaster OX=7227 GN=AAF52372 PE=4 SV=4, Drosophila_melanogaster_tr_Q4V4U2_Q4V4U2_DROME tr|Q4V4U2|Q4V4U2_DROME IP08170p OS=Drosophila melanogaster OX=7227 GN=AAF46801 PE=2 SV=1, Drosophila_melanogaster_tr_A1ZAJ8_A1ZAJ8_DROME tr|A1ZAJ8|A1ZAJ8_DROME FI17311p1 OS=Drosophila melanogaster OX=7227 GN=AAL48972 PE=2 SV=1, Drosophila_melanogaster_tr_A0A0B4K7T3_A0A0B4K7T3_DROME tr|A0A0B4K7T3|A0A0B4K7T3_DROME Uncharacterized protein_ isoform B OS=Drosophila melanogaster OX=7227 GN=AAF57948 PE=4 SV=1, Drosophila_melanogaster_tr_Q8SYS3_Q8SYS3_DROME tr|Q8SYS3|Q8SYS3_DROME RE38860p OS=Drosophila melanogaster OX=7227 GN=CG5550 PE=2 SV=1
OG0000000	Stylophora_pistillata_Spis4473 Spis4473 SpisGene4473	Drosophila_melanogaster_tr_Q9VX04_Q9VX04_DROME tr|Q9VX04|Q9VX04_DROME LP06940p OS=Drosophila melanogaster OX=7227 GN=FBpp0074269 PE=2 SV=2, Drosophila_melanogaster_tr_Q9W302_Q9W302_DROME tr|Q9W302|Q9W302_DROME GH05177p OS=Drosophila melanogaster OX=7227 GN=AAF46535 PE=2 SV=2, Drosophila_melanogaster_tr_M9PHH5_M9PHH5_DROME tr|M9PHH5|M9PHH5_DROME Uncharacterized protein_ isoform C OS=Drosophila melanogaster OX=7227 GN=FBpp0071364 PE=4 SV=1, Drosophila_melanogaster_tr_Q8MR72_Q8MR72_DROME tr|Q8MR72|Q8MR72_DROME GH01991p OS=Drosophila melanogaster OX=7227 GN=AAF46535 PE=2 SV=1, Drosophila_melanogaster_tr_Q9W301_Q9W301_DROME tr|Q9W301|Q9W301_DROME GH12692p OS=Drosophila melanogaster OX=7227 GN=Dmel\CG1889 PE=2 SV=1, Drosophila_melanogaster_tr_Q8IRM2_Q8IRM2_DROME tr|Q8IRM2|Q8IRM2_DROME Uncharacterized protein_ isoform D OS=Drosophila melanogaster OX=7227 GN=AAN09619 PE=4 SV=2, Drosophila_melanogaster_tr_A1Z7G6_A1Z7G6_DROME tr|A1Z7G6|A1Z7G6_DROME Fibrinogen C-terminal domain-containing protein _Fragment_ OS=Drosophila melanogaster OX=7227 GN=AAF59068 PE=4 SV=2, Drosophila_melanogaster_tr_Q95S38_Q95S38_DROME tr|Q95S38|Q95S38_DROME GM10015p OS=Drosophila melanogaster OX=7227 GN=CG10359 PE=2 SV=1, Drosophila_melanogaster_tr_B7Z0B3_B7Z0B3_DROME tr|B7Z0B3|B7Z0B3_DROME Uncharacterized protein_ isoform G OS=Drosophila melanogaster OX=7227 GN=AAF47782 PE=1 SV=1, Drosophila_melanogaster_tr_Q9VZN7_Q9VZN7_DROME tr|Q9VZN7|Q9VZN7_DROME RE57309p OS=Drosophila melanogaster OX=7227 GN=CG10359 PE=2 SV=2, Drosophila_melanogaster_tr_B7Z0B2_B7Z0B2_DROME tr|B7Z0B2|B7Z0B2_DROME Uncharacterized protein_ isoform E OS=Drosophila melanogaster OX=7227 GN=AAF47782 PE=1 SV=1
OG0000001	Stylophora_pistillata_Spis17368 Spis17368 SpisGene17368	Drosophila_melanogaster_sp_P11046_LAMB1_DROME sp|P11046|LAMB1_DROME Laminin subunit beta-1 OS=Drosophila melanogaster OX=7227 GN=LanB1 PE=1 SV=4
OG0000001	Stylophora_pistillata_Spis3304 Spis3304 SpisGene3304	Drosophila_melanogaster_sp_Q24567_NETA_DROME sp|Q24567|NETA_DROME Netrin-A OS=Drosophila melanogaster OX=7227 GN=NetA PE=2 SV=2, Drosophila_melanogaster_tr_X2JEZ9_X2JEZ9_DROME tr|X2JEZ9|X2JEZ9_DROME Netrin-A_ isoform C OS=Drosophila melanogaster OX=7227 GN=NetA PE=4 SV=1, Drosophila_melanogaster_tr_M9NF48_M9NF48_DROME tr|M9NF48|M9NF48_DROME Netrin-A_ isoform B OS=Drosophila melanogaster OX=7227 GN=NetA PE=4 SV=1
OG0000001	Stylophora_pistillata_Spis315 Spis315 SpisGene315	Drosophila_melanogaster_tr_X2JAW6_X2JAW6_DROME tr|X2JAW6|X2JAW6_DROME Laminin B2_ isoform B OS=Drosophila melanogaster OX=7227 GN=LanB2 PE=4 SV=1, Drosophila_melanogaster_sp_P15215_LAMC1_DROME sp|P15215|LAMC1_DROME Laminin subunit gamma-1 OS=Drosophila melanogaster OX=7227 GN=LanB2 PE=2 SV=2
OG0000001	Stylophora_pistillata_Spis645.t2 Spis645.t2 SpisGene645, Stylophora_pistillata_Spis598 Spis598 SpisGene598	Drosophila_melanogaster_tr_Q9XZC9_Q9XZC9_DROME tr|Q9XZC9|Q9XZC9_DROME Laminin alpha1_2 OS=Drosophila melanogaster OX=7227 GN=wb PE=2 SV=1, Drosophila_melanogaster_tr_Q8IP51_Q8IP51_DROME tr|Q8IP51|Q8IP51_DROME Wing blister_ isoform B OS=Drosophila melanogaster OX=7227 GN=wb PE=4 SV=1, Drosophila_melanogaster_tr_R9PY40_R9PY40_DROME tr|R9PY40|R9PY40_DROME Wing blister_ isoform G OS=Drosophila melanogaster OX=7227 GN=wb PE=4 SV=1
OG0000002	Stylophora_pistillata_Spis3385.t1 Spis3385.t1 SpisGene3385	Drosophila_melanogaster_tr_Q968S4_Q968S4_DROME tr|Q968S4|Q968S4_DROME Putative thrombospondin OS=Drosophila melanogaster OX=7227 GN=Tsp PE=2 SV=1, Drosophila_melanogaster_tr_Q9VM97_Q9VM97_DROME tr|Q9VM97|Q9VM97_DROME Thrombospondin_ isoform A OS=Drosophila melanogaster OX=7227 GN=Tsp PE=3 SV=2, Drosophila_melanogaster_tr_B7Z030_B7Z030_DROME tr|B7Z030|B7Z030_DROME Thrombospondin_ isoform G OS=Drosophila melanogaster OX=7227 GN=Tsp PE=3 SV=1
OG0000002	Stylophora_pistillata_Spis10820 Spis10820 SpisGene10820	Drosophila_melanogaster_tr_Q7YU67_Q7YU67_DROME tr|Q7YU67|Q7YU67_DROME RE68041p OS=Drosophila melanogaster OX=7227 GN=Sema5c PE=2 SV=1, Drosophila_melanogaster_tr_Q9VTT0_Q9VTT0_DROME tr|Q9VTT0|Q9VTT0_DROME Semaphorin 5c_ isoform A OS=Drosophila melanogaster OX=7227 GN=Sema5c PE=4 SV=3, Drosophila_melanogaster_tr_Q9U631_Q9U631_DROME tr|Q9U631|Q9U631_DROME Semaphorin 5C OS=Drosophila melanogaster OX=7227 GN=Sema5c PE=2 SV=1
OG0000002	Stylophora_pistillata_Spis372 Spis372 SpisGene372	Drosophila_melanogaster_tr_A1ZAF5_A1ZAF5_DROME tr|A1ZAF5|A1ZAF5_DROME FI18622p1 OS=Drosophila melanogaster OX=7227 GN=Sema2b PE=2 SV=1, Drosophila_melanogaster_tr_Q29QV5_Q29QV5_DROME tr|Q29QV5|Q29QV5_DROME IP13724p OS=Drosophila melanogaster OX=7227 GN=Sema2b PE=2 SV=1, Drosophila_melanogaster_tr_A0A0B4KG38_A0A0B4KG38_DROME tr|A0A0B4KG38|A0A0B4KG38_DROME Semaphorin 2b_ isoform D OS=Drosophila melanogaster OX=7227 GN=Sema2b PE=1 SV=1, Drosophila_melanogaster_sp_Q24323_SEM2A_DROME sp|Q24323|SEM2A_DROME Semaphorin-2A OS=Drosophila melanogaster OX=7227 GN=Sema2a PE=1 SV=2, Drosophila_melanogaster_sp_Q24322_SEM1A_DROME sp|Q24322|SEM1A_DROME Semaphorin-1A OS=Drosophila melanogaster OX=7227 GN=Sema1a PE=1 SV=3, Drosophila_melanogaster_tr_Q0E8S4_Q0E8S4_DROME tr|Q0E8S4|Q0E8S4_DROME Semaphorin 1a_ isoform D OS=Drosophila melanogaster OX=7227 GN=Sema1a PE=1 SV=2, Drosophila_melanogaster_tr_M9PCL7_M9PCL7_DROME tr|M9PCL7|M9PCL7_DROME Semaphorin 1a_ isoform G OS=Drosophila melanogaster OX=7227 GN=Sema1a PE=1 SV=1, Drosophila_melanogaster_tr_M9PFA5_M9PFA5_DROME tr|M9PFA5|M9PFA5_DROME Semaphorin 1a_ isoform H OS=Drosophila melanogaster OX=7227 GN=Sema1a PE=1 SV=1, Drosophila_melanogaster_tr_M9PB77_M9PB77_DROME tr|M9PB77|M9PB77_DROME Semaphorin 1a_ isoform I OS=Drosophila melanogaster OX=7227 GN=Sema1a PE=1 SV=1, Drosophila_melanogaster_tr_M9MRI2_M9MRI2_DROME tr|M9MRI2|M9MRI2_DROME Semaphorin 1a_ isoform F OS=Drosophila melanogaster OX=7227 GN=Sema1a PE=1 SV=1, Drosophila_melanogaster_tr_Q7KK54_Q7KK54_DROME tr|Q7KK54|Q7KK54_DROME MIP07328p OS=Drosophila melanogaster OX=7227 GN=Sema1b PE=1 SV=1, Drosophila_melanogaster_tr_O44253_O44253_DROME tr|O44253|O44253_DROME Similar to semaphorin-I OS=Drosophila melanogaster OX=7227 GN=Sema1b PE=2 SV=1
OG0000006	Stylophora_pistillata_Spis1234.t1 Spis1234.t1 SpisGene1234	Drosophila_melanogaster_tr_Q058W1_Q058W1_DROME tr|Q058W1|Q058W1_DROME Hig-anchoring scaffold protein_ isoform D OS=Drosophila melanogaster OX=7227 GN=Hasp PE=1 SV=1, Drosophila_melanogaster_tr_Q9VIU9_Q9VIU9_DROME tr|Q9VIU9|Q9VIU9_DROME Hig-anchoring scaffold protein_ isoform C OS=Drosophila melanogaster OX=7227 GN=Hasp PE=1 SV=3, Drosophila_melanogaster_tr_B7YZX0_B7YZX0_DROME tr|B7YZX0|B7YZX0_DROME Hig-anchoring scaffold protein_ isoform G OS=Drosophila melanogaster OX=7227 GN=Hasp PE=1 SV=2, Drosophila_melanogaster_tr_Q8INW2_Q8INW2_DROME tr|Q8INW2|Q8INW2_DROME Hig-anchoring scaffold protein_ isoform A OS=Drosophila melanogaster OX=7227 GN=Hasp PE=1 SV=1
OG0000006	Stylophora_pistillata_Spis13733 Spis13733 SpisGene13733, Stylophora_pistillata_Spis1578 Spis1578 SpisGene1578	Drosophila_melanogaster_sp_Q09101_HIG_DROME sp|Q09101|HIG_DROME Locomotion-related protein Hikaru genki OS=Drosophila melanogaster OX=7227 GN=hig PE=1 SV=2
OG0000007	Stylophora_pistillata_Spis1859 Spis1859 SpisGene1859	Drosophila_melanogaster_tr_M9PEI1_M9PEI1_DROME tr|M9PEI1|M9PEI1_DROME Dumpy_ isoform U OS=Drosophila melanogaster OX=7227 GN=dpy PE=4 SV=1, Drosophila_melanogaster_tr_M9PC45_M9PC45_DROME tr|M9PC45|M9PC45_DROME Dumpy_ isoform T OS=Drosophila melanogaster OX=7227 GN=dpy PE=4 SV=1, Drosophila_melanogaster_tr_M9PB31_M9PB31_DROME tr|M9PB31|M9PB31_DROME Dumpy_ isoform V OS=Drosophila melanogaster OX=7227 GN=dpy PE=4 SV=1, Drosophila_melanogaster_tr_M9PCJ6_M9PCJ6_DROME tr|M9PCJ6|M9PCJ6_DROME Dumpy_ isoform S OS=Drosophila melanogaster OX=7227 GN=dpy PE=4 SV=1, Drosophila_melanogaster_tr_M9PC48_M9PC48_DROME tr|M9PC48|M9PC48_DROME Dumpy_ isoform Y OS=Drosophila melanogaster OX=7227 GN=dpy PE=4 SV=1, Drosophila_melanogaster_tr_M9PEI7_M9PEI7_DROME tr|M9PEI7|M9PEI7_DROME Dumpy_ isoform Z OS=Drosophila melanogaster OX=7227 GN=dpy PE=4 SV=1, Drosophila_melanogaster_tr_M9PBZ0_M9PBZ0_DROME tr|M9PBZ0|M9PBZ0_DROME Dumpy_ isoform R OS=Drosophila melanogaster OX=7227 GN=dpy PE=4 SV=1, Drosophila_melanogaster_tr_M9PB30_M9PB30_DROME tr|M9PB30|M9PB30_DROME Dumpy_ isoform Q OS=Drosophila melanogaster OX=7227 GN=dpy PE=1 SV=1, Drosophila_melanogaster_tr_M9PC41_M9PC41_DROME tr|M9PC41|M9PC41_DROME Dumpy_ isoform O OS=Drosophila melanogaster OX=7227 GN=dpy PE=4 SV=1, Drosophila_melanogaster_tr_M9PB32_M9PB32_DROME tr|M9PB32|M9PB32_DROME Dumpy_ isoform AA OS=Drosophila melanogaster OX=7227 GN=dpy PE=4 SV=1, Drosophila_melanogaster_tr_M9PEH5_M9PEH5_DROME tr|M9PEH5|M9PEH5_DROME Dumpy_ isoform P OS=Drosophila melanogaster OX=7227 GN=dpy PE=4 SV=1, Drosophila_melanogaster_tr_M9PBZ4_M9PBZ4_DROME tr|M9PBZ4|M9PBZ4_DROME Dumpy_ isoform W OS=Drosophila melanogaster OX=7227 GN=dpy PE=4 SV=1, Drosophila_melanogaster_tr_M9PCJ8_M9PCJ8_DROME tr|M9PCJ8|M9PCJ8_DROME Dumpy_ isoform X OS=Drosophila melanogaster OX=7227 GN=dpy PE=4 SV=1, Drosophila_melanogaster_tr_M9NCR4_M9NCR4_DROME tr|M9NCR4|M9NCR4_DROME Dumpy_ isoform J OS=Drosophila melanogaster OX=7227 GN=dpy PE=4 SV=1, Drosophila_melanogaster_tr_M9NER8_M9NER8_DROME tr|M9NER8|M9NER8_DROME Dumpy_ isoform I OS=Drosophila melanogaster OX=7227 GN=dpy PE=4 SV=1, Drosophila_melanogaster_tr_M9NE82_M9NE82_DROME tr|M9NE82|M9NE82_DROME Dumpy_ isoform M OS=Drosophila melanogaster OX=7227 GN=dpy PE=4 SV=1
OG0000009	Stylophora_pistillata_Spis4925 Spis4925 SpisGene4925, Stylophora_pistillata_Spis8057 Spis8057 SpisGene8057	Drosophila_melanogaster_tr_Q49II5_Q49II5_DROME tr|Q49II5|Q49II5_DROME Metalloendopeptidase _Fragment_ OS=Drosophila melanogaster OX=7227 GN=tok PE=4 SV=1, Drosophila_melanogaster_tr_Q49IJ1_Q49IJ1_DROME tr|Q49IJ1|Q49IJ1_DROME Metalloendopeptidase _Fragment_ OS=Drosophila melanogaster OX=7227 GN=tok PE=4 SV=1, Drosophila_melanogaster_tr_Q49IJ0_Q49IJ0_DROME tr|Q49IJ0|Q49IJ0_DROME Metalloendopeptidase _Fragment_ OS=Drosophila melanogaster OX=7227 GN=tok PE=4 SV=1, Drosophila_melanogaster_tr_Q49II8_Q49II8_DROME tr|Q49II8|Q49II8_DROME Metalloendopeptidase _Fragment_ OS=Drosophila melanogaster OX=7227 GN=tok PE=4 SV=1, Drosophila_melanogaster_tr_Q49II0_Q49II0_DROME tr|Q49II0|Q49II0_DROME Metalloendopeptidase _Fragment_ OS=Drosophila melanogaster OX=7227 GN=tok PE=4 SV=1, Drosophila_melanogaster_tr_Q49II7_Q49II7_DROME tr|Q49II7|Q49II7_DROME Metalloendopeptidase _Fragment_ OS=Drosophila melanogaster OX=7227 GN=tok PE=4 SV=1, Drosophila_melanogaster_tr_Q49IK4_Q49IK4_DROME tr|Q49IK4|Q49IK4_DROME Metalloendopeptidase _Fragment_ OS=Drosophila melanogaster OX=7227 GN=tok PE=4 SV=1, Drosophila_melanogaster_sp_Q9VC47_TOK_DROME sp|Q9VC47|TOK_DROME Protein tolkin OS=Drosophila melanogaster OX=7227 GN=tok PE=1 SV=1, Drosophila_melanogaster_tr_Q7YU36_Q7YU36_DROME tr|Q7YU36|Q7YU36_DROME Metalloendopeptidase OS=Drosophila melanogaster OX=7227 GN=tld PE=2 SV=1, Drosophila_melanogaster_sp_P25723_TLD_DROME sp|P25723|TLD_DROME Dorsal-ventral patterning protein tolloid OS=Drosophila melanogaster OX=7227 GN=tld PE=2 SV=2
OG0000012	Stylophora_pistillata_Spis8301 Spis8301 SpisGene8301, Stylophora_pistillata_Spis6613 Spis6613 SpisGene6613	Drosophila_melanogaster_tr_Q9U5D0_Q9U5D0_DROME tr|Q9U5D0|Q9U5D0_DROME Hemolectin OS=Drosophila melanogaster OX=7227 GN=Hml PE=2 SV=1, Drosophila_melanogaster_tr_Q9VU94_Q9VU94_DROME tr|Q9VU94|Q9VU94_DROME Hemolectin_ isoform A OS=Drosophila melanogaster OX=7227 GN=Hml PE=1 SV=2, Drosophila_melanogaster_tr_M9PCE5_M9PCE5_DROME tr|M9PCE5|M9PCE5_DROME Hemolectin_ isoform B OS=Drosophila melanogaster OX=7227 GN=Hml PE=1 SV=1, Drosophila_melanogaster_tr_Q8MS79_Q8MS79_DROME tr|Q8MS79|Q8MS79_DROME LP05709p OS=Drosophila melanogaster OX=7227 GN=Hml PE=2 SV=1
OG0000012	Stylophora_pistillata_Spis11321.t1 Spis11321.t1 SpisGene11321	Drosophila_melanogaster_tr_Q9W2H2_Q9W2H2_DROME tr|Q9W2H2|Q9W2H2_DROME Crossveinless 2 OS=Drosophila melanogaster OX=7227 GN=cv-2 PE=2 SV=2, Drosophila_melanogaster_tr_Q9GYX3_Q9GYX3_DROME tr|Q9GYX3|Q9GYX3_DROME Crossveinless 2 OS=Drosophila melanogaster OX=7227 GN=cv-2 PE=2 SV=2
OG0000012	Stylophora_pistillata_Spis3283 Spis3283 SpisGene3283, Stylophora_pistillata_Spis16938 Spis16938 SpisGene16938	Drosophila_melanogaster_tr_Q9VKA7_Q9VKA7_DROME tr|Q9VKA7|Q9VKA7_DROME VWFC domain-containing protein OS=Drosophila melanogaster OX=7227 GN=Dmel\CG17211 PE=4 SV=1
OG0000013	Stylophora_pistillata_Spis10384 Spis10384 SpisGene10384	Drosophila_melanogaster_tr_Q9VM26_Q9VM26_DROME tr|Q9VM26|Q9VM26_DROME Protein Wnt OS=Drosophila melanogaster OX=7227 GN=Wnt6 PE=2 SV=3
OG0000013	Stylophora_pistillata_Spis10385 Spis10385 SpisGene10385	Drosophila_melanogaster_sp_P09615_WNTG_DROME sp|P09615|WNTG_DROME Protein wingless OS=Drosophila melanogaster OX=7227 GN=wg PE=1 SV=1
OG0000013	Stylophora_pistillata_Spis3868.t1 Spis3868.t1 SpisGene3868	Drosophila_melanogaster_sp_P28465_WNT2_DROME sp|P28465|WNT2_DROME Protein Wnt-2 OS=Drosophila melanogaster OX=7227 GN=Wnt2 PE=2 SV=2, Drosophila_melanogaster_tr_A0A0B4LFY4_A0A0B4LFY4_DROME tr|A0A0B4LFY4|A0A0B4LFY4_DROME Protein Wnt OS=Drosophila melanogaster OX=7227 GN=Wnt2 PE=3 SV=1
OG0000013	Stylophora_pistillata_Spis18607.t1 Spis18607.t1 SpisGene18607, Stylophora_pistillata_Spis727 Spis727 SpisGene727, Stylophora_pistillata_Spis726 Spis726 SpisGene726, Stylophora_pistillata_Spis18606 Spis18606 SpisGene18606	Drosophila_melanogaster_sp_Q9VFX1_WNT8_DROME sp|Q9VFX1|WNT8_DROME Wnt inhibitor of Dorsal protein OS=Drosophila melanogaster OX=7227 GN=wntD PE=1 SV=2
OG0000013	Stylophora_pistillata_Spis10383 Spis10383 SpisGene10383	Drosophila_melanogaster_tr_Q9VM25_Q9VM25_DROME tr|Q9VM25|Q9VM25_DROME Protein Wnt OS=Drosophila melanogaster OX=7227 GN=Wnt10 PE=3 SV=4
OG0000014	Stylophora_pistillata_Spis347 Spis347 SpisGene347	Drosophila_melanogaster_tr_Q9VKV3_Q9VKV3_DROME tr|Q9VKV3|Q9VKV3_DROME Lonely heart_ isoform A OS=Drosophila melanogaster OX=7227 GN=loh PE=4 SV=3, Drosophila_melanogaster_tr_Q8MSF8_Q8MSF8_DROME tr|Q8MSF8|Q8MSF8_DROME GM15606p OS=Drosophila melanogaster OX=7227 GN=loh PE=2 SV=1, Drosophila_melanogaster_tr_E1JHE3_E1JHE3_DROME tr|E1JHE3|E1JHE3_DROME Lonely heart_ isoform D OS=Drosophila melanogaster OX=7227 GN=loh PE=4 SV=2, Drosophila_melanogaster_tr_M9MRI1_M9MRI1_DROME tr|M9MRI1|M9MRI1_DROME Lonely heart_ isoform C OS=Drosophila melanogaster OX=7227 GN=loh PE=4 SV=1
OG0000014	Stylophora_pistillata_Spis2407 Spis2407 SpisGene2407	Drosophila_melanogaster_sp_Q868Z9_PPN_DROME sp|Q868Z9|PPN_DROME Papilin OS=Drosophila melanogaster OX=7227 GN=Ppn PE=1 SV=2
OG0000014	Stylophora_pistillata_Spis12681 Spis12681 SpisGene12681	Drosophila_melanogaster_tr_A0A0B4KHK4_A0A0B4KHK4_DROME tr|A0A0B4KHK4|A0A0B4KHK4_DROME ADAM metallopeptidase with thrombospondin type 1 motif A_ isoform C OS=Drosophila melanogaster OX=7227 GN=AdamTS-A PE=4 SV=1, Drosophila_melanogaster_tr_Q7KSH7_Q7KSH7_DROME tr|Q7KSH7|Q7KSH7_DROME ADAM metallopeptidase with thrombospondin type 1 motif A_ isoform E OS=Drosophila melanogaster OX=7227 GN=AdamTS-A PE=4 SV=1, Drosophila_melanogaster_tr_Q8SXB0_Q8SXB0_DROME tr|Q8SXB0|Q8SXB0_DROME ADAM metallopeptidase with thrombospondin type 1 motif A_ isoform B OS=Drosophila melanogaster OX=7227 GN=AdamTS-A PE=2 SV=1
OG0000014	Stylophora_pistillata_Spis12680 Spis12680 SpisGene12680	Drosophila_melanogaster_tr_Q8MRL5_Q8MRL5_DROME tr|Q8MRL5|Q8MRL5_DROME ADAM metallopeptidase with thrombospondin type 1 motif B_ isoform C OS=Drosophila melanogaster OX=7227 GN=AdamTS-B PE=2 SV=1, Drosophila_melanogaster_tr_Q9W493_Q9W493_DROME tr|Q9W493|Q9W493_DROME ADAM metallopeptidase with thrombospondin type 1 motif B_ isoform B OS=Drosophila melanogaster OX=7227 GN=AdamTS-B PE=4 SV=3
