Orthogroup	Ctenophora_Nuda_Beroe_ovata	Chordata_Vertebrata_Mus_musculus
OG0000000	Beroe_ovata_Bova1_4.0362.g6.t1 Bova1_4.0362.g6.t1	Mus_musculus_sp_Q80YX1_TENA_MOUSE sp_Q80YX1_TENA_MOUSE Tenascin OS=Mus musculus OX=10090 GN=Tnc PE=1 SV=1, Mus_musculus_sp_Q80YX1_TENA_MOUSE sp_Q80YX1_TENA_MOUSE Tenascin OS=Mus musculus OX=10090 GN=Tnc PE=1 SV=1, Mus_musculus_sp_Q80YX1_TENA_MOUSE sp_Q80YX1_TENA_MOUSE Tenascin OS=Mus musculus OX=10090 GN=Tnc PE=1 SV=1, Mus_musculus_sp_Q8BYI9_TENR_MOUSE sp_Q8BYI9_TENR_MOUSE Tenascin-R OS=Mus musculus OX=10090 GN=Tnr PE=1 SV=2, Mus_musculus_sp_Q8BYI9_TENR_MOUSE sp_Q8BYI9_TENR_MOUSE Tenascin-R OS=Mus musculus OX=10090 GN=Tnr PE=1 SV=2, Mus_musculus_sp_Q80Z71_TENN_MOUSE sp_Q80Z71_TENN_MOUSE Tenascin-N OS=Mus musculus OX=10090 GN=Tnn PE=1 SV=2
OG0000001	Beroe_ovata_Bova1_4.0354.g11.t1 Bova1_4.0354.g11.t1, Beroe_ovata_Bova1_4.0491.g2.t1 Bova1_4.0491.g2.t1	Mus_musculus_sp_Q61092_LAMC2_MOUSE sp_Q61092_LAMC2_MOUSE Laminin subunit gamma-2 OS=Mus musculus OX=10090 GN=Lamc2 PE=1 SV=2
OG0000001	Beroe_ovata_Bova1_4.0204.g2.t1 Bova1_4.0204.g2.t1	Mus_musculus_sp_Q9JI33_NET4_MOUSE sp_Q9JI33_NET4_MOUSE Netrin-4 OS=Mus musculus OX=10090 GN=Ntn4 PE=1 SV=2, Mus_musculus_sp_Q61087_LAMB3_MOUSE sp_Q61087_LAMB3_MOUSE Laminin subunit beta-3 OS=Mus musculus OX=10090 GN=Lamb3 PE=1 SV=2, Mus_musculus_sp_Q61292_LAMB2_MOUSE sp_Q61292_LAMB2_MOUSE Laminin subunit beta-2 OS=Mus musculus OX=10090 GN=Lamb2 PE=1 SV=2, Mus_musculus_sp_P02469_LAMB1_MOUSE sp_P02469_LAMB1_MOUSE Laminin subunit beta-1 OS=Mus musculus OX=10090 GN=Lamb1 PE=1 SV=3
OG0000001	Beroe_ovata_Bova1_4.0005.g58.t1 Bova1_4.0005.g58.t1	Mus_musculus_sp_Q9R1A3_NET3_MOUSE sp_Q9R1A3_NET3_MOUSE Netrin-3 OS=Mus musculus OX=10090 GN=Ntn3 PE=2 SV=1, Mus_musculus_sp_O09118_NET1_MOUSE sp_O09118_NET1_MOUSE Netrin-1 OS=Mus musculus OX=10090 GN=Ntn1 PE=1 SV=3, Mus_musculus_sp_Q9R0B6_LAMC3_MOUSE sp_Q9R0B6_LAMC3_MOUSE Laminin subunit gamma-3 OS=Mus musculus OX=10090 GN=Lamc3 PE=1 SV=2, Mus_musculus_sp_P02468_LAMC1_MOUSE sp_P02468_LAMC1_MOUSE Laminin subunit gamma-1 OS=Mus musculus OX=10090 GN=Lamc1 PE=1 SV=2
OG0000003	Beroe_ovata_Bova1_4.0552.g4.t1 Bova1_4.0552.g4.t1, Beroe_ovata_Bova1_4.0203.g12.t2 Bova1_4.0203.g12.t2, Beroe_ovata_Bova1_4.0203.g12.t1 Bova1_4.0203.g12.t1, Beroe_ovata_Bova1_4.0552.g5.t1 Bova1_4.0552.g5.t1, Beroe_ovata_Bova1_4.0203.g13.t1 Bova1_4.0203.g13.t1, Beroe_ovata_Bova1_4.2546.g1.t1 Bova1_4.2546.g1.t1	Mus_musculus_sp_Q61361_PGCB_MOUSE sp_Q61361_PGCB_MOUSE Brevican core protein OS=Mus musculus OX=10090 GN=Bcan PE=1 SV=2, Mus_musculus_sp_P55066_NCAN_MOUSE sp_P55066_NCAN_MOUSE Neurocan core protein OS=Mus musculus OX=10090 GN=Ncan PE=1 SV=1, Mus_musculus_sp_Q61282_PGCA_MOUSE sp_Q61282_PGCA_MOUSE Aggrecan core protein OS=Mus musculus OX=10090 GN=Acan PE=1 SV=2, Mus_musculus_sp_Q62059_CSPG2_MOUSE sp_Q62059_CSPG2_MOUSE Versican core protein OS=Mus musculus OX=10090 GN=Vcan PE=1 SV=2, Mus_musculus_sp_Q62059_CSPG2_MOUSE sp_Q62059_CSPG2_MOUSE Versican core protein OS=Mus musculus OX=10090 GN=Vcan PE=1 SV=2
OG0000010	Beroe_ovata_Bova1_4.0203.g21.t1 Bova1_4.0203.g21.t1	Mus_musculus_sp_Q05793_PGBM_MOUSE sp_Q05793_PGBM_MOUSE Basement membrane-specific heparan sulfate proteoglycan core protein OS=Mus musculus OX=10090 GN=Hspg2 PE=1 SV=1, Mus_musculus_sp_Q4VBE4_EGFLA_MOUSE sp_Q4VBE4_EGFLA_MOUSE Pikachurin OS=Mus musculus OX=10090 GN=Egflam PE=1 SV=1, Mus_musculus_sp_Q4VBE4_EGFLA_MOUSE sp_Q4VBE4_EGFLA_MOUSE Pikachurin OS=Mus musculus OX=10090 GN=Egflam PE=1 SV=1
OG0000010	Beroe_ovata_Bova1_4.0344.g2.t1 Bova1_4.0344.g2.t1, Beroe_ovata_Bova1_4.0113.g30.t1 Bova1_4.0113.g30.t1, Beroe_ovata_Bova1_4.0113.g29.t1 Bova1_4.0113.g29.t1	Mus_musculus_sp_A2ASQ1_AGRIN_MOUSE sp_A2ASQ1_AGRIN_MOUSE Agrin OS=Mus musculus OX=10090 GN=Agrn PE=1 SV=1, Mus_musculus_sp_A2ASQ1_AGRIN_MOUSE sp_A2ASQ1_AGRIN_MOUSE Agrin OS=Mus musculus OX=10090 GN=Agrn PE=1 SV=1, Mus_musculus_sp_P47931_FST_MOUSE sp_P47931_FST_MOUSE Follistatin OS=Mus musculus OX=10090 GN=Fst PE=2 SV=1
OG0000011	Beroe_ovata_Bova1_4.0021.g15.t1 Bova1_4.0021.g15.t1	Mus_musculus_sp_P26928_HGFL_MOUSE sp_P26928_HGFL_MOUSE Hepatocyte growth factor-like protein OS=Mus musculus OX=10090 GN=Mst1 PE=2 SV=2, Mus_musculus_sp_Q08048_HGF_MOUSE sp_Q08048_HGF_MOUSE Hepatocyte growth factor OS=Mus musculus OX=10090 GN=Hgf PE=1 SV=1, Mus_musculus_sp_Q08048_HGF_MOUSE sp_Q08048_HGF_MOUSE Hepatocyte growth factor OS=Mus musculus OX=10090 GN=Hgf PE=1 SV=1
OG0000012	Beroe_ovata_Bova1_4.0198.g22.t1 Bova1_4.0198.g22.t1, Beroe_ovata_Bova1_4.0198.g23.t1 Bova1_4.0198.g23.t1, Beroe_ovata_Bova1_4.0322.g6.t1 Bova1_4.0322.g6.t1	Mus_musculus_sp_Q6PZE0_MUC19_MOUSE sp_Q6PZE0_MUC19_MOUSE Mucin-19 OS=Mus musculus OX=10090 GN=Muc19 PE=2 SV=2, Mus_musculus_sp_Q80T03_MUC6_MOUSE sp_Q80T03_MUC6_MOUSE Mucin-6 OS=Mus musculus OX=10090 GN=Muc6 PE=2 SV=1, Mus_musculus_sp_Q80Z19_MUC2_MOUSE sp_Q80Z19_MUC2_MOUSE Mucin-2 _Fragment_ OS=Mus musculus OX=10090 GN=Muc2 PE=1 SV=2, Mus_musculus_sp_Q8CG65_SSPO_MOUSE sp_Q8CG65_SSPO_MOUSE SCO-spondin OS=Mus musculus OX=10090 GN=Sspo PE=2 SV=2, Mus_musculus_sp_Q8CIZ8_VWF_MOUSE sp_Q8CIZ8_VWF_MOUSE von Willebrand factor OS=Mus musculus OX=10090 GN=Vwf PE=1 SV=2, Mus_musculus_sp_F7A4A7_OTOGL_MOUSE sp_F7A4A7_OTOGL_MOUSE Otogelin-like protein OS=Mus musculus OX=10090 GN=Otogl PE=1 SV=1, Mus_musculus_sp_O55225_OTOG_MOUSE sp_O55225_OTOG_MOUSE Otogelin OS=Mus musculus OX=10090 GN=Otog PE=1 SV=3, Mus_musculus_sp_O55225_OTOG_MOUSE sp_O55225_OTOG_MOUSE Otogelin OS=Mus musculus OX=10090 GN=Otog PE=1 SV=3
OG0000012	Beroe_ovata_Bova1_4.0055.g43.t1 Bova1_4.0055.g43.t1, Beroe_ovata_Bova1_4.0090.g28.t2 Bova1_4.0090.g28.t2, Beroe_ovata_Bova1_4.0090.g28.t1 Bova1_4.0090.g28.t1, Beroe_ovata_Bova1_4.0548.g1.t2 Bova1_4.0548.g1.t2, Beroe_ovata_Bova1_4.0548.g1.t1 Bova1_4.0548.g1.t1	Mus_musculus_sp_O08523_TECTA_MOUSE sp_O08523_TECTA_MOUSE Alpha-tectorin OS=Mus musculus OX=10090 GN=Tecta PE=1 SV=2, Mus_musculus_sp_Q8CJ69_BMPER_MOUSE sp_Q8CJ69_BMPER_MOUSE BMP-binding endothelial regulator protein OS=Mus musculus OX=10090 GN=Bmper PE=1 SV=1, Mus_musculus_sp_Q3U492_KCP_MOUSE sp_Q3U492_KCP_MOUSE Kielin_chordin-like protein OS=Mus musculus OX=10090 GN=Kcp PE=1 SV=2, Mus_musculus_sp_Q3U515_VWCE_MOUSE sp_Q3U515_VWCE_MOUSE von Willebrand factor C and EGF domain-containing protein OS=Mus musculus OX=10090 GN=Vwce PE=2 SV=2
OG0000013	Beroe_ovata_Bova1_4.0140.g20.t1 Bova1_4.0140.g20.t1	Mus_musculus_sp_P28047_WNT7B_MOUSE sp_P28047_WNT7B_MOUSE Protein Wnt-7b OS=Mus musculus OX=10090 GN=Wnt7b PE=1 SV=1, Mus_musculus_sp_P21552_WNT2_MOUSE sp_P21552_WNT2_MOUSE Protein Wnt-2 OS=Mus musculus OX=10090 GN=Wnt2 PE=2 SV=2, Mus_musculus_sp_O70283_WNT2B_MOUSE sp_O70283_WNT2B_MOUSE Protein Wnt-2b OS=Mus musculus OX=10090 GN=Wnt2b PE=2 SV=3
OG0000013	Beroe_ovata_Bova1_4.0064.g51.t1 Bova1_4.0064.g51.t1, Beroe_ovata_Bova1_4.0064.g52.t1 Bova1_4.0064.g52.t1	Mus_musculus_sp_O35468_WNT9B_MOUSE sp_O35468_WNT9B_MOUSE Protein Wnt-9b OS=Mus musculus OX=10090 GN=Wnt9b PE=2 SV=2, Mus_musculus_sp_Q8R5M2_WNT9A_MOUSE sp_Q8R5M2_WNT9A_MOUSE Protein Wnt-9a OS=Mus musculus OX=10090 GN=Wnt9a PE=2 SV=1
OG0000015	Beroe_ovata_Bova1_4.0052.g5.t1 Bova1_4.0052.g5.t1, Beroe_ovata_Bova1_4.0628.g1.t1 Bova1_4.0628.g1.t1	Mus_musculus_sp_O08524_TECTB_MOUSE sp_O08524_TECTB_MOUSE Beta-tectorin OS=Mus musculus OX=10090 GN=Tectb PE=1 SV=2
OG0000017	Beroe_ovata_Bova1_4.0021.g29.t1 Bova1_4.0021.g29.t1, Beroe_ovata_Bova1_4.0101.g29.t1 Bova1_4.0101.g29.t1	Mus_musculus_sp_Q8R121_ZPI_MOUSE sp_Q8R121_ZPI_MOUSE Protein Z-dependent protease inhibitor OS=Mus musculus OX=10090 GN=Serpina10 PE=1 SV=1, Mus_musculus_sp_Q00898_A1AT5_MOUSE sp_Q00898_A1AT5_MOUSE Alpha-1-antitrypsin 1-5 OS=Mus musculus OX=10090 GN=Serpina1e PE=1 SV=1, Mus_musculus_sp_Q00897_A1AT4_MOUSE sp_Q00897_A1AT4_MOUSE Alpha-1-antitrypsin 1-4 OS=Mus musculus OX=10090 GN=Serpina1d PE=1 SV=1, Mus_musculus_sp_Q00896_A1AT3_MOUSE sp_Q00896_A1AT3_MOUSE Alpha-1-antitrypsin 1-3 OS=Mus musculus OX=10090 GN=Serpina1c PE=1 SV=2, Mus_musculus_sp_P07758_A1AT1_MOUSE sp_P07758_A1AT1_MOUSE Alpha-1-antitrypsin 1-1 OS=Mus musculus OX=10090 GN=Serpina1a PE=1 SV=4, Mus_musculus_sp_P22599_A1AT2_MOUSE sp_P22599_A1AT2_MOUSE Alpha-1-antitrypsin 1-2 OS=Mus musculus OX=10090 GN=Serpina1b PE=1 SV=2, Mus_musculus_sp_Q8CIE0_SPA11_MOUSE sp_Q8CIE0_SPA11_MOUSE Serpin A11 OS=Mus musculus OX=10090 GN=Serpina11 PE=2 SV=1, Mus_musculus_sp_Q9D7D2_SPA9_MOUSE sp_Q9D7D2_SPA9_MOUSE Serpin A9 OS=Mus musculus OX=10090 GN=Serpina9 PE=2 SV=1, Mus_musculus_sp_P61939_THBG_MOUSE sp_P61939_THBG_MOUSE Thyroxine-binding globulin OS=Mus musculus OX=10090 GN=Serpina7 PE=2 SV=1, Mus_musculus_sp_Q03734_SPA3M_MOUSE sp_Q03734_SPA3M_MOUSE Serine protease inhibitor A3M OS=Mus musculus OX=10090 GN=Serpina3m PE=1 SV=2, Mus_musculus_sp_P07759_SPA3K_MOUSE sp_P07759_SPA3K_MOUSE Serine protease inhibitor A3K OS=Mus musculus OX=10090 GN=Serpina3k PE=1 SV=2, Mus_musculus_sp_P29621_SPA3C_MOUSE sp_P29621_SPA3C_MOUSE Serine protease inhibitor A3C OS=Mus musculus OX=10090 GN=Serpina3c PE=2 SV=1, Mus_musculus_sp_Q91WP6_SPA3N_MOUSE sp_Q91WP6_SPA3N_MOUSE Serine protease inhibitor A3N OS=Mus musculus OX=10090 GN=Serpina3n PE=1 SV=1, Mus_musculus_sp_Q5I2A0_SPA3G_MOUSE sp_Q5I2A0_SPA3G_MOUSE Serine protease inhibitor A3G OS=Mus musculus OX=10090 GN=Serpina3g PE=1 SV=2, Mus_musculus_sp_Q80X76_SPA3F_MOUSE sp_Q80X76_SPA3F_MOUSE Serine protease inhibitor A3F OS=Mus musculus OX=10090 GN=Serpina3f PE=1 SV=3, Mus_musculus_sp_Q6P4P1_SPA3A_MOUSE sp_Q6P4P1_SPA3A_MOUSE Serine protease inhibitor A3A OS=Mus musculus OX=10090 GN=Serpina3a PE=1 SV=2, Mus_musculus_sp_Q8BYY9_SPA3B_MOUSE sp_Q8BYY9_SPA3B_MOUSE Serine protease inhibitor A3B OS=Mus musculus OX=10090 GN=Serpina3b PE=2 SV=1, Mus_musculus_sp_Q06770_CBG_MOUSE sp_Q06770_CBG_MOUSE Corticosteroid-binding globulin OS=Mus musculus OX=10090 GN=Serpina6 PE=1 SV=1, Mus_musculus_sp_P49182_HEP2_MOUSE sp_P49182_HEP2_MOUSE Heparin cofactor 2 OS=Mus musculus OX=10090 GN=Serpind1 PE=1 SV=1, Mus_musculus_sp_P97290_IC1_MOUSE sp_P97290_IC1_MOUSE Plasma protease C1 inhibitor OS=Mus musculus OX=10090 GN=Serping1 PE=1 SV=3, Mus_musculus_sp_Q61247_A2AP_MOUSE sp_Q61247_A2AP_MOUSE Alpha-2-antiplasmin OS=Mus musculus OX=10090 GN=Serpinf2 PE=1 SV=1
OG0000019	Beroe_ovata_Bova1_4.0050.g21.t1 Bova1_4.0050.g21.t1, Beroe_ovata_Bova1_4.0050.g20.t1 Bova1_4.0050.g20.t1	Mus_musculus_sp_Q9Z0J7_GDF15_MOUSE sp_Q9Z0J7_GDF15_MOUSE Growth_differentiation factor 15 OS=Mus musculus OX=10090 GN=Gdf15 PE=1 SV=2
OG0000019	Beroe_ovata_Bova1_4.0118.g26.t1 Bova1_4.0118.g26.t1	Mus_musculus_sp_O08689_GDF8_MOUSE sp_O08689_GDF8_MOUSE Growth_differentiation factor 8 OS=Mus musculus OX=10090 GN=Mstn PE=1 SV=1
OG0000019	Beroe_ovata_Bova1_4.0040.g35.t3 Bova1_4.0040.g35.t3, Beroe_ovata_Bova1_4.0040.g35.t2 Bova1_4.0040.g35.t2	Mus_musculus_sp_P34821_BMP8A_MOUSE sp_P34821_BMP8A_MOUSE Bone morphogenetic protein 8A OS=Mus musculus OX=10090 GN=Bmp8a PE=2 SV=1, Mus_musculus_sp_P49003_BMP5_MOUSE sp_P49003_BMP5_MOUSE Bone morphogenetic protein 5 OS=Mus musculus OX=10090 GN=Bmp5 PE=2 SV=1, Mus_musculus_sp_P49003_BMP5_MOUSE sp_P49003_BMP5_MOUSE Bone morphogenetic protein 5 OS=Mus musculus OX=10090 GN=Bmp5 PE=2 SV=1, Mus_musculus_sp_P20722_BMP6_MOUSE sp_P20722_BMP6_MOUSE Bone morphogenetic protein 6 OS=Mus musculus OX=10090 GN=Bmp6 PE=1 SV=2, Mus_musculus_sp_P23359_BMP7_MOUSE sp_P23359_BMP7_MOUSE Bone morphogenetic protein 7 OS=Mus musculus OX=10090 GN=Bmp7 PE=1 SV=2, Mus_musculus_sp_P21274_BMP2_MOUSE sp_P21274_BMP2_MOUSE Bone morphogenetic protein 2 OS=Mus musculus OX=10090 GN=Bmp2 PE=1 SV=3, Mus_musculus_sp_P43028_GDF6_MOUSE sp_P43028_GDF6_MOUSE Growth_differentiation factor 6 OS=Mus musculus OX=10090 GN=Gdf6 PE=2 SV=2, Mus_musculus_sp_P43027_GDF5_MOUSE sp_P43027_GDF5_MOUSE Growth_differentiation factor 5 OS=Mus musculus OX=10090 GN=Gdf5 PE=1 SV=2, Mus_musculus_sp_P43029_GDF7_MOUSE sp_P43029_GDF7_MOUSE Growth_differentiation factor 7 OS=Mus musculus OX=10090 GN=Gdf7 PE=2 SV=2, Mus_musculus_sp_Q8BHE5_BMP3_MOUSE sp_Q8BHE5_BMP3_MOUSE Bone morphogenetic protein 3 OS=Mus musculus OX=10090 GN=Bmp3 PE=1 SV=1, Mus_musculus_sp_P97737_GDF10_MOUSE sp_P97737_GDF10_MOUSE Growth_differentiation factor 10 OS=Mus musculus OX=10090 GN=Gdf10 PE=1 SV=2, Mus_musculus_sp_P20863_GDF1_MOUSE sp_P20863_GDF1_MOUSE Embryonic growth_differentiation factor 1 OS=Mus musculus OX=10090 GN=Gdf1 PE=2 SV=2, Mus_musculus_sp_Q07104_GDF3_MOUSE sp_Q07104_GDF3_MOUSE Growth_differentiation factor 3 OS=Mus musculus OX=10090 GN=Gdf3 PE=1 SV=2, Mus_musculus_sp_Q9Z0L4_BMP15_MOUSE sp_Q9Z0L4_BMP15_MOUSE Bone morphogenetic protein 15 OS=Mus musculus OX=10090 GN=Bmp15 PE=2 SV=1, Mus_musculus_sp_P43021_NODAL_MOUSE sp_P43021_NODAL_MOUSE Nodal OS=Mus musculus OX=10090 GN=Nodal PE=2 SV=2
OG0000021	Beroe_ovata_Bova1_4.0442.g1.t2 Bova1_4.0442.g1.t2, Beroe_ovata_Bova1_4.0442.g1.t1 Bova1_4.0442.g1.t1, Beroe_ovata_Bova1_4.0288.g8.t2 Bova1_4.0288.g8.t2, Beroe_ovata_Bova1_4.0288.g8.t3 Bova1_4.0288.g8.t3, Beroe_ovata_Bova1_4.0288.g8.t4 Bova1_4.0288.g8.t4, Beroe_ovata_Bova1_4.0288.g8.t1 Bova1_4.0288.g8.t1, Beroe_ovata_Bova1_4.0072.g25.t1 Bova1_4.0072.g25.t1, Beroe_ovata_Bova1_4.0018.g74.t1 Bova1_4.0018.g74.t1, Beroe_ovata_Bova1_4.0226.g12.t1 Bova1_4.0226.g12.t1	Mus_musculus_sp_P01132_EGF_MOUSE sp_P01132_EGF_MOUSE Pro-epidermal growth factor OS=Mus musculus OX=10090 GN=Egf PE=1 SV=2
OG0000022	Beroe_ovata_Bova1_4.0785.g1.t1 Bova1_4.0785.g1.t1, Beroe_ovata_Bova1_4.0354.g2.t1 Bova1_4.0354.g2.t1, Beroe_ovata_Bova1_4.0085.g13.t1 Bova1_4.0085.g13.t1	Mus_musculus_sp_P48036_ANXA5_MOUSE sp_P48036_ANXA5_MOUSE Annexin A5 OS=Mus musculus OX=10090 GN=Anxa5 PE=1 SV=1, Mus_musculus_sp_P14824_ANXA6_MOUSE sp_P14824_ANXA6_MOUSE Annexin A6 OS=Mus musculus OX=10090 GN=Anxa6 PE=1 SV=3, Mus_musculus_sp_O35640_ANXA8_MOUSE sp_O35640_ANXA8_MOUSE Annexin A8 OS=Mus musculus OX=10090 GN=Anxa8 PE=1 SV=2, Mus_musculus_sp_P07356_ANXA2_MOUSE sp_P07356_ANXA2_MOUSE Annexin A2 OS=Mus musculus OX=10090 GN=Anxa2 PE=1 SV=2, Mus_musculus_sp_Q9JHQ0_ANXA9_MOUSE sp_Q9JHQ0_ANXA9_MOUSE Annexin A9 OS=Mus musculus OX=10090 GN=Anxa9 PE=2 SV=2, Mus_musculus_sp_P10107_ANXA1_MOUSE sp_P10107_ANXA1_MOUSE Annexin A1 OS=Mus musculus OX=10090 GN=Anxa1 PE=1 SV=2, Mus_musculus_sp_P97429_ANXA4_MOUSE sp_P97429_ANXA4_MOUSE Annexin A4 OS=Mus musculus OX=10090 GN=Anxa4 PE=1 SV=4, Mus_musculus_sp_P97384_ANX11_MOUSE sp_P97384_ANX11_MOUSE Annexin A11 OS=Mus musculus OX=10090 GN=Anxa11 PE=1 SV=2, Mus_musculus_sp_O35639_ANXA3_MOUSE sp_O35639_ANXA3_MOUSE Annexin A3 OS=Mus musculus OX=10090 GN=Anxa3 PE=1 SV=4
OG0000022	Beroe_ovata_Bova1_4.0298.g2.t1 Bova1_4.0298.g2.t1, Beroe_ovata_Bova1_4.0337.g7.t1 Bova1_4.0337.g7.t1, Beroe_ovata_Bova1_4.0337.g7.t2 Bova1_4.0337.g7.t2	Mus_musculus_sp_Q07076_ANXA7_MOUSE sp_Q07076_ANXA7_MOUSE Annexin A7 OS=Mus musculus OX=10090 GN=Anxa7 PE=1 SV=2, Mus_musculus_sp_Q99JG3_ANX13_MOUSE sp_Q99JG3_ANX13_MOUSE Annexin A13 OS=Mus musculus OX=10090 GN=Anxa13 PE=1 SV=3
OG0000030	Beroe_ovata_Bova1_4.0151.g33.t1 Bova1_4.0151.g33.t1, Beroe_ovata_Bova1_4.0151.g32.t1 Bova1_4.0151.g32.t1, Beroe_ovata_Bova1_4.0256.g28.t2 Bova1_4.0256.g28.t2, Beroe_ovata_Bova1_4.0256.g28.t1 Bova1_4.0256.g28.t1	Mus_musculus_sp_Q9Z0F8_ADA17_MOUSE sp_Q9Z0F8_ADA17_MOUSE Disintegrin and metalloproteinase domain-containing protein 17 OS=Mus musculus OX=10090 GN=Adam17 PE=1 SV=3
OG0000030	Beroe_ovata_Bova1_4.0003.g115.t1 Bova1_4.0003.g115.t1, Beroe_ovata_Bova1_4.0003.g114.t1 Bova1_4.0003.g114.t1	Mus_musculus_sp_O35598_ADA10_MOUSE sp_O35598_ADA10_MOUSE Disintegrin and metalloproteinase domain-containing protein 10 OS=Mus musculus OX=10090 GN=Adam10 PE=1 SV=2
OG0000036	Beroe_ovata_Bova1_4.0040.g35.t1 Bova1_4.0040.g35.t1	Mus_musculus_sp_Q9QXT5_EGFL7_MOUSE sp_Q9QXT5_EGFL7_MOUSE Epidermal growth factor-like protein 7 OS=Mus musculus OX=10090 GN=Egfl7 PE=2 SV=2, Mus_musculus_sp_Q9JJZ5_EGFL6_MOUSE sp_Q9JJZ5_EGFL6_MOUSE Epidermal growth factor-like protein 6 OS=Mus musculus OX=10090 GN=Egfl6 PE=1 SV=1, Mus_musculus_sp_Q91V88_NPNT_MOUSE sp_Q91V88_NPNT_MOUSE Nephronectin OS=Mus musculus OX=10090 GN=Npnt PE=1 SV=1, Mus_musculus_sp_Q91V88_NPNT_MOUSE sp_Q91V88_NPNT_MOUSE Nephronectin OS=Mus musculus OX=10090 GN=Npnt PE=1 SV=1, Mus_musculus_sp_Q91V88_NPNT_MOUSE sp_Q91V88_NPNT_MOUSE Nephronectin OS=Mus musculus OX=10090 GN=Npnt PE=1 SV=1, Mus_musculus_sp_Q91V88_NPNT_MOUSE sp_Q91V88_NPNT_MOUSE Nephronectin OS=Mus musculus OX=10090 GN=Npnt PE=1 SV=1
OG0000041	Beroe_ovata_Bova1_4.0027.g44.t1 Bova1_4.0027.g44.t1	Mus_musculus_sp_Q99KC8_VMA5A_MOUSE sp_Q99KC8_VMA5A_MOUSE von Willebrand factor A domain-containing protein 5A OS=Mus musculus OX=10090 GN=Vwa5a PE=1 SV=2, Mus_musculus_sp_A9Z1V5_VW5B1_MOUSE sp_A9Z1V5_VW5B1_MOUSE von Willebrand factor A domain-containing protein 5B1 OS=Mus musculus OX=10090 GN=Vwa5b1 PE=2 SV=1
OG0000044	Beroe_ovata_Bova1_4.0038.g71.t1 Bova1_4.0038.g71.t1	Mus_musculus_sp_P21981_TGM2_MOUSE sp_P21981_TGM2_MOUSE Protein-glutamine gamma-glutamyltransferase 2 OS=Mus musculus OX=10090 GN=Tgm2 PE=1 SV=4, Mus_musculus_sp_Q08189_TGM3_MOUSE sp_Q08189_TGM3_MOUSE Protein-glutamine gamma-glutamyltransferase E OS=Mus musculus OX=10090 GN=Tgm3 PE=1 SV=2, Mus_musculus_sp_Q9D7I9_TGM5_MOUSE sp_Q9D7I9_TGM5_MOUSE Protein-glutamine gamma-glutamyltransferase 5 OS=Mus musculus OX=10090 GN=Tgm5 PE=2 SV=3, Mus_musculus_sp_Q8BZH1_TGM4_MOUSE sp_Q8BZH1_TGM4_MOUSE Protein-glutamine gamma-glutamyltransferase 4 OS=Mus musculus OX=10090 GN=Tgm4 PE=1 SV=2, Mus_musculus_sp_Q8BH61_F13A_MOUSE sp_Q8BH61_F13A_MOUSE Coagulation factor XIII A chain OS=Mus musculus OX=10090 GN=F13a1 PE=1 SV=3, Mus_musculus_sp_Q9JLF6_TGM1_MOUSE sp_Q9JLF6_TGM1_MOUSE Protein-glutamine gamma-glutamyltransferase K OS=Mus musculus OX=10090 GN=Tgm1 PE=1 SV=2
OG0000045	Beroe_ovata_Bova1_4.0013.g40.t1 Bova1_4.0013.g40.t1, Beroe_ovata_Bova1_4.0013.g39.t1 Bova1_4.0013.g39.t1	Mus_musculus_sp_Q61789_LAMA3_MOUSE sp_Q61789_LAMA3_MOUSE Laminin subunit alpha-3 OS=Mus musculus OX=10090 GN=Lama3 PE=1 SV=4, Mus_musculus_sp_Q61001_LAMA5_MOUSE sp_Q61001_LAMA5_MOUSE Laminin subunit alpha-5 OS=Mus musculus OX=10090 GN=Lama5 PE=1 SV=4, Mus_musculus_sp_P19137_LAMA1_MOUSE sp_P19137_LAMA1_MOUSE Laminin subunit alpha-1 OS=Mus musculus OX=10090 GN=Lama1 PE=1 SV=2, Mus_musculus_sp_Q60675_LAMA2_MOUSE sp_Q60675_LAMA2_MOUSE Laminin subunit alpha-2 OS=Mus musculus OX=10090 GN=Lama2 PE=1 SV=2
OG0000045	Beroe_ovata_Bova1_4.0938.g1.t1 Bova1_4.0938.g1.t1	Mus_musculus_sp_P97927_LAMA4_MOUSE sp_P97927_LAMA4_MOUSE Laminin subunit alpha-4 OS=Mus musculus OX=10090 GN=Lama4 PE=1 SV=2
OG0000049	Beroe_ovata_Bova1_4.0316.g2.t1 Bova1_4.0316.g2.t1, Beroe_ovata_Bova1_4.1059.g2.t1 Bova1_4.1059.g2.t1, Beroe_ovata_Bova1_4.0316.g1.t2 Bova1_4.0316.g1.t2, Beroe_ovata_Bova1_4.0316.g1.t1 Bova1_4.0316.g1.t1, Beroe_ovata_Bova1_4.0027.g58.t1 Bova1_4.0027.g58.t1, Beroe_ovata_Bova1_4.0027.g59.t1 Bova1_4.0027.g59.t1	Mus_musculus_sp_P70206_PLXA1_MOUSE sp_P70206_PLXA1_MOUSE Plexin-A1 OS=Mus musculus OX=10090 GN=Plxna1 PE=1 SV=1, Mus_musculus_sp_P70208_PLXA3_MOUSE sp_P70208_PLXA3_MOUSE Plexin-A3 OS=Mus musculus OX=10090 GN=Plxna3 PE=1 SV=2, Mus_musculus_sp_P70207_PLXA2_MOUSE sp_P70207_PLXA2_MOUSE Plexin-A2 OS=Mus musculus OX=10090 GN=Plxna2 PE=1 SV=2, Mus_musculus_sp_Q80UG2_PLXA4_MOUSE sp_Q80UG2_PLXA4_MOUSE Plexin-A4 OS=Mus musculus OX=10090 GN=Plxna4 PE=1 SV=3, Mus_musculus_sp_Q8CJH3_PLXB1_MOUSE sp_Q8CJH3_PLXB1_MOUSE Plexin-B1 OS=Mus musculus OX=10090 GN=Plxnb1 PE=1 SV=2, Mus_musculus_sp_Q9QY40_PLXB3_MOUSE sp_Q9QY40_PLXB3_MOUSE Plexin-B3 OS=Mus musculus OX=10090 GN=Plxnb3 PE=1 SV=2, Mus_musculus_sp_B2RXS4_PLXB2_MOUSE sp_B2RXS4_PLXB2_MOUSE Plexin-B2 OS=Mus musculus OX=10090 GN=Plxnb2 PE=1 SV=1, Mus_musculus_sp_Q3UH93_PLXD1_MOUSE sp_Q3UH93_PLXD1_MOUSE Plexin-D1 OS=Mus musculus OX=10090 GN=Plxnd1 PE=1 SV=1, Mus_musculus_sp_Q9QZC2_PLXC1_MOUSE sp_Q9QZC2_PLXC1_MOUSE Plexin-C1 OS=Mus musculus OX=10090 GN=Plxnc1 PE=1 SV=1
OG0000054	Beroe_ovata_Bova1_4.0046.g52.t1 Bova1_4.0046.g52.t1	Mus_musculus_sp_O54824_IL16_MOUSE sp_O54824_IL16_MOUSE Pro-interleukin-16 OS=Mus musculus OX=10090 GN=Il16 PE=1 SV=3
OG0000065	Beroe_ovata_Bova1_4.0102.g7.t1 Bova1_4.0102.g7.t1, Beroe_ovata_Bova1_4.0102.g8.t1 Bova1_4.0102.g8.t1	Mus_musculus_sp_Q8CFZ4_GPC3_MOUSE sp_Q8CFZ4_GPC3_MOUSE Glypican-3 OS=Mus musculus OX=10090 GN=Gpc3 PE=1 SV=1
OG0000078	Beroe_ovata_Bova1_4.0097.g25.t1 Bova1_4.0097.g25.t1, Beroe_ovata_Bova1_4.0199.g16.t1 Bova1_4.0199.g16.t1, Beroe_ovata_Bova1_4.0018.g111.t1 Bova1_4.0018.g111.t1, Beroe_ovata_Bova1_4.0122.g38.t1 Bova1_4.0122.g38.t1	Mus_musculus_sp_Q99JR5_TINAL_MOUSE sp_Q99JR5_TINAL_MOUSE Tubulointerstitial nephritis antigen-like OS=Mus musculus OX=10090 GN=Tinagl1 PE=1 SV=1, Mus_musculus_sp_P55097_CATK_MOUSE sp_P55097_CATK_MOUSE Cathepsin K OS=Mus musculus OX=10090 GN=Ctsk PE=1 SV=2
OG0000078	Beroe_ovata_Bova1_4.0116.g23.t1 Bova1_4.0116.g23.t1, Beroe_ovata_Bova1_4.0169.g19.t1 Bova1_4.0169.g19.t1	Mus_musculus_sp_P21460_CYTC_MOUSE sp_P21460_CYTC_MOUSE Cystatin-C OS=Mus musculus OX=10090 GN=Cst3 PE=1 SV=2, Mus_musculus_sp_Q80Y72_CSTL1_MOUSE sp_Q80Y72_CSTL1_MOUSE Cystatin-like 1 OS=Mus musculus OX=10090 GN=Cstl1 PE=2 SV=1, Mus_musculus_sp_Q80ZN5_CST13_MOUSE sp_Q80ZN5_CST13_MOUSE Cystatin-13 OS=Mus musculus OX=10090 GN=Cst13 PE=1 SV=1, Mus_musculus_sp_P32766_CST8_MOUSE sp_P32766_CST8_MOUSE Cystatin-8 OS=Mus musculus OX=10090 GN=Cst8 PE=1 SV=2
OG0000081	Beroe_ovata_Bova1_4.0012.g48.t3 Bova1_4.0012.g48.t3, Beroe_ovata_Bova1_4.0012.g48.t2 Bova1_4.0012.g48.t2, Beroe_ovata_Bova1_4.0012.g48.t1 Bova1_4.0012.g48.t1	Mus_musculus_sp_Q9CYA0_CREL2_MOUSE sp_Q9CYA0_CREL2_MOUSE Protein disulfide isomerase Creld2 OS=Mus musculus OX=10090 GN=Creld2 PE=1 SV=1, Mus_musculus_sp_Q91XD7_CREL1_MOUSE sp_Q91XD7_CREL1_MOUSE Protein disulfide isomerase Creld1 OS=Mus musculus OX=10090 GN=Creld1 PE=1 SV=1
OG0000093	Beroe_ovata_Bova1_4.0024.g37.t1 Bova1_4.0024.g37.t1, Beroe_ovata_Bova1_4.0024.g36.t1 Bova1_4.0024.g36.t1, Beroe_ovata_Bova1_4.0126.g23.t1 Bova1_4.0126.g23.t1, Beroe_ovata_Bova1_4.0024.g35.t1 Bova1_4.0024.g35.t1	Mus_musculus_sp_P35174_CYT2_MOUSE sp_P35174_CYT2_MOUSE Stefin-2 OS=Mus musculus OX=10090 GN=Stfa2 PE=3 SV=2, Mus_musculus_sp_P35173_CYT3_MOUSE sp_P35173_CYT3_MOUSE Stefin-3 OS=Mus musculus OX=10090 GN=Stfa3 PE=3 SV=1, Mus_musculus_sp_P35175_CYT1_MOUSE sp_P35175_CYT1_MOUSE Stefin-1 OS=Mus musculus OX=10090 GN=Stfa1 PE=3 SV=1, Mus_musculus_sp_Q62426_CYTB_MOUSE sp_Q62426_CYTB_MOUSE Cystatin-B OS=Mus musculus OX=10090 GN=Cstb PE=1 SV=1
OG0000114	Beroe_ovata_Bova1_4.0155.g12.t1 Bova1_4.0155.g12.t1, Beroe_ovata_Bova1_4.0155.g12.t2 Bova1_4.0155.g12.t2	Mus_musculus_sp_Q9D968_HCFC2_MOUSE sp_Q9D968_HCFC2_MOUSE Host cell factor 2 OS=Mus musculus OX=10090 GN=Hcfc2 PE=1 SV=2
OG0000141	Beroe_ovata_Bova1_4.0129.g39.t1 Bova1_4.0129.g39.t1	Mus_musculus_sp_Q9Z0G4_CCN5_MOUSE sp_Q9Z0G4_CCN5_MOUSE CCN family member 5 OS=Mus musculus OX=10090 GN=Ccn5 PE=2 SV=1, Mus_musculus_sp_O54775_CCN4_MOUSE sp_O54775_CCN4_MOUSE CCN family member 4 OS=Mus musculus OX=10090 GN=Ccn4 PE=2 SV=1, Mus_musculus_sp_P29268_CCN2_MOUSE sp_P29268_CCN2_MOUSE CCN family member 2 OS=Mus musculus OX=10090 GN=Ccn2 PE=1 SV=3, Mus_musculus_sp_P18406_CCN1_MOUSE sp_P18406_CCN1_MOUSE CCN family member 1 OS=Mus musculus OX=10090 GN=Ccn1 PE=1 SV=1
OG0000148	Beroe_ovata_Bova1_4.0104.g11.t1 Bova1_4.0104.g11.t1	Mus_musculus_sp_P17125_TGFB3_MOUSE sp_P17125_TGFB3_MOUSE Transforming growth factor beta-3 proprotein OS=Mus musculus OX=10090 GN=Tgfb3 PE=1 SV=1, Mus_musculus_sp_P27090_TGFB2_MOUSE sp_P27090_TGFB2_MOUSE Transforming growth factor beta-2 proprotein OS=Mus musculus OX=10090 GN=Tgfb2 PE=1 SV=2, Mus_musculus_sp_P04202_TGFB1_MOUSE sp_P04202_TGFB1_MOUSE Transforming growth factor beta-1 proprotein OS=Mus musculus OX=10090 GN=Tgfb1 PE=1 SV=1
OG0000156	Beroe_ovata_Bova1_4.0124.g23.t1 Bova1_4.0124.g23.t1	Mus_musculus_sp_C0HKD9_MFA1B_MOUSE sp_C0HKD9_MFA1B_MOUSE Microfibrillar-associated protein 1B OS=Mus musculus OX=10090 GN=Mfap1b PE=1 SV=1
OG0000171	Beroe_ovata_Bova1_4.0014.g57.t1 Bova1_4.0014.g57.t1	Mus_musculus_sp_Q9JI78_NGLY1_MOUSE sp_Q9JI78_NGLY1_MOUSE Peptide-N_4_-_N-acetyl-beta-glucosaminyl_asparagine amidase OS=Mus musculus OX=10090 GN=Ngly1 PE=1 SV=2
OG0000181	Beroe_ovata_Bova1_4.0127.g30.t1 Bova1_4.0127.g30.t1	Mus_musculus_sp_Q2TJ95_RSPO3_MOUSE sp_Q2TJ95_RSPO3_MOUSE R-spondin-3 OS=Mus musculus OX=10090 GN=Rspo3 PE=1 SV=2
OG0000182	Beroe_ovata_Bova1_4.0038.g27.t1 Bova1_4.0038.g27.t1	Mus_musculus_sp_Q3UVV9_VWA3A_MOUSE sp_Q3UVV9_VWA3A_MOUSE von Willebrand factor A domain-containing protein 3A OS=Mus musculus OX=10090 GN=Vwa3a PE=2 SV=1
