Orthogroup	Chordata_Vertebrata_Mus_musculus	Nematoda_Chromadorea_Caenorhabditis_elegans
OG0000083	Mus_musculus_sp_Q812F3_HYAL5_MOUSE sp_Q812F3_HYAL5_MOUSE Hyaluronidase-5 OS=Mus musculus OX=10090 GN=Hyal5 PE=1 SV=1, Mus_musculus_sp_Q05A56_HYAL4_MOUSE sp_Q05A56_HYAL4_MOUSE Hyaluronidase-4 OS=Mus musculus OX=10090 GN=Hyal4 PE=2 SV=1, Mus_musculus_sp_O35632_HYAL2_MOUSE sp_O35632_HYAL2_MOUSE Hyaluronidase-2 OS=Mus musculus OX=10090 GN=Hyal2 PE=1 SV=2	Caenorhabditis_elegans_T22C8.2 T22C8.2
OG0000084	Mus_musculus_sp_O35206_COFA1_MOUSE sp_O35206_COFA1_MOUSE Collagen alpha-1_XV_ chain OS=Mus musculus OX=10090 GN=Col15a1 PE=1 SV=2, Mus_musculus_sp_P39061_COIA1_MOUSE sp_P39061_COIA1_MOUSE Collagen alpha-1_XVIII_ chain OS=Mus musculus OX=10090 GN=Col18a1 PE=1 SV=4, Mus_musculus_sp_P39061_COIA1_MOUSE sp_P39061_COIA1_MOUSE Collagen alpha-1_XVIII_ chain OS=Mus musculus OX=10090 GN=Col18a1 PE=1 SV=4	Caenorhabditis_elegans_C36B1.1d C36B1.1d
OG0000088	Mus_musculus_sp_Q8VCC9_SPON1_MOUSE sp_Q8VCC9_SPON1_MOUSE Spondin-1 OS=Mus musculus OX=10090 GN=Spon1 PE=1 SV=1	Caenorhabditis_elegans_F10E7.4 F10E7.4
OG0000102	Mus_musculus_sp_Q9WVH9_FBLN5_MOUSE sp_Q9WVH9_FBLN5_MOUSE Fibulin-5 OS=Mus musculus OX=10090 GN=Fbln5 PE=1 SV=1, Mus_musculus_sp_Q9WVJ9_FBLN4_MOUSE sp_Q9WVJ9_FBLN4_MOUSE EGF-containing fibulin-like extracellular matrix protein 2 OS=Mus musculus OX=10090 GN=Efemp2 PE=1 SV=1, Mus_musculus_sp_Q8BPB5_FBLN3_MOUSE sp_Q8BPB5_FBLN3_MOUSE EGF-containing fibulin-like extracellular matrix protein 1 OS=Mus musculus OX=10090 GN=Efemp1 PE=1 SV=1	Caenorhabditis_elegans_ZK783.1e ZK783.1e
OG0000114	Mus_musculus_sp_Q9D968_HCFC2_MOUSE sp_Q9D968_HCFC2_MOUSE Host cell factor 2 OS=Mus musculus OX=10090 GN=Hcfc2 PE=1 SV=2	Caenorhabditis_elegans_C46A5.9 C46A5.9
OG0000120	Mus_musculus_sp_O35988_SDC4_MOUSE sp_O35988_SDC4_MOUSE Syndecan-4 OS=Mus musculus OX=10090 GN=Sdc4 PE=1 SV=1, Mus_musculus_sp_P43407_SDC2_MOUSE sp_P43407_SDC2_MOUSE Syndecan-2 OS=Mus musculus OX=10090 GN=Sdc2 PE=1 SV=1, Mus_musculus_sp_P18828_SDC1_MOUSE sp_P18828_SDC1_MOUSE Syndecan-1 OS=Mus musculus OX=10090 GN=Sdc1 PE=1 SV=1, Mus_musculus_sp_Q64519_SDC3_MOUSE sp_Q64519_SDC3_MOUSE Syndecan-3 OS=Mus musculus OX=10090 GN=Sdc3 PE=1 SV=2	Caenorhabditis_elegans_F57C7.3b F57C7.3b
OG0000156	Mus_musculus_sp_C0HKD9_MFA1B_MOUSE sp_C0HKD9_MFA1B_MOUSE Microfibrillar-associated protein 1B OS=Mus musculus OX=10090 GN=Mfap1b PE=1 SV=1	Caenorhabditis_elegans_F43G9.10 F43G9.10
OG0000269	Mus_musculus_sp_Q8BMF8_GLDN_MOUSE sp_Q8BMF8_GLDN_MOUSE Gliomedin OS=Mus musculus OX=10090 GN=Gldn PE=1 SV=1	Caenorhabditis_elegans_F11C3.2 F11C3.2, Caenorhabditis_elegans_C48E7.5 C48E7.5
OG0000351	Mus_musculus_sp_O08677_KNG1_MOUSE sp_O08677_KNG1_MOUSE Kininogen-1 OS=Mus musculus OX=10090 GN=Kng1 PE=1 SV=1, Mus_musculus_sp_O08677_KNG1_MOUSE sp_O08677_KNG1_MOUSE Kininogen-1 OS=Mus musculus OX=10090 GN=Kng1 PE=1 SV=1, Mus_musculus_sp_O08677_KNG1_MOUSE sp_O08677_KNG1_MOUSE Kininogen-1 OS=Mus musculus OX=10090 GN=Kng1 PE=1 SV=1	Caenorhabditis_elegans_K08B4.6 K08B4.6, Caenorhabditis_elegans_R01B10.1a R01B10.1a
OG0000353	Mus_musculus_sp_Q8K4G2_CONA1_MOUSE sp_Q8K4G2_CONA1_MOUSE Collagen alpha-1_XXIII_ chain OS=Mus musculus OX=10090 GN=Col23a1 PE=2 SV=2	Caenorhabditis_elegans_F29C4.8e F29C4.8e
