Orthogroup	Chordata_Vertebrata_Mus_musculus	Nematoda_Chromadorea_Caenorhabditis_elegans
OG0000000	Mus_musculus_sp_Q80YX1_TENA_MOUSE sp_Q80YX1_TENA_MOUSE Tenascin OS=Mus musculus OX=10090 GN=Tnc PE=1 SV=1, Mus_musculus_sp_Q80YX1_TENA_MOUSE sp_Q80YX1_TENA_MOUSE Tenascin OS=Mus musculus OX=10090 GN=Tnc PE=1 SV=1, Mus_musculus_sp_Q80YX1_TENA_MOUSE sp_Q80YX1_TENA_MOUSE Tenascin OS=Mus musculus OX=10090 GN=Tnc PE=1 SV=1, Mus_musculus_sp_Q8BYI9_TENR_MOUSE sp_Q8BYI9_TENR_MOUSE Tenascin-R OS=Mus musculus OX=10090 GN=Tnr PE=1 SV=2, Mus_musculus_sp_Q8BYI9_TENR_MOUSE sp_Q8BYI9_TENR_MOUSE Tenascin-R OS=Mus musculus OX=10090 GN=Tnr PE=1 SV=2, Mus_musculus_sp_Q80Z71_TENN_MOUSE sp_Q80Z71_TENN_MOUSE Tenascin-N OS=Mus musculus OX=10090 GN=Tnn PE=1 SV=2	Caenorhabditis_elegans_T15B7.1 T15B7.1, Caenorhabditis_elegans_C49C8.5 C49C8.5, Caenorhabditis_elegans_Y43C5A.2 Y43C5A.2, Caenorhabditis_elegans_T01D3.6b T01D3.6b
OG0000000	Mus_musculus_sp_Q9D1H9_MFAP4_MOUSE sp_Q9D1H9_MFAP4_MOUSE Microfibril-associated glycoprotein 4 OS=Mus musculus OX=10090 GN=Mfap4 PE=1 SV=1, Mus_musculus_sp_E9PV24_FIBA_MOUSE sp_E9PV24_FIBA_MOUSE Fibrinogen alpha chain OS=Mus musculus OX=10090 GN=Fga PE=1 SV=1, Mus_musculus_sp_E9PV24_FIBA_MOUSE sp_E9PV24_FIBA_MOUSE Fibrinogen alpha chain OS=Mus musculus OX=10090 GN=Fga PE=1 SV=1, Mus_musculus_sp_Q8K0E8_FIBB_MOUSE sp_Q8K0E8_FIBB_MOUSE Fibrinogen beta chain OS=Mus musculus OX=10090 GN=Fgb PE=1 SV=1, Mus_musculus_sp_Q8VCM7_FIBG_MOUSE sp_Q8VCM7_FIBG_MOUSE Fibrinogen gamma chain OS=Mus musculus OX=10090 GN=Fgg PE=1 SV=1, Mus_musculus_sp_Q71KU9_FGL1_MOUSE sp_Q71KU9_FGL1_MOUSE Fibrinogen-like protein 1 OS=Mus musculus OX=10090 GN=Fgl1 PE=1 SV=2, Mus_musculus_sp_Q9R045_ANGL2_MOUSE sp_Q9R045_ANGL2_MOUSE Angiopoietin-related protein 2 OS=Mus musculus OX=10090 GN=Angptl2 PE=2 SV=2, Mus_musculus_sp_Q640P2_ANGL1_MOUSE sp_Q640P2_ANGL1_MOUSE Angiopoietin-related protein 1 OS=Mus musculus OX=10090 GN=Angptl1 PE=2 SV=1, Mus_musculus_sp_Q8R0Z6_ANGL6_MOUSE sp_Q8R0Z6_ANGL6_MOUSE Angiopoietin-related protein 6 OS=Mus musculus OX=10090 GN=Angptl6 PE=2 SV=1, Mus_musculus_sp_Q8R1Q3_ANGL7_MOUSE sp_Q8R1Q3_ANGL7_MOUSE Angiopoietin-related protein 7 OS=Mus musculus OX=10090 GN=Angptl7 PE=2 SV=1, Mus_musculus_sp_Q9WVH6_ANGP4_MOUSE sp_Q9WVH6_ANGP4_MOUSE Angiopoietin-4 OS=Mus musculus OX=10090 GN=Angpt4 PE=1 SV=1, Mus_musculus_sp_O35608_ANGP2_MOUSE sp_O35608_ANGP2_MOUSE Angiopoietin-2 OS=Mus musculus OX=10090 GN=Angpt2 PE=2 SV=2, Mus_musculus_sp_O08538_ANGP1_MOUSE sp_O08538_ANGP1_MOUSE Angiopoietin-1 OS=Mus musculus OX=10090 GN=Angpt1 PE=1 SV=2, Mus_musculus_sp_Q9Z1P8_ANGL4_MOUSE sp_Q9Z1P8_ANGL4_MOUSE Angiopoietin-related protein 4 OS=Mus musculus OX=10090 GN=Angptl4 PE=1 SV=1, Mus_musculus_sp_Q9R182_ANGL3_MOUSE sp_Q9R182_ANGL3_MOUSE Angiopoietin-related protein 3 OS=Mus musculus OX=10090 GN=Angptl3 PE=1 SV=1, Mus_musculus_sp_P12804_FGL2_MOUSE sp_P12804_FGL2_MOUSE Fibroleukin OS=Mus musculus OX=10090 GN=Fgl2 PE=1 SV=1	Caenorhabditis_elegans_D1009.3b D1009.3b
OG0000001	Mus_musculus_sp_Q9R1A3_NET3_MOUSE sp_Q9R1A3_NET3_MOUSE Netrin-3 OS=Mus musculus OX=10090 GN=Ntn3 PE=2 SV=1, Mus_musculus_sp_O09118_NET1_MOUSE sp_O09118_NET1_MOUSE Netrin-1 OS=Mus musculus OX=10090 GN=Ntn1 PE=1 SV=3	Caenorhabditis_elegans_F41C6.1 F41C6.1
OG0000001	Mus_musculus_sp_Q9R0B6_LAMC3_MOUSE sp_Q9R0B6_LAMC3_MOUSE Laminin subunit gamma-3 OS=Mus musculus OX=10090 GN=Lamc3 PE=1 SV=2, Mus_musculus_sp_P02468_LAMC1_MOUSE sp_P02468_LAMC1_MOUSE Laminin subunit gamma-1 OS=Mus musculus OX=10090 GN=Lamc1 PE=1 SV=2	Caenorhabditis_elegans_C54D1.5 C54D1.5
OG0000002	Mus_musculus_sp_Q76KF0_SEM6D_MOUSE sp_Q76KF0_SEM6D_MOUSE Semaphorin-6D OS=Mus musculus OX=10090 GN=Sema6d PE=1 SV=1, Mus_musculus_sp_Q76KF0_SEM6D_MOUSE sp_Q76KF0_SEM6D_MOUSE Semaphorin-6D OS=Mus musculus OX=10090 GN=Sema6d PE=1 SV=1, Mus_musculus_sp_O35464_SEM6A_MOUSE sp_O35464_SEM6A_MOUSE Semaphorin-6A OS=Mus musculus OX=10090 GN=Sema6a PE=1 SV=2, Mus_musculus_sp_O54951_SEM6B_MOUSE sp_O54951_SEM6B_MOUSE Semaphorin-6B OS=Mus musculus OX=10090 GN=Sema6b PE=1 SV=1, Mus_musculus_sp_Q9WTM3_SEM6C_MOUSE sp_Q9WTM3_SEM6C_MOUSE Semaphorin-6C OS=Mus musculus OX=10090 GN=Sema6c PE=2 SV=1	Caenorhabditis_elegans_Y54E5B.1c Y54E5B.1c
OG0000003	Mus_musculus_sp_Q61361_PGCB_MOUSE sp_Q61361_PGCB_MOUSE Brevican core protein OS=Mus musculus OX=10090 GN=Bcan PE=1 SV=2, Mus_musculus_sp_P55066_NCAN_MOUSE sp_P55066_NCAN_MOUSE Neurocan core protein OS=Mus musculus OX=10090 GN=Ncan PE=1 SV=1, Mus_musculus_sp_Q61282_PGCA_MOUSE sp_Q61282_PGCA_MOUSE Aggrecan core protein OS=Mus musculus OX=10090 GN=Acan PE=1 SV=2, Mus_musculus_sp_Q62059_CSPG2_MOUSE sp_Q62059_CSPG2_MOUSE Versican core protein OS=Mus musculus OX=10090 GN=Vcan PE=1 SV=2, Mus_musculus_sp_Q62059_CSPG2_MOUSE sp_Q62059_CSPG2_MOUSE Versican core protein OS=Mus musculus OX=10090 GN=Vcan PE=1 SV=2	Caenorhabditis_elegans_T19E7.1 T19E7.1
OG0000003	Mus_musculus_sp_Q3SXB8_COL11_MOUSE sp_Q3SXB8_COL11_MOUSE Collectin-11 OS=Mus musculus OX=10090 GN=Colec11 PE=2 SV=2, Mus_musculus_sp_P35242_SFTPA_MOUSE sp_P35242_SFTPA_MOUSE Pulmonary surfactant-associated protein A OS=Mus musculus OX=10090 GN=Sftpa1 PE=1 SV=1, Mus_musculus_sp_P50404_SFTPD_MOUSE sp_P50404_SFTPD_MOUSE Pulmonary surfactant-associated protein D OS=Mus musculus OX=10090 GN=Sftpd PE=1 SV=1, Mus_musculus_sp_P41317_MBL2_MOUSE sp_P41317_MBL2_MOUSE Mannose-binding protein C OS=Mus musculus OX=10090 GN=Mbl2 PE=1 SV=2, Mus_musculus_sp_P39039_MBL1_MOUSE sp_P39039_MBL1_MOUSE Mannose-binding protein A OS=Mus musculus OX=10090 GN=Mbl1 PE=1 SV=1	Caenorhabditis_elegans_K02F3.5 K02F3.5
OG0000003	Mus_musculus_sp_P43025_TETN_MOUSE sp_P43025_TETN_MOUSE Tetranectin OS=Mus musculus OX=10090 GN=Clec3b PE=1 SV=2, Mus_musculus_sp_Q9EPW4_CLC3A_MOUSE sp_Q9EPW4_CLC3A_MOUSE C-type lectin domain family 3 member A OS=Mus musculus OX=10090 GN=Clec3a PE=3 SV=1	Caenorhabditis_elegans_C54D1.2 C54D1.2, Caenorhabditis_elegans_Y38H6C.8 Y38H6C.8, Caenorhabditis_elegans_R06B10.3 R06B10.3
OG0000003	Mus_musculus_sp_Q8K4Q8_COL12_MOUSE sp_Q8K4Q8_COL12_MOUSE Collectin-12 OS=Mus musculus OX=10090 GN=Colec12 PE=1 SV=1, Mus_musculus_sp_P49300_CLC10_MOUSE sp_P49300_CLC10_MOUSE C-type lectin domain family 10 member A OS=Mus musculus OX=10090 GN=Clec10a PE=1 SV=1, Mus_musculus_sp_P70194_CLC4F_MOUSE sp_P70194_CLC4F_MOUSE C-type lectin domain family 4 member F OS=Mus musculus OX=10090 GN=Clec4f PE=1 SV=1, Mus_musculus_sp_Q91ZW8_C209D_MOUSE sp_Q91ZW8_C209D_MOUSE CD209 antigen-like protein D OS=Mus musculus OX=10090 GN=Cd209d PE=2 SV=1, Mus_musculus_sp_Q8CJ91_C209B_MOUSE sp_Q8CJ91_C209B_MOUSE CD209 antigen-like protein B OS=Mus musculus OX=10090 GN=Cd209b PE=1 SV=2	Caenorhabditis_elegans_F25B4.9 F25B4.9
OG0000003	Mus_musculus_sp_Q9D8G5_REG4_MOUSE sp_Q9D8G5_REG4_MOUSE Regenerating islet-derived protein 4 OS=Mus musculus OX=10090 GN=Reg4 PE=2 SV=1, Mus_musculus_sp_O09049_REG3G_MOUSE sp_O09049_REG3G_MOUSE Regenerating islet-derived protein 3-gamma OS=Mus musculus OX=10090 GN=Reg3g PE=1 SV=1, Mus_musculus_sp_P43137_LIT1_MOUSE sp_P43137_LIT1_MOUSE Lithostathine-1 OS=Mus musculus OX=10090 GN=Reg1 PE=1 SV=1, Mus_musculus_sp_Q08731_LIT2_MOUSE sp_Q08731_LIT2_MOUSE Lithostathine-2 OS=Mus musculus OX=10090 GN=Reg2 PE=1 SV=1	Caenorhabditis_elegans_R07C3.1 R07C3.1
OG0000003	Mus_musculus_sp_Q80XD9_CLC2E_MOUSE sp_Q80XD9_CLC2E_MOUSE C-type lectin domain family 2 member E OS=Mus musculus OX=10090 GN=Clec2e PE=2 SV=2, Mus_musculus_sp_Q91V08_CLC2D_MOUSE sp_Q91V08_CLC2D_MOUSE C-type lectin domain family 2 member D OS=Mus musculus OX=10090 GN=Clec2d PE=1 SV=1, Mus_musculus_sp_Q6QLQ4_CLC7A_MOUSE sp_Q6QLQ4_CLC7A_MOUSE C-type lectin domain family 7 member A OS=Mus musculus OX=10090 GN=Clec7a PE=1 SV=3	Caenorhabditis_elegans_ZK863.9 ZK863.9
OG0000004	Mus_musculus_sp_O35701_MATN3_MOUSE sp_O35701_MATN3_MOUSE Matrilin-3 OS=Mus musculus OX=10090 GN=Matn3 PE=1 SV=2, Mus_musculus_sp_O08746_MATN2_MOUSE sp_O08746_MATN2_MOUSE Matrilin-2 OS=Mus musculus OX=10090 GN=Matn2 PE=2 SV=2, Mus_musculus_sp_P51942_MATN1_MOUSE sp_P51942_MATN1_MOUSE Cartilage matrix protein OS=Mus musculus OX=10090 GN=Matn1 PE=2 SV=2, Mus_musculus_sp_O89029_MATN4_MOUSE sp_O89029_MATN4_MOUSE Matrilin-4 OS=Mus musculus OX=10090 GN=Matn4 PE=1 SV=1	Caenorhabditis_elegans_K07D8.1 K07D8.1, Caenorhabditis_elegans_K08E5.3b K08E5.3b
OG0000005	Mus_musculus_sp_Q6HA09_ASTL_MOUSE sp_Q6HA09_ASTL_MOUSE Astacin-like metalloendopeptidase OS=Mus musculus OX=10090 GN=Astl PE=1 SV=3	Caenorhabditis_elegans_F45G2.1 F45G2.1, Caenorhabditis_elegans_C07D10.4 C07D10.4, Caenorhabditis_elegans_C34D4.9 C34D4.9, Caenorhabditis_elegans_T23H4.3 T23H4.3, Caenorhabditis_elegans_C24F3.3 C24F3.3
OG0000006	Mus_musculus_sp_Q60736_ZP3R_MOUSE sp_Q60736_ZP3R_MOUSE Zona pellucida sperm-binding protein 3 receptor OS=Mus musculus OX=10090 GN=Zp3r PE=1 SV=1	Caenorhabditis_elegans_T07H6.5c T07H6.5c
OG0000009	Mus_musculus_sp_P98063_BMP1_MOUSE sp_P98063_BMP1_MOUSE Bone morphogenetic protein 1 OS=Mus musculus OX=10090 GN=Bmp1 PE=1 SV=2, Mus_musculus_sp_Q9WVM6_TLL2_MOUSE sp_Q9WVM6_TLL2_MOUSE Tolloid-like protein 2 OS=Mus musculus OX=10090 GN=Tll2 PE=1 SV=1, Mus_musculus_sp_Q62381_TLL1_MOUSE sp_Q62381_TLL1_MOUSE Tolloid-like protein 1 OS=Mus musculus OX=10090 GN=Tll1 PE=1 SV=1	Caenorhabditis_elegans_F38E9.2 F38E9.2
OG0000010	Mus_musculus_sp_A2AJ76_HMCN2_MOUSE sp_A2AJ76_HMCN2_MOUSE Hemicentin-2 OS=Mus musculus OX=10090 GN=Hmcn2 PE=1 SV=1	Caenorhabditis_elegans_F15G9.4e F15G9.4e
OG0000010	Mus_musculus_sp_Q4VBE4_EGFLA_MOUSE sp_Q4VBE4_EGFLA_MOUSE Pikachurin OS=Mus musculus OX=10090 GN=Egflam PE=1 SV=1, Mus_musculus_sp_Q4VBE4_EGFLA_MOUSE sp_Q4VBE4_EGFLA_MOUSE Pikachurin OS=Mus musculus OX=10090 GN=Egflam PE=1 SV=1	Caenorhabditis_elegans_T19D12.6 T19D12.6
OG0000010	Mus_musculus_sp_A2ASQ1_AGRIN_MOUSE sp_A2ASQ1_AGRIN_MOUSE Agrin OS=Mus musculus OX=10090 GN=Agrn PE=1 SV=1, Mus_musculus_sp_A2ASQ1_AGRIN_MOUSE sp_A2ASQ1_AGRIN_MOUSE Agrin OS=Mus musculus OX=10090 GN=Agrn PE=1 SV=1	Caenorhabditis_elegans_F41G3.12 F41G3.12
OG0000013	Mus_musculus_sp_Q9QYS1_WNT16_MOUSE sp_Q9QYS1_WNT16_MOUSE Protein Wnt-16 OS=Mus musculus OX=10090 GN=Wnt16 PE=2 SV=2	Caenorhabditis_elegans_W08D2.1 W08D2.1
OG0000013	Mus_musculus_sp_P22724_WNT4_MOUSE sp_P22724_WNT4_MOUSE Protein Wnt-4 OS=Mus musculus OX=10090 GN=Wnt4 PE=1 SV=1	Caenorhabditis_elegans_K10B4.6a K10B4.6a
OG0000013	Mus_musculus_sp_P22726_WNT5B_MOUSE sp_P22726_WNT5B_MOUSE Protein Wnt-5b OS=Mus musculus OX=10090 GN=Wnt5b PE=1 SV=2, Mus_musculus_sp_P22725_WNT5A_MOUSE sp_P22725_WNT5A_MOUSE Protein Wnt-5a OS=Mus musculus OX=10090 GN=Wnt5a PE=1 SV=2	Caenorhabditis_elegans_W01B6.1 W01B6.1
OG0000013	Mus_musculus_sp_P48614_WN10B_MOUSE sp_P48614_WN10B_MOUSE Protein Wnt-10b OS=Mus musculus OX=10090 GN=Wnt10b PE=2 SV=1, Mus_musculus_sp_P70701_WN10A_MOUSE sp_P70701_WN10A_MOUSE Protein Wnt-10a OS=Mus musculus OX=10090 GN=Wnt10a PE=2 SV=1	Caenorhabditis_elegans_E01A2.3 E01A2.3
OG0000013	Mus_musculus_sp_O35468_WNT9B_MOUSE sp_O35468_WNT9B_MOUSE Protein Wnt-9b OS=Mus musculus OX=10090 GN=Wnt9b PE=2 SV=2, Mus_musculus_sp_Q8R5M2_WNT9A_MOUSE sp_Q8R5M2_WNT9A_MOUSE Protein Wnt-9a OS=Mus musculus OX=10090 GN=Wnt9a PE=2 SV=1	Caenorhabditis_elegans_F38E1.7 F38E1.7
OG0000014	Mus_musculus_sp_Q8BLI0_ATL1_MOUSE sp_Q8BLI0_ATL1_MOUSE ADAMTS-like protein 1 OS=Mus musculus OX=10090 GN=Adamtsl1 PE=2 SV=2	Caenorhabditis_elegans_F53B6.2c F53B6.2c
OG0000014	Mus_musculus_sp_Q9EPX2_PPN_MOUSE sp_Q9EPX2_PPN_MOUSE Papilin OS=Mus musculus OX=10090 GN=Papln PE=2 SV=2	Caenorhabditis_elegans_C37C3.6c C37C3.6c
OG0000016	Mus_musculus_sp_P34960_MMP12_MOUSE sp_P34960_MMP12_MOUSE Macrophage metalloelastase OS=Mus musculus OX=10090 GN=Mmp12 PE=1 SV=3, Mus_musculus_sp_P28862_MMP3_MOUSE sp_P28862_MMP3_MOUSE Stromelysin-1 OS=Mus musculus OX=10090 GN=Mmp3 PE=2 SV=2, Mus_musculus_sp_O55123_MMP10_MOUSE sp_O55123_MMP10_MOUSE Stromelysin-2 OS=Mus musculus OX=10090 GN=Mmp10 PE=2 SV=1, Mus_musculus_sp_O70138_MMP8_MOUSE sp_O70138_MMP8_MOUSE Neutrophil collagenase OS=Mus musculus OX=10090 GN=Mmp8 PE=2 SV=2, Mus_musculus_sp_Q9EPL6_MMP1B_MOUSE sp_Q9EPL6_MMP1B_MOUSE Interstitial collagenase B OS=Mus musculus OX=10090 GN=Mmp1b PE=2 SV=1, Mus_musculus_sp_Q10738_MMP7_MOUSE sp_Q10738_MMP7_MOUSE Matrilysin OS=Mus musculus OX=10090 GN=Mmp7 PE=2 SV=1, Mus_musculus_sp_Q02853_MMP11_MOUSE sp_Q02853_MMP11_MOUSE Stromelysin-3 OS=Mus musculus OX=10090 GN=Mmp11 PE=1 SV=2, Mus_musculus_sp_P53690_MMP14_MOUSE sp_P53690_MMP14_MOUSE Matrix metalloproteinase-14 OS=Mus musculus OX=10090 GN=Mmp14 PE=2 SV=3, Mus_musculus_sp_Q9R0S2_MMP24_MOUSE sp_Q9R0S2_MMP24_MOUSE Matrix metalloproteinase-24 OS=Mus musculus OX=10090 GN=Mmp24 PE=1 SV=2, Mus_musculus_sp_Q9WTR0_MMP16_MOUSE sp_Q9WTR0_MMP16_MOUSE Matrix metalloproteinase-16 OS=Mus musculus OX=10090 GN=Mmp16 PE=2 SV=3, Mus_musculus_sp_O54732_MMP15_MOUSE sp_O54732_MMP15_MOUSE Matrix metalloproteinase-15 OS=Mus musculus OX=10090 GN=Mmp15 PE=2 SV=1, Mus_musculus_sp_Q3U435_MMP25_MOUSE sp_Q3U435_MMP25_MOUSE Matrix metalloproteinase-25 OS=Mus musculus OX=10090 GN=Mmp25 PE=2 SV=1, Mus_musculus_sp_Q9R0S3_MMP17_MOUSE sp_Q9R0S3_MMP17_MOUSE Matrix metalloproteinase-17 OS=Mus musculus OX=10090 GN=Mmp17 PE=1 SV=3, Mus_musculus_sp_Q9JHI0_MMP19_MOUSE sp_Q9JHI0_MMP19_MOUSE Matrix metalloproteinase-19 OS=Mus musculus OX=10090 GN=Mmp19 PE=2 SV=1	Caenorhabditis_elegans_H36L18.1 H36L18.1
OG0000017	Mus_musculus_sp_O35684_NEUS_MOUSE sp_O35684_NEUS_MOUSE Neuroserpin OS=Mus musculus OX=10090 GN=Serpini1 PE=1 SV=1, Mus_musculus_sp_Q9JK88_SPI2_MOUSE sp_Q9JK88_SPI2_MOUSE Serpin I2 OS=Mus musculus OX=10090 GN=Serpini2 PE=1 SV=1, Mus_musculus_sp_P22777_PAI1_MOUSE sp_P22777_PAI1_MOUSE Plasminogen activator inhibitor 1 OS=Mus musculus OX=10090 GN=Serpine1 PE=1 SV=1, Mus_musculus_sp_Q07235_GDN_MOUSE sp_Q07235_GDN_MOUSE Glia-derived nexin OS=Mus musculus OX=10090 GN=Serpine2 PE=1 SV=2, Mus_musculus_sp_P32261_ANT3_MOUSE sp_P32261_ANT3_MOUSE Antithrombin-III OS=Mus musculus OX=10090 GN=Serpinc1 PE=1 SV=1, Mus_musculus_sp_Q5SV42_ILEUC_MOUSE sp_Q5SV42_ILEUC_MOUSE Leukocyte elastase inhibitor C OS=Mus musculus OX=10090 GN=Serpinb1c PE=1 SV=1, Mus_musculus_sp_Q8VHP7_ILEUB_MOUSE sp_Q8VHP7_ILEUB_MOUSE Leukocyte elastase inhibitor B OS=Mus musculus OX=10090 GN=Serpinb1b PE=1 SV=1, Mus_musculus_sp_Q9D154_ILEUA_MOUSE sp_Q9D154_ILEUA_MOUSE Leukocyte elastase inhibitor A OS=Mus musculus OX=10090 GN=Serpinb1a PE=1 SV=1, Mus_musculus_sp_O08800_SPB8_MOUSE sp_O08800_SPB8_MOUSE Serpin B8 OS=Mus musculus OX=10090 GN=Serpinb8 PE=1 SV=2, Mus_musculus_sp_P70124_SPB5_MOUSE sp_P70124_SPB5_MOUSE Serpin B5 OS=Mus musculus OX=10090 GN=Serpinb5 PE=1 SV=1, Mus_musculus_sp_P12388_PAI2_MOUSE sp_P12388_PAI2_MOUSE Plasminogen activator inhibitor 2_ macrophage OS=Mus musculus OX=10090 GN=Serpinb2 PE=1 SV=1, Mus_musculus_sp_Q9D7P9_SPB12_MOUSE sp_Q9D7P9_SPB12_MOUSE Serpin B12 OS=Mus musculus OX=10090 GN=Serpinb12 PE=2 SV=1, Mus_musculus_sp_Q8CDC0_SPB13_MOUSE sp_Q8CDC0_SPB13_MOUSE Serpin B13 OS=Mus musculus OX=10090 GN=Serpinb13 PE=2 SV=2, Mus_musculus_sp_Q9CQV3_SPB11_MOUSE sp_Q9CQV3_SPB11_MOUSE Serpin B11 OS=Mus musculus OX=10090 GN=Serpinb11 PE=2 SV=1, Mus_musculus_sp_Q9D695_SPB7_MOUSE sp_Q9D695_SPB7_MOUSE Serpin B7 OS=Mus musculus OX=10090 GN=Serpinb7 PE=2 SV=1	Caenorhabditis_elegans_Y32G9A.4 Y32G9A.4, Caenorhabditis_elegans_C05E4.3 C05E4.3, Caenorhabditis_elegans_F20D6.3 F20D6.3, Caenorhabditis_elegans_F20D6.4d F20D6.4d, Caenorhabditis_elegans_C03G6.19 C03G6.19, Caenorhabditis_elegans_C05E4.1 C05E4.1
OG0000019	Mus_musculus_sp_Q9Z0J7_GDF15_MOUSE sp_Q9Z0J7_GDF15_MOUSE Growth_differentiation factor 15 OS=Mus musculus OX=10090 GN=Gdf15 PE=1 SV=2, Mus_musculus_sp_O08689_GDF8_MOUSE sp_O08689_GDF8_MOUSE Growth_differentiation factor 8 OS=Mus musculus OX=10090 GN=Mstn PE=1 SV=1, Mus_musculus_sp_P55104_INHBC_MOUSE sp_P55104_INHBC_MOUSE Inhibin beta C chain OS=Mus musculus OX=10090 GN=Inhbc PE=2 SV=2, Mus_musculus_sp_O08717_INHBE_MOUSE sp_O08717_INHBE_MOUSE Inhibin beta E chain OS=Mus musculus OX=10090 GN=Inhbe PE=2 SV=2, Mus_musculus_sp_Q04998_INHBA_MOUSE sp_Q04998_INHBA_MOUSE Inhibin beta A chain OS=Mus musculus OX=10090 GN=Inhba PE=1 SV=1	Caenorhabditis_elegans_Y46E12BL.1b Y46E12BL.1b
OG0000019	Mus_musculus_sp_P34821_BMP8A_MOUSE sp_P34821_BMP8A_MOUSE Bone morphogenetic protein 8A OS=Mus musculus OX=10090 GN=Bmp8a PE=2 SV=1, Mus_musculus_sp_P49003_BMP5_MOUSE sp_P49003_BMP5_MOUSE Bone morphogenetic protein 5 OS=Mus musculus OX=10090 GN=Bmp5 PE=2 SV=1, Mus_musculus_sp_P49003_BMP5_MOUSE sp_P49003_BMP5_MOUSE Bone morphogenetic protein 5 OS=Mus musculus OX=10090 GN=Bmp5 PE=2 SV=1, Mus_musculus_sp_P20722_BMP6_MOUSE sp_P20722_BMP6_MOUSE Bone morphogenetic protein 6 OS=Mus musculus OX=10090 GN=Bmp6 PE=1 SV=2, Mus_musculus_sp_P23359_BMP7_MOUSE sp_P23359_BMP7_MOUSE Bone morphogenetic protein 7 OS=Mus musculus OX=10090 GN=Bmp7 PE=1 SV=2	Caenorhabditis_elegans_F39G3.8 F39G3.8
OG0000021	Mus_musculus_sp_O88322_NID2_MOUSE sp_O88322_NID2_MOUSE Nidogen-2 OS=Mus musculus OX=10090 GN=Nid2 PE=1 SV=2, Mus_musculus_sp_P10493_NID1_MOUSE sp_P10493_NID1_MOUSE Nidogen-1 OS=Mus musculus OX=10090 GN=Nid1 PE=1 SV=2	Caenorhabditis_elegans_F54F3.1c F54F3.1c
OG0000023	Mus_musculus_sp_Q05910_ADAM8_MOUSE sp_Q05910_ADAM8_MOUSE Disintegrin and metalloproteinase domain-containing protein 8 OS=Mus musculus OX=10090 GN=Adam8 PE=1 SV=3, Mus_musculus_sp_O35227_ADAM7_MOUSE sp_O35227_ADAM7_MOUSE Disintegrin and metalloproteinase domain-containing protein 7 OS=Mus musculus OX=10090 GN=Adam7 PE=2 SV=2, Mus_musculus_sp_Q9R0X2_ADEC1_MOUSE sp_Q9R0X2_ADEC1_MOUSE ADAM DEC1 OS=Mus musculus OX=10090 GN=Adamdec1 PE=2 SV=1, Mus_musculus_sp_Q8K410_ADA32_MOUSE sp_Q8K410_ADA32_MOUSE Disintegrin and metalloproteinase domain-containing protein 32 OS=Mus musculus OX=10090 GN=Adam32 PE=1 SV=3, Mus_musculus_sp_F8VQ03_ADAM3_MOUSE sp_F8VQ03_ADAM3_MOUSE A disintegrin and metallopeptidase domain 3 OS=Mus musculus OX=10090 GN=Adam3 PE=1 SV=1, Mus_musculus_sp_Q9R157_ADA18_MOUSE sp_Q9R157_ADA18_MOUSE Disintegrin and metalloproteinase domain-containing protein 18 OS=Mus musculus OX=10090 GN=Adam18 PE=1 SV=2, Mus_musculus_sp_Q60718_ADAM2_MOUSE sp_Q60718_ADAM2_MOUSE Disintegrin and metalloproteinase domain-containing protein 2 OS=Mus musculus OX=10090 GN=Adam2 PE=1 SV=2, Mus_musculus_sp_Q8R534_ADM1B_MOUSE sp_Q8R534_ADM1B_MOUSE Disintegrin and metalloproteinase domain-containing protein 1b OS=Mus musculus OX=10090 GN=Adam1b PE=1 SV=2, Mus_musculus_sp_Q9R159_ADA25_MOUSE sp_Q9R159_ADA25_MOUSE Disintegrin and metalloproteinase domain-containing protein 25 OS=Mus musculus OX=10090 GN=Adam25 PE=2 SV=1, Mus_musculus_sp_Q9R160_ADA24_MOUSE sp_Q9R160_ADA24_MOUSE Disintegrin and metalloproteinase domain-containing protein 24 OS=Mus musculus OX=10090 GN=Adam24 PE=1 SV=2, Mus_musculus_sp_Q9R158_AD26A_MOUSE sp_Q9R158_AD26A_MOUSE Disintegrin and metalloproteinase domain-containing protein 26A OS=Mus musculus OX=10090 GN=Adam26a PE=2 SV=2, Mus_musculus_sp_Q811Q4_ADA29_MOUSE sp_Q811Q4_ADA29_MOUSE Disintegrin and metalloproteinase domain-containing protein 29 OS=Mus musculus OX=10090 GN=Adam29 PE=2 SV=1, Mus_musculus_sp_Q9JI76_ADA21_MOUSE sp_Q9JI76_ADA21_MOUSE Disintegrin and metalloproteinase domain-containing protein 21 OS=Mus musculus OX=10090 GN=Adam21 PE=2 SV=1, Mus_musculus_sp_Q61072_ADAM9_MOUSE sp_Q61072_ADAM9_MOUSE Disintegrin and metalloproteinase domain-containing protein 9 OS=Mus musculus OX=10090 GN=Adam9 PE=1 SV=2, Mus_musculus_sp_Q61824_ADA12_MOUSE sp_Q61824_ADA12_MOUSE Disintegrin and metalloproteinase domain-containing protein 12 OS=Mus musculus OX=10090 GN=Adam12 PE=1 SV=2, Mus_musculus_sp_Q923W9_ADA33_MOUSE sp_Q923W9_ADA33_MOUSE Disintegrin and metalloproteinase domain-containing protein 33 OS=Mus musculus OX=10090 GN=Adam33 PE=1 SV=3, Mus_musculus_sp_O35674_ADA19_MOUSE sp_O35674_ADA19_MOUSE Disintegrin and metalloproteinase domain-containing protein 19 OS=Mus musculus OX=10090 GN=Adam19 PE=2 SV=2, Mus_musculus_sp_O88839_ADA15_MOUSE sp_O88839_ADA15_MOUSE Disintegrin and metalloproteinase domain-containing protein 15 OS=Mus musculus OX=10090 GN=Adam15 PE=1 SV=2, Mus_musculus_sp_O88839_ADA15_MOUSE sp_O88839_ADA15_MOUSE Disintegrin and metalloproteinase domain-containing protein 15 OS=Mus musculus OX=10090 GN=Adam15 PE=1 SV=2, Mus_musculus_sp_Q9R1V7_ADA23_MOUSE sp_Q9R1V7_ADA23_MOUSE Disintegrin and metalloproteinase domain-containing protein 23 OS=Mus musculus OX=10090 GN=Adam23 PE=1 SV=1, Mus_musculus_sp_Q9R1V6_ADA22_MOUSE sp_Q9R1V6_ADA22_MOUSE Disintegrin and metalloproteinase domain-containing protein 22 OS=Mus musculus OX=10090 GN=Adam22 PE=1 SV=2, Mus_musculus_sp_Q9R1V4_ADA11_MOUSE sp_Q9R1V4_ADA11_MOUSE Disintegrin and metalloproteinase domain-containing protein 11 OS=Mus musculus OX=10090 GN=Adam11 PE=1 SV=2	Caenorhabditis_elegans_Y37D8A.13 Y37D8A.13
OG0000024	Mus_musculus_sp_Q8R0S6_WFKN1_MOUSE sp_Q8R0S6_WFKN1_MOUSE WAP_ Kazal_ immunoglobulin_ Kunitz and NTR domain-containing protein 1 OS=Mus musculus OX=10090 GN=Wfikkn1 PE=2 SV=2	Caenorhabditis_elegans_W01F3.3e W01F3.3e, Caenorhabditis_elegans_T07H8.4e T07H8.4e
OG0000024	Mus_musculus_sp_Q62288_TICN1_MOUSE sp_Q62288_TICN1_MOUSE Testican-1 OS=Mus musculus OX=10090 GN=Spock1 PE=2 SV=2, Mus_musculus_sp_Q9ER58_TICN2_MOUSE sp_Q9ER58_TICN2_MOUSE Testican-2 OS=Mus musculus OX=10090 GN=Spock2 PE=1 SV=1	Caenorhabditis_elegans_C54E4.2c C54E4.2c
OG0000028	Mus_musculus_sp_P02463_CO4A1_MOUSE sp_P02463_CO4A1_MOUSE Collagen alpha-1_IV_ chain OS=Mus musculus OX=10090 GN=Col4a1 PE=1 SV=4, Mus_musculus_sp_Q9QZS0_CO4A3_MOUSE sp_Q9QZS0_CO4A3_MOUSE Collagen alpha-3_IV_ chain OS=Mus musculus OX=10090 GN=Col4a3 PE=1 SV=2	Caenorhabditis_elegans_K04H4.1b K04H4.1b
OG0000028	Mus_musculus_sp_P08122_CO4A2_MOUSE sp_P08122_CO4A2_MOUSE Collagen alpha-2_IV_ chain OS=Mus musculus OX=10090 GN=Col4a2 PE=1 SV=4, Mus_musculus_sp_Q9QZR9_CO4A4_MOUSE sp_Q9QZR9_CO4A4_MOUSE Collagen alpha-4_IV_ chain OS=Mus musculus OX=10090 GN=Col4a4 PE=1 SV=1	Caenorhabditis_elegans_F01G12.5b F01G12.5b
OG0000030	Mus_musculus_sp_Q9Z0F8_ADA17_MOUSE sp_Q9Z0F8_ADA17_MOUSE Disintegrin and metalloproteinase domain-containing protein 17 OS=Mus musculus OX=10090 GN=Adam17 PE=1 SV=3	Caenorhabditis_elegans_ZK154.7 ZK154.7
OG0000030	Mus_musculus_sp_O35598_ADA10_MOUSE sp_O35598_ADA10_MOUSE Disintegrin and metalloproteinase domain-containing protein 10 OS=Mus musculus OX=10090 GN=Adam10 PE=1 SV=2	Caenorhabditis_elegans_DY3.7 DY3.7
OG0000045	Mus_musculus_sp_Q61789_LAMA3_MOUSE sp_Q61789_LAMA3_MOUSE Laminin subunit alpha-3 OS=Mus musculus OX=10090 GN=Lama3 PE=1 SV=4, Mus_musculus_sp_Q61001_LAMA5_MOUSE sp_Q61001_LAMA5_MOUSE Laminin subunit alpha-5 OS=Mus musculus OX=10090 GN=Lama5 PE=1 SV=4	Caenorhabditis_elegans_K08C7.3e K08C7.3e
OG0000049	Mus_musculus_sp_Q8CJH3_PLXB1_MOUSE sp_Q8CJH3_PLXB1_MOUSE Plexin-B1 OS=Mus musculus OX=10090 GN=Plxnb1 PE=1 SV=2, Mus_musculus_sp_Q9QY40_PLXB3_MOUSE sp_Q9QY40_PLXB3_MOUSE Plexin-B3 OS=Mus musculus OX=10090 GN=Plxnb3 PE=1 SV=2, Mus_musculus_sp_B2RXS4_PLXB2_MOUSE sp_B2RXS4_PLXB2_MOUSE Plexin-B2 OS=Mus musculus OX=10090 GN=Plxnb2 PE=1 SV=1, Mus_musculus_sp_Q3UH93_PLXD1_MOUSE sp_Q3UH93_PLXD1_MOUSE Plexin-D1 OS=Mus musculus OX=10090 GN=Plxnd1 PE=1 SV=1, Mus_musculus_sp_Q9QZC2_PLXC1_MOUSE sp_Q9QZC2_PLXC1_MOUSE Plexin-C1 OS=Mus musculus OX=10090 GN=Plxnc1 PE=1 SV=1	Caenorhabditis_elegans_K04B12.1 K04B12.1
OG0000065	Mus_musculus_sp_Q8CFZ4_GPC3_MOUSE sp_Q8CFZ4_GPC3_MOUSE Glypican-3 OS=Mus musculus OX=10090 GN=Gpc3 PE=1 SV=1	Caenorhabditis_elegans_C39E6.1 C39E6.1
OG0000068	Mus_musculus_sp_O54974_LEG7_MOUSE sp_O54974_LEG7_MOUSE Galectin-7 OS=Mus musculus OX=10090 GN=Lgals7 PE=2 SV=3, Mus_musculus_sp_P16110_LEG3_MOUSE sp_P16110_LEG3_MOUSE Galectin-3 OS=Mus musculus OX=10090 GN=Lgals3 PE=1 SV=3, Mus_musculus_sp_Q8VED9_LEGL_MOUSE sp_Q8VED9_LEGL_MOUSE Galectin-related protein OS=Mus musculus OX=10090 GN=Lgalsl PE=1 SV=1, Mus_musculus_sp_Q8K419_LEG4_MOUSE sp_Q8K419_LEG4_MOUSE Galectin-4 OS=Mus musculus OX=10090 GN=Lgals4 PE=1 SV=2, Mus_musculus_sp_O08573_LEG9_MOUSE sp_O08573_LEG9_MOUSE Galectin-9 OS=Mus musculus OX=10090 GN=Lgals9 PE=1 SV=1, Mus_musculus_sp_Q91VD1_LEG12_MOUSE sp_Q91VD1_LEG12_MOUSE Galectin-12 OS=Mus musculus OX=10090 GN=Lgals12 PE=1 SV=2, Mus_musculus_sp_Q9JL15_LEG8_MOUSE sp_Q9JL15_LEG8_MOUSE Galectin-8 OS=Mus musculus OX=10090 GN=Lgals8 PE=1 SV=1	Caenorhabditis_elegans_W09H1.6b W09H1.6b, Caenorhabditis_elegans_F52H3.7b F52H3.7b, Caenorhabditis_elegans_ZK1248.16 ZK1248.16, Caenorhabditis_elegans_C44F1.3 C44F1.3, Caenorhabditis_elegans_C53D6.7 C53D6.7
OG0000068	Mus_musculus_sp_P16045_LEG1_MOUSE sp_P16045_LEG1_MOUSE Galectin-1 OS=Mus musculus OX=10090 GN=Lgals1 PE=1 SV=3	Caenorhabditis_elegans_Y41C4A.5 Y41C4A.5, Caenorhabditis_elegans_Y55B1AR.1 Y55B1AR.1
OG0000070	Mus_musculus_sp_Q3UQ28_PXDN_MOUSE sp_Q3UQ28_PXDN_MOUSE Peroxidasin homolog OS=Mus musculus OX=10090 GN=Pxdn PE=1 SV=2	Caenorhabditis_elegans_K09C8.5 K09C8.5, Caenorhabditis_elegans_ZK994.3 ZK994.3
OG0000074	Mus_musculus_sp_Q9R1B9_SLIT2_MOUSE sp_Q9R1B9_SLIT2_MOUSE Slit homolog 2 protein OS=Mus musculus OX=10090 GN=Slit2 PE=2 SV=2, Mus_musculus_sp_Q9WVB4_SLIT3_MOUSE sp_Q9WVB4_SLIT3_MOUSE Slit homolog 3 protein OS=Mus musculus OX=10090 GN=Slit3 PE=2 SV=2, Mus_musculus_sp_Q80TR4_SLIT1_MOUSE sp_Q80TR4_SLIT1_MOUSE Slit homolog 1 protein OS=Mus musculus OX=10090 GN=Slit1 PE=1 SV=2	Caenorhabditis_elegans_F40E10.4 F40E10.4
OG0000078	Mus_musculus_sp_Q99JR5_TINAL_MOUSE sp_Q99JR5_TINAL_MOUSE Tubulointerstitial nephritis antigen-like OS=Mus musculus OX=10090 GN=Tinagl1 PE=1 SV=1	Caenorhabditis_elegans_F26E4.3 F26E4.3
OG0000081	Mus_musculus_sp_Q9CYA0_CREL2_MOUSE sp_Q9CYA0_CREL2_MOUSE Protein disulfide isomerase Creld2 OS=Mus musculus OX=10090 GN=Creld2 PE=1 SV=1, Mus_musculus_sp_Q91XD7_CREL1_MOUSE sp_Q91XD7_CREL1_MOUSE Protein disulfide isomerase Creld1 OS=Mus musculus OX=10090 GN=Creld1 PE=1 SV=1	Caenorhabditis_elegans_F09E8.2b F09E8.2b, Caenorhabditis_elegans_F56H11.1e F56H11.1e
