Orthogroup	Chordata_Vertebrata_Coturnix_japonica	Cnidaria_Anthozoa_Xenia_spec
OG0000000	Coturnix_japonica_XP_015734261.1 tenascin isoform X1 [Coturnix japonica], Coturnix_japonica_XP_015725285.1 PREDICTED_ tenascin-R isoform X2 [Coturnix japonica], Coturnix_japonica_XP_015725046.1 tenascin-N [Coturnix japonica]	Xenia_spec_Xe_009126_T1 Xe_009126_T1 Xe_009126
OG0000000	Coturnix_japonica_XP_015706135.1 PREDICTED_ microfibril-associated glycoprotein 4_ partial [Coturnix japonica]	Xenia_spec_Xe_009140_T1 Xe_009140_T1 Xe_009140
OG0000001	Coturnix_japonica_XP_015706098.1 PREDICTED_ laminin subunit beta-4 [Coturnix japonica], Coturnix_japonica_XP_015730671.1 laminin subunit beta-2 [Coturnix japonica], Coturnix_japonica_XP_015706984.1 laminin subunit beta-1 [Coturnix japonica]	Xenia_spec_Xe_003284_T1 Xe_003284_T1 Xe_003284
OG0000001	Coturnix_japonica_XP_015734637.1 PREDICTED_ netrin-G2 isoform X3 [Coturnix japonica], Coturnix_japonica_XP_015724985.1 netrin-G1 isoform X4 [Coturnix japonica]	Xenia_spec_Xe_008027_T1 Xe_008027_T1 Xe_008027
OG0000001	Coturnix_japonica_XP_015732925.1 netrin-3 isoform X2 [Coturnix japonica], Coturnix_japonica_XP_015735411.1 netrin-1 [Coturnix japonica]	Xenia_spec_Xe_016511_T1 Xe_016511_T1 Xe_016511
OG0000001	Coturnix_japonica_XP_015734644.1 laminin subunit gamma-3 isoform X2 [Coturnix japonica], Coturnix_japonica_XP_015725067.1 laminin subunit gamma-1 [Coturnix japonica]	Xenia_spec_Xe_008821_T1 Xe_008821_T1 Xe_008821
OG0000001	Coturnix_japonica_XP_015710772.1 laminin subunit alpha-1 [Coturnix japonica]	Xenia_spec_Xe_002223_T1 Xe_002223_T1 Xe_002223
OG0000002	Coturnix_japonica_XP_015741579.1 cartilage oligomeric matrix protein [Coturnix japonica], Coturnix_japonica_XP_015704105.1 thrombospondin-4 isoform X1 [Coturnix japonica]	Xenia_spec_Xe_003115_T1 Xe_003115_T1 Xe_003115, Xenia_spec_Xe_003081_T1 Xe_003081_T1 Xe_003081
OG0000002	Coturnix_japonica_XP_015709878.1 semaphorin-5A [Coturnix japonica], Coturnix_japonica_XP_015724160.1 semaphorin-5B isoform X2 [Coturnix japonica]	Xenia_spec_Xe_009903_T1 Xe_009903_T1 Xe_009903
OG0000003	Coturnix_japonica_XP_015714842.1 PREDICTED_ collectin-11 isoform X1 [Coturnix japonica], Coturnix_japonica_XP_015711709.1 collectin-10 isoform X1 [Coturnix japonica], Coturnix_japonica_XP_015721592.1 mannose-binding protein [Coturnix japonica]	Xenia_spec_Xe_009803_T1 Xe_009803_T1 Xe_009803, Xenia_spec_Xe_009805_T1 Xe_009805_T1 Xe_009805, Xenia_spec_Xe_009799_T1 Xe_009799_T1 Xe_009799
OG0000003	Coturnix_japonica_XP_015703924.1 CD209 antigen-like protein E isoform X2 [Coturnix japonica]	Xenia_spec_Xe_008296_T1 Xe_008296_T1 Xe_008296, Xenia_spec_Xe_009687_T1 Xe_009687_T1 Xe_009687, Xenia_spec_Xe_010093_T1 Xe_010093_T1 Xe_010093, Xenia_spec_Xe_009593_T1 Xe_009593_T1 Xe_009593, Xenia_spec_Xe_002591_T1 Xe_002591_T1 Xe_002591
OG0000004	Coturnix_japonica_XP_015737645.1 von Willebrand factor A domain-containing protein 1 [Coturnix japonica], Coturnix_japonica_XP_015730555.1 collagen alpha-1_VII_ chain isoform X1 [Coturnix japonica], Coturnix_japonica_XP_015737180.1 collagen alpha-1_XX_ chain [Coturnix japonica], Coturnix_japonica_XP_015714536.1 collagen alpha-1_XII_ chain isoform X1 [Coturnix japonica], Coturnix_japonica_XP_015711669.1 PREDICTED_ collagen alpha-1_XIV_ chain isoform X1 [Coturnix japonica], Coturnix_japonica_XP_015722855.1 von Willebrand factor A domain-containing protein 2 isoform X2 [Coturnix japonica], Coturnix_japonica_XP_015709514.1 collagen alpha-6_VI_ chain [Coturnix japonica], Coturnix_japonica_XP_015723563.1 collagen alpha-3_VI_ chain isoform X1 [Coturnix japonica], Coturnix_japonica_XP_015713068.1 vitrin isoform X2 [Coturnix japonica], Coturnix_japonica_XP_015720468.1 cochlin [Coturnix japonica], Coturnix_japonica_XP_015715058.1 matrilin-3 [Coturnix japonica], Coturnix_japonica_XP_015711574.1 matrilin-2 isoform X1 [Coturnix japonica], Coturnix_japonica_XP_015738684.1 cartilage matrix protein [Coturnix japonica], Coturnix_japonica_XP_015737175.1 PREDICTED_ matrilin-4 isoform X1 [Coturnix japonica], Coturnix_japonica_XP_015737176.1 PREDICTED_ matrilin-4 isoform X2 [Coturnix japonica], Coturnix_japonica_XP_015714716.1 collagen alpha-1_XXI_ chain [Coturnix japonica], Coturnix_japonica_XP_015711896.1 collagen alpha-1_XXII_ chain isoform X1 [Coturnix japonica]	Xenia_spec_Xe_002025_T1 Xe_002025_T1 Xe_002025
OG0000005	Coturnix_japonica_XP_015720065.1 astacin-like metalloendopeptidase [Coturnix japonica]	Xenia_spec_Xe_015051_T1 Xe_015051_T1 Xe_015051, Xenia_spec_Xe_014351_T1 Xe_014351_T1 Xe_014351, Xenia_spec_Xe_014613_T1 Xe_014613_T1 Xe_014613, Xenia_spec_Xe_014350_T1 Xe_014350_T1 Xe_014350, Xenia_spec_Xe_015665_T1 Xe_015665_T1 Xe_015665
OG0000007	Coturnix_japonica_XP_015738107.1 PREDICTED_ LOW QUALITY PROTEIN_ multiple epidermal growth factor-like domains protein 6 [Coturnix japonica], Coturnix_japonica_XP_015705002.1 growth arrest-specific protein 6 [Coturnix japonica]	Xenia_spec_Xe_015834_T1 Xe_015834_T1 Xe_015834
OG0000007	Coturnix_japonica_XP_015726540.1 sushi_ nidogen and EGF-like domain-containing protein 1 isoform X1 [Coturnix japonica]	Xenia_spec_Xe_013492_T1 Xe_013492_T1 Xe_013492
OG0000007	Coturnix_japonica_XP_015727266.1 PREDICTED_ mucin-4 [Coturnix japonica]	Xenia_spec_Xe_015322_T1 Xe_015322_T1 Xe_015322, Xenia_spec_Xe_015322_T2 Xe_015322_T2 Xe_015322, Xenia_spec_Xe_014878_T1 Xe_014878_T1 Xe_014878, Xenia_spec_Xe_014862_T1 Xe_014862_T1 Xe_014862, Xenia_spec_Xe_014860_T1 Xe_014860_T1 Xe_014860, Xenia_spec_Xe_014856_T1 Xe_014856_T1 Xe_014856, Xenia_spec_Xe_014858_T1 Xe_014858_T1 Xe_014858, Xenia_spec_Xe_014859_T1 Xe_014859_T1 Xe_014859
OG0000009	Coturnix_japonica_XP_015726187.1 CUB domain-containing protein 2 isoform X2 [Coturnix japonica]	Xenia_spec_Xe_003323_T1 Xe_003323_T1 Xe_003323
OG0000010	Coturnix_japonica_XP_015738166.1 agrin isoform X4 [Coturnix japonica]	Xenia_spec_Xe_018671_T1 Xe_018671_T1 Xe_018671, Xenia_spec_Xe_012650_T1 Xe_012650_T1 Xe_012650, Xenia_spec_Xe_012927_T1 Xe_012927_T1 Xe_012927
OG0000012	Coturnix_japonica_XP_015708265.1 PREDICTED_ SCO-spondin [Coturnix japonica]	Xenia_spec_Xe_000847_T1 Xe_000847_T1 Xe_000847, Xenia_spec_Xe_018696_T1 Xe_018696_T1 Xe_018696, Xenia_spec_Xe_018706_T1 Xe_018706_T1 Xe_018706, Xenia_spec_Xe_018687_T1 Xe_018687_T1 Xe_018687
OG0000013	Coturnix_japonica_XP_015737876.1 protein Wnt-4 isoform X2 [Coturnix japonica]	Xenia_spec_Xe_012562_T1 Xe_012562_T1 Xe_012562
OG0000013	Coturnix_japonica_XP_015707967.1 protein Wnt-11 isoform X1 [Coturnix japonica]	Xenia_spec_Xe_015020_T1 Xe_015020_T1 Xe_015020
OG0000013	Coturnix_japonica_XP_015725941.1 PREDICTED_ protein Wnt-7b [Coturnix japonica]	Xenia_spec_Xe_016066_T1 Xe_016066_T1 Xe_016066, Xenia_spec_Xe_016066_T2 Xe_016066_T2 Xe_016066
OG0000013	Coturnix_japonica_XP_015709062.1 protein Wnt-2 [Coturnix japonica], Coturnix_japonica_XP_015740732.1 protein Wnt-2b [Coturnix japonica]	Xenia_spec_Xe_014676_T1 Xe_014676_T1 Xe_014676
OG0000014	Coturnix_japonica_XP_015734810.1 ADAMTS-like protein 2 isoform X2 [Coturnix japonica], Coturnix_japonica_XP_015728200.1 thrombospondin type-1 domain-containing protein 4 isoform X1 [Coturnix japonica]	Xenia_spec_Xe_002262_T1 Xe_002262_T1 Xe_002262
OG0000014	Coturnix_japonica_XP_015720070.1 papilin isoform X1 [Coturnix japonica]	Xenia_spec_Xe_011969_T1 Xe_011969_T1 Xe_011969
OG0000014	Coturnix_japonica_XP_015710221.1 PREDICTED_ LOW QUALITY PROTEIN_ A disintegrin and metalloproteinase with thrombospondin motifs 20_ partial [Coturnix japonica], Coturnix_japonica_XP_015730744.1 A disintegrin and metalloproteinase with thrombospondin motifs 9 isoform X2 [Coturnix japonica]	Xenia_spec_Xe_004267_T1 Xe_004267_T1 Xe_004267
OG0000015	Coturnix_japonica_XP_015721772.1 oncoprotein-induced transcript 3 protein isoform X1 [Coturnix japonica]	Xenia_spec_Xe_002027_T1 Xe_002027_T1 Xe_002027, Xenia_spec_Xe_002017_T1 Xe_002017_T1 Xe_002017, Xenia_spec_Xe_002026_T1 Xe_002026_T1 Xe_002026, Xenia_spec_Xe_002028_T1 Xe_002028_T1 Xe_002028, Xenia_spec_Xe_001050_T1 Xe_001050_T1 Xe_001050, Xenia_spec_Xe_001050_T2 Xe_001050_T2 Xe_001050, Xenia_spec_Xe_007946_T1 Xe_007946_T1 Xe_007946, Xenia_spec_Xe_007945_T1 Xe_007945_T1 Xe_007945
OG0000018	Coturnix_japonica_XP_015722587.1 PREDICTED_ LOW QUALITY PROTEIN_ lysyl oxidase homolog 4-like [Coturnix japonica], Coturnix_japonica_XP_015705736.1 lysyl oxidase homolog 3 [Coturnix japonica], Coturnix_japonica_XP_015738393.1 lysyl oxidase homolog 2 [Coturnix japonica]	Xenia_spec_Xe_013913_T1 Xe_013913_T1 Xe_013913, Xenia_spec_Xe_013934_T1 Xe_013934_T1 Xe_013934
OG0000018	Coturnix_japonica_XP_015722969.1 PREDICTED_ deleted in malignant brain tumors 1 protein [Coturnix japonica]	Xenia_spec_Xe_009686_T1 Xe_009686_T1 Xe_009686, Xenia_spec_Xe_009691_T1 Xe_009691_T1 Xe_009691, Xenia_spec_Xe_010129_T1 Xe_010129_T1 Xe_010129, Xenia_spec_Xe_010158_T1 Xe_010158_T1 Xe_010158, Xenia_spec_Xe_006051_T1 Xe_006051_T1 Xe_006051, Xenia_spec_Xe_010156_T1 Xe_010156_T1 Xe_010156, Xenia_spec_Xe_010159_T1 Xe_010159_T1 Xe_010159, Xenia_spec_Xe_010157_T1 Xe_010157_T1 Xe_010157, Xenia_spec_Xe_002016_T1 Xe_002016_T1 Xe_002016
OG0000019	Coturnix_japonica_XP_015738689.1 bone morphogenetic protein 8B-like [Coturnix japonica], Coturnix_japonica_XP_015714712.1 bone morphogenetic protein 5 isoform X1 [Coturnix japonica], Coturnix_japonica_XP_015710074.1 bone morphogenetic protein 6 [Coturnix japonica], Coturnix_japonica_XP_015737280.1 bone morphogenetic protein 7 [Coturnix japonica]	Xenia_spec_Xe_002372_T1 Xe_002372_T1 Xe_002372, Xenia_spec_Xe_002371_T1 Xe_002371_T1 Xe_002371
OG0000019	Coturnix_japonica_XP_015721467.1 bone morphogenetic protein 4 [Coturnix japonica], Coturnix_japonica_XP_015712614.1 bone morphogenetic protein 2 [Coturnix japonica]	Xenia_spec_Xe_000961_T1 Xe_000961_T1 Xe_000961, Xenia_spec_Xe_000961_T2 Xe_000961_T2 Xe_000961
OG0000019	Coturnix_japonica_XP_015705631.1 PREDICTED_ growth/differentiation factor 6_ partial [Coturnix japonica], Coturnix_japonica_XP_015736826.1 growth/differentiation factor 5 [Coturnix japonica], Coturnix_japonica_XP_015714970.1 growth/differentiation factor 7 [Coturnix japonica], Coturnix_japonica_XP_015717295.1 bone morphogenetic protein 3 [Coturnix japonica], Coturnix_japonica_XP_015722337.1 growth/differentiation factor 10 [Coturnix japonica]	Xenia_spec_Xe_002679_T1 Xe_002679_T1 Xe_002679
OG0000020	Coturnix_japonica_XP_015734782.1 collagen alpha-1_V_ chain isoform X1 [Coturnix japonica], Coturnix_japonica_XP_015725391.1 collagen alpha-1_XI_ chain isoform X1 [Coturnix japonica]	Xenia_spec_Xe_008243_T1 Xe_008243_T1 Xe_008243
OG0000020	Coturnix_japonica_XP_015705870.1 collagen alpha-1_II_ chain isoform X1 [Coturnix japonica], Coturnix_japonica_XP_015741354.1 LOW QUALITY PROTEIN_ collagen alpha-1_I_ chain [Coturnix japonica], Coturnix_japonica_XP_015709029.1 collagen alpha-2_I_ chain [Coturnix japonica], Coturnix_japonica_XP_015723325.1 collagen alpha-1_III_ chain [Coturnix japonica], Coturnix_japonica_XP_015723324.1 collagen alpha-2_V_ chain [Coturnix japonica]	Xenia_spec_Xe_007965_T1 Xe_007965_T1 Xe_007965, Xenia_spec_Xe_009290_T1 Xe_009290_T1 Xe_009290, Xenia_spec_Xe_009738_T1 Xe_009738_T1 Xe_009738, Xenia_spec_Xe_010176_T1 Xe_010176_T1 Xe_010176, Xenia_spec_Xe_009677_T1 Xe_009677_T1 Xe_009677, Xenia_spec_Xe_001362_T1 Xe_001362_T1 Xe_001362, Xenia_spec_Xe_009975_T1 Xe_009975_T1 Xe_009975, Xenia_spec_Xe_009974_T1 Xe_009974_T1 Xe_009974
OG0000021	Coturnix_japonica_XP_015721444.1 nidogen-2 isoform X2 [Coturnix japonica], Coturnix_japonica_XP_015713380.1 nidogen-1 isoform X1 [Coturnix japonica]	Xenia_spec_Xe_012353_T1 Xe_012353_T1 Xe_012353
OG0000021	Coturnix_japonica_XP_015717481.1 pro-epidermal growth factor isoform X2 [Coturnix japonica]	Xenia_spec_Xe_007982_T1 Xe_007982_T1 Xe_007982
OG0000022	Coturnix_japonica_XP_015722004.1 annexin A7 isoform X2 [Coturnix japonica]	Xenia_spec_Xe_008122_T1 Xe_008122_T1 Xe_008122
OG0000023	Coturnix_japonica_XP_015721656.1 disintegrin and metalloproteinase domain-containing protein 8 isoform X1 [Coturnix japonica], Coturnix_japonica_XP_015738502.1 disintegrin and metalloproteinase domain-containing protein 28 isoform X2 [Coturnix japonica], Coturnix_japonica_XP_015733264.1 disintegrin and metalloproteinase domain-containing protein 9-like [Coturnix japonica], Coturnix_japonica_XP_015738633.1 disintegrin and metalloproteinase domain-containing protein 9 [Coturnix japonica], Coturnix_japonica_XP_015723079.1 PREDICTED_ disintegrin and metalloproteinase domain-containing protein 12 isoform X2 [Coturnix japonica], Coturnix_japonica_XP_015718482.1 disintegrin and metalloproteinase domain-containing protein 33 isoform X2 [Coturnix japonica], Coturnix_japonica_XP_015731731.1 PREDICTED_ disintegrin and metalloproteinase domain-containing protein 19 isoform X1 [Coturnix japonica], Coturnix_japonica_XP_015723724.1 disintegrin and metalloproteinase domain-containing protein 23 [Coturnix japonica], Coturnix_japonica_XP_015708948.1 disintegrin and metalloproteinase domain-containing protein 22 isoform X1 [Coturnix japonica], Coturnix_japonica_XP_015740988.1 PREDICTED_ disintegrin and metalloproteinase domain-containing protein 11 isoform X2 [Coturnix japonica]	Xenia_spec_Xe_013551_T1 Xe_013551_T1 Xe_013551, Xenia_spec_Xe_013537_T1 Xe_013537_T1 Xe_013537
OG0000024	Coturnix_japonica_XP_015716467.1 testican-3 isoform X1 [Coturnix japonica], Coturnix_japonica_XP_015731364.1 testican-1 isoform X1 [Coturnix japonica], Coturnix_japonica_XP_015721924.1 testican-2 [Coturnix japonica]	Xenia_spec_Xe_015637_T1 Xe_015637_T1 Xe_015637
OG0000028	Coturnix_japonica_XP_015706908.1 collagen alpha-1_IV_ chain [Coturnix japonica], Coturnix_japonica_XP_015715960.1 collagen alpha-5_IV_ chain isoform X1 [Coturnix japonica], Coturnix_japonica_XP_015726877.1 collagen alpha-3_IV_ chain [Coturnix japonica]	Xenia_spec_Xe_014296_T1 Xe_014296_T1 Xe_014296
OG0000028	Coturnix_japonica_XP_015706905.1 collagen alpha-2_IV_ chain [Coturnix japonica], Coturnix_japonica_XP_015715965.1 collagen alpha-6_IV_ chain isoform X1 [Coturnix japonica], Coturnix_japonica_XP_015726876.1 collagen alpha-4_IV_ chain [Coturnix japonica]	Xenia_spec_Xe_014297_T1 Xe_014297_T1 Xe_014297
OG0000030	Coturnix_japonica_XP_015714888.1 disintegrin and metalloproteinase domain-containing protein 17 [Coturnix japonica]	Xenia_spec_Xe_002453_T1 Xe_002453_T1 Xe_002453
OG0000030	Coturnix_japonica_XP_015727888.1 disintegrin and metalloproteinase domain-containing protein 10 isoform X1 [Coturnix japonica]	Xenia_spec_Xe_020361_T1 Xe_020361_T1 Xe_020361, Xenia_spec_Xe_020374_T1 Xe_020374_T1 Xe_020374, Xenia_spec_Xe_008808_T1 Xe_008808_T1 Xe_008808, Xenia_spec_Xe_008342_T1 Xe_008342_T1 Xe_008342
OG0000033	Coturnix_japonica_XP_015711635.2 collagen triple helix repeat-containing protein 1 [Coturnix japonica]	Xenia_spec_Xe_009545_T1 Xe_009545_T1 Xe_009545, Xenia_spec_Xe_009552_T1 Xe_009552_T1 Xe_009552, Xenia_spec_Xe_009447_T1 Xe_009447_T1 Xe_009447, Xenia_spec_Xe_009467_T1 Xe_009467_T1 Xe_009467, Xenia_spec_Xe_009470_T2 Xe_009470_T2 Xe_009470, Xenia_spec_Xe_009470_T1 Xe_009470_T1 Xe_009470, Xenia_spec_Xe_009458_T1 Xe_009458_T1 Xe_009458, Xenia_spec_Xe_009454_T1 Xe_009454_T1 Xe_009454, Xenia_spec_Xe_009450_T1 Xe_009450_T1 Xe_009450, Xenia_spec_Xe_009466_T1 Xe_009466_T1 Xe_009466, Xenia_spec_Xe_009546_T1 Xe_009546_T1 Xe_009546, Xenia_spec_Xe_009448_T1 Xe_009448_T1 Xe_009448, Xenia_spec_Xe_018287_T1 Xe_018287_T1 Xe_018287, Xenia_spec_Xe_018285_T1 Xe_018285_T1 Xe_018285
OG0000035	Coturnix_japonica_XP_015728570.1 lactadherin isoform X1 [Coturnix japonica]	Xenia_spec_Xe_009250_T1 Xe_009250_T1 Xe_009250
OG0000037	Coturnix_japonica_XP_015707407.1 periostin isoform X8 [Coturnix japonica], Coturnix_japonica_XP_015731386.1 transforming growth factor-beta-induced protein ig-h3 [Coturnix japonica]	Xenia_spec_Xe_014976_T1 Xe_014976_T1 Xe_014976, Xenia_spec_Xe_014975_T1 Xe_014975_T1 Xe_014975, Xenia_spec_Xe_014974_T1 Xe_014974_T1 Xe_014974
OG0000038	Coturnix_japonica_XP_015715653.1 PREDICTED_ ectodysplasin-A isoform X1 [Coturnix japonica], Coturnix_japonica_XP_015706939.1 tumor necrosis factor ligand superfamily member 13B isoform X1 [Coturnix japonica], Coturnix_japonica_XP_015734323.1 tumor necrosis factor ligand superfamily member 15 [Coturnix japonica], Coturnix_japonica_XP_015725223.1 PREDICTED_ tumor necrosis factor ligand superfamily member 6 isoform X1 [Coturnix japonica], Coturnix_japonica_XP_015707222.1 tumor necrosis factor ligand superfamily member 11 isoform X1 [Coturnix japonica], Coturnix_japonica_XP_015727439.1 tumor necrosis factor ligand superfamily member 10 isoform X1 [Coturnix japonica]	Xenia_spec_Xe_014048_T1 Xe_014048_T1 Xe_014048, Xenia_spec_Xe_014047_T1 Xe_014047_T1 Xe_014047, Xenia_spec_Xe_014050_T1 Xe_014050_T1 Xe_014050, Xenia_spec_Xe_014051_T1 Xe_014051_T1 Xe_014051, Xenia_spec_Xe_014049_T1 Xe_014049_T1 Xe_014049
OG0000040	Coturnix_japonica_XP_015704232.1 endothelial cell-specific molecule 1 [Coturnix japonica], Coturnix_japonica_XP_015722767.1 kazal-type serine protease inhibitor domain-containing protein 1 [Coturnix japonica], Coturnix_japonica_XP_015717063.1 insulin-like growth factor-binding protein 7 isoform X2 [Coturnix japonica]	Xenia_spec_Xe_008627_T1 Xe_008627_T1 Xe_008627
OG0000041	Coturnix_japonica_XP_015740894.1 PREDICTED_ LOW QUALITY PROTEIN_ von Willebrand factor A domain-containing protein 5A [Coturnix japonica]	Xenia_spec_Xe_005440_T1 Xe_005440_T1 Xe_005440, Xenia_spec_Xe_005437_T1 Xe_005437_T1 Xe_005437, Xenia_spec_Xe_005431_T1 Xe_005431_T1 Xe_005431, Xenia_spec_Xe_005447_T1 Xe_005447_T1 Xe_005447, Xenia_spec_Xe_005456_T1 Xe_005456_T1 Xe_005456, Xenia_spec_Xe_005470_T1 Xe_005470_T1 Xe_005470, Xenia_spec_Xe_005444_T1 Xe_005444_T1 Xe_005444, Xenia_spec_Xe_005450_T1 Xe_005450_T1 Xe_005450, Xenia_spec_Xe_005434_T1 Xe_005434_T1 Xe_005434, Xenia_spec_Xe_005453_T1 Xe_005453_T1 Xe_005453, Xenia_spec_Xe_005472_T1 Xe_005472_T1 Xe_005472, Xenia_spec_Xe_005471_T1 Xe_005471_T1 Xe_005471, Xenia_spec_Xe_005454_T1 Xe_005454_T1 Xe_005454
OG0000041	Coturnix_japonica_XP_015727259.1 von Willebrand factor A domain-containing protein 5B2 isoform X1 [Coturnix japonica], Coturnix_japonica_XP_015737811.1 von Willebrand factor A domain-containing protein 5B1 [Coturnix japonica]	Xenia_spec_Xe_012595_T1 Xe_012595_T1 Xe_012595
OG0000044	Coturnix_japonica_XP_015737318.1 protein-glutamine gamma-glutamyltransferase 2 [Coturnix japonica], Coturnix_japonica_XP_015736940.1 PREDICTED_ protein-glutamine gamma-glutamyltransferase E-like_ partial [Coturnix japonica], Coturnix_japonica_XP_015736972.1 protein-glutamine gamma-glutamyltransferase 6-like [Coturnix japonica], Coturnix_japonica_XP_015709680.1 protein-glutamine gamma-glutamyltransferase 4 [Coturnix japonica]	Xenia_spec_Xe_014375_T1 Xe_014375_T1 Xe_014375, Xenia_spec_Xe_014377_T1 Xe_014377_T1 Xe_014377
OG0000045	Coturnix_japonica_XP_015710913.1 PREDICTED_ laminin subunit alpha-3 isoform X2 [Coturnix japonica], Coturnix_japonica_XP_015736975.1 laminin subunit alpha-5 isoform X3 [Coturnix japonica]	Xenia_spec_Xe_020060_T1 Xe_020060_T1 Xe_020060, Xenia_spec_Xe_002603_T1 Xe_002603_T1 Xe_002603
OG0000045	Coturnix_japonica_XP_015714210.1 laminin subunit alpha-4 [Coturnix japonica]	Xenia_spec_Xe_002601_T1 Xe_002601_T1 Xe_002601
OG0000049	Coturnix_japonica_XP_015730469.1 plexin-A1 isoform X1 [Coturnix japonica], Coturnix_japonica_XP_015740621.1 PREDICTED_ plexin-A2 [Coturnix japonica], Coturnix_japonica_XP_015716725.1 plexin-A4 isoform X1 [Coturnix japonica], Coturnix_japonica_XP_015730724.1 plexin-B1 isoform X2 [Coturnix japonica], Coturnix_japonica_XP_015708110.1 plexin-B2 [Coturnix japonica], Coturnix_japonica_XP_015730333.1 plexin-D1 [Coturnix japonica]	Xenia_spec_Xe_014133_T1 Xe_014133_T1 Xe_014133
OG0000054	Coturnix_japonica_XP_015728474.1 PREDICTED_ pro-interleukin-16 isoform X2 [Coturnix japonica]	Xenia_spec_Xe_016386_T1 Xe_016386_T1 Xe_016386
OG0000059	Coturnix_japonica_XP_015740640.1 signal peptide_ CUB and EGF-like domain-containing protein 3 isoform X3 [Coturnix japonica], Coturnix_japonica_XP_015725419.1 signal peptide_ CUB and EGF-like domain-containing protein 1 isoform X4 [Coturnix japonica], Coturnix_japonica_XP_015719548.1 PREDICTED_ signal peptide_ CUB and EGF-like domain-containing protein 2 isoform X1 [Coturnix japonica]	Xenia_spec_Xe_008324_T1 Xe_008324_T1 Xe_008324
OG0000063	Coturnix_japonica_XP_015708514.1 sonic hedgehog protein [Coturnix japonica], Coturnix_japonica_XP_015724713.1 indian hedgehog protein [Coturnix japonica], Coturnix_japonica_XP_015742402.1 desert hedgehog protein [Coturnix japonica]	Xenia_spec_Xe_010055_T1 Xe_010055_T1 Xe_010055
OG0000064	Coturnix_japonica_XP_015720647.1 PREDICTED_ latent-transforming growth factor beta-binding protein 2 isoform X4 [Coturnix japonica], Coturnix_japonica_XP_015713186.1 latent-transforming growth factor beta-binding protein 1 isoform X6 [Coturnix japonica], Coturnix_japonica_XP_015742103.1 PREDICTED_ fibrillin-3 isoform X1 [Coturnix japonica], Coturnix_japonica_XP_015705146.1 fibrillin-2 isoform X1 [Coturnix japonica], Coturnix_japonica_XP_015728443.1 fibrillin-1 isoform X1 [Coturnix japonica]	Xenia_spec_Xe_002322_T1 Xe_002322_T1 Xe_002322
OG0000065	Coturnix_japonica_XP_015707026.1 glypican-5 isoform X4 [Coturnix japonica], Coturnix_japonica_XP_015715912.1 glypican-3 isoform X1 [Coturnix japonica]	Xenia_spec_Xe_015641_T1 Xe_015641_T1 Xe_015641, Xenia_spec_Xe_015614_T1 Xe_015614_T1 Xe_015614, Xenia_spec_Xe_015613_T1 Xe_015613_T1 Xe_015613
OG0000070	Coturnix_japonica_XP_015714835.1 PREDICTED_ thyroid peroxidase [Coturnix japonica], Coturnix_japonica_XP_015714841.1 peroxidasin homolog [Coturnix japonica], Coturnix_japonica_XP_015737187.1 peroxidasin homolog [Coturnix japonica]	Xenia_spec_Xe_000193_T1 Xe_000193_T1 Xe_000193
OG0000078	Coturnix_japonica_XP_015712526.1 cystatin [Coturnix japonica], Coturnix_japonica_XP_015712583.1 cystatin-F [Coturnix japonica]	Xenia_spec_Xe_013236_T1 Xe_013236_T1 Xe_013236
OG0000081	Coturnix_japonica_XP_015730872.1 PREDICTED_ LOW QUALITY PROTEIN_ cysteine-rich with EGF-like domain protein 1 [Coturnix japonica], Coturnix_japonica_XP_015730872.1 PREDICTED_ LOW QUALITY PROTEIN_ cysteine-rich with EGF-like domain protein 1 [Coturnix japonica]	Xenia_spec_Xe_004317_T1 Xe_004317_T1 Xe_004317
OG0000083	Coturnix_japonica_XP_015730132.1 hyaluronidase-3 isoform X2 [Coturnix japonica], Coturnix_japonica_XP_015729975.1 hyaluronidase-1 [Coturnix japonica], Coturnix_japonica_XP_015708262.1 hyaluronidase PH-20 [Coturnix japonica], Coturnix_japonica_XP_015729965.1 PREDICTED_ hyaluronidase-2 [Coturnix japonica]	Xenia_spec_Xe_012872_T2 Xe_012872_T2 Xe_012872, Xenia_spec_Xe_012872_T1 Xe_012872_T1 Xe_012872
OG0000088	Coturnix_japonica_XP_015718401.1 spondin-2 [Coturnix japonica], Coturnix_japonica_XP_015719003.1 PREDICTED_ spondin-1 [Coturnix japonica]	Xenia_spec_Xe_008756_T1 Xe_008756_T1 Xe_008756
OG0000089	Coturnix_japonica_XP_015716178.1 chordin-like protein 1 [Coturnix japonica], Coturnix_japonica_XP_015708156.1 PREDICTED_ chordin-like protein 2 isoform X1 [Coturnix japonica]	Xenia_spec_Xe_014721_T1 Xe_014721_T1 Xe_014721
OG0000093	Coturnix_japonica_XP_015729012.1 leukocyte cysteine proteinase inhibitor 1-like [Coturnix japonica], Coturnix_japonica_XP_015729006.1 cystatin-B-like [Coturnix japonica]	Xenia_spec_Xe_018469_T1 Xe_018469_T1 Xe_018469, Xenia_spec_Xe_020077_T1 Xe_020077_T1 Xe_020077, Xenia_spec_Xe_018297_T1 Xe_018297_T1 Xe_018297, Xenia_spec_Xe_018334_T1 Xe_018334_T1 Xe_018334, Xenia_spec_Xe_018335_T1 Xe_018335_T1 Xe_018335, Xenia_spec_Xe_018263_T1 Xe_018263_T1 Xe_018263
OG0000102	Coturnix_japonica_XP_015720830.1 fibulin-5 [Coturnix japonica], Coturnix_japonica_XP_015712283.1 EGF-containing fibulin-like extracellular matrix protein 1 isoform X1 [Coturnix japonica]	Xenia_spec_Xe_015831_T1 Xe_015831_T1 Xe_015831
OG0000114	Coturnix_japonica_XP_015719754.1 host cell factor 2 isoform X2 [Coturnix japonica]	Xenia_spec_Xe_015898_T1 Xe_015898_T1 Xe_015898
OG0000150	Coturnix_japonica_XP_015725032.1 pappalysin-2 isoform X1 [Coturnix japonica], Coturnix_japonica_XP_015734233.1 PREDICTED_ pappalysin-1 isoform X2 [Coturnix japonica]	Xenia_spec_Xe_007831_T1 Xe_007831_T1 Xe_007831
OG0000182	Coturnix_japonica_XP_015732559.1 von Willebrand factor A domain-containing protein 3A [Coturnix japonica]	Xenia_spec_Xe_018472_T1 Xe_018472_T1 Xe_018472, Xenia_spec_Xe_018473_T1 Xe_018473_T1 Xe_018473
OG0000200	Coturnix_japonica_XP_015706466.1 PREDICTED_ von Willebrand factor A domain-containing protein 3B isoform X4 [Coturnix japonica]	Xenia_spec_Xe_015525_T1 Xe_015525_T1 Xe_015525
OG0000268	Coturnix_japonica_XP_015735107.1 cytokine receptor-like factor 3 [Coturnix japonica]	Xenia_spec_Xe_018600_T1 Xe_018600_T1 Xe_018600
OG0000463	Coturnix_japonica_XP_015711086.1 wnt inhibitory factor 1 [Coturnix japonica]	Xenia_spec_Xe_010628_T1 Xe_010628_T1 Xe_010628
