Orthogroup	Porifera_Demospongiae_Amphimedon_queenslandica	Chordata_Amphioxiformes_Branchiostoma_belcheri
OG0000032	Amphimedon_queenslandica_tr_A0A1X7TCP0_A0A1X7TCP0_AMPQE tr_A0A1X7TCP0_A0A1X7TCP0_AMPQE Uncharacterized protein OS=Amphimedon queenslandica OX=400682 PE=4 SV=1, Amphimedon_queenslandica_tr_A0A1X7T0X2_A0A1X7T0X2_AMPQE tr_A0A1X7T0X2_A0A1X7T0X2_AMPQE Uncharacterized protein OS=Amphimedon queenslandica OX=400682 PE=4 SV=1	Branchiostoma_belcheri_tr_A0A6P4ZQZ8_A0A6P4ZQZ8_BRABE tr|A0A6P4ZQZ8|A0A6P4ZQZ8_BRABE Uncharacterized protein LOC109481186 OS=Branchiostoma belcheri OX=7741 GN=LOC109481186 PE=4 SV=1, Branchiostoma_belcheri_tr_A0A6P5ABS5_A0A6P5ABS5_BRABE tr|A0A6P5ABS5|A0A6P5ABS5_BRABE Collagen alpha-2_IV_ chain-like OS=Branchiostoma belcheri OX=7741 GN=LOC109481184 PE=4 SV=1, Branchiostoma_belcheri_tr_A0A6P5ABP4_A0A6P5ABP4_BRABE tr|A0A6P5ABP4|A0A6P5ABP4_BRABE Short-chain collagen C4-like OS=Branchiostoma belcheri OX=7741 GN=LOC109481146 PE=4 SV=1, Branchiostoma_belcheri_tr_A0A6P5A679_A0A6P5A679_BRABE tr|A0A6P5A679|A0A6P5A679_BRABE Collagen alpha-1_XVII_ chain-like OS=Branchiostoma belcheri OX=7741 GN=LOC109483227 PE=4 SV=1, Branchiostoma_belcheri_tr_A0A6P4ZR05_A0A6P4ZR05_BRABE tr|A0A6P4ZR05|A0A6P4ZR05_BRABE Short-chain collagen C4-like OS=Branchiostoma belcheri OX=7741 GN=LOC109484721 PE=4 SV=1, Branchiostoma_belcheri_tr_A0A6P5ANP0_A0A6P5ANP0_BRABE tr|A0A6P5ANP0|A0A6P5ANP0_BRABE Short-chain collagen C4-like OS=Branchiostoma belcheri OX=7741 GN=LOC109484722 PE=4 SV=1, Branchiostoma_belcheri_tr_A0A6P4ZT43_A0A6P4ZT43_BRABE tr|A0A6P4ZT43|A0A6P4ZT43_BRABE Short-chain collagen C4-like OS=Branchiostoma belcheri OX=7741 GN=LOC109481856 PE=4 SV=1, Branchiostoma_belcheri_tr_A0A6P4Y9S8_A0A6P4Y9S8_BRABE tr|A0A6P4Y9S8|A0A6P4Y9S8_BRABE Short-chain collagen C4-like OS=Branchiostoma belcheri OX=7741 GN=LOC109461595 PE=4 SV=1, Branchiostoma_belcheri_tr_A0A6P5ADR7_A0A6P5ADR7_BRABE tr|A0A6P5ADR7|A0A6P5ADR7_BRABE Short-chain collagen C4-like OS=Branchiostoma belcheri OX=7741 GN=LOC109488156 PE=4 SV=1, Branchiostoma_belcheri_tr_A0A6P4ZRV9_A0A6P4ZRV9_BRABE tr|A0A6P4ZRV9|A0A6P4ZRV9_BRABE Short-chain collagen C4-like OS=Branchiostoma belcheri OX=7741 GN=LOC109477064 PE=4 SV=1, Branchiostoma_belcheri_tr_A0A6P5AR35_A0A6P5AR35_BRABE tr|A0A6P5AR35|A0A6P5AR35_BRABE Collagen alpha-1_XXIII_ chain-like OS=Branchiostoma belcheri OX=7741 GN=LOC109485354 PE=4 SV=1, Branchiostoma_belcheri_tr_A0A6P5AN33_A0A6P5AN33_BRABE tr|A0A6P5AN33|A0A6P5AN33_BRABE Collagen alpha-2_IV_ chain-like OS=Branchiostoma belcheri OX=7741 GN=LOC109485355 PE=4 SV=1, Branchiostoma_belcheri_tr_A0A6P5A7Z2_A0A6P5A7Z2_BRABE tr|A0A6P5A7Z2|A0A6P5A7Z2_BRABE Short-chain collagen C4-like OS=Branchiostoma belcheri OX=7741 GN=LOC109480125 PE=4 SV=1, Branchiostoma_belcheri_tr_A0A6P4XZ00_A0A6P4XZ00_BRABE tr|A0A6P4XZ00|A0A6P4XZ00_BRABE Collagen alpha-2_I_ chain-like isoform X2 OS=Branchiostoma belcheri OX=7741 GN=LOC109464738 PE=4 SV=1, Branchiostoma_belcheri_tr_A0A6P4YF32_A0A6P4YF32_BRABE tr|A0A6P4YF32|A0A6P4YF32_BRABE Collagen alpha-1_II_ chain-like isoform X1 OS=Branchiostoma belcheri OX=7741 GN=LOC109464738 PE=4 SV=1, Branchiostoma_belcheri_tr_A0A6P5AL21_A0A6P5AL21_BRABE tr|A0A6P5AL21|A0A6P5AL21_BRABE LOW QUALITY PROTEIN_ short-chain collagen C4-like OS=Branchiostoma belcheri OX=7741 GN=LOC109484865 PE=4 SV=1, Branchiostoma_belcheri_tr_A0A6P4ZRE9_A0A6P4ZRE9_BRABE tr|A0A6P4ZRE9|A0A6P4ZRE9_BRABE Short-chain collagen C4-like OS=Branchiostoma belcheri OX=7741 GN=LOC109484864 PE=4 SV=1, Branchiostoma_belcheri_tr_A0A6P4YJL5_A0A6P4YJL5_BRABE tr|A0A6P4YJL5|A0A6P4YJL5_BRABE Short-chain collagen C4-like isoform X5 OS=Branchiostoma belcheri OX=7741 GN=LOC109464683 PE=4 SV=1, Branchiostoma_belcheri_tr_A0A6P4YEV7_A0A6P4YEV7_BRABE tr|A0A6P4YEV7|A0A6P4YEV7_BRABE Short-chain collagen C4-like isoform X6 OS=Branchiostoma belcheri OX=7741 GN=LOC109464683 PE=4 SV=1, Branchiostoma_belcheri_tr_A0A6P5A9H2_A0A6P5A9H2_BRABE tr|A0A6P5A9H2|A0A6P5A9H2_BRABE Short-chain collagen C4-like isoform X12 OS=Branchiostoma belcheri OX=7741 GN=LOC109484085 PE=4 SV=1, Branchiostoma_belcheri_tr_A0A6P4ZNV8_A0A6P4ZNV8_BRABE tr|A0A6P4ZNV8|A0A6P4ZNV8_BRABE Short-chain collagen C4-like isoform X9 OS=Branchiostoma belcheri OX=7741 GN=LOC109484085 PE=4 SV=1, Branchiostoma_belcheri_tr_A0A6P5A0T8_A0A6P5A0T8_BRABE tr|A0A6P5A0T8|A0A6P5A0T8_BRABE Short-chain collagen C4-like isoform X11 OS=Branchiostoma belcheri OX=7741 GN=LOC109484085 PE=4 SV=1, Branchiostoma_belcheri_tr_A0A6P5A9G8_A0A6P5A9G8_BRABE tr|A0A6P5A9G8|A0A6P5A9G8_BRABE Short-chain collagen C4-like isoform X8 OS=Branchiostoma belcheri OX=7741 GN=LOC109484085 PE=4 SV=1, Branchiostoma_belcheri_tr_A0A6P5AI35_A0A6P5AI35_BRABE tr|A0A6P5AI35|A0A6P5AI35_BRABE Short-chain collagen C4-like isoform X6 OS=Branchiostoma belcheri OX=7741 GN=LOC109484085 PE=4 SV=1, Branchiostoma_belcheri_tr_A0A6P5A0T3_A0A6P5A0T3_BRABE tr|A0A6P5A0T3|A0A6P5A0T3_BRABE Short-chain collagen C4-like isoform X7 OS=Branchiostoma belcheri OX=7741 GN=LOC109484085 PE=4 SV=1, Branchiostoma_belcheri_tr_A0A6P5AI41_A0A6P5AI41_BRABE tr|A0A6P5AI41|A0A6P5AI41_BRABE Short-chain collagen C4-like isoform X10 OS=Branchiostoma belcheri OX=7741 GN=LOC109484085 PE=4 SV=1, Branchiostoma_belcheri_tr_A0A6P5AD26_A0A6P5AD26_BRABE tr|A0A6P5AD26|A0A6P5AD26_BRABE Short-chain collagen C4-like OS=Branchiostoma belcheri OX=7741 GN=LOC109485195 PE=4 SV=1, Branchiostoma_belcheri_tr_A0A6P4Z2P8_A0A6P4Z2P8_BRABE tr|A0A6P4Z2P8|A0A6P4Z2P8_BRABE Collagen alpha-2_I_ chain-like OS=Branchiostoma belcheri OX=7741 GN=LOC109472791 PE=4 SV=1, Branchiostoma_belcheri_tr_A0A6P4ZRF4_A0A6P4ZRF4_BRABE tr|A0A6P4ZRF4|A0A6P4ZRF4_BRABE Short-chain collagen C4-like OS=Branchiostoma belcheri OX=7741 GN=LOC109484868 PE=4 SV=1, Branchiostoma_belcheri_tr_A0A6P5AC09_A0A6P5AC09_BRABE tr|A0A6P5AC09|A0A6P5AC09_BRABE Uncharacterized protein LOC109484867 OS=Branchiostoma belcheri OX=7741 GN=LOC109484867 PE=4 SV=1, Branchiostoma_belcheri_tr_A0A6P5AI30_A0A6P5AI30_BRABE tr|A0A6P5AI30|A0A6P5AI30_BRABE Collagen alpha-1_XVI_ chain-like isoform X1 OS=Branchiostoma belcheri OX=7741 GN=LOC109484085 PE=4 SV=1, Branchiostoma_belcheri_tr_A0A6P5A0S8_A0A6P5A0S8_BRABE tr|A0A6P5A0S8|A0A6P5A0S8_BRABE Collagen alpha-1_XVI_ chain-like isoform X2 OS=Branchiostoma belcheri OX=7741 GN=LOC109484085 PE=4 SV=1, Branchiostoma_belcheri_tr_A0A6P5A9G3_A0A6P5A9G3_BRABE tr|A0A6P5A9G3|A0A6P5A9G3_BRABE Short-chain collagen C4-like isoform X3 OS=Branchiostoma belcheri OX=7741 GN=LOC109484085 PE=4 SV=1, Branchiostoma_belcheri_tr_A0A6P5ALE3_A0A6P5ALE3_BRABE tr|A0A6P5ALE3|A0A6P5ALE3_BRABE Short-chain collagen C4-like OS=Branchiostoma belcheri OX=7741 GN=LOC109484084 PE=4 SV=1, Branchiostoma_belcheri_tr_A0A6P4XYR3_A0A6P4XYR3_BRABE tr|A0A6P4XYR3|A0A6P4XYR3_BRABE Short-chain collagen C4-like isoform X7 OS=Branchiostoma belcheri OX=7741 GN=LOC109464683 PE=4 SV=1, Branchiostoma_belcheri_tr_A0A6P5ALE6_A0A6P5ALE6_BRABE tr|A0A6P5ALE6|A0A6P5ALE6_BRABE Short-chain collagen C4-like isoform X5 OS=Branchiostoma belcheri OX=7741 GN=LOC109484085 PE=4 SV=1, Branchiostoma_belcheri_tr_A0A6P4ZNV4_A0A6P4ZNV4_BRABE tr|A0A6P4ZNV4|A0A6P4ZNV4_BRABE Uncharacterized protein LOC109484085 isoform X4 OS=Branchiostoma belcheri OX=7741 GN=LOC109484085 PE=4 SV=1, Branchiostoma_belcheri_tr_A0A6P4YEV3_A0A6P4YEV3_BRABE tr|A0A6P4YEV3|A0A6P4YEV3_BRABE Uncharacterized protein LOC109464683 isoform X1 OS=Branchiostoma belcheri OX=7741 GN=LOC109464683 PE=4 SV=1, Branchiostoma_belcheri_tr_A0A6P4Y4G6_A0A6P4Y4G6_BRABE tr|A0A6P4Y4G6|A0A6P4Y4G6_BRABE Uncharacterized protein LOC109464683 isoform X3 OS=Branchiostoma belcheri OX=7741 GN=LOC109464683 PE=4 SV=1, Branchiostoma_belcheri_tr_A0A6P4XYQ9_A0A6P4XYQ9_BRABE tr|A0A6P4XYQ9|A0A6P4XYQ9_BRABE Uncharacterized protein LOC109464683 isoform X2 OS=Branchiostoma belcheri OX=7741 GN=LOC109464683 PE=4 SV=1, Branchiostoma_belcheri_tr_A0A6P4XL43_A0A6P4XL43_BRABE tr|A0A6P4XL43|A0A6P4XL43_BRABE Uncharacterized protein LOC109464683 isoform X4 OS=Branchiostoma belcheri OX=7741 GN=LOC109464683 PE=4 SV=1, Branchiostoma_belcheri_tr_A0A6P4XL47_A0A6P4XL47_BRABE tr|A0A6P4XL47|A0A6P4XL47_BRABE Cuticle collagen dpy-2-like isoform X1 OS=Branchiostoma belcheri OX=7741 GN=LOC109464684 PE=4 SV=1, Branchiostoma_belcheri_tr_A0A6P4YJM0_A0A6P4YJM0_BRABE tr|A0A6P4YJM0|A0A6P4YJM0_BRABE Cuticle collagen dpy-2-like isoform X2 OS=Branchiostoma belcheri OX=7741 GN=LOC109464684 PE=4 SV=1, Branchiostoma_belcheri_tr_A0A6P5A329_A0A6P5A329_BRABE tr|A0A6P5A329|A0A6P5A329_BRABE Cuticle collagen 91 OS=Branchiostoma belcheri OX=7741 GN=LOC109484866 PE=4 SV=1
OG0000034	Amphimedon_queenslandica_tr_A0A1X7UWV8_A0A1X7UWV8_AMPQE tr_A0A1X7UWV8_A0A1X7UWV8_AMPQE Uncharacterized protein OS=Amphimedon queenslandica OX=400682 GN=109581856 PE=4 SV=1, Amphimedon_queenslandica_tr_A0A1X7VPN4_A0A1X7VPN4_AMPQE tr_A0A1X7VPN4_A0A1X7VPN4_AMPQE Laminin EGF-like domain-containing protein OS=Amphimedon queenslandica OX=400682 PE=4 SV=1	Branchiostoma_belcheri_tr_A0A6P4ZEX6_A0A6P4ZEX6_BRABE tr|A0A6P4ZEX6|A0A6P4ZEX6_BRABE Attractin-like protein 1 OS=Branchiostoma belcheri OX=7741 GN=LOC109478279 PE=4 SV=1
OG0000036	Amphimedon_queenslandica_tr_A0A1X7V656_A0A1X7V656_AMPQE tr_A0A1X7V656_A0A1X7V656_AMPQE Uncharacterized protein OS=Amphimedon queenslandica OX=400682 PE=4 SV=1, Amphimedon_queenslandica_tr_A0A1X7UCB5_A0A1X7UCB5_AMPQE tr_A0A1X7UCB5_A0A1X7UCB5_AMPQE Uncharacterized protein OS=Amphimedon queenslandica OX=400682 PE=4 SV=1, Amphimedon_queenslandica_tr_A0A1X7TBI3_A0A1X7TBI3_AMPQE tr_A0A1X7TBI3_A0A1X7TBI3_AMPQE Uncharacterized protein OS=Amphimedon queenslandica OX=400682 PE=4 SV=1, Amphimedon_queenslandica_tr_A0A1X7V7J8_A0A1X7V7J8_AMPQE tr_A0A1X7V7J8_A0A1X7V7J8_AMPQE Uncharacterized protein OS=Amphimedon queenslandica OX=400682 GN=105312253 PE=4 SV=1, Amphimedon_queenslandica_tr_A0A1X7VV77_A0A1X7VV77_AMPQE tr_A0A1X7VV77_A0A1X7VV77_AMPQE Uncharacterized protein OS=Amphimedon queenslandica OX=400682 GN=109580237 PE=4 SV=1, Amphimedon_queenslandica_tr_A0A1X7TT31_A0A1X7TT31_AMPQE tr_A0A1X7TT31_A0A1X7TT31_AMPQE Uncharacterized protein OS=Amphimedon queenslandica OX=400682 PE=4 SV=1, Amphimedon_queenslandica_tr_A0A1X7TTE5_A0A1X7TTE5_AMPQE tr_A0A1X7TTE5_A0A1X7TTE5_AMPQE Uncharacterized protein OS=Amphimedon queenslandica OX=400682 PE=4 SV=1, Amphimedon_queenslandica_tr_A0A1X7TSV3_A0A1X7TSV3_AMPQE tr_A0A1X7TSV3_A0A1X7TSV3_AMPQE Uncharacterized protein OS=Amphimedon queenslandica OX=400682 PE=4 SV=1, Amphimedon_queenslandica_tr_A0A1X7VJK4_A0A1X7VJK4_AMPQE tr_A0A1X7VJK4_A0A1X7VJK4_AMPQE Uncharacterized protein OS=Amphimedon queenslandica OX=400682 PE=4 SV=1, Amphimedon_queenslandica_tr_A0A1X7T0G0_A0A1X7T0G0_AMPQE tr_A0A1X7T0G0_A0A1X7T0G0_AMPQE Uncharacterized protein OS=Amphimedon queenslandica OX=400682 PE=4 SV=1, Amphimedon_queenslandica_tr_A0A1X7SGQ6_A0A1X7SGQ6_AMPQE tr_A0A1X7SGQ6_A0A1X7SGQ6_AMPQE Uncharacterized protein OS=Amphimedon queenslandica OX=400682 PE=4 SV=1, Amphimedon_queenslandica_tr_A0A1X7T4Q7_A0A1X7T4Q7_AMPQE tr_A0A1X7T4Q7_A0A1X7T4Q7_AMPQE Uncharacterized protein OS=Amphimedon queenslandica OX=400682 PE=4 SV=1, Amphimedon_queenslandica_tr_A0A1X7U143_A0A1X7U143_AMPQE tr_A0A1X7U143_A0A1X7U143_AMPQE Uncharacterized protein OS=Amphimedon queenslandica OX=400682 PE=4 SV=1, Amphimedon_queenslandica_tr_A0A1X7SW10_A0A1X7SW10_AMPQE tr_A0A1X7SW10_A0A1X7SW10_AMPQE Uncharacterized protein OS=Amphimedon queenslandica OX=400682 PE=4 SV=1, Amphimedon_queenslandica_tr_A0A1X7UBP4_A0A1X7UBP4_AMPQE tr_A0A1X7UBP4_A0A1X7UBP4_AMPQE Uncharacterized protein OS=Amphimedon queenslandica OX=400682 PE=4 SV=1, Amphimedon_queenslandica_tr_A0A1X7T5Z8_A0A1X7T5Z8_AMPQE tr_A0A1X7T5Z8_A0A1X7T5Z8_AMPQE Uncharacterized protein OS=Amphimedon queenslandica OX=400682 PE=4 SV=1	Branchiostoma_belcheri_tr_A0A6P5AH82_A0A6P5AH82_BRABE tr|A0A6P5AH82|A0A6P5AH82_BRABE Uncharacterized protein LOC109483909 OS=Branchiostoma belcheri OX=7741 GN=LOC109483909 PE=4 SV=1
OG0000038	Amphimedon_queenslandica_tr_A0A1X7VQI5_A0A1X7VQI5_AMPQE tr_A0A1X7VQI5_A0A1X7VQI5_AMPQE TNF_2 domain-containing protein OS=Amphimedon queenslandica OX=400682 GN=109585650 PE=3 SV=1	Branchiostoma_belcheri_tr_A0A6P4XSF3_A0A6P4XSF3_BRABE tr|A0A6P4XSF3|A0A6P4XSF3_BRABE Uncharacterized protein LOC109461674 OS=Branchiostoma belcheri OX=7741 GN=LOC109461674 PE=3 SV=1, Branchiostoma_belcheri_tr_A0A6P5AF06_A0A6P5AF06_BRABE tr|A0A6P5AF06|A0A6P5AF06_BRABE Ectodysplasin-A-like OS=Branchiostoma belcheri OX=7741 GN=LOC109485699 PE=3 SV=1, Branchiostoma_belcheri_tr_A0A6P5A668_A0A6P5A668_BRABE tr|A0A6P5A668|A0A6P5A668_BRABE Uncharacterized protein LOC109485758 OS=Branchiostoma belcheri OX=7741 GN=LOC109485758 PE=3 SV=1, Branchiostoma_belcheri_tr_A0A6P5A6A4_A0A6P5A6A4_BRABE tr|A0A6P5A6A4|A0A6P5A6A4_BRABE Uncharacterized protein LOC109485795 OS=Branchiostoma belcheri OX=7741 GN=LOC109485795 PE=3 SV=1
OG0000039	Amphimedon_queenslandica_tr_A0A1X7VS50_A0A1X7VS50_AMPQE tr_A0A1X7VS50_A0A1X7VS50_AMPQE Sushi domain-containing protein OS=Amphimedon queenslandica OX=400682 PE=3 SV=1	Branchiostoma_belcheri_tr_A0A6P4YLZ8_A0A6P4YLZ8_BRABE tr|A0A6P4YLZ8|A0A6P4YLZ8_BRABE Uncharacterized protein LOC109465392 OS=Branchiostoma belcheri OX=7741 GN=LOC109465392 PE=4 SV=1, Branchiostoma_belcheri_tr_A0A6P4XWB9_A0A6P4XWB9_BRABE tr|A0A6P4XWB9|A0A6P4XWB9_BRABE Uncharacterized protein LOC109462711 OS=Branchiostoma belcheri OX=7741 GN=LOC109462711 PE=4 SV=1, Branchiostoma_belcheri_tr_A0A6P4Z8W7_A0A6P4Z8W7_BRABE tr|A0A6P4Z8W7|A0A6P4Z8W7_BRABE Uncharacterized protein LOC109476570 OS=Branchiostoma belcheri OX=7741 GN=LOC109476570 PE=4 SV=1, Branchiostoma_belcheri_tr_A0A6P4ZQ76_A0A6P4ZQ76_BRABE tr|A0A6P4ZQ76|A0A6P4ZQ76_BRABE Uncharacterized protein LOC109476568 OS=Branchiostoma belcheri OX=7741 GN=LOC109476568 PE=4 SV=1, Branchiostoma_belcheri_tr_A0A6P4YIH1_A0A6P4YIH1_BRABE tr|A0A6P4YIH1|A0A6P4YIH1_BRABE Uncharacterized protein LOC109464304 OS=Branchiostoma belcheri OX=7741 GN=LOC109464304 PE=4 SV=1, Branchiostoma_belcheri_tr_A0A6P4YKW6_A0A6P4YKW6_BRABE tr|A0A6P4YKW6|A0A6P4YKW6_BRABE Uncharacterized protein LOC109465072 OS=Branchiostoma belcheri OX=7741 GN=LOC109465072 PE=4 SV=1, Branchiostoma_belcheri_tr_A0A6P4YG64_A0A6P4YG64_BRABE tr|A0A6P4YG64|A0A6P4YG64_BRABE Uncharacterized protein LOC109469374 OS=Branchiostoma belcheri OX=7741 GN=LOC109469374 PE=4 SV=1, Branchiostoma_belcheri_tr_A0A6P5AI76_A0A6P5AI76_BRABE tr|A0A6P5AI76|A0A6P5AI76_BRABE Uncharacterized protein LOC109484117 OS=Branchiostoma belcheri OX=7741 GN=LOC109484117 PE=4 SV=1, Branchiostoma_belcheri_tr_A0A6P5AFZ5_A0A6P5AFZ5_BRABE tr|A0A6P5AFZ5|A0A6P5AFZ5_BRABE Uncharacterized protein LOC109483572 OS=Branchiostoma belcheri OX=7741 GN=LOC109483572 PE=4 SV=1, Branchiostoma_belcheri_tr_A0A6P4ZLW1_A0A6P4ZLW1_BRABE tr|A0A6P4ZLW1|A0A6P4ZLW1_BRABE Uncharacterized protein LOC109483586 OS=Branchiostoma belcheri OX=7741 GN=LOC109483586 PE=4 SV=1
OG0000040	Amphimedon_queenslandica_tr_A0A1X7TVU0_A0A1X7TVU0_AMPQE tr_A0A1X7TVU0_A0A1X7TVU0_AMPQE Uncharacterized protein OS=Amphimedon queenslandica OX=400682 PE=4 SV=1	Branchiostoma_belcheri_tr_A0A6P5AWE2_A0A6P5AWE2_BRABE tr|A0A6P5AWE2|A0A6P5AWE2_BRABE Kazal-type serine protease inhibitor domain-containing protein 1-like OS=Branchiostoma belcheri OX=7741 GN=LOC109486825 PE=4 SV=1, Branchiostoma_belcheri_tr_A0A6P4XY87_A0A6P4XY87_BRABE tr|A0A6P4XY87|A0A6P4XY87_BRABE Uncharacterized protein LOC109463154 OS=Branchiostoma belcheri OX=7741 GN=LOC109463154 PE=4 SV=1, Branchiostoma_belcheri_tr_A0A6P5AWF2_A0A6P5AWF2_BRABE tr|A0A6P5AWF2|A0A6P5AWF2_BRABE Insulin-like growth factor-binding protein 7 OS=Branchiostoma belcheri OX=7741 GN=LOC109486832 PE=4 SV=1
OG0000041	Amphimedon_queenslandica_tr_A0A1X7VQ95_A0A1X7VQ95_AMPQE tr_A0A1X7VQ95_A0A1X7VQ95_AMPQE Uncharacterized protein OS=Amphimedon queenslandica OX=400682 GN=100636438 PE=4 SV=1	Branchiostoma_belcheri_tr_A0A6P4ZKT8_A0A6P4ZKT8_BRABE tr|A0A6P4ZKT8|A0A6P4ZKT8_BRABE von Willebrand factor A domain-containing protein 5A-like OS=Branchiostoma belcheri OX=7741 GN=LOC109474402 PE=4 SV=1, Branchiostoma_belcheri_tr_A0A6P4Z940_A0A6P4Z940_BRABE tr|A0A6P4Z940|A0A6P4Z940_BRABE von Willebrand factor A domain-containing protein 5A-like OS=Branchiostoma belcheri OX=7741 GN=LOC109474530 PE=4 SV=1
OG0000041	Amphimedon_queenslandica_tr_A0A1X7VG51_A0A1X7VG51_AMPQE tr_A0A1X7VG51_A0A1X7VG51_AMPQE VWFA domain-containing protein OS=Amphimedon queenslandica OX=400682 PE=4 SV=1	Branchiostoma_belcheri_tr_A0A6P4Z2H8_A0A6P4Z2H8_BRABE tr|A0A6P4Z2H8|A0A6P4Z2H8_BRABE von Willebrand factor A domain-containing protein 5B1-like OS=Branchiostoma belcheri OX=7741 GN=LOC109472723 PE=4 SV=1, Branchiostoma_belcheri_tr_A0A6P4Z1T4_A0A6P4Z1T4_BRABE tr|A0A6P4Z1T4|A0A6P4Z1T4_BRABE von Willebrand factor A domain-containing protein 5B1-like OS=Branchiostoma belcheri OX=7741 GN=LOC109472557 PE=4 SV=1
OG0000041	Amphimedon_queenslandica_tr_A0A1X7V1S2_A0A1X7V1S2_AMPQE tr_A0A1X7V1S2_A0A1X7V1S2_AMPQE Poly [ADP-ribose] polymerase OS=Amphimedon queenslandica OX=400682 GN=100633591 PE=3 SV=1	Branchiostoma_belcheri_tr_A0A6P5A170_A0A6P5A170_BRABE tr|A0A6P5A170|A0A6P5A170_BRABE Poly [ADP-ribose] polymerase OS=Branchiostoma belcheri OX=7741 GN=LOC109479438 PE=3 SV=1
OG0000048	Amphimedon_queenslandica_tr_A0A1X7UU24_A0A1X7UU24_AMPQE tr_A0A1X7UU24_A0A1X7UU24_AMPQE Uncharacterized protein OS=Amphimedon queenslandica OX=400682 PE=4 SV=1	Branchiostoma_belcheri_tr_A0A6P4YTP3_A0A6P4YTP3_BRABE tr|A0A6P4YTP3|A0A6P4YTP3_BRABE Osteomodulin-like OS=Branchiostoma belcheri OX=7741 GN=LOC109468193 PE=4 SV=1
OG0000049	Amphimedon_queenslandica_tr_A0A1X7VVB6_A0A1X7VVB6_AMPQE tr_A0A1X7VVB6_A0A1X7VVB6_AMPQE Sema domain-containing protein OS=Amphimedon queenslandica OX=400682 GN=100641578 PE=3 SV=1, Amphimedon_queenslandica_tr_A0A1X7SV56_A0A1X7SV56_AMPQE tr_A0A1X7SV56_A0A1X7SV56_AMPQE Uncharacterized protein OS=Amphimedon queenslandica OX=400682 PE=4 SV=1, Amphimedon_queenslandica_tr_A0A1X7T417_A0A1X7T417_AMPQE tr_A0A1X7T417_A0A1X7T417_AMPQE Sema domain-containing protein OS=Amphimedon queenslandica OX=400682 PE=4 SV=1, Amphimedon_queenslandica_tr_A0A1X7UU11_A0A1X7UU11_AMPQE tr_A0A1X7UU11_A0A1X7UU11_AMPQE Uncharacterized protein OS=Amphimedon queenslandica OX=400682 PE=4 SV=1, Amphimedon_queenslandica_tr_A0A1X7VVB4_A0A1X7VVB4_AMPQE tr_A0A1X7VVB4_A0A1X7VVB4_AMPQE Uncharacterized protein OS=Amphimedon queenslandica OX=400682 GN=100641705 PE=3 SV=1, Amphimedon_queenslandica_tr_A0A1X7URZ8_A0A1X7URZ8_AMPQE tr_A0A1X7URZ8_A0A1X7URZ8_AMPQE Uncharacterized protein OS=Amphimedon queenslandica OX=400682 PE=4 SV=1, Amphimedon_queenslandica_tr_A0A1X7URK3_A0A1X7URK3_AMPQE tr_A0A1X7URK3_A0A1X7URK3_AMPQE Sema domain-containing protein OS=Amphimedon queenslandica OX=400682 PE=4 SV=1	Branchiostoma_belcheri_tr_A0A6P4ZHF9_A0A6P4ZHF9_BRABE tr|A0A6P4ZHF9|A0A6P4ZHF9_BRABE Plexin-A4-like OS=Branchiostoma belcheri OX=7741 GN=LOC109476886 PE=3 SV=1, Branchiostoma_belcheri_tr_A0A6P4ZWV4_A0A6P4ZWV4_BRABE tr|A0A6P4ZWV4|A0A6P4ZWV4_BRABE Plexin-A1-like isoform X2 OS=Branchiostoma belcheri OX=7741 GN=LOC109477341 PE=3 SV=1, Branchiostoma_belcheri_tr_A0A6P4YXM3_A0A6P4YXM3_BRABE tr|A0A6P4YXM3|A0A6P4YXM3_BRABE Plexin-A1-like isoform X1 OS=Branchiostoma belcheri OX=7741 GN=LOC109477341 PE=3 SV=1, Branchiostoma_belcheri_tr_A0A6P4ZT25_A0A6P4ZT25_BRABE tr|A0A6P4ZT25|A0A6P4ZT25_BRABE Plexin-A1-like isoform X3 OS=Branchiostoma belcheri OX=7741 GN=LOC109477341 PE=3 SV=1, Branchiostoma_belcheri_tr_A0A6P4ZBS9_A0A6P4ZBS9_BRABE tr|A0A6P4ZBS9|A0A6P4ZBS9_BRABE Plexin-A1-like isoform X4 OS=Branchiostoma belcheri OX=7741 GN=LOC109477341 PE=3 SV=1
OG0000051	Amphimedon_queenslandica_tr_A0A1X7V466_A0A1X7V466_AMPQE tr_A0A1X7V466_A0A1X7V466_AMPQE VWFA domain-containing protein OS=Amphimedon queenslandica OX=400682 GN=109581210 PE=4 SV=1	Branchiostoma_belcheri_tr_A0A6P5AV53_A0A6P5AV53_BRABE tr|A0A6P5AV53|A0A6P5AV53_BRABE VWFA and cache domain-containing protein CG16868-like OS=Branchiostoma belcheri OX=7741 GN=LOC109486447 PE=4 SV=1, Branchiostoma_belcheri_tr_A0A6P4ZXK3_A0A6P4ZXK3_BRABE tr|A0A6P4ZXK3|A0A6P4ZXK3_BRABE LOW QUALITY PROTEIN_ uncharacterized protein LOC109486509 OS=Branchiostoma belcheri OX=7741 GN=LOC109486509 PE=4 SV=1, Branchiostoma_belcheri_tr_A0A6P5A8G9_A0A6P5A8G9_BRABE tr|A0A6P5A8G9|A0A6P5A8G9_BRABE VWFA and cache domain-containing protein 1-like OS=Branchiostoma belcheri OX=7741 GN=LOC109486507 PE=4 SV=1, Branchiostoma_belcheri_tr_A0A6P5A744_A0A6P5A744_BRABE tr|A0A6P5A744|A0A6P5A744_BRABE VWFA and cache domain-containing protein 1-like isoform X1 OS=Branchiostoma belcheri OX=7741 GN=LOC109486105 PE=3 SV=1, Branchiostoma_belcheri_tr_A0A6P5AG98_A0A6P5AG98_BRABE tr|A0A6P5AG98|A0A6P5AG98_BRABE VWFA and cache domain-containing protein 1-like isoform X2 OS=Branchiostoma belcheri OX=7741 GN=LOC109486105 PE=3 SV=1, Branchiostoma_belcheri_tr_A0A6P4Y686_A0A6P4Y686_BRABE tr|A0A6P4Y686|A0A6P4Y686_BRABE Uncharacterized protein LOC109465163 OS=Branchiostoma belcheri OX=7741 GN=LOC109465163 PE=3 SV=1, Branchiostoma_belcheri_tr_A0A6P4XVK7_A0A6P4XVK7_BRABE tr|A0A6P4XVK7|A0A6P4XVK7_BRABE Voltage-dependent calcium channel subunit alpha-2/delta-4-like OS=Branchiostoma belcheri OX=7741 GN=LOC109463725 PE=4 SV=1
OG0000054	Amphimedon_queenslandica_tr_A0A1X7TU95_A0A1X7TU95_AMPQE tr_A0A1X7TU95_A0A1X7TU95_AMPQE Uncharacterized protein OS=Amphimedon queenslandica OX=400682 PE=4 SV=1, Amphimedon_queenslandica_tr_A0A1X7STD8_A0A1X7STD8_AMPQE tr_A0A1X7STD8_A0A1X7STD8_AMPQE Uncharacterized protein OS=Amphimedon queenslandica OX=400682 PE=4 SV=1	Branchiostoma_belcheri_tr_A0A6P5A7J1_A0A6P5A7J1_BRABE tr|A0A6P5A7J1|A0A6P5A7J1_BRABE Leucine-rich repeat-containing protein 7-like isoform X2 OS=Branchiostoma belcheri OX=7741 GN=LOC109486248 PE=4 SV=1, Branchiostoma_belcheri_tr_A0A6P5AR32_A0A6P5AR32_BRABE tr|A0A6P5AR32|A0A6P5AR32_BRABE Uncharacterized protein LOC109486248 isoform X1 OS=Branchiostoma belcheri OX=7741 GN=LOC109486248 PE=4 SV=1
OG0000054	Amphimedon_queenslandica_tr_A0A1X7UT64_A0A1X7UT64_AMPQE tr_A0A1X7UT64_A0A1X7UT64_AMPQE Uncharacterized protein OS=Amphimedon queenslandica OX=400682 GN=100636327 PE=4 SV=1	Branchiostoma_belcheri_tr_A0A6P4Z7T6_A0A6P4Z7T6_BRABE tr|A0A6P4Z7T6|A0A6P4Z7T6_BRABE Protein scribble homolog OS=Branchiostoma belcheri OX=7741 GN=LOC109476265 PE=4 SV=1
OG0000056	Amphimedon_queenslandica_tr_A0A1X7TYP3_A0A1X7TYP3_AMPQE tr_A0A1X7TYP3_A0A1X7TYP3_AMPQE RING-type E3 ubiquitin transferase OS=Amphimedon queenslandica OX=400682 GN=105314196 PE=4 SV=1	Branchiostoma_belcheri_tr_A0A6P4XQV8_A0A6P4XQV8_BRABE tr|A0A6P4XQV8|A0A6P4XQV8_BRABE E3 ubiquitin-protein ligase Midline-1-like OS=Branchiostoma belcheri OX=7741 GN=LOC109462399 PE=4 SV=1, Branchiostoma_belcheri_tr_A0A6P4Y6X5_A0A6P4Y6X5_BRABE tr|A0A6P4Y6X5|A0A6P4Y6X5_BRABE RING-type E3 ubiquitin transferase OS=Branchiostoma belcheri OX=7741 GN=LOC109462398 PE=4 SV=1, Branchiostoma_belcheri_tr_A0A6P4XV43_A0A6P4XV43_BRABE tr|A0A6P4XV43|A0A6P4XV43_BRABE RING-type E3 ubiquitin transferase OS=Branchiostoma belcheri OX=7741 GN=LOC109462385 PE=4 SV=1, Branchiostoma_belcheri_tr_A0A6P4ZZW5_A0A6P4ZZW5_BRABE tr|A0A6P4ZZW5|A0A6P4ZZW5_BRABE RING-type E3 ubiquitin transferase OS=Branchiostoma belcheri OX=7741 GN=LOC109478093 PE=4 SV=1, Branchiostoma_belcheri_tr_A0A6P4YVF7_A0A6P4YVF7_BRABE tr|A0A6P4YVF7|A0A6P4YVF7_BRABE Muscle M-line assembly protein unc-89-like OS=Branchiostoma belcheri OX=7741 GN=LOC109468813 PE=4 SV=1, Branchiostoma_belcheri_tr_A0A6P4YYT2_A0A6P4YYT2_BRABE tr|A0A6P4YYT2|A0A6P4YYT2_BRABE RING-type E3 ubiquitin transferase OS=Branchiostoma belcheri OX=7741 GN=LOC109473809 PE=4 SV=1, Branchiostoma_belcheri_tr_A0A6P4Y4I2_A0A6P4Y4I2_BRABE tr|A0A6P4Y4I2|A0A6P4Y4I2_BRABE E3 ubiquitin-protein ligase Midline-1-like OS=Branchiostoma belcheri OX=7741 GN=LOC109464693 PE=4 SV=1, Branchiostoma_belcheri_tr_A0A6P4YAQ4_A0A6P4YAQ4_BRABE tr|A0A6P4YAQ4|A0A6P4YAQ4_BRABE E3 ubiquitin-protein ligase Midline-1-like OS=Branchiostoma belcheri OX=7741 GN=LOC109461852 PE=4 SV=1, Branchiostoma_belcheri_tr_A0A6P4YLS7_A0A6P4YLS7_BRABE tr|A0A6P4YLS7|A0A6P4YLS7_BRABE E3 ubiquitin-protein ligase Midline-1-like OS=Branchiostoma belcheri OX=7741 GN=LOC109465318 PE=4 SV=1, Branchiostoma_belcheri_tr_A0A6P5AB99_A0A6P5AB99_BRABE tr|A0A6P5AB99|A0A6P5AB99_BRABE RING-type E3 ubiquitin transferase OS=Branchiostoma belcheri OX=7741 GN=LOC109487368 PE=4 SV=1, Branchiostoma_belcheri_tr_A0A6P4YMF5_A0A6P4YMF5_BRABE tr|A0A6P4YMF5|A0A6P4YMF5_BRABE E3 ubiquitin-protein ligase TRIM36-like isoform X1 OS=Branchiostoma belcheri OX=7741 GN=LOC109468953 PE=4 SV=1, Branchiostoma_belcheri_tr_A0A6P4Y1R1_A0A6P4Y1R1_BRABE tr|A0A6P4Y1R1|A0A6P4Y1R1_BRABE E3 ubiquitin-protein ligase TRIM36-like isoform X2 OS=Branchiostoma belcheri OX=7741 GN=LOC109468953 PE=4 SV=1, Branchiostoma_belcheri_tr_A0A6P4YU51_A0A6P4YU51_BRABE tr|A0A6P4YU51|A0A6P4YU51_BRABE Down syndrome cell adhesion molecule-like protein Dscam2 OS=Branchiostoma belcheri OX=7741 GN=LOC109468349 PE=4 SV=1
OG0000061	Amphimedon_queenslandica_tr_A0A1X7USU2_A0A1X7USU2_AMPQE tr_A0A1X7USU2_A0A1X7USU2_AMPQE Uncharacterized protein OS=Amphimedon queenslandica OX=400682 GN=100634021 PE=3 SV=1	Branchiostoma_belcheri_tr_A0A6P4ZBG6_A0A6P4ZBG6_BRABE tr|A0A6P4ZBG6|A0A6P4ZBG6_BRABE Copine-8-like isoform X4 OS=Branchiostoma belcheri OX=7741 GN=LOC109477303 PE=3 SV=1, Branchiostoma_belcheri_tr_A0A6P4ZIW8_A0A6P4ZIW8_BRABE tr|A0A6P4ZIW8|A0A6P4ZIW8_BRABE Copine-8-like isoform X1 OS=Branchiostoma belcheri OX=7741 GN=LOC109477303 PE=3 SV=1, Branchiostoma_belcheri_tr_A0A6P4ZSR6_A0A6P4ZSR6_BRABE tr|A0A6P4ZSR6|A0A6P4ZSR6_BRABE Copine-8-like isoform X3 OS=Branchiostoma belcheri OX=7741 GN=LOC109477303 PE=3 SV=1, Branchiostoma_belcheri_tr_A0A6P4YXA8_A0A6P4YXA8_BRABE tr|A0A6P4YXA8|A0A6P4YXA8_BRABE Copine-8-like isoform X2 OS=Branchiostoma belcheri OX=7741 GN=LOC109477303 PE=3 SV=1
