Orthogroup	Porifera_Demospongiae_Amphimedon_queenslandica	Chordata_Vertebrata_Bos_taurus
OG0000000	Amphimedon_queenslandica_tr_A0A1X7VG26_A0A1X7VG26_AMPQE tr_A0A1X7VG26_A0A1X7VG26_AMPQE Fibrinogen C-terminal domain-containing protein OS=Amphimedon queenslandica OX=400682 GN=100632699 PE=4 SV=1, Amphimedon_queenslandica_tr_A0A1X7TP62_A0A1X7TP62_AMPQE tr_A0A1X7TP62_A0A1X7TP62_AMPQE Fibrinogen C-terminal domain-containing protein OS=Amphimedon queenslandica OX=400682 PE=4 SV=1, Amphimedon_queenslandica_tr_A0A1X7TKD1_A0A1X7TKD1_AMPQE tr_A0A1X7TKD1_A0A1X7TKD1_AMPQE Fibrinogen C-terminal domain-containing protein OS=Amphimedon queenslandica OX=400682 PE=4 SV=1, Amphimedon_queenslandica_tr_A0A1X7THB2_A0A1X7THB2_AMPQE tr_A0A1X7THB2_A0A1X7THB2_AMPQE Fibrinogen C-terminal domain-containing protein OS=Amphimedon queenslandica OX=400682 PE=4 SV=1, Amphimedon_queenslandica_tr_A0A1X7T7C3_A0A1X7T7C3_AMPQE tr_A0A1X7T7C3_A0A1X7T7C3_AMPQE Angiopoietin-related protein 4 OS=Amphimedon queenslandica OX=400682 PE=4 SV=1, Amphimedon_queenslandica_tr_A0A1X7UD48_A0A1X7UD48_AMPQE tr_A0A1X7UD48_A0A1X7UD48_AMPQE Uncharacterized protein OS=Amphimedon queenslandica OX=400682 PE=4 SV=1, Amphimedon_queenslandica_tr_A0A1X7TEL1_A0A1X7TEL1_AMPQE tr_A0A1X7TEL1_A0A1X7TEL1_AMPQE Uncharacterized protein OS=Amphimedon queenslandica OX=400682 PE=4 SV=1, Amphimedon_queenslandica_tr_A0A1X7UMX4_A0A1X7UMX4_AMPQE tr_A0A1X7UMX4_A0A1X7UMX4_AMPQE Uncharacterized protein OS=Amphimedon queenslandica OX=400682 PE=4 SV=1, Amphimedon_queenslandica_tr_A0A1X7TQB3_A0A1X7TQB3_AMPQE tr_A0A1X7TQB3_A0A1X7TQB3_AMPQE Fibrinogen C-terminal domain-containing protein OS=Amphimedon queenslandica OX=400682 PE=4 SV=1, Amphimedon_queenslandica_tr_A0A1X7STG5_A0A1X7STG5_AMPQE tr_A0A1X7STG5_A0A1X7STG5_AMPQE Fibrinogen C-terminal domain-containing protein OS=Amphimedon queenslandica OX=400682 PE=4 SV=1, Amphimedon_queenslandica_tr_A0A1X7SKS1_A0A1X7SKS1_AMPQE tr_A0A1X7SKS1_A0A1X7SKS1_AMPQE Fibrinogen C-terminal domain-containing protein OS=Amphimedon queenslandica OX=400682 PE=4 SV=1	XP_005210603.1 tenascin isoform X1 [Bos taurus], XP_010811641.2 tenascin-N isoform X1 [Bos taurus]
OG0000000	Amphimedon_queenslandica_tr_A0A1X7ULD6_A0A1X7ULD6_AMPQE tr_A0A1X7ULD6_A0A1X7ULD6_AMPQE Fibrinogen C-terminal domain-containing protein OS=Amphimedon queenslandica OX=400682 GN=105313195 PE=4 SV=1, Amphimedon_queenslandica_tr_A0A1X7UNX5_A0A1X7UNX5_AMPQE tr_A0A1X7UNX5_A0A1X7UNX5_AMPQE Fibrinogen C-terminal domain-containing protein OS=Amphimedon queenslandica OX=400682 PE=4 SV=1, Amphimedon_queenslandica_tr_A0A1X7VAP0_A0A1X7VAP0_AMPQE tr_A0A1X7VAP0_A0A1X7VAP0_AMPQE Fibrinogen C-terminal domain-containing protein OS=Amphimedon queenslandica OX=400682 GN=100637828 PE=4 SV=1, Amphimedon_queenslandica_tr_A0A1X7UEI3_A0A1X7UEI3_AMPQE tr_A0A1X7UEI3_A0A1X7UEI3_AMPQE Fibrinogen C-terminal domain-containing protein OS=Amphimedon queenslandica OX=400682 PE=4 SV=1, Amphimedon_queenslandica_tr_A0A1X7TEI7_A0A1X7TEI7_AMPQE tr_A0A1X7TEI7_A0A1X7TEI7_AMPQE Fibrinogen C-terminal domain-containing protein OS=Amphimedon queenslandica OX=400682 PE=4 SV=1, Amphimedon_queenslandica_tr_A0A1X7SPQ0_A0A1X7SPQ0_AMPQE tr_A0A1X7SPQ0_A0A1X7SPQ0_AMPQE Fibrinogen C-terminal domain-containing protein OS=Amphimedon queenslandica OX=400682 PE=4 SV=1, Amphimedon_queenslandica_tr_A0A1X7TF91_A0A1X7TF91_AMPQE tr_A0A1X7TF91_A0A1X7TF91_AMPQE Fibrinogen C-terminal domain-containing protein OS=Amphimedon queenslandica OX=400682 PE=4 SV=1, Amphimedon_queenslandica_tr_A0A1X7UXI6_A0A1X7UXI6_AMPQE tr_A0A1X7UXI6_A0A1X7UXI6_AMPQE Fibrinogen C-terminal domain-containing protein OS=Amphimedon queenslandica OX=400682 PE=4 SV=1, Amphimedon_queenslandica_tr_A0A1X7UYQ5_A0A1X7UYQ5_AMPQE tr_A0A1X7UYQ5_A0A1X7UYQ5_AMPQE Fibrinogen C-terminal domain-containing protein OS=Amphimedon queenslandica OX=400682 GN=100632538 PE=4 SV=1, Amphimedon_queenslandica_tr_A0A1X7TTH3_A0A1X7TTH3_AMPQE tr_A0A1X7TTH3_A0A1X7TTH3_AMPQE Fibrinogen C-terminal domain-containing protein OS=Amphimedon queenslandica OX=400682 PE=4 SV=1, Amphimedon_queenslandica_tr_A0A1X7TT50_A0A1X7TT50_AMPQE tr_A0A1X7TT50_A0A1X7TT50_AMPQE Fibrinogen C-terminal domain-containing protein OS=Amphimedon queenslandica OX=400682 GN=100639626 PE=4 SV=1, Amphimedon_queenslandica_tr_A0A1X7U6Q1_A0A1X7U6Q1_AMPQE tr_A0A1X7U6Q1_A0A1X7U6Q1_AMPQE Fibrinogen C-terminal domain-containing protein OS=Amphimedon queenslandica OX=400682 PE=4 SV=1, Amphimedon_queenslandica_tr_A0A1X7U6Q6_A0A1X7U6Q6_AMPQE tr_A0A1X7U6Q6_A0A1X7U6Q6_AMPQE Fibrinogen C-terminal domain-containing protein OS=Amphimedon queenslandica OX=400682 PE=4 SV=1, Amphimedon_queenslandica_tr_A0A1X7T854_A0A1X7T854_AMPQE tr_A0A1X7T854_A0A1X7T854_AMPQE Fibrinogen C-terminal domain-containing protein OS=Amphimedon queenslandica OX=400682 GN=100637814 PE=4 SV=1, Amphimedon_queenslandica_tr_A0A1X7U6G7_A0A1X7U6G7_AMPQE tr_A0A1X7U6G7_A0A1X7U6G7_AMPQE Fibrinogen C-terminal domain-containing protein OS=Amphimedon queenslandica OX=400682 GN=105313870 PE=4 SV=1, Amphimedon_queenslandica_tr_A0A1X7TRL5_A0A1X7TRL5_AMPQE tr_A0A1X7TRL5_A0A1X7TRL5_AMPQE Fibrinogen C-terminal domain-containing protein OS=Amphimedon queenslandica OX=400682 GN=100634289 PE=4 SV=1, Amphimedon_queenslandica_tr_A0A1X7U772_A0A1X7U772_AMPQE tr_A0A1X7U772_A0A1X7U772_AMPQE Fibrinogen C-terminal domain-containing protein OS=Amphimedon queenslandica OX=400682 GN=105313869 PE=4 SV=1, Amphimedon_queenslandica_tr_A0A1X7TNT2_A0A1X7TNT2_AMPQE tr_A0A1X7TNT2_A0A1X7TNT2_AMPQE Fibrinogen C-terminal domain-containing protein OS=Amphimedon queenslandica OX=400682 GN=100639582 PE=4 SV=1, Amphimedon_queenslandica_tr_A0A1X7STA5_A0A1X7STA5_AMPQE tr_A0A1X7STA5_A0A1X7STA5_AMPQE Fibrinogen C-terminal domain-containing protein OS=Amphimedon queenslandica OX=400682 PE=4 SV=1, Amphimedon_queenslandica_tr_A0A1X7TF57_A0A1X7TF57_AMPQE tr_A0A1X7TF57_A0A1X7TF57_AMPQE Fibrinogen C-terminal domain-containing protein OS=Amphimedon queenslandica OX=400682 GN=100633103 PE=4 SV=1, Amphimedon_queenslandica_tr_A0A1X7T456_A0A1X7T456_AMPQE tr_A0A1X7T456_A0A1X7T456_AMPQE Fibrinogen C-terminal domain-containing protein OS=Amphimedon queenslandica OX=400682 PE=4 SV=1, Amphimedon_queenslandica_tr_A0A1X7U0N8_A0A1X7U0N8_AMPQE tr_A0A1X7U0N8_A0A1X7U0N8_AMPQE Fibrinogen C-terminal domain-containing protein OS=Amphimedon queenslandica OX=400682 GN=105314125 PE=4 SV=1, Amphimedon_queenslandica_tr_A0A1X7U0C2_A0A1X7U0C2_AMPQE tr_A0A1X7U0C2_A0A1X7U0C2_AMPQE Fibrinogen C-terminal domain-containing protein OS=Amphimedon queenslandica OX=400682 PE=4 SV=1, Amphimedon_queenslandica_tr_A0A1X7TP65_A0A1X7TP65_AMPQE tr_A0A1X7TP65_A0A1X7TP65_AMPQE Arpin OS=Amphimedon queenslandica OX=400682 PE=3 SV=1, Amphimedon_queenslandica_tr_A0A1X7U606_A0A1X7U606_AMPQE tr_A0A1X7U606_A0A1X7U606_AMPQE Fibrinogen C-terminal domain-containing protein OS=Amphimedon queenslandica OX=400682 PE=4 SV=1, Amphimedon_queenslandica_tr_A0A1X7T8J7_A0A1X7T8J7_AMPQE tr_A0A1X7T8J7_A0A1X7T8J7_AMPQE Fibrinogen C-terminal domain-containing protein OS=Amphimedon queenslandica OX=400682 PE=4 SV=1	XP_005213566.1 ficolin-2 isoform X2 [Bos taurus], XP_024834735.2 LOW QUALITY PROTEIN_ ficolin-3 [Bos taurus]
OG0000000	Amphimedon_queenslandica_tr_A0A1X7UEG4_A0A1X7UEG4_AMPQE tr_A0A1X7UEG4_A0A1X7UEG4_AMPQE Fibrinogen C-terminal domain-containing protein OS=Amphimedon queenslandica OX=400682 PE=4 SV=1, Amphimedon_queenslandica_tr_A0A1X7VPP5_A0A1X7VPP5_AMPQE tr_A0A1X7VPP5_A0A1X7VPP5_AMPQE Uncharacterized protein OS=Amphimedon queenslandica OX=400682 PE=4 SV=1, Amphimedon_queenslandica_tr_A0A1X7TEX2_A0A1X7TEX2_AMPQE tr_A0A1X7TEX2_A0A1X7TEX2_AMPQE Uncharacterized protein OS=Amphimedon queenslandica OX=400682 PE=4 SV=1, Amphimedon_queenslandica_tr_A0A1X7TFJ4_A0A1X7TFJ4_AMPQE tr_A0A1X7TFJ4_A0A1X7TFJ4_AMPQE Fibrinogen C-terminal domain-containing protein OS=Amphimedon queenslandica OX=400682 PE=4 SV=1, Amphimedon_queenslandica_tr_A0A1X7TFU9_A0A1X7TFU9_AMPQE tr_A0A1X7TFU9_A0A1X7TFU9_AMPQE Fibrinogen C-terminal domain-containing protein OS=Amphimedon queenslandica OX=400682 PE=4 SV=1	sp|Q24K15.1|ANGP4_BOVIN RecName_ Full=Angiopoietin-4; Short=ANG-4; Flags_ Precursor, sp|O77802.3|ANGP2_BOVIN RecName_ Full=Angiopoietin-2; Short=ANG-2; Flags_ Precursor, XP_059749109.1 angiopoietin-1 isoform X1 [Bos taurus]
OG0000000	Amphimedon_queenslandica_tr_A0A1X7VK27_A0A1X7VK27_AMPQE tr_A0A1X7VK27_A0A1X7VK27_AMPQE Fibrinogen C-terminal domain-containing protein OS=Amphimedon queenslandica OX=400682 GN=100632192 PE=4 SV=1	sp|Q29RY7.1|FGL2_BOVIN RecName_ Full=Fibroleukin; AltName_ Full=Fibrinogen-like protein 2; Flags_ Precursor
OG0000001	Amphimedon_queenslandica_tr_A0A1X7UHN7_A0A1X7UHN7_AMPQE tr_A0A1X7UHN7_A0A1X7UHN7_AMPQE Uncharacterized protein OS=Amphimedon queenslandica OX=400682 GN=100638010 PE=4 SV=1, Amphimedon_queenslandica_tr_A0A1X7VW10_A0A1X7VW10_AMPQE tr_A0A1X7VW10_A0A1X7VW10_AMPQE Uncharacterized protein OS=Amphimedon queenslandica OX=400682 GN=109582339 PE=4 SV=1	XP_059731805.1 laminin subunit gamma-2 isoform X1 [Bos taurus]
OG0000001	Amphimedon_queenslandica_tr_A0A1X7VTD0_A0A1X7VTD0_AMPQE tr_A0A1X7VTD0_A0A1X7VTD0_AMPQE Uncharacterized protein OS=Amphimedon queenslandica OX=400682 GN=105314164 PE=4 SV=1	XP_010803496.1 netrin-4 isoform X2 [Bos taurus], XP_059731406.1 laminin subunit beta-3 isoform X1 [Bos taurus], NP_001039712.2 laminin subunit beta-2 precursor [Bos taurus], DAA30633.1 TPA_ laminin_ beta 1 [Bos taurus]
OG0000001	Amphimedon_queenslandica_tr_A0A1X7V889_A0A1X7V889_AMPQE tr_A0A1X7V889_A0A1X7V889_AMPQE Uncharacterized protein OS=Amphimedon queenslandica OX=400682 PE=4 SV=1	sp|P07589.4|FINC_BOVIN RecName_ Full=Fibronectin; Short=FN; Contains_ RecName_ Full=Anastellin; Flags_ Precursor, sp|P07589.4|FINC_BOVIN RecName_ Full=Fibronectin; Short=FN; Contains_ RecName_ Full=Anastellin; Flags_ Precursor, sp|P07589.4|FINC_BOVIN RecName_ Full=Fibronectin; Short=FN; Contains_ RecName_ Full=Anastellin; Flags_ Precursor, sp|P07589.4|FINC_BOVIN RecName_ Full=Fibronectin; Short=FN; Contains_ RecName_ Full=Anastellin; Flags_ Precursor, sp|P07589.4|FINC_BOVIN RecName_ Full=Fibronectin; Short=FN; Contains_ RecName_ Full=Anastellin; Flags_ Precursor, sp|P07589.4|FINC_BOVIN RecName_ Full=Fibronectin; Short=FN; Contains_ RecName_ Full=Anastellin; Flags_ Precursor, XP_059734749.1 leukemia inhibitory factor receptor isoform X1 [Bos taurus]
OG0000001	Amphimedon_queenslandica_tr_A0A1X7VB47_A0A1X7VB47_AMPQE tr_A0A1X7VB47_A0A1X7VB47_AMPQE Uncharacterized protein OS=Amphimedon queenslandica OX=400682 GN=105312030 PE=4 SV=1, Amphimedon_queenslandica_tr_A0A1X7SI38_A0A1X7SI38_AMPQE tr_A0A1X7SI38_A0A1X7SI38_AMPQE Uncharacterized protein OS=Amphimedon queenslandica OX=400682 PE=4 SV=1	NP_001193801.1 netrin-5 precursor [Bos taurus]
OG0000001	Amphimedon_queenslandica_tr_A0A1X7SK21_A0A1X7SK21_AMPQE tr_A0A1X7SK21_A0A1X7SK21_AMPQE Laminin EGF-like domain-containing protein OS=Amphimedon queenslandica OX=400682 PE=4 SV=1	XP_059747260.1 netrin-G2 isoform X1 [Bos taurus], XP_059740913.1 netrin-G1 isoform X1 [Bos taurus], NP_001193834.1 netrin-3 precursor [Bos taurus], NP_001179495.1 netrin-1 precursor [Bos taurus], DAA24206.1 TPA_ laminin_ gamma 3-like [Bos taurus], NP_001193746.1 laminin subunit gamma-1 precursor [Bos taurus]
OG0000002	Amphimedon_queenslandica_tr_A0A1X7V5N9_A0A1X7V5N9_AMPQE tr_A0A1X7V5N9_A0A1X7V5N9_AMPQE Sema domain-containing protein OS=Amphimedon queenslandica OX=400682 GN=105312297 PE=4 SV=1, Amphimedon_queenslandica_tr_A0A1X7V831_A0A1X7V831_AMPQE tr_A0A1X7V831_A0A1X7V831_AMPQE Sema domain-containing protein OS=Amphimedon queenslandica OX=400682 PE=4 SV=1, Amphimedon_queenslandica_tr_A0A1X7U8W1_A0A1X7U8W1_AMPQE tr_A0A1X7U8W1_A0A1X7U8W1_AMPQE Sema domain-containing protein OS=Amphimedon queenslandica OX=400682 PE=4 SV=1	XP_059736229.1 von Willebrand factor A domain-containing protein 7 isoform X1 [Bos taurus]
OG0000002	Amphimedon_queenslandica_tr_A0A1X7T8F3_A0A1X7T8F3_AMPQE tr_A0A1X7T8F3_A0A1X7T8F3_AMPQE Uncharacterized protein OS=Amphimedon queenslandica OX=400682 PE=4 SV=1, Amphimedon_queenslandica_tr_A0A1X7SPA1_A0A1X7SPA1_AMPQE tr_A0A1X7SPA1_A0A1X7SPA1_AMPQE Uncharacterized protein OS=Amphimedon queenslandica OX=400682 PE=4 SV=1	XP_059735793.1 semaphorin-3B isoform X1 [Bos taurus], NP_001263630.1 semaphorin-3A precursor [Bos taurus], XP_059741648.1 semaphorin-3D isoform X1 [Bos taurus], XP_024839041.1 semaphorin-3F isoform X1 [Bos taurus], XP_059741517.1 semaphorin-3C isoform X1 [Bos taurus], XP_003586003.2 semaphorin-3E [Bos taurus], XP_010816133.2 semaphorin-3G isoform X1 [Bos taurus], sp|Q5EA85.1|SEM4A_BOVIN RecName_ Full=Semaphorin-4A; Flags_ Precursor, XP_003586665.1 semaphorin-4F isoform X1 [Bos taurus], XP_059745283.1 semaphorin-4D isoform X1 [Bos taurus], XP_010818201.1 semaphorin-4G isoform X1 [Bos taurus], NP_001094587.1 semaphorin-4G precursor [Bos taurus], XP_024854545.1 semaphorin-4C isoform X2 [Bos taurus], NP_001193114.1 semaphorin-7A precursor [Bos taurus], XP_010815150.2 semaphorin-5A [Bos taurus], XP_002684855.2 semaphorin-5B isoform X1 [Bos taurus], XP_059746380.1 semaphorin-6D isoform X1 [Bos taurus], XP_005209195.1 semaphorin-6A isoform X1 [Bos taurus], XP_024850768.2 semaphorin-6B isoform X2 [Bos taurus], XP_024845741.1 semaphorin-6C isoform X1 [Bos taurus]
OG0000003	Amphimedon_queenslandica_tr_A0A1X7UHZ5_A0A1X7UHZ5_AMPQE tr_A0A1X7UHZ5_A0A1X7UHZ5_AMPQE C-type lectin domain-containing protein OS=Amphimedon queenslandica OX=400682 GN=109583360 PE=4 SV=1	XP_002698060.3 C-type lectin domain family 19 member A [Bos taurus]
OG0000004	Amphimedon_queenslandica_tr_A0A1X7SJ45_A0A1X7SJ45_AMPQE tr_A0A1X7SJ45_A0A1X7SJ45_AMPQE VWFA domain-containing protein OS=Amphimedon queenslandica OX=400682 PE=4 SV=1, Amphimedon_queenslandica_tr_A0A1X7V9K0_A0A1X7V9K0_AMPQE tr_A0A1X7V9K0_A0A1X7V9K0_AMPQE VWFA domain-containing protein OS=Amphimedon queenslandica OX=400682 PE=4 SV=1, Amphimedon_queenslandica_tr_A0A1X7UZ52_A0A1X7UZ52_AMPQE tr_A0A1X7UZ52_A0A1X7UZ52_AMPQE VWFA domain-containing protein OS=Amphimedon queenslandica OX=400682 PE=4 SV=1, Amphimedon_queenslandica_tr_A0A1X7T3N5_A0A1X7T3N5_AMPQE tr_A0A1X7T3N5_A0A1X7T3N5_AMPQE VWFA domain-containing protein OS=Amphimedon queenslandica OX=400682 PE=3 SV=1, Amphimedon_queenslandica_tr_A0A1X7VAB7_A0A1X7VAB7_AMPQE tr_A0A1X7VAB7_A0A1X7VAB7_AMPQE Uncharacterized protein OS=Amphimedon queenslandica OX=400682 PE=4 SV=1, Amphimedon_queenslandica_tr_A0A1X7V9M7_A0A1X7V9M7_AMPQE tr_A0A1X7V9M7_A0A1X7V9M7_AMPQE VWFA domain-containing protein OS=Amphimedon queenslandica OX=400682 PE=4 SV=1, Amphimedon_queenslandica_tr_A0A1X7UXD9_A0A1X7UXD9_AMPQE tr_A0A1X7UXD9_A0A1X7UXD9_AMPQE VWFA domain-containing protein OS=Amphimedon queenslandica OX=400682 PE=4 SV=1, Amphimedon_queenslandica_tr_A0A1X7V8Q4_A0A1X7V8Q4_AMPQE tr_A0A1X7V8Q4_A0A1X7V8Q4_AMPQE Uncharacterized protein OS=Amphimedon queenslandica OX=400682 PE=4 SV=1, Amphimedon_queenslandica_tr_A0A1X7V9L7_A0A1X7V9L7_AMPQE tr_A0A1X7V9L7_A0A1X7V9L7_AMPQE VWFA domain-containing protein OS=Amphimedon queenslandica OX=400682 PE=4 SV=1, Amphimedon_queenslandica_tr_A0A1X7VAX9_A0A1X7VAX9_AMPQE tr_A0A1X7VAX9_A0A1X7VAX9_AMPQE VWFA domain-containing protein OS=Amphimedon queenslandica OX=400682 PE=4 SV=1, Amphimedon_queenslandica_tr_A0A1X7T8B1_A0A1X7T8B1_AMPQE tr_A0A1X7T8B1_A0A1X7T8B1_AMPQE VWFA domain-containing protein OS=Amphimedon queenslandica OX=400682 PE=4 SV=1, Amphimedon_queenslandica_tr_A0A1X7VAY4_A0A1X7VAY4_AMPQE tr_A0A1X7VAY4_A0A1X7VAY4_AMPQE VWFA domain-containing protein OS=Amphimedon queenslandica OX=400682 PE=4 SV=1, Amphimedon_queenslandica_tr_A0A1X7UYP0_A0A1X7UYP0_AMPQE tr_A0A1X7UYP0_A0A1X7UYP0_AMPQE VWFA domain-containing protein OS=Amphimedon queenslandica OX=400682 PE=4 SV=1, Amphimedon_queenslandica_tr_A0A1X7V8S5_A0A1X7V8S5_AMPQE tr_A0A1X7V8S5_A0A1X7V8S5_AMPQE VWFA domain-containing protein OS=Amphimedon queenslandica OX=400682 PE=4 SV=1, Amphimedon_queenslandica_tr_A0A1X7SFH7_A0A1X7SFH7_AMPQE tr_A0A1X7SFH7_A0A1X7SFH7_AMPQE VWFA domain-containing protein OS=Amphimedon queenslandica OX=400682 PE=4 SV=1, Amphimedon_queenslandica_tr_A0A1X7UXZ0_A0A1X7UXZ0_AMPQE tr_A0A1X7UXZ0_A0A1X7UXZ0_AMPQE VWFA domain-containing protein OS=Amphimedon queenslandica OX=400682 PE=4 SV=1, Amphimedon_queenslandica_tr_A0A1X7VAX4_A0A1X7VAX4_AMPQE tr_A0A1X7VAX4_A0A1X7VAX4_AMPQE VWFA domain-containing protein OS=Amphimedon queenslandica OX=400682 PE=3 SV=1, Amphimedon_queenslandica_tr_A0A1X7UY59_A0A1X7UY59_AMPQE tr_A0A1X7UY59_A0A1X7UY59_AMPQE Uncharacterized protein OS=Amphimedon queenslandica OX=400682 PE=4 SV=1, Amphimedon_queenslandica_tr_A0A1X7SYB6_A0A1X7SYB6_AMPQE tr_A0A1X7SYB6_A0A1X7SYB6_AMPQE VWFA domain-containing protein OS=Amphimedon queenslandica OX=400682 PE=4 SV=1, Amphimedon_queenslandica_tr_A0A1X7SR40_A0A1X7SR40_AMPQE tr_A0A1X7SR40_A0A1X7SR40_AMPQE VWFA domain-containing protein OS=Amphimedon queenslandica OX=400682 PE=4 SV=1, Amphimedon_queenslandica_tr_A0A1X7V9K7_A0A1X7V9K7_AMPQE tr_A0A1X7V9K7_A0A1X7V9K7_AMPQE VWFA domain-containing protein OS=Amphimedon queenslandica OX=400682 PE=4 SV=1, Amphimedon_queenslandica_tr_A0A1X7T7K3_A0A1X7T7K3_AMPQE tr_A0A1X7T7K3_A0A1X7T7K3_AMPQE VWFA domain-containing protein OS=Amphimedon queenslandica OX=400682 PE=4 SV=1, Amphimedon_queenslandica_tr_A0A1X7SVX6_A0A1X7SVX6_AMPQE tr_A0A1X7SVX6_A0A1X7SVX6_AMPQE VWFA domain-containing protein OS=Amphimedon queenslandica OX=400682 PE=4 SV=1, Amphimedon_queenslandica_tr_A0A1X7VJ19_A0A1X7VJ19_AMPQE tr_A0A1X7VJ19_A0A1X7VJ19_AMPQE Uncharacterized protein OS=Amphimedon queenslandica OX=400682 PE=4 SV=1, Amphimedon_queenslandica_tr_A0A1X7SKR6_A0A1X7SKR6_AMPQE tr_A0A1X7SKR6_A0A1X7SKR6_AMPQE VWFA domain-containing protein OS=Amphimedon queenslandica OX=400682 PE=4 SV=1, Amphimedon_queenslandica_tr_A0A1X7VWV6_A0A1X7VWV6_AMPQE tr_A0A1X7VWV6_A0A1X7VWV6_AMPQE Uncharacterized protein OS=Amphimedon queenslandica OX=400682 GN=100639213 PE=4 SV=1	XP_024846755.1 collagen alpha-1_XXVIII_ chain isoform X1 [Bos taurus]
OG0000006	Amphimedon_queenslandica_tr_A0A1X7UHV7_A0A1X7UHV7_AMPQE tr_A0A1X7UHV7_A0A1X7UHV7_AMPQE Uncharacterized protein OS=Amphimedon queenslandica OX=400682 GN=100640167 PE=4 SV=1, Amphimedon_queenslandica_tr_A0A1X7VKS2_A0A1X7VKS2_AMPQE tr_A0A1X7VKS2_A0A1X7VKS2_AMPQE Uncharacterized protein OS=Amphimedon queenslandica OX=400682 PE=4 SV=1, Amphimedon_queenslandica_tr_A0A1X7VUQ0_A0A1X7VUQ0_AMPQE tr_A0A1X7VUQ0_A0A1X7VUQ0_AMPQE Uncharacterized protein OS=Amphimedon queenslandica OX=400682 PE=3 SV=1, Amphimedon_queenslandica_tr_A0A1X7TY54_A0A1X7TY54_AMPQE tr_A0A1X7TY54_A0A1X7TY54_AMPQE Uncharacterized protein OS=Amphimedon queenslandica OX=400682 PE=4 SV=1, Amphimedon_queenslandica_tr_A0A1X7VPD3_A0A1X7VPD3_AMPQE tr_A0A1X7VPD3_A0A1X7VPD3_AMPQE Uncharacterized protein OS=Amphimedon queenslandica OX=400682 GN=100634470 PE=4 SV=1, Amphimedon_queenslandica_tr_A0A1X7VW19_A0A1X7VW19_AMPQE tr_A0A1X7VW19_A0A1X7VW19_AMPQE Uncharacterized protein OS=Amphimedon queenslandica OX=400682 GN=105316811 PE=4 SV=1, Amphimedon_queenslandica_tr_A0A1X7VC92_A0A1X7VC92_AMPQE tr_A0A1X7VC92_A0A1X7VC92_AMPQE Uncharacterized protein OS=Amphimedon queenslandica OX=400682 GN=105311920 PE=4 SV=1, Amphimedon_queenslandica_tr_A0A1X7VMB2_A0A1X7VMB2_AMPQE tr_A0A1X7VMB2_A0A1X7VMB2_AMPQE Uncharacterized protein OS=Amphimedon queenslandica OX=400682 PE=4 SV=1, Amphimedon_queenslandica_tr_A0A1X7VLN3_A0A1X7VLN3_AMPQE tr_A0A1X7VLN3_A0A1X7VLN3_AMPQE Uncharacterized protein OS=Amphimedon queenslandica OX=400682 PE=4 SV=1, Amphimedon_queenslandica_tr_A0A1X7VNL2_A0A1X7VNL2_AMPQE tr_A0A1X7VNL2_A0A1X7VNL2_AMPQE Uncharacterized protein OS=Amphimedon queenslandica OX=400682 PE=4 SV=1, Amphimedon_queenslandica_tr_A0A1X7VM60_A0A1X7VM60_AMPQE tr_A0A1X7VM60_A0A1X7VM60_AMPQE Uncharacterized protein OS=Amphimedon queenslandica OX=400682 PE=4 SV=1, Amphimedon_queenslandica_tr_A0A1X7VUM7_A0A1X7VUM7_AMPQE tr_A0A1X7VUM7_A0A1X7VUM7_AMPQE Uncharacterized protein OS=Amphimedon queenslandica OX=400682 GN=109581021 PE=4 SV=1, Amphimedon_queenslandica_tr_A0A1X7VM65_A0A1X7VM65_AMPQE tr_A0A1X7VM65_A0A1X7VM65_AMPQE Uncharacterized protein OS=Amphimedon queenslandica OX=400682 GN=109592646 PE=4 SV=1, Amphimedon_queenslandica_tr_A0A1X7VKR7_A0A1X7VKR7_AMPQE tr_A0A1X7VKR7_A0A1X7VKR7_AMPQE Uncharacterized protein OS=Amphimedon queenslandica OX=400682 PE=4 SV=1, Amphimedon_queenslandica_tr_A0A1X7VMB7_A0A1X7VMB7_AMPQE tr_A0A1X7VMB7_A0A1X7VMB7_AMPQE Uncharacterized protein OS=Amphimedon queenslandica OX=400682 GN=109592733 PE=4 SV=1, Amphimedon_queenslandica_tr_A0A1X7VVY6_A0A1X7VVY6_AMPQE tr_A0A1X7VVY6_A0A1X7VVY6_AMPQE Uncharacterized protein OS=Amphimedon queenslandica OX=400682 PE=4 SV=1, Amphimedon_queenslandica_tr_A0A1X7SNE5_A0A1X7SNE5_AMPQE tr_A0A1X7SNE5_A0A1X7SNE5_AMPQE Uncharacterized protein OS=Amphimedon queenslandica OX=400682 GN=109592231 PE=4 SV=1, Amphimedon_queenslandica_tr_A0A1X7VTZ5_A0A1X7VTZ5_AMPQE tr_A0A1X7VTZ5_A0A1X7VTZ5_AMPQE Uncharacterized protein OS=Amphimedon queenslandica OX=400682 PE=4 SV=1, Amphimedon_queenslandica_tr_A0A1X7U3N7_A0A1X7U3N7_AMPQE tr_A0A1X7U3N7_A0A1X7U3N7_AMPQE Uncharacterized protein OS=Amphimedon queenslandica OX=400682 PE=4 SV=1, Amphimedon_queenslandica_tr_A0A1X7V158_A0A1X7V158_AMPQE tr_A0A1X7V158_A0A1X7V158_AMPQE Uncharacterized protein OS=Amphimedon queenslandica OX=400682 PE=4 SV=1, Amphimedon_queenslandica_tr_A0A1X7SRY7_A0A1X7SRY7_AMPQE tr_A0A1X7SRY7_A0A1X7SRY7_AMPQE Uncharacterized protein OS=Amphimedon queenslandica OX=400682 PE=4 SV=1, Amphimedon_queenslandica_tr_A0A1X7SSJ6_A0A1X7SSJ6_AMPQE tr_A0A1X7SSJ6_A0A1X7SSJ6_AMPQE Uncharacterized protein OS=Amphimedon queenslandica OX=400682 PE=4 SV=1, Amphimedon_queenslandica_tr_A0A1X7SK83_A0A1X7SK83_AMPQE tr_A0A1X7SK83_A0A1X7SK83_AMPQE Uncharacterized protein OS=Amphimedon queenslandica OX=400682 PE=4 SV=1, Amphimedon_queenslandica_tr_A0A1X7UIE0_A0A1X7UIE0_AMPQE tr_A0A1X7UIE0_A0A1X7UIE0_AMPQE Uncharacterized protein OS=Amphimedon queenslandica OX=400682 PE=4 SV=1, Amphimedon_queenslandica_tr_A0A1X7T448_A0A1X7T448_AMPQE tr_A0A1X7T448_A0A1X7T448_AMPQE Uncharacterized protein OS=Amphimedon queenslandica OX=400682 PE=4 SV=1	NP_001411858.1 CUB and sushi domain-containing protein 3 [Bos taurus], NP_001411858.1 CUB and sushi domain-containing protein 3 [Bos taurus], NP_001411858.1 CUB and sushi domain-containing protein 3 [Bos taurus], NP_001411858.1 CUB and sushi domain-containing protein 3 [Bos taurus]
OG0000007	Amphimedon_queenslandica_tr_A0A1X7UBV4_A0A1X7UBV4_AMPQE tr_A0A1X7UBV4_A0A1X7UBV4_AMPQE Uncharacterized protein OS=Amphimedon queenslandica OX=400682 PE=4 SV=1, Amphimedon_queenslandica_tr_A0A1X7T313_A0A1X7T313_AMPQE tr_A0A1X7T313_A0A1X7T313_AMPQE Uncharacterized protein OS=Amphimedon queenslandica OX=400682 PE=4 SV=1	XP_024855952.1 growth arrest-specific protein 6 [Bos taurus]
OG0000007	Amphimedon_queenslandica_tr_A0A1X7T1V8_A0A1X7T1V8_AMPQE tr_A0A1X7T1V8_A0A1X7T1V8_AMPQE EGF_CA domain-containing protein OS=Amphimedon queenslandica OX=400682 PE=4 SV=1	NP_001012687.1 fatty acid synthase [Bos taurus]
OG0000007	Amphimedon_queenslandica_tr_A0A1X7VHY5_A0A1X7VHY5_AMPQE tr_A0A1X7VHY5_A0A1X7VHY5_AMPQE Uncharacterized protein OS=Amphimedon queenslandica OX=400682 PE=4 SV=1, Amphimedon_queenslandica_tr_A0A1X7SWG6_A0A1X7SWG6_AMPQE tr_A0A1X7SWG6_A0A1X7SWG6_AMPQE Uncharacterized protein OS=Amphimedon queenslandica OX=400682 PE=4 SV=1, Amphimedon_queenslandica_tr_A0A1X7SUC7_A0A1X7SUC7_AMPQE tr_A0A1X7SUC7_A0A1X7SUC7_AMPQE NIDO domain-containing protein OS=Amphimedon queenslandica OX=400682 PE=4 SV=1, Amphimedon_queenslandica_tr_A0A1X7UEE9_A0A1X7UEE9_AMPQE tr_A0A1X7UEE9_A0A1X7UEE9_AMPQE Uncharacterized protein OS=Amphimedon queenslandica OX=400682 GN=100638351 PE=4 SV=1, Amphimedon_queenslandica_tr_A0A1X7SED7_A0A1X7SED7_AMPQE tr_A0A1X7SED7_A0A1X7SED7_AMPQE NIDO domain-containing protein OS=Amphimedon queenslandica OX=400682 PE=4 SV=1	DAA30889.1 TPA_ 6720455I24Rik homolog [Bos taurus]
