Orthogroup	Porifera_Demospongiae_Amphimedon_queenslandica	Chordata_Amphioxiformes_Branchiostoma_belcheri
OG0000006	Amphimedon_queenslandica_tr_A0A1X7UIE0_A0A1X7UIE0_AMPQE tr_A0A1X7UIE0_A0A1X7UIE0_AMPQE Uncharacterized protein OS=Amphimedon queenslandica OX=400682 PE=4 SV=1	Branchiostoma_belcheri_tr_A0A6P4YYU3_A0A6P4YYU3_BRABE tr|A0A6P4YYU3|A0A6P4YYU3_BRABE E-selectin-like OS=Branchiostoma belcheri OX=7741 GN=LOC109468601 PE=4 SV=1, Branchiostoma_belcheri_tr_A0A6P4Z968_A0A6P4Z968_BRABE tr|A0A6P4Z968|A0A6P4Z968_BRABE Uncharacterized protein LOC109471363 OS=Branchiostoma belcheri OX=7741 GN=LOC109471363 PE=4 SV=1, Branchiostoma_belcheri_tr_A0A6P4ZM69_A0A6P4ZM69_BRABE tr|A0A6P4ZM69|A0A6P4ZM69_BRABE P-selectin-like OS=Branchiostoma belcheri OX=7741 GN=LOC109474786 PE=4 SV=1, Branchiostoma_belcheri_tr_A0A6P4YJW9_A0A6P4YJW9_BRABE tr|A0A6P4YJW9|A0A6P4YJW9_BRABE Sushi_ von Willebrand factor type A_ EGF and pentraxin domain-containing protein 1-like OS=Branchiostoma belcheri OX=7741 GN=LOC109464764 PE=4 SV=1, Branchiostoma_belcheri_tr_A0A6P4Y4S8_A0A6P4Y4S8_BRABE tr|A0A6P4Y4S8|A0A6P4Y4S8_BRABE E-selectin-like OS=Branchiostoma belcheri OX=7741 GN=LOC109464766 PE=4 SV=1, Branchiostoma_belcheri_tr_A0A6P4Z9T9_A0A6P4Z9T9_BRABE tr|A0A6P4Z9T9|A0A6P4Z9T9_BRABE CUB and sushi domain-containing protein 3-like OS=Branchiostoma belcheri OX=7741 GN=LOC109476850 PE=4 SV=1, Branchiostoma_belcheri_tr_A0A6P4Z118_A0A6P4Z118_BRABE tr|A0A6P4Z118|A0A6P4Z118_BRABE P-selectin-like OS=Branchiostoma belcheri OX=7741 GN=LOC109474368 PE=4 SV=1, Branchiostoma_belcheri_tr_A0A6P4ZGM2_A0A6P4ZGM2_BRABE tr|A0A6P4ZGM2|A0A6P4ZGM2_BRABE CUB and sushi domain-containing protein 3-like OS=Branchiostoma belcheri OX=7741 GN=LOC109474366 PE=4 SV=1, Branchiostoma_belcheri_tr_A0A6P4Z9P1_A0A6P4Z9P1_BRABE tr|A0A6P4Z9P1|A0A6P4Z9P1_BRABE Sushi_ von Willebrand factor type A_ EGF and pentraxin domain-containing protein 1-like OS=Branchiostoma belcheri OX=7741 GN=LOC109474734 PE=4 SV=1, Branchiostoma_belcheri_tr_A0A6P4YYC2_A0A6P4YYC2_BRABE tr|A0A6P4YYC2|A0A6P4YYC2_BRABE Sushi_ von Willebrand factor type A_ EGF and pentraxin domain-containing protein 1-like OS=Branchiostoma belcheri OX=7741 GN=LOC109471796 PE=4 SV=1, Branchiostoma_belcheri_tr_A0A6P4YC47_A0A6P4YC47_BRABE tr|A0A6P4YC47|A0A6P4YC47_BRABE Sushi_ von Willebrand factor type A_ EGF and pentraxin domain-containing protein 1-like OS=Branchiostoma belcheri OX=7741 GN=LOC109471797 PE=4 SV=1, Branchiostoma_belcheri_tr_A0A6P4YDA0_A0A6P4YDA0_BRABE tr|A0A6P4YDA0|A0A6P4YDA0_BRABE CUB and sushi domain-containing protein 3-like OS=Branchiostoma belcheri OX=7741 GN=LOC109472010 PE=4 SV=1, Branchiostoma_belcheri_tr_A0A6P4Z6N4_A0A6P4Z6N4_BRABE tr|A0A6P4Z6N4|A0A6P4Z6N4_BRABE CUB and sushi domain-containing protein 3-like OS=Branchiostoma belcheri OX=7741 GN=LOC109471793 PE=4 SV=1, Branchiostoma_belcheri_tr_A0A6P4ZKY5_A0A6P4ZKY5_BRABE tr|A0A6P4ZKY5|A0A6P4ZKY5_BRABE Sushi_ von Willebrand factor type A_ EGF and pentraxin domain-containing protein 1-like OS=Branchiostoma belcheri OX=7741 GN=LOC109483322 PE=4 SV=1, Branchiostoma_belcheri_tr_A0A6P4XRU1_A0A6P4XRU1_BRABE tr|A0A6P4XRU1|A0A6P4XRU1_BRABE CUB and sushi domain-containing protein 1-like OS=Branchiostoma belcheri OX=7741 GN=LOC109462688 PE=4 SV=1, Branchiostoma_belcheri_tr_A0A6P4YR41_A0A6P4YR41_BRABE tr|A0A6P4YR41|A0A6P4YR41_BRABE P-selectin-like OS=Branchiostoma belcheri OX=7741 GN=LOC109466428 PE=4 SV=1, Branchiostoma_belcheri_tr_A0A6P4YCR0_A0A6P4YCR0_BRABE tr|A0A6P4YCR0|A0A6P4YCR0_BRABE Polycystic kidney disease and receptor for egg jelly-related protein-like OS=Branchiostoma belcheri OX=7741 GN=LOC109468399 PE=4 SV=1
OG0000006	Amphimedon_queenslandica_tr_A0A1X7T448_A0A1X7T448_AMPQE tr_A0A1X7T448_A0A1X7T448_AMPQE Uncharacterized protein OS=Amphimedon queenslandica OX=400682 PE=4 SV=1	Branchiostoma_belcheri_tr_A0A6P4ZEY0_A0A6P4ZEY0_BRABE tr|A0A6P4ZEY0|A0A6P4ZEY0_BRABE Fibropellin-1-like OS=Branchiostoma belcheri OX=7741 GN=LOC109472808 PE=4 SV=1
OG0000007	Amphimedon_queenslandica_tr_A0A1X7VF43_A0A1X7VF43_AMPQE tr_A0A1X7VF43_A0A1X7VF43_AMPQE EGF-like domain-containing protein OS=Amphimedon queenslandica OX=400682 PE=4 SV=1, Amphimedon_queenslandica_tr_A0A1X7V609_A0A1X7V609_AMPQE tr_A0A1X7V609_A0A1X7V609_AMPQE EGF-like domain-containing protein OS=Amphimedon queenslandica OX=400682 PE=4 SV=1, Amphimedon_queenslandica_tr_A0A1X7SHW9_A0A1X7SHW9_AMPQE tr_A0A1X7SHW9_A0A1X7SHW9_AMPQE Uncharacterized protein OS=Amphimedon queenslandica OX=400682 PE=4 SV=1, Amphimedon_queenslandica_tr_A0A1X7V0H0_A0A1X7V0H0_AMPQE tr_A0A1X7V0H0_A0A1X7V0H0_AMPQE Uncharacterized protein OS=Amphimedon queenslandica OX=400682 PE=4 SV=1, Amphimedon_queenslandica_tr_A0A1X7SVD2_A0A1X7SVD2_AMPQE tr_A0A1X7SVD2_A0A1X7SVD2_AMPQE Uncharacterized protein OS=Amphimedon queenslandica OX=400682 PE=4 SV=1, Amphimedon_queenslandica_tr_A0A1X7SLA6_A0A1X7SLA6_AMPQE tr_A0A1X7SLA6_A0A1X7SLA6_AMPQE Uncharacterized protein OS=Amphimedon queenslandica OX=400682 PE=4 SV=1, Amphimedon_queenslandica_tr_A0A1X7TEE8_A0A1X7TEE8_AMPQE tr_A0A1X7TEE8_A0A1X7TEE8_AMPQE Uncharacterized protein OS=Amphimedon queenslandica OX=400682 PE=4 SV=1, Amphimedon_queenslandica_tr_A0A1X7U208_A0A1X7U208_AMPQE tr_A0A1X7U208_A0A1X7U208_AMPQE Uncharacterized protein OS=Amphimedon queenslandica OX=400682 PE=4 SV=1	Branchiostoma_belcheri_tr_A0A6P4ZYA7_A0A6P4ZYA7_BRABE tr|A0A6P4ZYA7|A0A6P4ZYA7_BRABE chitinase OS=Branchiostoma belcheri OX=7741 GN=LOC109483343 PE=4 SV=1, Branchiostoma_belcheri_tr_A0A6P4ZVZ3_A0A6P4ZVZ3_BRABE tr|A0A6P4ZVZ3|A0A6P4ZVZ3_BRABE Signal peptide_ CUB and EGF-like domain-containing protein 2 OS=Branchiostoma belcheri OX=7741 GN=LOC109480414 PE=4 SV=1
OG0000007	Amphimedon_queenslandica_tr_A0A1X7STU5_A0A1X7STU5_AMPQE tr_A0A1X7STU5_A0A1X7STU5_AMPQE Uncharacterized protein OS=Amphimedon queenslandica OX=400682 PE=4 SV=1, Amphimedon_queenslandica_tr_A0A1X7SF39_A0A1X7SF39_AMPQE tr_A0A1X7SF39_A0A1X7SF39_AMPQE Uncharacterized protein OS=Amphimedon queenslandica OX=400682 PE=4 SV=1	Branchiostoma_belcheri_tr_A0A6P5ABK3_A0A6P5ABK3_BRABE tr|A0A6P5ABK3|A0A6P5ABK3_BRABE Multiple epidermal growth factor-like domains protein 6 OS=Branchiostoma belcheri OX=7741 GN=LOC109487470 PE=4 SV=1
OG0000007	Amphimedon_queenslandica_tr_A0A1X7TP49_A0A1X7TP49_AMPQE tr_A0A1X7TP49_A0A1X7TP49_AMPQE Uncharacterized protein OS=Amphimedon queenslandica OX=400682 PE=4 SV=1, Amphimedon_queenslandica_tr_A0A1X7SDX5_A0A1X7SDX5_AMPQE tr_A0A1X7SDX5_A0A1X7SDX5_AMPQE EGF-like domain-containing protein OS=Amphimedon queenslandica OX=400682 PE=4 SV=1, Amphimedon_queenslandica_tr_A0A1X7UZT4_A0A1X7UZT4_AMPQE tr_A0A1X7UZT4_A0A1X7UZT4_AMPQE EGF-like domain-containing protein OS=Amphimedon queenslandica OX=400682 PE=4 SV=1	Branchiostoma_belcheri_tr_A0A6P5AHD3_A0A6P5AHD3_BRABE tr|A0A6P5AHD3|A0A6P5AHD3_BRABE Signal peptide_ CUB and EGF-like domain-containing protein 1 OS=Branchiostoma belcheri OX=7741 GN=LOC109482855 PE=4 SV=1
OG0000007	Amphimedon_queenslandica_tr_A0A1X7UBV4_A0A1X7UBV4_AMPQE tr_A0A1X7UBV4_A0A1X7UBV4_AMPQE Uncharacterized protein OS=Amphimedon queenslandica OX=400682 PE=4 SV=1, Amphimedon_queenslandica_tr_A0A1X7T313_A0A1X7T313_AMPQE tr_A0A1X7T313_A0A1X7T313_AMPQE Uncharacterized protein OS=Amphimedon queenslandica OX=400682 PE=4 SV=1	Branchiostoma_belcheri_tr_A0A6P4Z4U7_A0A6P4Z4U7_BRABE tr|A0A6P4Z4U7|A0A6P4Z4U7_BRABE Fibulin-5-like isoform X2 OS=Branchiostoma belcheri OX=7741 GN=LOC109475455 PE=4 SV=1, Branchiostoma_belcheri_tr_A0A6P4ZCJ1_A0A6P4ZCJ1_BRABE tr|A0A6P4ZCJ1|A0A6P4ZCJ1_BRABE Fibulin-1-like isoform X3 OS=Branchiostoma belcheri OX=7741 GN=LOC109475455 PE=4 SV=1, Branchiostoma_belcheri_tr_A0A6P4Z2V4_A0A6P4Z2V4_BRABE tr|A0A6P4Z2V4|A0A6P4Z2V4_BRABE Fibrillin-1-like OS=Branchiostoma belcheri OX=7741 GN=LOC109472848 PE=4 SV=1, Branchiostoma_belcheri_tr_A0A6P4ZG26_A0A6P4ZG26_BRABE tr|A0A6P4ZG26|A0A6P4ZG26_BRABE Multiple epidermal growth factor-like domains protein 6 OS=Branchiostoma belcheri OX=7741 GN=LOC109478527 PE=4 SV=1
OG0000007	Amphimedon_queenslandica_tr_A0A1X7T9P6_A0A1X7T9P6_AMPQE tr_A0A1X7T9P6_A0A1X7T9P6_AMPQE Uncharacterized protein OS=Amphimedon queenslandica OX=400682 PE=4 SV=1	Branchiostoma_belcheri_tr_A0A6P4YRX1_A0A6P4YRX1_BRABE tr|A0A6P4YRX1|A0A6P4YRX1_BRABE Complement component C1q receptor-like OS=Branchiostoma belcheri OX=7741 GN=LOC109470104 PE=4 SV=1, Branchiostoma_belcheri_tr_A0A6P4ZYL4_A0A6P4ZYL4_BRABE tr|A0A6P4ZYL4|A0A6P4ZYL4_BRABE Signal peptide_ CUB and EGF-like domain-containing protein 2 OS=Branchiostoma belcheri OX=7741 GN=LOC109481072 PE=4 SV=1
OG0000007	Amphimedon_queenslandica_tr_A0A1X7SJM0_A0A1X7SJM0_AMPQE tr_A0A1X7SJM0_A0A1X7SJM0_AMPQE Uncharacterized protein OS=Amphimedon queenslandica OX=400682 PE=4 SV=1, Amphimedon_queenslandica_tr_A0A1X7SKZ4_A0A1X7SKZ4_AMPQE tr_A0A1X7SKZ4_A0A1X7SKZ4_AMPQE Uncharacterized protein OS=Amphimedon queenslandica OX=400682 PE=4 SV=1, Amphimedon_queenslandica_tr_A0A1X7STM4_A0A1X7STM4_AMPQE tr_A0A1X7STM4_A0A1X7STM4_AMPQE Uncharacterized protein OS=Amphimedon queenslandica OX=400682 PE=4 SV=1	Branchiostoma_belcheri_tr_A0A6P4YU65_A0A6P4YU65_BRABE tr|A0A6P4YU65|A0A6P4YU65_BRABE Signal peptide_ CUB and EGF-like domain-containing protein 3 OS=Branchiostoma belcheri OX=7741 GN=LOC109467308 PE=4 SV=1, Branchiostoma_belcheri_tr_A0A6P4Y5P1_A0A6P4Y5P1_BRABE tr|A0A6P4Y5P1|A0A6P4Y5P1_BRABE Pro-epidermal growth factor-like OS=Branchiostoma belcheri OX=7741 GN=LOC109465016 PE=4 SV=1, Branchiostoma_belcheri_tr_A0A6P4XUX5_A0A6P4XUX5_BRABE tr|A0A6P4XUX5|A0A6P4XUX5_BRABE Signal peptide_ CUB and EGF-like domain-containing protein 2 OS=Branchiostoma belcheri OX=7741 GN=LOC109463500 PE=4 SV=1, Branchiostoma_belcheri_tr_A0A6P4ZPG5_A0A6P4ZPG5_BRABE tr|A0A6P4ZPG5|A0A6P4ZPG5_BRABE Fibrillin-1-like OS=Branchiostoma belcheri OX=7741 GN=LOC109475398 PE=4 SV=1
OG0000007	Amphimedon_queenslandica_tr_A0A1X7T0Q0_A0A1X7T0Q0_AMPQE tr_A0A1X7T0Q0_A0A1X7T0Q0_AMPQE EGF_CA domain-containing protein OS=Amphimedon queenslandica OX=400682 PE=4 SV=1	Branchiostoma_belcheri_tr_A0A6P4ZPP5_A0A6P4ZPP5_BRABE tr|A0A6P4ZPP5|A0A6P4ZPP5_BRABE Matrilin-2-like OS=Branchiostoma belcheri OX=7741 GN=LOC109476458 PE=4 SV=1
OG0000007	Amphimedon_queenslandica_tr_A0A1X7SFP3_A0A1X7SFP3_AMPQE tr_A0A1X7SFP3_A0A1X7SFP3_AMPQE Uncharacterized protein OS=Amphimedon queenslandica OX=400682 PE=4 SV=1	Branchiostoma_belcheri_tr_A0A6P4Z1X0_A0A6P4Z1X0_BRABE tr|A0A6P4Z1X0|A0A6P4Z1X0_BRABE LOW QUALITY PROTEIN_ uncharacterized protein LOC109474630 OS=Branchiostoma belcheri OX=7741 GN=LOC109474630 PE=3 SV=1, Branchiostoma_belcheri_tr_A0A6P5ATI0_A0A6P5ATI0_BRABE tr|A0A6P5ATI0|A0A6P5ATI0_BRABE Uncharacterized protein LOC109486081 OS=Branchiostoma belcheri OX=7741 GN=LOC109486081 PE=3 SV=1, Branchiostoma_belcheri_tr_A0A6P4YJ45_A0A6P4YJ45_BRABE tr|A0A6P4YJ45|A0A6P4YJ45_BRABE Mucin-like protein OS=Branchiostoma belcheri OX=7741 GN=LOC109464525 PE=4 SV=1, Branchiostoma_belcheri_tr_A0A6P4YLQ3_A0A6P4YLQ3_BRABE tr|A0A6P4YLQ3|A0A6P4YLQ3_BRABE Mucin-like protein OS=Branchiostoma belcheri OX=7741 GN=LOC109474529 PE=4 SV=1, Branchiostoma_belcheri_tr_A0A6P4YUB6_A0A6P4YUB6_BRABE tr|A0A6P4YUB6|A0A6P4YUB6_BRABE Protein mesh-like OS=Branchiostoma belcheri OX=7741 GN=LOC109472588 PE=4 SV=1, Branchiostoma_belcheri_tr_A0A6P4Z1X2_A0A6P4Z1X2_BRABE tr|A0A6P4Z1X2|A0A6P4Z1X2_BRABE Mucin-like protein OS=Branchiostoma belcheri OX=7741 GN=LOC109472589 PE=4 SV=1, Branchiostoma_belcheri_tr_A0A6P4YGC1_A0A6P4YGC1_BRABE tr|A0A6P4YGC1|A0A6P4YGC1_BRABE Uncharacterized protein LOC109465122 OS=Branchiostoma belcheri OX=7741 GN=LOC109465122 PE=3 SV=1, Branchiostoma_belcheri_tr_A0A6P4YVT9_A0A6P4YVT9_BRABE tr|A0A6P4YVT9|A0A6P4YVT9_BRABE Fibrillin-1-like OS=Branchiostoma belcheri OX=7741 GN=LOC109468912 PE=3 SV=1, Branchiostoma_belcheri_tr_A0A6P4ZE55_A0A6P4ZE55_BRABE tr|A0A6P4ZE55|A0A6P4ZE55_BRABE Mucin-like protein isoform X1 OS=Branchiostoma belcheri OX=7741 GN=LOC109472591 PE=4 SV=1, Branchiostoma_belcheri_tr_A0A6P4YUB8_A0A6P4YUB8_BRABE tr|A0A6P4YUB8|A0A6P4YUB8_BRABE Mucin-like protein isoform X2 OS=Branchiostoma belcheri OX=7741 GN=LOC109472591 PE=4 SV=1, Branchiostoma_belcheri_tr_A0A6P5AEP3_A0A6P5AEP3_BRABE tr|A0A6P5AEP3|A0A6P5AEP3_BRABE Mucin-like protein OS=Branchiostoma belcheri OX=7741 GN=LOC109483183 PE=3 SV=1, Branchiostoma_belcheri_tr_A0A6P5A6A8_A0A6P5A6A8_BRABE tr|A0A6P5A6A8|A0A6P5A6A8_BRABE Fibrillin-2-like OS=Branchiostoma belcheri OX=7741 GN=LOC109483246 PE=4 SV=1, Branchiostoma_belcheri_tr_A0A6P4XQJ4_A0A6P4XQJ4_BRABE tr|A0A6P4XQJ4|A0A6P4XQJ4_BRABE Uncharacterized protein LOC109465872 OS=Branchiostoma belcheri OX=7741 GN=LOC109465872 PE=3 SV=1
OG0000007	Amphimedon_queenslandica_tr_A0A1X7SSI1_A0A1X7SSI1_AMPQE tr_A0A1X7SSI1_A0A1X7SSI1_AMPQE Fibulin-5 OS=Amphimedon queenslandica OX=400682 PE=4 SV=1, Amphimedon_queenslandica_tr_A0A1X7T1V8_A0A1X7T1V8_AMPQE tr_A0A1X7T1V8_A0A1X7T1V8_AMPQE EGF_CA domain-containing protein OS=Amphimedon queenslandica OX=400682 PE=4 SV=1	Branchiostoma_belcheri_tr_A0A6P4ZMJ8_A0A6P4ZMJ8_BRABE tr|A0A6P4ZMJ8|A0A6P4ZMJ8_BRABE Mucin-17-like OS=Branchiostoma belcheri OX=7741 GN=LOC109475902 PE=4 SV=1
OG0000007	Amphimedon_queenslandica_tr_A0A1X7VHY5_A0A1X7VHY5_AMPQE tr_A0A1X7VHY5_A0A1X7VHY5_AMPQE Uncharacterized protein OS=Amphimedon queenslandica OX=400682 PE=4 SV=1, Amphimedon_queenslandica_tr_A0A1X7SWG6_A0A1X7SWG6_AMPQE tr_A0A1X7SWG6_A0A1X7SWG6_AMPQE Uncharacterized protein OS=Amphimedon queenslandica OX=400682 PE=4 SV=1, Amphimedon_queenslandica_tr_A0A1X7SUC7_A0A1X7SUC7_AMPQE tr_A0A1X7SUC7_A0A1X7SUC7_AMPQE NIDO domain-containing protein OS=Amphimedon queenslandica OX=400682 PE=4 SV=1, Amphimedon_queenslandica_tr_A0A1X7UEE9_A0A1X7UEE9_AMPQE tr_A0A1X7UEE9_A0A1X7UEE9_AMPQE Uncharacterized protein OS=Amphimedon queenslandica OX=400682 GN=100638351 PE=4 SV=1, Amphimedon_queenslandica_tr_A0A1X7SED7_A0A1X7SED7_AMPQE tr_A0A1X7SED7_A0A1X7SED7_AMPQE NIDO domain-containing protein OS=Amphimedon queenslandica OX=400682 PE=4 SV=1	Branchiostoma_belcheri_tr_A0A6P5A6P6_A0A6P5A6P6_BRABE tr|A0A6P5A6P6|A0A6P5A6P6_BRABE Sushi_ nidogen and EGF-like domain-containing protein 1 OS=Branchiostoma belcheri OX=7741 GN=LOC109480956 PE=4 SV=1, Branchiostoma_belcheri_tr_A0A6P5AB78_A0A6P5AB78_BRABE tr|A0A6P5AB78|A0A6P5AB78_BRABE chitinase OS=Branchiostoma belcheri OX=7741 GN=LOC109481008 PE=4 SV=1, Branchiostoma_belcheri_tr_A0A6P4ZLM4_A0A6P4ZLM4_BRABE tr|A0A6P4ZLM4|A0A6P4ZLM4_BRABE Sushi_ nidogen and EGF-like domain-containing protein 1 OS=Branchiostoma belcheri OX=7741 GN=LOC109474608 PE=4 SV=1, Branchiostoma_belcheri_tr_A0A6P4Z0Q0_A0A6P4Z0Q0_BRABE tr|A0A6P4Z0Q0|A0A6P4Z0Q0_BRABE Sushi_ nidogen and EGF-like domain-containing protein 1 OS=Branchiostoma belcheri OX=7741 GN=LOC109478103 PE=4 SV=1, Branchiostoma_belcheri_tr_A0A6P4ZMA3_A0A6P4ZMA3_BRABE tr|A0A6P4ZMA3|A0A6P4ZMA3_BRABE Sushi_ nidogen and EGF-like domain-containing protein 1 OS=Branchiostoma belcheri OX=7741 GN=LOC109478100 PE=4 SV=1, Branchiostoma_belcheri_tr_A0A6P4ZK34_A0A6P4ZK34_BRABE tr|A0A6P4ZK34|A0A6P4ZK34_BRABE Sushi_ nidogen and EGF-like domain-containing protein 1 isoform X1 OS=Branchiostoma belcheri OX=7741 GN=LOC109474179 PE=4 SV=1, Branchiostoma_belcheri_tr_A0A6P4Z7V3_A0A6P4Z7V3_BRABE tr|A0A6P4Z7V3|A0A6P4Z7V3_BRABE Stabilin-2-like isoform X2 OS=Branchiostoma belcheri OX=7741 GN=LOC109474179 PE=4 SV=1, Branchiostoma_belcheri_tr_A0A6P4YFG6_A0A6P4YFG6_BRABE tr|A0A6P4YFG6|A0A6P4YFG6_BRABE Uncharacterized protein LOC109464868 OS=Branchiostoma belcheri OX=7741 GN=LOC109464868 PE=4 SV=1
OG0000007	Amphimedon_queenslandica_tr_A0A1X7U2X5_A0A1X7U2X5_AMPQE tr_A0A1X7U2X5_A0A1X7U2X5_AMPQE Uncharacterized protein OS=Amphimedon queenslandica OX=400682 GN=109585006 PE=4 SV=1, Amphimedon_queenslandica_tr_A0A1X7TZR4_A0A1X7TZR4_AMPQE tr_A0A1X7TZR4_A0A1X7TZR4_AMPQE Uncharacterized protein OS=Amphimedon queenslandica OX=400682 PE=4 SV=1, Amphimedon_queenslandica_tr_A0A1X7V5I7_A0A1X7V5I7_AMPQE tr_A0A1X7V5I7_A0A1X7V5I7_AMPQE Uncharacterized protein OS=Amphimedon queenslandica OX=400682 PE=4 SV=1, Amphimedon_queenslandica_tr_A0A1X7T6D5_A0A1X7T6D5_AMPQE tr_A0A1X7T6D5_A0A1X7T6D5_AMPQE Uncharacterized protein OS=Amphimedon queenslandica OX=400682 GN=105315278 PE=4 SV=1	Branchiostoma_belcheri_tr_A0A6P5A598_A0A6P5A598_BRABE tr|A0A6P5A598|A0A6P5A598_BRABE Sushi domain-containing protein 2-like OS=Branchiostoma belcheri OX=7741 GN=LOC109479432 PE=4 SV=1, Branchiostoma_belcheri_tr_A0A6P4YCP4_A0A6P4YCP4_BRABE tr|A0A6P4YCP4|A0A6P4YCP4_BRABE Sushi domain-containing protein 2-like OS=Branchiostoma belcheri OX=7741 GN=LOC109462568 PE=4 SV=1, Branchiostoma_belcheri_tr_A0A6P4Z9B7_A0A6P4Z9B7_BRABE tr|A0A6P4Z9B7|A0A6P4Z9B7_BRABE Sushi domain-containing protein 2-like OS=Branchiostoma belcheri OX=7741 GN=LOC109474598 PE=4 SV=1, Branchiostoma_belcheri_tr_A0A6P4ZXY0_A0A6P4ZXY0_BRABE tr|A0A6P4ZXY0|A0A6P4ZXY0_BRABE Sushi domain-containing protein 2-like isoform X2 OS=Branchiostoma belcheri OX=7741 GN=LOC109478601 PE=4 SV=1, Branchiostoma_belcheri_tr_A0A6P5A218_A0A6P5A218_BRABE tr|A0A6P5A218|A0A6P5A218_BRABE Sushi domain-containing protein 2-like isoform X1 OS=Branchiostoma belcheri OX=7741 GN=LOC109478601 PE=4 SV=1
OG0000007	Amphimedon_queenslandica_tr_A0A1X7UXG1_A0A1X7UXG1_AMPQE tr_A0A1X7UXG1_A0A1X7UXG1_AMPQE Uncharacterized protein OS=Amphimedon queenslandica OX=400682 PE=4 SV=1, Amphimedon_queenslandica_tr_A0A1X7SNX2_A0A1X7SNX2_AMPQE tr_A0A1X7SNX2_A0A1X7SNX2_AMPQE VWFD domain-containing protein OS=Amphimedon queenslandica OX=400682 PE=4 SV=1, Amphimedon_queenslandica_tr_A0A1X7U0H9_A0A1X7U0H9_AMPQE tr_A0A1X7U0H9_A0A1X7U0H9_AMPQE AMOP domain-containing protein OS=Amphimedon queenslandica OX=400682 PE=4 SV=1, Amphimedon_queenslandica_tr_A0A1X7VEX8_A0A1X7VEX8_AMPQE tr_A0A1X7VEX8_A0A1X7VEX8_AMPQE Uncharacterized protein OS=Amphimedon queenslandica OX=400682 PE=4 SV=1, Amphimedon_queenslandica_tr_A0A1X7U0T3_A0A1X7U0T3_AMPQE tr_A0A1X7U0T3_A0A1X7U0T3_AMPQE VWFD domain-containing protein OS=Amphimedon queenslandica OX=400682 PE=4 SV=1, Amphimedon_queenslandica_tr_A0A1X7TZY4_A0A1X7TZY4_AMPQE tr_A0A1X7TZY4_A0A1X7TZY4_AMPQE Uncharacterized protein OS=Amphimedon queenslandica OX=400682 PE=4 SV=1, Amphimedon_queenslandica_tr_A0A1X7VE59_A0A1X7VE59_AMPQE tr_A0A1X7VE59_A0A1X7VE59_AMPQE Uncharacterized protein OS=Amphimedon queenslandica OX=400682 PE=4 SV=1, Amphimedon_queenslandica_tr_A0A1X7VFS2_A0A1X7VFS2_AMPQE tr_A0A1X7VFS2_A0A1X7VFS2_AMPQE VWFD domain-containing protein OS=Amphimedon queenslandica OX=400682 PE=4 SV=1, Amphimedon_queenslandica_tr_A0A1X7TQL5_A0A1X7TQL5_AMPQE tr_A0A1X7TQL5_A0A1X7TQL5_AMPQE Uncharacterized protein OS=Amphimedon queenslandica OX=400682 PE=4 SV=1, Amphimedon_queenslandica_tr_A0A1X7VD60_A0A1X7VD60_AMPQE tr_A0A1X7VD60_A0A1X7VD60_AMPQE EGF-like domain-containing protein OS=Amphimedon queenslandica OX=400682 PE=4 SV=1, Amphimedon_queenslandica_tr_A0A1X7VCF9_A0A1X7VCF9_AMPQE tr_A0A1X7VCF9_A0A1X7VCF9_AMPQE Uncharacterized protein OS=Amphimedon queenslandica OX=400682 PE=4 SV=1, Amphimedon_queenslandica_tr_A0A1X7TQV9_A0A1X7TQV9_AMPQE tr_A0A1X7TQV9_A0A1X7TQV9_AMPQE Uncharacterized protein OS=Amphimedon queenslandica OX=400682 PE=4 SV=1, Amphimedon_queenslandica_tr_A0A1X7TR13_A0A1X7TR13_AMPQE tr_A0A1X7TR13_A0A1X7TR13_AMPQE EGF-like domain-containing protein OS=Amphimedon queenslandica OX=400682 PE=4 SV=1, Amphimedon_queenslandica_tr_A0A1X7TH31_A0A1X7TH31_AMPQE tr_A0A1X7TH31_A0A1X7TH31_AMPQE EGF-like domain-containing protein OS=Amphimedon queenslandica OX=400682 PE=4 SV=1	Branchiostoma_belcheri_tr_A0A6P4ZKY2_A0A6P4ZKY2_BRABE tr|A0A6P4ZKY2|A0A6P4ZKY2_BRABE Mucin-like protein OS=Branchiostoma belcheri OX=7741 GN=LOC109475527 PE=4 SV=1, Branchiostoma_belcheri_tr_A0A6P4YF28_A0A6P4YF28_BRABE tr|A0A6P4YF28|A0A6P4YF28_BRABE Uncharacterized protein LOC109469101 OS=Branchiostoma belcheri OX=7741 GN=LOC109469101 PE=3 SV=1, Branchiostoma_belcheri_tr_A0A6P4Z7I9_A0A6P4Z7I9_BRABE tr|A0A6P4Z7I9|A0A6P4Z7I9_BRABE Uncharacterized protein LOC109474122 OS=Branchiostoma belcheri OX=7741 GN=LOC109474122 PE=4 SV=1, Branchiostoma_belcheri_tr_A0A6P4ZFI3_A0A6P4ZFI3_BRABE tr|A0A6P4ZFI3|A0A6P4ZFI3_BRABE Uncharacterized protein LOC109476260 OS=Branchiostoma belcheri OX=7741 GN=LOC109476260 PE=4 SV=1, Branchiostoma_belcheri_tr_A0A6P4Y1Z0_A0A6P4Y1Z0_BRABE tr|A0A6P4Y1Z0|A0A6P4Y1Z0_BRABE Uncharacterized protein LOC109464016 OS=Branchiostoma belcheri OX=7741 GN=LOC109464016 PE=4 SV=1, Branchiostoma_belcheri_tr_A0A6P4Z3Z2_A0A6P4Z3Z2_BRABE tr|A0A6P4Z3Z2|A0A6P4Z3Z2_BRABE Uncharacterized protein LOC109469973 OS=Branchiostoma belcheri OX=7741 GN=LOC109469973 PE=4 SV=1, Branchiostoma_belcheri_tr_A0A6P4Z9J9_A0A6P4Z9J9_BRABE tr|A0A6P4Z9J9|A0A6P4Z9J9_BRABE Uncharacterized protein LOC109472424 isoform X2 OS=Branchiostoma belcheri OX=7741 GN=LOC109472424 PE=4 SV=1, Branchiostoma_belcheri_tr_A0A6P4ZDL3_A0A6P4ZDL3_BRABE tr|A0A6P4ZDL3|A0A6P4ZDL3_BRABE Uncharacterized protein LOC109472424 isoform X1 OS=Branchiostoma belcheri OX=7741 GN=LOC109472424 PE=4 SV=1, Branchiostoma_belcheri_tr_A0A6P4Y1X0_A0A6P4Y1X0_BRABE tr|A0A6P4Y1X0|A0A6P4Y1X0_BRABE Uncharacterized protein LOC109463997 OS=Branchiostoma belcheri OX=7741 GN=LOC109463997 PE=4 SV=1, Branchiostoma_belcheri_tr_A0A6P4ZPG6_A0A6P4ZPG6_BRABE tr|A0A6P4ZPG6|A0A6P4ZPG6_BRABE Mucin-like protein OS=Branchiostoma belcheri OX=7741 GN=LOC109484263 PE=4 SV=1, Branchiostoma_belcheri_tr_A0A6P4ZSR8_A0A6P4ZSR8_BRABE tr|A0A6P4ZSR8|A0A6P4ZSR8_BRABE Uncharacterized protein LOC109476214 OS=Branchiostoma belcheri OX=7741 GN=LOC109476214 PE=4 SV=1, Branchiostoma_belcheri_tr_A0A6P4YTS1_A0A6P4YTS1_BRABE tr|A0A6P4YTS1|A0A6P4YTS1_BRABE Mucin-like protein OS=Branchiostoma belcheri OX=7741 GN=LOC109472420 PE=4 SV=1, Branchiostoma_belcheri_tr_A0A6P4ZDM5_A0A6P4ZDM5_BRABE tr|A0A6P4ZDM5|A0A6P4ZDM5_BRABE Mucin-like protein OS=Branchiostoma belcheri OX=7741 GN=LOC109477832 PE=4 SV=1, Branchiostoma_belcheri_tr_A0A6P4XSI4_A0A6P4XSI4_BRABE tr|A0A6P4XSI4|A0A6P4XSI4_BRABE Mucin-like protein OS=Branchiostoma belcheri OX=7741 GN=LOC109466325 PE=4 SV=1, Branchiostoma_belcheri_tr_A0A6P4ZR88_A0A6P4ZR88_BRABE tr|A0A6P4ZR88|A0A6P4ZR88_BRABE Mucin-like protein OS=Branchiostoma belcheri OX=7741 GN=LOC109475804 PE=4 SV=1, Branchiostoma_belcheri_tr_A0A6P4YBG1_A0A6P4YBG1_BRABE tr|A0A6P4YBG1|A0A6P4YBG1_BRABE Mucin-like protein OS=Branchiostoma belcheri OX=7741 GN=LOC109463724 PE=4 SV=1, Branchiostoma_belcheri_tr_A0A6P4Z8K3_A0A6P4Z8K3_BRABE tr|A0A6P4Z8K3|A0A6P4Z8K3_BRABE Mucin-like protein isoform X2 OS=Branchiostoma belcheri OX=7741 GN=LOC109476497 PE=4 SV=1, Branchiostoma_belcheri_tr_A0A6P4ZPT9_A0A6P4ZPT9_BRABE tr|A0A6P4ZPT9|A0A6P4ZPT9_BRABE Mucin-like protein isoform X1 OS=Branchiostoma belcheri OX=7741 GN=LOC109476497 PE=4 SV=1, Branchiostoma_belcheri_tr_A0A6P4ZRU5_A0A6P4ZRU5_BRABE tr|A0A6P4ZRU5|A0A6P4ZRU5_BRABE Mucin-like protein OS=Branchiostoma belcheri OX=7741 GN=LOC109479293 PE=4 SV=1, Branchiostoma_belcheri_tr_A0A6P4YIJ6_A0A6P4YIJ6_BRABE tr|A0A6P4YIJ6|A0A6P4YIJ6_BRABE Mucin-like protein OS=Branchiostoma belcheri OX=7741 GN=LOC109464339 PE=4 SV=1, Branchiostoma_belcheri_tr_A0A6P4ZN99_A0A6P4ZN99_BRABE tr|A0A6P4ZN99|A0A6P4ZN99_BRABE Mucin-like protein OS=Branchiostoma belcheri OX=7741 GN=LOC109480479 PE=4 SV=1, Branchiostoma_belcheri_tr_A0A6P5A167_A0A6P5A167_BRABE tr|A0A6P5A167|A0A6P5A167_BRABE Mucin-like protein isoform X1 OS=Branchiostoma belcheri OX=7741 GN=LOC109479433 PE=4 SV=1, Branchiostoma_belcheri_tr_A0A6P4YBH4_A0A6P4YBH4_BRABE tr|A0A6P4YBH4|A0A6P4YBH4_BRABE Mucin-like protein OS=Branchiostoma belcheri OX=7741 GN=LOC109466323 PE=4 SV=1, Branchiostoma_belcheri_tr_A0A6P4YF31_A0A6P4YF31_BRABE tr|A0A6P4YF31|A0A6P4YF31_BRABE Mucin-like protein isoform X2 OS=Branchiostoma belcheri OX=7741 GN=LOC109467148 PE=4 SV=1, Branchiostoma_belcheri_tr_A0A6P4Y885_A0A6P4Y885_BRABE tr|A0A6P4Y885|A0A6P4Y885_BRABE Mucin-like protein isoform X1 OS=Branchiostoma belcheri OX=7741 GN=LOC109467148 PE=4 SV=1, Branchiostoma_belcheri_tr_A0A6P4ZRJ4_A0A6P4ZRJ4_BRABE tr|A0A6P4ZRJ4|A0A6P4ZRJ4_BRABE Mucin-like protein OS=Branchiostoma belcheri OX=7741 GN=LOC109476989 PE=4 SV=1, Branchiostoma_belcheri_tr_A0A6P4ZQG1_A0A6P4ZQG1_BRABE tr|A0A6P4ZQG1|A0A6P4ZQG1_BRABE Mucin-like protein OS=Branchiostoma belcheri OX=7741 GN=LOC109481034 PE=4 SV=1, Branchiostoma_belcheri_tr_A0A6P5AF96_A0A6P5AF96_BRABE tr|A0A6P5AF96|A0A6P5AF96_BRABE Uncharacterized protein LOC109482239 OS=Branchiostoma belcheri OX=7741 GN=LOC109482239 PE=4 SV=1, Branchiostoma_belcheri_tr_A0A6P4ZGY8_A0A6P4ZGY8_BRABE tr|A0A6P4ZGY8|A0A6P4ZGY8_BRABE Mucin-like protein OS=Branchiostoma belcheri OX=7741 GN=LOC109482238 PE=4 SV=1, Branchiostoma_belcheri_tr_A0A6P4ZD52_A0A6P4ZD52_BRABE tr|A0A6P4ZD52|A0A6P4ZD52_BRABE LOW QUALITY PROTEIN_ mucin-like protein OS=Branchiostoma belcheri OX=7741 GN=LOC109473576 PE=4 SV=1
OG0000008	Amphimedon_queenslandica_tr_A0A1X7ULX8_A0A1X7ULX8_AMPQE tr_A0A1X7ULX8_A0A1X7ULX8_AMPQE EGF-like domain-containing protein OS=Amphimedon queenslandica OX=400682 PE=4 SV=1, Amphimedon_queenslandica_tr_A0A1X7US64_A0A1X7US64_AMPQE tr_A0A1X7US64_A0A1X7US64_AMPQE Uncharacterized protein OS=Amphimedon queenslandica OX=400682 PE=4 SV=1, Amphimedon_queenslandica_tr_A0A1X7UT47_A0A1X7UT47_AMPQE tr_A0A1X7UT47_A0A1X7UT47_AMPQE EGF-like domain-containing protein OS=Amphimedon queenslandica OX=400682 PE=4 SV=1	Branchiostoma_belcheri_tr_A0A6P4ZT28_A0A6P4ZT28_BRABE tr|A0A6P4ZT28|A0A6P4ZT28_BRABE Fibropellin-1-like OS=Branchiostoma belcheri OX=7741 GN=LOC109476303 PE=4 SV=1
