Orthogroup	Porifera_Demospongiae_Amphimedon_queenslandica	Chordata_Amphioxiformes_Branchiostoma_belcheri
OG0000008	Amphimedon_queenslandica_tr_A0A1X7VB30_A0A1X7VB30_AMPQE tr_A0A1X7VB30_A0A1X7VB30_AMPQE Uncharacterized protein OS=Amphimedon queenslandica OX=400682 PE=4 SV=1	Branchiostoma_belcheri_tr_A0A6P4ZYN0_A0A6P4ZYN0_BRABE tr|A0A6P4ZYN0|A0A6P4ZYN0_BRABE Uncharacterized protein LOC109481089 OS=Branchiostoma belcheri OX=7741 GN=LOC109481089 PE=4 SV=1, Branchiostoma_belcheri_tr_A0A6P4Y3R6_A0A6P4Y3R6_BRABE tr|A0A6P4Y3R6|A0A6P4Y3R6_BRABE C-type lectin-like OS=Branchiostoma belcheri OX=7741 GN=LOC109464492 PE=4 SV=1, Branchiostoma_belcheri_tr_A0A6P5ABL2_A0A6P5ABL2_BRABE tr|A0A6P5ABL2|A0A6P5ABL2_BRABE Uncharacterized protein LOC109481125 OS=Branchiostoma belcheri OX=7741 GN=LOC109481125 PE=4 SV=1, Branchiostoma_belcheri_tr_A0A6P4Z038_A0A6P4Z038_BRABE tr|A0A6P4Z038|A0A6P4Z038_BRABE Uromodulin-like OS=Branchiostoma belcheri OX=7741 GN=LOC109474144 PE=4 SV=1
OG0000008	Amphimedon_queenslandica_tr_A0A1X7V143_A0A1X7V143_AMPQE tr_A0A1X7V143_A0A1X7V143_AMPQE Uncharacterized protein OS=Amphimedon queenslandica OX=400682 GN=100633932 PE=4 SV=1, Amphimedon_queenslandica_tr_A0A1X7SNK1_A0A1X7SNK1_AMPQE tr_A0A1X7SNK1_A0A1X7SNK1_AMPQE Uncharacterized protein OS=Amphimedon queenslandica OX=400682 PE=4 SV=1	Branchiostoma_belcheri_tr_A0A6P4YIP8_A0A6P4YIP8_BRABE tr|A0A6P4YIP8|A0A6P4YIP8_BRABE Keratin-associated protein 10-1-like OS=Branchiostoma belcheri OX=7741 GN=LOC109469970 PE=4 SV=1
OG0000009	Amphimedon_queenslandica_tr_A0A1X7V6P7_A0A1X7V6P7_AMPQE tr_A0A1X7V6P7_A0A1X7V6P7_AMPQE Uncharacterized protein OS=Amphimedon queenslandica OX=400682 PE=4 SV=1	Branchiostoma_belcheri_tr_A0A6P4XCX9_A0A6P4XCX9_BRABE tr|A0A6P4XCX9|A0A6P4XCX9_BRABE Signal peptide_ CUB and EGF-like domain-containing protein 3 OS=Branchiostoma belcheri OX=7741 GN=LOC109462301 PE=4 SV=1
OG0000010	Amphimedon_queenslandica_tr_A0A1X7V0J8_A0A1X7V0J8_AMPQE tr_A0A1X7V0J8_A0A1X7V0J8_AMPQE Uncharacterized protein OS=Amphimedon queenslandica OX=400682 GN=105312484 PE=4 SV=1	Branchiostoma_belcheri_tr_A0A6P4Y602_A0A6P4Y602_BRABE tr|A0A6P4Y602|A0A6P4Y602_BRABE Protein sidekick homolog OS=Branchiostoma belcheri OX=7741 GN=LOC109466584 PE=4 SV=1
OG0000010	Amphimedon_queenslandica_tr_A0A1X7UGX2_A0A1X7UGX2_AMPQE tr_A0A1X7UGX2_A0A1X7UGX2_AMPQE Uncharacterized protein OS=Amphimedon queenslandica OX=400682 PE=4 SV=1, Amphimedon_queenslandica_tr_A0A1X7T1P2_A0A1X7T1P2_AMPQE tr_A0A1X7T1P2_A0A1X7T1P2_AMPQE Uncharacterized protein OS=Amphimedon queenslandica OX=400682 PE=4 SV=1	Branchiostoma_belcheri_tr_A0A6P4YGJ2_A0A6P4YGJ2_BRABE tr|A0A6P4YGJ2|A0A6P4YGJ2_BRABE Basement membrane-specific heparan sulfate proteoglycan core protein-like OS=Branchiostoma belcheri OX=7741 GN=LOC109472951 PE=4 SV=1, Branchiostoma_belcheri_tr_A0A6P4ZB96_A0A6P4ZB96_BRABE tr|A0A6P4ZB96|A0A6P4ZB96_BRABE Down syndrome cell adhesion molecule-like protein 1 homolog OS=Branchiostoma belcheri OX=7741 GN=LOC109472953 PE=4 SV=1
OG0000010	Amphimedon_queenslandica_tr_A0A1X7UPV7_A0A1X7UPV7_AMPQE tr_A0A1X7UPV7_A0A1X7UPV7_AMPQE Uncharacterized protein OS=Amphimedon queenslandica OX=400682 PE=4 SV=1, Amphimedon_queenslandica_tr_A0A1X7SQ55_A0A1X7SQ55_AMPQE tr_A0A1X7SQ55_A0A1X7SQ55_AMPQE Uncharacterized protein OS=Amphimedon queenslandica OX=400682 PE=4 SV=1	Branchiostoma_belcheri_tr_A0A6P4ZPG3_A0A6P4ZPG3_BRABE tr|A0A6P4ZPG3|A0A6P4ZPG3_BRABE Protein eyes shut homolog OS=Branchiostoma belcheri OX=7741 GN=LOC109476379 PE=4 SV=1, Branchiostoma_belcheri_tr_A0A6P4Z6X1_A0A6P4Z6X1_BRABE tr|A0A6P4Z6X1|A0A6P4Z6X1_BRABE Basement membrane-specific heparan sulfate proteoglycan core protein-like OS=Branchiostoma belcheri OX=7741 GN=LOC109479630 PE=4 SV=1, Branchiostoma_belcheri_tr_A0A6P4ZU55_A0A6P4ZU55_BRABE tr|A0A6P4ZU55|A0A6P4ZU55_BRABE Basement membrane-specific heparan sulfate proteoglycan core protein-like OS=Branchiostoma belcheri OX=7741 GN=LOC109479985 PE=4 SV=1, Branchiostoma_belcheri_tr_A0A6P5AJD7_A0A6P5AJD7_BRABE tr|A0A6P5AJD7|A0A6P5AJD7_BRABE Pikachurin-like OS=Branchiostoma belcheri OX=7741 GN=LOC109483498 PE=4 SV=1
OG0000013	Amphimedon_queenslandica_tr_A0A1X7UFS4_A0A1X7UFS4_AMPQE tr_A0A1X7UFS4_A0A1X7UFS4_AMPQE Protein Wnt OS=Amphimedon queenslandica OX=400682 PE=3 SV=1, Amphimedon_queenslandica_tr_A9YRX3_A9YRX3_AMPQE tr_A9YRX3_A9YRX3_AMPQE Protein Wnt OS=Amphimedon queenslandica OX=400682 GN=100641115 PE=3 SV=1	Branchiostoma_belcheri_tr_A0A6P4ZRB9_A0A6P4ZRB9_BRABE tr|A0A6P4ZRB9|A0A6P4ZRB9_BRABE Protein Wnt OS=Branchiostoma belcheri OX=7741 GN=LOC109476910 PE=3 SV=1, Branchiostoma_belcheri_tr_A0A6P4ZTM3_A0A6P4ZTM3_BRABE tr|A0A6P4ZTM3|A0A6P4ZTM3_BRABE Protein Wnt OS=Branchiostoma belcheri OX=7741 GN=LOC109477463 PE=3 SV=1
OG0000013	Amphimedon_queenslandica_tr_A0A1X7VSA1_A0A1X7VSA1_AMPQE tr_A0A1X7VSA1_A0A1X7VSA1_AMPQE Protein Wnt OS=Amphimedon queenslandica OX=400682 PE=3 SV=1	Branchiostoma_belcheri_tr_A0A6P4ZF84_A0A6P4ZF84_BRABE tr|A0A6P4ZF84|A0A6P4ZF84_BRABE Protein Wnt OS=Branchiostoma belcheri OX=7741 GN=LOC109478337 PE=3 SV=1, Branchiostoma_belcheri_tr_A0A6P4Z1G2_A0A6P4Z1G2_BRABE tr|A0A6P4Z1G2|A0A6P4Z1G2_BRABE Protein Wnt OS=Branchiostoma belcheri OX=7741 GN=LOC109478337 PE=3 SV=1, Branchiostoma_belcheri_tr_A0A6P4ZWS5_A0A6P4ZWS5_BRABE tr|A0A6P4ZWS5|A0A6P4ZWS5_BRABE Protein Wnt OS=Branchiostoma belcheri OX=7741 GN=LOC109478337 PE=3 SV=1, Branchiostoma_belcheri_tr_A0A6P4ZN33_A0A6P4ZN33_BRABE tr|A0A6P4ZN33|A0A6P4ZN33_BRABE Protein Wnt OS=Branchiostoma belcheri OX=7741 GN=LOC109478337 PE=3 SV=1, Branchiostoma_belcheri_tr_A0A6P4ZF79_A0A6P4ZF79_BRABE tr|A0A6P4ZF79|A0A6P4ZF79_BRABE Protein Wnt OS=Branchiostoma belcheri OX=7741 GN=LOC109478337 PE=3 SV=1, Branchiostoma_belcheri_tr_A0A6P4YGU8_A0A6P4YGU8_BRABE tr|A0A6P4YGU8|A0A6P4YGU8_BRABE Protein Wnt OS=Branchiostoma belcheri OX=7741 GN=LOC109465268 PE=3 SV=1, Branchiostoma_belcheri_tr_A0A6P4YHL1_A0A6P4YHL1_BRABE tr|A0A6P4YHL1|A0A6P4YHL1_BRABE Protein Wnt OS=Branchiostoma belcheri OX=7741 GN=LOC109465418 PE=3 SV=1, Branchiostoma_belcheri_tr_A0A6P4Y7D1_A0A6P4Y7D1_BRABE tr|A0A6P4Y7D1|A0A6P4Y7D1_BRABE Protein Wnt OS=Branchiostoma belcheri OX=7741 GN=LOC109465418 PE=3 SV=1, Branchiostoma_belcheri_tr_A0A6P4XNI7_A0A6P4XNI7_BRABE tr|A0A6P4XNI7|A0A6P4XNI7_BRABE Protein Wnt OS=Branchiostoma belcheri OX=7741 GN=LOC109465418 PE=3 SV=1, Branchiostoma_belcheri_tr_A0A6P4YM70_A0A6P4YM70_BRABE tr|A0A6P4YM70|A0A6P4YM70_BRABE Protein Wnt OS=Branchiostoma belcheri OX=7741 GN=LOC109465418 PE=3 SV=1
OG0000014	Amphimedon_queenslandica_tr_A0A1X7U0W6_A0A1X7U0W6_AMPQE tr_A0A1X7U0W6_A0A1X7U0W6_AMPQE Uncharacterized protein OS=Amphimedon queenslandica OX=400682 GN=105314085 PE=4 SV=1	Branchiostoma_belcheri_tr_A0A6P4YM63_A0A6P4YM63_BRABE tr|A0A6P4YM63|A0A6P4YM63_BRABE ADAMTS-like protein 2 OS=Branchiostoma belcheri OX=7741 GN=LOC109474657 PE=4 SV=1, Branchiostoma_belcheri_tr_A0A6P4YH70_A0A6P4YH70_BRABE tr|A0A6P4YH70|A0A6P4YH70_BRABE Thrombospondin type-1 domain-containing protein 4-like isoform X4 OS=Branchiostoma belcheri OX=7741 GN=LOC109469672 PE=4 SV=1, Branchiostoma_belcheri_tr_A0A6P4YQ13_A0A6P4YQ13_BRABE tr|A0A6P4YQ13|A0A6P4YQ13_BRABE Thrombospondin type-1 domain-containing protein 4-like isoform X1 OS=Branchiostoma belcheri OX=7741 GN=LOC109469672 PE=4 SV=1, Branchiostoma_belcheri_tr_A0A6P4Y425_A0A6P4Y425_BRABE tr|A0A6P4Y425|A0A6P4Y425_BRABE Thrombospondin type-1 domain-containing protein 4-like isoform X2 OS=Branchiostoma belcheri OX=7741 GN=LOC109469672 PE=4 SV=1, Branchiostoma_belcheri_tr_A0A6P4Z2I5_A0A6P4Z2I5_BRABE tr|A0A6P4Z2I5|A0A6P4Z2I5_BRABE Thrombospondin type-1 domain-containing protein 4-like isoform X3 OS=Branchiostoma belcheri OX=7741 GN=LOC109469672 PE=4 SV=1
OG0000014	Amphimedon_queenslandica_tr_A0A1X7U0E9_A0A1X7U0E9_AMPQE tr_A0A1X7U0E9_A0A1X7U0E9_AMPQE Uncharacterized protein OS=Amphimedon queenslandica OX=400682 PE=4 SV=1, Amphimedon_queenslandica_tr_A0A1X7U7C0_A0A1X7U7C0_AMPQE tr_A0A1X7U7C0_A0A1X7U7C0_AMPQE Uncharacterized protein OS=Amphimedon queenslandica OX=400682 PE=4 SV=1	Branchiostoma_belcheri_tr_A0A6P4Y379_A0A6P4Y379_BRABE tr|A0A6P4Y379|A0A6P4Y379_BRABE LOW QUALITY PROTEIN_ ADAMTS-like protein 1 OS=Branchiostoma belcheri OX=7741 GN=LOC109464383 PE=4 SV=1
OG0000014	Amphimedon_queenslandica_tr_A0A1X7U5R5_A0A1X7U5R5_AMPQE tr_A0A1X7U5R5_A0A1X7U5R5_AMPQE Peptidase M12B domain-containing protein OS=Amphimedon queenslandica OX=400682 GN=100633222 PE=4 SV=1	Branchiostoma_belcheri_tr_A0A6P4ZRX7_A0A6P4ZRX7_BRABE tr|A0A6P4ZRX7|A0A6P4ZRX7_BRABE A disintegrin and metalloproteinase with thrombospondin motifs 16-like OS=Branchiostoma belcheri OX=7741 GN=LOC109479325 PE=4 SV=1, Branchiostoma_belcheri_tr_A0A6P4ZJA4_A0A6P4ZJA4_BRABE tr|A0A6P4ZJA4|A0A6P4ZJA4_BRABE A disintegrin and metalloproteinase with thrombospondin motifs 18-like OS=Branchiostoma belcheri OX=7741 GN=LOC109479324 PE=4 SV=1, Branchiostoma_belcheri_tr_A0A6P5AC78_A0A6P5AC78_BRABE tr|A0A6P5AC78|A0A6P5AC78_BRABE A disintegrin and metalloproteinase with thrombospondin motifs 18-like OS=Branchiostoma belcheri OX=7741 GN=LOC109482606 PE=4 SV=1, Branchiostoma_belcheri_tr_A0A6P5ARY4_A0A6P5ARY4_BRABE tr|A0A6P5ARY4|A0A6P5ARY4_BRABE LOW QUALITY PROTEIN_ A disintegrin and metalloproteinase with thrombospondin motifs 3-like OS=Branchiostoma belcheri OX=7741 GN=LOC109485510 PE=4 SV=1, Branchiostoma_belcheri_tr_A0A6P4YYV9_A0A6P4YYV9_BRABE tr|A0A6P4YYV9|A0A6P4YYV9_BRABE A disintegrin and metalloproteinase with thrombospondin motifs 6-like OS=Branchiostoma belcheri OX=7741 GN=LOC109477637 PE=4 SV=1, Branchiostoma_belcheri_tr_A0A6P5ACX3_A0A6P5ACX3_BRABE tr|A0A6P5ACX3|A0A6P5ACX3_BRABE LOW QUALITY PROTEIN_ A disintegrin and metalloproteinase with thrombospondin motifs 12-like OS=Branchiostoma belcheri OX=7741 GN=LOC109485153 PE=4 SV=1, Branchiostoma_belcheri_tr_A0A6P4YRC0_A0A6P4YRC0_BRABE tr|A0A6P4YRC0|A0A6P4YRC0_BRABE A disintegrin and metalloproteinase with thrombospondin motifs 17-like OS=Branchiostoma belcheri OX=7741 GN=LOC109471897 PE=4 SV=1, Branchiostoma_belcheri_tr_A0A6P4ZGZ8_A0A6P4ZGZ8_BRABE tr|A0A6P4ZGZ8|A0A6P4ZGZ8_BRABE LOW QUALITY PROTEIN_ papilin-like OS=Branchiostoma belcheri OX=7741 GN=LOC109482249 PE=4 SV=1, Branchiostoma_belcheri_tr_A0A6P4ZJ53_A0A6P4ZJ53_BRABE tr|A0A6P4ZJ53|A0A6P4ZJ53_BRABE A disintegrin and metalloproteinase with thrombospondin motifs 9-like isoform X2 OS=Branchiostoma belcheri OX=7741 GN=LOC109477323 PE=4 SV=1, Branchiostoma_belcheri_tr_A0A6P4ZBN8_A0A6P4ZBN8_BRABE tr|A0A6P4ZBN8|A0A6P4ZBN8_BRABE A disintegrin and metalloproteinase with thrombospondin motifs 9-like isoform X1 OS=Branchiostoma belcheri OX=7741 GN=LOC109477323 PE=4 SV=1, Branchiostoma_belcheri_tr_A0A6P4YXJ1_A0A6P4YXJ1_BRABE tr|A0A6P4YXJ1|A0A6P4YXJ1_BRABE A disintegrin and metalloproteinase with thrombospondin motifs 9-like isoform X3 OS=Branchiostoma belcheri OX=7741 GN=LOC109477323 PE=4 SV=1, Branchiostoma_belcheri_tr_A0A6P4ZA21_A0A6P4ZA21_BRABE tr|A0A6P4ZA21|A0A6P4ZA21_BRABE A disintegrin and metalloproteinase with thrombospondin motifs 9-like OS=Branchiostoma belcheri OX=7741 GN=LOC109476941 PE=4 SV=1, Branchiostoma_belcheri_tr_A0A6P4YWX5_A0A6P4YWX5_BRABE tr|A0A6P4YWX5|A0A6P4YWX5_BRABE A disintegrin and metalloproteinase with thrombospondin motifs 9-like OS=Branchiostoma belcheri OX=7741 GN=LOC109477220 PE=4 SV=1, Branchiostoma_belcheri_tr_A0A6P5A0W5_A0A6P5A0W5_BRABE tr|A0A6P5A0W5|A0A6P5A0W5_BRABE A disintegrin and metalloproteinase with thrombospondin motifs 16-like OS=Branchiostoma belcheri OX=7741 GN=LOC109479323 PE=4 SV=1
OG0000018	Amphimedon_queenslandica_tr_A0A1X7URD2_A0A1X7URD2_AMPQE tr_A0A1X7URD2_A0A1X7URD2_AMPQE Uncharacterized protein OS=Amphimedon queenslandica OX=400682 GN=100636203 PE=4 SV=1, Amphimedon_queenslandica_tr_A0A1X7UQY5_A0A1X7UQY5_AMPQE tr_A0A1X7UQY5_A0A1X7UQY5_AMPQE Uncharacterized protein OS=Amphimedon queenslandica OX=400682 PE=4 SV=1	Branchiostoma_belcheri_tr_A0A6P4ZYS2_A0A6P4ZYS2_BRABE tr|A0A6P4ZYS2|A0A6P4ZYS2_BRABE Lysyl oxidase homolog 4-like isoform X1 OS=Branchiostoma belcheri OX=7741 GN=LOC109486842 PE=3 SV=1, Branchiostoma_belcheri_tr_A0A6P5AWG1_A0A6P5AWG1_BRABE tr|A0A6P5AWG1|A0A6P5AWG1_BRABE Lysyl oxidase homolog 4-like isoform X2 OS=Branchiostoma belcheri OX=7741 GN=LOC109486842 PE=3 SV=1, Branchiostoma_belcheri_tr_A0A6P5AT97_A0A6P5AT97_BRABE tr|A0A6P5AT97|A0A6P5AT97_BRABE Lysyl oxidase homolog 4-like isoform X3 OS=Branchiostoma belcheri OX=7741 GN=LOC109486842 PE=3 SV=1
OG0000018	Amphimedon_queenslandica_tr_A0A1X7URM7_A0A1X7URM7_AMPQE tr_A0A1X7URM7_A0A1X7URM7_AMPQE Uncharacterized protein OS=Amphimedon queenslandica OX=400682 PE=4 SV=1, Amphimedon_queenslandica_tr_A0A1X7UTD5_A0A1X7UTD5_AMPQE tr_A0A1X7UTD5_A0A1X7UTD5_AMPQE Uncharacterized protein OS=Amphimedon queenslandica OX=400682 PE=4 SV=1, Amphimedon_queenslandica_tr_A0A1X7T885_A0A1X7T885_AMPQE tr_A0A1X7T885_A0A1X7T885_AMPQE Uncharacterized protein OS=Amphimedon queenslandica OX=400682 PE=4 SV=1, Amphimedon_queenslandica_tr_A0A1X7UA33_A0A1X7UA33_AMPQE tr_A0A1X7UA33_A0A1X7UA33_AMPQE Uncharacterized protein OS=Amphimedon queenslandica OX=400682 PE=4 SV=1, Amphimedon_queenslandica_tr_A0A1X7U282_A0A1X7U282_AMPQE tr_A0A1X7U282_A0A1X7U282_AMPQE Uncharacterized protein OS=Amphimedon queenslandica OX=400682 GN=109585070 PE=4 SV=1, Amphimedon_queenslandica_tr_A0A1X7VPG7_A0A1X7VPG7_AMPQE tr_A0A1X7VPG7_A0A1X7VPG7_AMPQE Uncharacterized protein OS=Amphimedon queenslandica OX=400682 PE=4 SV=1, Amphimedon_queenslandica_tr_A0A1X7UF66_A0A1X7UF66_AMPQE tr_A0A1X7UF66_A0A1X7UF66_AMPQE Uncharacterized protein OS=Amphimedon queenslandica OX=400682 PE=4 SV=1, Amphimedon_queenslandica_tr_A0A1X7VPQ3_A0A1X7VPQ3_AMPQE tr_A0A1X7VPQ3_A0A1X7VPQ3_AMPQE Uncharacterized protein OS=Amphimedon queenslandica OX=400682 PE=4 SV=1, Amphimedon_queenslandica_tr_A0A1X7VN53_A0A1X7VN53_AMPQE tr_A0A1X7VN53_A0A1X7VN53_AMPQE Uncharacterized protein OS=Amphimedon queenslandica OX=400682 PE=4 SV=1, Amphimedon_queenslandica_tr_A0A1X7VQS8_A0A1X7VQS8_AMPQE tr_A0A1X7VQS8_A0A1X7VQS8_AMPQE Uncharacterized protein OS=Amphimedon queenslandica OX=400682 PE=4 SV=1, Amphimedon_queenslandica_tr_A0A1X7T6A2_A0A1X7T6A2_AMPQE tr_A0A1X7T6A2_A0A1X7T6A2_AMPQE Uncharacterized protein OS=Amphimedon queenslandica OX=400682 PE=4 SV=1, Amphimedon_queenslandica_tr_A0A1X7ULL6_A0A1X7ULL6_AMPQE tr_A0A1X7ULL6_A0A1X7ULL6_AMPQE Uncharacterized protein OS=Amphimedon queenslandica OX=400682 PE=4 SV=1, Amphimedon_queenslandica_tr_A0A1X7T7Q6_A0A1X7T7Q6_AMPQE tr_A0A1X7T7Q6_A0A1X7T7Q6_AMPQE Uncharacterized protein OS=Amphimedon queenslandica OX=400682 PE=4 SV=1, Amphimedon_queenslandica_tr_A0A1X7V253_A0A1X7V253_AMPQE tr_A0A1X7V253_A0A1X7V253_AMPQE Uncharacterized protein OS=Amphimedon queenslandica OX=400682 PE=4 SV=1, Amphimedon_queenslandica_tr_A0A1X7U110_A0A1X7U110_AMPQE tr_A0A1X7U110_A0A1X7U110_AMPQE Uncharacterized protein OS=Amphimedon queenslandica OX=400682 PE=4 SV=1, Amphimedon_queenslandica_tr_A0A1X7U1B7_A0A1X7U1B7_AMPQE tr_A0A1X7U1B7_A0A1X7U1B7_AMPQE Uncharacterized protein OS=Amphimedon queenslandica OX=400682 PE=4 SV=1, Amphimedon_queenslandica_tr_A0A1X7VGH3_A0A1X7VGH3_AMPQE tr_A0A1X7VGH3_A0A1X7VGH3_AMPQE Uncharacterized protein OS=Amphimedon queenslandica OX=400682 GN=100639096 PE=4 SV=1	Branchiostoma_belcheri_tr_A0A6P4Z371_A0A6P4Z371_BRABE tr|A0A6P4Z371|A0A6P4Z371_BRABE LOW QUALITY PROTEIN_ deleted in malignant brain tumors 1 protein-like OS=Branchiostoma belcheri OX=7741 GN=LOC109470879 PE=4 SV=1, Branchiostoma_belcheri_tr_A0A6P5ATS7_A0A6P5ATS7_BRABE tr|A0A6P5ATS7|A0A6P5ATS7_BRABE Antigen WC1.1-like OS=Branchiostoma belcheri OX=7741 GN=LOC109486991 PE=4 SV=1, Branchiostoma_belcheri_tr_A0A6P4YJP7_A0A6P4YJP7_BRABE tr|A0A6P4YJP7|A0A6P4YJP7_BRABE Scavenger receptor cysteine-rich type 1 protein M130-like OS=Branchiostoma belcheri OX=7741 GN=LOC109465858 PE=4 SV=1, Branchiostoma_belcheri_tr_A0A6P4Y904_A0A6P4Y904_BRABE tr|A0A6P4Y904|A0A6P4Y904_BRABE LOW QUALITY PROTEIN_ scavenger receptor cysteine-rich domain-containing group B protein-like OS=Branchiostoma belcheri OX=7741 GN=LOC109470875 PE=4 SV=1, Branchiostoma_belcheri_tr_A0A6P4ZZP6_A0A6P4ZZP6_BRABE tr|A0A6P4ZZP6|A0A6P4ZZP6_BRABE Deleted in malignant brain tumors 1 protein-like OS=Branchiostoma belcheri OX=7741 GN=LOC109481396 PE=4 SV=1, Branchiostoma_belcheri_tr_A0A6P4Y643_A0A6P4Y643_BRABE tr|A0A6P4Y643|A0A6P4Y643_BRABE Lysyl oxidase homolog 4-like OS=Branchiostoma belcheri OX=7741 GN=LOC109470154 PE=4 SV=1, Branchiostoma_belcheri_tr_A0A6P5AC85_A0A6P5AC85_BRABE tr|A0A6P5AC85|A0A6P5AC85_BRABE Neurotrypsin OS=Branchiostoma belcheri OX=7741 GN=LOC109481310 PE=4 SV=1
OG0000019	Amphimedon_queenslandica_tr_A0A1X7VCN7_A0A1X7VCN7_AMPQE tr_A0A1X7VCN7_A0A1X7VCN7_AMPQE TGF_BETA_2 domain-containing protein OS=Amphimedon queenslandica OX=400682 GN=105311952 PE=3 SV=1	Branchiostoma_belcheri_tr_A0A6P4YT30_A0A6P4YT30_BRABE tr|A0A6P4YT30|A0A6P4YT30_BRABE Bone morphogenetic protein 6-like OS=Branchiostoma belcheri OX=7741 GN=LOC109476129 PE=3 SV=1
OG0000020	Amphimedon_queenslandica_tr_A0A1X7UHR0_A0A1X7UHR0_AMPQE tr_A0A1X7UHR0_A0A1X7UHR0_AMPQE Fibrillar collagen NC1 domain-containing protein OS=Amphimedon queenslandica OX=400682 GN=100638905 PE=4 SV=1	Branchiostoma_belcheri_tr_A0A6P5AAT0_A0A6P5AAT0_BRABE tr|A0A6P5AAT0|A0A6P5AAT0_BRABE Collagen alpha-1_XI_ chain-like isoform X1 OS=Branchiostoma belcheri OX=7741 GN=LOC109484488 PE=4 SV=1, Branchiostoma_belcheri_tr_A0A6P5AMT1_A0A6P5AMT1_BRABE tr|A0A6P5AMT1|A0A6P5AMT1_BRABE Collagen alpha-1_XI_ chain-like isoform X3 OS=Branchiostoma belcheri OX=7741 GN=LOC109484488 PE=4 SV=1, Branchiostoma_belcheri_tr_A0A6P4ZQ52_A0A6P4ZQ52_BRABE tr|A0A6P4ZQ52|A0A6P4ZQ52_BRABE Collagen alpha-1_XI_ chain-like isoform X2 OS=Branchiostoma belcheri OX=7741 GN=LOC109484488 PE=4 SV=1, Branchiostoma_belcheri_tr_A0A6P5AJQ3_A0A6P5AJQ3_BRABE tr|A0A6P5AJQ3|A0A6P5AJQ3_BRABE Collagen alpha-1_V_ chain-like isoform X4 OS=Branchiostoma belcheri OX=7741 GN=LOC109484488 PE=4 SV=1, Branchiostoma_belcheri_tr_A0A6P5A1L4_A0A6P5A1L4_BRABE tr|A0A6P5A1L4|A0A6P5A1L4_BRABE Collagen alpha-2_I_ chain-like OS=Branchiostoma belcheri OX=7741 GN=LOC109484390 PE=4 SV=1
OG0000021	Amphimedon_queenslandica_tr_A0A1X7TVZ2_A0A1X7TVZ2_AMPQE tr_A0A1X7TVZ2_A0A1X7TVZ2_AMPQE Thrombomodulin OS=Amphimedon queenslandica OX=400682 PE=4 SV=1	Branchiostoma_belcheri_tr_A0A6P4ZJY5_A0A6P4ZJY5_BRABE tr|A0A6P4ZJY5|A0A6P4ZJY5_BRABE Very low-density lipoprotein receptor-like OS=Branchiostoma belcheri OX=7741 GN=LOC109475237 PE=4 SV=1, Branchiostoma_belcheri_tr_A0A6P5AGP4_A0A6P5AGP4_BRABE tr|A0A6P5AGP4|A0A6P5AGP4_BRABE Very low-density lipoprotein receptor-like OS=Branchiostoma belcheri OX=7741 GN=LOC109486221 PE=4 SV=1
OG0000021	Amphimedon_queenslandica_tr_A0A1X7V472_A0A1X7V472_AMPQE tr_A0A1X7V472_A0A1X7V472_AMPQE Uncharacterized protein OS=Amphimedon queenslandica OX=400682 PE=4 SV=1, Amphimedon_queenslandica_tr_A0A1X7TGT9_A0A1X7TGT9_AMPQE tr_A0A1X7TGT9_A0A1X7TGT9_AMPQE Uncharacterized protein OS=Amphimedon queenslandica OX=400682 PE=4 SV=1, Amphimedon_queenslandica_tr_A0A1X7SJY3_A0A1X7SJY3_AMPQE tr_A0A1X7SJY3_A0A1X7SJY3_AMPQE EGF-like domain-containing protein OS=Amphimedon queenslandica OX=400682 PE=4 SV=1, Amphimedon_queenslandica_tr_A0A1X7SJQ5_A0A1X7SJQ5_AMPQE tr_A0A1X7SJQ5_A0A1X7SJQ5_AMPQE EGF-like domain-containing protein OS=Amphimedon queenslandica OX=400682 PE=4 SV=1, Amphimedon_queenslandica_tr_A0A1X7TB95_A0A1X7TB95_AMPQE tr_A0A1X7TB95_A0A1X7TB95_AMPQE Uncharacterized protein OS=Amphimedon queenslandica OX=400682 PE=4 SV=1, Amphimedon_queenslandica_tr_A0A1X7SU79_A0A1X7SU79_AMPQE tr_A0A1X7SU79_A0A1X7SU79_AMPQE EGF-like domain-containing protein OS=Amphimedon queenslandica OX=400682 PE=4 SV=1, Amphimedon_queenslandica_tr_A0A1X7VS84_A0A1X7VS84_AMPQE tr_A0A1X7VS84_A0A1X7VS84_AMPQE Uncharacterized protein OS=Amphimedon queenslandica OX=400682 PE=4 SV=1, Amphimedon_queenslandica_tr_A0A1X7SVY2_A0A1X7SVY2_AMPQE tr_A0A1X7SVY2_A0A1X7SVY2_AMPQE Uncharacterized protein OS=Amphimedon queenslandica OX=400682 PE=4 SV=1	Branchiostoma_belcheri_tr_A0A6P5A6E5_A0A6P5A6E5_BRABE tr|A0A6P5A6E5|A0A6P5A6E5_BRABE Prolow-density lipoprotein receptor-related protein 1-like OS=Branchiostoma belcheri OX=7741 GN=LOC109480925 PE=4 SV=1
OG0000022	Amphimedon_queenslandica_tr_A0A1X7VQ74_A0A1X7VQ74_AMPQE tr_A0A1X7VQ74_A0A1X7VQ74_AMPQE Annexin OS=Amphimedon queenslandica OX=400682 GN=100638289 PE=3 SV=1	Branchiostoma_belcheri_tr_A0A6P4XTC9_A0A6P4XTC9_BRABE tr|A0A6P4XTC9|A0A6P4XTC9_BRABE Annexin OS=Branchiostoma belcheri OX=7741 GN=LOC109466626 PE=3 SV=1
OG0000022	Amphimedon_queenslandica_tr_A0A1X7SGH8_A0A1X7SGH8_AMPQE tr_A0A1X7SGH8_A0A1X7SGH8_AMPQE Uncharacterized protein OS=Amphimedon queenslandica OX=400682 GN=100638282 PE=3 SV=1, Amphimedon_queenslandica_tr_A0A1X7V5G7_A0A1X7V5G7_AMPQE tr_A0A1X7V5G7_A0A1X7V5G7_AMPQE Uncharacterized protein OS=Amphimedon queenslandica OX=400682 PE=3 SV=1, Amphimedon_queenslandica_tr_A0A1X7V673_A0A1X7V673_AMPQE tr_A0A1X7V673_A0A1X7V673_AMPQE Annexin OS=Amphimedon queenslandica OX=400682 GN=100634682 PE=3 SV=1	Branchiostoma_belcheri_tr_A0A6P4YRN1_A0A6P4YRN1_BRABE tr|A0A6P4YRN1|A0A6P4YRN1_BRABE Annexin OS=Branchiostoma belcheri OX=7741 GN=LOC109466572 PE=3 SV=1
OG0000024	Amphimedon_queenslandica_tr_A0A1X7VFM2_A0A1X7VFM2_AMPQE tr_A0A1X7VFM2_A0A1X7VFM2_AMPQE Uncharacterized protein OS=Amphimedon queenslandica OX=400682 GN=100635554 PE=4 SV=1	Branchiostoma_belcheri_tr_A0A6P4Y2T6_A0A6P4Y2T6_BRABE tr|A0A6P4Y2T6|A0A6P4Y2T6_BRABE Uncharacterized protein LOC109464249 OS=Branchiostoma belcheri OX=7741 GN=LOC109464249 PE=4 SV=1, Branchiostoma_belcheri_tr_A0A6P4XZ68_A0A6P4XZ68_BRABE tr|A0A6P4XZ68|A0A6P4XZ68_BRABE Protein crumbs homolog 2-like OS=Branchiostoma belcheri OX=7741 GN=LOC109464806 PE=4 SV=1, Branchiostoma_belcheri_tr_A0A6P4ZMN7_A0A6P4ZMN7_BRABE tr|A0A6P4ZMN7|A0A6P4ZMN7_BRABE Testican-2-like OS=Branchiostoma belcheri OX=7741 GN=LOC109478264 PE=4 SV=1
OG0000025	Amphimedon_queenslandica_tr_A0A1X7SHG3_A0A1X7SHG3_AMPQE tr_A0A1X7SHG3_A0A1X7SHG3_AMPQE Fibronectin type-III domain-containing protein OS=Amphimedon queenslandica OX=400682 PE=4 SV=1	Branchiostoma_belcheri_tr_A0A6P4YZ71_A0A6P4YZ71_BRABE tr|A0A6P4YZ71|A0A6P4YZ71_BRABE Uncharacterized protein LOC109477701 OS=Branchiostoma belcheri OX=7741 GN=LOC109477701 PE=4 SV=1
OG0000030	Amphimedon_queenslandica_tr_A0A1X7VBP5_A0A1X7VBP5_AMPQE tr_A0A1X7VBP5_A0A1X7VBP5_AMPQE Uncharacterized protein OS=Amphimedon queenslandica OX=400682 GN=105311941 PE=4 SV=1, Amphimedon_queenslandica_tr_A0A1X7SR42_A0A1X7SR42_AMPQE tr_A0A1X7SR42_A0A1X7SR42_AMPQE Peptidase M12B domain-containing protein OS=Amphimedon queenslandica OX=400682 PE=4 SV=1, Amphimedon_queenslandica_tr_A0A1X7V044_A0A1X7V044_AMPQE tr_A0A1X7V044_A0A1X7V044_AMPQE Uncharacterized protein OS=Amphimedon queenslandica OX=400682 PE=4 SV=1	Branchiostoma_belcheri_tr_A0A6P4Z3Q5_A0A6P4Z3Q5_BRABE tr|A0A6P4Z3Q5|A0A6P4Z3Q5_BRABE Disintegrin and metalloproteinase domain-containing protein 17-like OS=Branchiostoma belcheri OX=7741 GN=LOC109473119 PE=4 SV=1
OG0000030	Amphimedon_queenslandica_tr_A0A1X7U7R3_A0A1X7U7R3_AMPQE tr_A0A1X7U7R3_A0A1X7U7R3_AMPQE Disintegrin domain-containing protein OS=Amphimedon queenslandica OX=400682 PE=4 SV=1, Amphimedon_queenslandica_tr_A0A1X7U550_A0A1X7U550_AMPQE tr_A0A1X7U550_A0A1X7U550_AMPQE Uncharacterized protein OS=Amphimedon queenslandica OX=400682 GN=100632085 PE=4 SV=1	Branchiostoma_belcheri_tr_A0A6P4YCJ8_A0A6P4YCJ8_BRABE tr|A0A6P4YCJ8|A0A6P4YCJ8_BRABE Disintegrin and metalloproteinase domain-containing protein 10-like OS=Branchiostoma belcheri OX=7741 GN=LOC109468335 PE=4 SV=1, Branchiostoma_belcheri_tr_A0A6P4YZ43_A0A6P4YZ43_BRABE tr|A0A6P4YZ43|A0A6P4YZ43_BRABE Disintegrin and metalloproteinase domain-containing protein 10-like isoform X2 OS=Branchiostoma belcheri OX=7741 GN=LOC109468715 PE=4 SV=1, Branchiostoma_belcheri_tr_A0A6P4Y116_A0A6P4Y116_BRABE tr|A0A6P4Y116|A0A6P4Y116_BRABE Disintegrin and metalloproteinase domain-containing protein 10-like isoform X1 OS=Branchiostoma belcheri OX=7741 GN=LOC109468715 PE=4 SV=1, Branchiostoma_belcheri_tr_A0A6P4YLX1_A0A6P4YLX1_BRABE tr|A0A6P4YLX1|A0A6P4YLX1_BRABE Disintegrin and metalloproteinase domain-containing protein 10-like isoform X1 OS=Branchiostoma belcheri OX=7741 GN=LOC109468796 PE=4 SV=1, Branchiostoma_belcheri_tr_A0A6P4Y1A6_A0A6P4Y1A6_BRABE tr|A0A6P4Y1A6|A0A6P4Y1A6_BRABE Disintegrin and metalloproteinase domain-containing protein 10-like isoform X2 OS=Branchiostoma belcheri OX=7741 GN=LOC109468796 PE=4 SV=1
OG0000030	Amphimedon_queenslandica_tr_A0A1X7UAN2_A0A1X7UAN2_AMPQE tr_A0A1X7UAN2_A0A1X7UAN2_AMPQE Uncharacterized protein OS=Amphimedon queenslandica OX=400682 GN=109584186 PE=4 SV=1, Amphimedon_queenslandica_tr_A0A1X7ST77_A0A1X7ST77_AMPQE tr_A0A1X7ST77_A0A1X7ST77_AMPQE Uncharacterized protein OS=Amphimedon queenslandica OX=400682 GN=100641574 PE=4 SV=1	Branchiostoma_belcheri_tr_A0A6P4YKP3_A0A6P4YKP3_BRABE tr|A0A6P4YKP3|A0A6P4YKP3_BRABE Disintegrin and metalloproteinase domain-containing protein 10-like OS=Branchiostoma belcheri OX=7741 GN=LOC109468471 PE=4 SV=1
