Orthogroup	Porifera_Demospongiae_Amphimedon_queenslandica	Chordata_Amphioxiformes_Branchiostoma_belcheri
OG0000000	Amphimedon_queenslandica_tr_A0A1X7TKD1_A0A1X7TKD1_AMPQE tr_A0A1X7TKD1_A0A1X7TKD1_AMPQE Fibrinogen C-terminal domain-containing protein OS=Amphimedon queenslandica OX=400682 PE=4 SV=1, Amphimedon_queenslandica_tr_A0A1X7THB2_A0A1X7THB2_AMPQE tr_A0A1X7THB2_A0A1X7THB2_AMPQE Fibrinogen C-terminal domain-containing protein OS=Amphimedon queenslandica OX=400682 PE=4 SV=1, Amphimedon_queenslandica_tr_A0A1X7T7C3_A0A1X7T7C3_AMPQE tr_A0A1X7T7C3_A0A1X7T7C3_AMPQE Angiopoietin-related protein 4 OS=Amphimedon queenslandica OX=400682 PE=4 SV=1	Branchiostoma_belcheri_tr_A0A6P4ZUM2_A0A6P4ZUM2_BRABE tr|A0A6P4ZUM2|A0A6P4ZUM2_BRABE Fibrinogen-like protein 1 OS=Branchiostoma belcheri OX=7741 GN=LOC109476732 PE=4 SV=1
OG0000000	Amphimedon_queenslandica_tr_A0A1X7UD48_A0A1X7UD48_AMPQE tr_A0A1X7UD48_A0A1X7UD48_AMPQE Uncharacterized protein OS=Amphimedon queenslandica OX=400682 PE=4 SV=1, Amphimedon_queenslandica_tr_A0A1X7TEL1_A0A1X7TEL1_AMPQE tr_A0A1X7TEL1_A0A1X7TEL1_AMPQE Uncharacterized protein OS=Amphimedon queenslandica OX=400682 PE=4 SV=1, Amphimedon_queenslandica_tr_A0A1X7UMX4_A0A1X7UMX4_AMPQE tr_A0A1X7UMX4_A0A1X7UMX4_AMPQE Uncharacterized protein OS=Amphimedon queenslandica OX=400682 PE=4 SV=1	Branchiostoma_belcheri_tr_A0A6P4YDZ3_A0A6P4YDZ3_BRABE tr|A0A6P4YDZ3|A0A6P4YDZ3_BRABE Uncharacterized protein LOC109466899 OS=Branchiostoma belcheri OX=7741 GN=LOC109466899 PE=4 SV=1
OG0000000	Amphimedon_queenslandica_tr_A0A1X7ULD6_A0A1X7ULD6_AMPQE tr_A0A1X7ULD6_A0A1X7ULD6_AMPQE Fibrinogen C-terminal domain-containing protein OS=Amphimedon queenslandica OX=400682 GN=105313195 PE=4 SV=1, Amphimedon_queenslandica_tr_A0A1X7UNX5_A0A1X7UNX5_AMPQE tr_A0A1X7UNX5_A0A1X7UNX5_AMPQE Fibrinogen C-terminal domain-containing protein OS=Amphimedon queenslandica OX=400682 PE=4 SV=1, Amphimedon_queenslandica_tr_A0A1X7VAP0_A0A1X7VAP0_AMPQE tr_A0A1X7VAP0_A0A1X7VAP0_AMPQE Fibrinogen C-terminal domain-containing protein OS=Amphimedon queenslandica OX=400682 GN=100637828 PE=4 SV=1, Amphimedon_queenslandica_tr_A0A1X7UEI3_A0A1X7UEI3_AMPQE tr_A0A1X7UEI3_A0A1X7UEI3_AMPQE Fibrinogen C-terminal domain-containing protein OS=Amphimedon queenslandica OX=400682 PE=4 SV=1, Amphimedon_queenslandica_tr_A0A1X7TEI7_A0A1X7TEI7_AMPQE tr_A0A1X7TEI7_A0A1X7TEI7_AMPQE Fibrinogen C-terminal domain-containing protein OS=Amphimedon queenslandica OX=400682 PE=4 SV=1, Amphimedon_queenslandica_tr_A0A1X7SPQ0_A0A1X7SPQ0_AMPQE tr_A0A1X7SPQ0_A0A1X7SPQ0_AMPQE Fibrinogen C-terminal domain-containing protein OS=Amphimedon queenslandica OX=400682 PE=4 SV=1, Amphimedon_queenslandica_tr_A0A1X7TF91_A0A1X7TF91_AMPQE tr_A0A1X7TF91_A0A1X7TF91_AMPQE Fibrinogen C-terminal domain-containing protein OS=Amphimedon queenslandica OX=400682 PE=4 SV=1, Amphimedon_queenslandica_tr_A0A1X7UXI6_A0A1X7UXI6_AMPQE tr_A0A1X7UXI6_A0A1X7UXI6_AMPQE Fibrinogen C-terminal domain-containing protein OS=Amphimedon queenslandica OX=400682 PE=4 SV=1, Amphimedon_queenslandica_tr_A0A1X7UYQ5_A0A1X7UYQ5_AMPQE tr_A0A1X7UYQ5_A0A1X7UYQ5_AMPQE Fibrinogen C-terminal domain-containing protein OS=Amphimedon queenslandica OX=400682 GN=100632538 PE=4 SV=1, Amphimedon_queenslandica_tr_A0A1X7TTH3_A0A1X7TTH3_AMPQE tr_A0A1X7TTH3_A0A1X7TTH3_AMPQE Fibrinogen C-terminal domain-containing protein OS=Amphimedon queenslandica OX=400682 PE=4 SV=1, Amphimedon_queenslandica_tr_A0A1X7TT50_A0A1X7TT50_AMPQE tr_A0A1X7TT50_A0A1X7TT50_AMPQE Fibrinogen C-terminal domain-containing protein OS=Amphimedon queenslandica OX=400682 GN=100639626 PE=4 SV=1, Amphimedon_queenslandica_tr_A0A1X7U6Q1_A0A1X7U6Q1_AMPQE tr_A0A1X7U6Q1_A0A1X7U6Q1_AMPQE Fibrinogen C-terminal domain-containing protein OS=Amphimedon queenslandica OX=400682 PE=4 SV=1, Amphimedon_queenslandica_tr_A0A1X7U6Q6_A0A1X7U6Q6_AMPQE tr_A0A1X7U6Q6_A0A1X7U6Q6_AMPQE Fibrinogen C-terminal domain-containing protein OS=Amphimedon queenslandica OX=400682 PE=4 SV=1, Amphimedon_queenslandica_tr_A0A1X7T854_A0A1X7T854_AMPQE tr_A0A1X7T854_A0A1X7T854_AMPQE Fibrinogen C-terminal domain-containing protein OS=Amphimedon queenslandica OX=400682 GN=100637814 PE=4 SV=1, Amphimedon_queenslandica_tr_A0A1X7U6G7_A0A1X7U6G7_AMPQE tr_A0A1X7U6G7_A0A1X7U6G7_AMPQE Fibrinogen C-terminal domain-containing protein OS=Amphimedon queenslandica OX=400682 GN=105313870 PE=4 SV=1, Amphimedon_queenslandica_tr_A0A1X7TRL5_A0A1X7TRL5_AMPQE tr_A0A1X7TRL5_A0A1X7TRL5_AMPQE Fibrinogen C-terminal domain-containing protein OS=Amphimedon queenslandica OX=400682 GN=100634289 PE=4 SV=1, Amphimedon_queenslandica_tr_A0A1X7U772_A0A1X7U772_AMPQE tr_A0A1X7U772_A0A1X7U772_AMPQE Fibrinogen C-terminal domain-containing protein OS=Amphimedon queenslandica OX=400682 GN=105313869 PE=4 SV=1, Amphimedon_queenslandica_tr_A0A1X7TNT2_A0A1X7TNT2_AMPQE tr_A0A1X7TNT2_A0A1X7TNT2_AMPQE Fibrinogen C-terminal domain-containing protein OS=Amphimedon queenslandica OX=400682 GN=100639582 PE=4 SV=1, Amphimedon_queenslandica_tr_A0A1X7STA5_A0A1X7STA5_AMPQE tr_A0A1X7STA5_A0A1X7STA5_AMPQE Fibrinogen C-terminal domain-containing protein OS=Amphimedon queenslandica OX=400682 PE=4 SV=1, Amphimedon_queenslandica_tr_A0A1X7TF57_A0A1X7TF57_AMPQE tr_A0A1X7TF57_A0A1X7TF57_AMPQE Fibrinogen C-terminal domain-containing protein OS=Amphimedon queenslandica OX=400682 GN=100633103 PE=4 SV=1, Amphimedon_queenslandica_tr_A0A1X7T456_A0A1X7T456_AMPQE tr_A0A1X7T456_A0A1X7T456_AMPQE Fibrinogen C-terminal domain-containing protein OS=Amphimedon queenslandica OX=400682 PE=4 SV=1, Amphimedon_queenslandica_tr_A0A1X7U0N8_A0A1X7U0N8_AMPQE tr_A0A1X7U0N8_A0A1X7U0N8_AMPQE Fibrinogen C-terminal domain-containing protein OS=Amphimedon queenslandica OX=400682 GN=105314125 PE=4 SV=1, Amphimedon_queenslandica_tr_A0A1X7U0C2_A0A1X7U0C2_AMPQE tr_A0A1X7U0C2_A0A1X7U0C2_AMPQE Fibrinogen C-terminal domain-containing protein OS=Amphimedon queenslandica OX=400682 PE=4 SV=1, Amphimedon_queenslandica_tr_A0A1X7TP65_A0A1X7TP65_AMPQE tr_A0A1X7TP65_A0A1X7TP65_AMPQE Arpin OS=Amphimedon queenslandica OX=400682 PE=3 SV=1, Amphimedon_queenslandica_tr_A0A1X7U606_A0A1X7U606_AMPQE tr_A0A1X7U606_A0A1X7U606_AMPQE Fibrinogen C-terminal domain-containing protein OS=Amphimedon queenslandica OX=400682 PE=4 SV=1, Amphimedon_queenslandica_tr_A0A1X7T8J7_A0A1X7T8J7_AMPQE tr_A0A1X7T8J7_A0A1X7T8J7_AMPQE Fibrinogen C-terminal domain-containing protein OS=Amphimedon queenslandica OX=400682 PE=4 SV=1	Branchiostoma_belcheri_tr_A0A6P5ABL4_A0A6P5ABL4_BRABE tr|A0A6P5ABL4|A0A6P5ABL4_BRABE Microfibril-associated glycoprotein 4-like OS=Branchiostoma belcheri OX=7741 GN=LOC109484710 PE=4 SV=1, Branchiostoma_belcheri_tr_A0A6P4ZQY6_A0A6P4ZQY6_BRABE tr|A0A6P4ZQY6|A0A6P4ZQY6_BRABE Ryncolin-1-like isoform X3 OS=Branchiostoma belcheri OX=7741 GN=LOC109484705 PE=4 SV=1, Branchiostoma_belcheri_tr_A0A6P5A2Q0_A0A6P5A2Q0_BRABE tr|A0A6P5A2Q0|A0A6P5A2Q0_BRABE Microfibril-associated glycoprotein 4-like isoform X1 OS=Branchiostoma belcheri OX=7741 GN=LOC109484705 PE=4 SV=1, Branchiostoma_belcheri_tr_A0A6P5A2Q4_A0A6P5A2Q4_BRABE tr|A0A6P5A2Q4|A0A6P5A2Q4_BRABE Microfibril-associated glycoprotein 4-like OS=Branchiostoma belcheri OX=7741 GN=LOC109484709 PE=4 SV=1, Branchiostoma_belcheri_tr_A0A6P5ABL0_A0A6P5ABL0_BRABE tr|A0A6P5ABL0|A0A6P5ABL0_BRABE Microfibril-associated glycoprotein 4-like isoform X2 OS=Branchiostoma belcheri OX=7741 GN=LOC109484705 PE=4 SV=1, Branchiostoma_belcheri_tr_A0A6P5AKK9_A0A6P5AKK9_BRABE tr|A0A6P5AKK9|A0A6P5AKK9_BRABE Microfibril-associated glycoprotein 4-like OS=Branchiostoma belcheri OX=7741 GN=LOC109484707 PE=4 SV=1, Branchiostoma_belcheri_tr_A0A6P5AAK5_A0A6P5AAK5_BRABE tr|A0A6P5AAK5|A0A6P5AAK5_BRABE Uncharacterized protein LOC109484431 OS=Branchiostoma belcheri OX=7741 GN=LOC109484431 PE=4 SV=1, Branchiostoma_belcheri_tr_A0A6P4Z535_A0A6P4Z535_BRABE tr|A0A6P4Z535|A0A6P4Z535_BRABE Ficolin-2-like OS=Branchiostoma belcheri OX=7741 GN=LOC109470258 PE=4 SV=1, Branchiostoma_belcheri_tr_A0A6P4ZV33_A0A6P4ZV33_BRABE tr|A0A6P4ZV33|A0A6P4ZV33_BRABE Ficolin-1-like OS=Branchiostoma belcheri OX=7741 GN=LOC109482481 PE=4 SV=1, Branchiostoma_belcheri_tr_A0A6P4ZV24_A0A6P4ZV24_BRABE tr|A0A6P4ZV24|A0A6P4ZV24_BRABE Ficolin-1-like OS=Branchiostoma belcheri OX=7741 GN=LOC109482473 PE=4 SV=1, Branchiostoma_belcheri_tr_A0A6P5AFX9_A0A6P5AFX9_BRABE tr|A0A6P5AFX9|A0A6P5AFX9_BRABE Ficolin-2-like OS=Branchiostoma belcheri OX=7741 GN=LOC109482464 PE=4 SV=1, Branchiostoma_belcheri_tr_A0A6P5AFY8_A0A6P5AFY8_BRABE tr|A0A6P5AFY8|A0A6P5AFY8_BRABE Ficolin-2-like OS=Branchiostoma belcheri OX=7741 GN=LOC109482466 PE=4 SV=1, Branchiostoma_belcheri_tr_A0A6P4ZUF6_A0A6P4ZUF6_BRABE tr|A0A6P4ZUF6|A0A6P4ZUF6_BRABE Uncharacterized protein LOC109482266 OS=Branchiostoma belcheri OX=7741 GN=LOC109482266 PE=4 SV=1, Branchiostoma_belcheri_tr_A0A6P4ZV20_A0A6P4ZV20_BRABE tr|A0A6P4ZV20|A0A6P4ZV20_BRABE Ficolin-2-like OS=Branchiostoma belcheri OX=7741 GN=LOC109482468 PE=4 SV=1, Branchiostoma_belcheri_tr_A0A6P5AFB3_A0A6P5AFB3_BRABE tr|A0A6P5AFB3|A0A6P5AFB3_BRABE Ficolin-2-like OS=Branchiostoma belcheri OX=7741 GN=LOC109482262 PE=4 SV=1, Branchiostoma_belcheri_tr_A0A6P4ZZG8_A0A6P4ZZG8_BRABE tr|A0A6P4ZZG8|A0A6P4ZZG8_BRABE Ficolin-2-like OS=Branchiostoma belcheri OX=7741 GN=LOC109478972 PE=4 SV=1, Branchiostoma_belcheri_tr_A0A6P4ZCN7_A0A6P4ZCN7_BRABE tr|A0A6P4ZCN7|A0A6P4ZCN7_BRABE Ficolin-2-like OS=Branchiostoma belcheri OX=7741 GN=LOC109481047 PE=4 SV=1, Branchiostoma_belcheri_tr_A0A6P4XVC9_A0A6P4XVC9_BRABE tr|A0A6P4XVC9|A0A6P4XVC9_BRABE Ficolin-2-like OS=Branchiostoma belcheri OX=7741 GN=LOC109462454 PE=4 SV=1, Branchiostoma_belcheri_tr_A0A6P4YR90_A0A6P4YR90_BRABE tr|A0A6P4YR90|A0A6P4YR90_BRABE Techylectin-5B-like OS=Branchiostoma belcheri OX=7741 GN=LOC109469898 PE=4 SV=1, Branchiostoma_belcheri_tr_A0A6P4YIH6_A0A6P4YIH6_BRABE tr|A0A6P4YIH6|A0A6P4YIH6_BRABE Angiopoietin-related protein 7-like OS=Branchiostoma belcheri OX=7741 GN=LOC109469897 PE=4 SV=1, Branchiostoma_belcheri_tr_A0A6P4Z7J1_A0A6P4Z7J1_BRABE tr|A0A6P4Z7J1|A0A6P4Z7J1_BRABE Ficolin-1-like OS=Branchiostoma belcheri OX=7741 GN=LOC109476165 PE=4 SV=1, Branchiostoma_belcheri_tr_A0A6P4XSU8_A0A6P4XSU8_BRABE tr|A0A6P4XSU8|A0A6P4XSU8_BRABE Fibrinogen C domain-containing protein 1-like OS=Branchiostoma belcheri OX=7741 GN=LOC109466438 PE=4 SV=1, Branchiostoma_belcheri_tr_A0A6P4Z6I5_A0A6P4Z6I5_BRABE tr|A0A6P4Z6I5|A0A6P4Z6I5_BRABE Microfibril-associated glycoprotein 4-like isoform X2 OS=Branchiostoma belcheri OX=7741 GN=LOC109479517 PE=4 SV=1, Branchiostoma_belcheri_tr_A0A6P4ZSG7_A0A6P4ZSG7_BRABE tr|A0A6P4ZSG7|A0A6P4ZSG7_BRABE Microfibril-associated glycoprotein 4-like isoform X1 OS=Branchiostoma belcheri OX=7741 GN=LOC109479517 PE=4 SV=1, Branchiostoma_belcheri_tr_A0A6P4Z896_A0A6P4Z896_BRABE tr|A0A6P4Z896|A0A6P4Z896_BRABE Fibrinogen C domain-containing protein 1-A-like OS=Branchiostoma belcheri OX=7741 GN=LOC109476402 PE=4 SV=1, Branchiostoma_belcheri_tr_A0A6P4ZEG1_A0A6P4ZEG1_BRABE tr|A0A6P4ZEG1|A0A6P4ZEG1_BRABE Fibrinogen C domain-containing protein 1-like isoform X2 OS=Branchiostoma belcheri OX=7741 GN=LOC109475903 PE=4 SV=1, Branchiostoma_belcheri_tr_A0A6P4Z6L4_A0A6P4Z6L4_BRABE tr|A0A6P4Z6L4|A0A6P4Z6L4_BRABE Fibrinogen C domain-containing protein 1-like isoform X1 OS=Branchiostoma belcheri OX=7741 GN=LOC109475903 PE=4 SV=1, Branchiostoma_belcheri_tr_A0A6P4YF68_A0A6P4YF68_BRABE tr|A0A6P4YF68|A0A6P4YF68_BRABE Ficolin-1-like OS=Branchiostoma belcheri OX=7741 GN=LOC109464785 PE=4 SV=1, Branchiostoma_belcheri_tr_A0A6P4YDH4_A0A6P4YDH4_BRABE tr|A0A6P4YDH4|A0A6P4YDH4_BRABE Microfibril-associated glycoprotein 4-like OS=Branchiostoma belcheri OX=7741 GN=LOC109468614 PE=4 SV=1, Branchiostoma_belcheri_tr_A0A6P4YDG4_A0A6P4YDG4_BRABE tr|A0A6P4YDG4|A0A6P4YDG4_BRABE Microfibril-associated glycoprotein 4-like isoform X2 OS=Branchiostoma belcheri OX=7741 GN=LOC109468607 PE=4 SV=1, Branchiostoma_belcheri_tr_A0A6P4YUW2_A0A6P4YUW2_BRABE tr|A0A6P4YUW2|A0A6P4YUW2_BRABE Microfibril-associated glycoprotein 4-like isoform X1 OS=Branchiostoma belcheri OX=7741 GN=LOC109468607 PE=4 SV=1, Branchiostoma_belcheri_tr_A0A6P4YN77_A0A6P4YN77_BRABE tr|A0A6P4YN77|A0A6P4YN77_BRABE Microfibril-associated glycoprotein 4-like OS=Branchiostoma belcheri OX=7741 GN=LOC109465683 PE=4 SV=1, Branchiostoma_belcheri_tr_A0A6P4XZ48_A0A6P4XZ48_BRABE tr|A0A6P4XZ48|A0A6P4XZ48_BRABE Fibrinogen-like protein A OS=Branchiostoma belcheri OX=7741 GN=LOC109464786 PE=4 SV=1, Branchiostoma_belcheri_tr_A0A6P4YHM8_A0A6P4YHM8_BRABE tr|A0A6P4YHM8|A0A6P4YHM8_BRABE Ryncolin-4-like OS=Branchiostoma belcheri OX=7741 GN=LOC109464026 PE=4 SV=1, Branchiostoma_belcheri_tr_A0A6P4Y4V3_A0A6P4Y4V3_BRABE tr|A0A6P4Y4V3|A0A6P4Y4V3_BRABE Microfibril-associated glycoprotein 4-like OS=Branchiostoma belcheri OX=7741 GN=LOC109464782 PE=4 SV=1, Branchiostoma_belcheri_tr_A0A6P4ZXX1_A0A6P4ZXX1_BRABE tr|A0A6P4ZXX1|A0A6P4ZXX1_BRABE Ficolin-1-like OS=Branchiostoma belcheri OX=7741 GN=LOC109483180 PE=4 SV=1, Branchiostoma_belcheri_tr_A0A6P4Z8L0_A0A6P4Z8L0_BRABE tr|A0A6P4Z8L0|A0A6P4Z8L0_BRABE Fibrinogen C domain-containing protein 1-like OS=Branchiostoma belcheri OX=7741 GN=LOC109474373 PE=4 SV=1, Branchiostoma_belcheri_tr_A0A6P4XLF2_A0A6P4XLF2_BRABE tr|A0A6P4XLF2|A0A6P4XLF2_BRABE Ficolin-2-like OS=Branchiostoma belcheri OX=7741 GN=LOC109464783 PE=4 SV=1, Branchiostoma_belcheri_tr_A0A6P5AQT5_A0A6P5AQT5_BRABE tr|A0A6P5AQT5|A0A6P5AQT5_BRABE Ficolin-2-like OS=Branchiostoma belcheri OX=7741 GN=LOC109486177 PE=4 SV=1, Branchiostoma_belcheri_tr_A0A6P5A5V3_A0A6P5A5V3_BRABE tr|A0A6P5A5V3|A0A6P5A5V3_BRABE Ficolin-2-like OS=Branchiostoma belcheri OX=7741 GN=LOC109479604 PE=4 SV=1, Branchiostoma_belcheri_tr_A0A6P4Z8I3_A0A6P4Z8I3_BRABE tr|A0A6P4Z8I3|A0A6P4Z8I3_BRABE Ficolin-2-like OS=Branchiostoma belcheri OX=7741 GN=LOC109474346 PE=4 SV=1, Branchiostoma_belcheri_tr_A0A6P4YT49_A0A6P4YT49_BRABE tr|A0A6P4YT49|A0A6P4YT49_BRABE Ficolin-2-like OS=Branchiostoma belcheri OX=7741 GN=LOC109470417 PE=4 SV=1, Branchiostoma_belcheri_tr_A0A6P4Y4V8_A0A6P4Y4V8_BRABE tr|A0A6P4Y4V8|A0A6P4Y4V8_BRABE Ficolin-2-like OS=Branchiostoma belcheri OX=7741 GN=LOC109464787 PE=4 SV=1, Branchiostoma_belcheri_tr_A0A6P4ZKN5_A0A6P4ZKN5_BRABE tr|A0A6P4ZKN5|A0A6P4ZKN5_BRABE Techylectin-5B-like OS=Branchiostoma belcheri OX=7741 GN=LOC109474349 PE=4 SV=1, Branchiostoma_belcheri_tr_A0A6P5ACA1_A0A6P5ACA1_BRABE tr|A0A6P5ACA1|A0A6P5ACA1_BRABE Techylectin-5A-like OS=Branchiostoma belcheri OX=7741 GN=LOC109484963 PE=4 SV=1, Branchiostoma_belcheri_tr_A0A6P4YJY2_A0A6P4YJY2_BRABE tr|A0A6P4YJY2|A0A6P4YJY2_BRABE Ficolin-1-like OS=Branchiostoma belcheri OX=7741 GN=LOC109464784 PE=4 SV=1, Branchiostoma_belcheri_tr_A0A6P5AA72_A0A6P5AA72_BRABE tr|A0A6P5AA72|A0A6P5AA72_BRABE Fibrinogen C domain-containing protein 1-like OS=Branchiostoma belcheri OX=7741 GN=LOC109484292 PE=4 SV=1, Branchiostoma_belcheri_tr_A0A6P4ZPI7_A0A6P4ZPI7_BRABE tr|A0A6P4ZPI7|A0A6P4ZPI7_BRABE Uncharacterized protein LOC109484279 OS=Branchiostoma belcheri OX=7741 GN=LOC109484279 PE=4 SV=1, Branchiostoma_belcheri_tr_A0A6P5ANP5_A0A6P5ANP5_BRABE tr|A0A6P5ANP5|A0A6P5ANP5_BRABE Uncharacterized protein LOC109484728 isoform X1 OS=Branchiostoma belcheri OX=7741 GN=LOC109484728 PE=4 SV=1, Branchiostoma_belcheri_tr_A0A6P5AKN7_A0A6P5AKN7_BRABE tr|A0A6P5AKN7|A0A6P5AKN7_BRABE Uncharacterized protein LOC109484728 isoform X2 OS=Branchiostoma belcheri OX=7741 GN=LOC109484728 PE=4 SV=1, Branchiostoma_belcheri_tr_A0A6P5AJ42_A0A6P5AJ42_BRABE tr|A0A6P5AJ42|A0A6P5AJ42_BRABE Ryncolin-1-like OS=Branchiostoma belcheri OX=7741 GN=LOC109484349 PE=4 SV=1, Branchiostoma_belcheri_tr_A0A6P4YDM3_A0A6P4YDM3_BRABE tr|A0A6P4YDM3|A0A6P4YDM3_BRABE Ficolin-1-like OS=Branchiostoma belcheri OX=7741 GN=LOC109468654 PE=4 SV=1
OG0000000	Amphimedon_queenslandica_tr_A0A1X7UEG4_A0A1X7UEG4_AMPQE tr_A0A1X7UEG4_A0A1X7UEG4_AMPQE Fibrinogen C-terminal domain-containing protein OS=Amphimedon queenslandica OX=400682 PE=4 SV=1, Amphimedon_queenslandica_tr_A0A1X7VPP5_A0A1X7VPP5_AMPQE tr_A0A1X7VPP5_A0A1X7VPP5_AMPQE Uncharacterized protein OS=Amphimedon queenslandica OX=400682 PE=4 SV=1, Amphimedon_queenslandica_tr_A0A1X7TEX2_A0A1X7TEX2_AMPQE tr_A0A1X7TEX2_A0A1X7TEX2_AMPQE Uncharacterized protein OS=Amphimedon queenslandica OX=400682 PE=4 SV=1, Amphimedon_queenslandica_tr_A0A1X7TFJ4_A0A1X7TFJ4_AMPQE tr_A0A1X7TFJ4_A0A1X7TFJ4_AMPQE Fibrinogen C-terminal domain-containing protein OS=Amphimedon queenslandica OX=400682 PE=4 SV=1, Amphimedon_queenslandica_tr_A0A1X7TFU9_A0A1X7TFU9_AMPQE tr_A0A1X7TFU9_A0A1X7TFU9_AMPQE Fibrinogen C-terminal domain-containing protein OS=Amphimedon queenslandica OX=400682 PE=4 SV=1	Branchiostoma_belcheri_tr_A0A6P4XKH2_A0A6P4XKH2_BRABE tr|A0A6P4XKH2|A0A6P4XKH2_BRABE Fibrinogen-like protein 1 OS=Branchiostoma belcheri OX=7741 GN=LOC109464489 PE=4 SV=1, Branchiostoma_belcheri_tr_A0A6P5A3M2_A0A6P5A3M2_BRABE tr|A0A6P5A3M2|A0A6P5A3M2_BRABE Fibrinogen-like protein 1 OS=Branchiostoma belcheri OX=7741 GN=LOC109485040 PE=4 SV=1, Branchiostoma_belcheri_tr_A0A6P4ZUI1_A0A6P4ZUI1_BRABE tr|A0A6P4ZUI1|A0A6P4ZUI1_BRABE Fibrinogen-like protein 1 OS=Branchiostoma belcheri OX=7741 GN=LOC109485587 PE=4 SV=1, Branchiostoma_belcheri_tr_A0A6P5AM29_A0A6P5AM29_BRABE tr|A0A6P5AM29|A0A6P5AM29_BRABE Fibrinogen-like protein 1 OS=Branchiostoma belcheri OX=7741 GN=LOC109485109 PE=4 SV=1, Branchiostoma_belcheri_tr_A0A6P4Y5B9_A0A6P4Y5B9_BRABE tr|A0A6P4Y5B9|A0A6P4Y5B9_BRABE Fibrinogen-like protein 1 OS=Branchiostoma belcheri OX=7741 GN=LOC109469899 PE=4 SV=1, Branchiostoma_belcheri_tr_A0A6P5AET1_A0A6P5AET1_BRABE tr|A0A6P5AET1|A0A6P5AET1_BRABE Angiopoietin-related protein 7-like OS=Branchiostoma belcheri OX=7741 GN=LOC109485594 PE=4 SV=1, Branchiostoma_belcheri_tr_A0A6P4YGC2_A0A6P4YGC2_BRABE tr|A0A6P4YGC2|A0A6P4YGC2_BRABE Ficolin-2-like OS=Branchiostoma belcheri OX=7741 GN=LOC109469421 PE=4 SV=1, Branchiostoma_belcheri_tr_A0A6P4ZD09_A0A6P4ZD09_BRABE tr|A0A6P4ZD09|A0A6P4ZD09_BRABE Fibrinogen-like protein 1 OS=Branchiostoma belcheri OX=7741 GN=LOC109477660 PE=4 SV=1, Branchiostoma_belcheri_tr_A0A6P4YGY1_A0A6P4YGY1_BRABE tr|A0A6P4YGY1|A0A6P4YGY1_BRABE Angiopoietin-related protein 7-like OS=Branchiostoma belcheri OX=7741 GN=LOC109467609 PE=4 SV=1, Branchiostoma_belcheri_tr_A0A6P4ZL63_A0A6P4ZL63_BRABE tr|A0A6P4ZL63|A0A6P4ZL63_BRABE Microfibril-associated glycoprotein 4-like OS=Branchiostoma belcheri OX=7741 GN=LOC109477800 PE=4 SV=1, Branchiostoma_belcheri_tr_A0A6P5AWN0_A0A6P5AWN0_BRABE tr|A0A6P5AWN0|A0A6P5AWN0_BRABE Fibrinogen-like protein 1 isoform X2 OS=Branchiostoma belcheri OX=7741 GN=LOC109486936 PE=4 SV=1, Branchiostoma_belcheri_tr_A0A6P4ZZ24_A0A6P4ZZ24_BRABE tr|A0A6P4ZZ24|A0A6P4ZZ24_BRABE Fibrinogen-like protein 1 isoform X1 OS=Branchiostoma belcheri OX=7741 GN=LOC109486936 PE=4 SV=1, Branchiostoma_belcheri_tr_A0A6P4YCA4_A0A6P4YCA4_BRABE tr|A0A6P4YCA4|A0A6P4YCA4_BRABE Microfibril-associated glycoprotein 4-like OS=Branchiostoma belcheri OX=7741 GN=LOC109468225 PE=4 SV=1, Branchiostoma_belcheri_tr_A0A6P4ZUE6_A0A6P4ZUE6_BRABE tr|A0A6P4ZUE6|A0A6P4ZUE6_BRABE Microfibril-associated glycoprotein 4-like isoform X1 OS=Branchiostoma belcheri OX=7741 GN=LOC109477672 PE=4 SV=1, Branchiostoma_belcheri_tr_A0A6P4ZYC4_A0A6P4ZYC4_BRABE tr|A0A6P4ZYC4|A0A6P4ZYC4_BRABE Microfibril-associated glycoprotein 4-like isoform X3 OS=Branchiostoma belcheri OX=7741 GN=LOC109477672 PE=4 SV=1, Branchiostoma_belcheri_tr_A0A6P4ZYB3_A0A6P4ZYB3_BRABE tr|A0A6P4ZYB3|A0A6P4ZYB3_BRABE Microfibril-associated glycoprotein 4-like isoform X2 OS=Branchiostoma belcheri OX=7741 GN=LOC109477672 PE=4 SV=1, Branchiostoma_belcheri_tr_A0A6P4ZD38_A0A6P4ZD38_BRABE tr|A0A6P4ZD38|A0A6P4ZD38_BRABE Fibrinogen-like protein 1 OS=Branchiostoma belcheri OX=7741 GN=LOC109477690 PE=4 SV=1, Branchiostoma_belcheri_tr_A0A6P5A705_A0A6P5A705_BRABE tr|A0A6P5A705|A0A6P5A705_BRABE Ficolin-2-like OS=Branchiostoma belcheri OX=7741 GN=LOC109481037 PE=4 SV=1, Branchiostoma_belcheri_tr_A0A6P5ATP3_A0A6P5ATP3_BRABE tr|A0A6P5ATP3|A0A6P5ATP3_BRABE Fibroleukin-like OS=Branchiostoma belcheri OX=7741 GN=LOC109486958 PE=4 SV=1, Branchiostoma_belcheri_tr_A0A6P5A7S9_A0A6P5A7S9_BRABE tr|A0A6P5A7S9|A0A6P5A7S9_BRABE Ficolin-2-like OS=Branchiostoma belcheri OX=7741 GN=LOC109481293 PE=4 SV=1, Branchiostoma_belcheri_tr_A0A6P4YKD1_A0A6P4YKD1_BRABE tr|A0A6P4YKD1|A0A6P4YKD1_BRABE Fibrinogen-like protein 1 OS=Branchiostoma belcheri OX=7741 GN=LOC109470379 PE=4 SV=1, Branchiostoma_belcheri_tr_A0A6P5A1Q2_A0A6P5A1Q2_BRABE tr|A0A6P5A1Q2|A0A6P5A1Q2_BRABE Fibrinogen-like protein 1 OS=Branchiostoma belcheri OX=7741 GN=LOC109487638 PE=4 SV=1, Branchiostoma_belcheri_tr_A0A6P4Z3Q2_A0A6P4Z3Q2_BRABE tr|A0A6P4Z3Q2|A0A6P4Z3Q2_BRABE Ficolin-2-like OS=Branchiostoma belcheri OX=7741 GN=LOC109469886 PE=4 SV=1, Branchiostoma_belcheri_tr_A0A6P4YW84_A0A6P4YW84_BRABE tr|A0A6P4YW84|A0A6P4YW84_BRABE Ficolin-1-like OS=Branchiostoma belcheri OX=7741 GN=LOC109469052 PE=4 SV=1, Branchiostoma_belcheri_tr_A0A6P4XVN1_A0A6P4XVN1_BRABE tr|A0A6P4XVN1|A0A6P4XVN1_BRABE Ficolin-2-like OS=Branchiostoma belcheri OX=7741 GN=LOC109462528 PE=4 SV=1, Branchiostoma_belcheri_tr_A0A6P5AWL3_A0A6P5AWL3_BRABE tr|A0A6P5AWL3|A0A6P5AWL3_BRABE Fibrinogen-like protein 1 OS=Branchiostoma belcheri OX=7741 GN=LOC109486909 PE=4 SV=1, Branchiostoma_belcheri_tr_A0A6P4YKG3_A0A6P4YKG3_BRABE tr|A0A6P4YKG3|A0A6P4YKG3_BRABE Ficolin-2-like OS=Branchiostoma belcheri OX=7741 GN=LOC109470413 PE=4 SV=1, Branchiostoma_belcheri_tr_A0A6P4ZWP3_A0A6P4ZWP3_BRABE tr|A0A6P4ZWP3|A0A6P4ZWP3_BRABE Techylectin-5A-like OS=Branchiostoma belcheri OX=7741 GN=LOC109480631 PE=4 SV=1, Branchiostoma_belcheri_tr_A0A6P5AER1_A0A6P5AER1_BRABE tr|A0A6P5AER1|A0A6P5AER1_BRABE Microfibril-associated glycoprotein 4-like OS=Branchiostoma belcheri OX=7741 GN=LOC109485569 PE=4 SV=1, Branchiostoma_belcheri_tr_A0A6P4YR77_A0A6P4YR77_BRABE tr|A0A6P4YR77|A0A6P4YR77_BRABE Angiopoietin-2-like OS=Branchiostoma belcheri OX=7741 GN=LOC109469883 PE=4 SV=1, Branchiostoma_belcheri_tr_A0A6P4ZMN6_A0A6P4ZMN6_BRABE tr|A0A6P4ZMN6|A0A6P4ZMN6_BRABE Microfibril-associated glycoprotein 4-like OS=Branchiostoma belcheri OX=7741 GN=LOC109475949 PE=4 SV=1, Branchiostoma_belcheri_tr_A0A6P4Z154_A0A6P4Z154_BRABE tr|A0A6P4Z154|A0A6P4Z154_BRABE Fibrinogen-like protein 1 OS=Branchiostoma belcheri OX=7741 GN=LOC109474400 PE=4 SV=1, Branchiostoma_belcheri_tr_A0A6P4Z1N4_A0A6P4Z1N4_BRABE tr|A0A6P4Z1N4|A0A6P4Z1N4_BRABE Ficolin-2-like OS=Branchiostoma belcheri OX=7741 GN=LOC109469415 PE=4 SV=1, Branchiostoma_belcheri_tr_A0A6P4YXB7_A0A6P4YXB7_BRABE tr|A0A6P4YXB7|A0A6P4YXB7_BRABE Fibrinogen C domain-containing protein 1-like OS=Branchiostoma belcheri OX=7741 GN=LOC109469359 PE=4 SV=1, Branchiostoma_belcheri_tr_A0A6P4XUL8_A0A6P4XUL8_BRABE tr|A0A6P4XUL8|A0A6P4XUL8_BRABE Fibrinogen-like protein 1 OS=Branchiostoma belcheri OX=7741 GN=LOC109462239 PE=4 SV=1
OG0000000	Amphimedon_queenslandica_tr_A0A1X7VK27_A0A1X7VK27_AMPQE tr_A0A1X7VK27_A0A1X7VK27_AMPQE Fibrinogen C-terminal domain-containing protein OS=Amphimedon queenslandica OX=400682 GN=100632192 PE=4 SV=1	Branchiostoma_belcheri_tr_A0A6P4YPR6_A0A6P4YPR6_BRABE tr|A0A6P4YPR6|A0A6P4YPR6_BRABE Fibroleukin-like OS=Branchiostoma belcheri OX=7741 GN=LOC109469578 PE=4 SV=1
OG0000001	Amphimedon_queenslandica_tr_A0A1X7VTD0_A0A1X7VTD0_AMPQE tr_A0A1X7VTD0_A0A1X7VTD0_AMPQE Uncharacterized protein OS=Amphimedon queenslandica OX=400682 GN=105314164 PE=4 SV=1	Branchiostoma_belcheri_tr_A0A6P4YTD8_A0A6P4YTD8_BRABE tr|A0A6P4YTD8|A0A6P4YTD8_BRABE Netrin-1 OS=Branchiostoma belcheri OX=7741 GN=LOC109470495 PE=4 SV=1, Branchiostoma_belcheri_tr_A0A6P4YR81_A0A6P4YR81_BRABE tr|A0A6P4YR81|A0A6P4YR81_BRABE LOW QUALITY PROTEIN_ laminin subunit beta-1-like OS=Branchiostoma belcheri OX=7741 GN=LOC109469885 PE=4 SV=1
OG0000001	Amphimedon_queenslandica_tr_A0A1X7VJK8_A0A1X7VJK8_AMPQE tr_A0A1X7VJK8_A0A1X7VJK8_AMPQE Uncharacterized protein OS=Amphimedon queenslandica OX=400682 PE=4 SV=1, Amphimedon_queenslandica_tr_A0A1X7VJP3_A0A1X7VJP3_AMPQE tr_A0A1X7VJP3_A0A1X7VJP3_AMPQE Uncharacterized protein OS=Amphimedon queenslandica OX=400682 PE=4 SV=1, Amphimedon_queenslandica_tr_A0A1X7ULH8_A0A1X7ULH8_AMPQE tr_A0A1X7ULH8_A0A1X7ULH8_AMPQE Uncharacterized protein OS=Amphimedon queenslandica OX=400682 PE=3 SV=1, Amphimedon_queenslandica_tr_A0A1X7VI68_A0A1X7VI68_AMPQE tr_A0A1X7VI68_A0A1X7VI68_AMPQE Uncharacterized protein OS=Amphimedon queenslandica OX=400682 PE=4 SV=1	Branchiostoma_belcheri_tr_A0A6P5A1V3_A0A6P5A1V3_BRABE tr|A0A6P5A1V3|A0A6P5A1V3_BRABE LOW QUALITY PROTEIN_ tenascin-X-like OS=Branchiostoma belcheri OX=7741 GN=LOC109484472 PE=3 SV=1, Branchiostoma_belcheri_tr_A0A6P4Z8M8_A0A6P4Z8M8_BRABE tr|A0A6P4Z8M8|A0A6P4Z8M8_BRABE Uncharacterized protein LOC109474384 OS=Branchiostoma belcheri OX=7741 GN=LOC109474384 PE=4 SV=1, Branchiostoma_belcheri_tr_A0A6P5ADU8_A0A6P5ADU8_BRABE tr|A0A6P5ADU8|A0A6P5ADU8_BRABE LOW QUALITY PROTEIN_ uncharacterized protein LOC109481795 OS=Branchiostoma belcheri OX=7741 GN=LOC109481795 PE=4 SV=1
