Orthogroup	Porifera_Demospongiae_Amphimedon_queenslandica	Chordata_Vertebrata_Bos_taurus
OG0000148	Amphimedon_queenslandica_tr_A0A1X7VAP2_A0A1X7VAP2_AMPQE tr_A0A1X7VAP2_A0A1X7VAP2_AMPQE TGF_BETA_2 domain-containing protein OS=Amphimedon queenslandica OX=400682 GN=105312053 PE=3 SV=1, Amphimedon_queenslandica_tr_A0A1X7V271_A0A1X7V271_AMPQE tr_A0A1X7V271_A0A1X7V271_AMPQE TGF_BETA_2 domain-containing protein OS=Amphimedon queenslandica OX=400682 GN=105312496 PE=3 SV=1	NP_001094653.1 transforming growth factor beta-3 proprotein [Bos taurus], sp|P21214.3|TGFB2_BOVIN RecName_ Full=Transforming growth factor beta-2 proprotein; AltName_ Full=Milk growth factor; Short=MGF; Contains_ RecName_ Full=Latency-associated peptide; Short=LAP; Contains_ RecName_ Full=Transforming growth factor beta-2; Short=TGF-beta-2; Flags_ Precursor, XP_005216841.1 transforming growth factor beta-2 proprotein isoform X1 [Bos taurus], sp|P18341.2|TGFB1_BOVIN RecName_ Full=Transforming growth factor beta-1 proprotein; Contains_ RecName_ Full=Latency-associated peptide; Short=LAP; Contains_ RecName_ Full=Transforming growth factor beta-1; Short=TGF-beta-1; Flags_ Precursor, sp|P18341.2|TGFB1_BOVIN RecName_ Full=Transforming growth factor beta-1 proprotein; Contains_ RecName_ Full=Latency-associated peptide; Short=LAP; Contains_ RecName_ Full=Transforming growth factor beta-1; Short=TGF-beta-1; Flags_ Precursor
OG0000156	Amphimedon_queenslandica_tr_A0A1X7V0B9_A0A1X7V0B9_AMPQE tr_A0A1X7V0B9_A0A1X7V0B9_AMPQE MFAP1 domain-containing protein OS=Amphimedon queenslandica OX=400682 GN=105312554 PE=3 SV=1	sp|Q5EA98.1|MFAP1_BOVIN RecName_ Full=Microfibrillar-associated protein 1; AltName_ Full=Spliceosome B complex protein MFAP1
OG0000167	Amphimedon_queenslandica_tr_A0A1X7VMF1_A0A1X7VMF1_AMPQE tr_A0A1X7VMF1_A0A1X7VMF1_AMPQE Integrin beta OS=Amphimedon queenslandica OX=400682 GN=100633624 PE=3 SV=1, Amphimedon_queenslandica_tr_A0A1X7VV54_A0A1X7VV54_AMPQE tr_A0A1X7VV54_A0A1X7VV54_AMPQE Integrin beta OS=Amphimedon queenslandica OX=400682 GN=100639429 PE=3 SV=1, Amphimedon_queenslandica_tr_A0A1X7UB58_A0A1X7UB58_AMPQE tr_A0A1X7UB58_A0A1X7UB58_AMPQE Integrin beta OS=Amphimedon queenslandica OX=400682 GN=100636291 PE=3 SV=1	NP_776793.1 integrin beta-1 precursor [Bos taurus], sp|P53712.3|ITB1_BOVIN RecName_ Full=Integrin beta-1; AltName_ Full=Fibronectin receptor subunit beta; AltName_ Full=VLA-4 subunit beta; AltName_ CD_antigen=CD29; Flags_ Precursor
OG0000177	Amphimedon_queenslandica_tr_A0A1X7UHH8_A0A1X7UHH8_AMPQE tr_A0A1X7UHH8_A0A1X7UHH8_AMPQE Uncharacterized protein OS=Amphimedon queenslandica OX=400682 GN=100634571 PE=4 SV=1	XP_010801455.2 oviduct-specific glycoprotein isoform X1 [Bos taurus]
OG0000182	Amphimedon_queenslandica_tr_A0A1X7U8Z7_A0A1X7U8Z7_AMPQE tr_A0A1X7U8Z7_A0A1X7U8Z7_AMPQE VWFA domain-containing protein OS=Amphimedon queenslandica OX=400682 PE=4 SV=1	NP_001068891.1 2_4-dienoyl-CoA reductase [_3E_-enoyl-CoA-producing]_ mitochondrial [Bos taurus]
OG0000202	Amphimedon_queenslandica_tr_A0A1X7V703_A0A1X7V703_AMPQE tr_A0A1X7V703_A0A1X7V703_AMPQE Uncharacterized protein OS=Amphimedon queenslandica OX=400682 GN=109581159 PE=4 SV=1	NP_001192227.2 cysteine-rich motor neuron 1 protein precursor [Bos taurus]
OG0000209	Amphimedon_queenslandica_tr_A0A1X7VKV0_A0A1X7VKV0_AMPQE tr_A0A1X7VKV0_A0A1X7VKV0_AMPQE Uncharacterized protein OS=Amphimedon queenslandica OX=400682 PE=4 SV=1	DAA23975.1 TPA_ integrator complex subunit 6 [Bos taurus]
OG0000214	Amphimedon_queenslandica_tr_A0A1X7UUJ6_A0A1X7UUJ6_AMPQE tr_A0A1X7UUJ6_A0A1X7UUJ6_AMPQE Integrator complex subunit 14 OS=Amphimedon queenslandica OX=400682 GN=100639154 PE=3 SV=1	sp|Q5EA76.1|INT14_BOVIN RecName_ Full=Integrator complex subunit 14; AltName_ Full=von Willebrand factor A domain-containing protein 9
OG0000243	Amphimedon_queenslandica_tr_A0A1X7VXB1_A0A1X7VXB1_AMPQE tr_A0A1X7VXB1_A0A1X7VXB1_AMPQE Uncharacterized protein OS=Amphimedon queenslandica OX=400682 PE=3 SV=1	DAA23895.1 TPA_ interleukin 17D-like [Bos taurus], NP_001179011.1 interleukin-17F precursor [Bos taurus], DAA20250.1 TPA_ interleukin 17C-like [Bos taurus]
OG0000247	Amphimedon_queenslandica_tr_A0A1X7SRL3_A0A1X7SRL3_AMPQE tr_A0A1X7SRL3_A0A1X7SRL3_AMPQE LRRNT domain-containing protein OS=Amphimedon queenslandica OX=400682 PE=4 SV=1	sp|P79119.1|EPYC_BOVIN RecName_ Full=Epiphycan; AltName_ Full=Dermatan sulfate proteoglycan 3; AltName_ Full=Proteoglycan-Lb; Short=PG-Lb; AltName_ Full=Small chondroitin/dermatan sulfate proteoglycan; Flags_ Precursor, sp|P58874.2|OPT_BOVIN RecName_ Full=Opticin; AltName_ Full=Oculoglycan; Flags_ Precursor, XP_059731231.1 opticin isoform X1 [Bos taurus], sp|P19879.3|MIME_BOVIN RecName_ Full=Mimecan; AltName_ Full=Osteoglycin; Contains_ RecName_ Full=Corneal keratan sulfate proteoglycan 25 core protein; Short=KSPG25 protein; Contains_ RecName_ Full=Osteoinductive factor; Short=OIF; Flags_ Precursor
OG0000252	Amphimedon_queenslandica_tr_A0A1X7VMM0_A0A1X7VMM0_AMPQE tr_A0A1X7VMM0_A0A1X7VMM0_AMPQE Uncharacterized protein OS=Amphimedon queenslandica OX=400682 GN=100641327 PE=4 SV=1	XP_024843246.1 protein kinase C-binding protein NELL1 isoform X1 [Bos taurus], XP_059742460.1 protein kinase C-binding protein NELL2 isoform X1 [Bos taurus]
OG0000276	Amphimedon_queenslandica_tr_A0A1X7THU2_A0A1X7THU2_AMPQE tr_A0A1X7THU2_A0A1X7THU2_AMPQE Uncharacterized protein OS=Amphimedon queenslandica OX=400682 GN=100641351 PE=4 SV=1, Amphimedon_queenslandica_tr_A0A1X7TVC0_A0A1X7TVC0_AMPQE tr_A0A1X7TVC0_A0A1X7TVC0_AMPQE EGF-like domain-containing protein OS=Amphimedon queenslandica OX=400682 PE=4 SV=1	sp|Q9TTK4.1|LYST_BOVIN RecName_ Full=Lysosomal-trafficking regulator
OG0000315	Amphimedon_queenslandica_tr_A0A1X7T822_A0A1X7T822_AMPQE tr_A0A1X7T822_A0A1X7T822_AMPQE Fibrinogen C-terminal domain-containing protein OS=Amphimedon queenslandica OX=400682 PE=4 SV=1, Amphimedon_queenslandica_tr_A0A1X7TKK6_A0A1X7TKK6_AMPQE tr_A0A1X7TKK6_A0A1X7TKK6_AMPQE Fibrinogen C-terminal domain-containing protein OS=Amphimedon queenslandica OX=400682 PE=4 SV=1, Amphimedon_queenslandica_tr_A0A1X7U1F8_A0A1X7U1F8_AMPQE tr_A0A1X7U1F8_A0A1X7U1F8_AMPQE Fibrinogen C-terminal domain-containing protein OS=Amphimedon queenslandica OX=400682 PE=4 SV=1, Amphimedon_queenslandica_tr_A0A1X7TKQ7_A0A1X7TKQ7_AMPQE tr_A0A1X7TKQ7_A0A1X7TKQ7_AMPQE Fibrinogen C-terminal domain-containing protein OS=Amphimedon queenslandica OX=400682 PE=4 SV=1, Amphimedon_queenslandica_tr_A0A1X7TKD5_A0A1X7TKD5_AMPQE tr_A0A1X7TKD5_A0A1X7TKD5_AMPQE Fibrinogen C-terminal domain-containing protein OS=Amphimedon queenslandica OX=400682 PE=4 SV=1, Amphimedon_queenslandica_tr_A0A1X7U232_A0A1X7U232_AMPQE tr_A0A1X7U232_A0A1X7U232_AMPQE Fibrinogen C-terminal domain-containing protein OS=Amphimedon queenslandica OX=400682 PE=4 SV=1	NP_001094745.1 intelectin-2 precursor [Bos taurus]
OG0000363	Amphimedon_queenslandica_tr_A0A1X7VEY6_A0A1X7VEY6_AMPQE tr_A0A1X7VEY6_A0A1X7VEY6_AMPQE Uncharacterized protein OS=Amphimedon queenslandica OX=400682 PE=4 SV=1	XP_002696881.1 HHIP-like protein 1 [Bos taurus]
OG0000447	Amphimedon_queenslandica_tr_A0A1X7VE53_A0A1X7VE53_AMPQE tr_A0A1X7VE53_A0A1X7VE53_AMPQE Uncharacterized protein OS=Amphimedon queenslandica OX=400682 PE=4 SV=1	XP_024831766.1 proteoglycan 4 isoform X3 [Bos taurus]
OG0000863	Amphimedon_queenslandica_tr_A0A1X7V6W4_A0A1X7V6W4_AMPQE tr_A0A1X7V6W4_A0A1X7V6W4_AMPQE Receptor protein serine_threonine kinase OS=Amphimedon queenslandica OX=400682 PE=3 SV=1	XP_059743351.1 bone morphogenetic protein receptor type-1B isoform X2 [Bos taurus], AAX19139.1 activin A receptor type IIB_ partial [Bos taurus], sp|Q95126.1|AVR2B_BOVIN RecName_ Full=Activin receptor type-2B; AltName_ Full=Activin receptor type IIB; Short=ACTR-IIB; Flags_ Precursor, sp|Q95126.1|AVR2B_BOVIN RecName_ Full=Activin receptor type-2B; AltName_ Full=Activin receptor type IIB; Short=ACTR-IIB; Flags_ Precursor
