Orthogroup	Cnidaria_Hydrozoa_Hydra_vulgaris	Chordata_Vertebrata_Mus_musculus
OG0000000	Hydra_vulgaris_Sc4wPfr_570.g25944.t1 Sc4wPfr_570.g25944.t1	Mus_musculus_sp_Q80YX1_TENA_MOUSE sp_Q80YX1_TENA_MOUSE Tenascin OS=Mus musculus OX=10090 GN=Tnc PE=1 SV=1, Mus_musculus_sp_Q80YX1_TENA_MOUSE sp_Q80YX1_TENA_MOUSE Tenascin OS=Mus musculus OX=10090 GN=Tnc PE=1 SV=1, Mus_musculus_sp_Q80YX1_TENA_MOUSE sp_Q80YX1_TENA_MOUSE Tenascin OS=Mus musculus OX=10090 GN=Tnc PE=1 SV=1, Mus_musculus_sp_Q8BYI9_TENR_MOUSE sp_Q8BYI9_TENR_MOUSE Tenascin-R OS=Mus musculus OX=10090 GN=Tnr PE=1 SV=2, Mus_musculus_sp_Q8BYI9_TENR_MOUSE sp_Q8BYI9_TENR_MOUSE Tenascin-R OS=Mus musculus OX=10090 GN=Tnr PE=1 SV=2, Mus_musculus_sp_Q80Z71_TENN_MOUSE sp_Q80Z71_TENN_MOUSE Tenascin-N OS=Mus musculus OX=10090 GN=Tnn PE=1 SV=2
OG0000001	Hydra_vulgaris_Sc4wPfr_1127.g22555.t1 Sc4wPfr_1127.g22555.t1	Mus_musculus_sp_Q61292_LAMB2_MOUSE sp_Q61292_LAMB2_MOUSE Laminin subunit beta-2 OS=Mus musculus OX=10090 GN=Lamb2 PE=1 SV=2, Mus_musculus_sp_P02469_LAMB1_MOUSE sp_P02469_LAMB1_MOUSE Laminin subunit beta-1 OS=Mus musculus OX=10090 GN=Lamb1 PE=1 SV=3
OG0000001	Hydra_vulgaris_Sc4wPfr_811.1.g17372.t1 Sc4wPfr_811.1.g17372.t1	Mus_musculus_sp_Q8R4F1_NTNG2_MOUSE sp_Q8R4F1_NTNG2_MOUSE Netrin-G2 OS=Mus musculus OX=10090 GN=Ntng2 PE=1 SV=2
OG0000001	Hydra_vulgaris_Sc4wPfr_328.2.g12077.t1 Sc4wPfr_328.2.g12077.t1	Mus_musculus_sp_Q9R0B6_LAMC3_MOUSE sp_Q9R0B6_LAMC3_MOUSE Laminin subunit gamma-3 OS=Mus musculus OX=10090 GN=Lamc3 PE=1 SV=2, Mus_musculus_sp_P02468_LAMC1_MOUSE sp_P02468_LAMC1_MOUSE Laminin subunit gamma-1 OS=Mus musculus OX=10090 GN=Lamc1 PE=1 SV=2
OG0000002	Hydra_vulgaris_Sc4wPfr_1066.g10197.t1 Sc4wPfr_1066.g10197.t1	Mus_musculus_sp_A2ATD1_ISM1_MOUSE sp_A2ATD1_ISM1_MOUSE Isthmin-1 OS=Mus musculus OX=10090 GN=Ism1 PE=1 SV=1
OG0000003	Hydra_vulgaris_Sc4wPfr_1300.g9827.t1 Sc4wPfr_1300.g9827.t1, Hydra_vulgaris_Sc4wPfr_1300.g9822.t1 Sc4wPfr_1300.g9822.t1, Hydra_vulgaris_Sc4wPfr_38.1.g13212.t4 Sc4wPfr_38.1.g13212.t4	Mus_musculus_sp_Q3SXB8_COL11_MOUSE sp_Q3SXB8_COL11_MOUSE Collectin-11 OS=Mus musculus OX=10090 GN=Colec11 PE=2 SV=2, Mus_musculus_sp_P35242_SFTPA_MOUSE sp_P35242_SFTPA_MOUSE Pulmonary surfactant-associated protein A OS=Mus musculus OX=10090 GN=Sftpa1 PE=1 SV=1, Mus_musculus_sp_P50404_SFTPD_MOUSE sp_P50404_SFTPD_MOUSE Pulmonary surfactant-associated protein D OS=Mus musculus OX=10090 GN=Sftpd PE=1 SV=1, Mus_musculus_sp_P41317_MBL2_MOUSE sp_P41317_MBL2_MOUSE Mannose-binding protein C OS=Mus musculus OX=10090 GN=Mbl2 PE=1 SV=2, Mus_musculus_sp_P39039_MBL1_MOUSE sp_P39039_MBL1_MOUSE Mannose-binding protein A OS=Mus musculus OX=10090 GN=Mbl1 PE=1 SV=1
OG0000004	Hydra_vulgaris_Sc4wPfr_756.g14109.t1 Sc4wPfr_756.g14109.t1	Mus_musculus_sp_Q8VHI5_VITRN_MOUSE sp_Q8VHI5_VITRN_MOUSE Vitrin OS=Mus musculus OX=10090 GN=Vit PE=1 SV=2, Mus_musculus_sp_Q62507_COCH_MOUSE sp_Q62507_COCH_MOUSE Cochlin OS=Mus musculus OX=10090 GN=Coch PE=1 SV=2
OG0000005	Hydra_vulgaris_Sc4wPfr_85.g841.t1 Sc4wPfr_85.g841.t1, Hydra_vulgaris_Sc4wPfr_269.g7770.t1 Sc4wPfr_269.g7770.t1, Hydra_vulgaris_Sc4wPfr_356.g7066.t1 Sc4wPfr_356.g7066.t1, Hydra_vulgaris_Sc4wPfr_356.g7078.t1 Sc4wPfr_356.g7078.t1, Hydra_vulgaris_Sc4wPfr_326.g15690.t1 Sc4wPfr_326.g15690.t1, Hydra_vulgaris_Sc4wPfr_703.g8968.t1 Sc4wPfr_703.g8968.t1, Hydra_vulgaris_Sc4wPfr_703.g8968.t2 Sc4wPfr_703.g8968.t2, Hydra_vulgaris_Sc4wPfr_703.g8970.t1 Sc4wPfr_703.g8970.t1, Hydra_vulgaris_Sc4wPfr_576.1.g2978.t1 Sc4wPfr_576.1.g2978.t1, Hydra_vulgaris_Sc4wPfr_552.g10517.t1 Sc4wPfr_552.g10517.t1, Hydra_vulgaris_Sc4wPfr_180.g11697.t1 Sc4wPfr_180.g11697.t1, Hydra_vulgaris_Sc4wPfr_144.1.g11748.t1 Sc4wPfr_144.1.g11748.t1, Hydra_vulgaris_Sc4wPfr_180.g11698.t1 Sc4wPfr_180.g11698.t1	Mus_musculus_sp_Q6HA09_ASTL_MOUSE sp_Q6HA09_ASTL_MOUSE Astacin-like metalloendopeptidase OS=Mus musculus OX=10090 GN=Astl PE=1 SV=3
OG0000006	Hydra_vulgaris_Sc4wPfr_172.g6062.t1 Sc4wPfr_172.g6062.t1, Hydra_vulgaris_Sc4wPfr_172.g6056.t1 Sc4wPfr_172.g6056.t1	Mus_musculus_sp_Q8R054_SRPX2_MOUSE sp_Q8R054_SRPX2_MOUSE Sushi repeat-containing protein SRPX2 OS=Mus musculus OX=10090 GN=Srpx2 PE=1 SV=2, Mus_musculus_sp_Q9R0M3_SRPX_MOUSE sp_Q9R0M3_SRPX_MOUSE Sushi-repeat-containing protein SRPX OS=Mus musculus OX=10090 GN=Srpx PE=2 SV=1, Mus_musculus_sp_A2AVA0_SVEP1_MOUSE sp_A2AVA0_SVEP1_MOUSE Sushi_ von Willebrand factor type A_ EGF and pentraxin domain-containing protein 1 OS=Mus musculus OX=10090 GN=Svep1 PE=1 SV=1
OG0000009	Hydra_vulgaris_Sc4wPfr_113.1.g28340.t1 Sc4wPfr_113.1.g28340.t1	Mus_musculus_sp_O08859_TSG6_MOUSE sp_O08859_TSG6_MOUSE Tumor necrosis factor-inducible gene 6 protein OS=Mus musculus OX=10090 GN=Tnfaip6 PE=1 SV=1
OG0000010	Hydra_vulgaris_Sc4wPfr_378.g22717.t1 Sc4wPfr_378.g22717.t1, Hydra_vulgaris_Sc4wPfr_378.g22717.t2 Sc4wPfr_378.g22717.t2	Mus_musculus_sp_Q05793_PGBM_MOUSE sp_Q05793_PGBM_MOUSE Basement membrane-specific heparan sulfate proteoglycan core protein OS=Mus musculus OX=10090 GN=Hspg2 PE=1 SV=1
OG0000010	Hydra_vulgaris_Sc4wPfr_5.g3410.t1 Sc4wPfr_5.g3410.t1	Mus_musculus_sp_P47931_FST_MOUSE sp_P47931_FST_MOUSE Follistatin OS=Mus musculus OX=10090 GN=Fst PE=2 SV=1
OG0000011	Hydra_vulgaris_Sc4wPfr_353.g28153.t1 Sc4wPfr_353.g28153.t1	Mus_musculus_sp_P19221_THRB_MOUSE sp_P19221_THRB_MOUSE Prothrombin OS=Mus musculus OX=10090 GN=F2 PE=1 SV=1
OG0000012	Hydra_vulgaris_Sc4wPfr_977.g21608.t1 Sc4wPfr_977.g21608.t1	Mus_musculus_sp_Q8CG65_SSPO_MOUSE sp_Q8CG65_SSPO_MOUSE SCO-spondin OS=Mus musculus OX=10090 GN=Sspo PE=2 SV=2
OG0000012	Hydra_vulgaris_Sc4wPfr_68.g2364.t1 Sc4wPfr_68.g2364.t1	Mus_musculus_sp_Q3U492_KCP_MOUSE sp_Q3U492_KCP_MOUSE Kielin_chordin-like protein OS=Mus musculus OX=10090 GN=Kcp PE=1 SV=2, Mus_musculus_sp_Q3U515_VWCE_MOUSE sp_Q3U515_VWCE_MOUSE von Willebrand factor C and EGF domain-containing protein OS=Mus musculus OX=10090 GN=Vwce PE=2 SV=2
OG0000013	Hydra_vulgaris_Sc4wPfr_804.g24094.t1 Sc4wPfr_804.g24094.t1	Mus_musculus_sp_P04426_WNT1_MOUSE sp_P04426_WNT1_MOUSE Proto-oncogene Wnt-1 OS=Mus musculus OX=10090 GN=Wnt1 PE=1 SV=1
OG0000013	Hydra_vulgaris_Sc4wPfr_399.g28064.t1 Sc4wPfr_399.g28064.t1	Mus_musculus_sp_P17553_WNT3_MOUSE sp_P17553_WNT3_MOUSE Proto-oncogene Wnt-3 OS=Mus musculus OX=10090 GN=Wnt3 PE=1 SV=1, Mus_musculus_sp_P27467_WNT3A_MOUSE sp_P27467_WNT3A_MOUSE Protein Wnt-3a OS=Mus musculus OX=10090 GN=Wnt3a PE=1 SV=1
OG0000013	Hydra_vulgaris_Sc4wPfr_275.3.g1992.t1 Sc4wPfr_275.3.g1992.t1	Mus_musculus_sp_P22724_WNT4_MOUSE sp_P22724_WNT4_MOUSE Protein Wnt-4 OS=Mus musculus OX=10090 GN=Wnt4 PE=1 SV=1
OG0000013	Hydra_vulgaris_Sc4wPfr_1214.g29750.t1 Sc4wPfr_1214.g29750.t1	Mus_musculus_sp_P28047_WNT7B_MOUSE sp_P28047_WNT7B_MOUSE Protein Wnt-7b OS=Mus musculus OX=10090 GN=Wnt7b PE=1 SV=1
OG0000013	Hydra_vulgaris_Sc4wPfr_439.g20853.t1 Sc4wPfr_439.g20853.t1	Mus_musculus_sp_P21552_WNT2_MOUSE sp_P21552_WNT2_MOUSE Protein Wnt-2 OS=Mus musculus OX=10090 GN=Wnt2 PE=2 SV=2, Mus_musculus_sp_O70283_WNT2B_MOUSE sp_O70283_WNT2B_MOUSE Protein Wnt-2b OS=Mus musculus OX=10090 GN=Wnt2b PE=2 SV=3
OG0000013	Hydra_vulgaris_Sc4wPfr_440.g6790.t1 Sc4wPfr_440.g6790.t1	Mus_musculus_sp_Q64527_WNT8A_MOUSE sp_Q64527_WNT8A_MOUSE Protein Wnt-8a OS=Mus musculus OX=10090 GN=Wnt8a PE=2 SV=2
OG0000014	Hydra_vulgaris_Sc4wPfr_1091.g16431.t1 Sc4wPfr_1091.g16431.t1, Hydra_vulgaris_Sc4wPfr_3168.g9700.t1 Sc4wPfr_3168.g9700.t1	Mus_musculus_sp_Q80T21_ATL4_MOUSE sp_Q80T21_ATL4_MOUSE ADAMTS-like protein 4 OS=Mus musculus OX=10090 GN=Adamtsl4 PE=2 SV=1, Mus_musculus_sp_Q3UTY6_THSD4_MOUSE sp_Q3UTY6_THSD4_MOUSE Thrombospondin type-1 domain-containing protein 4 OS=Mus musculus OX=10090 GN=Thsd4 PE=1 SV=2
OG0000015	Hydra_vulgaris_Sc4wPfr_330.g6850.t1 Sc4wPfr_330.g6850.t1	Mus_musculus_sp_O08524_TECTB_MOUSE sp_O08524_TECTB_MOUSE Beta-tectorin OS=Mus musculus OX=10090 GN=Tectb PE=1 SV=2
OG0000018	Hydra_vulgaris_Sc4wPfr_289.g2555.t1 Sc4wPfr_289.g2555.t1, Hydra_vulgaris_Sc4wPfr_296.g32332.t1 Sc4wPfr_296.g32332.t1, Hydra_vulgaris_Sc4wPfr_289.g2550.t1 Sc4wPfr_289.g2550.t1	Mus_musculus_sp_Q924C6_LOXL4_MOUSE sp_Q924C6_LOXL4_MOUSE Lysyl oxidase homolog 4 OS=Mus musculus OX=10090 GN=Loxl4 PE=2 SV=2, Mus_musculus_sp_Q9Z175_LOXL3_MOUSE sp_Q9Z175_LOXL3_MOUSE Lysyl oxidase homolog 3 OS=Mus musculus OX=10090 GN=Loxl3 PE=1 SV=2, Mus_musculus_sp_P58022_LOXL2_MOUSE sp_P58022_LOXL2_MOUSE Lysyl oxidase homolog 2 OS=Mus musculus OX=10090 GN=Loxl2 PE=1 SV=2
OG0000019	Hydra_vulgaris_Sc4wPfr_292.g13083.t1 Sc4wPfr_292.g13083.t1, Hydra_vulgaris_Sc4wPfr_825.g15293.t1 Sc4wPfr_825.g15293.t1, Hydra_vulgaris_Sc4wPfr_1127.1.g1473.t1 Sc4wPfr_1127.1.g1473.t1	Mus_musculus_sp_Q9Z0J7_GDF15_MOUSE sp_Q9Z0J7_GDF15_MOUSE Growth_differentiation factor 15 OS=Mus musculus OX=10090 GN=Gdf15 PE=1 SV=2, Mus_musculus_sp_O08689_GDF8_MOUSE sp_O08689_GDF8_MOUSE Growth_differentiation factor 8 OS=Mus musculus OX=10090 GN=Mstn PE=1 SV=1, Mus_musculus_sp_P55104_INHBC_MOUSE sp_P55104_INHBC_MOUSE Inhibin beta C chain OS=Mus musculus OX=10090 GN=Inhbc PE=2 SV=2, Mus_musculus_sp_O08717_INHBE_MOUSE sp_O08717_INHBE_MOUSE Inhibin beta E chain OS=Mus musculus OX=10090 GN=Inhbe PE=2 SV=2, Mus_musculus_sp_Q04998_INHBA_MOUSE sp_Q04998_INHBA_MOUSE Inhibin beta A chain OS=Mus musculus OX=10090 GN=Inhba PE=1 SV=1
OG0000019	Hydra_vulgaris_Sc4wPfr_628.g32876.t1 Sc4wPfr_628.g32876.t1, Hydra_vulgaris_Sc4wPfr_628.g32877.t1 Sc4wPfr_628.g32877.t1, Hydra_vulgaris_Sc4wPfr_628.g32875.t1 Sc4wPfr_628.g32875.t1	Mus_musculus_sp_P34821_BMP8A_MOUSE sp_P34821_BMP8A_MOUSE Bone morphogenetic protein 8A OS=Mus musculus OX=10090 GN=Bmp8a PE=2 SV=1, Mus_musculus_sp_P49003_BMP5_MOUSE sp_P49003_BMP5_MOUSE Bone morphogenetic protein 5 OS=Mus musculus OX=10090 GN=Bmp5 PE=2 SV=1, Mus_musculus_sp_P49003_BMP5_MOUSE sp_P49003_BMP5_MOUSE Bone morphogenetic protein 5 OS=Mus musculus OX=10090 GN=Bmp5 PE=2 SV=1, Mus_musculus_sp_P20722_BMP6_MOUSE sp_P20722_BMP6_MOUSE Bone morphogenetic protein 6 OS=Mus musculus OX=10090 GN=Bmp6 PE=1 SV=2, Mus_musculus_sp_P23359_BMP7_MOUSE sp_P23359_BMP7_MOUSE Bone morphogenetic protein 7 OS=Mus musculus OX=10090 GN=Bmp7 PE=1 SV=2
OG0000019	Hydra_vulgaris_Sc4wPfr_121.g2830.t1 Sc4wPfr_121.g2830.t1	Mus_musculus_sp_P21274_BMP2_MOUSE sp_P21274_BMP2_MOUSE Bone morphogenetic protein 2 OS=Mus musculus OX=10090 GN=Bmp2 PE=1 SV=3
OG0000019	Hydra_vulgaris_Sc4wPfr_639.g22916.t1 Sc4wPfr_639.g22916.t1	Mus_musculus_sp_P43028_GDF6_MOUSE sp_P43028_GDF6_MOUSE Growth_differentiation factor 6 OS=Mus musculus OX=10090 GN=Gdf6 PE=2 SV=2, Mus_musculus_sp_P43027_GDF5_MOUSE sp_P43027_GDF5_MOUSE Growth_differentiation factor 5 OS=Mus musculus OX=10090 GN=Gdf5 PE=1 SV=2, Mus_musculus_sp_P43029_GDF7_MOUSE sp_P43029_GDF7_MOUSE Growth_differentiation factor 7 OS=Mus musculus OX=10090 GN=Gdf7 PE=2 SV=2, Mus_musculus_sp_Q8BHE5_BMP3_MOUSE sp_Q8BHE5_BMP3_MOUSE Bone morphogenetic protein 3 OS=Mus musculus OX=10090 GN=Bmp3 PE=1 SV=1, Mus_musculus_sp_P97737_GDF10_MOUSE sp_P97737_GDF10_MOUSE Growth_differentiation factor 10 OS=Mus musculus OX=10090 GN=Gdf10 PE=1 SV=2
OG0000020	Hydra_vulgaris_Sc4wPfr_73.g11528.t1 Sc4wPfr_73.g11528.t1, Hydra_vulgaris_Sc4wPfr_363.2.g30379.t1 Sc4wPfr_363.2.g30379.t1, Hydra_vulgaris_Sc4wPfr_558.1.g10166.t1 Sc4wPfr_558.1.g10166.t1, Hydra_vulgaris_Sc4wPfr_16.1.g8497.t1 Sc4wPfr_16.1.g8497.t1	Mus_musculus_sp_P28481_CO2A1_MOUSE sp_P28481_CO2A1_MOUSE Collagen alpha-1_II_ chain OS=Mus musculus OX=10090 GN=Col2a1 PE=1 SV=2, Mus_musculus_sp_P28481_CO2A1_MOUSE sp_P28481_CO2A1_MOUSE Collagen alpha-1_II_ chain OS=Mus musculus OX=10090 GN=Col2a1 PE=1 SV=2, Mus_musculus_sp_P28481_CO2A1_MOUSE sp_P28481_CO2A1_MOUSE Collagen alpha-1_II_ chain OS=Mus musculus OX=10090 GN=Col2a1 PE=1 SV=2, Mus_musculus_sp_P28481_CO2A1_MOUSE sp_P28481_CO2A1_MOUSE Collagen alpha-1_II_ chain OS=Mus musculus OX=10090 GN=Col2a1 PE=1 SV=2, Mus_musculus_sp_P11087_CO1A1_MOUSE sp_P11087_CO1A1_MOUSE Collagen alpha-1_I_ chain OS=Mus musculus OX=10090 GN=Col1a1 PE=1 SV=4, Mus_musculus_sp_P11087_CO1A1_MOUSE sp_P11087_CO1A1_MOUSE Collagen alpha-1_I_ chain OS=Mus musculus OX=10090 GN=Col1a1 PE=1 SV=4, Mus_musculus_sp_Q01149_CO1A2_MOUSE sp_Q01149_CO1A2_MOUSE Collagen alpha-2_I_ chain OS=Mus musculus OX=10090 GN=Col1a2 PE=1 SV=2, Mus_musculus_sp_P08121_CO3A1_MOUSE sp_P08121_CO3A1_MOUSE Collagen alpha-1_III_ chain OS=Mus musculus OX=10090 GN=Col3a1 PE=1 SV=4, Mus_musculus_sp_Q3U962_CO5A2_MOUSE sp_Q3U962_CO5A2_MOUSE Collagen alpha-2_V_ chain OS=Mus musculus OX=10090 GN=Col5a2 PE=1 SV=1
OG0000020	Hydra_vulgaris_Sc4wPfr_73.g11591.t3 Sc4wPfr_73.g11591.t3, Hydra_vulgaris_Sc4wPfr_73.g11591.t1 Sc4wPfr_73.g11591.t1, Hydra_vulgaris_Sc4wPfr_73.g11591.t2 Sc4wPfr_73.g11591.t2	Mus_musculus_sp_Q30D77_COOA1_MOUSE sp_Q30D77_COOA1_MOUSE Collagen alpha-1_XXIV_ chain OS=Mus musculus OX=10090 GN=Col24a1 PE=2 SV=2, Mus_musculus_sp_Q5QNQ9_CORA1_MOUSE sp_Q5QNQ9_CORA1_MOUSE Collagen alpha-1_XXVII_ chain OS=Mus musculus OX=10090 GN=Col27a1 PE=2 SV=1
OG0000021	Hydra_vulgaris_Sc4wPfr_597.2.g14347.t1 Sc4wPfr_597.2.g14347.t1	Mus_musculus_sp_P01132_EGF_MOUSE sp_P01132_EGF_MOUSE Pro-epidermal growth factor OS=Mus musculus OX=10090 GN=Egf PE=1 SV=2
OG0000022	Hydra_vulgaris_Sc4wPfr_1269.g30707.t1 Sc4wPfr_1269.g30707.t1	Mus_musculus_sp_Q07076_ANXA7_MOUSE sp_Q07076_ANXA7_MOUSE Annexin A7 OS=Mus musculus OX=10090 GN=Anxa7 PE=1 SV=2
OG0000022	Hydra_vulgaris_Sc4wPfr_828.1.g12788.t1 Sc4wPfr_828.1.g12788.t1, Hydra_vulgaris_Sc4wPfr_828.1.g12787.t1 Sc4wPfr_828.1.g12787.t1	Mus_musculus_sp_Q99JG3_ANX13_MOUSE sp_Q99JG3_ANX13_MOUSE Annexin A13 OS=Mus musculus OX=10090 GN=Anxa13 PE=1 SV=3
OG0000023	Hydra_vulgaris_Sc4wPfr_463.g30914.t1 Sc4wPfr_463.g30914.t1, Hydra_vulgaris_Sc4wPfr_463.g30914.t2 Sc4wPfr_463.g30914.t2, Hydra_vulgaris_Sc4wPfr_463.g30915.t1 Sc4wPfr_463.g30915.t1	Mus_musculus_sp_Q05910_ADAM8_MOUSE sp_Q05910_ADAM8_MOUSE Disintegrin and metalloproteinase domain-containing protein 8 OS=Mus musculus OX=10090 GN=Adam8 PE=1 SV=3, Mus_musculus_sp_O35227_ADAM7_MOUSE sp_O35227_ADAM7_MOUSE Disintegrin and metalloproteinase domain-containing protein 7 OS=Mus musculus OX=10090 GN=Adam7 PE=2 SV=2, Mus_musculus_sp_Q9R0X2_ADEC1_MOUSE sp_Q9R0X2_ADEC1_MOUSE ADAM DEC1 OS=Mus musculus OX=10090 GN=Adamdec1 PE=2 SV=1, Mus_musculus_sp_Q8K410_ADA32_MOUSE sp_Q8K410_ADA32_MOUSE Disintegrin and metalloproteinase domain-containing protein 32 OS=Mus musculus OX=10090 GN=Adam32 PE=1 SV=3, Mus_musculus_sp_F8VQ03_ADAM3_MOUSE sp_F8VQ03_ADAM3_MOUSE A disintegrin and metallopeptidase domain 3 OS=Mus musculus OX=10090 GN=Adam3 PE=1 SV=1, Mus_musculus_sp_Q9R157_ADA18_MOUSE sp_Q9R157_ADA18_MOUSE Disintegrin and metalloproteinase domain-containing protein 18 OS=Mus musculus OX=10090 GN=Adam18 PE=1 SV=2, Mus_musculus_sp_Q60718_ADAM2_MOUSE sp_Q60718_ADAM2_MOUSE Disintegrin and metalloproteinase domain-containing protein 2 OS=Mus musculus OX=10090 GN=Adam2 PE=1 SV=2, Mus_musculus_sp_Q8R534_ADM1B_MOUSE sp_Q8R534_ADM1B_MOUSE Disintegrin and metalloproteinase domain-containing protein 1b OS=Mus musculus OX=10090 GN=Adam1b PE=1 SV=2, Mus_musculus_sp_Q9R159_ADA25_MOUSE sp_Q9R159_ADA25_MOUSE Disintegrin and metalloproteinase domain-containing protein 25 OS=Mus musculus OX=10090 GN=Adam25 PE=2 SV=1, Mus_musculus_sp_Q9R160_ADA24_MOUSE sp_Q9R160_ADA24_MOUSE Disintegrin and metalloproteinase domain-containing protein 24 OS=Mus musculus OX=10090 GN=Adam24 PE=1 SV=2, Mus_musculus_sp_Q9R158_AD26A_MOUSE sp_Q9R158_AD26A_MOUSE Disintegrin and metalloproteinase domain-containing protein 26A OS=Mus musculus OX=10090 GN=Adam26a PE=2 SV=2, Mus_musculus_sp_Q811Q4_ADA29_MOUSE sp_Q811Q4_ADA29_MOUSE Disintegrin and metalloproteinase domain-containing protein 29 OS=Mus musculus OX=10090 GN=Adam29 PE=2 SV=1, Mus_musculus_sp_Q9JI76_ADA21_MOUSE sp_Q9JI76_ADA21_MOUSE Disintegrin and metalloproteinase domain-containing protein 21 OS=Mus musculus OX=10090 GN=Adam21 PE=2 SV=1, Mus_musculus_sp_Q61072_ADAM9_MOUSE sp_Q61072_ADAM9_MOUSE Disintegrin and metalloproteinase domain-containing protein 9 OS=Mus musculus OX=10090 GN=Adam9 PE=1 SV=2, Mus_musculus_sp_Q61824_ADA12_MOUSE sp_Q61824_ADA12_MOUSE Disintegrin and metalloproteinase domain-containing protein 12 OS=Mus musculus OX=10090 GN=Adam12 PE=1 SV=2, Mus_musculus_sp_Q923W9_ADA33_MOUSE sp_Q923W9_ADA33_MOUSE Disintegrin and metalloproteinase domain-containing protein 33 OS=Mus musculus OX=10090 GN=Adam33 PE=1 SV=3, Mus_musculus_sp_O35674_ADA19_MOUSE sp_O35674_ADA19_MOUSE Disintegrin and metalloproteinase domain-containing protein 19 OS=Mus musculus OX=10090 GN=Adam19 PE=2 SV=2, Mus_musculus_sp_O88839_ADA15_MOUSE sp_O88839_ADA15_MOUSE Disintegrin and metalloproteinase domain-containing protein 15 OS=Mus musculus OX=10090 GN=Adam15 PE=1 SV=2, Mus_musculus_sp_O88839_ADA15_MOUSE sp_O88839_ADA15_MOUSE Disintegrin and metalloproteinase domain-containing protein 15 OS=Mus musculus OX=10090 GN=Adam15 PE=1 SV=2, Mus_musculus_sp_Q9R1V7_ADA23_MOUSE sp_Q9R1V7_ADA23_MOUSE Disintegrin and metalloproteinase domain-containing protein 23 OS=Mus musculus OX=10090 GN=Adam23 PE=1 SV=1, Mus_musculus_sp_Q9R1V6_ADA22_MOUSE sp_Q9R1V6_ADA22_MOUSE Disintegrin and metalloproteinase domain-containing protein 22 OS=Mus musculus OX=10090 GN=Adam22 PE=1 SV=2, Mus_musculus_sp_Q9R1V4_ADA11_MOUSE sp_Q9R1V4_ADA11_MOUSE Disintegrin and metalloproteinase domain-containing protein 11 OS=Mus musculus OX=10090 GN=Adam11 PE=1 SV=2
OG0000024	Hydra_vulgaris_Sc4wPfr_244.2.g15108.t1 Sc4wPfr_244.2.g15108.t1, Hydra_vulgaris_Sc4wPfr_244.2.g15108.t2 Sc4wPfr_244.2.g15108.t2	Mus_musculus_sp_Q8R0S6_WFKN1_MOUSE sp_Q8R0S6_WFKN1_MOUSE WAP_ Kazal_ immunoglobulin_ Kunitz and NTR domain-containing protein 1 OS=Mus musculus OX=10090 GN=Wfikkn1 PE=2 SV=2
OG0000024	Hydra_vulgaris_Sc4wPfr_199.g28646.t1 Sc4wPfr_199.g28646.t1	Mus_musculus_sp_Q62288_TICN1_MOUSE sp_Q62288_TICN1_MOUSE Testican-1 OS=Mus musculus OX=10090 GN=Spock1 PE=2 SV=2, Mus_musculus_sp_Q9ER58_TICN2_MOUSE sp_Q9ER58_TICN2_MOUSE Testican-2 OS=Mus musculus OX=10090 GN=Spock2 PE=1 SV=1
OG0000028	Hydra_vulgaris_Sc4wPfr_272.g11352.t1 Sc4wPfr_272.g11352.t1, Hydra_vulgaris_Sc4wPfr_272.g11351.t1 Sc4wPfr_272.g11351.t1	Mus_musculus_sp_P02463_CO4A1_MOUSE sp_P02463_CO4A1_MOUSE Collagen alpha-1_IV_ chain OS=Mus musculus OX=10090 GN=Col4a1 PE=1 SV=4, Mus_musculus_sp_Q9QZS0_CO4A3_MOUSE sp_Q9QZS0_CO4A3_MOUSE Collagen alpha-3_IV_ chain OS=Mus musculus OX=10090 GN=Col4a3 PE=1 SV=2
OG0000030	Hydra_vulgaris_Sc4wPfr_1380.1.g8435.t1 Sc4wPfr_1380.1.g8435.t1	Mus_musculus_sp_Q9Z0F8_ADA17_MOUSE sp_Q9Z0F8_ADA17_MOUSE Disintegrin and metalloproteinase domain-containing protein 17 OS=Mus musculus OX=10090 GN=Adam17 PE=1 SV=3
OG0000030	Hydra_vulgaris_Sc4wPfr_26.g17289.t1 Sc4wPfr_26.g17289.t1, Hydra_vulgaris_Sc4wPfr_26.g17289.t2 Sc4wPfr_26.g17289.t2, Hydra_vulgaris_Sc4wPfr_1020.1.g6653.t1 Sc4wPfr_1020.1.g6653.t1, Hydra_vulgaris_Sc4wPfr_1020.1.g6652.t1 Sc4wPfr_1020.1.g6652.t1	Mus_musculus_sp_O35598_ADA10_MOUSE sp_O35598_ADA10_MOUSE Disintegrin and metalloproteinase domain-containing protein 10 OS=Mus musculus OX=10090 GN=Adam10 PE=1 SV=2
OG0000034	Hydra_vulgaris_Sc4wPfr_1475.1.g4365.t1 Sc4wPfr_1475.1.g4365.t1, Hydra_vulgaris_Sc4wPfr_1475.g5204.t2 Sc4wPfr_1475.g5204.t2, Hydra_vulgaris_Sc4wPfr_1475.g5204.t1 Sc4wPfr_1475.g5204.t1, Hydra_vulgaris_Sc4wPfr_832.g4698.t1 Sc4wPfr_832.g4698.t1	Mus_musculus_sp_Q80T91_MEG11_MOUSE sp_Q80T91_MEG11_MOUSE Multiple epidermal growth factor-like domains protein 11 OS=Mus musculus OX=10090 GN=Megf11 PE=1 SV=3, Mus_musculus_sp_Q80T91_MEG11_MOUSE sp_Q80T91_MEG11_MOUSE Multiple epidermal growth factor-like domains protein 11 OS=Mus musculus OX=10090 GN=Megf11 PE=1 SV=3, Mus_musculus_sp_Q6DIB5_MEG10_MOUSE sp_Q6DIB5_MEG10_MOUSE Multiple epidermal growth factor-like domains protein 10 OS=Mus musculus OX=10090 GN=Megf10 PE=1 SV=1
OG0000034	Hydra_vulgaris_Sc4wPfr_325.1.g5332.t1 Sc4wPfr_325.1.g5332.t1, Hydra_vulgaris_Sc4wPfr_325.1.g5334.t1 Sc4wPfr_325.1.g5334.t1	Mus_musculus_sp_P60882_MEGF8_MOUSE sp_P60882_MEGF8_MOUSE Multiple epidermal growth factor-like domains protein 8 OS=Mus musculus OX=10090 GN=Megf8 PE=1 SV=2
OG0000040	Hydra_vulgaris_Sc4wPfr_62.g4386.t1 Sc4wPfr_62.g4386.t1, Hydra_vulgaris_Sc4wPfr_230.g26213.t1 Sc4wPfr_230.g26213.t1	Mus_musculus_sp_Q8BJ66_KAZD1_MOUSE sp_Q8BJ66_KAZD1_MOUSE Kazal-type serine protease inhibitor domain-containing protein 1 OS=Mus musculus OX=10090 GN=Kazald1 PE=1 SV=2, Mus_musculus_sp_Q80W15_IBPL1_MOUSE sp_Q80W15_IBPL1_MOUSE Insulin-like growth factor-binding protein-like 1 OS=Mus musculus OX=10090 GN=Igfbpl1 PE=2 SV=1, Mus_musculus_sp_Q61581_IBP7_MOUSE sp_Q61581_IBP7_MOUSE Insulin-like growth factor-binding protein 7 OS=Mus musculus OX=10090 GN=Igfbp7 PE=1 SV=3
OG0000041	Hydra_vulgaris_Sc4wPfr_422.g20203.t1 Sc4wPfr_422.g20203.t1	Mus_musculus_sp_Q99KC8_VMA5A_MOUSE sp_Q99KC8_VMA5A_MOUSE von Willebrand factor A domain-containing protein 5A OS=Mus musculus OX=10090 GN=Vwa5a PE=1 SV=2, Mus_musculus_sp_A9Z1V5_VW5B1_MOUSE sp_A9Z1V5_VW5B1_MOUSE von Willebrand factor A domain-containing protein 5B1 OS=Mus musculus OX=10090 GN=Vwa5b1 PE=2 SV=1
OG0000044	Hydra_vulgaris_Sc4wPfr_1298.g6418.t1 Sc4wPfr_1298.g6418.t1	Mus_musculus_sp_P21981_TGM2_MOUSE sp_P21981_TGM2_MOUSE Protein-glutamine gamma-glutamyltransferase 2 OS=Mus musculus OX=10090 GN=Tgm2 PE=1 SV=4, Mus_musculus_sp_Q08189_TGM3_MOUSE sp_Q08189_TGM3_MOUSE Protein-glutamine gamma-glutamyltransferase E OS=Mus musculus OX=10090 GN=Tgm3 PE=1 SV=2, Mus_musculus_sp_Q9D7I9_TGM5_MOUSE sp_Q9D7I9_TGM5_MOUSE Protein-glutamine gamma-glutamyltransferase 5 OS=Mus musculus OX=10090 GN=Tgm5 PE=2 SV=3, Mus_musculus_sp_Q8BZH1_TGM4_MOUSE sp_Q8BZH1_TGM4_MOUSE Protein-glutamine gamma-glutamyltransferase 4 OS=Mus musculus OX=10090 GN=Tgm4 PE=1 SV=2, Mus_musculus_sp_Q8BH61_F13A_MOUSE sp_Q8BH61_F13A_MOUSE Coagulation factor XIII A chain OS=Mus musculus OX=10090 GN=F13a1 PE=1 SV=3, Mus_musculus_sp_Q9JLF6_TGM1_MOUSE sp_Q9JLF6_TGM1_MOUSE Protein-glutamine gamma-glutamyltransferase K OS=Mus musculus OX=10090 GN=Tgm1 PE=1 SV=2
OG0000045	Hydra_vulgaris_Sc4wPfr_301.g14000.t1 Sc4wPfr_301.g14000.t1, Hydra_vulgaris_Sc4wPfr_14.g1744.t1 Sc4wPfr_14.g1744.t1	Mus_musculus_sp_Q61789_LAMA3_MOUSE sp_Q61789_LAMA3_MOUSE Laminin subunit alpha-3 OS=Mus musculus OX=10090 GN=Lama3 PE=1 SV=4, Mus_musculus_sp_Q61001_LAMA5_MOUSE sp_Q61001_LAMA5_MOUSE Laminin subunit alpha-5 OS=Mus musculus OX=10090 GN=Lama5 PE=1 SV=4
OG0000045	Hydra_vulgaris_Sc4wPfr_14.g1743.t1 Sc4wPfr_14.g1743.t1	Mus_musculus_sp_P97927_LAMA4_MOUSE sp_P97927_LAMA4_MOUSE Laminin subunit alpha-4 OS=Mus musculus OX=10090 GN=Lama4 PE=1 SV=2
OG0000054	Hydra_vulgaris_Sc4wPfr_1416.g33239.t1 Sc4wPfr_1416.g33239.t1	Mus_musculus_sp_O54824_IL16_MOUSE sp_O54824_IL16_MOUSE Pro-interleukin-16 OS=Mus musculus OX=10090 GN=Il16 PE=1 SV=3
OG0000080	Hydra_vulgaris_Sc4wPfr_649.g10301.t1 Sc4wPfr_649.g10301.t1, Hydra_vulgaris_Sc4wPfr_649.g10296.t1 Sc4wPfr_649.g10296.t1, Hydra_vulgaris_Sc4wPfr_649.g10299.t1 Sc4wPfr_649.g10299.t1	Mus_musculus_sp_P39876_TIMP3_MOUSE sp_P39876_TIMP3_MOUSE Metalloproteinase inhibitor 3 OS=Mus musculus OX=10090 GN=Timp3 PE=1 SV=1, Mus_musculus_sp_P25785_TIMP2_MOUSE sp_P25785_TIMP2_MOUSE Metalloproteinase inhibitor 2 OS=Mus musculus OX=10090 GN=Timp2 PE=1 SV=2, Mus_musculus_sp_P12032_TIMP1_MOUSE sp_P12032_TIMP1_MOUSE Metalloproteinase inhibitor 1 OS=Mus musculus OX=10090 GN=Timp1 PE=1 SV=2
OG0000081	Hydra_vulgaris_Sc4wPfr_324.1.g5440.t1 Sc4wPfr_324.1.g5440.t1, Hydra_vulgaris_Sc4wPfr_196.1.g29669.t1 Sc4wPfr_196.1.g29669.t1	Mus_musculus_sp_Q9CYA0_CREL2_MOUSE sp_Q9CYA0_CREL2_MOUSE Protein disulfide isomerase Creld2 OS=Mus musculus OX=10090 GN=Creld2 PE=1 SV=1, Mus_musculus_sp_Q91XD7_CREL1_MOUSE sp_Q91XD7_CREL1_MOUSE Protein disulfide isomerase Creld1 OS=Mus musculus OX=10090 GN=Creld1 PE=1 SV=1
OG0000083	Hydra_vulgaris_Sc4wPfr_131.1.g19981.t1 Sc4wPfr_131.1.g19981.t1	Mus_musculus_sp_Q812F3_HYAL5_MOUSE sp_Q812F3_HYAL5_MOUSE Hyaluronidase-5 OS=Mus musculus OX=10090 GN=Hyal5 PE=1 SV=1, Mus_musculus_sp_Q05A56_HYAL4_MOUSE sp_Q05A56_HYAL4_MOUSE Hyaluronidase-4 OS=Mus musculus OX=10090 GN=Hyal4 PE=2 SV=1, Mus_musculus_sp_O35632_HYAL2_MOUSE sp_O35632_HYAL2_MOUSE Hyaluronidase-2 OS=Mus musculus OX=10090 GN=Hyal2 PE=1 SV=2
OG0000089	Hydra_vulgaris_Sc4wPfr_811.1.g17345.t1 Sc4wPfr_811.1.g17345.t1	Mus_musculus_sp_Q920C1_CRDL1_MOUSE sp_Q920C1_CRDL1_MOUSE Chordin-like protein 1 OS=Mus musculus OX=10090 GN=Chrdl1 PE=1 SV=1, Mus_musculus_sp_Q8VEA6_CRDL2_MOUSE sp_Q8VEA6_CRDL2_MOUSE Chordin-like protein 2 OS=Mus musculus OX=10090 GN=Chrdl2 PE=1 SV=1
OG0000093	Hydra_vulgaris_Sc4wPfr_313.g17063.t1 Sc4wPfr_313.g17063.t1	Mus_musculus_sp_P35174_CYT2_MOUSE sp_P35174_CYT2_MOUSE Stefin-2 OS=Mus musculus OX=10090 GN=Stfa2 PE=3 SV=2, Mus_musculus_sp_P35173_CYT3_MOUSE sp_P35173_CYT3_MOUSE Stefin-3 OS=Mus musculus OX=10090 GN=Stfa3 PE=3 SV=1, Mus_musculus_sp_P35175_CYT1_MOUSE sp_P35175_CYT1_MOUSE Stefin-1 OS=Mus musculus OX=10090 GN=Stfa1 PE=3 SV=1, Mus_musculus_sp_Q62426_CYTB_MOUSE sp_Q62426_CYTB_MOUSE Cystatin-B OS=Mus musculus OX=10090 GN=Cstb PE=1 SV=1
OG0000112	Hydra_vulgaris_Sc4wPfr_475.1.g23420.t1 Sc4wPfr_475.1.g23420.t1, Hydra_vulgaris_Sc4wPfr_608.1.g30575.t1 Sc4wPfr_608.1.g30575.t1, Hydra_vulgaris_Sc4wPfr_1360.g9388.t1 Sc4wPfr_1360.g9388.t1, Hydra_vulgaris_Sc4wPfr_1360.g9377.t1 Sc4wPfr_1360.g9377.t1	Mus_musculus_sp_B2RY83_HPSE2_MOUSE sp_B2RY83_HPSE2_MOUSE Inactive heparanase-2 OS=Mus musculus OX=10090 GN=Hpse2 PE=2 SV=1, Mus_musculus_sp_Q6YGZ1_HPSE_MOUSE sp_Q6YGZ1_HPSE_MOUSE Heparanase OS=Mus musculus OX=10090 GN=Hpse PE=1 SV=3
OG0000114	Hydra_vulgaris_Sc4wPfr_250.g15997.t1 Sc4wPfr_250.g15997.t1	Mus_musculus_sp_Q61191_HCFC1_MOUSE sp_Q61191_HCFC1_MOUSE Host cell factor 1 OS=Mus musculus OX=10090 GN=Hcfc1 PE=1 SV=2
OG0000120	Hydra_vulgaris_Sc4wPfr_739.g28832.t1 Sc4wPfr_739.g28832.t1	Mus_musculus_sp_O35988_SDC4_MOUSE sp_O35988_SDC4_MOUSE Syndecan-4 OS=Mus musculus OX=10090 GN=Sdc4 PE=1 SV=1, Mus_musculus_sp_P43407_SDC2_MOUSE sp_P43407_SDC2_MOUSE Syndecan-2 OS=Mus musculus OX=10090 GN=Sdc2 PE=1 SV=1, Mus_musculus_sp_P18828_SDC1_MOUSE sp_P18828_SDC1_MOUSE Syndecan-1 OS=Mus musculus OX=10090 GN=Sdc1 PE=1 SV=1, Mus_musculus_sp_Q64519_SDC3_MOUSE sp_Q64519_SDC3_MOUSE Syndecan-3 OS=Mus musculus OX=10090 GN=Sdc3 PE=1 SV=2
