Orthogroup	Cnidaria_Hydrozoa_Hydra_vulgaris	Insecta_Diptera_Drosophila_melanogaster
OG0000000	Hydra_vulgaris_Sc4wPfr_570.g25944.t1 Sc4wPfr_570.g25944.t1	Drosophila_melanogaster_tr_Q9VF34_Q9VF34_DROME tr|Q9VF34|Q9VF34_DROME Fibrinogen C-terminal domain-containing protein OS=Drosophila melanogaster OX=7227 GN=FBpp0082632 PE=4 SV=2
OG0000001	Hydra_vulgaris_Sc4wPfr_1127.g22555.t1 Sc4wPfr_1127.g22555.t1	Drosophila_melanogaster_sp_P11046_LAMB1_DROME sp|P11046|LAMB1_DROME Laminin subunit beta-1 OS=Drosophila melanogaster OX=7227 GN=LanB1 PE=1 SV=4
OG0000001	Hydra_vulgaris_Sc4wPfr_328.2.g12077.t1 Sc4wPfr_328.2.g12077.t1	Drosophila_melanogaster_tr_X2JAW6_X2JAW6_DROME tr|X2JAW6|X2JAW6_DROME Laminin B2_ isoform B OS=Drosophila melanogaster OX=7227 GN=LanB2 PE=4 SV=1, Drosophila_melanogaster_sp_P15215_LAMC1_DROME sp|P15215|LAMC1_DROME Laminin subunit gamma-1 OS=Drosophila melanogaster OX=7227 GN=LanB2 PE=2 SV=2
OG0000001	Hydra_vulgaris_Sc4wPfr_1578.g16759.t1 Sc4wPfr_1578.g16759.t1, Hydra_vulgaris_Sc4wPfr_90.g1174.t1 Sc4wPfr_90.g1174.t1	Drosophila_melanogaster_tr_Q9XZC9_Q9XZC9_DROME tr|Q9XZC9|Q9XZC9_DROME Laminin alpha1_2 OS=Drosophila melanogaster OX=7227 GN=wb PE=2 SV=1, Drosophila_melanogaster_tr_Q8IP51_Q8IP51_DROME tr|Q8IP51|Q8IP51_DROME Wing blister_ isoform B OS=Drosophila melanogaster OX=7227 GN=wb PE=4 SV=1, Drosophila_melanogaster_tr_R9PY40_R9PY40_DROME tr|R9PY40|R9PY40_DROME Wing blister_ isoform G OS=Drosophila melanogaster OX=7227 GN=wb PE=4 SV=1
OG0000002	Hydra_vulgaris_Sc4wPfr_48.g30233.t1 Sc4wPfr_48.g30233.t1, Hydra_vulgaris_Sc4wPfr_175.1.g31517.t1 Sc4wPfr_175.1.g31517.t1, Hydra_vulgaris_Sc4wPfr_1747.g1269.t1 Sc4wPfr_1747.g1269.t1	Drosophila_melanogaster_tr_Q9VGJ0_Q9VGJ0_DROME tr|Q9VGJ0|Q9VGJ0_DROME Uncharacterized protein_ isoform A OS=Drosophila melanogaster OX=7227 GN=Dmel\CG12594 PE=4 SV=3
OG0000003	Hydra_vulgaris_Sc4wPfr_1968.g26006.t1 Sc4wPfr_1968.g26006.t1	Drosophila_melanogaster_tr_A1Z8L7_A1Z8L7_DROME tr|A1Z8L7|A1Z8L7_DROME Uncharacterized protein_ isoform C OS=Drosophila melanogaster OX=7227 GN=CK02422a PE=4 SV=2, Drosophila_melanogaster_tr_Q9VQX3_Q9VQX3_DROME tr|Q9VQX3|Q9VQX3_DROME HL05328p OS=Drosophila melanogaster OX=7227 GN=lectin-24Db PE=2 SV=1, Drosophila_melanogaster_tr_Q9VM16_Q9VM16_DROME tr|Q9VM16|Q9VM16_DROME LP02603p OS=Drosophila melanogaster OX=7227 GN=Dmel\CG15818 PE=2 SV=1, Drosophila_melanogaster_tr_Q9VQ53_Q9VQ53_DROME tr|Q9VQ53|Q9VQ53_DROME Uncharacterized protein_ isoform D OS=Drosophila melanogaster OX=7227 GN=mdcds_4396 PE=4 SV=3, Drosophila_melanogaster_tr_Q9VQU4_Q9VQU4_DROME tr|Q9VQU4|Q9VQU4_DROME Lectin-24A OS=Drosophila melanogaster OX=7227 GN=lectin-24A PE=2 SV=1, Drosophila_melanogaster_tr_Q9VPS3_Q9VPS3_DROME tr|Q9VPS3|Q9VPS3_DROME C-type lectin domain-containing protein OS=Drosophila melanogaster OX=7227 GN=Dmel\CG2839 PE=4 SV=2, Drosophila_melanogaster_tr_Q9W0I2_Q9W0I2_DROME tr|Q9W0I2|Q9W0I2_DROME RE15268p OS=Drosophila melanogaster OX=7227 GN=tfc PE=2 SV=1, Drosophila_melanogaster_tr_Q8IRH8_Q8IRH8_DROME tr|Q8IRH8|Q8IRH8_DROME LP02252p OS=Drosophila melanogaster OX=7227 GN=tfc PE=2 SV=1, Drosophila_melanogaster_sp_Q59DY5_LEDL3_DROME sp|Q59DY5|LEDL3_DROME C-type lectin 37Db OS=Drosophila melanogaster OX=7227 GN=lectin-37Db PE=2 SV=1, Drosophila_melanogaster_tr_Q9VKL8_Q9VKL8_DROME tr|Q9VKL8|Q9VKL8_DROME Lectin-33A OS=Drosophila melanogaster OX=7227 GN=lectin-33A PE=4 SV=2, Drosophila_melanogaster_tr_Q2XYE0_Q2XYE0_DROME tr|Q2XYE0|Q2XYE0_DROME CG8343 _Fragment_ OS=Drosophila melanogaster OX=7227 GN=CG8343 PE=4 SV=1, Drosophila_melanogaster_tr_Q6NMY2_Q6NMY2_DROME tr|Q6NMY2|Q6NMY2_DROME RH54371p OS=Drosophila melanogaster OX=7227 GN=BEST_GH10831 PE=2 SV=1
OG0000009	Hydra_vulgaris_Sc4wPfr_1380.1.g8427.t1 Sc4wPfr_1380.1.g8427.t1, Hydra_vulgaris_Sc4wPfr_175.g6382.t1 Sc4wPfr_175.g6382.t1, Hydra_vulgaris_Sc4wPfr_175.g6382.t2 Sc4wPfr_175.g6382.t2, Hydra_vulgaris_Sc4wPfr_38.1.g13212.t1 Sc4wPfr_38.1.g13212.t1, Hydra_vulgaris_Sc4wPfr_38.1.g13212.t2 Sc4wPfr_38.1.g13212.t2	Drosophila_melanogaster_tr_Q49II5_Q49II5_DROME tr|Q49II5|Q49II5_DROME Metalloendopeptidase _Fragment_ OS=Drosophila melanogaster OX=7227 GN=tok PE=4 SV=1, Drosophila_melanogaster_tr_Q49IJ1_Q49IJ1_DROME tr|Q49IJ1|Q49IJ1_DROME Metalloendopeptidase _Fragment_ OS=Drosophila melanogaster OX=7227 GN=tok PE=4 SV=1, Drosophila_melanogaster_tr_Q49IJ0_Q49IJ0_DROME tr|Q49IJ0|Q49IJ0_DROME Metalloendopeptidase _Fragment_ OS=Drosophila melanogaster OX=7227 GN=tok PE=4 SV=1, Drosophila_melanogaster_tr_Q49II8_Q49II8_DROME tr|Q49II8|Q49II8_DROME Metalloendopeptidase _Fragment_ OS=Drosophila melanogaster OX=7227 GN=tok PE=4 SV=1, Drosophila_melanogaster_tr_Q49II0_Q49II0_DROME tr|Q49II0|Q49II0_DROME Metalloendopeptidase _Fragment_ OS=Drosophila melanogaster OX=7227 GN=tok PE=4 SV=1, Drosophila_melanogaster_tr_Q49II7_Q49II7_DROME tr|Q49II7|Q49II7_DROME Metalloendopeptidase _Fragment_ OS=Drosophila melanogaster OX=7227 GN=tok PE=4 SV=1, Drosophila_melanogaster_tr_Q49IK4_Q49IK4_DROME tr|Q49IK4|Q49IK4_DROME Metalloendopeptidase _Fragment_ OS=Drosophila melanogaster OX=7227 GN=tok PE=4 SV=1, Drosophila_melanogaster_sp_Q9VC47_TOK_DROME sp|Q9VC47|TOK_DROME Protein tolkin OS=Drosophila melanogaster OX=7227 GN=tok PE=1 SV=1, Drosophila_melanogaster_tr_Q7YU36_Q7YU36_DROME tr|Q7YU36|Q7YU36_DROME Metalloendopeptidase OS=Drosophila melanogaster OX=7227 GN=tld PE=2 SV=1, Drosophila_melanogaster_sp_P25723_TLD_DROME sp|P25723|TLD_DROME Dorsal-ventral patterning protein tolloid OS=Drosophila melanogaster OX=7227 GN=tld PE=2 SV=2
OG0000010	Hydra_vulgaris_Sc4wPfr_378.g22720.t1 Sc4wPfr_378.g22720.t1, Hydra_vulgaris_Sc4wPfr_378.g22721.t1 Sc4wPfr_378.g22721.t1	Drosophila_melanogaster_tr_Q8MPN3_Q8MPN3_DROME tr|Q8MPN3|Q8MPN3_DROME Perlecan OS=Drosophila melanogaster OX=7227 GN=trol PE=2 SV=1, Drosophila_melanogaster_tr_M9NE56_M9NE56_DROME tr|M9NE56|M9NE56_DROME Terribly reduced optic lobes_ isoform AK OS=Drosophila melanogaster OX=7227 GN=trol PE=1 SV=1, Drosophila_melanogaster_tr_M9NDL5_M9NDL5_DROME tr|M9NDL5|M9NDL5_DROME Terribly reduced optic lobes_ isoform AF OS=Drosophila melanogaster OX=7227 GN=trol PE=1 SV=2, Drosophila_melanogaster_tr_M9NES6_M9NES6_DROME tr|M9NES6|M9NES6_DROME Terribly reduced optic lobes_ isoform AU OS=Drosophila melanogaster OX=7227 GN=trol PE=1 SV=2, Drosophila_melanogaster_tr_Q9W4Y3_Q9W4Y3_DROME tr|Q9W4Y3|Q9W4Y3_DROME Terribly reduced optic lobes_ isoform AT OS=Drosophila melanogaster OX=7227 GN=trol PE=1 SV=4, Drosophila_melanogaster_tr_E1JJC0_E1JJC0_DROME tr|E1JJC0|E1JJC0_DROME Terribly reduced optic lobes_ isoform AH OS=Drosophila melanogaster OX=7227 GN=trol PE=1 SV=3, Drosophila_melanogaster_tr_X2JCE8_X2JCE8_DROME tr|X2JCE8|X2JCE8_DROME Terribly reduced optic lobes_ isoform BA OS=Drosophila melanogaster OX=7227 GN=trol PE=1 SV=1, Drosophila_melanogaster_tr_X2JE09_X2JE09_DROME tr|X2JE09|X2JE09_DROME Terribly reduced optic lobes_ isoform AV OS=Drosophila melanogaster OX=7227 GN=trol PE=1 SV=1, Drosophila_melanogaster_tr_A0A023GRW4_A0A023GRW4_DROME tr|A0A023GRW4|A0A023GRW4_DROME Terribly reduced optic lobes_ isoform AZ OS=Drosophila melanogaster OX=7227 GN=trol PE=1 SV=1, Drosophila_melanogaster_tr_Q8IRV8_Q8IRV8_DROME tr|Q8IRV8|Q8IRV8_DROME Terribly reduced optic lobes_ isoform AO OS=Drosophila melanogaster OX=7227 GN=trol PE=1 SV=3, Drosophila_melanogaster_tr_M9NDM1_M9NDM1_DROME tr|M9NDM1|M9NDM1_DROME Terribly reduced optic lobes_ isoform AP OS=Drosophila melanogaster OX=7227 GN=trol PE=1 SV=2, Drosophila_melanogaster_tr_X2JDK9_X2JDK9_DROME tr|X2JDK9|X2JDK9_DROME Terribly reduced optic lobes_ isoform AS OS=Drosophila melanogaster OX=7227 GN=trol PE=1 SV=1, Drosophila_melanogaster_tr_Q9NFS9_Q9NFS9_DROME tr|Q9NFS9|Q9NFS9_DROME Perlecan domain V _Fragment_ OS=Drosophila melanogaster OX=7227 GN=trol PE=2 SV=1, Drosophila_melanogaster_tr_Q9NEG1_Q9NEG1_DROME tr|Q9NEG1|Q9NEG1_DROME EG_BACR25B3.11 protein OS=Drosophila melanogaster OX=7227 GN=trol PE=4 SV=1, Drosophila_melanogaster_tr_M9NET2_M9NET2_DROME tr|M9NET2|M9NET2_DROME Terribly reduced optic lobes_ isoform AI OS=Drosophila melanogaster OX=7227 GN=trol PE=1 SV=2, Drosophila_melanogaster_tr_M9NGK3_M9NGK3_DROME tr|M9NGK3|M9NGK3_DROME Terribly reduced optic lobes_ isoform AL OS=Drosophila melanogaster OX=7227 GN=trol PE=1 SV=2, Drosophila_melanogaster_tr_M9NFR6_M9NFR6_DROME tr|M9NFR6|M9NFR6_DROME Terribly reduced optic lobes_ isoform AY OS=Drosophila melanogaster OX=7227 GN=trol PE=1 SV=2, Drosophila_melanogaster_tr_Q8IRV9_Q8IRV9_DROME tr|Q8IRV9|Q8IRV9_DROME Terribly reduced optic lobes_ isoform AW OS=Drosophila melanogaster OX=7227 GN=trol PE=1 SV=3, Drosophila_melanogaster_tr_M9NGL3_M9NGL3_DROME tr|M9NGL3|M9NGL3_DROME Terribly reduced optic lobes_ isoform AM OS=Drosophila melanogaster OX=7227 GN=trol PE=1 SV=2, Drosophila_melanogaster_tr_Q8MSR5_Q8MSR5_DROME tr|Q8MSR5|Q8MSR5_DROME SD04592p OS=Drosophila melanogaster OX=7227 GN=trol PE=2 SV=1, Drosophila_melanogaster_tr_Q8IRV7_Q8IRV7_DROME tr|Q8IRV7|Q8IRV7_DROME Terribly reduced optic lobes_ isoform AG OS=Drosophila melanogaster OX=7227 GN=trol PE=1 SV=3, Drosophila_melanogaster_tr_X2JAC7_X2JAC7_DROME tr|X2JAC7|X2JAC7_DROME Terribly reduced optic lobes_ isoform AX OS=Drosophila melanogaster OX=7227 GN=trol PE=1 SV=1, Drosophila_melanogaster_tr_M9NE61_M9NE61_DROME tr|M9NE61|M9NE61_DROME Terribly reduced optic lobes_ isoform AR OS=Drosophila melanogaster OX=7227 GN=trol PE=1 SV=2, Drosophila_melanogaster_tr_Q9W4Y4_Q9W4Y4_DROME tr|Q9W4Y4|Q9W4Y4_DROME Terribly reduced optic lobes_ isoform AN OS=Drosophila melanogaster OX=7227 GN=trol PE=1 SV=5, Drosophila_melanogaster_tr_M9NFS1_M9NFS1_DROME tr|M9NFS1|M9NFS1_DROME Terribly reduced optic lobes_ isoform AQ OS=Drosophila melanogaster OX=7227 GN=trol PE=1 SV=2, Drosophila_melanogaster_tr_Q9NEF9_Q9NEF9_DROME tr|Q9NEF9|Q9NEF9_DROME EG_BACR25B3.1 protein OS=Drosophila melanogaster OX=7227 GN=trol PE=4 SV=1
OG0000010	Hydra_vulgaris_Sc4wPfr_1259.g23030.t1 Sc4wPfr_1259.g23030.t1	Drosophila_melanogaster_sp_A0A1F4_EYS_DROME sp|A0A1F4|EYS_DROME Protein eyes shut OS=Drosophila melanogaster OX=7227 GN=eys PE=1 SV=1, Drosophila_melanogaster_tr_M9PBU9_M9PBU9_DROME tr|M9PBU9|M9PBU9_DROME Eyes shut_ isoform E OS=Drosophila melanogaster OX=7227 GN=eys PE=4 SV=2
OG0000010	Hydra_vulgaris_Sc4wPfr_5.g3410.t1 Sc4wPfr_5.g3410.t1	Drosophila_melanogaster_tr_Q86NV3_Q86NV3_DROME tr|Q86NV3|Q86NV3_DROME Follistatin_ isoform A OS=Drosophila melanogaster OX=7227 GN=Fs PE=2 SV=1, Drosophila_melanogaster_tr_A0A0B4LFH4_A0A0B4LFH4_DROME tr|A0A0B4LFH4|A0A0B4LFH4_DROME Follistatin_ isoform B OS=Drosophila melanogaster OX=7227 GN=Fs PE=4 SV=1, Drosophila_melanogaster_tr_Q8WR59_Q8WR59_DROME tr|Q8WR59|Q8WR59_DROME Follistatin OS=Drosophila melanogaster OX=7227 GN=Fs PE=2 SV=1
OG0000012	Hydra_vulgaris_Sc4wPfr_309.g10778.t1 Sc4wPfr_309.g10778.t1, Hydra_vulgaris_Sc4wPfr_977.g21608.t1 Sc4wPfr_977.g21608.t1, Hydra_vulgaris_Sc4wPfr_363.2.g30334.t1 Sc4wPfr_363.2.g30334.t1	Drosophila_melanogaster_tr_Q9U5D0_Q9U5D0_DROME tr|Q9U5D0|Q9U5D0_DROME Hemolectin OS=Drosophila melanogaster OX=7227 GN=Hml PE=2 SV=1, Drosophila_melanogaster_tr_Q9VU94_Q9VU94_DROME tr|Q9VU94|Q9VU94_DROME Hemolectin_ isoform A OS=Drosophila melanogaster OX=7227 GN=Hml PE=1 SV=2, Drosophila_melanogaster_tr_M9PCE5_M9PCE5_DROME tr|M9PCE5|M9PCE5_DROME Hemolectin_ isoform B OS=Drosophila melanogaster OX=7227 GN=Hml PE=1 SV=1, Drosophila_melanogaster_tr_Q8MS79_Q8MS79_DROME tr|Q8MS79|Q8MS79_DROME LP05709p OS=Drosophila melanogaster OX=7227 GN=Hml PE=2 SV=1
OG0000012	Hydra_vulgaris_Sc4wPfr_68.g2364.t1 Sc4wPfr_68.g2364.t1	Drosophila_melanogaster_tr_Q9W2H2_Q9W2H2_DROME tr|Q9W2H2|Q9W2H2_DROME Crossveinless 2 OS=Drosophila melanogaster OX=7227 GN=cv-2 PE=2 SV=2, Drosophila_melanogaster_tr_Q9GYX3_Q9GYX3_DROME tr|Q9GYX3|Q9GYX3_DROME Crossveinless 2 OS=Drosophila melanogaster OX=7227 GN=cv-2 PE=2 SV=2
OG0000012	Hydra_vulgaris_Sc4wPfr_977.g21610.t1 Sc4wPfr_977.g21610.t1	Drosophila_melanogaster_tr_Q9VKA7_Q9VKA7_DROME tr|Q9VKA7|Q9VKA7_DROME VWFC domain-containing protein OS=Drosophila melanogaster OX=7227 GN=Dmel\CG17211 PE=4 SV=1
OG0000013	Hydra_vulgaris_Sc4wPfr_68.g2322.t1 Sc4wPfr_68.g2322.t1, Hydra_vulgaris_Sc4wPfr_68.g2320.t1 Sc4wPfr_68.g2320.t1, Hydra_vulgaris_Sc4wPfr_224.1.g33373.t1 Sc4wPfr_224.1.g33373.t1	Drosophila_melanogaster_tr_Q9VM26_Q9VM26_DROME tr|Q9VM26|Q9VM26_DROME Protein Wnt OS=Drosophila melanogaster OX=7227 GN=Wnt6 PE=2 SV=3
OG0000013	Hydra_vulgaris_Sc4wPfr_804.g24094.t1 Sc4wPfr_804.g24094.t1	Drosophila_melanogaster_sp_P09615_WNTG_DROME sp|P09615|WNTG_DROME Protein wingless OS=Drosophila melanogaster OX=7227 GN=wg PE=1 SV=1
OG0000013	Hydra_vulgaris_Sc4wPfr_287.2.g28262.t1 Sc4wPfr_287.2.g28262.t1	Drosophila_melanogaster_sp_P28466_WNT5_DROME sp|P28466|WNT5_DROME Protein Wnt-5 OS=Drosophila melanogaster OX=7227 GN=Wnt5 PE=1 SV=2, Drosophila_melanogaster_tr_X2JL29_X2JL29_DROME tr|X2JL29|X2JL29_DROME Protein Wnt OS=Drosophila melanogaster OX=7227 GN=Wnt5 PE=3 SV=1, Drosophila_melanogaster_tr_Q2XY20_Q2XY20_DROME tr|Q2XY20|Q2XY20_DROME Protein Wnt _Fragment_ OS=Drosophila melanogaster OX=7227 GN=Wnt5 PE=3 SV=1
OG0000013	Hydra_vulgaris_Sc4wPfr_1214.g29750.t1 Sc4wPfr_1214.g29750.t1	Drosophila_melanogaster_sp_P28465_WNT2_DROME sp|P28465|WNT2_DROME Protein Wnt-2 OS=Drosophila melanogaster OX=7227 GN=Wnt2 PE=2 SV=2, Drosophila_melanogaster_tr_A0A0B4LFY4_A0A0B4LFY4_DROME tr|A0A0B4LFY4|A0A0B4LFY4_DROME Protein Wnt OS=Drosophila melanogaster OX=7227 GN=Wnt2 PE=3 SV=1
OG0000013	Hydra_vulgaris_Sc4wPfr_440.g6790.t1 Sc4wPfr_440.g6790.t1	Drosophila_melanogaster_sp_Q9VFX1_WNT8_DROME sp|Q9VFX1|WNT8_DROME Wnt inhibitor of Dorsal protein OS=Drosophila melanogaster OX=7227 GN=wntD PE=1 SV=2
OG0000014	Hydra_vulgaris_Sc4wPfr_1091.g16431.t1 Sc4wPfr_1091.g16431.t1, Hydra_vulgaris_Sc4wPfr_3168.g9700.t1 Sc4wPfr_3168.g9700.t1	Drosophila_melanogaster_tr_Q9VKV3_Q9VKV3_DROME tr|Q9VKV3|Q9VKV3_DROME Lonely heart_ isoform A OS=Drosophila melanogaster OX=7227 GN=loh PE=4 SV=3, Drosophila_melanogaster_tr_Q8MSF8_Q8MSF8_DROME tr|Q8MSF8|Q8MSF8_DROME GM15606p OS=Drosophila melanogaster OX=7227 GN=loh PE=2 SV=1, Drosophila_melanogaster_tr_E1JHE3_E1JHE3_DROME tr|E1JHE3|E1JHE3_DROME Lonely heart_ isoform D OS=Drosophila melanogaster OX=7227 GN=loh PE=4 SV=2, Drosophila_melanogaster_tr_M9MRI1_M9MRI1_DROME tr|M9MRI1|M9MRI1_DROME Lonely heart_ isoform C OS=Drosophila melanogaster OX=7227 GN=loh PE=4 SV=1
OG0000014	Hydra_vulgaris_Sc4wPfr_1091.g16432.t1 Sc4wPfr_1091.g16432.t1	Drosophila_melanogaster_tr_Q8MRL5_Q8MRL5_DROME tr|Q8MRL5|Q8MRL5_DROME ADAM metallopeptidase with thrombospondin type 1 motif B_ isoform C OS=Drosophila melanogaster OX=7227 GN=AdamTS-B PE=2 SV=1, Drosophila_melanogaster_tr_Q9W493_Q9W493_DROME tr|Q9W493|Q9W493_DROME ADAM metallopeptidase with thrombospondin type 1 motif B_ isoform B OS=Drosophila melanogaster OX=7227 GN=AdamTS-B PE=4 SV=3
OG0000019	Hydra_vulgaris_Sc4wPfr_292.g13083.t1 Sc4wPfr_292.g13083.t1, Hydra_vulgaris_Sc4wPfr_825.g15293.t1 Sc4wPfr_825.g15293.t1, Hydra_vulgaris_Sc4wPfr_1127.1.g1473.t1 Sc4wPfr_1127.1.g1473.t1	Drosophila_melanogaster_tr_Q9XZ62_Q9XZ62_DROME tr|Q9XZ62|Q9XZ62_DROME Myoglianin OS=Drosophila melanogaster OX=7227 GN=myo PE=2 SV=1, Drosophila_melanogaster_tr_Q9V4F4_Q9V4F4_DROME tr|Q9V4F4|Q9V4F4_DROME LD29161p OS=Drosophila melanogaster OX=7227 GN=myo PE=2 SV=1, Drosophila_melanogaster_sp_O61643_INHB_DROME sp|O61643|INHB_DROME Inhibin beta chain OS=Drosophila melanogaster OX=7227 GN=Actbeta PE=1 SV=2, Drosophila_melanogaster_tr_Q9VQG9_Q9VQG9_DROME tr|Q9VQG9|Q9VQG9_DROME Dawdle_ isoform A OS=Drosophila melanogaster OX=7227 GN=daw PE=2 SV=1, Drosophila_melanogaster_tr_Q8SZQ4_Q8SZQ4_DROME tr|Q8SZQ4|Q8SZQ4_DROME RE69013p OS=Drosophila melanogaster OX=7227 GN=mav PE=2 SV=1, Drosophila_melanogaster_tr_Q9V4E6_Q9V4E6_DROME tr|Q9V4E6|Q9V4E6_DROME Maverick OS=Drosophila melanogaster OX=7227 GN=mav PE=2 SV=1
OG0000019	Hydra_vulgaris_Sc4wPfr_628.g32876.t1 Sc4wPfr_628.g32876.t1, Hydra_vulgaris_Sc4wPfr_628.g32877.t1 Sc4wPfr_628.g32877.t1, Hydra_vulgaris_Sc4wPfr_628.g32875.t1 Sc4wPfr_628.g32875.t1	Drosophila_melanogaster_tr_X2JB15_X2JB15_DROME tr|X2JB15|X2JB15_DROME Screw_ isoform B OS=Drosophila melanogaster OX=7227 GN=scw PE=3 SV=1, Drosophila_melanogaster_sp_P54631_SCW_DROME sp|P54631|SCW_DROME Protein screw OS=Drosophila melanogaster OX=7227 GN=scw PE=2 SV=2, Drosophila_melanogaster_sp_P27091_60A_DROME sp|P27091|60A_DROME Protein 60A OS=Drosophila melanogaster OX=7227 GN=gbb PE=1 SV=1, Drosophila_melanogaster_tr_A0A0B4LGA7_A0A0B4LGA7_DROME tr|A0A0B4LGA7|A0A0B4LGA7_DROME Glass bottom boat_ isoform B OS=Drosophila melanogaster OX=7227 GN=gbb PE=3 SV=1
OG0000019	Hydra_vulgaris_Sc4wPfr_121.g2830.t1 Sc4wPfr_121.g2830.t1	Drosophila_melanogaster_sp_P07713_DECA_DROME sp|P07713|DECA_DROME Protein decapentaplegic OS=Drosophila melanogaster OX=7227 GN=dpp PE=1 SV=2
OG0000022	Hydra_vulgaris_Sc4wPfr_181.2.g21314.t1 Sc4wPfr_181.2.g21314.t1	Drosophila_melanogaster_sp_Q9VXG4_ANX11_DROME sp|Q9VXG4|ANX11_DROME Annexin B11 OS=Drosophila melanogaster OX=7227 GN=AnxB11 PE=2 SV=2, Drosophila_melanogaster_tr_A0A0B4KH34_A0A0B4KH34_DROME tr|A0A0B4KH34|A0A0B4KH34_DROME Annexin OS=Drosophila melanogaster OX=7227 GN=AnxB9 PE=1 SV=1, Drosophila_melanogaster_sp_P22464_ANXB9_DROME sp|P22464|ANXB9_DROME Annexin B9 OS=Drosophila melanogaster OX=7227 GN=AnxB9 PE=1 SV=2, Drosophila_melanogaster_sp_P22465_ANX10_DROME sp|P22465|ANX10_DROME Annexin B10 OS=Drosophila melanogaster OX=7227 GN=AnxB10 PE=2 SV=3
OG0000023	Hydra_vulgaris_Sc4wPfr_463.g30914.t1 Sc4wPfr_463.g30914.t1, Hydra_vulgaris_Sc4wPfr_463.g30914.t2 Sc4wPfr_463.g30914.t2, Hydra_vulgaris_Sc4wPfr_463.g30915.t1 Sc4wPfr_463.g30915.t1	Drosophila_melanogaster_tr_B7Z0Y2_B7Z0Y2_DROME tr|B7Z0Y2|B7Z0Y2_DROME Mind-meld_ isoform D OS=Drosophila melanogaster OX=7227 GN=mmd PE=4 SV=1, Drosophila_melanogaster_tr_Q9VXL1_Q9VXL1_DROME tr|Q9VXL1|Q9VXL1_DROME Mind-meld_ isoform F OS=Drosophila melanogaster OX=7227 GN=mmd PE=4 SV=6, Drosophila_melanogaster_tr_X2JE21_X2JE21_DROME tr|X2JE21|X2JE21_DROME Mind-meld_ isoform J OS=Drosophila melanogaster OX=7227 GN=mmd PE=4 SV=1, Drosophila_melanogaster_tr_M9PER2_M9PER2_DROME tr|M9PER2|M9PER2_DROME Mind-meld_ isoform H OS=Drosophila melanogaster OX=7227 GN=mmd PE=4 SV=1, Drosophila_melanogaster_tr_M9PH86_M9PH86_DROME tr|M9PH86|M9PH86_DROME Mind-meld_ isoform I OS=Drosophila melanogaster OX=7227 GN=mmd PE=4 SV=1, Drosophila_melanogaster_tr_M9NDY9_M9NDY9_DROME tr|M9NDY9|M9NDY9_DROME Mind-meld_ isoform G OS=Drosophila melanogaster OX=7227 GN=mmd PE=4 SV=1, Drosophila_melanogaster_tr_M9NH46_M9NH46_DROME tr|M9NH46|M9NH46_DROME Mind-meld_ isoform E OS=Drosophila melanogaster OX=7227 GN=mmd PE=4 SV=1, Drosophila_melanogaster_tr_Q7KUY7_Q7KUY7_DROME tr|Q7KUY7|Q7KUY7_DROME Mind-meld_ isoform B OS=Drosophila melanogaster OX=7227 GN=mmd PE=4 SV=2, Drosophila_melanogaster_tr_Q9GZ15_Q9GZ15_DROME tr|Q9GZ15|Q9GZ15_DROME MIND-MELD _Fragment_ OS=Drosophila melanogaster OX=7227 GN=mmd PE=2 SV=1
OG0000023	Hydra_vulgaris_Sc4wPfr_618.g14849.t1 Sc4wPfr_618.g14849.t1	Drosophila_melanogaster_tr_Q8T3I9_Q8T3I9_DROME tr|Q8T3I9|Q8T3I9_DROME SD03917p OS=Drosophila melanogaster OX=7227 GN=Meltrin PE=2 SV=1, Drosophila_melanogaster_tr_Q86P79_Q86P79_DROME tr|Q86P79|Q86P79_DROME SD04095p _Fragment_ OS=Drosophila melanogaster OX=7227 GN=Meltrin PE=2 SV=1, Drosophila_melanogaster_tr_Q400M8_Q400M8_DROME tr|Q400M8|Q400M8_DROME Meltrin_ isoform D OS=Drosophila melanogaster OX=7227 GN=Meltrin PE=1 SV=2, Drosophila_melanogaster_tr_Q6QU65_Q6QU65_DROME tr|Q6QU65|Q6QU65_DROME ADAM metalloprotease OS=Drosophila melanogaster OX=7227 GN=Meltrin PE=1 SV=1
OG0000024	Hydra_vulgaris_Sc4wPfr_199.g28646.t1 Sc4wPfr_199.g28646.t1	Drosophila_melanogaster_tr_A0A0B4KH80_A0A0B4KH80_DROME tr|A0A0B4KH80|A0A0B4KH80_DROME Carrier of wingless_ isoform E OS=Drosophila melanogaster OX=7227 GN=Cow PE=4 SV=1, Drosophila_melanogaster_sp_Q9VCR3_COW_DROME sp|Q9VCR3|COW_DROME Proteoglycan Cow OS=Drosophila melanogaster OX=7227 GN=Cow PE=1 SV=3
OG0000028	Hydra_vulgaris_Sc4wPfr_272.g11352.t1 Sc4wPfr_272.g11352.t1, Hydra_vulgaris_Sc4wPfr_272.g11351.t1 Sc4wPfr_272.g11351.t1	Drosophila_melanogaster_tr_O18407_O18407_DROME tr|O18407|O18407_DROME Collagen type IV alpha 2 OS=Drosophila melanogaster OX=7227 GN=vkg PE=2 SV=1, Drosophila_melanogaster_tr_Q9VMV5_Q9VMV5_DROME tr|Q9VMV5|Q9VMV5_DROME Viking_ isoform A OS=Drosophila melanogaster OX=7227 GN=vkg PE=1 SV=1
OG0000030	Hydra_vulgaris_Sc4wPfr_1380.1.g8435.t1 Sc4wPfr_1380.1.g8435.t1	Drosophila_melanogaster_sp_Q9VAC5_ADA17_DROME sp|Q9VAC5|ADA17_DROME ADAM 17-like protease OS=Drosophila melanogaster OX=7227 GN=Tace PE=2 SV=2
OG0000030	Hydra_vulgaris_Sc4wPfr_26.g17289.t1 Sc4wPfr_26.g17289.t1, Hydra_vulgaris_Sc4wPfr_26.g17289.t2 Sc4wPfr_26.g17289.t2, Hydra_vulgaris_Sc4wPfr_1020.1.g6653.t1 Sc4wPfr_1020.1.g6653.t1, Hydra_vulgaris_Sc4wPfr_1020.1.g6652.t1 Sc4wPfr_1020.1.g6652.t1	Drosophila_melanogaster_tr_Q9VAI2_Q9VAI2_DROME tr|Q9VAI2|Q9VAI2_DROME Kuzbanian-like_ isoform A OS=Drosophila melanogaster OX=7227 GN=Kul PE=4 SV=1, Drosophila_melanogaster_tr_A0A0B4LHU2_A0A0B4LHU2_DROME tr|A0A0B4LHU2|A0A0B4LHU2_DROME Kuzbanian-like_ isoform C OS=Drosophila melanogaster OX=7227 GN=Kul PE=4 SV=1, Drosophila_melanogaster_tr_Q59DZ3_Q59DZ3_DROME tr|Q59DZ3|Q59DZ3_DROME FI21209p1 OS=Drosophila melanogaster OX=7227 GN=kuz PE=1 SV=1, Drosophila_melanogaster_tr_A8DZ03_A8DZ03_DROME tr|A8DZ03|A8DZ03_DROME Kuzbanian_ isoform G OS=Drosophila melanogaster OX=7227 GN=kuz PE=1 SV=2, Drosophila_melanogaster_tr_A8DZ02_A8DZ02_DROME tr|A8DZ02|A8DZ02_DROME Kuzbanian_ isoform F OS=Drosophila melanogaster OX=7227 GN=kuz PE=1 SV=2, Drosophila_melanogaster_tr_Q9VJW9_Q9VJW9_DROME tr|Q9VJW9|Q9VJW9_DROME Kuzbanian_ isoform A OS=Drosophila melanogaster OX=7227 GN=kuz PE=1 SV=1, Drosophila_melanogaster_tr_Q94902_Q94902_DROME tr|Q94902|Q94902_DROME Kuzbanian OS=Drosophila melanogaster OX=7227 GN=kuz PE=2 SV=1
OG0000034	Hydra_vulgaris_Sc4wPfr_325.1.g5334.t1 Sc4wPfr_325.1.g5334.t1	Drosophila_melanogaster_tr_Q9VLT6_Q9VLT6_DROME tr|Q9VLT6|Q9VLT6_DROME Multiple EGF like domains 8_ isoform B OS=Drosophila melanogaster OX=7227 GN=Megf8 PE=4 SV=4, Drosophila_melanogaster_tr_X2J9V1_X2J9V1_DROME tr|X2J9V1|X2J9V1_DROME Multiple EGF like domains 8_ isoform C OS=Drosophila melanogaster OX=7227 GN=Megf8 PE=4 SV=1, Drosophila_melanogaster_tr_Q8T0D8_Q8T0D8_DROME tr|Q8T0D8|Q8T0D8_DROME LD09511p OS=Drosophila melanogaster OX=7227 GN=Megf8 PE=2 SV=1
OG0000044	Hydra_vulgaris_Sc4wPfr_1298.g6418.t1 Sc4wPfr_1298.g6418.t1	Drosophila_melanogaster_tr_Q8IPH0_Q8IPH0_DROME tr|Q8IPH0|Q8IPH0_DROME Transglutaminase_ isoform B OS=Drosophila melanogaster OX=7227 GN=Tg PE=1 SV=1, Drosophila_melanogaster_tr_Q9VLU2_Q9VLU2_DROME tr|Q9VLU2|Q9VLU2_DROME RE08173p OS=Drosophila melanogaster OX=7227 GN=Tg PE=2 SV=2
OG0000045	Hydra_vulgaris_Sc4wPfr_301.g14000.t1 Sc4wPfr_301.g14000.t1, Hydra_vulgaris_Sc4wPfr_14.g1744.t1 Sc4wPfr_14.g1744.t1	Drosophila_melanogaster_sp_Q00174_LAMA_DROME sp|Q00174|LAMA_DROME Laminin subunit alpha OS=Drosophila melanogaster OX=7227 GN=LanA PE=1 SV=2
OG0000045	Hydra_vulgaris_Sc4wPfr_14.g1743.t1 Sc4wPfr_14.g1743.t1	Drosophila_melanogaster_tr_M9MRU0_M9MRU0_DROME tr|M9MRU0|M9MRU0_DROME Wing blister_ isoform C OS=Drosophila melanogaster OX=7227 GN=wb PE=4 SV=1
OG0000049	Hydra_vulgaris_Sc4wPfr_2743.g8203.t1 Sc4wPfr_2743.g8203.t1	Drosophila_melanogaster_tr_Q86M56_Q86M56_DROME tr|Q86M56|Q86M56_DROME LD10519p OS=Drosophila melanogaster OX=7227 GN=PlexA PE=2 SV=1
OG0000080	Hydra_vulgaris_Sc4wPfr_649.g10301.t1 Sc4wPfr_649.g10301.t1, Hydra_vulgaris_Sc4wPfr_649.g10296.t1 Sc4wPfr_649.g10296.t1, Hydra_vulgaris_Sc4wPfr_649.g10299.t1 Sc4wPfr_649.g10299.t1	Drosophila_melanogaster_sp_Q9VH14_TIMP_DROME sp|Q9VH14|TIMP_DROME Tissue inhibitor of metalloproteinase OS=Drosophila melanogaster OX=7227 GN=Timp PE=1 SV=1
OG0000120	Hydra_vulgaris_Sc4wPfr_739.g28832.t1 Sc4wPfr_739.g28832.t1	Drosophila_melanogaster_tr_B7YZN0_B7YZN0_DROME tr|B7YZN0|B7YZN0_DROME Syndecan OS=Drosophila melanogaster OX=7227 GN=Sdc PE=1 SV=2, Drosophila_melanogaster_tr_E1JGQ9_E1JGQ9_DROME tr|E1JGQ9|E1JGQ9_DROME Syndecan OS=Drosophila melanogaster OX=7227 GN=Sdc PE=1 SV=2, Drosophila_melanogaster_sp_P49415_SDC_DROME sp|P49415|SDC_DROME Syndecan OS=Drosophila melanogaster OX=7227 GN=Sdc PE=2 SV=2, Drosophila_melanogaster_tr_B7YZM9_B7YZM9_DROME tr|B7YZM9|B7YZM9_DROME Syndecan OS=Drosophila melanogaster OX=7227 GN=Sdc PE=1 SV=1, Drosophila_melanogaster_tr_A0A0B4LG79_A0A0B4LG79_DROME tr|A0A0B4LG79|A0A0B4LG79_DROME Syndecan OS=Drosophila melanogaster OX=7227 GN=Sdc PE=1 SV=1, Drosophila_melanogaster_tr_A0A0B4K862_A0A0B4K862_DROME tr|A0A0B4K862|A0A0B4K862_DROME Syndecan OS=Drosophila melanogaster OX=7227 GN=Sdc PE=3 SV=1
OG0000133	Hydra_vulgaris_Sc4wPfr_628.g32869.t1 Sc4wPfr_628.g32869.t1	Drosophila_melanogaster_sp_Q9VPF0_ATK_DROME sp|Q9VPF0|ATK_DROME Protein artichoke OS=Drosophila melanogaster OX=7227 GN=atk PE=1 SV=2
OG0000141	Hydra_vulgaris_Sc4wPfr_106.g23502.t1 Sc4wPfr_106.g23502.t1	Drosophila_melanogaster_tr_Q9VVK3_Q9VVK3_DROME tr|Q9VVK3|Q9VVK3_DROME Ccn OS=Drosophila melanogaster OX=7227 GN=Ccn PE=2 SV=2
OG0000299	Hydra_vulgaris_Sc4wPfr_868.g27218.t1 Sc4wPfr_868.g27218.t1, Hydra_vulgaris_Sc4wPfr_868.g27218.t2 Sc4wPfr_868.g27218.t2	Drosophila_melanogaster_tr_Q9VFA8_Q9VFA8_DROME tr|Q9VFA8|Q9VFA8_DROME Uncharacterized protein_ isoform D OS=Drosophila melanogaster OX=7227 GN=lincRNA.S6902 PE=4 SV=5, Drosophila_melanogaster_tr_A0A0C4DHG7_A0A0C4DHG7_DROME tr|A0A0C4DHG7|A0A0C4DHG7_DROME Uncharacterized protein_ isoform F OS=Drosophila melanogaster OX=7227 GN=CG31154 PE=4 SV=1
