Orthogroup	Cnidaria_Hydrozoa_Hydra_vulgaris	Chordata_Vertebrata_Mus_musculus
OG0000122	Hydra_vulgaris_Sc4wPfr_787.g23207.t1 Sc4wPfr_787.g23207.t1	Mus_musculus_sp_P33434_MMP2_MOUSE sp_P33434_MMP2_MOUSE 72 kDa type IV collagenase OS=Mus musculus OX=10090 GN=Mmp2 PE=1 SV=1, Mus_musculus_sp_P41245_MMP9_MOUSE sp_P41245_MMP9_MOUSE Matrix metalloproteinase-9 OS=Mus musculus OX=10090 GN=Mmp9 PE=1 SV=2
OG0000141	Hydra_vulgaris_Sc4wPfr_106.g23502.t1 Sc4wPfr_106.g23502.t1	Mus_musculus_sp_Q9Z0G4_CCN5_MOUSE sp_Q9Z0G4_CCN5_MOUSE CCN family member 5 OS=Mus musculus OX=10090 GN=Ccn5 PE=2 SV=1, Mus_musculus_sp_O54775_CCN4_MOUSE sp_O54775_CCN4_MOUSE CCN family member 4 OS=Mus musculus OX=10090 GN=Ccn4 PE=2 SV=1, Mus_musculus_sp_P29268_CCN2_MOUSE sp_P29268_CCN2_MOUSE CCN family member 2 OS=Mus musculus OX=10090 GN=Ccn2 PE=1 SV=3, Mus_musculus_sp_P18406_CCN1_MOUSE sp_P18406_CCN1_MOUSE CCN family member 1 OS=Mus musculus OX=10090 GN=Ccn1 PE=1 SV=1
OG0000154	Hydra_vulgaris_Sc4wPfr_165.g9991.t2 Sc4wPfr_165.g9991.t2	Mus_musculus_sp_Q66K08_CILP1_MOUSE sp_Q66K08_CILP1_MOUSE Cartilage intermediate layer protein 1 OS=Mus musculus OX=10090 GN=Cilp PE=1 SV=1, Mus_musculus_sp_D3Z7H8_CILP2_MOUSE sp_D3Z7H8_CILP2_MOUSE Cartilage intermediate layer protein 2 OS=Mus musculus OX=10090 GN=Cilp2 PE=1 SV=1
OG0000156	Hydra_vulgaris_Sc4wPfr_292.g13106.t1 Sc4wPfr_292.g13106.t1, Hydra_vulgaris_Sc4wPfr_292.g13097.t1 Sc4wPfr_292.g13097.t1	Mus_musculus_sp_C0HKD9_MFA1B_MOUSE sp_C0HKD9_MFA1B_MOUSE Microfibrillar-associated protein 1B OS=Mus musculus OX=10090 GN=Mfap1b PE=1 SV=1
OG0000160	Hydra_vulgaris_Sc4wPfr_707.1.g4138.t1 Sc4wPfr_707.1.g4138.t1	Mus_musculus_sp_Q3UW26_BSPH1_MOUSE sp_Q3UW26_BSPH1_MOUSE Binder of sperm protein homolog 1 OS=Mus musculus OX=10090 GN=Bsph1 PE=2 SV=1
OG0000261	Hydra_vulgaris_Sc4wPfr_388.g4770.t1 Sc4wPfr_388.g4770.t1	Mus_musculus_sp_Q9R118_HTRA1_MOUSE sp_Q9R118_HTRA1_MOUSE Serine protease HTRA1 OS=Mus musculus OX=10090 GN=Htra1 PE=1 SV=2, Mus_musculus_sp_A2RT60_HTRA4_MOUSE sp_A2RT60_HTRA4_MOUSE Serine protease HTRA4 OS=Mus musculus OX=10090 GN=Htra4 PE=2 SV=1, Mus_musculus_sp_Q9D236_HTRA3_MOUSE sp_Q9D236_HTRA3_MOUSE Serine protease HTRA3 OS=Mus musculus OX=10090 GN=Htra3 PE=1 SV=3, Mus_musculus_sp_Q9D236_HTRA3_MOUSE sp_Q9D236_HTRA3_MOUSE Serine protease HTRA3 OS=Mus musculus OX=10090 GN=Htra3 PE=1 SV=3, Mus_musculus_sp_Q9D236_HTRA3_MOUSE sp_Q9D236_HTRA3_MOUSE Serine protease HTRA3 OS=Mus musculus OX=10090 GN=Htra3 PE=1 SV=3
OG0000268	Hydra_vulgaris_Sc4wPfr_304.2.g12739.t1 Sc4wPfr_304.2.g12739.t1	Mus_musculus_sp_Q9Z2L7_CRLF3_MOUSE sp_Q9Z2L7_CRLF3_MOUSE Cytokine receptor-like factor 3 OS=Mus musculus OX=10090 GN=Crlf3 PE=1 SV=1
OG0000291	Hydra_vulgaris_Sc4wPfr_635.g14772.t1 Sc4wPfr_635.g14772.t1	Mus_musculus_sp_Q8R1W8_IMPG1_MOUSE sp_Q8R1W8_IMPG1_MOUSE Interphotoreceptor matrix proteoglycan 1 OS=Mus musculus OX=10090 GN=Impg1 PE=1 SV=1, Mus_musculus_sp_Q80XH2_IMPG2_MOUSE sp_Q80XH2_IMPG2_MOUSE Interphotoreceptor matrix proteoglycan 2 OS=Mus musculus OX=10090 GN=Impg2 PE=1 SV=1
OG0000350	Hydra_vulgaris_Sc4wPfr_239.g21109.t1 Sc4wPfr_239.g21109.t1	Mus_musculus_sp_J3S6Y1_TSEAR_MOUSE sp_J3S6Y1_TSEAR_MOUSE Thrombospondin-type laminin G domain and EAR repeat-containing protein OS=Mus musculus OX=10090 GN=Tspear PE=1 SV=1
OG0000463	Hydra_vulgaris_Sc4wPfr_176.g26307.t1 Sc4wPfr_176.g26307.t1	Mus_musculus_sp_Q9WUA1_WIF1_MOUSE sp_Q9WUA1_WIF1_MOUSE Wnt inhibitory factor 1 OS=Mus musculus OX=10090 GN=Wif1 PE=2 SV=1
