Orthogroup	Chordata_Amphioxiformes_Branchiostoma_floridae	Platyhelminthes_Tricladida_Schmidtea_mediterranea
OG0000009	Branchiostoma_floridae_tr_A0A9J7M4L8_A0A9J7M4L8_BRAFL tr|A0A9J7M4L8|A0A9J7M4L8_BRAFL Metalloendopeptidase OS=Branchiostoma floridae OX=7739 GN=LOC118428034 PE=4 SV=1, Branchiostoma_floridae_tr_A0A9J7M3H7_A0A9J7M3H7_BRAFL tr|A0A9J7M3H7|A0A9J7M3H7_BRAFL Bone morphogenetic protein 1-like OS=Branchiostoma floridae OX=7739 GN=LOC118428033 PE=4 SV=1, Branchiostoma_floridae_tr_A0A9J7HMB2_A0A9J7HMB2_BRAFL tr|A0A9J7HMB2|A0A9J7HMB2_BRAFL Metalloendopeptidase OS=Branchiostoma floridae OX=7739 GN=LOC118405444 PE=4 SV=1, Branchiostoma_floridae_tr_A0A9J7KQT2_A0A9J7KQT2_BRAFL tr|A0A9J7KQT2|A0A9J7KQT2_BRAFL Metalloendopeptidase OS=Branchiostoma floridae OX=7739 GN=LOC118410730 PE=4 SV=1	Schmidtea_mediterranea_maker-scaffold7935-augustus-gene-0.39-mRNA-1 maker-scaffold7935-augustus-gene-0.39-mRNA-1 protein AED_0.10 eAED_0.10 QI_422|1|1|1|0.35|0.72|18|100|1068
OG0000009	Branchiostoma_floridae_tr_A0A9J7HI82_A0A9J7HI82_BRAFL tr|A0A9J7HI82|A0A9J7HI82_BRAFL GPI-anchored protein pfl2 OS=Branchiostoma floridae OX=7739 GN=LOC118404856 PE=4 SV=1	Schmidtea_mediterranea_maker-scaffold17880-augustus-gene-0.37-mRNA-1 maker-scaffold17880-augustus-gene-0.37-mRNA-1 protein AED_0.01 eAED_0.01 QI_15|1|0.8|1|0|0.4|5|0|231, Schmidtea_mediterranea_maker-scaffold5831-snap-gene-1.61-mRNA-1 maker-scaffold5831-snap-gene-1.61-mRNA-1 protein AED_0.45 eAED_0.55 QI_0|0|0|0.66|1|1|3|0|161
OG0000009	Branchiostoma_floridae_tr_A0A9J7KYW3_A0A9J7KYW3_BRAFL tr|A0A9J7KYW3|A0A9J7KYW3_BRAFL P-selectin-like OS=Branchiostoma floridae OX=7739 GN=LOC118413623 PE=4 SV=1	Schmidtea_mediterranea_maker-scaffold5831-snap-gene-1.66-mRNA-1 maker-scaffold5831-snap-gene-1.66-mRNA-1 protein AED_0.56 eAED_0.56 QI_0|0|0|0.22|1|1|9|0|397, Schmidtea_mediterranea_maker-scaffold5831-snap-gene-1.67-mRNA-1 maker-scaffold5831-snap-gene-1.67-mRNA-1 protein AED_0.58 eAED_0.58 QI_0|0|0|0.5|0.66|1|4|0|254, Schmidtea_mediterranea_maker-scaffold5831-snap-gene-1.65-mRNA-1 maker-scaffold5831-snap-gene-1.65-mRNA-1 protein AED_0.69 eAED_0.69 QI_0|0|0|0.2|1|1|5|0|244
OG0000010	Branchiostoma_floridae_tr_A0A9J7LDU2_A0A9J7LDU2_BRAFL tr|A0A9J7LDU2|A0A9J7LDU2_BRAFL Roundabout homolog 1-like isoform X8 OS=Branchiostoma floridae OX=7739 GN=LOC118418184 PE=4 SV=1, Branchiostoma_floridae_tr_A0A9J7MU47_A0A9J7MU47_BRAFL tr|A0A9J7MU47|A0A9J7MU47_BRAFL Roundabout homolog 1-like isoform X9 OS=Branchiostoma floridae OX=7739 GN=LOC118418184 PE=4 SV=1, Branchiostoma_floridae_tr_A0A9J7LDR8_A0A9J7LDR8_BRAFL tr|A0A9J7LDR8|A0A9J7LDR8_BRAFL Roundabout homolog 1-like isoform X2 OS=Branchiostoma floridae OX=7739 GN=LOC118418184 PE=4 SV=1, Branchiostoma_floridae_tr_A0A9J7LBR2_A0A9J7LBR2_BRAFL tr|A0A9J7LBR2|A0A9J7LBR2_BRAFL Roundabout homolog 1-like isoform X1 OS=Branchiostoma floridae OX=7739 GN=LOC118418184 PE=4 SV=1, Branchiostoma_floridae_tr_A0A9J7LDT4_A0A9J7LDT4_BRAFL tr|A0A9J7LDT4|A0A9J7LDT4_BRAFL Roundabout homolog 1-like isoform X6 OS=Branchiostoma floridae OX=7739 GN=LOC118418184 PE=4 SV=1, Branchiostoma_floridae_tr_A0A9J7LE75_A0A9J7LE75_BRAFL tr|A0A9J7LE75|A0A9J7LE75_BRAFL Roundabout homolog 2-like isoform X5 OS=Branchiostoma floridae OX=7739 GN=LOC118418184 PE=4 SV=1, Branchiostoma_floridae_tr_A0A9J7MV02_A0A9J7MV02_BRAFL tr|A0A9J7MV02|A0A9J7MV02_BRAFL Roundabout homolog 1-like isoform X4 OS=Branchiostoma floridae OX=7739 GN=LOC118418184 PE=4 SV=1, Branchiostoma_floridae_tr_A0A9J7LE64_A0A9J7LE64_BRAFL tr|A0A9J7LE64|A0A9J7LE64_BRAFL Roundabout homolog 1-like isoform X3 OS=Branchiostoma floridae OX=7739 GN=LOC118418184 PE=4 SV=1, Branchiostoma_floridae_tr_A0A9J7LBV0_A0A9J7LBV0_BRAFL tr|A0A9J7LBV0|A0A9J7LBV0_BRAFL Roundabout homolog 1-like isoform X10 OS=Branchiostoma floridae OX=7739 GN=LOC118418184 PE=4 SV=1, Branchiostoma_floridae_tr_A0A9J7LE85_A0A9J7LE85_BRAFL tr|A0A9J7LE85|A0A9J7LE85_BRAFL Roundabout homolog 1-like isoform X7 OS=Branchiostoma floridae OX=7739 GN=LOC118418184 PE=4 SV=1	Schmidtea_mediterranea_maker-scaffold40828-augustus-gene-0.30-mRNA-1 maker-scaffold40828-augustus-gene-0.30-mRNA-1 protein AED_0.00 eAED_0.00 QI_82|1|0.66|1|1|1|3|0|1101
OG0000011	Branchiostoma_floridae_tr_A0A9J7KWY2_A0A9J7KWY2_BRAFL tr|A0A9J7KWY2|A0A9J7KWY2_BRAFL Plasminogen-like OS=Branchiostoma floridae OX=7739 GN=LOC118412373 PE=4 SV=1, Branchiostoma_floridae_tr_A0A9J7N8G5_A0A9J7N8G5_BRAFL tr|A0A9J7N8G5|A0A9J7N8G5_BRAFL Apolipoprotein_A_-like OS=Branchiostoma floridae OX=7739 GN=LOC118427767 PE=4 SV=1	Schmidtea_mediterranea_maker-scaffold10194-snap-gene-0.60-mRNA-1 maker-scaffold10194-snap-gene-0.60-mRNA-1 protein AED_0.18 eAED_0.18 QI_0|0|0|0.42|1|1|7|0|322
OG0000011	Branchiostoma_floridae_tr_A0A9J7KZ36_A0A9J7KZ36_BRAFL tr|A0A9J7KZ36|A0A9J7KZ36_BRAFL Semaphorin-5B-like OS=Branchiostoma floridae OX=7739 GN=LOC118413574 PE=4 SV=1	Schmidtea_mediterranea_maker-scaffold1071-snap-gene-1.56-mRNA-1 maker-scaffold1071-snap-gene-1.56-mRNA-1 protein AED_0.54 eAED_0.54 QI_0|0|0|0.25|0.33|0.25|4|0|122, Schmidtea_mediterranea_maker-scaffold1071-snap-gene-1.57-mRNA-1 maker-scaffold1071-snap-gene-1.57-mRNA-1 protein AED_0.22 eAED_0.24 QI_0|0|0|1|0|0|2|0|203
OG0000011	Branchiostoma_floridae_tr_A0A9J7MIH1_A0A9J7MIH1_BRAFL tr|A0A9J7MIH1|A0A9J7MIH1_BRAFL Uncharacterized protein LOC118410859 OS=Branchiostoma floridae OX=7739 GN=LOC118410859 PE=4 SV=1	Schmidtea_mediterranea_maker-scaffold19804-snap-gene-0.12-mRNA-1 maker-scaffold19804-snap-gene-0.12-mRNA-1 protein AED_0.04 eAED_0.04 QI_37|0.5|0.66|1|0|0|3|77|99, Schmidtea_mediterranea_maker-scaffold15368-augustus-gene-0.16-mRNA-1 maker-scaffold15368-augustus-gene-0.16-mRNA-1 protein AED_0.04 eAED_0.04 QI_0|1|0.5|1|1|1|2|80|186
OG0000011	Branchiostoma_floridae_tr_A0A9J7HT24_A0A9J7HT24_BRAFL tr|A0A9J7HT24|A0A9J7HT24_BRAFL Uncharacterized protein LOC118408260 OS=Branchiostoma floridae OX=7739 GN=LOC118408260 PE=4 SV=1, Branchiostoma_floridae_tr_A0A9J7HUU4_A0A9J7HUU4_BRAFL tr|A0A9J7HUU4|A0A9J7HUU4_BRAFL Plasminogen-like OS=Branchiostoma floridae OX=7739 GN=LOC118408262 PE=4 SV=1	Schmidtea_mediterranea_maker-scaffold392-augustus-gene-1.29-mRNA-1 maker-scaffold392-augustus-gene-1.29-mRNA-1 protein AED_0.01 eAED_0.01 QI_0|0.66|0.5|0.75|0.66|0.75|4|1444|178
OG0000012	Branchiostoma_floridae_tr_A0A9J7LSZ6_A0A9J7LSZ6_BRAFL tr|A0A9J7LSZ6|A0A9J7LSZ6_BRAFL SCO-spondin-like OS=Branchiostoma floridae OX=7739 GN=LOC118424280 PE=4 SV=1	Schmidtea_mediterranea_maker-scaffold15036-snap-gene-0.26-mRNA-1 maker-scaffold15036-snap-gene-0.26-mRNA-1 protein AED_0.06 eAED_0.06 QI_0|0.83|0.83|0.96|0.53|0.58|31|0|1798
OG0000012	Branchiostoma_floridae_tr_A0A9J7LUQ0_A0A9J7LUQ0_BRAFL tr|A0A9J7LUQ0|A0A9J7LUQ0_BRAFL von Willebrand factor C and EGF domain-containing protein-like OS=Branchiostoma floridae OX=7739 GN=LOC118424175 PE=4 SV=1, Branchiostoma_floridae_tr_A0A9J7N427_A0A9J7N427_BRAFL tr|A0A9J7N427|A0A9J7N427_BRAFL Mucin-2-like OS=Branchiostoma floridae OX=7739 GN=LOC118424274 PE=4 SV=1	Schmidtea_mediterranea_maker-scaffold3230-augustus-gene-1.44-mRNA-1 maker-scaffold3230-augustus-gene-1.44-mRNA-1 protein AED_0.24 eAED_0.29 QI_0|0.78|0.8|0.93|0.28|0.53|15|59|1141, Schmidtea_mediterranea_maker-scaffold12100-snap-gene-0.38-mRNA-1 maker-scaffold12100-snap-gene-0.38-mRNA-1 protein AED_0.26 eAED_0.26 QI_0|0.75|0.6|0.8|0.5|0.2|5|0|1076
OG0000012	Branchiostoma_floridae_tr_A0A9J7HWC3_A0A9J7HWC3_BRAFL tr|A0A9J7HWC3|A0A9J7HWC3_BRAFL IgGFc-binding protein-like OS=Branchiostoma floridae OX=7739 GN=LOC118409032 PE=4 SV=1, Branchiostoma_floridae_tr_A0A9J7KLZ2_A0A9J7KLZ2_BRAFL tr|A0A9J7KLZ2|A0A9J7KLZ2_BRAFL Uncharacterized protein LOC118409063 OS=Branchiostoma floridae OX=7739 GN=LOC118409063 PE=4 SV=1	Schmidtea_mediterranea_maker-scaffold17393-augustus-gene-0.24-mRNA-1 maker-scaffold17393-augustus-gene-0.24-mRNA-1 protein AED_0.05 eAED_0.05 QI_240|0.66|0.5|1|1|1|4|0|943, Schmidtea_mediterranea_maker-scaffold17393-augustus-gene-0.25-mRNA-1 maker-scaffold17393-augustus-gene-0.25-mRNA-1 protein AED_0.00 eAED_0.00 QI_434|1|1|1|0.5|0.66|3|24|211
OG0000013	Branchiostoma_floridae_tr_A0A9J7L5Y9_A0A9J7L5Y9_BRAFL tr|A0A9J7L5Y9|A0A9J7L5Y9_BRAFL Protein Wnt OS=Branchiostoma floridae OX=7739 GN=LOC118415996 PE=3 SV=1	Schmidtea_mediterranea_maker-scaffold1075-snap-gene-0.46-mRNA-1 maker-scaffold1075-snap-gene-0.46-mRNA-1 protein AED_0.12 eAED_0.12 QI_109|0.66|0.42|1|0.33|0|7|0|511, Schmidtea_mediterranea_maker-scaffold4491-snap-gene-0.19-mRNA-1 maker-scaffold4491-snap-gene-0.19-mRNA-1 protein AED_0.08 eAED_0.08 QI_0|0|0|0.5|0.2|0.16|6|0|372, Schmidtea_mediterranea_maker-scaffold14654-snap-gene-0.26-mRNA-1 maker-scaffold14654-snap-gene-0.26-mRNA-1 protein AED_0.15 eAED_0.15 QI_0|0|0|0.33|0.8|0.83|6|0|309, Schmidtea_mediterranea_maker-scaffold24568-augustus-gene-0.47-mRNA-1 maker-scaffold24568-augustus-gene-0.47-mRNA-1 protein AED_0.00 eAED_0.00 QI_16|1|1|1|0.5|0.33|3|124|372
OG0000013	Branchiostoma_floridae_tr_C3Z2P0_C3Z2P0_BRAFL tr|C3Z2P0|C3Z2P0_BRAFL Protein Wnt OS=Branchiostoma floridae OX=7739 GN=LOC118415326 PE=3 SV=1	Schmidtea_mediterranea_maker-scaffold4184-snap-gene-0.24-mRNA-1 maker-scaffold4184-snap-gene-0.24-mRNA-1 protein AED_0.05 eAED_0.05 QI_0|0|0|0.5|0.6|0.5|6|0|427
OG0000013	Branchiostoma_floridae_tr_O61700_O61700_BRAFL tr|O61700|O61700_BRAFL Protein Wnt OS=Branchiostoma floridae OX=7739 GN=Wnt7b PE=2 SV=1, Branchiostoma_floridae_tr_A0A9J7L7U8_A0A9J7L7U8_BRAFL tr|A0A9J7L7U8|A0A9J7L7U8_BRAFL Protein Wnt OS=Branchiostoma floridae OX=7739 GN=LOC118416551 PE=3 SV=1, Branchiostoma_floridae_tr_A0A9J7L936_A0A9J7L936_BRAFL tr|A0A9J7L936|A0A9J7L936_BRAFL Protein Wnt OS=Branchiostoma floridae OX=7739 GN=LOC118416575 PE=3 SV=1, Branchiostoma_floridae_tr_A0A9J7L7H8_A0A9J7L7H8_BRAFL tr|A0A9J7L7H8|A0A9J7L7H8_BRAFL Protein Wnt OS=Branchiostoma floridae OX=7739 GN=LOC118416575 PE=3 SV=1	Schmidtea_mediterranea_maker-scaffold5858-augustus-gene-1.57-mRNA-1 maker-scaffold5858-augustus-gene-1.57-mRNA-1 protein AED_0.19 eAED_0.19 QI_722|0.83|0.85|0.85|0.16|0.71|7|0|346
OG0000014	Branchiostoma_floridae_tr_A0A9J7L9D6_A0A9J7L9D6_BRAFL tr|A0A9J7L9D6|A0A9J7L9D6_BRAFL A disintegrin and metalloproteinase with thrombospondin motifs 20-like OS=Branchiostoma floridae OX=7739 GN=LOC118416375 PE=4 SV=1, Branchiostoma_floridae_tr_A0A9J7L735_A0A9J7L735_BRAFL tr|A0A9J7L735|A0A9J7L735_BRAFL A disintegrin and metalloproteinase with thrombospondin motifs 9-like OS=Branchiostoma floridae OX=7739 GN=LOC118416374 PE=4 SV=1, Branchiostoma_floridae_tr_A0A9J7L4W5_A0A9J7L4W5_BRAFL tr|A0A9J7L4W5|A0A9J7L4W5_BRAFL A disintegrin and metalloproteinase with thrombospondin motifs 9-like OS=Branchiostoma floridae OX=7739 GN=LOC118415541 PE=4 SV=1	Schmidtea_mediterranea_maker-scaffold35401-snap-gene-0.54-mRNA-1 maker-scaffold35401-snap-gene-0.54-mRNA-1 protein AED_0.10 eAED_0.10 QI_27|0.84|0.84|1|0.36|0.65|26|101|1154
OG0000016	Branchiostoma_floridae_tr_A0A9J7M5C7_A0A9J7M5C7_BRAFL tr|A0A9J7M5C7|A0A9J7M5C7_BRAFL 72 kDa type IV collagenase-like OS=Branchiostoma floridae OX=7739 GN=LOC118428578 PE=3 SV=1, Branchiostoma_floridae_tr_A0A9J7LP52_A0A9J7LP52_BRAFL tr|A0A9J7LP52|A0A9J7LP52_BRAFL Stromelysin-2-like OS=Branchiostoma floridae OX=7739 GN=LOC118422022 PE=3 SV=1	Schmidtea_mediterranea_maker-scaffold7938-snap-gene-0.18-mRNA-1 maker-scaffold7938-snap-gene-0.18-mRNA-1 protein AED_0.17 eAED_0.21 QI_0|0.58|0.53|0.76|0.66|0.61|13|0|486, Schmidtea_mediterranea_maker-scaffold4098-snap-gene-0.30-mRNA-1 maker-scaffold4098-snap-gene-0.30-mRNA-1 protein AED_0.01 eAED_0.01 QI_131|0.81|0.83|1|0.63|0.58|12|36|484, Schmidtea_mediterranea_maker-scaffold41550-snap-gene-0.65-mRNA-1 maker-scaffold41550-snap-gene-0.65-mRNA-1 protein AED_0.02 eAED_0.02 QI_0|0.8|0.72|0.90|0.9|0.90|11|37|491
OG0000018	Branchiostoma_floridae_tr_A0A9J7L1X2_A0A9J7L1X2_BRAFL tr|A0A9J7L1X2|A0A9J7L1X2_BRAFL Protein-lysine 6-oxidase-like OS=Branchiostoma floridae OX=7739 GN=LOC118414450 PE=3 SV=1, Branchiostoma_floridae_tr_A0A9J7L2W2_A0A9J7L2W2_BRAFL tr|A0A9J7L2W2|A0A9J7L2W2_BRAFL Protein-lysine 6-oxidase-like isoform X2 OS=Branchiostoma floridae OX=7739 GN=LOC118414783 PE=4 SV=1, Branchiostoma_floridae_tr_A0A9J7L2H7_A0A9J7L2H7_BRAFL tr|A0A9J7L2H7|A0A9J7L2H7_BRAFL Protein-lysine 6-oxidase-like isoform X3 OS=Branchiostoma floridae OX=7739 GN=LOC118414783 PE=4 SV=1, Branchiostoma_floridae_tr_A0A9J7L3R3_A0A9J7L3R3_BRAFL tr|A0A9J7L3R3|A0A9J7L3R3_BRAFL Protein-lysine 6-oxidase-like isoform X1 OS=Branchiostoma floridae OX=7739 GN=LOC118414783 PE=4 SV=1	Schmidtea_mediterranea_maker-scaffold2109-augustus-gene-0.18-mRNA-1 maker-scaffold2109-augustus-gene-0.18-mRNA-1 protein AED_0.33 eAED_0.33 QI_39|0.62|0.66|0.88|0.37|0.66|9|50|645, Schmidtea_mediterranea_maker-scaffold11314-snap-gene-0.19-mRNA-1 maker-scaffold11314-snap-gene-0.19-mRNA-1 protein AED_0.45 eAED_0.50 QI_0|0|0|0.5|0|0|2|0|360, Schmidtea_mediterranea_maker-scaffold11314-snap-gene-0.20-mRNA-1 maker-scaffold11314-snap-gene-0.20-mRNA-1 protein AED_0.45 eAED_0.50 QI_0|0|0|0.5|1|1|2|0|360
OG0000019	Branchiostoma_floridae_tr_A0A9J7N2V0_A0A9J7N2V0_BRAFL tr|A0A9J7N2V0|A0A9J7N2V0_BRAFL Growth/differentiation factor 8-like OS=Branchiostoma floridae OX=7739 GN=LOC118423923 PE=3 SV=1, Branchiostoma_floridae_tr_A0A9J7MFV7_A0A9J7MFV7_BRAFL tr|A0A9J7MFV7|A0A9J7MFV7_BRAFL Bone morphogenetic protein 4-like OS=Branchiostoma floridae OX=7739 GN=LOC118432556 PE=3 SV=1, Branchiostoma_floridae_tr_A0A9J7N3A4_A0A9J7N3A4_BRAFL tr|A0A9J7N3A4|A0A9J7N3A4_BRAFL Inhibin beta B chain-like OS=Branchiostoma floridae OX=7739 GN=LOC118423922 PE=3 SV=1, Branchiostoma_floridae_tr_A0A9J7NCI1_A0A9J7NCI1_BRAFL tr|A0A9J7NCI1|A0A9J7NCI1_BRAFL Growth/differentiation factor 8-like OS=Branchiostoma floridae OX=7739 GN=LOC118432070 PE=3 SV=1, Branchiostoma_floridae_tr_A0A9J7N4K9_A0A9J7N4K9_BRAFL tr|A0A9J7N4K9|A0A9J7N4K9_BRAFL Protein DVR-1 homolog OS=Branchiostoma floridae OX=7739 GN=LOC118424706 PE=3 SV=1	Schmidtea_mediterranea_maker-scaffold6043-augustus-gene-0.26-mRNA-1 maker-scaffold6043-augustus-gene-0.26-mRNA-1 protein AED_0.00 eAED_0.00 QI_219|1|1|1|0.33|0.75|4|544|374, Schmidtea_mediterranea_maker-scaffold8614-snap-gene-1.51-mRNA-1 maker-scaffold8614-snap-gene-1.51-mRNA-1 protein AED_0.33 eAED_0.34 QI_0|0.66|0.75|1|0|0.25|4|201|247
OG0000019	Branchiostoma_floridae_tr_A0A9J7KTS2_A0A9J7KTS2_BRAFL tr|A0A9J7KTS2|A0A9J7KTS2_BRAFL Bone morphogenetic protein 2-like OS=Branchiostoma floridae OX=7739 GN=LOC118411660 PE=3 SV=1, Branchiostoma_floridae_tr_A0A9J7KI87_A0A9J7KI87_BRAFL tr|A0A9J7KI87|A0A9J7KI87_BRAFL Bone morphogenetic protein 7-like OS=Branchiostoma floridae OX=7739 GN=LOC118404943 PE=3 SV=1, Branchiostoma_floridae_tr_A0A9J7MF51_A0A9J7MF51_BRAFL tr|A0A9J7MF51|A0A9J7MF51_BRAFL Bone morphogenetic protein 2-like OS=Branchiostoma floridae OX=7739 GN=LOC118432320 PE=3 SV=1, Branchiostoma_floridae_tr_A0A9J7MGU7_A0A9J7MGU7_BRAFL tr|A0A9J7MGU7|A0A9J7MGU7_BRAFL Bone morphogenetic protein 4-like OS=Branchiostoma floridae OX=7739 GN=LOC118432394 PE=3 SV=1, Branchiostoma_floridae_tr_A0A9J7ND74_A0A9J7ND74_BRAFL tr|A0A9J7ND74|A0A9J7ND74_BRAFL Protein decapentaplegic-like isoform X2 OS=Branchiostoma floridae OX=7739 GN=LOC118432422 PE=3 SV=1, Branchiostoma_floridae_tr_A0A9J7MFK0_A0A9J7MFK0_BRAFL tr|A0A9J7MFK0|A0A9J7MFK0_BRAFL Bone morphogenetic protein 8A-like isoform X1 OS=Branchiostoma floridae OX=7739 GN=LOC118432422 PE=3 SV=1, Branchiostoma_floridae_tr_A0A9J7N648_A0A9J7N648_BRAFL tr|A0A9J7N648|A0A9J7N648_BRAFL Uncharacterized protein LOC118427296 OS=Branchiostoma floridae OX=7739 GN=LOC118427296 PE=3 SV=1, Branchiostoma_floridae_tr_A0A9J7LB27_A0A9J7LB27_BRAFL tr|A0A9J7LB27|A0A9J7LB27_BRAFL Growth/differentiation factor 6-like OS=Branchiostoma floridae OX=7739 GN=LOC118417252 PE=3 SV=1, Branchiostoma_floridae_tr_A0A9J7MJR3_A0A9J7MJR3_BRAFL tr|A0A9J7MJR3|A0A9J7MJR3_BRAFL Bone morphogenetic protein 3-like OS=Branchiostoma floridae OX=7739 GN=LOC118411348 PE=3 SV=1, Branchiostoma_floridae_tr_A0A9J7HTR0_A0A9J7HTR0_BRAFL tr|A0A9J7HTR0|A0A9J7HTR0_BRAFL Univin-like OS=Branchiostoma floridae OX=7739 GN=LOC118408791 PE=3 SV=1, Branchiostoma_floridae_tr_C3Z598_C3Z598_BRAFL tr|C3Z598|C3Z598_BRAFL Bone morphogenetic protein 2-like OS=Branchiostoma floridae OX=7739 GN=LOC118420107 PE=3 SV=1, Branchiostoma_floridae_tr_C3XYS2_C3XYS2_BRAFL tr|C3XYS2|C3XYS2_BRAFL Nodal-like OS=Branchiostoma floridae OX=7739 GN=LOC118412021 PE=3 SV=1	Schmidtea_mediterranea_maker-scaffold34701-augustus-gene-0.6-mRNA-1 maker-scaffold34701-augustus-gene-0.6-mRNA-1 protein AED_0.00 eAED_0.00 QI_51|1|1|1|1|1|2|116|143, Schmidtea_mediterranea_maker-scaffold4731-augustus-gene-0.23-mRNA-1 maker-scaffold4731-augustus-gene-0.23-mRNA-1 protein AED_0.40 eAED_0.40 QI_0|0.14|0.12|0.25|1|1|8|64|556, Schmidtea_mediterranea_maker-scaffold34701-augustus-gene-0.5-mRNA-1 maker-scaffold34701-augustus-gene-0.5-mRNA-1 protein AED_0.05 eAED_0.05 QI_0|0.5|0.33|0.66|1|0.66|3|116|165, Schmidtea_mediterranea_maker-scaffold2542-augustus-gene-0.6-mRNA-1 maker-scaffold2542-augustus-gene-0.6-mRNA-1 protein AED_0.24 eAED_0.24 QI_0|0.5|0.33|0.66|1|1|3|116|310
OG0000020	Branchiostoma_floridae_tr_A0A9J7HVW5_A0A9J7HVW5_BRAFL tr|A0A9J7HVW5|A0A9J7HVW5_BRAFL Collagen alpha-1_V_ chain-like OS=Branchiostoma floridae OX=7739 GN=LOC118408754 PE=4 SV=1, Branchiostoma_floridae_tr_A0A9J7LI16_A0A9J7LI16_BRAFL tr|A0A9J7LI16|A0A9J7LI16_BRAFL Collagen alpha-1_V_ chain-like isoform X1 OS=Branchiostoma floridae OX=7739 GN=LOC118420599 PE=4 SV=1, Branchiostoma_floridae_tr_A0A9J7LID2_A0A9J7LID2_BRAFL tr|A0A9J7LID2|A0A9J7LID2_BRAFL Collagen alpha-1_V_ chain-like isoform X2 OS=Branchiostoma floridae OX=7739 GN=LOC118420599 PE=4 SV=1, Branchiostoma_floridae_tr_A0A9J7MYH5_A0A9J7MYH5_BRAFL tr|A0A9J7MYH5|A0A9J7MYH5_BRAFL Collagen alpha-1_V_ chain-like isoform X8 OS=Branchiostoma floridae OX=7739 GN=LOC118420599 PE=4 SV=1, Branchiostoma_floridae_tr_A0A9J7MVV4_A0A9J7MVV4_BRAFL tr|A0A9J7MVV4|A0A9J7MVV4_BRAFL Collagen alpha-1_V_ chain-like isoform X6 OS=Branchiostoma floridae OX=7739 GN=LOC118420599 PE=4 SV=1, Branchiostoma_floridae_tr_A0A9J7LJG2_A0A9J7LJG2_BRAFL tr|A0A9J7LJG2|A0A9J7LJG2_BRAFL Collagen alpha-1_V_ chain-like isoform X7 OS=Branchiostoma floridae OX=7739 GN=LOC118420599 PE=4 SV=1, Branchiostoma_floridae_tr_A0A9J7MYG3_A0A9J7MYG3_BRAFL tr|A0A9J7MYG3|A0A9J7MYG3_BRAFL Collagen alpha-1_V_ chain-like isoform X5 OS=Branchiostoma floridae OX=7739 GN=LOC118420599 PE=4 SV=1, Branchiostoma_floridae_tr_A0A9J7LK91_A0A9J7LK91_BRAFL tr|A0A9J7LK91|A0A9J7LK91_BRAFL Collagen alpha-1_V_ chain-like isoform X4 OS=Branchiostoma floridae OX=7739 GN=LOC118420599 PE=4 SV=1, Branchiostoma_floridae_tr_A0A9J7LJP7_A0A9J7LJP7_BRAFL tr|A0A9J7LJP7|A0A9J7LJP7_BRAFL Collagen alpha-1_V_ chain-like isoform X3 OS=Branchiostoma floridae OX=7739 GN=LOC118420599 PE=4 SV=1, Branchiostoma_floridae_tr_A0A9J7MZH6_A0A9J7MZH6_BRAFL tr|A0A9J7MZH6|A0A9J7MZH6_BRAFL Collagen alpha-1_XI_ chain-like OS=Branchiostoma floridae OX=7739 GN=LOC118421390 PE=4 SV=1, Branchiostoma_floridae_tr_A0A9J7NDD7_A0A9J7NDD7_BRAFL tr|A0A9J7NDD7|A0A9J7NDD7_BRAFL Collagen alpha-1_I_ chain-like OS=Branchiostoma floridae OX=7739 GN=LOC118432715 PE=4 SV=1	Schmidtea_mediterranea_maker-scaffold19303-augustus-gene-0.58-mRNA-1 maker-scaffold19303-augustus-gene-0.58-mRNA-1 protein AED_0.22 eAED_0.31 QI_0|0.74|0.78|1|0.77|0.85|28|191|2030
OG0000020	Branchiostoma_floridae_tr_A0A9J7LLB6_A0A9J7LLB6_BRAFL tr|A0A9J7LLB6|A0A9J7LLB6_BRAFL Collagen alpha-1_I_ chain-like OS=Branchiostoma floridae OX=7739 GN=LOC118421184 PE=4 SV=1	Schmidtea_mediterranea_augustus_masked-scaffold13202-processed-gene-0.4-mRNA-1 augustus_masked-scaffold13202-processed-gene-0.4-mRNA-1 protein AED_0.12 eAED_0.12 QI_0|0|0|0.9|1|1|20|0|2163, Schmidtea_mediterranea_maker-scaffold10673-snap-gene-0.70-mRNA-1 maker-scaffold10673-snap-gene-0.70-mRNA-1 protein AED_0.27 eAED_0.27 QI_0|0.35|0.47|1|0.65|0.80|21|0|2053
OG0000021	Branchiostoma_floridae_tr_A0A9J7M241_A0A9J7M241_BRAFL tr|A0A9J7M241|A0A9J7M241_BRAFL Fibrillin-1-like OS=Branchiostoma floridae OX=7739 GN=LOC118427139 PE=4 SV=1	Schmidtea_mediterranea_maker-scaffold5879-augustus-gene-0.28-mRNA-1 maker-scaffold5879-augustus-gene-0.28-mRNA-1 protein AED_0.28 eAED_0.28 QI_330|0.33|0.5|0.9|0.22|0.5|10|395|587, Schmidtea_mediterranea_maker-scaffold19113-snap-gene-0.19-mRNA-1 maker-scaffold19113-snap-gene-0.19-mRNA-1 protein AED_0.15 eAED_0.15 QI_40|0.71|0.75|0.87|0.57|0.75|8|183|628
OG0000022	Branchiostoma_floridae_tr_A0A9J7KV83_A0A9J7KV83_BRAFL tr|A0A9J7KV83|A0A9J7KV83_BRAFL Annexin OS=Branchiostoma floridae OX=7739 GN=LOC118411820 PE=3 SV=1, Branchiostoma_floridae_tr_A0A9J7KUH5_A0A9J7KUH5_BRAFL tr|A0A9J7KUH5|A0A9J7KUH5_BRAFL Annexin OS=Branchiostoma floridae OX=7739 GN=LOC118411559 PE=3 SV=1, Branchiostoma_floridae_tr_A0A9J7HUQ9_A0A9J7HUQ9_BRAFL tr|A0A9J7HUQ9|A0A9J7HUQ9_BRAFL Annexin OS=Branchiostoma floridae OX=7739 GN=LOC118409383 PE=3 SV=1, Branchiostoma_floridae_tr_A0A9J7HWS4_A0A9J7HWS4_BRAFL tr|A0A9J7HWS4|A0A9J7HWS4_BRAFL Annexin OS=Branchiostoma floridae OX=7739 GN=LOC118409383 PE=3 SV=1, Branchiostoma_floridae_tr_A0A9J7HJD9_A0A9J7HJD9_BRAFL tr|A0A9J7HJD9|A0A9J7HJD9_BRAFL Annexin OS=Branchiostoma floridae OX=7739 GN=LOC118404144 PE=3 SV=1	Schmidtea_mediterranea_maker-scaffold17507-augustus-gene-0.9-mRNA-1 maker-scaffold17507-augustus-gene-0.9-mRNA-1 protein AED_0.22 eAED_0.22 QI_471|1|1|1|0.5|0.55|9|69|339, Schmidtea_mediterranea_snap_masked-scaffold46263-processed-gene-0.1-mRNA-1 snap_masked-scaffold46263-processed-gene-0.1-mRNA-1 protein AED_0.25 eAED_0.25 QI_0|0|0|1|1|1|4|0|149, Schmidtea_mediterranea_maker-scaffold1449-augustus-gene-0.17-mRNA-1 maker-scaffold1449-augustus-gene-0.17-mRNA-1 protein AED_0.20 eAED_0.20 QI_63|0.52|0.55|0.83|0.76|0.66|18|0|1431
OG0000024	Branchiostoma_floridae_tr_A0A9J7K5R8_A0A9J7K5R8_BRAFL tr|A0A9J7K5R8|A0A9J7K5R8_BRAFL Equistatin-like OS=Branchiostoma floridae OX=7739 GN=LOC118403407 PE=4 SV=1, Branchiostoma_floridae_tr_A0A9J7KE15_A0A9J7KE15_BRAFL tr|A0A9J7KE15|A0A9J7KE15_BRAFL Neurogenic locus notch homolog protein 1-like OS=Branchiostoma floridae OX=7739 GN=LOC118403683 PE=4 SV=1	Schmidtea_mediterranea_maker-scaffold34004-snap-gene-0.20-mRNA-1 maker-scaffold34004-snap-gene-0.20-mRNA-1 protein AED_0.47 eAED_0.47 QI_0|0.4|0.16|0.83|0|0|6|0|243, Schmidtea_mediterranea_maker-scaffold10745-augustus-gene-0.24-mRNA-1 maker-scaffold10745-augustus-gene-0.24-mRNA-1 protein AED_0.31 eAED_0.31 QI_115|1|1|1|1|1|3|107|175, Schmidtea_mediterranea_maker-scaffold12358-augustus-gene-0.7-mRNA-1 maker-scaffold12358-augustus-gene-0.7-mRNA-1 protein AED_0.00 eAED_0.00 QI_152|1|1|1|1|1|3|55|169, Schmidtea_mediterranea_maker-scaffold15670-augustus-gene-0.9-mRNA-1 maker-scaffold15670-augustus-gene-0.9-mRNA-1 protein AED_0.00 eAED_0.00 QI_21|1|1|1|1|1|3|52|163, Schmidtea_mediterranea_maker-scaffold31871-augustus-gene-0.18-mRNA-1 maker-scaffold31871-augustus-gene-0.18-mRNA-1 protein AED_0.00 eAED_0.00 QI_21|1|1|1|1|1|3|52|163, Schmidtea_mediterranea_maker-scaffold31871-snap-gene-0.21-mRNA-1 maker-scaffold31871-snap-gene-0.21-mRNA-1 protein AED_0.25 eAED_0.25 QI_0|0.4|0.16|0.83|1|1|6|0|191, Schmidtea_mediterranea_maker-scaffold29512-snap-gene-0.44-mRNA-1 maker-scaffold29512-snap-gene-0.44-mRNA-1 protein AED_0.51 eAED_0.53 QI_0|0.14|0|0.37|1|1|8|0|188
