Orthogroup	Chordata_Amphioxiformes_Branchiostoma_floridae	Porifera_Demospongiae_Amphimedon_queenslandica
OG0000006	Branchiostoma_floridae_tr_A0A9J7KZG7_A0A9J7KZG7_BRAFL tr|A0A9J7KZG7|A0A9J7KZG7_BRAFL E-selectin-like OS=Branchiostoma floridae OX=7739 GN=LOC118413628 PE=4 SV=1, Branchiostoma_floridae_tr_A0A9J7KS29_A0A9J7KS29_BRAFL tr|A0A9J7KS29|A0A9J7KS29_BRAFL P-selectin-like OS=Branchiostoma floridae OX=7739 GN=LOC118411135 PE=4 SV=1, Branchiostoma_floridae_tr_A0A9J7KL36_A0A9J7KL36_BRAFL tr|A0A9J7KL36|A0A9J7KL36_BRAFL Sushi_ von Willebrand factor type A_ EGF and pentraxin domain-containing protein 1-like OS=Branchiostoma floridae OX=7739 GN=LOC118408387 PE=4 SV=1, Branchiostoma_floridae_tr_A0A9J7KRG9_A0A9J7KRG9_BRAFL tr|A0A9J7KRG9|A0A9J7KRG9_BRAFL Sushi_ von Willebrand factor type A_ EGF and pentraxin domain-containing protein 1-like OS=Branchiostoma floridae OX=7739 GN=LOC118411128 PE=4 SV=1, Branchiostoma_floridae_tr_A0A9J7MEU0_A0A9J7MEU0_BRAFL tr|A0A9J7MEU0|A0A9J7MEU0_BRAFL Sushi_ von Willebrand factor type A_ EGF and pentraxin domain-containing protein 1-like OS=Branchiostoma floridae OX=7739 GN=LOC118431591 PE=4 SV=1, Branchiostoma_floridae_tr_A0A9J7MGE5_A0A9J7MGE5_BRAFL tr|A0A9J7MGE5|A0A9J7MGE5_BRAFL CUB and sushi domain-containing protein 3-like OS=Branchiostoma floridae OX=7739 GN=LOC118431602 PE=4 SV=1, Branchiostoma_floridae_tr_A0A9J7MHE1_A0A9J7MHE1_BRAFL tr|A0A9J7MHE1|A0A9J7MHE1_BRAFL CUB and sushi domain-containing protein 3-like OS=Branchiostoma floridae OX=7739 GN=LOC118410166 PE=4 SV=1, Branchiostoma_floridae_tr_A0A9J7KV98_A0A9J7KV98_BRAFL tr|A0A9J7KV98|A0A9J7KV98_BRAFL P-selectin-like OS=Branchiostoma floridae OX=7739 GN=LOC118412400 PE=4 SV=1, Branchiostoma_floridae_tr_A0A9J7HS91_A0A9J7HS91_BRAFL tr|A0A9J7HS91|A0A9J7HS91_BRAFL Sushi_ von Willebrand factor type A_ EGF and pentraxin domain-containing protein 1-like OS=Branchiostoma floridae OX=7739 GN=LOC118408065 PE=4 SV=1, Branchiostoma_floridae_tr_A0A9J7MER0_A0A9J7MER0_BRAFL tr|A0A9J7MER0|A0A9J7MER0_BRAFL Sushi_ von Willebrand factor type A_ EGF and pentraxin domain-containing protein 1-like OS=Branchiostoma floridae OX=7739 GN=LOC118431547 PE=4 SV=1, Branchiostoma_floridae_tr_A0A9J7KRY7_A0A9J7KRY7_BRAFL tr|A0A9J7KRY7|A0A9J7KRY7_BRAFL P-selectin-like OS=Branchiostoma floridae OX=7739 GN=LOC118411136 PE=4 SV=1, Branchiostoma_floridae_tr_A0A9J7MIY7_A0A9J7MIY7_BRAFL tr|A0A9J7MIY7|A0A9J7MIY7_BRAFL E-selectin-like OS=Branchiostoma floridae OX=7739 GN=LOC118411127 PE=4 SV=1, Branchiostoma_floridae_tr_A0A9J7HSJ9_A0A9J7HSJ9_BRAFL tr|A0A9J7HSJ9|A0A9J7HSJ9_BRAFL P-selectin-like OS=Branchiostoma floridae OX=7739 GN=LOC118408067 PE=4 SV=1, Branchiostoma_floridae_tr_A0A9J7KSP2_A0A9J7KSP2_BRAFL tr|A0A9J7KSP2|A0A9J7KSP2_BRAFL P-selectin-like OS=Branchiostoma floridae OX=7739 GN=LOC118411155 PE=3 SV=1	Amphimedon_queenslandica_tr_A0A1X7UIE0_A0A1X7UIE0_AMPQE tr_A0A1X7UIE0_A0A1X7UIE0_AMPQE Uncharacterized protein OS=Amphimedon queenslandica OX=400682 PE=4 SV=1
OG0000007	Branchiostoma_floridae_tr_A0A9J7LPF5_A0A9J7LPF5_BRAFL tr|A0A9J7LPF5|A0A9J7LPF5_BRAFL Multiple epidermal growth factor-like domains protein 6 OS=Branchiostoma floridae OX=7739 GN=LOC118422938 PE=4 SV=1	Amphimedon_queenslandica_tr_A0A1X7VF43_A0A1X7VF43_AMPQE tr_A0A1X7VF43_A0A1X7VF43_AMPQE EGF-like domain-containing protein OS=Amphimedon queenslandica OX=400682 PE=4 SV=1, Amphimedon_queenslandica_tr_A0A1X7V609_A0A1X7V609_AMPQE tr_A0A1X7V609_A0A1X7V609_AMPQE EGF-like domain-containing protein OS=Amphimedon queenslandica OX=400682 PE=4 SV=1, Amphimedon_queenslandica_tr_A0A1X7SHW9_A0A1X7SHW9_AMPQE tr_A0A1X7SHW9_A0A1X7SHW9_AMPQE Uncharacterized protein OS=Amphimedon queenslandica OX=400682 PE=4 SV=1, Amphimedon_queenslandica_tr_A0A1X7V0H0_A0A1X7V0H0_AMPQE tr_A0A1X7V0H0_A0A1X7V0H0_AMPQE Uncharacterized protein OS=Amphimedon queenslandica OX=400682 PE=4 SV=1, Amphimedon_queenslandica_tr_A0A1X7SVD2_A0A1X7SVD2_AMPQE tr_A0A1X7SVD2_A0A1X7SVD2_AMPQE Uncharacterized protein OS=Amphimedon queenslandica OX=400682 PE=4 SV=1, Amphimedon_queenslandica_tr_A0A1X7SLA6_A0A1X7SLA6_AMPQE tr_A0A1X7SLA6_A0A1X7SLA6_AMPQE Uncharacterized protein OS=Amphimedon queenslandica OX=400682 PE=4 SV=1, Amphimedon_queenslandica_tr_A0A1X7TEE8_A0A1X7TEE8_AMPQE tr_A0A1X7TEE8_A0A1X7TEE8_AMPQE Uncharacterized protein OS=Amphimedon queenslandica OX=400682 PE=4 SV=1, Amphimedon_queenslandica_tr_A0A1X7U208_A0A1X7U208_AMPQE tr_A0A1X7U208_A0A1X7U208_AMPQE Uncharacterized protein OS=Amphimedon queenslandica OX=400682 PE=4 SV=1
OG0000007	Branchiostoma_floridae_tr_A0A9J7MUW5_A0A9J7MUW5_BRAFL tr|A0A9J7MUW5|A0A9J7MUW5_BRAFL Fibulin-5-like OS=Branchiostoma floridae OX=7739 GN=LOC118418109 PE=4 SV=1	Amphimedon_queenslandica_tr_A0A1X7SJM0_A0A1X7SJM0_AMPQE tr_A0A1X7SJM0_A0A1X7SJM0_AMPQE Uncharacterized protein OS=Amphimedon queenslandica OX=400682 PE=4 SV=1, Amphimedon_queenslandica_tr_A0A1X7SKZ4_A0A1X7SKZ4_AMPQE tr_A0A1X7SKZ4_A0A1X7SKZ4_AMPQE Uncharacterized protein OS=Amphimedon queenslandica OX=400682 PE=4 SV=1, Amphimedon_queenslandica_tr_A0A1X7STM4_A0A1X7STM4_AMPQE tr_A0A1X7STM4_A0A1X7STM4_AMPQE Uncharacterized protein OS=Amphimedon queenslandica OX=400682 PE=4 SV=1
OG0000007	Branchiostoma_floridae_tr_A0A9J7LV78_A0A9J7LV78_BRAFL tr|A0A9J7LV78|A0A9J7LV78_BRAFL Fibrillin-2-like OS=Branchiostoma floridae OX=7739 GN=LOC118425020 PE=4 SV=1, Branchiostoma_floridae_tr_A0A9J7LWV1_A0A9J7LWV1_BRAFL tr|A0A9J7LWV1|A0A9J7LWV1_BRAFL Protocadherin Fat 4-like OS=Branchiostoma floridae OX=7739 GN=LOC118425022 PE=4 SV=1, Branchiostoma_floridae_tr_A0A9J7ND14_A0A9J7ND14_BRAFL tr|A0A9J7ND14|A0A9J7ND14_BRAFL Uncharacterized protein LOC118432152 OS=Branchiostoma floridae OX=7739 GN=LOC118432152 PE=3 SV=1, Branchiostoma_floridae_tr_A0A9J7LPL5_A0A9J7LPL5_BRAFL tr|A0A9J7LPL5|A0A9J7LPL5_BRAFL Mucin-2-like OS=Branchiostoma floridae OX=7739 GN=LOC118423045 PE=3 SV=1, Branchiostoma_floridae_tr_A0A9J7LWB7_A0A9J7LWB7_BRAFL tr|A0A9J7LWB7|A0A9J7LWB7_BRAFL Uncharacterized protein LOC118425001 OS=Branchiostoma floridae OX=7739 GN=LOC118425001 PE=3 SV=1, Branchiostoma_floridae_tr_A0A9J7KIA1_A0A9J7KIA1_BRAFL tr|A0A9J7KIA1|A0A9J7KIA1_BRAFL Uncharacterized protein LOC118405005 OS=Branchiostoma floridae OX=7739 GN=LOC118405005 PE=4 SV=1, Branchiostoma_floridae_tr_A0A9J7LX00_A0A9J7LX00_BRAFL tr|A0A9J7LX00|A0A9J7LX00_BRAFL Mucin-like protein OS=Branchiostoma floridae OX=7739 GN=LOC118425021 PE=4 SV=1, Branchiostoma_floridae_tr_A0A9J7M4K8_A0A9J7M4K8_BRAFL tr|A0A9J7M4K8|A0A9J7M4K8_BRAFL Mucin-like protein OS=Branchiostoma floridae OX=7739 GN=LOC118428511 PE=4 SV=1, Branchiostoma_floridae_tr_A0A9J7KRN7_A0A9J7KRN7_BRAFL tr|A0A9J7KRN7|A0A9J7KRN7_BRAFL Uncharacterized protein LOC118411056 OS=Branchiostoma floridae OX=7739 GN=LOC118411056 PE=4 SV=1, Branchiostoma_floridae_tr_A0A9J7KRJ9_A0A9J7KRJ9_BRAFL tr|A0A9J7KRJ9|A0A9J7KRJ9_BRAFL Uncharacterized protein LOC118411162 OS=Branchiostoma floridae OX=7739 GN=LOC118411162 PE=3 SV=1, Branchiostoma_floridae_tr_A0A9J7M584_A0A9J7M584_BRAFL tr|A0A9J7M584|A0A9J7M584_BRAFL Mucin-like protein OS=Branchiostoma floridae OX=7739 GN=LOC118428513 PE=4 SV=1, Branchiostoma_floridae_tr_A0A9J7M8F0_A0A9J7M8F0_BRAFL tr|A0A9J7M8F0|A0A9J7M8F0_BRAFL Mucin-like protein OS=Branchiostoma floridae OX=7739 GN=LOC118428514 PE=4 SV=1, Branchiostoma_floridae_tr_A0A9J7LAY8_A0A9J7LAY8_BRAFL tr|A0A9J7LAY8|A0A9J7LAY8_BRAFL Uncharacterized protein LOC118417709 OS=Branchiostoma floridae OX=7739 GN=LOC118417709 PE=3 SV=1, Branchiostoma_floridae_tr_A0A9J7MG51_A0A9J7MG51_BRAFL tr|A0A9J7MG51|A0A9J7MG51_BRAFL Mucin-like protein OS=Branchiostoma floridae OX=7739 GN=LOC118409674 PE=3 SV=1	Amphimedon_queenslandica_tr_A0A1X7SFP3_A0A1X7SFP3_AMPQE tr_A0A1X7SFP3_A0A1X7SFP3_AMPQE Uncharacterized protein OS=Amphimedon queenslandica OX=400682 PE=4 SV=1
OG0000007	Branchiostoma_floridae_tr_A0A9J7LU88_A0A9J7LU88_BRAFL tr|A0A9J7LU88|A0A9J7LU88_BRAFL Fibulin-1-like OS=Branchiostoma floridae OX=7739 GN=LOC118424270 PE=4 SV=1	Amphimedon_queenslandica_tr_A0A1X7SSI1_A0A1X7SSI1_AMPQE tr_A0A1X7SSI1_A0A1X7SSI1_AMPQE Fibulin-5 OS=Amphimedon queenslandica OX=400682 PE=4 SV=1, Amphimedon_queenslandica_tr_A0A1X7T1V8_A0A1X7T1V8_AMPQE tr_A0A1X7T1V8_A0A1X7T1V8_AMPQE EGF_CA domain-containing protein OS=Amphimedon queenslandica OX=400682 PE=4 SV=1
OG0000007	Branchiostoma_floridae_tr_A0A9J7HWA3_A0A9J7HWA3_BRAFL tr|A0A9J7HWA3|A0A9J7HWA3_BRAFL Sushi_ nidogen and EGF-like domain-containing protein 1 OS=Branchiostoma floridae OX=7739 GN=LOC118409093 PE=4 SV=1, Branchiostoma_floridae_tr_A0A9J7HHN5_A0A9J7HHN5_BRAFL tr|A0A9J7HHN5|A0A9J7HHN5_BRAFL Sushi_ nidogen and EGF-like domain-containing protein 1 OS=Branchiostoma floridae OX=7739 GN=LOC118403833 PE=4 SV=1, Branchiostoma_floridae_tr_A0A9J7N1W5_A0A9J7N1W5_BRAFL tr|A0A9J7N1W5|A0A9J7N1W5_BRAFL Sushi_ nidogen and EGF-like domain-containing protein 1 isoform X1 OS=Branchiostoma floridae OX=7739 GN=LOC118425150 PE=4 SV=1, Branchiostoma_floridae_tr_A0A9J7LWJ4_A0A9J7LWJ4_BRAFL tr|A0A9J7LWJ4|A0A9J7LWJ4_BRAFL Sushi_ nidogen and EGF-like domain-containing protein 1 isoform X2 OS=Branchiostoma floridae OX=7739 GN=LOC118425150 PE=4 SV=1, Branchiostoma_floridae_tr_A0A9J7N1X6_A0A9J7N1X6_BRAFL tr|A0A9J7N1X6|A0A9J7N1X6_BRAFL Echinoidin-like OS=Branchiostoma floridae OX=7739 GN=LOC118424279 PE=4 SV=1, Branchiostoma_floridae_tr_A0A9J7N3V3_A0A9J7N3V3_BRAFL tr|A0A9J7N3V3|A0A9J7N3V3_BRAFL Sushi_ nidogen and EGF-like domain-containing protein 1 OS=Branchiostoma floridae OX=7739 GN=LOC118424278 PE=4 SV=1, Branchiostoma_floridae_tr_A0A9J7HIV1_A0A9J7HIV1_BRAFL tr|A0A9J7HIV1|A0A9J7HIV1_BRAFL Sushi_ nidogen and EGF-like domain-containing protein 1 isoform X2 OS=Branchiostoma floridae OX=7739 GN=LOC118404944 PE=4 SV=1, Branchiostoma_floridae_tr_A0A9J7HL29_A0A9J7HL29_BRAFL tr|A0A9J7HL29|A0A9J7HL29_BRAFL Sushi_ nidogen and EGF-like domain-containing protein 1 isoform X1 OS=Branchiostoma floridae OX=7739 GN=LOC118404944 PE=4 SV=1, Branchiostoma_floridae_tr_A0A9J7KI66_A0A9J7KI66_BRAFL tr|A0A9J7KI66|A0A9J7KI66_BRAFL Uncharacterized protein LOC118404875 OS=Branchiostoma floridae OX=7739 GN=LOC118404875 PE=4 SV=1, Branchiostoma_floridae_tr_A0A9J7LJG5_A0A9J7LJG5_BRAFL tr|A0A9J7LJG5|A0A9J7LJG5_BRAFL Sushi_ nidogen and EGF-like domain-containing protein 1 OS=Branchiostoma floridae OX=7739 GN=LOC118420937 PE=4 SV=1, Branchiostoma_floridae_tr_A0A9J7LGN3_A0A9J7LGN3_BRAFL tr|A0A9J7LGN3|A0A9J7LGN3_BRAFL Sushi_ nidogen and EGF-like domain-containing protein 1 OS=Branchiostoma floridae OX=7739 GN=LOC118419370 PE=4 SV=1, Branchiostoma_floridae_tr_A0A9J7HIG0_A0A9J7HIG0_BRAFL tr|A0A9J7HIG0|A0A9J7HIG0_BRAFL Sushi_ nidogen and EGF-like domain-containing protein 1 OS=Branchiostoma floridae OX=7739 GN=LOC118404951 PE=4 SV=1	Amphimedon_queenslandica_tr_A0A1X7VHY5_A0A1X7VHY5_AMPQE tr_A0A1X7VHY5_A0A1X7VHY5_AMPQE Uncharacterized protein OS=Amphimedon queenslandica OX=400682 PE=4 SV=1, Amphimedon_queenslandica_tr_A0A1X7SWG6_A0A1X7SWG6_AMPQE tr_A0A1X7SWG6_A0A1X7SWG6_AMPQE Uncharacterized protein OS=Amphimedon queenslandica OX=400682 PE=4 SV=1, Amphimedon_queenslandica_tr_A0A1X7SUC7_A0A1X7SUC7_AMPQE tr_A0A1X7SUC7_A0A1X7SUC7_AMPQE NIDO domain-containing protein OS=Amphimedon queenslandica OX=400682 PE=4 SV=1, Amphimedon_queenslandica_tr_A0A1X7UEE9_A0A1X7UEE9_AMPQE tr_A0A1X7UEE9_A0A1X7UEE9_AMPQE Uncharacterized protein OS=Amphimedon queenslandica OX=400682 GN=100638351 PE=4 SV=1, Amphimedon_queenslandica_tr_A0A1X7SED7_A0A1X7SED7_AMPQE tr_A0A1X7SED7_A0A1X7SED7_AMPQE NIDO domain-containing protein OS=Amphimedon queenslandica OX=400682 PE=4 SV=1
OG0000007	Branchiostoma_floridae_tr_A0A9J7HLF1_A0A9J7HLF1_BRAFL tr|A0A9J7HLF1|A0A9J7HLF1_BRAFL Protein mesh-like OS=Branchiostoma floridae OX=7739 GN=LOC118405019 PE=4 SV=1, Branchiostoma_floridae_tr_A0A9J7K5X1_A0A9J7K5X1_BRAFL tr|A0A9J7K5X1|A0A9J7K5X1_BRAFL Sushi domain-containing protein 2-like OS=Branchiostoma floridae OX=7739 GN=LOC118403486 PE=4 SV=1, Branchiostoma_floridae_tr_A0A9J7LLV4_A0A9J7LLV4_BRAFL tr|A0A9J7LLV4|A0A9J7LLV4_BRAFL Sushi domain-containing protein 2-like OS=Branchiostoma floridae OX=7739 GN=LOC118421857 PE=4 SV=1, Branchiostoma_floridae_tr_A0A9J7MMQ9_A0A9J7MMQ9_BRAFL tr|A0A9J7MMQ9|A0A9J7MMQ9_BRAFL Sushi domain-containing protein 2-like OS=Branchiostoma floridae OX=7739 GN=LOC118413509 PE=4 SV=1	Amphimedon_queenslandica_tr_A0A1X7U2X5_A0A1X7U2X5_AMPQE tr_A0A1X7U2X5_A0A1X7U2X5_AMPQE Uncharacterized protein OS=Amphimedon queenslandica OX=400682 GN=109585006 PE=4 SV=1, Amphimedon_queenslandica_tr_A0A1X7TZR4_A0A1X7TZR4_AMPQE tr_A0A1X7TZR4_A0A1X7TZR4_AMPQE Uncharacterized protein OS=Amphimedon queenslandica OX=400682 PE=4 SV=1, Amphimedon_queenslandica_tr_A0A1X7V5I7_A0A1X7V5I7_AMPQE tr_A0A1X7V5I7_A0A1X7V5I7_AMPQE Uncharacterized protein OS=Amphimedon queenslandica OX=400682 PE=4 SV=1, Amphimedon_queenslandica_tr_A0A1X7T6D5_A0A1X7T6D5_AMPQE tr_A0A1X7T6D5_A0A1X7T6D5_AMPQE Uncharacterized protein OS=Amphimedon queenslandica OX=400682 GN=105315278 PE=4 SV=1
OG0000007	Branchiostoma_floridae_tr_A0A9J7KYV1_A0A9J7KYV1_BRAFL tr|A0A9J7KYV1|A0A9J7KYV1_BRAFL Uncharacterized protein LOC118413607 OS=Branchiostoma floridae OX=7739 GN=LOC118413607 PE=4 SV=1, Branchiostoma_floridae_tr_A0A9J7KWF5_A0A9J7KWF5_BRAFL tr|A0A9J7KWF5|A0A9J7KWF5_BRAFL Mucin-like protein OS=Branchiostoma floridae OX=7739 GN=LOC118412870 PE=4 SV=1, Branchiostoma_floridae_tr_A0A9J7MMV0_A0A9J7MMV0_BRAFL tr|A0A9J7MMV0|A0A9J7MMV0_BRAFL Mucin-like protein OS=Branchiostoma floridae OX=7739 GN=LOC118413563 PE=4 SV=1, Branchiostoma_floridae_tr_A0A9J7K5S7_A0A9J7K5S7_BRAFL tr|A0A9J7K5S7|A0A9J7K5S7_BRAFL Uncharacterized protein LOC118403422 OS=Branchiostoma floridae OX=7739 GN=LOC118403422 PE=4 SV=1, Branchiostoma_floridae_tr_A0A9J7HMY3_A0A9J7HMY3_BRAFL tr|A0A9J7HMY3|A0A9J7HMY3_BRAFL Uncharacterized protein LOC118404934 OS=Branchiostoma floridae OX=7739 GN=LOC118404934 PE=4 SV=1, Branchiostoma_floridae_tr_A0A9J7HIS7_A0A9J7HIS7_BRAFL tr|A0A9J7HIS7|A0A9J7HIS7_BRAFL Uncharacterized protein LOC118404933 OS=Branchiostoma floridae OX=7739 GN=LOC118404933 PE=4 SV=1, Branchiostoma_floridae_tr_A0A9J7M247_A0A9J7M247_BRAFL tr|A0A9J7M247|A0A9J7M247_BRAFL Mucin-like protein OS=Branchiostoma floridae OX=7739 GN=LOC118427057 PE=4 SV=1, Branchiostoma_floridae_tr_A0A9J7MYZ9_A0A9J7MYZ9_BRAFL tr|A0A9J7MYZ9|A0A9J7MYZ9_BRAFL Mucin-like protein OS=Branchiostoma floridae OX=7739 GN=LOC118422927 PE=4 SV=1, Branchiostoma_floridae_tr_A0A9J7LPW0_A0A9J7LPW0_BRAFL tr|A0A9J7LPW0|A0A9J7LPW0_BRAFL Mucin-like protein OS=Branchiostoma floridae OX=7739 GN=LOC118422937 PE=4 SV=1, Branchiostoma_floridae_tr_A0A9J7L5A8_A0A9J7L5A8_BRAFL tr|A0A9J7L5A8|A0A9J7L5A8_BRAFL Mucin-like protein OS=Branchiostoma floridae OX=7739 GN=LOC118415618 PE=4 SV=1, Branchiostoma_floridae_tr_A0A9J7MZ35_A0A9J7MZ35_BRAFL tr|A0A9J7MZ35|A0A9J7MZ35_BRAFL Mucin-like protein OS=Branchiostoma floridae OX=7739 GN=LOC118423033 PE=4 SV=1, Branchiostoma_floridae_tr_A0A9J7LTE7_A0A9J7LTE7_BRAFL tr|A0A9J7LTE7|A0A9J7LTE7_BRAFL Mucin-like protein OS=Branchiostoma floridae OX=7739 GN=LOC118424271 PE=4 SV=1, Branchiostoma_floridae_tr_A0A9J7LJG1_A0A9J7LJG1_BRAFL tr|A0A9J7LJG1|A0A9J7LJG1_BRAFL Mucin-like protein OS=Branchiostoma floridae OX=7739 GN=LOC118420227 PE=4 SV=1, Branchiostoma_floridae_tr_A0A9J7LPZ7_A0A9J7LPZ7_BRAFL tr|A0A9J7LPZ7|A0A9J7LPZ7_BRAFL Mucin-like protein OS=Branchiostoma floridae OX=7739 GN=LOC118423030 PE=4 SV=1, Branchiostoma_floridae_tr_A0A9J7KBK0_A0A9J7KBK0_BRAFL tr|A0A9J7KBK0|A0A9J7KBK0_BRAFL Mucin-like protein OS=Branchiostoma floridae OX=7739 GN=LOC118407795 PE=4 SV=1, Branchiostoma_floridae_tr_A0A9J7MG93_A0A9J7MG93_BRAFL tr|A0A9J7MG93|A0A9J7MG93_BRAFL Uncharacterized protein LOC118409686 isoform X5 OS=Branchiostoma floridae OX=7739 GN=LOC118409686 PE=4 SV=1, Branchiostoma_floridae_tr_A0A9J7MG75_A0A9J7MG75_BRAFL tr|A0A9J7MG75|A0A9J7MG75_BRAFL Uncharacterized protein LOC118409686 isoform X3 OS=Branchiostoma floridae OX=7739 GN=LOC118409686 PE=4 SV=1, Branchiostoma_floridae_tr_A0A9J7KMK8_A0A9J7KMK8_BRAFL tr|A0A9J7KMK8|A0A9J7KMK8_BRAFL Uncharacterized protein LOC118409686 isoform X2 OS=Branchiostoma floridae OX=7739 GN=LOC118409686 PE=4 SV=1, Branchiostoma_floridae_tr_A0A9J7KMX2_A0A9J7KMX2_BRAFL tr|A0A9J7KMX2|A0A9J7KMX2_BRAFL Uncharacterized protein LOC118409686 isoform X1 OS=Branchiostoma floridae OX=7739 GN=LOC118409686 PE=4 SV=1, Branchiostoma_floridae_tr_A0A9J7KMK9_A0A9J7KMK9_BRAFL tr|A0A9J7KMK9|A0A9J7KMK9_BRAFL Uncharacterized protein LOC118409686 isoform X4 OS=Branchiostoma floridae OX=7739 GN=LOC118409686 PE=4 SV=1, Branchiostoma_floridae_tr_A0A9J7MG33_A0A9J7MG33_BRAFL tr|A0A9J7MG33|A0A9J7MG33_BRAFL Uncharacterized protein LOC118409686 isoform X6 OS=Branchiostoma floridae OX=7739 GN=LOC118409686 PE=4 SV=1, Branchiostoma_floridae_tr_A0A9J7MUJ6_A0A9J7MUJ6_BRAFL tr|A0A9J7MUJ6|A0A9J7MUJ6_BRAFL Mucin-like protein OS=Branchiostoma floridae OX=7739 GN=LOC118417833 PE=4 SV=1	Amphimedon_queenslandica_tr_A0A1X7UXG1_A0A1X7UXG1_AMPQE tr_A0A1X7UXG1_A0A1X7UXG1_AMPQE Uncharacterized protein OS=Amphimedon queenslandica OX=400682 PE=4 SV=1, Amphimedon_queenslandica_tr_A0A1X7SNX2_A0A1X7SNX2_AMPQE tr_A0A1X7SNX2_A0A1X7SNX2_AMPQE VWFD domain-containing protein OS=Amphimedon queenslandica OX=400682 PE=4 SV=1, Amphimedon_queenslandica_tr_A0A1X7U0H9_A0A1X7U0H9_AMPQE tr_A0A1X7U0H9_A0A1X7U0H9_AMPQE AMOP domain-containing protein OS=Amphimedon queenslandica OX=400682 PE=4 SV=1, Amphimedon_queenslandica_tr_A0A1X7VEX8_A0A1X7VEX8_AMPQE tr_A0A1X7VEX8_A0A1X7VEX8_AMPQE Uncharacterized protein OS=Amphimedon queenslandica OX=400682 PE=4 SV=1, Amphimedon_queenslandica_tr_A0A1X7U0T3_A0A1X7U0T3_AMPQE tr_A0A1X7U0T3_A0A1X7U0T3_AMPQE VWFD domain-containing protein OS=Amphimedon queenslandica OX=400682 PE=4 SV=1, Amphimedon_queenslandica_tr_A0A1X7TZY4_A0A1X7TZY4_AMPQE tr_A0A1X7TZY4_A0A1X7TZY4_AMPQE Uncharacterized protein OS=Amphimedon queenslandica OX=400682 PE=4 SV=1, Amphimedon_queenslandica_tr_A0A1X7VE59_A0A1X7VE59_AMPQE tr_A0A1X7VE59_A0A1X7VE59_AMPQE Uncharacterized protein OS=Amphimedon queenslandica OX=400682 PE=4 SV=1, Amphimedon_queenslandica_tr_A0A1X7VFS2_A0A1X7VFS2_AMPQE tr_A0A1X7VFS2_A0A1X7VFS2_AMPQE VWFD domain-containing protein OS=Amphimedon queenslandica OX=400682 PE=4 SV=1, Amphimedon_queenslandica_tr_A0A1X7TQL5_A0A1X7TQL5_AMPQE tr_A0A1X7TQL5_A0A1X7TQL5_AMPQE Uncharacterized protein OS=Amphimedon queenslandica OX=400682 PE=4 SV=1, Amphimedon_queenslandica_tr_A0A1X7VD60_A0A1X7VD60_AMPQE tr_A0A1X7VD60_A0A1X7VD60_AMPQE EGF-like domain-containing protein OS=Amphimedon queenslandica OX=400682 PE=4 SV=1, Amphimedon_queenslandica_tr_A0A1X7VCF9_A0A1X7VCF9_AMPQE tr_A0A1X7VCF9_A0A1X7VCF9_AMPQE Uncharacterized protein OS=Amphimedon queenslandica OX=400682 PE=4 SV=1, Amphimedon_queenslandica_tr_A0A1X7TQV9_A0A1X7TQV9_AMPQE tr_A0A1X7TQV9_A0A1X7TQV9_AMPQE Uncharacterized protein OS=Amphimedon queenslandica OX=400682 PE=4 SV=1, Amphimedon_queenslandica_tr_A0A1X7TR13_A0A1X7TR13_AMPQE tr_A0A1X7TR13_A0A1X7TR13_AMPQE EGF-like domain-containing protein OS=Amphimedon queenslandica OX=400682 PE=4 SV=1, Amphimedon_queenslandica_tr_A0A1X7TH31_A0A1X7TH31_AMPQE tr_A0A1X7TH31_A0A1X7TH31_AMPQE EGF-like domain-containing protein OS=Amphimedon queenslandica OX=400682 PE=4 SV=1
OG0000008	Branchiostoma_floridae_tr_A0A9J7HIY9_A0A9J7HIY9_BRAFL tr|A0A9J7HIY9|A0A9J7HIY9_BRAFL Fibropellin-1-like OS=Branchiostoma floridae OX=7739 GN=LOC118405011 PE=4 SV=1	Amphimedon_queenslandica_tr_A0A1X7ULX8_A0A1X7ULX8_AMPQE tr_A0A1X7ULX8_A0A1X7ULX8_AMPQE EGF-like domain-containing protein OS=Amphimedon queenslandica OX=400682 PE=4 SV=1, Amphimedon_queenslandica_tr_A0A1X7US64_A0A1X7US64_AMPQE tr_A0A1X7US64_A0A1X7US64_AMPQE Uncharacterized protein OS=Amphimedon queenslandica OX=400682 PE=4 SV=1, Amphimedon_queenslandica_tr_A0A1X7UT47_A0A1X7UT47_AMPQE tr_A0A1X7UT47_A0A1X7UT47_AMPQE EGF-like domain-containing protein OS=Amphimedon queenslandica OX=400682 PE=4 SV=1
OG0000008	Branchiostoma_floridae_tr_A0A9J7LLS8_A0A9J7LLS8_BRAFL tr|A0A9J7LLS8|A0A9J7LLS8_BRAFL Fibropellin-1-like OS=Branchiostoma floridae OX=7739 GN=LOC118421859 PE=4 SV=1, Branchiostoma_floridae_tr_A0A9J7HRK4_A0A9J7HRK4_BRAFL tr|A0A9J7HRK4|A0A9J7HRK4_BRAFL Snaclec trimecetin subunit beta-like OS=Branchiostoma floridae OX=7739 GN=LOC118408101 PE=4 SV=1, Branchiostoma_floridae_tr_A0A9J7KQD5_A0A9J7KQD5_BRAFL tr|A0A9J7KQD5|A0A9J7KQD5_BRAFL Uncharacterized protein LOC118410561 OS=Branchiostoma floridae OX=7739 GN=LOC118410561 PE=4 SV=1, Branchiostoma_floridae_tr_A0A9J7LSG7_A0A9J7LSG7_BRAFL tr|A0A9J7LSG7|A0A9J7LSG7_BRAFL Uncharacterized protein LOC118423531 OS=Branchiostoma floridae OX=7739 GN=LOC118423531 PE=4 SV=1, Branchiostoma_floridae_tr_A0A9J7KRD8_A0A9J7KRD8_BRAFL tr|A0A9J7KRD8|A0A9J7KRD8_BRAFL Neurogenic locus notch homolog protein 1-like isoform X13 OS=Branchiostoma floridae OX=7739 GN=LOC118411086 PE=4 SV=1, Branchiostoma_floridae_tr_A0A9J7KSJ9_A0A9J7KSJ9_BRAFL tr|A0A9J7KSJ9|A0A9J7KSJ9_BRAFL Neurogenic locus notch homolog protein 1-like isoform X5 OS=Branchiostoma floridae OX=7739 GN=LOC118411086 PE=4 SV=1, Branchiostoma_floridae_tr_A0A9J7KSV6_A0A9J7KSV6_BRAFL tr|A0A9J7KSV6|A0A9J7KSV6_BRAFL Neurogenic locus notch homolog protein 1-like isoform X9 OS=Branchiostoma floridae OX=7739 GN=LOC118411086 PE=4 SV=1, Branchiostoma_floridae_tr_A0A9J7MIW0_A0A9J7MIW0_BRAFL tr|A0A9J7MIW0|A0A9J7MIW0_BRAFL Neurogenic locus notch homolog protein 1-like isoform X15 OS=Branchiostoma floridae OX=7739 GN=LOC118411086 PE=4 SV=1, Branchiostoma_floridae_tr_A0A9J7MIW7_A0A9J7MIW7_BRAFL tr|A0A9J7MIW7|A0A9J7MIW7_BRAFL Neurogenic locus Notch protein-like isoform X11 OS=Branchiostoma floridae OX=7739 GN=LOC118411086 PE=4 SV=1, Branchiostoma_floridae_tr_A0A9J7MJ03_A0A9J7MJ03_BRAFL tr|A0A9J7MJ03|A0A9J7MJ03_BRAFL Neurogenic locus notch homolog protein 1-like isoform X14 OS=Branchiostoma floridae OX=7739 GN=LOC118411086 PE=4 SV=1, Branchiostoma_floridae_tr_A0A9J7MJC9_A0A9J7MJC9_BRAFL tr|A0A9J7MJC9|A0A9J7MJC9_BRAFL Neurogenic locus Notch protein-like isoform X1 OS=Branchiostoma floridae OX=7739 GN=LOC118411086 PE=4 SV=1, Branchiostoma_floridae_tr_A0A9J7MIT6_A0A9J7MIT6_BRAFL tr|A0A9J7MIT6|A0A9J7MIT6_BRAFL Neurogenic locus notch homolog protein 1-like isoform X12 OS=Branchiostoma floridae OX=7739 GN=LOC118411086 PE=4 SV=1, Branchiostoma_floridae_tr_A0A9J7KSI2_A0A9J7KSI2_BRAFL tr|A0A9J7KSI2|A0A9J7KSI2_BRAFL Neurogenic locus Notch protein-like isoform X3 OS=Branchiostoma floridae OX=7739 GN=LOC118411086 PE=4 SV=1, Branchiostoma_floridae_tr_A0A9J7KS08_A0A9J7KS08_BRAFL tr|A0A9J7KS08|A0A9J7KS08_BRAFL Neurogenic locus Notch protein-like isoform X10 OS=Branchiostoma floridae OX=7739 GN=LOC118411086 PE=4 SV=1, Branchiostoma_floridae_tr_A0A9J7KRZ2_A0A9J7KRZ2_BRAFL tr|A0A9J7KRZ2|A0A9J7KRZ2_BRAFL Neurogenic locus notch homolog protein 1-like isoform X6 OS=Branchiostoma floridae OX=7739 GN=LOC118411086 PE=4 SV=1, Branchiostoma_floridae_tr_A0A9J7KRU4_A0A9J7KRU4_BRAFL tr|A0A9J7KRU4|A0A9J7KRU4_BRAFL Neurogenic locus notch homolog protein 1-like isoform X7 OS=Branchiostoma floridae OX=7739 GN=LOC118411086 PE=4 SV=1, Branchiostoma_floridae_tr_A0A9J7KRB5_A0A9J7KRB5_BRAFL tr|A0A9J7KRB5|A0A9J7KRB5_BRAFL Neurogenic locus notch homolog protein 1-like isoform X2 OS=Branchiostoma floridae OX=7739 GN=LOC118411086 PE=4 SV=1, Branchiostoma_floridae_tr_A0A9J7KR84_A0A9J7KR84_BRAFL tr|A0A9J7KR84|A0A9J7KR84_BRAFL Neurogenic locus notch homolog protein 1-like isoform X8 OS=Branchiostoma floridae OX=7739 GN=LOC118411086 PE=4 SV=1, Branchiostoma_floridae_tr_A0A9J7KR80_A0A9J7KR80_BRAFL tr|A0A9J7KR80|A0A9J7KR80_BRAFL Neurogenic locus Notch protein-like isoform X4 OS=Branchiostoma floridae OX=7739 GN=LOC118411086 PE=4 SV=1, Branchiostoma_floridae_tr_A0A9J7KRM2_A0A9J7KRM2_BRAFL tr|A0A9J7KRM2|A0A9J7KRM2_BRAFL Neurogenic locus notch homolog protein 1-like OS=Branchiostoma floridae OX=7739 GN=LOC118411186 PE=4 SV=1, Branchiostoma_floridae_tr_A0A9J7KCH3_A0A9J7KCH3_BRAFL tr|A0A9J7KCH3|A0A9J7KCH3_BRAFL Oncoprotein-induced transcript 3 protein-like OS=Branchiostoma floridae OX=7739 GN=LOC118408620 PE=4 SV=1	Amphimedon_queenslandica_tr_A0A1X7VB30_A0A1X7VB30_AMPQE tr_A0A1X7VB30_A0A1X7VB30_AMPQE Uncharacterized protein OS=Amphimedon queenslandica OX=400682 PE=4 SV=1
OG0000010	Branchiostoma_floridae_tr_A0A9J7MLJ9_A0A9J7MLJ9_BRAFL tr|A0A9J7MLJ9|A0A9J7MLJ9_BRAFL Down syndrome cell adhesion molecule-like protein 1 homolog isoform X2 OS=Branchiostoma floridae OX=7739 GN=LOC118412724 PE=4 SV=1, Branchiostoma_floridae_tr_A0A9J7MLX0_A0A9J7MLX0_BRAFL tr|A0A9J7MLX0|A0A9J7MLX0_BRAFL Down syndrome cell adhesion molecule-like protein 1 homolog isoform X1 OS=Branchiostoma floridae OX=7739 GN=LOC118412724 PE=4 SV=1	Amphimedon_queenslandica_tr_A0A1X7V0J8_A0A1X7V0J8_AMPQE tr_A0A1X7V0J8_A0A1X7V0J8_AMPQE Uncharacterized protein OS=Amphimedon queenslandica OX=400682 GN=105312484 PE=4 SV=1
OG0000010	Branchiostoma_floridae_tr_A0A9J7HGK5_A0A9J7HGK5_BRAFL tr|A0A9J7HGK5|A0A9J7HGK5_BRAFL Hemicentin-1-like OS=Branchiostoma floridae OX=7739 GN=LOC118404298 PE=4 SV=1, Branchiostoma_floridae_tr_A0A9J7K7Q1_A0A9J7K7Q1_BRAFL tr|A0A9J7K7Q1|A0A9J7K7Q1_BRAFL Contactin-2-like OS=Branchiostoma floridae OX=7739 GN=LOC118404896 PE=4 SV=1, Branchiostoma_floridae_tr_A0A9J7HJK1_A0A9J7HJK1_BRAFL tr|A0A9J7HJK1|A0A9J7HJK1_BRAFL Nephrin-like OS=Branchiostoma floridae OX=7739 GN=LOC118404301 PE=4 SV=1	Amphimedon_queenslandica_tr_A0A1X7UGX2_A0A1X7UGX2_AMPQE tr_A0A1X7UGX2_A0A1X7UGX2_AMPQE Uncharacterized protein OS=Amphimedon queenslandica OX=400682 PE=4 SV=1, Amphimedon_queenslandica_tr_A0A1X7T1P2_A0A1X7T1P2_AMPQE tr_A0A1X7T1P2_A0A1X7T1P2_AMPQE Uncharacterized protein OS=Amphimedon queenslandica OX=400682 PE=4 SV=1
