Orthogroup	Chordata_Amphioxiformes_Branchiostoma_floridae	Porifera_Demospongiae_Amphimedon_queenslandica
OG0000021	Branchiostoma_floridae_tr_A0A9J7NCW3_A0A9J7NCW3_BRAFL tr|A0A9J7NCW3|A0A9J7NCW3_BRAFL Very low-density lipoprotein receptor-like OS=Branchiostoma floridae OX=7739 GN=LOC118431481 PE=4 SV=1, Branchiostoma_floridae_tr_A0A9J7NCN6_A0A9J7NCN6_BRAFL tr|A0A9J7NCN6|A0A9J7NCN6_BRAFL Very low-density lipoprotein receptor-like OS=Branchiostoma floridae OX=7739 GN=LOC118431332 PE=4 SV=1	Amphimedon_queenslandica_tr_A0A1X7TVZ2_A0A1X7TVZ2_AMPQE tr_A0A1X7TVZ2_A0A1X7TVZ2_AMPQE Thrombomodulin OS=Amphimedon queenslandica OX=400682 PE=4 SV=1
OG0000021	Branchiostoma_floridae_tr_A0A9J7M241_A0A9J7M241_BRAFL tr|A0A9J7M241|A0A9J7M241_BRAFL Fibrillin-1-like OS=Branchiostoma floridae OX=7739 GN=LOC118427139 PE=4 SV=1	Amphimedon_queenslandica_tr_A0A1X7V472_A0A1X7V472_AMPQE tr_A0A1X7V472_A0A1X7V472_AMPQE Uncharacterized protein OS=Amphimedon queenslandica OX=400682 PE=4 SV=1, Amphimedon_queenslandica_tr_A0A1X7TGT9_A0A1X7TGT9_AMPQE tr_A0A1X7TGT9_A0A1X7TGT9_AMPQE Uncharacterized protein OS=Amphimedon queenslandica OX=400682 PE=4 SV=1, Amphimedon_queenslandica_tr_A0A1X7SJY3_A0A1X7SJY3_AMPQE tr_A0A1X7SJY3_A0A1X7SJY3_AMPQE EGF-like domain-containing protein OS=Amphimedon queenslandica OX=400682 PE=4 SV=1, Amphimedon_queenslandica_tr_A0A1X7SJQ5_A0A1X7SJQ5_AMPQE tr_A0A1X7SJQ5_A0A1X7SJQ5_AMPQE EGF-like domain-containing protein OS=Amphimedon queenslandica OX=400682 PE=4 SV=1, Amphimedon_queenslandica_tr_A0A1X7TB95_A0A1X7TB95_AMPQE tr_A0A1X7TB95_A0A1X7TB95_AMPQE Uncharacterized protein OS=Amphimedon queenslandica OX=400682 PE=4 SV=1, Amphimedon_queenslandica_tr_A0A1X7SU79_A0A1X7SU79_AMPQE tr_A0A1X7SU79_A0A1X7SU79_AMPQE EGF-like domain-containing protein OS=Amphimedon queenslandica OX=400682 PE=4 SV=1, Amphimedon_queenslandica_tr_A0A1X7VS84_A0A1X7VS84_AMPQE tr_A0A1X7VS84_A0A1X7VS84_AMPQE Uncharacterized protein OS=Amphimedon queenslandica OX=400682 PE=4 SV=1, Amphimedon_queenslandica_tr_A0A1X7SVY2_A0A1X7SVY2_AMPQE tr_A0A1X7SVY2_A0A1X7SVY2_AMPQE Uncharacterized protein OS=Amphimedon queenslandica OX=400682 PE=4 SV=1
OG0000022	Branchiostoma_floridae_tr_A0A9J7KV83_A0A9J7KV83_BRAFL tr|A0A9J7KV83|A0A9J7KV83_BRAFL Annexin OS=Branchiostoma floridae OX=7739 GN=LOC118411820 PE=3 SV=1	Amphimedon_queenslandica_tr_A0A1X7VQ74_A0A1X7VQ74_AMPQE tr_A0A1X7VQ74_A0A1X7VQ74_AMPQE Annexin OS=Amphimedon queenslandica OX=400682 GN=100638289 PE=3 SV=1
OG0000022	Branchiostoma_floridae_tr_A0A9J7KUH5_A0A9J7KUH5_BRAFL tr|A0A9J7KUH5|A0A9J7KUH5_BRAFL Annexin OS=Branchiostoma floridae OX=7739 GN=LOC118411559 PE=3 SV=1	Amphimedon_queenslandica_tr_A0A1X7SGH8_A0A1X7SGH8_AMPQE tr_A0A1X7SGH8_A0A1X7SGH8_AMPQE Uncharacterized protein OS=Amphimedon queenslandica OX=400682 GN=100638282 PE=3 SV=1, Amphimedon_queenslandica_tr_A0A1X7V5G7_A0A1X7V5G7_AMPQE tr_A0A1X7V5G7_A0A1X7V5G7_AMPQE Uncharacterized protein OS=Amphimedon queenslandica OX=400682 PE=3 SV=1, Amphimedon_queenslandica_tr_A0A1X7V673_A0A1X7V673_AMPQE tr_A0A1X7V673_A0A1X7V673_AMPQE Annexin OS=Amphimedon queenslandica OX=400682 GN=100634682 PE=3 SV=1
OG0000024	Branchiostoma_floridae_tr_A0A9J7MAA7_A0A9J7MAA7_BRAFL tr|A0A9J7MAA7|A0A9J7MAA7_BRAFL Uncharacterized protein LOC118430440 OS=Branchiostoma floridae OX=7739 GN=LOC118430440 PE=4 SV=1, Branchiostoma_floridae_tr_A0A9J7M6I3_A0A9J7M6I3_BRAFL tr|A0A9J7M6I3|A0A9J7M6I3_BRAFL Uncharacterized protein LOC118429318 OS=Branchiostoma floridae OX=7739 GN=LOC118429318 PE=4 SV=1, Branchiostoma_floridae_tr_A0A9J7K5R8_A0A9J7K5R8_BRAFL tr|A0A9J7K5R8|A0A9J7K5R8_BRAFL Equistatin-like OS=Branchiostoma floridae OX=7739 GN=LOC118403407 PE=4 SV=1, Branchiostoma_floridae_tr_A0A9J7KE15_A0A9J7KE15_BRAFL tr|A0A9J7KE15|A0A9J7KE15_BRAFL Neurogenic locus notch homolog protein 1-like OS=Branchiostoma floridae OX=7739 GN=LOC118403683 PE=4 SV=1, Branchiostoma_floridae_tr_A0A9J7KQT8_A0A9J7KQT8_BRAFL tr|A0A9J7KQT8|A0A9J7KQT8_BRAFL Uncharacterized protein LOC118410823 isoform X3 OS=Branchiostoma floridae OX=7739 GN=LOC118410823 PE=4 SV=1, Branchiostoma_floridae_tr_A0A9J7KR34_A0A9J7KR34_BRAFL tr|A0A9J7KR34|A0A9J7KR34_BRAFL Uncharacterized protein LOC118410823 isoform X2 OS=Branchiostoma floridae OX=7739 GN=LOC118410823 PE=4 SV=1, Branchiostoma_floridae_tr_A0A9J7KRR0_A0A9J7KRR0_BRAFL tr|A0A9J7KRR0|A0A9J7KRR0_BRAFL Uncharacterized protein LOC118410823 isoform X1 OS=Branchiostoma floridae OX=7739 GN=LOC118410823 PE=4 SV=1, Branchiostoma_floridae_tr_A0A9J7KS65_A0A9J7KS65_BRAFL tr|A0A9J7KS65|A0A9J7KS65_BRAFL Testican-2-like isoform X4 OS=Branchiostoma floridae OX=7739 GN=LOC118410823 PE=4 SV=1	Amphimedon_queenslandica_tr_A0A1X7VFM2_A0A1X7VFM2_AMPQE tr_A0A1X7VFM2_A0A1X7VFM2_AMPQE Uncharacterized protein OS=Amphimedon queenslandica OX=400682 GN=100635554 PE=4 SV=1
OG0000030	Branchiostoma_floridae_tr_A0A9J7HFR1_A0A9J7HFR1_BRAFL tr|A0A9J7HFR1|A0A9J7HFR1_BRAFL ADAM 17-like protease isoform X1 OS=Branchiostoma floridae OX=7739 GN=LOC118404014 PE=4 SV=1, Branchiostoma_floridae_tr_A0A9J7HIE3_A0A9J7HIE3_BRAFL tr|A0A9J7HIE3|A0A9J7HIE3_BRAFL ADAM 17-like protease isoform X5 OS=Branchiostoma floridae OX=7739 GN=LOC118404014 PE=4 SV=1, Branchiostoma_floridae_tr_A0A9J7HIR6_A0A9J7HIR6_BRAFL tr|A0A9J7HIR6|A0A9J7HIR6_BRAFL ADAM 17-like protease isoform X2 OS=Branchiostoma floridae OX=7739 GN=LOC118404014 PE=4 SV=1, Branchiostoma_floridae_tr_A0A9J7KH78_A0A9J7KH78_BRAFL tr|A0A9J7KH78|A0A9J7KH78_BRAFL ADAM 17-like protease isoform X3 OS=Branchiostoma floridae OX=7739 GN=LOC118404014 PE=4 SV=1, Branchiostoma_floridae_tr_A0A9J7HIZ3_A0A9J7HIZ3_BRAFL tr|A0A9J7HIZ3|A0A9J7HIZ3_BRAFL ADAM 17-like protease isoform X4 OS=Branchiostoma floridae OX=7739 GN=LOC118404014 PE=4 SV=1	Amphimedon_queenslandica_tr_A0A1X7VBP5_A0A1X7VBP5_AMPQE tr_A0A1X7VBP5_A0A1X7VBP5_AMPQE Uncharacterized protein OS=Amphimedon queenslandica OX=400682 GN=105311941 PE=4 SV=1, Amphimedon_queenslandica_tr_A0A1X7SR42_A0A1X7SR42_AMPQE tr_A0A1X7SR42_A0A1X7SR42_AMPQE Peptidase M12B domain-containing protein OS=Amphimedon queenslandica OX=400682 PE=4 SV=1, Amphimedon_queenslandica_tr_A0A1X7V044_A0A1X7V044_AMPQE tr_A0A1X7V044_A0A1X7V044_AMPQE Uncharacterized protein OS=Amphimedon queenslandica OX=400682 PE=4 SV=1
OG0000030	Branchiostoma_floridae_tr_A0A9J7KU24_A0A9J7KU24_BRAFL tr|A0A9J7KU24|A0A9J7KU24_BRAFL Disintegrin and metalloproteinase domain-containing protein 10-like OS=Branchiostoma floridae OX=7739 GN=LOC118412071 PE=4 SV=1, Branchiostoma_floridae_tr_A0A9J7MJR0_A0A9J7MJR0_BRAFL tr|A0A9J7MJR0|A0A9J7MJR0_BRAFL Disintegrin and metalloproteinase domain-containing protein 10-like isoform X1 OS=Branchiostoma floridae OX=7739 GN=LOC118411340 PE=4 SV=1, Branchiostoma_floridae_tr_A0A9J7KS49_A0A9J7KS49_BRAFL tr|A0A9J7KS49|A0A9J7KS49_BRAFL Disintegrin and metalloproteinase domain-containing protein 10-like isoform X2 OS=Branchiostoma floridae OX=7739 GN=LOC118411340 PE=4 SV=1, Branchiostoma_floridae_tr_A0A9J7KTJ1_A0A9J7KTJ1_BRAFL tr|A0A9J7KTJ1|A0A9J7KTJ1_BRAFL Disintegrin and metalloproteinase domain-containing protein 10-like isoform X1 OS=Branchiostoma floridae OX=7739 GN=LOC118411919 PE=4 SV=1, Branchiostoma_floridae_tr_A0A9J7KUJ7_A0A9J7KUJ7_BRAFL tr|A0A9J7KUJ7|A0A9J7KUJ7_BRAFL Disintegrin and metalloproteinase domain-containing protein 10-like isoform X3 OS=Branchiostoma floridae OX=7739 GN=LOC118411919 PE=4 SV=1, Branchiostoma_floridae_tr_A0A9J7KVF6_A0A9J7KVF6_BRAFL tr|A0A9J7KVF6|A0A9J7KVF6_BRAFL Disintegrin and metalloproteinase domain-containing protein 10-like isoform X2 OS=Branchiostoma floridae OX=7739 GN=LOC118411919 PE=4 SV=1	Amphimedon_queenslandica_tr_A0A1X7U7R3_A0A1X7U7R3_AMPQE tr_A0A1X7U7R3_A0A1X7U7R3_AMPQE Disintegrin domain-containing protein OS=Amphimedon queenslandica OX=400682 PE=4 SV=1, Amphimedon_queenslandica_tr_A0A1X7U550_A0A1X7U550_AMPQE tr_A0A1X7U550_A0A1X7U550_AMPQE Uncharacterized protein OS=Amphimedon queenslandica OX=400682 GN=100632085 PE=4 SV=1
OG0000030	Branchiostoma_floridae_tr_A0A9J7ML04_A0A9J7ML04_BRAFL tr|A0A9J7ML04|A0A9J7ML04_BRAFL Disintegrin and metalloproteinase domain-containing protein 10-like isoform X1 OS=Branchiostoma floridae OX=7739 GN=LOC118412678 PE=4 SV=1, Branchiostoma_floridae_tr_A0A9J7MLI0_A0A9J7MLI0_BRAFL tr|A0A9J7MLI0|A0A9J7MLI0_BRAFL Disintegrin and metalloproteinase domain-containing protein 10-like isoform X2 OS=Branchiostoma floridae OX=7739 GN=LOC118412678 PE=4 SV=1	Amphimedon_queenslandica_tr_A0A1X7UAN2_A0A1X7UAN2_AMPQE tr_A0A1X7UAN2_A0A1X7UAN2_AMPQE Uncharacterized protein OS=Amphimedon queenslandica OX=400682 GN=109584186 PE=4 SV=1, Amphimedon_queenslandica_tr_A0A1X7ST77_A0A1X7ST77_AMPQE tr_A0A1X7ST77_A0A1X7ST77_AMPQE Uncharacterized protein OS=Amphimedon queenslandica OX=400682 GN=100641574 PE=4 SV=1
OG0000032	Branchiostoma_floridae_tr_A0A9J7N0Q2_A0A9J7N0Q2_BRAFL tr|A0A9J7N0Q2|A0A9J7N0Q2_BRAFL Short-chain collagen C4-like OS=Branchiostoma floridae OX=7739 GN=LOC118422346 PE=4 SV=1, Branchiostoma_floridae_tr_A0A9J7LSU0_A0A9J7LSU0_BRAFL tr|A0A9J7LSU0|A0A9J7LSU0_BRAFL Short-chain collagen C4-like OS=Branchiostoma floridae OX=7739 GN=LOC118423536 PE=4 SV=1, Branchiostoma_floridae_tr_A0A9J7N320_A0A9J7N320_BRAFL tr|A0A9J7N320|A0A9J7N320_BRAFL Short-chain collagen C4-like OS=Branchiostoma floridae OX=7739 GN=LOC118423537 PE=4 SV=1, Branchiostoma_floridae_tr_A0A9J7LQF6_A0A9J7LQF6_BRAFL tr|A0A9J7LQF6|A0A9J7LQF6_BRAFL Short-chain collagen C4-like OS=Branchiostoma floridae OX=7739 GN=LOC118423155 PE=4 SV=1, Branchiostoma_floridae_tr_A0A9J7MY27_A0A9J7MY27_BRAFL tr|A0A9J7MY27|A0A9J7MY27_BRAFL Collagen alpha-1_V_ chain-like OS=Branchiostoma floridae OX=7739 GN=LOC118422344 PE=4 SV=1, Branchiostoma_floridae_tr_A0A9J7LP30_A0A9J7LP30_BRAFL tr|A0A9J7LP30|A0A9J7LP30_BRAFL Short-chain collagen C4-like OS=Branchiostoma floridae OX=7739 GN=LOC118422345 PE=4 SV=1, Branchiostoma_floridae_tr_A0A9J7LQF5_A0A9J7LQF5_BRAFL tr|A0A9J7LQF5|A0A9J7LQF5_BRAFL Short-chain collagen C4-like OS=Branchiostoma floridae OX=7739 GN=LOC118423399 PE=4 SV=1, Branchiostoma_floridae_tr_A0A9J7KQR6_A0A9J7KQR6_BRAFL tr|A0A9J7KQR6|A0A9J7KQR6_BRAFL Short-chain collagen C4-like OS=Branchiostoma floridae OX=7739 GN=LOC118410667 PE=4 SV=1, Branchiostoma_floridae_tr_C3YB76_C3YB76_BRAFL tr|C3YB76|C3YB76_BRAFL Short-chain collagen C4-like OS=Branchiostoma floridae OX=7739 GN=LOC118410067 PE=4 SV=1, Branchiostoma_floridae_tr_C3YB78_C3YB78_BRAFL tr|C3YB78|C3YB78_BRAFL Short-chain collagen C4-like OS=Branchiostoma floridae OX=7739 GN=LOC118410664 PE=4 SV=1, Branchiostoma_floridae_tr_A0A9J7MM69_A0A9J7MM69_BRAFL tr|A0A9J7MM69|A0A9J7MM69_BRAFL Collagen alpha-3_IV_ chain-like OS=Branchiostoma floridae OX=7739 GN=LOC118413218 PE=4 SV=1, Branchiostoma_floridae_tr_A0A9J7KWW4_A0A9J7KWW4_BRAFL tr|A0A9J7KWW4|A0A9J7KWW4_BRAFL Short-chain collagen C4-like OS=Branchiostoma floridae OX=7739 GN=LOC118412867 PE=4 SV=1, Branchiostoma_floridae_tr_A0A9J7HHD5_A0A9J7HHD5_BRAFL tr|A0A9J7HHD5|A0A9J7HHD5_BRAFL Collagen alpha-2_IX_ chain-like OS=Branchiostoma floridae OX=7739 GN=LOC118403032 PE=4 SV=1, Branchiostoma_floridae_tr_C3YR84_C3YR84_BRAFL tr|C3YR84|C3YR84_BRAFL Collagen alpha-3_IV_ chain-like OS=Branchiostoma floridae OX=7739 GN=LOC118413670 PE=4 SV=1, Branchiostoma_floridae_tr_A0A9J7LNH8_A0A9J7LNH8_BRAFL tr|A0A9J7LNH8|A0A9J7LNH8_BRAFL Uncharacterized protein LOC118422637 OS=Branchiostoma floridae OX=7739 GN=LOC118422637 PE=4 SV=1, Branchiostoma_floridae_tr_A0A9J7N1G6_A0A9J7N1G6_BRAFL tr|A0A9J7N1G6|A0A9J7N1G6_BRAFL Short-chain collagen C4-like OS=Branchiostoma floridae OX=7739 GN=LOC118422714 PE=4 SV=1, Branchiostoma_floridae_tr_A0A9J7N8W5_A0A9J7N8W5_BRAFL tr|A0A9J7N8W5|A0A9J7N8W5_BRAFL Short-chain collagen C4-like OS=Branchiostoma floridae OX=7739 GN=LOC118427829 PE=4 SV=1, Branchiostoma_floridae_tr_A0A9J7LNJ1_A0A9J7LNJ1_BRAFL tr|A0A9J7LNJ1|A0A9J7LNJ1_BRAFL LOW QUALITY PROTEIN_ collectin-12-like OS=Branchiostoma floridae OX=7739 GN=LOC118422638 PE=4 SV=1, Branchiostoma_floridae_tr_A0A9J7MYI0_A0A9J7MYI0_BRAFL tr|A0A9J7MYI0|A0A9J7MYI0_BRAFL Short-chain collagen C4-like isoform X2 OS=Branchiostoma floridae OX=7739 GN=LOC118422641 PE=4 SV=1, Branchiostoma_floridae_tr_A0A9J7N1C3_A0A9J7N1C3_BRAFL tr|A0A9J7N1C3|A0A9J7N1C3_BRAFL Short-chain collagen C4-like isoform X1 OS=Branchiostoma floridae OX=7739 GN=LOC118422641 PE=4 SV=1, Branchiostoma_floridae_tr_A0A9J7LQA3_A0A9J7LQA3_BRAFL tr|A0A9J7LQA3|A0A9J7LQA3_BRAFL Short-chain collagen C4-like OS=Branchiostoma floridae OX=7739 GN=LOC118422640 PE=4 SV=1	Amphimedon_queenslandica_tr_A0A1X7TCP0_A0A1X7TCP0_AMPQE tr_A0A1X7TCP0_A0A1X7TCP0_AMPQE Uncharacterized protein OS=Amphimedon queenslandica OX=400682 PE=4 SV=1, Amphimedon_queenslandica_tr_A0A1X7T0X2_A0A1X7T0X2_AMPQE tr_A0A1X7T0X2_A0A1X7T0X2_AMPQE Uncharacterized protein OS=Amphimedon queenslandica OX=400682 PE=4 SV=1
OG0000034	Branchiostoma_floridae_tr_A0A9J7KXG1_A0A9J7KXG1_BRAFL tr|A0A9J7KXG1|A0A9J7KXG1_BRAFL Attractin-like protein 1 OS=Branchiostoma floridae OX=7739 GN=LOC118413199 PE=4 SV=1	Amphimedon_queenslandica_tr_A0A1X7UWV8_A0A1X7UWV8_AMPQE tr_A0A1X7UWV8_A0A1X7UWV8_AMPQE Uncharacterized protein OS=Amphimedon queenslandica OX=400682 GN=109581856 PE=4 SV=1, Amphimedon_queenslandica_tr_A0A1X7VPN4_A0A1X7VPN4_AMPQE tr_A0A1X7VPN4_A0A1X7VPN4_AMPQE Laminin EGF-like domain-containing protein OS=Amphimedon queenslandica OX=400682 PE=4 SV=1
OG0000034	Branchiostoma_floridae_tr_A0A9J7LPR3_A0A9J7LPR3_BRAFL tr|A0A9J7LPR3|A0A9J7LPR3_BRAFL Neurogenic locus Notch protein-like OS=Branchiostoma floridae OX=7739 GN=LOC118423076 PE=4 SV=1	Amphimedon_queenslandica_tr_A0A1X7TBK3_A0A1X7TBK3_AMPQE tr_A0A1X7TBK3_A0A1X7TBK3_AMPQE Uncharacterized protein OS=Amphimedon queenslandica OX=400682 PE=4 SV=1
OG0000036	Branchiostoma_floridae_tr_A0A9J7M5D6_A0A9J7M5D6_BRAFL tr|A0A9J7M5D6|A0A9J7M5D6_BRAFL Uncharacterized protein LOC118428591 OS=Branchiostoma floridae OX=7739 GN=LOC118428591 PE=4 SV=1	Amphimedon_queenslandica_tr_A0A1X7V656_A0A1X7V656_AMPQE tr_A0A1X7V656_A0A1X7V656_AMPQE Uncharacterized protein OS=Amphimedon queenslandica OX=400682 PE=4 SV=1, Amphimedon_queenslandica_tr_A0A1X7UCB5_A0A1X7UCB5_AMPQE tr_A0A1X7UCB5_A0A1X7UCB5_AMPQE Uncharacterized protein OS=Amphimedon queenslandica OX=400682 PE=4 SV=1, Amphimedon_queenslandica_tr_A0A1X7TBI3_A0A1X7TBI3_AMPQE tr_A0A1X7TBI3_A0A1X7TBI3_AMPQE Uncharacterized protein OS=Amphimedon queenslandica OX=400682 PE=4 SV=1, Amphimedon_queenslandica_tr_A0A1X7V7J8_A0A1X7V7J8_AMPQE tr_A0A1X7V7J8_A0A1X7V7J8_AMPQE Uncharacterized protein OS=Amphimedon queenslandica OX=400682 GN=105312253 PE=4 SV=1, Amphimedon_queenslandica_tr_A0A1X7VV77_A0A1X7VV77_AMPQE tr_A0A1X7VV77_A0A1X7VV77_AMPQE Uncharacterized protein OS=Amphimedon queenslandica OX=400682 GN=109580237 PE=4 SV=1, Amphimedon_queenslandica_tr_A0A1X7TT31_A0A1X7TT31_AMPQE tr_A0A1X7TT31_A0A1X7TT31_AMPQE Uncharacterized protein OS=Amphimedon queenslandica OX=400682 PE=4 SV=1, Amphimedon_queenslandica_tr_A0A1X7TTE5_A0A1X7TTE5_AMPQE tr_A0A1X7TTE5_A0A1X7TTE5_AMPQE Uncharacterized protein OS=Amphimedon queenslandica OX=400682 PE=4 SV=1, Amphimedon_queenslandica_tr_A0A1X7TSV3_A0A1X7TSV3_AMPQE tr_A0A1X7TSV3_A0A1X7TSV3_AMPQE Uncharacterized protein OS=Amphimedon queenslandica OX=400682 PE=4 SV=1, Amphimedon_queenslandica_tr_A0A1X7VJK4_A0A1X7VJK4_AMPQE tr_A0A1X7VJK4_A0A1X7VJK4_AMPQE Uncharacterized protein OS=Amphimedon queenslandica OX=400682 PE=4 SV=1, Amphimedon_queenslandica_tr_A0A1X7T0G0_A0A1X7T0G0_AMPQE tr_A0A1X7T0G0_A0A1X7T0G0_AMPQE Uncharacterized protein OS=Amphimedon queenslandica OX=400682 PE=4 SV=1, Amphimedon_queenslandica_tr_A0A1X7SGQ6_A0A1X7SGQ6_AMPQE tr_A0A1X7SGQ6_A0A1X7SGQ6_AMPQE Uncharacterized protein OS=Amphimedon queenslandica OX=400682 PE=4 SV=1, Amphimedon_queenslandica_tr_A0A1X7T4Q7_A0A1X7T4Q7_AMPQE tr_A0A1X7T4Q7_A0A1X7T4Q7_AMPQE Uncharacterized protein OS=Amphimedon queenslandica OX=400682 PE=4 SV=1, Amphimedon_queenslandica_tr_A0A1X7U143_A0A1X7U143_AMPQE tr_A0A1X7U143_A0A1X7U143_AMPQE Uncharacterized protein OS=Amphimedon queenslandica OX=400682 PE=4 SV=1, Amphimedon_queenslandica_tr_A0A1X7SW10_A0A1X7SW10_AMPQE tr_A0A1X7SW10_A0A1X7SW10_AMPQE Uncharacterized protein OS=Amphimedon queenslandica OX=400682 PE=4 SV=1, Amphimedon_queenslandica_tr_A0A1X7UBP4_A0A1X7UBP4_AMPQE tr_A0A1X7UBP4_A0A1X7UBP4_AMPQE Uncharacterized protein OS=Amphimedon queenslandica OX=400682 PE=4 SV=1, Amphimedon_queenslandica_tr_A0A1X7T5Z8_A0A1X7T5Z8_AMPQE tr_A0A1X7T5Z8_A0A1X7T5Z8_AMPQE Uncharacterized protein OS=Amphimedon queenslandica OX=400682 PE=4 SV=1
OG0000038	Branchiostoma_floridae_tr_A0A9J7L5U7_A0A9J7L5U7_BRAFL tr|A0A9J7L5U7|A0A9J7L5U7_BRAFL Uncharacterized protein LOC118415493 OS=Branchiostoma floridae OX=7739 GN=LOC118415493 PE=3 SV=1, Branchiostoma_floridae_tr_A0A9J7M4J9_A0A9J7M4J9_BRAFL tr|A0A9J7M4J9|A0A9J7M4J9_BRAFL Uncharacterized protein LOC118428006 OS=Branchiostoma floridae OX=7739 GN=LOC118428006 PE=3 SV=1, Branchiostoma_floridae_tr_A0A9J7M3G4_A0A9J7M3G4_BRAFL tr|A0A9J7M3G4|A0A9J7M3G4_BRAFL Ectodysplasin-A-like OS=Branchiostoma floridae OX=7739 GN=LOC118428005 PE=3 SV=1, Branchiostoma_floridae_tr_A0A9J7N759_A0A9J7N759_BRAFL tr|A0A9J7N759|A0A9J7N759_BRAFL Uncharacterized protein LOC118428004 OS=Branchiostoma floridae OX=7739 GN=LOC118428004 PE=3 SV=1	Amphimedon_queenslandica_tr_A0A1X7VQI5_A0A1X7VQI5_AMPQE tr_A0A1X7VQI5_A0A1X7VQI5_AMPQE TNF_2 domain-containing protein OS=Amphimedon queenslandica OX=400682 GN=109585650 PE=3 SV=1
OG0000039	Branchiostoma_floridae_tr_A0A9J7HL44_A0A9J7HL44_BRAFL tr|A0A9J7HL44|A0A9J7HL44_BRAFL Uncharacterized protein LOC118405866 OS=Branchiostoma floridae OX=7739 GN=LOC118405866 PE=4 SV=1, Branchiostoma_floridae_tr_A0A9J7HRT0_A0A9J7HRT0_BRAFL tr|A0A9J7HRT0|A0A9J7HRT0_BRAFL Uncharacterized protein LOC118406387 OS=Branchiostoma floridae OX=7739 GN=LOC118406387 PE=4 SV=1, Branchiostoma_floridae_tr_A0A9J7MPR7_A0A9J7MPR7_BRAFL tr|A0A9J7MPR7|A0A9J7MPR7_BRAFL Uncharacterized protein LOC118415485 OS=Branchiostoma floridae OX=7739 GN=LOC118415485 PE=4 SV=1, Branchiostoma_floridae_tr_A0A9J7L518_A0A9J7L518_BRAFL tr|A0A9J7L518|A0A9J7L518_BRAFL Uncharacterized protein LOC118415516 OS=Branchiostoma floridae OX=7739 GN=LOC118415516 PE=4 SV=1, Branchiostoma_floridae_tr_A0A9J7HPA9_A0A9J7HPA9_BRAFL tr|A0A9J7HPA9|A0A9J7HPA9_BRAFL Uncharacterized protein LOC118407020 OS=Branchiostoma floridae OX=7739 GN=LOC118407020 PE=4 SV=1, Branchiostoma_floridae_tr_A0A9J7KYZ7_A0A9J7KYZ7_BRAFL tr|A0A9J7KYZ7|A0A9J7KYZ7_BRAFL LOW QUALITY PROTEIN_ uncharacterized protein LOC118413673 OS=Branchiostoma floridae OX=7739 GN=LOC118413673 PE=4 SV=1, Branchiostoma_floridae_tr_A0A9J7HQ66_A0A9J7HQ66_BRAFL tr|A0A9J7HQ66|A0A9J7HQ66_BRAFL Uncharacterized protein LOC118407508 OS=Branchiostoma floridae OX=7739 GN=LOC118407508 PE=4 SV=1, Branchiostoma_floridae_tr_A0A9J7M8Q2_A0A9J7M8Q2_BRAFL tr|A0A9J7M8Q2|A0A9J7M8Q2_BRAFL Uncharacterized protein LOC118430248 OS=Branchiostoma floridae OX=7739 GN=LOC118430248 PE=4 SV=1, Branchiostoma_floridae_tr_A0A9J7LMI9_A0A9J7LMI9_BRAFL tr|A0A9J7LMI9|A0A9J7LMI9_BRAFL LOW QUALITY PROTEIN_ uncharacterized protein LOC118422217 OS=Branchiostoma floridae OX=7739 GN=LOC118422217 PE=4 SV=1, Branchiostoma_floridae_tr_A0A9J7M949_A0A9J7M949_BRAFL tr|A0A9J7M949|A0A9J7M949_BRAFL Uncharacterized protein LOC118430249 OS=Branchiostoma floridae OX=7739 GN=LOC118430249 PE=4 SV=1, Branchiostoma_floridae_tr_A0A9J7ND81_A0A9J7ND81_BRAFL tr|A0A9J7ND81|A0A9J7ND81_BRAFL Uncharacterized protein LOC118431582 OS=Branchiostoma floridae OX=7739 GN=LOC118431582 PE=3 SV=1, Branchiostoma_floridae_tr_A0A9J7HKY1_A0A9J7HKY1_BRAFL tr|A0A9J7HKY1|A0A9J7HKY1_BRAFL Uncharacterized protein LOC118404968 OS=Branchiostoma floridae OX=7739 GN=LOC118404968 PE=4 SV=1	Amphimedon_queenslandica_tr_A0A1X7VS50_A0A1X7VS50_AMPQE tr_A0A1X7VS50_A0A1X7VS50_AMPQE Sushi domain-containing protein OS=Amphimedon queenslandica OX=400682 PE=3 SV=1
OG0000040	Branchiostoma_floridae_tr_A0A9J7L1E1_A0A9J7L1E1_BRAFL tr|A0A9J7L1E1|A0A9J7L1E1_BRAFL Kazal-type serine protease inhibitor domain-containing protein 1-like isoform X5 OS=Branchiostoma floridae OX=7739 GN=LOC118414154 PE=4 SV=1, Branchiostoma_floridae_tr_A0A9J7L057_A0A9J7L057_BRAFL tr|A0A9J7L057|A0A9J7L057_BRAFL Uncharacterized protein LOC118413580 OS=Branchiostoma floridae OX=7739 GN=LOC118413580 PE=4 SV=1, Branchiostoma_floridae_tr_A0A9J7L2C5_A0A9J7L2C5_BRAFL tr|A0A9J7L2C5|A0A9J7L2C5_BRAFL Insulin-like growth factor-binding protein-like 1 OS=Branchiostoma floridae OX=7739 GN=LOC118414160 PE=4 SV=1	Amphimedon_queenslandica_tr_A0A1X7TVU0_A0A1X7TVU0_AMPQE tr_A0A1X7TVU0_A0A1X7TVU0_AMPQE Uncharacterized protein OS=Amphimedon queenslandica OX=400682 PE=4 SV=1
OG0000041	Branchiostoma_floridae_tr_A0A9J7MYP6_A0A9J7MYP6_BRAFL tr|A0A9J7MYP6|A0A9J7MYP6_BRAFL LOW QUALITY PROTEIN_ von Willebrand factor A domain-containing protein 5A-like OS=Branchiostoma floridae OX=7739 GN=LOC118420707 PE=4 SV=1	Amphimedon_queenslandica_tr_A0A1X7VQ95_A0A1X7VQ95_AMPQE tr_A0A1X7VQ95_A0A1X7VQ95_AMPQE Uncharacterized protein OS=Amphimedon queenslandica OX=400682 GN=100636438 PE=4 SV=1
OG0000041	Branchiostoma_floridae_tr_A0A9J7MAS6_A0A9J7MAS6_BRAFL tr|A0A9J7MAS6|A0A9J7MAS6_BRAFL von Willebrand factor A domain-containing protein 5B1-like OS=Branchiostoma floridae OX=7739 GN=LOC118430868 PE=4 SV=1, Branchiostoma_floridae_tr_A0A9J7MD33_A0A9J7MD33_BRAFL tr|A0A9J7MD33|A0A9J7MD33_BRAFL von Willebrand factor A domain-containing protein 5B1-like OS=Branchiostoma floridae OX=7739 GN=LOC118430871 PE=4 SV=1	Amphimedon_queenslandica_tr_A0A1X7VG51_A0A1X7VG51_AMPQE tr_A0A1X7VG51_A0A1X7VG51_AMPQE VWFA domain-containing protein OS=Amphimedon queenslandica OX=400682 PE=4 SV=1
OG0000041	Branchiostoma_floridae_tr_A0A9J7KGX4_A0A9J7KGX4_BRAFL tr|A0A9J7KGX4|A0A9J7KGX4_BRAFL Poly [ADP-ribose] polymerase OS=Branchiostoma floridae OX=7739 GN=LOC118404511 PE=3 SV=1	Amphimedon_queenslandica_tr_A0A1X7V1S2_A0A1X7V1S2_AMPQE tr_A0A1X7V1S2_A0A1X7V1S2_AMPQE Poly [ADP-ribose] polymerase OS=Amphimedon queenslandica OX=400682 GN=100633591 PE=3 SV=1
OG0000047	Branchiostoma_floridae_tr_A0A9J7MR60_A0A9J7MR60_BRAFL tr|A0A9J7MR60|A0A9J7MR60_BRAFL Uncharacterized protein LOC118415620 OS=Branchiostoma floridae OX=7739 GN=LOC118415620 PE=4 SV=1	Amphimedon_queenslandica_tr_A0A1X7UZ57_A0A1X7UZ57_AMPQE tr_A0A1X7UZ57_A0A1X7UZ57_AMPQE Uncharacterized protein OS=Amphimedon queenslandica OX=400682 PE=3 SV=1, Amphimedon_queenslandica_tr_A0A1X7UXZ5_A0A1X7UXZ5_AMPQE tr_A0A1X7UXZ5_A0A1X7UXZ5_AMPQE Uncharacterized protein OS=Amphimedon queenslandica OX=400682 PE=3 SV=1, Amphimedon_queenslandica_tr_A0A1X7UY64_A0A1X7UY64_AMPQE tr_A0A1X7UY64_A0A1X7UY64_AMPQE Uncharacterized protein OS=Amphimedon queenslandica OX=400682 PE=3 SV=1
OG0000048	Branchiostoma_floridae_tr_A0A9J7MT30_A0A9J7MT30_BRAFL tr|A0A9J7MT30|A0A9J7MT30_BRAFL Leucine-rich repeat-containing protein 15-like OS=Branchiostoma floridae OX=7739 GN=LOC118418204 PE=4 SV=1	Amphimedon_queenslandica_tr_A0A1X7UU24_A0A1X7UU24_AMPQE tr_A0A1X7UU24_A0A1X7UU24_AMPQE Uncharacterized protein OS=Amphimedon queenslandica OX=400682 PE=4 SV=1
OG0000049	Branchiostoma_floridae_tr_A0A9J7L9M9_A0A9J7L9M9_BRAFL tr|A0A9J7L9M9|A0A9J7L9M9_BRAFL Plexin-A4-like OS=Branchiostoma floridae OX=7739 GN=LOC118416498 PE=3 SV=1, Branchiostoma_floridae_tr_A0A9J7MQ74_A0A9J7MQ74_BRAFL tr|A0A9J7MQ74|A0A9J7MQ74_BRAFL Plexin-A1-like OS=Branchiostoma floridae OX=7739 GN=LOC118415111 PE=3 SV=1	Amphimedon_queenslandica_tr_A0A1X7VVB6_A0A1X7VVB6_AMPQE tr_A0A1X7VVB6_A0A1X7VVB6_AMPQE Sema domain-containing protein OS=Amphimedon queenslandica OX=400682 GN=100641578 PE=3 SV=1, Amphimedon_queenslandica_tr_A0A1X7SV56_A0A1X7SV56_AMPQE tr_A0A1X7SV56_A0A1X7SV56_AMPQE Uncharacterized protein OS=Amphimedon queenslandica OX=400682 PE=4 SV=1, Amphimedon_queenslandica_tr_A0A1X7T417_A0A1X7T417_AMPQE tr_A0A1X7T417_A0A1X7T417_AMPQE Sema domain-containing protein OS=Amphimedon queenslandica OX=400682 PE=4 SV=1, Amphimedon_queenslandica_tr_A0A1X7UU11_A0A1X7UU11_AMPQE tr_A0A1X7UU11_A0A1X7UU11_AMPQE Uncharacterized protein OS=Amphimedon queenslandica OX=400682 PE=4 SV=1, Amphimedon_queenslandica_tr_A0A1X7VVB4_A0A1X7VVB4_AMPQE tr_A0A1X7VVB4_A0A1X7VVB4_AMPQE Uncharacterized protein OS=Amphimedon queenslandica OX=400682 GN=100641705 PE=3 SV=1, Amphimedon_queenslandica_tr_A0A1X7URZ8_A0A1X7URZ8_AMPQE tr_A0A1X7URZ8_A0A1X7URZ8_AMPQE Uncharacterized protein OS=Amphimedon queenslandica OX=400682 PE=4 SV=1, Amphimedon_queenslandica_tr_A0A1X7URK3_A0A1X7URK3_AMPQE tr_A0A1X7URK3_A0A1X7URK3_AMPQE Sema domain-containing protein OS=Amphimedon queenslandica OX=400682 PE=4 SV=1
