Orthogroup	Chordata_Amphioxiformes_Branchiostoma_floridae	Platyhelminthes_Tricladida_Schmidtea_mediterranea
OG0000064	Branchiostoma_floridae_tr_A0A9J7MMW4_A0A9J7MMW4_BRAFL tr|A0A9J7MMW4|A0A9J7MMW4_BRAFL Latent-transforming growth factor beta-binding protein 1-like OS=Branchiostoma floridae OX=7739 GN=LOC118413602 PE=4 SV=1	Schmidtea_mediterranea_maker-scaffold2473-augustus-gene-0.58-mRNA-1 maker-scaffold2473-augustus-gene-0.58-mRNA-1 protein AED_0.13 eAED_0.13 QI_0|0.66|0.25|1|0.33|0.5|4|0|143
OG0000070	Branchiostoma_floridae_tr_A0A9J7MYR9_A0A9J7MYR9_BRAFL tr|A0A9J7MYR9|A0A9J7MYR9_BRAFL Peroxidasin homolog OS=Branchiostoma floridae OX=7739 GN=LOC118421694 PE=3 SV=1, Branchiostoma_floridae_tr_A0A9J7HM94_A0A9J7HM94_BRAFL tr|A0A9J7HM94|A0A9J7HM94_BRAFL Thyroid peroxidase OS=Branchiostoma floridae OX=7739 GN=LOC118405412 PE=3 SV=1, Branchiostoma_floridae_tr_A0A9J7KIY2_A0A9J7KIY2_BRAFL tr|A0A9J7KIY2|A0A9J7KIY2_BRAFL Thyroid peroxidase OS=Branchiostoma floridae OX=7739 GN=LOC118405423 PE=3 SV=1, Branchiostoma_floridae_tr_A0A9J7HM67_A0A9J7HM67_BRAFL tr|A0A9J7HM67|A0A9J7HM67_BRAFL Thyroid peroxidase OS=Branchiostoma floridae OX=7739 GN=LOC118405423 PE=3 SV=1, Branchiostoma_floridae_tr_A0A9J7HMW6_A0A9J7HMW6_BRAFL tr|A0A9J7HMW6|A0A9J7HMW6_BRAFL Thyroid peroxidase OS=Branchiostoma floridae OX=7739 GN=LOC118405423 PE=3 SV=1, Branchiostoma_floridae_tr_A0A9J7KI86_A0A9J7KI86_BRAFL tr|A0A9J7KI86|A0A9J7KI86_BRAFL Thyroid peroxidase OS=Branchiostoma floridae OX=7739 GN=LOC118405423 PE=3 SV=1, Branchiostoma_floridae_tr_A0A9J7ME95_A0A9J7ME95_BRAFL tr|A0A9J7ME95|A0A9J7ME95_BRAFL Peroxidasin homolog OS=Branchiostoma floridae OX=7739 GN=LOC118432218 PE=4 SV=1	Schmidtea_mediterranea_maker-scaffold5478-snap-gene-0.30-mRNA-1 maker-scaffold5478-snap-gene-0.30-mRNA-1 protein AED_0.23 eAED_0.24 QI_0|0.2|0|1|0.2|0.16|6|0|1775
OG0000073	Branchiostoma_floridae_tr_A0A9J7MMD3_A0A9J7MMD3_BRAFL tr|A0A9J7MMD3|A0A9J7MMD3_BRAFL Uncharacterized protein LOC118413777 OS=Branchiostoma floridae OX=7739 GN=LOC118413777 PE=4 SV=1, Branchiostoma_floridae_tr_A0A9J7HUV5_A0A9J7HUV5_BRAFL tr|A0A9J7HUV5|A0A9J7HUV5_BRAFL Uncharacterized protein LOC118407442 OS=Branchiostoma floridae OX=7739 GN=LOC118407442 PE=4 SV=1, Branchiostoma_floridae_tr_A0A9J7N7T2_A0A9J7N7T2_BRAFL tr|A0A9J7N7T2|A0A9J7N7T2_BRAFL CUB and sushi domain-containing protein 1-like isoform X2 OS=Branchiostoma floridae OX=7739 GN=LOC118429888 PE=4 SV=1, Branchiostoma_floridae_tr_A0A9J7KL81_A0A9J7KL81_BRAFL tr|A0A9J7KL81|A0A9J7KL81_BRAFL Uncharacterized protein LOC118408880 OS=Branchiostoma floridae OX=7739 GN=LOC118408880 PE=4 SV=1, Branchiostoma_floridae_tr_A0A9J7M8E6_A0A9J7M8E6_BRAFL tr|A0A9J7M8E6|A0A9J7M8E6_BRAFL Uncharacterized protein LOC118430053 OS=Branchiostoma floridae OX=7739 GN=LOC118430053 PE=4 SV=1, Branchiostoma_floridae_tr_A0A9J7MM56_A0A9J7MM56_BRAFL tr|A0A9J7MM56|A0A9J7MM56_BRAFL Uncharacterized protein LOC118413543 OS=Branchiostoma floridae OX=7739 GN=LOC118413543 PE=4 SV=1, Branchiostoma_floridae_tr_A0A9J7MC04_A0A9J7MC04_BRAFL tr|A0A9J7MC04|A0A9J7MC04_BRAFL Uncharacterized protein LOC118431114 OS=Branchiostoma floridae OX=7739 GN=LOC118431114 PE=4 SV=1, Branchiostoma_floridae_tr_A0A9J7MBB8_A0A9J7MBB8_BRAFL tr|A0A9J7MBB8|A0A9J7MBB8_BRAFL Sushi_ von Willebrand factor type A_ EGF and pentraxin domain-containing protein 1-like OS=Branchiostoma floridae OX=7739 GN=LOC118431101 PE=4 SV=1	Schmidtea_mediterranea_maker-scaffold4363-snap-gene-0.37-mRNA-1 maker-scaffold4363-snap-gene-0.37-mRNA-1 protein AED_0.12 eAED_0.12 QI_0|0.69|0.66|0.91|0.52|0.75|24|0|1648
OG0000074	Branchiostoma_floridae_tr_A0A9J7NA59_A0A9J7NA59_BRAFL tr|A0A9J7NA59|A0A9J7NA59_BRAFL Leucine-rich repeat-containing protein 4C-like OS=Branchiostoma floridae OX=7739 GN=LOC118431539 PE=4 SV=1, Branchiostoma_floridae_tr_A0A9J7KNX1_A0A9J7KNX1_BRAFL tr|A0A9J7KNX1|A0A9J7KNX1_BRAFL Leucine-rich repeat-containing protein 70-like OS=Branchiostoma floridae OX=7739 GN=LOC118410098 PE=4 SV=1, Branchiostoma_floridae_tr_A0A9J7LJT9_A0A9J7LJT9_BRAFL tr|A0A9J7LJT9|A0A9J7LJT9_BRAFL Leucine-rich repeat-containing protein 15-like OS=Branchiostoma floridae OX=7739 GN=LOC118421220 PE=4 SV=1, Branchiostoma_floridae_tr_A0A9J7MCX2_A0A9J7MCX2_BRAFL tr|A0A9J7MCX2|A0A9J7MCX2_BRAFL Leucine-rich repeat-containing protein 15-like OS=Branchiostoma floridae OX=7739 GN=LOC118431735 PE=4 SV=1, Branchiostoma_floridae_tr_A0A9J7MPW3_A0A9J7MPW3_BRAFL tr|A0A9J7MPW3|A0A9J7MPW3_BRAFL Slit homolog 2 protein-like OS=Branchiostoma floridae OX=7739 GN=LOC118414987 PE=4 SV=1	Schmidtea_mediterranea_maker-scaffold388-augustus-gene-4.45-mRNA-1 maker-scaffold388-augustus-gene-4.45-mRNA-1 protein AED_0.03 eAED_0.03 QI_1337|1|1|1|0.30|0.40|27|353|1205
OG0000080	Branchiostoma_floridae_tr_A0A9J7HVZ1_A0A9J7HVZ1_BRAFL tr|A0A9J7HVZ1|A0A9J7HVZ1_BRAFL Metalloproteinase inhibitor 3-like OS=Branchiostoma floridae OX=7739 GN=LOC118408936 PE=3 SV=1, Branchiostoma_floridae_tr_A0A9J7L530_A0A9J7L530_BRAFL tr|A0A9J7L530|A0A9J7L530_BRAFL Metalloproteinase inhibitor 3-like OS=Branchiostoma floridae OX=7739 GN=LOC118415649 PE=3 SV=1	Schmidtea_mediterranea_maker-scaffold16385-augustus-gene-0.38-mRNA-1 maker-scaffold16385-augustus-gene-0.38-mRNA-1 protein AED_0.00 eAED_0.00 QI_443|1|1|1|0|0.33|3|35|141, Schmidtea_mediterranea_maker-scaffold4907-snap-gene-0.19-mRNA-1 maker-scaffold4907-snap-gene-0.19-mRNA-1 protein AED_0.29 eAED_0.29 QI_0|0.16|0.15|0.26|0.72|0.73|19|700|487
OG0000081	Branchiostoma_floridae_tr_A0A9J7MS62_A0A9J7MS62_BRAFL tr|A0A9J7MS62|A0A9J7MS62_BRAFL Cysteine-rich with EGF-like domain protein 2 OS=Branchiostoma floridae OX=7739 GN=LOC118416260 PE=3 SV=1	Schmidtea_mediterranea_maker-scaffold21973-augustus-gene-0.25-mRNA-1 maker-scaffold21973-augustus-gene-0.25-mRNA-1 protein AED_0.01 eAED_0.02 QI_2|0|0|1|0|0|2|0|715
OG0000085	Branchiostoma_floridae_tr_A0A9J7LLT0_A0A9J7LLT0_BRAFL tr|A0A9J7LLT0|A0A9J7LLT0_BRAFL Decorin-like OS=Branchiostoma floridae OX=7739 GN=LOC118421862 PE=4 SV=1, Branchiostoma_floridae_tr_A0A9J7MEX0_A0A9J7MEX0_BRAFL tr|A0A9J7MEX0|A0A9J7MEX0_BRAFL SLIT and NTRK-like protein 6 OS=Branchiostoma floridae OX=7739 GN=LOC118432097 PE=4 SV=1, Branchiostoma_floridae_tr_A0A9J7NCF6_A0A9J7NCF6_BRAFL tr|A0A9J7NCF6|A0A9J7NCF6_BRAFL Insulin-like growth factor-binding protein complex acid labile subunit OS=Branchiostoma floridae OX=7739 GN=LOC118431645 PE=4 SV=1, Branchiostoma_floridae_tr_A0A9J7NDL0_A0A9J7NDL0_BRAFL tr|A0A9J7NDL0|A0A9J7NDL0_BRAFL Fibroblast growth factor receptor-like 1 OS=Branchiostoma floridae OX=7739 GN=LOC118432098 PE=4 SV=1, Branchiostoma_floridae_tr_A0A9J7HS18_A0A9J7HS18_BRAFL tr|A0A9J7HS18|A0A9J7HS18_BRAFL Leucine-rich repeat-containing protein 15-like OS=Branchiostoma floridae OX=7739 GN=LOC118408290 PE=4 SV=1, Branchiostoma_floridae_tr_A0A9J7KXY9_A0A9J7KXY9_BRAFL tr|A0A9J7KXY9|A0A9J7KXY9_BRAFL Insulin-like growth factor-binding protein complex acid labile subunit OS=Branchiostoma floridae OX=7739 GN=LOC118412806 PE=4 SV=1, Branchiostoma_floridae_tr_A0A9J7MH78_A0A9J7MH78_BRAFL tr|A0A9J7MH78|A0A9J7MH78_BRAFL Chondroadherin-like OS=Branchiostoma floridae OX=7739 GN=LOC118410089 PE=4 SV=1, Branchiostoma_floridae_tr_A0A9J7L858_A0A9J7L858_BRAFL tr|A0A9J7L858|A0A9J7L858_BRAFL Leucine-rich repeat-containing protein 15-like OS=Branchiostoma floridae OX=7739 GN=LOC118416791 PE=4 SV=1, Branchiostoma_floridae_tr_A0A9J7L976_A0A9J7L976_BRAFL tr|A0A9J7L976|A0A9J7L976_BRAFL Immunoglobulin superfamily containing leucine-rich repeat protein-like OS=Branchiostoma floridae OX=7739 GN=LOC118416291 PE=4 SV=1, Branchiostoma_floridae_tr_A0A9J7MQA8_A0A9J7MQA8_BRAFL tr|A0A9J7MQA8|A0A9J7MQA8_BRAFL Leucine-rich repeat-containing protein 4-like OS=Branchiostoma floridae OX=7739 GN=LOC118415938 PE=4 SV=1, Branchiostoma_floridae_tr_A0A9J7L843_A0A9J7L843_BRAFL tr|A0A9J7L843|A0A9J7L843_BRAFL Leucine-rich repeat-containing protein 15-like OS=Branchiostoma floridae OX=7739 GN=LOC118416313 PE=4 SV=1, Branchiostoma_floridae_tr_A0A9J7L823_A0A9J7L823_BRAFL tr|A0A9J7L823|A0A9J7L823_BRAFL Insulin-like growth factor-binding protein complex acid labile subunit OS=Branchiostoma floridae OX=7739 GN=LOC118416639 PE=4 SV=1, Branchiostoma_floridae_tr_A0A9J7LF97_A0A9J7LF97_BRAFL tr|A0A9J7LF97|A0A9J7LF97_BRAFL Leucine-rich repeat-containing protein 24-like OS=Branchiostoma floridae OX=7739 GN=LOC118419460 PE=4 SV=1, Branchiostoma_floridae_tr_A0A9J7MW20_A0A9J7MW20_BRAFL tr|A0A9J7MW20|A0A9J7MW20_BRAFL Leucine-rich repeat-containing protein 24-like OS=Branchiostoma floridae OX=7739 GN=LOC118418940 PE=4 SV=1, Branchiostoma_floridae_tr_A0A9J7MSQ1_A0A9J7MSQ1_BRAFL tr|A0A9J7MSQ1|A0A9J7MSQ1_BRAFL Leucine-rich repeat-containing protein 15-like OS=Branchiostoma floridae OX=7739 GN=LOC118416477 PE=4 SV=1, Branchiostoma_floridae_tr_A0A9J7MQU9_A0A9J7MQU9_BRAFL tr|A0A9J7MQU9|A0A9J7MQU9_BRAFL Leucine-rich repeat-containing protein 15-like OS=Branchiostoma floridae OX=7739 GN=LOC118416370 PE=4 SV=1, Branchiostoma_floridae_tr_A0A9J7L6L4_A0A9J7L6L4_BRAFL tr|A0A9J7L6L4|A0A9J7L6L4_BRAFL Leucine-rich repeat and immunoglobulin-like domain containing-NOGO receptor-interacting protein 4 OS=Branchiostoma floridae OX=7739 GN=LOC118416307 PE=4 SV=1, Branchiostoma_floridae_tr_A0A9J7LCU1_A0A9J7LCU1_BRAFL tr|A0A9J7LCU1|A0A9J7LCU1_BRAFL Leucine-rich repeat and immunoglobulin-like domain-containing nogo receptor-interacting protein 2 OS=Branchiostoma floridae OX=7739 GN=LOC118418292 PE=4 SV=1, Branchiostoma_floridae_tr_A0A9J7LH18_A0A9J7LH18_BRAFL tr|A0A9J7LH18|A0A9J7LH18_BRAFL Leucine-rich repeat-containing protein 24-like OS=Branchiostoma floridae OX=7739 GN=LOC118420162 PE=4 SV=1, Branchiostoma_floridae_tr_A0A9J7LU84_A0A9J7LU84_BRAFL tr|A0A9J7LU84|A0A9J7LU84_BRAFL Leucine-rich repeat-containing protein 15-like OS=Branchiostoma floridae OX=7739 GN=LOC118424261 PE=4 SV=1, Branchiostoma_floridae_tr_A0A9J7HR76_A0A9J7HR76_BRAFL tr|A0A9J7HR76|A0A9J7HR76_BRAFL SLIT and NTRK-like protein 3 OS=Branchiostoma floridae OX=7739 GN=LOC118407533 PE=4 SV=1	Schmidtea_mediterranea_maker-scaffold29486-augustus-gene-0.14-mRNA-1 maker-scaffold29486-augustus-gene-0.14-mRNA-1 protein AED_0.26 eAED_0.30 QI_91|0.5|0.66|1|0|0.66|3|0|437
OG0000088	Branchiostoma_floridae_tr_A0A9J7L4B9_A0A9J7L4B9_BRAFL tr|A0A9J7L4B9|A0A9J7L4B9_BRAFL Spondin-1-like isoform X2 OS=Branchiostoma floridae OX=7739 GN=LOC118414975 PE=4 SV=1, Branchiostoma_floridae_tr_A0A9J7MPW0_A0A9J7MPW0_BRAFL tr|A0A9J7MPW0|A0A9J7MPW0_BRAFL Spondin-1-like isoform X1 OS=Branchiostoma floridae OX=7739 GN=LOC118414975 PE=4 SV=1, Branchiostoma_floridae_tr_A0A9J7LAE0_A0A9J7LAE0_BRAFL tr|A0A9J7LAE0|A0A9J7LAE0_BRAFL Uncharacterized protein LOC118416763 isoform X2 OS=Branchiostoma floridae OX=7739 GN=LOC118416763 PE=4 SV=1, Branchiostoma_floridae_tr_A0A9J7L817_A0A9J7L817_BRAFL tr|A0A9J7L817|A0A9J7L817_BRAFL Uncharacterized protein LOC118416763 isoform X1 OS=Branchiostoma floridae OX=7739 GN=LOC118416763 PE=4 SV=1, Branchiostoma_floridae_tr_A0A9J7HTD2_A0A9J7HTD2_BRAFL tr|A0A9J7HTD2|A0A9J7HTD2_BRAFL Spondin-1 OS=Branchiostoma floridae OX=7739 GN=LOC118406830 PE=4 SV=1	Schmidtea_mediterranea_maker-scaffold2562-augustus-gene-0.30-mRNA-1 maker-scaffold2562-augustus-gene-0.30-mRNA-1 protein AED_0.31 eAED_0.32 QI_0|1|0.75|1|0.66|0.5|4|179|609, Schmidtea_mediterranea_maker-scaffold2562-snap-gene-0.37-mRNA-1 maker-scaffold2562-snap-gene-0.37-mRNA-1 protein AED_0.07 eAED_0.09 QI_0|0.33|0.14|1|0.66|0.57|7|0|1127, Schmidtea_mediterranea_maker-scaffold2562-snap-gene-0.38-mRNA-1 maker-scaffold2562-snap-gene-0.38-mRNA-1 protein AED_0.62 eAED_0.63 QI_0|0|0|0.16|1|1|6|0|510, Schmidtea_mediterranea_maker-scaffold4198-snap-gene-0.24-mRNA-1 maker-scaffold4198-snap-gene-0.24-mRNA-1 protein AED_0.16 eAED_0.16 QI_0|0.5|0.2|0.8|0.75|0.8|5|0|730
OG0000093	Branchiostoma_floridae_tr_C3ZM26_C3ZM26_BRAFL tr|C3ZM26|C3ZM26_BRAFL Cystatin-B-like OS=Branchiostoma floridae OX=7739 GN=LOC118422806 PE=3 SV=1	Schmidtea_mediterranea_maker-scaffold13106-augustus-gene-0.13-mRNA-1 maker-scaffold13106-augustus-gene-0.13-mRNA-1 protein AED_0.40 eAED_0.40 QI_0|0|0|0.66|1|1|3|0|99, Schmidtea_mediterranea_maker-scaffold13106-augustus-gene-0.14-mRNA-1 maker-scaffold13106-augustus-gene-0.14-mRNA-1 protein AED_0.40 eAED_0.40 QI_0|0|0|0.66|1|1|3|0|99, Schmidtea_mediterranea_maker-scaffold9678-snap-gene-0.36-mRNA-1 maker-scaffold9678-snap-gene-0.36-mRNA-1 protein AED_0.24 eAED_0.24 QI_0|0.4|0.33|0.5|0.8|0.83|6|359|259, Schmidtea_mediterranea_augustus_masked-scaffold17106-processed-gene-0.0-mRNA-1 augustus_masked-scaffold17106-processed-gene-0.0-mRNA-1 protein AED_0.07 eAED_0.07 QI_0|0|0|1|1|1|2|0|77
OG0000094	Branchiostoma_floridae_tr_A0A9J7M114_A0A9J7M114_BRAFL tr|A0A9J7M114|A0A9J7M114_BRAFL Leucine-rich repeat and calponin homology domain-containing protein 1-like isoform X1 OS=Branchiostoma floridae OX=7739 GN=LOC118427250 PE=4 SV=1, Branchiostoma_floridae_tr_A0A9J7M2D0_A0A9J7M2D0_BRAFL tr|A0A9J7M2D0|A0A9J7M2D0_BRAFL Leucine-rich repeat and calponin homology domain-containing protein 1-like isoform X3 OS=Branchiostoma floridae OX=7739 GN=LOC118427250 PE=4 SV=1, Branchiostoma_floridae_tr_A0A9J7M3V6_A0A9J7M3V6_BRAFL tr|A0A9J7M3V6|A0A9J7M3V6_BRAFL Leucine-rich repeat and calponin homology domain-containing protein 1-like isoform X2 OS=Branchiostoma floridae OX=7739 GN=LOC118427250 PE=4 SV=1, Branchiostoma_floridae_tr_A0A9J7M1D4_A0A9J7M1D4_BRAFL tr|A0A9J7M1D4|A0A9J7M1D4_BRAFL Leucine-rich repeat and calponin homology domain-containing protein 1-like isoform X10 OS=Branchiostoma floridae OX=7739 GN=LOC118427250 PE=4 SV=1, Branchiostoma_floridae_tr_A0A9J7N7E9_A0A9J7N7E9_BRAFL tr|A0A9J7N7E9|A0A9J7N7E9_BRAFL Leucine-rich repeat and calponin homology domain-containing protein 1-like isoform X7 OS=Branchiostoma floridae OX=7739 GN=LOC118427250 PE=4 SV=1, Branchiostoma_floridae_tr_A0A9J7N4E4_A0A9J7N4E4_BRAFL tr|A0A9J7N4E4|A0A9J7N4E4_BRAFL Leucine-rich repeat and calponin homology domain-containing protein 1-like isoform X5 OS=Branchiostoma floridae OX=7739 GN=LOC118427250 PE=4 SV=1, Branchiostoma_floridae_tr_A0A9J7N616_A0A9J7N616_BRAFL tr|A0A9J7N616|A0A9J7N616_BRAFL Leucine-rich repeat and calponin homology domain-containing protein 1-like isoform X9 OS=Branchiostoma floridae OX=7739 GN=LOC118427250 PE=4 SV=1, Branchiostoma_floridae_tr_A0A9J7M1V7_A0A9J7M1V7_BRAFL tr|A0A9J7M1V7|A0A9J7M1V7_BRAFL Leucine-rich repeat and calponin homology domain-containing protein 1-like isoform X6 OS=Branchiostoma floridae OX=7739 GN=LOC118427250 PE=4 SV=1, Branchiostoma_floridae_tr_A0A9J7N7S6_A0A9J7N7S6_BRAFL tr|A0A9J7N7S6|A0A9J7N7S6_BRAFL Leucine-rich repeat and calponin homology domain-containing protein 1-like isoform X4 OS=Branchiostoma floridae OX=7739 GN=LOC118427250 PE=4 SV=1, Branchiostoma_floridae_tr_A0A9J7N7M4_A0A9J7N7M4_BRAFL tr|A0A9J7N7M4|A0A9J7N7M4_BRAFL DISP complex protein LRCH3-like isoform X8 OS=Branchiostoma floridae OX=7739 GN=LOC118427250 PE=4 SV=1	Schmidtea_mediterranea_maker-scaffold3545-snap-gene-0.55-mRNA-1 maker-scaffold3545-snap-gene-0.55-mRNA-1 protein AED_0.30 eAED_0.30 QI_137|0.57|0.5|1|0.28|0.25|8|0|278
OG0000101	Branchiostoma_floridae_tr_A0A9J7LIB1_A0A9J7LIB1_BRAFL tr|A0A9J7LIB1|A0A9J7LIB1_BRAFL Nephrin-like isoform X11 OS=Branchiostoma floridae OX=7739 GN=LOC118419693 PE=4 SV=1, Branchiostoma_floridae_tr_A0A9J7MUZ2_A0A9J7MUZ2_BRAFL tr|A0A9J7MUZ2|A0A9J7MUZ2_BRAFL Nephrin-like isoform X10 OS=Branchiostoma floridae OX=7739 GN=LOC118419693 PE=4 SV=1, Branchiostoma_floridae_tr_A0A9J7LI58_A0A9J7LI58_BRAFL tr|A0A9J7LI58|A0A9J7LI58_BRAFL Nephrin-like isoform X9 OS=Branchiostoma floridae OX=7739 GN=LOC118419693 PE=4 SV=1, Branchiostoma_floridae_tr_A0A9J7LHB4_A0A9J7LHB4_BRAFL tr|A0A9J7LHB4|A0A9J7LHB4_BRAFL Nephrin-like isoform X2 OS=Branchiostoma floridae OX=7739 GN=LOC118419693 PE=4 SV=1, Branchiostoma_floridae_tr_A0A9J7MUW3_A0A9J7MUW3_BRAFL tr|A0A9J7MUW3|A0A9J7MUW3_BRAFL Nephrin-like isoform X5 OS=Branchiostoma floridae OX=7739 GN=LOC118419693 PE=4 SV=1, Branchiostoma_floridae_tr_A0A9J7MX57_A0A9J7MX57_BRAFL tr|A0A9J7MX57|A0A9J7MX57_BRAFL Nephrin-like isoform X1 OS=Branchiostoma floridae OX=7739 GN=LOC118419693 PE=4 SV=1, Branchiostoma_floridae_tr_A0A9J7LG30_A0A9J7LG30_BRAFL tr|A0A9J7LG30|A0A9J7LG30_BRAFL Nephrin-like isoform X4 OS=Branchiostoma floridae OX=7739 GN=LOC118419693 PE=4 SV=1, Branchiostoma_floridae_tr_A0A9J7LHG4_A0A9J7LHG4_BRAFL tr|A0A9J7LHG4|A0A9J7LHG4_BRAFL Nephrin-like isoform X8 OS=Branchiostoma floridae OX=7739 GN=LOC118419693 PE=4 SV=1, Branchiostoma_floridae_tr_A0A9J7MX72_A0A9J7MX72_BRAFL tr|A0A9J7MX72|A0A9J7MX72_BRAFL Nephrin-like isoform X7 OS=Branchiostoma floridae OX=7739 GN=LOC118419693 PE=4 SV=1, Branchiostoma_floridae_tr_A0A9J7LG19_A0A9J7LG19_BRAFL tr|A0A9J7LG19|A0A9J7LG19_BRAFL Nephrin-like isoform X3 OS=Branchiostoma floridae OX=7739 GN=LOC118419693 PE=4 SV=1, Branchiostoma_floridae_tr_A0A9J7LFS9_A0A9J7LFS9_BRAFL tr|A0A9J7LFS9|A0A9J7LFS9_BRAFL Nephrin-like isoform X6 OS=Branchiostoma floridae OX=7739 GN=LOC118419693 PE=4 SV=1	Schmidtea_mediterranea_maker-scaffold1238-augustus-gene-0.40-mRNA-1 maker-scaffold1238-augustus-gene-0.40-mRNA-1 protein AED_0.10 eAED_0.10 QI_905|0.66|0.74|0.80|0.63|0.64|31|1053|2217
OG0000111	Branchiostoma_floridae_tr_A0A9J7M730_A0A9J7M730_BRAFL tr|A0A9J7M730|A0A9J7M730_BRAFL Activating transcription factor 7-interacting protein 1-like isoform X2 OS=Branchiostoma floridae OX=7739 GN=LOC118428681 PE=4 SV=1, Branchiostoma_floridae_tr_A0A9J7N9V5_A0A9J7N9V5_BRAFL tr|A0A9J7N9V5|A0A9J7N9V5_BRAFL Activating transcription factor 7-interacting protein 1-like isoform X4 OS=Branchiostoma floridae OX=7739 GN=LOC118428681 PE=4 SV=1, Branchiostoma_floridae_tr_A0A9J7M4Q8_A0A9J7M4Q8_BRAFL tr|A0A9J7M4Q8|A0A9J7M4Q8_BRAFL Activating transcription factor 7-interacting protein 1-like isoform X1 OS=Branchiostoma floridae OX=7739 GN=LOC118428681 PE=4 SV=1, Branchiostoma_floridae_tr_A0A9J7M501_A0A9J7M501_BRAFL tr|A0A9J7M501|A0A9J7M501_BRAFL Activating transcription factor 7-interacting protein 1-like isoform X10 OS=Branchiostoma floridae OX=7739 GN=LOC118428681 PE=4 SV=1, Branchiostoma_floridae_tr_A0A9J7M5T9_A0A9J7M5T9_BRAFL tr|A0A9J7M5T9|A0A9J7M5T9_BRAFL Activating transcription factor 7-interacting protein 1-like isoform X3 OS=Branchiostoma floridae OX=7739 GN=LOC118428681 PE=4 SV=1, Branchiostoma_floridae_tr_A0A9J7N643_A0A9J7N643_BRAFL tr|A0A9J7N643|A0A9J7N643_BRAFL Activating transcription factor 7-interacting protein 1-like isoform X5 OS=Branchiostoma floridae OX=7739 GN=LOC118428681 PE=4 SV=1, Branchiostoma_floridae_tr_A0A9J7M5H9_A0A9J7M5H9_BRAFL tr|A0A9J7M5H9|A0A9J7M5H9_BRAFL Mucin-5AC-like isoform X6 OS=Branchiostoma floridae OX=7739 GN=LOC118428681 PE=4 SV=1, Branchiostoma_floridae_tr_A0A9J7N8N9_A0A9J7N8N9_BRAFL tr|A0A9J7N8N9|A0A9J7N8N9_BRAFL Activating transcription factor 7-interacting protein 1-like isoform X7 OS=Branchiostoma floridae OX=7739 GN=LOC118428681 PE=4 SV=1, Branchiostoma_floridae_tr_A0A9J7N824_A0A9J7N824_BRAFL tr|A0A9J7N824|A0A9J7N824_BRAFL Flocculation protein FLO11-like isoform X9 OS=Branchiostoma floridae OX=7739 GN=LOC118428681 PE=4 SV=1, Branchiostoma_floridae_tr_A0A9J7N9G1_A0A9J7N9G1_BRAFL tr|A0A9J7N9G1|A0A9J7N9G1_BRAFL Flocculation protein FLO11-like isoform X8 OS=Branchiostoma floridae OX=7739 GN=LOC118428681 PE=4 SV=1	Schmidtea_mediterranea_maker-scaffold1368-snap-gene-2.30-mRNA-1 maker-scaffold1368-snap-gene-2.30-mRNA-1 protein AED_0.26 eAED_0.26 QI_0|0.5|0.57|1|0.16|0.57|7|375|480
OG0000113	Branchiostoma_floridae_tr_A0A9J7N5U9_A0A9J7N5U9_BRAFL tr|A0A9J7N5U9|A0A9J7N5U9_BRAFL Titin-like OS=Branchiostoma floridae OX=7739 GN=LOC118425904 PE=4 SV=1, Branchiostoma_floridae_tr_A0A9J7N5I6_A0A9J7N5I6_BRAFL tr|A0A9J7N5I6|A0A9J7N5I6_BRAFL Fibronectin type-III domain-containing protein 3A-like isoform X1 OS=Branchiostoma floridae OX=7739 GN=LOC118426863 PE=4 SV=1, Branchiostoma_floridae_tr_A0A9J7M0I1_A0A9J7M0I1_BRAFL tr|A0A9J7M0I1|A0A9J7M0I1_BRAFL Fibronectin type-III domain-containing protein 3A-like isoform X2 OS=Branchiostoma floridae OX=7739 GN=LOC118426863 PE=4 SV=1, Branchiostoma_floridae_tr_A0A9J7M1M0_A0A9J7M1M0_BRAFL tr|A0A9J7M1M0|A0A9J7M1M0_BRAFL Fibronectin type-III domain-containing protein 3A-like isoform X3 OS=Branchiostoma floridae OX=7739 GN=LOC118426863 PE=4 SV=1, Branchiostoma_floridae_tr_A0A9J7M1B4_A0A9J7M1B4_BRAFL tr|A0A9J7M1B4|A0A9J7M1B4_BRAFL Fibronectin type-III domain-containing protein 3A-like isoform X4 OS=Branchiostoma floridae OX=7739 GN=LOC118426863 PE=4 SV=1	Schmidtea_mediterranea_snap_masked-scaffold2036-processed-gene-0.23-mRNA-1 snap_masked-scaffold2036-processed-gene-0.23-mRNA-1 protein AED_0.14 eAED_0.14 QI_2086|0.25|0.23|0.28|1|1|21|0|917
OG0000114	Branchiostoma_floridae_tr_A0A9J7MRQ7_A0A9J7MRQ7_BRAFL tr|A0A9J7MRQ7|A0A9J7MRQ7_BRAFL Host cell factor 1-like OS=Branchiostoma floridae OX=7739 GN=LOC118415779 PE=4 SV=1	Schmidtea_mediterranea_maker-scaffold3444-snap-gene-0.54-mRNA-1 maker-scaffold3444-snap-gene-0.54-mRNA-1 protein AED_0.20 eAED_0.21 QI_0|0.71|0.62|1|0.71|0.62|8|144|1028
OG0000119	Branchiostoma_floridae_tr_A0A9J7KUK6_A0A9J7KUK6_BRAFL tr|A0A9J7KUK6|A0A9J7KUK6_BRAFL Leucine-rich repeat-containing protein 69-like OS=Branchiostoma floridae OX=7739 GN=LOC118411757 PE=4 SV=1	Schmidtea_mediterranea_maker-scaffold21724-augustus-gene-0.7-mRNA-1 maker-scaffold21724-augustus-gene-0.7-mRNA-1 protein AED_0.10 eAED_0.11 QI_23|0.77|0.9|1|0.88|0.9|10|308|704
OG0000120	Branchiostoma_floridae_tr_A0A9J7HNG3_A0A9J7HNG3_BRAFL tr|A0A9J7HNG3|A0A9J7HNG3_BRAFL Syndecan OS=Branchiostoma floridae OX=7739 GN=LOC118405168 PE=3 SV=1, Branchiostoma_floridae_tr_A0A9J7HJA4_A0A9J7HJA4_BRAFL tr|A0A9J7HJA4|A0A9J7HJA4_BRAFL Syndecan OS=Branchiostoma floridae OX=7739 GN=LOC118405168 PE=3 SV=1	Schmidtea_mediterranea_maker-scaffold913-augustus-gene-0.3-mRNA-1 maker-scaffold913-augustus-gene-0.3-mRNA-1 protein AED_0.01 eAED_0.01 QI_1098|1|1|1|0.5|0.33|3|511|65
OG0000129	Branchiostoma_floridae_tr_A0A9J7MDE0_A0A9J7MDE0_BRAFL tr|A0A9J7MDE0|A0A9J7MDE0_BRAFL Uncharacterized protein LOC118431640 OS=Branchiostoma floridae OX=7739 GN=LOC118431640 PE=4 SV=1	Schmidtea_mediterranea_maker-scaffold7616-snap-gene-0.60-mRNA-1 maker-scaffold7616-snap-gene-0.60-mRNA-1 protein AED_0.03 eAED_0.03 QI_28|0.94|0.94|1|0.62|0.75|36|74|3676
OG0000133	Branchiostoma_floridae_tr_A0A9J7LIP6_A0A9J7LIP6_BRAFL tr|A0A9J7LIP6|A0A9J7LIP6_BRAFL Leucine-rich repeat-containing protein 9-like OS=Branchiostoma floridae OX=7739 GN=LOC118420193 PE=4 SV=1, Branchiostoma_floridae_tr_A0A9J7L2S7_A0A9J7L2S7_BRAFL tr|A0A9J7L2S7|A0A9J7L2S7_BRAFL Leucine-rich repeat-containing protein 9-like isoform X2 OS=Branchiostoma floridae OX=7739 GN=LOC118414886 PE=4 SV=1, Branchiostoma_floridae_tr_A0A9J7L2R6_A0A9J7L2R6_BRAFL tr|A0A9J7L2R6|A0A9J7L2R6_BRAFL Leucine-rich repeat-containing protein 9-like isoform X1 OS=Branchiostoma floridae OX=7739 GN=LOC118414886 PE=4 SV=1	Schmidtea_mediterranea_maker-scaffold38628-augustus-gene-0.4-mRNA-1 maker-scaffold38628-augustus-gene-0.4-mRNA-1 protein AED_0.06 eAED_0.06 QI_0|0|0|0.5|1|1|2|0|1488, Schmidtea_mediterranea_maker-scaffold11278-augustus-gene-0.66-mRNA-1 maker-scaffold11278-augustus-gene-0.66-mRNA-1 protein AED_0.11 eAED_0.12 QI_0|0.44|0.4|0.9|0.88|0.9|10|504|578
OG0000134	Branchiostoma_floridae_tr_A0A9J7HUK3_A0A9J7HUK3_BRAFL tr|A0A9J7HUK3|A0A9J7HUK3_BRAFL Midasin OS=Branchiostoma floridae OX=7739 GN=LOC118407320 PE=3 SV=1	Schmidtea_mediterranea_maker-scaffold18052-snap-gene-0.20-mRNA-1 maker-scaffold18052-snap-gene-0.20-mRNA-1 protein AED_0.11 eAED_0.32 QI_0|0.6|0.57|0.85|0.6|0.71|21|37|4030
OG0000141	Branchiostoma_floridae_tr_A0A9J7LM83_A0A9J7LM83_BRAFL tr|A0A9J7LM83|A0A9J7LM83_BRAFL CCN family member 2-like OS=Branchiostoma floridae OX=7739 GN=LOC118421279 PE=3 SV=1	Schmidtea_mediterranea_maker-scaffold11956-snap-gene-0.30-mRNA-1 maker-scaffold11956-snap-gene-0.30-mRNA-1 protein AED_0.14 eAED_0.14 QI_111|0.75|0.8|0.8|0.5|0.6|5|0|273
OG0000152	Branchiostoma_floridae_tr_A0A9J7KGU3_A0A9J7KGU3_BRAFL tr|A0A9J7KGU3|A0A9J7KGU3_BRAFL Leucine-rich repeat protein SHOC-2-like OS=Branchiostoma floridae OX=7739 GN=LOC118403634 PE=4 SV=1	Schmidtea_mediterranea_maker-scaffold1162-snap-gene-0.32-mRNA-1 maker-scaffold1162-snap-gene-0.32-mRNA-1 protein AED_0.16 eAED_0.17 QI_0|0|0|0.66|0.5|0.66|9|0|492
OG0000156	Branchiostoma_floridae_tr_A0A9J7ML96_A0A9J7ML96_BRAFL tr|A0A9J7ML96|A0A9J7ML96_BRAFL Microfibrillar-associated protein 1-like OS=Branchiostoma floridae OX=7739 GN=LOC118412421 PE=3 SV=1	Schmidtea_mediterranea_maker-scaffold12426-augustus-gene-0.24-mRNA-1 maker-scaffold12426-augustus-gene-0.24-mRNA-1 protein AED_0.01 eAED_0.01 QI_102|1|1|1|0|0|2|41|456
OG0000166	Branchiostoma_floridae_tr_A0A9J7LDM2_A0A9J7LDM2_BRAFL tr|A0A9J7LDM2|A0A9J7LDM2_BRAFL Secreted frizzled-related protein 2-like isoform X2 OS=Branchiostoma floridae OX=7739 GN=LOC118418916 PE=3 SV=1, Branchiostoma_floridae_tr_A0A9J7LED5_A0A9J7LED5_BRAFL tr|A0A9J7LED5|A0A9J7LED5_BRAFL Secreted frizzled-related protein 2-like isoform X1 OS=Branchiostoma floridae OX=7739 GN=LOC118418916 PE=3 SV=1	Schmidtea_mediterranea_maker-scaffold2622-augustus-gene-0.20-mRNA-1 maker-scaffold2622-augustus-gene-0.20-mRNA-1 protein AED_0.00 eAED_0.00 QI_387|0.5|0.66|1|1|1|3|193|346
OG0000171	Branchiostoma_floridae_tr_A0A9J7K9A4_A0A9J7K9A4_BRAFL tr|A0A9J7K9A4|A0A9J7K9A4_BRAFL Peptide-N_4_-_N-acetyl-beta-glucosaminyl_asparagine amidase OS=Branchiostoma floridae OX=7739 GN=LOC118406119 PE=3 SV=1	Schmidtea_mediterranea_maker-scaffold1856-augustus-gene-1.52-mRNA-1 maker-scaffold1856-augustus-gene-1.52-mRNA-1 protein AED_0.15 eAED_0.15 QI_138|0.5|0.8|0.8|0.5|0.6|5|1177|445
OG0000177	Branchiostoma_floridae_tr_A0A9J7M8C8_A0A9J7M8C8_BRAFL tr|A0A9J7M8C8|A0A9J7M8C8_BRAFL Protein phosphatase 1 regulatory subunit 7-like OS=Branchiostoma floridae OX=7739 GN=LOC118430027 PE=4 SV=1	Schmidtea_mediterranea_maker-scaffold2908-augustus-gene-0.26-mRNA-1 maker-scaffold2908-augustus-gene-0.26-mRNA-1 protein AED_0.00 eAED_0.00 QI_148|1|1|1|1|1|2|57|318
