Orthogroup	Chordata_Amphioxiformes_Branchiostoma_floridae	Platyhelminthes_Tricladida_Schmidtea_mediterranea
OG0000028	Branchiostoma_floridae_tr_A0A9J7N7R3_A0A9J7N7R3_BRAFL tr|A0A9J7N7R3|A0A9J7N7R3_BRAFL Collagen alpha-5_IV_ chain-like isoform X5 OS=Branchiostoma floridae OX=7739 GN=LOC118427234 PE=4 SV=1, Branchiostoma_floridae_tr_A0A9J7M2A7_A0A9J7M2A7_BRAFL tr|A0A9J7M2A7|A0A9J7M2A7_BRAFL Collagen alpha-2_IV_ chain-like isoform X4 OS=Branchiostoma floridae OX=7739 GN=LOC118427234 PE=4 SV=1, Branchiostoma_floridae_tr_A0A9J7M0Z3_A0A9J7M0Z3_BRAFL tr|A0A9J7M0Z3|A0A9J7M0Z3_BRAFL Collagen alpha-5_IV_ chain-like isoform X1 OS=Branchiostoma floridae OX=7739 GN=LOC118427234 PE=4 SV=1, Branchiostoma_floridae_tr_A0A9J7M1L5_A0A9J7M1L5_BRAFL tr|A0A9J7M1L5|A0A9J7M1L5_BRAFL Collagen alpha-2_IV_ chain-like isoform X2 OS=Branchiostoma floridae OX=7739 GN=LOC118427234 PE=4 SV=1, Branchiostoma_floridae_tr_A0A9J7M3T5_A0A9J7M3T5_BRAFL tr|A0A9J7M3T5|A0A9J7M3T5_BRAFL Collagen alpha-5_IV_ chain-like isoform X3 OS=Branchiostoma floridae OX=7739 GN=LOC118427234 PE=4 SV=1, Branchiostoma_floridae_tr_A0A9J7N4D6_A0A9J7N4D6_BRAFL tr|A0A9J7N4D6|A0A9J7N4D6_BRAFL Collagen alpha-2_IV_ chain-like isoform X1 OS=Branchiostoma floridae OX=7739 GN=LOC118427235 PE=4 SV=1, Branchiostoma_floridae_tr_A0A9J7M1T8_A0A9J7M1T8_BRAFL tr|A0A9J7M1T8|A0A9J7M1T8_BRAFL Collagen alpha-2_IV_ chain-like isoform X2 OS=Branchiostoma floridae OX=7739 GN=LOC118427235 PE=4 SV=1, Branchiostoma_floridae_tr_A0A9J7MKI9_A0A9J7MKI9_BRAFL tr|A0A9J7MKI9|A0A9J7MKI9_BRAFL Collagen alpha-5_IV_ chain-like isoform X8 OS=Branchiostoma floridae OX=7739 GN=LOC118412003 PE=4 SV=1, Branchiostoma_floridae_tr_A0A9J7KUR8_A0A9J7KUR8_BRAFL tr|A0A9J7KUR8|A0A9J7KUR8_BRAFL Collagen alpha-5_IV_ chain-like isoform X15 OS=Branchiostoma floridae OX=7739 GN=LOC118412003 PE=4 SV=1, Branchiostoma_floridae_tr_A0A9J7MKD0_A0A9J7MKD0_BRAFL tr|A0A9J7MKD0|A0A9J7MKD0_BRAFL Collagen alpha-5_IV_ chain-like isoform X5 OS=Branchiostoma floridae OX=7739 GN=LOC118412003 PE=4 SV=1, Branchiostoma_floridae_tr_A0A9J7KUT7_A0A9J7KUT7_BRAFL tr|A0A9J7KUT7|A0A9J7KUT7_BRAFL Collagen alpha-5_IV_ chain-like isoform X1 OS=Branchiostoma floridae OX=7739 GN=LOC118412003 PE=4 SV=1, Branchiostoma_floridae_tr_A0A9J7KUQ8_A0A9J7KUQ8_BRAFL tr|A0A9J7KUQ8|A0A9J7KUQ8_BRAFL Collagen alpha-5_IV_ chain-like isoform X3 OS=Branchiostoma floridae OX=7739 GN=LOC118412003 PE=4 SV=1, Branchiostoma_floridae_tr_A0A9J7KTS6_A0A9J7KTS6_BRAFL tr|A0A9J7KTS6|A0A9J7KTS6_BRAFL Collagen alpha-5_IV_ chain-like isoform X4 OS=Branchiostoma floridae OX=7739 GN=LOC118412003 PE=4 SV=1, Branchiostoma_floridae_tr_A0A9J7KUJ9_A0A9J7KUJ9_BRAFL tr|A0A9J7KUJ9|A0A9J7KUJ9_BRAFL Collagen alpha-5_IV_ chain-like isoform X2 OS=Branchiostoma floridae OX=7739 GN=LOC118412003 PE=4 SV=1, Branchiostoma_floridae_tr_A0A9J7MKM1_A0A9J7MKM1_BRAFL tr|A0A9J7MKM1|A0A9J7MKM1_BRAFL Collagen alpha-5_IV_ chain-like isoform X10 OS=Branchiostoma floridae OX=7739 GN=LOC118412003 PE=4 SV=1, Branchiostoma_floridae_tr_A0A9J7MKD1_A0A9J7MKD1_BRAFL tr|A0A9J7MKD1|A0A9J7MKD1_BRAFL Collagen alpha-5_IV_ chain-like isoform X9 OS=Branchiostoma floridae OX=7739 GN=LOC118412003 PE=4 SV=1, Branchiostoma_floridae_tr_A0A9J7MK12_A0A9J7MK12_BRAFL tr|A0A9J7MK12|A0A9J7MK12_BRAFL Collagen alpha-5_IV_ chain-like isoform X6 OS=Branchiostoma floridae OX=7739 GN=LOC118412003 PE=4 SV=1, Branchiostoma_floridae_tr_A0A9J7KV95_A0A9J7KV95_BRAFL tr|A0A9J7KV95|A0A9J7KV95_BRAFL Collagen alpha-5_IV_ chain-like isoform X12 OS=Branchiostoma floridae OX=7739 GN=LOC118412003 PE=4 SV=1, Branchiostoma_floridae_tr_A0A9J7KTZ5_A0A9J7KTZ5_BRAFL tr|A0A9J7KTZ5|A0A9J7KTZ5_BRAFL Collagen alpha-5_IV_ chain-like isoform X11 OS=Branchiostoma floridae OX=7739 GN=LOC118412003 PE=4 SV=1, Branchiostoma_floridae_tr_A0A9J7KU95_A0A9J7KU95_BRAFL tr|A0A9J7KU95|A0A9J7KU95_BRAFL Collagen alpha-5_IV_ chain-like isoform X7 OS=Branchiostoma floridae OX=7739 GN=LOC118412003 PE=4 SV=1, Branchiostoma_floridae_tr_A0A9J7KTU4_A0A9J7KTU4_BRAFL tr|A0A9J7KTU4|A0A9J7KTU4_BRAFL Collagen alpha-5_IV_ chain-like isoform X13 OS=Branchiostoma floridae OX=7739 GN=LOC118412003 PE=4 SV=1, Branchiostoma_floridae_tr_A0A9J7KUK8_A0A9J7KUK8_BRAFL tr|A0A9J7KUK8|A0A9J7KUK8_BRAFL Collagen alpha-5_IV_ chain-like isoform X14 OS=Branchiostoma floridae OX=7739 GN=LOC118412003 PE=4 SV=1, Branchiostoma_floridae_tr_A0A9J7KUU8_A0A9J7KUU8_BRAFL tr|A0A9J7KUU8|A0A9J7KUU8_BRAFL Collagen alpha-3_IV_ chain-like isoform X3 OS=Branchiostoma floridae OX=7739 GN=LOC118412004 PE=4 SV=1, Branchiostoma_floridae_tr_A0A9J7KTT7_A0A9J7KTT7_BRAFL tr|A0A9J7KTT7|A0A9J7KTT7_BRAFL Collagen alpha-3_IV_ chain-like isoform X1 OS=Branchiostoma floridae OX=7739 GN=LOC118412004 PE=4 SV=1, Branchiostoma_floridae_tr_A0A9J7MKD5_A0A9J7MKD5_BRAFL tr|A0A9J7MKD5|A0A9J7MKD5_BRAFL Collagen alpha-4_IV_ chain-like isoform X4 OS=Branchiostoma floridae OX=7739 GN=LOC118412004 PE=4 SV=1, Branchiostoma_floridae_tr_A0A9J7MK17_A0A9J7MK17_BRAFL tr|A0A9J7MK17|A0A9J7MK17_BRAFL Collagen alpha-3_IV_ chain-like isoform X5 OS=Branchiostoma floridae OX=7739 GN=LOC118412004 PE=4 SV=1, Branchiostoma_floridae_tr_A0A9J7KVP6_A0A9J7KVP6_BRAFL tr|A0A9J7KVP6|A0A9J7KVP6_BRAFL Collagen alpha-5_IV_ chain-like isoform X2 OS=Branchiostoma floridae OX=7739 GN=LOC118412004 PE=4 SV=1, Branchiostoma_floridae_tr_A0A9J7HM09_A0A9J7HM09_BRAFL tr|A0A9J7HM09|A0A9J7HM09_BRAFL Collagen alpha-2_IV_ chain-like OS=Branchiostoma floridae OX=7739 GN=LOC118406236 PE=4 SV=1, Branchiostoma_floridae_tr_A0A9J7KHS0_A0A9J7KHS0_BRAFL tr|A0A9J7KHS0|A0A9J7KHS0_BRAFL Collagen alpha-5_IV_ chain-like OS=Branchiostoma floridae OX=7739 GN=LOC118404283 PE=4 SV=1, Branchiostoma_floridae_tr_A0A9J7HJH7_A0A9J7HJH7_BRAFL tr|A0A9J7HJH7|A0A9J7HJH7_BRAFL Collagen alpha-3_IV_ chain-like OS=Branchiostoma floridae OX=7739 GN=LOC118405413 PE=4 SV=1, Branchiostoma_floridae_tr_A0A9J7HLU0_A0A9J7HLU0_BRAFL tr|A0A9J7HLU0|A0A9J7HLU0_BRAFL Collagen alpha-2_IV_ chain-like OS=Branchiostoma floridae OX=7739 GN=LOC118405341 PE=4 SV=1, Branchiostoma_floridae_tr_A0A9J7HIB0_A0A9J7HIB0_BRAFL tr|A0A9J7HIB0|A0A9J7HIB0_BRAFL Collagen alpha-4_IV_ chain-like OS=Branchiostoma floridae OX=7739 GN=LOC118403826 PE=4 SV=1, Branchiostoma_floridae_tr_A0A9J7MHH7_A0A9J7MHH7_BRAFL tr|A0A9J7MHH7|A0A9J7MHH7_BRAFL Collagen alpha-2_IV_ chain-like OS=Branchiostoma floridae OX=7739 GN=LOC118432728 PE=4 SV=1, Branchiostoma_floridae_tr_A0A9J7M6J1_A0A9J7M6J1_BRAFL tr|A0A9J7M6J1|A0A9J7M6J1_BRAFL Collagen alpha-1_IV_ chain-like OS=Branchiostoma floridae OX=7739 GN=LOC118429384 PE=4 SV=1	Schmidtea_mediterranea_maker-scaffold11455-augustus-gene-0.21-mRNA-1 maker-scaffold11455-augustus-gene-0.21-mRNA-1 protein AED_0.05 eAED_0.08 QI_0|0|0|1|1|1|2|0|135, Schmidtea_mediterranea_maker-scaffold17765-snap-gene-0.7-mRNA-1 maker-scaffold17765-snap-gene-0.7-mRNA-1 protein AED_0.08 eAED_0.08 QI_46|0.92|0.89|0.96|0.96|0.96|29|0|1699, Schmidtea_mediterranea_maker-scaffold7038-augustus-gene-0.53-mRNA-1 maker-scaffold7038-augustus-gene-0.53-mRNA-1 protein AED_0.08 eAED_0.08 QI_168|0.93|0.86|1|1|1|30|0|2199, Schmidtea_mediterranea_maker-scaffold1323-snap-gene-0.42-mRNA-1 maker-scaffold1323-snap-gene-0.42-mRNA-1 protein AED_0.11 eAED_0.13 QI_0|0.91|0.88|1|0.88|0.94|36|391|2129, Schmidtea_mediterranea_maker-scaffold32825-augustus-gene-0.19-mRNA-1 maker-scaffold32825-augustus-gene-0.19-mRNA-1 protein AED_0.05 eAED_0.05 QI_61|0.92|0.96|0.96|0.96|0.96|27|28|1813
OG0000029	Branchiostoma_floridae_tr_A0A9J7MID4_A0A9J7MID4_BRAFL tr|A0A9J7MID4|A0A9J7MID4_BRAFL Contactin-associated protein-like 2 isoform X2 OS=Branchiostoma floridae OX=7739 GN=LOC118432761 PE=3 SV=1, Branchiostoma_floridae_tr_A0A9J7MFG2_A0A9J7MFG2_BRAFL tr|A0A9J7MFG2|A0A9J7MFG2_BRAFL Contactin-associated protein-like 2 isoform X3 OS=Branchiostoma floridae OX=7739 GN=LOC118432761 PE=3 SV=1, Branchiostoma_floridae_tr_A0A9J7MGG8_A0A9J7MGG8_BRAFL tr|A0A9J7MGG8|A0A9J7MGG8_BRAFL Contactin-associated protein-like 2 isoform X1 OS=Branchiostoma floridae OX=7739 GN=LOC118432761 PE=3 SV=1, Branchiostoma_floridae_tr_A0A9J7MFG4_A0A9J7MFG4_BRAFL tr|A0A9J7MFG4|A0A9J7MFG4_BRAFL Contactin-associated protein-like 5 isoform X4 OS=Branchiostoma floridae OX=7739 GN=LOC118432761 PE=3 SV=1	Schmidtea_mediterranea_maker-scaffold3932-snap-gene-0.36-mRNA-1 maker-scaffold3932-snap-gene-0.36-mRNA-1 protein AED_0.21 eAED_0.29 QI_0|0.75|0.69|1|0.58|0.92|13|170|790
OG0000030	Branchiostoma_floridae_tr_A0A9J7HFR1_A0A9J7HFR1_BRAFL tr|A0A9J7HFR1|A0A9J7HFR1_BRAFL ADAM 17-like protease isoform X1 OS=Branchiostoma floridae OX=7739 GN=LOC118404014 PE=4 SV=1, Branchiostoma_floridae_tr_A0A9J7HIE3_A0A9J7HIE3_BRAFL tr|A0A9J7HIE3|A0A9J7HIE3_BRAFL ADAM 17-like protease isoform X5 OS=Branchiostoma floridae OX=7739 GN=LOC118404014 PE=4 SV=1, Branchiostoma_floridae_tr_A0A9J7HIR6_A0A9J7HIR6_BRAFL tr|A0A9J7HIR6|A0A9J7HIR6_BRAFL ADAM 17-like protease isoform X2 OS=Branchiostoma floridae OX=7739 GN=LOC118404014 PE=4 SV=1, Branchiostoma_floridae_tr_A0A9J7KH78_A0A9J7KH78_BRAFL tr|A0A9J7KH78|A0A9J7KH78_BRAFL ADAM 17-like protease isoform X3 OS=Branchiostoma floridae OX=7739 GN=LOC118404014 PE=4 SV=1, Branchiostoma_floridae_tr_A0A9J7HIZ3_A0A9J7HIZ3_BRAFL tr|A0A9J7HIZ3|A0A9J7HIZ3_BRAFL ADAM 17-like protease isoform X4 OS=Branchiostoma floridae OX=7739 GN=LOC118404014 PE=4 SV=1	Schmidtea_mediterranea_maker-scaffold6061-augustus-gene-1.43-mRNA-1 maker-scaffold6061-augustus-gene-1.43-mRNA-1 protein AED_0.27 eAED_0.28 QI_0|0.64|0.61|0.94|0.58|0.88|18|137|784
OG0000030	Branchiostoma_floridae_tr_A0A9J7KU24_A0A9J7KU24_BRAFL tr|A0A9J7KU24|A0A9J7KU24_BRAFL Disintegrin and metalloproteinase domain-containing protein 10-like OS=Branchiostoma floridae OX=7739 GN=LOC118412071 PE=4 SV=1, Branchiostoma_floridae_tr_A0A9J7MJR0_A0A9J7MJR0_BRAFL tr|A0A9J7MJR0|A0A9J7MJR0_BRAFL Disintegrin and metalloproteinase domain-containing protein 10-like isoform X1 OS=Branchiostoma floridae OX=7739 GN=LOC118411340 PE=4 SV=1, Branchiostoma_floridae_tr_A0A9J7KS49_A0A9J7KS49_BRAFL tr|A0A9J7KS49|A0A9J7KS49_BRAFL Disintegrin and metalloproteinase domain-containing protein 10-like isoform X2 OS=Branchiostoma floridae OX=7739 GN=LOC118411340 PE=4 SV=1, Branchiostoma_floridae_tr_A0A9J7KTJ1_A0A9J7KTJ1_BRAFL tr|A0A9J7KTJ1|A0A9J7KTJ1_BRAFL Disintegrin and metalloproteinase domain-containing protein 10-like isoform X1 OS=Branchiostoma floridae OX=7739 GN=LOC118411919 PE=4 SV=1, Branchiostoma_floridae_tr_A0A9J7KUJ7_A0A9J7KUJ7_BRAFL tr|A0A9J7KUJ7|A0A9J7KUJ7_BRAFL Disintegrin and metalloproteinase domain-containing protein 10-like isoform X3 OS=Branchiostoma floridae OX=7739 GN=LOC118411919 PE=4 SV=1, Branchiostoma_floridae_tr_A0A9J7KVF6_A0A9J7KVF6_BRAFL tr|A0A9J7KVF6|A0A9J7KVF6_BRAFL Disintegrin and metalloproteinase domain-containing protein 10-like isoform X2 OS=Branchiostoma floridae OX=7739 GN=LOC118411919 PE=4 SV=1	Schmidtea_mediterranea_maker-scaffold4771-augustus-gene-0.17-mRNA-1 maker-scaffold4771-augustus-gene-0.17-mRNA-1 protein AED_0.15 eAED_0.19 QI_0|0|0|0.83|0.8|1|6|0|430
OG0000040	Branchiostoma_floridae_tr_A0A9J7L1E1_A0A9J7L1E1_BRAFL tr|A0A9J7L1E1|A0A9J7L1E1_BRAFL Kazal-type serine protease inhibitor domain-containing protein 1-like isoform X5 OS=Branchiostoma floridae OX=7739 GN=LOC118414154 PE=4 SV=1, Branchiostoma_floridae_tr_A0A9J7L057_A0A9J7L057_BRAFL tr|A0A9J7L057|A0A9J7L057_BRAFL Uncharacterized protein LOC118413580 OS=Branchiostoma floridae OX=7739 GN=LOC118413580 PE=4 SV=1, Branchiostoma_floridae_tr_A0A9J7L2C5_A0A9J7L2C5_BRAFL tr|A0A9J7L2C5|A0A9J7L2C5_BRAFL Insulin-like growth factor-binding protein-like 1 OS=Branchiostoma floridae OX=7739 GN=LOC118414160 PE=4 SV=1	Schmidtea_mediterranea_maker-scaffold2624-snap-gene-0.62-mRNA-1 maker-scaffold2624-snap-gene-0.62-mRNA-1 protein AED_0.00 eAED_0.00 QI_163|1|1|1|1|1|3|260|253
OG0000041	Branchiostoma_floridae_tr_A0A9J7MYP6_A0A9J7MYP6_BRAFL tr|A0A9J7MYP6|A0A9J7MYP6_BRAFL LOW QUALITY PROTEIN_ von Willebrand factor A domain-containing protein 5A-like OS=Branchiostoma floridae OX=7739 GN=LOC118420707 PE=4 SV=1, Branchiostoma_floridae_tr_A0A9J7MAS6_A0A9J7MAS6_BRAFL tr|A0A9J7MAS6|A0A9J7MAS6_BRAFL von Willebrand factor A domain-containing protein 5B1-like OS=Branchiostoma floridae OX=7739 GN=LOC118430868 PE=4 SV=1, Branchiostoma_floridae_tr_A0A9J7MD33_A0A9J7MD33_BRAFL tr|A0A9J7MD33|A0A9J7MD33_BRAFL von Willebrand factor A domain-containing protein 5B1-like OS=Branchiostoma floridae OX=7739 GN=LOC118430871 PE=4 SV=1	Schmidtea_mediterranea_snap_masked-scaffold19108-processed-gene-0.1-mRNA-1 snap_masked-scaffold19108-processed-gene-0.1-mRNA-1 protein AED_0.91 eAED_0.96 QI_0|0|0|0.41|1|1|12|0|406
OG0000042	Branchiostoma_floridae_tr_A0A9J7HWK5_A0A9J7HWK5_BRAFL tr|A0A9J7HWK5|A0A9J7HWK5_BRAFL Neurexin-1-like isoform X1 OS=Branchiostoma floridae OX=7739 GN=LOC118408405 PE=4 SV=1, Branchiostoma_floridae_tr_A0A9J7HTK5_A0A9J7HTK5_BRAFL tr|A0A9J7HTK5|A0A9J7HTK5_BRAFL Neurexin-1-like isoform X2 OS=Branchiostoma floridae OX=7739 GN=LOC118408405 PE=4 SV=1, Branchiostoma_floridae_tr_A0A9J7KLK8_A0A9J7KLK8_BRAFL tr|A0A9J7KLK8|A0A9J7KLK8_BRAFL Neurexin-1-like isoform X6 OS=Branchiostoma floridae OX=7739 GN=LOC118408405 PE=4 SV=1, Branchiostoma_floridae_tr_A0A9J7HVT4_A0A9J7HVT4_BRAFL tr|A0A9J7HVT4|A0A9J7HVT4_BRAFL Neurexin-1-like isoform X10 OS=Branchiostoma floridae OX=7739 GN=LOC118408405 PE=4 SV=1, Branchiostoma_floridae_tr_A0A9J7HSP6_A0A9J7HSP6_BRAFL tr|A0A9J7HSP6|A0A9J7HSP6_BRAFL Neurexin-3-like isoform X20 OS=Branchiostoma floridae OX=7739 GN=LOC118408405 PE=4 SV=1, Branchiostoma_floridae_tr_A0A9J7HWL3_A0A9J7HWL3_BRAFL tr|A0A9J7HWL3|A0A9J7HWL3_BRAFL Neurexin-1-like isoform X13 OS=Branchiostoma floridae OX=7739 GN=LOC118408405 PE=4 SV=1, Branchiostoma_floridae_tr_A0A9J7HSN5_A0A9J7HSN5_BRAFL tr|A0A9J7HSN5|A0A9J7HSN5_BRAFL Neurexin-3-like isoform X9 OS=Branchiostoma floridae OX=7739 GN=LOC118408405 PE=4 SV=1, Branchiostoma_floridae_tr_A0A9J7KIJ9_A0A9J7KIJ9_BRAFL tr|A0A9J7KIJ9|A0A9J7KIJ9_BRAFL Neurexin-1-like isoform X3 OS=Branchiostoma floridae OX=7739 GN=LOC118408405 PE=4 SV=1, Branchiostoma_floridae_tr_A0A9J7KC96_A0A9J7KC96_BRAFL tr|A0A9J7KC96|A0A9J7KC96_BRAFL Neurexin-1-like isoform X5 OS=Branchiostoma floridae OX=7739 GN=LOC118408405 PE=4 SV=1, Branchiostoma_floridae_tr_A0A9J7HVA6_A0A9J7HVA6_BRAFL tr|A0A9J7HVA6|A0A9J7HVA6_BRAFL Neurexin-1-like isoform X4 OS=Branchiostoma floridae OX=7739 GN=LOC118408405 PE=4 SV=1, Branchiostoma_floridae_tr_A0A9J7HVB6_A0A9J7HVB6_BRAFL tr|A0A9J7HVB6|A0A9J7HVB6_BRAFL Neurexin-1-like isoform X16 OS=Branchiostoma floridae OX=7739 GN=LOC118408405 PE=4 SV=1, Branchiostoma_floridae_tr_A0A9J7HVA1_A0A9J7HVA1_BRAFL tr|A0A9J7HVA1|A0A9J7HVA1_BRAFL Neurexin-1-like isoform X11 OS=Branchiostoma floridae OX=7739 GN=LOC118408405 PE=4 SV=1, Branchiostoma_floridae_tr_A0A9J7HV32_A0A9J7HV32_BRAFL tr|A0A9J7HV32|A0A9J7HV32_BRAFL Neurexin-3-like isoform X22 OS=Branchiostoma floridae OX=7739 GN=LOC118408405 PE=4 SV=1, Branchiostoma_floridae_tr_A0A9J7KLH7_A0A9J7KLH7_BRAFL tr|A0A9J7KLH7|A0A9J7KLH7_BRAFL Neurexin-3-like isoform X23 OS=Branchiostoma floridae OX=7739 GN=LOC118408405 PE=4 SV=1, Branchiostoma_floridae_tr_A0A9J7KLL0_A0A9J7KLL0_BRAFL tr|A0A9J7KLL0|A0A9J7KLL0_BRAFL Neurexin-1-like isoform X18 OS=Branchiostoma floridae OX=7739 GN=LOC118408405 PE=4 SV=1, Branchiostoma_floridae_tr_A0A9J7HVB3_A0A9J7HVB3_BRAFL tr|A0A9J7HVB3|A0A9J7HVB3_BRAFL Neurexin-3-like isoform X25 OS=Branchiostoma floridae OX=7739 GN=LOC118408405 PE=4 SV=1, Branchiostoma_floridae_tr_A0A9J7HWM1_A0A9J7HWM1_BRAFL tr|A0A9J7HWM1|A0A9J7HWM1_BRAFL Neurexin-3-like isoform X27 OS=Branchiostoma floridae OX=7739 GN=LOC118408405 PE=4 SV=1, Branchiostoma_floridae_tr_A0A9J7HT59_A0A9J7HT59_BRAFL tr|A0A9J7HT59|A0A9J7HT59_BRAFL Neurexin-3-like isoform X26 OS=Branchiostoma floridae OX=7739 GN=LOC118408405 PE=4 SV=1, Branchiostoma_floridae_tr_A0A9J7HVT9_A0A9J7HVT9_BRAFL tr|A0A9J7HVT9|A0A9J7HVT9_BRAFL Neurexin-3-like isoform X24 OS=Branchiostoma floridae OX=7739 GN=LOC118408405 PE=4 SV=1, Branchiostoma_floridae_tr_A0A9J7HSN2_A0A9J7HSN2_BRAFL tr|A0A9J7HSN2|A0A9J7HSN2_BRAFL Neurexin-3-like isoform X21 OS=Branchiostoma floridae OX=7739 GN=LOC118408405 PE=4 SV=1, Branchiostoma_floridae_tr_A0A9J7KCA0_A0A9J7KCA0_BRAFL tr|A0A9J7KCA0|A0A9J7KCA0_BRAFL Neurexin-1-like isoform X17 OS=Branchiostoma floridae OX=7739 GN=LOC118408405 PE=4 SV=1, Branchiostoma_floridae_tr_A0A9J7HT50_A0A9J7HT50_BRAFL tr|A0A9J7HT50|A0A9J7HT50_BRAFL Neurexin-1-like isoform X12 OS=Branchiostoma floridae OX=7739 GN=LOC118408405 PE=4 SV=1, Branchiostoma_floridae_tr_A0A9J7KL39_A0A9J7KL39_BRAFL tr|A0A9J7KL39|A0A9J7KL39_BRAFL Neurexin-3-like isoform X19 OS=Branchiostoma floridae OX=7739 GN=LOC118408405 PE=4 SV=1, Branchiostoma_floridae_tr_A0A9J7KIK3_A0A9J7KIK3_BRAFL tr|A0A9J7KIK3|A0A9J7KIK3_BRAFL Neurexin-1-like isoform X15 OS=Branchiostoma floridae OX=7739 GN=LOC118408405 PE=4 SV=1, Branchiostoma_floridae_tr_A0A9J7HTL7_A0A9J7HTL7_BRAFL tr|A0A9J7HTL7|A0A9J7HTL7_BRAFL Neurexin-1-like isoform X14 OS=Branchiostoma floridae OX=7739 GN=LOC118408405 PE=4 SV=1, Branchiostoma_floridae_tr_A0A9J7KL38_A0A9J7KL38_BRAFL tr|A0A9J7KL38|A0A9J7KL38_BRAFL Neurexin-1-like isoform X7 OS=Branchiostoma floridae OX=7739 GN=LOC118408405 PE=4 SV=1, Branchiostoma_floridae_tr_A0A9J7HSH5_A0A9J7HSH5_BRAFL tr|A0A9J7HSH5|A0A9J7HSH5_BRAFL Neurexin-1-like isoform X8 OS=Branchiostoma floridae OX=7739 GN=LOC118408405 PE=4 SV=1, Branchiostoma_floridae_tr_A0A9J7KIK7_A0A9J7KIK7_BRAFL tr|A0A9J7KIK7|A0A9J7KIK7_BRAFL Neurexin-3-like isoform X29 OS=Branchiostoma floridae OX=7739 GN=LOC118408405 PE=4 SV=1, Branchiostoma_floridae_tr_A0A9J7HVC7_A0A9J7HVC7_BRAFL tr|A0A9J7HVC7|A0A9J7HVC7_BRAFL Neurexin-3-like isoform X30 OS=Branchiostoma floridae OX=7739 GN=LOC118408405 PE=4 SV=1, Branchiostoma_floridae_tr_A0A9J7HTM9_A0A9J7HTM9_BRAFL tr|A0A9J7HTM9|A0A9J7HTM9_BRAFL Neurexin-3-like isoform X28 OS=Branchiostoma floridae OX=7739 GN=LOC118408405 PE=4 SV=1	Schmidtea_mediterranea_maker-scaffold25981-snap-gene-1.52-mRNA-1 maker-scaffold25981-snap-gene-1.52-mRNA-1 protein AED_0.29 eAED_0.29 QI_0|0.25|0|0.4|1|1|5|0|226, Schmidtea_mediterranea_maker-scaffold2082-snap-gene-0.19-mRNA-1 maker-scaffold2082-snap-gene-0.19-mRNA-1 protein AED_0.75 eAED_0.75 QI_0|0|0|0.04|1|1|24|0|703
OG0000045	Branchiostoma_floridae_tr_A0A9J7KLA1_A0A9J7KLA1_BRAFL tr|A0A9J7KLA1|A0A9J7KLA1_BRAFL Laminin subunit alpha-2-like OS=Branchiostoma floridae OX=7739 GN=LOC118408193 PE=4 SV=1	Schmidtea_mediterranea_maker-scaffold2580-snap-gene-1.69-mRNA-1 maker-scaffold2580-snap-gene-1.69-mRNA-1 protein AED_0.06 eAED_0.08 QI_112|0.76|0.75|0.96|0.48|0.73|53|0|2966
OG0000047	Branchiostoma_floridae_tr_A0A9J7LX21_A0A9J7LX21_BRAFL tr|A0A9J7LX21|A0A9J7LX21_BRAFL Ferric-chelate reductase 1 OS=Branchiostoma floridae OX=7739 GN=LOC118425143 PE=4 SV=1, Branchiostoma_floridae_tr_A0A9J7LVW4_A0A9J7LVW4_BRAFL tr|A0A9J7LVW4|A0A9J7LVW4_BRAFL Defense protein Hdd11 OS=Branchiostoma floridae OX=7739 GN=LOC118424641 PE=4 SV=1, Branchiostoma_floridae_tr_A0A9J7LWX3_A0A9J7LWX3_BRAFL tr|A0A9J7LWX3|A0A9J7LWX3_BRAFL Defense protein Hdd11 OS=Branchiostoma floridae OX=7739 GN=LOC118425071 PE=4 SV=1, Branchiostoma_floridae_tr_A0A9J7MR60_A0A9J7MR60_BRAFL tr|A0A9J7MR60|A0A9J7MR60_BRAFL Uncharacterized protein LOC118415620 OS=Branchiostoma floridae OX=7739 GN=LOC118415620 PE=4 SV=1, Branchiostoma_floridae_tr_A0A9J7LUX0_A0A9J7LUX0_BRAFL tr|A0A9J7LUX0|A0A9J7LUX0_BRAFL Defense protein 3 OS=Branchiostoma floridae OX=7739 GN=LOC118425057 PE=4 SV=1, Branchiostoma_floridae_tr_A0A9J7M1C4_A0A9J7M1C4_BRAFL tr|A0A9J7M1C4|A0A9J7M1C4_BRAFL Ferric-chelate reductase 1 isoform X2 OS=Branchiostoma floridae OX=7739 GN=LOC118427246 PE=4 SV=1, Branchiostoma_floridae_tr_A0A9J7N7E6_A0A9J7N7E6_BRAFL tr|A0A9J7N7E6|A0A9J7N7E6_BRAFL Ferric-chelate reductase 1 isoform X1 OS=Branchiostoma floridae OX=7739 GN=LOC118427246 PE=4 SV=1, Branchiostoma_floridae_tr_A0A9J7M1U8_A0A9J7M1U8_BRAFL tr|A0A9J7M1U8|A0A9J7M1U8_BRAFL Ferric-chelate reductase 1 OS=Branchiostoma floridae OX=7739 GN=LOC118427245 PE=4 SV=1, Branchiostoma_floridae_tr_A0A9J7NCS1_A0A9J7NCS1_BRAFL tr|A0A9J7NCS1|A0A9J7NCS1_BRAFL Ferric-chelate reductase 1 isoform X1 OS=Branchiostoma floridae OX=7739 GN=LOC118431394 PE=3 SV=1, Branchiostoma_floridae_tr_A0A9J7MCP1_A0A9J7MCP1_BRAFL tr|A0A9J7MCP1|A0A9J7MCP1_BRAFL Ferric-chelate reductase 1-like isoform X3 OS=Branchiostoma floridae OX=7739 GN=LOC118431394 PE=3 SV=1, Branchiostoma_floridae_tr_A0A9J7MC15_A0A9J7MC15_BRAFL tr|A0A9J7MC15|A0A9J7MC15_BRAFL Ferric-chelate reductase 1 isoform X2 OS=Branchiostoma floridae OX=7739 GN=LOC118431394 PE=3 SV=1, Branchiostoma_floridae_tr_A0A9J7ME13_A0A9J7ME13_BRAFL tr|A0A9J7ME13|A0A9J7ME13_BRAFL Ferric-chelate reductase 1-like OS=Branchiostoma floridae OX=7739 GN=LOC118432081 PE=3 SV=1, Branchiostoma_floridae_tr_A0A9J7MXT4_A0A9J7MXT4_BRAFL tr|A0A9J7MXT4|A0A9J7MXT4_BRAFL Cell wall protein DAN4-like OS=Branchiostoma floridae OX=7739 GN=LOC118420157 PE=4 SV=1, Branchiostoma_floridae_tr_A0A9J7MXW7_A0A9J7MXW7_BRAFL tr|A0A9J7MXW7|A0A9J7MXW7_BRAFL Ferric-chelate reductase 1 OS=Branchiostoma floridae OX=7739 GN=LOC118420153 PE=4 SV=1, Branchiostoma_floridae_tr_A0A9J7LSX2_A0A9J7LSX2_BRAFL tr|A0A9J7LSX2|A0A9J7LSX2_BRAFL Defense protein 3 isoform X1 OS=Branchiostoma floridae OX=7739 GN=LOC118424086 PE=4 SV=1, Branchiostoma_floridae_tr_A0A9J7LUM3_A0A9J7LUM3_BRAFL tr|A0A9J7LUM3|A0A9J7LUM3_BRAFL Defense protein 3 isoform X2 OS=Branchiostoma floridae OX=7739 GN=LOC118424086 PE=4 SV=1, Branchiostoma_floridae_tr_C3YEZ5_C3YEZ5_BRAFL tr|C3YEZ5|C3YEZ5_BRAFL Defense protein 3 OS=Branchiostoma floridae OX=7739 GN=LOC118405801 PE=4 SV=1, Branchiostoma_floridae_tr_C3YEZ4_C3YEZ4_BRAFL tr|C3YEZ4|C3YEZ4_BRAFL Defense protein 1 OS=Branchiostoma floridae OX=7739 GN=LOC118405802 PE=4 SV=1, Branchiostoma_floridae_tr_A0A9J7KI89_A0A9J7KI89_BRAFL tr|A0A9J7KI89|A0A9J7KI89_BRAFL Ferric-chelate reductase 1 OS=Branchiostoma floridae OX=7739 GN=LOC118405440 PE=4 SV=1, Branchiostoma_floridae_tr_A0A9J7N0W3_A0A9J7N0W3_BRAFL tr|A0A9J7N0W3|A0A9J7N0W3_BRAFL Ferric-chelate reductase 1 OS=Branchiostoma floridae OX=7739 GN=LOC118424179 PE=4 SV=1, Branchiostoma_floridae_tr_A0A9J7LXC4_A0A9J7LXC4_BRAFL tr|A0A9J7LXC4|A0A9J7LXC4_BRAFL Ferric-chelate reductase 1 isoform X1 OS=Branchiostoma floridae OX=7739 GN=LOC118424518 PE=4 SV=1, Branchiostoma_floridae_tr_A0A9J7LUR9_A0A9J7LUR9_BRAFL tr|A0A9J7LUR9|A0A9J7LUR9_BRAFL Defense protein 3 isoform X2 OS=Branchiostoma floridae OX=7739 GN=LOC118424518 PE=4 SV=1	Schmidtea_mediterranea_maker-scaffold497-augustus-gene-0.36-mRNA-1 maker-scaffold497-augustus-gene-0.36-mRNA-1 protein AED_0.09 eAED_0.09 QI_0|0.71|0.8|0.86|0.35|0.53|15|149|652
OG0000048	Branchiostoma_floridae_tr_A0A9J7NA92_A0A9J7NA92_BRAFL tr|A0A9J7NA92|A0A9J7NA92_BRAFL Insulin-like growth factor-binding protein complex acid labile subunit OS=Branchiostoma floridae OX=7739 GN=LOC118431643 PE=4 SV=1, Branchiostoma_floridae_tr_A0A9J7MT30_A0A9J7MT30_BRAFL tr|A0A9J7MT30|A0A9J7MT30_BRAFL Leucine-rich repeat-containing protein 15-like OS=Branchiostoma floridae OX=7739 GN=LOC118418204 PE=4 SV=1, Branchiostoma_floridae_tr_A0A9J7KPF8_A0A9J7KPF8_BRAFL tr|A0A9J7KPF8|A0A9J7KPF8_BRAFL Platelet glycoprotein V-like OS=Branchiostoma floridae OX=7739 GN=LOC118410233 PE=4 SV=1, Branchiostoma_floridae_tr_A0A9J7KND6_A0A9J7KND6_BRAFL tr|A0A9J7KND6|A0A9J7KND6_BRAFL Protein slit-like OS=Branchiostoma floridae OX=7739 GN=LOC118409876 PE=4 SV=1, Branchiostoma_floridae_tr_A0A9J7MH62_A0A9J7MH62_BRAFL tr|A0A9J7MH62|A0A9J7MH62_BRAFL Platelet glycoprotein V-like OS=Branchiostoma floridae OX=7739 GN=LOC118431951 PE=4 SV=1, Branchiostoma_floridae_tr_A0A9J7MQS7_A0A9J7MQS7_BRAFL tr|A0A9J7MQS7|A0A9J7MQS7_BRAFL Uncharacterized protein LOC118415386 OS=Branchiostoma floridae OX=7739 GN=LOC118415386 PE=4 SV=1, Branchiostoma_floridae_tr_A0A9J7L5T4_A0A9J7L5T4_BRAFL tr|A0A9J7L5T4|A0A9J7L5T4_BRAFL Uncharacterized protein LOC118415419 OS=Branchiostoma floridae OX=7739 GN=LOC118415419 PE=4 SV=1, Branchiostoma_floridae_tr_A0A9J7L8Y7_A0A9J7L8Y7_BRAFL tr|A0A9J7L8Y7|A0A9J7L8Y7_BRAFL Leucine-rich repeat-containing protein 70-like OS=Branchiostoma floridae OX=7739 GN=LOC118416166 PE=4 SV=1, Branchiostoma_floridae_tr_A0A9J7L7V7_A0A9J7L7V7_BRAFL tr|A0A9J7L7V7|A0A9J7L7V7_BRAFL Uncharacterized protein LOC118416557 OS=Branchiostoma floridae OX=7739 GN=LOC118416557 PE=4 SV=1, Branchiostoma_floridae_tr_A0A9J7KQB2_A0A9J7KQB2_BRAFL tr|A0A9J7KQB2|A0A9J7KQB2_BRAFL Decorin-like OS=Branchiostoma floridae OX=7739 GN=LOC118410531 PE=4 SV=1, Branchiostoma_floridae_tr_A0A9J7KPH9_A0A9J7KPH9_BRAFL tr|A0A9J7KPH9|A0A9J7KPH9_BRAFL Podocan-like OS=Branchiostoma floridae OX=7739 GN=LOC118410253 PE=4 SV=1, Branchiostoma_floridae_tr_A0A9J7HER5_A0A9J7HER5_BRAFL tr|A0A9J7HER5|A0A9J7HER5_BRAFL Slit homolog 1 protein-like OS=Branchiostoma floridae OX=7739 GN=LOC118403631 PE=4 SV=1	Schmidtea_mediterranea_maker-scaffold10901-augustus-gene-0.37-mRNA-1 maker-scaffold10901-augustus-gene-0.37-mRNA-1 protein AED_0.05 eAED_0.05 QI_126|1|1|1|0.66|0.57|7|1281|732
OG0000053	Branchiostoma_floridae_tr_A0A9J7HQ36_A0A9J7HQ36_BRAFL tr|A0A9J7HQ36|A0A9J7HQ36_BRAFL Malignant fibrous histiocytoma-amplified sequence 1 homolog OS=Branchiostoma floridae OX=7739 GN=LOC118407449 PE=4 SV=1	Schmidtea_mediterranea_augustus_masked-scaffold16533-processed-gene-0.1-mRNA-1 augustus_masked-scaffold16533-processed-gene-0.1-mRNA-1 protein AED_0.08 eAED_0.08 QI_0|-1|0|1|-1|1|1|0|877
OG0000056	Branchiostoma_floridae_tr_A0A9J7LRW5_A0A9J7LRW5_BRAFL tr|A0A9J7LRW5|A0A9J7LRW5_BRAFL RING-type E3 ubiquitin transferase OS=Branchiostoma floridae OX=7739 GN=LOC118423826 PE=4 SV=1, Branchiostoma_floridae_tr_A0A9J7N099_A0A9J7N099_BRAFL tr|A0A9J7N099|A0A9J7N099_BRAFL RING-type E3 ubiquitin transferase OS=Branchiostoma floridae OX=7739 GN=LOC118423826 PE=4 SV=1	Schmidtea_mediterranea_maker-scaffold6014-snap-gene-0.37-mRNA-1 maker-scaffold6014-snap-gene-0.37-mRNA-1 protein AED_0.00 eAED_0.00 QI_166|0.85|0.87|1|0.42|0.5|8|407|786
