Orthogroup	Chordata_Amphioxiformes_Branchiostoma_floridae	Porifera_Demospongiae_Amphimedon_queenslandica
OG0000051	Branchiostoma_floridae_tr_A0A9J7L6T5_A0A9J7L6T5_BRAFL tr|A0A9J7L6T5|A0A9J7L6T5_BRAFL Uncharacterized protein LOC118416225 OS=Branchiostoma floridae OX=7739 GN=LOC118416225 PE=4 SV=1, Branchiostoma_floridae_tr_A0A9J7L7X1_A0A9J7L7X1_BRAFL tr|A0A9J7L7X1|A0A9J7L7X1_BRAFL chitinase OS=Branchiostoma floridae OX=7739 GN=LOC118416038 PE=4 SV=1, Branchiostoma_floridae_tr_A0A9J7L6D5_A0A9J7L6D5_BRAFL tr|A0A9J7L6D5|A0A9J7L6D5_BRAFL chitinase OS=Branchiostoma floridae OX=7739 GN=LOC118416038 PE=4 SV=1, Branchiostoma_floridae_tr_A0A9J7L6K6_A0A9J7L6K6_BRAFL tr|A0A9J7L6K6|A0A9J7L6K6_BRAFL chitinase OS=Branchiostoma floridae OX=7739 GN=LOC118416038 PE=4 SV=1, Branchiostoma_floridae_tr_A0A9J7L5V3_A0A9J7L5V3_BRAFL tr|A0A9J7L5V3|A0A9J7L5V3_BRAFL Uncharacterized protein LOC118415805 isoform X1 OS=Branchiostoma floridae OX=7739 GN=LOC118415805 PE=4 SV=1, Branchiostoma_floridae_tr_A0A9J7L5N2_A0A9J7L5N2_BRAFL tr|A0A9J7L5N2|A0A9J7L5N2_BRAFL Uncharacterized protein LOC118415805 isoform X2 OS=Branchiostoma floridae OX=7739 GN=LOC118415805 PE=4 SV=1, Branchiostoma_floridae_tr_A0A9J7L745_A0A9J7L745_BRAFL tr|A0A9J7L745|A0A9J7L745_BRAFL VWFA and cache domain-containing protein 1-like OS=Branchiostoma floridae OX=7739 GN=LOC118416224 PE=4 SV=1, Branchiostoma_floridae_tr_A0A9J7L8B9_A0A9J7L8B9_BRAFL tr|A0A9J7L8B9|A0A9J7L8B9_BRAFL chitinase OS=Branchiostoma floridae OX=7739 GN=LOC118416227 PE=4 SV=1, Branchiostoma_floridae_tr_A0A9J7MCV7_A0A9J7MCV7_BRAFL tr|A0A9J7MCV7|A0A9J7MCV7_BRAFL VWFA and cache domain-containing protein 1-like isoform X5 OS=Branchiostoma floridae OX=7739 GN=LOC118431459 PE=3 SV=1, Branchiostoma_floridae_tr_A0A9J7NBR8_A0A9J7NBR8_BRAFL tr|A0A9J7NBR8|A0A9J7NBR8_BRAFL VWFA and cache domain-containing protein 1-like isoform X4 OS=Branchiostoma floridae OX=7739 GN=LOC118431459 PE=3 SV=1, Branchiostoma_floridae_tr_A0A9J7NCV3_A0A9J7NCV3_BRAFL tr|A0A9J7NCV3|A0A9J7NCV3_BRAFL VWFA and cache domain-containing protein 1-like isoform X3 OS=Branchiostoma floridae OX=7739 GN=LOC118431459 PE=3 SV=1, Branchiostoma_floridae_tr_A0A9J7MCW9_A0A9J7MCW9_BRAFL tr|A0A9J7MCW9|A0A9J7MCW9_BRAFL VWFA and cache domain-containing protein 1-like isoform X1 OS=Branchiostoma floridae OX=7739 GN=LOC118431459 PE=3 SV=1, Branchiostoma_floridae_tr_A0A9J7NCB3_A0A9J7NCB3_BRAFL tr|A0A9J7NCB3|A0A9J7NCB3_BRAFL VWFA and cache domain-containing protein 1-like isoform X2 OS=Branchiostoma floridae OX=7739 GN=LOC118431459 PE=3 SV=1, Branchiostoma_floridae_tr_A0A9J7M608_A0A9J7M608_BRAFL tr|A0A9J7M608|A0A9J7M608_BRAFL Voltage-dependent calcium channel subunit alpha-2/delta-2-like OS=Branchiostoma floridae OX=7739 GN=LOC118428210 PE=4 SV=1	Amphimedon_queenslandica_tr_A0A1X7V466_A0A1X7V466_AMPQE tr_A0A1X7V466_A0A1X7V466_AMPQE VWFA domain-containing protein OS=Amphimedon queenslandica OX=400682 GN=109581210 PE=4 SV=1
OG0000054	Branchiostoma_floridae_tr_A0A9J7MDC4_A0A9J7MDC4_BRAFL tr|A0A9J7MDC4|A0A9J7MDC4_BRAFL Leucine-rich repeat-containing protein 7-like isoform X2 OS=Branchiostoma floridae OX=7739 GN=LOC118431806 PE=4 SV=1, Branchiostoma_floridae_tr_A0A9J7MGW3_A0A9J7MGW3_BRAFL tr|A0A9J7MGW3|A0A9J7MGW3_BRAFL Uncharacterized protein LOC118431806 isoform X1 OS=Branchiostoma floridae OX=7739 GN=LOC118431806 PE=4 SV=1	Amphimedon_queenslandica_tr_A0A1X7TU95_A0A1X7TU95_AMPQE tr_A0A1X7TU95_A0A1X7TU95_AMPQE Uncharacterized protein OS=Amphimedon queenslandica OX=400682 PE=4 SV=1, Amphimedon_queenslandica_tr_A0A1X7STD8_A0A1X7STD8_AMPQE tr_A0A1X7STD8_A0A1X7STD8_AMPQE Uncharacterized protein OS=Amphimedon queenslandica OX=400682 PE=4 SV=1
OG0000054	Branchiostoma_floridae_tr_A0A9J7HI67_A0A9J7HI67_BRAFL tr|A0A9J7HI67|A0A9J7HI67_BRAFL Protein scribble homolog isoform X6 OS=Branchiostoma floridae OX=7739 GN=LOC118404738 PE=4 SV=1, Branchiostoma_floridae_tr_A0A9J7HIA6_A0A9J7HIA6_BRAFL tr|A0A9J7HIA6|A0A9J7HIA6_BRAFL Protein scribble homolog isoform X8 OS=Branchiostoma floridae OX=7739 GN=LOC118404738 PE=4 SV=1, Branchiostoma_floridae_tr_A0A9J7HME8_A0A9J7HME8_BRAFL tr|A0A9J7HME8|A0A9J7HME8_BRAFL Protein scribble homolog isoform X21 OS=Branchiostoma floridae OX=7739 GN=LOC118404738 PE=4 SV=1, Branchiostoma_floridae_tr_A0A9J7HIB6_A0A9J7HIB6_BRAFL tr|A0A9J7HIB6|A0A9J7HIB6_BRAFL Protein scribble homolog isoform X22 OS=Branchiostoma floridae OX=7739 GN=LOC118404738 PE=4 SV=1, Branchiostoma_floridae_tr_A0A9J7HI75_A0A9J7HI75_BRAFL tr|A0A9J7HI75|A0A9J7HI75_BRAFL Protein scribble homolog isoform X20 OS=Branchiostoma floridae OX=7739 GN=LOC118404738 PE=4 SV=1, Branchiostoma_floridae_tr_A0A9J7KF50_A0A9J7KF50_BRAFL tr|A0A9J7KF50|A0A9J7KF50_BRAFL Protein scribble homolog isoform X9 OS=Branchiostoma floridae OX=7739 GN=LOC118404738 PE=4 SV=1, Branchiostoma_floridae_tr_A0A9J7HMD8_A0A9J7HMD8_BRAFL tr|A0A9J7HMD8|A0A9J7HMD8_BRAFL Protein scribble homolog isoform X7 OS=Branchiostoma floridae OX=7739 GN=LOC118404738 PE=4 SV=1, Branchiostoma_floridae_tr_A0A9J7HHU9_A0A9J7HHU9_BRAFL tr|A0A9J7HHU9|A0A9J7HHU9_BRAFL Protein scribble homolog isoform X15 OS=Branchiostoma floridae OX=7739 GN=LOC118404738 PE=4 SV=1, Branchiostoma_floridae_tr_A0A9J7HIC6_A0A9J7HIC6_BRAFL tr|A0A9J7HIC6|A0A9J7HIC6_BRAFL Protein scribble homolog isoform X36 OS=Branchiostoma floridae OX=7739 GN=LOC118404738 PE=4 SV=1, Branchiostoma_floridae_tr_A0A9J7K7H8_A0A9J7K7H8_BRAFL tr|A0A9J7K7H8|A0A9J7K7H8_BRAFL Protein scribble homolog isoform X39 OS=Branchiostoma floridae OX=7739 GN=LOC118404738 PE=4 SV=1, Branchiostoma_floridae_tr_A0A9J7KI98_A0A9J7KI98_BRAFL tr|A0A9J7KI98|A0A9J7KI98_BRAFL Protein scribble homolog isoform X40 OS=Branchiostoma floridae OX=7739 GN=LOC118404738 PE=4 SV=1, Branchiostoma_floridae_tr_A0A9J7KH87_A0A9J7KH87_BRAFL tr|A0A9J7KH87|A0A9J7KH87_BRAFL Protein scribble homolog isoform X41 OS=Branchiostoma floridae OX=7739 GN=LOC118404738 PE=4 SV=1, Branchiostoma_floridae_tr_A0A9J7HHW8_A0A9J7HHW8_BRAFL tr|A0A9J7HHW8|A0A9J7HHW8_BRAFL Protein scribble homolog isoform X42 OS=Branchiostoma floridae OX=7739 GN=LOC118404738 PE=4 SV=1, Branchiostoma_floridae_tr_A0A9J7HHX0_A0A9J7HHX0_BRAFL tr|A0A9J7HHX0|A0A9J7HHX0_BRAFL Protein scribble homolog isoform X43 OS=Branchiostoma floridae OX=7739 GN=LOC118404738 PE=4 SV=1, Branchiostoma_floridae_tr_A0A9J7HKA9_A0A9J7HKA9_BRAFL tr|A0A9J7HKA9|A0A9J7HKA9_BRAFL Protein scribble homolog isoform X38 OS=Branchiostoma floridae OX=7739 GN=LOC118404738 PE=4 SV=1, Branchiostoma_floridae_tr_A0A9J7HMF9_A0A9J7HMF9_BRAFL tr|A0A9J7HMF9|A0A9J7HMF9_BRAFL Protein scribble homolog isoform X35 OS=Branchiostoma floridae OX=7739 GN=LOC118404738 PE=4 SV=1, Branchiostoma_floridae_tr_A0A9J7KH83_A0A9J7KH83_BRAFL tr|A0A9J7KH83|A0A9J7KH83_BRAFL Protein scribble homolog isoform X27 OS=Branchiostoma floridae OX=7739 GN=LOC118404738 PE=4 SV=1, Branchiostoma_floridae_tr_A0A9J7KI92_A0A9J7KI92_BRAFL tr|A0A9J7KI92|A0A9J7KI92_BRAFL Protein scribble homolog isoform X26 OS=Branchiostoma floridae OX=7739 GN=LOC118404738 PE=4 SV=1, Branchiostoma_floridae_tr_A0A9J7HHV9_A0A9J7HHV9_BRAFL tr|A0A9J7HHV9|A0A9J7HHV9_BRAFL Protein scribble homolog isoform X28 OS=Branchiostoma floridae OX=7739 GN=LOC118404738 PE=4 SV=1, Branchiostoma_floridae_tr_A0A9J7HHV6_A0A9J7HHV6_BRAFL tr|A0A9J7HHV6|A0A9J7HHV6_BRAFL Protein scribble homolog isoform X29 OS=Branchiostoma floridae OX=7739 GN=LOC118404738 PE=4 SV=1, Branchiostoma_floridae_tr_A0A9J7HKS1_A0A9J7HKS1_BRAFL tr|A0A9J7HKS1|A0A9J7HKS1_BRAFL Protein scribble homolog isoform X17 OS=Branchiostoma floridae OX=7739 GN=LOC118404738 PE=4 SV=1, Branchiostoma_floridae_tr_A0A9J7HI00_A0A9J7HI00_BRAFL tr|A0A9J7HI00|A0A9J7HI00_BRAFL Protein scribble homolog isoform X16 OS=Branchiostoma floridae OX=7739 GN=LOC118404738 PE=4 SV=1, Branchiostoma_floridae_tr_A0A9J7KI00_A0A9J7KI00_BRAFL tr|A0A9J7KI00|A0A9J7KI00_BRAFL Protein scribble homolog isoform X3 OS=Branchiostoma floridae OX=7739 GN=LOC118404738 PE=4 SV=1, Branchiostoma_floridae_tr_A0A9J7KI85_A0A9J7KI85_BRAFL tr|A0A9J7KI85|A0A9J7KI85_BRAFL Protein scribble homolog isoform X12 OS=Branchiostoma floridae OX=7739 GN=LOC118404738 PE=4 SV=1, Branchiostoma_floridae_tr_A0A9J7HKT0_A0A9J7HKT0_BRAFL tr|A0A9J7HKT0|A0A9J7HKT0_BRAFL Protein scribble homolog isoform X31 OS=Branchiostoma floridae OX=7739 GN=LOC118404738 PE=4 SV=1, Branchiostoma_floridae_tr_A0A9J7KF56_A0A9J7KF56_BRAFL tr|A0A9J7KF56|A0A9J7KF56_BRAFL Protein scribble homolog isoform X37 OS=Branchiostoma floridae OX=7739 GN=LOC118404738 PE=4 SV=1, Branchiostoma_floridae_tr_A0A9J7HI10_A0A9J7HI10_BRAFL tr|A0A9J7HI10|A0A9J7HI10_BRAFL Protein scribble homolog isoform X30 OS=Branchiostoma floridae OX=7739 GN=LOC118404738 PE=4 SV=1, Branchiostoma_floridae_tr_A0A9J7KI09_A0A9J7KI09_BRAFL tr|A0A9J7KI09|A0A9J7KI09_BRAFL Protein scribble homolog isoform X32 OS=Branchiostoma floridae OX=7739 GN=LOC118404738 PE=4 SV=1, Branchiostoma_floridae_tr_A0A9J7K7H4_A0A9J7K7H4_BRAFL tr|A0A9J7K7H4|A0A9J7K7H4_BRAFL Protein scribble homolog isoform X25 OS=Branchiostoma floridae OX=7739 GN=LOC118404738 PE=4 SV=1, Branchiostoma_floridae_tr_A0A9J7HHU7_A0A9J7HHU7_BRAFL tr|A0A9J7HHU7|A0A9J7HHU7_BRAFL Protein scribble homolog isoform X14 OS=Branchiostoma floridae OX=7739 GN=LOC118404738 PE=4 SV=1, Branchiostoma_floridae_tr_A0A9J7HK89_A0A9J7HK89_BRAFL tr|A0A9J7HK89|A0A9J7HK89_BRAFL Protein scribble homolog isoform X10 OS=Branchiostoma floridae OX=7739 GN=LOC118404738 PE=4 SV=1, Branchiostoma_floridae_tr_A0A9J7HL15_A0A9J7HL15_BRAFL tr|A0A9J7HL15|A0A9J7HL15_BRAFL Protein scribble homolog isoform X4 OS=Branchiostoma floridae OX=7739 GN=LOC118404738 PE=4 SV=1, Branchiostoma_floridae_tr_A0A9J7HHT7_A0A9J7HHT7_BRAFL tr|A0A9J7HHT7|A0A9J7HHT7_BRAFL Protein scribble homolog isoform X1 OS=Branchiostoma floridae OX=7739 GN=LOC118404738 PE=4 SV=1, Branchiostoma_floridae_tr_A0A9J7KH79_A0A9J7KH79_BRAFL tr|A0A9J7KH79|A0A9J7KH79_BRAFL Protein scribble homolog isoform X13 OS=Branchiostoma floridae OX=7739 GN=LOC118404738 PE=4 SV=1, Branchiostoma_floridae_tr_A0A9J7HKF6_A0A9J7HKF6_BRAFL tr|A0A9J7HKF6|A0A9J7HKF6_BRAFL Protein scribble homolog isoform X19 OS=Branchiostoma floridae OX=7739 GN=LOC118404738 PE=4 SV=1, Branchiostoma_floridae_tr_A0A9J7K7H0_A0A9J7K7H0_BRAFL tr|A0A9J7K7H0|A0A9J7K7H0_BRAFL Protein scribble homolog isoform X11 OS=Branchiostoma floridae OX=7739 GN=LOC118404738 PE=4 SV=1, Branchiostoma_floridae_tr_A0A9J7HK99_A0A9J7HK99_BRAFL tr|A0A9J7HK99|A0A9J7HK99_BRAFL Protein scribble homolog isoform X24 OS=Branchiostoma floridae OX=7739 GN=LOC118404738 PE=4 SV=1, Branchiostoma_floridae_tr_A0A9J7HHZ0_A0A9J7HHZ0_BRAFL tr|A0A9J7HHZ0|A0A9J7HHZ0_BRAFL Protein scribble homolog isoform X2 OS=Branchiostoma floridae OX=7739 GN=LOC118404738 PE=4 SV=1, Branchiostoma_floridae_tr_A0A9J7HKE6_A0A9J7HKE6_BRAFL tr|A0A9J7HKE6|A0A9J7HKE6_BRAFL Protein scribble homolog isoform X5 OS=Branchiostoma floridae OX=7739 GN=LOC118404738 PE=4 SV=1, Branchiostoma_floridae_tr_A0A9J7HL24_A0A9J7HL24_BRAFL tr|A0A9J7HL24|A0A9J7HL24_BRAFL Protein scribble homolog isoform X18 OS=Branchiostoma floridae OX=7739 GN=LOC118404738 PE=4 SV=1, Branchiostoma_floridae_tr_A0A9J7HKT9_A0A9J7HKT9_BRAFL tr|A0A9J7HKT9|A0A9J7HKT9_BRAFL Protein scribble homolog isoform X45 OS=Branchiostoma floridae OX=7739 GN=LOC118404738 PE=4 SV=1, Branchiostoma_floridae_tr_A0A9J7HL46_A0A9J7HL46_BRAFL tr|A0A9J7HL46|A0A9J7HL46_BRAFL Protein scribble homolog isoform X47 OS=Branchiostoma floridae OX=7739 GN=LOC118404738 PE=4 SV=1, Branchiostoma_floridae_tr_A0A9J7KI13_A0A9J7KI13_BRAFL tr|A0A9J7KI13|A0A9J7KI13_BRAFL Protein scribble homolog isoform X46 OS=Branchiostoma floridae OX=7739 GN=LOC118404738 PE=4 SV=1, Branchiostoma_floridae_tr_A0A9J7HI94_A0A9J7HI94_BRAFL tr|A0A9J7HI94|A0A9J7HI94_BRAFL Protein scribble homolog isoform X48 OS=Branchiostoma floridae OX=7739 GN=LOC118404738 PE=4 SV=1, Branchiostoma_floridae_tr_A0A9J7HI22_A0A9J7HI22_BRAFL tr|A0A9J7HI22|A0A9J7HI22_BRAFL Protein scribble homolog isoform X44 OS=Branchiostoma floridae OX=7739 GN=LOC118404738 PE=4 SV=1, Branchiostoma_floridae_tr_A0A9J7HI85_A0A9J7HI85_BRAFL tr|A0A9J7HI85|A0A9J7HI85_BRAFL Protein scribble homolog isoform X34 OS=Branchiostoma floridae OX=7739 GN=LOC118404738 PE=4 SV=1, Branchiostoma_floridae_tr_A0A9J7KF53_A0A9J7KF53_BRAFL tr|A0A9J7KF53|A0A9J7KF53_BRAFL Protein scribble homolog isoform X23 OS=Branchiostoma floridae OX=7739 GN=LOC118404738 PE=4 SV=1, Branchiostoma_floridae_tr_A0A9J7HKG6_A0A9J7HKG6_BRAFL tr|A0A9J7HKG6|A0A9J7HKG6_BRAFL Protein scribble homolog isoform X33 OS=Branchiostoma floridae OX=7739 GN=LOC118404738 PE=4 SV=1	Amphimedon_queenslandica_tr_A0A1X7UT64_A0A1X7UT64_AMPQE tr_A0A1X7UT64_A0A1X7UT64_AMPQE Uncharacterized protein OS=Amphimedon queenslandica OX=400682 GN=100636327 PE=4 SV=1
OG0000056	Branchiostoma_floridae_tr_A0A9J7L6V2_A0A9J7L6V2_BRAFL tr|A0A9J7L6V2|A0A9J7L6V2_BRAFL RING-type E3 ubiquitin transferase OS=Branchiostoma floridae OX=7739 GN=LOC118416248 PE=4 SV=1, Branchiostoma_floridae_tr_A0A9J7N2I6_A0A9J7N2I6_BRAFL tr|A0A9J7N2I6|A0A9J7N2I6_BRAFL RING-type E3 ubiquitin transferase OS=Branchiostoma floridae OX=7739 GN=LOC118424720 PE=4 SV=1, Branchiostoma_floridae_tr_A0A9J7N4G3_A0A9J7N4G3_BRAFL tr|A0A9J7N4G3|A0A9J7N4G3_BRAFL RING-type E3 ubiquitin transferase OS=Branchiostoma floridae OX=7739 GN=LOC118424720 PE=4 SV=1, Branchiostoma_floridae_tr_A0A9J7N426_A0A9J7N426_BRAFL tr|A0A9J7N426|A0A9J7N426_BRAFL RING-type E3 ubiquitin transferase OS=Branchiostoma floridae OX=7739 GN=LOC118424720 PE=4 SV=1, Branchiostoma_floridae_tr_A0A9J7LVH6_A0A9J7LVH6_BRAFL tr|A0A9J7LVH6|A0A9J7LVH6_BRAFL RING-type E3 ubiquitin transferase OS=Branchiostoma floridae OX=7739 GN=LOC118424720 PE=4 SV=1, Branchiostoma_floridae_tr_A0A9J7LVY9_A0A9J7LVY9_BRAFL tr|A0A9J7LVY9|A0A9J7LVY9_BRAFL RING-type E3 ubiquitin transferase OS=Branchiostoma floridae OX=7739 GN=LOC118424720 PE=4 SV=1, Branchiostoma_floridae_tr_A0A9J7N1I7_A0A9J7N1I7_BRAFL tr|A0A9J7N1I7|A0A9J7N1I7_BRAFL RING-type E3 ubiquitin transferase OS=Branchiostoma floridae OX=7739 GN=LOC118424720 PE=4 SV=1, Branchiostoma_floridae_tr_A0A9J7N4L4_A0A9J7N4L4_BRAFL tr|A0A9J7N4L4|A0A9J7N4L4_BRAFL RING-type E3 ubiquitin transferase OS=Branchiostoma floridae OX=7739 GN=LOC118424720 PE=4 SV=1, Branchiostoma_floridae_tr_A0A9J7KRL1_A0A9J7KRL1_BRAFL tr|A0A9J7KRL1|A0A9J7KRL1_BRAFL RING-type E3 ubiquitin transferase OS=Branchiostoma floridae OX=7739 GN=LOC118411174 PE=4 SV=1, Branchiostoma_floridae_tr_A0A9J7KRF7_A0A9J7KRF7_BRAFL tr|A0A9J7KRF7|A0A9J7KRF7_BRAFL RING-type E3 ubiquitin transferase OS=Branchiostoma floridae OX=7739 GN=LOC118411174 PE=4 SV=1, Branchiostoma_floridae_tr_A0A9J7KRM6_A0A9J7KRM6_BRAFL tr|A0A9J7KRM6|A0A9J7KRM6_BRAFL RING-type E3 ubiquitin transferase OS=Branchiostoma floridae OX=7739 GN=LOC118411174 PE=4 SV=1, Branchiostoma_floridae_tr_A0A9J7MIX4_A0A9J7MIX4_BRAFL tr|A0A9J7MIX4|A0A9J7MIX4_BRAFL RING-type E3 ubiquitin transferase OS=Branchiostoma floridae OX=7739 GN=LOC118411174 PE=4 SV=1, Branchiostoma_floridae_tr_A0A9J7MJG6_A0A9J7MJG6_BRAFL tr|A0A9J7MJG6|A0A9J7MJG6_BRAFL RING-type E3 ubiquitin transferase OS=Branchiostoma floridae OX=7739 GN=LOC118411174 PE=4 SV=1, Branchiostoma_floridae_tr_A0A9J7MJ47_A0A9J7MJ47_BRAFL tr|A0A9J7MJ47|A0A9J7MJ47_BRAFL RING-type E3 ubiquitin transferase OS=Branchiostoma floridae OX=7739 GN=LOC118411174 PE=4 SV=1, Branchiostoma_floridae_tr_A0A9J7MJ06_A0A9J7MJ06_BRAFL tr|A0A9J7MJ06|A0A9J7MJ06_BRAFL RING-type E3 ubiquitin transferase OS=Branchiostoma floridae OX=7739 GN=LOC118411174 PE=4 SV=1, Branchiostoma_floridae_tr_A0A9J7LCB5_A0A9J7LCB5_BRAFL tr|A0A9J7LCB5|A0A9J7LCB5_BRAFL RING-type E3 ubiquitin transferase OS=Branchiostoma floridae OX=7739 GN=LOC118418462 PE=4 SV=1, Branchiostoma_floridae_tr_A0A9J7N1L2_A0A9J7N1L2_BRAFL tr|A0A9J7N1L2|A0A9J7N1L2_BRAFL E3 ubiquitin-protein ligase Midline-1-like OS=Branchiostoma floridae OX=7739 GN=LOC118423086 PE=4 SV=1, Branchiostoma_floridae_tr_A0A9J7HPK9_A0A9J7HPK9_BRAFL tr|A0A9J7HPK9|A0A9J7HPK9_BRAFL E3 ubiquitin-protein ligase Midline-1-like OS=Branchiostoma floridae OX=7739 GN=LOC118406249 PE=4 SV=1, Branchiostoma_floridae_tr_A0A9J7HJS2_A0A9J7HJS2_BRAFL tr|A0A9J7HJS2|A0A9J7HJS2_BRAFL E3 ubiquitin-protein ligase Midline-1-like OS=Branchiostoma floridae OX=7739 GN=LOC118405415 PE=4 SV=1, Branchiostoma_floridae_tr_A0A9J7LMD4_A0A9J7LMD4_BRAFL tr|A0A9J7LMD4|A0A9J7LMD4_BRAFL RING-type E3 ubiquitin transferase OS=Branchiostoma floridae OX=7739 GN=LOC118422178 PE=4 SV=1, Branchiostoma_floridae_tr_A0A9J7LUL6_A0A9J7LUL6_BRAFL tr|A0A9J7LUL6|A0A9J7LUL6_BRAFL E3 ubiquitin-protein ligase Midline-1-like OS=Branchiostoma floridae OX=7739 GN=LOC118423502 PE=4 SV=1, Branchiostoma_floridae_tr_A0A9J7LPJ1_A0A9J7LPJ1_BRAFL tr|A0A9J7LPJ1|A0A9J7LPJ1_BRAFL RING-type E3 ubiquitin transferase OS=Branchiostoma floridae OX=7739 GN=LOC118422179 PE=4 SV=1, Branchiostoma_floridae_tr_A0A9J7KSN9_A0A9J7KSN9_BRAFL tr|A0A9J7KSN9|A0A9J7KSN9_BRAFL E3 ubiquitin-protein ligase Trim36-like isoform X2 OS=Branchiostoma floridae OX=7739 GN=LOC118411539 PE=4 SV=1, Branchiostoma_floridae_tr_A0A9J7MK00_A0A9J7MK00_BRAFL tr|A0A9J7MK00|A0A9J7MK00_BRAFL E3 ubiquitin-protein ligase Trim36-like isoform X1 OS=Branchiostoma floridae OX=7739 GN=LOC118411539 PE=4 SV=1, Branchiostoma_floridae_tr_A0A9J7KTZ2_A0A9J7KTZ2_BRAFL tr|A0A9J7KTZ2|A0A9J7KTZ2_BRAFL E3 ubiquitin-protein ligase Trim36-like isoform X3 OS=Branchiostoma floridae OX=7739 GN=LOC118411539 PE=4 SV=1, Branchiostoma_floridae_tr_A0A9J7KSK9_A0A9J7KSK9_BRAFL tr|A0A9J7KSK9|A0A9J7KSK9_BRAFL E3 ubiquitin-protein ligase Trim36-like isoform X4 OS=Branchiostoma floridae OX=7739 GN=LOC118411539 PE=4 SV=1, Branchiostoma_floridae_tr_A0A9J7KU17_A0A9J7KU17_BRAFL tr|A0A9J7KU17|A0A9J7KU17_BRAFL E3 ubiquitin-protein ligase Trim36-like isoform X5 OS=Branchiostoma floridae OX=7739 GN=LOC118411539 PE=4 SV=1	Amphimedon_queenslandica_tr_A0A1X7TYP3_A0A1X7TYP3_AMPQE tr_A0A1X7TYP3_A0A1X7TYP3_AMPQE RING-type E3 ubiquitin transferase OS=Amphimedon queenslandica OX=400682 GN=105314196 PE=4 SV=1
OG0000061	Branchiostoma_floridae_tr_A0A9J7L8F1_A0A9J7L8F1_BRAFL tr|A0A9J7L8F1|A0A9J7L8F1_BRAFL LOW QUALITY PROTEIN_ copine-8-like OS=Branchiostoma floridae OX=7739 GN=LOC118416902 PE=3 SV=1	Amphimedon_queenslandica_tr_A0A1X7USU2_A0A1X7USU2_AMPQE tr_A0A1X7USU2_A0A1X7USU2_AMPQE Uncharacterized protein OS=Amphimedon queenslandica OX=400682 GN=100634021 PE=3 SV=1
OG0000062	Branchiostoma_floridae_tr_A0A9J7LBM6_A0A9J7LBM6_BRAFL tr|A0A9J7LBM6|A0A9J7LBM6_BRAFL Delta-like protein OS=Branchiostoma floridae OX=7739 GN=LOC118417211 PE=4 SV=1, Branchiostoma_floridae_tr_A0A9J7L6H6_A0A9J7L6H6_BRAFL tr|A0A9J7L6H6|A0A9J7L6H6_BRAFL Delta-like protein OS=Branchiostoma floridae OX=7739 GN=LOC118416040 PE=4 SV=1	Amphimedon_queenslandica_tr_A0A1X7UTI9_A0A1X7UTI9_AMPQE tr_A0A1X7UTI9_A0A1X7UTI9_AMPQE Uncharacterized protein OS=Amphimedon queenslandica OX=400682 PE=4 SV=1, Amphimedon_queenslandica_tr_A0A1X7TRG8_A0A1X7TRG8_AMPQE tr_A0A1X7TRG8_A0A1X7TRG8_AMPQE Uncharacterized protein OS=Amphimedon queenslandica OX=400682 GN=100638185 PE=4 SV=1, Amphimedon_queenslandica_tr_A0A1X7TXK4_A0A1X7TXK4_AMPQE tr_A0A1X7TXK4_A0A1X7TXK4_AMPQE Uncharacterized protein OS=Amphimedon queenslandica OX=400682 PE=4 SV=1, Amphimedon_queenslandica_tr_A0A1X7VDH5_A0A1X7VDH5_AMPQE tr_A0A1X7VDH5_A0A1X7VDH5_AMPQE Delta-like protein OS=Amphimedon queenslandica OX=400682 PE=4 SV=1, Amphimedon_queenslandica_tr_A0A1X7VXU5_A0A1X7VXU5_AMPQE tr_A0A1X7VXU5_A0A1X7VXU5_AMPQE Delta-like protein OS=Amphimedon queenslandica OX=400682 GN=100639049 PE=4 SV=1
OG0000063	Branchiostoma_floridae_tr_C3YRC4_C3YRC4_BRAFL tr|C3YRC4|C3YRC4_BRAFL Sonic hedgehog protein-like OS=Branchiostoma floridae OX=7739 GN=LOC118412838 PE=4 SV=1, Branchiostoma_floridae_tr_A0A9J7MNC0_A0A9J7MNC0_BRAFL tr|A0A9J7MNC0|A0A9J7MNC0_BRAFL Indian hedgehog protein-like OS=Branchiostoma floridae OX=7739 GN=LOC118413679 PE=4 SV=1, Branchiostoma_floridae_tr_A0A9J7HTW1_A0A9J7HTW1_BRAFL tr|A0A9J7HTW1|A0A9J7HTW1_BRAFL Uncharacterized protein LOC118409038 OS=Branchiostoma floridae OX=7739 GN=LOC118409038 PE=3 SV=1	Amphimedon_queenslandica_tr_A0A1X7TB22_A0A1X7TB22_AMPQE tr_A0A1X7TB22_A0A1X7TB22_AMPQE HintN domain-containing protein OS=Amphimedon queenslandica OX=400682 PE=4 SV=1, Amphimedon_queenslandica_tr_A0A1X7UIG2_A0A1X7UIG2_AMPQE tr_A0A1X7UIG2_A0A1X7UIG2_AMPQE HintN domain-containing protein OS=Amphimedon queenslandica OX=400682 PE=3 SV=1, Amphimedon_queenslandica_tr_A0A1X7TZL0_A0A1X7TZL0_AMPQE tr_A0A1X7TZL0_A0A1X7TZL0_AMPQE HintN domain-containing protein OS=Amphimedon queenslandica OX=400682 PE=3 SV=1, Amphimedon_queenslandica_tr_A0A1X7UHL0_A0A1X7UHL0_AMPQE tr_A0A1X7UHL0_A0A1X7UHL0_AMPQE HintN domain-containing protein OS=Amphimedon queenslandica OX=400682 PE=4 SV=1
OG0000065	Branchiostoma_floridae_tr_A0A9J7N425_A0A9J7N425_BRAFL tr|A0A9J7N425|A0A9J7N425_BRAFL Glypican-5-like OS=Branchiostoma floridae OX=7739 GN=LOC118426900 PE=3 SV=1	Amphimedon_queenslandica_tr_A0A1X7UR14_A0A1X7UR14_AMPQE tr_A0A1X7UR14_A0A1X7UR14_AMPQE Uncharacterized protein OS=Amphimedon queenslandica OX=400682 GN=100639280 PE=3 SV=1
OG0000076	Branchiostoma_floridae_tr_A0A9J7M0N2_A0A9J7M0N2_BRAFL tr|A0A9J7M0N2|A0A9J7M0N2_BRAFL Uncharacterized protein LOC118427108 OS=Branchiostoma floridae OX=7739 GN=LOC118427108 PE=4 SV=1, Branchiostoma_floridae_tr_A0A9J7M1C5_A0A9J7M1C5_BRAFL tr|A0A9J7M1C5|A0A9J7M1C5_BRAFL Uncharacterized protein LOC118427109 OS=Branchiostoma floridae OX=7739 GN=LOC118427109 PE=4 SV=1, Branchiostoma_floridae_tr_A0A9J7M277_A0A9J7M277_BRAFL tr|A0A9J7M277|A0A9J7M277_BRAFL Uncharacterized protein LOC118427105 OS=Branchiostoma floridae OX=7739 GN=LOC118427105 PE=4 SV=1, Branchiostoma_floridae_tr_A0A9J7MB35_A0A9J7MB35_BRAFL tr|A0A9J7MB35|A0A9J7MB35_BRAFL Uncharacterized protein LOC118430131 OS=Branchiostoma floridae OX=7739 GN=LOC118430131 PE=4 SV=1, Branchiostoma_floridae_tr_A0A9J7HWX3_A0A9J7HWX3_BRAFL tr|A0A9J7HWX3|A0A9J7HWX3_BRAFL chitinase OS=Branchiostoma floridae OX=7739 GN=LOC118409092 PE=4 SV=1, Branchiostoma_floridae_tr_A0A9J7KNZ3_A0A9J7KNZ3_BRAFL tr|A0A9J7KNZ3|A0A9J7KNZ3_BRAFL chitinase OS=Branchiostoma floridae OX=7739 GN=LOC118410102 PE=4 SV=1, Branchiostoma_floridae_tr_A0A9J7KNY3_A0A9J7KNY3_BRAFL tr|A0A9J7KNY3|A0A9J7KNY3_BRAFL chitinase OS=Branchiostoma floridae OX=7739 GN=LOC118410102 PE=4 SV=1, Branchiostoma_floridae_tr_A0A9J7KP19_A0A9J7KP19_BRAFL tr|A0A9J7KP19|A0A9J7KP19_BRAFL chitinase OS=Branchiostoma floridae OX=7739 GN=LOC118410102 PE=4 SV=1, Branchiostoma_floridae_tr_A0A9J7MFH1_A0A9J7MFH1_BRAFL tr|A0A9J7MFH1|A0A9J7MFH1_BRAFL IgGFc-binding protein-like isoform X1 OS=Branchiostoma floridae OX=7739 GN=LOC118432311 PE=4 SV=1, Branchiostoma_floridae_tr_A0A9J7L030_A0A9J7L030_BRAFL tr|A0A9J7L030|A0A9J7L030_BRAFL IgGFc-binding protein-like OS=Branchiostoma floridae OX=7739 GN=LOC118413444 PE=4 SV=1, Branchiostoma_floridae_tr_A0A9J7LIH4_A0A9J7LIH4_BRAFL tr|A0A9J7LIH4|A0A9J7LIH4_BRAFL IgGFc-binding protein-like OS=Branchiostoma floridae OX=7739 GN=LOC118420728 PE=4 SV=1, Branchiostoma_floridae_tr_A0A9J7MLP3_A0A9J7MLP3_BRAFL tr|A0A9J7MLP3|A0A9J7MLP3_BRAFL IgGFc-binding protein-like OS=Branchiostoma floridae OX=7739 GN=LOC118413222 PE=4 SV=1, Branchiostoma_floridae_tr_A0A9J7M3F5_A0A9J7M3F5_BRAFL tr|A0A9J7M3F5|A0A9J7M3F5_BRAFL Uncharacterized protein LOC118427033 OS=Branchiostoma floridae OX=7739 GN=LOC118427033 PE=4 SV=1	Amphimedon_queenslandica_tr_A0A1X7UYM1_A0A1X7UYM1_AMPQE tr_A0A1X7UYM1_A0A1X7UYM1_AMPQE AMOP domain-containing protein OS=Amphimedon queenslandica OX=400682 PE=4 SV=1, Amphimedon_queenslandica_tr_A0A1X7V3M0_A0A1X7V3M0_AMPQE tr_A0A1X7V3M0_A0A1X7V3M0_AMPQE Uncharacterized protein OS=Amphimedon queenslandica OX=400682 PE=4 SV=1, Amphimedon_queenslandica_tr_A0A1X7T5F0_A0A1X7T5F0_AMPQE tr_A0A1X7T5F0_A0A1X7T5F0_AMPQE Uncharacterized protein OS=Amphimedon queenslandica OX=400682 PE=4 SV=1, Amphimedon_queenslandica_tr_A0A1X7T9S8_A0A1X7T9S8_AMPQE tr_A0A1X7T9S8_A0A1X7T9S8_AMPQE Uncharacterized protein OS=Amphimedon queenslandica OX=400682 PE=4 SV=1, Amphimedon_queenslandica_tr_A0A1X7TA55_A0A1X7TA55_AMPQE tr_A0A1X7TA55_A0A1X7TA55_AMPQE Uncharacterized protein OS=Amphimedon queenslandica OX=400682 PE=4 SV=1, Amphimedon_queenslandica_tr_A0A1X7SUK5_A0A1X7SUK5_AMPQE tr_A0A1X7SUK5_A0A1X7SUK5_AMPQE EGF-like domain-containing protein OS=Amphimedon queenslandica OX=400682 PE=4 SV=1
OG0000077	Branchiostoma_floridae_tr_A0A9J7M3J9_A0A9J7M3J9_BRAFL tr|A0A9J7M3J9|A0A9J7M3J9_BRAFL Receptor-type tyrosine-protein phosphatase beta-like OS=Branchiostoma floridae OX=7739 GN=LOC118427110 PE=4 SV=1	Amphimedon_queenslandica_tr_A0A1X7UYH5_A0A1X7UYH5_AMPQE tr_A0A1X7UYH5_A0A1X7UYH5_AMPQE Fibronectin type-III domain-containing protein OS=Amphimedon queenslandica OX=400682 GN=109581706 PE=4 SV=1, Amphimedon_queenslandica_tr_A0A1X7UGD4_A0A1X7UGD4_AMPQE tr_A0A1X7UGD4_A0A1X7UGD4_AMPQE Uncharacterized protein OS=Amphimedon queenslandica OX=400682 GN=109583458 PE=4 SV=1
OG0000081	Branchiostoma_floridae_tr_A0A9J7MS62_A0A9J7MS62_BRAFL tr|A0A9J7MS62|A0A9J7MS62_BRAFL Cysteine-rich with EGF-like domain protein 2 OS=Branchiostoma floridae OX=7739 GN=LOC118416260 PE=3 SV=1	Amphimedon_queenslandica_tr_A0A1X7VRA4_A0A1X7VRA4_AMPQE tr_A0A1X7VRA4_A0A1X7VRA4_AMPQE Uncharacterized protein OS=Amphimedon queenslandica OX=400682 GN=105314063 PE=3 SV=1
OG0000086	Branchiostoma_floridae_tr_A0A9J7LWH4_A0A9J7LWH4_BRAFL tr|A0A9J7LWH4|A0A9J7LWH4_BRAFL Uncharacterized protein LOC118424874 OS=Branchiostoma floridae OX=7739 GN=LOC118424874 PE=4 SV=1	Amphimedon_queenslandica_tr_A0A1X7SDK1_A0A1X7SDK1_AMPQE tr_A0A1X7SDK1_A0A1X7SDK1_AMPQE Angiopoietin-related protein 4 OS=Amphimedon queenslandica OX=400682 PE=4 SV=1, Amphimedon_queenslandica_tr_A0A1X7TIJ9_A0A1X7TIJ9_AMPQE tr_A0A1X7TIJ9_A0A1X7TIJ9_AMPQE Fibrinogen C-terminal domain-containing protein OS=Amphimedon queenslandica OX=400682 PE=4 SV=1
