Orthogroup	Chordata_Amphioxiformes_Branchiostoma_floridae	Porifera_Demospongiae_Amphimedon_queenslandica
OG0000000	Branchiostoma_floridae_tr_A0A9J7LN89_A0A9J7LN89_BRAFL tr|A0A9J7LN89|A0A9J7LN89_BRAFL Versican core protein-like OS=Branchiostoma floridae OX=7739 GN=LOC118421928 PE=4 SV=1, Branchiostoma_floridae_tr_A0A9J7KUW6_A0A9J7KUW6_BRAFL tr|A0A9J7KUW6|A0A9J7KUW6_BRAFL Collagen alpha-1_XVII_ chain-like OS=Branchiostoma floridae OX=7739 GN=LOC118411872 PE=4 SV=1, Branchiostoma_floridae_tr_A0A9J7KTF0_A0A9J7KTF0_BRAFL tr|A0A9J7KTF0|A0A9J7KTF0_BRAFL Collagen alpha-1_I_ chain-like OS=Branchiostoma floridae OX=7739 GN=LOC118411862 PE=4 SV=1	Amphimedon_queenslandica_tr_A0A1X7TP62_A0A1X7TP62_AMPQE tr_A0A1X7TP62_A0A1X7TP62_AMPQE Fibrinogen C-terminal domain-containing protein OS=Amphimedon queenslandica OX=400682 PE=4 SV=1
OG0000000	Branchiostoma_floridae_tr_A0A9J7L8L7_A0A9J7L8L7_BRAFL tr|A0A9J7L8L7|A0A9J7L8L7_BRAFL Angiopoietin-related protein 3-like OS=Branchiostoma floridae OX=7739 GN=LOC118416624 PE=4 SV=1	Amphimedon_queenslandica_tr_A0A1X7TKD1_A0A1X7TKD1_AMPQE tr_A0A1X7TKD1_A0A1X7TKD1_AMPQE Fibrinogen C-terminal domain-containing protein OS=Amphimedon queenslandica OX=400682 PE=4 SV=1, Amphimedon_queenslandica_tr_A0A1X7THB2_A0A1X7THB2_AMPQE tr_A0A1X7THB2_A0A1X7THB2_AMPQE Fibrinogen C-terminal domain-containing protein OS=Amphimedon queenslandica OX=400682 PE=4 SV=1, Amphimedon_queenslandica_tr_A0A1X7T7C3_A0A1X7T7C3_AMPQE tr_A0A1X7T7C3_A0A1X7T7C3_AMPQE Angiopoietin-related protein 4 OS=Amphimedon queenslandica OX=400682 PE=4 SV=1
OG0000000	Branchiostoma_floridae_tr_A0A9J7N0A1_A0A9J7N0A1_BRAFL tr|A0A9J7N0A1|A0A9J7N0A1_BRAFL Uncharacterized protein LOC118421761 OS=Branchiostoma floridae OX=7739 GN=LOC118421761 PE=4 SV=1, Branchiostoma_floridae_tr_A0A9J7MZB8_A0A9J7MZB8_BRAFL tr|A0A9J7MZB8|A0A9J7MZB8_BRAFL Microfibril-associated glycoprotein 4-like OS=Branchiostoma floridae OX=7739 GN=LOC118421299 PE=4 SV=1, Branchiostoma_floridae_tr_A0A9J7MY72_A0A9J7MY72_BRAFL tr|A0A9J7MY72|A0A9J7MY72_BRAFL Microfibril-associated glycoprotein 4-like OS=Branchiostoma floridae OX=7739 GN=LOC118421300 PE=4 SV=1, Branchiostoma_floridae_tr_A0A9J7LNR3_A0A9J7LNR3_BRAFL tr|A0A9J7LNR3|A0A9J7LNR3_BRAFL Ryncolin-1-like OS=Branchiostoma floridae OX=7739 GN=LOC118421760 PE=4 SV=1, Branchiostoma_floridae_tr_A0A9J7LL47_A0A9J7LL47_BRAFL tr|A0A9J7LL47|A0A9J7LL47_BRAFL Ficolin-2-like OS=Branchiostoma floridae OX=7739 GN=LOC118421615 PE=4 SV=1, Branchiostoma_floridae_tr_A0A9J7MF63_A0A9J7MF63_BRAFL tr|A0A9J7MF63|A0A9J7MF63_BRAFL Ficolin-2-like OS=Branchiostoma floridae OX=7739 GN=LOC118431928 PE=4 SV=1, Branchiostoma_floridae_tr_A0A9J7MC07_A0A9J7MC07_BRAFL tr|A0A9J7MC07|A0A9J7MC07_BRAFL Fibrinogen C domain-containing protein 1-like OS=Branchiostoma floridae OX=7739 GN=LOC118431100 PE=4 SV=1, Branchiostoma_floridae_tr_A0A9J7MAD2_A0A9J7MAD2_BRAFL tr|A0A9J7MAD2|A0A9J7MAD2_BRAFL Angiopoietin-2-like OS=Branchiostoma floridae OX=7739 GN=LOC118430281 PE=4 SV=1, Branchiostoma_floridae_tr_A0A9J7MWL1_A0A9J7MWL1_BRAFL tr|A0A9J7MWL1|A0A9J7MWL1_BRAFL Ficolin-2-like OS=Branchiostoma floridae OX=7739 GN=LOC118421173 PE=4 SV=1, Branchiostoma_floridae_tr_A0A9J7LL70_A0A9J7LL70_BRAFL tr|A0A9J7LL70|A0A9J7LL70_BRAFL Fibrinogen C domain-containing protein 1-like OS=Branchiostoma floridae OX=7739 GN=LOC118421145 PE=4 SV=1, Branchiostoma_floridae_tr_A0A9J7MY04_A0A9J7MY04_BRAFL tr|A0A9J7MY04|A0A9J7MY04_BRAFL Fibrinogen C domain-containing protein 1-A-like OS=Branchiostoma floridae OX=7739 GN=LOC118421176 PE=4 SV=1, Branchiostoma_floridae_tr_A0A9J7MZ66_A0A9J7MZ66_BRAFL tr|A0A9J7MZ66|A0A9J7MZ66_BRAFL Ficolin-2-like OS=Branchiostoma floridae OX=7739 GN=LOC118421175 PE=4 SV=1, Branchiostoma_floridae_tr_A0A9J7LJY3_A0A9J7LJY3_BRAFL tr|A0A9J7LJY3|A0A9J7LJY3_BRAFL Ficolin-2-like OS=Branchiostoma floridae OX=7739 GN=LOC118421177 PE=4 SV=1, Branchiostoma_floridae_tr_A0A9J7MZ41_A0A9J7MZ41_BRAFL tr|A0A9J7MZ41|A0A9J7MZ41_BRAFL Ficolin-2-like OS=Branchiostoma floridae OX=7739 GN=LOC118421102 PE=4 SV=1, Branchiostoma_floridae_tr_A0A9J7LM23_A0A9J7LM23_BRAFL tr|A0A9J7LM23|A0A9J7LM23_BRAFL Fibrinogen C domain-containing protein 1-like OS=Branchiostoma floridae OX=7739 GN=LOC118421181 PE=4 SV=1, Branchiostoma_floridae_tr_A0A9J7LRW3_A0A9J7LRW3_BRAFL tr|A0A9J7LRW3|A0A9J7LRW3_BRAFL Ficolin-1-like OS=Branchiostoma floridae OX=7739 GN=LOC118423398 PE=4 SV=1, Branchiostoma_floridae_tr_A0A9J7MYB9_A0A9J7MYB9_BRAFL tr|A0A9J7MYB9|A0A9J7MYB9_BRAFL Ficolin-1-like OS=Branchiostoma floridae OX=7739 GN=LOC118421402 PE=4 SV=1, Branchiostoma_floridae_tr_A0A9J7HW56_A0A9J7HW56_BRAFL tr|A0A9J7HW56|A0A9J7HW56_BRAFL Ficolin-1-like OS=Branchiostoma floridae OX=7739 GN=LOC118408877 PE=4 SV=1, Branchiostoma_floridae_tr_A0A9J7N0I8_A0A9J7N0I8_BRAFL tr|A0A9J7N0I8|A0A9J7N0I8_BRAFL Ryncolin-1-like OS=Branchiostoma floridae OX=7739 GN=LOC118422273 PE=4 SV=1, Branchiostoma_floridae_tr_A0A9J7LQ57_A0A9J7LQ57_BRAFL tr|A0A9J7LQ57|A0A9J7LQ57_BRAFL Ficolin-1-like OS=Branchiostoma floridae OX=7739 GN=LOC118422563 PE=4 SV=1, Branchiostoma_floridae_tr_A0A9J7LQ44_A0A9J7LQ44_BRAFL tr|A0A9J7LQ44|A0A9J7LQ44_BRAFL Ficolin-1-like OS=Branchiostoma floridae OX=7739 GN=LOC118422564 PE=4 SV=1, Branchiostoma_floridae_tr_A0A9J7LNA7_A0A9J7LNA7_BRAFL tr|A0A9J7LNA7|A0A9J7LNA7_BRAFL Ficolin-1-like OS=Branchiostoma floridae OX=7739 GN=LOC118422559 PE=4 SV=1, Branchiostoma_floridae_tr_A0A9J7LRV7_A0A9J7LRV7_BRAFL tr|A0A9J7LRV7|A0A9J7LRV7_BRAFL Ryncolin-1-like OS=Branchiostoma floridae OX=7739 GN=LOC118423194 PE=4 SV=1, Branchiostoma_floridae_tr_A0A9J7LT20_A0A9J7LT20_BRAFL tr|A0A9J7LT20|A0A9J7LT20_BRAFL Fibrinogen C domain-containing protein 1-like OS=Branchiostoma floridae OX=7739 GN=LOC118423617 PE=4 SV=1, Branchiostoma_floridae_tr_A0A9J7N926_A0A9J7N926_BRAFL tr|A0A9J7N926|A0A9J7N926_BRAFL Uncharacterized protein LOC118430604 OS=Branchiostoma floridae OX=7739 GN=LOC118430604 PE=4 SV=1, Branchiostoma_floridae_tr_A0A9J7HIT6_A0A9J7HIT6_BRAFL tr|A0A9J7HIT6|A0A9J7HIT6_BRAFL Ficolin-1-like OS=Branchiostoma floridae OX=7739 GN=LOC118404148 PE=4 SV=1, Branchiostoma_floridae_tr_A0A9J7HLS3_A0A9J7HLS3_BRAFL tr|A0A9J7HLS3|A0A9J7HLS3_BRAFL Microfibril-associated glycoprotein 4-like OS=Branchiostoma floridae OX=7739 GN=LOC118406154 PE=4 SV=1, Branchiostoma_floridae_tr_A0A9J7M5V3_A0A9J7M5V3_BRAFL tr|A0A9J7M5V3|A0A9J7M5V3_BRAFL Microfibril-associated glycoprotein 4-like OS=Branchiostoma floridae OX=7739 GN=LOC118428694 PE=4 SV=1, Branchiostoma_floridae_tr_C3Z9N5_C3Z9N5_BRAFL tr|C3Z9N5|C3Z9N5_BRAFL Microfibril-associated glycoprotein 4-like isoform X1 OS=Branchiostoma floridae OX=7739 GN=LOC118403339 PE=4 SV=1, Branchiostoma_floridae_tr_A0A9J7KGQ6_A0A9J7KGQ6_BRAFL tr|A0A9J7KGQ6|A0A9J7KGQ6_BRAFL Microfibril-associated glycoprotein 4-like isoform X2 OS=Branchiostoma floridae OX=7739 GN=LOC118403339 PE=4 SV=1, Branchiostoma_floridae_tr_A0A9J7KFN4_A0A9J7KFN4_BRAFL tr|A0A9J7KFN4|A0A9J7KFN4_BRAFL Microfibril-associated glycoprotein 4-like isoform X3 OS=Branchiostoma floridae OX=7739 GN=LOC118403339 PE=4 SV=1, Branchiostoma_floridae_tr_A0A9J7ML58_A0A9J7ML58_BRAFL tr|A0A9J7ML58|A0A9J7ML58_BRAFL Microfibril-associated glycoprotein 4-like OS=Branchiostoma floridae OX=7739 GN=LOC118412446 PE=4 SV=1, Branchiostoma_floridae_tr_A0A9J7MLB1_A0A9J7MLB1_BRAFL tr|A0A9J7MLB1|A0A9J7MLB1_BRAFL Microfibril-associated glycoprotein 4-like OS=Branchiostoma floridae OX=7739 GN=LOC118412444 PE=4 SV=1, Branchiostoma_floridae_tr_A0A9J7KU53_A0A9J7KU53_BRAFL tr|A0A9J7KU53|A0A9J7KU53_BRAFL LOW QUALITY PROTEIN_ ficolin-1-like OS=Branchiostoma floridae OX=7739 GN=LOC118411679 PE=4 SV=1, Branchiostoma_floridae_tr_A0A9J7KUI2_A0A9J7KUI2_BRAFL tr|A0A9J7KUI2|A0A9J7KUI2_BRAFL Ficolin-1-like OS=Branchiostoma floridae OX=7739 GN=LOC118412231 PE=4 SV=1, Branchiostoma_floridae_tr_A0A9J7MJ34_A0A9J7MJ34_BRAFL tr|A0A9J7MJ34|A0A9J7MJ34_BRAFL Fibroleukin-like OS=Branchiostoma floridae OX=7739 GN=LOC118411206 PE=4 SV=1, Branchiostoma_floridae_tr_A0A9J7M8P2_A0A9J7M8P2_BRAFL tr|A0A9J7M8P2|A0A9J7M8P2_BRAFL LOW QUALITY PROTEIN_ fibrinogen C domain-containing protein 1-like OS=Branchiostoma floridae OX=7739 GN=LOC118430235 PE=4 SV=1, Branchiostoma_floridae_tr_A0A9J7KV88_A0A9J7KV88_BRAFL tr|A0A9J7KV88|A0A9J7KV88_BRAFL Ficolin-1-like OS=Branchiostoma floridae OX=7739 GN=LOC118412452 PE=4 SV=1, Branchiostoma_floridae_tr_A0A9J7LLG5_A0A9J7LLG5_BRAFL tr|A0A9J7LLG5|A0A9J7LLG5_BRAFL Uncharacterized protein LOC118421508 OS=Branchiostoma floridae OX=7739 GN=LOC118421508 PE=4 SV=1, Branchiostoma_floridae_tr_A0A9J7LK76_A0A9J7LK76_BRAFL tr|A0A9J7LK76|A0A9J7LK76_BRAFL Uncharacterized protein LOC118421237 OS=Branchiostoma floridae OX=7739 GN=LOC118421237 PE=4 SV=1, Branchiostoma_floridae_tr_A0A9J7L664_A0A9J7L664_BRAFL tr|A0A9J7L664|A0A9J7L664_BRAFL Ficolin-1-like OS=Branchiostoma floridae OX=7739 GN=LOC118416083 PE=4 SV=1	Amphimedon_queenslandica_tr_A0A1X7ULD6_A0A1X7ULD6_AMPQE tr_A0A1X7ULD6_A0A1X7ULD6_AMPQE Fibrinogen C-terminal domain-containing protein OS=Amphimedon queenslandica OX=400682 GN=105313195 PE=4 SV=1, Amphimedon_queenslandica_tr_A0A1X7UNX5_A0A1X7UNX5_AMPQE tr_A0A1X7UNX5_A0A1X7UNX5_AMPQE Fibrinogen C-terminal domain-containing protein OS=Amphimedon queenslandica OX=400682 PE=4 SV=1, Amphimedon_queenslandica_tr_A0A1X7VAP0_A0A1X7VAP0_AMPQE tr_A0A1X7VAP0_A0A1X7VAP0_AMPQE Fibrinogen C-terminal domain-containing protein OS=Amphimedon queenslandica OX=400682 GN=100637828 PE=4 SV=1, Amphimedon_queenslandica_tr_A0A1X7UEI3_A0A1X7UEI3_AMPQE tr_A0A1X7UEI3_A0A1X7UEI3_AMPQE Fibrinogen C-terminal domain-containing protein OS=Amphimedon queenslandica OX=400682 PE=4 SV=1, Amphimedon_queenslandica_tr_A0A1X7TEI7_A0A1X7TEI7_AMPQE tr_A0A1X7TEI7_A0A1X7TEI7_AMPQE Fibrinogen C-terminal domain-containing protein OS=Amphimedon queenslandica OX=400682 PE=4 SV=1, Amphimedon_queenslandica_tr_A0A1X7SPQ0_A0A1X7SPQ0_AMPQE tr_A0A1X7SPQ0_A0A1X7SPQ0_AMPQE Fibrinogen C-terminal domain-containing protein OS=Amphimedon queenslandica OX=400682 PE=4 SV=1, Amphimedon_queenslandica_tr_A0A1X7TF91_A0A1X7TF91_AMPQE tr_A0A1X7TF91_A0A1X7TF91_AMPQE Fibrinogen C-terminal domain-containing protein OS=Amphimedon queenslandica OX=400682 PE=4 SV=1, Amphimedon_queenslandica_tr_A0A1X7UXI6_A0A1X7UXI6_AMPQE tr_A0A1X7UXI6_A0A1X7UXI6_AMPQE Fibrinogen C-terminal domain-containing protein OS=Amphimedon queenslandica OX=400682 PE=4 SV=1, Amphimedon_queenslandica_tr_A0A1X7UYQ5_A0A1X7UYQ5_AMPQE tr_A0A1X7UYQ5_A0A1X7UYQ5_AMPQE Fibrinogen C-terminal domain-containing protein OS=Amphimedon queenslandica OX=400682 GN=100632538 PE=4 SV=1, Amphimedon_queenslandica_tr_A0A1X7TTH3_A0A1X7TTH3_AMPQE tr_A0A1X7TTH3_A0A1X7TTH3_AMPQE Fibrinogen C-terminal domain-containing protein OS=Amphimedon queenslandica OX=400682 PE=4 SV=1, Amphimedon_queenslandica_tr_A0A1X7TT50_A0A1X7TT50_AMPQE tr_A0A1X7TT50_A0A1X7TT50_AMPQE Fibrinogen C-terminal domain-containing protein OS=Amphimedon queenslandica OX=400682 GN=100639626 PE=4 SV=1, Amphimedon_queenslandica_tr_A0A1X7U6Q1_A0A1X7U6Q1_AMPQE tr_A0A1X7U6Q1_A0A1X7U6Q1_AMPQE Fibrinogen C-terminal domain-containing protein OS=Amphimedon queenslandica OX=400682 PE=4 SV=1, Amphimedon_queenslandica_tr_A0A1X7U6Q6_A0A1X7U6Q6_AMPQE tr_A0A1X7U6Q6_A0A1X7U6Q6_AMPQE Fibrinogen C-terminal domain-containing protein OS=Amphimedon queenslandica OX=400682 PE=4 SV=1, Amphimedon_queenslandica_tr_A0A1X7T854_A0A1X7T854_AMPQE tr_A0A1X7T854_A0A1X7T854_AMPQE Fibrinogen C-terminal domain-containing protein OS=Amphimedon queenslandica OX=400682 GN=100637814 PE=4 SV=1, Amphimedon_queenslandica_tr_A0A1X7U6G7_A0A1X7U6G7_AMPQE tr_A0A1X7U6G7_A0A1X7U6G7_AMPQE Fibrinogen C-terminal domain-containing protein OS=Amphimedon queenslandica OX=400682 GN=105313870 PE=4 SV=1, Amphimedon_queenslandica_tr_A0A1X7TRL5_A0A1X7TRL5_AMPQE tr_A0A1X7TRL5_A0A1X7TRL5_AMPQE Fibrinogen C-terminal domain-containing protein OS=Amphimedon queenslandica OX=400682 GN=100634289 PE=4 SV=1, Amphimedon_queenslandica_tr_A0A1X7U772_A0A1X7U772_AMPQE tr_A0A1X7U772_A0A1X7U772_AMPQE Fibrinogen C-terminal domain-containing protein OS=Amphimedon queenslandica OX=400682 GN=105313869 PE=4 SV=1, Amphimedon_queenslandica_tr_A0A1X7TNT2_A0A1X7TNT2_AMPQE tr_A0A1X7TNT2_A0A1X7TNT2_AMPQE Fibrinogen C-terminal domain-containing protein OS=Amphimedon queenslandica OX=400682 GN=100639582 PE=4 SV=1, Amphimedon_queenslandica_tr_A0A1X7STA5_A0A1X7STA5_AMPQE tr_A0A1X7STA5_A0A1X7STA5_AMPQE Fibrinogen C-terminal domain-containing protein OS=Amphimedon queenslandica OX=400682 PE=4 SV=1, Amphimedon_queenslandica_tr_A0A1X7TF57_A0A1X7TF57_AMPQE tr_A0A1X7TF57_A0A1X7TF57_AMPQE Fibrinogen C-terminal domain-containing protein OS=Amphimedon queenslandica OX=400682 GN=100633103 PE=4 SV=1, Amphimedon_queenslandica_tr_A0A1X7T456_A0A1X7T456_AMPQE tr_A0A1X7T456_A0A1X7T456_AMPQE Fibrinogen C-terminal domain-containing protein OS=Amphimedon queenslandica OX=400682 PE=4 SV=1, Amphimedon_queenslandica_tr_A0A1X7U0N8_A0A1X7U0N8_AMPQE tr_A0A1X7U0N8_A0A1X7U0N8_AMPQE Fibrinogen C-terminal domain-containing protein OS=Amphimedon queenslandica OX=400682 GN=105314125 PE=4 SV=1, Amphimedon_queenslandica_tr_A0A1X7U0C2_A0A1X7U0C2_AMPQE tr_A0A1X7U0C2_A0A1X7U0C2_AMPQE Fibrinogen C-terminal domain-containing protein OS=Amphimedon queenslandica OX=400682 PE=4 SV=1, Amphimedon_queenslandica_tr_A0A1X7TP65_A0A1X7TP65_AMPQE tr_A0A1X7TP65_A0A1X7TP65_AMPQE Arpin OS=Amphimedon queenslandica OX=400682 PE=3 SV=1, Amphimedon_queenslandica_tr_A0A1X7U606_A0A1X7U606_AMPQE tr_A0A1X7U606_A0A1X7U606_AMPQE Fibrinogen C-terminal domain-containing protein OS=Amphimedon queenslandica OX=400682 PE=4 SV=1, Amphimedon_queenslandica_tr_A0A1X7T8J7_A0A1X7T8J7_AMPQE tr_A0A1X7T8J7_A0A1X7T8J7_AMPQE Fibrinogen C-terminal domain-containing protein OS=Amphimedon queenslandica OX=400682 PE=4 SV=1
OG0000000	Branchiostoma_floridae_tr_A0A9J7KW45_A0A9J7KW45_BRAFL tr|A0A9J7KW45|A0A9J7KW45_BRAFL Uncharacterized protein LOC118412713 OS=Branchiostoma floridae OX=7739 GN=LOC118412713 PE=3 SV=1, Branchiostoma_floridae_tr_A0A9J7M3S0_A0A9J7M3S0_BRAFL tr|A0A9J7M3S0|A0A9J7M3S0_BRAFL Angiopoietin-related protein 2-like OS=Branchiostoma floridae OX=7739 GN=LOC118427718 PE=4 SV=1, Branchiostoma_floridae_tr_A0A9J7HSV3_A0A9J7HSV3_BRAFL tr|A0A9J7HSV3|A0A9J7HSV3_BRAFL Fibrinogen-like protein 1 OS=Branchiostoma floridae OX=7739 GN=LOC118407468 PE=4 SV=1, Branchiostoma_floridae_tr_A0A9J7MCY7_A0A9J7MCY7_BRAFL tr|A0A9J7MCY7|A0A9J7MCY7_BRAFL Microfibril-associated glycoprotein 4-like OS=Branchiostoma floridae OX=7739 GN=LOC118430807 PE=4 SV=1, Branchiostoma_floridae_tr_A0A9J7NAJ8_A0A9J7NAJ8_BRAFL tr|A0A9J7NAJ8|A0A9J7NAJ8_BRAFL Microfibril-associated glycoprotein 4-like OS=Branchiostoma floridae OX=7739 GN=LOC118430452 PE=4 SV=1, Branchiostoma_floridae_tr_A0A9J7M9E9_A0A9J7M9E9_BRAFL tr|A0A9J7M9E9|A0A9J7M9E9_BRAFL Microfibril-associated glycoprotein 4-like OS=Branchiostoma floridae OX=7739 GN=LOC118430453 PE=4 SV=1, Branchiostoma_floridae_tr_A0A9J7HQ98_A0A9J7HQ98_BRAFL tr|A0A9J7HQ98|A0A9J7HQ98_BRAFL Microfibril-associated glycoprotein 4-like OS=Branchiostoma floridae OX=7739 GN=LOC118407467 PE=4 SV=1, Branchiostoma_floridae_tr_A0A9J7HUF6_A0A9J7HUF6_BRAFL tr|A0A9J7HUF6|A0A9J7HUF6_BRAFL Angiopoietin-related protein 2-like isoform X2 OS=Branchiostoma floridae OX=7739 GN=LOC118407825 PE=4 SV=1, Branchiostoma_floridae_tr_A0A9J7LSH7_A0A9J7LSH7_BRAFL tr|A0A9J7LSH7|A0A9J7LSH7_BRAFL Ficolin-2-like OS=Branchiostoma floridae OX=7739 GN=LOC118423545 PE=4 SV=1, Branchiostoma_floridae_tr_A0A9J7KSC7_A0A9J7KSC7_BRAFL tr|A0A9J7KSC7|A0A9J7KSC7_BRAFL Microfibril-associated glycoprotein 4-like OS=Branchiostoma floridae OX=7739 GN=LOC118411437 PE=4 SV=1, Branchiostoma_floridae_tr_A0A9J7KTE2_A0A9J7KTE2_BRAFL tr|A0A9J7KTE2|A0A9J7KTE2_BRAFL Angiopoietin-related protein 2-like OS=Branchiostoma floridae OX=7739 GN=LOC118411858 PE=4 SV=1, Branchiostoma_floridae_tr_A0A9J7KTS1_A0A9J7KTS1_BRAFL tr|A0A9J7KTS1|A0A9J7KTS1_BRAFL Angiopoietin-2-like OS=Branchiostoma floridae OX=7739 GN=LOC118411435 PE=4 SV=1, Branchiostoma_floridae_tr_A0A9J7KTX9_A0A9J7KTX9_BRAFL tr|A0A9J7KTX9|A0A9J7KTX9_BRAFL Deleted in malignant brain tumors 1 protein-like OS=Branchiostoma floridae OX=7739 GN=LOC118411866 PE=4 SV=1, Branchiostoma_floridae_tr_A0A9J7MJV0_A0A9J7MJV0_BRAFL tr|A0A9J7MJV0|A0A9J7MJV0_BRAFL Uncharacterized protein LOC118411865 OS=Branchiostoma floridae OX=7739 GN=LOC118411865 PE=4 SV=1, Branchiostoma_floridae_tr_A0A9J7MKE1_A0A9J7MKE1_BRAFL tr|A0A9J7MKE1|A0A9J7MKE1_BRAFL Scavenger receptor cysteine-rich domain superfamily protein-like OS=Branchiostoma floridae OX=7739 GN=LOC118411813 PE=4 SV=1, Branchiostoma_floridae_tr_A0A9J7MKF6_A0A9J7MKF6_BRAFL tr|A0A9J7MKF6|A0A9J7MKF6_BRAFL Microfibril-associated glycoprotein 4-like OS=Branchiostoma floridae OX=7739 GN=LOC118411856 PE=4 SV=1, Branchiostoma_floridae_tr_A0A9J7NAW1_A0A9J7NAW1_BRAFL tr|A0A9J7NAW1|A0A9J7NAW1_BRAFL Angiopoietin-4-like isoform X1 OS=Branchiostoma floridae OX=7739 GN=LOC118430451 PE=4 SV=1, Branchiostoma_floridae_tr_A0A9J7NBR5_A0A9J7NBR5_BRAFL tr|A0A9J7NBR5|A0A9J7NBR5_BRAFL Angiopoietin-4-like isoform X2 OS=Branchiostoma floridae OX=7739 GN=LOC118430451 PE=4 SV=1, Branchiostoma_floridae_tr_A0A9J7HR55_A0A9J7HR55_BRAFL tr|A0A9J7HR55|A0A9J7HR55_BRAFL Uncharacterized protein LOC118407816 OS=Branchiostoma floridae OX=7739 GN=LOC118407816 PE=4 SV=1, Branchiostoma_floridae_tr_A0A9J7KKY6_A0A9J7KKY6_BRAFL tr|A0A9J7KKY6|A0A9J7KKY6_BRAFL Fibrinogen-like protein 1 OS=Branchiostoma floridae OX=7739 GN=LOC118407819 PE=4 SV=1, Branchiostoma_floridae_tr_A0A9J7HTS9_A0A9J7HTS9_BRAFL tr|A0A9J7HTS9|A0A9J7HTS9_BRAFL Angiopoietin-2-like OS=Branchiostoma floridae OX=7739 GN=LOC118407826 PE=4 SV=1, Branchiostoma_floridae_tr_A0A9J7KTF8_A0A9J7KTF8_BRAFL tr|A0A9J7KTF8|A0A9J7KTF8_BRAFL Ficolin-2-like OS=Branchiostoma floridae OX=7739 GN=LOC118411875 PE=4 SV=1, Branchiostoma_floridae_tr_A0A9J7LVQ0_A0A9J7LVQ0_BRAFL tr|A0A9J7LVQ0|A0A9J7LVQ0_BRAFL Fibrinogen-like protein 1 OS=Branchiostoma floridae OX=7739 GN=LOC118424735 PE=4 SV=1, Branchiostoma_floridae_tr_A0A9J7MJD6_A0A9J7MJD6_BRAFL tr|A0A9J7MJD6|A0A9J7MJD6_BRAFL Angiopoietin-2-like OS=Branchiostoma floridae OX=7739 GN=LOC118411440 PE=4 SV=1, Branchiostoma_floridae_tr_A0A9J7KU64_A0A9J7KU64_BRAFL tr|A0A9J7KU64|A0A9J7KU64_BRAFL Angiopoietin-2-like OS=Branchiostoma floridae OX=7739 GN=LOC118411426 PE=4 SV=1	Amphimedon_queenslandica_tr_A0A1X7UEG4_A0A1X7UEG4_AMPQE tr_A0A1X7UEG4_A0A1X7UEG4_AMPQE Fibrinogen C-terminal domain-containing protein OS=Amphimedon queenslandica OX=400682 PE=4 SV=1, Amphimedon_queenslandica_tr_A0A1X7VPP5_A0A1X7VPP5_AMPQE tr_A0A1X7VPP5_A0A1X7VPP5_AMPQE Uncharacterized protein OS=Amphimedon queenslandica OX=400682 PE=4 SV=1, Amphimedon_queenslandica_tr_A0A1X7TEX2_A0A1X7TEX2_AMPQE tr_A0A1X7TEX2_A0A1X7TEX2_AMPQE Uncharacterized protein OS=Amphimedon queenslandica OX=400682 PE=4 SV=1, Amphimedon_queenslandica_tr_A0A1X7TFJ4_A0A1X7TFJ4_AMPQE tr_A0A1X7TFJ4_A0A1X7TFJ4_AMPQE Fibrinogen C-terminal domain-containing protein OS=Amphimedon queenslandica OX=400682 PE=4 SV=1, Amphimedon_queenslandica_tr_A0A1X7TFU9_A0A1X7TFU9_AMPQE tr_A0A1X7TFU9_A0A1X7TFU9_AMPQE Fibrinogen C-terminal domain-containing protein OS=Amphimedon queenslandica OX=400682 PE=4 SV=1
OG0000000	Branchiostoma_floridae_tr_A0A9J7L5Y5_A0A9J7L5Y5_BRAFL tr|A0A9J7L5Y5|A0A9J7L5Y5_BRAFL Fibroleukin-like OS=Branchiostoma floridae OX=7739 GN=LOC118415373 PE=4 SV=1	Amphimedon_queenslandica_tr_A0A1X7VK27_A0A1X7VK27_AMPQE tr_A0A1X7VK27_A0A1X7VK27_AMPQE Fibrinogen C-terminal domain-containing protein OS=Amphimedon queenslandica OX=400682 GN=100632192 PE=4 SV=1
OG0000001	Branchiostoma_floridae_tr_A0A9J7L569_A0A9J7L569_BRAFL tr|A0A9J7L569|A0A9J7L569_BRAFL Netrin-1 OS=Branchiostoma floridae OX=7739 GN=LOC118415570 PE=4 SV=1, Branchiostoma_floridae_tr_A0A9J7L7R6_A0A9J7L7R6_BRAFL tr|A0A9J7L7R6|A0A9J7L7R6_BRAFL Laminin subunit beta-1-like isoform X4 OS=Branchiostoma floridae OX=7739 GN=LOC118416742 PE=4 SV=1, Branchiostoma_floridae_tr_A0A9J7L7W8_A0A9J7L7W8_BRAFL tr|A0A9J7L7W8|A0A9J7L7W8_BRAFL Laminin subunit beta-1-like isoform X6 OS=Branchiostoma floridae OX=7739 GN=LOC118416742 PE=4 SV=1, Branchiostoma_floridae_tr_A0A9J7L7Z9_A0A9J7L7Z9_BRAFL tr|A0A9J7L7Z9|A0A9J7L7Z9_BRAFL Laminin subunit beta-1-like isoform X2 OS=Branchiostoma floridae OX=7739 GN=LOC118416742 PE=4 SV=1, Branchiostoma_floridae_tr_A0A9J7MS81_A0A9J7MS81_BRAFL tr|A0A9J7MS81|A0A9J7MS81_BRAFL Laminin subunit beta-1-like isoform X1 OS=Branchiostoma floridae OX=7739 GN=LOC118416742 PE=4 SV=1, Branchiostoma_floridae_tr_A0A9J7LAB9_A0A9J7LAB9_BRAFL tr|A0A9J7LAB9|A0A9J7LAB9_BRAFL Laminin subunit beta-1-like isoform X3 OS=Branchiostoma floridae OX=7739 GN=LOC118416742 PE=4 SV=1, Branchiostoma_floridae_tr_A0A9J7L963_A0A9J7L963_BRAFL tr|A0A9J7L963|A0A9J7L963_BRAFL Laminin subunit beta-1-like isoform X7 OS=Branchiostoma floridae OX=7739 GN=LOC118416742 PE=4 SV=1, Branchiostoma_floridae_tr_A0A9J7L8D4_A0A9J7L8D4_BRAFL tr|A0A9J7L8D4|A0A9J7L8D4_BRAFL Laminin subunit beta-1-like isoform X5 OS=Branchiostoma floridae OX=7739 GN=LOC118416742 PE=4 SV=1, Branchiostoma_floridae_tr_A0A9J7MT27_A0A9J7MT27_BRAFL tr|A0A9J7MT27|A0A9J7MT27_BRAFL Laminin subunit beta-1-like isoform X8 OS=Branchiostoma floridae OX=7739 GN=LOC118416742 PE=4 SV=1, Branchiostoma_floridae_tr_A0A9J7MR92_A0A9J7MR92_BRAFL tr|A0A9J7MR92|A0A9J7MR92_BRAFL Laminin subunit beta-1-like isoform X9 OS=Branchiostoma floridae OX=7739 GN=LOC118416742 PE=4 SV=1	Amphimedon_queenslandica_tr_A0A1X7VTD0_A0A1X7VTD0_AMPQE tr_A0A1X7VTD0_A0A1X7VTD0_AMPQE Uncharacterized protein OS=Amphimedon queenslandica OX=400682 GN=105314164 PE=4 SV=1
OG0000001	Branchiostoma_floridae_tr_A0A9J7MY77_A0A9J7MY77_BRAFL tr|A0A9J7MY77|A0A9J7MY77_BRAFL Tenascin-X-like OS=Branchiostoma floridae OX=7739 GN=LOC118421312 PE=3 SV=1, Branchiostoma_floridae_tr_A0A9J7M7H3_A0A9J7M7H3_BRAFL tr|A0A9J7M7H3|A0A9J7M7H3_BRAFL Phosphatidylinositol phosphatase PTPRQ-like OS=Branchiostoma floridae OX=7739 GN=LOC118429282 PE=4 SV=1, Branchiostoma_floridae_tr_A0A9J7NAS6_A0A9J7NAS6_BRAFL tr|A0A9J7NAS6|A0A9J7NAS6_BRAFL Protein sidekick-2-like OS=Branchiostoma floridae OX=7739 GN=LOC118429283 PE=4 SV=1, Branchiostoma_floridae_tr_A0A9J7M892_A0A9J7M892_BRAFL tr|A0A9J7M892|A0A9J7M892_BRAFL Uncharacterized protein LOC118428459 isoform X1 OS=Branchiostoma floridae OX=7739 GN=LOC118428459 PE=4 SV=1, Branchiostoma_floridae_tr_A0A9J7M6I6_A0A9J7M6I6_BRAFL tr|A0A9J7M6I6|A0A9J7M6I6_BRAFL Uncharacterized protein LOC118428459 isoform X3 OS=Branchiostoma floridae OX=7739 GN=LOC118428459 PE=4 SV=1, Branchiostoma_floridae_tr_A0A9J7M5F2_A0A9J7M5F2_BRAFL tr|A0A9J7M5F2|A0A9J7M5F2_BRAFL Uncharacterized protein LOC118428459 isoform X4 OS=Branchiostoma floridae OX=7739 GN=LOC118428459 PE=4 SV=1, Branchiostoma_floridae_tr_A0A9J7N5V0_A0A9J7N5V0_BRAFL tr|A0A9J7N5V0|A0A9J7N5V0_BRAFL Uncharacterized protein LOC118428459 isoform X5 OS=Branchiostoma floridae OX=7739 GN=LOC118428459 PE=4 SV=1	Amphimedon_queenslandica_tr_A0A1X7VJK8_A0A1X7VJK8_AMPQE tr_A0A1X7VJK8_A0A1X7VJK8_AMPQE Uncharacterized protein OS=Amphimedon queenslandica OX=400682 PE=4 SV=1, Amphimedon_queenslandica_tr_A0A1X7VJP3_A0A1X7VJP3_AMPQE tr_A0A1X7VJP3_A0A1X7VJP3_AMPQE Uncharacterized protein OS=Amphimedon queenslandica OX=400682 PE=4 SV=1, Amphimedon_queenslandica_tr_A0A1X7ULH8_A0A1X7ULH8_AMPQE tr_A0A1X7ULH8_A0A1X7ULH8_AMPQE Uncharacterized protein OS=Amphimedon queenslandica OX=400682 PE=3 SV=1, Amphimedon_queenslandica_tr_A0A1X7VI68_A0A1X7VI68_AMPQE tr_A0A1X7VI68_A0A1X7VI68_AMPQE Uncharacterized protein OS=Amphimedon queenslandica OX=400682 PE=4 SV=1
OG0000001	Branchiostoma_floridae_tr_A0A9J7MCB2_A0A9J7MCB2_BRAFL tr|A0A9J7MCB2|A0A9J7MCB2_BRAFL Receptor-type tyrosine-protein phosphatase F-like OS=Branchiostoma floridae OX=7739 GN=LOC118431483 PE=3 SV=1, Branchiostoma_floridae_tr_A0A9J7MFK4_A0A9J7MFK4_BRAFL tr|A0A9J7MFK4|A0A9J7MFK4_BRAFL Phosphatidylinositol phosphatase PTPRQ-like isoform X1 OS=Branchiostoma floridae OX=7739 GN=LOC118432370 PE=3 SV=1, Branchiostoma_floridae_tr_A0A9J7MEP3_A0A9J7MEP3_BRAFL tr|A0A9J7MEP3|A0A9J7MEP3_BRAFL Phosphatidylinositol phosphatase PTPRQ-like isoform X2 OS=Branchiostoma floridae OX=7739 GN=LOC118432370 PE=3 SV=1, Branchiostoma_floridae_tr_A0A9J7MWN7_A0A9J7MWN7_BRAFL tr|A0A9J7MWN7|A0A9J7MWN7_BRAFL Uncharacterized protein LOC118420158 OS=Branchiostoma floridae OX=7739 GN=LOC118420158 PE=4 SV=1, Branchiostoma_floridae_tr_A0A9J7LG31_A0A9J7LG31_BRAFL tr|A0A9J7LG31|A0A9J7LG31_BRAFL Protein sidekick-2-like OS=Branchiostoma floridae OX=7739 GN=LOC118419505 PE=4 SV=1	Amphimedon_queenslandica_tr_A0A1X7UDR2_A0A1X7UDR2_AMPQE tr_A0A1X7UDR2_A0A1X7UDR2_AMPQE Uncharacterized protein OS=Amphimedon queenslandica OX=400682 PE=4 SV=1, Amphimedon_queenslandica_tr_A0A1X7UEI7_A0A1X7UEI7_AMPQE tr_A0A1X7UEI7_A0A1X7UEI7_AMPQE Uncharacterized protein OS=Amphimedon queenslandica OX=400682 PE=4 SV=1, Amphimedon_queenslandica_tr_A0A1X7UEK4_A0A1X7UEK4_AMPQE tr_A0A1X7UEK4_A0A1X7UEK4_AMPQE Uncharacterized protein OS=Amphimedon queenslandica OX=400682 PE=4 SV=1, Amphimedon_queenslandica_tr_A0A1X7SR16_A0A1X7SR16_AMPQE tr_A0A1X7SR16_A0A1X7SR16_AMPQE Uncharacterized protein OS=Amphimedon queenslandica OX=400682 PE=4 SV=1
OG0000001	Branchiostoma_floridae_tr_A0A9J7LWR5_A0A9J7LWR5_BRAFL tr|A0A9J7LWR5|A0A9J7LWR5_BRAFL Usherin-like OS=Branchiostoma floridae OX=7739 GN=LOC118424239 PE=4 SV=1, Branchiostoma_floridae_tr_A0A9J7L4M2_A0A9J7L4M2_BRAFL tr|A0A9J7L4M2|A0A9J7L4M2_BRAFL Usherin-like OS=Branchiostoma floridae OX=7739 GN=LOC118415341 PE=4 SV=1	Amphimedon_queenslandica_tr_A0A1X7UXM0_A0A1X7UXM0_AMPQE tr_A0A1X7UXM0_A0A1X7UXM0_AMPQE Uncharacterized protein OS=Amphimedon queenslandica OX=400682 GN=105312708 PE=4 SV=1
