Orthogroup	Chordata_Amphioxiformes_Branchiostoma_lanceolatum	Placozoa_Trichoplacidae_Tricoplax_adhaerens
OG0000056	Branchiostoma_lanceolatum_tr_A0A8K0A174_A0A8K0A174_BRALA tr|A0A8K0A174|A0A8K0A174_BRALA RING-type E3 ubiquitin transferase OS=Branchiostoma lanceolatum OX=7740 GN=MID1 PE=4 SV=1, Branchiostoma_lanceolatum_tr_A0A8K0A3S7_A0A8K0A3S7_BRALA tr|A0A8K0A3S7|A0A8K0A3S7_BRALA RING-type E3 ubiquitin transferase OS=Branchiostoma lanceolatum OX=7740 GN=MID1 PE=4 SV=1, Branchiostoma_lanceolatum_tr_A0A8K0A1I7_A0A8K0A1I7_BRALA tr|A0A8K0A1I7|A0A8K0A1I7_BRALA RING-type E3 ubiquitin transferase OS=Branchiostoma lanceolatum OX=7740 GN=MID1 PE=4 SV=1, Branchiostoma_lanceolatum_tr_A0A8J9VXD6_A0A8J9VXD6_BRALA tr|A0A8J9VXD6|A0A8J9VXD6_BRALA RING-type E3 ubiquitin transferase OS=Branchiostoma lanceolatum OX=7740 GN=MID1 PE=4 SV=1, Branchiostoma_lanceolatum_tr_A0A8J9ZCN2_A0A8J9ZCN2_BRALA tr|A0A8J9ZCN2|A0A8J9ZCN2_BRALA RING-type E3 ubiquitin transferase OS=Branchiostoma lanceolatum OX=7740 GN=MID2 PE=4 SV=1, Branchiostoma_lanceolatum_tr_A0A8K0EX75_A0A8K0EX75_BRALA tr|A0A8K0EX75|A0A8K0EX75_BRALA RING-type E3 ubiquitin transferase OS=Branchiostoma lanceolatum OX=7740 GN=MID2 PE=4 SV=1, Branchiostoma_lanceolatum_tr_A0A8K0A8K8_A0A8K0A8K8_BRALA tr|A0A8K0A8K8|A0A8K0A8K8_BRALA RING-type E3 ubiquitin transferase OS=Branchiostoma lanceolatum OX=7740 GN=MID2 PE=4 SV=1, Branchiostoma_lanceolatum_tr_A0A8K0ABK9_A0A8K0ABK9_BRALA tr|A0A8K0ABK9|A0A8K0ABK9_BRALA RING-type E3 ubiquitin transferase OS=Branchiostoma lanceolatum OX=7740 GN=MID2 PE=4 SV=1, Branchiostoma_lanceolatum_tr_A0A8K0A829_A0A8K0A829_BRALA tr|A0A8K0A829|A0A8K0A829_BRALA RING-type E3 ubiquitin transferase OS=Branchiostoma lanceolatum OX=7740 GN=MID2 PE=4 SV=1, Branchiostoma_lanceolatum_tr_A0A8K0E968_A0A8K0E968_BRALA tr|A0A8K0E968|A0A8K0E968_BRALA MID1 protein OS=Branchiostoma lanceolatum OX=7740 GN=MID1 PE=4 SV=1, Branchiostoma_lanceolatum_tr_A0A8J9YMI7_A0A8J9YMI7_BRALA tr|A0A8J9YMI7|A0A8J9YMI7_BRALA MID1 protein OS=Branchiostoma lanceolatum OX=7740 GN=MID1 PE=4 SV=1, Branchiostoma_lanceolatum_tr_A0A8K0EIA7_A0A8K0EIA7_BRALA tr|A0A8K0EIA7|A0A8K0EIA7_BRALA MID1 protein OS=Branchiostoma lanceolatum OX=7740 GN=MID1 PE=4 SV=1, Branchiostoma_lanceolatum_tr_A0A8K0EDZ5_A0A8K0EDZ5_BRALA tr|A0A8K0EDZ5|A0A8K0EDZ5_BRALA MID1 protein OS=Branchiostoma lanceolatum OX=7740 GN=MID1 PE=4 SV=1, Branchiostoma_lanceolatum_tr_A0A8J9YPI7_A0A8J9YPI7_BRALA tr|A0A8J9YPI7|A0A8J9YPI7_BRALA MID1 protein OS=Branchiostoma lanceolatum OX=7740 GN=MID1 PE=4 SV=1, Branchiostoma_lanceolatum_tr_A0A8J9ZE42_A0A8J9ZE42_BRALA tr|A0A8J9ZE42|A0A8J9ZE42_BRALA TRIM36 protein OS=Branchiostoma lanceolatum OX=7740 GN=TRIM36 PE=4 SV=1, Branchiostoma_lanceolatum_tr_A0A8J9ZD77_A0A8J9ZD77_BRALA tr|A0A8J9ZD77|A0A8J9ZD77_BRALA TRIM36 protein OS=Branchiostoma lanceolatum OX=7740 GN=TRIM36 PE=4 SV=1, Branchiostoma_lanceolatum_tr_A0A8J9ZCK6_A0A8J9ZCK6_BRALA tr|A0A8J9ZCK6|A0A8J9ZCK6_BRALA RING-type E3 ubiquitin transferase OS=Branchiostoma lanceolatum OX=7740 GN=MID1 PE=4 SV=1	Tricoplax_adhaerens_tr_B3SAG8_B3SAG8_TRIAD tr_B3SAG8_B3SAG8_TRIAD Uncharacterized protein OS=Trichoplax adhaerens OX=10228 GN=TRIADDRAFT_61254 PE=4 SV=1
OG0000061	Branchiostoma_lanceolatum_tr_A0A8J9ZKP6_A0A8J9ZKP6_BRALA tr|A0A8J9ZKP6|A0A8J9ZKP6_BRALA CPNE3 protein OS=Branchiostoma lanceolatum OX=7740 GN=CPNE3 PE=3 SV=1, Branchiostoma_lanceolatum_tr_A0A8K0EIW3_A0A8K0EIW3_BRALA tr|A0A8K0EIW3|A0A8K0EIW3_BRALA CPNE3 protein OS=Branchiostoma lanceolatum OX=7740 GN=CPNE3 PE=3 SV=1, Branchiostoma_lanceolatum_tr_A0A8K0ENT9_A0A8K0ENT9_BRALA tr|A0A8K0ENT9|A0A8K0ENT9_BRALA CPNE3 protein OS=Branchiostoma lanceolatum OX=7740 GN=CPNE3 PE=3 SV=1, Branchiostoma_lanceolatum_tr_A0A8K0A8B7_A0A8K0A8B7_BRALA tr|A0A8K0A8B7|A0A8K0A8B7_BRALA CPNE7 protein OS=Branchiostoma lanceolatum OX=7740 GN=CPNE7 PE=3 SV=1	Tricoplax_adhaerens_tr_B3S6Q5_B3S6Q5_TRIAD tr_B3S6Q5_B3S6Q5_TRIAD Uncharacterized protein OS=Trichoplax adhaerens OX=10228 GN=TRIADDRAFT_29988 PE=3 SV=1, Tricoplax_adhaerens_tr_B3RMR9_B3RMR9_TRIAD tr_B3RMR9_B3RMR9_TRIAD Uncharacterized protein OS=Trichoplax adhaerens OX=10228 GN=TRIADDRAFT_20570 PE=3 SV=1
OG0000061	Branchiostoma_lanceolatum_tr_A0A8K0ESI7_A0A8K0ESI7_BRALA tr|A0A8K0ESI7|A0A8K0ESI7_BRALA CPNE8 protein OS=Branchiostoma lanceolatum OX=7740 GN=CPNE8 PE=3 SV=1, Branchiostoma_lanceolatum_tr_A0A8J9ZYS0_A0A8J9ZYS0_BRALA tr|A0A8J9ZYS0|A0A8J9ZYS0_BRALA CPNE8 protein OS=Branchiostoma lanceolatum OX=7740 GN=CPNE8 PE=3 SV=1, Branchiostoma_lanceolatum_tr_A0A8K0EQ33_A0A8K0EQ33_BRALA tr|A0A8K0EQ33|A0A8K0EQ33_BRALA CPNE8 protein OS=Branchiostoma lanceolatum OX=7740 GN=CPNE8 PE=3 SV=1, Branchiostoma_lanceolatum_tr_A0A8J9ZY72_A0A8J9ZY72_BRALA tr|A0A8J9ZY72|A0A8J9ZY72_BRALA CPNE8 protein OS=Branchiostoma lanceolatum OX=7740 GN=CPNE8 PE=3 SV=1, Branchiostoma_lanceolatum_tr_A0A8J9ZW37_A0A8J9ZW37_BRALA tr|A0A8J9ZW37|A0A8J9ZW37_BRALA CPNE8 protein OS=Branchiostoma lanceolatum OX=7740 GN=CPNE8 PE=3 SV=1, Branchiostoma_lanceolatum_tr_A0A8J9ZVL4_A0A8J9ZVL4_BRALA tr|A0A8J9ZVL4|A0A8J9ZVL4_BRALA CPNE8 protein OS=Branchiostoma lanceolatum OX=7740 GN=CPNE8 PE=3 SV=1, Branchiostoma_lanceolatum_tr_A0A8K0EVQ5_A0A8K0EVQ5_BRALA tr|A0A8K0EVQ5|A0A8K0EVQ5_BRALA CPNE8 protein OS=Branchiostoma lanceolatum OX=7740 GN=CPNE8 PE=3 SV=1	Tricoplax_adhaerens_tr_B3SDA1_B3SDA1_TRIAD tr_B3SDA1_B3SDA1_TRIAD Uncharacterized protein OS=Trichoplax adhaerens OX=10228 GN=TRIADDRAFT_33766 PE=3 SV=1, Tricoplax_adhaerens_tr_B3SD98_B3SD98_TRIAD tr_B3SD98_B3SD98_TRIAD Uncharacterized protein OS=Trichoplax adhaerens OX=10228 GN=TRIADDRAFT_33811 PE=3 SV=1, Tricoplax_adhaerens_tr_B3SD97_B3SD97_TRIAD tr_B3SD97_B3SD97_TRIAD Uncharacterized protein OS=Trichoplax adhaerens OX=10228 GN=TRIADDRAFT_33800 PE=3 SV=1, Tricoplax_adhaerens_tr_B3SD96_B3SD96_TRIAD tr_B3SD96_B3SD96_TRIAD C2 domain-containing protein OS=Trichoplax adhaerens OX=10228 GN=TRIADDRAFT_62253 PE=3 SV=1
OG0000062	Branchiostoma_lanceolatum_tr_A0A8J9Z763_A0A8J9Z763_BRALA tr|A0A8J9Z763|A0A8J9Z763_BRALA Delta-like protein OS=Branchiostoma lanceolatum OX=7740 GN=DLL1 PE=4 SV=1, Branchiostoma_lanceolatum_tr_A0A8K0ESR6_A0A8K0ESR6_BRALA tr|A0A8K0ESR6|A0A8K0ESR6_BRALA DLL1 protein OS=Branchiostoma lanceolatum OX=7740 GN=DLL1 PE=4 SV=1, Branchiostoma_lanceolatum_tr_A0A8K0EQ31_A0A8K0EQ31_BRALA tr|A0A8K0EQ31|A0A8K0EQ31_BRALA DLL1 protein OS=Branchiostoma lanceolatum OX=7740 GN=DLL1 PE=4 SV=1	Tricoplax_adhaerens_tr_B3S6K5_B3S6K5_TRIAD tr_B3S6K5_B3S6K5_TRIAD Delta-like protein _Fragment_ OS=Trichoplax adhaerens OX=10228 GN=TRIADDRAFT_587 PE=4 SV=1
OG0000065	Branchiostoma_lanceolatum_tr_A0A8K0EDI7_A0A8K0EDI7_BRALA tr|A0A8K0EDI7|A0A8K0EDI7_BRALA GPC5 protein OS=Branchiostoma lanceolatum OX=7740 GN=GPC5 PE=3 SV=1	Tricoplax_adhaerens_tr_B3SCH4_B3SCH4_TRIAD tr_B3SCH4_B3SCH4_TRIAD Uncharacterized protein OS=Trichoplax adhaerens OX=10228 GN=TRIADDRAFT_61971 PE=3 SV=1, Tricoplax_adhaerens_tr_B3SCH2_B3SCH2_TRIAD tr_B3SCH2_B3SCH2_TRIAD Uncharacterized protein OS=Trichoplax adhaerens OX=10228 GN=TRIADDRAFT_61969 PE=3 SV=1, Tricoplax_adhaerens_tr_B3SCH3_B3SCH3_TRIAD tr_B3SCH3_B3SCH3_TRIAD Uncharacterized protein OS=Trichoplax adhaerens OX=10228 GN=TRIADDRAFT_61970 PE=3 SV=1
OG0000074	Branchiostoma_lanceolatum_tr_A0A8K0EUJ4_A0A8K0EUJ4_BRALA tr|A0A8K0EUJ4|A0A8K0EUJ4_BRALA SLIT2 protein OS=Branchiostoma lanceolatum OX=7740 GN=SLIT2 PE=4 SV=1, Branchiostoma_lanceolatum_tr_A0A8J9ZQS5_A0A8J9ZQS5_BRALA tr|A0A8J9ZQS5|A0A8J9ZQS5_BRALA SLIT2 protein _Fragment_ OS=Branchiostoma lanceolatum OX=7740 GN=SLIT2 PE=4 SV=1, Branchiostoma_lanceolatum_tr_A0A8J9ZSE6_A0A8J9ZSE6_BRALA tr|A0A8J9ZSE6|A0A8J9ZSE6_BRALA SLIT2 protein _Fragment_ OS=Branchiostoma lanceolatum OX=7740 GN=SLIT2 PE=4 SV=1, Branchiostoma_lanceolatum_tr_A0A8K0ERA1_A0A8K0ERA1_BRALA tr|A0A8K0ERA1|A0A8K0ERA1_BRALA SLIT2 protein _Fragment_ OS=Branchiostoma lanceolatum OX=7740 GN=SLIT2 PE=4 SV=1, Branchiostoma_lanceolatum_tr_A0A8K0ENP1_A0A8K0ENP1_BRALA tr|A0A8K0ENP1|A0A8K0ENP1_BRALA SLIT2 protein _Fragment_ OS=Branchiostoma lanceolatum OX=7740 GN=SLIT2 PE=4 SV=1, Branchiostoma_lanceolatum_tr_A0A8J9ZQR1_A0A8J9ZQR1_BRALA tr|A0A8J9ZQR1|A0A8J9ZQR1_BRALA SLIT2 protein OS=Branchiostoma lanceolatum OX=7740 GN=SLIT2 PE=4 SV=1, Branchiostoma_lanceolatum_tr_A0A8J9ZSD7_A0A8J9ZSD7_BRALA tr|A0A8J9ZSD7|A0A8J9ZSD7_BRALA SLIT2 protein OS=Branchiostoma lanceolatum OX=7740 GN=SLIT2 PE=4 SV=1, Branchiostoma_lanceolatum_tr_A0A8J9ZR99_A0A8J9ZR99_BRALA tr|A0A8J9ZR99|A0A8J9ZR99_BRALA SLIT2 protein OS=Branchiostoma lanceolatum OX=7740 GN=SLIT2 PE=4 SV=1, Branchiostoma_lanceolatum_tr_A0A8J9ZNE7_A0A8J9ZNE7_BRALA tr|A0A8J9ZNE7|A0A8J9ZNE7_BRALA SLIT2 protein OS=Branchiostoma lanceolatum OX=7740 GN=SLIT2 PE=4 SV=1, Branchiostoma_lanceolatum_tr_A0A8K0ELJ9_A0A8K0ELJ9_BRALA tr|A0A8K0ELJ9|A0A8K0ELJ9_BRALA SLIT2 protein OS=Branchiostoma lanceolatum OX=7740 GN=SLIT2 PE=4 SV=1, Branchiostoma_lanceolatum_tr_A0A8K0ERU2_A0A8K0ERU2_BRALA tr|A0A8K0ERU2|A0A8K0ERU2_BRALA SLIT2 protein OS=Branchiostoma lanceolatum OX=7740 GN=SLIT2 PE=4 SV=1, Branchiostoma_lanceolatum_tr_A0A8J9ZQW4_A0A8J9ZQW4_BRALA tr|A0A8J9ZQW4|A0A8J9ZQW4_BRALA SLIT2 protein OS=Branchiostoma lanceolatum OX=7740 GN=SLIT2 PE=4 SV=1, Branchiostoma_lanceolatum_tr_A0A8J9ZRB0_A0A8J9ZRB0_BRALA tr|A0A8J9ZRB0|A0A8J9ZRB0_BRALA SLIT2 protein OS=Branchiostoma lanceolatum OX=7740 GN=SLIT2 PE=4 SV=1, Branchiostoma_lanceolatum_tr_A0A8K0ER96_A0A8K0ER96_BRALA tr|A0A8K0ER96|A0A8K0ER96_BRALA SLIT2 protein OS=Branchiostoma lanceolatum OX=7740 GN=SLIT2 PE=4 SV=1, Branchiostoma_lanceolatum_tr_A0A8J9ZNE0_A0A8J9ZNE0_BRALA tr|A0A8J9ZNE0|A0A8J9ZNE0_BRALA SLIT2 protein OS=Branchiostoma lanceolatum OX=7740 GN=SLIT2 PE=4 SV=1, Branchiostoma_lanceolatum_tr_A0A8J9ZNJ6_A0A8J9ZNJ6_BRALA tr|A0A8J9ZNJ6|A0A8J9ZNJ6_BRALA SLIT2 protein OS=Branchiostoma lanceolatum OX=7740 GN=SLIT2 PE=4 SV=1, Branchiostoma_lanceolatum_tr_A0A8J9ZPU9_A0A8J9ZPU9_BRALA tr|A0A8J9ZPU9|A0A8J9ZPU9_BRALA SLIT2 protein OS=Branchiostoma lanceolatum OX=7740 GN=SLIT2 PE=4 SV=1, Branchiostoma_lanceolatum_tr_A0A8K0ENR0_A0A8K0ENR0_BRALA tr|A0A8K0ENR0|A0A8K0ENR0_BRALA SLIT2 protein OS=Branchiostoma lanceolatum OX=7740 GN=SLIT2 PE=4 SV=1, Branchiostoma_lanceolatum_tr_A0A8K0ENN6_A0A8K0ENN6_BRALA tr|A0A8K0ENN6|A0A8K0ENN6_BRALA SLIT2 protein OS=Branchiostoma lanceolatum OX=7740 GN=SLIT2 PE=4 SV=1, Branchiostoma_lanceolatum_tr_A0A8J9ZNC7_A0A8J9ZNC7_BRALA tr|A0A8J9ZNC7|A0A8J9ZNC7_BRALA SLIT2 protein OS=Branchiostoma lanceolatum OX=7740 GN=SLIT2 PE=4 SV=1, Branchiostoma_lanceolatum_tr_A0A8J9ZPW0_A0A8J9ZPW0_BRALA tr|A0A8J9ZPW0|A0A8J9ZPW0_BRALA SLIT2 protein OS=Branchiostoma lanceolatum OX=7740 GN=SLIT2 PE=4 SV=1, Branchiostoma_lanceolatum_tr_A0A8J9ZQX6_A0A8J9ZQX6_BRALA tr|A0A8J9ZQX6|A0A8J9ZQX6_BRALA SLIT2 protein OS=Branchiostoma lanceolatum OX=7740 GN=SLIT2 PE=4 SV=1, Branchiostoma_lanceolatum_tr_A0A8J9ZND2_A0A8J9ZND2_BRALA tr|A0A8J9ZND2|A0A8J9ZND2_BRALA SLIT2 protein OS=Branchiostoma lanceolatum OX=7740 GN=SLIT2 PE=4 SV=1	Tricoplax_adhaerens_tr_B3S3J9_B3S3J9_TRIAD tr_B3S3J9_B3S3J9_TRIAD Uncharacterized protein OS=Trichoplax adhaerens OX=10228 GN=TRIADDRAFT_58750 PE=4 SV=1
OG0000076	Branchiostoma_lanceolatum_tr_A0A8J9YZ21_A0A8J9YZ21_BRALA tr|A0A8J9YZ21|A0A8J9YZ21_BRALA FCGBP protein OS=Branchiostoma lanceolatum OX=7740 GN=FCGBP PE=4 SV=1, Branchiostoma_lanceolatum_tr_A0A8J9ZI81_A0A8J9ZI81_BRALA tr|A0A8J9ZI81|A0A8J9ZI81_BRALA chitinase OS=Branchiostoma lanceolatum OX=7740 GN=FCGBP PE=4 SV=1, Branchiostoma_lanceolatum_tr_A0A8J9ZGL0_A0A8J9ZGL0_BRALA tr|A0A8J9ZGL0|A0A8J9ZGL0_BRALA chitinase OS=Branchiostoma lanceolatum OX=7740 GN=FCGBP PE=4 SV=1, Branchiostoma_lanceolatum_tr_A0A8J9ZFD6_A0A8J9ZFD6_BRALA tr|A0A8J9ZFD6|A0A8J9ZFD6_BRALA chitinase OS=Branchiostoma lanceolatum OX=7740 GN=FCGBP PE=4 SV=1, Branchiostoma_lanceolatum_tr_A0A8J9YWF0_A0A8J9YWF0_BRALA tr|A0A8J9YWF0|A0A8J9YWF0_BRALA FCGBP protein OS=Branchiostoma lanceolatum OX=7740 GN=FCGBP PE=4 SV=1, Branchiostoma_lanceolatum_tr_A0A8K0AD19_A0A8K0AD19_BRALA tr|A0A8K0AD19|A0A8K0AD19_BRALA NOTCH2 protein OS=Branchiostoma lanceolatum OX=7740 GN=NOTCH2 PE=4 SV=1, Branchiostoma_lanceolatum_tr_A0A8J9ZMB6_A0A8J9ZMB6_BRALA tr|A0A8J9ZMB6|A0A8J9ZMB6_BRALA FCGBP protein OS=Branchiostoma lanceolatum OX=7740 GN=FCGBP PE=4 SV=1, Branchiostoma_lanceolatum_tr_A0A8K0ESW3_A0A8K0ESW3_BRALA tr|A0A8K0ESW3|A0A8K0ESW3_BRALA FCGBP protein OS=Branchiostoma lanceolatum OX=7740 GN=FCGBP PE=4 SV=1, Branchiostoma_lanceolatum_tr_A0A8J9VJC5_A0A8J9VJC5_BRALA tr|A0A8J9VJC5|A0A8J9VJC5_BRALA FCGBP protein OS=Branchiostoma lanceolatum OX=7740 GN=FCGBP PE=4 SV=1, Branchiostoma_lanceolatum_tr_A0A8K0AHB4_A0A8K0AHB4_BRALA tr|A0A8K0AHB4|A0A8K0AHB4_BRALA FCGBP protein OS=Branchiostoma lanceolatum OX=7740 GN=FCGBP PE=4 SV=1, Branchiostoma_lanceolatum_tr_A0A8K0ACD3_A0A8K0ACD3_BRALA tr|A0A8K0ACD3|A0A8K0ACD3_BRALA FCGBP protein OS=Branchiostoma lanceolatum OX=7740 GN=FCGBP PE=4 SV=1, Branchiostoma_lanceolatum_tr_A0A8K0ABA0_A0A8K0ABA0_BRALA tr|A0A8K0ABA0|A0A8K0ABA0_BRALA FCGBP protein OS=Branchiostoma lanceolatum OX=7740 GN=FCGBP PE=4 SV=1, Branchiostoma_lanceolatum_tr_A0A8K0AD80_A0A8K0AD80_BRALA tr|A0A8K0AD80|A0A8K0AD80_BRALA SELP protein OS=Branchiostoma lanceolatum OX=7740 GN=SELP PE=4 SV=1, Branchiostoma_lanceolatum_tr_A0A8J9ZJS4_A0A8J9ZJS4_BRALA tr|A0A8J9ZJS4|A0A8J9ZJS4_BRALA FCGBP protein OS=Branchiostoma lanceolatum OX=7740 GN=FCGBP PE=4 SV=1, Branchiostoma_lanceolatum_tr_A0A8K0EDV9_A0A8K0EDV9_BRALA tr|A0A8K0EDV9|A0A8K0EDV9_BRALA COL6A3 protein OS=Branchiostoma lanceolatum OX=7740 GN=COL6A3 PE=4 SV=1	Tricoplax_adhaerens_tr_B3RM88_B3RM88_TRIAD tr_B3RM88_B3RM88_TRIAD Fibronectin type-III domain-containing protein OS=Trichoplax adhaerens OX=10228 GN=TRIADDRAFT_52275 PE=4 SV=1, Tricoplax_adhaerens_tr_B3RXJ6_B3RXJ6_TRIAD tr_B3RXJ6_B3RXJ6_TRIAD Uncharacterized protein OS=Trichoplax adhaerens OX=10228 GN=TRIADDRAFT_56233 PE=4 SV=1, Tricoplax_adhaerens_tr_B3S9V2_B3S9V2_TRIAD tr_B3S9V2_B3S9V2_TRIAD Uncharacterized protein OS=Trichoplax adhaerens OX=10228 GN=TRIADDRAFT_61038 PE=4 SV=1
OG0000080	Branchiostoma_lanceolatum_tr_A0A8J9ZR06_A0A8J9ZR06_BRALA tr|A0A8J9ZR06|A0A8J9ZR06_BRALA TIMP4 protein OS=Branchiostoma lanceolatum OX=7740 GN=TIMP4 PE=4 SV=1, Branchiostoma_lanceolatum_tr_A0A8K0A285_A0A8K0A285_BRALA tr|A0A8K0A285|A0A8K0A285_BRALA TIMP3 protein OS=Branchiostoma lanceolatum OX=7740 GN=TIMP3 PE=3 SV=1	Tricoplax_adhaerens_tr_B3RWZ3_B3RWZ3_TRIAD tr_B3RWZ3_B3RWZ3_TRIAD NTR domain-containing protein OS=Trichoplax adhaerens OX=10228 GN=TRIADDRAFT_56937 PE=3 SV=1
OG0000087	Branchiostoma_lanceolatum_tr_A0A8J9VDL8_A0A8J9VDL8_BRALA tr|A0A8J9VDL8|A0A8J9VDL8_BRALA TSPOAP1 protein OS=Branchiostoma lanceolatum OX=7740 GN=TSPOAP1 PE=3 SV=1	Tricoplax_adhaerens_tr_B3S564_B3S564_TRIAD tr_B3S564_B3S564_TRIAD Uncharacterized protein OS=Trichoplax adhaerens OX=10228 GN=TRIADDRAFT_59211 PE=3 SV=1
OG0000088	Branchiostoma_lanceolatum_tr_A0A8J9ZLF9_A0A8J9ZLF9_BRALA tr|A0A8J9ZLF9|A0A8J9ZLF9_BRALA SPON2 protein OS=Branchiostoma lanceolatum OX=7740 GN=SPON2 PE=4 SV=1, Branchiostoma_lanceolatum_tr_A0A8J9ZLL4_A0A8J9ZLL4_BRALA tr|A0A8J9ZLL4|A0A8J9ZLL4_BRALA SPON2 protein OS=Branchiostoma lanceolatum OX=7740 GN=SPON2 PE=4 SV=1, Branchiostoma_lanceolatum_tr_A0A8J9ZMX0_A0A8J9ZMX0_BRALA tr|A0A8J9ZMX0|A0A8J9ZMX0_BRALA SPON2 protein OS=Branchiostoma lanceolatum OX=7740 GN=SPON2 PE=4 SV=1, Branchiostoma_lanceolatum_tr_A0A8K0EQY2_A0A8K0EQY2_BRALA tr|A0A8K0EQY2|A0A8K0EQY2_BRALA SPON2 protein OS=Branchiostoma lanceolatum OX=7740 GN=SPON2 PE=4 SV=1, Branchiostoma_lanceolatum_tr_A0A8K0EWM7_A0A8K0EWM7_BRALA tr|A0A8K0EWM7|A0A8K0EWM7_BRALA SPON2 protein OS=Branchiostoma lanceolatum OX=7740 GN=SPON2 PE=4 SV=1, Branchiostoma_lanceolatum_tr_A0A8J9Z9T9_A0A8J9Z9T9_BRALA tr|A0A8J9Z9T9|A0A8J9Z9T9_BRALA Spondin-1 OS=Branchiostoma lanceolatum OX=7740 GN=SPON1 PE=4 SV=1	Tricoplax_adhaerens_tr_B3SC37_B3SC37_TRIAD tr_B3SC37_B3SC37_TRIAD Spondin domain-containing protein OS=Trichoplax adhaerens OX=10228 GN=TRIADDRAFT_61837 PE=4 SV=1
OG0000089	Branchiostoma_lanceolatum_tr_A0A8K0E9Z4_A0A8K0E9Z4_BRALA tr|A0A8K0E9Z4|A0A8K0E9Z4_BRALA CHRDL1 protein OS=Branchiostoma lanceolatum OX=7740 GN=CHRDL1 PE=4 SV=1, Branchiostoma_lanceolatum_tr_A0A8K0EDD8_A0A8K0EDD8_BRALA tr|A0A8K0EDD8|A0A8K0EDD8_BRALA CHRDL1 protein OS=Branchiostoma lanceolatum OX=7740 GN=CHRDL1 PE=4 SV=1	Tricoplax_adhaerens_tr_B3RM16_B3RM16_TRIAD tr_B3RM16_B3RM16_TRIAD Uncharacterized protein OS=Trichoplax adhaerens OX=10228 GN=TRIADDRAFT_52199 PE=4 SV=1
OG0000094	Branchiostoma_lanceolatum_tr_A0A8K0EDU3_A0A8K0EDU3_BRALA tr|A0A8K0EDU3|A0A8K0EDU3_BRALA LRCH3 protein OS=Branchiostoma lanceolatum OX=7740 GN=LRCH3 PE=4 SV=1, Branchiostoma_lanceolatum_tr_A0A8J9Z079_A0A8J9Z079_BRALA tr|A0A8J9Z079|A0A8J9Z079_BRALA LRCH3 protein OS=Branchiostoma lanceolatum OX=7740 GN=LRCH3 PE=4 SV=1, Branchiostoma_lanceolatum_tr_A0A8J9YZP7_A0A8J9YZP7_BRALA tr|A0A8J9YZP7|A0A8J9YZP7_BRALA LRCH3 protein OS=Branchiostoma lanceolatum OX=7740 GN=LRCH3 PE=4 SV=1, Branchiostoma_lanceolatum_tr_A0A8J9Z0C8_A0A8J9Z0C8_BRALA tr|A0A8J9Z0C8|A0A8J9Z0C8_BRALA LRCH3 protein OS=Branchiostoma lanceolatum OX=7740 GN=LRCH3 PE=4 SV=1, Branchiostoma_lanceolatum_tr_A0A8J9Z093_A0A8J9Z093_BRALA tr|A0A8J9Z093|A0A8J9Z093_BRALA LRCH3 protein OS=Branchiostoma lanceolatum OX=7740 GN=LRCH3 PE=4 SV=1, Branchiostoma_lanceolatum_tr_A0A8J9YZP8_A0A8J9YZP8_BRALA tr|A0A8J9YZP8|A0A8J9YZP8_BRALA LRCH3 protein OS=Branchiostoma lanceolatum OX=7740 GN=LRCH3 PE=4 SV=1, Branchiostoma_lanceolatum_tr_A0A8J9Z0C4_A0A8J9Z0C4_BRALA tr|A0A8J9Z0C4|A0A8J9Z0C4_BRALA LRCH3 protein OS=Branchiostoma lanceolatum OX=7740 GN=LRCH3 PE=4 SV=1, Branchiostoma_lanceolatum_tr_A0A8J9Z0C7_A0A8J9Z0C7_BRALA tr|A0A8J9Z0C7|A0A8J9Z0C7_BRALA LRCH3 protein OS=Branchiostoma lanceolatum OX=7740 GN=LRCH3 PE=4 SV=1, Branchiostoma_lanceolatum_tr_A0A8K0E9W3_A0A8K0E9W3_BRALA tr|A0A8K0E9W3|A0A8K0E9W3_BRALA LRCH3 protein OS=Branchiostoma lanceolatum OX=7740 GN=LRCH3 PE=4 SV=1, Branchiostoma_lanceolatum_tr_A0A8J9YZU1_A0A8J9YZU1_BRALA tr|A0A8J9YZU1|A0A8J9YZU1_BRALA LRCH3 protein OS=Branchiostoma lanceolatum OX=7740 GN=LRCH3 PE=4 SV=1, Branchiostoma_lanceolatum_tr_A0A8J9YZP6_A0A8J9YZP6_BRALA tr|A0A8J9YZP6|A0A8J9YZP6_BRALA LRCH3 protein OS=Branchiostoma lanceolatum OX=7740 GN=LRCH3 PE=4 SV=1, Branchiostoma_lanceolatum_tr_A0A8K0E8Q8_A0A8K0E8Q8_BRALA tr|A0A8K0E8Q8|A0A8K0E8Q8_BRALA LRCH3 protein OS=Branchiostoma lanceolatum OX=7740 GN=LRCH3 PE=4 SV=1, Branchiostoma_lanceolatum_tr_A0A8J9YZZ9_A0A8J9YZZ9_BRALA tr|A0A8J9YZZ9|A0A8J9YZZ9_BRALA LRCH3 protein OS=Branchiostoma lanceolatum OX=7740 GN=LRCH3 PE=4 SV=1, Branchiostoma_lanceolatum_tr_A0A8K0EDB3_A0A8K0EDB3_BRALA tr|A0A8K0EDB3|A0A8K0EDB3_BRALA LRCH3 protein OS=Branchiostoma lanceolatum OX=7740 GN=LRCH3 PE=4 SV=1, Branchiostoma_lanceolatum_tr_A0A8K0EB88_A0A8K0EB88_BRALA tr|A0A8K0EB88|A0A8K0EB88_BRALA LRCH3 protein OS=Branchiostoma lanceolatum OX=7740 GN=LRCH3 PE=4 SV=1	Tricoplax_adhaerens_tr_B3SCG9_B3SCG9_TRIAD tr_B3SCG9_B3SCG9_TRIAD Uncharacterized protein _Fragment_ OS=Trichoplax adhaerens OX=10228 GN=TRIADDRAFT_33284 PE=4 SV=1
OG0000103	Branchiostoma_lanceolatum_tr_A0A8J9ZHR8_A0A8J9ZHR8_BRALA tr|A0A8J9ZHR8|A0A8J9ZHR8_BRALA LRRC49 protein OS=Branchiostoma lanceolatum OX=7740 GN=LRRC49 PE=4 SV=1, Branchiostoma_lanceolatum_tr_A0A8K0ENR3_A0A8K0ENR3_BRALA tr|A0A8K0ENR3|A0A8K0ENR3_BRALA LRRC49 protein OS=Branchiostoma lanceolatum OX=7740 GN=LRRC49 PE=4 SV=1, Branchiostoma_lanceolatum_tr_A0A8J9ZKJ7_A0A8J9ZKJ7_BRALA tr|A0A8J9ZKJ7|A0A8J9ZKJ7_BRALA LRRC49 protein OS=Branchiostoma lanceolatum OX=7740 GN=LRRC49 PE=4 SV=1, Branchiostoma_lanceolatum_tr_A0A8J9ZK56_A0A8J9ZK56_BRALA tr|A0A8J9ZK56|A0A8J9ZK56_BRALA LRRC49 protein OS=Branchiostoma lanceolatum OX=7740 GN=LRRC49 PE=4 SV=1, Branchiostoma_lanceolatum_tr_A0A8J9ZHS4_A0A8J9ZHS4_BRALA tr|A0A8J9ZHS4|A0A8J9ZHS4_BRALA LRRC49 protein OS=Branchiostoma lanceolatum OX=7740 GN=LRRC49 PE=4 SV=1	Tricoplax_adhaerens_tr_B3RSJ4_B3RSJ4_TRIAD tr_B3RSJ4_B3RSJ4_TRIAD Uncharacterized protein OS=Trichoplax adhaerens OX=10228 GN=TRIADDRAFT_54619 PE=4 SV=1
OG0000114	Branchiostoma_lanceolatum_tr_A0A8K0EVT4_A0A8K0EVT4_BRALA tr|A0A8K0EVT4|A0A8K0EVT4_BRALA HCFC1 protein OS=Branchiostoma lanceolatum OX=7740 GN=HCFC1 PE=4 SV=1, Branchiostoma_lanceolatum_tr_A0A8K0ET55_A0A8K0ET55_BRALA tr|A0A8K0ET55|A0A8K0ET55_BRALA HCFC1 protein OS=Branchiostoma lanceolatum OX=7740 GN=HCFC1 PE=4 SV=1, Branchiostoma_lanceolatum_tr_A0A8K0ESW5_A0A8K0ESW5_BRALA tr|A0A8K0ESW5|A0A8K0ESW5_BRALA HCFC1 protein OS=Branchiostoma lanceolatum OX=7740 GN=HCFC1 PE=4 SV=1, Branchiostoma_lanceolatum_tr_A0A8J9ZYA8_A0A8J9ZYA8_BRALA tr|A0A8J9ZYA8|A0A8J9ZYA8_BRALA HCFC1 protein OS=Branchiostoma lanceolatum OX=7740 GN=HCFC1 PE=4 SV=1, Branchiostoma_lanceolatum_tr_A0A8K0EQQ2_A0A8K0EQQ2_BRALA tr|A0A8K0EQQ2|A0A8K0EQQ2_BRALA HCFC1 protein OS=Branchiostoma lanceolatum OX=7740 GN=HCFC1 PE=4 SV=1, Branchiostoma_lanceolatum_tr_A0A8J9ZZS5_A0A8J9ZZS5_BRALA tr|A0A8J9ZZS5|A0A8J9ZZS5_BRALA HCFC1 protein OS=Branchiostoma lanceolatum OX=7740 GN=HCFC1 PE=4 SV=1, Branchiostoma_lanceolatum_tr_A0A8J9ZZG4_A0A8J9ZZG4_BRALA tr|A0A8J9ZZG4|A0A8J9ZZG4_BRALA HCFC1 protein OS=Branchiostoma lanceolatum OX=7740 GN=HCFC1 PE=4 SV=1, Branchiostoma_lanceolatum_tr_A0A8K0A1U8_A0A8K0A1U8_BRALA tr|A0A8K0A1U8|A0A8K0A1U8_BRALA HCFC1 protein OS=Branchiostoma lanceolatum OX=7740 GN=HCFC1 PE=4 SV=1, Branchiostoma_lanceolatum_tr_A0A8J9ZX22_A0A8J9ZX22_BRALA tr|A0A8J9ZX22|A0A8J9ZX22_BRALA HCFC1 protein OS=Branchiostoma lanceolatum OX=7740 GN=HCFC1 PE=4 SV=1	Tricoplax_adhaerens_tr_B3RXZ8_B3RXZ8_TRIAD tr_B3RXZ8_B3RXZ8_TRIAD Fibronectin type-III domain-containing protein _Fragment_ OS=Trichoplax adhaerens OX=10228 GN=TRIADDRAFT_16582 PE=4 SV=1
OG0000119	Branchiostoma_lanceolatum_tr_A0A8K0E6I6_A0A8K0E6I6_BRALA tr|A0A8K0E6I6|A0A8K0E6I6_BRALA LRRC40 protein OS=Branchiostoma lanceolatum OX=7740 GN=LRRC40 PE=4 SV=1, Branchiostoma_lanceolatum_tr_A0A8K0E8D8_A0A8K0E8D8_BRALA tr|A0A8K0E8D8|A0A8K0E8D8_BRALA LRRC40 protein OS=Branchiostoma lanceolatum OX=7740 GN=LRRC40 PE=4 SV=1, Branchiostoma_lanceolatum_tr_A0A8K0EB64_A0A8K0EB64_BRALA tr|A0A8K0EB64|A0A8K0EB64_BRALA LRRC40 protein OS=Branchiostoma lanceolatum OX=7740 GN=LRRC40 PE=4 SV=1	Tricoplax_adhaerens_tr_B3S1E5_B3S1E5_TRIAD tr_B3S1E5_B3S1E5_TRIAD Uncharacterized protein OS=Trichoplax adhaerens OX=10228 GN=TRIADDRAFT_27850 PE=4 SV=1
OG0000126	Branchiostoma_lanceolatum_tr_A0A8K0ETA0_A0A8K0ETA0_BRALA tr|A0A8K0ETA0|A0A8K0ETA0_BRALA CTD-3088G3.8 protein OS=Branchiostoma lanceolatum OX=7740 GN=CTD-3088G3.8 PE=4 SV=1, Branchiostoma_lanceolatum_tr_A0A8K0EVX9_A0A8K0EVX9_BRALA tr|A0A8K0EVX9|A0A8K0EVX9_BRALA CTD-3088G3.8 protein OS=Branchiostoma lanceolatum OX=7740 GN=CTD-3088G3.8 PE=4 SV=1, Branchiostoma_lanceolatum_tr_A0A8J9YTX8_A0A8J9YTX8_BRALA tr|A0A8J9YTX8|A0A8J9YTX8_BRALA CPT2 protein OS=Branchiostoma lanceolatum OX=7740 GN=CPT2 PE=3 SV=1, Branchiostoma_lanceolatum_tr_A0A8J9YYW4_A0A8J9YYW4_BRALA tr|A0A8J9YYW4|A0A8J9YYW4_BRALA Hypp7221 protein OS=Branchiostoma lanceolatum OX=7740 GN=Hypp7221 PE=4 SV=1, Branchiostoma_lanceolatum_tr_A0A8J9YZ00_A0A8J9YZ00_BRALA tr|A0A8J9YZ00|A0A8J9YZ00_BRALA CTD-3088G3.8 protein OS=Branchiostoma lanceolatum OX=7740 GN=CTD-3088G3.8 PE=4 SV=1	Tricoplax_adhaerens_tr_B3S1T7_B3S1T7_TRIAD tr_B3S1T7_B3S1T7_TRIAD Uncharacterized protein OS=Trichoplax adhaerens OX=10228 GN=TRIADDRAFT_57880 PE=4 SV=1
OG0000133	Branchiostoma_lanceolatum_tr_A0A8J9ZTW7_A0A8J9ZTW7_BRALA tr|A0A8J9ZTW7|A0A8J9ZTW7_BRALA LRRC9 protein OS=Branchiostoma lanceolatum OX=7740 GN=LRRC9 PE=4 SV=1, Branchiostoma_lanceolatum_tr_A0A8J9ZR44_A0A8J9ZR44_BRALA tr|A0A8J9ZR44|A0A8J9ZR44_BRALA LRRC9 protein OS=Branchiostoma lanceolatum OX=7740 GN=LRRC9 PE=4 SV=1, Branchiostoma_lanceolatum_tr_A0A8J9ZQY4_A0A8J9ZQY4_BRALA tr|A0A8J9ZQY4|A0A8J9ZQY4_BRALA LRRC9 protein OS=Branchiostoma lanceolatum OX=7740 GN=LRRC9 PE=4 SV=1, Branchiostoma_lanceolatum_tr_A0A8J9ZQY7_A0A8J9ZQY7_BRALA tr|A0A8J9ZQY7|A0A8J9ZQY7_BRALA LRRC9 protein OS=Branchiostoma lanceolatum OX=7740 GN=LRRC9 PE=4 SV=1	Tricoplax_adhaerens_tr_B3S208_B3S208_TRIAD tr_B3S208_B3S208_TRIAD Uncharacterized protein _Fragment_ OS=Trichoplax adhaerens OX=10228 GN=TRIADDRAFT_10167 PE=4 SV=1
OG0000134	Branchiostoma_lanceolatum_tr_A0A8J9W2Q4_A0A8J9W2Q4_BRALA tr|A0A8J9W2Q4|A0A8J9W2Q4_BRALA Midasin OS=Branchiostoma lanceolatum OX=7740 GN=MDN1 PE=3 SV=1	Tricoplax_adhaerens_tr_B3S1D4_B3S1D4_TRIAD tr_B3S1D4_B3S1D4_TRIAD VWFA domain-containing protein OS=Trichoplax adhaerens OX=10228 GN=TRIADDRAFT_27429 PE=4 SV=1
OG0000138	Branchiostoma_lanceolatum_tr_A0A8K0AA17_A0A8K0AA17_BRALA tr|A0A8K0AA17|A0A8K0AA17_BRALA PTPRF protein OS=Branchiostoma lanceolatum OX=7740 GN=PTPRF PE=4 SV=1, Branchiostoma_lanceolatum_tr_A0A8K0ACR5_A0A8K0ACR5_BRALA tr|A0A8K0ACR5|A0A8K0ACR5_BRALA PTPRF protein OS=Branchiostoma lanceolatum OX=7740 GN=PTPRF PE=4 SV=1, Branchiostoma_lanceolatum_tr_A0A8K0A918_A0A8K0A918_BRALA tr|A0A8K0A918|A0A8K0A918_BRALA PTPRF protein OS=Branchiostoma lanceolatum OX=7740 GN=PTPRF PE=4 SV=1	Tricoplax_adhaerens_tr_B3RNN4_B3RNN4_TRIAD tr_B3RNN4_B3RNN4_TRIAD Fibronectin type-III domain-containing protein OS=Trichoplax adhaerens OX=10228 GN=TRIADDRAFT_53229 PE=4 SV=1
