Orthogroup	Chordata_Amphioxiformes_Branchiostoma_lanceolatum	Placozoa_Trichoplacidae_Tricoplax_adhaerens
OG0000021	Branchiostoma_lanceolatum_tr_A0A8J9ZNM4_A0A8J9ZNM4_BRALA tr|A0A8J9ZNM4|A0A8J9ZNM4_BRALA LRP1 protein OS=Branchiostoma lanceolatum OX=7740 GN=LRP1 PE=4 SV=1, Branchiostoma_lanceolatum_tr_A0A8J9ZRM1_A0A8J9ZRM1_BRALA tr|A0A8J9ZRM1|A0A8J9ZRM1_BRALA LRP6 protein OS=Branchiostoma lanceolatum OX=7740 GN=LRP6 PE=4 SV=1, Branchiostoma_lanceolatum_tr_A0A8S4MN26_A0A8S4MN26_BRALA tr|A0A8S4MN26|A0A8S4MN26_BRALA NOTCH2 protein OS=Branchiostoma lanceolatum OX=7740 GN=NOTCH2 PE=4 SV=1, Branchiostoma_lanceolatum_tr_A0A8S4MLH2_A0A8S4MLH2_BRALA tr|A0A8S4MLH2|A0A8S4MLH2_BRALA NID1 protein OS=Branchiostoma lanceolatum OX=7740 GN=NID1 PE=4 SV=1, Branchiostoma_lanceolatum_tr_A0A8S4MM32_A0A8S4MM32_BRALA tr|A0A8S4MM32|A0A8S4MM32_BRALA NID1 protein OS=Branchiostoma lanceolatum OX=7740 GN=NID1 PE=4 SV=1, Branchiostoma_lanceolatum_tr_A0A8S4MMY0_A0A8S4MMY0_BRALA tr|A0A8S4MMY0|A0A8S4MMY0_BRALA NID1 protein OS=Branchiostoma lanceolatum OX=7740 GN=NID1 PE=4 SV=1, Branchiostoma_lanceolatum_tr_A0A8S4MMH3_A0A8S4MMH3_BRALA tr|A0A8S4MMH3|A0A8S4MMH3_BRALA NID1 protein OS=Branchiostoma lanceolatum OX=7740 GN=NID1 PE=4 SV=1, Branchiostoma_lanceolatum_tr_A0A8S4MML2_A0A8S4MML2_BRALA tr|A0A8S4MML2|A0A8S4MML2_BRALA NID1 protein OS=Branchiostoma lanceolatum OX=7740 GN=NID1 PE=4 SV=1, Branchiostoma_lanceolatum_tr_A0A8S4MLP1_A0A8S4MLP1_BRALA tr|A0A8S4MLP1|A0A8S4MLP1_BRALA NID1 protein OS=Branchiostoma lanceolatum OX=7740 GN=NID1 PE=4 SV=1, Branchiostoma_lanceolatum_tr_A0A8S4MLX3_A0A8S4MLX3_BRALA tr|A0A8S4MLX3|A0A8S4MLX3_BRALA NID1 protein OS=Branchiostoma lanceolatum OX=7740 GN=NID1 PE=4 SV=1, Branchiostoma_lanceolatum_tr_A0A8S4MLI6_A0A8S4MLI6_BRALA tr|A0A8S4MLI6|A0A8S4MLI6_BRALA NID1 protein OS=Branchiostoma lanceolatum OX=7740 GN=NID1 PE=4 SV=1, Branchiostoma_lanceolatum_tr_A0A8S4MLV2_A0A8S4MLV2_BRALA tr|A0A8S4MLV2|A0A8S4MLV2_BRALA NID1 protein OS=Branchiostoma lanceolatum OX=7740 GN=NID1 PE=4 SV=1, Branchiostoma_lanceolatum_tr_A0A8S4MLF4_A0A8S4MLF4_BRALA tr|A0A8S4MLF4|A0A8S4MLF4_BRALA NID1 protein OS=Branchiostoma lanceolatum OX=7740 GN=NID1 PE=4 SV=1, Branchiostoma_lanceolatum_tr_A0A8S4MNV0_A0A8S4MNV0_BRALA tr|A0A8S4MNV0|A0A8S4MNV0_BRALA NID1 protein OS=Branchiostoma lanceolatum OX=7740 GN=NID1 PE=4 SV=1	Tricoplax_adhaerens_tr_B3S0C6_B3S0C6_TRIAD tr_B3S0C6_B3S0C6_TRIAD Uncharacterized protein OS=Trichoplax adhaerens OX=10228 GN=TRIADDRAFT_57765 PE=4 SV=1
OG0000021	Branchiostoma_lanceolatum_tr_A0A8K0E6W3_A0A8K0E6W3_BRALA tr|A0A8K0E6W3|A0A8K0E6W3_BRALA LRP1 protein OS=Branchiostoma lanceolatum OX=7740 GN=LRP1 PE=4 SV=1, Branchiostoma_lanceolatum_tr_A0A8J9YX93_A0A8J9YX93_BRALA tr|A0A8J9YX93|A0A8J9YX93_BRALA VLDLR protein OS=Branchiostoma lanceolatum OX=7740 GN=VLDLR PE=4 SV=1	Tricoplax_adhaerens_tr_B3S2H0_B3S2H0_TRIAD tr_B3S2H0_B3S2H0_TRIAD Uncharacterized protein _Fragment_ OS=Trichoplax adhaerens OX=10228 GN=TRIADDRAFT_27379 PE=4 SV=1
OG0000022	Branchiostoma_lanceolatum_tr_A0A8J9Z4F2_A0A8J9Z4F2_BRALA tr|A0A8J9Z4F2|A0A8J9Z4F2_BRALA Annexin OS=Branchiostoma lanceolatum OX=7740 GN=ANXA7 PE=3 SV=1, Branchiostoma_lanceolatum_tr_A0A8J9Z3Q9_A0A8J9Z3Q9_BRALA tr|A0A8J9Z3Q9|A0A8J9Z3Q9_BRALA Annexin OS=Branchiostoma lanceolatum OX=7740 GN=ANXA7 PE=3 SV=1, Branchiostoma_lanceolatum_tr_A0A8J9Z3X0_A0A8J9Z3X0_BRALA tr|A0A8J9Z3X0|A0A8J9Z3X0_BRALA Annexin OS=Branchiostoma lanceolatum OX=7740 GN=ANXA7 PE=3 SV=1, Branchiostoma_lanceolatum_tr_A0A8J9Z3U1_A0A8J9Z3U1_BRALA tr|A0A8J9Z3U1|A0A8J9Z3U1_BRALA Annexin OS=Branchiostoma lanceolatum OX=7740 GN=ANXA7 PE=3 SV=1, Branchiostoma_lanceolatum_tr_A0A8J9Z3T0_A0A8J9Z3T0_BRALA tr|A0A8J9Z3T0|A0A8J9Z3T0_BRALA Annexin OS=Branchiostoma lanceolatum OX=7740 GN=ANXA7 PE=3 SV=1	Tricoplax_adhaerens_tr_B3S0N9_B3S0N9_TRIAD tr_B3S0N9_B3S0N9_TRIAD Annexin OS=Trichoplax adhaerens OX=10228 GN=TRIADDRAFT_57118 PE=3 SV=1
OG0000022	Branchiostoma_lanceolatum_tr_A0A8K0EBK4_A0A8K0EBK4_BRALA tr|A0A8K0EBK4|A0A8K0EBK4_BRALA Annexin OS=Branchiostoma lanceolatum OX=7740 GN=ANXA11 PE=3 SV=1, Branchiostoma_lanceolatum_tr_A0A8J9Z2T9_A0A8J9Z2T9_BRALA tr|A0A8J9Z2T9|A0A8J9Z2T9_BRALA Annexin OS=Branchiostoma lanceolatum OX=7740 GN=ANXA11 PE=3 SV=1	Tricoplax_adhaerens_tr_B3S9E5_B3S9E5_TRIAD tr_B3S9E5_B3S9E5_TRIAD Annexin OS=Trichoplax adhaerens OX=10228 GN=TRIADDRAFT_38333 PE=3 SV=1
OG0000023	Branchiostoma_lanceolatum_tr_A0A8J9ZM90_A0A8J9ZM90_BRALA tr|A0A8J9ZM90|A0A8J9ZM90_BRALA ADAM12 protein OS=Branchiostoma lanceolatum OX=7740 GN=ADAM12 PE=4 SV=1, Branchiostoma_lanceolatum_tr_A0A8J9ZMF5_A0A8J9ZMF5_BRALA tr|A0A8J9ZMF5|A0A8J9ZMF5_BRALA ADAM12 protein OS=Branchiostoma lanceolatum OX=7740 GN=ADAM12 PE=4 SV=1, Branchiostoma_lanceolatum_tr_A0A8J9VFV9_A0A8J9VFV9_BRALA tr|A0A8J9VFV9|A0A8J9VFV9_BRALA ADAM23 protein OS=Branchiostoma lanceolatum OX=7740 GN=ADAM23 PE=4 SV=1, Branchiostoma_lanceolatum_tr_A0A8J9VEB7_A0A8J9VEB7_BRALA tr|A0A8J9VEB7|A0A8J9VEB7_BRALA ADAM23 protein OS=Branchiostoma lanceolatum OX=7740 GN=ADAM23 PE=4 SV=1, Branchiostoma_lanceolatum_tr_A0A8J9YLN7_A0A8J9YLN7_BRALA tr|A0A8J9YLN7|A0A8J9YLN7_BRALA ADAM23 protein OS=Branchiostoma lanceolatum OX=7740 GN=ADAM23 PE=4 SV=1, Branchiostoma_lanceolatum_tr_A0A8J9W3N8_A0A8J9W3N8_BRALA tr|A0A8J9W3N8|A0A8J9W3N8_BRALA ADAM23 protein OS=Branchiostoma lanceolatum OX=7740 GN=ADAM23 PE=4 SV=1, Branchiostoma_lanceolatum_tr_A0A8J9W6V1_A0A8J9W6V1_BRALA tr|A0A8J9W6V1|A0A8J9W6V1_BRALA ADAM23 protein OS=Branchiostoma lanceolatum OX=7740 GN=ADAM23 PE=4 SV=1	Tricoplax_adhaerens_tr_B3SAV4_B3SAV4_TRIAD tr_B3SAV4_B3SAV4_TRIAD Uncharacterized protein OS=Trichoplax adhaerens OX=10228 GN=TRIADDRAFT_64349 PE=4 SV=1, Tricoplax_adhaerens_tr_B3SAV3_B3SAV3_TRIAD tr_B3SAV3_B3SAV3_TRIAD Uncharacterized protein _Fragment_ OS=Trichoplax adhaerens OX=10228 GN=TRIADDRAFT_32380 PE=4 SV=1, Tricoplax_adhaerens_tr_B3SAV2_B3SAV2_TRIAD tr_B3SAV2_B3SAV2_TRIAD Uncharacterized protein _Fragment_ OS=Trichoplax adhaerens OX=10228 GN=TRIADDRAFT_32362 PE=4 SV=1, Tricoplax_adhaerens_tr_B3SAV6_B3SAV6_TRIAD tr_B3SAV6_B3SAV6_TRIAD Uncharacterized protein OS=Trichoplax adhaerens OX=10228 GN=TRIADDRAFT_32445 PE=4 SV=1, Tricoplax_adhaerens_tr_B3SAV5_B3SAV5_TRIAD tr_B3SAV5_B3SAV5_TRIAD Uncharacterized protein OS=Trichoplax adhaerens OX=10228 GN=TRIADDRAFT_61393 PE=4 SV=1, Tricoplax_adhaerens_tr_B3SAW2_B3SAW2_TRIAD tr_B3SAW2_B3SAW2_TRIAD Uncharacterized protein OS=Trichoplax adhaerens OX=10228 GN=TRIADDRAFT_32386 PE=4 SV=1, Tricoplax_adhaerens_tr_B3RIV5_B3RIV5_TRIAD tr_B3RIV5_B3RIV5_TRIAD Uncharacterized protein _Fragment_ OS=Trichoplax adhaerens OX=10228 GN=TRIADDRAFT_1282 PE=4 SV=1
OG0000024	Branchiostoma_lanceolatum_tr_A0A8K0F3Y3_A0A8K0F3Y3_BRALA tr|A0A8K0F3Y3|A0A8K0F3Y3_BRALA OLFM3 protein OS=Branchiostoma lanceolatum OX=7740 GN=OLFM3 PE=4 SV=1, Branchiostoma_lanceolatum_tr_A0A8K0F196_A0A8K0F196_BRALA tr|A0A8K0F196|A0A8K0F196_BRALA OLFM3 protein OS=Branchiostoma lanceolatum OX=7740 GN=OLFM3 PE=4 SV=1, Branchiostoma_lanceolatum_tr_A0A8K0F1T2_A0A8K0F1T2_BRALA tr|A0A8K0F1T2|A0A8K0F1T2_BRALA OLFM3 protein OS=Branchiostoma lanceolatum OX=7740 GN=OLFM3 PE=4 SV=1, Branchiostoma_lanceolatum_tr_A0A8K0AH10_A0A8K0AH10_BRALA tr|A0A8K0AH10|A0A8K0AH10_BRALA OLFM3 protein OS=Branchiostoma lanceolatum OX=7740 GN=OLFM3 PE=4 SV=1, Branchiostoma_lanceolatum_tr_A0A8K0AGI0_A0A8K0AGI0_BRALA tr|A0A8K0AGI0|A0A8K0AGI0_BRALA OLFM3 protein OS=Branchiostoma lanceolatum OX=7740 GN=OLFM3 PE=4 SV=1, Branchiostoma_lanceolatum_tr_A0A8K0AJA9_A0A8K0AJA9_BRALA tr|A0A8K0AJA9|A0A8K0AJA9_BRALA OLFM3 protein OS=Branchiostoma lanceolatum OX=7740 GN=OLFM3 PE=4 SV=1, Branchiostoma_lanceolatum_tr_A0A8K0F3L5_A0A8K0F3L5_BRALA tr|A0A8K0F3L5|A0A8K0F3L5_BRALA OLFM3 protein OS=Branchiostoma lanceolatum OX=7740 GN=OLFM3 PE=4 SV=1, Branchiostoma_lanceolatum_tr_A0A8K0EZ53_A0A8K0EZ53_BRALA tr|A0A8K0EZ53|A0A8K0EZ53_BRALA OLFM3 protein OS=Branchiostoma lanceolatum OX=7740 GN=OLFM3 PE=4 SV=1	Tricoplax_adhaerens_tr_B3SAJ2_B3SAJ2_TRIAD tr_B3SAJ2_B3SAJ2_TRIAD Predicted protein OS=Trichoplax adhaerens OX=10228 GN=TRIADDRAFT_61279 PE=4 SV=1
OG0000028	Branchiostoma_lanceolatum_tr_A0A8J9Z0K0_A0A8J9Z0K0_BRALA tr|A0A8J9Z0K0|A0A8J9Z0K0_BRALA COL4A6 protein OS=Branchiostoma lanceolatum OX=7740 GN=COL4A6 PE=4 SV=1, Branchiostoma_lanceolatum_tr_A0A8J9YZW6_A0A8J9YZW6_BRALA tr|A0A8J9YZW6|A0A8J9YZW6_BRALA COL4A6 protein OS=Branchiostoma lanceolatum OX=7740 GN=COL4A6 PE=4 SV=1, Branchiostoma_lanceolatum_tr_A0A8J9Z0K1_A0A8J9Z0K1_BRALA tr|A0A8J9Z0K1|A0A8J9Z0K1_BRALA COL4A6 protein OS=Branchiostoma lanceolatum OX=7740 GN=COL4A6 PE=4 SV=1, Branchiostoma_lanceolatum_tr_A0A8J9Z0G5_A0A8J9Z0G5_BRALA tr|A0A8J9Z0G5|A0A8J9Z0G5_BRALA COL4A6 protein OS=Branchiostoma lanceolatum OX=7740 GN=COL4A6 PE=4 SV=1, Branchiostoma_lanceolatum_tr_A0A8K0EA30_A0A8K0EA30_BRALA tr|A0A8K0EA30|A0A8K0EA30_BRALA COL4A6 protein OS=Branchiostoma lanceolatum OX=7740 GN=COL4A6 PE=4 SV=1, Branchiostoma_lanceolatum_tr_A0A8J9Z835_A0A8J9Z835_BRALA tr|A0A8J9Z835|A0A8J9Z835_BRALA COL4A6 protein OS=Branchiostoma lanceolatum OX=7740 GN=COL4A6 PE=4 SV=1, Branchiostoma_lanceolatum_tr_A0A8J9Z8R0_A0A8J9Z8R0_BRALA tr|A0A8J9Z8R0|A0A8J9Z8R0_BRALA COL4A6 protein OS=Branchiostoma lanceolatum OX=7740 GN=COL4A6 PE=4 SV=1, Branchiostoma_lanceolatum_tr_A0A8K0EGS1_A0A8K0EGS1_BRALA tr|A0A8K0EGS1|A0A8K0EGS1_BRALA COL4A6 protein OS=Branchiostoma lanceolatum OX=7740 GN=COL4A6 PE=4 SV=1, Branchiostoma_lanceolatum_tr_A0A8K0EFV7_A0A8K0EFV7_BRALA tr|A0A8K0EFV7|A0A8K0EFV7_BRALA COL4A6 protein OS=Branchiostoma lanceolatum OX=7740 GN=COL4A6 PE=4 SV=1, Branchiostoma_lanceolatum_tr_A0A8J9Z7N0_A0A8J9Z7N0_BRALA tr|A0A8J9Z7N0|A0A8J9Z7N0_BRALA COL4A6 protein OS=Branchiostoma lanceolatum OX=7740 GN=COL4A6 PE=4 SV=1, Branchiostoma_lanceolatum_tr_A0A8J9Z7L1_A0A8J9Z7L1_BRALA tr|A0A8J9Z7L1|A0A8J9Z7L1_BRALA COL4A6 protein OS=Branchiostoma lanceolatum OX=7740 GN=COL4A6 PE=4 SV=1, Branchiostoma_lanceolatum_tr_A0A8J9Z954_A0A8J9Z954_BRALA tr|A0A8J9Z954|A0A8J9Z954_BRALA COL4A6 protein OS=Branchiostoma lanceolatum OX=7740 GN=COL4A6 PE=4 SV=1, Branchiostoma_lanceolatum_tr_A0A8K0EI76_A0A8K0EI76_BRALA tr|A0A8K0EI76|A0A8K0EI76_BRALA COL4A6 protein OS=Branchiostoma lanceolatum OX=7740 GN=COL4A6 PE=4 SV=1, Branchiostoma_lanceolatum_tr_A0A8J9Z9B6_A0A8J9Z9B6_BRALA tr|A0A8J9Z9B6|A0A8J9Z9B6_BRALA COL4A6 protein OS=Branchiostoma lanceolatum OX=7740 GN=COL4A6 PE=4 SV=1, Branchiostoma_lanceolatum_tr_A0A8J9Z7X7_A0A8J9Z7X7_BRALA tr|A0A8J9Z7X7|A0A8J9Z7X7_BRALA COL4A6 protein OS=Branchiostoma lanceolatum OX=7740 GN=COL4A6 PE=4 SV=1, Branchiostoma_lanceolatum_tr_A0A8K0EDW7_A0A8K0EDW7_BRALA tr|A0A8K0EDW7|A0A8K0EDW7_BRALA COL4A6 protein OS=Branchiostoma lanceolatum OX=7740 GN=COL4A6 PE=4 SV=1, Branchiostoma_lanceolatum_tr_A0A8J9YTW0_A0A8J9YTW0_BRALA tr|A0A8J9YTW0|A0A8J9YTW0_BRALA COL4A2 protein OS=Branchiostoma lanceolatum OX=7740 GN=COL4A2 PE=4 SV=1, Branchiostoma_lanceolatum_tr_A0A8J9ZWY9_A0A8J9ZWY9_BRALA tr|A0A8J9ZWY9|A0A8J9ZWY9_BRALA COL4A2 protein OS=Branchiostoma lanceolatum OX=7740 GN=COL4A2 PE=4 SV=1, Branchiostoma_lanceolatum_tr_A0A8J9ZVZ6_A0A8J9ZVZ6_BRALA tr|A0A8J9ZVZ6|A0A8J9ZVZ6_BRALA COL4A2 protein OS=Branchiostoma lanceolatum OX=7740 GN=COL4A2 PE=4 SV=1, Branchiostoma_lanceolatum_tr_A0A8J9ZVH3_A0A8J9ZVH3_BRALA tr|A0A8J9ZVH3|A0A8J9ZVH3_BRALA COL4A2 protein OS=Branchiostoma lanceolatum OX=7740 GN=COL4A2 PE=4 SV=1, Branchiostoma_lanceolatum_tr_A0A8K0AFQ0_A0A8K0AFQ0_BRALA tr|A0A8K0AFQ0|A0A8K0AFQ0_BRALA COL4A2 protein OS=Branchiostoma lanceolatum OX=7740 GN=COL4A2 PE=4 SV=1, Branchiostoma_lanceolatum_tr_A0A8K0AGL8_A0A8K0AGL8_BRALA tr|A0A8K0AGL8|A0A8K0AGL8_BRALA COL4A2 protein OS=Branchiostoma lanceolatum OX=7740 GN=COL4A2 PE=4 SV=1, Branchiostoma_lanceolatum_tr_A0A8J9Z852_A0A8J9Z852_BRALA tr|A0A8J9Z852|A0A8J9Z852_BRALA COL4A2 protein OS=Branchiostoma lanceolatum OX=7740 GN=COL4A2 PE=4 SV=1, Branchiostoma_lanceolatum_tr_A0A8J9Z825_A0A8J9Z825_BRALA tr|A0A8J9Z825|A0A8J9Z825_BRALA COL4A2 protein OS=Branchiostoma lanceolatum OX=7740 GN=COL4A2 PE=4 SV=1	Tricoplax_adhaerens_tr_B3S7P7_B3S7P7_TRIAD tr_B3S7P7_B3S7P7_TRIAD Collagen IV NC1 domain-containing protein OS=Trichoplax adhaerens OX=10228 GN=TRIADDRAFT_30529 PE=4 SV=1, Tricoplax_adhaerens_tr_B3S7P5_B3S7P5_TRIAD tr_B3S7P5_B3S7P5_TRIAD Collagen IV NC1 domain-containing protein OS=Trichoplax adhaerens OX=10228 GN=TRIADDRAFT_60245 PE=4 SV=1
OG0000029	Branchiostoma_lanceolatum_tr_A0A8K0EMK9_A0A8K0EMK9_BRALA tr|A0A8K0EMK9|A0A8K0EMK9_BRALA CNTNAP2 protein OS=Branchiostoma lanceolatum OX=7740 GN=CNTNAP2 PE=4 SV=1, Branchiostoma_lanceolatum_tr_A0A8K0EK82_A0A8K0EK82_BRALA tr|A0A8K0EK82|A0A8K0EK82_BRALA CNTNAP2 protein OS=Branchiostoma lanceolatum OX=7740 GN=CNTNAP2 PE=4 SV=1, Branchiostoma_lanceolatum_tr_A0A8J9W930_A0A8J9W930_BRALA tr|A0A8J9W930|A0A8J9W930_BRALA CNTNAP2 protein OS=Branchiostoma lanceolatum OX=7740 GN=CNTNAP2 PE=4 SV=1, Branchiostoma_lanceolatum_tr_A0A8J9YNV9_A0A8J9YNV9_BRALA tr|A0A8J9YNV9|A0A8J9YNV9_BRALA CNTNAP2 protein OS=Branchiostoma lanceolatum OX=7740 GN=CNTNAP2 PE=3 SV=1, Branchiostoma_lanceolatum_tr_A0A8J9W6K4_A0A8J9W6K4_BRALA tr|A0A8J9W6K4|A0A8J9W6K4_BRALA CNTNAP2 protein OS=Branchiostoma lanceolatum OX=7740 GN=CNTNAP2 PE=3 SV=1, Branchiostoma_lanceolatum_tr_A0A8J9YRY9_A0A8J9YRY9_BRALA tr|A0A8J9YRY9|A0A8J9YRY9_BRALA CNTNAP2 protein OS=Branchiostoma lanceolatum OX=7740 GN=CNTNAP2 PE=3 SV=1, Branchiostoma_lanceolatum_tr_A0A8J9ZEE6_A0A8J9ZEE6_BRALA tr|A0A8J9ZEE6|A0A8J9ZEE6_BRALA CNTNAP1 protein OS=Branchiostoma lanceolatum OX=7740 GN=CNTNAP1 PE=4 SV=1, Branchiostoma_lanceolatum_tr_A0A8J9ZGK8_A0A8J9ZGK8_BRALA tr|A0A8J9ZGK8|A0A8J9ZGK8_BRALA CNTNAP1 protein OS=Branchiostoma lanceolatum OX=7740 GN=CNTNAP1 PE=4 SV=1, Branchiostoma_lanceolatum_tr_A0A8K0EGL1_A0A8K0EGL1_BRALA tr|A0A8K0EGL1|A0A8K0EGL1_BRALA CNTNAP2 protein OS=Branchiostoma lanceolatum OX=7740 GN=CNTNAP2 PE=4 SV=1, Branchiostoma_lanceolatum_tr_A0A8J9VTM6_A0A8J9VTM6_BRALA tr|A0A8J9VTM6|A0A8J9VTM6_BRALA CNTNAP1 protein OS=Branchiostoma lanceolatum OX=7740 GN=CNTNAP1 PE=4 SV=1	Tricoplax_adhaerens_tr_B3RLL8_B3RLL8_TRIAD tr_B3RLL8_B3RLL8_TRIAD Predicted protein OS=Trichoplax adhaerens OX=10228 GN=TRIADDRAFT_52048 PE=4 SV=1, Tricoplax_adhaerens_tr_B3S1M6_B3S1M6_TRIAD tr_B3S1M6_B3S1M6_TRIAD Predicted protein OS=Trichoplax adhaerens OX=10228 GN=TRIADDRAFT_58343 PE=4 SV=1, Tricoplax_adhaerens_tr_B3S8K5_B3S8K5_TRIAD tr_B3S8K5_B3S8K5_TRIAD Uncharacterized protein OS=Trichoplax adhaerens OX=10228 GN=TRIADDRAFT_60571 PE=4 SV=1, Tricoplax_adhaerens_tr_B3S8J9_B3S8J9_TRIAD tr_B3S8J9_B3S8J9_TRIAD LAM_G_DOMAIN domain-containing protein _Fragment_ OS=Trichoplax adhaerens OX=10228 GN=TRIADDRAFT_5406 PE=4 SV=1, Tricoplax_adhaerens_tr_B3S945_B3S945_TRIAD tr_B3S945_B3S945_TRIAD LAM_G_DOMAIN domain-containing protein OS=Trichoplax adhaerens OX=10228 GN=TRIADDRAFT_31364 PE=4 SV=1
OG0000030	Branchiostoma_lanceolatum_tr_A0A8K0EGY7_A0A8K0EGY7_BRALA tr|A0A8K0EGY7|A0A8K0EGY7_BRALA ADAM17 protein OS=Branchiostoma lanceolatum OX=7740 GN=ADAM17 PE=4 SV=1, Branchiostoma_lanceolatum_tr_A0A8J9Z6R1_A0A8J9Z6R1_BRALA tr|A0A8J9Z6R1|A0A8J9Z6R1_BRALA ADAM17 protein OS=Branchiostoma lanceolatum OX=7740 GN=ADAM17 PE=4 SV=1, Branchiostoma_lanceolatum_tr_A0A8J9Z5D1_A0A8J9Z5D1_BRALA tr|A0A8J9Z5D1|A0A8J9Z5D1_BRALA ADAM17 protein OS=Branchiostoma lanceolatum OX=7740 GN=ADAM17 PE=4 SV=1, Branchiostoma_lanceolatum_tr_A0A8J9Z6M1_A0A8J9Z6M1_BRALA tr|A0A8J9Z6M1|A0A8J9Z6M1_BRALA ADAM17 protein OS=Branchiostoma lanceolatum OX=7740 GN=ADAM17 PE=4 SV=1	Tricoplax_adhaerens_tr_B3S467_B3S467_TRIAD tr_B3S467_B3S467_TRIAD Peptidase M12B domain-containing protein OS=Trichoplax adhaerens OX=10228 GN=TRIADDRAFT_58971 PE=4 SV=1
OG0000030	Branchiostoma_lanceolatum_tr_A0A8J9ZCJ0_A0A8J9ZCJ0_BRALA tr|A0A8J9ZCJ0|A0A8J9ZCJ0_BRALA ADAM10 protein OS=Branchiostoma lanceolatum OX=7740 GN=ADAM10 PE=4 SV=1, Branchiostoma_lanceolatum_tr_A0A8J9ZDQ3_A0A8J9ZDQ3_BRALA tr|A0A8J9ZDQ3|A0A8J9ZDQ3_BRALA ADAM10 protein OS=Branchiostoma lanceolatum OX=7740 GN=ADAM10 PE=4 SV=1, Branchiostoma_lanceolatum_tr_A0A8J9ZCU2_A0A8J9ZCU2_BRALA tr|A0A8J9ZCU2|A0A8J9ZCU2_BRALA ADAM10 protein OS=Branchiostoma lanceolatum OX=7740 GN=ADAM10 PE=4 SV=1, Branchiostoma_lanceolatum_tr_A0A8J9ZCI8_A0A8J9ZCI8_BRALA tr|A0A8J9ZCI8|A0A8J9ZCI8_BRALA ADAM10 protein OS=Branchiostoma lanceolatum OX=7740 GN=ADAM10 PE=4 SV=1, Branchiostoma_lanceolatum_tr_A0A8K0EHM3_A0A8K0EHM3_BRALA tr|A0A8K0EHM3|A0A8K0EHM3_BRALA ADAM10 protein OS=Branchiostoma lanceolatum OX=7740 GN=ADAM10 PE=4 SV=1, Branchiostoma_lanceolatum_tr_A0A8K0EJS0_A0A8K0EJS0_BRALA tr|A0A8K0EJS0|A0A8K0EJS0_BRALA ADAM10 protein OS=Branchiostoma lanceolatum OX=7740 GN=ADAM10 PE=4 SV=1	Tricoplax_adhaerens_tr_B3RL71_B3RL71_TRIAD tr_B3RL71_B3RL71_TRIAD Uncharacterized protein OS=Trichoplax adhaerens OX=10228 GN=TRIADDRAFT_19172 PE=4 SV=1, Tricoplax_adhaerens_tr_B3RJM6_B3RJM6_TRIAD tr_B3RJM6_B3RJM6_TRIAD Uncharacterized protein OS=Trichoplax adhaerens OX=10228 GN=TRIADDRAFT_19354 PE=4 SV=1, Tricoplax_adhaerens_tr_B3RJQ4_B3RJQ4_TRIAD tr_B3RJQ4_B3RJQ4_TRIAD Uncharacterized protein OS=Trichoplax adhaerens OX=10228 GN=TRIADDRAFT_51548 PE=4 SV=1, Tricoplax_adhaerens_tr_B3RMA9_B3RMA9_TRIAD tr_B3RMA9_B3RMA9_TRIAD Uncharacterized protein OS=Trichoplax adhaerens OX=10228 GN=TRIADDRAFT_52298 PE=4 SV=1
OG0000031	Branchiostoma_lanceolatum_tr_A0A8J9VF61_A0A8J9VF61_BRALA tr|A0A8J9VF61|A0A8J9VF61_BRALA VWDE protein OS=Branchiostoma lanceolatum OX=7740 GN=VWDE PE=4 SV=1	Tricoplax_adhaerens_tr_B3RR34_B3RR34_TRIAD tr_B3RR34_B3RR34_TRIAD Uncharacterized protein _Fragment_ OS=Trichoplax adhaerens OX=10228 GN=TRIADDRAFT_22292 PE=4 SV=1
OG0000034	Branchiostoma_lanceolatum_tr_A0A8J9ZTI1_A0A8J9ZTI1_BRALA tr|A0A8J9ZTI1|A0A8J9ZTI1_BRALA ATRNL1 protein OS=Branchiostoma lanceolatum OX=7740 GN=ATRNL1 PE=4 SV=1, Branchiostoma_lanceolatum_tr_A0A8J9ZRU6_A0A8J9ZRU6_BRALA tr|A0A8J9ZRU6|A0A8J9ZRU6_BRALA ATRNL1 protein OS=Branchiostoma lanceolatum OX=7740 GN=ATRNL1 PE=4 SV=1	Tricoplax_adhaerens_tr_B3S377_B3S377_TRIAD tr_B3S377_B3S377_TRIAD Laminin EGF-like domain-containing protein OS=Trichoplax adhaerens OX=10228 GN=TRIADDRAFT_58624 PE=4 SV=1
OG0000034	Branchiostoma_lanceolatum_tr_A0A8J9ZYH2_A0A8J9ZYH2_BRALA tr|A0A8J9ZYH2|A0A8J9ZYH2_BRALA MEGF8 protein OS=Branchiostoma lanceolatum OX=7740 GN=MEGF8 PE=4 SV=1	Tricoplax_adhaerens_tr_B3RTL8_B3RTL8_TRIAD tr_B3RTL8_B3RTL8_TRIAD Uncharacterized protein OS=Trichoplax adhaerens OX=10228 GN=TRIADDRAFT_55971 PE=4 SV=1
OG0000040	Branchiostoma_lanceolatum_tr_A0A8K0EIN4_A0A8K0EIN4_BRALA tr|A0A8K0EIN4|A0A8K0EIN4_BRALA CRIM1 protein OS=Branchiostoma lanceolatum OX=7740 GN=CRIM1 PE=4 SV=1	Tricoplax_adhaerens_tr_B3RRD1_B3RRD1_TRIAD tr_B3RRD1_B3RRD1_TRIAD IGFBP N-terminal domain-containing protein OS=Trichoplax adhaerens OX=10228 GN=TRIADDRAFT_54193 PE=4 SV=1
OG0000040	Branchiostoma_lanceolatum_tr_A0A8K0EQC8_A0A8K0EQC8_BRALA tr|A0A8K0EQC8|A0A8K0EQC8_BRALA KAZALD1 protein OS=Branchiostoma lanceolatum OX=7740 GN=KAZALD1 PE=4 SV=1, Branchiostoma_lanceolatum_tr_A0A8K0EMT5_A0A8K0EMT5_BRALA tr|A0A8K0EMT5|A0A8K0EMT5_BRALA KAZALD1 protein OS=Branchiostoma lanceolatum OX=7740 GN=KAZALD1 PE=4 SV=1, Branchiostoma_lanceolatum_tr_A0A8J9ZMS7_A0A8J9ZMS7_BRALA tr|A0A8J9ZMS7|A0A8J9ZMS7_BRALA IGFBP7 protein OS=Branchiostoma lanceolatum OX=7740 GN=IGFBP7 PE=4 SV=1, Branchiostoma_lanceolatum_tr_A0A8J9ZQP9_A0A8J9ZQP9_BRALA tr|A0A8J9ZQP9|A0A8J9ZQP9_BRALA IGFBP7 protein OS=Branchiostoma lanceolatum OX=7740 GN=IGFBP7 PE=4 SV=1, Branchiostoma_lanceolatum_tr_A0A8J9ZN21_A0A8J9ZN21_BRALA tr|A0A8J9ZN21|A0A8J9ZN21_BRALA IGFBP7 protein OS=Branchiostoma lanceolatum OX=7740 GN=IGFBP7 PE=4 SV=1	Tricoplax_adhaerens_tr_B3SCG1_B3SCG1_TRIAD tr_B3SCG1_B3SCG1_TRIAD IGFBP N-terminal domain-containing protein OS=Trichoplax adhaerens OX=10228 GN=TRIADDRAFT_64395 PE=4 SV=1
OG0000041	Branchiostoma_lanceolatum_tr_A0A8J9Z7G6_A0A8J9Z7G6_BRALA tr|A0A8J9Z7G6|A0A8J9Z7G6_BRALA Poly [ADP-ribose] polymerase OS=Branchiostoma lanceolatum OX=7740 GN=PARP4 PE=3 SV=1	Tricoplax_adhaerens_tr_B3SBE5_B3SBE5_TRIAD tr_B3SBE5_B3SBE5_TRIAD Poly [ADP-ribose] polymerase OS=Trichoplax adhaerens OX=10228 GN=TRIADDRAFT_61586 PE=4 SV=1, Tricoplax_adhaerens_tr_B3SBE1_B3SBE1_TRIAD tr_B3SBE1_B3SBE1_TRIAD Poly [ADP-ribose] polymerase _Fragment_ OS=Trichoplax adhaerens OX=10228 GN=TRIADDRAFT_32651 PE=4 SV=1
OG0000048	Branchiostoma_lanceolatum_tr_A0A8J9YPP9_A0A8J9YPP9_BRALA tr|A0A8J9YPP9|A0A8J9YPP9_BRALA SLIT1 protein OS=Branchiostoma lanceolatum OX=7740 GN=SLIT1 PE=4 SV=1	Tricoplax_adhaerens_tr_B3RYL4_B3RYL4_TRIAD tr_B3RYL4_B3RYL4_TRIAD Uncharacterized protein OS=Trichoplax adhaerens OX=10228 GN=TRIADDRAFT_56599 PE=4 SV=1, Tricoplax_adhaerens_tr_B3RMC9_B3RMC9_TRIAD tr_B3RMC9_B3RMC9_TRIAD Uncharacterized protein OS=Trichoplax adhaerens OX=10228 GN=TRIADDRAFT_53904 PE=4 SV=1, Tricoplax_adhaerens_tr_B3SD38_B3SD38_TRIAD tr_B3SD38_B3SD38_TRIAD Uncharacterized protein OS=Trichoplax adhaerens OX=10228 GN=TRIADDRAFT_62194 PE=4 SV=1
OG0000049	Branchiostoma_lanceolatum_tr_A0A8J9ZZQ5_A0A8J9ZZQ5_BRALA tr|A0A8J9ZZQ5|A0A8J9ZZQ5_BRALA PLXNA4 protein OS=Branchiostoma lanceolatum OX=7740 GN=PLXNA4 PE=3 SV=1, Branchiostoma_lanceolatum_tr_A0A8J9ZYE2_A0A8J9ZYE2_BRALA tr|A0A8J9ZYE2|A0A8J9ZYE2_BRALA PLXNA4 protein OS=Branchiostoma lanceolatum OX=7740 GN=PLXNA4 PE=3 SV=1, Branchiostoma_lanceolatum_tr_A0A8K0ETU9_A0A8K0ETU9_BRALA tr|A0A8K0ETU9|A0A8K0ETU9_BRALA PLXNA1 protein OS=Branchiostoma lanceolatum OX=7740 GN=PLXNA1 PE=3 SV=1, Branchiostoma_lanceolatum_tr_A0A8K0EWJ2_A0A8K0EWJ2_BRALA tr|A0A8K0EWJ2|A0A8K0EWJ2_BRALA PLXNA1 protein OS=Branchiostoma lanceolatum OX=7740 GN=PLXNA1 PE=3 SV=1, Branchiostoma_lanceolatum_tr_A0A8K0ETK9_A0A8K0ETK9_BRALA tr|A0A8K0ETK9|A0A8K0ETK9_BRALA PLXNA1 protein OS=Branchiostoma lanceolatum OX=7740 GN=PLXNA1 PE=3 SV=1, Branchiostoma_lanceolatum_tr_A0A8K0ERD8_A0A8K0ERD8_BRALA tr|A0A8K0ERD8|A0A8K0ERD8_BRALA PLXNA1 protein OS=Branchiostoma lanceolatum OX=7740 GN=PLXNA1 PE=3 SV=1	Tricoplax_adhaerens_tr_B3RWZ7_B3RWZ7_TRIAD tr_B3RWZ7_B3RWZ7_TRIAD Sema domain-containing protein OS=Trichoplax adhaerens OX=10228 GN=TRIADDRAFT_56941 PE=3 SV=1, Tricoplax_adhaerens_tr_B3RWZ9_B3RWZ9_TRIAD tr_B3RWZ9_B3RWZ9_TRIAD Sema domain-containing protein OS=Trichoplax adhaerens OX=10228 GN=TRIADDRAFT_56943 PE=3 SV=1
OG0000051	Branchiostoma_lanceolatum_tr_A0A8K0EQF9_A0A8K0EQF9_BRALA tr|A0A8K0EQF9|A0A8K0EQF9_BRALA CACHD1 protein OS=Branchiostoma lanceolatum OX=7740 GN=CACHD1 PE=4 SV=1, Branchiostoma_lanceolatum_tr_A0A8J9ZWV3_A0A8J9ZWV3_BRALA tr|A0A8J9ZWV3|A0A8J9ZWV3_BRALA chitinase OS=Branchiostoma lanceolatum OX=7740 GN=CACHD1 PE=4 SV=1, Branchiostoma_lanceolatum_tr_A0A8J9ZYW2_A0A8J9ZYW2_BRALA tr|A0A8J9ZYW2|A0A8J9ZYW2_BRALA chitinase OS=Branchiostoma lanceolatum OX=7740 GN=CACHD1 PE=4 SV=1, Branchiostoma_lanceolatum_tr_A0A8K0EW43_A0A8K0EW43_BRALA tr|A0A8K0EW43|A0A8K0EW43_BRALA CACHD1 protein OS=Branchiostoma lanceolatum OX=7740 GN=CACHD1 PE=4 SV=1, Branchiostoma_lanceolatum_tr_A0A8J9ZZJ7_A0A8J9ZZJ7_BRALA tr|A0A8J9ZZJ7|A0A8J9ZZJ7_BRALA CACHD1 protein OS=Branchiostoma lanceolatum OX=7740 GN=CACHD1 PE=4 SV=1, Branchiostoma_lanceolatum_tr_A0A8J9ZWB3_A0A8J9ZWB3_BRALA tr|A0A8J9ZWB3|A0A8J9ZWB3_BRALA CACHD1 protein OS=Branchiostoma lanceolatum OX=7740 GN=CACHD1 PE=4 SV=1	Tricoplax_adhaerens_tr_B3RP11_B3RP11_TRIAD tr_B3RP11_B3RP11_TRIAD VWFA domain-containing protein OS=Trichoplax adhaerens OX=10228 GN=TRIADDRAFT_53363 PE=4 SV=1
OG0000051	Branchiostoma_lanceolatum_tr_A0A8J9ZH34_A0A8J9ZH34_BRALA tr|A0A8J9ZH34|A0A8J9ZH34_BRALA CACNA2D2 protein OS=Branchiostoma lanceolatum OX=7740 GN=CACNA2D2 PE=3 SV=1	Tricoplax_adhaerens_tr_B3RUM1_B3RUM1_TRIAD tr_B3RUM1_B3RUM1_TRIAD VWFA domain-containing protein OS=Trichoplax adhaerens OX=10228 GN=TRIADDRAFT_55341 PE=4 SV=1
OG0000054	Branchiostoma_lanceolatum_tr_A0A8J9Z6U2_A0A8J9Z6U2_BRALA tr|A0A8J9Z6U2|A0A8J9Z6U2_BRALA SCRIB protein OS=Branchiostoma lanceolatum OX=7740 GN=SCRIB PE=4 SV=1	Tricoplax_adhaerens_tr_B3S477_B3S477_TRIAD tr_B3S477_B3S477_TRIAD Uncharacterized protein OS=Trichoplax adhaerens OX=10228 GN=TRIADDRAFT_28844 PE=4 SV=1
