Orthogroup	Chordata_Amphioxiformes_Branchiostoma_lanceolatum	Placozoa_Trichoplacidae_Tricoplax_adhaerens
OG0000010	Branchiostoma_lanceolatum_tr_A0A8J9Z721_A0A8J9Z721_BRALA tr|A0A8J9Z721|A0A8J9Z721_BRALA EYS protein OS=Branchiostoma lanceolatum OX=7740 GN=EYS PE=4 SV=1, Branchiostoma_lanceolatum_tr_A0A8J9W8K8_A0A8J9W8K8_BRALA tr|A0A8J9W8K8|A0A8J9W8K8_BRALA HSPG2 protein OS=Branchiostoma lanceolatum OX=7740 GN=HSPG2 PE=4 SV=1, Branchiostoma_lanceolatum_tr_A0A8J9W633_A0A8J9W633_BRALA tr|A0A8J9W633|A0A8J9W633_BRALA HSPG2 protein OS=Branchiostoma lanceolatum OX=7740 GN=HSPG2 PE=4 SV=1, Branchiostoma_lanceolatum_tr_A0A8J9YNE0_A0A8J9YNE0_BRALA tr|A0A8J9YNE0|A0A8J9YNE0_BRALA HSPG2 protein OS=Branchiostoma lanceolatum OX=7740 GN=HSPG2 PE=4 SV=1, Branchiostoma_lanceolatum_tr_A0A8J9VHM4_A0A8J9VHM4_BRALA tr|A0A8J9VHM4|A0A8J9VHM4_BRALA HSPG2 protein OS=Branchiostoma lanceolatum OX=7740 GN=HSPG2 PE=4 SV=1, Branchiostoma_lanceolatum_tr_A0A8J9VLW6_A0A8J9VLW6_BRALA tr|A0A8J9VLW6|A0A8J9VLW6_BRALA HSPG2 protein OS=Branchiostoma lanceolatum OX=7740 GN=HSPG2 PE=4 SV=1, Branchiostoma_lanceolatum_tr_A0A8J9W0C9_A0A8J9W0C9_BRALA tr|A0A8J9W0C9|A0A8J9W0C9_BRALA HSPG2 protein OS=Branchiostoma lanceolatum OX=7740 GN=HSPG2 PE=4 SV=1, Branchiostoma_lanceolatum_tr_A0A8J9YRN7_A0A8J9YRN7_BRALA tr|A0A8J9YRN7|A0A8J9YRN7_BRALA HSPG2 protein OS=Branchiostoma lanceolatum OX=7740 GN=HSPG2 PE=4 SV=1, Branchiostoma_lanceolatum_tr_A0A8J9W8K1_A0A8J9W8K1_BRALA tr|A0A8J9W8K1|A0A8J9W8K1_BRALA HSPG2 protein OS=Branchiostoma lanceolatum OX=7740 GN=HSPG2 PE=4 SV=1, Branchiostoma_lanceolatum_tr_A0A8J9VTE9_A0A8J9VTE9_BRALA tr|A0A8J9VTE9|A0A8J9VTE9_BRALA HSPG2 protein OS=Branchiostoma lanceolatum OX=7740 GN=HSPG2 PE=4 SV=1, Branchiostoma_lanceolatum_tr_A0A8J9YND5_A0A8J9YND5_BRALA tr|A0A8J9YND5|A0A8J9YND5_BRALA HSPG2 protein OS=Branchiostoma lanceolatum OX=7740 GN=HSPG2 PE=4 SV=1, Branchiostoma_lanceolatum_tr_A0A8J9YS91_A0A8J9YS91_BRALA tr|A0A8J9YS91|A0A8J9YS91_BRALA HSPG2 protein OS=Branchiostoma lanceolatum OX=7740 GN=HSPG2 PE=4 SV=1, Branchiostoma_lanceolatum_tr_A0A8J9W5H4_A0A8J9W5H4_BRALA tr|A0A8J9W5H4|A0A8J9W5H4_BRALA HSPG2 protein OS=Branchiostoma lanceolatum OX=7740 GN=HSPG2 PE=4 SV=1, Branchiostoma_lanceolatum_tr_A0A8J9YPU0_A0A8J9YPU0_BRALA tr|A0A8J9YPU0|A0A8J9YPU0_BRALA HSPG2 protein OS=Branchiostoma lanceolatum OX=7740 GN=HSPG2 PE=4 SV=1, Branchiostoma_lanceolatum_tr_A0A8J9YSP4_A0A8J9YSP4_BRALA tr|A0A8J9YSP4|A0A8J9YSP4_BRALA HSPG2 protein OS=Branchiostoma lanceolatum OX=7740 GN=HSPG2 PE=4 SV=1, Branchiostoma_lanceolatum_tr_A0A8J9W623_A0A8J9W623_BRALA tr|A0A8J9W623|A0A8J9W623_BRALA HSPG2 protein OS=Branchiostoma lanceolatum OX=7740 GN=HSPG2 PE=4 SV=1, Branchiostoma_lanceolatum_tr_A0A8J9WHJ7_A0A8J9WHJ7_BRALA tr|A0A8J9WHJ7|A0A8J9WHJ7_BRALA HSPG2 protein OS=Branchiostoma lanceolatum OX=7740 GN=HSPG2 PE=4 SV=1, Branchiostoma_lanceolatum_tr_A0A8J9VJE5_A0A8J9VJE5_BRALA tr|A0A8J9VJE5|A0A8J9VJE5_BRALA HSPG2 protein OS=Branchiostoma lanceolatum OX=7740 GN=HSPG2 PE=4 SV=1, Branchiostoma_lanceolatum_tr_A0A8J9YYQ9_A0A8J9YYQ9_BRALA tr|A0A8J9YYQ9|A0A8J9YYQ9_BRALA EGFLAM protein OS=Branchiostoma lanceolatum OX=7740 GN=EGFLAM PE=4 SV=1, Branchiostoma_lanceolatum_tr_A0A8J9YYU9_A0A8J9YYU9_BRALA tr|A0A8J9YYU9|A0A8J9YYU9_BRALA EGFLAM protein OS=Branchiostoma lanceolatum OX=7740 GN=EGFLAM PE=4 SV=1	Tricoplax_adhaerens_tr_B3S003_B3S003_TRIAD tr_B3S003_B3S003_TRIAD Uncharacterized protein OS=Trichoplax adhaerens OX=10228 GN=TRIADDRAFT_57635 PE=4 SV=1
OG0000010	Branchiostoma_lanceolatum_tr_A0A8J9ZKZ8_A0A8J9ZKZ8_BRALA tr|A0A8J9ZKZ8|A0A8J9ZKZ8_BRALA FST protein OS=Branchiostoma lanceolatum OX=7740 GN=FST PE=4 SV=1	Tricoplax_adhaerens_tr_B3RSW2_B3RSW2_TRIAD tr_B3RSW2_B3RSW2_TRIAD Uncharacterized protein OS=Trichoplax adhaerens OX=10228 GN=TRIADDRAFT_63780 PE=4 SV=1
OG0000011	Branchiostoma_lanceolatum_tr_A0A8J9Z3J9_A0A8J9Z3J9_BRALA tr|A0A8J9Z3J9|A0A8J9Z3J9_BRALA LPA protein OS=Branchiostoma lanceolatum OX=7740 GN=LPA PE=4 SV=1, Branchiostoma_lanceolatum_tr_A0A8J9Z3P3_A0A8J9Z3P3_BRALA tr|A0A8J9Z3P3|A0A8J9Z3P3_BRALA LPA protein OS=Branchiostoma lanceolatum OX=7740 GN=LPA PE=4 SV=1, Branchiostoma_lanceolatum_tr_A0A8K0EAV0_A0A8K0EAV0_BRALA tr|A0A8K0EAV0|A0A8K0EAV0_BRALA PLG protein OS=Branchiostoma lanceolatum OX=7740 GN=PLG PE=4 SV=1	Tricoplax_adhaerens_tr_B3RL81_B3RL81_TRIAD tr_B3RL81_B3RL81_TRIAD Uncharacterized protein _Fragment_ OS=Trichoplax adhaerens OX=10228 GN=TRIADDRAFT_10520 PE=4 SV=1
OG0000011	Branchiostoma_lanceolatum_tr_A0A8K0EIV6_A0A8K0EIV6_BRALA tr|A0A8K0EIV6|A0A8K0EIV6_BRALA Metalloendopeptidase OS=Branchiostoma lanceolatum OX=7740 GN=LPA PE=4 SV=1, Branchiostoma_lanceolatum_tr_A0A8K0A429_A0A8K0A429_BRALA tr|A0A8K0A429|A0A8K0A429_BRALA LPA protein OS=Branchiostoma lanceolatum OX=7740 GN=LPA PE=4 SV=1, Branchiostoma_lanceolatum_tr_A0A8K0A0S9_A0A8K0A0S9_BRALA tr|A0A8K0A0S9|A0A8K0A0S9_BRALA LPA protein OS=Branchiostoma lanceolatum OX=7740 GN=LPA PE=4 SV=1, Branchiostoma_lanceolatum_tr_A0A8K0EZH1_A0A8K0EZH1_BRALA tr|A0A8K0EZH1|A0A8K0EZH1_BRALA PLG protein OS=Branchiostoma lanceolatum OX=7740 GN=PLG PE=4 SV=1, Branchiostoma_lanceolatum_tr_A0A8J9ZJ81_A0A8J9ZJ81_BRALA tr|A0A8J9ZJ81|A0A8J9ZJ81_BRALA LPA protein OS=Branchiostoma lanceolatum OX=7740 GN=LPA PE=4 SV=1, Branchiostoma_lanceolatum_tr_A0A8K0ELP4_A0A8K0ELP4_BRALA tr|A0A8K0ELP4|A0A8K0ELP4_BRALA LPA protein OS=Branchiostoma lanceolatum OX=7740 GN=LPA PE=4 SV=1, Branchiostoma_lanceolatum_tr_A0A8J9YWW9_A0A8J9YWW9_BRALA tr|A0A8J9YWW9|A0A8J9YWW9_BRALA LPA protein OS=Branchiostoma lanceolatum OX=7740 GN=LPA PE=4 SV=1, Branchiostoma_lanceolatum_tr_A0A8J9ZZX1_A0A8J9ZZX1_BRALA tr|A0A8J9ZZX1|A0A8J9ZZX1_BRALA HGF protein OS=Branchiostoma lanceolatum OX=7740 GN=HGF PE=3 SV=1	Tricoplax_adhaerens_tr_B3RYG3_B3RYG3_TRIAD tr_B3RYG3_B3RYG3_TRIAD Uncharacterized protein OS=Trichoplax adhaerens OX=10228 GN=TRIADDRAFT_25018 PE=4 SV=1
OG0000011	Branchiostoma_lanceolatum_tr_A0A8K0A1P9_A0A8K0A1P9_BRALA tr|A0A8K0A1P9|A0A8K0A1P9_BRALA LPA protein OS=Branchiostoma lanceolatum OX=7740 GN=LPA PE=4 SV=1	Tricoplax_adhaerens_tr_B3RXM7_B3RXM7_TRIAD tr_B3RXM7_B3RXM7_TRIAD Kringle domain-containing protein _Fragment_ OS=Trichoplax adhaerens OX=10228 GN=TRIADDRAFT_25473 PE=4 SV=1
OG0000011	Branchiostoma_lanceolatum_tr_A0A8J9YXB8_A0A8J9YXB8_BRALA tr|A0A8J9YXB8|A0A8J9YXB8_BRALA MUSK protein OS=Branchiostoma lanceolatum OX=7740 GN=MUSK PE=4 SV=1	Tricoplax_adhaerens_tr_B3RL69_B3RL69_TRIAD tr_B3RL69_B3RL69_TRIAD Uncharacterized protein OS=Trichoplax adhaerens OX=10228 GN=TRIADDRAFT_51898 PE=4 SV=1, Tricoplax_adhaerens_tr_B3S8L1_B3S8L1_TRIAD tr_B3S8L1_B3S8L1_TRIAD Kringle domain-containing protein _Fragment_ OS=Trichoplax adhaerens OX=10228 GN=TRIADDRAFT_31001 PE=4 SV=1, Tricoplax_adhaerens_tr_B3S8S0_B3S8S0_TRIAD tr_B3S8S0_B3S8S0_TRIAD Kringle domain-containing protein _Fragment_ OS=Trichoplax adhaerens OX=10228 GN=TRIADDRAFT_8692 PE=4 SV=1, Tricoplax_adhaerens_tr_B3S9I4_B3S9I4_TRIAD tr_B3S9I4_B3S9I4_TRIAD Kringle domain-containing protein _Fragment_ OS=Trichoplax adhaerens OX=10228 GN=TRIADDRAFT_9323 PE=4 SV=1, Tricoplax_adhaerens_tr_B3S9I9_B3S9I9_TRIAD tr_B3S9I9_B3S9I9_TRIAD Kringle domain-containing protein _Fragment_ OS=Trichoplax adhaerens OX=10228 GN=TRIADDRAFT_9202 PE=4 SV=1, Tricoplax_adhaerens_tr_B3S5U6_B3S5U6_TRIAD tr_B3S5U6_B3S5U6_TRIAD Kringle domain-containing protein OS=Trichoplax adhaerens OX=10228 GN=TRIADDRAFT_29648 PE=4 SV=1, Tricoplax_adhaerens_tr_B3RL75_B3RL75_TRIAD tr_B3RL75_B3RL75_TRIAD Uncharacterized protein OS=Trichoplax adhaerens OX=10228 GN=TRIADDRAFT_51904 PE=4 SV=1, Tricoplax_adhaerens_tr_B3RL82_B3RL82_TRIAD tr_B3RL82_B3RL82_TRIAD Uncharacterized protein OS=Trichoplax adhaerens OX=10228 GN=TRIADDRAFT_51914 PE=4 SV=1, Tricoplax_adhaerens_tr_B3RL76_B3RL76_TRIAD tr_B3RL76_B3RL76_TRIAD Uncharacterized protein OS=Trichoplax adhaerens OX=10228 GN=TRIADDRAFT_51905 PE=4 SV=1, Tricoplax_adhaerens_tr_B3RL85_B3RL85_TRIAD tr_B3RL85_B3RL85_TRIAD Predicted protein OS=Trichoplax adhaerens OX=10228 GN=TRIADDRAFT_51917 PE=4 SV=1, Tricoplax_adhaerens_tr_B3S501_B3S501_TRIAD tr_B3S501_B3S501_TRIAD Kringle domain-containing protein _Fragment_ OS=Trichoplax adhaerens OX=10228 GN=TRIADDRAFT_29248 PE=4 SV=1, Tricoplax_adhaerens_tr_B3SE75_B3SE75_TRIAD tr_B3SE75_B3SE75_TRIAD Kringle domain-containing protein _Fragment_ OS=Trichoplax adhaerens OX=10228 GN=TRIADDRAFT_8320 PE=4 SV=1
OG0000012	Branchiostoma_lanceolatum_tr_A0A8J9ZUE9_A0A8J9ZUE9_BRALA tr|A0A8J9ZUE9|A0A8J9ZUE9_BRALA MUC5AC protein OS=Branchiostoma lanceolatum OX=7740 GN=MUC5AC PE=4 SV=1, Branchiostoma_lanceolatum_tr_A0A8J9YQR3_A0A8J9YQR3_BRALA tr|A0A8J9YQR3|A0A8J9YQR3_BRALA OTOGL protein OS=Branchiostoma lanceolatum OX=7740 GN=OTOGL PE=4 SV=1, Branchiostoma_lanceolatum_tr_A0A8J9W725_A0A8J9W725_BRALA tr|A0A8J9W725|A0A8J9W725_BRALA MUC5AC protein OS=Branchiostoma lanceolatum OX=7740 GN=MUC5AC PE=4 SV=1	Tricoplax_adhaerens_tr_B3RQT5_B3RQT5_TRIAD tr_B3RQT5_B3RQT5_TRIAD Uncharacterized protein _Fragment_ OS=Trichoplax adhaerens OX=10228 GN=TRIADDRAFT_21952 PE=4 SV=1
OG0000012	Branchiostoma_lanceolatum_tr_A0A8K0EG51_A0A8K0EG51_BRALA tr|A0A8K0EG51|A0A8K0EG51_BRALA BMPER protein OS=Branchiostoma lanceolatum OX=7740 GN=BMPER PE=4 SV=1, Branchiostoma_lanceolatum_tr_A0A8K0EE77_A0A8K0EE77_BRALA tr|A0A8K0EE77|A0A8K0EE77_BRALA BMPER protein OS=Branchiostoma lanceolatum OX=7740 GN=BMPER PE=4 SV=1, Branchiostoma_lanceolatum_tr_A0A8K0EH44_A0A8K0EH44_BRALA tr|A0A8K0EH44|A0A8K0EH44_BRALA KCP protein OS=Branchiostoma lanceolatum OX=7740 GN=KCP PE=3 SV=1, Branchiostoma_lanceolatum_tr_A0A8K0EF69_A0A8K0EF69_BRALA tr|A0A8K0EF69|A0A8K0EF69_BRALA KCP protein OS=Branchiostoma lanceolatum OX=7740 GN=KCP PE=3 SV=1, Branchiostoma_lanceolatum_tr_A0A8K0EJ61_A0A8K0EJ61_BRALA tr|A0A8K0EJ61|A0A8K0EJ61_BRALA KCP protein OS=Branchiostoma lanceolatum OX=7740 GN=KCP PE=3 SV=1, Branchiostoma_lanceolatum_tr_A0A8J9ZV31_A0A8J9ZV31_BRALA tr|A0A8J9ZV31|A0A8J9ZV31_BRALA FBLN2 protein OS=Branchiostoma lanceolatum OX=7740 GN=FBLN2 PE=4 SV=1, Branchiostoma_lanceolatum_tr_A0A8J9ZUL8_A0A8J9ZUL8_BRALA tr|A0A8J9ZUL8|A0A8J9ZUL8_BRALA NOTCH1 protein OS=Branchiostoma lanceolatum OX=7740 GN=NOTCH1 PE=4 SV=1	Tricoplax_adhaerens_tr_B3RRG7_B3RRG7_TRIAD tr_B3RRG7_B3RRG7_TRIAD Uncharacterized protein OS=Trichoplax adhaerens OX=10228 GN=TRIADDRAFT_54231 PE=4 SV=1
OG0000013	Branchiostoma_lanceolatum_tr_A0A8J9Z3R8_A0A8J9Z3R8_BRALA tr|A0A8J9Z3R8|A0A8J9Z3R8_BRALA Protein Wnt OS=Branchiostoma lanceolatum OX=7740 GN=WNT8A PE=3 SV=1	Tricoplax_adhaerens_tr_B3S743_B3S743_TRIAD tr_B3S743_B3S743_TRIAD Protein Wnt _Fragment_ OS=Trichoplax adhaerens OX=10228 GN=TRIADDRAFT_30370 PE=3 SV=1, Tricoplax_adhaerens_tr_B3RIQ5_B3RIQ5_TRIAD tr_B3RIQ5_B3RIQ5_TRIAD Protein Wnt OS=Trichoplax adhaerens OX=10228 GN=TRIADDRAFT_52489 PE=3 SV=1
OG0000013	Branchiostoma_lanceolatum_tr_A0A8S4MN77_A0A8S4MN77_BRALA tr|A0A8S4MN77|A0A8S4MN77_BRALA Protein Wnt OS=Branchiostoma lanceolatum OX=7740 GN=WNT7B PE=3 SV=1	Tricoplax_adhaerens_tr_B3S731_B3S731_TRIAD tr_B3S731_B3S731_TRIAD Protein Wnt OS=Trichoplax adhaerens OX=10228 GN=TRIADDRAFT_60019 PE=3 SV=1, Tricoplax_adhaerens_tr_B3S730_B3S730_TRIAD tr_B3S730_B3S730_TRIAD Protein Wnt _Fragment_ OS=Trichoplax adhaerens OX=10228 GN=TRIADDRAFT_8072 PE=3 SV=1
OG0000014	Branchiostoma_lanceolatum_tr_A0A8K0ET75_A0A8K0ET75_BRALA tr|A0A8K0ET75|A0A8K0ET75_BRALA ADAMTS6 protein OS=Branchiostoma lanceolatum OX=7740 GN=ADAMTS6 PE=4 SV=1, Branchiostoma_lanceolatum_tr_A0A8K0EXF9_A0A8K0EXF9_BRALA tr|A0A8K0EXF9|A0A8K0EXF9_BRALA ADAMTSL2 protein OS=Branchiostoma lanceolatum OX=7740 GN=ADAMTSL2 PE=4 SV=1, Branchiostoma_lanceolatum_tr_A0A8K0F300_A0A8K0F300_BRALA tr|A0A8K0F300|A0A8K0F300_BRALA ADAMTSL2 protein OS=Branchiostoma lanceolatum OX=7740 GN=ADAMTSL2 PE=4 SV=1, Branchiostoma_lanceolatum_tr_A0A8K0EIS5_A0A8K0EIS5_BRALA tr|A0A8K0EIS5|A0A8K0EIS5_BRALA THSD4 protein _Fragment_ OS=Branchiostoma lanceolatum OX=7740 GN=THSD4 PE=4 SV=1, Branchiostoma_lanceolatum_tr_A0A8K0EL06_A0A8K0EL06_BRALA tr|A0A8K0EL06|A0A8K0EL06_BRALA THSD4 protein OS=Branchiostoma lanceolatum OX=7740 GN=THSD4 PE=4 SV=1, Branchiostoma_lanceolatum_tr_A0A8K0EIG2_A0A8K0EIG2_BRALA tr|A0A8K0EIG2|A0A8K0EIG2_BRALA THSD4 protein OS=Branchiostoma lanceolatum OX=7740 GN=THSD4 PE=4 SV=1, Branchiostoma_lanceolatum_tr_A0A8J9ZFA2_A0A8J9ZFA2_BRALA tr|A0A8J9ZFA2|A0A8J9ZFA2_BRALA THSD4 protein OS=Branchiostoma lanceolatum OX=7740 GN=THSD4 PE=4 SV=1, Branchiostoma_lanceolatum_tr_A0A8K0ELH0_A0A8K0ELH0_BRALA tr|A0A8K0ELH0|A0A8K0ELH0_BRALA THSD4 protein _Fragment_ OS=Branchiostoma lanceolatum OX=7740 GN=THSD4 PE=4 SV=1, Branchiostoma_lanceolatum_tr_A0A8K0EGT5_A0A8K0EGT5_BRALA tr|A0A8K0EGT5|A0A8K0EGT5_BRALA THSD4 protein _Fragment_ OS=Branchiostoma lanceolatum OX=7740 GN=THSD4 PE=4 SV=1, Branchiostoma_lanceolatum_tr_A0A8J9ZIE9_A0A8J9ZIE9_BRALA tr|A0A8J9ZIE9|A0A8J9ZIE9_BRALA ADAMTSL3 protein OS=Branchiostoma lanceolatum OX=7740 GN=ADAMTSL3 PE=4 SV=1, Branchiostoma_lanceolatum_tr_A0A8K0A9T8_A0A8K0A9T8_BRALA tr|A0A8K0A9T8|A0A8K0A9T8_BRALA ADAMTS18 protein OS=Branchiostoma lanceolatum OX=7740 GN=ADAMTS18 PE=4 SV=1, Branchiostoma_lanceolatum_tr_A0A8K0AGP8_A0A8K0AGP8_BRALA tr|A0A8K0AGP8|A0A8K0AGP8_BRALA ADAMTS18 protein OS=Branchiostoma lanceolatum OX=7740 GN=ADAMTS18 PE=4 SV=1, Branchiostoma_lanceolatum_tr_A0A8K0ADD7_A0A8K0ADD7_BRALA tr|A0A8K0ADD7|A0A8K0ADD7_BRALA ADAMTS18 protein OS=Branchiostoma lanceolatum OX=7740 GN=ADAMTS18 PE=4 SV=1, Branchiostoma_lanceolatum_tr_A0A8J9Z405_A0A8J9Z405_BRALA tr|A0A8J9Z405|A0A8J9Z405_BRALA ADAMTS3 protein OS=Branchiostoma lanceolatum OX=7740 GN=ADAMTS3 PE=4 SV=1, Branchiostoma_lanceolatum_tr_A0A8J9YYJ9_A0A8J9YYJ9_BRALA tr|A0A8J9YYJ9|A0A8J9YYJ9_BRALA ADAMTS6 protein OS=Branchiostoma lanceolatum OX=7740 GN=ADAMTS6 PE=4 SV=1, Branchiostoma_lanceolatum_tr_A0A8J9YZ42_A0A8J9YZ42_BRALA tr|A0A8J9YZ42|A0A8J9YZ42_BRALA ADAMTS6 protein OS=Branchiostoma lanceolatum OX=7740 GN=ADAMTS6 PE=4 SV=1, Branchiostoma_lanceolatum_tr_A0A8S4MNF9_A0A8S4MNF9_BRALA tr|A0A8S4MNF9|A0A8S4MNF9_BRALA ADAMTS7 protein OS=Branchiostoma lanceolatum OX=7740 GN=ADAMTS7 PE=4 SV=1, Branchiostoma_lanceolatum_tr_A0A8J9ZG01_A0A8J9ZG01_BRALA tr|A0A8J9ZG01|A0A8J9ZG01_BRALA ADAMTS17 protein OS=Branchiostoma lanceolatum OX=7740 GN=ADAMTS17 PE=4 SV=1, Branchiostoma_lanceolatum_tr_A0A8J9ZG09_A0A8J9ZG09_BRALA tr|A0A8J9ZG09|A0A8J9ZG09_BRALA ADAMTS17 protein OS=Branchiostoma lanceolatum OX=7740 GN=ADAMTS17 PE=4 SV=1, Branchiostoma_lanceolatum_tr_A0A8J9ZV65_A0A8J9ZV65_BRALA tr|A0A8J9ZV65|A0A8J9ZV65_BRALA PAPLN protein OS=Branchiostoma lanceolatum OX=7740 GN=PAPLN PE=4 SV=1, Branchiostoma_lanceolatum_tr_A0A8J9ZTH0_A0A8J9ZTH0_BRALA tr|A0A8J9ZTH0|A0A8J9ZTH0_BRALA PAPLN protein OS=Branchiostoma lanceolatum OX=7740 GN=PAPLN PE=4 SV=1, Branchiostoma_lanceolatum_tr_A0A8J9ZYD7_A0A8J9ZYD7_BRALA tr|A0A8J9ZYD7|A0A8J9ZYD7_BRALA ADAMTS9 protein OS=Branchiostoma lanceolatum OX=7740 GN=ADAMTS9 PE=4 SV=1, Branchiostoma_lanceolatum_tr_A0A8K0A0L5_A0A8K0A0L5_BRALA tr|A0A8K0A0L5|A0A8K0A0L5_BRALA ADAMTS9 protein OS=Branchiostoma lanceolatum OX=7740 GN=ADAMTS9 PE=4 SV=1, Branchiostoma_lanceolatum_tr_A0A8J9ZX65_A0A8J9ZX65_BRALA tr|A0A8J9ZX65|A0A8J9ZX65_BRALA ADAMTS9 protein OS=Branchiostoma lanceolatum OX=7740 GN=ADAMTS9 PE=4 SV=1, Branchiostoma_lanceolatum_tr_A0A8J9ZYM3_A0A8J9ZYM3_BRALA tr|A0A8J9ZYM3|A0A8J9ZYM3_BRALA ADAMTS9 protein OS=Branchiostoma lanceolatum OX=7740 GN=ADAMTS9 PE=4 SV=1, Branchiostoma_lanceolatum_tr_A0A8J9ZVX1_A0A8J9ZVX1_BRALA tr|A0A8J9ZVX1|A0A8J9ZVX1_BRALA ADAMTS9 protein OS=Branchiostoma lanceolatum OX=7740 GN=ADAMTS9 PE=4 SV=1, Branchiostoma_lanceolatum_tr_A0A8J9ZCI5_A0A8J9ZCI5_BRALA tr|A0A8J9ZCI5|A0A8J9ZCI5_BRALA ADAMTS15 protein OS=Branchiostoma lanceolatum OX=7740 GN=ADAMTS15 PE=4 SV=1, Branchiostoma_lanceolatum_tr_A0A8J9Z3J2_A0A8J9Z3J2_BRALA tr|A0A8J9Z3J2|A0A8J9Z3J2_BRALA ADAMTS16 protein OS=Branchiostoma lanceolatum OX=7740 GN=ADAMTS16 PE=4 SV=1	Tricoplax_adhaerens_tr_B3RJG1_B3RJG1_TRIAD tr_B3RJG1_B3RJG1_TRIAD Peptidase M12B domain-containing protein OS=Trichoplax adhaerens OX=10228 GN=TRIADDRAFT_52613 PE=4 SV=1
OG0000015	Branchiostoma_lanceolatum_tr_A0A8K0EGU7_A0A8K0EGU7_BRALA tr|A0A8K0EGU7|A0A8K0EGU7_BRALA CUZD1 protein OS=Branchiostoma lanceolatum OX=7740 GN=CUZD1 PE=4 SV=1, Branchiostoma_lanceolatum_tr_A0A8K0EE67_A0A8K0EE67_BRALA tr|A0A8K0EE67|A0A8K0EE67_BRALA CUZD1 protein OS=Branchiostoma lanceolatum OX=7740 GN=CUZD1 PE=4 SV=1, Branchiostoma_lanceolatum_tr_A0A8J9Z749_A0A8J9Z749_BRALA tr|A0A8J9Z749|A0A8J9Z749_BRALA CUZD1 protein OS=Branchiostoma lanceolatum OX=7740 GN=CUZD1 PE=4 SV=1, Branchiostoma_lanceolatum_tr_A0A8K0ECX6_A0A8K0ECX6_BRALA tr|A0A8K0ECX6|A0A8K0ECX6_BRALA CUZD1 protein OS=Branchiostoma lanceolatum OX=7740 GN=CUZD1 PE=4 SV=1, Branchiostoma_lanceolatum_tr_A0A8K0EBW5_A0A8K0EBW5_BRALA tr|A0A8K0EBW5|A0A8K0EBW5_BRALA CUZD1 protein OS=Branchiostoma lanceolatum OX=7740 GN=CUZD1 PE=4 SV=1, Branchiostoma_lanceolatum_tr_A0A8S4MM50_A0A8S4MM50_BRALA tr|A0A8S4MM50|A0A8S4MM50_BRALA CUZD1 protein OS=Branchiostoma lanceolatum OX=7740 GN=CUZD1 PE=4 SV=1, Branchiostoma_lanceolatum_tr_A0A8S4MLT3_A0A8S4MLT3_BRALA tr|A0A8S4MLT3|A0A8S4MLT3_BRALA DMBT1 protein OS=Branchiostoma lanceolatum OX=7740 GN=DMBT1 PE=4 SV=1, Branchiostoma_lanceolatum_tr_A0A8J9ZSS8_A0A8J9ZSS8_BRALA tr|A0A8J9ZSS8|A0A8J9ZSS8_BRALA CUZD1 protein OS=Branchiostoma lanceolatum OX=7740 GN=CUZD1 PE=4 SV=1, Branchiostoma_lanceolatum_tr_A0A8J9ZDC5_A0A8J9ZDC5_BRALA tr|A0A8J9ZDC5|A0A8J9ZDC5_BRALA CUZD1 protein OS=Branchiostoma lanceolatum OX=7740 GN=CUZD1 PE=4 SV=1, Branchiostoma_lanceolatum_tr_A0A8J9ZCF5_A0A8J9ZCF5_BRALA tr|A0A8J9ZCF5|A0A8J9ZCF5_BRALA MATN2 protein OS=Branchiostoma lanceolatum OX=7740 GN=MATN2 PE=4 SV=1, Branchiostoma_lanceolatum_tr_A0A8J9ZB42_A0A8J9ZB42_BRALA tr|A0A8J9ZB42|A0A8J9ZB42_BRALA CUZD1 protein OS=Branchiostoma lanceolatum OX=7740 GN=CUZD1 PE=4 SV=1, Branchiostoma_lanceolatum_tr_A0A8J9ZBX5_A0A8J9ZBX5_BRALA tr|A0A8J9ZBX5|A0A8J9ZBX5_BRALA CUZD1 protein OS=Branchiostoma lanceolatum OX=7740 GN=CUZD1 PE=4 SV=1, Branchiostoma_lanceolatum_tr_A0A8J9VUQ8_A0A8J9VUQ8_BRALA tr|A0A8J9VUQ8|A0A8J9VUQ8_BRALA OIT3 protein OS=Branchiostoma lanceolatum OX=7740 GN=OIT3 PE=4 SV=1, Branchiostoma_lanceolatum_tr_A0A8K0E5P6_A0A8K0E5P6_BRALA tr|A0A8K0E5P6|A0A8K0E5P6_BRALA CUZD1 protein OS=Branchiostoma lanceolatum OX=7740 GN=CUZD1 PE=4 SV=1, Branchiostoma_lanceolatum_tr_A0A8K0E3M7_A0A8K0E3M7_BRALA tr|A0A8K0E3M7|A0A8K0E3M7_BRALA CUZD1 protein OS=Branchiostoma lanceolatum OX=7740 GN=CUZD1 PE=4 SV=1, Branchiostoma_lanceolatum_tr_A0A8K0EKS0_A0A8K0EKS0_BRALA tr|A0A8K0EKS0|A0A8K0EKS0_BRALA CUZD1 protein OS=Branchiostoma lanceolatum OX=7740 GN=CUZD1 PE=4 SV=1, Branchiostoma_lanceolatum_tr_A0A8J9VSI0_A0A8J9VSI0_BRALA tr|A0A8J9VSI0|A0A8J9VSI0_BRALA OIT3 protein OS=Branchiostoma lanceolatum OX=7740 GN=OIT3 PE=4 SV=1	Tricoplax_adhaerens_tr_B3RRK6_B3RRK6_TRIAD tr_B3RRK6_B3RRK6_TRIAD Uncharacterized protein OS=Trichoplax adhaerens OX=10228 GN=TRIADDRAFT_54276 PE=4 SV=1
OG0000017	Branchiostoma_lanceolatum_tr_A0A8K0EZS5_A0A8K0EZS5_BRALA tr|A0A8K0EZS5|A0A8K0EZS5_BRALA SERPINB2 protein OS=Branchiostoma lanceolatum OX=7740 GN=SERPINB2 PE=3 SV=1, Branchiostoma_lanceolatum_tr_A0A8K0ADT3_A0A8K0ADT3_BRALA tr|A0A8K0ADT3|A0A8K0ADT3_BRALA SERPINC1 protein OS=Branchiostoma lanceolatum OX=7740 GN=SERPINC1 PE=3 SV=1, Branchiostoma_lanceolatum_tr_A0A8K0AH49_A0A8K0AH49_BRALA tr|A0A8K0AH49|A0A8K0AH49_BRALA SERPINC1 protein OS=Branchiostoma lanceolatum OX=7740 GN=SERPINC1 PE=3 SV=1, Branchiostoma_lanceolatum_tr_A0A8K0AD85_A0A8K0AD85_BRALA tr|A0A8K0AD85|A0A8K0AD85_BRALA SERPINB3 protein OS=Branchiostoma lanceolatum OX=7740 GN=SERPINB3 PE=3 SV=1, Branchiostoma_lanceolatum_tr_A0A8J9YZD2_A0A8J9YZD2_BRALA tr|A0A8J9YZD2|A0A8J9YZD2_BRALA SERPINB9 protein OS=Branchiostoma lanceolatum OX=7740 GN=SERPINB9 PE=3 SV=1, Branchiostoma_lanceolatum_tr_A0A8K0EDM4_A0A8K0EDM4_BRALA tr|A0A8K0EDM4|A0A8K0EDM4_BRALA SERPINB9 protein OS=Branchiostoma lanceolatum OX=7740 GN=SERPINB9 PE=3 SV=1, Branchiostoma_lanceolatum_tr_A0A8K0AAU8_A0A8K0AAU8_BRALA tr|A0A8K0AAU8|A0A8K0AAU8_BRALA SERPINB9 protein OS=Branchiostoma lanceolatum OX=7740 GN=SERPINB9 PE=3 SV=1, Branchiostoma_lanceolatum_tr_A0A8K0ABC2_A0A8K0ABC2_BRALA tr|A0A8K0ABC2|A0A8K0ABC2_BRALA SERPINB9 protein OS=Branchiostoma lanceolatum OX=7740 GN=SERPINB9 PE=3 SV=1, Branchiostoma_lanceolatum_tr_A0A8K0ACF9_A0A8K0ACF9_BRALA tr|A0A8K0ACF9|A0A8K0ACF9_BRALA SERPINB9 protein OS=Branchiostoma lanceolatum OX=7740 GN=SERPINB9 PE=3 SV=1, Branchiostoma_lanceolatum_tr_A0A8K0AA52_A0A8K0AA52_BRALA tr|A0A8K0AA52|A0A8K0AA52_BRALA SERPINB9 protein OS=Branchiostoma lanceolatum OX=7740 GN=SERPINB9 PE=3 SV=1, Branchiostoma_lanceolatum_tr_A0A8K0AB89_A0A8K0AB89_BRALA tr|A0A8K0AB89|A0A8K0AB89_BRALA SERPINB9 protein OS=Branchiostoma lanceolatum OX=7740 GN=SERPINB9 PE=3 SV=1, Branchiostoma_lanceolatum_tr_A0A8K0AGB6_A0A8K0AGB6_BRALA tr|A0A8K0AGB6|A0A8K0AGB6_BRALA SERPINB9 protein OS=Branchiostoma lanceolatum OX=7740 GN=SERPINB9 PE=3 SV=1, Branchiostoma_lanceolatum_tr_A0A8J9WDW5_A0A8J9WDW5_BRALA tr|A0A8J9WDW5|A0A8J9WDW5_BRALA SERPINB10 protein OS=Branchiostoma lanceolatum OX=7740 GN=SERPINB10 PE=3 SV=1, Branchiostoma_lanceolatum_tr_A0A8S4MMR4_A0A8S4MMR4_BRALA tr|A0A8S4MMR4|A0A8S4MMR4_BRALA SERPINB2 protein OS=Branchiostoma lanceolatum OX=7740 GN=SERPINB2 PE=3 SV=1, Branchiostoma_lanceolatum_tr_A0A8S4MLS5_A0A8S4MLS5_BRALA tr|A0A8S4MLS5|A0A8S4MLS5_BRALA SERPINB9 protein OS=Branchiostoma lanceolatum OX=7740 GN=SERPINB9 PE=3 SV=1, Branchiostoma_lanceolatum_tr_A0A8S4MLX6_A0A8S4MLX6_BRALA tr|A0A8S4MLX6|A0A8S4MLX6_BRALA SERPINB9 protein OS=Branchiostoma lanceolatum OX=7740 GN=SERPINB9 PE=3 SV=1	Tricoplax_adhaerens_tr_B3S279_B3S279_TRIAD tr_B3S279_B3S279_TRIAD SERPIN domain-containing protein OS=Trichoplax adhaerens OX=10228 GN=TRIADDRAFT_63332 PE=3 SV=1
OG0000018	Branchiostoma_lanceolatum_tr_A0A8K0EJM6_A0A8K0EJM6_BRALA tr|A0A8K0EJM6|A0A8K0EJM6_BRALA DMBT1 protein OS=Branchiostoma lanceolatum OX=7740 GN=DMBT1 PE=4 SV=1, Branchiostoma_lanceolatum_tr_A0A8K0EFK8_A0A8K0EFK8_BRALA tr|A0A8K0EFK8|A0A8K0EFK8_BRALA PRSS12 protein OS=Branchiostoma lanceolatum OX=7740 GN=PRSS12 PE=4 SV=1, Branchiostoma_lanceolatum_tr_A0A8J9ZCL7_A0A8J9ZCL7_BRALA tr|A0A8J9ZCL7|A0A8J9ZCL7_BRALA DMBT1 protein OS=Branchiostoma lanceolatum OX=7740 GN=DMBT1 PE=4 SV=1	Tricoplax_adhaerens_tr_B3SCU9_B3SCU9_TRIAD tr_B3SCU9_B3SCU9_TRIAD Sortilin-related receptor OS=Trichoplax adhaerens OX=10228 GN=TRIADDRAFT_62104 PE=3 SV=1
OG0000018	Branchiostoma_lanceolatum_tr_A0A8J9Z0M4_A0A8J9Z0M4_BRALA tr|A0A8J9Z0M4|A0A8J9Z0M4_BRALA Deleted in malignant brain tumors 1 protein OS=Branchiostoma lanceolatum OX=7740 GN=DMBT1 PE=3 SV=1	Tricoplax_adhaerens_tr_B3RNP7_B3RNP7_TRIAD tr_B3RNP7_B3RNP7_TRIAD Uncharacterized protein OS=Trichoplax adhaerens OX=10228 GN=TRIADDRAFT_53242 PE=3 SV=1
OG0000018	Branchiostoma_lanceolatum_tr_A0A8K0EI03_A0A8K0EI03_BRALA tr|A0A8K0EI03|A0A8K0EI03_BRALA ZAN protein OS=Branchiostoma lanceolatum OX=7740 GN=ZAN PE=4 SV=1, Branchiostoma_lanceolatum_tr_A0A8K0EFK5_A0A8K0EFK5_BRALA tr|A0A8K0EFK5|A0A8K0EFK5_BRALA PRSS12 protein OS=Branchiostoma lanceolatum OX=7740 GN=PRSS12 PE=3 SV=1	Tricoplax_adhaerens_tr_B3RS21_B3RS21_TRIAD tr_B3RS21_B3RS21_TRIAD Uncharacterized protein OS=Trichoplax adhaerens OX=10228 GN=TRIADDRAFT_54447 PE=3 SV=1
OG0000018	Branchiostoma_lanceolatum_tr_A0A8J9VDI4_A0A8J9VDI4_BRALA tr|A0A8J9VDI4|A0A8J9VDI4_BRALA NOTCH1 protein OS=Branchiostoma lanceolatum OX=7740 GN=NOTCH1 PE=4 SV=1, Branchiostoma_lanceolatum_tr_A0A8J9YN11_A0A8J9YN11_BRALA tr|A0A8J9YN11|A0A8J9YN11_BRALA NOTCH2 protein OS=Branchiostoma lanceolatum OX=7740 GN=NOTCH2 PE=4 SV=1	Tricoplax_adhaerens_tr_B3RJF8_B3RJF8_TRIAD tr_B3RJF8_B3RJF8_TRIAD Uncharacterized protein OS=Trichoplax adhaerens OX=10228 GN=TRIADDRAFT_52608 PE=4 SV=1, Tricoplax_adhaerens_tr_B3RMD2_B3RMD2_TRIAD tr_B3RMD2_B3RMD2_TRIAD Uncharacterized protein OS=Trichoplax adhaerens OX=10228 GN=TRIADDRAFT_53907 PE=4 SV=1
OG0000019	Branchiostoma_lanceolatum_tr_A0A8J9YQV8_A0A8J9YQV8_BRALA tr|A0A8J9YQV8|A0A8J9YQV8_BRALA INHBB protein OS=Branchiostoma lanceolatum OX=7740 GN=INHBB PE=3 SV=1, Branchiostoma_lanceolatum_tr_A0A8K0EBU7_A0A8K0EBU7_BRALA tr|A0A8K0EBU7|A0A8K0EBU7_BRALA MSTN protein OS=Branchiostoma lanceolatum OX=7740 GN=MSTN PE=3 SV=1	Tricoplax_adhaerens_tr_B3S1T4_B3S1T4_TRIAD tr_B3S1T4_B3S1T4_TRIAD TGF_BETA_2 domain-containing protein OS=Trichoplax adhaerens OX=10228 GN=TRIADDRAFT_57877 PE=3 SV=1
OG0000019	Branchiostoma_lanceolatum_tr_A0A8J9Z1K9_A0A8J9Z1K9_BRALA tr|A0A8J9Z1K9|A0A8J9Z1K9_BRALA BMP2 protein OS=Branchiostoma lanceolatum OX=7740 GN=BMP2 PE=3 SV=1	Tricoplax_adhaerens_tr_B3S3B9_B3S3B9_TRIAD tr_B3S3B9_B3S3B9_TRIAD TGF_BETA_2 domain-containing protein OS=Trichoplax adhaerens OX=10228 GN=TRIADDRAFT_58663 PE=3 SV=1
OG0000019	Branchiostoma_lanceolatum_tr_A0A8J9YZ11_A0A8J9YZ11_BRALA tr|A0A8J9YZ11|A0A8J9YZ11_BRALA BMP6 protein OS=Branchiostoma lanceolatum OX=7740 GN=BMP6 PE=3 SV=1	Tricoplax_adhaerens_tr_B3S115_B3S115_TRIAD tr_B3S115_B3S115_TRIAD TGF_BETA_2 domain-containing protein _Fragment_ OS=Trichoplax adhaerens OX=10228 GN=TRIADDRAFT_9164 PE=3 SV=1
OG0000019	Branchiostoma_lanceolatum_tr_A0A8J9ZTM1_A0A8J9ZTM1_BRALA tr|A0A8J9ZTM1|A0A8J9ZTM1_BRALA BMP2 protein OS=Branchiostoma lanceolatum OX=7740 GN=BMP2 PE=3 SV=1, Branchiostoma_lanceolatum_tr_A0A8J9ZTJ3_A0A8J9ZTJ3_BRALA tr|A0A8J9ZTJ3|A0A8J9ZTJ3_BRALA BMP4 protein OS=Branchiostoma lanceolatum OX=7740 GN=BMP4 PE=3 SV=1	Tricoplax_adhaerens_tr_B3S0I2_B3S0I2_TRIAD tr_B3S0I2_B3S0I2_TRIAD TGF_BETA_2 domain-containing protein OS=Trichoplax adhaerens OX=10228 GN=TRIADDRAFT_57057 PE=3 SV=1
